created_utc	id	title	author	ups	downs	num_comments	selftext	subreddit_id	is_self
1359074076.0	1783q2	Need help creating a homemade soil mix.	Frat_Panda	18	1	7	So I've had a Chinese Elm for a little over a year now and I've noticed it is starting to become loose in the pot. I was thinking about replanting it but I don't have any soil. I went to my local nursery and asked if she had any bonsai soil and all she had was a 50lb bag of some kind of bark mix. I did notice however that she had some smaller bags of bone meal and other things to make your own soil mix. I've done a little bit of research on soil mixtures, but I am still unsure what all ingredients go into a soil mix and the ratio of them. Any help would be appreciated.  	t5_2qowd	True
1356989270.0	15qqpc	Underwater Bonsai	daedius	20	5	1		t5_2qowd	False
1356894066.0	15ol6n	Can anyone tell me what this white stuff around my tree is?	jeredditdoncjesuis	22	6	34		t5_2qowd	False
1356592438.0	15icjz	PJ fig forest (young)	sketchndraw	18	3	0		t5_2qowd	False
1356333813.0	15d5iu	Merry Christmas too! Didn't dare post it until I saw TheAgreeableCow's post :) 	leguellec	18	2	3		t5_2qowd	False
1354167667.0	13zap7	Japanese Black Pine Sprouts started from seeds 4 weeks ago...new to Bonsai, what should I be doing at this point?	krausjr	17	0	13		t5_2qowd	False
1353109324.0	13bqv0	I got a bonsai tree the other day, can anyone tell me what kind it is and what condition it's in? I don't know much about bonsai trees.	DoDaDaTheIdiot	17	1	19		t5_2qowd	False
1350562049.0	11ooih	Just got this bonsai as present, need help identifying please!	banytoshbot	17	1	13		t5_2qowd	False
1348304289.0	10ai4u	Mini bonsai bench...using tiltshiftmaker.com	small_trunks	26	9	16		t5_2qowd	False
1348024875.0	1049fw	Looking for advice on a schefflera bonsai	generic_andrew	16	0	19		t5_2qowd	False
1346506993.0	z6m20	Pruning advice for this Japanese Holly (Ilex Crenata)?	iyeballin	18	1	11		t5_2qowd	False
1346176361.0	yz017	Planning a chop on this Bald Cypress, maybe try air layering. Also, a collected crape myrtle.	jakethesnakebooboo	18	0	7		t5_2qowd	False
1342980615.0	wz30h	Is it possible to get rid of these wire markings?	Potatoe292	19	2	11		t5_2qowd	False
1342537123.0	wpc1y	Lindsay Farr's World Of Bonsai series - online resource	monkeydatum	19	3	1		t5_2qowd	False
1338492286.0	ueby7	One man’s trash is another’s treasure: (fire?) maple destined for disposal	reidpar	17	3	5		t5_2qowd	False
1337586412.0	tx8az	So I just discovered there's a bonsai reddit. Here's my tree. Any tips or suggestions?	tripsk1	19	5	7		t5_2qowd	False
1337362509.0	ttjbe	Fukien Tea trees. Suggestions/comments are welcome!	jakethesnakebooboo	16	1	21		t5_2qowd	False
1337125302.0	tp279	My Juniper's roots are showing. Is this okay or should I cover them up?	stupidhoes	19	5	17		t5_2qowd	False
1333506720.0	rs8j8	My first bonsai.  13 year old mugo that was a reject from my dad's nursery. 	benwillmill	21	4	13		t5_2qowd	False
1332965765.0	ri2c7	Recommend me a moss for my shefflera abricola!	Homeyjojo	18	2	20		t5_2qowd	False
1329432413.0	psz8f	I found this floating in the water after I watered my brand new bonsai...help? 	mortsdron2	16	0	8		t5_2qowd	False
1327976725.0	p3xzr	This tree was abandoned, I hope to save it. (I think it is a tiger wood) Is it possible?	sheirdog	16	0	6		t5_2qowd	False
1322836325.0	mxj8g	Finally got around to wiring a juniper that's been waiting its turn. Just garden stock but I'm happy with how this one turned out. 	myopinionstinks	19	2	11		t5_2qowd	False
1315858623.0	kdfbh	Just arriving to r/bonsai with this guy. Is someone able to identify it?	libermate	16	0	15		t5_2qowd	False
1313057786.0	jfkes	"Stylish Juniper - Bonsai South Nursery  (HD Video of the ""Creation"" of a Juniper Bonsai)"	senaca	17	1	3		t5_2qowd	False
1306509311.0	hlk5h	I thought you all might like to see my trees in training. 	theroc1217	18	3	3		t5_2qowd	False
1301640435.0	gg6ma	Back to bonsai	evmibo	16	0	7	"I started bonsai while I was in highschool.  Among other things, when I went to college I focused more on alcohol, but now that I'm almost out I decided to start back up again, although this time I'm trying to keep it to under 5 well trained trees until I can get a house.

I built this stand for my screened in porch in my apartment.  Thought I'd share.  It receives morning sun all the way until noonish.

by the way, I still love beer.

http://img.photobucket.com/albums/v238/EvaN8/patiotablefinal.jpg

http://img.photobucket.com/albums/v238/EvaN8/patiotablefinal2.jpg

edit: this is my first reddit submit, I would have liked to put the picture next to the title..  still a nub"	t5_2qowd	True
1290457517.0	ea4iv	What would you recommend for a newbie?	SpacePlatypus	16	1	8	I've always appreciated Bonsai as an art form, and now I'm looking into giving it a shot myself.  I live in Wisconsin, so I'm guessing I should start in the Spring, when the weather is warm enough to leave it outside without it getting damaged.  So until then, I'm trying to gather as much information on the subject as I can.  I would love any recommendations for an easy species for a beginner to start with.	t5_2qowd	True
1376604329.0	1kg4xa	Help! What's wrong with my Maple bonsai? (Good growth, the leaves started browning)	discountphilly	17	2	13		t5_2qowd	False
1376243212.0	1k5jk9	New to Bonsai, could you guys give me some advice on my newest tree?	Chriscorrigan94	16	0	12		t5_2qowd	False
1374713179.0	1izuj7	Pinching Elms: a beginner's primer by Andy Rutledge, USA	RedSolution	15	0	0		t5_2qowd	False
1373655239.0	1i65w5	What does /Bonsai think of my new Japanese maples.	SqwallaDollas	16	2	6		t5_2qowd	False
1373039657.0	1hp28i	How can I help this jade?	pogobropatino	20	5	20		t5_2qowd	False
1372677374.0	1hf4xf	Planted my Chinese elm &amp; boxwood in the ground yesterday!	aryary	20	4	9		t5_2qowd	False
1371498498.0	1gjarg	I need help identifying a bonsai I got for my dad. Album in comments.	jeovex	16	0	8		t5_2qowd	False
1370046096.0	1ffrt4	So I decided to take a walk around my property today and look for potential bonsai material to dig up next spring and inspiration (We have a 6 acres). Here are some of my finds.	ninj3rz	20	5	4		t5_2qowd	False
1369596528.0	1f3fsf	Cleaning and repotting Ligustrum Vulgare (Privet).	jgustavo85	17	2	0		t5_2qowd	False
1369009386.0	1envt5	Nursery Finds	BaconPanda	17	3	12		t5_2qowd	False
1368403653.0	1e7ofe	Juniper Literati with shari UPDATE	sketchndraw	20	5	13		t5_2qowd	False
1368027299.0	1dxq47	Acer Burg (leaves turning brown)	AndreasHolbech	18	2	16		t5_2qowd	False
1367602262.0	1dmp1m	These are my favorite bonsai books. What are yours?	music_maker	16	2	19	"My absolute all-time favorite bonsai books are (the unfortunately out of print) John Naka's **Bonsai Techniques I and II**.  If my copies were damaged, I would pay current market price without hesitation to replace them.  They're that good.  Should be standard reading for every serious bonsai student.

Close runner-ups for me are: 

* **Bonsai with Japanese Maples** by Peter Adams.  If you grow japanese maples and don't own this book, you're really missing out. Brilliant book.

* **Bonsai Life Histories** by Martin Treasure.  This book shows how a number of gorgeous trees have evolved over the years. 

Other books I often go back to:

* **The Bonsai Workshop** by Herb Gustafson

* **Making Bonsai Landscapes** by Herb Gustafson

* **Bonsai Masterclass** by Peter Chan

* **Complete book of Bonsai** by Harry Tomlinson

* **The Bonsai Survival Manual** by Colin Lewis


These are my ""desert island"" bonsai books.  What are your favorites?  
"	t5_2qowd	True
1367597843.0	1dmjom	Bought this guy offline at the end of last year. This is the only new growth so far this year, should I try to remove the excess dead/how do I tell what is actually dead and not just in extreme shock?	Kmas90515	15	1	6		t5_2qowd	False
1367514835.0	1dk86q	Picked up this european hornbeam today with the intent of thickening the trunk ... I have some questions.	music_maker	19	5	10		t5_2qowd	False
1366906449.0	1d39d7	I am going to trim my Juniper Bonsai trees for the first time, any advice?	barcaloco86	18	4	6		t5_2qowd	False
1366825611.0	1d0u0v	Here's my second attempt at bonsai - a Brazilian Rain Tree - beginner questions inside!	myweekhardy	18	4	7		t5_2qowd	False
1366560898.0	1cszfb	First attempt at potting something, is this pot too small for it?	Mikerk	20	3	11		t5_2qowd	False
1366504661.0	1cru96	What is this? And can I bonsai it?	moosenuckle87	18	2	23		t5_2qowd	False
1366482808.0	1cr5nt	Maybe this will one day lead to better understanding trees and their needs and being able to prevents deaths from stress and other factors.	pru555	20	3	2		t5_2qowd	False
1366253108.0	1ckx6f	[Update] Mini-Jade and a few more questions (Thank You All!)	nerd42	18	3	3		t5_2qowd	False
1366074657.0	1cfhz1	Concerned about some spots on my Natal Plum	voodoochild461	16	1	9		t5_2qowd	False
1365978195.0	1ccmvj	New bonsai owner seeking advice.	mlph	18	3	13		t5_2qowd	False
1364521064.0	1b7s4b	Dwarf yaupon holly flattop style bonsai	Adamaskwhy	21	5	5		t5_2qowd	False
1364389818.0	1b3vvc	"Did the branch thickening technique work? Update on the ""Specimen"" ficus microcarpa"	Adamaskwhy	19	3	1		t5_2qowd	False
1363828784.0	1apcbs	"A while back I submitted a picture of one of the American Hornbeams I oversee where I work. Here she is again, preparing for her Spring ""break Out"" "	pineapple_kitten	15	1	5		t5_2qowd	False
1361937496.0	19b1p3	Ryan Neil on Japanese Black, Red, and White Pine care	RedSolution	15	0	9		t5_2qowd	False
1360994369.0	18mjnx	Any advice for me and my new Golden Gate Ficus?	TheBoldMuffin	17	2	9		t5_2qowd	False
1360284846.0	183n5j	"Advice Needed: Why is the green-part so ""brittle?"" It just falls apart when I barely touch it. "	47620	17	2	22		t5_2qowd	False
1359950211.0	17ui0e	Thought this looked pretty cool ,you can see the twigs pretty nice this way	tronsai	25	8	1		t5_2qowd	False
1358557684.0	16unrk	Can anyone help me ID this? It was given to me by a friend and I don't know what to do with it.	Reddit_Conspiracist	19	5	5		t5_2qowd	False
1358216039.0	16laxa	I've been collecting hornbeam (Carpinus Caroliniana) this year. [album]	myopinionstinks	19	4	16		t5_2qowd	False
1357526621.0	163h0a	 Podocarpus Bonsai first styling	Adamaskwhy	17	2	7		t5_2qowd	False
1357453970.0	161t71	I was wondering if you could help identify this plant	rbres00	17	2	5		t5_2qowd	False
1356681179.0	15kc0o	Need some advice, is my plant dying?	bethetree	20	7	7		t5_2qowd	False
1356215018.0	15arj2	Criticisms/Suggestions please! Found this Juniper at Home Depot and thought I'd try to start styling a semi-cascade/possible eventual cascade. Sorry for a lack of 'before' pics.	jakethesnakebooboo	17	3	10		t5_2qowd	False
1355344312.0	14qrwe	I know it isn't going to be a bonsai tree, but I thought since I had it I might as well try wiring. How did I do? Should I get rid of the long horizontal branch?	Parkertron	21	5	22		t5_2qowd	False
1353389917.0	13hup4	Looking for advice on my first bonsai, Japanese Boxwood from nursery stock..	themandoval	18	2	7		t5_2qowd	False
1350234456.0	11gt1i	r/bonsai, this is my avocado. Is it time to begin pruning leaves and roots?  The root runs 1.0' deep.	CJLB	19	6	25		t5_2qowd	False
1349563490.0	1128t7	Firethoorn/Pyracantha shohin bonsai with fully ripe berries.	small_trunks	17	2	5		t5_2qowd	False
1349261459.0	10valk	I've become a big fan of this youtube channel- latest episode is on Japanese White Pines	CottageMcMurphy	16	2	4		t5_2qowd	False
1348806430.0	10lrg2	Fused ficus bonsai	RedSolution	16	0	9		t5_2qowd	False
1346378325.0	z4255	Bought my first today. I've always wanted to try bonsai - I'm completely ignorant, but immensely enthusiastic! Advice from the more experienced (IE everyone) would be much appreciated.	Baron_Wobblyhorse	19	3	9		t5_2qowd	False
1345940796.0	ytx2r	My first bonsai, a little Jade plant. Any advice welcome!	toshikisan	16	2	4		t5_2qowd	False
1344732506.0	y2lu4	Picked up my first plant today - beginner here! 	TanRabbits	16	3	3		t5_2qowd	False
1343009206.0	wzsx3	Here's my new winter rose bonsai, any types on taking care of this little guy?	bromethieus	18	1	7		t5_2qowd	False
1340320834.0	veogk	Root over rock first timer, any tips would be appreciated! Also, can anyone identify?	BeastofamaN	17	1	11		t5_2qowd	False
1338422490.0	ucyx1	My pre-bonsai collection, feedback comments or questions are welcome!	jgustavo85	15	2	11	"1- http://i.imgur.com/Q6q8Q.jpg  

2- http://i.imgur.com/qTQJg.jpg

3- http://i.imgur.com/8K8Zb.jpg

4- http://i.imgur.com/BviHF.jpg

5- http://i.imgur.com/iSQKV.jpg

6- http://i.imgur.com/yz1n2.jpg

7- http://i.imgur.com/vRQYG.jpg

8- http://i.imgur.com/yrOW3.jpg

9- http://i.imgur.com/8GvBJ.jpg 
"	t5_2qowd	True
1338035586.0	u5wjs	Just pics of my not quite pre-bonsai..	PeanutButterW0lf	15	2	5		t5_2qowd	False
1337868770.0	u2ri3	Was throwing this sargentii in the trash when its life was saved by a bored friend. We ended up spending a bunch of wire and time on this 'meh' juni. It will require thinning but it was getting late!	myopinionstinks	17	3	6		t5_2qowd	False
1335247459.0	spktr	A moss table? More like a YES table.	AlexKid007	17	3	2		t5_2qowd	False
1334106393.0	s3jcd	weee	diegoratt	19	5	2		t5_2qowd	False
1333910570.0	rzivl	New bonsai for Easter! (green mound juniper) Hows it look?	Homeyjojo	17	1	2		t5_2qowd	False
1332434622.0	r8k6p	Any way to save my tree? (MIC)	threadterminus	16	3	11		t5_2qowd	False
1331592327.0	qtlst	Here are some of my young bonsai. I have some others too...	noface	16	2	7		t5_2qowd	False
1328468327.0	pc39x	Progression of garden juniper. Still learning. Still having a blast! Critique and comments welcome as always.	myopinionstinks	17	0	4		t5_2qowd	False
1327237229.0	oreza	Noelanders Trophy Trees	bonsaieejit	17	3	3		t5_2qowd	False
1324795089.0	npya2	Been wanting to get into bonsai for a while. My parents got me what I believe is a 4 year old Juniper. Share your tips!	pathartl	16	0	9		t5_2qowd	False
1317383366.0	kwdeq	Can anyone identify my bonsai. Man at the market didn't speak English.	alkane_alien	16	1	10		t5_2qowd	False
1314808311.0	k0buw	Did A Few Re-pots Today...	jarnish	17	2	8		t5_2qowd	False
1309036887.0	i94yc	Hi bonsai guys, can anyone help this beginner out?	soladragon	17	2	16	"I am very new to the bonsai idea, I would like to start one this month and keep it alive. I live in the UK and was wondering what seeds should I get? Can I use any tree seeds? And any advice you can give me.

Thank you."	t5_2qowd	True
1306132811.0	hhuwm	Help me /r/bonsai!  I'm killing my Bonsai, I don't know what's wrong with it.  It was a gift, I don't  know what kind of tree it is.	MetaphorFists	15	0	11		t5_2qowd	False
1376589935.0	1kfl8m	Jacaranda still supple after numerous toppings	crossvine	18	4	9		t5_2qowd	False
1375894276.0	1jw5xn	Ficus microcarpa: Da' Beast	Adamaskwhy	14	2	9		t5_2qowd	False
1375614886.0	1joc94	What type of tree is this? (Revisited)	carpecupcake	17	3	13		t5_2qowd	False
1375289587.0	1jfj2p	A reader's willow leaf ficus	Adamaskwhy	16	2	8		t5_2qowd	False
1374486107.0	1isxbo	Hey guys, got this guy a couple of days ago, can anyone help me identify the species of tree it is?	finndeath42	20	5	3		t5_2qowd	False
1374438459.0	1irnbr	Will this survive?	WildGinger701	15	1	10	"I was potting this serissa yesterday and accidentally snapped part of the trunk off. It's being held together by a twist tie currently. It's been like that for about 24 hours now. Do you think the tree will repair itself if i keep it held like that? Is there anything else I can do to help?

Photos: http://imgur.com/a/y00oy"	t5_2qowd	True
1373146899.0	1hrp8m	2 new trees from nursery.	jgustavo85	24	10	4		t5_2qowd	False
1372185329.0	1h1xuz	Some Refinement Tips on a Yaupon Holly Yamadori	Adamaskwhy	15	2	16		t5_2qowd	False
1372023846.0	1gxhk1	Should I be worried about this green stuff taking over my soil?	mrleetman	16	2	10		t5_2qowd	False
1371846617.0	1gtewu	My sons bonsai, nit bad for $14	slm4996	20	5	16		t5_2qowd	False
1370979593.0	1g55lw	New juniper bonsai I made from a nursery plant	Jacob_The_Duck	16	2	4		t5_2qowd	False
1370534378.0	1fsp6w	Beyond saving? My brother in laws tree (details in comments)	bonsajamal	15	0	9		t5_2qowd	False
1370100002.0	1fgsuy	Walter Pall is selling a few trees for a friend. If you click on the thumbnails, you can see the price. You might want to consider a second mortgage.	small_trunks	17	3	13		t5_2qowd	False
1369163879.0	1es63n	Please don't throw away your dead Bonsai!	LumpMaroon	16	1	11	"I am currently looking for dead bonsai trees. I plan on attaching moss to mimic a live bonsai in an aquascaped aquarium! If anyone has any trees they're willing to part with please let me know! Thanks!  

EDIT:  I see a lot of similarities between the art of Bonsai, and the Iwagumi aquarium!  Check out these beauties!  https://www.youtube.com/watch?v=b0dQrSu2VSg&amp;feature=youtube_gdata_player"	t5_2qowd	True
1369161394.0	1es2n2	It has been 2 weeks since last update, do i really just lop off half the tree?	Kmas90515	14	2	10		t5_2qowd	False
1369073407.0	1ephgx	Styling The Juniper Procumbens – Juniper #2 - A Six Part Series of Before and After Styling for Beginners	DallasBonsai	17	2	15		t5_2qowd	False
1368472271.0	1e9ft0	European Beech (FOR FREE! - paid for the pot) - just repotted	AndreasHolbech	17	5	10	"So i got this Beech, and i would like to share it with you! Here is it http://i.imgur.com/dp1bCCp.jpg , it need some years work and styling. 
(spring is late this year)
- sorry for my poor english 
Peace out! "	t5_2qowd	True
1368377998.0	1e6v9q	Japanese Maple leaves turning green. Happening to anybody else?	sikadelic	17	1	12	"My first year having a Japanese Maple so I'm not sure how prevalent this is.  Through my searches i see some attributing it to low sunlight,  however, this is definitely not my case. My tree receives approximately 5 hours of direct sun each day.  Aside from the color (and a few leaves getting gnawed on by pests) it is in great shape. Anybody else ever had this problem? 

http://www.imgur.com/tsVv6b3.jpeg"	t5_2qowd	True
1367813382.0	1drv3w	Reddit, my friend got a new Mallsai (yes, shame on him) but neither of us can figure out what species it is...think you guys could help? :D	LegitPygmy	23	7	6		t5_2qowd	False
1367417979.0	1dhcvf	New to Bonsai - confused how to begin	nine9d	16	1	38	"Hey everyone,
I have been a lurker of this sub for quite some time and I am a plant lover/gardener at heart. One thing that I have always wanted to get into was Bonsai, and now is the time. I have been reading tons of info, and like many hobbies there is lots of conflicting info out there. Basically I would just like some direction in how I should start.

Do most people start with a tree from the nursery, or do they get an actual Bonsai? I don't have any Bonsai shops in my area (NY), but I wouldn't be opposed to travel and find one.

Also, I have seen when people buy trees from a nursery, some just let it stay in the gallon pot for the first year, while others take it out and get right to work with repotting and such. Very confusing which way to go.

I will be keeping my tree(s) outside and I am interested in an Azalea bush and also a Japanese Red Maple. Whether these are good starters or not I do not know, but both of these I have experience with in the full grown form and wanted to get them in Bonsai if possible.

Any help is appreciated, thanks so much for all the info and inspiration in this sub so far."	t5_2qowd	True
1365822752.0	1c90so	New azalea, looking for tips/suggestions	HamburgerTime	14	0	22		t5_2qowd	False
1365761639.0	1c754p	Scared its dying - Details in comments	the_el_man	15	2	18		t5_2qowd	False
1365030548.0	1bmeh9	Help me turn this found Eastern White Pine into a bonsai	ludatic12	16	2	6		t5_2qowd	False
1364770694.0	1bduss	I had to make more soil. 25 gallons or so	Adamaskwhy	18	4	10		t5_2qowd	False
1364014010.0	1aueor	Paradise Bonsai Club Display at Orchid show. Kaneohe, HI. Sorry, I'm a terrible photographer, and not much of a bonsaist either.	Ditch-Doc	15	1	1		t5_2qowd	False
1363573647.0	1ai1pp	2013 Kokufu-ten Submissions | Tyler Sherrod Bonsai	RedSolution	15	1	0		t5_2qowd	False
1362557159.0	19rkrs	Bought this soil from a store that sells Bonsai. Legit?	Mietom4	16	1	12		t5_2qowd	False
1362291396.0	19kd74	Three-point displays | Bonsai Tonight	RedSolution	17	3	0		t5_2qowd	False
1361332358.0	18v5sz	How To Bonsai - Create Root Over Rock	RedSolution	15	1	3		t5_2qowd	False
1361311753.0	18uez3	My Japanese Black Pine saplings	leothedeo	18	6	13		t5_2qowd	False
1360904173.0	18kcr2	My first trim, how'd I do?	classy_nerd	19	3	32		t5_2qowd	False
1359556681.0	17k8s4	I set it on the ground! (Bjorvalabonsai)	myopinionstinks	19	4	5		t5_2qowd	False
1359245640.0	17cbyb	Cotoneaster horizontalis/Cotoneaster Bonsai Progression Series	RedSolution	16	3	4		t5_2qowd	False
1359155480.0	17a9eo	"Many new trees in from Japan and Korea at Lodder - photos from today.

Click ""Slideshow""."	small_trunks	14	1	14		t5_2qowd	False
1358827543.0	171afj	Creating a Boxwood Forest - YouTube	RedSolution	16	3	1		t5_2qowd	False
1357620589.0	165zzw	Bonsai tree species name? I got this as a gift, and any tips or advice would be greatly appreciated.	jlynn43	15	0	27		t5_2qowd	False
1357111335.0	15tde6	Little clero starting his training today.	sketchndraw	15	1	15		t5_2qowd	False
1354811070.0	14e0e7	Hazels - intended for group planting (posted about these last week, just got some photos this afternoon)	Parkertron	19	4	12		t5_2qowd	False
1354396530.0	144atd	erodium	chaddlacy	18	4	4		t5_2qowd	False
1353274186.0	13ey43	Bonsai growing a weird fungus. Any advice?	william701	19	5	18		t5_2qowd	False
1352632505.0	13088c	Kubote Engei Exhibition Photos	bonsaieejit	18	4	2		t5_2qowd	False
1352097047.0	12nmt2	Sunshine Coast Bonsai Show 2012	RedSolution	15	2	5		t5_2qowd	False
1351873538.0	12iqeo	We now have FLAIR on /r/bonsai - ideally use it to name your city and USDA Zone	small_trunks	17	4	16	"Today our mod, Tesseracter, added flair to  /r/bonsai - to be used in a similar way to how it is used in /r/gardening .

The suggestion for how to use flair is as follows: city, usda zone (or equivalent), optional short text regarding experience in bonsai (beginner, intermediate, experienced, expert etc)
I'll be putting something like: Amsterdam, Zone 8, Experienced

"	t5_2qowd	True
1350753603.0	11syq3	How do you all feel about bonsai chili (bonchi)?	luciferprinciple	16	3	10	"I was thinking of drastically pruning back my chilis this year after I read about Bonchis. If not bonsai, it still seems like a way of keeping mother plants compact and beautiful as well as providing a continuous source of cuttings for new full-size plants. I had a few questions though.

Considering they grow so quickly, is there a disadvantage to using chilis as longterm bonsai? I'm worried I won't be able to dwarf the leaves through trimming.

Since chilis bark, I'm excited to develop a thick rootstock during the growing season. Ive heard that trimming back the terminal node helps the truck thicken up by concentrating resources. Is this reasonable?

 "	t5_2qowd	True
1346839873.0	zdxip	"Turning a normal tree ""into bonsai"""	elfwicket	14	1	13	"So I still haven't bought my first plant quite yet and I had gone to home depot as well as a garden center that is nearby and they didn't have any bonsai trees specifically (at least on that day). I did, however, find these trees that were definitely larger than your average bonsai tree and for much cheaper (nearly $5 for some). Since it would be my first tree I didn't want to go overboard with the spending (though am willing to pay for the usual ~$20 for a bonsai tree) I was wondering if it was possible to grab one of those trees that I had found and trim it down to size?

I also figure that if it were possible, I could split the tree into 2 or 3 smaller trees. Is this possible? If so, is this something I could possibly do if I don't find one already labeled as a ""bonsai tree""?"	t5_2qowd	True
1345679648.0	yo0k8	Found this Red Cedar in my yard, and planted. Any tips on what EXACTLY should be done? New to the art of Bonsai :(	sayertindall	17	4	7		t5_2qowd	False
1344027694.0	xn0zn	Help! Friend punctured a root! Will she survive? :(	martinyay	24	10	10		t5_2qowd	False
1338850744.0	ul1kk	"Bougainvillea ""Patio"" Plant - Repotted, going to be a while before I decide what to do with it. Has potential though, right?"	bitofbonsai	14	0	5		t5_2qowd	False
1338818791.0	uk730	My new cotoneaster	Archetix	15	2	7		t5_2qowd	False
1337805612.0	u1kqe	New life	ANTRagnarok	17	6	5		t5_2qowd	False
1337198376.0	tqg9y	A year of growth from seed	Gangstapantz	16	3	5		t5_2qowd	False
1336116893.0	t6jqz	My first bonsai (Juniper) and some other plant art that like to put together and tend to.	horsekeepe	19	4	4		t5_2qowd	False
1331846570.0	qydil	What does reddit bonsai think of this stainless steel pot...bad drainage?	abebob	18	6	10		t5_2qowd	False
1331600700.0	qtsw3	Japanese Maple 'Before'. Wait 'til the 'After' shot in a month.	AlexKid007	15	2	9		t5_2qowd	False
1330011816.0	q2l6z	What Are YOUR Favorite Trees To Grow?	jarnish	14	0	11	"Curious to know what everyone is having good luck with, enjoying, or looking forward to growing.

My three favorites are still Brazilian Rain Tree, Chinese Wisteria, and Fuiken Tea.

What're yours?"	t5_2qowd	True
1328042976.0	p517h	Dad Collected This 15-Year-Old Nebari for Me About 4 Months Ago - Here's My Prune Job from Today	jarnish	14	0	11		t5_2qowd	False
1327578280.0	oxh59	Bonsai Eejit Blog -A bonsai enthusiasts bonsai diary- daily posts on what is probably the most active bonsai blog on the Internet!	bonsaieejit	14	0	1		t5_2qowd	False
