created_utc	id	title	author	ups	downs	num_comments	selftext	subreddit_id	is_self
1345400847.0	yhccv	Great article on grow boxes and training pots. Stop putting pre-bonsai material and saplings in bonsai pots so soon!	music_maker	32	3	5		t5_2qowd	False
1343602893.0	xd15e	My bonsai I've had for around 10 years. 	JoeMomma8008	36	5	11		t5_2qowd	False
1340232437.0	vcpan	Amazing shot of a tree from BBC's Wild China.  Inspiring.	bamb00zled	32	4	7		t5_2qowd	False
1312524130.0	j9m5u	Just wired and restyled my dwarf jade (portulacaria afra). This is a great species for beginners, and will tolerate being indoors! I keep it outside in the summer though... 	PerfectNebari	32	0	8		t5_2qowd	False
1371506069.0	1gjlhp	Baker's dozen of boxwoods	pru555	35	8	21		t5_2qowd	False
1371050888.0	1g77u0	Anybody have an extra half a million laying around?	poopiedust	40	10	11		t5_2qowd	False
1368468714.0	1e9ayg	Styling The Juniper Procumbens – A Six Part Series (Plant 1 of 6)	DallasBonsai	36	8	8		t5_2qowd	False
1368197016.0	1e2k1d	My Bonsai is getting brown tips.. What does this mean and how do I make it healthy?	shadowfusion	34	6	32		t5_2qowd	False
1368093088.0	1dzqx7	Bonsai noob: please help me identify my first tree. Any additional tips would be greatly appreciated!!!	movingshadow808	35	5	53		t5_2qowd	False
1367129805.0	1d9e03	My first bonsai... Am I doing it right? (Operculicarya decaryi)	Solfish	33	6	5		t5_2qowd	False
1357578159.0	164l32	Working on some of my pre-bonsais on saturday afternoon.	jgustavo85	34	3	9		t5_2qowd	False
1349388541.0	10yktt	Korean Hornbeam bonsai. This is my favourite tree - it's about 13inches/33cm tall.	small_trunks	30	1	13		t5_2qowd	False
1343513273.0	xbcyp	Another shot of Fairy Lake Bonsai tree	whytep	39	11	4		t5_2qowd	False
1340294939.0	vdxgx	Got bored and made this Bonsai inspired rug out of some carpet scraps. 	benwillmill	35	5	2		t5_2qowd	False
1335807129.0	t00nu	Yamadori in the wild		30	2	6		t5_2qowd	False
1329256439.0	ppphi	Amazing treehouse sculpture on a bonsai. 	stilettopanda	32	2	3		t5_2qowd	False
1322005577.0	mm2rq	I just displayed these 5 specimens at a recent art show. Thanks for looking.	AlexKid007	31	3	3		t5_2qowd	False
1376239600.0	1k5fov	Jacaranda Trees quickly swallow their scars	crossvine	31	2	10		t5_2qowd	False
1371242650.0	1gd19q	Schefflera	jgustavo85	35	6	6		t5_2qowd	False
1371057073.0	1g7g5t	Bjorvala's latest parody. Kouka-en Cribs. Hilarious!	myopinionstinks	36	8	4		t5_2qowd	False
1369777866.0	1f867x	Carving interesting deadwood into a buttonwood Bonsai	Adamaskwhy	30	2	5		t5_2qowd	False
1367935496.0	1dv14g	Hanging with Nagatoshi	myopinionstinks	35	8	15		t5_2qowd	False
1367857597.0	1dsst0	More Monterey Cypress!!! what do you think?	Quickbeam	34	6	11		t5_2qowd	False
1367356062.0	1dfqj4	Grafting Utah juniper	RedSolution	31	5	5		t5_2qowd	False
1366050146.0	1cejlk	Not sure what to do, would love some personal advice.	Typical_ASU_Student	30	4	25		t5_2qowd	False
1363122593.0	1a66n8	An old mate of mine is a retired marine engineer and gets bored from time to time.	LuckyBdx4	33	6	4	"http://imgur.com/WrbsjzZ

Australia. "	t5_2qowd	True
1362422415.0	19nh0r	Can anyone tell me why my tree has lost so many leaves?	trs0817	29	1	18		t5_2qowd	False
1361042235.0	18nf0r	Does anyone think this is a bad idea? They're tropical clippings and this seems to be doing them good.	lowlikecousteau	35	7	27		t5_2qowd	False
1356591342.0	15ibqi	Little shohin port Jackson fig just cleaned him up a bit	sketchndraw	29	2	7		t5_2qowd	False
1355609434.0	14wv35	This is Europe's largest bonsai dealer - Lodder Bonsai in The Netherlands	small_trunks	35	7	11		t5_2qowd	False
1353947176.0	13tfxr	First Little Dude - Any thoughts?  Should I keep training it this way?	thavirg	32	5	18		t5_2qowd	False
1353099215.0	13bg72	Shohin Plum bonsai. Four year progress with a complete design change at the start.	small_trunks	34	5	22		t5_2qowd	False
1350597543.0	11poqq	Boxwood bonsai with fantastic bark	RedSolution	30	4	18		t5_2qowd	False
1348455608.0	10dhcl	Beginner Bonsai-er......tricks of the trade????	MisunderstoodBrownie	30	1	10		t5_2qowd	False
1347384538.0	zput6	This is a miniature (mame) Pomegranate bonsai...it's roughly 11cm/4 inches tall	small_trunks	34	4	5		t5_2qowd	False
1319756139.0	lriua	My frist tree.	Mr_Oppenheimer	32	5	10		t5_2qowd	False
1314918130.0	k1tug	Stolen!  All of 'em.	DoriftuEvo	31	2	15	"6 bonsai trees were stolen from my backyard in Brighton, MA today.  They're probably not worth much, but they were mine and I spent the past few years cultivating them.  The pic isn't great, but it's the only one I have of all of them.

[Trees](http://i.imgur.com/zfNbd.jpg)

From left to right, two brush cherries, a ficus, a white pine, a bougainvillea, and a brush cherry. Please let me know if you know anything.

If you stole them, please take care of them properly or sell them to someone that can.  All but the pine are tropical.  They should be outside in full sun until the temperature starts getting below 50 at night and then brought in for the winter and put under artificial lighting.  The pine should stay outside, but protected from strong wind throughout the winter."	t5_2qowd	True
1309090162.0	i9ib4	My first bonsai. 	Cujo420	30	2	7		t5_2qowd	False
1375300948.0	1jfz8w	This Boxwood was in the trash at a local nursery. I brought it home for free (with permission of course)	Craption	34	6	14		t5_2qowd	False
1373710179.0	1i7mt1	SABURO KATO COLLECTIONS	bonsaieejit	33	5	0		t5_2qowd	False
1372794092.0	1himx8	My little collection, a few Q's in the descriptions (semi-repost)	bonsajamal	29	3	5		t5_2qowd	False
1372146023.0	1h0xvo	Pictures from a Japanese Bonsai Nursery	notsponsored	33	7	15	These aren't my pictures, just thought I'd share this amazing photo set	t5_2qowd	True
1371954889.0	1gw0c7	My two azaleas have exploded in growth, and I'm now a little overwhelmed	kiraella	30	4	12		t5_2qowd	False
1369851549.0	1fa6xv	Native trees for bonsai	Adamaskwhy	29	3	8		t5_2qowd	False
1368626552.0	1eds29	Labor of love or, how many bonsai do you really have Adam?	Adamaskwhy	32	5	8		t5_2qowd	False
1367434905.0	1dhypi	Grafting jap. maple HigasaYama for the first time, nerve-wracking to say the least	knockoutbmc	28	0	7		t5_2qowd	False
1367162505.0	1d9wn0	Olive tree...should I cut or leave this shoot?	theskyisgreen	33	6	14		t5_2qowd	False
1365025879.0	1bm84y	GSBF Collection at the Huntington Gardens	RedSolution	32	4	3		t5_2qowd	False
1364800432.0	1berx2	The world's 10 oldest living trees	CottageMcMurphy	34	6	26		t5_2qowd	False
1363563541.0	1ahq64	So I chopped the trunk and let it grow, now what?	Adamaskwhy	29	2	1		t5_2qowd	False
1362871105.0	19ztj1	I put some trees outside last week - looked like spring had sprung. Hold on there it's going back to -5C this week and snow tonight! All back into the greenhouse. Sigh...	small_trunks	29	1	27		t5_2qowd	False
1362068504.0	19eh8u	"What is a ""bonsai tree""?
This post will get me crucified...oh well"	Adamaskwhy	34	8	10		t5_2qowd	False
1357138867.0	15tssd	My Christmas present with humble beginnings.	Xenocide321	31	4	16		t5_2qowd	False
1355267499.0	14owzw	Anyone remember a post from a month ago asking if a tree with a tap root was ok to use as bonsai? A few people wanted to see it, but I didn't have any pictures. That is, until I looked...	sjr63	30	2	17		t5_2qowd	False
1354725051.0	14bton	Winter snow just hit my bonsai this afternoon here in Amsterdam.	small_trunks	30	2	43		t5_2qowd	False
1352964910.0	138b7n	Has anyone ever created a bonsai forrest?	runragged	33	7	23	Came across this reddit from bestof and though it would be seriously awesome.	t5_2qowd	True
1351369668.0	126r8j	Weirdest bonsai pot I own - Hanya-style by ABC Ceramics (UK)	small_trunks	29	3	10		t5_2qowd	False
1343445762.0	xa70m	Fairy lake bonsai	whytep	34	8	3		t5_2qowd	False
1338354184.0	ubo6o	You know you're getting addicted to bonsai when you buy a 12 piece bonsai tool kit complete with a traditional Japanese brush off eBay...	tripsk1	33	5	14		t5_2qowd	False
1335819366.0	t0cet	Jade Bonsai Collection	thinker99	29	1	6		t5_2qowd	False
1335338694.0	srg58	just a tree in a pot ¯\_(ツ)_/¯		32	3	13		t5_2qowd	False
1329919725.0	q0wf9	Ryan Neil, America's next bonsai superstar,  is building his bonsai nursery.	myopinionstinks	30	3	4		t5_2qowd	False
1327445082.0	ov4e4	Willowbog Collection Part 1	bonsaieejit	27	2	3		t5_2qowd	False
1304977715.0	h7mzo	Less than a year and I have a new addiction...Bonsai.	jaspersurfer	27	1	5		t5_2qowd	False
1374436242.0	1irkve	Chinese Elm progression pics (6 months)	Snorbitz	30	2	18		t5_2qowd	False
1372014344.0	1gx6y7	Bjorn Bjornholm: Bjorvala Bonsai Studio	RedSolution	31	3	2		t5_2qowd	False
1371346474.0	1gfip7	First plant, help with species?	sindri0730	32	7	9		t5_2qowd	False
1369427649.0	1ezqqv	Bonsai @ Chelsea Flower Show 2013	bonsaieejit	27	1	0		t5_2qowd	False
1369413767.0	1ez9lv	Collected this Ponderosa yesterday	kiraella	27	0	13		t5_2qowd	False
1368383446.0	1e717j	I'm starting an oak bonsai it's my first time, any tips?	POWN_SCOPES	38	13	52		t5_2qowd	False
1367860994.0	1dsx2u	Slightly unorthodox Bonsai display table	Adamaskwhy	41	15	11		t5_2qowd	False
1366202370.0	1cj1le	I kill every plant I've ever owned. Look at my poor Bonsai. How can I fix this? :(	DaisyLayz	31	3	20		t5_2qowd	False
1363656280.0	1akbn2	 My First Bonsai. I've always wanted one and finally found a local vendor. 	johnmichael956	33	8	3		t5_2qowd	False
1362430908.0	19ns2d	Free Jade Cutting	bitofbonsai	27	2	4		t5_2qowd	False
1360711390.0	18ep1h	I live in a tiny studio apartment, so I have to get creative with growing space. This is where I keep my little trainer trees. 	list_less	33	7	3		t5_2qowd	False
1359534905.0	17jwmv	A gift from my son, any advice?	ricky1710	33	6	7		t5_2qowd	False
1355955097.0	154rli	This is how it started	El_Al_Erfainsht	29	1	30		t5_2qowd	False
1351551487.0	12ayug	I bought this little fella about a year ago, I think it has turned out great, but I don't know it's species whatsoever. Any ideas?	callesucia	31	6	9		t5_2qowd	False
1350066972.0	11dlvj	New to bonsai- I started some pomegranates from seed last winter and was curious if I could do anything with them.	iamaturtle	28	3	26		t5_2qowd	False
1349625396.0	113a1g	Common European Elm shohin bonsai. Grown from collected seedling. Height 8inches/20cm.	small_trunks	28	2	8		t5_2qowd	False
1349284526.0	10vu70	Bonsai tree from the Botanic Gardens in DC	Thoraxekicksazz	30	4	7		t5_2qowd	False
1347039209.0	zijsv	Ten Greatest Bonsai Fallacies	RedSolution	27	0	16		t5_2qowd	False
1345757288.0	ypui5	My giant redwood just transplanted a week ago. I'm gonna start trimming next year I think.	ReverbandDelay	33	5	8		t5_2qowd	False
1343701777.0	xfdz0	Got what seems to be an old tree for free. Any idea what tree type this is and advice for its care?	lospinas	30	3	6		t5_2qowd	False
1341432902.0	w1npj	My first Bonsai, a Japanese Maple. How's he look?	horralltiki	34	10	13		t5_2qowd	False
1341022314.0	vtqcs	Probably the largest bonsai pot I've ever seen [more in comments]	TheAgreeableCow	27	2	4		t5_2qowd	False
1333741940.0	rwrt7	the worlds largest bonsai tree planting	nilss0n	28	3	2		t5_2qowd	False
1333575925.0	rtl9j	My black pine seedlings!	nsoysauce	30	3	17		t5_2qowd	False
1301329847.0	gd88b	I made a new bonsai bench this weekend. What do you guys think?	spike55151	28	1	14		t5_2qowd	False
1374778784.0	1j1nb2	Japanese Yew, One of two, Give me advice and I'll thank you.	glableglabes	29	3	15		t5_2qowd	False
1373555154.0	1i30ib	Siberian Elm Leaf Size	RedSolution	28	1	5		t5_2qowd	False
1370130903.0	1fhp7k	Anyone know where I can BUY some really fine leafed moss like this or know of any varieties?		35	10	17		t5_2qowd	False
1370095380.0	1fgpy7	Some new purchases! [Japanese Holly + Dwarf Redwood Group]	Crazzymax	28	3	28		t5_2qowd	False
1369240770.0	1eucni	Graham Potter gives valuable insight on growing from seed and sapling	PeanutButterW0lf	30	4	12		t5_2qowd	False
1368567379.0	1ecaoy	Large cryptomeria air layer – part 1	RedSolution	31	6	7		t5_2qowd	False
1367654200.0	1do482	Port Jackson Fig i got for my 20th today from my beautiful girlfriend.	Corncorn01	31	7	3		t5_2qowd	False
1367316626.0	1dei0o	Mother and Child Hawthorn	bonsaieejit	27	3	5		t5_2qowd	False
1367088126.0	1d888n	Airlayered a total of 7 trees today and took some pictures while I was doing it!	aryary	30	4	28		t5_2qowd	False
1365989497.0	1cd0gx	Juniperus Virginiana collection album. (An update from yesterday's post)	sikadelic	32	6	24		t5_2qowd	False
1365911415.0	1cb4h3	Excited to go collect this Juniperus Virginiana tomorrow!	sikadelic	29	5	18		t5_2qowd	False
1361051185.0	18nom2	When should I start focusing on styling? Is this tree too young? 	blackbirdrising	27	2	12		t5_2qowd	False
1360115565.0	17z0da	Beautiful blooming Ume from Kokufu 2012	RedSolution	27	4	1		t5_2qowd	False
1358197890.0	16kn4r	What are you gonna do with that piece of crap?	Adamaskwhy	30	4	12		t5_2qowd	False
1357059116.0	15rxx2	Stephen's Larch Restyle	bonsaieejit	27	4	10		t5_2qowd	False
1356951707.0	15px28	Tall Larch Restyling	bonsaieejit	29	3	11		t5_2qowd	False
1355610407.0	14ww1u	One small secret they didn't tell us in bonsai 101	Adamaskwhy	29	2	0		t5_2qowd	False
1348867565.0	10n0yz	My newest bonsai - an Olive. It's 10 -12 years old and is roughly 15cm/6 inches tall.	small_trunks	29	2	5		t5_2qowd	False
1347209500.0	zlvrv	Boxwood a few months after a major haircut	bitofbonsai	28	2	13		t5_2qowd	False
1346501346.0	z6jfy	Inspiring form! (x-post from r/pics)	TzarKrispie	34	12	4		t5_2qowd	False
1345828260.0	yrgxa	Help! Can anyone tell me what mind of bonsai this is? And maybe where to find one like it?	Trollivertwist	31	4	12		t5_2qowd	False
1344467298.0	xwpom	Inspiration from the wild. [BotanicalPorn x-post]	GerardHopkins	28	1	0		t5_2qowd	False
1343967687.0	xlrjx	Does anyone know what kind of tree this is?	SavageLegit	28	3	4		t5_2qowd	False
1342050543.0	wevvi	Grew this from seed. Little over a year old. Adansonia digitata (Baobab) When do I start pruning?	brandonw617	30	4	11		t5_2qowd	False
1339572099.0	uzhhf	Grand Old Bonsais are just out there for the taking (Graham Potter)	CottageMcMurphy	26	0	2		t5_2qowd	False
1336349038.0	tae0d	This isn't a Bonsai but I know you guys have some love for succulents, here is another one of my plant art pieces.	horsekeepe	31	4	2		t5_2qowd	False
1332774076.0	re9d1	x-post from r/earthporn: Can this type of tree be done as a bonsai?	linkizzl	27	3	8		t5_2qowd	False
1330898143.0	qhmxt	I present to you: **the Pacific Rim Bonsai Collection!** A beautiful and mind-blowing collection. (via my blog).	aabowman	27	1	5		t5_2qowd	False
1315939392.0	kehap	bonsaifarm.tv  I'm surprised it's not been mentioned in this subreddit. Informative, 10min episodes. Hope you enjoy as I did!	myopinionstinks	26	2	7		t5_2qowd	False
1371486171.0	1giu7j	Do bonsai harbor edible fruit?	SimonPlusOliver	26	1	27	I've heard about one with cherries, now I want to know if they're any others.	t5_2qowd	True
1369440745.0	1f04zf	Small juniper bonsai from Sky Nursery in Seattle. It lives outside.	sgwizdak	28	5	8		t5_2qowd	False
1369142170.0	1erfls	Chinese Elm - My first bonsai	OldBronzebeard	28	5	5		t5_2qowd	False
1365361504.0	1bv7ns	Bonsai out in the open | Shohin-bonsai Europe Studio	RedSolution	26	0	4		t5_2qowd	False
1362526596.0	19qmun	My brother's dog got to my plant while I was in class today. Is it going to make it okay? :(	kobra1294	28	4	3		t5_2qowd	False
1360660815.0	18dblt	Would this be suitable to take a cutting from and work into a bonsai?	TheRealJSmith	27	3	16		t5_2qowd	False
1359249523.0	17cfww	Thinking about doing a windswept juniper (see image 3), but I'm hesitant to make such a drastic change. What do you guys think?	Qcumbaman	30	5	20		t5_2qowd	False
1357927224.0	16e0xn	Shohin Cotoneaster [Artist: Mike Pollock]	RedSolution	31	6	16		t5_2qowd	False
1357654781.0	166mej	Black Pine that doubled as our xmas tree this year	minorth88	33	8	2		t5_2qowd	False
1353465937.0	13jn8g	A tale of three bonsai trees	Adamaskwhy	26	1	5		t5_2qowd	False
1347663421.0	zwfzf	Ficus Retusa bonsai - progression photos over 4 years of development	small_trunks	28	3	1		t5_2qowd	False
1347249006.0	zmxgl	Bonai stencil painting (same stencil as bonsai carpet I posted before)	benwillmill	29	4	1		t5_2qowd	False
1345203898.0	ydev9	I'm looking to turn this English oak into a bonsai, will it actually work?	Skinsnbaccy	26	2	15		t5_2qowd	False
1343751920.0	xgeaq	I bought this bonsai but don't know what type of tree it is, could anyone help? Also, any tips on pruning, watering, and fertilizing? Thanks :)	PinkSombrero	29	4	14		t5_2qowd	False
1342218924.0	wiu61	Any suggestions on styling my Fukien Tea?	Maxin8r95	26	3	6		t5_2qowd	False
1337279633.0	ts0oc	Hey /r/Bonsai, in the past month my juniper has gone from lush green to browning. Desperate for some advice.	Subara	25	1	23		t5_2qowd	False
1329848852.0	pzm69	Can ANY tree be a bonsai, or only certain types?	brianatlarge	27	3	15		t5_2qowd	True
1320357784.0	lzicc	The white annoyed me	faceplanted	25	2	6		t5_2qowd	False
1375814796.0	1jtu4q	Shohin Root Over Rock Trident Maple	OldBronzebeard	27	3	12		t5_2qowd	False
1372966172.0	1hnf7q	Bonsai and Friends	Adamaskwhy	26	4	4		t5_2qowd	False
1372189598.0	1h23r8	Bonsai leaves changing colour, not looking good	the_el_man	26	3	8		t5_2qowd	False
1371925205.0	1gv7bq	Progressions, updates, and a new (to the blog) tree.	Adamaskwhy	28	4	4		t5_2qowd	False
1370290218.0	1flpl8	First trimming of my first Satsuki azalea; suggestions and criticism welcomed.	glableglabes	28	3	18		t5_2qowd	False
1368156172.0	1e1q32	Not sure if you consider this bonsai or not, but it makes me happy.	ganjias2	26	5	9		t5_2qowd	False
1367499762.0	1djqol	Indianapolis Bonsai Club’s May Meeting	RedSolution	29	6	12		t5_2qowd	False
1365966975.0	1cc96r	Just got a new Bonsai (Mini-Jade) and decided to research about it right away. I have some questions though (questions in picture descriptions)	nerd42	26	3	15		t5_2qowd	False
1365785904.0	1c7s8a	5 inch tall Green Island Ficus, Banyan Style	Adamaskwhy	25	1	4		t5_2qowd	False
1365095209.0	1bo6eu	My Blue Star repot, shape, and trim. Still a work in progress.	kthehun89	25	4	13		t5_2qowd	False
1364918325.0	1bis41	Happy Birthday small_trunks! May your branches be gnarly and your backbuds be plentiful!	myopinionstinks	27	5	30	To the guy with the answers and great advice. Cheers!	t5_2qowd	True
1364856272.0	1bgt5o	My first ever attempt at pruning a bonsai, no wire yet, first prune (I have no idea what I'm doing)	moosenuckle87	27	2	9		t5_2qowd	False
1364836968.0	1bfkut	Expensive Bonsai seeds I planted	BaconPanda	41	17	24	"So, I purchased two seeds from a reputable bonsai supplier for $950 total.  I planted them last week in a mixture of potting soil and manure, and have made sure to only water them by setting ice cubes on the soil surface.  

One sprouted today and this is what it looks like.  What do I do to style it?  I'd like to make it into one of those S shaped trees like you see at the mall.

http://imgur.com/r30Betu"	t5_2qowd	True
1362691896.0	19vbkc	Jade Succulent got the boldest trim I've ever done – fingers crossed, did I go too far?	AlexKid007	24	1	7		t5_2qowd	False
1361164238.0	18qggr	Am I doomed to a cascade? Inherited from my grandmother.	Brammaha	23	0	16		t5_2qowd	False
1360782647.0	18glov	Big Ol' Trident Maple Project	Adamaskwhy	28	5	14		t5_2qowd	False
1360205959.0	181i9d	This is my favorite pot dealer. The other side to the art of bonsai. 	Adamaskwhy	24	2	5		t5_2qowd	False
1360007440.0	17vtd1	"I browse different Nurseries around town looking for the ""diamond in the rough"" I dont know too much about Bonsai, but I think this one is a nice find. Can't wait for Spring!"	bitofbonsai	27	6	10		t5_2qowd	False
1358987153.0	175okv	Wondering about moss. Not exactly a bonsai question, but you all would probably be the most knowledgeable on it.	NotSafeForWubbzy	24	2	23	Does anyone know of a good article or guide online to cultivating moss? I found a hillside that has some [really beautiful stuff](http://imgur.com/a/d8LRi) and I'd like to take a sample and grow it's babies.	t5_2qowd	True
1358030421.0	16gjbr	A hippy gave me this in 2004, after almost a decade of seeing it struggle, could you guys tell me how to make it thrive?	Iamstu	25	1	12		t5_2qowd	False
1356531989.0	15gvbn	Carving a deciduous tree for bonsai (blasphemy!)	Adamaskwhy	25	2	2		t5_2qowd	False
1356088428.0	1580wc	Ficus in Chinaware (3 progression pics)	El_Al_Erfainsht	24	2	11		t5_2qowd	False
1355691002.0	14yfmq	Some of my small Korean Hornbeams - here without leaves. Deciduous trees often look their best without leaves, when the form of the trunk and the structure of the branches can easily been seen.	small_trunks	26	3	5		t5_2qowd	False
1355262087.0	14oq93	Green island ficus cascade bonsai/ fifty shades of bonsai	Adamaskwhy	29	5	5		t5_2qowd	False
1354576321.0	14879i	Airlayer of a small Red leaf Cherry I did this year. Started in early April and removed the layer in early August. Looking at the root growth it could have been removed after maybe 2-3 months and not 4. 	small_trunks	27	3	26		t5_2qowd	False
1351874293.0	12ir6i	The youtube list.	myopinionstinks	25	3	14	"Greetings!

I watch a lot of youtube. Whenever I come across a channel with bonsai videos I subscribe to them. I wanted to share my list so some of you can find new vids and perhaps if you know of a channel, you can offer it up as well. I'm just going to list the channels rather than make them all links. Some of these guys you'll recognize. A bunch are not in English but I still feel like you can take something away from watching; if that's your thing.

www.youtube.com/user/&lt;name of channel without brackets&gt;




ActuBonsaiFr    
bjorvalabonsai   
bonsaiEejit  
BonsaiArtisans   
BonsaiBSF   
bonsaifocustv  
bonsaihunters  
bonsaiMirai  
BonsaiWestCollection  
CentroBonsaiTenerife  
chasnsx  
conceptninetynine  
DallasBonsai  
GrahamWPotter  
jgeanangel  
MarczikaBonsaiStudio  
megajozelito  
mikobonsai  
mortenalbek  
ofBOnsaiMagazine  
oleabonsai  
OrlandoBonsaiTV
SatsukiMania  
SebastijanSandev  
SylvainBerbie  
thebonsaihub  
TonyTicklebonsai  
TorinVec  
UMZMerlin  
VietLuanTran  
wigertsbonsai  

And of course, wolfmeditation ;-)

Hope you can either use or add to this list. 

Cheers, 

-B

late edit, Jerry, why is your channel devoid of lessons? You have about 3600 aspiring artists who would love to see you do winter work..."	t5_2qowd	True
1347495822.0	zsncl	First try at nursery stock, ground juniper.	Talkurt	26	2	14		t5_2qowd	False
1344967433.0	y7prj	SO I just bought a new Juniper Nana and potted it, it was my first time, how did I do? 	frickendamnit	28	5	7		t5_2qowd	False
1344433912.0	xvpme	My new Japanese Garden Juniper bonsai. I think it's beautiful so far, looking for tips on trimming!	drakenkorin13	24	2	5		t5_2qowd	False
1341958384.0	wco7c	Don't remember them producing roots like this that quick. 4 week ago, air layer.	kodanky	25	1	6		t5_2qowd	False
1340070568.0	v96n7	Bougainvillea pruning,  follow up of a post a week or two ago	bitofbonsai	23	0	9		t5_2qowd	False
1335794065.0	szpyb	first submission here.. I present my Chinese Elm (pic)	PeanutButterW0lf	27	3	8		t5_2qowd	False
1334354910.0	s8mr8	[Update] My first tree after some more pruning and my first attempt at wiring (Link to original in comments)	linkizzl	27	2	13		t5_2qowd	False
1332355458.0	r743e	Hinoki Progression. Still haven't a clue what I'm doing. Still having a blast!	myopinionstinks	23	1	10		t5_2qowd	False
1319550024.0	lodb5	Raintree Corking	jarnish	27	4	11		t5_2qowd	False
1317832405.0	l1um1	Fantastic Bonsai Collection, Excellent Photo Galleries; Informative! Interesting! 5 Stars!	mkr7	26	3	4		t5_2qowd	False
1317694398.0	l01vg	My 6 year old son wants to turn his tree he got at school into a bonsai...	not_an_ent	25	3	9		t5_2qowd	False
1313116892.0	jgd3k	Graham Potter's YouTube Channel. Mr. Potter is an English bonsai artist, and his videos are unmatched in quality and instructional value. Every bonsai enthusiast should see these, especially beginners.	PerfectNebari	28	3	3		t5_2qowd	False
1371684723.0	1govtr	Tried trimming a nursery juniper, critique welcome.	beepbeepsean	27	4	20		t5_2qowd	False
1370809780.0	1g00fq	Update on my Trident maple &amp; Chinese elm!	aryary	29	5	14		t5_2qowd	False
1368312364.0	1e5ijo	Update: Korean boxwood - Potting &amp; Styling	music_maker	26	5	12		t5_2qowd	False
1368064759.0	1dz3ch	Neighbor went to Florida and surprised my GF and I with a Juniper!	Codyhop	30	7	20		t5_2qowd	False
1367576773.0	1dm18v	Bonsai auctions in Japan. 1000 yen is roughly US$10, EUR 8.00 or GBP 6.60	small_trunks	24	2	12		t5_2qowd	False
1367271875.0	1dd701	Is it too late to turn this tree into a bonsai?	tfb414	28	6	9		t5_2qowd	False
1367018695.0	1d6pox	Helping out a relative... what species is this?	xljj42	25	3	7		t5_2qowd	False
1367000550.0	1d637l	Started a live oak bonsai from seed 5 years ago. Looking for advice.	Higgs_Particle	28	7	16		t5_2qowd	False
1366838834.0	1d1cv0	Let's air layer everything!	Adamaskwhy	24	1	11		t5_2qowd	False
1364677183.0	1bbknr	One of the MANY Shimpaku Juniper I care for. Jin and Shari.	pineapple_kitten	27	4	4		t5_2qowd	False
1364147479.0	1ax81f	Spring maintenance on 5 ilex bonsai. Yes, more ilex, sorry	Adamaskwhy	26	2	5		t5_2qowd	False
1363619746.0	1aizw1	Elm Forest Update	bonsaieejit	26	4	8		t5_2qowd	False
1363448576.0	1aeuwq	An album of my first tree. Bought and repotted this Japanese Maple yesterday.	sikadelic	29	5	14		t5_2qowd	False
1360078811.0	17xpo1	Some nice looking trees from the UK	Adamaskwhy	25	4	2		t5_2qowd	False
1359740027.0	17pcpb	My friend started a Beginner Bonsai youtube channel. I thought /r/bonsai might like it. 	jljones83	25	1	7		t5_2qowd	False
1358747904.0	16z3u8	Help me (beginner) identify this unlabeled bonsai tree?	finley5	24	4	12		t5_2qowd	False
