created_utc	id	title	author	ups	downs	num_comments	selftext	subreddit_id	is_self
1367194789.0	1daykl	Took a trip to the Washington, DC National Arboretum.	GingerStu	302	20	30		t5_2qowd	False
1335770520.0	szg3v	5 yr Redditor. 93 Karma pts total. My Bonsai Collection in Bloom to finally break 100.	bettermentflux	206	17	9		t5_2qowd	False
1343600194.0	xcyr7	Aquarium Bonsai Made by Attaching Algae to Driftwood	nilss0n	189	9	11		t5_2qowd	False
1364568557.0	1b8sdd	Smallest landscape ever? Nailed it.	myopinionstinks	201	23	9		t5_2qowd	False
1345956774.0	yuabv	Re-potting Trident Maple (picture series) 	TheAgreeableCow	183	6	30		t5_2qowd	False
1376147319.0	1k3akz	Here's my garden..... That is all	vitalesan	202	25	19		t5_2qowd	False
1366789083.0	1czx7w	Beautiful Bonsai Cherry Tree (Xpost from /r/pics)	Spanky2679	189	23	13		t5_2qowd	False
1370730316.0	1fy6vp	The Weyerhauser bonsai collection in Federal Way, WA (at company HQ) has some really good stuff	pjkeoki	150	8	32		t5_2qowd	False
1361672443.0	1941c0	Hobbit-hole Bonsai	CHIM-CHIM	146	9	15		t5_2qowd	False
1368970194.0	1emnyg	I visited small_trunks today and he gave me my first trees! Five of them, and a whole lot of pots and other stuff as well!	aryary	149	16	45		t5_2qowd	False
1353818584.0	13qwdb	Found this at the bottom of a rock climb	thealoof	142	9	18		t5_2qowd	False
1336755684.0	tiejn	So, reddit, how do you like this hornbeam?	dijxtra	128	2	16		t5_2qowd	False
1343939823.0	xkzho	"Malaysian bonsai cultivator Kuah Tee Tiong holds the smallest of his miniature bonsai at his residence in Kuala Lumpur August 24, 2005. These miniature bonsai from a local species known as ""water jasmine""; measure 22mm."	RedSolution	130	8	10		t5_2qowd	False
1367699039.0	1dp1jc	I am so happy! My very first show quality bonsai! I have spent the last year proving to myself that I won't kill it, so finally took the plunge! I hope you like it too!	Ditch-Doc	130	10	19		t5_2qowd	False
1343816821.0	xi065	A month ago, I went to Suzhou, China...	NOREMAC84	124	7	13		t5_2qowd	False
1375818718.0	1jtzrx	The Yamaki Pine was Planted in 1626, and Survived the Atomic Bomb at Hiroshima on August 6th, 1945, 68 Years Ago Today. It was Given to the People of the United States as a Bicentennial Gift in 1976.	KayBeeToys	131	15	21		t5_2qowd	False
1374633707.0	1ixhx1	My wild Thyme bonsai I've been working on.	oldxscars	123	12	42		t5_2qowd	False
1357331517.0	15yvdd	Awesome bonsai-treehouse	aryary	134	23	4		t5_2qowd	False
1344497441.0	xxh6c	Now that's a Maple Forest (Bonsai Society of Victoria)	TheAgreeableCow	114	2	6		t5_2qowd	False
1375877229.0	1jvmkl	Finally starting to produce pomegranates :D	Kmas90515	120	16	40		t5_2qowd	False
1347090724.0	zjrbh	I refreshed the Japanese Maple forest with some moss I found. Here's my assistant inspecting the work.	TheAgreeableCow	111	4	18		t5_2qowd	False
1343361251.0	x8aug	New Zealand Tea Tree Bonsai	RedSolution	110	5	15		t5_2qowd	False
1369076036.0	1epkzc	Dwarf jade bunjin bonsai	Adamaskwhy	110	13	20		t5_2qowd	False
1356328888.0	15d1wb	Merry Christmas	TheAgreeableCow	108	13	5		t5_2qowd	False
1346629419.0	z94j2	The Bonsai Society of Greater St. Louis shows off their bonsai during the Japanese Festival at the Missouri Botanical Garden this weekend [15 pics]	rubikscubefreak	101	5	4		t5_2qowd	False
1343597574.0	xcwf4	cultivated since 1625 and purported to have been in Hiroshima in 1945	wouldeye	111	15	5		t5_2qowd	False
1361233943.0	18saen	Here's an elephant's food (portulacaria afra) I just repotted into a pot made by a friend. What does r/bonsai think?	Qcumbaman	100	5	9		t5_2qowd	False
1359801441.0	17qyyy	My Pride and Joy. Juniper roots over rock, over rock. 3 years in the making	AlexKid007	107	11	9		t5_2qowd	False
1344741127.0	y2t6l	My young Japanese White Pine	TheAgreeableCow	101	7	8		t5_2qowd	False
1349429882.0	10zhya	Sensei and a tree at class tonight.	Ditch-Doc	98	8	19		t5_2qowd	False
1336200420.0	t82si	Lake Tree, BC, Canada [found in /r/pics]		93	1	12		t5_2qowd	False
1346359089.0	z3hti	Apple bonsai tree - shohin size.	small_trunks	95	7	37		t5_2qowd	False
1363263754.0	1aa3nz	After the worst days of my life, this was a very small comfort, but a comfort none the less.	amberrr626	103	19	6		t5_2qowd	False
1341021713.0	vtpve	Torch Coral Bonsai	treetrollololo	89	2	14		t5_2qowd	False
1332355088.0	r73qx	Couldn't leave him to the lawn mower. Wish us luck. What's your smallest tree look like?	myopinionstinks	95	5	29		t5_2qowd	False
1376258074.0	1k60p0	Cutting off the airlayers and putting them in pots!	aryary	96	10	19		t5_2qowd	False
1361620064.0	192rdy	Stolen bonsai	Cueball81	95	8	20		t5_2qowd	False
1343407035.0	x95f5	Friend bought a bonsai in a yardsale. I think he made a great purchase.	macsr4idiots	89	5	11		t5_2qowd	False
1336735205.0	ti0on	Amazing bonsai farm right nest to where I work.  Can't believe I never noticed this.	whimsicalwondering	84	1	21		t5_2qowd	False
1366131849.0	1cgz8c	Some shots from the National Arboretum in Washington DC. Unfortunately, not all of the benches were full. Some trees were being protected having been recently repotted.	myopinionstinks	88	5	19		t5_2qowd	False
1347938817.0	1027hc	Our family owns a pair of Bonsai Dwellers 	turbosolid	83	3	5		t5_2qowd	False
1368505830.0	1eansd	.| Its been trained for two weeks in the style of wtfamidoing |.	theSikx	90	13	25		t5_2qowd	False
1375469377.0	1jkwqm	I heard you like ramification! Shave and a haircut, 2 bits.	Ditch-Doc	91	9	25		t5_2qowd	False
1366332972.0	1cnb4u	Beautiful Trident Maple Bonsai.	Spanky2679	86	7	15		t5_2qowd	False
1372357028.0	1h6z6k	Put it in the ground they said	tronsai	92	16	8		t5_2qowd	False
1361736200.0	195av0	A hollow trunk ilex schilling first styling	Adamaskwhy	82	3	18		t5_2qowd	False
1360626996.0	18cbat	Any love for my succulent roots over rock?	AlexKid007	91	15	22		t5_2qowd	False
1369703656.0	1f66fl	So, I found this in the yard. It seems that it had been mowed over for a couple years but still survived. Almost like a natural bonsai.	ninj3rz	86	13	12		t5_2qowd	False
1365843796.0	1c9ff6	This was a delightful surprise this morning	knockoutbmc	82	6	11		t5_2qowd	False
1346458401.0	z5vuh	A gift for a friend. I've been working on this since 2002. 	treehause	80	3	10		t5_2qowd	False
1368307685.0	1e5dey	My accidental chilli bonsai	MikeGayner	85	13	17	"I had [this](http://i.imgur.com/hpOh5PV.jpg) Fire Flame chilli growing in my garden and the wind toppled it over. I didn't notice for some time, and by then the main stem had grown on a funny angle. I soon noticed that the leaves were stunted, so I put it into this little pot I found. When it flowered and fruited (unexpectedly) the flowers and fruit were also tiny.

It's obviously not a true bonsai, but I thought you guys might get a kick out of it."	t5_2qowd	True
1346181506.0	yz5z8	Growing bonsai from seed	abebob	117	43	8		t5_2qowd	False
1345447716.0	yii27	New pot and a trim, my Chinese Elm is ready for Spring.	TheAgreeableCow	81	7	9		t5_2qowd	False
1336269264.0	t9562	Japanese Maple Forrest	TheAgreeableCow	78	4	6		t5_2qowd	False
1339900135.0	v5w0a	"Developing a ""Stick in a pot"" into a Bonsai"	TheAgreeableCow	76	2	10		t5_2qowd	False
1370567234.0	1ftyuy	Collected Western Azalea	treehause	80	8	45	"This is one of the oldest Azalea bonsai I've ever worked on. Dan Robinson and a number of other well known bonsai folks consider it the oldest **bonsaied** azalea in the world. Over three centuries.  

[Album](http://imgur.com/a/ofevl#0)

[Edit: I just relized that what I wrote above implied this was one of the oldest Azaleas in the world, when I meant it was one of the oldest ""Bonsai"" Azaleas in the world]"	t5_2qowd	True
1344325743.0	xtb6b	The hardy Jade (rain water only, trim and a re-pot every few years), but starting to look pretty good.	TheAgreeableCow	78	4	12		t5_2qowd	False
1369867011.0	1fargp	Made a new bonsai stand	Snorbitz	76	4	23		t5_2qowd	False
1345511822.0	yk0gx	The rosemary I'm trying to get my hands on. Beautiful. 	Pro19	79	9	15		t5_2qowd	False
1366884543.0	1d2oyj	Finally finished after 3 days: my first Buxus from nursery	knockoutbmc	75	11	20		t5_2qowd	False
1365444275.0	1bxj9t	Longwood Gardens Bonsai (Spring)	Derporelli	73	7	5		t5_2qowd	False
1347320390.0	zoh0u	Chile Pepper Bonsai Plants. Has anyone here tried this?	wcdunn	71	5	21		t5_2qowd	False
1341695820.0	w6yz6	So I visited the Omiya Bonsai Village in Japan back in 2008. Here are some shots I took. 	ChimpoftheWoods	71	3	9		t5_2qowd	False
1373872898.0	1ibrqu	One of my cypress trees	notsponsored	72	6	7		t5_2qowd	False
1367767743.0	1dqg0o	Picked up this sweet korean hornbeam pre-bonsai today	music_maker	74	10	14		t5_2qowd	False
1365296929.0	1btti0	Hey guys.. I've never been to this sub but was told you may like some of these pics (The first 6 atleast)	thedarkcharger	76	10	4		t5_2qowd	False
1374699833.0	1izdek	[Album] NC Arboretum Bonsai Gallery	InYourLibrary	68	5	13		t5_2qowd	False
1368199246.0	1e2mi5	Few months ago I went to a bonsai class at the house of Mr. Andy Buettner. I would like to share some pictures	jgustavo85	66	3	17		t5_2qowd	False
1363828995.0	1apcly	"White Pine. I also posted this one, but this is the ""new"" pot."	pineapple_kitten	69	4	14		t5_2qowd	False
1349490446.0	110x88	Bonsai Society of Victoria Exhibition 2012	TheAgreeableCow	65	1	14		t5_2qowd	False
1373366868.0	1hxeos	What does r/bonsai think of my initial styling?	AndreasHolbech	71	9	28		t5_2qowd	False
1358630303.0	16w7fq	My Schefflera Progress	edro	69	7	7		t5_2qowd	False
1349189769.0	10th45	A few shots from the nursery closest to me. Check out the size of this elm!	myopinionstinks	63	4	21		t5_2qowd	False
1376318969.0	1k7ja4	A bonsai master’s trees are stolen from his nursery	OldBronzebeard	68	3	36		t5_2qowd	False
1362971031.0	1a26jj	A beginners small collection.	brutusthedestroyer	70	9	11		t5_2qowd	False
1369621822.0	1f45dz	Como Zoo Bonsai Garden	love_and_peace	70	10	8		t5_2qowd	False
1366850768.0	1d1suh	No leaves sprouting yet makes me wonder...	TopLegion	92	32	24		t5_2qowd	False
1362756132.0	19wxv0	Hoping this will be my bonsai's last snow of the season, we are ready for spring. 	Munkeez	71	9	8		t5_2qowd	False
1351127499.0	121gg2	"National Bonsai Museum in Tokyo.
Went here in 2011, some of the trees here are over 800 years old. awesomesauce"	chaddlacy	64	4	10		t5_2qowd	False
1368197884.0	1e2kxs	A Magical Land Where Almost Every House Has A Bonsai	RedSolution	65	4	9		t5_2qowd	False
1369327453.0	1ewuf4	"I recently got into Bonsai and I am loving it! This is the first ""bonsai"" I've made from a nursery plant/shrub. Pyracantha or Firethorn Bonsai"	piero1255	70	9	28		t5_2qowd	False
1366578703.0	1ctkfw	Thief steals beautiful Maple from Master Bonsai Artist, Walter Pall	Craption	70	10	13		t5_2qowd	False
1375668029.0	1jpq4z	Chinese tea tree. Opinions appreciated.	poloman25	66	6	40		t5_2qowd	False
1367415596.0	1dhah3	Bougainvillea also known as Veranera here in my country. Prebonsai still on a training pot.	jgustavo85	60	6	11		t5_2qowd	False
1364308427.0	1b1jju	My fukien tea.		66	6	15		t5_2qowd	False
1351996996.0	12lfmb	Desert rose is blooming	pinkley-taurus	64	3	11		t5_2qowd	False
1341481848.0	w2k7e	A new home for (some of) my trees	Carnot	66	5	12		t5_2qowd	False
1370884483.0	1g20gc	My New Ficus Microcarpa Ginseng Tree	masterkm	63	5	27		t5_2qowd	False
1358878890.0	172fsf	S-Curve Elms	Adamaskwhy	62	4	8		t5_2qowd	False
1342546358.0	wplpu	Bonsai Progression - Ligustrum ovalifolium/Common Privet	MR_Rictus	61	7	10		t5_2qowd	False
1362207142.0	19igpu	An xpost from r/mildlyinteresting and r/geology.. but should be here too	CottageMcMurphy	63	7	5		t5_2qowd	False
1354034901.0	13vou1	Bonsai Tree (Ages 12+): Assembly Required	daedius	63	10	10		t5_2qowd	False
1341525717.0	w3iy6	Amazing artwork of Takanori Aiba	jesusfactory	62	6	6		t5_2qowd	False
1374272830.0	1intrc	At the botanical garden	pth	61	7	13		t5_2qowd	False
1369523965.0	1f1y9b	Some uh... interesting nebari...	aryary	86	31	4		t5_2qowd	False
1361779502.0	196ld5	Graham Potter demonstrates how to turn a very ordinary little nursery juniper into an inspiring bonsai tree.	RedSolution	56	4	13		t5_2qowd	False
1360539733.0	189vgn	Finished wiring my pomegranate bonsai. Springtime will be sexy with those curves.	AlexKid007	58	4	18		t5_2qowd	False
1344046964.0	xnirg	The Bonsai trees of Longwood Gardens, Pennsylvania	ATA72	53	0	10		t5_2qowd	False
1343339087.0	x7oa2	I put my Fukien tea outside yesterday and it rewarded me with a blossom today!		60	6	10		t5_2qowd	False
1335221682.0	soyee	Small in life big in a picture	dodadoo	56	2	6		t5_2qowd	False
1361151887.0	18q2su	Just repotted a little gollum jade. What do you guys think?	Qcumbaman	59	7	12		t5_2qowd	False
1360602125.0	18bet3	After 2 years of looking at it, I finally styled this procumbens into a cascade. 	myopinionstinks	58	5	14		t5_2qowd	False
1359696606.0	17ohey	Picture-Perfect Bonsai	philo1618	61	8	8		t5_2qowd	False
1354862549.0	14flde	For everyone wondering what to do with ugly trees. I present: Stumpy.	Ditch-Doc	65	10	28		t5_2qowd	False
1354761099.0	14czy6	The first bonsai I did as a kid, a Ficus triangularis, is still doing great 13 years later.	CrucialCrew	56	8	3		t5_2qowd	False
1357248135.0	15wr30	love these guys	chuckieace	57	6	10		t5_2qowd	False
1372701975.0	1hfugz	Strangler fig bonsai?! Say what?!	Adamaskwhy	57	6	6		t5_2qowd	False
1371663002.0	1go16x	Two ficus, two treatments and some major root work	Adamaskwhy	57	9	9		t5_2qowd	False
1370032299.0	1ffc3g	Chinese elm group first trim	Snorbitz	55	3	10		t5_2qowd	False
1368030695.0	1dxu7v	Botanical garden Pirna-Zuschendorf	cleberecht	54	1	5		t5_2qowd	False
1348373315.0	10buuy	Chinese Elm - waking up from Winter	TheAgreeableCow	53	3	8		t5_2qowd	False
1346545460.0	z7icg	English Ivy by Jack Wikle in Ann Arbor. 	charlesbronson05	53	1	4		t5_2qowd	False
1376360250.0	1k91hr	Told my mom that I was getting into bonsai so this is what she gets me...	professerchaos0	59	7	26		t5_2qowd	False
1375993186.0	1jz9d4	Little ilex from Walmart	Adamaskwhy	56	9	14		t5_2qowd	False
1366102706.0	1cg9jb	My latest project	teko1986	56	9	10		t5_2qowd	False
1364901748.0	1bibzi	"""Next step is to clean up the rootball by combing out old soil"""	aryary	60	10	4		t5_2qowd	False
1357097858.0	15t0ri	Hairy Hornbeam bonsai tree or, Wire until your fingers bleed	Adamaskwhy	50	3	6		t5_2qowd	False
1352867253.0	135y84	Why is it so hard to start a bonsai from seed?	Frat_Panda	64	14	59	Everyone says that starting a bonsai from seed is difficult and that you need at least ten years of experience before you can do it. What exactly about it is so hard? What can be done to overcome the hardships?	t5_2qowd	True
1375579118.0	1jnnfy	This weekend was the Bonsai Exhibition Costa Rica 2013	jgustavo85	53	6	4		t5_2qowd	False
1368818664.0	1eja3w	Beautiful windswept tree in Cypruss. I now understand why it's such a difficult style to reproduce!	aryary	56	7	4		t5_2qowd	False
1365260600.0	1bsqid	Bonsai Maintenance Duty at Epcot	Adamaskwhy	48	0	4		t5_2qowd	False
1337698394.0	tzb3i	[Logo Contest] European Larch	Carnot	50	1	15		t5_2qowd	False
1329156837.0	pnqmf	Club Trees	DoriftuEvo	48	0	7		t5_2qowd	False
1374541513.0	1iuq3n	Went to Montreal Botanical Garden to see their Bonsais. Good inspiration, here are the pics.	Archetix	52	7	20		t5_2qowd	False
1372089605.0	1gz3jg	First completely solo Bonsai. Juniper Procumbens. Any constructive criticism?	Schoolya	54	10	21		t5_2qowd	False
1361893373.0	199ha3	How I make bonsai soil. My mix, my technique. And The Machine.....	Adamaskwhy	52	4	8		t5_2qowd	False
1349728462.0	115ma6	My first Bonsai!  9 Years old.	FightsWithForks	53	6	19		t5_2qowd	False
1321303379.0	mc63b	I won this beautiful example of a boxwood from a raffle at a small, local bonsai convention	flarbo	48	3	10		t5_2qowd	False
1369603236.0	1f3mz4	May is probably the nicest month in my bonsai garden - trees coming into leaf, Crabapples blooming and everywhere green and red. Here are all the photos I've taken in the last 3 weeks.	small_trunks	53	9	21		t5_2qowd	False
1341577198.0	w4jew	I was out looking for Yamadori, but after surviving for so many years, there was no way I was pulling this one out	TheAgreeableCow	47	3	7		t5_2qowd	False
1369164685.0	1es76d	Jim J. Smith Bonsai Gallery	p3tr0l	49	4	17	"Back in '11 my wife and I visited the [James J. Smith Bonsai Gallery](http://www.heathcotebotanicalgardens.org/bonsai-garden/history-creation) at Heathcote Botanical Gardens here in Florida. I proceeded to photograph every bonsai on display. 

[Here's an Imgur gallery for you to enjoy](http://imgur.com/a/wX4A8#0). 


*My first original submission to Reddit.*"	t5_2qowd	True
1366652204.0	1cvih5	Bonsallal年3 Mis Fotos: Recordando II, Museo de Alcobendas 2010	Salva70	53	7	5		t5_2qowd	False
1365731785.0	1c6g4s	Black Pine before and after	Albuslux	50	3	9		t5_2qowd	False
1365682883.0	1c4p0y	Birch Bonsai. Quick snap shot of the back.	BrickOvenBread	49	2	7		t5_2qowd	False
1365568038.0	1c1k7u	My wife bought me this beautiful pot for my birthday. I repotted my favorite tree, a Hokkaido Elm in it about a month ago. Finally got around to uploading the pictures!	BeastofamaN	49	2	4		t5_2qowd	False
1352451198.0	12wmh8	Last class. We had a raffle and I won a nice little tree!	Ditch-Doc	50	5	15		t5_2qowd	False
1375226396.0	1jdtty	My other juniper bonsai. Advice appreciated.	poloman25	48	5	19		t5_2qowd	False
1368314060.0	1e5ka2	By request. The new Banyan. Scale and white background by 2 and 8 year old.	Ditch-Doc	51	8	16		t5_2qowd	False
1362174833.0	19hk9d	Wire bonsai trees (cool little art gallery)	maak_d	49	5	4		t5_2qowd	False
1356006125.0	155xdm	Air layering an olive tree is like shooting fish in a barrel. I did this during fall/winter.	El_Al_Erfainsht	47	5	12		t5_2qowd	False
1355800117.0	15151b	A member of the Aloe family.  It only flowers once; it is the opposite of a Bonsai, very fleeting. But it bears a resemblance. (1704 x 2272) [Xpost r/botanicalporn]	bamb00zled	50	5	12		t5_2qowd	False
1355354138.0	14r3ko	Rooftop garden with my five starter trees	generalelectrix	49	3	16		t5_2qowd	False
1352076230.0	12n1xk	Ulmus Parvifolia 5 years progression	RedSolution	45	4	16		t5_2qowd	False
1339737618.0	v2zsy	Seiju Elm -- Work in progress	treehause	49	3	8		t5_2qowd	False
1373315451.0	1hvye3	My first bonsai!	HamsterFarm	52	6	12		t5_2qowd	False
1371683887.0	1gouq3	Juniper bush, now bonsai tree. It's been about 4 years since we dug this out of the ground. Criticism greatly appreciated.	li3uz	53	8	7		t5_2qowd	False
1370454307.0	1fqfsf	Birthday Bonsai and pretty kitty	Hawkbeardo	54	14	28		t5_2qowd	False
1366722298.0	1cxl9u	A couple Walmart Ficus Microcarpa found on the cheap	RedSolution	46	5	18		t5_2qowd	False
1359154391.0	17a80u	"My repotted ""mallsai"" Fukien Tea tree"	RedSolution	50	7	14		t5_2qowd	False
1358254662.0	16m5xa	Some new growth on my willow leaf fig after being cut back hard.  Any styling tips??	Cueball81	47	2	11		t5_2qowd	False
1344392797.0	xuxj1	Nursery stock Hinoki Cypress I threw together this weekend. 	charlesbronson05	46	2	9		t5_2qowd	False
1343545324.0	xc1d2	New to bonsai. This is my first tree ever. I just got in the mail. I have no idea what to do with it. I trimmed it a bit and so far I like the way it looks.	Elfgrim	58	16	41		t5_2qowd	False
1340603593.0	vk65l	New Variegated Baby Jade	databacon	48	5	10		t5_2qowd	False
1373399670.0	1hyfmq	Repotting My Bougainvillea Beastie	Adamaskwhy	48	3	23		t5_2qowd	False
1370360733.0	1fnntc	A few Brazilian Raintree bonsai	Adamaskwhy	48	5	16		t5_2qowd	False
1369943972.0	1fcvhr	"Indoor bonsai:Japanese maple species- acer palmatum ""plastica"""	Adamaskwhy	53	9	3		t5_2qowd	False
1368263712.0	1e4dvd	Found this on /r/gardening, is this of any use to us?	aryary	47	6	2		t5_2qowd	False
1367335681.0	1deyls	Sycamore I found (Indiana)	Yusuke_Urameshi	50	7	6		t5_2qowd	False
1365528316.0	1c01qd	Finally spring.	tronsai	47	7	4		t5_2qowd	False
1362932256.0	1a109g	What form is this awesome little tree shaped in? 	sikadelic	48	4	14		t5_2qowd	False
1355095341.0	14kkzg	Last Year's Noelanders Trophy	bonsaieejit	48	3	3		t5_2qowd	False
1355067665.0	14jt1o	I'd like to welcome small_trunks to the moderator team!	tesseracter	51	8	18	"When I got moderator thrust upon me (seriously, the previous mod assigned me, then disappeared) there were about 200 subscribed, and things were pretty quiet here.

We are now over 4000 subscribers, and things are progressing well. Newbies are taken care of, people are getting feedback, and while we haven't reached the upper echelons of bonsai culture (yet?), the group feels inclusive and encouraging, and perhaps we've saved a few trees lives. Just like bonsai, the first priority is care and maintenance, and while I try to keep up with everyone, I'm approaching my limits.

small_trunks has been making improvements to the subreddit before, via requests and excellent content, and has now taken up my request, and I look forward to seeing his impact even more.

PS, if you don't have a bonsai bench, [small_trunks version](http://www.bonsaiempire.com/miscellaneous/building-bench) is very good, looks classy, and I made it before connecting two and two together that they were the same person. "	t5_2qowd	True
1340408865.0	vgl6z	Diamond in the rough [Corky Bark Elm progression]	TheAgreeableCow	44	3	11		t5_2qowd	False
1336534855.0	te4x5	Awesome roots		52	8	7		t5_2qowd	False
1332547297.0	raqwe	My maple	noface	44	4	4		t5_2qowd	False
1376505788.0	1kd5ni	Seems Legit	Perkinstein	51	11	35		t5_2qowd	False
1372882267.0	1hl7op	Wired up my JWP.	edro	50	8	19		t5_2qowd	False
1371973727.0	1gwefw	For my first attempt at carpentry ever, I will build a modular bonsai shelf thing. Here is a 3D model. Any tips/pointers?	ireadallthecomments	46	4	15		t5_2qowd	False
1371277314.0	1gdzog	Bonsai Exhibition at the Royal Botanical Garden, Madrid, Spain	phoboid	51	10	10		t5_2qowd	False
1369939866.0	1fcpzh	My first attempts at bonsai	GoneBabyGnda	48	5	4		t5_2qowd	False
1369001098.0	1enlyt	Austin Bonsai Society Show (In 3D) - 5/19/2013	kacjugr	46	4	25		t5_2qowd	False
1364958642.0	1bkbap	I'm completely new to bonsai. How did I do shaping my Chinese Elm?	Going_To_Pigfarts	44	5	7		t5_2qowd	False
1356095669.0	1584et	I don't use wire to bend my bonsai branches, I just build small swings...and wait...	small_trunks	48	8	15		t5_2qowd	False
1349815507.0	117psy	"Progression of Zelkova Nire (Japanese Corkbark Elm) from a raw trunk into an almost finished bonsai over a period of 4 years. 

I bought the trunk at a club auction, spent the first year growing new roots and then concentrated on branch ramification. AMA..."	small_trunks	43	3	13		t5_2qowd	False
1339184796.0	us24w	This old tree is outside my office and inspires me	reidpar	46	2	6		t5_2qowd	False
1374910263.0	1j5fkg	Competitive display at Usa Jingu, Oita. Suggested x-post from /r/marijuanaenthusiasts/	atomosk	50	7	11		t5_2qowd	False
1371793142.0	1gs20l	Re-potting a long overdue Mugo pine.	treehause	44	6	18		t5_2qowd	False
1369579166.0	1f2yxr	DBS - The Danish annual year meeting with Kevin Willson	AndreasHolbech	45	4	9		t5_2qowd	False
1367455110.0	1dipe7	I guess I needed to remind myself that azaleas are brittle &amp; shouldn't be wired..	CottageMcMurphy	44	4	15		t5_2qowd	False
1364938733.0	1bjkr7	A larch using just three branches: Hi-res so you can zoom-in and look around.	treehause	42	3	18		t5_2qowd	False
1360265237.0	182xpa	You never forget your first... Particularly when it gets stolen.	baudtack	46	6	25		t5_2qowd	False
1358691251.0	16xgus	Noelanders Trophy 2013 Winners	bonsaieejit	43	2	1		t5_2qowd	False
1357403498.0	160ftd	Not all bonsai are green.	small_trunks	47	10	12		t5_2qowd	False
1332109353.0	r2jwu	One of my newer bonsai - Pyracantha Rogersiana	noface	40	0	4		t5_2qowd	False
1328132249.0	p6oyx	Shohin Malus (First Post here)	nodeworx	41	4	17		t5_2qowd	False
1312843061.0	jcvfu	Blue Alps Juniper styling, before &amp; after about 8-10 hours of work over 2 days (I'm on vacation :P)	PerfectNebari	44	4	8		t5_2qowd	False
1376507430.0	1kd81s	The results are in!	bonsajamal	47	5	22		t5_2qowd	False
1374781647.0	1j1r9o	S-curve elm revisit, although they're not really S-curves anymore	Adamaskwhy	43	5	8		t5_2qowd	False
1372609244.0	1hdbwn	Root over rock juniper	RedSolution	44	5	4		t5_2qowd	False
1369775772.0	1f83et	I know you lot like this place: I took a little trip to Lodder Bonsai, in The Netherlands this morning - here are the photos I took as I was walking round.	small_trunks	41	2	63		t5_2qowd	False
1368808049.0	1eix5s	How many of (bonsai4me) Harry Harrington's trees were grown by him from seed?	small_trunks	51	13	29		t5_2qowd	False
1360527715.0	189gyb	My patio is dedicated to training bonsai.	U_P_G_R_A_Y_E_D_D	45	4	7		t5_2qowd	False
1357846256.0	16bw5g	Old Korean Hornbeam 	Adamaskwhy	42	5	5		t5_2qowd	False
1346790232.0	zcqe1	Collected Larch - made into a bonsai.	small_trunks	45	8	8		t5_2qowd	False
1345347920.0	ygiht	My Flowering Quince at the end of Winter	TheAgreeableCow	42	0	6		t5_2qowd	False
1331146520.0	qm2r9	Dandelion Bonsai. Whoa.	murmurtoad	46	7	12		t5_2qowd	False
1318219284.0	l6p73	My 20 year old Juniper Bonsai	puckkarma	44	5	10		t5_2qowd	False
1376086655.0	1k1zpe	My air layering attempt and (so far) success on an apple tree + Ligustrum Vulgaris for the lols.	bonsajamal	42	4	8		t5_2qowd	False
1375739215.0	1jroa6	Neea buxifolia carving and initial styling	Adamaskwhy	42	4	20		t5_2qowd	False
1372043048.0	1gy22j	Hey look! I made a mall-sai! Golden Cypress, cutting taken 2/09.	Ditch-Doc	41	6	12		t5_2qowd	False
1371064009.0	1g7q72	Last of the bonsai in my [ our ] own collection	bonsaieejit	44	5	2		t5_2qowd	False
1368905407.0	1elaao	I've transferred some fresh moss from in between the bricks of my patio to my Juniper bonsai... The results are nothing short of wonderful	drakenkorin13	44	5	25		t5_2qowd	False
