created_utc	id	title	author	ups	downs	num_comments	selftext	subreddit_id	is_self
1316109073.0	kgq5y	My $10 Bonsai Experiment	Jarfol	22	3	9	"About a month ago I was bored.  I had an itch to work on a tree but nothing needed to be done, so I decided to go to Home Depot and just buy the best material I could find.

The pickings were slim but I just grabbed the best I could find, a Japanese Evergreen Holly (Ilex crenata).  There were more than a dozen there but none of them had anything close to a decent trunkline except for this one.  The tree cost me $6.50.  

Then I swung by Walmart and grabbed a bag of [Special Kitty cat litter](http://www.walmart.com/ip/Special-Kitty-Natural-Cat-Litter-25-lb/10293705?).  I had never tried cat litter before and most brands don't work for bonsai, but I heard rumors about this particular kind being useful.  $3.50 for a 25 lb bag.

So I brought the tree home, and did some hardcore top and root pruning (especially roots, I really tore them out).  I then repotted it in a bigger bulb plastic pot with about 75% cat litter, 25% perlite, and a dash of Osmocote.  I didn't think I would post this on reddit or else I would have documented a bit of this.  

[So here is the before and after.](http://imgur.com/a/KiIOY)  A month later, and the tree is doing fine.  Still not pushing buds yet but there is a ton of new root growth.  When I pruned it I wanted to cut it even shorter, but its not a bad idea to leave a fair amount of foliage for the plant.  Once it (hopefully) gets some good back-budding on those stumps, I will cut those long branches on the top back to the first or second leaves.

Its still a good year or two at least from a bonsai, but for $10 I think its pretty good so far.  Fingers crossed that the cat litter works out, and I get some good back-budding.  "	t5_2qowd	True
1313671090.0	jmohy	R/Bonsai. Don't buy mallsai! If you receive one, read the link! 	protomor	20	2	3		t5_2qowd	False
1312927214.0	jdxuc	A Tiny Yamadori	Jarfol	19	1	4		t5_2qowd	False
1312678907.0	jb74c	Our first bonsai =)  Any advice is welcomed and much appreciated!	wrin	19	2	12		t5_2qowd	False
1309623171.0	if1qj	The birth of an Olive tree...		18	0	4	"Here's a pic of my new [Olive tree](http://i.imgur.com/gJ3Tq.jpg).

I planted the seeds (6 altogether) on the 28th April. Exactly two months later, this little fella broke the surface.

 Olives are notoriously difficult to propagate from seed, so when I first saw him I was like a dog with two tails :)

Not sure what to name him yet... maybe Albert, any suggestions Reddit?"	t5_2qowd	True
1375653849.0	1jpay6	My Tree isn't doing so well any ideas?	Craig210	20	3	12		t5_2qowd	False
1375471987.0	1jl09p	Maintenance I did on a holiday, couldn't wait until the weekend and updates from trees I got recently.	jgustavo85	21	3	8		t5_2qowd	False
1373221654.0	1htaiq	Spider Mites?! I need help	piero1255	26	9	16		t5_2qowd	False
1372545707.0	1hc18p	An Example of Unusual Back-Budding in a Collected Pine	treehause	20	4	8		t5_2qowd	False
1372255861.0	1h3wn2	Endless cypress seeds here. Wanted to try something different.	LeagueOfGents	20	3	6		t5_2qowd	False
1371824269.0	1gsmj7	Got my Husband a Juniper bonsai for Father's day :) Our first one! [it is now outside, this pic is from the day he opened it]	AlphaBook	22	5	9		t5_2qowd	False
1371159634.0	1gaoh9	Nacho Marin demo in Orlando	Adamaskwhy	20	4	9		t5_2qowd	False
1370466799.0	1fqwzs	I KNOW it's not really a bonsai - it's a mini Yucca. I bought it a couple of years ago at a local garden centre and finally got round to doing something with it a two weeks ago.	small_trunks	25	6	15		t5_2qowd	False
1367637602.0	1dnsdm	How can I get this to be shallower and more compact?	Kaizen_Blitz	20	5	26		t5_2qowd	False
1367275659.0	1ddcdt	My juniper procumbens nana.	contraposition	22	5	0		t5_2qowd	False
1367195908.0	1dazxc	Spring Bonsai Show 2013 San Diego, CA	whereflowersgrow	18	1	3		t5_2qowd	False
1366205288.0	1cj431	Courtesy of Tony Tickle: Do you have too many bonsai?	myopinionstinks	23	6	6		t5_2qowd	False
1364099018.0	1awdet	Ficus Fusion 1 year progression (ficus tanuki)	RedSolution	20	4	7		t5_2qowd	False
1363548314.0	1ah8go	I went out into my yard looking for a tree with a decent trunk and found this, though the weed whacker beat me to it. Can I save it?	himynameiskyle	20	2	7		t5_2qowd	False
1361866544.0	199004	Not sure what I should do next... help!	Mietom4	18	3	12		t5_2qowd	False
1361764914.0	196847	My first true wild collection	PeanutButterW0lf	19	1	8	"I know she ain't the prettiest thing you ever did see:  http://imgur.com/a/euYCA

Eastern red cedar that I collected (with permission) from a local land trust the other day.  Hard to find 'em this thick yet small, so I grabbed it..  was growing between some large rocks.  Gonna be a long hard road to anything that resembles a bonsai, but I see at least some potential :)

Beer is for scale, and inspiration.  "	t5_2qowd	True
1358610311.0	16vmws	Found a juniper at a garden center. Does she sound like material for my first bonsai?	NotSafeForWubbzy	19	2	14	"It had a pretty nice angle coming out of the ground and a nice trunk taper and a good crown. 

The main problems were that it was in a 3 gallon pot and the guy said that it was a ""ground cover"" breed of juniper, and he said it would be tough as a bonsai. 

Is this true? Or do you think it would be worth a try. I've called around and its the only viable candidate for a bonsai anywhere in my area. But do you think I should wait until I have a greater selection in the spring?

EDIT Ok I got it and took some [pictures](http://imgur.com/a/5eVdO). Its a chinese juniper. I have an Idea of what I want to keep (everything highlighted in red already exists in the plant and would make a good composition, That ""s"" curve is the present line of the trunk. My questions are, if I hack off all of the foliage except what's in red... is that too much too quickly? If it is, what's the right timing? I've read in some places that jan/feb is the time to do it, lots of others say spring. If it's not too much too soon, is there a good guide to pruning, including how to get off that entire extra trunk without killing/hurting the tree, and how to get all of those extra small branches off without the trunk ending up looking like shit

tl;dr how do I get to what's highlighted in red (its all there, just covered by tons of overgrowth.)"	t5_2qowd	True
1358154397.0	16jktz	"Tree dormancy sheet from Virginia Tech. 

The three **main** triggers of entering dormancy are daylength (actually longer night-length), lower temperatures and increased water supplies. It is the EXIT from dormancy where CHILLING is required (500-2000 hours of 2-4c)."	small_trunks	21	3	2		t5_2qowd	False
1357385763.0	16063w	A couple of my little works in progress.	Cueball81	20	2	14		t5_2qowd	False
1356294737.0	15c8ar	Received a chinese elm bonsai as a gift but don't know how to care for it yet	winder	17	1	25	"My wife gave me a bonsai today, she said it was a chinese elm and was about 10 years old. I'm not sure how to care for it yet, so I'm wondering where I should put it and how often I should water it while I start learning how to care for it properly.

I live in Massachusetts outside Boston.

I also noticed that the wire attached to the tree is rusty and cutting into the trunk in some places. Should I remove the wire now? If I remove the wire should it be replaced?

Here are some pictures of the tree: http://imgur.com/a/sgKQj"	t5_2qowd	True
1355342335.0	14qpl5	Buxus, before and after. Extreme beginner at this so feedback is appreciated. 	Parkertron	21	3	14		t5_2qowd	False
1354900137.0	14g9l1	Have you ever modelled a bonsai after a tree you saw in real life?	aryary	20	3	7		t5_2qowd	True
1353436674.0	13irdh	Celtis or Hackberry bonsai; they are not easy to find but this one was cheap. It has bumps and curves in all the right places. It's been growing all summer in a garden bed but now into a pot so it can go in my greenhouse.	small_trunks	20	2	3		t5_2qowd	False
1353186416.0	13d8dp	How dead is this bonsai tree?	MANTIS_POWER	24	8	12		t5_2qowd	False
1352610156.0	12zxb4	Two bonsai demonstrations	Adamaskwhy	19	3	0		t5_2qowd	False
1351796324.0	12gz92	Bonsai inorganic soil mix. I make my own Bonsai soil from 3 similar sized components: Sharp granite grit, Akadama and Diatomaceous earth (aka Moler Clay, aka Sophisticat Pink cat litter). The proportions are 1:1:1 and I use it for all my bonsai.	small_trunks	19	3	55		t5_2qowd	False
1351713586.0	12ezwt	Rescue Maple Autumn Colour	bonsaieejit	21	6	5		t5_2qowd	False
1350312212.0	11ignp	Mame and Shohin bonsai pots - all made by Walsall Studio ceramics. I can never resist good pots when they are reasonably priced.	small_trunks	18	1	1		t5_2qowd	False
1350247199.0	11h5gp	Miniature leaf Japanese Maple shohin	small_trunks	22	6	5		t5_2qowd	False
1346945770.0	zgbsy	Help with my first bonsai?  It's a small juniper that still has juvenile foliage.	Ace_Of_Spayeds	19	2	18		t5_2qowd	False
1344272423.0	xruj4	Bonsaitree at work	aryary	19	4	19	"Well hello there!

Since a few months I've been cleaning at a dentist's during the weekends and evenings. She has a very nice bonsai-tree in the waiting room and it's about 10-15 years old now. The previous cleaner was in charge of taking care of it, since the dentist doesn't really know how to do that. And now it's my job. 

When I started working there, the tree looked half-dead. There were very little leaves on it and it had quite a few dead branches. Also lots of tall branches. Since then I've pruned it where I deemed necessary (mostly apical) and it looks a lot healthier now, so I think I'm doing something right. But I didn't dare touch the bigger branches, specifically two of them.

[Here are some pictures of the tree.](http://imgur.com/a/jCAgV)

- For the first branch, I'm not sure if I should cut it at red or blue. It sticks out a good 30-50 cm before it even starts growing leaves. That's why I prefer red, since it's closer to the core of the tree, but I don't know if the tree can handle that. So that's what I want to ask you.

- I want to cut the second branch at the pink line. This was the branch I've pruned the most since I got there and has since grown quite full. However, just like the first branch, it's sticking out a lot. That is why I want to cut it shorter, to make the tree 'fuller'. 

I also want to change the soil and prune the roots, but I think I'm too late for that right now. From what I've read online, it should be done in the springtime and we're already halfway through summer now. Am I correct?

The dentist does have plant-fertilizer there, and I've given it to the tree two times now (in the course of approx 3 months). If necessary, I'm willing to buy a special fertilizer. 

The location of the tree is in the waiting room, next to a big window. It's also right next to the entrance, so during the whole day the door opens and closes and it gets fresh air. There is no direct sunlight, but a lot of natural light. In the winter it's colder (waiting room isn't very warm) and during the summer it's warmer. I believe the tree is experiencing all 4 seasons, but more moderate than it would outside. 

Any help &amp; suggestions on this beautiful tree would be appreciated! I want to make it as healthy as possible, so please help! :)

Edit: I do have some experience with gardening, since we have a pretty big backyard and my dad &amp; I spend a lot of time in it."	t5_2qowd	True
1339653504.0	v192g	A few photos of my Bonsai.	mc2222	18	3	9		t5_2qowd	False
1337216409.0	tqw2t	Strangler tree (x-post from /r/botanicalporn) would make an incredible bonsai.  Imagine the possibilities.	whimsicalwondering	18	1	5		t5_2qowd	False
1337180667.0	tq108	This is my juniper after trimming, re-potting, wiring, and a little weighting. 	stupidhoes	19	4	7		t5_2qowd	False
1333901894.0	rzccg	New weeping fig bonsai. Any tips for successful growth?	caseygail	18	3	3		t5_2qowd	False
1332758031.0	re0ul	New here, glad to have found you!	2latenow	20	4	10	"

Hi - I'm new to this subreddit and wanted to share my ""bonsai story"" by way of introduction. As you read it I am sure you will find it a bit sensational but I assure you every word is 100% true...

I've been growing bonsai for 5+ years and started like most people do; alone and confused. Friends and family rolled their eyes, laughed behind my back and waited for the phase to fizzle. 

Many dead trees later, I decided I liked the IDEA of bonsai too much to give up, even though I was frustrated and wasn't getting results like I wanted. The guy behind the register at the local bonsai nursery happened to mention he was the president of the local bonsai club and I should come check them out. The next meeting was literally on my birthday. Coincidence?

Everyone seemed friendly enough. I had brought a couple trees I needed to re-pot and showed what I could do. I got some good pointers and tips from various members, but generally people commented that it looked like I knew what I was doing. I was satisfied with that, but also knew I still had a lot to learn. The club was the key, there were obviously some very knowledgeable people there.

A couple months later the Pres had arranged a trip to visit the bonsai garden of some old ""bonsai hermit"" type guy. I asked for the address and phone number and offered to meet the prez there. He said ""sorry"", and explained the guy was something of a hermit with no phone and no email. You couldn't just show up there on your own. So I happily rode with the prez. 

Once there, I was surrounded by about 250 of the absolute best bonsai I had ever seen in person. In a clearing of a pine forest was a roughly circular area surrounding a small shack, dozens of telephone poles were sunk into the ground to varying heights, each capped by a round concrete slab of varying diameter. Upon these pedestals the bonsai were arranged...like some incredible fantasy bonsai stonehenge. I wandered among them for about an hour, utterly in awe of every detail. Every time I asked the price of a tree the bonsai hermit; rail thin, leather skinned, and crazy gypsy hermit scary looking (with a lazy eye, even!) cackled at me, ""that one's not for sale, heh, heh"" over and over ""not for sale"", as if he were mocking me.

Long story short, I did find an incredible azalea and had to have it. The price quoted would make anyone wilt, but I agreed to pay without question. Of course, spooky bonsai hermit guy laughed when I whipped out my plastic. ""Cash only, buddy, ha ha ha!"" - I didn't have enough.

I took out every last dollar I had and handed it to him, (about half the asking price) explaining that's all I had. He asked ""you gonna be at the next meetin?"" I said yes, I planned to. He said ""me too, just bring the rest then."" I said thank you and extended my hand to shake his. He reached out a frail leathery claw towards me and smiled, steel gray eyes probing the depth of my integrity. I looked down at his hand to shake it, and noticed for the first time it was covered with tattoos of lightning bolts down the length of his fingers. I shivered in 85 degree heat.

Fast forward to the next club meeting. This guy was doing a demonstration on air layering. When he was done I asked if he had a minute. He said yes and followed me to a quiet corner. I paid him the remaining $ I owed him, and sheepishly asked if he might need any help at his place. He said, ""sure you can help out if you want, I can't pay ya nothin' but you'll learn a lot.""

From that day until this, I have been his student. I have spent roughly two full days per week during the growing season driving 1.5 hours each way to another *state* to help care for his trees and create my own. I am learning everything this man can teach me from his 40 years of personal and private bonsai practice. While he is still very much a hermit he is also a great friend and teacher. 

Incidentally his family bought him a cell phone last year. He promptly stuck it in his back pocket and I left it be. One day out of the blue he asked me if I would do him a favor and put my number in so if he needed to call me he could. He handed me the phone and I realized I was entering the first name in memory. I guess I was the only person he could imagine wanting to call. That kind of stuff will mess you up if you're not careful.

So I am proud of my bonsai teacher, and everything he has taught me. I cannot summarize it, or paraphrase. The knowledge has simply become a part of who I am, and I do my best to practice what I have learned, but also question and challenge it. 

I'm here because I love bonsai and hope to meet like minded and help those with questions. Maybe have some of my own questions answered, etc.

Thanks for reading my story,
2latenow"	t5_2qowd	True
1329829619.0	pz9il	I know this is a really unclear picture, but could someone tell me what sort of tree this is nonetheless and if it's any good as Bonsai?	jeredditdoncjesuis	19	1	18		t5_2qowd	False
1329256626.0	pppnu	The Secret Art of Bonsai Revealed.	tux1954	19	1	0		t5_2qowd	False
1329247891.0	ppi3s	My pomegranate will make me very proud this Spring.	AlexKid007	19	1	13		t5_2qowd	False
1316094593.0	kghzh	Trying to style a cascade. meh :/	myopinionstinks	19	0	5		t5_2qowd	False
1312611281.0	jalkm	Bonsai at Century Park - Shanghai	ghosteatingtiger	17	1	1		t5_2qowd	False
1311363038.0	ix2le	My Four Baby Jack Pines	GnomeKing	17	1	8		t5_2qowd	False
1307637968.0	hvmrp	Bonsai - North Carolina Arboretum (May 2011)	asthealexflies	20	2	6		t5_2qowd	False
1376255699.0	1k5xxq	My first tree, Trident Maple	professerchaos0	17	1	10		t5_2qowd	False
1376000537.0	1jzjl0	Bald Cypress - When and where to prune them back?	comfortablybum	17	1	4		t5_2qowd	False
1374962915.0	1j6mba	Need help with plant ID, and suggestions, zone 9a	1pcsnowman	19	3	4		t5_2qowd	False
1374536271.0	1iujo8	ficus update	Wudditdoowiddit	17	1	20		t5_2qowd	False
1374341044.0	1ipbzf	Share your bonsai	OldBronzebeard	19	3	5	"I've seen a lot of different trees on this sub and I thought it might be a nice idea to create a thread where we can all share some images of our trees. 

Either your whole collection, a tree you are working on at the moment or your all time favourite. It doesn't have to be an imgur link, it could be a link to your blog, flickr - whatever you like.

Naturally there will be a lot beginners like myself whose trees we would see frequently in the sub that may be less interesting to the seasoned veteran! Despite this I encourage everyone who is interested to participate. 

[Here](http://imgur.com/a/A5ec6#0) are a few images of my trees which I am enjoying thoroughly as my enthusiasm and interest in the hobby continues to grow."	t5_2qowd	True
1374013964.0	1ig1oz	When did you first become interested in bonsai.	mrleetman	23	5	46	I first became intrigued 3 years ago, I'm 24, and I'm finally getting decent at bonsai and horticulture in general. When did you all, specifically the grizzled bad-asses with tons of experience, start with bonsai? How were you first introduced? 	t5_2qowd	True
1373996333.0	1ifcxk	New Graham Potter Vid (3 weeks old)	Mayotte	21	4	2		t5_2qowd	False
1373836102.0	1iaocm	My growing collection...	linkizzl	20	4	7	"These are the things I have collected recently, some I dug up myself in the woods, but most I bought from nurseries, and mostly they were all on the cheap.

Sorry, I don't know how to make a imgur album, I have tried before but I always lose it before I can get to a link...

[Spruce](http://imgur.com/70uNVKX) I just picked up today for $25, it is hard to see in the picture but I think this will make a fantastic little tree in a very short amount of time. [Here](http://imgur.com/GEOYx4G) it is again.

[This](http://imgur.com/fw5pMR2) is [going](http://imgur.com/doOcrwp) to be my [pride] (http://imgur.com/MDuBTAg) and joy. This big japanese maple is about 6 feet tall, with a 6 inch thick trunk. All the branches come off within the first 3 feet of the trunk, the trunk above that is all dead. Because of this, I got it for $90 when it was marked at $370. I am very excited to start playing with this one.

[Cute little cypress](http://imgur.com/XUByUpC) I bought a few days ago as well. It will probably be about 1 foot tall when it is done. It has two main trunks, some good branching (just in need of being cleaned up, badly...) The reason I bought it is that it has some cute little roots that caught my eye seen [here](http://imgur.com/hzB0SS3) I know it isn't perfect material, but I got it on the cheap and think I could make something work.

[Larch](http://imgur.com/8yOyvPe) I bought earlier this year from a nursery. It is about 2 feet tall. Japanese Larch to be more specific, I lost a good amount of the root ball when I dug it out of the nursery, but am pleased to say it is doing very healthily now. Here are the [roots](http://imgur.com/kMLk5dK).

[Red Maple](http://imgur.com/MHcMFvn) that I dug up this spring that was going out of the foundation of my house... It is short, the trunk is only about 5 inches tall due to being hit with the weed whacker several times over the years, and I think with a few more years I could make it have a single full canopy on top of that trunk. [Here](http://imgur.com/CskXVZx) it is again.

I had much more hope for this [hornbeam](http://imgur.com/N2atRsF) last year when I dug it out of my woods. After cutting it back there year and letting it grow, I am losing hope, but I will still find something to do with it.

Anyways, that's it, sorry I couldn't just give a photo album, I'm not very good with imgur..."	t5_2qowd	True
1372360440.0	1h73zz	Rejuvenating a ficus bonsai, part 2	Adamaskwhy	18	4	7		t5_2qowd	False
1370459173.0	1fqmd7	Five new Insta-Bonsai-Mugos from my favorite nursery	knockoutbmc	21	3	12		t5_2qowd	False
1369933580.0	1fchp1	What to do with these Maples ?	Crazzymax	20	5	22		t5_2qowd	False
1369791738.0	1f8o25	My juniper bonsai, how is it looking?	Troyster143	23	7	25		t5_2qowd	False
1367935446.0	1dv12u	A late PBA post	myopinionstinks	17	0	0		t5_2qowd	False
1367625824.0	1dngt7	Nursery Find 10$ a piece	pru555	21	3	1		t5_2qowd	False
1367433757.0	1dhx5i	Any tips on Field Maple ramification?	Snorbitz	19	2	15		t5_2qowd	False
1367354557.0	1dfody	Could any one help identify this species?	commentor4	21	5	8		t5_2qowd	False
1366858321.0	1d231z	Turface vs NAPA #8822 weight per volume: Science!	SimpleBonsai	16	0	8		t5_2qowd	False
1363872492.0	1aqb58	Complete and utter noob here.  You guys inspired me to start from a cutting.  Went out yesterday and found these two guys rooted in on top of a huge, mossy, shaded boulder.  Am I doing this all wrong?  (mid Tn)	The-Stranger	19	3	23		t5_2qowd	False
1363810661.0	1aoo31	I find drinking helps.	linkizzl	24	7	12	"I find drinking helps, especially when you are new, when working on new trees. 

I have only been doing this for 2 years now, so I am also new, and I know that one thing that holds me back the most is that I am afraid of doing something that will kill my tree. And you know what? Beer alleviates that fear! This little suckers are a lot tougher than you think, and really there is only one way to learn this shit, and that is to try it out yourself. Sure, you could ask r/bonsai for advice, and they may tell you don't do it, but you never really learn your lesson, and you never really learn if maybe your method would work.

Really, if you are questioning something, just try it! If you kill a branch or even the entire tree, well you learned something didn't you? And if you only killed a branch, then woohoo now you get to learn how to deal with a dead branch! It is all a learning process, and from what I have seen on this subreddit newbies are often afraid to try something new because they think killing a tree is a huge deal. It isn't, things die, go buy another one and don't do what you just did again!

Drinking alleviates these thoughts. 

Here is what I just made: [Fuck yeah!](http://imgur.com/fDSNFdM)

He is a Juniper my mother bought for me after I killed my previous one, he was prebonsai stock bought from a trusted vendor, and damn he had a lot of roots. Beer helped me with cutting those to fit the new pot. I am going to try to fill in the top area to make a single layered canopy. Not really a traditional juniper style, but you know what? Fuck it.

That is also soil that I made myself for the first time, pretty proud of that shit. I have about 20 more gallons in the garage, I didn't really realize how much I was making. I think I was drinking when I was making that too...

That is another idea new people need to keep in their minds: ""Fuck it."" You wanna try a type of tree that isn't frequently used or do a style that isn't frequently done in that style? Hey man, if it is what you wanna do then fuck it and give it a shot! Just have a back up plan ready, and probably try on multiple trees at once. It's like shooting a gun, you send enough lead down range you are bound to hit your target sooner or later. Just replace lead with trees. And target with what you want your tree to look like.

Moral of the story, or as you reddit commoners like to say ""**tl:dr**"" : Just try it. What do you have to loose? Normally it is just a $20 tree. And I am tipsy."	t5_2qowd	True
1363714808.0	1alrzh	Four updates: four ilex, one male, one old, one potato, one pig	Adamaskwhy	19	3	4		t5_2qowd	False
1363033186.0	1a3n9j	"My first bonsai. A juniper ""nana"""	Mexicaninja	21	5	15		t5_2qowd	False
1362429754.0	19nqkr	Recently trimmed the roots of my 2-3 year old Ginko Biloba in time for Spring. Here is how it went.	zebes7	16	1	7		t5_2qowd	False
1361393489.0	18wp52	Holy Balls! Guy Guidry at the NoNaMe Bonsai Study Group	Adamaskwhy	19	3	2		t5_2qowd	False
1359774437.0	17qgqi	The much anticipated, long promised, long winded, Ever Lovin' Bonsai Soil Epic	Adamaskwhy	19	1	13		t5_2qowd	False
