created_utc	id	title	author	ups	downs	num_comments	selftext	subreddit_id	is_self
1361069542.0	18o7df	Advise for first time camper + family 	debianmike	24	7	15	"I used to camp out as a kid, but I have never ventured out as the ""adult"" of a group of people.

This summer, my wife's family is planning a group outing in the woods somewhere in New England (or upstate NY).

I have been wanting to try camping again to see if I would like it as an adult, so this works out pretty well (they chose camping as a cheap alternative for all the children that are involved).

So my question is, how do you gear up for a week long camping trip, starting with nothing and being ready for anything....without spending a fortune....and in a way that if I hate it I wont be stuck with all this gear?
"	t5_2qk80	True
1360008799.0	17vv5x	My little mountain hideout, view from sleeping bag, Gjende lake, Norway.	Takingadumpnow	19	2	0		t5_2qk80	False
1359404860.0	17g5jx	Camping: What tent to get	bluesforsalvador	22	5	45	"My girlfriend and I are going camping in South Florida during valentine's day weekend (her idea!).  And I'm looking for a tent.  I've been camping before, but could use some pointers.

I've read a lot of specifications of tents that say they have ""Factory sealed seams"" to improve weather protection.  But I've read reviews that of those tents that say they leak when it rains.
My questions:
**Should I buy some seam sealer and go over the seams when I buy the tent.** (possibly voiding any warranty)
**Do all casual camping tents leak and need seam sealer?**
**Are air mattresses really necessary?** (I've seen a lot of people say they are on reddit)


I'm looking for a tent with good ventilation (because it's likely to be hot in South Florida) and one that doesn't leak (it rain a lot down here).

[Here](http://www.meijer.com/s/alps-vertex-4-person-mountaineering-tent/_/R-224194?CAWELAID=415254522&amp;PID=4485850&amp;cmpid=commjunct)'s a tent that I'm looking at now.  Thoughts?


Thanks!"	t5_2qk80	True
1355829100.0	151ptq	Whats the best game plan for someone who is going to go winter camping?	clinicall	24	8	25	"My buddy has a 4 season tent, however I only have a 0 Celsius sleeping bag.  We are going camping this January, record low last year was -25 F. Any tips in staying warm doing some mild hiking, and especially staying warm at night? Warm pads? What's your advice?

EDIT: I'd rather not spend $200 for a sleeping bag I'd only use once.

Hey thanks for all the helpful advice everyone! I realize its better to rent a bag for a weekend that has a higher rating, Thanks again! I'll have to come back here more often, and upload some pics!"	t5_2qk80	True
1352745664.0	132oy9	Camping in France	metamonster	21	5	8		t5_2qk80	False
1352048285.0	12m8ku	"Who here would make fondue on a camping trip? Betty Crocker would!

  "	RealFamilyTime	19	4	3		t5_2qk80	False
1350996825.0	11xz2z	Tent Tips for Happy Camping | BlogPad - Digital World	irfanahmad7	21	2	3		t5_2qk80	False
1350975600.0	11xo0w	Has anybody had experience with living at a campground? 8-10 weeks is what i'm thinking	lampwall	20	2	13	"I got a job at an aquarium in Ft. Pierce, Florida from December to March on the east coast at the beach. I am looking at different housing options, and am thinking about living out of my 1989 VW bus at a state park that is a few miles from my job.

Has anybody here had experience with living at a campground? So far i think that i can definitely do it, just wondering what i'm not considering in this process. "	t5_2qk80	True
1350681826.0	11rooz	Hey Campit, how to you pack your 3-day bags?	CarbonGod	19	4	20	"Hey all.   First time overnighter.  Will be doing 3-day AT very very soon.  However, I'm not sure how to pack my bag?  I have a 80L and my wife will have a 60L.   Will have 2 Thermarest Sol pads, 2 bags, and a tent, along with the normal clothes(really, how much should I take?  Ain't taking a shower!), FBC meals, and other random bits and bobs.

Should I strap the pads and bags to the bottom?  Should I give my wife the 2 pads, and I get the tent?  Should they be on the sides, inside, yaddayaddayadda.   

What do you do?  What should I keep close at hand, and what should I bury to the bottom?

Thanks in advance!

EDIT: Thank you everyone.  We have rearranged quite a bit.  Tossed clothes, and switched to synthetics we have (plus some more bought).   On our 10 miler test run, we ran into some issues of weight.  Got a light weight tent, and will try sleeping in ONE bag.  That will cut 5 some pounds off.  I'm having issues with hip and upper leg pain, along with collar bone bruising.   Will snag ""special"" foam padding from work this week and use that on my shoulders ;)   I'm sure hip bruising was from jeans,and all the pleats, riviet, and crap.  I'm also not where near fit enough for this weight, so....that will have to be fixed later.
I gave all upvotes....and took all advice!

"	t5_2qk80	True
1346891405.0	zf8cu	Florida Camping in August	kingsmuse	23	5	5		t5_2qk80	False
1343538482.0	xbx6w	Beautiful sunset to end a great trip. 	one4seven3six2five1	20	2	1		t5_2qk80	False
1339619152.0	v0ejc	East Coast Culture Shock	FaustusRedux	22	5	26	"I'm a Colorado native who now lives in New England.  My kids are finally old enough to go camping, so I'm trying to find good places to go.  It's amazing to me how different an activity ""camping"" around here is compared to the trips I took as a kid in the National Forests in the Rocky Mountains.

People ""camp"" at what seem to me to be resorts...clubhouses, shows, swimming pools, activities.  Just craziness.  And at least in Massachusetts, even the more traditional campgrounds are already mostly filled up for summer.  I know this because you *must* reserve your site via a website, and you *must* reserve it for at least 2 nights.

I guess there's no real point to this.  Just venting to people who might get it.  I guess I should just be glad Vermont is close enough to actually find something approaching wilderness and solitude.

EDIT:  I was honestly just venting, and y'all came through with some really good suggestions.  Thank you!"	t5_2qk80	True
1337215218.0	tqv1o	Quick video of how I make an alcohol stove out of a bud light aluminum bottle	barkeep8	17	0	8		t5_2qk80	False
1336529943.0	te0f8	Favorite Dutch Oven recipe?	cinch123	18	2	32	We are going family camping this weekend. We usually cook at least one dinner in the Dutch Oven, but I don't really want to do a stew, which is what we usually do. I figure some of you also love Dutch Oven cooking, so share your favorite recipe here!	t5_2qk80	True
1329518984.0	puidc	If you love camping, please take this quick survey for my class project! Thanks!	carebearstare83613	20	5	12		t5_2qk80	False
1329066649.0	pm6kx	Getting Started	Gipionocheiyort	18	1	59	"Hi!

My fiance and I have been talking about going camping for a while now, and I think we're going to try going this spring when it gets a bit warmer.  We've been having some relationship difficulties lately and really feel like the alone time that camping would give us could help things.

I have a little bit of camping experience from when I was younger (only on large commercial lot style campgrounds unfortunately...don't think it's really camping if there is a lodge facility with showers, tvs, and a pool table) and she has no experience at all, so we pretty much need to start from scratch.

I've been looking around on Amazon for gear options since I figured going off of customer reviews would be better than going into a store knowing nothing about what I need and getting upsold without realizing it.

I was wondering if anyone had any advice for someone just starting out, or if there were any good resources out there to help us figure out what we need.  I do have a few specific questions that I was hoping someone could help with.

1. Does anyone have a list of the actual gear that we'd need?  I have a basic idea of what we'd need to bring with us but I'm afraid of forgetting something that we'd need.
2. Can I trust the big stores like REI or Dicks to actually tell me what I'll need?  Or am I better off researching and buying online?

I figure we'll most likely start off at Great Smokey Mountains National Park since it's only a few hours away and seems like a nice place to get a feel for things. "	t5_2qk80	True
1325043375.0	nt4ji	When I found a few packs of Polaroid film at a thrift store I brought my instant camera instead of a digital camera on the Allagash River canoe trip.		18	1	5		t5_2qk80	False
1320534200.0	m1u5j	How do you guys get over the idea of being attacked by a bear?	pippx	18	2	66	"I live in central NC and have been camping my entire life. However, I get reluctant about camping in back country or for prolonged amounts of time, simply because I am terrified by the idea of being mauled, attacked, eaten, raped, etc, by a bear. 

How do you guys get over this? Do you just use logic? Statistics? Do you try to ignore the little voice in the back of your head? Do you avoid reading news stories about bear attacks? I seriously want to get over this so I can start backpacking in my gorgeous state."	t5_2qk80	True
1310743570.0	iqh6j	Ferret Camping Set......Oh.  My.  God.		22	6	4		t5_2qk80	False
1375317365.0	1jgl9g	A couple of Southerners who are interested in cold weather camping.	sadsouvenaunce	18	0	16	My fiancé and I live in New Orleans and we love camping. From his time as a Boy Scout, we have all of the camping gear we need. We try to camp at least once a year, but usually it's more. We've never camped in the winter but this year we want to give it a chance. Our main concern is driving. We have never driven in snow and rarely drive on icy roads. Our vehicle is a 2 wheel drive Tahoe. Ideally, we would like to camp in a mountainous area such as the Smokies. Is this a realistic plan? How is it driving on roads? Should we consider renting a car somewhere? Any ideas on nice camping areas that we could navigate (preferably a days drive)?	t5_2qk80	True
1375287993.0	1jfgvj	Backpacking Crabtree Falls and Spy Rock, VA	lfalexan	21	6	3		t5_2qk80	False
1373457312.0	1i0317	Is Camping Not Your Thing? It Can Be!	impankajpaliwal	22	6	5		t5_2qk80	False
1372041058.0	1gxzzq	Camping Pisgah National Forest, NC	wsgaston	25	10	10		t5_2qk80	False
1369349922.0	1exobq	Best Camping in Wisconsin??	IMototoMI	23	9	15	"Does anybody here have any suggestions for a great camping area in Wisconsin? I have been a few places, mostly near kettle moraine but I am looking for a relatively remote area for a group of about 10 people. 

I live in Chicago so any ones further South will be more convenient but I am willing to travel for an awesome area. 

Thanks for any advice!"	t5_2qk80	True
1369257326.0	1euzba	Hey R/Camping, What are some of your favorite uses of Blue tarps other than as groundcover or shelter?	Berndawg25	23	7	13	I get made fun by my buddies for always bringing a couple extra tarps.  I think they are the most useful product and stand toe to toe with duct tape.  Any of you have some unconventional uses you'd care to share?	t5_2qk80	True
1369236574.0	1eu7b1	Rainy weekend of camping ahead, any suggestions?	wallcharger2	22	5	27	My fiancee are getting away for a long weekend and the forecast shows a good chance of rain every day.  We are no strangers to the outdoors, have all the right clothing and great tent that's been through rain before.  We've hiked in rain and enjoyed it.  Still, this is a bit next level for us; I don't know that we'll see the sun at all.  Any tricks to make it more fun, set up camp in a way that's best suited for rain, etc?  I'm less curious about how to stay dry - we've got that part down - and more about how to make it the best version of camping it can be given the circumstances.	t5_2qk80	True
1368999264.0	1enjqi	Music Festival Camping help?	ObamasInPajamas	19	3	22	"I'm not super outdoorsy, I'm not always out camping or anything, but more than likely after I go to Bonnaroo, I will use the equipment I buy more... but first, I'm looking at ""How To Survive Bonnaroo"" lists, things of that sort, and of course they're saying - shade, shade and tons of it. I found a fairly cheap (Amazon Prime price is 89) screened shelter (http://www.amazon.com/Coleman-10-Instant-Screened-Shelter/dp/B00339C3G4/) and I was wondering if this would stand up (with proper staking and roping) in tough winds and rain? 

I also was planning on buying some deluxe cots, 48 on Prime (http://www.amazon.com/Texsport-Deluxe-Folding-Camp-Cot/dp/B001NI6TBW/) and stick two in there and a table, with some tent lights and the works. 

Should I do anything else besides secure them? Buy tarps or something for the sides for rain, anything? Honestly, I'm just kind of winging it mostly before I go to Bonnaroo in June. I'm sure /r/Camping knows tons more than me on this sort of thing."	t5_2qk80	True
1368967871.0	1emmj1	Video of my 9 year old demonstrating how to use a vintage Coleman stove	bushidoka	25	8	7	"Hi folks, yesterday we picked up a Coleman stove off Kijiji and my boys wanted to make a video of how to use it so we did a team effort.   My 9 year old ""stars"" in it, and most of the editing was done by my 11 year old.   It is a Coleman Model 4M which seems to put it between 1958 and 1972 best I can tell on Google.   $60 was a good deal for one of these old work horses in mint condition.   New ones go for more than twice that.

[9 year old demonstrating how to use a Coleman Model 4M](https://www.youtube.com/watch?v=qLG4vYb0_Rw)"	t5_2qk80	True
1368460799.0	1e90n1	Camping Food - Cooking Catfish	ronsanto44	27	10	3		t5_2qk80	False
1367031298.0	1d72yn	Camping flashlight - what do you use?	anickles	17	2	28	"I was preparing camping gear for the year, setting up the tent, laying out the sleeping bag, checking my gear, changing batteries, etc. I get to my flashlight and realize an upgrade would be a wise decision. 

I'm looking for something pretty rugged. I don't need it to withstand being ran over by a tank or a nuclear blast, but it will be dropped, typical stuff. I also require it to be waterproof for obvious reasons. LED with multiple brightness settings/dimming isn't necessarily required but would be really nice. I'd like to have a pretty long battery life as well. 

So, what are you guys using? What would you buy if you needed a new light?"	t5_2qk80	True
1364999013.0	1bl6sz	Anyone every used solar chargers?	Twidbin	19	3	30	I don't know if this is the right subreddit, but I am traveling to a really remote part of Kenya in a month or so and will have no access to electricity. I was wondering if anyone had any recommendations for solar chargers as I am looking to mostly charge my camera and video camera. Any trips would be great. Thanks guys!	t5_2qk80	True
1362076545.0	19erbk	Winter Camping in Killarney 	PinkAlbatros	17	3	2	"Hey there,

I am planning to do a quick overnight winter camping in Killarney Park in the very near future.  Is there anyone who has done this in that park? And if so any tips on good locations for one night stay during winter months? I mean tent camping.  Thank you in advance."	t5_2qk80	True
1361897393.0	199lr6	Cold weather camping for wussy person	throwaway8299	20	4	17	My SO and I have been planning a camping trip to Vogel state park in GA for a while now for our big low-budget Spring Break trip. Well, I just found out that it is not, in fact, going to warm up at all next week like I had thought it might. I am a very cold-intolerant person and I also have a slew of health problems that make me miserable when it is extremely cold out (migraines, reynauds, joint problems). Since we have no other options, and I am determined to carry on with my camping plans, I am packing an excess of blankets, socks, hand/foot warmers, etc. Are there any other unique ways that you guys have found to stay warm? I guess my last resort before packing up and coming home would be to sleep in the car, but that still isn't very warm... I have heard of tent heaters and stuff like that, but not sure those are so safe. I don't really care if the experience is primitive or whatever, I just want to be able to enjoy whatever experience I can get. Suggestions?	t5_2qk80	True
1357621977.0	1661fc	A little trailer I made for my winter camping of 2012	DBurdie91	19	3	2		t5_2qk80	False
1357429866.0	16165f	9° of stupidity	HiTechRedneck	27	10	10		t5_2qk80	False
1357388156.0	16071l	hammock for zombies?	FedhmanKassad	25	9	10		t5_2qk80	False
1355719867.0	14z8bt	My recent night on the BC coastline. An absolutely amazing place to camp.	zeptepe	19	5	0		t5_2qk80	False
1354635270.0	149jun	Vinegar -- A Useful Item in Camping	daviddeugene	30	15	7		t5_2qk80	False
1350451104.0	11m6s8	Wizards of r/camping, What is the difference between a simple pop up tent from walmart that costs 40 bucks, and the same size tent from a company like REI that costs 300 bucks?	wdarea51	19	2	13	"Me and my girlfriend are looking to buy a tent for camping, and we have always used the typical walmart 30-50 dollar 3-4 person tents, usually made by ozark trail or something of that nature.

We are wondering if it is worth it to spend upwards of 300 dollars on a nice tent, because we can't find anything wrong with the walmart ones."	t5_2qk80	True
1349862321.0	118ttj	Night In The Jungle	Veeraksana	20	3	1		t5_2qk80	False
1348807486.0	10lscd	The strange formations of Goblin Valley State Park.	ealpiner	18	3	4		t5_2qk80	False
1347604299.0	zv6h4	Top 5 fun-filled Camping Expeditions That Turn Into a full-blown Disaster	HarryPrice	42	29	2		t5_2qk80	False
1347469148.0	zrv2c	Great car camping spots in Southern California?	SensiblyReckless	18	3	20	"I'm trying to plan a trip for a few of my friends and myself. Most of them aren't experienced with camping and are more comfortable with car camping than backpacking! I'm looking for a place in Southern California that allows campfires and has other activities (canoeing, kayaking, hiking, etc). Does anyone have any suggestions? I mostly only go camping and backpacking around Northern California so I don't know any spots! I'm also going through a hard breakup, so somewhere that would be stunningly beautiful to take my mind off of things is a plus!

Thank you!"	t5_2qk80	True
1344229618.0	xr03a	Car Camping along Hwy 101 from Vancouver to Northern California soon. 	trashcompactor	18	2	17	"Making this trip at the end of August.  I'll be camping out of my truck and wondering if anyone has any advice/cool spots to share. 

I figure as long as I stick to the coast I should be able to find a back road to drive down and sleep for the night.

Thinking of stopping for a night or two around Sea Side, and Coo's Bay in OR, then down to Humboldt Redwood state park area for a few nights. Unless I should stay on the coast? I really want to see some big trees. Any good Northern Cali spots list them off! Thanks. 

Edit: This is awesome! Thanks everyone. 

 "	t5_2qk80	True
1342481446.0	wo63x	Screws that hold the handle appear to short.	Bunny08able	24	7	5		t5_2qk80	False
1341815981.0	w9d4h	Just got home from a one week camping in Yosemite. Here are some pictures I took. 	hopehelvete	19	3	3		t5_2qk80	False
1339774371.0	v3jls	R/Camping, my boyfriend is taking me camping in a very remote forest soon. That's all good and fine, but how am I supposed to poop?!	throwawaycamperr	23	7	65	As amusing as it may sound, I'm serious! I've camped before but always in a place with facilities. Any tips?	t5_2qk80	True
1332162100.0	r3e2k	"Is it really ""you get what you pay for"" with tents?"	notjustahatrack	17	0	36	"So I'm looking into buying my first tent, I've done a lot of camping with my parents when I was younger, but never had my old gear.  We always used my parents Eureka! Tent and that seemed to be OK, but from what iMve read on here, most people seem to go with Marmont, REI or Kelty and those seem to be more expensive than say a Coleman tent.  Are they that much better at keeping the moisture out of the tent or is it a paying for the name thing?  

**edit:** So mostly i plan to car camp, however i do plan to camp from spring to fall, asically anytime the temperature is above 55ish degrees during the day.  I dont really care if it rains or shines, i've camped through it all and plan to keep doing so.  My major concern is water in the tent, nothing more miserable than waking up from a good nights sleep and everything in the tent being soaked from the overnight rain or just from the mositure from us in the tent."	t5_2qk80	True
1326817361.0	okyzh	Some cool camping trinkets. I especially like the Swisschamp knife.	Skibum360	17	1	1		t5_2qk80	False
1376651970.0	1khcym	Camping done right.	for_the_shorties	26	11	2		t5_2qk80	False
1374965695.0	1j6pav	Bryce Canyon Camping Availability?	bulldogcrow15	20	5	5	I live in Las Vegas and was hoping to take a trip up to Bryce Canyon in September.  Ideally I would like to go for Labor Day weekend.  I went online and saw that most of the camp sites are on a first come, first served basis.  Does anyone know how crowded Bryce is likely to be?  Are the chances good that I'll get there and find an available campsite?  Thanks!	t5_2qk80	True
1374416018.0	1ir0yu	How to find and fix slow leak in air mattress?	TexasDex	17	4	16	I have a Coleman queen size air mattress worth a built in pump and it has a very slow leak in it somewhere. Every morning my wife and I are touching the floor when we wake up. Any suggestions as to how to find and repair it?	t5_2qk80	True
1374065661.0	1ihduc	First weekend camping trip, exploring the Badlands, and hiking the black hills, would love some feedback.	Omaromar	19	4	20	"EDIT*



I am planning on leaving Friday Aug 16th, not sure how long we will be in the badlands, maybe just driving through the loop.  Saturday morning we will wake up early and head out the a Harney Peak trail head and start the climb.(No idea what we need as far as passes for state parks? I assume we should have some backpacks with water and snacks also.)

After climbing Harney peak, I want to head down and take a tour of the windy caves, or maybe setup camp at a cool spot by a lake.

Leave Sunday morning and head back to Minnesota. 

* Stage 1

[The overall route, Burnsville MN to  Harney Peak
Mount Rushmore, SD, with a stop at Badlands National Park, 9 hour drive.](http://i.imgur.com/MI4smGD.jpg)

 
* Stage 2
[The loop through the Badlands. My first question is, what are the rules with pulling over and taking pictures? Is there a place we can park and then set up a few lawn chairs and smoke a hookah pipe at sunset on a cool ridge with a vista? Do i need some sort of national park pass?](http://i.imgur.com/1qZFbvI.jpg)

 
* Stage 3
[We pull into either Rapid city or Keystone SD.](http://i.imgur.com/0pHA1dO.png)

 
* Stage 4
[We will then head out to a trail head and then climb up to the old fire watch tower on Harney Peak. No idea where the trail heads are or what we need to access them.](http://i.imgur.com/0pHA1dO.png)



Complete amateur here, any help would be welcome, thanks in advance.

------------------------------------
**-Updated Crowd sourced plan-**

* Will be leaving Friday morning to have more daylight in the BadLands. We will get off the loop and park, then walk in until we find a great spot and set up tents and hang out for the night.

* Saturday morning we will arrive at Custer State park. A Redditor recommended Sylvan lake but that camp site is all full! Bummer I know, but next year I will know to sign up early. The closest camp ground that is open Aug 17th is Blue Bell Campground. Its 17 miles away from Harney Peak trail we want to summit. Thats cool I guess, we can drive up from our camp site and park at the base of the mountain next to Sylvan lake? 

* After we do the summit, we will tackle atleast one of the other trails mentioned here.


"	t5_2qk80	True
1372774331.0	1hhwup	Camp cooking utensils ???	Dragon_Snapper	18	5	30	It has been years, and now time to start getting a few new items for my camping totes. My question is what is a good compact cooking pots and pans others have used? This is not for backpack camping, but tenting for week long trips, or weekends.	t5_2qk80	True
1372349895.0	1h6pfb	Southern California Camping	space_trip	22	7	13	"Would love some suggestions for amazing spots to camp that has lots of adventure and nature. Love climbing across boulders, waterfalls, rope jumps, cliff jumps, beautiful nature, etc.

I'm in Los Angeles and willing to drive 4 hours."	t5_2qk80	True
1371867066.0	1gu1fq	Is it true you shouldn't touch the inside of a tent wall when it's raining?	debianmike	20	6	4	"I haven't been camping in over 20 years.

I bought a new tent this week and we are heading out in August.

I've always wondered why people are always worried about touching the inside of the tent wall if it's raining out, and if that ""myth""? still holds true."	t5_2qk80	True
1371230212.0	1gcktp	Sleeping Bag Washing Question	PhDouche	20	6	14	"I'm going camping next week for the first time in too many years, and I want to wash my long-overdue-for-it sleeping bag. However, the care label says in hug letters NOT to wash it in a home agitator style machine, only in commercial, front-load units. Is there any way around this? I'll take it to the laundromat if push comes to shove, but it's a pain in the butt.

Thanks for any help or advice!

EDIT:

Thanks to everyone for their perspectives; it's a synthetic bag, so I don't know if the down issues are a problem, but either way I will take it to the laundromat."	t5_2qk80	True
1370010443.0	1felbq	est. 3am sunrise on Tebesjuak Lake, Aurora Borealis, and a happy camper, Nunavut	arcticatlantic	17	2	1		t5_2qk80	False
