created_utc	id	title	author	ups	downs	num_comments	selftext	subreddit_id	is_self
1346117593.0	yxqj0	Camping babes :) 	lollette	75	37	19		t5_2qk80	False
1345039817.0	y9fcd	Glamping in UK	photoszz	51	17	12		t5_2qk80	False
1341532375.0	w3pah	Banana slug at Portola Redwoods	weare13888	38	0	4		t5_2qk80	False
1339007851.0	uocgj	Camping on the tip of Sinai	saba-7-o	42	2	5		t5_2qk80	False
1327787863.0	p0xoo	Since folks seem to be interested, here's a bunch more photos from my 50-day canoe trip	arcticatlantic	44	5	20		t5_2qk80	False
1315510261.0	k95ku	"My idea of ""car"" camping."	infinityprime	43	5	13		t5_2qk80	False
1370538277.0	1fsulx	41 Camping Hacks That Are Borderline Genius	ramblinRed	114	77	24		t5_2qk80	False
1370366799.0	1fnvpn	Unfortunately I inherited my mother's inability to 'pack light'....		74	37	61		t5_2qk80	False
1339547949.0	uyxlz	Yosemite Coyote	Heroicarts	42	5	3		t5_2qk80	False
1336596418.0	tfafu	traveling through Wyoming before the parks opened, we were forced to camp on the side of the road.	bcgpete	43	5	6		t5_2qk80	False
1374343858.0	1ipf5u	Going to this beautifull place in a couple of days!	Lliesaa	43	11	4		t5_2qk80	False
1370042522.0	1ffnxd	Meramec River, MO. View from my favorite campsite, getting ready for my yearly trip there next weekend.	drock8	43	6	6		t5_2qk80	False
1365039116.0	1bmpz9	December camping at Sunpeaks Resort in Kamloops, BC. Too much snow to go home.	Wintereighty7	45	5	5		t5_2qk80	False
1364151652.0	1axcqe	Algonquin backcountry at sunset (Eastern Pines). Miss you, summer! 	averageintelligence	42	6	8		t5_2qk80	False
1358394292.0	16qbj4	Killarney provincial park.  Arrived late, in the dark.  Woke up to this amazing view.  	McBalls_	45	7	17		t5_2qk80	False
1353368804.0	13h86n	Dreary camping at Mt. Diablo last weekend. Didn't stop us from having a good time. 	TechnologyFetish	38	5	7		t5_2qk80	False
1348247984.0	1098we	Our July campsite on Black Rapids	climbinginzen	42	8	6		t5_2qk80	False
1348065864.0	104ygs	Breakfast of champions: Outdoor edition	Motourist	44	6	8		t5_2qk80	False
1339538980.0	uype6	Had a nosy neighbor at our campsite last night [Stone State Park, IA]	ALXD	42	4	5		t5_2qk80	False
1373561017.0	1i38cp	Kettle Moraine State Forest Southern Unit Camping and Biking.	Middle_Aged	44	11	14		t5_2qk80	False
1371669959.0	1goayb	Why doesn't /r/camping have an FAQ?	gizmola	42	7	7	"FAQ or at the very least a list of ""must have supplies"" and whatnot?

I realize I am asking other people to do work :)"	t5_2qk80	True
1351722756.0	12fayb	Caddo Lake, Texas.	america__yall	41	9	9		t5_2qk80	False
1349197600.0	10tp97	Camping with 3,499 friends - Alchemy 2012	melicious23	45	10	19		t5_2qk80	False
1347842025.0	zzwv5	Grand Canyon May 2010 	nlkuhner	42	4	3		t5_2qk80	False
1344040482.0	xnd9p	I think of myself as a minimalist (Bike rack, and 7 dollar tent)	USABMXer	40	5	7		t5_2qk80	False
1343080278.0	x1e3y	It's almost time for my annual Labor Day Weekend camping trip. Here are a few memories from last year.	melicious23	40	8	18		t5_2qk80	False
1342449381.0	wn801	Camping in the heat next weekend, thought I'd try these in my cooler. Nasty or yummy?	betterWithSprinkles	38	3	21		t5_2qk80	False
1340217843.0	vcack	"DIY strap ""chair"", looks good for backpacking."	lovellama	44	9	19		t5_2qk80	False
1375126264.0	1jaohl	I always curse the weight of the iron skillet while packing it. But then meals like this remind me why I pack it. (Sorry for potato quality)	pinappleINspace	55	21	20		t5_2qk80	False
1346171692.0	yyv5c	Moonrise over Heart of the Hills campground, Olympic Peninsula, Washington. [x-post from r/pics]	electron_junkie	34	1	3		t5_2qk80	False
1343578343.0	xcfwh	The best way to wake up a late sleeping camper...	jolennne	59	25	22		t5_2qk80	False
1373309197.0	1hvpnn	Advice on how to camp with a toddler	tuscangourmet	59	24	46	"As a father of a 2yo toddler who recently went camping with him, here is my advice on how to camp with a 2yo toddler: don't. 

That's all there is to it. "	t5_2qk80	True
1373150905.0	1hrtbo	My story of repairing a blown-out internal frame in a Gregory Baltoro backpack, while afield.	apestate	41	5	5		t5_2qk80	False
1372207846.0	1h2rf8	Supermoon over our Galveston camp site. Taken with IPhone.	Sondex	54	23	6		t5_2qk80	False
1370627025.0	1fvi8g	Help your friends avoid stupid camping 'hacks'	hlynn117	37	4	15	The buzzfeed '41 Camping Hacks' article has shown up several times on my feed. It has a bit of good advice -- but most of it is patently terrible. It describes these hacks as 'borderline genius' -- if you've never slept in a tent somewhere that's not your backyard. [Here's the original article.](http://www.buzzfeed.com/peggy/camping-hacks-that-are-borderline-genius) [Here's my response.](http://throwthisbookatme.com/2013/06/07/15-camping-hacks-that-actually-make-sense/) Even if you read neither, please stop your friends from constructing DIY 'laundry machines' and 'portable toilets' for camping trips.	t5_2qk80	True
1366226724.0	1cjwmr	Guess What This DIY RV Is Made Out Of...	marinated_pork	40	9	14		t5_2qk80	False
1353733942.0	13paj6	Summer is not that far off... The amphibious camping trailer.	baronofballard	40	3	2		t5_2qk80	False
1352308551.0	12t0dd	A solid way to find campsites. Good forums too.	taintburger	41	6	6		t5_2qk80	False
1345074537.0	yagww	I was thinking about getting one of these for car camping. What do you think?	bolthead88	37	5	37		t5_2qk80	False
1333476486.0	rrhyt	Bear saves dude from a mountail lion.	missledave	47	14	12		t5_2qk80	False
1369590244.0	1f39ak	Winter Camping Yellowknife 2012 Canadian Forces	My_Little_Brony	42	9	21		t5_2qk80	False
1368829708.0	1ejn9y	For US folks: REI is having its annual sale, and there are some very, very good deals to be had	tuscangourmet	56	23	54	"[REI](http://www.rei.com) is having its annual anniversary sale, and there are some very good deals to be had. They are such an awesome company with a fantastic customer service (I don't work there, and I have no affiliation). 

I had bought a tent three weeks ago with them, but seeing the deals they had I returned it to take a larger one, and they made no issue whatsoever, which may sound normal...but they also applied a refund on the difference between the price I had paid one week ago for other stuff I had bought and the current sale price of the same items. 

Result? I ended up spending more money with them, buying other things...

if you have to stock for your next camping season, go have a look. "	t5_2qk80	True
1361645791.0	1939i3	If you have ever been to a beach bon fire	ocfirepits	37	6	21	"You may not know, but the city of newport beach california is attempting to remove all 60 of its beach fire rings. Rings that have been here since the 40's. The California coastal Commision is set to place a verdict on the matter at the day and time below.

 If you are in the area I urge you to attend, the commissions staff have recommended that they DENY the permits needed to remove the fire rings, and that removal would set a precedent for the rest of the state, can you image california without the summer bon fires?


If you would like to show support, you can sign this petition online: 

The commission will read EVERY signature.
http://www.change.org/petitions/california-coastal-commission-newport-beach-city-council-members-stop-the-removal-of-60-fire-rings-at-big-corona-state-beach-and-balboa


THE MEETING IS :
WEDNESDAY, MARCH 6, 2013 at 8:30 AM PST
THE BAHIA RESORT HOTEL 998 WEST MISSION BAY DRIVE SAN DIEGO, CA 92109 (415) 407-3211 Phone number will only be in service when the meeting is in session


Directions: From Orange County Take the I-5 S Take exit 21 to merge onto Sea World Dr/Tecolote Rd Continue to follow Sea World Dr Merge onto W Mission Bay Dr via the ramp to Ingraham St/Mission Beach Take the ramp onto W Mission Bay Dr Destination will be on the right


Feel free to write further support in the form of letters and relevant stories to savethefirepits@gmail.com they will all be forwarded directly to the Coastal Commission

Thank you for all of your support,"	t5_2qk80	True
1346847094.0	ze0zw	This is how we spent camping in France last week. You can see how our tarp building skills improved slightly ;)	kingmoon	41	10	18		t5_2qk80	False
1338432338.0	ud7s6	Moving west.	moonpies_for_misfits	35	3	3		t5_2qk80	False
1338340092.0	ubbql	This is why you should never cheap out on your tent.	ALXD	41	9	20		t5_2qk80	False
1338322724.0	uauzq	Went ATV Camping for the first time.	WASD_sux	42	12	11		t5_2qk80	False
1322001727.0	mm08n	I'll see your shoebox campfire pizza and raise you a dutch oven campfire pizza.	Mr_Ballyhoo	35	4	13		t5_2qk80	False
1376078509.0	1k1p79	Camping at Cumberland Island to celebrate our first wedding anniversary.	cozmir	37	9	5		t5_2qk80	False
1374181432.0	1il473	Anyone have any luck with these?	thejeckyll22	34	3	10		t5_2qk80	False
1367994397.0	1dx2c2	Any van dwellers here? I live in my van in Vienna, Austria, it began as an experiment, and now I can't think of any other lifestyle that suits me more.	ViennaCityNomad	40	5	36	Ok, this shall be a little AMA. I am also in the facebook vandwellers group and know a lot of things are much different here than in the USA, and possibly elsewhere outside of Europe. It's safe and hassle free (if you do it right), no problems with the authorities so far. I started doing it last August, and had a great winter in my car, in the city. I heat with denatured alcohol, not propane.	t5_2qk80	True
1365029909.0	1bmdle	Desert Camping out in San Bernardino County BLM	pardus79	38	6	12		t5_2qk80	False
1359490429.0	17ij7x	What are good ways to learn how to camp?	White_Knights	37	4	82	"Hi reddit. I've only been camping a few times in my life with my dad, and I've been wanting to go camping on my own, or with friends for a while. We're all inexperienced, so I wondered if you guys had any good resources or ways to learn besides going out and blundering around until I figure out how to do things. Any general camping tips would be appreciated too. 
  
 Thanks!

Edit: I learned that alcohol is a necessity for camping."	t5_2qk80	True
1337959580.0	u4kl3	The view from my little slice of Lake Champlain	aymalah	36	2	4		t5_2qk80	False
1312066657.0	j4fc9	Camping next to the ocean: Wake up, swim, nap, boat, nap, bike along beach, sleep.		34	4	6		t5_2qk80	False
1375243774.0	1jeeu9	Couple of Panorama's I stitched together from this years family trip.	zeroack	40	8	3		t5_2qk80	False
1370272106.0	1fl1eb	I guess I just need to drive further west in Illinois to get away from the flat boring land.	Mr_Ballyhoo	36	4	5		t5_2qk80	False
1370039264.0	1ffkcz	Caprock Canyon State Park, great camp sites	carpetbagger101	37	6	4		t5_2qk80	False
1350589358.0	11pf9i	Grab-and-go camping brekkie: Banana Tacos	RealFamilyTime	46	17	13		t5_2qk80	False
1348501073.0	10e9pz	Fall Colors at Pancake Rocks, CO	flippant	33	3	3		t5_2qk80	False
1333110736.0	rktnr	This is one of the coolest tent trailers I have ever seen (I am not sure if anyone has ever called a tent trailer cool before)	Brenden105	38	9	10		t5_2qk80	False
1325022096.0	nsqfj	This tent may not be practical but I still want it.	XavierWoodshed	33	2	2		t5_2qk80	False
1310613820.0	ip36m	Sex while camping is the best.	danifestmestiny	38	8	7	It's in tents.	t5_2qk80	True
1376510867.0	1kdd06	This is Not exactly camping	robotcamper1	43	11	7		t5_2qk80	False
1373361218.0	1hxblq	Camping with spoiled 6 and 9 year olds.	Icanus	41	12	28	"My wife and I go camping every year and we love it, the slow pace of life, cooking outdoors, living with the sun, nature, trees, birds, ...  
Now I want to share that love for camping and nature with my sisters' kids, my 6 year old godchild and his 9 year old brother. Both boys. They spend their days on their iPads, Wii, Nintendo 3DS and my sister keeps them indoors mostly so they wouldn't get dirty or hurt.  
I'm thinking of going to this place for a few days: http://www.goolderheide.be/  
It has a swimming pool and is next to the woods for hiking, cycling and playing.  
My wife and me would sleep in our large basecamp tent and I got a small tent for the boys to sleep in. I prefer to hang my hammock in the wild woods, but with these spoiled kids, that wouldn't work out :)

Now I'm looking for tips to get these kids to love camping and the outdoors.  
Thank you all very much in advance!

edit: wow, a ton of great responses! /r/camping  really is an awesome community!  
I just got home from work and read quickly through it all, I'll find some time tomorrow to answer, thank, and ask questions. Thank you all very much!"	t5_2qk80	True
1373319031.0	1hw387	Sleeping bag of choice for hammock camping	idleline	36	6	17	"I'm wondering if there are certain bags that are better suited for hammock camping. I have an old bag and a new hammock. 

Recently I've stumbled onto the amazing world of camping in a hammock. I use an ENO DoubleNest that I picked up for lounging and quickly fell in love with it for sleeping in overnight on 2 different trips. My first 5 nights were awesome. Night 6 we got rain, and although I had anticipated it and put up a tarp, I still got cold in 50 degree temps with a 30 degree bag. My back or side, depending on how I laid, would get cold even if it felt warm in the bag. 

Pic: http://i.imgur.com/Xi9V5F9.jpg

ps. I realize ENO hammocks are not designed for overnight like a hennessey, but I mainly camp in Arizona where bugs and rain aren't always a problem. I like the openness. "	t5_2qk80	True
1371818818.0	1gshr6	So, would this be a great product for tents? (x-post from /r/Technology)	BIKEiLIKE	37	10	13		t5_2qk80	False
1370736588.0	1fyd2i	One of my favorite camping spots	Autodidact2	46	19	7		t5_2qk80	False
1369180640.0	1esslw	4 day portage trip in algonquin last week	lancelongmast	33	2	8		t5_2qk80	False
1368996362.0	1eng0s	do you use a tent footprint or just a tarp?	Mr_Dove	35	6	29	I just use a tarp.  I don't own the footprint that is made for my tent.  I would like a new tarp this season though.	t5_2qk80	True
1367252794.0	1dcgaj	I have been placed in charge of serving 106 meals over four days for my brother's island camping bachelor party. This best man needs ideas!	tomcz036	40	10	38	"So here's the background on this weekend long trip:

-There will be at most 20 guys on Saturday night and Sunday morning. On Friday and Monday it will only be about 8.

-We have a 5 acre island in Brainerd, MN to ourselves. Only access is by boat, once on the island, we're there. No chance to re-supply.  Access to a charcoal grill and gas stove-top. No electricity.

-Money isn't a big issue, but I am a frugal man. No dietary restrictions.

-Both my brother and I are fairly experienced campers and cookers, but the scale of this party is throwing us a bit.  

Anyone have experience with a similar situation? Or some ideas? "	t5_2qk80	True
1365617138.0	1c2soy	Camping Food - Campfire Chili	billychicago	40	12	5		t5_2qk80	False
1364955095.0	1bk6k9	Almost ran this guy over with my (mountain) bike.	WhatTheFoxtrout	42	13	8		t5_2qk80	False
1354692265.0	14b9jo	Santa Rosa Mountain, CA	DankDaveNurse	39	8	2		t5_2qk80	False
1354144034.0	13yli7	In the middle of a two week camping trip around France	oliciv	40	7	9		t5_2qk80	False
1345333313.0	yg6pi	Never buying mountain house again (not because they are bad)	smartwaffle	38	8	18	"Don't get me wrong. I think for what the food is they do a very good job and have relied on them for the last 4 years for my backpacking food needs. However, due to recent financial changes I can't afford 7.00 a meal. Thus, I have been exploring ways of creating a less expensive backpacking experience.

This weekend, I fed three people for 3 bucks (one meal). One box of:

http://www.amazon.com/Zatarains-Orleans-Style-Jambalaya-8-Ounce/dp/B000E3ZFBC/ref=sr_1_1?s=grocery&amp;ie=UTF8&amp;qid=1345332640&amp;sr=1-1&amp;keywords=jambalaya

(The box had six servings, I had left overs)

Two tablespoons of:

http://www.samsclub.com/sams/augason-farms-butter-powder-10-cans-2-pk/prod1620372.ip

Six servings of:

http://www.augasonfarms.com/Meats/Beef-Flavored-Vegetarian-Meat-SubstituteEveryday-Size-Can-UPC-78716-09026

And I had a great meal. Enjoyed it immensely and it passed the toughest test of all, my two very sweet but very different in taste daughters of 9 and 7.

I am seriously considering putting together a bunch of meals in mylar bags. The amount of money you save is amazing.



"	t5_2qk80	True
1344339429.0	xthge	I sprained my ankle very badly a couple of months ago, so this is how I've been camping all summer. It's better than nothing! 	fernguts	39	8	9		t5_2qk80	False
1340303452.0	ve6gj	Gear Review: REI Camp Pack-N-Prep Tote/Table	mehwolfy	35	3	8		t5_2qk80	False
1372698567.0	1hfps7	So, after 27 mosquito bites after one night of camping, I need something that repels them.	crazzybabby	37	6	45	"I went camping with my boyfriend this weekend and after getting bit, several times through my clothing and Vibrams, we had to call it a night much earlier than originally planned. We both used bug spray, and I had long sleeve shirt and yoga pants despite it being in the 80's. Also-- He only got 1 bite. 

We are going camping this weekend and I am so scared for more bites--they are SOOO itchy! What can I do to prevent getting bit on our next trip?

Edit: also, what would you recommend I wear, considering it's going to be humid and in the low-mid 80's. "	t5_2qk80	True
1361636685.0	1930n6	X-post from /r/pics. What does /r/camping think of these trampoline tents? I don't think I'd use one, but they are interesting.	ccnova	37	10	13		t5_2qk80	False
1358457602.0	16rw3s	Greatest campsite (tents right on lake)	Thebluewalrus	33	6	6		t5_2qk80	False
1352688525.0	131j0j	R/Camping, I did not know if you are aware of this, but a much bigger r/campingandhiking exists	willsmosh	45	16	7	I did not find this out to Yesterday, but I bet a lot of you knew this already.	t5_2qk80	True
1348871772.0	10n4u6	We've come a long way in our beach camping.	lobstahslayah	35	5	1		t5_2qk80	False
1347816464.0	zz85r	Easy, fun camping recipe: Dulce de Leche. As long as it doesn't explode.	RealFamilyTime	37	9	21		t5_2qk80	False
1347037764.0	ziiie	Lake Eaton, NY State Park	knightjohannes	30	2	4		t5_2qk80	False
1346990998.0	zhnfg	I made this 'house' for my six year old daughter. I told her it can be used to start a campfire. Basic, but I like it. How does reddit start their campfire? Without combustible fuel as an accelerant.	originalSALGOOD	37	9	40		t5_2qk80	False
1345170718.0	ycto0	Last time I went camping back home. Majagua, Venezuela.	OttoTheDude	28	0	5		t5_2qk80	False
1343929017.0	xkn6q	some pics from our canoe camping trip down the Delaware water gap.	olsmobile	35	5	9		t5_2qk80	False
1340589085.0	vjtlh	Was shopping for camping gear for an upcoming motocamping trip. Then I saw this, and realized it was all I truly needed. 		47	16	12		t5_2qk80	False
1338237221.0	u977z	Big Bend National Park, overlooking Mexican Border.	eduardj	34	5	2		t5_2qk80	False
1375850374.0	1jv3f0	Cross post from r/AZCamping. My last trip to the Sitgreaves National Park. More in comments	unicknn	37	11	3		t5_2qk80	False
1371284884.0	1ge41i	Hopefully my new camping spot, what does r/camping think? [Smith Mountain Lake, VA]	Bond-H-Bond	37	9	6		t5_2qk80	False
1369416800.0	1ezdhd	REI	ukdkbr	33	6	21	"I had decided to get a nice tent and went with the REI Hobitat 6 w/Garage.  I could only find it on their site listed as 2011 overstock, no big deal.  Yesterday the package came, as I'm hauling in the box I'm thinking to myself that there is no way a tent could weigh this much ... open up the box and it has 2 Hobitat 6 tents and one garage.  I checked the invoice and the Qty was 1 and they only charged me the $260 once.

So ... FREE TENT!  Hah /r/camping should I call REI and notify them of the mistake or surprise a friend/family member with a free kick as tent?  I mean I have no idea why I would need 2."	t5_2qk80	True
1356500803.0	15geik	Student Lives in a Tent Ep.6	glowpunk	36	11	3		t5_2qk80	False
1354637378.0	149lpv	Winter Camping (in Texas) at Lake Mineral Wells State Park.	lambseathams	32	6	6		t5_2qk80	False
1342470956.0	wnv1h	Would this count for camping?	maxmtrx	30	3	9		t5_2qk80	False
1375940460.0	1jxtj8	Little Album of my Trip to the Samilkameen (BC, Canada) back country	TheOnlyGerman	31	6	1		t5_2qk80	False
1369847552.0	1fa1ro	This backcountry canoeing season is starting to look just fine in Ontario.	Ken_Wood	31	5	0		t5_2qk80	False
1367002144.0	1d65ai	Filmed this while camping at Lake Patagonia with a couple friends last week. [OC]	gaberade	28	3	4		t5_2qk80	False
1360459113.0	1881l6	So my wife and I bought a 1966 Yellowstone Cavalier travel trailer yesterday.	jgo23	30	3	17	"This will be a work in progress for a bit, but we're hoping with a little TLC and a lot of help from a fellow redditor/buddy this young lady will be camp worthy for this season!  It definitely has a few issues, but all are minor and nothing structural (except 1 floor spot which is 50% repaired already).  This may be a bit hack and slash for some, but I'm no professional and everything I'm doing is at least better than the previous repairs done to this poor thing.  I'm just hoping to get her road ready for now.

BTW: First reddit post!

Album: http://imgur.com/a/jpAZG#7

2/10/13 So we had a thunderstorm, but we were able to get the back floor filled in and pulled the siding back down to meet in the corner. Was tough considering the camper has settled so much. I'm looking forward  to getting the structural things settled so the wife will want to help.

2/12/2013 We have flooring and a back wall again.  I'm hoping the wall materials we chose will hold up.  The back is going to be insulated with the foam board and then sealed in with spray foam.  As long as we fixed all leaks I don't suppose it will be an issue.  But the camper is now ""campable"". And it is raining today (2/13/13) so I really can't do much with the camper right now.  My next thing is to put insulation in the back and support the curve in the storage cubby."	t5_2qk80	True
1358347576.0	16opkh	Manitoulin island, Ontario Canada. 	McBalls_	31	5	9		t5_2qk80	False
1356669126.0	15k27m	My Deer hunting camp back in October 	pac122011	44	16	5		t5_2qk80	False
1348545830.0	10fla9	Tahoe camping trip!	nlkuhner	32	3	2		t5_2qk80	False
1345812732.0	yr1ub	When nature calls - 2 gadgets to help female campers!	gocampingaustralia	38	15	13		t5_2qk80	False
1342622767.0	wreon	I was thinking of going camping with my motorcycle along the Mississippi river in Minnesota. I guess I won't - Xpost from r/WTF		41	12	18		t5_2qk80	False
1339450383.0	uwsx7	Camping Solo?	nowa90	30	4	28	"I've camped out once on some family's land (google map 44.676084,-63.042644 if your curious) with 3 freinds, but was wondering what it'd be like camping solo, or with a dog (2 year old black lab). Last time we went, someone left a bag of chips out near the fire pit, and we awoke to some teeth marks in it, nothing too big (comparable to squirrel or rodent) but may or may not have been a coyote or something. I'm 18 in november if it makes any difference at all. 
Any advice from /camping?

I've camped in tents 3-4 times before (not counting back yard adventurs) "	t5_2qk80	True
1336495107.0	td4xv	The Nastiest Critters Lurking Outside Your Tent	PerrinD	28	2	15		t5_2qk80	False
1375201299.0	1jcu74	Xpost from /r/portland : New site with every Oregon campground listed	jdbausch	35	10	2		t5_2qk80	False
1374093766.0	1iif1s	xpost from r/campinggear. $50 backpack and tent haul from a local pawnshop	aroploen91	36	9	15		t5_2qk80	False
1368223209.0	1e3fud	best non refrigerated food to bring camping	krazo	31	7	34	"im going on a camping trip in Algonquin Part this thursday for 4 days. We have to take a 2 hour canoe ride to our camping site so i need food that will last and would'nt go bad if it got warm. and what other shit should i bring? i havent really dont much camping before so im not use to this and i feel extremely unprepared 

EDIT: Wow you guys were a lot of help, thanks."	t5_2qk80	True
1351259100.0	124fgi	Dispersed Camping	bicyclehobo	33	7	6		t5_2qk80	False
1350785404.0	11tr3t	How much is too much: electronics	iphoneluver	35	9	62	When I go camping (especially in public camp grounds) i always see people in RV's and trailers with all the comforts of home, I see people with tents but they bring generators and are on their cell phones.  And I hate that.  What I wanna know r/camping is how much is too much?  The only electronics I bring when camping (and yes I use a tent or I string up a tarp if the weather is going to be good) I bring my phone but it stays on airplane mode, a hand crank radio for quite camp fire music, and a head lamp.  What does r/camping have to say	t5_2qk80	True
1342396654.0	wm6gv	Enjoy ladies	drumstick_jolly	32	5	7		t5_2qk80	False
1336945184.0	tlheg	Tick season is upon us.	sawyersutton	26	1	11		t5_2qk80	False
1332504471.0	r9uw2	Bubbletree WANT!	BellyRave	31	7	8		t5_2qk80	False
1376593643.0	1kfqai	four buddies and all our gear rambling around Yoho and the Rockies in this magic dragon... ..RIP magic dragon	boybecameafox	30	4	2		t5_2qk80	False
1376374727.0	1k9hag	Olympic Nat'l Park, WA	J_Richard	31	7	1		t5_2qk80	False
1372868840.0	1hkpgh	What is your favorite (humorous) camping advice? Here's mine...	SubCircus	38	14	17	When hiking, always wear a small bell that will alert bears to your presence from a distance, rather than a surprise encounter.  Also, keep an eye out for bear droppings on or near the trail.  Bear poop is easy to spot because it has small bells in it. 	t5_2qk80	True
1367874924.0	1dtfor	Had to have a front and back fire to make it though the snow in May last weekend. (Eminence MO)	bodafrisco	41	17	5		t5_2qk80	False
