created_utc	id	title	author	ups	downs	num_comments	selftext	subreddit_id	is_self
1370789187.0	1fzdsi	Nighttime logistics of car camping with a 1-year old	HODORx3	16	3	29	"I've been camping all my life and want to get my son started early. We've been invited to join some friends on July 4th weekend. I'm working out the logistics for nighttime with him. At home he sleeps in a crib in his pajamas - no blankets. It'll be too cold at night in the tent to place him like that in a portable crib. We're not sure he's ready for blankets yet. One untested idea is to bring him inside one of our sleeping bags with us.I'm curious, what do other parents do? Any suggestions?"	t5_2qk80	True
1370580668.0	1fue2w	a few cooler questions.	Mr_Dove	15	6	11	"I'm in the market for a new cooler/ice box for car camping with my family.  We have 2 adults and 4 kids.  We usually camp for 2 days.  3 is usually the high end.

There's alot that I don't know or don't understand about coolers.

How large of a cooler do i need for my family and the length of our outtings? I'm guessing between 50 and 120 quarts...

How should ice be placed in the cooler?  Should it be layered in the bottom of the cooler with food placed on top or should the ice be dumped on top of the food?   

Do any coolers have dividers or organization within the cooler?  I always hate having all my food floating in the bottom of the cooler.  I also hate having everything just kind of thrown into the cooler.

Is there any benefit to using ice packs instead of ice?  Do they last longer or stay colder?  I know plenty of people use frozen water bottles to keep their food cold in the cooler.

"	t5_2qk80	True
1369772916.0	1f7zi8	New to /r/camping, not new to camping - looking for good camping in Utah	moostermoo	14	1	15	"I guess we do what this subreddit calls car camping.  We load the car, drive somewhere, set up camp and proceed to enjoy nature and the time away. We have various cooking gear and dutches, we have two totes of supplies and a dry goods box for food that doesn't go in the cooler, a cooler, a couple of chairs, sleeping bags, air mattress and a sturdy, canvas spring-bar tent.  We just got back from our first camp out of the season and are already wanting to plan the next one.

So Reddit, where do you all camp when in Utah?

Also, we ended up with a coffee dilemma this past weekend that rather sucked.  What do all of you do to satisfy your coffee need while camping? no percolators please.

Thanks in advance!"	t5_2qk80	True
1369508493.0	1f1ir7	Using a hammock in relatively cool temperature tonight. What should I bring with an eno with a low tonight of 45?	rafikiwock	14	3	11	"A sleeping bag? lots of blankets?  this post will not be relevant two hours after its posting time.
thanks"	t5_2qk80	True
1367276438.0	1dddgj	Deciding between two Car Camping Tents	hamselgeson	13	1	16	"Hello r/Camping. My limited time with this sub has been rewarding to say the least, but now I have a decision to make. I'm looking at a 4-person car camping tent (for use in Wisconsin/Minnesota State Parks), and I'm having a tough time deciding between the [REI Camp Dome 4](http://www.rei.com/product/777757/rei-camp-dome-4-tent) and the [Eureka Tetragon 4](http://www.campmor.com/eureka-tetragon-4-4-person-tent.shtml). 

Preventing water seepage is a primary concern, so I was wondering if purchasing the extra $100 I would spend on the REI one is worth it (paying for the name brand, that is).

Any suggestions/advice/alternatives would be appreciated! Thanks!"	t5_2qk80	True
1367176231.0	1dabxl	Here's an album of my trip through the 17 runs of the Hillsborough river in Temple Terrace, FL	Axle_Grease	17	5	3	"http://imgur.com/a/QKbVf

Man if you try this I seriously hope you enjoy portaging, we probably had to get out of the boat or maneuver it around river-road-blocks ~50 times.

I have more pictures, just thought I'd select the best out of the album. I'm also working on a potential video/time lapse of the trip, but it needs more brainstorming."	t5_2qk80	True
1366687780.0	1cwvr1	Secluded, primitive camping in Arkansas?	stripesandpockets	16	6	10	A friend and I are planning on camping in Arkansas in about a month. We're looking for a perfect spot, preferably in northwest Arkansas. Somewhere pretty secluded with minimal people, and near the river (possibly a sunny clearing near water). We don't need any amenities. We would prefer to be able to have our car near. Any suggestions?	t5_2qk80	True
1365839183.0	1c9dbd	how to store and then pack your camping gear?	Mr_Dove	13	2	12	"I've heard that some folks keep all their camping gear in sturdy plastic totes that can just be thrown into the car at campout time.

Are there any particular models that are popular?  I assume that something large and sturdy is best.  Even Walmart has lots of storage bins but most of them are flimsy."	t5_2qk80	True
1364337064.0	1b2l0l	Best camping in/near SF Bay Area?	Harkthezombie	12	3	19	I just discovered this sub and I could really use your help. My wife and I are going to be celebrating our 2 year wedding anniversary and I want to take her camping someplace cool in the SF Bay Area. Are there any suggestions on a nice, safe and preferably beautiful campgrounds in that are that you guys can give me?	t5_2qk80	True
1363693990.0	1al636	Advice for a trip to the Everglades for 1 semi-outdoorsy man and a severely-indoor say woman?	porkbuttextravaganza	13	2	15	My boyfriend has convinced me to spend 2 nights tent-camping in Everglades National Park before we head to the Keys for a few days. I have not actively camped in close to 2 decades. I like nature but it rarely likes me, especially the bugs. Need any advice for supplies, things to do/avoid, etc.? Thank you all in advance!	t5_2qk80	True
1363334961.0	1ac9aj	Any /r/campers in Hungary?  	daxofdeath	14	2	0	I live in Budapest, and I teach in the Buda hills - I have ~week off at the end of this mont/beginning of April and I'd like to do some camping during that time.  Any suggestions where to go?  Anyone wanna join?	t5_2qk80	True
1362544773.0	19r9mf	Trip Planning Kentucky	Froggie901	11	0	10	"Me and my friend a semi-experience hikers/campers. We are looking to plan a 3-4 day hiking/camping trip to correspond with business trip while we are in Kentucky in Mid July. 

Any help would be appreciated! "	t5_2qk80	True
1361572101.0	191q04	Halifax down jacket, group deal...any reviews? x-post r/outdoors	clampers	13	2	0	"So groupon has a deal right now for a down jacket, that looks pretty sweet, I just can't find ANY reviews on it....is it worth the money??
[groupon link](http://www.groupon.com/deals/gg-halifax-down-packable-jackets?p=1&amp;utm_source=pc_goods&amp;utm_medium=email&amp;sid=811f14a2-3695-4ff0-ad7e-b135e82bcea8&amp;division=napa-sonoma&amp;user=1a5dfacf664c4c4d3c7080f3fa5a0f4d0da5ddb4f97fcf725e201ad6e954212a&amp;date=20130222&amp;s=body&amp;c=deal_img&amp;d=deal-page)"	t5_2qk80	True
1360521684.0	1899yr	Camping-lite: In your opinion, what is the best minimal tent setup?	Comafly	14	2	29	"Hey everyone. I plan to leave my city, Perth - Western Australia, and backpack across the country. Tracing the western coast down south and around to the Eastern states. I'm going to plan as best I can to stay at hostels, and organize couches to surf on, but I will most likely run in to the situation where I'll need to set up camp.

The thing is, I don't want to carry around really bulky camping equipment with me when I wont be using it that much at all. So my question to you is, what do you think is the very basic, lightweight, minimal tent-camping setup?

Cheers!"	t5_2qk80	True
1359653625.0	17n0g2	Future of Tenting	trippin_mind	18	7	8		t5_2qk80	False
1359568410.0	17kly4	Is it reasonable to go camping with my 8-pound dog?	WhenIm6TFour	15	3	41	"She's almost two now, so not really a baby anymore, and she loves running around in the woods on 2-3 hour hikes with me. She doesn't really tend to bark at things other than people when we're outside (strangely, no squirrels or deer or anything).

I haven't tried sleeping outside with her, but she does love napping in my hammock/sleeping bag with me.

My mom just says she (the dog) is too much of a weenie to handle it. Are there any common problems that arise with small-dog-camping?"	t5_2qk80	True
1356886802.0	15oeyw	Msr drangonfly pump spare part	Authigenic	14	3	5	While doing the stove's annual cleaning, I managed to lose the check valve ball bearing on the pump.  I plan on calling MSR tomorrow, but I would rather not pay for the complete repair kit if possible.  If there is anyone in redditland that has a pump that is beyond repair and would be willing to send it my way, I would be willing to pay a few bucks for shipping and the trouble. 	t5_2qk80	True
1356455740.0	15fcmn	Looking for trails in Georgia?	BannedGinger	15	3	16	I've never used this sub before so I don't  know if this is the place for this, but I'm looking for something new. I was interested in places like Bear Creek or Panther Creek, but they seem to crowded. I'd like something with great scenery that is fairly secluded. 	t5_2qk80	True
1355689851.0	14yehx	Planning a National Park road trip for this summer, need some advice	EscapeFromTexas	13	1	31	"My family of 4 is going to drive from Houston to the Grand Canyon and then perhaps points west that have yet to be determined. I'd love some advice on great spots to tent camp, fish, etc. on the way.
Please share with me your favorite spots or tell me things we shouldn't miss that might not be obvious.

Ideally I'd like to go all the way up to Washington and visit friends and family we have scattered up there. I have a National Parks Rec Lands pass, and I'd like to make the most of it! "	t5_2qk80	True
1354875080.0	14fs7n	Looking for a nice one piece long john underwear that will keep me warm all winter. Something that's good for indoors (my cabin) and outdoors along the beach in a cold Cape Cod winter. Ideally $50 or under. 	DumplingKing1	15	3	18		t5_2qk80	True
1352404993.0	12vg7y	Going to Jumbo Rocks @ Joshua Tree for first time, any tips regarding the area or desert camping in general?	phonenumberguy	14	4	16	"My friends and I are from LA. We are SICK of the recreation available here, the clubs, the bars, the restaurants. We want to leave all of our phones, computers, electronic devices at home and just reconnect with the earth (I know it sounds corny, but we are craving something like this.) 

Can you guys point me the way of any good tips for the area? Any good hikes or anything like that? Also, any must know pro-tips for desert camping? 

Thanks so much guys, Love you! "	t5_2qk80	True
1351793227.0	12gvww	To camp or not to camp with my kids?	sof_1062	15	4	20	"We are going about 90 mins out of town to camp but the temps will drop into high 40s at night. We have 3 kids, 11,10 and 4 going. I will have all the kids in one tent and myself and my SO in the other tent. I'm not worried about us but is this too cold for the kids to be camping?

*edit, the high is about 75 during the day."	t5_2qk80	True
1350946100.0	11wn6z	Looking for food suggestions; 4d/3n, first time overnighting.		14	1	10	"Hi r/camping!

I'm making preparations for a trip this weekend and while I have just about everything else sorted out, I'm absolutely clueless in regards to what to do for food. My budget is about $30 US, give or take a bit (I can spend more if necessary, I'd just prefer not to).

I don't have personal access to a stove. I am certain that at least one of my colleagues will be bringing one, but I don't want to assume I can just use it, and I don't intend to purchase my own right now. I do, however, have access to a cooler, but I don't know how long perishable food (deli meat, hot dogs, cheese) will keep in a cooler, given that the ice will eventually melt. I have access to fresh water, the campsite isn't going to be that primitive, so there's that.

Should I stick mostly to dry food? Should I try to take a few perishable items?

Thanks in advance for any advice y'all can provide."	t5_2qk80	True
1350413853.0	11l14h	Braved the rain! Had a great weekend at Indian Cave State Park.	100uf	11	0	7		t5_2qk80	False
1350355851.0	11jt2l	After a long hiatus, I've started building my gear collection back up. Any suggestions?		13	1	11	"Long story short, I've started building up my collection of camping/hiking gear after letting myself get too caught up in city life.

I got a great deal on the [Alps Chaos 3](http://www.alpsmountaineering.com/alps/products/tents/backpacking-tents/chaos#.UHzKd8XA8XM) and have picked up a few odds and ends along with it (footprint, extra tarp, etc.)  I have been looking to pick up a new sleeping bag and sleeping pad.  Suggestions are welcome.

Also, I currently live in central OK if anyone has any suggestions for great spots."	t5_2qk80	True
1349247561.0	10v4l1	Long time spring/summer camper here, looking to get in to winter camping at an affordable price.	ChillDoggin	13	2	15	So, I've been camping casually and back country for some years now, but only during warm seasons.  This year, I'd really like to get into winter camping to avoid the crowded camp sites, bugs, etc.  Plus, I'd like to be able to camp with my girlfriend more often, but she just can't stand the heat of summer time camping so I think she may enjoy the colder season quite a bit more.  The main problem I've run into so far however, has been the price tag that comes with winter gear.  I was wondering if any of you winter campers could suggest some affordable gear at a fair price.  Sleeping bags and tents are my primary concern right now.  At this point, I think we'd only be doing car camping so serious hiking gear isn't really a concern.  It gets super cold where I'm at (Southern Indiana) but snow isn't really a concern at this point either.  Thanks!	t5_2qk80	True
1347233912.0	zmii4	Check out this hammock style tent. I hope they make it to production!	AdrianRipburger	19	9	3		t5_2qk80	False
1346463275.0	z5zvy	Car camping tents?	Ronadon	14	2	27	So I've already got all of my expensive ultralight tents and hammocks and what not, but what I lack is a good sized inexpensive car camping tent. I have a rei 2 man but it's way too small for a comfortable car camping tent. Do you all have any experience with cheap 3 man ish sized tents that don't leak? Walmart and Target have tons of cheap tents but all of the experiences i've ever had with them has been very soggy.	t5_2qk80	True
1345957782.0	yub3j	Anyone familiar with camping in Washington near lakes?	icanpicturethat	11	0	8	Looking for something that is remote and/or private but still car camping and easy access to a lake for kayaking. Spacious campgrounds would be okay but the less neighbors the better. Not prepared for much of a walk in, to much bulky stuff and an injury makes carting things more than a short walk by foot difficult. I would be able to cart stuff a short distance by kayak if it was close enough that several trips trips could be made in a short time. Campfires permitted would be preferred. The trip would be for next weekend.	t5_2qk80	True
1344721354.0	y2cfr	Going backpacking in Yosemite this week.  Just found out there's a storm rolling in... Suggestions?	krypto1339	13	1	17	"Yep, looks pretty gnarly.  Any suggestions on what/what not to bring?

UPDATE:  Just got back!  We were extremely lucky on the rain front, only had one heavy rainfall, and it only lasted for a few hours mid-day.  Brought lots of plastic bags which helped with the aftermath.  Still, couldn't have asked for better weather 99% of the time.

Yes, we were lucky enough to do Half Dome (started early before the clouds came in).  It was fantastic, but the *real* treat was Clouds Rest.  Trust me on this one, folks.  Make it a priority.  =]"	t5_2qk80	True
1344368652.0	xu878	It was a pretty awesome weekend. Spring River, Arkansas 2012 (x-post from R/kayaking)	Rangerup95	13	2	3		t5_2qk80	False
1343765073.0	xgsxu	Bears and Dogs? Should my dog wear bells or armour?	canadianviking	16	4	24	I'm heading up to camp in an area that's seen a lot of bear activity this summer.  I'm planning on bringing my 50 pound mutt. He will be leashed or tied up and with me at all times. Any other precautions I should take?	t5_2qk80	True
1343745721.0	xg85p	Is there a proper way to use an ax?	Xtapher23	17	5	31	"Been camping for a while, but never wanted my own ax, till recently.  Just finding logs and large branches to cut up, makes me want to buy my own ax.  I'm usually the person in charge of managing the fire. 

I've never owned anything more than a Swiss army knife.  I would like to know if you have any advice for me?"	t5_2qk80	True
1342671440.0	wsudr	Can my crappy tent be waterproofed?	misternarwhal	16	4	13	"Hi campers,

I got this tent about 15 years ago and used it once, and then haven't been camping since.  It's an Avid Outdoor 2017 (you'll notice the company no longer exists), was probably less than $150, and was widely considered to be a piece of crap at the time.  The one time I did use it, it leaked from one poorly stitched point in a seam.

I think I might be able to fix the seam leak (and might as well redo all of them) with seam sealer (any opinions on this?), but the stuff I'm reading seems to suggest that I should also refresh the durable water repellent (dwr) on the floor and sides.  Problem is, I can't even tell if this thing had dwr.  If not, how do I waterproof the fabric itself?

The crapness: "	t5_2qk80	True
1342038705.0	wejgl	Camp Showers?	maruluna	15	3	38	"Just got back from camping in Cyprus Lake Campground at [Bruce Peninsula National Park](http://www.pc.gc.ca/eng/pn-np/on/bruce/index.aspx) here in Ontario, Canada. It's easily one of the most beautiful parks in Ontario, especially near and around the grotto/cove areas. 

Anyways, the one issue we had was the campground had no showers. I'm fine going a few days with just a dip in the lake but my group (which consists a mix of 21-27 year olds) could not bare going without a shower every morning. To the point were we'd have to drive out to a pay shower 15-20mins away every morning.

I was wondering if anyone here has experiences with portable showers (solar or gas heated/no heat) and shower shelters. Does anyone have any suggestions for future trips that doesn't include ice soap?

---

Edit: Here's a [link](http://imgur.com/a/HdgVk) to some photos I took while there. Gorgeous! "	t5_2qk80	True
1341620884.0	w5mzq	Beginner gear, tips, and suggestions?	underwater_sky	14	1	13	"r/camping,  I have never been camping and would like to get into it; I was interested in things I should know before camping, and what gear to to get.  I am 19 years old, and live at home and need to get out of the house during the summer.  I would most likely be camping solo, as none of my friends want to camp but hopefully that will change.  I would like to spend a weekend away from home just to unwind in the wilderness.  I will probably not use the gear all that often, so I don't need anything too expensive, although USA made is preferred, but not necessary.  I would just like to know what I should get/bring (i.e. tent, hammock?, sleeping bag, etc.) with me for a weekend getaway.  Basically what are the essentials while camping? 

Also, I live in the Chicago-area and would like to know good places to camp within 4 hours or so.

Thanks
"	t5_2qk80	True
1341291246.0	vyq52	Anybody ever been to Cherry Springs state park in Pennsylvania?  It is one of the darkest spots east of the Mississippi.  Girl and I are thinking about going.	wdarea51	12	0	5		t5_2qk80	True
1341253662.0	vxokr	Where to buy a decent waterproof but inexpensive tent in Canada?	WhatFreshHell	16	4	19	"Discounting all department stores (unless someone knows something I don't, I've seen what they have at walmart and Canadian Tire) any places or types of stores I should look for decent tents that I might have overlooked?  Brands to look for?

I'm looking for a true quality car camping 2-3 season tent that is smartly designed to minimize wetness in the rain and sleeps two comfortably with room for clothes and such.

So far the best thing I think I've come across is the Mountain equipment co-op site but their cheapest tents don't seem far removed from department store tents and I'm afraid to pay a premium for buying from them."	t5_2qk80	True
1339527235.0	uydoo	fun ideas like slacklining to do while camping?	almostalmost	14	2	7	going camping soon and wanna do some fun stuff. slacklining is somethign I plan on....any other cool ideas....	t5_2qk80	True
1338854115.0	ul4u7	Looking for that perfect place around Asheville, NC.	skymann13	15	4	5	Can anyone give me some advice as to where I can take my girlfriend camping for her birthday? She loves the mountains and lakes...any ideas?	t5_2qk80	True
1337974878.0	u4xko	What do you cook/prep before you go out to camp/hike/hunt? 	jcemitte	11	0	16	My best friend is a pop tarts, ham and bread sandwich guy when we go to the mountains an up until now I've followed suit. Our group is going out this weekend and I'm sick of boring bland food the whole time. what are some thing you make ahead of time or get together so you can throw it on the stove without too much fuss? I got breakfast down... what about lunch and dinner?	t5_2qk80	True
1337031007.0	tn2yj	Deep in the Ndoki Jungle, A Few Sheets of Nylon Can Feel a Lot Like Home - by Tim Cahill (Outside magazine founding editor)	PerrinD	12	0	0		t5_2qk80	False
1336869028.0	tkbok	Planning food for 10 people, 5 days, 2 stoves, no fire. Help!	raszpberry	11	1	19	My friends and I are attending a music festival this month and I've been put in charge of food. There are no fires allowed at the festival, but we will have 2 small propane stoves. We'll be in the festival for dinner mostly but I'm looking for hearty lunch ideas. No vegetarians, 1 gluten-free. Any ideas?	t5_2qk80	True
1335892973.0	t1r2g	To the Arctic!	Stripedpajamas	13	1	7	"Hey campers,

I'm a college student, soon to depart for Greenland on a research adventure.  I'll be staying in a tent, just above the arctic circle.  I am an eagle scout, with loads of continental-US camping and backpacking experience, including winter camping.  I haven't, however, been camping farther north than the Finger Lakes.  Gear ideas, etc would be greatly appreciated.  I have a good tent and a -30F bag, and lots of wool socks to take.  Other than temperature, though, I don't really know what to expect in terms of differences between here and there.

Any tips/suggestions would be greatly appreciated.

Best,
StripedPajamas"	t5_2qk80	True
1335764392.0	szcq9	A small review on my new shoulder bag (day-hike/single overnight camping)	bradclarkston	12	0	4		t5_2qk80	False
1335490174.0	sukbm	Help with SoCal Camping. (New to the California area)	Praxibetel_Ix	11	1	14	"The Girlfriend and I are desperately looking for a good place to camp. We like to rough it. We don't like to see people or evidence of people (stupid pre-determined campsites with the grill stuck to a concrete base). We love forests but have never camped in the desert.
we would prefer a place we could fish for our own food but not necessary.
IF any one knows of a good area within a few hours of the LA area that would be great!  

Side note: If any one knows about places for beach camping that is another thing we would be into."	t5_2qk80	True
1335232048.0	sp82r	Need help picking a spot to camp at the Grand Canyon	jesse950	13	2	21	"Are there any non official campsites at the Grand Canyon or do I have to make reservations with the NPS?

Every where I can find online says that we have to camp in the designated ""Camping"" Areas. Were not looking to hike down to the bottom but to spend the night and leave the next day. Shooting to visit in mid August."	t5_2qk80	True
1334895388.0	sj40c	Heading to Fahnestock State Park, NY tomorrow for a soggy weekend of camping. Excited regardless	newsdaylaura18	14	3	7		t5_2qk80	False
1334230810.0	s60xl	Our decision process in buying our trailer	Zarley	19	8	13		t5_2qk80	False
1333998563.0	s17wc	Family of six needs some gear for car camping, also advice and maybe some valium.	mysuperfakename	12	1	16	"My husband and I will be taking our collective kids camping this summer.  The youngest campers are our twin sons (7) and my two teenaged daughters and one five year old Golden Retriever.  

Due to the numbers of us, we need decent/not great gear that won't turn this trip into an expensive three or four days in Vermont.  WE have almost nothing in the way of gear.  

Can folks recommend general brands for tents, sleeping gear and cooking?  I was looking at[ this tent](http://www.amazon.com/Coleman-Instant-Foot-Person-Room/dp/B003QUT9OE/ref=wl_it_dp_o_pC_nS?ie=UTF8&amp;coliid=I1KRUPC2V6JNFP&amp;colid=19K2N6NCM5TSF) or[ this tent](http://www.amazon.com/Wenzel-Kodiak-Family-Cabin-Dome/dp/B002PB0DZO/ref=wl_it_dp_o_pC_S_T1?ie=UTF8&amp;coliid=I2S7VUF4YWY5N0&amp;colid=19K2N6NCM5TSF) for all of us.  

I would like to just cook over the open fire pit rather than buy a crappy little stove, but not sure if this is wise considering the size of our brood? Are the Colemans that bad?  We aren't hiking, but would like to when our sons get a bit older and more familiar with the idea of sleeping in a tent/can help haul their own stuff.

Sleeping pads or mattresses?  Should a pad be good enough for the younger kiddos?  

Any other parents out there with BTDT advice? 

Thank you so much!!"	t5_2qk80	True
1331925235.0	qzru3	Looking for gear recommendations for sleeping pads for people with bad backs. Any advice is much appreciated. 	higginsnburke	12	0	20		t5_2qk80	True
