created_utc	id	title	author	ups	downs	num_comments	selftext	subreddit_id	is_self
1370621101.0	1fva1n	Hard to argue with this kind of logic	foes_mono	370	43	20		t5_2qk80	False
1346722245.0	zb8sj	If you do this... Fuck you! (Seen in middlefork campground outside northbend WA)	nakatak	333	29	34		t5_2qk80	False
1370276265.0	1fl6g5	Wasn't easy to get to, but I found this spot over the weekend.	BKCII	331	27	31		t5_2qk80	False
1371000634.0	1g5z43	Set up camp on a cliff at midnight, woke to this beautiful view.	backnblack	304	33	18		t5_2qk80	False
1346802643.0	zd3u2	raw. Best part of camping: no makeup. Girls agree?	hannahnou	308	48	27		t5_2qk80	False
1342961563.0	wyr19	My girlfriend and I rebuilt this vintage travel trailer this spring - lots of process pics.	imakethenews	293	35	52		t5_2qk80	False
1370901304.0	1g2p6k	Canoe camping in Nahatlatch, BC yesterday	foes_mono	263	10	20		t5_2qk80	False
1353899928.0	13sk5p	The best way to wake up after the first night of a three-day camping trip. :D	TheBathCave	223	16	24		t5_2qk80	False
1371739560.0	1gq9li	After browsing /Camping for a bit	gman311	246	50	27		t5_2qk80	False
1372815763.0	1hjebk	Getting ready for the weekend!	andr50	219	20	45		t5_2qk80	False
1358519602.0	16tfkk	Think i found the perfect campsite. Norway. (xpost from /pics)	briller	218	21	19		t5_2qk80	False
1345157443.0	ycgdh	Everything is better when camping	charlie1202	224	29	26		t5_2qk80	False
1375478049.0	1jl8ah	Fat Tire knows what's up	michwest9	239	48	18		t5_2qk80	False
1370371762.0	1fo2ce	Camping with 2 daughters, 2 dogs, and a wife has taught me the crucial art of *minivan tetris*.	likeBruceSpringsteen	217	29	38		t5_2qk80	False
1376361496.0	1k933a	This was my home for a week.	apharis	207	22	30		t5_2qk80	False
1352474069.0	12wync	Found at my last campsite	munterhitch	205	25	43		t5_2qk80	False
1371705093.0	1gpk9j	All the camping	DatAssFat	216	33	14		t5_2qk80	False
1375397179.0	1jiz7c	Nothing like getting out of your tent to this...	aristicks	195	15	14		t5_2qk80	False
1374502092.0	1it91r	I've heard of camping on top of a cliff, but never camping while hung against the side of a cliff	FatTonyWilliam	230	52	58		t5_2qk80	False
1376580258.0	1kf8iu	These are the moments we live for.	Dr_Stephen_Colbert	186	12	17		t5_2qk80	False
1373400307.0	1hygjs	I think I over paid for this tent...	CurbRogerD	209	33	35		t5_2qk80	False
1344606278.0	xzutc	I love camping, but this made me giggle snort!!	ladyxanax	203	31	6		t5_2qk80	False
1374331567.0	1ip2ld	Girls camping in 1934	tuscangourmet	190	20	8		t5_2qk80	False
1364789348.0	1beh9n	Did a little car camping this weekend, thought I'd show you guys the camping setup in my '07 Tacoma.	misplacedinspace	180	21	37		t5_2qk80	False
1343360366.0	x89z5	Sometimes life doesn't get better than this 	Zilon	172	18	21		t5_2qk80	False
1370217451.0	1fjqvt	Got an up vote this weekend	GrilledSteez	208	51	3		t5_2qk80	False
1374012488.0	1ifzqc	The perfect place for a birthday dinner!	AnthroGirl	172	21	5		t5_2qk80	False
1373634409.0	1i5fao	Shot I got in Montana last summer (Glacier NP).	BennieBond	164	18	8		t5_2qk80	False
1337444596.0	tuty0	To whomever suggested slapping a headlamp on a water jug, you're the bestest.	PedroMeatball	162	14	6		t5_2qk80	False
1359981609.0	17v3zt	My little mountain hideout. Gjende lake, Norway.	Takingadumpnow	159	13	12		t5_2qk80	False
1344524741.0	xxwuf	This is my preferred method for cooking breakfast when I go camping.  	akuzin	159	16	53		t5_2qk80	False
1375282829.0	1jfa3m	Kelty Sonic 8 Airpitch Tent first time setup.	busydane	155	12	77		t5_2qk80	False
1376406218.0	1ka4jg	Boat access only camping in Allegheny National Forest	GiraffeLizard	162	23	28		t5_2qk80	False
1342993698.0	wzesd	My $2500 home built teardrop camper.	slothlovechunk	155	14	29		t5_2qk80	False
1368164438.0	1e1y58	Finished my heated on-board shower today (x-post from r/Jeep)	eatingacookie	165	23	31		t5_2qk80	False
1373503392.0	1i1q5j	Being a fire fighter has it's perks. I never go camping without a pair of my old gloves.	SearchPartyAnimal	162	27	19		t5_2qk80	False
1373932144.0	1idjkh	Camping on top of a waterfall in the highlands of the Brazilian Amazon.	melten77	146	11	11		t5_2qk80	False
1370010376.0	1fel90	All loaded up on Tulemalu Lake, Nunavut	arcticatlantic	147	15	13		t5_2qk80	False
1359653100.0	17mzrz	I built a home made Camp Kitchen/Chuck Box - Made from expanded PVC and aluminum! [x-post from /r/myog]	ha1ex	144	10	20		t5_2qk80	False
1365086421.0	1bnv1y	So it's not a 28 foot trailer, but our family is really looking forward to the 6 trips we have booked this year! We pick it up on Saturday :D	kg51	152	21	54		t5_2qk80	False
1374236649.0	1imkzn	trip to canada	jordancro	148	19	36		t5_2qk80	False
1375912188.0	1jwvpe	Early morning fire in Ireland	evidex	145	16	15		t5_2qk80	False
1373215967.0	1ht4ef	Here's the checklist my wife and I use for car camping. Do you guys see anything missing?	woodenrowbot	153	23	88		t5_2qk80	False
1346228681.0	z0eqz	This is where I spent the weekend	user24	140	11	15		t5_2qk80	False
1375546986.0	1jmqz3	Camping with the wife	PigSlam	165	37	44		t5_2qk80	False
1371317642.0	1gepwf	This was our view a little walk away from the tent. Two Jack Lake, Alberta.	maelstrom_soslow	137	12	5		t5_2qk80	False
1376276481.0	1k6ljj	Waking up on the shores of Loch Etive, Scotland	ElitistSlutPirate	142	15	5		t5_2qk80	False
1371583124.0	1glqe6	I woke up on a mountain, and in the clouds, this weekend.	csswizardry	143	17	7		t5_2qk80	False
1371426680.0	1ghdq2	Quite a morning above the Buffalo River, Arkansas	Underwood93	147	19	19		t5_2qk80	False
1372454622.0	1h9vdu	Camping on my honeymoon	uneekwahn	136	10	20		t5_2qk80	False
1355266135.0	14ovch	This is a picture of my dog from last weekend. This is how I feel when I know I'm going camping.	surrealasm_atwork	139	16	8		t5_2qk80	False
1373771843.0	1i97vi	Bear Tooth Pass, Wyoming	mangoburtango	143	20	15		t5_2qk80	False
1374118573.0	1ijat0	Gotta love some island camping.	abrouss811	132	9	12		t5_2qk80	False
1355901040.0	153jxp	A little safety and first aid suggestion that I'd like to share after learning the hard way last night: When camping/hiking/bushwalking to remote locations with others, please consider (and discuss, if you can) mental health issues with your group.	kilcunda	139	21	18	"The title may seem a little confusing, so here's some context (If you're in a rush and want to skip the wall of text, scroll down to the break or the TL;DR):

For Christmas, myself and three other friends had planned a short overnight hiking trip in the Dandenong Ranges in Australia: Nothing too complicated, a 9 kilometre trek up an old timer tramline then an easy downhill walk the next morning. Unfortunately, two of my friends had to drop out at the last minute, leaving only myself and one other. We had not been camping together before, but knew each other fairly well (friends for about 12 months), so we were completely comfortable going as just the two of us. For convenience of writing and anonymity, I'll call her B.

The walk itself went quite well (save for a tiger-snake that I nearly stepped on), we set up camp and enjoyed sitting around a fire-pit eating dinner and sharing stories. Later that night, however, B woke me up asking if she could come in to my tent for a second. I was a bit confused, but thought that perhaps she couldn't sleep. When I unzipped the entrance, I could see that B was shaking and seemed incredibly nervous. Thinking that something had happened or that she was suffering from hypothermia, I asked if everything was alright. Unexpectedly, she broke down crying and told me that the trees squeaking in the wind was scaring her, which seemed incredibly out of character considering that the encounter with the tiger snake earlier that day barely phased her. Since I had only just been woken, I wasn't quite sure what was going on at first, so I tried my best to comfort her and ask what was wrong. Within less than two minutes she started throwing up. 

Now, I'm no psychologist by any stretch of the imagination, but luckily I've had some experience with people suffering from mental health issues through both my course and a (now ex) partner that was diagnosed with schizophrenia during our relationship. Once I was awake enough to understand what was going on, I realised she was having a panic attack. I tried my best to comfort her and threw some dead ferns on the smouldering fire-pit (I assumed that panic attacks wouldn't mix well with not being able to see anything). Eventually, she was calm enough to speak explain to me that she had been in a car accident about two years earlier where the driver of the other vehicle was killed and that she was diagnosed with Post Traumatic Stress Disorder as a result. She was still shaking and occasionally vomiting, so I made sure she sat next to the fire and kept her fluids up. 

Luckily for us, our campsite bordered a logging track and offered limited 3G coverage in the upper section. We quickly got in contact with her parents who owned a four-wheel drive, were familiar with the campsite and were able to pick her up (knowing that her parents were on the way helped B calm down significantly - Prior to that I was seriously considering emergency assistance. Had we been in a more remote location, I don't doubt that that would have happened with the ammount of vomiting). At 3am, they arrived and drove her home, they were also kind enough to drive me back to my car at the bottom of the mountain.

I should repeat, we were *extremely* lucky to have circumstances in our favour. Safety should always be a number one priority when camping - We came well prepared and with plenty of first aid supplies and experience. That said, I was completely unprepared for this situation. When one thinks of camping emergencies they usually consider exposure, illness, allergies, snakebite, sprains, broken bones, asthma, and other physical problems. Mental issues, however, never once crossed my mind. Had this been a psychotic episode rather than an anxiety attack, I would have had very little idea as to how to respond (and, again, that's coming from someone that once supported a partner through schizophrenic episodes and frightening hallucinations - In a remote setting, everything seems turned on its head).

****

So, here's the message I would like to leave: I understand that mental health is (VERY unfortunately) often considered a taboo topic, but please, **discuss these matters with your party**. Before travelling, ask yourself how you would respond to a mental health emergency such as a panic attack or psychotic episode. **If you - like millions of others - struggle with mental health issues that may lead to a similar situation, please discuss them with the people you're camping with if you can**, even subtly if possible. 

**If you find yourself in a situation where someone in your party starts having an anxiety attack, psychotic episode or any other potential mental health emergency, stay calm and try your very best to be understanding, empathetic and patient** (Edit: User BadDadWhy [also suggests you be polite](http://www.reddit.com/r/camping/comments/153jxp/a_little_safety_and_first_aid_suggestion_that_id/c7j1ig4).). Re-lighting the fire so that the campsite was well-lit helped a lot in my situation, but your circumstances may be completely different to mine.

If you're not sure how you would respond to a person suffering from such an attack or episode:

* ['4 Things You Shouldn’t Say To Someone Having A Panic Attack'](http://thoughtcatalog.com/2012/4-things-you-shouldnt-say-to-someone-having-a-panic-attack/)
* ['How to Help Someone Who's Having a Panic Attack'](http://www.livestrong.com/article/152711-how-to-help-someone-whos-having-an-anxiety-attack/)
* ['Learn First Aid for Psychosis](http://mindhacks.com/2007/09/12/learn-first-aid-for-psychosis/)

*****

**TL;DR**: Friend of mine experienced a post-traumatic-stress related panic attack during a camping trip, started vomiting, shaking and lost a lot of fluid very quickly. **Please consider any possibility of a mental health related emergency while camping with others** - Discuss with your party how you would react to such a situation, even if none of your party members are known to suffer from mental health issues: They might not feel comfortable talking about such very private and sensitive issues, meaning that you may not prepare for them. If you find yourself dealing with a mental-health related emergency in a remote location, be empathetic, caring and understanding to the victim - Try to stay calm, do NOT yell, and make sure to keep an eye out for physical issues that may result (e.g. shortness of breath, loss in fluids from vomiting, etc). Most importantly, stay safe.

*****

**This is a self-post, I do not receive any Karma for it. Please upvote so that other redditors can read and learn about a potential emergency situation that they may not have considered.**"	t5_2qk80	True
1350188678.0	11g4dd	Nice little surprise in the woods.	yfilak	129	16	27		t5_2qk80	False
1365357596.0	1bv2ze	after 4 years of snow, storms, salt and high altitudes, this is my tent airing out at the beginning of the season! yay spring!	Darkosman	129	16	17		t5_2qk80	False
1359108075.0	178zap	Foil wrapped bush made pizza on the fire	kryscooper	123	8	14		t5_2qk80	False
1349322408.0	10x220	My sleeping spot last Saturday in TN's Virgin Falls.	khamul	122	9	7		t5_2qk80	False
1346192901.0	yzixf	Long exposure from last weekend's canoe trip	svetovit	120	4	17		t5_2qk80	False
1373457390.0	1i032p	These festival goers were definitely not prepared for rain	fromeout11	139	24	34		t5_2qk80	False
1374609691.0	1iwn36	My hammock my boyfriend had custom made for my birthday.	TheSnugg	141	27	23		t5_2qk80	False
1367782808.0	1dqvsc	Backyard camping in NC. Spent all day building this fire pit, then spent all night enjoying it.	hiddenflorida	128	19	16		t5_2qk80	False
1370795231.0	1fzjg1	Camping on the Oregon coast this weekend	iRelapse	133	21	23		t5_2qk80	False
1346030142.0	yvov3	All I need...	SKOLJACK	117	8	13		t5_2qk80	False
1368763923.0	1ehyrn	Built a sleeping platform/storage area for the back of my 4runner!	DaniDoodlez	123	11	21		t5_2qk80	False
1358918123.0	173ukt	Campsite on a gravel bar on the Copper River (Alaska)	drewgriz	119	9	10		t5_2qk80	False
1372612953.0	1hdfni	Fishing in Mokowanis Lake in Glacier National Park...	njhiker	118	14	10		t5_2qk80	False
1372115635.0	1h01zr	A friend and I took the kayaks out and found a nice camping spot on an island.	JasonWin	123	14	5		t5_2qk80	False
1376302090.0	1k761k	Good Illustration of River Dangers	sstterry1	116	11	8		t5_2qk80	False
1365723169.0	1c64uz	My summer as a staff member at a Boy Scout camp.	TheBird47	127	18	17		t5_2qk80	False
1360621376.0	18c3ri	My campsite near Winter Park CO. Not very remote but very beautiful. 	ohratz	115	10	6		t5_2qk80	False
1349982681.0	11bo6g	perfection... crystal clear shores of Pitt Lake, British Columbia. 	TWAT_ROCKETS	115	6	10		t5_2qk80	False
1376169685.0	1k3xti	Winter Camping Album	HeyJackWannaWearAHat	113	9	8		t5_2qk80	False
1363222547.0	1a9644	Beauty	escher15	112	11	5		t5_2qk80	False
1371085001.0	1g8itr	Had a pretty nice spot a few days ago	Teddy_Raptor	110	9	10		t5_2qk80	False
1353379236.0	13hjtr	Waking up to morning rain while camping in beautiful Big Sur, California	poor_tom	110	7	11		t5_2qk80	False
1337791383.0	u17pp	My dad and I built a Mongolian ger to camp in!	isaidDONTPANIC	111	9	15		t5_2qk80	False
1375812912.0	1jtrgb	Favorite car camping spot (for the Santa Ynez Area) in my favorite tent ever (Kodiak Canvas Flex Bow)	akbal7	112	13	14		t5_2qk80	False
1362123897.0	19gamz	Baking some rosemary parmesan bread in a reflector oven	wombuster	110	8	8		t5_2qk80	False
1346198973.0	yzp8s	I ride until I can surround myself with green.	uluru	104	7	4		t5_2qk80	False
1369855076.0	1fabix	My favorite camping spot, just before setting up. Anyone recognize the place?	nirbenvana	109	9	23		t5_2qk80	False
1369705131.0	1f685c	We made Australian damper bread - flour+salt+water on a stick over a campfire!	ILikeAppleJuice	119	18	21		t5_2qk80	False
1373255820.0	1hucw1	Saw this poor guy this weekend	tinkfirefly	123	25	34		t5_2qk80	False
1350478865.0	11mlo3	Hammock camping in the Grand Canyon next to a stream with rapids. [x-post r/hammocks]	wiuara	100	3	16		t5_2qk80	False
1347061101.0	zj5kv	You gotta wake up early to get the best photos.	thepfunk	111	14	8		t5_2qk80	False
1371853451.0	1gtne0	Camping beside this river in Ava, MO.	zoeeatsbutterflies	100	7	11		t5_2qk80	False
1369971125.0	1fdsx6	Truck camping at its finest	jclark754	112	18	12		t5_2qk80	False
1360890324.0	18jx2h	Pictures from my first winter camping trip in the Chattahoochee National Forest, GA. The snow was a surprise!	melicious23	107	13	26		t5_2qk80	False
1375932913.0	1jxljf	Just took my girlfriend, who's never been backpacking, on a 20 mile trip along the AT... she loved it!	jon5444	123	27	17		t5_2qk80	False
1374518987.0	1itv9w	You don't always get great weather...	thonor	109	14	15		t5_2qk80	False
1358702705.0	16xq0m	Camping with my dog, son, and a marmot Thor 3p.  	McBalls_	101	7	33		t5_2qk80	False
1375118663.0	1jadkj	Camping in Great River Bluffs State Park this weekend..20 mi. South of Winona Mn	Fixedgearsandbeers	101	9	8		t5_2qk80	False
1374006719.0	1ifrsa	Campsite in Catskills NY	bosterony78	106	10	10		t5_2qk80	False
1372093405.0	1gz8as	Our campsite during the Supermoon (6/23/13) in Castle Valley, UT [Album]	snowmanvt	106	13	13		t5_2qk80	False
1375701366.0	1jqfke	Camping in Wales UK	fraxinous	101	12	7		t5_2qk80	False
1375371468.0	1jhzmu	Lake Blanche, Utah	bbluez	106	14	6		t5_2qk80	False
1367494693.0	1djmy9	Camping in Ireland	evidex	105	13	19		t5_2qk80	False
1364848721.0	1bgb9s	This is my ceiling right now in central Florida. 4:40pm April 1, 2013	WhatTheFoxtrout	106	14	17		t5_2qk80	False
1347562277.0	zu3co	Dog staying warm by the fire	MileHighBarfly	120	31	19		t5_2qk80	False
1376017786.0	1k04a4	Canoe Camping in Algonquin National Park, ON	Sundance91	100	10	16		t5_2qk80	False
1357101284.0	15t46d	Boundary Waters	Horvitz444	108	18	18		t5_2qk80	False
1352941486.0	137opt	Kayak tripping in Pointe Au Baril, Ontario	hailstormz	94	3	10		t5_2qk80	False
1363151021.0	1a76d4	Morning view	escher15	99	10	6		t5_2qk80	False
1354808914.0	14dyji	My vintage fiberglass RV with an 1889 mini pot belly stove.	Breakstruckalot	99	9	14		t5_2qk80	False
1343412471.0	x9b9k	First night with the new (to me) trailer		97	9	14		t5_2qk80	False
1341847774.0	w9uzr	Border Collie wake up service at 12,000 ft. (San Juan National Forest- Colorado)	blondski	94	8	11		t5_2qk80	False
1340218808.0	vcbdc	I enjoy dinners like this SO much :)	Zodiathan	96	7	10		t5_2qk80	False
1369932842.0	1fcgof	This just popped up on my frontpage ... thought some of you might appreciate the irony (x-post r/adviceanimals)	Gavin_152	145	58	5		t5_2qk80	False
1373062051.0	1hprvn	Just got a sweet new tent.	rttrees	100	15	9		t5_2qk80	False
1360277000.0	183dfq	Maine has some beautiful campsites - outside of Portland and in Acadia	brianjcaruso	92	5	19		t5_2qk80	False
1353819440.0	13qx26	Escaping to the Nevada desert	Tim_The_Enchanter	99	11	14		t5_2qk80	False
1348542970.0	10fie0	Last year I met a friend for the southwest leg of her x-country road trip. We hiked state parks and camped the whole way, it was the most amazing experience of my life and wish I was still out there. Since I was looking through the photos, I thought I'd share some...	chloecatt	90	8	18		t5_2qk80	False
1344378050.0	xuil3	Camping on the Oregon coast.	moonpies_for_misfits	93	11	15		t5_2qk80	False
1371480055.0	1gimv9	Our lake spot a few days ago	Teddy_Raptor	99	13	5		t5_2qk80	False
1343441136.0	xa34j	This is how I'm camping this weekend	ridinretro1973	89	8	13		t5_2qk80	False
1373079913.0	1hqa1o	Camping in and next to the old Spruce Mtn Fire Lookout Tower in Wyoming	desert_wombat	98	12	13		t5_2qk80	False
1362366414.0	19m5oe	First time winter camping :)	NoCLeverNameHere	87	3	20		t5_2qk80	False
1375989169.0	1jz3j6	One week of camping is enough to reset the body's circadian cycle.	chigonzo	98	17	6		t5_2qk80	False
1375619910.0	1joeic	Camping in Austria has beautiful places	Lliesaa	98	14	14		t5_2qk80	False
1347887555.0	100qws	Went camping at a few spots this past weekend. This topped best experience for waking up.		94	8	17		t5_2qk80	False
1376242785.0	1k5j1u	I was camping in the Grand Canyon and left my boots outside the tent, under the rain fly. I woke up the morning of our ascent to discover a squirrel had chewed through my boot lace. My solution required a creative use of something no camper should leave home without!	AckbarsAttache	111	29	25		t5_2qk80	False
1373721081.0	1i7s6o	I fell asleep here, last night.	csswizardry	95	14	13		t5_2qk80	False
1369749195.0	1f75rk	This is not how we envisioned our Memorial Day weekend of tent camping	Boxyrobot	100	18	18		t5_2qk80	False
1369683801.0	1f5jt4	Took our new popup out for the first time this weekend...camped in one my whole childhood and now our daughter gets to enjoy the same	kg51	97	15	10		t5_2qk80	False
1366931997.0	1d48a2	First Refuge trip of the year!! Twin Bridges, MO	bodafrisco	89	10	22		t5_2qk80	False
1363654960.0	1ak9ui	canoe trip in algonquin last august...	lancelongmast	92	9	10		t5_2qk80	False
1359580008.0	17l17v	What to pack for a camp kitchen	capnkrool	89	6	7		t5_2qk80	False
1353515251.0	13kl08	sea kayaking through the San Juan Islands, WA - Pt. Doughty	DragonGirl83	94	12	15		t5_2qk80	False
1374517937.0	1ittns	My view from the weekend	edawg0803	92	10	3		t5_2qk80	False
1356904411.0	15ov3w	Went Beach Camping with some friends, had an awesome time.	TexVikbs	89	7	13		t5_2qk80	False
1337657770.0	tyox1	First trip of the season, still a bit cold in Alberta	zombiecharlesdarwin	87	3	19		t5_2qk80	False
1376516715.0	1kdl9o	Thought I'd post a picture from my solo trip. Though I cut it short, details inside.	Caututious	92	11	31		t5_2qk80	False
1372391103.0	1h867q	4-day trip in killarney provincial park	lancelongmast	87	11	5		t5_2qk80	False
1358050650.0	16h4df	Early camp morning.	digitalreck	103	21	13		t5_2qk80	False
1357933579.0	16e8pq	Our Campsite @ Bar Harbor, ME - Imgur	Wcooper24	82	2	7		t5_2qk80	False
1344961417.0	y7izz	First meal in a dutch oven: roast chicken w/ bacon and cider.	wallenstein3d	89	10	22		t5_2qk80	False
1335819498.0	t0cj9	camping level: no money for a tent	moboization_28	92	14	41		t5_2qk80	False
1372962963.0	1hnbly	Hemingway on Camping	thegreatescapetrail	90	12	11		t5_2qk80	False
1366819429.0	1d0lk4	Camping in Hells Canyon	tands	90	12	11		t5_2qk80	False
1366590606.0	1ctz41	Big Sur Camping	Frederick_Austin	87	8	21		t5_2qk80	False
1356711248.0	15ks0v	Our desert camp this year	Bigmojoo	87	11	8		t5_2qk80	False
1351630133.0	12cwpi	Got a weekend in at Batavia kill leanto before the storm. It was cloudy but a gorgeous night.	crocodileheart	81	4	6		t5_2qk80	False
1376267135.0	1k6b2v	From my recent trip to the southern part of Ontario's Algonquin park.	lukinlbc	85	5	7		t5_2qk80	False
1361336204.0	18vaez	Had to bring all the toys for a President's Day camping trip	wintyfresh	91	16	7		t5_2qk80	False
1350412239.0	11kzba	Not bad for a Tuesday... 	Tim_The_Enchanter	85	12	14		t5_2qk80	False
1366478536.0	1cr0pg	Shot from last weekend, thought you guys might enjoy it!	randomtrance	82	5	4		t5_2qk80	False
1367317841.0	1deiov	The island I camped on this weekend	duiy	92	17	12		t5_2qk80	False
1360173028.0	180csg	5 Campfire Cooking Tips That Will Impress Your Friends	AndyZealot	104	31	27		t5_2qk80	False
1358279617.0	16mw9m	Lake Superior provincial park	McBalls_	86	14	13		t5_2qk80	False
1343874195.0	xji8k	Our new-to-us teardrop camping trailer!	kg51	84	7	21		t5_2qk80	False
1372277373.0	1h4pqb	This is where my younger brother and sister slept... Man I miss being a kid.	rectums	95	21	8		t5_2qk80	False
1361231563.0	18s7ei	As promised my trip to the Grand Canyon in January, also White Sands and Death Valley. 	Scruffy_the-janitor	83	14	16		t5_2qk80	False
1368588552.0	1ed11y	Survival Tablet, looks promising.	damnitcletus	85	12	24		t5_2qk80	False
1366578360.0	1ctk1l	Reminder: This week is National Park Week. Free admission Monday through Friday.	ScrapsDenver	89	16	6		t5_2qk80	False
1359241174.0	17c78f	Waimanu Valley, Hawaii [1024x680] Tent Life	Patrick_JL	77	6	7		t5_2qk80	False
1376144830.0	1k38jf	The New way to camp	JDPComedy	95	21	27		t5_2qk80	False
1376072945.0	1k1hlp	Some shots from Northern Algonquin Park	Syntackz	87	16	16		t5_2qk80	False
1374457844.0	1is9h8	Little Tybee Georgia.	Acorichards	82	12	8		t5_2qk80	False
1374164406.0	1ikf27	Nice morning view from our campsite on Pharaoh Lake (Upstate New York)	PangeaDestructor	78	9	5		t5_2qk80	False
1358434190.0	16r4m0	George lake, Killarney provincial park. There was an eerie fog, and this is my dog.  No filter. 	McBalls_	83	12	4		t5_2qk80	False
1346946677.0	zgcmj	Camping by the Pacific Ocean (Hawaii)	patssle	77	5	9		t5_2qk80	False
1375837110.0	1junqw	Went camping this weekend and built a fire on my own for the first time. One of the most beautiful sights . . .	what_the_deckle	83	10	7		t5_2qk80	False
1372028087.0	1gxm7t	River camping (again)	genitalderpies	80	12	8		t5_2qk80	False
1370461452.0	1fqpln	Nothing like taking a lunch break while on a weekend float (flint river , ga)	ClassyBravo	88	19	7		t5_2qk80	False
1369605765.0	1f3pid	Hammock camping on the Florida Trail	antmaneater	79	9	14		t5_2qk80	False
1340061600.0	v8yjm	My Seat for Father's Day Weekend	crmacjr	80	9	4		t5_2qk80	False
1376311213.0	1k7brz	What a view to wake up to, Loch Ness	cris1	78	7	12		t5_2qk80	False
1374276809.0	1inyas	Fire cooked shrimp stirfry.	RambleLZOn	77	6	7		t5_2qk80	False
1343524954.0	xbmrz	Camping in heaven.	ridinretro1973	78	9	22		t5_2qk80	False
