created_utc	id	title	author	ups	downs	num_comments	selftext	subreddit_id	is_self
1325812439.0	o4r5c	What r/entwives is all about	Stellaaaaa	71	5	28	"I spend some time on other subreddits, but never quite enjoy it as much as our little home here. Part of me wishes there were more posts so I would have more reason to cozy up in here, but with popularity, there has been a trend in other subreddits that I hope never happens here.

""ZOMGWTFBBQ What does this have to do with __insert_subreddit_name_here__ it doesn't belong go away you suck and you're ruining our subreddit with your trash!""

Entwives isn't about posting things that are ONLY related to being a female tree smoker. 

It's about US. It's about who we are. It's about our thoughts and insecurities; our hopes and fears; our successes and failures; our dreams and nightmares; our proud moments and disappointments. It's about finding like-minded people to discuss daily life with and knowing that when you come here it won't be judged. 

And if you ARE here to judge we'll downvote you to oblivion and put a ""NO BOYS ALLOWED"" sticker on your forehead. :)

Just had to get that off my chest!

PS - OK, sometimes it's about weed too."	t5_2s7a6	True
1317463233.0	kxdx1	Appreciation for the Entwives. [x-post from r/trees]	TragicOne	73	6	11	"I was just reading through /r/trees and it got me to thinking. Don't you think entwives are just the best? For the life of me I have never met a lady who smokes that has not been cool as hell. They are always funny, always smart, and almost always creative.

To quote Tupac, ""You are appreciated."""	t5_2s7a6	True
1309308350.0	ibtyz	I've been studying for 6 hours today and decided to take a break and share my favorite piece with my favorite ladies. Meet Maleficent!	seattle_lite	66	2	12		t5_2s7a6	False
1374784258.0	1j1ux7	I don't wank to lurk anymore...	ShoegazingStardust	70	3	22	"I've been reading everyday for weeks and I wanted to say hello!  I look forward to reading the posts everyday and feel lucky to have stumbled upon this group.

I'm having a great day [5] and wanted to share my favorite [piece](http://imgur.com/voGMpBp)
"	t5_2s7a6	True
1359843448.0	17rw5q	I smoke two joints when I play video games, and every 10,000 points		67	3	42	"&gt;I smoke two joints in the morning,  
I smoke two joints at night,  
I smoke two joints when I play video games,  
And every 10,000 points  
  
  
Where's my vidya-game playing entwives at? What's your game of choice right now?  
  
I'm knee deep in Skyrim... a little late to the party, but I was holding out for Diablo 3... So much for that idea."	t5_2s7a6	True
1357980612.0	16fi9x	Learned a lesson. [7]	sassy_creed	68	8	19	"College student here. Went to a party tonight after smoking a nice bowl. I'm dancing with my friends, having an okay time, when this guy comes up and grabs me from behind and tells me to dance with his friend. I was trying to say no when he leans up to his friend and says ""She's ugly but she has a nice rack."" 

I'm right here! I can hear you! I call him out on it and he gets all embarrassed but I decided I had had it with this party and I left. Went back to my house, smoked a bit more to mellow out, then texted a friend about what happened. 20 minutes later he shows up in front of my house with chicken tenders. 

Sometimes I just get so annoyed with how people can act that you forget to appreciate the sweethearts who are right before you. So take a moment right now to appreciate them.

Okay. Thanks."	t5_2s7a6	True
1353376654.0	13hgxr	Bubbles	DrP3n0r	74	7	14	"So I had a bit of a magical experience today. I decided to smoke this afternoon in celebration of no classes until next Monday (Thanksgiving Break!). I had just picked up an 8th of some really nice purp and was sitting in this awesome clearing in the woods where I usually smoke. It was so pretty out, and I got to about a [7]. I was listening to some really trippy trance music, and I remembered that I had one of those little bottles of bubbles from my cousin's wedding (like [these](http://www.favorsandflowers.com/images/classic-wedding-bubbles.jpg)). So I start blowing bubbles and let me tell you gals, I felt like my soul was being cleansed and I so content haha.

The bubbles would float and swirl in the breeze and the sunlight hit them so you could see a huge array of colors through them and it was just so beautiful... I spent probably 45 minutes just listening to music and blowing bubbles. It was m a g i c a l. That's all.

**TL;DR: Got high and blew bubbles. Bliss ensued.**"	t5_2s7a6	True
1352265774.0	12s2z6	Colorado entwife here!	kt4eva	70	6	28	I'm feeling so good. I am watching the news right now, and they are talking about how amendment 64 has passed. It's history right before my eyes. I'm a real happy camper.	t5_2s7a6	True
1346463785.0	z60bs	All Set For Saturday :) - Imgur (Whovian Pieces and Nails!)	SirSparksAlot	73	7	11		t5_2s7a6	False
1344545070.0	xyj02	My new favorite pair of undies! :) thought y'all would appreciate 'em.	Tornadotrailer	76	12	7		t5_2s7a6	False
1339826773.0	v4otw	my Bob Marley Mani :D	daytr1pper	79	17	13		t5_2s7a6	False
1334792807.0	sgwhk	"Found an awesome tin stash box in a vintage shop in New Hope today. It says ""Contraband"" on the front. Perfect. "	soupypsouperson	65	1	11		t5_2s7a6	False
1334585660.0	sce4m	My personal debate with myself everytime I submit my face + smoke on r/trees		79	14	2		t5_2s7a6	False
1330769089.0	qfrwg	Something unexpected made it's way into my life today. [4] Entwives meet Flora.	hanstalhoffer	70	3	22	"A few weeks ago our beloved pet turtle Karl caught pneumonia and suddenly passed away. We buried him in the front yard with red tulips all around and a large stone to mark his place. I felt terrible because it was probably something that I did/didn't do which put him in the health condition he was in. We did everything we could to get him better but he was just too far sick to bring back so I made his passing as easy for him as I possibly could. 

I've been heart broken, this all happened around my birthday and my present from my father was a brand new basking dock for him which he hand built. I decided that I wouldn't get another turtle for quite some time so that I could make sure nothing like that would ever happen again, I feel so responsible. However tonight my boyfriends cousin showed up at our house unexpectedly with a baby yellow bellied slider, it was a present for my boyfriend's mother (it's her birthday tonight) but she had no place big enough to put her and so she had my boyfriend come surprise me with [her](http://imgur.com/TSiDS).

I almost cried. [She's so beautiful.](http://imgur.com/JZ8ep) Anyway I just wanted to share something that made me really happy today. We smoked a lot of weed about it.

**TL;DR: I lost a turtle a few weeks ago and didn't plan on getting a new one for a while but my surprise Flora was too cute to say no.**"	t5_2s7a6	True
1329445987.0	pta43	What happens when I toke and am alone and bored	dangerssnake	89	24	19		t5_2s7a6	False
1326848539.0	olojz	My Ent, myself and our sapling. &lt;3	IAmDubSteph	71	8	13		t5_2s7a6	False
1320793540.0	m5dc0	Night classes suck. amiright? 	jessiema	67	2	9		t5_2s7a6	False
1310597172.0	iovmo	My 6 month old		72	8	17	"would like to smash on my keyboard:



dwrarsvx qwszswssv rvc  j gb yb ygn ynb yhbhb y b7hg bgcv cs csz   dx 


that is all. maybe now he'll leave it alone."	t5_2s7a6	True
1376300018.0	1k74yl	Hey ladies, thought you might like my latest ink!! Pretty cheeky huh :P	missmwahxox	111	50	25		t5_2s7a6	False
1371872129.0	1gu6eb	:C Ladies I'm so jealous! I don't have a dog, but I do have a fat ass rabbit!	hanstalhoffer	76	9	11		t5_2s7a6	False
1362424448.0	19njkn	Shark Week?		68	3	16	"Started shark week with a bhang bar, a giant PCH Chicago dog, chili cheese fries, a DQ sundae, and a nap. Thank you, marijuana, for getting me through the worst cramps of my life.

(Edit) so glad we could all bond around the fact that Mother Nature sucks so hard sometimes!"	t5_2s7a6	True
1360648525.0	18d2x4	This is a 12 foot denim cactus I stitched up. What's the coolest thing you've ever made?		71	7	29		t5_2s7a6	False
1356619254.0	15iq76	So in love with my Christmas present	pleasepostmybail	72	6	3		t5_2s7a6	False
1355428084.0	14su66	Made my ent a cheesy jalapeno pullapart loaf for his office potluck (x-post from /trees)	longhairidontcare	69	9	10		t5_2s7a6	False
1355113753.0	14l514	Found these magic glasses that turns orbs of light into hearts. I wish life always looked like this. My bowl at a [4].	butterflybrains	70	9	5		t5_2s7a6	False
1349201269.0	10tt6k	The glow shot	KeylimeEyes	71	7	2		t5_2s7a6	False
1348253294.0	109elw	Glow in the dark nail polish? Possible!	Arienrhod	71	8	5		t5_2s7a6	False
1345071016.0	yad7l	Made some medicated cookies for my boyfrient ()	short1forlife	68	7	6		t5_2s7a6	False
1345010023.0	y8ys7	What do you lady's think of the soap i made today?	KeylimeEyes	67	2	2		t5_2s7a6	False
1342846440.0	wwu3p	The four Bs: Blueberries, bong, bubble bath! Tonight is gonna be awesome. 	Bamka	66	4	3		t5_2s7a6	False
1333776165.0	rxibx	Got lots of hate on /r/trees because of it's lack of trees. But this is why I love my boyfriENT	mellymel058	75	10	8		t5_2s7a6	False
1328823714.0	pid3q	Any of you ladies study abroad? Here's me at a [7] in front of the Eiffel Tower. I'd love to see your pics!	marleymar	73	10	21		t5_2s7a6	False
1326954475.0	omxa6	Here is a comic I made about hiking through a foot of snow, with a goofy dog, at a [6].		70	5	9		t5_2s7a6	False
1326248086.0	obq7z	This is my baby to share.	domestickdyke	67	2	4		t5_2s7a6	False
1320508950.0	m1gxf	I will never not be proud to be an entwife.	pineappleespresso	69	4	12	"I've been smoking for about 4 years now, and before I ~came to my senses~ as it were, I saw trees as being in the same category as alcohol or other harder drugs, and said I would never so much as try it, as well as most of the other general misconceptions that come with being misinformed my whole life about ganja. Now, after these 4 wonderful, enlightened years I can't even believe I used to think that way, and frankly, I can't believe how much better my life is now that I've become a proud stoner. My back and neck hurt less, even when sober, my sense of connectivity with and appretiation for my planet and my fellow humans has flourished, and even the great relationship i had with my mom has improved, as we now share stories of our stoney experiences and views.

I recently discovered /r/trees, and yesterday I realized /r/entwives is a thing that exists, and I couldn't be happier. The entire /r/trees community and its subreddits is full of some of the friendliest, most relaxed, and overall most accepting people I've ever known, and, much like irl when I meet someone who also smokes, I feel like we were all friends before we even met, as sappy as that sounds.

Before I ramble on too much, I'd like to say thank you and hello to everyone on /r/entwives and add that I have no idea how to end this post so here's [this.](http://favim.com/orig/201104/27/Favim.com-25678.jpg)"	t5_2s7a6	True
1317317384.0	kvha6	If we let him, Huckleberry bunny would eat all our trees...	BYAHBYAHBYAH	73	9	17		t5_2s7a6	False
1317055520.0	krymh	just looked at my smoking gear, I don't know if i could have a more girly set up. (My bowl, lighter and sploof) 	rosieco	74	11	24		t5_2s7a6	False
1315438694.0	k862h	This One's For You Ladies!	JessicaMaple	70	9	4		t5_2s7a6	False
1312939634.0	je3ys	my baby and i celebrating our birthdays		71	8	13		t5_2s7a6	False
1308540298.0	i40k9	"My ent is now referring to our wedding anniversary as my ""annual review"" and when I do something that displeases him, tells me, ""that's going on your performance evaluation."" [4]"	yaen	70	4	17	"This to me is the best thing I've ever heard. I'm coming up on my first performance review, and hopefully I'll still have a position afterward. I think it's in the bag XD 

Here's to sweet, long-lasting ent-love."	t5_2s7a6	True
1307162644.0	hrb8e	Multiple choice.  1) Bad Week.  2) PMS   3) Trees   *4) All of the above!*	mizzally	68	5	12		t5_2s7a6	False
1373588709.0	1i4c4v	I am a lurker here (so far), but I saw this and thought you ladies might like it :)	captainalana	78	19	12		t5_2s7a6	False
1368457906.0	1e8x98	Marijuana Moms, We Salute You	focoent	66	8	1		t5_2s7a6	False
1367969755.0	1dw9u9	Can you guys imagine a monthly weed subscription box??	thecrosseyedbear	66	5	25	Where you pay 20 bucks a month or something and receive a new rare strain to try out each month. I was looking at a nail polish subscription service and thought of this... I can't wait for weed to actually be legal everywhere. [6-ish]	t5_2s7a6	True
1361604253.0	192kif	 [high](8) so out of character for me but...	GangaMonster	69	10	17	"So I'm sitting here. A bowl full of bubble, my 2nd tall boy of Crispin, my knitting; and Red Dragon just started. 
All of a sudden I get this thought in my head ""Edward Norton is such a babe"" 
all I can do is laugh and laugh! I've never used the word ""babe"" in my life. 

I had to share, and you ladies are the only ones who would understand.
I love you all!
&lt;3"	t5_2s7a6	True
1357391833.0	1608li	What's your most used or favorite life-hack?	greenwomanoftheriver	70	8	99	"I have a few that I've used forever...

Mayonnaise works to get sticky goop off glass.

Aquanet hairspray will get lipstick out of clothing.

And 90%+ alcohol with a little kosher salt will clean your bong right out without having to resort to chemicals or expensive cleaners.

My most recent one is:

Coconut oil in ALL THE THINGS. In my hair, on my skin, in my food... and I'll be damned if in the last two weeks all those things didn't start looking and working better. This is the kind I use: http://i.imgur.com/OudqU.jpg  
You can get it at Costco for under $25 for a giant tub.

What are your life-hacks?"	t5_2s7a6	True
1352332340.0	12tsha	Something I saw browsing around..thought you ladies would like it.	KuntryIII	67	5	1		t5_2s7a6	False
1347810252.0	zz2nz	YSK: Queen Victoria was an ent	pante710	65	0	3		t5_2s7a6	False
1343749704.0	xgc13	Super Silver Haze. 	itsrubiboobie	65	2	2		t5_2s7a6	False
1337824980.0	u2264	Toke n' Touch!! Probably NSFW.		72	10	34	"Hah, I feel like this post could get real weird real fast, but you ladies are the closest things to girlfriends I got, so this was the first place I thought to turn! Maybe this is a bit personal, but it's the internet so whatever. 

When I toke, I LOVE to touch myself. But I have been told that my habits are a bit excessive. I usually flick the bean 3 times a day, as long as I have the time for it. And when I am high, that number can easily double. That being said, I'm getting a bit bored with my own techniques, and my ent only has so many hours in his day... so I'm left to fend for myself a lot of the time.

So I thought maybe I could ask you ladies about your habits and get a few new ideas!! Any toy suggestions are welcome, along with favored fappable websites! Videos, erotica, kink, whatever! "	t5_2s7a6	True
1337602783.0	txens	Today is the day it begins... and I'm scared.	greenwomanoftheriver	71	10	19	"Just over two years ago a shining star was taken from the world. Her name was Mackenzie Cowell, I was a business associate of her mother and got to enjoy a lot of pictures of Kenzi as she grew up. 

On 2-9-10 she disappeared, her car was found on a rural back road that night, and her body in the river four days later.

Her killer was arrested that October. His DNA matched that found at the site where her body was found, and her blood was found in his apartment carpet. I know the killer as well. I've grown up with him. He worked for my mother. And I have no doubt he is guilty... he IS that kind of person.

Today begins jury selection for the trial. I'm scared because this sick waste of space took a beautiful person away, I'm scared because his attorney is known for winning for guilty clients. I'm scared because if he walks, it will tear this town apart. I'm scared because if he doesn't walk, it could do the same. 

I'm scared that justice will not be served, and Mackenzie so totally deserves it.

No matter the outcome of the trial, I know it is in the greater power's hands. Please smoke a bowl for myself and our little town, getting ready to go through the ugliest ugly that has happened in a long time."	t5_2s7a6	True
1335528713.0	sv64i	Laaaaaawl. Made my day a little better.	XibalbaBruja	67	4	3		t5_2s7a6	False
1334981137.0	skut6	The lengths I had to go to to find this lighter under the couch were outrageous, but the rewards were great!		67	6	1		t5_2s7a6	False
1332471898.0	r9fkg	It's been one of those days, fellow entwives... had to roll a joint instead of smoking a bowl	MedusaStoned	71	11	12		t5_2s7a6	False
1316044007.0	kfx22	Galaxy nail art	JoKat	68	3	11		t5_2s7a6	False
1314832195.0	k0pfp	My New Sherlock Bubbler	JessicaMaple	66	6	10		t5_2s7a6	False
1306802853.0	hnuoa	One of my favorite lady ents	JennyLeeLark	64	2	7		t5_2s7a6	False
1303220244.0	gtkzn	"Me and my roomy made these hemp bikinis.  I put a ""reddit"" coupon code in there for you lovely ladies.  Happy early 420!"	Areefadanklin	69	5	31		t5_2s7a6	False
1374092754.0	1iidkh	I was searching on etsy for a shirt when I came across this	2legit2quitHEYHEY	70	7	4		t5_2s7a6	False
1370756490.0	1fyw41	Tomorrow I'm going to be awesome. Or, how I finally accepted the truth.	oneplustwoislove	66	6	18	"My life has been tumultuous. There have been lulls and times of peace. I went through some very dark times emotionally and learned a lot.

Three years ago, I met a guy, fell hard and we were in love. For a while. Then he started to change. And, really, they were positive changes. But one of those changes was that he wants kids. I really don't.

So we broke up. And for two days I cried and barely ate.

But then something occurred to me. He ended things because he knew I would never want what he did. I would have done the same thing. I realized that our friendship was always the main focus of our relationship. That would never change.

So I went on a date with a very nice man who also does not want kids (POF really delivered in this case) and there was no anxiety or emotional baggage.

I'm seeing this new guy again tomorrow for brunch. And I'm going to be awesome, cuz I know I am. I'm not hiding anymore. This is me, I'm awesome."	t5_2s7a6	True
1360193016.0	1812vx	Life is Beautiful	tanzler	64	1	8	"Nothing make me appreciate my life more than a beautiful ""open-your-windows"" kind of afternoon, making love to my Ent, and a bowl :)

Enjoy life ladies~"	t5_2s7a6	True
1356086458.0	15800j	Ladies...look what came in the mail today! First time using a vape and I'm feeling good! [8]	GBCxTCP	65	2	18		t5_2s7a6	False
1348786748.0	10l7mk	"Entwives...making wings for dinner and enjoying 
fall spirits.....this was the counter..guess what happened next."	missfittnc	64	6	8		t5_2s7a6	False
1344370663.0	xuag4	I'm between houses right now...	omac318	63	3	4	moving one to the other, and after one successful day of moving 90% of my things by myself in my tiny coupe car, I am so hot! haha so here I am, on reddit, toking in my bra, with a fan on me. uptokes for loving the freedom this feels like!	t5_2s7a6	True
1343831768.0	xi9bs	My Ent and Myself, doing what we do best 	xplasticastle	71	10	4		t5_2s7a6	False
1341639353.0	w61qw	My smoking buddy!  :D	AFrogsLife	68	4	8		t5_2s7a6	False
1341446487.0	w1ycm	happy fourth laaaadies! tokes up!	daytr1pper	69	10	9		t5_2s7a6	False
1340178608.0	vbisi	Ok not A woman, wife or married BUT	mrsmokesalot101	81	20	12	"I just wanted to say that hopefully sometime in the future I will get an entwife that would just be the coolest thing ever. 
Well have a nice day! "	t5_2s7a6	True
1338352371.0	ubmsp	Ent 'n Entwife prepping for a wedding!	EntAlterEgo	68	5	4		t5_2s7a6	False
1335875823.0	t1foa	When your dealer finally texts you after being dry for two weeks.	_honeybird	64	2	1		t5_2s7a6	False
1334763466.0	sg4sh	i may get fired today	trippingdoozer	70	9	27	"On Friday I accidentally charged a woman for conventional asparagus instead of organic asparagus. She brought it to my attention, and I apologized and told her I'd be happy to keep it at the conventional price but I could also void it off and charge her for organic. She said she wanted to be charged the higher price, so I complied. 

Monday my boss pulls me aside and tells me that they received a complaint from her about not being charged enough for asparagus or some apples (conventional vs. organic prices). I tell my boss the story and that I don't remember anything being said about the apples, but I would have fixed those too. We leave it at a 'cool, just be aware of that problem and look to see if a product is organic or not rather than assuming'. I had already started doing that, so I wasn't that concerned and just thought it was pretty funny that a customer actually complained about not being charged enough at a place that is frequently referred to as Whole Paycheck. 

Yesterday my boss has me log off my register early because the complaint was sent to store management and they want me to write a statement about what happened. After I hand it in I ask if I'm going to be written up and he tells me he doesn't know what they plan to do. 

I used to work in a different department where the boss hated me and wrote me up for some complete bullshit that put me on a final warning. This means if I get written up before June I lose my job. There's nothing I can do to defend myself against this.

TL;DR I didn't charge someone enough money, she complained, and now because a former boss hated me I may lose my job."	t5_2s7a6	True
1326222071.0	ob59p	Babysharing my little men! 	Booperelli	67	5	7		t5_2s7a6	False
1322850524.0	mxs2f	You might be an entwife when...	kitkatkitkat	63	1	60	"You clean lipstick off your bong.


I was just doing that and lol'd

READY? NOW YOU GO! "	t5_2s7a6	True
1314731694.0	jzcce	Not sure if you ladies saw this, but these purses are super cute. I ordered the small pleated tote... :)	SwisherRolledTight	79	18	13		t5_2s7a6	False
1311044665.0	itg67	Everything is just better naked.	poopylemoncat	62	5	32	Ya feel me, ladies?	t5_2s7a6	True
1376700540.0	1kiv88	Hmmm... I'm going to want this in about 5 minutes. ;) Happy fucking Friday, ladies. &lt;3	ameliorates	71	9	3		t5_2s7a6	False
1375302236.0	1jg14i	Need to rant, ladies... birthday was yesterday, complete disappointment...	Ravara	68	5	21	"Hey ladies... just needed to vent somewhat. 

So I turned 23 yesterday. I've had a hard childhood and birthdays haven't been important to me, because it hasn't been important to anyone else. I've been in a relationship with my ent for the past 2 1/2 years or so. On my 21st bday, didn't do anything. He had to work all day and night, so I understood and wasn't too upset. 22nd bday, he had to go to orientation at his new college, so that was fine. 23rd bday, we're living together now, are kind of in a bad situation (both unemployed, just trying to get on our feet). So, all I wanted for the day is to relax and enjoy myself at home. All I wanted. I even gathered the energy to go buy myself some weed, cotton candy hookah tobacco, alcohol, and a mint creme pie to serve as a half assed bday cake. 

So we go and get these, put everything away, and he starts making dinner and stating we have to talk. We have both been procrastinating with things and that was the subject. I've always been a very independent person, and tend to get a little offended when people tell me how I should be living my life. HE has the tendency to channel his father during talks and comes across as very condescending. Basically, ""you're 23 now, what are you doing with your life, you have no goals"". Which I do. I stated ""I've always been a very independent person"", and he responds, without missing a beat, ""Well look at where that's gotten you."" I was pissed and left the room. We talked over it after he followed me, but I didn't know what he wanted me to do RIGHT THEN to make him fucking satisfied. All I wanted to do for THIS NIGHT IN PARTICULAR was to ENJOY myself. 

That ruined EVERYTHING. 

I was sick was anger and refused dinner to go take a long bath to unwind. Didn't help much. Smoked a bowl with my ent while pretty much ignoring him, to see if that would help me get over it. Nope. A night full of hookah, weed, alcohol, pie, and movies was nonexistent. Now I'm here crying, finally releasing my frustration. I was up until about 3-4 upset, trying to read and fall asleep. I know he feels bad but I don't think he realizes how much he hurt me. 

Well, here's to the hope of an acceptable birthday NEXT year. 

Also, got an email this morning stating I didn't get the much needed job that I thought I had for sure. 

Thanks ladies for listening. Take a toke for me."	t5_2s7a6	True
1374859712.0	1j3x3k	It's Friday. (x-post from r/blackpeoplegifs)	morningwarriorcat	73	15	8		t5_2s7a6	False
1374441451.0	1irqq3	Deeply regretting not getting this at Hallmark earlier. Gonna have to go back!	syrianhamster	67	4	3		t5_2s7a6	False
1372461906.0	1ha41g	was struggling to screw the lid on my water without looking at it. till I looked at it. haha, oops.	iSpellGood	69	10	11		t5_2s7a6	False
