created_utc	id	title	author	ups	downs	num_comments	selftext	subreddit_id	is_self
1314759946.0	jzs4j	shaving your legs while stoned [also posted in r/trees]	kristinananana	97	11	17		t5_2s7a6	False
1374357956.0	1ipuaj	One of my favorite activities is to get baked and then bake. Here are my raspberry and blueberry-raspberry turnovers, from scratch!	MidgeMuffin	97	8	10		t5_2s7a6	False
1370220761.0	1fjurl	I saw that you like garage sales. I work at a thrift store.	xNeyNounex	93	9	4		t5_2s7a6	False
1368561646.0	1ec31u	So, [6]. Let me tell you ladies something..	hell0missmiller	93	5	13	"So today is my first scheduled day off of work in three weeks.

1. Slept in until 11
2. Took care of some stuff that needed attending to (finally..)
3. Made breakfast with my man (college student and we really splurged--bacon, sausage, pineapple, cinnamon rolls..)
4. Been kind of bummed for the past couple of days. A good friend of mine recently passed away and I'm all out of whack because of it. So, like any ent/entwife would do, I'm smoking to cope. 
5. Boyfriend has kind of given me my space, but insisted that I pack the vape while nude. Of course I obliged..
6. Ended up smoking and having the best sex and orgasm that I've ever had in my life. Literally. 
7. Not sad anymore.

TMI, I know. I just know that there's going to be someone on this sub who will appreciate having a much MUCH needed good day. 

I hope each of you are having an equally awesome day. Toke up! :) [8]

Edit: I just want to say that I love you /r/entwives. You are sincerely some of the nicest ladies out there. Thank you for your kindness &lt;3"	t5_2s7a6	True
1367965243.0	1dw40j	So mad I can't breathe!!!!	nfmadprops04	110	25	53	"SO FARRAH ABRAHAM MADE A MILLION DOLLARS OFF HER SEX TAPE! Seriously?! What the hell is wrong with this country? Are you fucking kidding me?!!! I went to college. I got a degree. And she gets knocked up at sixteen, put on tv, and is now a millionaire? How am I supposed to raise my daughters in this country now? Like, seriously?

What's the point?

 It makes me fucking sick.

EDIT: I in no way meant to slut-shame anyone. I am just disgusted at the amount of money she got paid for the video because she, you know, hasn't done anything except get pregnant and apply to be on a tv show where she got paid $120,000 a year for it."	t5_2s7a6	True
1359313408.0	17dp0t	The Ent and I recently made cannabutter. Here is the process we followed (complete with pictures)! I hope this can help you ladies make your own (and of course feel free to ask me/us questions!)	Cerridwenn	91	5	10		t5_2s7a6	False
1359071004.0	177ztp	My little bunny man, Phoebos, sitting in my lap and cheering me up after a hard week and a bowl. Sharing time, ladies, show me your little buddies! Let the cute lift the mood :)	FourPartFox	91	6	43		t5_2s7a6	False
1347526316.0	ztblc	Unknot your knickers! We all have shit days. Instead of complaining, I'm going to share my new stash box. 	JessicaMaple	96	10	11		t5_2s7a6	False
1343969862.0	xlthd	Ladies, after a 2.5 month break due to a summer internship,  I'm proud to say I'm high as fuck.	Mirror23	91	8	6	Just wanted to share my good news :)	t5_2s7a6	True
1327550251.0	ox48k	It's my cake day! Here's my girl Roxy! 	brandnewedgarsuit	98	7	2		t5_2s7a6	False
1327329687.0	osw0f	sitting in the shower at a [6] - try it, fellow entwives :) [x-post from r/trees]	itsaboutthyme	92	6	26		t5_2s7a6	False
1319672741.0	lqbjk	It has been one of those days, girls. Here's to you, EntWives 	TimsGirl2006	89	2	17		t5_2s7a6	False
1316363603.0	kjlil	I think you ladies would appreciate this as well.	stphni	94	6	12		t5_2s7a6	False
1375890508.0	1jw0vy	I love the view of my garden in the morning	cupcaketaybay	96	11	15		t5_2s7a6	False
1367339137.0	1df37i	I've stayed close with a bunch of ents from my freshman hall. We're seniors now, and last Friday was our last day of classes. One friend, an Eagle Scout, made us all these bracelets. I'm so touched and sad to be leaving such a tight-knit circle of ents.	clitzpah	92	6	2		t5_2s7a6	False
1362760330.0	19x2ku	After seeing an entwive's upcoming wedding, I couldn't stop thinking about my own ENT. Here he is on our wedding day. Show us your ENT, ladies!	COCOnizzle	90	8	79		t5_2s7a6	False
1360021931.0	17wcu6	My ent roommate got this for me...I've got mail! 	ArdorAdrift	105	16	5		t5_2s7a6	False
1359566077.0	17kiyk	So Happy!! 	g0g0_yubari	89	5	14	We just closed on our house. We are home owners now. My FI and I had been looking since July and we saw 58 houses... so it is a big relief to finally have this process over with.. Now time for the celebratory smoke with you ladies!!! :) 	t5_2s7a6	True
1352229692.0	12qtm2	My new pipe from sweet pickle glass came in :) I've named her Aurora. First bowl is for you fellow entwives	bluebebe	98	15	9		t5_2s7a6	False
1346019558.0	yveod	my summer? i decorated lighters, a lot of lighters	carlye_renee	96	13	12		t5_2s7a6	False
1345210114.0	ydix6	my girlfriends &amp;&amp; i didn't wanna get our hair and makeup wet last night! :) you guys have any fun group photos you wanna share?	daytr1pper	92	7	12		t5_2s7a6	False
1342132194.0	wgtcs	And I wondered why the clerk stared at me... [7]	kiltsaresexy	107	21	9		t5_2s7a6	False
1339918919.0	v67kn	What's on the agenda for tonight? Purple nails, Rocky Horror and trees.	RetrOctober	94	10	18		t5_2s7a6	False
1331774818.0	qx3gq	For all of the expecting Entwives ...thought you might get a kick (or ideas) out of this. Super cute!	sexykitty	99	14	7		t5_2s7a6	False
1330181912.0	q5gxm	Yesterday a secret admirer sent me flowers and a love letter.. and I have NO clue who it was!	perplexia_majora	89	7	10		t5_2s7a6	False
1373408165.0	1hyrhd	THEY KNEW!	llamabooks	91	6	6		t5_2s7a6	False
1352907117.0	136mv7	This always makes me giggle.	kujuh	92	4	2		t5_2s7a6	False
1345187075.0	yd770	My best frient and I drove out to see the meteor shower last weekend, and it completely took my breath away. Here is my favorite picture of us toking. [8]	Human-Being	89	7	1		t5_2s7a6	False
1342023381.0	we2j3	We set the date!! :)	hullobirdy	98	9	23	"Hey ladies, hope everyone is well :)
Last night my ent and I decided to set the date for our wedding, 4/20/13! Anniversary bowls for life! Our family is gonna think we're goofballs, but I did want to incorporate a lot of quirky details and this one is my favorite by far! Just had to share my excitement :3"	t5_2s7a6	True
1339078935.0	upsji	IDK how high I was... Ladies, your opinion?	whoknowsifitsmeornot	88	6	23	"We've just moved in the past month and our new house is surrounded by woods, which is great for us, but it's not so great for the bugs. We are spraying this weekend so we can get the animals out before we spray, but until then we are roach killers extraordinaires. My ENt&amp;I have been dry for about a week or so. Last night I score us some killa. Three rips and I'm in the shower (because everyone knows showering high is amazing and if you don't, you betta aks somebody..).
So again, I'm high, in the shower and out of the corner of my eye I see a freaking roach crawling on my chest!!!?!?! I totally freak and slap the shit out of my boob, only to realize... the ""roach"" i though I saw was my areola. Holy shit I was high. "	t5_2s7a6	True
1334445225.0	sa3gi	A Bride and Groom I did today. Boss liked it so much it made it to the front window! Huzzah!  	IAmDubSteph	89	4	2		t5_2s7a6	False
1331313839.0	qp3hx	Re-upped last night, and my non-ent bf had made this face when the smell came from my pocket as I walked passed him.	Cmdr_Taw	95	11	11		t5_2s7a6	False
1329358556.0	prnxy	For the classy entwife, I wish I could buy all of you this Tiffany Key ring.	emsosweet	86	1	5		t5_2s7a6	False
1318584035.0	lbvyc	Not sure if its a repost: but thought you gals might have a laugh	HighGed	96	12	7		t5_2s7a6	False
1371614051.0	1gmtc9	Best day ever!!	The4mccoys	91	6	32	"Warning, might be a little long!

My son who is 5 1/2 is high functioning autistic. His name is Charlie. This past year he has made leaps and bounds and is doing amazing. This past week he has really started to come into his own and really show he has an opinion. Yesterday while getting ready to take him to his summer camp- Farm school- I put his things in a new tote I had made for him. He looked at me and said ""mom, where's my back pack? All the kids will have back packs and I want mine too."" I stood there a little stunned and then as a tear ran down my cheek I helped him find his back pack and put his stuff in it. I went to put his lunch box in and he said ""mom, I will carry my lunch box, just like the other kids."" And the flood gates opened and I did the happy cry while telling him sure and zipping up his bag. 

This was an amazing thing to experience and when I told my husband he teared up a little and told Charlie what a cool kid he was. So tonight I am laying in bed, listening to my husband read the kids their bed time story (Harry Potter), when I hear the following conversation take place.

Charlie: Dad, I have a question.
Husband: What is it buddy?
Charlie: What's your favorite color?
Husband: I like Blue.
Charlie: why?
Husband: I don't know, just always have!
Charlie: Dad, what's your favorite food?
Husband: Anything mom makes! I like it all! 
Charlie: But what?
Husband: (names off several dishes) What's your favorite Charlie?
Charlie: Muffins!

OMG ladies!!!! OMG!!!! This is THE first ever full on conversation we have ever had with Charlie. This is the first moment he has EVER asked a personal question. He has never asked or done anything like this before. I am laying in bed just crying, listening to his sweet voice and the simple conversation he is having with his dad. This is such a huge moment for us. I want to remember this moment forever. "	t5_2s7a6	True
1369276080.0	1evn6u	Found and bought the car of my dreams...	natonya	94	10	22		t5_2s7a6	False
1364578977.0	1b94sn	Do you burn candles, or use incense? Here's my new incense holder.	entgardener	87	4	36		t5_2s7a6	False
1354826794.0	14eid1	Got the call!! 	g0g0_yubari	90	9	8	My wedding dress just came in!! I'm so excited! I can't believe it came this early, I wasn't expecting it til February.. totally made my day and I just had to share with my entladies! :) 	t5_2s7a6	True
1342807639.0	wvv36	My usual breakfast is a bowl of cereal. I think I like this wake and bake thing :)	shmoopie313	85	1	11		t5_2s7a6	False
1341944722.0	wc8qv	Smoking on your period...	asksteevs	98	15	23	is the best. My cramps are awful and my boyfriend and I had a huge talk last night (too confusing to explain). I started my period this morning and I'm cramping so bad. So I'm smoking a bowl and trying to relax. It's been a rough few days, and I finally feel relaxed. Right now I'm thankful that my cramps are drastically lessoned right now and that I'm off work today. Yay trees! That's all, entwives. Thanks for reading if you did! Have a nice day!	t5_2s7a6	True
1339208077.0	usl8o	When a girl just needs beer &amp; nachos 	Moonbeam108	94	6	8		t5_2s7a6	False
1335390437.0	ssgmq	Cat, Xbox, Wine and Chillum.. The cure for a less than awesome day...	Kaydye	91	5	9		t5_2s7a6	False
1331672457.0	qv3k9	What I love most about this gif is how well it is made. Making good gifs are hard! Well done, whoever made this. :) 	burzment	88	4	6		t5_2s7a6	False
1310481249.0	infih	Hold up, is this any of you?? (x-post from trees)	mantralicious	95	11	8		t5_2s7a6	False
1376596595.0	1kfudv	For the wine loving ent wives.	whyunogivemegoodname	100	18	10		t5_2s7a6	False
1375471141.0	1jkz3i	This advertisement is a little controversial but I found it funny as hell	jkil1127	95	9	23		t5_2s7a6	False
1373945327.0	1ie08k	Mary Jane meet Aunt Flow	cinematicheart1	93	9	26	Do any other female ents find it soooooo relieving and relaxing to smoke during that time of the month? Because it's seriously evening out my mood swings and getting rid of my cramps like no other. I'd so rather smoke than take pain killers.	t5_2s7a6	True
1373045735.0	1hp93x	So, I did a project. And I like sharing stuff with you guys. So....Here.... :D	Mrs_R0ck5tar69	92	8	13		t5_2s7a6	False
1364390306.0	1b3w8u	I got so stoned...	greenwomanoftheriver	92	8	35	"I bought pork tenderloin for a ""passover"" dinner.

What are your ""I got so stoned"" moments?"	t5_2s7a6	True
1356947079.0	15pv8z	Painted my NYE mani at a [6] and I'm happy with it! (xpost r/redditlaqueristas)	meganaudrie	93	12	3		t5_2s7a6	False
1354380102.0	143vip	Saw this on /r/trees. This is exactly how I feel everyday as a single female ent 	TheJester220	97	12	7		t5_2s7a6	False
1323144116.0	n228g	Look what my mom gave to me!	hannah_petey	94	13	10		t5_2s7a6	False
1322596599.0	mtp5w	My little man.	pashafisk	87	7	17		t5_2s7a6	False
1374340820.0	1ipbq7	Today is the only day I'll ever turn 23. Me and my mom baked, and then she baked me this cake!!! :) Here to share it with you lovely ladies~	HAIYAWATHA	94	13	32		t5_2s7a6	False
1374276814.0	1inyb0	That feeling when you order cheap stuff on amazon high and realize it won't show up until next month.	hanstalhoffer	98	17	30		t5_2s7a6	False
1373774372.0	1i9aiy	"""Your Highness...."""	pepperpopcorn	86	7	26	"I feel like when we're high we should get to wear tiaras, then address each other as Your Highness. That would make me happy :)

Edit: I just want to thank you guys for being so awesome. I posted this at a 9 last night while hanging out with my entwives friends and I just wanted an excuse to wear a tiara. "	t5_2s7a6	True
1371931690.0	1gvdxj	I don't have a stoney dog, but I have Oliver Muffins who acts stoned 90% of the time anyways.	Drunk_CrazyCatLady	91	10	3		t5_2s7a6	False
1368986893.0	1en45l	First Fucking Grown-Up lunch...at 31.	natonya	88	7	6	"I did that. Today! With my husband.
Today at 2:52pm on a Saturday, we were sitting at Grinder's, talking, laughing, drinking and high as mother fuckers. Better yet.... WITHOUT OUR CHILDREN!

It was our first Saturday DAY date since we were 18/17! 

The day just got better and better.
Ending with workaholics and ben&amp;jerrys Pistachio Pistachio! Thank you baby Jesus! "	t5_2s7a6	True
1357094674.0	15sxh3	All my pipes are octopus themed, but my MFLB was feeling left out... sharpies to the rescue!	metaljellyfish	90	10	11		t5_2s7a6	False
1351655068.0	12dpv3	The newest Disney Princess. 	kitkatkitkat	93	8	11		t5_2s7a6	False
1350670539.0	11rcf1	I just want to tell each and every one of you, that you are awesome.	kujuh	95	10	18	"I've been part of this amazing community for some time, and today I've been scrolling and scrolling, reading a TON of posts, laughing with you and even crying with you every now and then. It's so great to see such a wonderful group of women, when there is so much hate and ignorance in the world today. 

I love seeing your smiles. I love rejoicing with you over a new job, piece, lover, or WHATEVER it is. 

I don't have many girl friends, and my sisters all live far away from me. Thank you for lifting me up when I'm feeling down. I love you! "	t5_2s7a6	True
1341374489.0	w0ke5	As a veteran, wishing you a Happy &amp; High 4th!		93	9	17		t5_2s7a6	False
1341276518.0	vycdu	True story. 	kiltsaresexy	91	6	2		t5_2s7a6	False
1340646403.0	vky5a	Don't have an ent of my own yet, but I just want to say...	starkind	87	4	29	I love you gals a lot. You guys always brighten my day, out of all the tree-related subreddits. I hope everyone has a fantastic Monday, and a great rest of the week as well! :)	t5_2s7a6	True
1334873190.0	sijr8	A beauty tip for fellow entwives!	whosername	89	6	16	I usually carry a pack of blotting papers (to reduce shine/try to make myself look presentable after running to catch bus etc)  but realized I was out when I caught a glimpse of my super-shiny self in the mirror at school. I had a total MacGyver moment and used a rolling paper instead! Zigzag was just as good as the Sephora ones I'd been using and cheaper!! Thought I'd share!	t5_2s7a6	True
1359138076.0	179n3i	A rant at a [0]	bride_of_dankenstein	86	3	24	"2 1/2 years. The longest relationship I've ever been in. In these 2 1/2 years, I've had 2 suicide attempts. One taking a whole bottle of my anti-depressants [ironic] and the other by drinking Comet, a hard cleaner. I've went from cutting, even carving the word ""fat"" onto my stomach, to burning, to pulling out fistfulls of hair, to leaving bruises all over my body. I've been called worthless, a whore, deformed, ugly, fat, even so far as to going in detail about my competition. We would have fights. Big fights. Why I didn't believe in god, why I didn't fight back harder against my rapist [he was another boyfriend I dated for 8 months at the time], how I destroyed his family and friendships. How everyone hated me. How I should be ashamed of my pansexuality. How I should get over my jealousy. How I should let him drink, even though he was a mean, mean drunk. Even after he pushed me into a towel bar and left a bruise on my backside, I stayed. 
Well I don't want to stay anymore. I don't want to feel worthless anymore. I don't want to have to keep worrying about if he's finally drank himself to death and is left in a gutter somewhere, or still talking to his ex, or making out with some pregnant black girl because her boyfriend is abusive. 
I want someone to be proud of me. For supporting my parents, for working 3 jobs. I want to be respected. I want to be loved and cherished. I want to get presents for my birthday, for Christmas. I want to feel pretty. 
 So toke one up for me, lady. My pipe that he bought me broke. 

tl;dr: You are beautiful and you must never forget that you are a princess. 

Edit: Thank you all for such amazing words of kindess. I really, really appreciate it. If any of you ladies in WV, I'd be honoured to toke with you &lt;3
"	t5_2s7a6	True
1357116202.0	15tgeb	I got blazed as fuuu and painted my nails for 4 hours!	hanstalhoffer	92	13	31	"[They turned out awesome though.](http://imgur.com/a/1NRuu) I started at like 9 and when I looked up it was 1am! Time to smoke another blunt.

What are you ladies up to this fine evening/morning? Happy New Years btw!"	t5_2s7a6	True
1355288339.0	14pke0	First round of customized lighters (not complete).	kobayashimaru13	91	13	6		t5_2s7a6	False
1355207746.0	14njgu	Check out the clasp on my favorite necklace	psycho_hose_beast	92	10	5		t5_2s7a6	False
1354805473.0	14dvby	Happy Legalized Day Washington!	greenwomanoftheriver	87	7	5	All the entladies celebrate! (As long as the weed you are smoking was found on the ground or fell out of the sky. That's our story and we're sticking to it!)	t5_2s7a6	True
1338056914.0	u68vh	My new smoking buddy decided my tummy was a perfect spot to nap.	Edward_Seakitten	92	8	7		t5_2s7a6	False
1333738494.0	rwog1	It's on.	thoughtbubbles	89	5	10		t5_2s7a6	False
1331036010.0	qk29p	What happened when I asked my s.o. to hang my shirt.	yabbadabbaderp	100	17	26		t5_2s7a6	False
1323330872.0	n4lsa	2 years ago today I lost my virginity	hmskowronski	95	15	10		t5_2s7a6	False
1367035415.0	1d76ts	Hello Entwives! I achieved something I never thought possible this month and I feel like sharing my excitement!	sjmartin12	86	5	13	"So this year has been a pretty tough one. I struggled with depression. In July my dad died of cancer, two days after he died my mom found out that he was cheating on her, my long term boyfriEnt and I split up while his father was going through chemo as well, and all the while I've been having to look after my mother who struggles with anorexia. I can honestly say that weed kept me sane through this whole process!
But recently, life has improved so drastically and so much has happened! After a long hiatus from studying theatre at my local university, I managed to get a role as a pinup model in a new play that just premiered in March. It was such a great confidence booster, and I rediscovered my passion for performance again, that I had lost over the years due to fear and self doubt. 
Around February I had started writing little bits of comedy material and jokes in my spare time, never having the guts to really perform stand up comedy. I always found that whenever I got stoned at home in the mornings before I would work my night shifts, I would think of insightful, and sometimes absurd jokes that would make burst into laughter on my own. 
Well, just three weeks ago a friend of mine who is involved in theatre encouraged me to perform at an open mic at a comedy club. I was terrified at the idea of it, but somehow I mustered up the courage to do a five minute set. I was the only female performer, amongst fifteen male comics, many of whom were professionals. And I still have no idea how, but I ended up totally rocking the performance.
After the show, I was invited to compete in a comedy competition the following week, by a bunch of the comedians there. And by some kind of miracle, I WON FIRST PLACE! Now I'm off to the finals next week and I have a chance at winning 500 dollars! My newspaper wrote an article about me, and I hosted an open mic night at another comedy club.
Never had I ever dreamed that I could be funny enough to be a standup comic! And now in such a short amount of time, at the young age of 20, and thanks to the help of my good friend Mary Jane, I seem to be doing it. 
It's scary as hell, and as a young female in a male dominated society, I get really overwhelmed by it all, but I also feel very empowered. I got my sense of humour from my Dad. He would have been so proud. "	t5_2s7a6	True
1355972417.0	155a6e	merry fucking Christmas to me! nsfw	sheelaymignon	104	22	9		t5_2s7a6	False
1355689259.0	14ydwh	"My trees-oblivious grandmother gave me this ""really pretty vase"" as an early Christmas gift :) Suggestions, ladies?"	nfmadprops04	87	10	23		t5_2s7a6	False
1351114453.0	121205	Getting creative with my nail polish at a [6]. (x-post from r/trees)	LaahTeeDah	91	6	6		t5_2s7a6	False
1349155245.0	10sxc2	My first kitty! He still needs a name. 	Sometimes_Why	88	7	56		t5_2s7a6	False
1338826045.0	ukcz0	Arts and crafts	Fuzzyfozzybear	85	3	4		t5_2s7a6	False
1335002333.0	sl3zr	The best 4/20 gift I could possibly give myself - a completed dissertation and an evening with the last of my bag!	bluefactories	84	5	17		t5_2s7a6	False
1331841563.0	qy91n	ENTWIVES! I JUST GOT MY DREAM JOB!!		90	8	26	"I moved to a new city just a few months ago and worked through temp agencies for a while, but today I got an offer from a company offering me my DREAM job and I am so excited to start! Just wanted to share this moment of unadulterated joy with all of you!

I love you all! Eeeee!"	t5_2s7a6	True
1326080001.0	o8szj	Painting nails.	Natsuu	83	5	10		t5_2s7a6	False
1324591157.0	nn4tq	My Entwife Secret Santa made me an amazing TARDIS notebook (plus bonus kitty stickers)! Thank you Leah!		91	9	3		t5_2s7a6	False
1314680589.0	jyr4n	Squilliam Fancypants, Squilly for short	debbiegirl364	84	4	13		t5_2s7a6	False
1372604135.0	1hd76s	My Day in the ENT Life :)	yokayla	88	8	18		t5_2s7a6	False
1370998720.0	1g5wrc	I made both bracelets, but also the pendant on the top one which I am super proud of! what do you ladies think?	greenerisgrass	88	13	22		t5_2s7a6	False
1368029891.0	1dxt8g	The am I pregnant or not results are in......	atoadmin	97	18	33	If you finally started your period, clap your hands! Clap clap! If you finally started your period, clap your hands! Clap clap! If you finally started your period, then your panties will surely show it! If you finally started your period, clap your hands! Clap clap!	t5_2s7a6	True
1366895792.0	1d2wng	It seems like a Wednesday pets show-off day. Here's my baby, David, my pretty princess- we spent our 18 years together until last Monday	myowmyow	88	6	9		t5_2s7a6	False
1366497582.0	1crmqm	I GOT A JOB.	Cmdr_Taw	85	7	21	I GOT A JOOOOOOOOOOOOOOOOOOOOOOOOOOOOOOOOOOOB OMG	t5_2s7a6	True
1361738243.0	195daa	I picked up a new hobby two days ago. While this is not perfect or even finished, I'm still really proud of it and I couldn't wait to show you lovely ladies. Also my first post on this sub.	Borchiki	95	17	21		t5_2s7a6	False
1353806321.0	13qm64	Saturday evening mani. 	JustCallMeCheese	90	9	20		t5_2s7a6	False
1339542151.0	uysfc	Just another summer night	itsrubiboobie	88	13	12		t5_2s7a6	False
1333820041.0	ry27z	This always seems to slip my mind...	BYAHBYAHBYAH	92	15	14		t5_2s7a6	False
1327107137.0	opm4b	First World Entwife Problems	Stellaaaaa	83	4	14		t5_2s7a6	False
1327078767.0	op0io	Entwives 4/20 Gift Exchange?	amyfarrahfowlerphd	87	10	60	"In light of the other topic inviting this subreddit to take part in their gift exchange, why don't we do our own for 4/20? 

Maybe we could get redditgifts involved?
Bueller?

Edit: Wow! So many responses! Ok... so... where do we start?"	t5_2s7a6	True
1323642394.0	n8w0e	anybody seen tangled? meet pascal :)	justjumpit	86	7	8		t5_2s7a6	False
1312604022.0	jaivy	I bought my entwife some entwine tonight! (xpost from trees) 	lookatmybrain	81	1	11		t5_2s7a6	False
1310756912.0	iqo0q	Lady Ents, I water marbled my nails today and they ended up looking pretty psychedelic :) [4]	puddlecity	88	7	21		t5_2s7a6	False
1301604936.0	gfteq	can i get some love, ents? my beloved cat maryjane passed away this morning :( 	fuckyoushima	84	7	12		t5_2s7a6	False
1370682806.0	1fx3dz	A toke and a tan	LilRed11	82	6	13		t5_2s7a6	False
1368496216.0	1eabyw	My favourite neighbourhood smoke spot with my best buddy. Anyone else love biking with their dog?	Vietmam	84	3	23		t5_2s7a6	False
1368279884.0	1e4lmu	I thought you all might appreciate my new bracelet (made in the US with recycled materials!)	anti_entity	89	12	10		t5_2s7a6	False
1367963007.0	1dw0zq	My frient and I got high and worked in the flower bed. Any of you guys garden?	atoadmin	82	4	24		t5_2s7a6	False
1367434878.0	1dhyos	May I present my new friend, Piggy Wiggy	HollyDolly12	84	6	14		t5_2s7a6	False
