created_utc	id	title	author	ups	downs	num_comments	selftext	subreddit_id	is_self
1354865539.0	14fnfy	worst feeling ever!	sheelaymignon	65	11	8	"I'm done with work. my belly is full. I've taken all my clothes off, and tucked in for the rest of the night, to watch tv in bed. I go to pack my bowl. 





THE LIGHTER IS ON THE DRESSER. 

and the floor is made of lava. icy lava. with shards of glass. and my room is suddenly a million miles wide.

HARK! a wild boyfriend! surely he will help this damsel in de-stress?



to be continued..."	t5_2s7a6	True
1353640594.0	13nf1b	Snuggling with my dog after his steak &amp; bacon thanksgiving. Everything was homemade including the greatest pumpkin pie. 	Miss_rampage	65	9	9		t5_2s7a6	False
1347934893.0	10237y	"A little Panama Red in my brand spankin' new ""Day of the Dead""-esque jar :)"	AphroditeAndTheXbox	63	6	4		t5_2s7a6	False
1346725897.0	zbcge	first time the husbENT introduced me to BHO dabs		64	8	6		t5_2s7a6	False
1343195630.0	x49uo	I found a new use for my birth control pouch!	asksteevs	59	2	6		t5_2s7a6	False
1340743001.0	vncdo	"While handing him the bong- he says to me, ""Paint me like one of your French girls."" I lost it. "	whatsameow	62	3	3		t5_2s7a6	False
1339889991.0	v5ony	"I'm really starting to enjoy these clear ""papers"". "	KleptoKelly	59	1	16		t5_2s7a6	False
1339181532.0	urz1q	my target scores! 5 bucks each ^.^ 	victoriatx	61	8	5		t5_2s7a6	False
1336873525.0	tkemn	Gave myself an early mother's day gift :)	Fuzzyfozzybear	65	6	15	"On Friday I had my Fallopian tubes vanquished :) I am so so happy to have that stress or pressure of having another minion. My minion is almost two, and plenty enough child for me to handle! My husbent had originally opted for vasectomy, but we were warned that long term studies are showing increase in erectile dysfunction :( so that wasn't an option for us (defeats purpose of being sterilized!). 

My reasons are many but my number one is providing for my son. And even more so, we would want to adopt should the desire to add to our family ever hit. Highly unlikely, but never say never! 

So toke one for me, and two for my Fallopian tubes. It's been fun, it's been real, it's been real fun. But as my dr said, she burns those suckers ""from stem to stern"" :) and for that I will be making her red velvet cupcakes! 

Edit: another motivator for me is the fact the US government wants to have a say on my reproductive system and I am sorry but a room full of old men who think they know my body better, big middle finger to those dudes. Thanks for the love beautiful entwives, I am almost back to 100% and can't wait to be cleared for sexy time! ;)"	t5_2s7a6	True
1331446420.0	qr944	My dragon made of balloons. 	IAmDubSteph	59	5	6		t5_2s7a6	False
1325629091.0	o1mw0	Had a sudden urge to post this &lt;3	Cawstewow	64	5	21	"Just wanted to say that I love you gals! I don't post on here much, but I love seeing your posts on my Front Page every day :)

I'm thinking of each of you right now and wishing for wonderful things in 2012"	t5_2s7a6	True
1316898497.0	kqbeq	I just needed somewhere to vent my sad :(	crookedspoons	62	6	58	"my ent and I are no longer together, and it's totally my fault, I admit that. I now have no other ents nor entwives to chill with, and have been without herb for 2 weeks, which hasn't been too bad, but I've had a lot going on, and miss being able to eat regularly and sleep at night, which le ganja really helped me with. I have no idea when I'll be able to toke up again, cuz my current roommate isn't an entwife, and is completely against my smoking, and said she would turn me in if I ever had any in our place :( I guess the point is to toke one up for me, ladies.

TL;DR: I have no ent, no IRL entwife, and no herb, and I'm a sad panda :/"	t5_2s7a6	True
1313951936.0	jpt8e	It's raining outside.  Good thing I have all my necessities. [8]	BlackLotusDutchess	61	3	13		t5_2s7a6	False
1313080216.0	jftcn	I had a Grandma's Boy moment x-post from treecomics	SwisherRolledTight	62	4	8		t5_2s7a6	False
1305731343.0	he8xg	I met a guy c:	OrganicSprout	61	5	10	"Well, he met me. I work in cell phones, and after signing him up he gave me his number. Asked me for drinks sometime! It was crazy! I gave him a call not long later.

The first date was fantastic. He brought me flowers, pulled out my chair, insisted on paying for everything. Not to mention we got along really well. We have a bunch in common, and he even tokes! And drinks. And various other things.

BUT. We've hung out a whole bunch since then. It's going really well. It was so sudden and so fantastic that I'm just really happy. I think this is going somewhere.

I'm not going to be alone anymore :)"	t5_2s7a6	True
1291865405.0	eip70	DAE get SUPER horny while high?	soowet	63	7	47	"I swear  I can't control it. Every time I smoke I just get really, really horny. I'll just suddenly get wet out of no where and crave sex. I also have the most amazing mind-blowing  orgasms ever when high, too. 
Hopefully the batteries in the vibrator are charged!"	t5_2s7a6	True
1375557564.0	1jn1nz	Pig roast, entwives style! Any western wa entwives are invited!	volcomchk143	68	9	14		t5_2s7a6	False
1374331375.0	1ip2f8	When your sapling wakes you at 7am it's wake and brew. (Ent mug courtesy of u/KeepInKitchen)	jheint	63	9	10		t5_2s7a6	False
1374195715.0	1ilmxx	lately I love making friendship bracelets when I'm high :)	cactusbrandy	64	8	23		t5_2s7a6	False
1373264223.0	1hul20	I've been here for 10 minutes, and I already love all of you.	shinyisyourheart	62	5	16	I feel so at home here! It's so nice to see other lovely ladies into trees the way I am :) Keep on toking my friends.	t5_2s7a6	True
1371953264.0	1gvyxe	Ladies, my days of being dry are limited! My First grow, Green Poison Auto! [This is my husbands hand lol] 3 weeks left!	Trichkitty	61	6	9		t5_2s7a6	False
1370470527.0	1fr1uv	We're doing it! Details for A DAY IN THE ENTLIFE posted here!	twerkitout	61	7	27	"Get it, entlife? Like entwife? Harhar! I'll be here all week, folks!

No, seriously. Here's the plan:

1. Over the next week, take photos of your day. I know some of you wanted to do weekends and this way we can each decide what type of day we'd like to share.

2. Put 15-25ish of your photos in an imgur album (if you are worried about privacy strip the metadata before you upload them, even though imgur does this it's not a bad idea to strip them before they even get there). 

3. Next Wednesday, I'll post a thread that you can comment on with your imgur album links. *Please don't flood the front page with day in the life albums.* 

I haven't yet decided if voting should be done by upvotes or if we should do something externally so downvotes don't become an issue. What do you think?

I'm overwhelmed with the response to this so far and I am to excited to see what you babes have to share!

TL;DR Your mission, should you choose to accept it, is to document one of your days in the next week and then post it in 7 days in a communal thread. Godspeed. ;)"	t5_2s7a6	True
1370137669.0	1fhvw3	Broke my boyfrients bong the other day. Surprising him when he gets home from work!	justdowntheroad	57	3	4		t5_2s7a6	False
1366247103.0	1ckp5r	[WWP] the wettest pussy you'll see today	FoxesRidingHorses	64	8	9		t5_2s7a6	False
1365823308.0	1c91ct	[7]You know you're an Entwife when...	kiltsaresexy	60	3	16	"...You're holding a joint to your friend's mouth for her because she's doing her nails. 

It's also how you know you win the best friend award...hehe.

What moments in life make you think, ""Yep...I'm an entwife..."""	t5_2s7a6	True
1352092880.0	12njjc	Had a very stressful week! So tonight I decided to pamper myself. Happy November ladies! Stay positive!:) 	emilysmackabish	59	2	2		t5_2s7a6	False
1350413346.0	11l0l0	Completed my first sewing project in a while!	mars_de_milo	61	7	4		t5_2s7a6	False
1347402474.0	zqeox	Im gonna need everyone to take a big toke for me	bluebebe	64	11	33	"Soo I went to get gas today, it took 50$ to fill up, so i started doing some math. Ive recently moved in with my boyfriend and pay 400$ a month in rent, i only make about 800 a month. So 800-400. I have to fill up once a week so thats 200 a month. 100 for the phone bill and 47 for my car insurance. that comes out to about $1.76 a day that i have to live on. yeaaaaah, needless to say im out of weed majorly depressed. ive applied to every job i can in the past couple of months and havent gotten a call back for anything. :(
thanks ladies for letting me rant"	t5_2s7a6	True
1337994946.0	u5dg6	I got something pretty great in the mail today...	Petra-Arkanian	63	5	22	"I've been feeling sort of blah recently, so I decided to treat myself to an MFLB.  My old personal piece was a tiny one-hitter, so it was time for an upgrayedd (spelled thusly for a double dose of pimping).  

Let me tell you, ladies and dangly-bit lurkers, this thing is pretty flipping awesome.  The same amount of weed that got me to the solid 8 I'm at now (seriously, I have to delete and retype so much right now because I'm so torched) would normally have gotten me to a 5...and I can still save it and cook with it, and my mouth doesn't taste like ash.  Other bonus:  I've been watching the videos on the magic flight website to learn how to do it properly and the dude who does them is just a little bit adorable.

My only question is...why didn't I do this sooner?  This is one party I should have gotten to earlier."	t5_2s7a6	True
1336819341.0	tjilz	Help a entwife (soon to be real wife) out!!	mickwagner	66	12	37	"Hi ladies! Wanna help an entwife out? My fiance and I just got our engagement pictures taken(in the woods and with our dogs) and our photographer says if we get 50 good comments within 7 days we get a free canvas print! I would love to have this as a wedding gift for my future husband! Help a girl out???

http://www.samanthamelanson.com/
(Michelle + Sean Bolton/Boylston shoot)


edit : I believe it takes a while for the comments to show up. She probably just needs to approve them! And I realize I wrote a entwife not an. Oh well!!"	t5_2s7a6	True
1336699140.0	thg84	This is one type of porn that belongs here. NSFL	Anonissue	75	21	18		t5_2s7a6	False
1336577960.0	tetgt	DAE want to be friends with her?	Cerridwenn	66	8	11		t5_2s7a6	False
1329440244.0	pt5m0	I am my own new best friend!	bubbo	63	7	19	Made up a batch of chocolate, coconut and almond scones into he oven. They'll be toasty in 10 minutes and so will I. BOOM! Thursday, people, Thursday.	t5_2s7a6	True
1326564702.0	ogyr4	This one's for the ladies!	injitora	60	3	7		t5_2s7a6	False
1326427550.0	oezi3	My dirty little secret	Stellaaaaa	64	4	68	"I really feel the need to get something off my chest, but unfortunately it's just not something that I can tell people I know personally yet. I feel like this is (hopefully) a safe place and who knows, maybe I can find some support here.

I weighed in today at 282 lbs. 

Only my doctor knows how much I really weigh and I don't want to know what people's reactions would be if I told them. This is probably the heaviest I've been in years. About 10 years ago I was almost to 290. The silver lining was that I was told that I had an underactive thyroid and was put on some medication to level it out. I lost about 20 lbs in the next 6 months and then slowly got down to 250 in the next 7 years.  In the past year I slowly started putting it back on and in the past 6 months alone I've put on 20 and finally weighed in at my current 282 at the doctor's office today. When she brought up the option of bariatric surgery (as a last resort if I'm not able to do this on my own) I almost broke down crying right there in the office, but fortunately I waited until I got home. 

I feel embarrassed and disgusted with myself. I know all of the right things to do but I'm lazy and I like food, what can I say? I hate to exercise. I'd rather sit and read a book or play video games. I love to cook and bake for myself and my friends. I like to try new restaurants and have girls' nights where we drink and get the munchies.

So here I sat most of the day since getting home from the doctor, having kicked myself all day and felt horrible about myself. And finally I decided I'd had enough. I did some research on the two top options the doctor told me about (Weight Watchers and Overeaters Anonymous) and decided to join WW on a trial basis. I've also decided to approach my weight problem the same way I quit smoking - like an addiction (since it probably is). I will take one day at a time and I will not use the occasional slip up as an excuse to do horribly for the rest of the day or to throw in the towel altogether. I really want to use this day as a turning point for me. I have known people that have gone through that surgery and it was a horrible experience for them that they've never really recovered from.

So that's my secret. If anyone is on WW and wants a buddy or even if you aren't and would like to buddy up, I would love some company along my new journey.

I'm going to go drink some water now. :P"	t5_2s7a6	True
1321403730.0	mdr2h	Smart Women Smoke More Weed (x-post from /r/TwoXChromosomes) 	lemonkiss	60	7	6		t5_2s7a6	False
1318461408.0	la597	ooo wow hi /r/entwives	zomgimagirlonreddit	64	5	45	you girls are my baked twoxchromosomes. this is nice.	t5_2s7a6	True
1317356313.0	kw462	We got a lot of love, ladies. Let's share it with people who need it!		62	5	10		t5_2s7a6	False
1316839148.0	kpshd	It's my Reddit Birthday and my Ent Husband thought I should share one of our Ent Kitties with you.	JerseyMouth	63	10	12		t5_2s7a6	False
1315947340.0	kely6	Makeup I did at a [7] 	eccentricbirdie	63	8	32		t5_2s7a6	False
1314209096.0	jt3jd	I've waited for today since December		60	3	17	"It's been a hard year. Within one month I was inexplicably fired, left by my fianc, and stranded after my car broke down. I was also commuting an hour to school 4 days a week in the early mornings, before transit was available. I ended up failing some classes and my graduation was delayed - transportation was a huge issue in my absenteeism and I struggled with depression through the rest of my program. I was finally able to get unemployment, but looking for work without a vehicle was tough in my area; busses didn't come anywhere near my apartment. I spent months dime-to-dime, borrowing little bits of money here and there for the occasional bill inflation. My now live-in ent would help me out as much as he could, which was more than I could ask for. It's tough for me to accept help let alone express need for it. Before I knew it I was packing up and moving into a cheap four bedroom house with four other people who had already lived there for 2 years, none of whom I knew. Good ol' craigslist. I am incredibly grateful that my situation was as mild as it was though; I don't have kids, no one depended on me to make ends meet, if anything happened it affected me and only me. I have great sympathy for those in worse situations and will do more in the future to be sensitive and helpful toward others who are having a rough go.

So I finally made it through my courses and graduated. I scheduled my licensing exams. I pored over text for months. I passed and got my license. I moved in with my ent and I got the first job I interviewed for. Today's my first day! It's also my last day on the lease at my craigslist house. From here, I'll go to the house to finish cleaning, then come home and shower, get on the bus, and start my career. Wish me luck guys ;)

[5]"	t5_2s7a6	True
1313187424.0	jh70q	Girls! I got the courage to get my lip pierced! This is my 19th birthday present to myself and I'm ecstatic!!	rosieco	75	21	24		t5_2s7a6	False
1311610115.0	iz9t1	My new shoes :D   X-post from Trees	SwisherRolledTight	64	10	12		t5_2s7a6	False
1302126518.0	gk8f8	I saveded a life at a [5] x-post	forestcitygypsy	62	8	21	"I work as a barista in a coffee shop in an office building.

Today when I returned to work, I offered to take the garbages for my boss since he had a lot to do still after the lunch rush. When I turned the corner, there was an old man sprawled on the ground in front of the door(which is beside the mens room) with about 4 people gathered around. I sprung into action and immediately got someone to call 911 and checked his pupil reaction/breathing/pulse, kept asking questions though he was unresponsive. Got him on his side and timed his heart beats and breaths while waiting for the paramedics.

Not to mention I did all this at a {5]. I just wanted to share my good deed because I am so proud that I kept my head and potentially saved this man's life. :) 

[EDIT] Heard from the owner of the building today. The family got ahold of him to thank everyone involved and let him know the guy was fine. Had a drug interaction and had to get his stomach pumped. Now hes just there for observation through the weekend.

I wanted to share with my entwives becauses I love you guys!
"	t5_2s7a6	True
1374651063.0	1ixz4m	So this is it :(	danni88	58	1	14		t5_2s7a6	False
1372377642.0	1h7qhf	"After THE craziest day at work today, I need a bowl THIS big!!!! Luckily I'm off work as soon as I click ""submit"" so THANK GOODNESS I'll get my bowl momentarily!!"	morningwarriorcat	68	14	3		t5_2s7a6	False
1365225885.0	1bs77k	Entwives, I am about to turn 23 and I've finally accomplished something awesome.	Katat0nikRadi0	61	9	6	"Ladies, my 23rd birthday is in five days and for the first time in my entire life, I feel as though I've accomplished something important.

In October a friend and I started the first Hempology 101 Society chapter in Alberta at Medicine Hat College. I'm not sure how to put it into words, but all my life I've felt like I'm supposed to change something about the world. Ever since I was a kid all I really wanted to be was an activist. I admired the people I saw in the newspaper doing something about injustices. I'm just now realizing that it's turning into a reality for me instead of constantly telling myself it's just a pipe dream.

The friend who helped me start the club invited his ""cool friend"" to join when we first started up. He became the secretary, then my boyfriend. We moved in together after Christmas. He's my pot prince. He plays in a band, he pitched the idea of a 4/20 concert.

What started out as a plan for a little concert on 4/20 (our very conservative city's first 4/20 event in years) has turned into a gigantic multi-genre benefit concert with sponsors coming out of the woodwork.

My favourite local punk band has agreed to make our show, in our crappy little city, their 10 year reunion concert. I used to go to every one of their shows without fail. I used to be moshing in the crowd idolizing them in junior high, now I'm talking to them like an events director while I try to hold in my fangirl squeak..

Today we got a call that there was a shipment for us at the post office... What the hell could it be? Donations and donations and donations! Thank you gifts for bands, door prizes, t-shirts, coffee mugs, buttons, hats! We've gotten so much more support than I ever imagined! Even my mom, who doesn't entirely belive in the cause, is donating some of her homemade crafts to hand out because ""they have hemp string and hippies like that stuff"". My mother... My mother who just last summer threw a shitfit upon learning I toke.

I finally feel like I'm helping. Even if it's just the fact that I'm finally giving the cannabis enthusiasts of Medicine Hat, AB their first 4/20 since the ""crackdown"" on drugs and the hiring of practically more police than we have people.

The forms are filled out, the i's are dotted, the t's are crossed, everything is legal as fuck. T- 15 days and counting.

[Here](http://m.facebook.com/events/419095878170816) is the link to the Facebook event page if anyone would like to check it out. I'm proud of this, chillin at a solid [8], and I want to shout it from the rooftops that I will help legalize this amazing plant if it's the last thing I do.

Tl;dr: I organized a 4/20 event in a town that has practically become a police state and met the perfect Ent in the process. I'm helping! :D

Edit... For words and such."	t5_2s7a6	True
1355601403.0	14wnp3	Show me your cute as fuck pictures!	Cmdr_Taw	67	9	67	"[My mom got me a wig as a Christmas present!] (http://imgur.com/6591e)  I'm cute as fuck!
"	t5_2s7a6	True
1352965225.0	138be9	I wanted it to be the holiday season, so I nail polished my lighter	thecrosseyedbear	58	6	4		t5_2s7a6	False
1352054507.0	12mepv	So my boyfriend recommended this subreddit	vizune	64	7	39	"Or should I say my ent? :P

I'm new to Reddit so please bare with me but decided to gather the courage to introduce myself on a subreddit. 

Hi everyone, I'm 21 and from England.
I've been with my ent for over 2 years now and we pretty much do everything together including smoking a J and he's the one that introduced it to me to begin with. 

It works wonders after work. It feels like all the tense stress just evaporates from my body :)

I best stop blabbering away now."	t5_2s7a6	True
1345790678.0	yqqok	my ent let my try some polishes out on him	that5girl	64	11	14		t5_2s7a6	False
1339874926.0	v5d77	My boss publicly humiliated me today	Nomsxxx	64	7	12	"I thought I was doing what I was meant to be doing, manning the BBQ. Apparently I was meant to be helping someone clear the handful of plates in the room.
 He started shouting at me in the middle of the crowd and reduced me to tears :( 
On my way to my ent's house to curl up in a ball, get stoned, get cuddles and watch breaking bad"	t5_2s7a6	True
1339812865.0	v4fdh	Hey ladies, this is my first post. Here is my little buddy Ted at a [0]. 		60	5	4		t5_2s7a6	False
1336526616.0	tdxb4	Are you guys familiar with the awesome sub r/redditlaqueristas?  I'm addicted! Here's my most recent mani [5]		62	9	17		t5_2s7a6	False
1328373373.0	paqbn	I was tired of the plain silver cigarette case, soooo....	Nayalith	61	4	13		t5_2s7a6	False
1327203866.0	or1nh	I was at a solid [9] with my lover when we stumbled across this gem...	that_gingergirl	67	10	4		t5_2s7a6	False
1326625856.0	ohw3k	Thank you ladies!	littlestsister	56	1	10	"I'm a long time net-surfer and mostly lurk wherever I go. Not because I don't have anything to say, but because I'm terrified of making a fool out of myself. I know this is very silly, but it is still a fear I suffer from.

[/r/entwives](/r/entwives) is a very comfortable subreddit and I made this account to practice posting and putting my opinions out there in this place where I've felt safer than most other places here on reddit. 

So thank you all for being who you are, uptokes to all of you as soon as I get home from work!"	t5_2s7a6	True
1316472621.0	kkysf	I cut all of my hair off, then noticed that a ton of you girls have also! I'm feeling like a brand new person and I love it.	rosieco	59	7	24	"I've always been dying and cutting and bleaching and fussing around with my hair. Lately I've felt like it's become such a burden, so I went to a really great Philadelphia salon and got it all cut off! I feel so empowered now. I realized just how much I used to depend on my hair to make me feel pretty, and now that it's gone I feel more beautiful than ever. Not to mention it takes me half the time to get ready in the morning, which is soooo nice! Tell me what you think! 

[a pic of me before, showing off my snazzy watch](http://i.imgur.com/3TDIj.jpg)

[the new me!](http://i.imgur.com/EnH9f.jpg)"	t5_2s7a6	True
1310844393.0	irgrd	Entwives- I think we need our own theme.	counteraxe	65	8	38	"While I love the old trees theme we've been rocking for as long as I've been here, I think we should make this community a bit more our own. I was playing around with the style sheet and made [this](http://i.imgur.com/F99OY.png) as an example. Basically it is the current theme in purple, kinda mixing the trees theme with the 2xc theme. I was thinking if we went this route we could make the tag line: Entwives, the ladies with the purps. 

Anyway, that was just one idea. If any of you lovely ladies have other ideas please let me know and I can try to incorporate it or make a different theme. Also, if anybody has any ideas for a logo more specific to entwives please let us all know. 

Thanks! "	t5_2s7a6	True
1375979300.0	1jypon	Filled up my scooter tank and this made me laugh.	DarcyRouge	69	15	7		t5_2s7a6	False
1372661089.0	1hevkd	Relaxing bath with my MFLB.	sjun630157	58	7	8		t5_2s7a6	False
1371694660.0	1gp8cb	My stoney pup should have a playdate with your stony pup!	Randab	62	9	8		t5_2s7a6	False
1370200901.0	1fj7uc	My new addition, meet Solid!	mastermalinger	62	9	15		t5_2s7a6	False
1368291810.0	1e4wjp	My preparations for spending the weekend at my grandparents'	atoadmin	59	2	12		t5_2s7a6	False
1365659747.0	1c4bbu	Musing about my husbent at a [5] after a dry spell	nfmadprops04	59	3	0	"True love is a man in the kitchen who realizes you're stoned and distracted on reddit, so he starts mercilessly pelting you with fruit snacks and Reese's cups. Because he knows you have the munchies. And also you're his wife and ""fuck you that's why"" :P *wink*"	t5_2s7a6	True
