created_utc	id	title	author	ups	downs	num_comments	selftext	subreddit_id	is_self
1354372973.0	143qs7	Guess I'll be laying off trees for a while!! :)	AphroditeAndTheXbox	602	143	71		t5_2s7a6	False
1372743965.0	1hhb9g	When I'm dressed up for a date and my boyfriEnt and I smoke before we leave.	littlemissadventure	414	38	26		t5_2s7a6	False
1356289943.0	15c46n	So I made a comic about smoking	HRH_Puckington	391	42	38		t5_2s7a6	False
1372282751.0	1h4x6f	Smoked and headed to the beach with my ent today.. and this happened :D	shmoopie313	342	32	37		t5_2s7a6	False
1338691007.0	ui1vk	Boyfrient and I have a bet going on which subreddit is more accepting. Posted this pic I drew for him in r/trees and hour or so ago...not much love! 	sherbear493	380	67	21		t5_2s7a6	False
1338046184.0	u61qi	afraid to post this in r/trees cause of being a girl and being in the picture.. here's me [8] chilling with my sugar glider MaryJ	cornflowered	327	30	53		t5_2s7a6	False
1353269246.0	13et2l	My ent proposed!	Kelcu	323	35	42		t5_2s7a6	False
1355096522.0	14km99	Being both a woman and entwife is so wonderful! I took this pic earlier for my ent and just want to share its awesomeness with you ladies. [NSFW but classy]	nfmadprops04	339	59	32		t5_2s7a6	False
1320379624.0	lzwjk	PMS, cramps, meet your kryptonite. 	zap-actionsdower	290	14	49		t5_2s7a6	False
1329866039.0	q00vz	Yes Darlings.  I'm sure you can agree!	NixFix	276	16	10		t5_2s7a6	False
1350843568.0	11uq19	"""Home, at last""-- A comic that needs very few words"	galactic_moshpit	289	29	8		t5_2s7a6	False
1348054751.0	104qkg	today should have been my ent's 24th birthday, here is a picture of us that i love. he passed in june, i miss him. toking all day.	eitherway8	292	32	28		t5_2s7a6	False
1376444246.0	1kbj1e	"I call this one ""Summer Goddess or it's not like I have anything better to do over break"" (watch out: cartoon boobies!)"	HRH_Puckington	287	30	28		t5_2s7a6	False
1344185336.0	xpwnp	I heard marbled nails were all the rage... I got a little bit carried away.	DrP3n0r	278	28	33		t5_2s7a6	False
1357225394.0	15w1xb	My ent and I on our wedding day this past August :)	nina420	276	29	24		t5_2s7a6	False
1369064376.0	1ep5z8	UPDATE: I've gained my independence. It's going to be a long rd, but here's my first and only piece of furniture!	sputnik_	264	16	15		t5_2s7a6	False
1327860556.0	p1vji	marrying my fiENTce this spring- i finally finished crocheting the shawl i'm wearing with my dress. it's taken me a year to make this! i had to share:)	jeeminychristmas	253	17	42		t5_2s7a6	False
1337748787.0	u0k5o	I love my ent:)	SarahHope10	248	16	23		t5_2s7a6	False
1339101860.0	uqdv0	My now-ex went and cheated on me and broke up with me a week before finals. He hated piercings and my smoking. Well, then. Toke up, ladies!	chincella	252	19	25		t5_2s7a6	False
1338866421.0	ulgs0	The Matriarch of the Entwives	shanglish	239	10	13		t5_2s7a6	False
1372820005.0	1hjjbp	Saw this today and thought it was good advice for us entwives.	travelingsparrow	246	19	14		t5_2s7a6	False
1347770822.0	zyjrm	It's getting cold outside, ladies. Remember to check those sweaters!	Bamka	250	23	8		t5_2s7a6	False
1370617172.0	1fv516	I love vaping and cross stitching	am_i_human	244	22	24		t5_2s7a6	False
1328190061.0	p7nn0	When I think of entwives, this is what I think of. Finally, I found a picture to illustrate my thoughts. 	dptofnala	230	8	11		t5_2s7a6	False
1331779005.0	qx71k	Do any other Entwives have these experiences?	magnumthepi	238	25	20		t5_2s7a6	False
1367271007.0	1dd5qd	Was told in r/trees that you lovely ladies might like my matching nails and bowl! &lt;3	A_GDTwinkie	244	26	17		t5_2s7a6	False
1322141344.0	mnv87	Sometimes thats ok :)	brandnewedgarsuit	226	8	12		t5_2s7a6	False
1345525587.0	yke7i	It's going to be a good night 	Natalia_Bandita	233	15	38		t5_2s7a6	False
1351006214.0	11y7hw	Entwives, can we take a moment to appreciate my grinder? :)	kaylakitty	235	23	20		t5_2s7a6	False
1346977799.0	zh9jm	Thought this was cute &amp; wanted to share	plastic_soul	251	39	5		t5_2s7a6	False
1343867749.0	xjbsj	I hate this	squabette720	228	17	22		t5_2s7a6	False
1319267971.0	lku4a	Be careful, it's sweater season!	JessicaMaple	220	5	9		t5_2s7a6	False
1356886183.0	15oego	No one suspects a thing! 	monkey50596	223	16	30		t5_2s7a6	False
1335545520.0	svidm	Ladies! It is the dress of our people! Glow in the dark too, woot woot.	sunshighnedaydreams	235	32	19		t5_2s7a6	False
1357144118.0	15txqg	Me and my Ent wrote this magnetic poem about the year ahead at a [5]	SammyDoodle	222	28	6		t5_2s7a6	False
1342462420.0	wnlef	Pot-smoking moms tired of being judged by wine drinkers 	ddgsj7889	207	12	26		t5_2s7a6	False
1373718307.0	1i7qme	Some of you loved my cross stitching, so I got up the courage to sell them at a local art crawl! It was a huge success and I wanted to thank you for giving me the confidence to do it.	am_i_human	210	19	22		t5_2s7a6	False
1344523942.0	xxw2w	30 with two kids, back to my teenage weight. :) Yay!	greenwomanoftheriver	220	27	13		t5_2s7a6	False
1370534323.0	1fsp47	This pretty much sums up why I stopped lurking /r/trees, so glad this place exists!	AnnieOakleaf	207	20	19		t5_2s7a6	False
1369157196.0	1erwzf	Super cute bathing suit I found, it was the last one left! :) (okay, okay... :D I'm showing off the Sapling!)	Mrs_R0ck5tar69	229	42	22		t5_2s7a6	False
1326719825.0	oj998	Let's forget the mod drama.  Show me some love.  Here's a pic of my ent and me.  Let me see you and your ent.	MsFit	218	29	164		t5_2s7a6	False
1352298551.0	12sq1t	I'm a legal ENT!	AphroditeAndTheXbox	204	18	47	"I live in Washington state and we just legalized trees!  Woo hoo!!! So proud of my little state right now! Gives a new meaning to our state slogan ""The Evergreen State!""

Yeah!! Toke up my fellow Washingtonians! :)"	t5_2s7a6	True
1344832544.0	y4n3k	Girl friEnts are the best. :) My girls and I tokin when a Madonna song came on. Entwives understand.	ktswan	193	10	32		t5_2s7a6	False
1353532770.0	13l4hr	No love for this on /r/RedditLaqueristas		206	27	34		t5_2s7a6	False
1338147870.0	u7mon	How I felt getting my nails done at a [6] yesterday	yuna1881	195	15	9		t5_2s7a6	False
1314238705.0	jtky2	I made myself a new wallet! (r/trees didn't like it...)	delola3100	203	23	33		t5_2s7a6	False
1354577876.0	14893v	How an entwife makes 150 DIY wedding invitations.	nfmadprops04	195	17	14		t5_2s7a6	False
1326737590.0	ojjkw	My Ent and I being silly at Wal-mart. Married 18 years 	corriek1975	196	21	14		t5_2s7a6	False
1347305664.0	zo1ll	Oh, Mother Nature! 	kjgyfk	185	8	11		t5_2s7a6	False
1335858296.0	t199j	We do exist! x post r/trees	crackdog	180	5	3		t5_2s7a6	False
1328902271.0	pjqwi	Ladies, if I could I would buy each of you a pair of these! 	soupypsouperson	186	12	30		t5_2s7a6	False
1323024093.0	mzyc8	Best secret carrying case for weed and weed accessories? :-P	Bamka	190	16	20		t5_2s7a6	False
1368117065.0	1e0c92	Art - totally looks like an entwife to me!	BruceWayneIsBarman	189	14	8		t5_2s7a6	False
1355901510.0	153k9y	OMG what if Lisa Frank made a bong?!!	kitkatkitkat	191	17	77	"How cool would that be!?

EDIT #2: tested the waters over at r/tress... [Looking](http://www.reddit.com/r/trees/comments/154uqa/he_had_nice_hair_i_asked_if_i_could_wear_it/c7jedh4) like we're on to something ladies! 

Edit: Holy fucking crap. omg. JUST OH MY GOD! First lets start with the creation by Ms. LannaFrank [ITS BEEN CONCEPTUALIZED](http://i.imgur.com/plNe7.jpg)  

Can we take this another step? can we get the word out to the ents and the artisans that this is something that we would LOVE? Could it be mass produced. 

also I'm not usually one for capitalization but the turn out and looooooove I feel from this post JUST MAKES ME WANT TO YELL. so I'M YELLING. Who knew a phrase that randomly popped out of my mouth at 11:20 on a tuesday night would turn into this? Yes, that is how it happened. I was at a solid [7] thinking about nothing and IT WAS AS IF GOD SPOKE THROUGH ME I just said ""what if Lisa Frank made a bong?"" posted it on r/entwives. DONE. 

Hey, btws I love you guys. "	t5_2s7a6	True
1355766802.0	1503xb	After weeks trying to decide what to get my Ent for Christmas...	Katat0nikRadi0	184	10	13		t5_2s7a6	False
1343109164.0	x26kj	A self portrait embodying my lady-ent power!	beyourhighest	187	14	13		t5_2s7a6	False
1320243357.0	lxoy4	Any other entwives prefer hangin with animals over hangin with people when you're blazing?	cherielynne	187	15	37		t5_2s7a6	False
1329920218.0	q0woy	Hooray, look what just arrived!	lounsey	181	11	19		t5_2s7a6	False
1327620298.0	oyavq	I smoked my last bowl :(	corriek1975	182	13	14		t5_2s7a6	False
1326567004.0	oh08l	Any man to give me this would definitely win my heart. 	soupypsouperson	181	10	11		t5_2s7a6	False
1366513619.0	1cs3sk	I'm not sure how Entwives is feeling about nails these days but here are my pineapple nails for my first 420! Anyone else celebrate with festive nails or apparel today? (redditlaqueristas x-post)	DodgyBollocks	190	17	23		t5_2s7a6	False
1353564335.0	13lxiz	A girl could only wish. 	emilysmackabish	187	20	13		t5_2s7a6	False
1329334676.0	pr3qy	so I asked the cute guy from my favorite head shop out on from some drinks last night... A little confidence goes a long way!	galacticvagina	191	20	21	"and his reaction was the cutest thing I've ever seen! He gave me the biggest smile and said ""Actually, I would love that"" and we exchanged numbers. 

I've been a regular there for over a year coming in at least once or twice a week so we know each other pretty well. Yesterday I came in to get my usual incense and shisha and we start talking about valentines day. He made it a point to tell me he was single and then asked me if I had any romantic plans. I told him no that I was just going to dinner with a fellow entwife. Flirting/conversation continues and then I leave to get to class. 

I nervously go back after class and ask him if he wanted to go get drinks with me when he gets off work. We ended up liking the same beer bars and met up at one of them late last night. It was so much fun! He even paid for my drinks and he was the first guy to ever buy me a drink! We talked forever and had a great connection AND we're doing it all over again tomorrow!

I just want to say, a little confidence goes a long way ladies! Don't be afraid to take chances otherwise you'll regret it if you don't! What's the worst that could happen!?"	t5_2s7a6	True
1364260300.0	1b0gqr	Hi Ladies, remember me? That person yelling about Lisa Frank bongs a while back? Well my 25th birthday just passed and in honor of the occasion my best friend and roommate made it a reality. 	kitkatkitkat	193	25	29		t5_2s7a6	False
1349765516.0	116oo4	I do.	UpvotesAllKitties	200	29	26		t5_2s7a6	False
1373370463.0	1hxgxd	Entwive's Fashion (repost from /r/pics)	malastrega	173	9	19		t5_2s7a6	False
1354460792.0	145h9c	So I colored my MFLB rainbow by following the natural wood grain. What do you guys think?	Nezumify	182	14	8		t5_2s7a6	False
1343600344.0	xcyw7	celebrating my IRL cakeday	prENTcess	187	23	30		t5_2s7a6	False
1340734722.0	vn35y	Of course you're not the only stoned mom.	vestalsubversion	180	15	40		t5_2s7a6	False
1340342071.0	vf8bm	I'm numb, He died at just 4 years old. This is us not 3 weeks ago. He was my entpuppy out of the pair so please, a toke for my snugglebutt Grover.	kitkatkitkat	177	11	24		t5_2s7a6	False
1321803969.0	mj26n	I get tired of seeing a bucket of Mountain Dew and 100 lbs of Doritos when boys post their marathon gaming/toking sessions...	Chillface	180	14	26		t5_2s7a6	False
1351794731.0	12gxj4	My husbENT and our new puppy.	Syoder	181	17	8		t5_2s7a6	False
1349304452.0	10wh00	No wonder the Entwives left the Ents!	Aye-curumba	184	23	62	"I am so upset about what is going on in /r/trees right now. One of us posted a pipe and just because it shows a little bit of OP, she is automatically a karma whore.

We can't help that seeing some of our bodies make your little peepee's hard. Fucking control yourself. Seriously, do we have to be covered from head to toe just to post something? She is in a double layered tanktop and is holding up this pipe.

If this was a guy, no one would give a shit. It is because she is a woman and has tits that these guys are making a huge fuss. I just unsubscribed from /r/trees. I am done with those assholes and just sticking to us girls where it is safe!

**Edit**: Ok so I was a bit angry when I wrote this but I have smoked and cleaned my Ents turtle tank and have calmed down. I don't mean to attack all men or meant to say all of r/trees is bad. I know it comes off that way and maybe in my mind at the time I just could not find better wording. 

I still believe that we are subjected to be objectified but then we get scrutinized for it at the same time. We can't help that our boobs make us look sexy to you and that the stores only sell clothes that show them off. We are forced into being a sex object because that is what the world wants us to be and then when we are just trying to be normal, we are punished for it. 

I am a bit stoned so I don't think this is the best way to put it. When I am sober, i'll come back and edit again. I apologize if I have made anyone feel guilty about their gender, not everyone is an asshole. Much love. "	t5_2s7a6	True
1327122212.0	opvns	This was on r/wtf but I think it fits better here... Pregnant entwife	tricksy_rabbit	181	20	9		t5_2s7a6	False
1358622517.0	16vz6a	In October, I told my boyfriend that I'd propose to him if we get a hockey season this year. Well, it's opening night! I think you ladies will appreciate the method. 	bluntthrow2013	182	22	32		t5_2s7a6	False
1349450996.0	10zvay	The mark of a true entwife	elladour	170	10	24		t5_2s7a6	False
1341582141.0	w4mg2	"New study finds that alcohol, not marijuana is the ""gateway"" drug."	greenwomanoftheriver	162	5	2		t5_2s7a6	False
1348780650.0	10l10q	So, I was looking for a prom dress and I stumbled upon one I liked, but I felt like it needed to be a little bit different.	LadyCaiti	188	32	21		t5_2s7a6	False
1348683695.0	10iokm	"My ent said ""Honey, I got you flowers"" then handed me this beautiful sample of his garden :)"	pcclady	171	11	11		t5_2s7a6	False
1342556811.0	wpxo7	Toking with my entmate at a solid [7] when the cat walks up. (x-post r/trees)	laa-dee-daa	166	8	2		t5_2s7a6	False
1367466588.0	1dj480	No trees in this post.. just the kitten i found keeping warm in the engine of my car. Now she never leaves my side. I couldnt ask for a better companion.	number1nubcake	169	17	25		t5_2s7a6	False
1373214970.0	1ht3cu	I think you ladies will appreciate my humble wallpaper collection (found mostly from r/wallpapers)	supersamazin	165	8	19		t5_2s7a6	False
1365737461.0	1c6nbv	To the entwives, from an ent	vinsneezel	166	14	31	"This girl in Harvard Square got run over by a 24-foot truck a few minutes ago. I didn't see the accident, but I did see the aftermath. She was lying on the pavement, surrounded by paramedics and policemen (and alive). I had just hit the ol' one-hitter and I watched for a minute, thinking about the random violence of life.

And then I saw the boyfriend. I've never seen a man so overcome. He was screaming like an animal as his friends held him back. I could almost hear his heart tearing in half.

I thought about my girlfriend. We have been together 2 years, and live together now. She supported me in my decision to go to massage school and start a new career at the age of 30. She is patient with my working two jobs, even though we only really get 1 or 2 nights a week together. When I wake up next to her, I'm always glad that I did, even though she takes up 7/8 of the bed. She doesn't seem to mind that my hairline is receding, even though I do.

I had never smoked and a little over a year ago, I started. She's a social smoker at best, and I quickly became an every day smoker. I did it because I enjoyed the way it made me feel less grumpy and revitalized my old enthusiasm for life that I lost sometime ago. And she supported me in that too, despite almost never partaking herself.

I love her and if anything ever happened to her, I know I'd be like that boy I saw today. And since she's such a great entwife, I just wanted to thank all of you. I read this sub all the time... I've always related better to women anyway. So on behalf of all the ents, thank you. "	t5_2s7a6	True
1351026396.0	11yudv	So I'm at about a [6] while at the vet...	KeepInKitchen	176	20	29	"So I had to take my brand new baby bunnies to the vet because my neighbor's rabbits got some bunny flu or something, and what I thought would be a TERRIBLE day of sick animals and expensive antibiotics  turned out way better than anyone could have expected!

There was this little girl (maybe 5-7) who was walking around the waiting room telling people what animal they looked like and why she thought that cool. That means every person was getting complimented by this amazing kid. 

She made her way around the room (as far as i can remember it went: monkey, dolphin, moose, cat, gold fish, cat, panda), came up to me and just started staring. I'd seen what she'd been doing so I played along. I started making weird faces and poses and what-not. Well, in the middle of all the silliness I accidentally yawned.

""You look like a lion!"" She shouted, giggling behind her hands.

So I did what any stoned and silly person would do: I roared my indoor roar, slashed at the air with my painted claws, and shook my wild mane in approval. Then she joined in! We roared and pretended to hold her cat in the air like Simba! We were having so much fun, when suddenly she stopped.

""You don't just look like a lion! You look like a Disney Princess if she were cool enough to be a lion! Like if Snow White was more lion-y!""

Let me say right now, that is the greatest compliment I've ever gotten. Not only am I a princess, but I am Disney Princess of the Jungle!!! I can't even think of something that would come close to how awesome that is!

So, I get called in the back. Fun time over, back to being an adult. I finish up with the vet and start to leave. The little girl comes up to me before I get to the door.

""You were the top of the food chain!"" She said, while handing me a friggin' blue raspberry Blow-Pop! Then she initiated a 7 step high five/fist bump/hand shake which we both ended with a big roar!

I do not know who was raising this child, but they are certainly raising her right. My current theory: my child is a time traveler.

tl;dr: I am high, my bunnies are fine, little kids kick ass, and I have candy."	t5_2s7a6	True
1346803246.0	zd4iy	I just found the best lighter in the world 	little-bird	165	14	9		t5_2s7a6	False
1350144386.0	11f20n	Got a new phone case.  Thought you ladies might like it!	k4good	180	27	14		t5_2s7a6	False
1342740131.0	wuele	I found this mural today and thought of you guys. 	PrincessPineapple	160	6	4		t5_2s7a6	False
1344284259.0	xs7uq	How I see my fiance when I thought we were dry and he managed to scavenge enough kief for an entire bowl.	nfmadprops04	170	16	7		t5_2s7a6	False
1331077894.0	qkvuk	Having a horrible, no good, very bad day. BUT I HAVE PRETTY NEW INK SO EVERYTHING'S OKAY!	metaljellyfish	166	15	63		t5_2s7a6	False
1371818274.0	1gshah	How to Get Your Dog High with 3 Easy Steps, And Pictures!	apondforxmas	178	24	8		t5_2s7a6	False
1350750966.0	11swi4	Hey there Entwives! I draw little slice-of-stoner-life comics. Here are a few c: 	reavercleaver	160	11	35		t5_2s7a6	False
1319115121.0	lin4a	Cake, pour vous. All of vous.	freakess_of_meh	157	8	13		t5_2s7a6	False
1354646495.0	149uwy	My favourite picture of me and my Ent :D	Nomsxxx	170	20	8		t5_2s7a6	False
1332082766.0	r21wi	I got to see my favorites artist work on vacation at a [6]. I was so amazed! 	iluvjly	157	6	22		t5_2s7a6	False
1330243304.0	q6ii3	Look What I Made with Paint Samples! (xpost from r/trees)	biggirlnow	163	11	9		t5_2s7a6	False
1320965357.0	m7zjo	Dear Entwives, you gals asked us to post some pictures of us ents to reciprocate the favor of your cute pictures. Here's me at a [5] during a week of primitive camping. : )	Yamato7	163	12	31		t5_2s7a6	False
1369230951.0	1eu0xn	As request, my collection of different artists renditions of the Disney Princesses. (some are NSFWish)	Natalia_Bandita	165	17	56		t5_2s7a6	False
1355521576.0	14v3qq	I like that my stash is cute.. but i don't have any girlfriENTs to appreciate it with me. i hope you like!	vypie	153	5	12		t5_2s7a6	False
1330000040.0	q2ety	Thought this photo would fit in nicely here :3	deliciouscakeforall	159	12	13		t5_2s7a6	False
1366821569.0	1d0obw	Do you Entwives love wine as much as I do? Look what I found today! Entwine!	granolasandwich	173	25	25		t5_2s7a6	False
1334929586.0	sjmjo	My 4/20 nails :D (x-posted to RedditLacqueristas)		165	18	8		t5_2s7a6	False
1366318121.0	1cmq30	I finally got my period! I'M NOT PREGNANT!!!!!! Toke one for me ladies!	datoldthrowaway	167	22	72	Oh what a relief~ :]	t5_2s7a6	True
1354902037.0	14gbl4	Today is my 25th birthday. This is how I'm celebrating it. 	mjranr	155	12	20		t5_2s7a6	False
1337054512.0	tnnq9	I buzzed my head.  It feels really, really,really good.	Cmdr_Taw	153	12	30		t5_2s7a6	False
1337899853.0	u3iv2	How I've passed every (pre-employment) piss test--ladies only		156	11	67	"1) **Obtain clean urine.** This can be purchased as a [synthetic](http://www.antitest.com/synthetic-urine/ultra-pure.html), or you can always ask a friendly donor.

2) **Pour the sample into a condom free of lubricant and spermicide.** A regular lubed condom will work fine, just rinse it out first. Do NOT use a colored condom--the dye will seep into the sample. Condoms are great because they've already been burst-tested, and they fit naturally for where you're going to put it.

3) **Knot that shiz tight.**  You don't want air bubbles, especially if you  plan on storing the sample for later use (and you'll probably want to use gloves for tying the knot). YOU CAN FREEZE IT THIS WAY.  

4) **Use a glass of hot water to bring up the temperature.** If you freeze the sample in the condom, allow yourself about 60-90 minutes ahead of the test to defrost and bring up to approximately body temp. A drinking glass is the perfect size--drop the piss-cicle in the hot water, and once it's all melted, freshen up the water to make it warm before insertion. Even if you DON'T freeze it, heat it up this way first. It's easier for your body to *maintain* temperature than heat up a foreign object that's room temp.

5) **Insert into Nature's Pocket.** This is the most awkward part, but there really isn't a better way to keep the sample at body temp (or to hide it from pat-downs!) than to do a little clam cramming. The easiest way I've found is to lie on my back with my legs up, and use 3 fingers to kind of 'shoehorn' the condom and push it up in there. DON'T PANIC, you need to be relaxed. It feels weird and you're going to worry about the condom leaking or breaking, but barring any kind of *vagina dentata* condition (and assuming you've knotted it securely) you're safe.

6) **Don't forget your implements!** Stick a bobby pin with a nubbin cut off in your hair, or a tiny set of nail clippers in your pocket. You need to perforate the condom in order to fill the cup, but you don't want a mess everywhere. You also don't want to make the hole so small that it cools significantly by the time it's filled the cup. I'd say no smaller than 1/8"" or 3-4mm.

PROTIP: Stick a napkin or paper towel in your pocket (or bra) so you have somewhere to put the condom when you're done. Clinics have been getting more stringent with their policies--no running water in the restroom until you're done, no flushing the toilet--and you'd better believe they check the trash after you're out. You'll want to wad the condom into the napkin and stick it somewhere on you for disposal elsewhere.

If anyone wants to supplement this, feel free :) Just figured I'd make a post to refer back to, since this topic seems to come up a good bit.

---------------------------------------------------

**Edit 1:** As [djspacebunny](http://www.reddit.com/r/entwives/comments/u3iv2/how_ive_passed_every_preemployment_piss/c4s4ny7) pointed out, one can use a plastic travel-size shampoo bottle in the same fashion. It would definitely be easier to insert!

**Edit 2:** ""*Pat-downs, WTF?*"" You might be thinking. YES! I've been frisked by nurses and even had my scalp massaged (I was wearing a bandana over my head at the time) to make sure I wasn't carrying in spoof urine. Shit is getting serious."	t5_2s7a6	True
1374088757.0	1ii7s9	I've been so into this every time I smoke/vape it's so awesome! Any of you love her?	danni88	157	14	37		t5_2s7a6	False
1354244347.0	14163a	I want to decorate a lighter		152	14	11		t5_2s7a6	False
1336996007.0	tmbvr	"The result of my latest ""Get Stoned and Creative"" series......."	joanlamont	156	12	48		t5_2s7a6	False
1369843140.0	1f9w6v	Thought of you ladies when I found my new favorite coffee mug at Goodwill!	tyedyejam	156	13	4		t5_2s7a6	False
1336935109.0	tl9vb	Look what my Ent got me for my first Mothers Day :)	yuna1881	152	14	7		t5_2s7a6	False
1325116761.0	nu84c	Girlfrent's new pajamas arrived while she is away on vacation with family. (x-post from trees)	highaboveme	148	8	12		t5_2s7a6	False
1370894278.0	1g2ed1	Secret from PostSecret.com	jnulynne	148	11	5		t5_2s7a6	False
1373473124.0	1i0kcs	Went to visit my girlfriEnt yesterday. Last time we visited I showed her these online. SHE GOT ME ONE!!! :D	Mrs_R0ck5tar69	153	17	19		t5_2s7a6	False
1350436401.0	11lqsi	Waited so long for the moment this picture portrays... really wanted to share this picture of me and the new ent! it was little blissful moment and an okay shot of the dreads too :)	mantralicious	165	28	13		t5_2s7a6	False
