created_utc	id	title	author	ups	downs	num_comments	selftext	subreddit_id	is_self
1366231070.0	1ck2wy	WOW...this is the show S2 produces for vegas? more likely a company vacation with a cheap tournament on the side	koldakill3s	125	33	85	"been playing off and on since sept 2009

i basically only play mid wars now and lurk this forum to see whats new in the community

and wow after watching the twitch stream for these finals and the production value...its like watching a **low budget porno**

everything is just sleazy feeling about it

if your gonna be cheap at least keep it legit and more interesting, why dont you hold it at S2 headquarters and keep it low budget so the prizes can be that much more  amazing? Is this just a kill two birds with one stone type thing ..by holding the tournament  in vegas the S2 staff also gets a free trip their and it serves more as a company get away with a cheap ass tournament on the side? ( via maliken)

ps: renting out the hardwood suite for the actual production and tournament..im not so sure this was the best choice..maliken must really enjoy basketball or something"	t5_2r497	True
1357551247.0	1642rf	HoN 3.0 Leaks, list of pictures on pastebin. Comment if you want extras, I can provide if I care much enough.	EbinHyunRaid	125	35	151		t5_2r497	False
1349587063.0	112s4e	My camera allowed me too look off the map, Guess what i found!	badookey	107	17	11		t5_2r497	False
1337005226.0	tmgyw	took screenshot of phil's desktop after he closed hon, new hon tour details 	infern0d	111	18	19		t5_2r497	False
1332181421.0	r3rtz	secret message found in stone henge	davidcroda	130	38	12		t5_2r497	False
1323644234.0	n8x36	"Comparison between the HoN and Dota 2 camera 
distances"		121	33	100		t5_2r497	False
1315516234.0	k999t	How I feel chasing through fog (X-Post from r/funny)	Mjilaeck	116	25	11		t5_2r497	False
1313024673.0	jf71v	HoN Hero Spotlight: Rhapsody	latex2e	102	13	146		t5_2r497	False
1374338654.0	1ip9ch	Is that Blacksmith's face on Engi's keg?	CaptTyingKnots	102	17	21		t5_2r497	False
1367541551.0	1dl771	I want to play a game... (3.1 Patch Notes Game!)	Idejder	117	28	588	"Why hellloooo there everyone. 3.1 - The Runic Shift is coming to you guys tomorrow, so we figure it's a good time to let you all explore the patch notes, in a very fun way! As an aside, the patch is actually building right behind me! Weeeee!

I was just going to have you guys guess a line of the patch notes and I will tell you what it is. But... you have all seen this [picture](http://i.imgur.com/LrIOvzF.png) already. So just having you guess the line straight up would be boring. You already know where to start...

So I scrambled the order of the sections!

General, Heroes, Items, Bots, Matchmaking, Content, Bug Fixes. Those 7 sections are now in a random order in the notes. I have to make it interesting at least!

The patch notes are exactly 697 lines long. Some lines are MUCH longer than others. Some are blank. Some are headers. Choose Wisely.

**Rules of the Game:**

* Pick a number between 1 and 697.
* Each person gets 1 (ONE) guess. As I see each reply I will look up that line on the notes and let you know exactly what it says. I will not get to every single reply, but I will do my best.
* Use your collective knowledge and put together the patch notes early!
* Don't ruin the fun for others. Don't be rude or a jerk.

HAVE FUN!

**EDIT**: I am done, heading to bed. Thanks for the fun and I hope everyone enjoyed it! Let us know what you think of *3.1 - The Runic Shift* tomorrow!

&lt;3 to all! And to all a good night!"	t5_2r497	True
1359634721.0	17mj4q	This is not how you do a high-resolution texture	Seruz	135	48	16		t5_2r497	False
1336430846.0	tbx65	I am a new HoN player, but this was amazing...	mhp01a	120	33	38	Last night I was playing with some friends, my MMR is a steady 1350(i know, impressive) the other guys I play with are all high 1500's low 1600's.  Well we played a game and stupidly took 4 carries with me on keeper.  We tried to remake 3 times and the other team(5 man clan team) wouldn't do it. So we knew it would be a 15 min cc so we stacked mid lane and waited... and waited... finally we ran to Kongor where they had him at about 3% life.  We killed 4 of their 5 and took the Kongor kill.  They were so pissed.  They tried remaking but now we wanted to mess with them.  The game ended at 15 min with a CC... by them we were up on them 18 kills to 2 kills and each of us had 2-3 levels on them.  Our mid pebs had a 6 mins port key and just wreaked havoc from there.  I am sure this isn't the coolest story to a bunch of guys who have been around forever in the game, but to me it just about made my night :P	t5_2r497	True
1328882219.0	pjcbz	Smyger's HoN Digest Vol. 8	DivineWithin	112	25	43		t5_2r497	False
1328243992.0	p8tt0	Fayde sketch	oxoxoxo	112	19	25		t5_2r497	False
1326652385.0	oi6me	I think this every time I play support.	bookObanana	120	32	7		t5_2r497	False
1324231862.0	nhhcj	Stealing mid	Helllraiser	112	20	20		t5_2r497	False
1320543250.0	m1ylz	My life in MM	maxm0	118	26	32		t5_2r497	False
1320349716.0	lzckw	Anyone Else ?	Fluffy-Kitten	119	30	57		t5_2r497	False
1306519022.0	hlogq	HoN Bingo!	htns	98	9	36		t5_2r497	False
1373821638.0	1ia7wo	"Here's an idea for a female legionnaire avatar ""legionette"" !"	Lootre	124	34	32		t5_2r497	False
1373570868.0	1i3nu7	This is why I love Honcast	Ghidoran	105	18	13		t5_2r497	False
1372651866.0	1hencg	When I call mid and the enemy teams pink/blue picks Monkey King	Arygos	120	34	35		t5_2r497	False
1364723361.0	1bcoja	The Rock going hard!	ImbaZab	117	28	18		t5_2r497	False
1361972664.0	19bqx8	The real stealthmaster 	Ryvox	109	19	31		t5_2r497	False
1358794463.0	170450	Moar about HoN 3.0!	nfswaa	100	11	77		t5_2r497	False
1358389520.0	16q5bj	New sign at our new office - here we go!	S2Deejay	113	23	55		t5_2r497	False
1353731396.0	13p8is	HoN Top 5 Plays of the Week - November 23rd	NinjaPT	94	8	13		t5_2r497	False
1340058861.0	v8vvx	Scumbag Riot Games [League of Legends] trying to prevent other MOBA games from featuring at big tournaments	vsquar3d	115	29	87		t5_2r497	False
1332092185.0	r27e8	Heroes of Nonsense 2	Zimmericz	134	45	21		t5_2r497	False
1332003266.0	r0xse	When my team wins a 60+ min. game		131	42	6		t5_2r497	False
1325912775.0	o6f5g	A friendly reminder to all those who buy wards, upgrade courier, and the rarest of rare, selfless in HoN.	UnicornPorn	124	37	36		t5_2r497	False
1324179535.0	ngzke	Calling mid in HoN	Decessum	110	21	53		t5_2r497	False
1322611277.0	mtzyq	Fnatic.MSI's Nova explains why you shouldn't flame teammates for mistakes.	CutChemist11	94	8	31		t5_2r497	False
1304611519.0	h4wbo	How I picture the average Brazilian HON player	GODONARHINO	142	55	84		t5_2r497	False
1294327867.0	exa4z	One of the best hon vids i've seen recently	Greeshka	95	10	25		t5_2r497	False
1372235781.0	1h3ihx	My Official Statement Regarding Forum Bullshit and the Future of Team stayGreen	melonzz	143	58	168		t5_2r497	False
1367429982.0	1dhrv9	To S2 staff	Kolapz	132	43	46	"Hi,

You all know me. 2 years ago I signed a contract with S2 Games, signed by Laura Baker, Shawn Tooley and Marc DeForest. A couple weeks ago I've found out that you're cutting funding to the only remaining ""neutral"" eSports news site that covers HoN, i.e. Gosugamers.net that I've been a senior editor at for the past year and a half.

I've been trying to reach someone from S2 so I can terminate my contract for the past 2 weeks but received no answer. The contract I signed with you was mostly in regards to an NDA agreement for an indefinite time frame that can be terminated by either side at any time. Considering I do no longer work for you, I would like that contract to be terminated. Unofortunately, all of the people that ""know"" who I am, all of the people from S2 that I communicated with in the past like Shashi, Laura or Shawn are no longer in the company so I have no one to contact to. I tried to contact the people in charge for the past 2 weeks via Nick and Sam, but received no answer.

Please contact me, thanks. "	t5_2r497	True
1342985694.0	wz7es	Feeding on purpose	rasser	125	42	30		t5_2r497	False
1331008584.0	qjp7q	Scumbag Steve plays Magebane	BicuriousKitten	136	45	25		t5_2r497	False
1326399863.0	oed6i	SCHLONGCAST is LIVE! With Comely &amp; Nigma	NigmaNoname	108	24	33		t5_2r497	False
1326032068.0	o7yak	That's a new one	Goymer	124	37	8		t5_2r497	False
1311239759.0	ivoea	So since hon is down again, I figured I'd find another way to play without S2's servers.		121	33	20		t5_2r497	False
1375210818.0	1jd825	When the enemy team has a dc and the game is a total stomp	NotoriousNiklas	114	30	17		t5_2r497	False
1361768048.0	196bjm	One of the best ganks I've ever seen!!!!	chibidood	110	19	27		t5_2r497	False
1350610757.0	11q2sk	HoN Top 5 Plays of the Week - October 16th	Lotheim	88	3	34		t5_2r497	False
1348835931.0	10m69z	I've seen enough Hentai to know where this is going..	imaginarydice	112	28	19		t5_2r497	False
1340831455.0	vpemz	We all need a scapegoat	ImaginaryPoliceForce	111	26	28		t5_2r497	False
1324654993.0	nnzrv	How I feel playing a Beta-Test Hero for the first time	NigmaNoname	122	34	21		t5_2r497	False
1322203133.0	monra	First World Crits		110	21	18		t5_2r497	False
1316171797.0	khj3j	How many people are on a team...?	Ellezag	108	24	17		t5_2r497	False
1315579502.0	ka2mk	Teenage Mutant Ninja Newerth	terrmith	127	43	12		t5_2r497	False
1315283056.0	k62qh	Watermelon	pclamer	113	26	14		t5_2r497	False
1314064189.0	jr7to	Why can't I do this?	Shoryucas	101	12	32		t5_2r497	False
1307010503.0	hptqx	World's Longest Barrel Roll	ClaudeNX	88	4	16		t5_2r497	False
1306782231.0	hnnnu	*Sunglasses*	ClaudeNX	102	16	5		t5_2r497	False
1372231063.0	1h3fjv	With all the drama set aside, can we do something about the upvotes/downvote scores being hidden? I really think it's pointless for this sub. What are we, r/politics?	ReposterAndProud	114	33	81		t5_2r497	True
1367642104.0	1dnwg4	Scrabble Stratagy	TheGlassDanse	114	27	3		t5_2r497	False
1362461950.0	19owof	Amazing dive and escape by Swindle and Zfreek vs complexity	evoken1	99	14	25		t5_2r497	False
1361487980.0	18zga0	Zephyr vs Pestilence. This has badass written all over it.	TheoColt	102	15	13		t5_2r497	False
1358663578.0	16x3gm	Heroes of Newerth [1500] : Man's Best Friend(s) - YouTube	VnDevil	92	8	11		t5_2r497	False
1355954005.0	154qbe	Maliken Interview about HoN 3.0	Hamcake9	100	14	107	"Here's a nice little interview about HoN 3.0 and HoN in general with Maliken, courtesy of Idejder's twitter

http://venturebeat.com/2012/12/19/heroes-of-newerth-3-0-adds-bots-hopes-to-teach-new-players-interview

https://twitter.com/Idejder"	t5_2r497	True
1347888920.0	100rwz	"After 5 years in the making, S2Game's original Classic ""Savage: The Battle for Newerth"" has now officially been re-released and modernized by the fan-base, dubbed ""Savage XR 1.0"""	PiggyWidit	100	16	34		t5_2r497	False
1346048358.0	yw539	It's a simple request.	Bicworm	109	23	13		t5_2r497	False
1334880714.0	siqke	HoN Pubs/Solo queue [Fixed]	FrinkFactor	132	44	27		t5_2r497	False
1328982925.0	pky70	HoN Hacks...	dubesor86	125	42	64		t5_2r497	False
1328030350.0	p4r4p	How I feel when I play Amun Ra	Vespher	118	34	14		t5_2r497	False
1327152581.0	oq6kx	[Blog] Things DotA2 and HoN can Learn from Each Other	NigmaNoname	106	24	92		t5_2r497	False
1312094270.0	j4ojg	A simple solution for S2	doliner	116	31	23		t5_2r497	False
1369331214.0	1ewzan	[Vin Diesel mentions Heroes of Newerth (2 minute mark)](http://www.youtube.com/watch?v=QIHpFLnhGTo)	knexx	100	15	67	"http://www.youtube.com/watch?v=QIHpFLnhGTo (I SUCK AT REDDIT)

(the funny thing is EMPEROR was the one who found this! :D)"	t5_2r497	True
1364892550.0	1bi6zt	Awesome custom Hero Spotlight: Cataclysma	Elune_	107	27	46		t5_2r497	False
1359610613.0	17m4aw	i bet maliken avoids eye contact with this guy	simao_br	128	44	39		t5_2r497	False
1355200226.0	14ncgd	A repost but.. S2 fixing the servers for those who haven't seen it!	newbkid	114	30	34		t5_2r497	False
1328919046.0	pk47l	My feelings towards how S2 works atm	epilepzi	136	50	59		t5_2r497	False
1328422025.0	pbkp5	Base race	Zotak	103	20	19		t5_2r497	False
1326436139.0	of5ca	Good	Twes	107	22	21		t5_2r497	False
1321953826.0	mlaus	I Love HoN.	Comely	121	33	54	"I think a lot of time we get lost in our criticism, in our frustration, in our a lot of things, but seriously HoN is such an amazing game. It really is a rare game that really manages to capture my full attention. I've played Dota2 and LoL lately and I just tie everything back into my HoN knowledge and experience.

S2 has done an amazing job crafting what is such an incredible game, so apologize my brief fellatio here, you guys know I'm hard on S2 when they deserve it, but HoN's game feel is absolutely amazing.

God damn HoN is fun. "	t5_2r497	True
1320229676.0	lxk02	So, i just started playing Balphagore because its a free week....	Balphanewbie	102	22	44		t5_2r497	False
1319798249.0	ls2eq	I'm no artist, but this is what I put on my porch	painfulbliss	107	25	13		t5_2r497	False
1310440326.0	in1it	HoN Hero Spotlight: Revenant	Caesarr	92	6	56		t5_2r497	False
1304235687.0	h1aom	PRO DEVOURER AND COMMENTATING PART 2	ysondre	107	25	37		t5_2r497	False
1373688152.0	1i78em	HoN Top 5 Plays of the Week - July 12th	NinjaPT	96	17	38		t5_2r497	False
1364617210.0	1babtk	Solstice and Corrupted Disciple cosplay at GSL 2013!	moonrobin	93	10	10		t5_2r497	False
1364441785.0	1b5nsz	I am a terrible person for thinking this...	Zhugebob	105	23	76	"Can we get an alt avatar of Ra: ""Jesus""?

That ult resurrection would be sweet.

(Edit: ""Yey! I made a successful Reddit post! Praise Jesus!"" )"	t5_2r497	True
1359445999.0	17hiq5	Booboo is scary	evoken1	99	15	12		t5_2r497	False
1358630231.0	16w7dp	HoN Top 5 Plays of the Week - January 18th	NinjaPT	90	7	25		t5_2r497	False
1355687942.0	14yckl	HON DATABASE HACKED?		103	20	158	Huge rumor going out! MOON AND NIR ALREADY TAKEN DOWN HIDE YOUR KIDS HIDE YOUR WIFE	t5_2r497	True
1354344403.0	143evz	HoN Top 5 Plays of the Week - November 30th	NinjaPT	97	14	16		t5_2r497	False
1353113239.0	13bun1	HoN Top 5 Plays of the Week - November 16th - YouTube	Godeye	99	17	18		t5_2r497	False
1348906131.0	10nsu5	Watermelon Headshot HoN Remix - YouTube	SwedishFaggot	94	9	13		t5_2r497	False
1339194886.0	usb40	Please do something about the /ignore function	Glowingstick	92	11	26		t5_2r497	False
1333707726.0	rw3ps	Best forum signature I've seen so far!	MediocreX	143	62	45		t5_2r497	False
1330687393.0	qecov	Hon Hero Spotlight: Cat. 	Krytt11	123	40	18		t5_2r497	False
1327947991.0	p3a53	Sounds like he's a little mad...		121	41	37		t5_2r497	False
1325733091.0	o3fhc	"So Moonmeander played DR
"	kenxcross	114	33	32		t5_2r497	False
1325560824.0	o0m8e	HoN Hero Spotlight: Artesia	Grymrir	86	4	87		t5_2r497	False
1372366356.0	1h7cb1	The battle for newerth has begun...	maesterturtle	107	28	8		t5_2r497	False
1368857502.0	1ekd53	AngryTestie HoN Announcer!	I3lackShadow	106	24	43		t5_2r497	False
1362979131.0	1a2exx	I have no effect on the outcome of my games. 	YeahVeryeah	102	23	46		t5_2r497	False
1347802266.0	zyxhm	Everytime I see this box at works, it immediately makes me lose focus on my job at hand :|	Trajer	106	26	9		t5_2r497	False
1341114328.0	vv5vb	I swear, every time I have low health...	Krytt11	111	28	16		t5_2r497	False
1336091036.0	t60gr	This is going to be a fun game.		99	17	21		t5_2r497	False
1329423734.0	psrwg	I found a flow chart for playing Zephyr.	Krytt11	128	43	9		t5_2r497	False
1327604292.0	oxxam	look who i randomly saw at midway in chicago. we got our bags searched together... nothing like everything needed to operate honcast in your carry on, breaky. :D	0obeno0	128	47	63		t5_2r497	False
1323872939.0	nceae	I make this speech to my team (friends and pubs alike) far to often.	spenCzar	98	20	23		t5_2r497	False
1323452909.0	n6g89	The true meaning of today's patch	NigmaNoname	119	37	50		t5_2r497	False
1322424458.0	mr44d	Just happened in game	huhuh11	104	23	22	"&gt; Beginning of game, all heroes in fountain

&gt; Midas en Behemoth spam spell/cancel

&gt; Soulstealer player says
&gt;""YOU RETARDED
&gt;MY BABY WOKE UP
&gt;BYE!""
&gt;Soulstealer has left the game"	t5_2r497	True
1310269783.0	ild6i	The n0tail Way of Winning 3v5 - Highlight Video of a game worth watching	Rythian	101	18	27		t5_2r497	False
1310169327.0	ikhru	Tired of leavers on your team? Make like n0tail and go 40/3 with 927 gpm and 1217 xpm. Game starts at 32:00.		94	12	60		t5_2r497	False
1309182709.0	iabkd	Pay tribute to your player of the Game	FlyingFoX13	96	13	32		t5_2r497	False
1308357313.0	i2l48	Unlucky random x2!	skopey	91	10	20		t5_2r497	False
1306411894.0	hklag	S2's Inspiration for Nomad's Ultimate	ClaudeNX	91	8	7		t5_2r497	False
1363734478.0	1amjdo	Added a couple new things to the sidebar.  Feedback and what needs to be improved and added appreciated	newbkid	87	8	52	"Added Upcoming Tournament Games and a Hon Streams link on the sidebar.  Anything that is wrong, missed, looks bad, or can be improved please let me know.  ~~I'm in the process of finding someone to clean up our sidebar with some CSS so be patient with that.~~ 
Constructive Criticism Only.
Thank you

[SBT]Newbie

UPDATE:  Currently adding CSS to the sidebar!  Will update when its ready!! :-)
UPDATE: 3/20/2013 3:00AM EST - I have a basic shell of the sidebar updated while the CSS gets made.  Will be resizing images for the sidebar as well.  If there's anything missing, wrong, misspelled, etc let me know. Will be working on it more tomororw and into the weekend

FINAL UPDATE:  I will be updating the Upcoming Games manually for the next couple months while the CSS gets made.  Once it's ready we will update it and I hope it meets everyone's expectations.  Thank you!

~The Mod Team"	t5_2r497	True
1356025323.0	156d4w	"""OMG I LOVE PANDA"""	iNchok	100	21	53		t5_2r497	False
1349979806.0	11bkvt	LightBrand [New Item]	JonJinBae	90	8	66		t5_2r497	False
1346989364.0	zhlta	Playing 1500's. Player with &lt;50 games and decent KD gets weird items 	Mooseeey	102	25	42		t5_2r497	False
1346119755.0	yxstw	HoN Hero Spotlight: Oogie the Primalist!	Meeea	95	15	90		t5_2r497	False
1325872888.0	o5nsl	It just made my day knowing that this actually works.	Variability	106	25	33		t5_2r497	False
1316710255.0	ko25v	"I""M NOT MAD! THIS IS ME HAVING FUN!"	drewlynoted	95	15	33		t5_2r497	False
1314822306.0	k0k47	HoN LOL Moment!	XtremeFlash	101	20	21		t5_2r497	False
1313608272.0	jlw1o	DAE want to see a balance patch? There hasn't been one in weeks. They just keep adding things. STOP IT. 	jacksprat870	92	12	34	balance plz.	t5_2r497	True
1313386074.0	jj38r	Found this posted in /r/gaming. Relevant.	Pinoynac	101	20	14		t5_2r497	False
