created_utc	id	title	author	ups	downs	num_comments	selftext	subreddit_id	is_self
1311984140.0	j3puj	Liars (credit to forum user Puro)	tookie22	621	138	71		t5_2r497	False
1369095035.0	1eqauy	When Playing Thunderbringer and Someone Gets Low	cptncabinet	471	49	36		t5_2r497	False
1334315130.0	s7rkv	tdM|Tralfamadore: Why I'm finished with Heroes of Newerth and S2 Games	Tralf	495	104	207	"My name is Tralfamadore, formerly of SK-Gaming and now Trademark Esports for Heroes of Newerth.  Throughout my career in HoN, I've managed to make a decent chunk of money through both online and offline tournaments, such as the GosuGamers' World Cup to Dreamhack Winter 2011 to NASL Season 2 Finals, with great success, as well as meet some really wonderful people in the Heroes of Newerth community. 

I am going to talk in great depth about my experiences, my success, and now my frustration with Heroes of Newerth and S2 Games as a whole and why I'm quitting.  This is going to be a long one, but I'm going to do my best to outline my opinions with as little bias as possible but with as much detail as possible, to give you a full scope of where I am coming from. 

The game Heroes of Newerth itself is disgustingly good.  It plays by far better than any MOBA in its genre.  Don't believe me? Try it for yourself.  The response, the animations, the graphics, the turn rates, reduced lag; all of these things can be credited to amazing developers and coders for S2 - what an amazing job they have done.  When I list all of these qualities, in my mind (and I think most others' as well) I'm directly comparing them to characteristics of Dota 2.  I also played a great deal of Dota 1 (and now Dota 2) - I dabbled into some of the top inhouse leagues, but never really got heavily into the scene - unfortunately, at the time I had horrible netlag from college internet, and I played on a horrible laptop that yielded 10 fps tops, and I couldn't download a hotkey script. That's right, I had to click **everything**.  This inhibited me quite a bit - but when HoN came out (as well as my new computer ^^) it had a build in hotkey script that made me fall in love with the game. 

I remember the moment, actually, that I switched from Dota 1 to HoN.  For about 2 weeks, while I was playing in the DXD league on USW, Orie (YoDa) kept spamming /b m whispers saying ""YOU GUYS! You're playing the wrong game - Dota is dead, hon is where it's at.""  Eventually, I got annoyed with his spam and went to try it myself.  I instantly fell in love - between the reconnect feature, smooth gameplay, and the other things I mentioned, it was far superior to Dota in every aspect (at this time, too, about 90% of the heroes in HoN were all DotA ports, so balance was near-perfect).  Many other Dota players, both casual and pro, who have played Hon most all agree that Hon *plays* better.  I found this many months back and found it very interesting: 

http://www.tdabots.com/forums/index.php?/topic/4789-so-i-played-a-game-of-dota/

This is taken from TDA forums, and it was a topic started by Tarano, one of (in my opinion) the strongest players HoN had seen in its time. I never heard of him in Dota 1, sounds like he played on more East leagues or something (old IHL by Ucross, DCL, etc). Anyway, Tarano built up this reputation in the competitors forums (at least in my opinion) of being S2's harshest critic.  Actually, many of his ideas were almost completely parallel to mine in terms of balancing the game. That being said, at the beginning of HoN, Tarano heavily supported HoN over Dota1, with reasons he outlined in that thread: 
""I recommend you to do what I did when I first started HoN. Play a few games of HoN, then go play DotA. After a week of that, I got to know HoN enough to question why I was playing DotA.""
What does this say to me? S2, you now have someone who detests your game and its utter imbalances (I'm just using one person as an example, could list *many, many* others) who used to sing its praises.  That's how far we've come, in terms of balance and keeping the community happy.  
**EDIT: To read more, filter the comments to ""Top"".**"	t5_2r497	True
1319425988.0	lmp7d	Hi guys here's my rendition of Bubbles	bearfuck1	404	40	68		t5_2r497	False
1354400918.0	144f03	Rampage has been found dead!	Bumthekz	398	50	15		t5_2r497	False
1365281303.0	1btchv	Cthulhuphant trying to gank a lane	VictoriaLust	391	42	21		t5_2r497	False
1373219991.0	1ht8oh	Rampage in the 1500s	RazorN6	404	54	18		t5_2r497	False
1322989539.0	mzm2u	The Brazilian Double Life	MenialTasks	444	98	38		t5_2r497	False
1372337630.0	1h6bhb	Just browsing IMDb when...	AxencoH	412	66	33		t5_2r497	False
1369237307.0	1eu86q	Standing in teamfights as Rhapsody	NotoriousNiklas	394	50	25		t5_2r497	False
1333268388.0	rnos8	Something happened to my HoN client. Anyone else get this?	Riddlerforce	440	111	18		t5_2r497	False
1343074833.0	x184e	New Summer alt avatar	golf_	368	63	41		t5_2r497	False
1326158510.0	oa4sp	Well I guess that's that	warchamp7	367	77	403	"As of yesterday, I am no longer a global moderator for Heroes of Newerth, I was forcefully removed from the team without even getting to post a goodbye. After 3 years or more of volunteering my free time to a game I loved, I eventually became too disinterested and inactive to warrant maintaining the status. As such, I think it's time for a nice big post. I warn you now I'm a terrible writer so I'm probably just gonna toss out a wall of rambling.

**The Beginning**

When HoN first entered beta, I got in relatively early through a friend. I was never a big dota player but I had played it ocassionally and had heard about LoL being in development (And expected terrible things simply because of the name). I enjoyed the game and ended up participating on the forums, including making a big mega thread at one point filled to the brim with hero information.

Eventually, as I do with most games, I started tinkering with the game files and I created a simple mod that put all the DotA names for items next to the HoN one in-game. It was crude and imperfect, but it got the job done. With that, mods for HoN were born and an incredible and talented community began to thrive, leading to the later creation of the mod manager. Shortly after I made that first mod and released it in the ""Interface"" section of the forums, it was altered into a modding section with me as the moderator in charge. Around this time, S2 was still a small indie company, with only 20 - 30 people total with nearly half of those being the artist team.

I joined a moderator team along with a number of other really cool people that I'm friends with still to this day. Most of them are listed on the [credits page](http://www.heroesofnewerth.com/credits.php) in the 'Moderators' section.

Looking at that list, I wanna quickly go over a couple of them.

**The Cool People**

Nome was one of the first global mods and a great contributor, eventually getting hired by S2 to work on design. He later brought his girlfriend who we all know as MsPudding on board. Both of them are amazing people that I am proud to call friends. As most of you should know however, they no longer work at S2.

China was a moderator for balance and rightfully so as capable of a player as he was. He was opionated though and as anyone might have learned, including myself, that's not generally too welcome in the HoN community, more on this in a bit.

ElementUser, my god what an amazing fellow. He's made so many improvement to HoN and supplied so many fixes to hero glitches it's absurd. HoN would probably be so much more worse off than it is without him.

Sucker is the worst ever, gggg.

Other people that deserve mentions: 

Idejder, who was at first a forum admin and was later hired. He does an insane amount of things for HoN that really don't get recognized. 

Maide, another global moderator who got hired and another very cool guy. 

Bangerz, a fantastic modder for HoN who was eventually made a global mod, and then like others before him, hired at S2.

SoundWizard, the man with the most fitting name, he's a sound design wizard that S2 was smart to hire, the work he does is fantastic.

A recurring theme with a lot of these people is that they were community contributors who eventually got hired. For a short time, S2 even had a junior staff role, which existed solely to recognize some of the moderating team that weren't actually employees. It gave them status as S2, but they weren't on payroll. I believe Tobias and another member of the tech support team were the first to earn that rank, with me being next after them. Eventually though, the rank was being thrown around too easily, and it was nuked.

A lot of you reading this probably recognize most if not all of those people I mentioned, and rightfully so, they're some of the greatest people working at S2. Well, actually, they're about all the great people working at S2.

That's not to say the other members are bad, but they are not as involved as the above were, because the above were all originally part of the community and stayed as that. I'm not trying to overlook people like Fielding, Brad, Gogo or the art team who are all fantastic people, but they along with my above mentions get horribly overshadowed by the ""bad seeds"" of S2.

**The Problems**

~~You know, there isn't really a number of problems with HoN. I have my rather infamous grudge with Diva and I really dislike his design decisions, but ultimately he was not the only person deciding everything. When Diva took over, there was a distinct change in direction for HoN, not controlled by him or any other designer. This change was shortly after the HoN store was implemented. Something that was created for one reason and one reason alone: Money. There is someone at S2 very obsessed with the acquisition of the stuff and I don't doubt it's any surprise to anyone who that is.~~

***The Addendum***

Since I'm under NDA from my fleeting time as Junior S2, I can't speak on certain things I know of internal S2 things and HoN, which is why this is all more of an opinion piece. It's come to light however that Diva might very well be as guilty as Maliken for HoN turning into what it has.

**The One Problem**

Maliken. This man is the poison that has killed HoN and ruined something that really could have been great. Nothing is changed in HoN without Maliken being okay with it and that's probably the worst thing in the world. It's a wonder HoN isn't worse off than it is right now and that's purely because people were able to talk him out of some really horrible ideas. He's a poor decision maker with a temper and he loves to kick down the doors of his employees who are doing their damnedest to create great things and instead have them do something to make him more money. Unfortunately, S2 wouldn't exist without him, since he's the man funding it all from the beginning, and also now pocketing the profits. You'd probably think it a great thing to be working at S2 but Maliken is probably the only one getting anything decent from HoN's success.

If I had to name anything else wrong with HoN, it would most definitely be HoNcast. Breaky and Phil are poor excuses for casters and their partnership with S2 impedes the rise of anyone else who might try to step into the light. Why should anyone try to became a great caster for HoN when S2 has an official outlet for it. To top things off, HoNcast is terrible, they're poor casters and it shows every single time they go live. If you don't watch competitive Starcraft 2, you should know that all of the big name casters for it are actually very capable players themselves, a couple of which were even professional players during the prime of Starcraft 1. Phil and Breaky are not on that same level when it comes to HoN.

**Closing**

Over the last many months, I've slowly lost interest in HoN, and it showed in my activity, thus the reason I was removed from the moderating team. HoN is not the game it used to be, it's devolved into a cash grab, and the passion everyone used to have for it seems to be fading. HoN has lost it's flair, LoL is a thrown together mess that doesn't feel like it meshes, and DotA 2 is plagued by nearly decade old mechanics and design choices that do not play well after the improvements HoN/LoL brought to the table. In the end, I feel like my time contributing to this genre is over. I will still probably play all three at various times, but I think all of them are too far gone for me to ever have the passion for them I once had for HoN.

To Fielding, Jason, Ikkyo, Jamestown, Shawn, Mercenary, Slacker, KingKtulu, Gogo, Phlogiston, Jesse, Shippy, Ari, Cracky, Konran, Chavo, Nome, Idejder, Pudding, Maide, Bangerz, SoundWizard, I give you my thanks for providing me with the game that I had a passion for unlike anything else before and for generally being great people. It has been a horrible experience watching such a fantastic product fade into what it has become; a shadow of it's former self and a mere glimmer of what it had the potential to be.

On the plus side though, I'm sure Maliken's got a fleet of ferrari's at this point, and that's what truly matters."	t5_2r497	True
1327388902.0	ou6u2	Heroes of Newerth in a nutshell.	middo	342	60	69		t5_2r497	False
1333935445.0	s0315	To the company that once filled me with so much hope and excitement.	bickymarnot	352	70	155		t5_2r497	False
1320873566.0	m6k26	Heroes of the Caribbean	Earthsea	312	33	23		t5_2r497	False
1329102135.0	pmwra	Every time I watch Game of Thrones....		359	82	64		t5_2r497	False
1303666265.0	gwe9s	S2 needs to see DEMAND from players for -ARDM game modes!	bballbt36	327	54	56	Hey guys, this is Bdiz from Evil Geniuses (formerly from SK Gaming, just left them though!) requesting upvotes to help show the demand for the popular FUN game mode from DotA, All Random Death Match.  For anyone not sure of what the mode is, essentially it's the same as playing a regular game of AR, except everytime you die you'll revive as a new hero.  The mode was originally in the beta version of HoN, however it was buggy and requires many hours of work on the development side to properly work in HoN.  [S2]Fielding himself has stated that they (S2) need to see a lot of demand before they begin working, do your part to make HoN a better game by upvoting this!  Also, make sure to vote in the poll posted on the HoN forums! http://forums.heroesofnewerth.com/showthread.php?t=251807	t5_2r497	True
1358229180.0	16lqqd	Jungler vs Jungler	vsquar3d	298	30	32		t5_2r497	False
1329581592.0	pvb8w	DW without a PK	SimplyHuman	292	40	26		t5_2r497	False
1346722288.0	zb8tz	C-C-C-COMBO BREAKER	biurb	279	36	15		t5_2r497	False
1355766362.0	1503gt	I found Devo's childhood picture.	VWEEEEDUB	282	36	15		t5_2r497	False
1354583915.0	148gaz	Tralf blasting hag	marcelpavoni	258	22	24		t5_2r497	False
1341846733.0	w9u0s	If the 1300's ever had a highlights video, this would be it. 	TheoColt	250	15	41		t5_2r497	False
1332380920.0	r7pms	The Legend of Brown Player	NutellaGrande	274	44	41	"*THE LEGEND OF BROWN PLAYER*
(non-fiction)

A chronicle by Catscratch, First of his name, 2012 AD


The tale begins in the first few minutes of one of many countless battles fought in Newerth.  Brown Fayde, who will be referred to under by his heroic appellation Brown Player, was reporting from the offensive lane that ""pred famr.""  We knew things were grim, as the deaths of brown fayde followed by repeated spam of ""gfuk"" ""fuk"" and  ""pred famr"" could mean only one thing - a monster was being created in the depths of legion bottom lane.


The rest of Hellbourne was not faring well either - a Vindicator defensive lane solo was at best trading blows with the legion offensive lane heroes.  Zephyr mid was going well, but as the game progressed, successive deaths were taking a heavy toll on his gpm.  A dark cloud descended on newerth.  All could feel the end coming as the Legion gathered for a push mid-lane, looking to sever Hellbourne reinforcements to that portion of the map.  Hellbourne's Lookout Bubbles makes his report over voice chat, followed by the heavy silence of acceptance. ""Predator, held fast by his retainer Empath, has a Doombringer.""  The hellbourne defenders braced for the end, determined to stand as long as they could before their Barracks fell under the immense weight of the Legions's farm.


Without warning, an opportunity for victory presented itself, and Vindcator embraced it.  Predator was push-staffed into the Hellbourne base, followed by a Global silence that allowed the Hellbourne team to train down the Legion's mammoth carry before his team could react.  The Doombringer hit the ground with a thud heard across the map, and when the dust cleared, Brown Player arose victorius, holding the great blade like Isildur held the One Ring.


**Let us pause for a moment, and contemplate the deep philosophical implications of this turn of events.  Brown Player, who could not spell ""farm"", had acquired a Doombringer.**


Hope returned immediately to the heroes of Hellbourne.  They planned feverishly to pass the Doombringer to Vindicator.  While his farm was not great, he was the best hope Hellbourne had.  Vindicator was no stranger to Doombringer pooling, and was comfortable with the item.  He almost exclusively plays low HP ranged carries.  He had trained for this day his entire life.  The team finally convinced Brown Player to Hellbourne ancients to pass the weapon, breathing new life into the near-beaten defenders.  Brown Player arrived first, determined to fulfill his destiny (or maybe it was just luck, there was no proof he comprehended the idea of doombringer at this point, understood its implications, or had any higher brain function whatsoever), only to see a half HP Legion Predator farming the Hellbourne ancients.  Hellbourne watched as Brown Player swung his mighty scythe, cutting through the enemy predator just in time to kill him before stun wore off.
As Brown Player started killing the ancients, suddenly Vindicator understood.  Much like Elrond watching Isildur turn away from Mount Doom, Vindicator realized an inflection point had occurred.  Brown player had finally comprehended the power of his inventory, and would keep the weapon til death did him part.


Hellbourne watched helplessly as Brown Player silently farmed, occasionally going to pick off enemy heroes.  Suddenly, an enemy Andromeda appeared on the minimap, well into Legion territory.  The pull of The One Doombringer was too strong for Brown Player, it corrupted him.  The feeble warnings of his teammates did not hold a candle to the allure of +250dmg to Brown Player's autoattacks - He felt invincible.  Brown player initiated on Andromeda, and the full weight of the Legion crashed into him.  The Doombringer, along with all hope for victory, was lost in a single instant.  A single ""fuk"" was the only thing that broke the sullen silence that had fallen over Hellbourne chat.  Empath grabbed the mighty weapon and disappeared into the fog of war.  A minute later, the message each Hellbourne defender dreaded most rolled across the screen: ""Empath has been slain by Neutral Creeps.""


A sucessful kick vote showed that all 9 players could appreciate the massive impact Brown Player left on the game.  **If there is a moral to be found in The Legend of Brown Player, it is that the best player on a team is almost always meaningless;  it is the worst player on a team you should fear.**"	t5_2r497	True
1329080848.0	pmgli	100% rated guide is 100%	cedwreck	280	56	17		t5_2r497	False
1359790341.0	17qtyt	Anyone else think these look terrible?	Ryurain	253	33	100	"[http://imgur.com/zY7eDwV](http://imgur.com/zY7eDwV)

These honestly look like they were drawn by a 8 year old and make me feel like I'm playing a trashy Facebook game. 

Edit: holy crap quite the discussion here, was hoping an S2 would tell us what's up with this.

Edit: [forums](http://forums.heroesofnewerth.com/showthread.php?479973-Does-not-fit-the-theme-of-HoN-3-0&amp;p=15555581&amp;viewfull=1#post15555581) being replaced. "	t5_2r497	True
1308131730.0	i06ps	Bubbles in a nutshell...	wondaboy	251	32	45		t5_2r497	False
1360953138.0	18lco0	bkid?	leep4	260	41	25		t5_2r497	False
1328120842.0	p6fbn	That Awkward Moment When You Realize...	DaBombbbb	285	61	20		t5_2r497	False
1332500254.0	r9td8	Its true.	Roflskates3	257	38	43		t5_2r497	False
1320644491.0	m384a	I was bored and made a wallpaper	warchamp7	234	21	68		t5_2r497	False
1360640565.0	18cthn	1800+ MMR Ophelia Players	BigPaenix	243	25	43		t5_2r497	False
1304178174.0	h0v28	Danger Monkey	pen0r	223	11	26		t5_2r497	False
