created_utc	id	title	author	ups	downs	num_comments	selftext	subreddit_id	is_self
1326307949.0	ocohc	In Case of Fire	thezhiff	129	22	8		t5_2r497	False
1323811362.0	nbh7i	I'm calling you out Bkid...	il0v3surf1ng	167	59	7		t5_2r497	False
1317012613.0	kriyw	Most embarrassing bloodlust ever...	PabloTheBear	120	10	14		t5_2r497	False
1311749294.0	j0xym	DAE give the S2 Gorilla a monocle at first load? :D	Those_Silly_Ducks	122	12	31		t5_2r497	False
1371764043.0	1gr601	Smyger released a new video	L0rdenglish	126	17	48		t5_2r497	False
1363468608.0	1afft5	people love rebecca black	Hannskii	140	30	34		t5_2r497	False
1361459869.0	18yggv	Solid Artillery Jungle Guide by Stonefain. 	Objuden	125	19	43		t5_2r497	False
1350799101.0	11u1dz	How I feel as melee carry when the enemy gets a Void Talisman	annuphix	136	28	7		t5_2r497	False
1349712252.0	11554t	Dotaboss - The Key of Destiny - (Xpost /r/leagueoflegends)	Tbau5	132	19	18		t5_2r497	False
1349527281.0	111fk9	What we get up too in Heroes Of Newerth	Mystogan	188	75	94		t5_2r497	False
1340941446.0	vs1ce	Why you don't want BR's on your team... (x-post from r/gaming)	chiubakka	151	40	34		t5_2r497	False
1327282675.0	os79h	Banana Scout 2.0 (plz bring to Newerth!)	youreastud	146	37	25		t5_2r497	False
1325032704.0	nsxt7	What I feel like when playing with friends new to this game..	samkxu	137	28	8		t5_2r497	False
1324320718.0	nirle	How I feel when I get ganked but then turn it around	n8bit	164	54	13		t5_2r497	False
1322074121.0	mmzm5	everytime i have to stretch my arm to grab something...	gottasay	136	29	8		t5_2r497	False
1318044509.0	l4tjg	Armadon + Monarch + Martyr = ...	NovaX81	119	9	20		t5_2r497	False
1313460870.0	jk0pd	S2Diva kicks WarChamp7 out of super beta	freewarchamp	146	38	200		t5_2r497	False
1376534268.0	1ke78v	How i feel when i still try to defend HON	apercots	136	28	42		t5_2r497	False
1371840898.0	1gt7gt	Imagine a mode...	S2Kros	129	17	68		t5_2r497	False
1370635672.0	1fvuc3	Yes, S2Games!	_ohaiThere	126	16	33		t5_2r497	False
1354954581.0	14hotg	HoN Top 5 Plays of the Week - December 7th	NinjaPT	124	15	27		t5_2r497	False
1341176486.0	vw5is	You're Gonna Have a Bad Time.	DrTrollenheimer	153	43	21		t5_2r497	False
1320621945.0	m2uov	How I feel when I decide to Solo Queue and my team picks their Heroes	NigmaNoname	129	23	33		t5_2r497	False
1319226927.0	lkafg	HoN Personalities	En1337ened	128	19	75	"I thought it would be fun to map out some common HoN personalities:

- **The Professor**: ""I'm not going to concede because then you won't learn anything""
- **Commander Taggart**: ""Never give up. Never surrender.""
- **The DJ**: mic comes on, garbled shitty music plays... all game.
- **Deaf Jams**: ""I can't hear you. Listening to my music.""
- **Rihanna**: Feel like you're the only girl in the HoN world? You are. And every guy reminds you that computers don't belong in the kitchen.
- **Fat Man**: When Silver Bullet isn't enough, there's always Level 5 Codex
- **Doomsday Prophet**: Oh God, they got First Blood. It's all over now. CC at 15.
- **The Deflector**: ""Damn dude, you were awful."" ""Yeah, but seriously, look at this 0-8 Glacius. What a trash bandit nubling.""
- **The Brown Noser**: ""[All] Every game, my team is trash. Blue, you were really good though. Give me your sympathies. Validate my life.""
- **Exlax**: I have to take a 12 Couric poop, but I'll start this game first.
- **Survivorman**: Deep in enemy territory. Alone. No TPs. No chance of survival.
- **The Shameless Self Promoter**: 1400 game, but still spamming ""Check out my twitch.tv stream! twitch.tv/SirNoobington""
- **Edgar Allen Poe**: Taunted by KingRaven, rage quits life.
- **There is a ME in Team**: Always half-way across the map when you need them most.
- **Mr. Magoo**: Apparently has no minimap and is oblivious to everything. Then gets pist when he dies, even though you told him about his impeding death.
- **The Big Mac**: ""I'll take that kill to go."" *Nighthound swoops in for a last hit, then retreats into stealth during a team fight*
- **Automatan 3000**: Auto-attacks throughout the laning phase. Never responds to you as a lane mate.
- **The Swimmer**: GG. Sitting in the pool spamming wards until we can CC.
- **Good Guy Glacius**: Wards all game. Maxes aura early on. Stacks and pulls. Only denies creeps and harasses. Never takes a kill. Dies numerous times so that the carry may live.
- **The Toyota**: We have a runaway Rampage who won't stop charging even though the target has retreated into tower range with 4 allies nearby.
- **The Smurf**: Aww, look at this cute little blue guy...
- **The Little Brother**: ""Sorry I'm playing so bad... I suck, this is actually my brother's account."" Sure Buddy...
- **The Human Scale**: ""Valk's arrow is so imba!"" ""Maybe you should stop running into it and standing still...."" If it killed me, it must be imbalanced.
- **The Economist**: Rages about how S2 is $2 and needs to stop charging for everything. Obviously, games with no business model are very successful.
- **The Gardener**: ""BRB, farming jungle for 30 minutes."" Tends to his crops, stacks them, gets into his zone and at peace. Meanwhile, the team is 0-22.
- **The Tattle-Tell**: Piss him off and he tells everyone your positions.
- **Techies**: If only Engineer had a suicide...
- **The Charter Subscriber**: With a ping of 1,000 ms, there's only one explanation. Charter Internet.
- **The Casual Gamer**: ""Sorry, it's hard to target with a tracking pad""
- **Syndrome**: Did he just make a sentance entirely out of f-bombs? Or does he just have tourettes?
- **The Double-Agent**: Trash talks his team so much, he's basically a 6th player for Hellbourne.
- **The Squib**: Born of a magical family, but cannot cast spells himself.
- **Master of His Domain**: Playing HoN, but apparently has entirely different objectives. ""Hey guys, check this out, I have 30 pets!"" or Never pushes, just tries to get the highest KD they can.
- **Leeroy Jenkins**: Oh my god... did he just go in? *Genocide*

Feel free to add your own in the comments :)"	t5_2r497	True
1317772434.0	l13j3	My attempt at being a master nerd...		145	40	69		t5_2r497	False
1314042782.0	jqwll	Drew bubbles in mspaint during a break at work	erockmazz	124	17	31		t5_2r497	False
1313579547.0	jlhkm	All things considered, at the end of the day this is the reason why I'm still playing HoN	rntksi	152	47	53		t5_2r497	False
1361815509.0	197bpx	Suggestion: Make an ingame betting system for HoNcast, where you can bet with silvercoins on a team	scantid	134	28	31	"Just an idea I had, but I think it would boost the viewercount on honcast, and give some extra thrill to viewers.

What do you guys think? Is it possible?"	t5_2r497	True
1358013971.0	16g1hv	HoN Top 5 Plays of the Week - January 11th	NinjaPT	125	20	27		t5_2r497	False
1356934855.0	15pnw1	Warpcleft is OP stop using him please. 	Ominous_Seal	129	21	26		t5_2r497	False
1354200817.0	13ztue	S2 and the HoN Community Donate $15,000 to the American Red Cross! 	ajdaughe	133	23	13		t5_2r497	False
1349366609.0	10xw7e	HoNTour Announced!!	Encaitor	132	23	92		t5_2r497	False
1344173004.0	xpozc	So I just won a 1v5...	Stod92	129	21	98	"Two team mates were afk during hero selection and didn't like the heroes they randomed. After dying within a minute of laning they both rage quit. Opponents refuse to remake. 5 minutes later my other two team mates leave and I'm stuck by myself. Typically I would just leave but I decided to play on as I was having fun, and ended up winning the match. 

Does this ever happen? I'm not claiming to be amazing at HoN but I found it pretty hilarious considering they refused to remake.

Match ID: 97183314"	t5_2r497	True
1338105601.0	u72pq	Devourer vs. Moon Queen	kutuzof	156	51	6		t5_2r497	False
1318309665.0	l7y8n	How I feel when someone else buys a ward when I'm playing support	gregsaw	148	42	14		t5_2r497	False
1308155727.0	i0ezl	Lulzsec just took down HoN	ysondre	134	30	121		t5_2r497	False
1301007217.0	gaueu	Let's get 1500 Chiprels faster by getting the 10 Dollar HoN sale to the front page on /r/gaming	PencilDragons	120	11	117		t5_2r497	False
1376336059.0	1k85q7	New Gunblade ult	tonny23	139	30	19		t5_2r497	False
1370202745.0	1fj9wx	Mindblow after soloq	peAkSC2	122	15	31		t5_2r497	False
1359140222.0	179pp8	I'm [S2]Kros AMA (now with other S2 members!)	S2Kros	129	26	518	"Hey all,

As announced earlier this week, I'm doing an AMA now! I asked around and got some other S2 members interested. I have with me today:

S2Deejay - DJ Hirko, Lead Programmer of HoN

Idejder - Alan Cacciamani, Lead Technical Designer

S2Bangerz - Ben Pettit, Lead UIX Developer

S2BladeRunner(s2malloc) - Paul Dziadzio, AI Programmer

Meeea - Mia Violet, Director of Spotlights

s2Maide - Ian Fox, Online Systems Programmer

s2xanderk - Ken Smith, Community Manager

And I'm sure others will poke their head in as the day goes on.

**Update**: Thanks all for the fantastic questions. I've started to slow down on answering but I'll come back and answer the ones I see through the weekend."	t5_2r497	True
1342786470.0	wvbxh	On behalf of Australians, thank-you S2 for finally adding Australian servers to matchmaking.	Magzter	118	16	46	"This has been requested ever since the first few months HoN was released.

I made a thread when I first purchased the game requesting this with plenty of back up from my fellow Australians. Back when Australian servers weren't even available for public games! 

The Aus servers for public games was a nice addition the Aussies fell in love with instantly, and now this has completed the game for me, I have no more wants from S2 other then to keep up the good work.

Again, thanks everyone at S2 for making this become a reality."	t5_2r497	True
1341980152.0	wda1u	It took a year but I can finally afford it!	Nemoder	129	24	40		t5_2r497	False
1336956663.0	tlpup	How I was privately removed from the Epoch Community	DivineWithin	131	25	120	"A little introduction to what Project Epoch is:  

Project Epoch is a clan in Heroes of Newerth created right after LN disbanded. This clan's only purpose is to serve as a way to help trainees under 1700 get better by having mentors volunteering to mentor the students that come to this clan seeking for help. Mentors are rewarded by gold coins as a little incentive and motivation to keep mentoring these trainees. 
***
Hello Redditors, some of you may know me as DivineWithin, or eC`cHi. I have been a member of Epoch Project ever since this clan was made, and have been in the LNCIP (Ludus Novicius Community Involvement Project), mentoring over 200 students and refining my ways of teaching players how to get better (for free!). I have been a dedicated mentor and have provided a loyal service to my trainees and administrators of the like for a very long time, mentoring hundreds of hours way before the coin system was introduced to this community, way before this community even reached 50 members.
 
Working alongside Yukari and the rest of the Epoch community, I have made great friends and established strong connections with the trainees I mentor, as well as other mentors, officers of the like. I have seen people come and go very fast, and I have seen people who have stayed with me for this long. But not this time, E.
 

My Story:
 

I had exams for the entire month of April, so I have not been able to be active mentoring people on Epoch for that duration. During this time, whatever free time I had was put into mentoring my current trainees as a way of taking a break, and then it was back to studying. After finals were done, I came on the forums and was introduced to Portal, a system created and used by mentors so admins can check minutes mentored and credit mentors for their work. I will keep from posting information related to how Portal works for the sake of privacy.
 

My style of teaching differs greatly from other mentors. I like to go beyond the scope of merely spectating a game and give scattered (although some would claim detailed) instruction whilst my trainee struggles with last hits and denies. I feel that they cannot get the most out of our time, so I supplement these sessions with game reviews, 1v1 private sessions, and skype calls after the match. For trainees that ask for it, I also mentor their future matches and try to work with them to identify their areas of weakness. I put a lot of work into helping my student improve their level of play and **all**, with no exceptions, have shown honest appreciation for my efforts.
 

During my stay in Epoch, I found that students need time to process and digest the information we try to provide for them. For even the simplest concepts, trainees may need to ask questions that require attention outside the game they just played. This is where I try to go the extra mile and offer my spare time on Skype to go over and review a game, sometimes for hours, without playing with them. This is my style of teaching. I talk to them for hours on end via Skype without them playing, and they sit and listen. Whatever questions they have, they are free to ask me without being under pressure, i.e. in a game. When I review concepts and mechanics to a trainee, I talk for over 2 hours at a time, sometimes making my throat hurt just because I truly want them to get better and enjoy playing HoN more. However, when a big misunderstanding like this that leads me into being exempted from Project Epoch without notice, it hurts, it really does.
 

When I explained this to RyanWenke (new GM hired by S2 in charge of publicity matters for Epoch, also the manager of Portal), this gentleman accused me of ""cutting corners"", or as a way of spending more time with students in order to try and get more minutes recorded down, getting more coins as a result of it. I tried to explain my situation with him and before I even got to 30% of my explanation, he laughed in my face and told me that talking on Skype with your trainees can already be done via chat mentoring function in game, and splitting up the times to talk on Skype would just cut corners for you to get more coins. I hope this is merely an understanding on his part, as he did not give me a chance to explain myself. I tried reaching out to him on Skype but it seems like he has no interest in contacting me. I find these allegations to be quite frankly insulting, and anyone who knows me will know this to be untrue. I've been volunteering my time, for free, as a member of LN for the last 2 months until they have disbanded. I've been in Project Epoch since the inception of the clan; and I'm in no way movitated by e-currency to help others.
 

After he discussed this with Visions, I have not heard of any of them since (Visions has not even bothered to PM me, requesting my side of the story). I was:
 
• Removed from Project Epoch silently without notice

• My orange name that I have worked hard for was removed

• Removed from the Epoch Chat Channel

• Demoted to a regular member on the forums
 

With all due respect Reddit, I thank you all for reading my concern. It was a very fun experience working with Project Epoch until ElementUser and Yukari left. People who do these things simply leave no feelings for the people that do the hard work, and everything done is done internally, without letting the public know about it. I am here to shed you some light on this, and how the mentors are really treated when something does not go their intended way.
 

To this day, I have been constantly taking in new students to mentor, and every single one of my students have gave feedback that my teaching style has been a tremendous help for them and it has benefited their game play by far. A lot of my trainees frequently offered to pay me back, some even gifted me gold coins without my consent because they know I will always decline it. I will still continue to mentor my current trainees who are on my Skype list, because I am loyal to them. Just because I have been booted from a non-profit community does not mean I am not able to teach.
 

My mentoring thread can be found [here](http://projectepoch.com/forums/showthread.php?t=49)

This thread [here](http://www.reddit.com/r/HeroesofNewerth/comments/irl2r/introducing_the_epoch_project_a_community/) is where it all started
***
**tl;dr:** Epoch silently kicked one of the first and oldest staying mentors from their community, and this is here because the post I make on the Epoch forums will be deleted and removed once the administrators find it.
***
**Edit:** For anyone curious, whether or not I get invited back to Epoch is entirely up to them. If they decide to invite me back in, this will hurt their reputation, and seeing that mentors are a renewable source, I highly doubt this possibility anyways. I will be continuing to mentor anyone that asks for help still, with the same amount of effort put into this as I have put throughout my days in Epoch. The only difference now is that it will be more of a challenge finding players who are willing to accept me as their mentor."	t5_2r497	True
1336368929.0	taryp	Sand Wraith Likes This	YeahVeryeah	128	25	9		t5_2r497	False
1297725280.0	flg0n	You asked and we delivered. Jon St John AKA Duke Nukem is doing an announcer for HoN	warchamp7	117	8	37		t5_2r497	False
1343596925.0	xcvtl	A change in career for Moraxus. - The Iron Chef	Broodje	136	31	12		t5_2r497	False
1329247526.0	pphs6	Stay calssy S2.....	skopey	148	47	45		t5_2r497	False
1320278264.0	lybmq	Shadycast &amp; col drama	mathlc	123	19	153	"http://pastebin.com/cgWTDEWN

"	t5_2r497	True
1361588187.0	1926vz	99% of the people that play HoN.	I_TriedThatOnce	143	41	29		t5_2r497	False
1356435996.0	15f22m	I was crucially stoned when I made and ordered this (MX Browns).	coldteeth	132	27	38		t5_2r497	False
1342217456.0	wisr5	As a support player, people like this (gray) fucking piss me off.	FrostyM288	141	37	73		t5_2r497	False
1338568209.0	ufsry	I think S2 is trying to tell me something...	Carniflex	126	25	8		t5_2r497	False
1337352102.0	ttb6n	Happy Friday! - A present from me to you!	S2HamOnRye	115	10	52		t5_2r497	False
1337042278.0	tnd0p	Follow-up on the shattered mousepad	NutellaGrande	118	13	48	"Hey dudes,

[I was that guy who raged hard a few weeks ago and shattered my mousepad.](http://www.reddit.com/r/HeroesofNewerth/comments/t6art/well_thats_just_about_enough_hon_for_me_tonight/)

Idejder mentioned in the thread S2 might send me a replacement mousepad - and he did, along with a few other things:

http://i.imgur.com/tqPsO.jpg

http://imgur.com/edZmi

The mousepad is signed by team Diva and team Dogkaiser, and the card is a code for 1000 gold coins.  Made for a pretty awesome evening after a long day at work.

Thanks for the love S2!

"	t5_2r497	True
1312084393.0	j4lg3	A video S2 needs to watch with the recent patch...	mot359	119	17	27		t5_2r497	False
1362759031.0	19x12l	HoN Custom Map: Cursed Quarry [Random Spells + CTF]	Copper40	121	21	77		t5_2r497	False
1333812131.0	rxwx9	Whenever someone calls MID MIA...	TheoColt	159	55	25		t5_2r497	False
1332224085.0	r4r0t	When I fail early game but our carry pulls off the WIN	DakotaDC	137	32	13		t5_2r497	False
1320854878.0	m670w	I play this game too much.	crazyapes1	132	28	38		t5_2r497	False
1302890306.0	gqwqn	I'm [S2]Nome, designer for HoN... AMA!	S2Nome	113	10	292	"Hello folks, I'm a gameplay designer for HoN. My ""duties""--if you can call them that--include creating and scripting new heroes and items, determining gameplay mechanics, and doing minor balancing. I am also working closely with interface and web programmers on a few upcoming additions to the game. Ask me anything!"	t5_2r497	True
1366407111.0	1cp9dj	Maliken responds to some of the recent issues	Plfdsiokf	122	18	112	"Forum thread http://forums.heroesofnewerth.com/showthread.php?492248-If-it-s-true-you-consider-Breakycpk-expendable-You-re-nuts

Screenshots for summary http://imgur.com/a/iHFKv#0"	t5_2r497	True
1366110391.0	1cgdjj	Losing? Make art!	TechnicalHiccup	128	22	21		t5_2r497	False
1360783595.0	18gmx2	When ANYONE on my team gets Bloodlust.	BigPaenix	140	36	17		t5_2r497	False
1354334931.0	1437mv	A tribute to our silent champion: tommy9k7	plopliar	125	23	24	"Me and 3 friends were playing HoN one night a couple weeks ago. We are all in the high 1600s, except for one  who is 1790. Our random on our team was a brown player by the name of tommy9k7. He picked pebbles and  went mid.

He then proceeded to demolish mid, as well as the rest of the opposing team. We requeued with him several times after this. He went mid every time as brown, and every time he completely destroyed the oppostion.... and he never said a single word.

He carried our team each and every time. Never spoke a word. Never said anything over chat. Just silently won the game for us over and over. Never asked for wards, never said anything.

Then after the 5th game or so of him going immortal, he was done. And then he spoke for the first, and last time. He said:

&gt;Thanks.

And with that he disappeared into the shadows of newerth, never to be seen again.

No, tommy9k7, thank *you.*"	t5_2r497	True
1343103408.0	x21n0	This is where the action happens in Caldavar cool heat map	lorrim	119	17	33		t5_2r497	False
1324571837.0	nmr2a	When pubs try to imitate the pros [x-post from r/DotA2]	evirdrevo	124	23	16		t5_2r497	False
1320814335.0	m5qzn	Torturer jukes Plague Rider	pablolanke	115	12	27		t5_2r497	False
1308823899.0	i71nr	Wildsoul IRL	elrzepo	115	10	13		t5_2r497	False
1308154351.0	i0ecq	Heroes of Newerth: Legendary by RaViJ	ysondre	113	11	51		t5_2r497	False
1371005233.0	1g64zi	My New Mousepad	Minty_252	128	27	45		t5_2r497	False
1328624940.0	peojx	S2 you need to fire whoever did this. It looks like shit.	milk2stronk	157	58	44		t5_2r497	False
1303856031.0	gy4ds	If this is you... I hate you	DivineBurke	115	14	25		t5_2r497	False
1371910172.0	1gutjo	Some HoN shirts I made	derGigi	111	10	72	"Hey everone,
these shirts are quite 'old' for me now, since it's been a while that I've made them. Finally I've got some time on my hands and decided to upload them - yay!

http://imgur.com/a/GgUVv

Any feedback is welcome! I planned to do some more, but did not get around to it yet. I still have many ideas floating around in the back of my head.

Personally, I love the gg-cc-15 and the pubtrain shirt. While the codex5 shirt was the most work, I feel the print is too small - so I blew it up on the preview. If I decide to print it again (maybe for one of you guys?) I would print it bigger.

Anyway, would appreciate any and all feedback! 

---

*UPDATE* Holy crap, thanks for all the feedback folks! I will definitely find a way to make them available. Unfortunately I am currently in Egypt and have lousy Interwebz - but I'll be back home in a week and update you guys asap. Thanks again, you guys are awesome! 

---

*UPDATE2* Shirts are online! [New thread!](http://www.reddit.com/r/HeroesofNewerth/comments/1iwjzi/update_some_hon_shirts_i_made/)

---

Cheers,
gi

P.S: Train vector graphic from [keepdesigning.com](http://www.keepdesigning.com/vectors/10-train-vector-graphics/)"	t5_2r497	True
1362135761.0	19ggvd	Duckboots.	Fujikawa28	126	29	9		t5_2r497	False
1358872038.0	1727b4	3.0 Preview trailer	TomaTozzz	121	23	84		t5_2r497	False
1356372348.0	15ds83	BR? BR? BR?	_UsUrPeR_	123	23	12		t5_2r497	False
1336102728.0	t6art	Well, that's just about enough HoN for me tonight.	NutellaGrande	116	16	37		t5_2r497	False
1333006120.0	riy7b	Highlight of the Night ft. Bdiz	LoveofGaming	131	28	18		t5_2r497	False
1326752862.0	ojwdk	Monarch &amp; SchlongCast	youreastud	132	34	22		t5_2r497	False
1319160203.0	ljebx	legionnaire longest charge ever !?	DarkMsn	110	12	13		t5_2r497	False
1313411426.0	jjap8	Myrmidon: The hardest carry known to man	NigmaNoname	130	30	77		t5_2r497	False
1312432041.0	j8hcg	Today I tried to see how low I could get my APM and still win a game	Strayl1ght	116	14	33		t5_2r497	False
1307979085.0	hykfr	so jera, why do you have 3 duck boots?	Baggiez	115	14	35		t5_2r497	False
