created_utc	id	title	author	ups	downs	num_comments	selftext	subreddit_id	is_self
1344431824.0	xvny3	One of my favourite moments from season 5	fudgebucket27	490	59	30		t5_2s28b	False
1361323763.0	18uuor	Frank on Acid	Benneke10	503	75	20		t5_2s28b	False
1358180637.0	16k1xo	I know pictures of Mac's Tavern in Philadelphia have been posted before, but I wanted to show you guys what it looks like as soon as you walk in.  You can tell they tried to make it look like Paddy's	shadowslayer978	504	77	59		t5_2s28b	False
1325317134.0	nxbg5	"""Recently was in the hospital and this was by my bed""
(x-post from r/funny)"		470	39	9		t5_2s28b	False
1367078131.0	1d7xq5	SHUT UP DOG!		486	58	20		t5_2s28b	False
1342104038.0	wfyhd	Watching Parks and Recreation ... Paddys?	twombles62	509	82	40		t5_2s28b	False
1341383955.0	w0rr8	I'm gonna rise up	hero0fwar	479	58	30		t5_2s28b	False
1349666096.0	114bfw	The Dynamic Duo	fuzzypits	475	48	5		t5_2s28b	False
1340232250.0	vcp4o	feelings	hero0fwar	469	48	16		t5_2s28b	False
1337122562.0	tozu4	A day at the spa		498	73	10		t5_2s28b	False
1358781988.0	16zp64	Found her watching Shameless. Some things never change. 		520	96	22		t5_2s28b	False
1354746852.0	14cjpb	What I think whenever this happens...	joehasthisname	457	35	7		t5_2s28b	False
1374086486.0	1ii4gs	"""Damn dude, you can draw. I'm getting kind of, like, a little flustered here."""	huemanateee	485	62	3		t5_2s28b	False
1373549133.0	1i2tos	The cops don't seem to like Dee's dancing.	Latirem	518	102	12		t5_2s28b	False
1352077007.0	12n2rk	The cast stopped by my school today and met some pretty neat friends 	HBPBeatbabies	457	39	47		t5_2s28b	False
1336423277.0	tbq4u	D.E.N.N.I.S	Shit-Barometer	510	83	18		t5_2s28b	False
1335721859.0	syds1	this is me whenever I am browsing /r/IASIP	wharma-kore	510	88	5		t5_2s28b	False
1366831751.0	1d12l9	I have created... A masterpiece	Laurenanne727	494	73	17		t5_2s28b	False
1330441719.0	q9qlp	anytime someone starts talking about shit that is over my head...	hero0fwar	437	23	5		t5_2s28b	False
1359166421.0	17alfp	...and friendship for everyone.	yellow_buzzard	470	54	11		t5_2s28b	False
1334443063.0	sa1wd	Charlie Day at his finest. 	shrugalicious	484	71	17		t5_2s28b	False
1369892942.0	1fbkot	The Implication.	JDCarpenter91	475	63	41		t5_2s28b	False
1368138064.0	1e1413	Mac's ocular patdown	WHAT_HAVE_YOU_DONE	461	48	8		t5_2s28b	False
1343548397.0	xc2u5	Rum Ham Wallpaper	onmelanchollyhill	455	41	12		t5_2s28b	False
1369524393.0	1f1yo4	"""Just a couple of people who totally got off.. bro"""	H1dden	463	54	36		t5_2s28b	False
1347198776.0	zlnns	"Whenever I hear ""Higher Love""..."	Th3_Fu22	463	57	11		t5_2s28b	False
1340753195.0	vnmym	One of Frank's finest moments	Leinadz	475	68	35		t5_2s28b	False
1371348648.0	1gfkpo	I picked up this print at the Denver ComicCon for a friend. Figured you guys would appreciate it.	jukejointj	462	59	13		t5_2s28b	False
1345653728.0	yn85q	You gonna get mad? You gonna turn into the mad munchkin?	King_Slayer_Slayer	460	49	16		t5_2s28b	False
1368203574.0	1e2rk2	Lizard, am I standing in poop??	Laurenanne727	460	52	9		t5_2s28b	False
1352555427.0	12yntv	How Charlie Downvotes (x-post from r/gifs)	sgtcjl	495	89	9		t5_2s28b	False
1351023935.0	11yrbk	This is the ONLY subreddit that I feel safe posting this gif....	iiiicpdiiii	451	49	18		t5_2s28b	False
1376270279.0	1k6ekw	Retarded: 5, Normal: 0	sniffbrocaine	479	70	26		t5_2s28b	False
1375903630.0	1jwjgr	What is White Trash about this??	CircularJerkuler	476	70	14		t5_2s28b	False
1369593423.0	1f3cmm	The official drink of Jabronies everywhere!	Tank_gamer10	476	67	27		t5_2s28b	False
1368997587.0	1enhnb	"""Oh, those disgusting ex-girlfriend porno sites. I mean there's so many of them, though. Which one? Which one did he post them to?"""	ChillWithBenjamin	486	85	5		t5_2s28b	False
1335188039.0	so4k9	He’s a … juggler. 	wharma-kore	467	65	11		t5_2s28b	False
1329231485.0	pp4x1	Milk steak boiled over hard with a side of your finest jelly beans, raw.	Raoul_Digby	492	82	40		t5_2s28b	False
1333664652.0	rvc9c	Nothing Sexual	FrostofAeons	455	50	9		t5_2s28b	False
1376237931.0	1k5dz5	Can't you see how retarded she is?	BUKKIKEA	486	84	20		t5_2s28b	False
1337183398.0	tq38u	Do i look suspicious	default112	478	75	9		t5_2s28b	False
1346117548.0	yxqhb	My favorite shirt	Kurtmcgurt	447	50	5		t5_2s28b	False
1325047565.0	nt79i	Probably my favorite moment from season 6	swordyface	429	32	6		t5_2s28b	False
1358284901.0	16n3av	Storm coming? Hatchet coming.	UltimateChill	463	70	7		t5_2s28b	False
1336515296.0	tdnaq	are you drinking sunscreen?	wharma-kore	442	44	17		t5_2s28b	False
1371528542.0	1gkcmr	Sweet Dee has been drinking too much wine in a can	beherns	525	130	6		t5_2s28b	False
1369713380.0	1f6hfz	Spotted a potential match for Charlie in Season 4 of Arrested Development	kegs	477	78	39		t5_2s28b	False
1357916871.0	16dqp7	Wild card, bitches [Tattoo]	Sheylian	519	124	26		t5_2s28b	False
1355949625.0	154lb9	Even when he's fat. 	thejozoflife	464	75	28		t5_2s28b	False
1332702072.0	rczfh	I dressed up as a Mexican gangster last night, but I kept getting asked whether I was supposed to be Mac's dad.	lorcantc	472	81	15		t5_2s28b	False
1370019519.0	1few3j	Charlie is one litigious Mo'Fo'	friskydingo67	456	62	11		t5_2s28b	False
1362411252.0	19n3uh	Kind of comes out of nowhere....at least it's classy	taterNuts	456	60	29		t5_2s28b	False
1351261982.0	124hx3	Her breasts. Were awesome.	montani304	458	60	49		t5_2s28b	False
1368742831.0	1eha7j	Call me Dr. Mantis Toboggan	Jaylee9000	449	59	26		t5_2s28b	False
1356392082.0	15ea6l	Bitch!	m84m	437	46	20		t5_2s28b	False
1350882225.0	11vrhd	An original Charlie Day!	polska1717	438	48	5		t5_2s28b	False
1347607411.0	zv863	When the Prez got picked up this week...	pquegg	448	59	15		t5_2s28b	False
1342374899.0	wlmrp	One of my favorite Charlie moments	diehardcubforever	437	50	12		t5_2s28b	False
1338997884.0	uo3a7	It's Always Sunny In Pixel-Delphia		433	41	21		t5_2s28b	False
1371817447.0	1gsgpp	I just don't think there's any science to support that	wharma-kore	443	58	24		t5_2s28b	False
1374878345.0	1j4lba	Ladies and gentlemen, we are Electric Dream Machine.	maebybluth	439	53	18		t5_2s28b	False
1367962418.0	1dw08u	I tear up every time.	ibaadk	436	50	29		t5_2s28b	False
1348332770.0	10awx1	Girl I was talking to told me she didn't think the show was funny. 	7Snakes	455	65	22		t5_2s28b	False
1371423792.0	1ghajq	I'm gonna fire a beer across his bow. Ruffle his feathers.	vera214usc	434	47	23		t5_2s28b	False
1368715619.0	1egbe7	Hey, nobody minds if I do a little dancing right now, do they?	Laurenanne727	441	52	20		t5_2s28b	False
1368332280.0	1e61rd	The Special Agent Jack Bauer	DavosSeawart	443	60	18		t5_2s28b	False
1365267315.0	1bswsx	Disgusting Animal	atticus138	450	65	17		t5_2s28b	False
1368916912.0	1elmbp	OK, Here's what we're going to do, We're gonna hit the ATM, grab some money... but only enough to have a quiet night out.	prometheuspk	446	58	10		t5_2s28b	False
1368640448.0	1ee8y0	"""Slow...slow..."""	TheLurkingCrow	463	77	24		t5_2s28b	False
1363419944.0	1aefxn	Was watching interviews and this was my favorite part from all of them 	FunkyFro	427	47	27		t5_2s28b	False
1352934511.0	137hae	Frank doesn't like your post.	paulfknwalsh	418	35	4		t5_2s28b	False
1372379308.0	1h7sem	Frank and Barbara	atticus138	432	47	13		t5_2s28b	False
1353347863.0	13gkdb	How I feel every time I post something on reddit.	BillionBeast	447	62	16		t5_2s28b	False
1344318557.0	xt6ki	If only this were possible	blackmamba888	433	49	23		t5_2s28b	False
1351351443.0	126b9f	A post made 7 years ago on Rob's IMDB page	likwitsnake	449	68	35		t5_2s28b	False
1374356631.0	1ipsud	Broke up with my girlfriend of over a year. This line sums everything up at the moment.	alfrocks	429	51	14		t5_2s28b	False
1347775289.0	zymp4	We're lawyers!	OliRanson	436	55	16		t5_2s28b	False
1363031067.0	1a3k2v	I went out partying over the past weekend and wore this shirt. I figured you guys would love it! 	Loweded	522	140	32		t5_2s28b	False
1335656699.0	sxgcq	Day Man (x-post from /r/wallpapers)	hero0fwar	409	27	24		t5_2s28b	False
1373664405.0	1i6ik0	Don't let him rape you, Philadelphia.	spoonlessjoe	444	68	8		t5_2s28b	False
1372188674.0	1h22fi	one of my favorite moments from the christmas episode	davidistheshit	435	58	39		t5_2s28b	False
1370661834.0	1fwojg	Game of Thrones writers wrote the majority of an episode for the new season of It's Always Sunny	tecocrep	429	47	36		t5_2s28b	False
1356792536.0	15mis0	"""This may be the darkest thing we've ever done."""	rumhum	415	36	27		t5_2s28b	False
1372688506.0	1hfdh7	Your mom doesn't know dick. She's a dumb, fat, cow. And your sister, she is a stupid little shit-mouth bitch, isn't she?	AdioSiks	441	65	22		t5_2s28b	False
1368559085.0	1ebzl9	I'm a handsome companion, who goes to nice dinners with fancy women	VictorBlimpmuscle	424	50	17		t5_2s28b	False
1373824087.0	1iaam2	Oh you want feelings? Doctor jinx has something for feelings.	slim2323	441	67	17		t5_2s28b	False
1336641865.0	tg8kt	"""What has Frank been doing in the basement this whole time?"""	argon1028	410	31	23		t5_2s28b	False
1370961509.0	1g4fhk	It's Always Sunny In Philadelphia Season 9 - Promo Trailer (FXX Teasers) - Funny promo bits for a Swedish channel [x-post /r/sweden]	rubixqube	418	43	56		t5_2s28b	False
1369949667.0	1fd3a7	out of all my friends i am apparently the only one willing to buy tickets to this musical	batman2001	429	55	45		t5_2s28b	False
1368287774.0	1e4scx	Charlie's buttdance	Redditwho1	430	59	12		t5_2s28b	False
1367541813.0	1dl7hh	That's Rob Thomas. Matchbox 20. Sing a song. Shut up.	AndyRullo	414	44	17		t5_2s28b	False
1359432264.0	17h5tx	One of the funniest scenes (video in comments.)	strallweat	448	76	34		t5_2s28b	False
1354061116.0	13wix3	The Main Reason to Go to Philly	AUflyguy	419	47	14		t5_2s28b	False
1365832404.0	1c999x	The Nightman	atticus138	444	66	16		t5_2s28b	False
1335104615.0	smmoi	been trying to find the download link all morning, still no luck	god0fwar	401	32	13		t5_2s28b	False
1350663291.0	11r4d0	HOLY SHIT	Senseitaco	449	79	30		t5_2s28b	False
1350561182.0	11oo1c	Ahhh, marital bliss..	slideyep	428	60	15		t5_2s28b	False
1349610783.0	1131qf	this is the week!!!	beerMEplease	417	44	17		t5_2s28b	False
1375948696.0	1jxzp3	Roundhouse kick	MrSlowrolla	431	63	11		t5_2s28b	False
1353212134.0	13duv4	Quite possibly my favourite scene between these three.	PAlove	405	31	20		t5_2s28b	False
1355418854.0	14sk07	Man hunters 	jboozer	431	57	20		t5_2s28b	False
1344529912.0	xy25n	There's not enough salt in the world	darlingbudsofmay	416	47	26		t5_2s28b	False
1336744612.0	ti5iz	it's like my new thing	wharma-kore	430	57	20		t5_2s28b	False
1364243297.0	1aztyp	Viggo Morgenstein	hate_tank	416	52	11		t5_2s28b	False
1352959699.0	1387j6	Spotted this in r/NFL. Thought you guys would enjoy.	Phthalate	421	57	7		t5_2s28b	False
1375877825.0	1jvn1n	what's your spaghetti policy here?	wharma-kore	427	56	24		t5_2s28b	False
1372864083.0	1hkjh9	Dee's face says it all	Laurenanne727	437	72	28		t5_2s28b	False
1351535003.0	12adlg	Living on the East Coast this is all I can think about Hurricane Sandy (FIXED)	trollinDC	427	60	11		t5_2s28b	False
1374562340.0	1ivcl6	THERE AIN'T NO JESUS HERE...EXCEPT ME I'M JESUS	HEELHousell	424	62	24		t5_2s28b	False
1351172623.0	122cch	The greatest shirt I have ever gotten from someone, I wear it all the time now	redsoxfan8227	409	44	12		t5_2s28b	False
1366038042.0	1ce4az	Happy April 15th	Sonofbilly	420	56	21		t5_2s28b	False
1361242196.0	18skmy	I AM LEGEND	SemajSemajSemaj	419	54	24		t5_2s28b	False
1356882512.0	15obxt	Experiencing reality	taterNuts	408	47	18		t5_2s28b	False
1371398517.0	1ggjg3	See that door right there?	josshhhh	418	58	15		t5_2s28b	False
1338184082.0	u8c9n	I think Charlie would really benefit from visiting this Golden Corral.	onmyhonor	403	38	5		t5_2s28b	False
1376485759.0	1kcg9e	"""I like you too new charlie! New charlie...."""	GRAMMARNOTGRAMMERFFS	424	64	31		t5_2s28b	False
1373134625.0	1hrc0x	Born in a pool of gasoline.	bunnysmacker	423	68	6		t5_2s28b	False
1367239700.0	1dc1vz	"S07e01 Frank's Pretty Woman - Frank finally admits to being Charlie's father - He shared half his ""genes"""	eudaimondaimon	415	53	16		t5_2s28b	False
1365449479.0	1bxqge	Whats the name of this dance again?	TheMoz	404	51	28		t5_2s28b	False
1369090155.0	1eq4gg	"Mr. Kelly, in your sworn statement to police you claim the prisoner told you that if you didn't, and I quote ""Jam a bnch of stuff up your butt, he would rape you so hard the room would stink, and then he would eat your butt and his son's butt in the stink until his stomach was full of...your butts."""	PepeLaRue	400	44	11		t5_2s28b	False
1365794331.0	1c83o4	Hilarious ad placement on the Nightman Cometh video	ryanoh	426	76	11		t5_2s28b	False
1362303834.0	19kkdx	Ladies and Gentlemen, Charlie Kelly..	slideyep	440	82	16		t5_2s28b	False
1366766351.0	1cz8dk	Paying tribute	the_ant_i_drug	388	32	13		t5_2s28b	False
1353269311.0	13et59	I love charlie		406	48	14		t5_2s28b	False
1339461517.0	ux2ji	let's say you and I go toe-to-toe on bird law	moonman404	391	40	16		t5_2s28b	False
1376190936.0	1k4izg	Beads?	atticus138	428	73	24		t5_2s28b	False
1345847882.0	ys1my	Found this awesome drawing of Frank. Want this on a T-Shirt so bad.	WildPrawn	393	38	16		t5_2s28b	False
1376162492.0	1k3q0k	Charlie in Lethal Weapon 5 is priceless.	shitasscuntniggadick	392	37	21		t5_2s28b	False
1361617008.0	192q8k	My fave Frank reaction/face	slowro	388	39	24		t5_2s28b	False
1358697303.0	16xl0y	Computer Virus	beerMEplease	409	63	13		t5_2s28b	False
1347919470.0	101mxd	The Boys Are Out Tonight	AUflyguy	389	36	10		t5_2s28b	False
1365542432.0	1c0m79	Season 9 begins. (posted on Danny DeVito's Twitter)	billmeister123	409	58	59		t5_2s28b	False
1337047275.0	tnhn4	I detailed all the IASIP Philadelphia locations on Google Maps. I've posted this before, but I've since updated it...plus its my cake day. So suck on that white stains.	PhillyGreg	398	47	20		t5_2s28b	False
1330237046.0	q6fnr	I shouldn't be surprised that this is the first thing I see at Philadelphia airport shops when I land.	Estoye	369	21	20		t5_2s28b	False
1374744747.0	1j0o1u	Handsome [gif]	atticus138	397	51	11		t5_2s28b	False
1352843275.0	13581a	"""...You ate a whole block of cheese before a date?"""		393	48	28		t5_2s28b	False
1343353938.0	x83i4	Glenn on what Sweet Dee would look like with steroids	literaturefracture	413	62	21		t5_2s28b	False
1322510416.0	mscra	Cats	Slartibartfastibast	363	16	13		t5_2s28b	False
1376583744.0	1kfd10	One of my favorite scenes. Just so wrong!	TrapperKeeperGuy	404	57	11		t5_2s28b	False
1357249587.0	15wszb	'Oh Charlie, what are you trying to tell me?'	k726xah	405	58	20		t5_2s28b	False
1351460118.0	128l5v	I was in a club last night and had no idea how to dance. Until I thought of this. 	ponies_lol	387	41	9		t5_2s28b	False
1345262015.0	yewhv	Cat in the Wall	gerntoronto	403	57	15		t5_2s28b	False
1362704584.0	19vrsk	"My favorite scene from ""How Mac Got Fat"""	SAMISNEAT	401	54	16		t5_2s28b	False
1340464544.0	vhghu	I'm sold	wharma-kore	405	57	10		t5_2s28b	False
1360117344.0	17z2l9	My friend told me she has a pack of feral cats outside of her apartment at night.  I gave her way to sleep through it.	jstag	392	47	11		t5_2s28b	False
1358225190.0	16lmgi	My thoughts on the starting of the NHL season in the words of Dennis Reynolds.	amorningofsleep	405	65	16		t5_2s28b	False
1354744639.0	14ch39	My favorite scene... ever...	Applepappel	414	67	17		t5_2s28b	False
1360433499.0	1879rw	I run into a lot of hornets in my line of work.	HarrisonBergeron93	394	53	19		t5_2s28b	False
1341334053.0	vzhn3	How i feel when job searching...	roninh8	499	161	23		t5_2s28b	False
1330837812.0	qgtxv	The original lyrics to Night Man	CobraStallone	361	21	11		t5_2s28b	False
1369799686.0	1f8y4z	Don't know if anybody noticed this IASIP cameo in the new season of Arrested Development yet.	GrryScrry	472	137	21		t5_2s28b	False
1362622895.0	19th6t	You get fork stabbed!	Liam_McPoyle	397	54	13		t5_2s28b	False
1360440615.0	187hu0	You could chop a camel right in the hump and drink all of it's milk right off of the tip of this thing! [S03E01]	Simbrian	387	45	11		t5_2s28b	False
1376607184.0	1kg8m2	"""Would you like a spot of tea?"" ""Ye-eeeees!"""	reddit858	381	42	21		t5_2s28b	False
1365957500.0	1cby13	You gotta make it sexy! Hips and nips, otherwise I'm not eating.	RickyBigRigs	429	84	14		t5_2s28b	False
1352334510.0	12tuxo	Went out and found this today	sholia	386	52	11		t5_2s28b	False
1372787380.0	1hidkz	I CUT THE BRAKES!	HumeCreative	395	60	16		t5_2s28b	False
1348034575.0	104hlg	Created this gif from one of the better episodes	Renson	371	34	34		t5_2s28b	False
1347408642.0	zqlhz	Beard Of The Week	BrianTheLady	388	51	8		t5_2s28b	False
1374301489.0	1ioli2	BECAUSE I'M WANTED....	HEELHousell	385	44	11		t5_2s28b	False
1374785222.0	1j1w90	It's Goddamn bright out here.	SirKennithNoisewater	390	51	14		t5_2s28b	False
1364055889.0	1av47k	Best $5 ever spent	mr_moptastic	406	71	20		t5_2s28b	False
1351079138.0	1201ol	Bribe	hero0fwar	378	49	6		t5_2s28b	False
1364362550.0	1b3gde	Did you fuck my mom? DID YOU FUCK MY FUCKING MOM, SANTA?	Seggli	373	40	18		t5_2s28b	False
1336244164.0	t8nna	This Always Sunny fan knows how to protest.	BigPapaZ	427	97	17		t5_2s28b	False
1356894789.0	15oltl	"""I am presenting myself as a powerful lady.."""	taterNuts	380	49	10		t5_2s28b	False
1344381399.0	xum0p	A Vote for Dennis Reynolds is a Vote for Underage Rape	AUflyguy	394	60	17		t5_2s28b	False
1334593711.0	sckfn	Real. Boiled. Denim.	CoupleADicksInAYard	386	55	10		t5_2s28b	False
1329762794.0	py2sn	Hulk Hogan	turdmalone	414	83	21		t5_2s28b	False
1368118361.0	1e0dw5	We be cool. We're even now. Bump it.	Laurenanne727	367	37	17		t5_2s28b	False
1355761717.0	14zypo	Noticed some excited extras..	Russian_Unicorn	383	50	24		t5_2s28b	False
1348945358.0	10oeha	You take my breath away....	slideyep	373	45	12		t5_2s28b	False
1339368030.0	uv78d	Nothing Sexual!	JesseJaymz	371	41	10		t5_2s28b	False
1332614113.0	rbnp0	Just found out some of my Facebook friends are fans of It's Always Sunny	eissirk	379	49	18		t5_2s28b	False
1368510690.0	1eas9g	Classic frank. His lines always make me laugh.	justthatbroman	386	62	18		t5_2s28b	False
1343871732.0	xjfr1	YO IASIP fans! Look who I met! 	wasabishooter	406	75	77		t5_2s28b	False
1333233574.0	rmydi	a spa day	hero0fwar	378	51	7		t5_2s28b	False
1324329698.0	nixvr	Scumbag Dennis	cavity_creeps	361	35	27		t5_2s28b	False
1376535006.0	1ke83w	"""We need to split them up."" / ""That's a good idea. How do you propose we do that?"""	MadderR3d	365	37	20		t5_2s28b	False
1360334138.0	184roj	Chardee MacDennis: The Game of Games	phelinephile	385	57	25		t5_2s28b	False
1351401317.0	127hzr	"""Hello fellow American. This you should vote me. I leave power good. Thank you, thank you"""	goblinskill	370	45	16		t5_2s28b	False
1372743553.0	1hhauj	Charlie meets a jockey for the first time. S3:E12 The Gang Gets Whacked: Part 1	lostinthesnow	358	35	6		t5_2s28b	False
1372764189.0	1hho2m	Words of wisdom from Frank	Antrikshy	374	53	11		t5_2s28b	False
1366991538.0	1d5rg6	"Their faces get me every time.. ""Fake out!!"""	Laurenanne727	389	69	10		t5_2s28b	False
1340665747.0	vljsi	I guess someone forgot to tell Sandusky...	RobotRollCall24	399	74	20		t5_2s28b	False
1374946376.0	1j63ib	You don't WANT to salt the Snail, but she leaves you no choice!	maebybluth	362	38	20		t5_2s28b	False
1359408269.0	17ga59	Show us where he touched you Charlie.	Jesus_Took_My_Wheel	352	33	20		t5_2s28b	False
1350761509.0	11t5z1	Martina Martinez telling the truth	YouAreSoLying	375	49	27		t5_2s28b	False
1362707971.0	19vvu6	Sandra… you dumb bitch	AlmostSeenOn	351	31	5		t5_2s28b	False
1357130478.0	15tncv	gun fever	beerMEplease	373	53	6		t5_2s28b	False
1326420428.0	oetuz	Spotted this familiar building on Parks &amp; Rec tonight...	rbeezy	329	7	30		t5_2s28b	False
1367168241.0	1da2lj	Take my breathhhh awaaaaaaaayyyyy	DieGo2SHAE	385	66	9		t5_2s28b	False
1366216813.0	1cjii5	Honey and Vinegar	Doc_MantisToboggan	333	17	12		t5_2s28b	False
1359232984.0	17bydc	You two have boyfriends? How did you not know that the reason I invited you back to my bar was to bang you?	7Snakes	368	50	13		t5_2s28b	False
1329440043.0	pt5g5	"""We're lawyers"""	hobelife	359	40	15		t5_2s28b	False
1351803834.0	12h7ry	Sweet Dee Cameo in latest South Park Episode (well, not really...)	eIectricsheep	390	73	14		t5_2s28b	False
1339977960.0	v76rd	a spa day	hero0fwar	373	56	6		t5_2s28b	False
1339736297.0	v2yug	the whole time	rbooo	357	37	7		t5_2s28b	False
1325843341.0	o59hy	Found this gem in my pics folder. Thought you guys might like it: Charlie from Hundred Dollar Baby		347	25	10		t5_2s28b	False
1371866253.0	1gu0o8	"Season 6 Episode 5: ""How is this white trash?"""	charliekelly1234	355	41	14		t5_2s28b	False
1368027396.0	1dxq8h	Freedom!!!	pinkspaceship17	366	47	13		t5_2s28b	False
1333759399.0	rx6dg	The first question one should ask.	somewhat_pirate	369	52	6		t5_2s28b	False
1353173124.0	13cvqp	I see your shirt and raise you mine	theRealnightman	373	52	7		t5_2s28b	False
1363872361.0	1aqb0n	FIGHT MILK	AlmostSeenOn	378	59	22		t5_2s28b	False
1363973287.0	1at5t5	Paul McCartney, Sid Viscious, and Bob Dylan in Chemical Toilet	jrocboi	359	46	19		t5_2s28b	False
1353524019.0	13kuri	My kitten (who's normally very active) sits right in front of me and sits through entire episodes every time I put IASIP on		374	66	27		t5_2s28b	False
1345203582.0	ydeq8	Fifty Shades of Dennis	failspy	396	77	10		t5_2s28b	False
1373825933.0	1iacqi	the trash man	wharma-kore	353	40	5		t5_2s28b	False
1366900219.0	1d31du	I knew this shit wasn't fake.	TheStabbingHobo	351	39	8		t5_2s28b	False
1360986331.0	18mcqm	Glenn Howerton Confirms Season 9 is in the Works.	FinTheHumann	368	54	30	"He did this via [twitter](https://twitter.com/Glenn_Howerton/status/302622702395609089)

"	t5_2s28b	True
1371289149.0	1ge60z	This CAPTCHA is demonstrating its value nicely	Sheylian	418	105	12		t5_2s28b	False
1360083619.0	17xv32	We're lawyers!	SurroundedByMachines	353	46	12		t5_2s28b	False
1353411586.0	13i6ym	Its just nice to do something different for a change	m84m	358	44	11		t5_2s28b	False
1348171898.0	107kcu	Serpico.	thebradymills	360	45	17		t5_2s28b	False
1345759061.0	ypwga	I do not give a shit, Deandra.	Mousi	360	50	30		t5_2s28b	False
1374120634.0	1ijd6e	Fighter of the...	fidink	360	48	11		t5_2s28b	False
1372882466.0	1hl7y0	My favorite kind of day (x-post r/funny)	SpiderDice	351	41	12		t5_2s28b	False
1345588314.0	yls10	My anticipation for season 8 continues to build.	Jesus_Took_My_Wheel	347	36	22		t5_2s28b	False
1344631244.0	y0k9x	WILDCARD, BITCHES!  YEE-HAWWW!!	redjimdit	380	73	20		t5_2s28b	False
1375461492.0	1jkmf4	Frank, the master cock blocker	Mann_Monroe	356	45	9		t5_2s28b	False
1365517937.0	1bzo8s	You're all outta time bitch!	SuperDiglett	364	58	14		t5_2s28b	False
1356622828.0	15isv9	"Just saw Mac's ""avatar"" on Workaholics!"	SmokeTrainwreck	393	85	22		t5_2s28b	False
1348685250.0	10iqbm	"""It's Always Sunny"" unveils all-new cast."		353	44	39		t5_2s28b	False
1343673039.0	xej5s	You see how these pecs are poppin? Take a real close look at this body. This body is chiseled.	fansbobby	345	36	4		t5_2s28b	False
1366436727.0	1cq7cd	My room has the worst color, but this poster ties it all together.	mygwalt	340	31	18		t5_2s28b	False
1352127706.0	12o38k	Looks like two crises in NYC in today's news that the gang has already solved in Philadelphia...	ibsprocket	340	31	13		t5_2s28b	False
1322722629.0	mvve8	Frank in one quote.	7Snakes	324	14	10		t5_2s28b	False
1369014223.0	1eo1jq	"""We did a bunch of those monster energy drinks and dry humped. It was awful. I think she gave me poison ivy."""	vsnarski	338	34	24		t5_2s28b	False
1330014944.0	q2nih	it's nice to do something different	rbooo	355	49	21		t5_2s28b	False
1374341797.0	1ipcsz	How come Mac's the only one who gets to push the button on the walkie?	costanza_vandelay	346	43	29		t5_2s28b	False
1367349887.0	1dfhs5	Fighter of the night van!	fuzzrocket02	351	47	4		t5_2s28b	False
1355520693.0	14v2u2	"The best scene from ""The Gang Dines Out"""	FlyingCowOfDoom	342	33	7		t5_2s28b	False
1337345331.0	tt6tf	that doesn't seem very gay..	hero0fwar	350	48	5		t5_2s28b	False
1341196557.0	vwm03	My favourite part of Lethal Weapon 5	lunex	338	32	12		t5_2s28b	False
1339229537.0	usy5j	Mail room conspiracy 	justsamhart	334	24	13		t5_2s28b	False
1354002099.0	13v4de	TRY AND MOVE ME, BRO!	Phthalate	329	27	8		t5_2s28b	False
1332169391.0	r3i8u	"""Dennis, your mule is SHIT.  I am no longer turned on by mules."""	LizardsRmeiLyfe	348	41	13		t5_2s28b	False
1332073410.0	r1ykt	What is with the waitress' computer?	dbtree123	335	27	33		t5_2s28b	False
1356285714.0	15c0m5	DO NOT trust this man!	Mousi	350	51	25		t5_2s28b	False
1356530447.0	15gug5	My favourite moment from this season. 	Gryffes	350	54	18		t5_2s28b	False
1353089213.0	13b4y0	Dennis Reynolds take on Faith -  S8 E6	cheZ_2	360	64	9		t5_2s28b	False
1344055128.0	xnpi5	You ate the stem, the stickers and all that shit?!	sdenoon	333	35	10		t5_2s28b	False
1341019299.0	vto2d	hmm, that's weird	hero0fwar	358	59	12		t5_2s28b	False
1371479120.0	1giluz	The boys are back in town!	SuperDiglett	348	47	17		t5_2s28b	False
1360883587.0	18jop2	Pepe Silvia!	ButImNotARapper_	384	86	43	"Sorry its a self post but this is the biggest epiphany I've ever had

http://imgur.com/6XQCq4H"	t5_2s28b	True
1360130902.0	17zi68	I don't wanna get too bulky. I wanna stay nice and lean and tight.	minusthebeers	342	43	19		t5_2s28b	False
1358104619.0	16i566	"""i bought a billboard"""	lamport	343	49	8		t5_2s28b	False
1354902364.0	14gby2	To live is to dance.	Tdogg425	329	34	22		t5_2s28b	False
1347981058.0	102yjs	Cracks me up every time..	slideyep	358	59	33		t5_2s28b	False
1332389890.0	r7wx8	ಠ_ಠ (X-post from r/funny)	tweak4ever	335	37	6		t5_2s28b	False
