created_utc	id	title	author	ups	downs	num_comments	selftext	subreddit_id	is_self
1334759889.0	sg1ot	Yeaaaaaaaaaa...	Chem125	252	47	20		t5_2s28b	False
1357081879.0	15sk7e	Danny DeVito's contract	eifersucht12a	231	30	15		t5_2s28b	False
1353323684.0	13g2nz	Just enough to have a quiet night out.	m84m	232	28	6		t5_2s28b	False
1338086118.0	u6sfq	Charlie Logic	rayrayallday	221	17	4		t5_2s28b	False
1375168287.0	1jc2qs	Don't find you attractive.	maebybluth	239	37	16		t5_2s28b	False
1373649984.0	1i5y8v	They're ugly as all hell, but I have a feeling I'm gonna like 'em a lot more when I'm high as shit on crack...	VictorBlimpmuscle	228	30	10		t5_2s28b	False
1364248618.0	1b01bp	The Night Man Cometh (x-post r/IDAP)	holdinicedteas	230	29	14		t5_2s28b	False
1356083795.0	157ys5	Charlie's reaction to winning radio contest: best 1.2 seconds in IASIP history	DrBentastic	225	22	7		t5_2s28b	False
1333323663.0	roowr	Macs got moves	ladyrara	225	24	18		t5_2s28b	False
1326774938.0	oke0m	Charlie's last job (x-post from Pics)	Mr_Abe_Froman	220	15	5		t5_2s28b	False
1372460718.0	1ha2p6	"""The outcast, the slut, the bitch, the whore. The lonely, sad, slutty, bitchy, whore."""	AdioSiks	225	25	16		t5_2s28b	False
1355772654.0	150aa4	Charlie painting I made recently!	chibop	231	28	10		t5_2s28b	False
1352412944.0	12vp4z	Mac's Shame	Temporarily__Alone	216	17	17		t5_2s28b	False
1349911265.0	11a1xx	Preview pic from tomorrow's episode!	Orosehunt	239	38	20		t5_2s28b	False
1346056454.0	yw93w	Yeah, girl. You was more mixed up than a milkshake, baby. [S3 EP9 - Sweet Dee's Dating a Retarded Person]	the_wise_janitor	231	31	15		t5_2s28b	False
1329480962.0	ptscf	Frank's night out	KreighzyKeegan	224	24	12		t5_2s28b	False
1320768316.0	m4wau	Crosspost from /r/Funny:  Sweet Dee on Skis!	x30Jx	214	13	4		t5_2s28b	False
1375572183.0	1jnglf	I love eggs...	lmack28	232	33	14		t5_2s28b	False
1364782839.0	1be8x9	My God, There is Not Enough Salt in the World For Her!	balisticpilot	228	30	8		t5_2s28b	False
1359665395.0	17nflg	My favorite awkward moment.  	analogorithm	229	29	12		t5_2s28b	False
1344700416.0	y1uk4	Frankenstien (x-post from r/funny)	sgtcjl	240	40	6		t5_2s28b	False
1328753949.0	ph7ov	Always sunny in Philly Valentine's day cards-Tell that special someone how you really feel.	Ya_Ya_UrAWoman	219	21	14		t5_2s28b	False
1316999557.0	krcd4	I try to do this every Saturday....	hero0fwar	204	6	9		t5_2s28b	False
1371681634.0	1gors3	No..no..please don't bathe the students.	costanza_vandelay	232	32	16		t5_2s28b	False
1325806632.0	o4msl	Don't you hate it when you see some guy wearing this shirt and then you get the little song stuck in your head?		212	14	24		t5_2s28b	False
1323111015.0	n1e0d	Full on Rapist (xpost from /r/pics)	stiny826	213	16	22		t5_2s28b	False
1318737546.0	ldsh9	Charlie Day to host Saturday Night Live on November 5	mattv1	212	16	28	Just saw it on SNL.  Should be awesome sauce.	t5_2s28b	True
1355502996.0	14uk1r	I thought the waiter from last night's episode seemed really familiar then I remembered. I guess the HR guy got fired for hiring Mac and Charlie.	xnerdyxrealistx	211	17	12		t5_2s28b	False
1350060117.0	11deyp	My roommate and I had a party for the premiere, everyone dressed up for the show. 	LovecraftInBrooklyn	212	14	18		t5_2s28b	False
1375331226.0	1jh1pd	I wish more parents were like Charlie (x-post r/funny)	maebybluth	223	29	11		t5_2s28b	False
1357647271.0	166hj7	Inconclusive.	BeniGoat	223	27	15		t5_2s28b	False
1354835776.0	14etce	N - Nurturing Dependence	kramdiw	207	11	14		t5_2s28b	False
1347136201.0	zkjj3	One of my favorite episodes [S4 E9 -Dennis Reynolds: An Erotic Life]	pooticus	228	32	12		t5_2s28b	False
1335516071.0	sv1h5	You know what it is, bitch.	turdmalone	207	12	9		t5_2s28b	False
1327179304.0	oqlqa	Unfortunately, I did have to say this last night.	HighnDryPhilly	234	39	6		t5_2s28b	False
1369230432.0	1eu0dc	"The D.E.N.N.I.S. System - A Not So ""Sunny"" Horror Recut"	ZeusPeabody	207	14	24		t5_2s28b	False
1360548642.0	18a6h3	It's always sunny in the victorian era	ahab_rehab	225	35	12		t5_2s28b	False
1354921379.0	14gxa1	As requested: Mac's Dance	Tdogg425	214	20	15		t5_2s28b	False
1321465153.0	mel4k	is it just me or does Frank just keep getting better 	hero0fwar	209	18	29		t5_2s28b	False
1367246087.0	1dc81k	I also was told I was to meet a woman with giant breasts.	BretMichaelsWig	225	31	4		t5_2s28b	False
1353443466.0	13iz3r	I'm chopping all of my action... And mostly power	normanpsycho	212	19	9		t5_2s28b	False
1353128251.0	13c7ql	Thought you guys would like my shirt!	paprikaelle	266	75	15		t5_2s28b	False
1320809277.0	m5nng	Gotta love religious Mac	Ken_ny	205	13	18		t5_2s28b	False
1341960244.0	wcq4l	First time in Philadelphia and had to make a stop at Mac's Tavern.	hardcoreufo	218	26	22		t5_2s28b	False
1338302020.0	uad41	Yeah, well you're lookin' all sorts o' good!	BabyEddieConrad	227	35	15		t5_2s28b	False
1335954554.0	t33as	Not in My bar, bro	slideyep	214	22	16		t5_2s28b	False
1369330296.0	1ewy10	"It looks like ""Tom Cruise"" makes an appearance in the next season of IASIP..."	kurbs101	221	31	8		t5_2s28b	False
1326404407.0	oeh0h	Dubstep Dayman	notacop911	227	33	25		t5_2s28b	False
1326168945.0	oadbo	Lizard...	hero0fwar	203	12	9		t5_2s28b	False
1367015490.0	1d6lyx	WE WILL CRUSH YOUR SKULL WITH OUR WEAPONS!	LiquidSwordsman	210	21	3		t5_2s28b	False
1363366424.0	1acwuj	Stone's new Dayman IPA! x-post from r/beerporn	crushinrussian	207	21	18		t5_2s28b	False
1355599691.0	14wm3r	I'm in, but there's a problem! I can't make heads or tails of Charlie's chicken scratch!	The2500	226	34	17		t5_2s28b	False
1343177111.0	x3rrx	When Someone Won't Accept My Friend Request	AUflyguy	238	50	5		t5_2s28b	False
1330974629.0	qix7c	I would so spend my christmas mornings like this...	hero0fwar	228	38	10		t5_2s28b	False
1325535603.0	o04pg	The man doesn't blink!	WCT5742	213	28	7		t5_2s28b	False
1375995091.0	1jzc1r	Day Man Wallpaper	willrapeforkarma	208	19	7		t5_2s28b	False
1352206060.0	12q5je	see you bitches... (x-post from /r/tvgifs)	hero0fwar	210	20	7		t5_2s28b	False
1339272710.0	utl6a	Hm, seems to me like it'd be easier to steal the box than jars of liquid	hero0fwar	203	11	12		t5_2s28b	False
1346788576.0	zcoos	Men Stuff	thewooboost	207	19	6		t5_2s28b	False
1344134077.0	xp4x4	"I see the one marked ""Private."""	Snowy_crack	212	24	5		t5_2s28b	False
1332439275.0	r8o0d	Someone on r/stenciltemplates posted a Lorax stencil, I couldn't help but fix it for them	myheadhurtsalot	219	29	7		t5_2s28b	False
1367198613.0	1db3g7	Picture tiny shrimp crawling over every inch of this boat	chunt859	215	27	7		t5_2s28b	False
1365191093.0	1br56f	I made this a couple months ago and think you guys might like it! Dayman!	anonanimus	209	24	26		t5_2s28b	False
1344264150.0	xrmbp	Is your cat making too much noise all the time?	tiMMy4190	214	28	11		t5_2s28b	False
1343510802.0	xbaxr	I feel like if I had that kind of mobility, I'd be capable of almost...well pretty much anything.	TheOnlyAlex	201	15	12		t5_2s28b	False
1333648363.0	ruxq6	When I realize the sun's gone down but am too lazy to get up and turn on the light.	Choppy_LaStatch	201	17	1		t5_2s28b	False
1325541483.0	o08yl	The correct way to look at things	dsolomo	201	20	5		t5_2s28b	False
1367527777.0	1dkpsg	"""That's one frieeeeed turkey."""	fabioballin	202	17	10		t5_2s28b	False
1328550388.0	pde7c	Now where am I supposed to dump this thing? (x-post from WTF?!)	shtoobins	208	24	6		t5_2s28b	False
1336756954.0	tifoj	A clear tale of corruption	enjoiglobes2	187	8	6		t5_2s28b	False
1363214448.0	1a8vzo	I'm not going to sit down until you say something nice to me.	Platinum_Mattress	213	32	6		t5_2s28b	False
1335898458.0	t1w78	Danny DeVito's contract with IASIP	MoonieBooches	193	10	12		t5_2s28b	False
1370052571.0	1ffyax	Extreme Makeover: Home Edition	shifty1032231	205	23	20		t5_2s28b	False
1367957383.0	1dvt5n	Just to Get a Base [S3 E1 - The Gang Finds a Dumpster Baby]	jensenr30	227	46	13		t5_2s28b	False
1350839708.0	11ume9	Season 7 Bloopers!	kee440	204	23	15		t5_2s28b	False
1366725291.0	1cxo9q	This guy needs to contact Charlie Kelly, Esq.	OmniMalev	228	47	28		t5_2s28b	False
1343486105.0	xarqn	this is one idea of how I can spend my Saturday	hero0fwar	214	35	11		t5_2s28b	False
1339498957.0	uxrfn	Wish I had Dennis's flexibility in jeans...	brokendimension	201	22	7		t5_2s28b	False
1334512701.0	sb18q	Donovan McNabb!	theescobar88	205	25	12		t5_2s28b	False
1373542531.0	1i2oim	Just a couple of people who totally got off, bro. [gif]	AdioSiks	201	23	17		t5_2s28b	False
1353806352.0	13qm7a	Found this for €5 in an Irish charity shop. I couldn't resist because of the implication...	biblosaurus	210	32	7		t5_2s28b	False
1324000679.0	nelou	Something I found when subbing in a Kindergarten classroom.  A great way to teach rhyming!	slickboarder89	192	11	8		t5_2s28b	False
1323184720.0	n2k27	it's like poetry 	hero0fwar	189	13	2		t5_2s28b	False
1320003864.0	lubw4	I had the jacket... Charlie costume!	freshasaurus	212	31	20		t5_2s28b	False
1347596542.0	zv0x0	Rock, Flag &amp; Eagle	CaptSheela	197	17	10		t5_2s28b	False
1325139495.0	numoa	Frank is my favorite character	kirkis	194	16	14		t5_2s28b	False
1372283948.0	1h4yhf	You unzipped me, it's all coming back! I hate you! [S8E5]	Thomas024	207	30	12		t5_2s28b	False
1366944357.0	1d4o1a	TIL that Rickety Cricket is married to Emily Deschanel...blew my mind.	apieracc	186	14	14		t5_2s28b	False
1335647325.0	sx9en	don't know if this has already been up or not, but just found this today, it's fucking awesome	hero0fwar	221	45	14		t5_2s28b	False
1331335853.0	qpl7g	My St. Paddy's Day shirt finally came today!	GoSioux14	196	17	17		t5_2s28b	False
1322580626.0	mtedr	Is your piglet making TOO MUCH NOISE all the time?	silverpaw1786	210	31	18		t5_2s28b	False
1363736509.0	1amm6q	The Hunger...	thtoneaznguy	203	24	11		t5_2s28b	False
1330876738.0	qh8et	Whatcha thinkin' about?	liamc	194	16	5		t5_2s28b	False
1323895441.0	nctha	You're gonna have to pop it on.	CtrlAltDeleteDie	187	12	15		t5_2s28b	False
1375939132.0	1jxs7v	I'M A SWEDISH PLUMBER I'M HERE TO FIX YOUR PIPES.	shitasscuntniggadick	193	20	25		t5_2s28b	False
1352846925.0	135c7z	god dammit Charlie 	NoisyNeighbor	198	28	8		t5_2s28b	False
1349385764.0	10yhqk	Slumber Cocktail	btreichel	189	16	22		t5_2s28b	False
1344784522.0	y3fl0	The Other Frankenstein	sgtcjl	202	31	8		t5_2s28b	False
1341199176.0	vwo77	My family visited me in Los Angeles and this was the one movie/tv site they wanted to see.	methmouthjuggalo	186	12	22		t5_2s28b	False
1327434481.0	ouv8x	Wild Card...	hero0fwar	192	18	9		t5_2s28b	False
1374447183.0	1irxlc	Real champs eat at McDonald's... I'm lovin' it! (where's my check?)	reddit858	193	18	13		t5_2s28b	False
1373177445.0	1hshhl	"""Shady Nasty's?"""	camb42	190	18	10		t5_2s28b	False
1352741582.0	132kfi	Sweet Dee Cosplay!  [x-post from /r/videos]	newBreed	219	45	10		t5_2s28b	False
1353732350.0	13p989	Feel like this belongs here... (x-post from r/pics)	huemanateee	209	38	3		t5_2s28b	False
1333909003.0	rzhm8	So I was watching P&amp;R last night and thought this place (building on the left) looked really familiar. What do you think?	spence_mgence88	214	42	31		t5_2s28b	False
1324855838.0	nqkyv	Merry Christmas from the Gang!	busterbluth91	186	15	7		t5_2s28b	False
1349509024.0	111930	Who thinks we should have downvote arrows in this sub?	special2plumsfor1	299	128	77	It occurs to me that this is one of the few (or any) tv subreddits that disable the downvote arrow by default in CSS. I think it is fine in places like /r/gonewild, or /r/loseit, but the point of upvoting and downvoting is to promote posts that are relevant and interesting, and demote posts that are irrelevant and beating a dead horse. Especially in a tv subreddit, this is a feature I think we should have enabled. I'd like to get the community's opinion on this before going to our other mods and making the code change for implementation. 	t5_2s28b	True
1372784408.0	1hi9hc	Of course she's huge, she just ate an entire sleeve of cookies!	haydenbates	194	23	6		t5_2s28b	False
1356286779.0	15c1jc	"With all the news about the ""irresistible dental assistant"" won't someone think of this poor guy?"	FriesWithThat	198	29	7		t5_2s28b	False
1321405384.0	mds52	Finally, a relevant Facebook ad	petekill	183	16	8		t5_2s28b	False
1368420182.0	1e8788	My internet chose the worst time to disconnect on me	ILoveLamp9	188	22	3		t5_2s28b	False
1348435217.0	10cxa2	Always been one of my favorite scenes	Daniel_Hall	184	18	8		t5_2s28b	False
1340885665.0	vqjnn	Hey my name is Danny too!		183	17	10		t5_2s28b	False
1329514138.0	pueuf	Dark horse for my favorite Dennis moment of season 7	Wikwak	183	13	11		t5_2s28b	False
1327071485.0	oovkn	What in the hell is that going to accomplish?	hero0fwar	186	18	3		t5_2s28b	False
1375942024.0	1jxuvm	Holy shit that lizard talks!	lolinternetz	182	15	4		t5_2s28b	False
1369985536.0	1fe50x	Looks like Rum Ham survived and had kids.	JDCarpenter91	222	56	6		t5_2s28b	False
1342290141.0	wk36a	Hammerhead's, Dewey Beach, DE	lysis_	194	29	6		t5_2s28b	False
1339513318.0	uy0ce	Am I the only one who wants to do something like this after watching this scene?	TheOnlyAlex	196	30	10		t5_2s28b	False
1326526004.0	ogl4e	Mmm, baby dudes	slideyep	186	19	8		t5_2s28b	False
1375325053.0	1jguep	"""Rum ham! No! I'm sorry, rum ham!"""	ktqueenofknots	193	28	10		t5_2s28b	False
1374797829.0	1j2c7c	Who's ready to go toe-to-toe on some BIRD LAW?	benmk	190	24	7		t5_2s28b	False
1367813768.0	1drvi8	How's this for childish bro?	fabioballin	183	19	1		t5_2s28b	False
1346093602.0	yx0lr	Currently visiting friends in Ukraine, look who we found! No wonder he is gone for months on end...	domokunosan	197	33	8		t5_2s28b	False
1345991502.0	yuq88	Apple seeds [S5 E9- Mac and Dennis Break Up]	the_wise_janitor	190	23	15		t5_2s28b	False
1328159746.0	p7b16	charlie with no beard?	hero0fwar	186	19	47		t5_2s28b	False
1325743049.0	o3ma8	Sunny + Ben &amp; Jerry's	swordyface	173	6	11		t5_2s28b	False
1322782901.0	mws4r	What I expect every time I turn on public television.	Snowy_crack	176	10	7		t5_2s28b	False
1375937419.0	1jxqij	You disgust me.	MrSlowrolla	196	31	13		t5_2s28b	False
1369772887.0	1f7zgm	Virus Video	ChillWithBenjamin	183	15	4		t5_2s28b	False
1357087668.0	15sq6c	Does your dog make TO MUCH NOISE?	Emily_in_Chains	213	50	11		t5_2s28b	False
1330921037.0	qi3ro	One of my favorite scenes.	Skepgnostic	193	27	17		t5_2s28b	False
1329714562.0	pxec4	I eat stickers all the time, Dude! [S5 E2- The Gang Hits the Road]	Monarchy44	192	24	13		t5_2s28b	False
1340810239.0	vorx4	Do you think they let people get a room here without putting a credit card down?	blondeambition88	184	21	7		t5_2s28b	False
1375707023.0	1jqjb5	Dear Chase,	jeeeeeeeeeeeezlouise	187	27	10		t5_2s28b	False
1372689128.0	1hfe42	The Gang	NoxiousKnight	192	29	9		t5_2s28b	False
1369318729.0	1ewjyx	Don't let him rape you..... Philadelphia!	prometheuspk	179	20	1		t5_2s28b	False
1362687754.0	19v5ws	Whats with the outfit?...uhh man...	hankscorpioo	193	28	8		t5_2s28b	False
1327142629.0	oq3vw	Flourish the pinky. YYYYYEEEESSSSSSS.	shtoobins	183	20	11		t5_2s28b	False
1372919275.0	1hmc2r	Today we celebrate our Declaration of Dependence!	HEXAEMERON	174	9	10		t5_2s28b	False
1368734039.0	1egyit	This jabroni was way off	hookedupphat	185	25	15		t5_2s28b	False
1354122507.0	13xw4t	Best Always Sunny Moments 	beerMEplease	194	30	21		t5_2s28b	False
1329677163.0	pwnxd	My friends and I played Chardee MacDennis last night. I can assure you, it really is the game of games.	stcody	191	33	31		t5_2s28b	False
1334548974.0	sbvhm	God you're disgusting, a disgusting animal	impossibleprincess	188	31	12		t5_2s28b	False
1368448372.0	1e8o92	It's totally broken.	mwolf83	204	46	12		t5_2s28b	False
1365777091.0	1c7h4k	The Nightman Cometh Live!	skibum607	174	11	21		t5_2s28b	False
1364020935.0	1aujw2	I assumed they shot this scene in front of a full house until I took a screenshot.	Carrmann	181	19	8		t5_2s28b	False
1357605980.0	165inq	Margaret McPoyle?	jphobbit	196	38	23		t5_2s28b	False
1350129136.0	11etbf	Green Man strikes! (I love this part of the episode)	adonorocks	192	31	17		t5_2s28b	False
1347057605.0	zj2a5	I may not be much...	beerMEplease	188	32	1		t5_2s28b	False
1330816934.0	qggpb	"When no one gets your ""Sunny"" reference..."	impossibleprincess	191	30	14		t5_2s28b	False
1321534440.0	mfme4	Just got my bobbleheads! Except Dennis looks more like Colin Firth than himself..	BisFor	164	6	19		t5_2s28b	False
1357374194.0	1600u5	thought i'd share some of my cousin's artwork with you guys...	jadenx2	191	32	8		t5_2s28b	False
1349981772.0	11bn5h	Friendly reminder... tonight is the season premiere of It's Always Sunny In Philadelphia! 	hamseatlambs	182	21	39	"For those of you that would like to join in on discussion during and immediately following the show, there will be an ""official"" thread being posted here a couple hours before the show airs. We can discuss the episode, share factoids, and just generally have a good time!

For those of you on the west coast, you will probably have to join us an hour late, but we will keep your seat warm. I will be sure to mark the thread with a big SPOILER tag, but yous guys shouldn't come in if you are waiting for your personal DVR showing. If you start your own thread, please be respectful and don't put spoilers in the title. Otherwise we will pop a quick SHHH on you.

I'm so excited! Feel my nips. They're, like, super-hard, right?


Edit: 10pm eastern, 9pm central, and idontcare for jabronis."	t5_2s28b	True
1356751849.0	15lvq1	One of my favorite moments from this season. 	Katabatical	171	15	8		t5_2s28b	False
1316609503.0	kmoed	I think this is my favorite scene 	hero0fwar	179	23	12		t5_2s28b	False
1374114864.0	1ij68u	For the website...	antiherodave	169	16	13		t5_2s28b	False
1368945171.0	1embu8	Frank can be oddly inspirational.	onestrawplease	163	8	5		t5_2s28b	False
1353200757.0	13dlgx	My favorite Frank moment	caseymac121	166	14	10		t5_2s28b	False
1329472776.0	ptpnq	Frank lights Sweet Dee on fire	KreighzyKeegan	171	19	8		t5_2s28b	False
1320373268.0	lzske	Rum Ham in progress	NotAmishSoStopAsking	163	7	31		t5_2s28b	False
1373073008.0	1hq32r	"""The Pecan Sandies"""	ILikeWhereThisIsGoin	179	24	6		t5_2s28b	False
1365383051.0	1bvyie	I'd like to call in a bomb threat	Benneke10	195	39	17		t5_2s28b	False
1362873957.0	19zwga	Glenn Howerton on Pink Dime Nips	Haebang	168	15	16		t5_2s28b	False
1350582364.0	11p77a	24 beers, i'm not surprised	xjoefre	172	18	3		t5_2s28b	False
1321708805.0	mi0l4	I'm goin in the crevice.	EddieKC	166	12	11		t5_2s28b	False
1371842474.0	1gt9iu	Alright guys, drop a beat for us. You ready?	falkers	170	14	12		t5_2s28b	False
1374520492.0	1itxir	DickTowel.com	BlitzAce71	181	29	5		t5_2s28b	False
1373902245.0	1icegk	Kitten Mittons!!	blueshockey91	198	45	26		t5_2s28b	False
1372567319.0	1hclt9	Milk steak over hard with raw jelly beans.	JustPlainRude	200	49	9		t5_2s28b	False
1364583177.0	1b9a2n	Charlie kelly here!	paprikaelle	359	204	35		t5_2s28b	False
1327215955.0	or86t	Always Sunny in Bethlehem		183	26	9		t5_2s28b	False
1372174478.0	1h1jax	My buddy and his band did a cover of Dayman	Metalero9389	189	37	24		t5_2s28b	False
1368481883.0	1e9t8m	I found this in a library book. Looks like he's paid his troll toll.	Apollo303	168	12	7		t5_2s28b	False
1359336897.0	17efzg	I found these at a thrift store and thought of you	OpossumPendulum	208	58	9		t5_2s28b	False
1357186151.0	15vaen	"My favorite Mac ""walk a way"" moment"	ilikeexplosions	165	13	5		t5_2s28b	False
1355640185.0	14xkyb	When Mac arrives 	zombiefork	176	26	6		t5_2s28b	False
1333043373.0	rjjhl	Get that shit outta here!	Corryyyy	167	19	7		t5_2s28b	False
1372084648.0	1gyxvx	You wanna take care of that honey?	Mi_hermano	177	25	8		t5_2s28b	False
1365201587.0	1briig	"We gotta write a song about how we do not diddle kids! (singing) ""Do not diddle kids! It's no good diddling kids!"""	balisticpilot	171	22	4		t5_2s28b	False
1361258949.0	18t2kn	Stuck in a sticky situation? Charlie knows the way out	ILoveLamp9	181	33	5		t5_2s28b	False
1344247952.0	xrcqi	Your shirt doesn't even fit by the way.  If you want to be an elitist get yourself a tailor..	slideyep	173	19	2		t5_2s28b	False
1334361063.0	s8rqc	Charlie's E-Match	brunoip	161	12	14		t5_2s28b	False
1324281788.0	nian2	Dennis lost his mind way back in season 3.	shtoobins	157	4	7		t5_2s28b	False
1370234564.0	1fka13	My favorite scene from Its Always Sunny.	bigfatround0	169	21	8		t5_2s28b	False
1364617007.0	1babni	Whoops!	hate_tank	177	25	12		t5_2s28b	False
1363821842.0	1ap3ah	A while back I suggested playing CharDeeMacDenis with some of my friends. My idiot friend wanted to replicate all the rules.	not_a_jew_69	186	38	9		t5_2s28b	False
1354568644.0	147xtx	I'm introducing this to my friends at this year's Christmas party. I think it's safe to say it's going to be a good Christmas. 		176	24	23		t5_2s28b	False
1330480018.0	qalvf	Gentlemen...	g0blin84	156	7	5		t5_2s28b	False
1374611767.0	1iwpwc	That's white trash	seeksaltcreek	165	16	5		t5_2s28b	False
1368057221.0	1dyth4	Classic Frank	costanza_vandelay	169	21	10		t5_2s28b	False
1362190938.0	19i27t	Drew this to thank my best friend for looking after me, because I don't do...words.	TheKidsCallMeHoJu	177	29	5		t5_2s28b	False
1335450031.0	stksm	Hi, My name is Walter Harris.  I'm with the Family Association for the Protection of Children.	slideyep	166	20	7		t5_2s28b	False
1335335514.0	sref3	Check out this bar i stumbled into in Busan, South Korea!!!	scmger	198	48	9		t5_2s28b	False
1375223876.0	1jdqju	Green Man!	castiliad	167	17	8		t5_2s28b	False
1363455723.0	1af1yp	My favorite Dennis scene		165	17	8		t5_2s28b	False
1363329084.0	1ac5to	Now THAT is a body that just won't quit	Benneke10	180	32	16		t5_2s28b	False
1351215850.0	123ngu	WHOOORES	fpsb0b306	164	16	7		t5_2s28b	False
1346458884.0	z5w80	it truly is awesome	yesshur	160	11	5		t5_2s28b	False
1360435016.0	187be9	I live right outside of Boston, Mass. I'm supposed to go to my Mom's house in the next city to check on her cats, but the blizzard's driving ban is preventing me from leaving. This is exactly my situation right now.	Platinum_Mattress	192	44	0		t5_2s28b	False
1353607791.0	13mnrh	Actually, we're done now. 	youbequiet	172	26	15		t5_2s28b	False
1351277122.0	124xqh	This was the last show I expected to be terrified by.	xnerdyxrealistx	163	19	15		t5_2s28b	False
1335890597.0	t1oyk	My favorite IASIP scene. 		167	24	23		t5_2s28b	False
1316284149.0	kiu1g	A nice egg?	JoeAconite	157	13	20		t5_2s28b	False
1350971734.0	11xldb	"""Well, look at the bright side Franklin, we got ourselves a pumpkin"" (My Original Carving)"	SlicedLime	168	21	6		t5_2s28b	False
1349119184.0	10rwm7	I bet you're gonna say he re-tweets everyone...but this still made me excited!	paprikaelle	183	37	4		t5_2s28b	False
1327074419.0	ooxe4	This whole scene absolutely killed me when I first saw it, but some of my friends thought it was too silly. Your thoughts?!	gene_parmesan258	161	12	24		t5_2s28b	False
1369954704.0	1fd9r5	This one goes out to a very special soldier, a soldier of for-tune.	reddit858	159	13	8		t5_2s28b	False
1349674045.0	114i95	First look at Xzibit as Dee in the new season of Sunny!	isipalafalaf	168	23	2		t5_2s28b	False
1339539092.0	uypid	my friend and I's attempt at birds of war a few Halloweens ago	mchoffman	177	29	9		t5_2s28b	False
1326005627.0	o7pwo	The God Hole		175	28	3		t5_2s28b	False
1317211145.0	ku00w	flip flip flipadelphia	hero0fwar	158	13	6		t5_2s28b	False
1369933373.0	1fchff	Just noticed this on the Nightman Commeth (look at background painting)	jamesryoma	237	94	24		t5_2s28b	False
1352792161.0	134312	"""Picture tiny shrimp crawling all over the inside of this boat."""	normanpsycho	164	24	8		t5_2s28b	False
1350448589.0	11m4jh	How stars are made...	DaMasterDebater	161	17	4		t5_2s28b	False
1344833738.0	y4o69	RUM HAM!!! (Season 7x2)	nick-halden	184	39	13		t5_2s28b	False
1333999693.0	s18zo	seems like a good plan	ty_vs	153	7	3		t5_2s28b	False
1332260929.0	r58x7	probably the funniest end to an episode 		195	52	17		t5_2s28b	False
1330578294.0	qciiv	Ain't no party like a McPoyles party.	Andrew0650	159	15	13		t5_2s28b	False
1376179185.0	1k47rt	Frankie Rum-ham	JHole04	168	23	3		t5_2s28b	False
1347491800.0	zsjbr	Hoooly hell! There's a teddy bear and it got something hard in it	Gebskin	161	18	12		t5_2s28b	False
1343512107.0	xbc1e	"We don't have any ""legal"" recourse"	fuzzypits	158	17	2		t5_2s28b	False
1326592031.0	ohggk	just found this on tumblr, no source provided, if anyone knows if there are more like this out there or the source please let me know	hero0fwar	185	40	15		t5_2s28b	False
1369086339.0	1epz8n	Charlie's favorite hobby store.	WuTangDisciple	159	18	11		t5_2s28b	False
1355362394.0	14rcv4	One of Dennis's best moves	beerMEplease	149	7	9		t5_2s28b	False
1333809150.0	rxvbh	Let's turn it up, let's get weird, let's get weeeeird.	PhillyGreg	165	19	5		t5_2s28b	False
1373289905.0	1hv1li	(Found) Frank &amp; Charlie: Real. Boiled. Denim.	CaptFlowers	150	10	3		t5_2s28b	False
1368493991.0	1ea924	The memory haunts me...	DROPkick28	179	38	12		t5_2s28b	False
1360182723.0	180p8r	The Gang Gets Analyzed.	rocknrollercoaster	173	33	112	I've heard a lot of people saying this episode wasn't funny. I, on the other hand, thought it was one of the best and most interesting episodes of Sunny. I'm just wondering what some of the naysayers thought.	t5_2s28b	True
1350691296.0	11rxrb	Why would you do that, charlie?	sempiternal	159	15	9		t5_2s28b	False
1338598738.0	ugihb	Look What I Scored at GoodWill Today.	Whereisnumnum	152	11	2		t5_2s28b	False
1338433868.0	ud96v	This reminds me of Dennis, Mac and Charlie's Party Mansion Flyer. (x-post r/WTF)	JurassicParkerr	165	20	7		t5_2s28b	False
1375107796.0	1j9zkw	Needs more veins. (Se3 Ep3. Dennis and Dee's Mom is Dead)	mwolf83	174	33	6		t5_2s28b	False
