created_utc	id	title	author	ups	downs	num_comments	selftext	subreddit_id	is_self
1356963816.0	15q2ol	Josh McRoberts of the Orlando Magic is starting to look a lot lika Charlie	J1P3A	3564	1258	63		t5_2s28b	False
1376405046.0	1ka340	I tried posting this in /r/birdswitharms but they didn't get it.	ImAgressivelyPassive	7017	4754	83		t5_2s28b	False
1373453694.0	1i00rf	Frank's transformation since joining The Gang	NGHTMR	2924	887	84		t5_2s28b	False
1354595850.0	148uaj	Well /r/pics didn't recognize him. Real nice guy by the way.	dontforgettotip	3174	1140	108		t5_2s28b	False
1352592156.0	12zigj	"Made this into a gif today ""The Gang"""	hero0fwar	2185	399	49		t5_2s28b	False
1375235853.0	1je59r	Classy as hell.	atticus138	2420	728	106		t5_2s28b	False
1329105205.0	pmz53	Reddit today	ChemicalOle	2302	717	44		t5_2s28b	False
1358047066.0	16h0u1	I think Charlie Kelly is secretly the manager of my apartment complex	IcosaheDroolSymmetry	1700	293	45		t5_2s28b	False
1376322893.0	1k7o0z	I thought Fat Mac was back for a second...	pootsforever	1815	437	103		t5_2s28b	False
1375281262.0	1jf88b	My new lock/home screen.	ThatGreyKid	1730	361	48		t5_2s28b	False
1373231700.0	1htlwd	my FB cover photo and profile pic [s08e09 - the gang dines out]	bearvsoctopus	1668	320	39		t5_2s28b	False
1360608845.0	18bn9g	Looks like someone pissed off Charlie. (X-post r/funny)	DrKlezdoom	1624	320	40		t5_2s28b	False
1364409622.0	1b4ivr	I support all types of marriage, including cool, straight dude marriage.	HG_Fantomos	1493	248	23		t5_2s28b	False
1375494168.0	1jlpqw	New IASIP Season Poster	kevr117	1451	231	75		t5_2s28b	False
1366507263.0	1crx0c	Armed security. Don't worry about it. (From Rob McElhenneys twitter)	licopter	1448	246	47		t5_2s28b	False
1358511876.0	16ta9z	Sweet Dee makes a guest appearance on he new season of Archer	pillarofdawn	1585	386	44		t5_2s28b	False
1359078135.0	1788pb	You can't get funny like this anywhere else 	ibaadk	1430	236	25		t5_2s28b	False
1370866756.0	1g1gui	I love Charlie and Mac's relationship	slideyep	1493	300	62		t5_2s28b	False
1358871894.0	17275m	This is at a bar in my town (KC, MO)		1364	230	34		t5_2s28b	False
1363541015.0	1ah03t	WHAT UP!!	betoporco	1314	209	28		t5_2s28b	False
1355898519.0	153i30	My drawing of Sweet Dee that I did in class today.	lvl5LazorLotus	1271	194	19		t5_2s28b	False
1376048965.0	1k0qt3	My favorite 1.5 seconds of the show	cherryfizz	1274	207	65		t5_2s28b	False
1356699564.0	15kkc2	The most beautiful scene in IASIP in my opinion	pussy_ass_nigga_69	1219	179	140		t5_2s28b	False
1356440372.0	15f3l1	The scene that cemented my love for this show.	-Kilgore_Trout-	1168	147	34		t5_2s28b	False
1360696191.0	18e5co	An entire day out in public and nothing but weird stares. Maybe you guys will appreciate my shirt more.	TrapperKeeperGuy	1249	256	33		t5_2s28b	False
1367328920.0	1deqq0	"""That doesn't sound right, but I don't know enough about stars to dispute it."" S05e03"	eudaimondaimon	1207	218	36		t5_2s28b	False
1343012657.0	wzw7c	I posted this to r/birdswitharms - they didn't get it.	kdar	1146	183	20		t5_2s28b	False
1346347146.0	z345j	Someone suggested that I also post this gif here.	prannisment	1214	258	26		t5_2s28b	False
1355337370.0	14qjvj	I freakin' LOVE this show!	ccckt13	1079	165	26		t5_2s28b	False
1334230941.0	s6103	why you don't leave philly.	ajemahaj	1183	299	16		t5_2s28b	False
1346276863.0	z1iqi	Tonight, on Reddit.	Mousi	1121	241	22		t5_2s28b	False
1327512598.0	ow9oi	Someone out there deserves a freaking medal for this.	TH3MlLKMAN	1049	174	16		t5_2s28b	False
1374149045.0	1ijy3g	PhiladelphiAvengers	hero0fwar	974	112	48		t5_2s28b	False
1349418758.0	10zcyc	Ran into this homeless guy at my local Whole Foods.	darkninjason	966	102	44		t5_2s28b	False
1375585099.0	1jnt5e	This still amazes me	MEOW_VIP	1054	208	125		t5_2s28b	False
1361049367.0	18nmmf	Charlie...	atticus138	1024	183	19		t5_2s28b	False
1356011869.0	1560sl	The Demise of Rickety Cricket	KakunaUsedHarden	944	111	85		t5_2s28b	False
1349270600.0	10vfyf	The Original Overly Attached Girlfriend	insertclichehere	1084	255	56		t5_2s28b	False
1373031060.0	1hou2c	what's your favorite hobby?	wharma-kore	937	121	38		t5_2s28b	False
1367787680.0	1dr1ax	I *will* forget that the board is nailed down later.	blab70	933	143	29		t5_2s28b	False
1348616380.0	10h7tb	IASIAP changed their fb cover photo. wut	jaykasten	899	119	118		t5_2s28b	False
1352219139.0	12qh5c	My sister-in-law's friend couldn't make her wedding, but he did get her the best present	giddyup523	879	106	47		t5_2s28b	False
1359491824.0	17il0z	Boys are out tonight huh.	7Snakes	888	120	22		t5_2s28b	False
1357837242.0	16bl5e	Im not fat! - Mac	ottersaurusREX	927	153	43		t5_2s28b	False
1365111934.0	1boukq	Found it.	ThinkingFurther	877	116	41		t5_2s28b	False
1372940849.0	1hmp03	a true patriot	wharma-kore	865	109	35		t5_2s28b	False
1358998462.0	17631e	FIGHTER OF THE NIGHT MAN!	rojomariposa420	874	126	28		t5_2s28b	False
1346427558.0	z5163	The Greatness of Charlie	pumper911	875	124	31		t5_2s28b	False
1368812182.0	1ej293	Danny DeVito came to my local burger joint!	marcel87	895	145	42		t5_2s28b	False
1364151749.0	1axcu3	Charlie can't read	mintyfresh21	888	143	25		t5_2s28b	False
1365020389.0	1bm02i	Facial expressions	Marcolol	836	95	33		t5_2s28b	False
1350416793.0	11l4i3	Rickety Cricket Alignment Chart	thatoneguy42	869	129	24		t5_2s28b	False
1375126681.0	1jap3a	"""Uhh, You guys all better eat a dick, 'cause Sweet Dee beat the system."""	ianf1217	894	163	32		t5_2s28b	False
1369236014.0	1eu6nx	I found this neat place in LA yesterday	thealyssavirus	860	134	55		t5_2s28b	False
1334803481.0	sh6o8	I know you all felt the same way	CaptainFriendship	928	200	32		t5_2s28b	False
1359668657.0	17njyu	Never forget!!	bo34	791	75	24		t5_2s28b	False
1340847657.0	vpubx	Almost did not recognize this guy	HanZ408	844	126	57		t5_2s28b	False
1354663909.0	14afo0	PhiladelphiAvengers	WorkFriendlyAcct	789	75	25		t5_2s28b	False
1349176417.0	10t7km	how I feel everyday at work	tyknows	832	120	6		t5_2s28b	False
1366900851.0	1d325u	"Whenever someone says, ""I had this crazy dream last night."""	balisticpilot	835	125	17		t5_2s28b	False
1370440194.0	1fpy0e	The one IASIP character that always gets the better of the Gang...	grytpype	822	115	87		t5_2s28b	False
1348691961.0	10ixll	Frank Reynolds, Historian.	Mousi	776	63	11		t5_2s28b	False
1342799642.0	wvmo0	Hoooly shit! Is that the ocean?! 	The2500	833	126	25		t5_2s28b	False
1358445857.0	16rh5e	Hey...	ColinFlolin	830	130	20		t5_2s28b	False
1355835723.0	151sx4	It's almost Christmas, everyone, do you have your rocks ready?	Spekter5150	764	61	31		t5_2s28b	False
1345482603.0	yj4yl	Yeah... pretty excited to see this.	LizardsRmeiLyfe	828	126	28		t5_2s28b	False
1374985913.0	1j78s4	Went to a dress up as the Always Sunny gang + McPoyles	joewizzle	833	133	43		t5_2s28b	False
1365399991.0	1bwhga	My favorite Dennis moment.		819	121	41		t5_2s28b	False
1369398288.0	1eyt4g	NBC doing a story on the jersey shore right now. This is all I can think of.	cackbewl	850	152	33		t5_2s28b	False
1375792610.0	1jt313	which one...	wharma-kore	840	152	28		t5_2s28b	False
1358123262.0	16iql4	Me as one of the Mcpoyle's; nobody on facebook got it and I got all kinds of shit. No regrets...	syntak1	813	135	50		t5_2s28b	False
1372094704.0	1gza2f	In honor of the Stanley Cup here is Charlie on ice	T-Lang	780	103	22		t5_2s28b	False
1347855768.0	100a8k	My brother participated in a filming of How The States Got Their Shapes. He took a picture with Brian Unger and there was only one appropriate pose. THEY'RE LAWYERS!	Kevward	770	98	22		t5_2s28b	False
1371129886.0	1g9kvh	FYI: They're filming right now at 17th and Chestnut in Philly	unfairllama	769	98	40		t5_2s28b	False
1366408334.0	1cpaxu	Gail The Snail is back for season 9!	Jesus_Took_My_Wheel	801	127	37		t5_2s28b	False
1335272431.0	spvsu	Charlie...	wharma-kore	808	141	44		t5_2s28b	False
1351459879.0	128kxc	Living on the East Coast this is all I can think about Hurricane Sandy	Jlovering5	740	78	26		t5_2s28b	False
1366657487.0	1cvpor	Charlie should be able to pull this one off [x-post from r/4chan]	Marcolol	792	129	20		t5_2s28b	False
1375034776.0	1j84wc	What was I supposed to do?!	maebybluth	787	125	11		t5_2s28b	False
1362953260.0	1a1mo3	Most people thought I was just some bum. 	Perkinstein	743	97	20		t5_2s28b	False
1354962639.0	14hs7r	It's Always Sunny in Philadelphia Season 1-7 is currently on Netflix	scotishstriker	718	75	68		t5_2s28b	False
1367423536.0	1dhjg6	Bro, you could chop a camel right in the hump and drink all of its milk right off the tip of this thing! [S3E1]	greatdane4	733	91	18		t5_2s28b	False
1350302405.0	11i9ry	Can I offer you... 	beerMEplease	736	90	15		t5_2s28b	False
1350040135.0	11czwb	An Original Hitler	kingshigh	726	91	34		t5_2s28b	False
1357583485.0	164r27	Charlie Kelly: Full on rapist (tattoo)	getinthecage	817	179	86		t5_2s28b	False
1350357392.0	11jurc	Look who was at the airport 	BigJuicy2	730	101	32		t5_2s28b	False
1363271645.0	1aaakf	Someone said you would like this.  I ran in to Rob Mcelhenney at Macy's yesterday. X Post from r/pics	tango211	784	153	59		t5_2s28b	False
1338486864.0	ue6ve	The hero we need.	Cban51	759	128	18		t5_2s28b	False
1374012323.0	1ifzie	"""What up! We are three cool guys looking for other cool guys to chill in our party mansion..."""	keez123	734	100	31		t5_2s28b	False
1373909287.0	1icnp3	Better Than Any TSA Body Scanner... [S05:E02]	balisticpilot	736	106	19		t5_2s28b	False
1361548291.0	190x7a	LOOT LOOT LOOT!!!	taterNuts	718	97	31		t5_2s28b	False
1357745243.0	1692n8	So it's evaluation time at work... (r/funny didn't appreciate this)	holisticcannonball	821	204	30		t5_2s28b	False
1338558977.0	uflq1	What I imagine reading 50 Shades of Grey is like	Raoul_Digby	699	87	18		t5_2s28b	False
1358618449.0	16vum6	Tell me this kid doesn't get it.  Jean shorts, high ride, and dat smirk	softroxstar	748	136	18		t5_2s28b	False
1328803898.0	phw9o	It's this magnificent bastards birthday today	milhouse3083	740	131	40		t5_2s28b	False
1355690714.0	14yfco	Charlie Leaves Philly [x-post from r/funny]	birdieputt	686	80	25		t5_2s28b	False
1336014906.0	t4i4w	The nightnurse cometh	cubbycubb	723	119	20		t5_2s28b	False
1366145657.0	1chi1u	They've honed Dennis down to such a beautifully perfect character	prosthetic4head	693	88	53		t5_2s28b	False
1363681281.0	1akzl7	IASIP's best promotion ad.	alittle7	696	95	22		t5_2s28b	False
1350157327.0	11fdek	[spoiler] An original Hitler in 'The Nightman Cometh' (S4, E13)	LukeTheJedi	659	60	20		t5_2s28b	False
1375375907.0	1ji5kv	They'll be out of business in a weeks time	ayoodilay	713	117	34		t5_2s28b	False
1370143409.0	1fi1ec	100th Episode Cast Photo!	grytpype	663	70	32		t5_2s28b	False
1349728354.0	115m5f	Wise words from Dennis on choosing political candidates	benjaminmktn121	671	80	17		t5_2s28b	False
1348086525.0	105kdd	Just found this subreddit. My roommate and I were the McPoyle Bros for Halloween a few years ago. I'm on the left.	needz	677	88	31		t5_2s28b	False
1374504479.0	1itbsj	Glenn Howerton talks 'Coffee Town,' confirms 'Always Sunny' will end after 10 seasons	andthatswhyyoualways	681	95	166		t5_2s28b	False
1348548365.0	10fo06	Hi. I'm a recovering crack head, this is my retarded sister that I take care of. I'd like some welfare please.	sdenoon	657	76	17		t5_2s28b	False
1363778435.0	1annsp	this scene gets me every time	AlmostSeenOn	674	94	26		t5_2s28b	False
1347501890.0	zsttl	Look what I saw yesterday!	boogerflinger	658	80	14		t5_2s28b	False
1375717749.0	1jqujg	"""And how do you catch a cricket?"" ""With a giant bird."""	reddit858	686	108	19		t5_2s28b	False
1340618720.0	vkdo6	Saw this in Singapore.  Thought you jabronis might enjoy.	gwarster	665	93	15		t5_2s28b	False
1371938711.0	1gvl8e	That felt sexy. Was it sexy?	DerpyDonut	674	103	23		t5_2s28b	False
1336949117.0	tlk9y	So I met Margaret McPoyle yesterday. I can see the attraction.	JiggysMyDayJob	621	51	59		t5_2s28b	False
1370287572.0	1fllq5	Watching this show nonstop for 6 months before realizing there's a subreddit	marchingprinter	698	133	40		t5_2s28b	False
1365700129.0	1c58ye	With all the talk of North Korea in the news, this is all I can think of.	TheStabbingHobo	674	107	30		t5_2s28b	False
1345920608.0	yte1x	That's when Dee came in	cultivating_mass	635	78	26		t5_2s28b	False
1370738692.0	1fyf44	Any fellow fans want to help me get this to Mac? (x-post r/funny)	coolmatt701	664	102	36		t5_2s28b	False
1370366451.0	1fnv96	Artemis knows what the boys like	Mann_Monroe	650	94	21		t5_2s28b	False
1368971752.0	1emp0s	"""Dennis, your mule is shit. I'm no longer turned on by mules"""	qqewrty	653	96	20		t5_2s28b	False
1351874536.0	12irfr	"""I got more of a catholic thing going on. You know? Sort of a hand of god."	CockroachClitoris	640	85	27		t5_2s28b	False
1372284589.0	1h4z62	The best scene from A Very Sunny Christmas	Thomas024	649	97	40		t5_2s28b	False
1359562118.0	17ke9q	It's a jumping-off point. 	ewilliam	660	102	23		t5_2s28b	False
1372595997.0	1hd1s1	"""Go download me a hoagie off the internet."""	SaltyCarl	647	92	24		t5_2s28b	False
1356323774.0	15cxg9	best wallpaper i've found so far	guidotheguido	619	65	16		t5_2s28b	False
1361841054.0	1988j9	Quite possibly the funniest scene in the entire show.	mcon6864	656	106	42		t5_2s28b	False
1361755342.0	195x3q	Mayans and Mexicans	atticus138	627	79	17		t5_2s28b	False
1352143298.0	12ok99	my gf was snooping through my ipad, she all the sudden set it down and asked if there was anything i wanted to tell her	rbrink13	627	71	24		t5_2s28b	False
1357665782.0	166xkj	One of my favorite Charlie scenes!	earwigy1990	624	69	18		t5_2s28b	False
1361896294.0	199khp	Pepe Silvia: Last Seen Donating at BK for muscular dystrophy	cackbewl	644	95	18		t5_2s28b	False
1369148332.0	1erlts	Tornadoes comin'... Hatchet comin'	mademperornero	641	100	4		t5_2s28b	False
1363134751.0	1a6mvr	My favorite Frank scene	Doc_MantisToboggan	647	101	29		t5_2s28b	False
1373302634.0	1hvgha	Finally there is an elegant comfortable mitten for cats	Nic__Cage	661	114	22		t5_2s28b	False
1353861323.0	13rhyu	Cat in your wall? (x-post r/aww)	nothingcorporate	640	96	14		t5_2s28b	False
1372511385.0	1hb4e1	yes my good man...	wharma-kore	622	81	17		t5_2s28b	False
1359845440.0	17ry9h	Redditors at Work	cupanoodle	777	237	6		t5_2s28b	False
1350499201.0	11n5t9	I was watching The League when suddenly...	mokadude1	651	112	34		t5_2s28b	False
1362153838.0	19guav	So I made this last semester, who wants to play?	Doc_MantisToboggan	634	96	49		t5_2s28b	False
1350997770.0	11xzsj	Who wouldn't want their garbage men in tuxedos and driving a limo?	xnerdyxrealistx	626	86	17		t5_2s28b	False
1367591494.0	1dmcbd	Lethal Weapon 5 Criterion Cover	likwitsnake	629	93	26		t5_2s28b	False
1363706413.0	1alh7n	Is it sexy?	Doc_MantisToboggan	616	79	28		t5_2s28b	False
1359777590.0	17qjpk	Mac's Tribal Tats	princesspeache	616	92	26		t5_2s28b	False
1349348957.0	10xi7f	ONLY ONE MORE WEEK!	hero0fwar	586	60	37		t5_2s28b	False
1341169615.0	vw057	Charlie Day. Didn't catch this one the first time through	Leinadz	618	92	15		t5_2s28b	False
1373737272.0	1i86lp	My favorite relationship on IASIP	vespaceballs6	602	77	34		t5_2s28b	False
1371172301.0	1gb4ku	Guess who showed up at my friend's bike shop today?	icangetuatoe	610	85	37		t5_2s28b	False
1358387147.0	16q281	Introducing Eagles New Head Coach Charlie Kelly	ssebonac	593	67	32		t5_2s28b	False
1372633115.0	1he2jx	So I bumped into Mac and Charlie a few weeks ago.	smallwoodlandcreatur	605	83	53		t5_2s28b	False
1366050344.0	1cejuk	What is this word....?	ILoveLamp9	580	64	7		t5_2s28b	False
1363447449.0	1aetw4	"Dennis's ""Progression"" in this episode kills me"	TheMoz	608	89	32		t5_2s28b	False
1365891621.0	1cajwx	I'm sorry rum ham!	Bogwaterben	607	88	19		t5_2s28b	False
1348247861.0	1098rq	Who's that sexy news guy? It's Mitt! Yes, It's Mitt!	wendell_short_eyes	612	93	10		t5_2s28b	False
1363979464.0	1atdsu	One of the best, out of nowhere moments in the show IMO. 	SoupJedi	587	65	34		t5_2s28b	False
1353639228.0	13ndwk	I feel like my cousin has turned into Mac from season 7	TomorrowsConquest	600	84	35		t5_2s28b	False
1362458251.0	19osbq	Not sure if you've seen this before. I found it in an art gallery.	daveleclair	568	53	9		t5_2s28b	False
1349801240.0	117be6	This must be what Charlie sees on his way home from work	jboozer	597	78	9		t5_2s28b	False
1360792414.0	18gypt	Still looking for that perfect card for your special someone? Look no further.. 	balmaniac	584	64	10		t5_2s28b	False
1347330428.0	zorkn	DO NOT VOTE FOR DENNIS REYNOLDS	Wings_Of_Karma	617	102	18		t5_2s28b	False
1369313326.0	1ewerf	"The one guy with a job that's worse than ""Charlie work""..."	VictorBlimpmuscle	594	83	26		t5_2s28b	False
1337864545.0	u2op3	From the set of Lethal Weapon 5	rbooo	553	46	9		t5_2s28b	False
1362569577.0	19rqz3	Thought you guys might like my new T-shirt	Absolution101	595	82	20		t5_2s28b	False
1357002604.0	15r2z1	Well. It's official. Cosmo fell for the D.E.N.N.I.S. System...	eldergreene	549	41	18		t5_2s28b	False
1355233825.0	14nx93	Artemis has that special something. A certain je ne sais quoi.	ChemicalOle	581	74	28		t5_2s28b	False
1348499815.0	10e8ku	You know exactly what you've done!	slideyep	572	60	11		t5_2s28b	False
1339857859.0	v518x	the whole idea of this makes me laugh everytime	hero0fwar	582	79	18		t5_2s28b	False
1370528639.0	1fsi04	That's retard strength if I've ever seen it..	Laurenanne727	617	113	20		t5_2s28b	False
1366242526.0	1ckizw	I'm exited to meet our new neighbors	regularhei	582	80	33		t5_2s28b	False
1352913627.0	136tro	Dayman Fighter of the Watchmen!	ssebonac	573	73	22		t5_2s28b	False
1360077799.0	17xoma	Frank fan art	jakefortwice	595	92	20		t5_2s28b	False
1375838891.0	1jupus	This is every night of my life...	atticus138	579	80	16		t5_2s28b	False
1372388308.0	1h82v4	Look what I found at my Goodwill!	artemis1093	637	140	45		t5_2s28b	False
1359375924.0	17fbrn	What are yooou?	Gebskin	572	76	19		t5_2s28b	False
1371727772.0	1gpyzq	Does this look like the street the bar is on? (Rodney Mullen video from before its always sunny)	Cytosen	590	94	62		t5_2s28b	False
1343224852.0	x4q80	On the guido boat	enjoiglobes2	569	72	27		t5_2s28b	False
1351624709.0	12cpt8	My friends and I on halloween.... not everyone knew those who did loved us.	shortbusridurr	556	65	18		t5_2s28b	False
1376140712.0	1k35sn	DID YOU FUCK MY MOM! DID YOU FUCK MY MOM!	BUKKIKEA	609	116	29		t5_2s28b	False
1364600956.0	1b9vcs	"Mac's ""Dat Ass"" Face (Season 1)"	PurpleRainMage	546	50	22		t5_2s28b	False
1374628263.0	1ixb7c	Glenn Howerton says there may be more than 10 seaons of Always Sunny	brafzachland	561	65	71		t5_2s28b	False
1366108467.0	1cgcgx	"""Oh Pepper Jack loves Fraggle rock"""	Seniorhippyhazza	549	60	17		t5_2s28b	False
1361471187.0	18ytvf	The preferred dessert of all Full-On-Rapists!	YonderMTN	607	115	15		t5_2s28b	False
1335512731.0	sv04t	My favorite sign of the playoffs this year (xpost from r/hockey)	livejamie	536	49	8		t5_2s28b	False
1341446454.0	w1ybo	The REAL only reason to look forward to September	JDM713	585	99	18		t5_2s28b	False
1371058757.0	1g7ij2	Hand of God	mahchefai	571	88	20		t5_2s28b	False
1369647143.0	1f4owc	Mac addresses the most prevalent of concerns regarding urban life	josshhhh	553	67	10		t5_2s28b	False
1372028803.0	1gxmwy	Looks like the gang finally sold some merchandising for Paddy's!	Ladygunshooter	581	95	27		t5_2s28b	False
1358555837.0	16ulue	Your own D.E.N.N.I.S system. 	Rather_Confused	530	49	64		t5_2s28b	False
1360203915.0	181fw5	My new poster... Was so excited when I found it... Bought it without hesitation	aaoun	557	79	31		t5_2s28b	False
1343268565.0	x60h6	Met this guy while walking in Melrose! He lost the fat! [x-post from r/pics]	actioncomicbible	545	64	44		t5_2s28b	False
1375977802.0	1jynnv	Think I got the wrong part of the building but you guys get it.	IncidentOn57thStreet	546	69	20		t5_2s28b	False
1366582017.0	1ctokc	What are you looking at dicknose	The-Sentinel	574	92	14		t5_2s28b	False
1362099134.0	19fkfo	I was watching The Perks of Being a Wallflower when I realized...		583	99	28		t5_2s28b	False
1374680640.0	1iymgv	Yeah, you're gonna wanna eat that, then huff some glue and chug some beer	SoundSouljah	576	99	34		t5_2s28b	False
1363372724.0	1ad4hv	Figured this sub would like my new credit card. I can't believe this was actually approved!	Zer0wned	568	87	26		t5_2s28b	False
1373390300.0	1hy2fe	My favorite part of Season 8	ColinsModeratelyCool	617	142	32		t5_2s28b	False
1363908789.0	1arl43	"""Ah, he's good with the conversation"""	jhandersson	558	88	14		t5_2s28b	False
1364213449.0	1ayw97	Stockholm Syndrom	donkeybonner	568	90	7		t5_2s28b	False
1376534016.0	1ke6y1	"""This is SINBAD'S house."""	MadderR3d	561	91	30		t5_2s28b	False
1359275810.0	17d1rm	I think we all would...	Platinum_Mattress	547	77	37		t5_2s28b	False
1360271554.0	1835zv	Mine and my buddies iPhone wallpaper. Dayman/Nightman 	betoporco	527	57	18		t5_2s28b	False
1359662872.0	17nc7u	Found Charlies favorite meal at a restaurant in Florence.	ewilz	556	86	27		t5_2s28b	False
1352399418.0	12v9vw	No idea if this has been previously posted before, but it gave me a chuckle.	Platinum_Mattress	600	123	18		t5_2s28b	False
1374827381.0	1j34m6	Sssssssssssss [S4 E13 - The Nightman Cometh]	sp4ce	539	70	33		t5_2s28b	False
1366741218.0	1cy92c	"""Stupid goddamn little savages...Idiots! IDIOTS!!"""	VictorBlimpmuscle	541	70	30		t5_2s28b	False
1361726153.0	19505x	I see what ya did there, Netflix.	btreichel	615	140	29		t5_2s28b	False
1374442277.0	1irrom	Oh, that's right.	josshhhh	524	59	17		t5_2s28b	False
1367697232.0	1dozlq	That's pretty wide right?	stabbish	526	60	19		t5_2s28b	False
1355013251.0	14iury	Damn Netflix....	jdmcblunt	566	100	27		t5_2s28b	False
1334675026.0	se9ug	Look at this giant bird. [x-post from r/birdswitharms]	xshare	565	97	15		t5_2s28b	False
1367267190.0	1dd080	I wanna get that Jesus on the cross look	LetsGetWeeiird	538	68	18		t5_2s28b	False
1333400343.0	rq2lg	They make it look like so much fun!	Corryyyy	515	50	9		t5_2s28b	False
1339685274.0	v1pdq	I would play the shit out of this	hero0fwar	527	65	50		t5_2s28b	False
1338058488.0	u6a0b	I spotted Sweet Dee skiing!	bebop8929	602	138	27		t5_2s28b	False
1360522985.0	189bhh	I googled the actor that plays Mac's father and got this picture of him in another role. Remind you of anyone?	JHole04	547	81	51		t5_2s28b	False
1376578878.0	1kf6rb	Look what I found in the background of some Jaguar F-Type pictures I was browsing!!!	DublinItUp	531	73	22		t5_2s28b	False
1364329087.0	1b2a2c	The moment that made IASIP my favorite tv show.	Firepork	509	53	43		t5_2s28b	False
1364913838.0	1bimi7	Freedom!	hate_tank	514	59	15		t5_2s28b	False
1364870744.0	1bhmky	Crack. Maybe only once.	hate_tank	508	50	21		t5_2s28b	False
1364931643.0	1bjajt	TIL Charlie Kelly was right about Bird Law: You can't own a hummingbird as a pet	cracka_azz_cracka	498	47	33		t5_2s28b	False
1373850144.0	1ib4hy	My reaction to the George Zimmerman verdict.	washington_fapitals	543	94	11		t5_2s28b	False
1364671525.0	1bbeiw	Dat Ass! (NSFW)	daisy_kate	563	122	30		t5_2s28b	False
1354272806.0	141pnt	Put this in a plastic bag, and boom, shower radio, buddy	Gebskin	504	54	11		t5_2s28b	False
1352275724.0	12sdb9	Get'em, Glenn!	mje267	566	119	49		t5_2s28b	False
1335975836.0	t3gnl	Ben and Jerry's: Milksteak and Jellybeans	hunterchamb	500	49	19		t5_2s28b	False
1373096239.0	1hqn3i	Do you like it? It's very generous.	costanza_vandelay	507	63	17		t5_2s28b	False
1354363294.0	143mnx	I don't know about you, but I was in tears after this scene ended.	nooby_pls	509	67	38		t5_2s28b	False
1348422830.0	10clac	So it has been foretold.	SethnotScott	513	73	12		t5_2s28b	False
1346621427.0	z8x7x	charlie	rbooo	542	102	10		t5_2s28b	False
1374388401.0	1iqmy9	I thought I recognized the girl on the McDonald's Monopoly commercial...	rolotomb	530	89	32		t5_2s28b	False
1361648583.0	193cis	WILDCARD BITCHES	cneck	531	86	10		t5_2s28b	False
1354806597.0	14dwat	When the person next to me in a Law Seminar tells the Tutor that he would like to specialise in Bird Law.	lorcantc	513	70	14		t5_2s28b	False
1373789511.0	1i9mow	"""The Nightman"" by Charlie Kelly"	Indycoone	507	68	27		t5_2s28b	False
1363619574.0	1aizoh	I've got the good lord going down on me!	agentgreen420	550	109	12		t5_2s28b	False
1365217620.0	1brzpg	The Night Man Cometh	atticus138	489	46	17		t5_2s28b	False
1353965870.0	13u0uz	Sunday rituals 	squints_palledorous	510	66	12		t5_2s28b	False
1375422251.0	1jjrdh	Seduction done right. [S5, E10]	ryancardiff	499	58	12		t5_2s28b	False
1355497064.0	14ueo1	My favorite scene from last night's episode	bigs1	480	36	45		t5_2s28b	False
1354298363.0	1427uk	It's Always Sunny coming to Netflix Instant Streaming December 8th!!!	numbers12and35	468	24	26		t5_2s28b	False
1348836523.0	10m6n8	Can't wait until season 8 begins	goblinskill	505	67	26		t5_2s28b	False
1341591598.0	w4ul5	Best Lethal Weapon  Movie Ever....	roninh8	508	72	22		t5_2s28b	False
1358727832.0	16yi0d	"Dennis (Glenn Howerton) in ""The Strangers"". I could not take this movie seriously because of this."	CtraneS	509	67	54		t5_2s28b	False
1352985797.0	138kup	Frank in the closet 	ottersaurusREX	485	46	21		t5_2s28b	False
1368242936.0	1e404l	I love so much about this man.	VictorMyNameIs	518	83	19		t5_2s28b	False
1342544566.0	wpjov	My buddy tweeted a picture from his wedding (of which I am in) to Glenn Howerton (Dennis of It's Always Sunny) and he re-tweeted it to his 200K+ followers. I am way more excited about this than any grown man should be. (X-Post from r/Pics)	peterpanman2	502	67	15		t5_2s28b	False
1342888395.0	wxeva	is there anything you don't like about this place?	hero0fwar	493	58	8		t5_2s28b	False
1367740981.0	1dq23h	Allows for violent hand movements. (X-post r/funny)	BaconTits_3000	462	31	13		t5_2s28b	False
1361380041.0	18w7y9	The Good Lord is going down on you?!	normanpsycho	517	84	10		t5_2s28b	False
