created_utc	id	title	author	ups	downs	num_comments	selftext	subreddit_id	is_self
1375683823.0	1jq5bx	"""You can't kill yourself bro, your neck is too thick!"""	milehighmecked	337	41	13		t5_2s28b	False
1362797910.0	19ya7z	This outfit is all of my favorite Charlie moments.	ecological_fallacy	337	42	24		t5_2s28b	False
1359586989.0	17laqx	Is that the ocean?!	cupanoodle	460	166	9		t5_2s28b	False
1346766077.0	zc2bj	Frank Thunder-gunning the shit out of the gang.	philbob8	347	50	8		t5_2s28b	False
1341705396.0	w772a	Frank's old girlfriend is paying a visit to my friend's town.	notacute	341	45	8		t5_2s28b	False
1337540615.0	twawl	Dr. Mantis Toboggan	hero0fwar	331	37	5		t5_2s28b	False
1361809563.0	1974tx	I'm an Oil Man!	AKing618	353	60	14		t5_2s28b	False
1351840054.0	12i6dg	For me, Charlie's insanity has always been one of the true highlights of the show...	chanks	323	29	30		t5_2s28b	False
1338405797.0	ucjed	I'M GONNA PUT MY THUMB THROUGH YOUR EYE YOU LITTLE BITCH!	fuzzypits	347	54	6		t5_2s28b	False
1338142929.0	u7j2z	Oh my God, get lost, creep!	TheOnlyAlex	343	53	19		t5_2s28b	False
1329841406.0	pzgb8	"""Egg."""	hobelife	333	39	14		t5_2s28b	False
1371647194.0	1gni2z	Perfect mix of comfort and wind resistance.	mwolf83	347	53	15		t5_2s28b	False
1346004548.0	yv0kv	"Had my first day of work today, and everybody kept on mentioning this guy named ""Pepe"". This is how I felt until I figured out who they were talking about."	noflippingidea	342	50	21		t5_2s28b	False
1331532546.0	qskrc	The Whore-ax	killer_beez_kneez	335	41	5		t5_2s28b	False
1375651924.0	1jp8ri	We're the home of the original Kitten Mittons!	maebybluth	363	70	10		t5_2s28b	False
1358354399.0	16owex	Beans [s04e05x06]	will118	341	50	8		t5_2s28b	False
1356223586.0	15ayu9	The future of patriotism...	ibaadk	346	55	20		t5_2s28b	False
1331138325.0	qlw55	Danny Devito taking one of his trollfoot photos	hero0fwar	331	39	21		t5_2s28b	False
1328895833.0	pjlpq	There's no Pepe Silvia?	hero0fwar	343	55	32		t5_2s28b	False
1373210616.0	1hsz7p	Why don't we play nightcrawlers anymore?!	ShellShocked13	346	55	20		t5_2s28b	False
1363795959.0	1ao44p	Was trying to find a certain image of Dennis, ended up finding this beautiful picture of Mac. Enjoy.	onelung	323	32	6		t5_2s28b	False
1346862055.0	zedh7	The implication ie [S6 E3 - The Gang Buys a Boat]	mesosa	354	68	29		t5_2s28b	False
1343089020.0	x1n8s	So I was playing Jeopardy on my iPod, when suddenly...	badluckbelle	345	57	9		t5_2s28b	False
1334936317.0	sjsix	I showed my mom the boat episode and she loved it. A few weeks later she sent me this picture from Thailand...	iheartdna	344	56	13		t5_2s28b	False
1334137813.0	s4490	This moment made me laugh so hard	banytoshbot	322	33	23		t5_2s28b	False
1333130133.0	rl7pw	SOLD!	Corryyyy	350	61	10		t5_2s28b	False
1364775180.0	1bdz4k	.com	Buttbutttimecapsule	368	80	8		t5_2s28b	False
1355974708.0	155ce2	that's why it was on every letter	scottschism	386	101	69		t5_2s28b	False
1340195753.0	vbqcf	Dude, you could totally chop a camel in its hump and drink all its milk off the... off the tip of this thing, man!	iiiicpdiiii	344	61	6		t5_2s28b	False
1367118939.0	1d94s8	A few unrelated Mac moments	thejehosephat	320	33	15		t5_2s28b	False
1365080531.0	1bnozt	Just beat the system	mwolf83	323	34	34		t5_2s28b	False
1358823701.0	1715le	You see that door?? (xpost from /funny)	smellyfartcloud	327	39	7		t5_2s28b	False
1342198902.0	wi9e7	Awesome fan-made It's Always Sunny In Philadelphia L4D campaign. (x-post from r/gaming)	myfajahas400children	342	60	21		t5_2s28b	False
1350613230.0	11q5fs	Milk Steak	Benneke10	328	43	20		t5_2s28b	False
1356123442.0	158vsy	It's Always Sunny Christmas Card	mansoor30	312	30	9		t5_2s28b	False
1349122444.0	10s0b1	Nightman Never stood a chance	Halfbakedjuice	327	41	20		t5_2s28b	False
1345127007.0	ybki2	Squeak...Squeak...Squeak...	wildfire2k5	339	55	9		t5_2s28b	False
1342727521.0	wu141	"""You mind if I just took a quick peek at your new review there?"""	The2500	328	44	2		t5_2s28b	False
1338973135.0	unp11	How Sweet Dee went jogging	Asfald	326	42	6		t5_2s28b	False
1327780340.0	p0sfy	Charlie Kelly's own recipe	binbindabba	320	39	26		t5_2s28b	False
1374935982.0	1j5tea	I just found this subreddit and this was my reaction	Mass49	405	123	15		t5_2s28b	False
1354527757.0	146zta	Anyone else a fan of the Mac hip stance?	slideyep	317	36	10		t5_2s28b	False
1326068859.0	o8kox	My favourite Christmas present. 	BZilliA	303	24	15		t5_2s28b	False
1356840644.0	15nozb	"""Let's just light the nursing home on fire"""	NFHoward	315	31	8		t5_2s28b	False
1351962184.0	12kj4w	Marital Bliss 3.0	Mousi	306	25	21		t5_2s28b	False
1344922393.0	y6t2p	One of my favorite Sunny scenes	Serdne	327	45	12		t5_2s28b	False
1338817949.0	uk6hx	always a good idea	hero0fwar	313	33	4		t5_2s28b	False
1329332206.0	pr1lt	probably one of the creepiest dennis moments (IMO)	hero0fwar	330	46	31		t5_2s28b	False
1366325774.0	1cn1hb	I think the person who wrote my Sexual Harassment Training Program is a fan of the show.	deathspresso	353	78	7		t5_2s28b	False
1334118489.0	s3u2z	One of the best Sunny moments of all time. 	BaggySpandex	336	56	18		t5_2s28b	False
1333067115.0	rk4ok	I died....	kingshigh	323	38	12		t5_2s28b	False
1370622476.0	1fvbwj	Samantha gets to be mean! Because Samantha is a star, and maybe one day you'll be a star, but now you're trash!- Charlie Kelly	mothershipq	335	54	20		t5_2s28b	False
1370103095.0	1fgvte	"""Seriously? Congratulations!"""	BaggySpandex	330	50	22		t5_2s28b	False
1364316140.0	1b1sm5	I did it and I made it so sexy!	unspoken_lies	317	39	10		t5_2s28b	False
1350000732.0	11c7rv	After ordering FX Canada and then finding out it didn't have It's Always Sunny.	myfajahas400children	309	29	14		t5_2s28b	False
1347592522.0	zuxa1	Ze' Glory Hole!	YonderMTN	315	40	23		t5_2s28b	False
1357355427.0	15zl8l	I actually could not get my hands over my head in this costume. Just to be clear. 	denine	328	53	12		t5_2s28b	False
1331232993.0	qnntj	JABRONY * 2012	SonsOfLiberty86	316	41	6		t5_2s28b	False
1371001008.0	1g5zkz	I love everything about this	AlmostSeenOn	315	43	20		t5_2s28b	False
1341638584.0	w616q	I can't believe it took me this long to find this subreddit. But boy, am I happy I did.	AlexHeyNa	326	52	4		t5_2s28b	False
1332969454.0	ri5pz	SURPRISE BITCH! [gif]	Corryyyy	307	35	11		t5_2s28b	False
1371773400.0	1grh6z	Hanging out in LA for the day might as well take a pic of Paddy's Pub.	omgitskevin	318	46	28		t5_2s28b	False
1361403666.0	18x2md	Thank You for Your Service	Benneke10	313	40	11		t5_2s28b	False
1344195092.0	xq55n	I'M GONNA PUT MY THUMB THROUGH YOUR EYE YOU LITTLE BITCH!	TheOnlyAlex	326	49	8		t5_2s28b	False
1339639017.0	v0wwb	warm sun, cool ocean breeze.......	bledsoe7324	300	26	12		t5_2s28b	False
1359991178.0	17varu	Frank fan art	jakefortwice	340	65	13		t5_2s28b	False
1350105953.0	11ek5m	The best thing about time-travel movies...	stuckunderwheels	304	31	6		t5_2s28b	False
1341266493.0	vy2ol	Crime Stinks!	tiMMy4190	308	36	10		t5_2s28b	False
1334582973.0	sccer	Go, Snail Go! Get outta here!	BrianTheLady	311	39	26		t5_2s28b	False
1364976583.0	1bkrfz	Ended things with a female friend of mine, came home to find my roommate had left me a present on my wall	whiskeysquid	319	49	22		t5_2s28b	False
1320945766.0	m7lmm	Pretty much.	0rangendRed	284	10	6		t5_2s28b	False
1369200662.0	1etgjx	I'm Dr. Toboggan, Dr. Mantis Toboggan.	clonsiah	307	35	18		t5_2s28b	False
1364723544.0	1bcolh	McPoyle???	TheMightyZander	347	80	10		t5_2s28b	False
1334868019.0	sielj	TIL...	sleepfighter7	451	180	57		t5_2s28b	False
1340134438.0	vagcl	Charlie Kelly's Milk Steak	CharlieFightsEmOff	326	54	12		t5_2s28b	False
1339172278.0	urr1u	Your eyebrow...it's so..connected.  You're a stone-cold fox, Margaret.	TheOnlyAlex	298	28	15		t5_2s28b	False
1332296451.0	r649a	Lyrics we can all live by.	kieranwilson32	311	39	10		t5_2s28b	False
1367638383.0	1dnt4r	a golf cart i would choose every time if i had the choice.	tsmith944	306	40	7		t5_2s28b	False
1365623019.0	1c30y8	Anyone know of a gif of this scene?	krisross	326	55	28		t5_2s28b	False
1362722971.0	19wcpl	Charlie gets me every time with this one [S3:E12]	beastybryan	297	32	10		t5_2s28b	False
1353291921.0	13fg4r	My favorite Charlie moment (x-post'd from r/Sherlock)	johnnyfortune	308	36	7		t5_2s28b	False
1355462530.0	14tv0d	Charlie's looking right at me...	SkwisgarIsAmsDick	291	28	12		t5_2s28b	False
1359949310.0	17ugwi	It's mostly that horrible angle that you see in porns...	Renson	314	47	10		t5_2s28b	False
1351566555.0	12bhdx	My husband and I in our Halloween costumes	housestarktech	301	34	28		t5_2s28b	False
1352463115.0	12wrfr	Wait, THAT looks like a dick!	hatsandhardcore	315	48	13		t5_2s28b	False
1330397714.0	q93qa	It works every time...	matthickman90	291	26	14		t5_2s28b	False
1324511902.0	nlwpj	Ronnie the Rat...	MDevonL	295	27	3		t5_2s28b	False
1355173854.0	14mhwl	Happy early Christmas to me!	TomorrowsConquest	309	45	22		t5_2s28b	False
1350633844.0	11qlgf	More Marital Bliss	slideyep	301	35	10		t5_2s28b	False
1370220236.0	1fju5w	Me trying to learn golf today.	RuncibleSpoon18	314	53	6		t5_2s28b	False
1324683825.0	noidr	you know I wonder this too...	hero0fwar	284	23	5		t5_2s28b	False
1373975201.0	1ieona	This Filipino lady went crazy on me! Started scratching me like a velociraptor!	PepeLaRue	303	42	15		t5_2s28b	False
1372229228.0	1h3e47	Jesus Christ, the kids an idiot.	clonsiah	298	35	16		t5_2s28b	False
1365340308.0	1bumrz	What do you smell?	Firepork	315	51	10		t5_2s28b	False
1351065946.0	11zw8t	In regard to the upcoming election, I agree with Charlie	moxiedrinker82	280	18	13		t5_2s28b	False
1333551073.0	rsxqd	"""Dude, That is BAD ASS"""	Corryyyy	295	35	8		t5_2s28b	False
1372346371.0	1h6kwb	Dennis, Stevie and Jean-Ralphio. My worlds have collided.	RichG13	306	45	45		t5_2s28b	False
1357428650.0	1614wv	I'm gonna pull a Good Will Hunting	Tayto2000	301	40	33		t5_2s28b	False
1375756621.0	1jsa9p	"""Surprise, bitch!"""	cokecap91	291	33	12		t5_2s28b	False
1355504063.0	14ul53	"""Tipping"""	Tdogg425	282	23	39		t5_2s28b	False
1374883697.0	1j4ra8	Just Bump It	milehighmecked	300	40	7		t5_2s28b	False
1374261365.0	1inewo	Wait! .................... he's cool!	Eamez	297	37	12		t5_2s28b	False
1367521388.0	1dkgv0	"""He loves Mexicans"""	stovenozo	298	41	14		t5_2s28b	False
1324292668.0	nie0g	Just saw the news!	Eamez	283	22	3		t5_2s28b	False
1340278391.0	vdleg	The God Hole	mmclennan	308	48	9		t5_2s28b	False
1373756820.0	1i8s22	I'm gonna fire a beer across his bow, ruffle his feathers	ajc212	291	30	14		t5_2s28b	False
1352436533.0	12wdbi	Drawing conclusions. And... drawing this.	wendell_short_eyes	285	29	21		t5_2s28b	False
1344722776.0	y2doa	we're gonna sell these on the street	hero0fwar	282	23	9		t5_2s28b	False
1339555399.0	uz4jt	this...is public access.	Raoul_Digby	289	32	10		t5_2s28b	False
1338930028.0	umpig	I wish they would make this guy a regular. 	The2500	300	46	26		t5_2s28b	False
1374238605.0	1immlq	Couldn't help but think of my favorite illiterate.	tinypurplefish	304	50	15		t5_2s28b	False
1364304733.0	1b1g2d	no...it's your neighbor!	taterNuts	294	37	17		t5_2s28b	False
1356104531.0	158b20	"Is anyone else reminded of this guy when Frank says ""Charlie""?"	kdar	335	81	18		t5_2s28b	False
1334499597.0	sashl	has to be the best way to get information out of someone	wharma-kore	297	42	5		t5_2s28b	False
1376080444.0	1k1rpk	"@ ComicCon San Diego, I say ""Hey Mac, looking super buff bro!"" He looks up and gives me the head nod!"	Ruck1707	285	32	7		t5_2s28b	False
1333610174.0	ruby2	PEPE SILVIA	wharma-kore	297	46	28		t5_2s28b	False
1374074069.0	1ihn3q	You're wanting me to say that I wanna make love to a little baby tiny boy	SchraderFineMinerals	296	39	19		t5_2s28b	False
1366223580.0	1cjs4j	Dr. Jinx's Homeopathic Remidies	thtoneaznguy	294	42	18		t5_2s28b	False
1362358784.0	19lwsj	Pick. Throw.	Benneke10	315	60	16		t5_2s28b	False
1356845047.0	15nsza	Probably the best of Mac's shirts	jomo983	281	29	10		t5_2s28b	False
1335068583.0	sm8uw	One of the best IASIP episodes. 	shrugalicious	305	49	25		t5_2s28b	False
1334368661.0	s8xcy	The implication	r2002	287	32	8		t5_2s28b	False
1333498240.0	rs12o	Look who lives in my neighborhood	its_me02	291	37	13		t5_2s28b	False
1367383313.0	1dgpmx	Put up a small tribute to Mac in my store.	hate_tank	289	40	6		t5_2s28b	False
1372452402.0	1h9spp	The Whole McPoyle Gang (Angry)	camb42	302	52	23		t5_2s28b	False
1345374124.0	ygvz0	Public transportation is the worst.	maz-o	299	51	19		t5_2s28b	False
1373590657.0	1i4ef7	I can't stop crying, Ernesto!	Jesus_Took_My_Wheel	280	30	3		t5_2s28b	False
1345289272.0	yfanx	"""This is how we get psyched up before each level."""	failspy	293	43	7		t5_2s28b	False
1343697148.0	xf96h	My mom says I'm not pretty enough	iwantahouse	279	31	8		t5_2s28b	False
1332871162.0	rg5lf	Dr. Mantis Toboggan	hero0fwar	289	40	9		t5_2s28b	False
1350202246.0	11gch8	Which one of us do you want to take ya in the back and bang ya?	shtoobins	279	33	22		t5_2s28b	False
1344875037.0	y5f87	It's Always Sunny reference I just noticed in The Sims 3!	RGT42	317	73	21		t5_2s28b	False
1342460512.0	wnj7c	Rex did a pretty sweet panther though...	hardcore_softie	302	53	12		t5_2s28b	False
1339108907.0	uqkep	I feel like you're big leaguing me here.	ftp411	264	16	7		t5_2s28b	False
1357512725.0	16316y	There is some shit going down right now....	walsh92	313	68	22		t5_2s28b	False
1324433221.0	nkp0o	You've got to be shitting me.	anthropophile	265	19	3		t5_2s28b	False
1364273876.0	1b0wtb	Chardee MacDennis Mishap	kBeeN377	301	56	21		t5_2s28b	False
1372387334.0	1h81pm	"""We're gonna need a towel or a table cloth or something!"""	lostinthesnow	272	28	9		t5_2s28b	False
1326939310.0	omjph	Surprise, bitch!	hero0fwar	270	27	4		t5_2s28b	False
1373310622.0	1hvrnh	I do not like it with the skin, Dee. I am not allowed to eat it with the skin. I AM NOT ALLOWED!	AdioSiks	264	22	12		t5_2s28b	False
1370893704.0	1g2di7	Just hit 30,000 Jabronies today!	hero0fwar	262	18	8		t5_2s28b	False
1365988224.0	1ccyxp	I went to the zoo today, and saw some familiar names.	pooping_rainbows	278	36	14		t5_2s28b	False
1354462367.0	145i6p	I'm more sober than I've ever been [xpost from /r/tvgifs]	hero0fwar	299	55	11		t5_2s28b	False
1340939577.0	vrznh	butt butt	hero0fwar	260	14	7		t5_2s28b	False
1374588735.0	1ivuyq	Funny that they never mentioned her again...	chhey	272	30	22		t5_2s28b	False
1368728435.0	1egr3f	Danny DeVito's TV is a window to the Future... Listen to the song when he turns on the TV in this old clip from Taxi...	NyPoster	261	19	32		t5_2s28b	False
1332115628.0	r2okb	Danny DeVito is; The Lorax. And...	HBreeder	267	26	11		t5_2s28b	False
1329602000.0	pvojn	this scene was fucking priceless	hero0fwar	276	33	12		t5_2s28b	False
1340418253.0	vgsmd	Definitely my favorite episode of this show.	ThatShaunGuy	296	57	35		t5_2s28b	False
1374933303.0	1j5rei	"""Hey Deandra, got an bacon bits? We like to put them in Artemis's hair, and they rain down on me when we bang"""	RandiReed1990	275	35	13		t5_2s28b	False
1354133756.0	13y93w	Charlies Match profile	AugustsOnlySon	269	31	25		t5_2s28b	False
1331913613.0	qzien	thinking of doing a local comedy amature night, this is my biggest fear...	hero0fwar	254	14	13		t5_2s28b	False
1330589001.0	qcovp	Darkest part in this show	DBurdie91	261	21	32		t5_2s28b	False
1344993336.0	y8id3	cutoff jorts = greater flexibility	mellow_man13	273	32	25		t5_2s28b	False
1329538838.0	puv63	All I could think about when I watched this last night	TOHCskin	268	28	5		t5_2s28b	False
1371150266.0	1gabcd	Rob McElhenney and Charlie Day filming It’s Always Sunny In Philadelphia (season 9)	chrisjortiz	258	17	18		t5_2s28b	False
1355944398.0	154ezm	It's a Christmas Miracle!	dukeAg	272	34	21		t5_2s28b	False
1355147354.0	14lqfo	Merry Christmas Bitches!	ChemicalOle	265	28	7		t5_2s28b	False
1350165405.0	11fkr0	Wildcard, Bitches!	thebradymills	255	18	6		t5_2s28b	False
1331508763.0	qs45b	South Philly 	hero0fwar	282	46	12		t5_2s28b	False
1344519839.0	xxsgq	EGG!	frshmt	279	39	6		t5_2s28b	False
1354857234.0	14fgo4	I made a wallpaper from tonight's episode	Jay-Eff-Gee	270	34	8		t5_2s28b	False
1369430154.0	1ezto4	Wish I had best friends like these.	Tank_gamer10	268	32	10		t5_2s28b	False
1358966238.0	174w6o	Get outta the way you fat dickhead!	fuzzypits	277	42	19		t5_2s28b	False
1356059913.0	157fre	/RumHam/	ASAPlaptop	272	34	12		t5_2s28b	False
1375621005.0	1jof2k	This also still amazes me	bambiix	266	30	15		t5_2s28b	False
1373627926.0	1i5abq	You are gonna get so much shit shoved up your ass tonight, four eyes.	AdioSiks	274	39	8		t5_2s28b	False
1372791850.0	1hijqu	I have to have my tools!	galesden	270	35	25		t5_2s28b	False
1371597850.0	1gmaj4	What the hell is going on?	normanpsycho	271	41	39	That's Tammy, Trey's ex-girlfriend. This is classic Tammy. Trey broke up with Tammy because Maureen Kanallen said that she saw Tammy flirting with Walt Timny at a party, but she was only doing it to make Trey jealous because you know, she thought that Trey secretly liked Erin Henebry, but he doesn't like Erin Henebry, it was all a bunch of bull.	t5_2s28b	True
1370036715.0	1ffhhk	Sweet Dee dressed in green	reddit858	271	38	8		t5_2s28b	False
1364023162.0	1aul5w	We're Lawyers!	six6six4kids	272	36	9		t5_2s28b	False
1376025638.0	1k0cfx	"""Barney, he's the guy that tipped me off to Pepe Silvia"""	waka_flocculonodular	260	27	21		t5_2s28b	False
1374420444.0	1ir4j7	Was watching an episode of Curb Your Enthusiasm when I noticed this crazy lady	lostinthesnow	303	74	24		t5_2s28b	False
1375717796.0	1jqul4	Magnets. Just magnets.	missladybear	274	41	18		t5_2s28b	False
1349346483.0	10xh5n	God damnit, Dee!  Would you get out of here?!	spreezy89	273	39	5		t5_2s28b	False
1373727629.0	1i7wv3	Who's that sexy news guy? It's Mac! Yes, it's Mac! And he's on the channel, whatever we make it on, news!	jmWaka25	272	43	17		t5_2s28b	False
1362593460.0	19sdgp	Wanted, Dead or Alive	RickyBigRigs	253	18	12		t5_2s28b	False
1355555569.0	14vx4d	The world is a safer place... when he's around	Juice27	267	36	9		t5_2s28b	False
1328206489.0	p7z9a	I can't be 100% sure, but I think the guy in the leather jacket wants to eat Charlie's baby. 	MisterWonka	266	34	23		t5_2s28b	False
1353193746.0	13dfc6	Give Me Money.	DayWalkerRunner	252	20	10		t5_2s28b	False
1319033093.0	lhhcd	Invite to the party mansion	enjoiglobes2	246	14	10		t5_2s28b	False
1333849067.0	rynj6	Work first. And then you can do your weird inflatable tube man P. Diddy dance. 	RedSolution	249	20	4		t5_2s28b	False
1331380577.0	qq74j	What is white trash about that?!	hatsandhardcore	237	8	12		t5_2s28b	False
1323728953.0	na651	Bought a book online, this is what I saw when I opened it up.	Snowy_crack	258	31	7		t5_2s28b	False
1345736423.0	yp7gs	Mac and Coach.	Platinum_Mattress	271	42	12		t5_2s28b	False
1344004408.0	xmcux	the crevice	mooj2110	264	39	6		t5_2s28b	False
1338747402.0	uiue7	"""What are you hobbies?"" ""Magnets."" (xp from /r/funny)"	smittenkitten33	264	36	12		t5_2s28b	False
1323373634.0	n57s0	I will never laugh as hard as I did the first time I saw this.	Snowy_crack	245	14	18		t5_2s28b	False
1338659266.0	uhejm	Boom!	Mousi	281	54	6		t5_2s28b	False
1372721283.0	1hgktt	I was trying to download a mixtape, but when I got to the Captcha, it didn't exist.	_1863	277	51	19		t5_2s28b	False
1337280759.0	ts1n5	My older relatives must not watch Sunny	giddyup523	279	51	22		t5_2s28b	False
1334836562.0	shois	I know he's a nemesis but anyone else love this guy?	slideyep	246	19	26		t5_2s28b	False
1329637468.0	pw966	Probably my favorite moment ever...	85Fiero	262	40	11		t5_2s28b	False
1368727957.0	1egqfw	Was told to post here. My roommate giving Danny Devito a piggy back ride.		245	23	10		t5_2s28b	False
1326473166.0	oflle	"""I wanted to eat that lady...."""	hero0fwar	235	7	11		t5_2s28b	False
1374206402.0	1ilzcf	The name's Artemis	hero0fwar	264	40	20		t5_2s28b	False
1362070461.0	19ejm7	My neighbor painted this, pretty cool.	mossypots	300	74	5		t5_2s28b	False
1362525382.0	19qlaa	Dating advice	adamgmoney13	286	64	10		t5_2s28b	False
1328327378.0	pa83h	What's up bitches?!  You're the Subreddit of the Day for February 4th, 2012!	SRotD	254	29	39	"Friends of /r/IASIP!  Our sincerest congratulations to all!  Thanks goes to those who made this subreddit the awesome place that it is.

Thanks to the posters, the commenters, the person who cleaned this place up to make it so beautiful, high fives all around!

Now it's your turn, show your love for this place by subscribing.  Go on and click that **subscribe buttin**!  Make a post, share a comment, get involved!

Thank you for your subreddit and for making reddit.com a much more interesting place.

---

""There is no way I'm dating a retarded person."""	t5_2s28b	True
1339945994.0	v6h8w	Always Sunny invades r/Community	blpoker	290	67	8		t5_2s28b	False
1328644542.0	pf37q	That's not a twist!	hero0fwar	241	19	6		t5_2s28b	False
1370588872.0	1fukri	Favorite scene from my favorite episode (S07E02)	ehlu15	247	30	15		t5_2s28b	False
1357210545.0	15vt7b	I got more of a Catholic thing going.  Sort of.. The Hand of God.	jellystone	253	36	9		t5_2s28b	False
1339797791.0	v444t	Interesting point. 	The2500	251	33	6		t5_2s28b	False
1325713154.0	o30pt	this makes me laugh everytime	hero0fwar	249	27	13		t5_2s28b	False
1324055726.0	nfc92	We're lawyers!	Calleroo	235	18	19		t5_2s28b	False
1366346032.0	1cns3p	We need charlie in the investigation	cubbycubb	253	33	18		t5_2s28b	False
1363722796.0	1am35s	A coworker just told me about a dream they had the previous night.	jackflash45	238	24	0		t5_2s28b	False
1335820076.0	t0d4b	It's called a Charlie 1-2, okay?  You're gonna do this!	thebradymills	263	47	8		t5_2s28b	False
1371854824.0	1gtoy6	Charlie Kelly: Master Thief	skoog16	243	30	7		t5_2s28b	False
1343821063.0	xi249	Honey and Vinegar, driven by the thrill of the sale.		244	28	5		t5_2s28b	False
1368402547.0	1e7n63	"""Banging your sister is perverted, Dennis."""	ChillWithBenjamin	272	55	21		t5_2s28b	False
1372985314.0	1hnynv	My uncle is one of the producers and close friend of the cast, here he is hanging with the McPoyles. Boy does he have some awesome stories.	racattack	245	28	20		t5_2s28b	False
1354881920.0	14fv8k	So I got a box of peaches from my online friend!	raidraidraid	259	46	33		t5_2s28b	False
1374721475.0	1j04h3	wallpaper I made from fxx.com	hero0fwar	247	36	9		t5_2s28b	False
1354282378.0	141u0y	just a couple of people who totally got off, bro	NGHTMR	234	21	19		t5_2s28b	False
1345391626.0	yh4j6	When My Girlfriend Keeps Nagging Me in Bed	AUflyguy	250	39	6		t5_2s28b	False
1331999074.0	r0vev	ASIP Portrait of the Gang. (wish my family had one like this) 	toecondom	254	40	12		t5_2s28b	False
1345430301.0	yi462	My current desktop	gerntoronto	243	34	24		t5_2s28b	False
1375980837.0	1jyrr9	I lost it at this scene	Jp_Burke	249	39	16		t5_2s28b	False
1351634199.0	12d20j	Storms coming?	stonenbone	244	32	4		t5_2s28b	False
1340565029.0	vj8xy	As requested - Pepe Silvia Shirt Design (Minus eyes... Apparently i cant do them)	Slick85	228	20	52		t5_2s28b	False
1334339337.0	s88li	Isn't she precious?	Corryyyy	250	39	5		t5_2s28b	False
1348792401.0	10ldlo	Every pimp has a chalice!	Simbrian	246	34	5		t5_2s28b	False
1347043408.0	zinww	New to this sub, not sure if it's a repost, but either way it is pretty awesome.	MANTHEFUCKUPBRO	237	28	16		t5_2s28b	False
1337915510.0	u3w4s	Charlie would enjoy this shop down in San Francisco	MistahSchwartz	234	25	14		t5_2s28b	False
1328686773.0	pfzrx	Mac, on how to deal with cyclists...	dontdoitbro	227	16	11		t5_2s28b	False
1376106453.0	1k2knf	You are NOT capable of doing that.	MrSlowrolla	233	29	17		t5_2s28b	False
1375752295.0	1js4rz	All right all right, you got me. I am an actor, my name is Don Cheadle	HoChiMiner	225	14	16		t5_2s28b	False
1370817693.0	1g0a0a	Redditor proposes to his girlfriend on the top of a mountain beside a cliff, and suggests that she had to say yes -- because of the implication. (X-Post from r/CampingandHiking)	CDNeyesonly	249	44	7		t5_2s28b	False
1364616276.0	1bab0n	Got it	costanza_vandelay	232	27	3		t5_2s28b	False
1355044178.0	14jivo	I just love the narcissistic psychosis of Dennis.	m84m	226	20	21		t5_2s28b	False
1376584155.0	1kfdkt	Frank being Frank	LFazevedo	245	39	14		t5_2s28b	False
1372050185.0	1gy97q	Egg!	camb42	251	41	10		t5_2s28b	False
1342046388.0	werkx	yes, yes you do	hero0fwar	242	37	11		t5_2s28b	False
1366936484.0	1d4dz1	"""You'll be smitten!"""	FFBB648	276	68	10		t5_2s28b	False
1364107929.0	1awk27	Dick Towel! Nsfw	hate_tank	263	58	9		t5_2s28b	False
1358388172.0	16q3mn	The Gang Gets Animated	tutoredzeus	228	22	10		t5_2s28b	False
1351954141.0	12kcx9	"""I thought you said you weren't going to hit on her?"" Am I hitting on her?"""	fuzzypits	247	43	14		t5_2s28b	False
1323611354.0	n8gan	Ryan! Stab somebody!	Sects_And_Violence	224	19	12		t5_2s28b	False
1370965402.0	1g4kn1	MRW I trip over my words due to anxiety while giving residence hall tours at my university to large groups of new students and parents	txchainsawmascaraxx	258	54	12		t5_2s28b	False
1351259620.0	124fvh	Going as Charlie again	stonenbone	255	49	27		t5_2s28b	False
1342982585.0	wz4r7	the only show considered a comedy	scottschism	267	62	19		t5_2s28b	False
1342337978.0	wl3wm	jars of pee	hero0fwar	228	20	10		t5_2s28b	False
1341590922.0	w4txm	ate a pear for the first time in a long time and this went through my head	jbo490	222	15	7		t5_2s28b	False
1330479009.0	qakzj	I feel the same way	hero0fwar	216	13	6		t5_2s28b	False
1323960821.0	ndtfq	A Young Ronnie the Rat [FIXED]	bertbargo	224	20	9		t5_2s28b	False
1319404716.0	lmdh7	Friend carved this, I'm simply here to reap his karma	Lightnin4000	216	12	8		t5_2s28b	False
1358007482.0	16fvgm	Just started watching this show, when I realized something	shadowslayer978	282	78	23		t5_2s28b	False
1354373411.0	143r18	My new wallpaper	ab0uttreefiddy	261	57	11		t5_2s28b	False
