created_utc	id	title	author	ups	downs	num_comments	selftext	subreddit_id	is_self
1319991808.0	lu5tq	Breathing on windows and pretending to be a velociraptor 	MattyHchrist	17	4	1		t5_2sdsw	False
1319828437.0	lshhj	Why Do We Keep Going Back to Jurassic Park?	EmperorYork	13	2	0		t5_2sdsw	False
1319591596.0	lp4ma	Jurassic park ultimate trilogy out today!!! (FYI best buy has an exclusive combo not listed on Jp.com with both blu rays and regular DVDs for 10 bucks more)... I however opted for the toy. 	CanisLupusArctos	14	3	7		t5_2sdsw	False
1311462111.0	ixz6b	Spielberg says new 'Jurassic Park' is coming soon - Yahoo! Movies	slckash	13	1	0		t5_2sdsw	False
1376516009.0	1kdk9q	Jurassic Park VHS - Sealed	JustinKeenan	11	1	5	I have a Jurassic Park VHS sealed new, never been opened, still has stickers for a $5 rebate that expired in 1995. Just wondering what the approximate value of something like this is? Thanks	t5_2sdsw	True
1373231782.0	1htlzt	Does anyone remember this from their childhood days?	roadghost24	14	4	15		t5_2sdsw	False
1364694058.0	1bc2mj	What are you hoping that the JP4 story is about?	swallowmycockuccino	12	1	16	I was watching The Lost World and Jurassic Park III (didn't watch the original as I'm saving that for the upcoming 3D release next week) and started to get really excited for Jurassic Park 4. Like most of you, I've been waiting for this movie for years and kept an eye on it while it was stuck in development hell. Anyway, I started to wonder what this story should be about. A return to Isla Nublar would be great, returning to Isla Sorna wouldn't really be a good story as it's already been the location for two of the movies. Or should the story go to the mainland for good? Should the old characters return or should there be a complete cleanout of the cast? Would love to know what you guys think this movie that's got us all worked up is going to be about.	t5_2sdsw	True
1364051583.0	1av08j	Jurassic Park Jeep going Cross Country (Not Boomerjinks)	bearsa113609	20	8	6	"I'm the owner of JP Jeeep #18, and I'm not associated with boomerjinks. However, in light of their situation, I will be driving it myself instead of having it shipped. Who could resist driving to Colorado (original area where Velociraptor fossils came from Book Cannon) in the jeep itself.        
So, if your along the general route to Colorado from South Carolina, or if you are just interested, post away!          "	t5_2sdsw	True
1363194650.0	1a8424	Poll: Which JP movie was better 2 or 3?	ShwinMan	15	4	19		t5_2sdsw	True
1362364660.0	19m3nm	Dos anyone know what happened to it?	Finndogs	15	5	13	Does anyone know what happened to Hammond's cane in the first Jurassic Park movie after production. Im wondering because if there was one ting from that movie I'd want to own it is that cane	t5_2sdsw	True
1357768890.0	169vff	Obama Vs. Dinosaurs...the game!	Alexbell89	15	4	4		t5_2sdsw	False
1355366866.0	14rhrn	"Jurassic Park Idea for a game Minecraft ""xpost from Minecraft"" I would buy this game just for this."	AnusBlaster	15	7	0		t5_2sdsw	False
1352249402.0	12rhef	Does anyone have pics of all the iterations of the fractal from the book?	2-PAM-chloride	11	0	5	I am debating getting a tattoo of one of the fractal iterations that are interspersed throughout the JP book. I loaned my only copy out and I was wondering if anybody has pics of the whole series of 7, I only have the [first](http://imgur.com/Ghgj3) and [second](http://imgur.com/ywkfD).	t5_2sdsw	True
1350878101.0	11vo0f	This guy had an awesome jeep [x-post from r/jeep]	hyena419	10	0	0		t5_2sdsw	False
1346223797.0	z0c6e	Ray Arnold's arm and leg unboxing. Really.	jarxg	10	2	0		t5_2sdsw	False
1344716678.0	y28ab	How Quagmire dies in Famiky Guy	hyena419	21	9	2		t5_2sdsw	False
1329780795.0	pyhma	One of the best guitar cover of the Jurassic Park helicopter landing theme I have heard	oldmonkmgm	12	2	2		t5_2sdsw	False
1321944969.0	ml7gn	Landmark Theaters to show Jurassic Park in Denver and Washington, DC in the next two weeks.	zoidfarb	11	1	7	For any fans who wish they had seen it in theaters, Landmark Theaters is showing Jurassic Park in theaters Friday &amp; Saturday in Denver and in Washington DC the following weekend. [Source](http://www.landmarktheatres.com/Films/films_frameset.asp?id=43768)	t5_2sdsw	True
1321554867.0	mfxev	Any JP fans headed to Megacon 2012 in Orlando, FL?	FlawlessCowboy	11	0	17	"""Ay, ay, ay why didn't I build in Orlando?""

Hello folks,
I was just curious to see if any other JP fans are going to be present at Mega this coming year. The reason I ask is I am organizing a Jurassic Park group  ""so astounding that [it'll] capture the imagination of the entire planet."" See you there I hope."	t5_2sdsw	True
1320259208.0	lxyyj	Super Mario meets Jurassic Park	Geekskull	11	1	0		t5_2sdsw	False
1318381411.0	l8zan	Check out what is coming on Oct 25th!	InHarmsWay	11	1	1		t5_2sdsw	False
1310159988.0	ikdpx	Why is this not a bigger deal.		12	2	5	I'd expect more love for Jurassic Park on reddit.	t5_2sdsw	True
1372263216.0	1h45zt	Jurassic Park 4 will not be as reported. Major revisions have taken place	Alexbell89	10	2	1		t5_2sdsw	False
1371955774.0	1gw145	What are Spinosaurs Made of? An awesome look at the making of a 12-ton, thousand-horsepower dinosaur for Jurassic Park III movie.	antdude	9	1	0		t5_2sdsw	False
1371476050.0	1giiur	Just finished the book but I have some questions.	LifeDisrupter	10	1	4	So I just finished both books and they were fantastic, but why couldn't Spielberg make the movie after the lost world book? I mean the general concept is there with the trailers and what not, but why'd he change it so much? Why not just follow the book it would have been such a better movie, what do you guys think? What's your favorite part from the second book?	t5_2sdsw	True
1369017390.0	1eo5by	Source says he has an early version of JP4 script + theres no T rex		14	3	21	"I don't know how reliable he is but I figured I'd post it.

https://twitter.com/CocchiaroAngelo/status/336274099317915649

https://twitter.com/CocchiaroAngelo"	t5_2sdsw	True
1367655397.0	1do4se	Idea for the prefect Jurassic Park game. A mix of Pokemon Snap, Oregon Trail, and Far Cry 3.		9	0	8	"Takes place in the timeline of the second movie.

You play as Jeff Goldblum (not essential, but it *is* Jeff Goldblum).

You choose what equipment and how much you start off with (the garage scene in the beginning of the film). 

You have a camera as your 'main' bit of equipment. 

Main mission is the story of the movie (with added video game scenes).

Free roam is optional, you always carry your camera (and if you want, your weapons) to document the dinosaurs. You get money for the pictures you send to Hammond (this involves recharging camera at base camp, shooting photos of dinosaurs [closer the better, carnivores worth more than herbivores, alive worth more than dead etc], then going back to base to send the photos off) and this money is used to get air supplies of weapons (possibly food [you can scavenge for food as well, it's  hard to collect enough]). Alternatively, you can steal from the 'bad guys' from the movie (so sneak/storm their camp(s) and steal). 

Up to 4 players. If not multiplayer, you can tell NPCs to go off and collect photos, scavenge etc, if you dont have enough food/water for them, they can die.  

I'm not planning to make this because I dont have the skills/time/money, just a thought I had seeing as the games available aren't *that* great. I guess it could be a Far Cry 3 mod. What do you think? 

EDIT: ~~Prefect~~ --&gt; **Perfect**"	t5_2sdsw	True
1367274316.0	1ddaje	Jurassic Park Reportedly has their Production Designer	Alexbell89	9	0	0		t5_2sdsw	False
1366985079.0	1d5jn2	I want the computer perimeter failure alarm as a ringtone	ageowns	11	1	9	Does this already exist? I thought I'd ask before I go to town trying to make it myself.	t5_2sdsw	True
1364998184.0	1bl5vd	Jurassic Park Pop-Up Trailer	antdude	10	1	0		t5_2sdsw	False
1362864948.0	19zn47	Still trying to cover the entire JP soundtrack on piano. Here's the next one! (Remembering Petticoat Lane)	Microrator	10	1	0		t5_2sdsw	False
1359160633.0	17afbx	Best Amazon Review Ever! (Scroll to First Review)	SnakeDanger	11	4	1		t5_2sdsw	False
1354774614.0	14dduz	Looking For A Good Cryocan Replica	tjjnic	14	4	3	I'm looking for a decent Embryo Cryocan replica for sale somewhere. If you know of any that are on the market, post a link, i'd appreciate it.	t5_2sdsw	True
1346380211.0	z445h	r/jurassicpark, prove to my fiancé reddit knows all....	bkiefz	11	0	5	My fiancé is obsessed with jurassic park, it is his favorite everything. We frequent islands of adventure/universal studios in Orlando Florida and while walking through the jurassic park area the main theme song is played but in a steel drum version in the background. He claims nobody can or will ever locate  this version of the song for him, when I suggested reddit....he doubted us. Please help me shove this in his face/make his day :)	t5_2sdsw	True
1346125637.0	yxz9h	"What are your ideas for Jurassic Park 4? Apparently it's going to ""reinvent the franchise,"" so go wild before it's released."	gooberoo	10	1	15	"My idea: there's sort of an underground sport where people go to the ruins of Jurassic Park to hunt dinosaurs. That's the premise, but obviously when our hero's ""hunting party"" goes to the island they have a bit of trouble getting off. And no freakin' kids, just a group of maybe 6-10 awesome characters doing their thing, and only maybe 3-5 actually get off the island.

One of the characters would be an age-old bad ass who dreamed of hunting and killing the T Rex. However when rumours spread that the T Rex was killed by a larger dinosaur, he sets his sights on that one for revenge. This also serves as a bit of a fan service for when he finds and kills the Spinosaurus.
"	t5_2sdsw	True
1345494678.0	yjid6	Ahh... The majestic melodica.	oneyeartrip	13	4	2		t5_2sdsw	False
1344893467.0	y5zj6	Recommended JPOG mods? 	AlphaPromethean	9	0	3	"I already have the film canon mod, (I love it,but I had to change the starting money though,64 million is a bit much) and would like some recommendations for some good mods.


Help would be appreciated. "	t5_2sdsw	True
1328398959.0	pb6zl	I'm off to see JP at the biggest theater in my city!	JaggerSavage	11	1	1		t5_2sdsw	False
1324598002.0	nn9dv	Jurassic Park: Origins- Concept Art JP1 Jeep	hawkeyehandgrenade	9	1	1		t5_2sdsw	False
1322194187.0	mojlw	The Lost World JP Playstation Game. Has anyone else played it?	Dracovitch	10	0	15	"It was the first game I ever played for the original Playstation. You got to play as a variety of dinosaurs and characters. It's still (in my opinion) one of the best games ever. It was a sad day when I lsot that game. I'd love to find a copy... 

Anyhow, for those that have never played, feel free to ask me all about it, I can give you a pretty good description of almost everything in the game."	t5_2sdsw	True
1319793529.0	ls194	Sprucing up r/JurassicPark	EmperorYork	9	2	24	As I write this I never expected 216 members to find their way here, which I find great and welcome you all. Now I would like to improve the page a little but my editing skills are non-existent. So, I am willing to hand out a moderator/admin role(s) to people who can help improve the page with custom logo or add flair ideas, anything to get this page going. All ideas welcome. 	t5_2sdsw	True
1368037583.0	1dy2z9	Official statement from Universal on Jurassic Park IV	iamalexk	10	2	3		t5_2sdsw	False
1366005054.0	1cdhii	"I call it ""Defending the Kill"""	Xephyron	12	4	0		t5_2sdsw	False
1365475965.0	1byqxf	2 of my Jurassic Park pins	BlazingCondor	9	2	2		t5_2sdsw	False
1364857083.0	1bgv5l	My kids are growing!!!!	lXxSpikexXl	12	2	2		t5_2sdsw	False
1364295681.0	1b19sz	Recently, we made a video review for The Lost World, I'd really appreciate you taking a look!	165309	13	6	18		t5_2sdsw	False
1363052944.0	1a4dap	When I die. (Age 4)	cobra9613	11	4	3	When I was around four I would tell my grandma every day that when I die I want to be buried with all my JP toys especially my T-Rex! I'm now 17. If I could hug my 4 y/o self I would hug the shit outta myself!	t5_2sdsw	True
1360368978.0	185xh4	Awesome Jeff Goldblum is Awesome	ColourCrisis	10	1	4		t5_2sdsw	False
1359432623.0	17h698	I have a plot hole for the second and third movies. Please tell me im not the only one who has thought of this.	Coldbaconannihilator	14	6	25	So if they went to Isla Sorna in the third movie and ran into the spinosaurus, Why didn't they run into it in The Lost World? 	t5_2sdsw	True
1353453313.0	13jacv	Robocop: Operation Jurassic Park	arwilliamswriter	11	4	0		t5_2sdsw	False
1334819279.0	shi5p	lucky pack. still use it till this day.	nicksnothome	9	1	3		t5_2sdsw	False
1334204674.0	s5o3s	Classic Jurassic by Zen (x-post r/HipHopHeads)	sabu632	11	3	3		t5_2sdsw	False
1327619320.0	oya3r	Jurassic Park Theme remixed by Swizz Beats	Puddindoobop	9	1	0		t5_2sdsw	False
1327507107.0	ow5kz	"""I want tasers on full charge!"""	FlawlessCowboy	10	1	3		t5_2sdsw	False
1326660624.0	oic43	The 5 issue JP: Dangerous Games comic series just wrapped up.  Did anyone read it?	halfmast	10	1	2		t5_2sdsw	True
1318477923.0	lafcu	Brite Futures: Dark Past Ep1	Grimpoke	9	0	1		t5_2sdsw	False
1376004896.0	1jzp0u	Could anyone tell me more about this Jurassic Park banner? Can't seem to find it anywhere online	smelly_socks	9	2	1		t5_2sdsw	False
1375337220.0	1jh7k1	Question about the ultimate trilogy gift set.	treeogre66	9	0	6	Does anyone know where I can buy the statue that came with it?	t5_2sdsw	True
1373673703.0	1i6tom	Help locating Nedry's shirt	brainflatus	9	2	2	Hello folks! I have no idea where the best place to ask this is, so I am hoping that maybe this is a good place to start my search. I am trying desperately to locate a Hawaiian shirt just like the one Dennis Nedry wears in the original Jurassic Park movie. Do any of you have any idea where I might locate one?	t5_2sdsw	True
1370612498.0	1fuzmb	Informal poll for JP4 - feathers or no?	Mister_DK	8	0	18	"The original Jurassic Park had a huge impact on the public's perception of dinosaurs.  Spielberg made a point to have them behave like animals, rather than acting like usual movie monsters.  And a big part of that was trying to incorporate things like being warm blooded, being related to birds, not dragging their tails, etc.  Now since the original movie came out, scientists have learned that many dinosaurs, particularly the theropods that ""star"" in the films had feathers.  The studio has said that they won't be having feathered dinosaurs in the next one (I suspect because animating feathers realistically would be super expensive).  Do you think they should?  Would you rather have a more educational imagining dinosaurs, or a more entertaining imagining of them?"	t5_2sdsw	True
1370604615.0	1futer	3D Blu-Ray vs Original Blu-Ray Release	swallowmycockuccino	7	0	9	Does anyone know if the 3D Blu-Ray cut is a little different? For some reason when I saw it in the cinema it looked different than the original in some parts. Maybe it was just seeing it in the cinemas for the first time. Was there any extra scenes added? There was definitely new music added, i thought.	t5_2sdsw	True
1367481164.0	1djg5q	Clever girl...	modestaz	11	2	1		t5_2sdsw	False
1367125090.0	1d9adt	Question about JP 3D movie	Not_Bluffing	11	3	4	I am in New Zealand and JP 3D hasn't been released here yet. My problem is I am going to America soon and wont have time to see it before I go. My question is does anyone know how long it will be in the theatres for in America? 	t5_2sdsw	True
1366066677.0	1cf6zv	(r/gaming XPOST) Pandering to the community...	Vandelay797	9	1	0		t5_2sdsw	False
1365725057.0	1c67c1	For My Cake Day Post, I Present The 30-Second Bunnies' Parody of Jurassic Park, All Done by Bunnies, In 30 Seconds	brittney8282	12	5	0		t5_2sdsw	False
1365454180.0	1bxx24	Creating The Raptor Suit From Jurassic Park	adrianlinks	11	4	0		t5_2sdsw	False
1365147564.0	1bpyzj	Gallery of 1000+ images from /r/JurassicPark (add to the collection)	pmlinstrot	11	3	0		t5_2sdsw	False
1364960113.0	1bkd49	JP2: The Lost World Stupid Question	viper7128	7	2	5	"Hello guys,

This is my first Reddit post, I've been resisting making an account for over a year now but today I finally gave in.

Anyway I was watching JP: THW last night and something about it has been bothering me. 

When Ian is talking to John in the beginning of the movie, John explains that Isla Sorna is where they were supposed to breed the dinosaurs before bringing them to Isla Nublar. 

However, in the first movie it shows the whole raptor birth scene (and eggs) and it gave me the impression that the dinosaurs breed, born, and matured all on Nublar. 

I don't know if this question even makes sense (it's late lol), but does anyone have an explanation?

btw: I have yet to read the books."	t5_2sdsw	True
1363136919.0	1a6pjg	Just saw a screening of JP 3D - experience spoilers within	Shark_Dog1	8	1	5	"Just saw a screening of Jurassic Park 3D on an Imax screen.

As a JP fan, I had been excited to see JP3D for over a year. I made sure not to watch any JP film within the last few months to make the experience as seemingly new as possible.

My thoughts (experience spoilers below)

It was a great experience. I hadn't seen JP in a while (and didn't remember the cinema experience from back in the 90's), and it really is a movie made for the big screen. 

[Now, the 3-D wasn't great. As I have found with most movies where 3-D was added in post-production, the 3-D really doesn't shine or add anything demonstrable to the experience. In fact, IMO, other than in closeup shots, such as interior environments, the cars, etc, the 3-D seems unnecessary- and seems to hurt the eyes after a while. Those of you expecting to jump out of your seats when the T-rex chases the Jeep will be disappointed. However, the sound was AWESOME. I shook in my seat when T-Rex turns and roars towards Grant  as he sparks the flare. The special effects hold up well. Other than the Brachiosaurus sneeze (which never looked good IMO) the gallies and a few seconds of the raptors in the kitchen, I'm still amazed by the work of Spielberg, Amblin and co. from so many years ago. Don't go because it's in 3-D. Go because](/spoiler) it's one of the greatest movie experiences of all time the way it was meant to be seen- on a giant screen. Please, chance it"	t5_2sdsw	True
1362204767.0	19if3j	I can't take credit it for this, but it's so true. . . 	thekutterback	10	3	3		t5_2sdsw	False
1361368892.0	18vw41	JPOG Re Release?	Baus7171	12	3	7	"Would anyone want JPOG to be re released? I would, but it seems that both the developer and publisher companies have gone out of business. Or how about Mobile JPOG?
"	t5_2sdsw	True
1360035511.0	17wu9x	Continuity Error Between 2nd &amp; 3rd Movie	weaselman1080	12	6	12	So at the end of the 2nd movie all the pterodactyls were roaming around freely but in the 3rd movie they were locked up in the birdcage? Anyone care to explain?	t5_2sdsw	True
1359055447.0	177f4r	I... I dont even... wat	TruffleShuffle694	12	4	3		t5_2sdsw	False
1357443019.0	161j0w	My Jurassic Park Collection	Gojirex	14	6	9	"https://www.youtube.com/watch?v=qdDlc4rob-s

This is my entire Collection of toys, so for Just the Jurassic Park stuff:
0:00-1:30, 4:15-5:40

I've been collecting since the first movie came out, so enjoy!"	t5_2sdsw	True
1356295029.0	15c8jz	Need help. Jurassic Park Builder issue	InHarmsWay	8	1	6	"I have been trying to get it running on my Ipad after being away for a bit, but when it gets to the ""connecting to the game server"" it comes up with an error pop-up box that says ""failed to connect to server"". How do I fix this?"	t5_2sdsw	True
1354753281.0	14cqzu	Have a spare copy on VHS? This guy wants it	M3wThr33	12	3	4		t5_2sdsw	False
1350486984.0	11msjt	Alan Grant Halloween Costume?	cmillsrun	7	1	3	"Does anyone know of the hat Alan Grant uses?  I've googled it with these results and would rather not have to spend $100 if I don't have to.

http://www.jplegacy.org/board/showthread.php?t=18876

Thanks!"	t5_2sdsw	True
1347546884.0	ztncg	This brought a tear to my eyes. Memories of watching Jurassic Park for the first time and general nostalgia	oldmonkmgm	11	5	3		t5_2sdsw	False
1347470831.0	zrwu0	I need a dino themed gift idea for a bday present, anyone have any interesting suggestions?	FickleFred	7	0	2		t5_2sdsw	False
1346989327.0	zhlrx	Isla Sorna/InGen	KongzillaRex	7	2	4	"So i understand that TLW and JP/// take place on Isla Sorna, yet i have some questions about the island....

1. In TLW its open and less dense than in JP///, ive heard that in TLW there was a drought but have also heard that its a seperate less dense part of the island.

2. How come the teams in TLW diddnt encounter the Spino? Different part of the island again maybe?

3. TLW raptors had no feathers but in JP/// they got em. Ive heard that the TLW ones are all female. But ive also heard that there different sub-species.

4. In TLW there are ""free"" Pteranodons yet in JP/// there all caged up. Sub-species again?

Now aside from the questions about the island itself how bout InGen?

1. In JP/// they hint that InGen is doing things that are off the list. Grant says ""I wonder what else they were up to."" Is InGen going to take a turn to be like Weyland-Yutani from Aliens? Or was it just a mis-classification?
"	t5_2sdsw	True
1346093443.0	yx0fo	Books like Jurassic Park?	obviously_oblivious	7	1	17	"I posted this on /r/Dinosaurs but to no avail.

So does Michael Crichton have the market cornered on dinosaur nonfiction? I've read Jurassic Park and The Lost World a few times and I love them, but I'd really like to read something else dino themed. The only other book I'm aware of is Carnosaur... but... well if it's anything like the movie

Any suggestions for me?"	t5_2sdsw	True
1343142882.0	x2qku	My dream synopsis for Jurassic Park 4!	doctorbooshka	9	2	8	Let us hope they get Sam Neil to at least have a cameo. I think he should become more like a John Hammond character. Let it be set in the future and they can make him look like an old man running a a company which protects people from Dinosaurs in South America. In the time between movies 3 and 4 the dinosaurs finally breach land in the northern part of South America and in Central America. In a panic America places a 100 ft electric which was built by Ingen. After the company survived a near Enron fallout they invested their last stocks in the electric fence projects which were used on Isla Sorna for the park. The government bailed them out in order to contract them out to he American-Mexican border. Now Ingen had become in bed with the US govt. and worked there way back into the genetic research side of things. In an effort to recover their research from the islands affected by the dinosaur insurgence they launched a military operation to transport as many dinosaurs to a research base in Texas. Before the ships could get back a militant animal right activists set charges in the boats in order to sink right of the coast setting the dinosaurs free. This was the biggest messup in history. Now dinosaurs run rampant throughout South America and began breeding rapidly. Soon 15 species of Dinosaurs were killing and destroying villages and soon towns. Sam Neil has sent his team on a mission to Venezuela to find a scientist who has created a virus that will only infect the dino's. Now they have to fight their way through militias and dinosaurs to make it from the border of mexico all the way to Venezuela. This would be my dream movie! 	t5_2sdsw	True
1343118728.0	x2c92	See you in 2014! 	Alexbell89	8	0	1		t5_2sdsw	False
1342568209.0	wq9z4	I just started playing the game. Come on TellTale	BigMax55	8	0	0		t5_2sdsw	False
1340678363.0	vlws7	Who here frequents the Dan's JP3 Page Message Board?	Anisette	10	3	6	"http://www.dansjp3page.com/board2/index.asp

I've been visiting this board since 2000. Anyone else?"	t5_2sdsw	True
1338522821.0	uf38v	"""Help settle an argument about Jurassic Park"" (x-post from r/movies)"	Caf-fiend	11	3	2		t5_2sdsw	False
1337545745.0	twesk	I put a video together from Dinosaur World. Enjoy!	tabbeee	7	0	3		t5_2sdsw	False
1333777374.0	rxj5y	Malcolm Rex (Xpost from /r/funny)	garrettj	11	4	1		t5_2sdsw	False
1331185571.0	qmyw9	Favorite JP Dino?		10	2	28	What was your favorite dino in the JP books/movies? For me,I'd have to say it's a tie between Parasaurolophus and the Spinosaurus in JP3.	t5_2sdsw	True
1325986928.0	o7em5	Did anyone else here use ingennet? (memories)	damianlz	9	0	5	"Before there were movie sites, when anyone who liked something nerdy had to deal with odd geocities and yahoo pages made from fluro HTML pages there was a single golden site called ingennet.com (or was it ingen.net) that was the single greatest source of Jurassic park.. anything.

there isnt really much more to this page, I was just curious if anyone else here misses the site?"	t5_2sdsw	True
1324106255.0	ng5br	how many Spielberg Faces are from JP?	drianmalcolm1	7	1	0		t5_2sdsw	False
1320855825.0	m67pc	For any of you in Austin, TX...	MadBeard	8	1	0		t5_2sdsw	False
1320093838.0	lvlge	Island Tour of Isla Nublar	finalxcution	7	1	3		t5_2sdsw	False
1314343562.0	juwxa	The first movie was great	Fetal	12	5	2	The other ones not so much	t5_2sdsw	True
1314061445.0	jr6eb	Jurassic Park today and JP3 tomorrow on AMC. AWWWWWWWWWWWWWW YEEEEEEEAAAAAAAAAAAA	megustcizer	11	4	3		t5_2sdsw	False
1376767187.0	1kkbaq	The Best Game. Ever. In the History of Games.	Tr1xCadeyrn	6	0	4		t5_2sdsw	False
1376065704.0	1k181d	The end of this Shark Week commercial reminded me of a certain scene...	Darth_Ballard	7	1	3		t5_2sdsw	False
