created_utc	id	title	author	ups	downs	num_comments	selftext	subreddit_id	is_self
1320684794.0	m3ngy	Jurassic Park foreshadowing, I just realized 18 years later.	Microphone_Assassin	542	133	24		t5_2sdsw	False
1360094138.0	17y87y	Best tweet to come out of the Super Bowl	surfer451	267	19	6		t5_2sdsw	False
1366001940.0	1cdep5	Two tickets / twenty years	quitepossiblylying	210	21	18		t5_2sdsw	False
1360785818.0	18gpuz	My new JP mug	reptomin	199	17	18		t5_2sdsw	False
1357489166.0	162c23	Possible foreshadowing at the beginning of Jurassic Park	RobBelmonte	237	59	31		t5_2sdsw	False
1346188377.0	yzdvp	My college graduation cap.	JurassicPFan	190	14	23		t5_2sdsw	False
1359673655.0	17nqie	Goodnight, sweet prince. You're in God's VCR now.	obviously_oblivious	193	14	25		t5_2sdsw	False
1357945551.0	16en5g	Jurassic Park 4 in theaters June 13 2014!	whynotjoin	190	15	54		t5_2sdsw	False
1360860744.0	18itcc	This was my brother-in-law's Halloween costume this past year.	BackOfTheHearse	180	14	7		t5_2sdsw	False
1366138148.0	1ch7pu	Definitely a candidate for best Dad.	Stumpalupagus	181	23	12		t5_2sdsw	False
1359734407.0	17p65a	if i spot this game at an arcade, i HAVE to play it. 	brightshinies	178	16	15		t5_2sdsw	False
1367429801.0	1dhrmc	From r/funny	Phoenix_Ikki	169	20	4		t5_2sdsw	False
1371948521.0	1gvuog	This is my new favorite picture of Sam Neill.	arthurdentxxxxii	171	21	6		t5_2sdsw	False
1366938337.0	1d4gb3	Makes sense...	Prodigious-Beast	155	5	8		t5_2sdsw	False
1359868368.0	17sl25	My friend's Jurassic Park Jeep project	Zarathustra2003	161	12	13		t5_2sdsw	False
1365351684.0	1buw9i	Best Ian Malcolm fan art out there	ZakieChan	165	15	13		t5_2sdsw	False
1365917242.0	1cb9ie	This made me rethink my stance on raptors		160	10	24		t5_2sdsw	False
1347313905.0	zoakc	Check out my first tattoo!	shellville	175	31	23		t5_2sdsw	False
1358954229.0	174i2g	Clever girl.	velocicopter	154	10	7		t5_2sdsw	False
1366982503.0	1d5gvu	Giraffic Park (Possibly a repost)	XenomorphSB	168	26	9		t5_2sdsw	False
1362691220.0	19vamx	My Jurassic Park Collection	casey6027	145	8	35		t5_2sdsw	False
1362199156.0	19ia8s	Anyone else getting excited for Jurassic Park 3D?	jporigins	147	12	23		t5_2sdsw	False
1350503005.0	11na59	Thought you guys might like our costumes	dilpickle218	143	9	8		t5_2sdsw	False
1365963276.0	1cc4p0	Thought you guys would like my new shirt	arthurdentxxxxii	142	7	8		t5_2sdsw	False
1359736094.0	17p80e	Why I love /r/jurassicpark	arthurdentxxxxii	141	14	2		t5_2sdsw	False
1341131365.0	vvg00	Jurassic Park Wins	lefayad1991	139	10	6		t5_2sdsw	False
1362000919.0	19cpds	See? Nobody cares.	nutsocharles	151	27	7		t5_2sdsw	False
1365793289.0	1c828o	One of my new favorite GIFs	Zmodem	131	10	10		t5_2sdsw	False
1376407210.0	1ka5qh	The automatic door at my local grocery store does a superb imitation of T-rex from the original film. I heard it this morning and decided to record it.	tramplamps	134	19	11		t5_2sdsw	False
1368861786.0	1ekfot	Different angle of Muldoon's death	RobBelmonte	127	10	40		t5_2sdsw	False
1368217645.0	1e38zq	I see your Jurassic Park Car, And I Raise you My Jurassic Park Car! (X-post /r/pics)	IMP3L	136	16	20		t5_2sdsw	False
1365723093.0	1c64r6	Scumbag John Hammond	herrijt	143	26	28		t5_2sdsw	False
1352692866.0	131no9	Someone in my town drives this around.  I'm insanely jealous.	cptcliche	119	0	13		t5_2sdsw	False
1366563173.0	1ct1tv	I fucking love cars!	TyrannosaurusReddit	118	5	3		t5_2sdsw	False
1374865019.0	1j445u	Hey guys! What do you think about my newest ink?	mlechuga	137	27	17		t5_2sdsw	False
1374075235.0	1iholx	Jurassic Park is frightening in the dark!	Stumpalupagus	128	15	17		t5_2sdsw	False
1369870055.0	1fav70	T-Rex Crashes Wedding	Burrito_Fiction	138	27	7		t5_2sdsw	False
1348315043.0	10alt6	Dennis Nedry makes an appearance on BBC news!	macrocephale	125	13	14		t5_2sdsw	False
1375579981.0	1jnoa5	My iPod bit the dust 20 minutes into a 12 car ride. Stopped at the next book store to make everything all better.	CoachChris	125	18	8		t5_2sdsw	False
1372034414.0	1gxstq	Found this gem at the movie theatre in my town.	aslejs11711	129	17	9		t5_2sdsw	False
1365493630.0	1bz7iw	"Every time ""reddit is under heavy load"" I think this."	precisi0n86	119	6	6		t5_2sdsw	False
1373033732.0	1howb4	My 18th Birthday Cake!	lieutenant_lick_me	121	13	8		t5_2sdsw	False
1368817124.0	1ej89q	If Ian Malcom had become an R&amp;B Star this is what his album cover would look like	TeddyGrahams_Pro	125	12	4		t5_2sdsw	False
1370557096.0	1ftm0h	I didn't know Nicholas Cage was in this movie...	slander420	129	23	5		t5_2sdsw	False
1367419082.0	1dhe1i	Found this piece of my childhood at my grandparents house last week!	forgetmynamex07	116	9	10		t5_2sdsw	False
1362592966.0	19scta	Found YouTube comment gold on the Jurrasic Park theme song.	Leonardus97	125	19	0		t5_2sdsw	False
1368145547.0	1e1d8h	XPost from r/Cosplay Myself as Robert Muldoon	FlawlessCowboy	115	7	10		t5_2sdsw	False
1365211407.0	1brta2	Found this on Amazon, immediately went to reviews. Wasn't disappointed	icemanx322	121	17	2		t5_2sdsw	False
1346789315.0	zcpf0	Where's the goat?!	Derporelli	114	9	5		t5_2sdsw	False
1375813696.0	1jtsl3	Apparently Mr. Hammond and I use the same bank.	Thinandbony	115	12	7		t5_2sdsw	False
1332334797.0	r6o5c	Cosplay Nailing it (xpost from /r/pics)	EmperorYork	106	6	5		t5_2sdsw	False
1373638700.0	1i5jj2	cruising around and saw this, this morning, thought it was worth sharing	MrVStheWorld	106	8	8		t5_2sdsw	False
1366866646.0	1d2d2n	A friend of mine got new vanity plates. (X-post from r/funny)	thesared	111	8	3		t5_2sdsw	False
1354846540.0	14f594	Posted on /r/wtf I don't really see the problem with it	EmperorYork	107	11	11		t5_2sdsw	False
1375799317.0	1jt9en	Welcome....to Jurassic Park	patdennis1	112	17	4		t5_2sdsw	False
1359839110.0	17rrev	Best thing I've bought in a long long time.	you_gotta_go	111	10	11		t5_2sdsw	False
1330301833.0	q7cg4	Just discovered this subreddit, here is my offering &lt;3	meggosaurusx	103	2	5		t5_2sdsw	False
1367181526.0	1daifh	This is just sad	tzippy84	99	3	8		t5_2sdsw	False
1371333420.0	1gf63f	Guess What I Found at the Dump On Friday!	Bear10	106	9	5		t5_2sdsw	False
1357101245.0	15t44y	New Jurassic Park game!	Alexbell89	98	6	25		t5_2sdsw	False
1365292969.0	1btpbj	After more than a decade of searching, my cousin and I have finally acquired this.	lordlegion	104	10	9		t5_2sdsw	False
1362867661.0	19zpyc	Coolest Jeep currently sitting on my block 	floydian239	105	11	11		t5_2sdsw	False
1352318916.0	12tcf5	Jurassic Park 3D Poster.	Suchomimus	101	6	18		t5_2sdsw	False
1351157880.0	1223zf	Thought /r/JurassicPark would get a kick out of this.	Icedhope	106	13	9		t5_2sdsw	False
1365224268.0	1bs5xn	We went to Jurassic Park 3D and did the best we could :D	longlostlotrelf	108	13	22		t5_2sdsw	False
1365046780.0	1bn03h	Jurassic Park, then and now [x-post from r/movies]	brittney8282	99	7	19		t5_2sdsw	False
1360241794.0	18290y	Thought you guys would appreciate this piece I had done a couple of years ago		100	6	6		t5_2sdsw	False
1364589430.0	1b9hwu	Check out this early concept art for the first Jurassic Park movie! Reminds me more of the book.	Movieguru92	100	11	11		t5_2sdsw	False
1366304620.0	1cm6n0	Went home to visit family, found this giant button in a box of my old stuff	quebueno	97	9	10		t5_2sdsw	False
1348418039.0	10ch0s	As a teacher, I often weave indirect pop culture references into my lessons to see how closely my students are paying attention. Some days are more obvious than others... [x-post from r/movies]	SideburnedBard	91	4	6		t5_2sdsw	False
1348086419.0	105k8r	Must go faster...	coldonmartin	99	9	4		t5_2sdsw	False
1371741257.0	1gqbm4	Man crush... level 100	ChipHazard1	101	13	7		t5_2sdsw	False
1371231113.0	1gcm2p	grow up they said...you cant play with your toys forever they said...	bobaroski2121	94	5	8		t5_2sdsw	False
1369969479.0	1fdr59	I was told to show you guys my first tattoo done by Jimmy Ditto in Fort Wayne, IN. (x-post from tattoos)	Phill_osophical	101	10	3		t5_2sdsw	False
1364464670.0	1b641z	A worthy cause	AFCartoonist	102	13	7		t5_2sdsw	False
1353110339.0	13brua	The interactive cd-rom title screen. Couldn't find a highres so I made my own.	pilotfish	94	4	8		t5_2sdsw	False
1368800192.0	1einu1	Dr. Grant, my dear Dr. Sattler, welcome to Jurassic Park....	ChipHazard1	98	11	2		t5_2sdsw	False
1368731782.0	1egvg8	My friend just Jurassic Park(ed) it on Far Cry 3	n7graduate	99	9	11		t5_2sdsw	False
1365450125.0	1bxrcs	Birthday trip to see Jurassic Park 3D= success!!	mermaidmar	107	17	5		t5_2sdsw	False
1361269966.0	18t8vg	I make custom xbox controllers. Any love for this one?	ThePearman	108	22	27		t5_2sdsw	False
1357957106.0	16ezn6	Everyone in This Subreddit Right Now		94	7	7		t5_2sdsw	False
1355261786.0	14opvs	Most accurate novel-canon map I've ever seen	RobBelmonte	96	9	10		t5_2sdsw	False
1328648685.0	pf6po	Nedry's screen lock girl 	hawkeyehandgrenade	93	3	7		t5_2sdsw	False
1371830821.0	1gsudf	Jurassic Park inspired art.	arthurdentxxxxii	98	12	1		t5_2sdsw	False
1371143000.0	1ga13y	It's so vicious, RUN! [FIXED] (x-posted from /r/funny)	JimmyLegs50	99	10	4		t5_2sdsw	False
1363231706.0	1a9hhj	Who's up for some jigglers? Fresh from 1994...	genderfucker	100	16	5		t5_2sdsw	False
1356718316.0	15kyvj	Look What Was For Sale a Mile From my Grandma's House!		94	6	21		t5_2sdsw	False
1366841962.0	1d1h91	Saw this on the road today.	Ryan137	88	8	3		t5_2sdsw	False
1365182038.0	1bqsvk	Got my JP3D tickets... where am I keeping them until tonight you ask?	tenniswritercoug	95	11	2		t5_2sdsw	False
1358645102.0	16wmno	Buttdialed		92	11	2		t5_2sdsw	False
1331620361.0	qu7ts	so John Hammond is walking through the bookstore looking for investment ideas when...	BayHarbourButcher	85	4	0		t5_2sdsw	False
1373608500.0	1i4xzq	TIL the circuit breaker from Jurassic Park is a Cutler Hammer Westinghouse model SPB-100. You can get one for a mere ~$3000.	paleeoguy4	94	10	19		t5_2sdsw	False
1372458408.0	1ha00y	I was looking for one of my old water bottles when I found this little gem from my childhood....	KongzillaRex	98	18	5		t5_2sdsw	False
1370127170.0	1fhlcm	This is what I spent all my allowance on the summer of 1997 (Lost World Topps Collection)	crunkfresh	86	6	5		t5_2sdsw	False
1355044928.0	14jj7e	I saw this 11 years ago at the Hays Antique Truck Museum in Woodland, CA I am wondering where it went.	mnblly	88	6	11		t5_2sdsw	False
1376771051.0	1kkffy	Dodson, we've got Dodson here.	Zackery_Attackery	99	17	8		t5_2sdsw	False
1323176802.0	n2ghq	We all do this, there is no shame. 	MattyHchrist	87	7	8		t5_2sdsw	False
1367522716.0	1dkily	Looks like it will be set on Nublar	casey6027	89	5	23		t5_2sdsw	False
1374235092.0	1imjsg	A Jurassic Park vintage book cover I made a few years back. Source in comments!	trevordunt39	82	5	4		t5_2sdsw	False
1367040021.0	1d7awa	Found this at my local thrift shop for 2 bucks. Can't wait to read it!	TruffleShuffle694	95	14	18		t5_2sdsw	False
1364822674.0	1bf52w	Did you feel that?	lifeuhfindsaway	89	11	15		t5_2sdsw	False
1360706127.0	18ei32	My childhood bed, painted by my father circa 1994	BrianTheLady	89	10	1		t5_2sdsw	False
1346518649.0	z6un7	It may not be a rug, but I think it ties the room together quite nice	EmperorYork	86	6	8		t5_2sdsw	False
1341252259.0	vxn1n	I made a mini version of the Jurassic Park gates with paper and glue.	licehead	84	4	8		t5_2sdsw	False
1370556259.0	1ftkvj	"""We spared no expense"" [x-post from r/funny]"	hefranco7	94	17	9		t5_2sdsw	False
1354305655.0	142fhd	Dennis Nedry	iato19459	82	7	10		t5_2sdsw	False
1323232410.0	n3i4z	They should remake Jurassic Park with updated versions of Velociraptors that account for new improved knowledge about them.	feenicks	88	7	7		t5_2sdsw	False
1368912345.0	1elhp6	Surprised to see this at my local gas station today. Is this Early Viral Marketing or just some awesome fans?	al3x094	82	6	15		t5_2sdsw	False
1370909428.0	1g30ah	Found my old Topps hologram cards. These used to blow my mind.	Yolocaust_Survivor	82	8	3		t5_2sdsw	False
1363447764.0	1aeu6h	Had this made in Honduras several years ago	AFCartoonist	83	9	2		t5_2sdsw	False
1359135242.0	179jls	You know your way around the kitchen?!?!?	Zmodem	83	6	9		t5_2sdsw	False
1335492196.0	sum6f	"This is what I drive every day to, from, and during 
work."	bearsa113609	83	10	10		t5_2sdsw	False
1349805740.0	117ga2	Apparently, this was almost Jurassic Park 4	EmperorYork	83	5	31		t5_2sdsw	False
1374943005.0	1j601m	Life Found a Way	Nightshade1765	79	10	3		t5_2sdsw	False
1363117902.0	1a6086	Looks like the tour vehicles made an appearance in jp3	kmmgreen5	82	11	18		t5_2sdsw	False
1321077437.0	m9k89	Never thought of it this way, did you?	BrenDerlin	83	11	8		t5_2sdsw	False
1345477348.0	yize4	You had one job!	dilpickle218	78	4	13		t5_2sdsw	False
1328326665.0	pa7mk	The most badass part of JP	megustcizer	75	4	11		t5_2sdsw	False
1323326703.0	n4jpc	That's....that's a dinosaur		78	7	9		t5_2sdsw	False
1323258571.0	n3tp4	The best JP related amazon review (x-post from r/funny)	MattyHchrist	75	2	11		t5_2sdsw	False
1376917695.0	1knwsw	Diorama my son did for school last year.	rtmille	81	8	8		t5_2sdsw	False
1374440598.0	1irpsg	Thought you guys would like the rc I built	rcborg	74	1	8		t5_2sdsw	False
1352464398.0	12ws3k	Charles Freeze! (Xposted oc from r/funny)	DavidRandom	83	10	0		t5_2sdsw	False
1376016115.0	1k02ca	Took the rc jp jeep out today	rcborg	77	7	5		t5_2sdsw	False
1366811120.0	1d0bf4	Jurassic Park 4 to Film in Hawaii in addition to New Orleans	Alexbell89	81	10	17		t5_2sdsw	False
1364862786.0	1bh9bu	Dat Claw	DesolationRow	89	21	2		t5_2sdsw	False
1369678611.0	1f5dlm	Worst Jurassic Park car yet??	sayerofthings	91	21	29		t5_2sdsw	False
1363156188.0	1a7arv	Original Jurassic Park Teaser Trailer from 1992!	Tender_Vittles1988	74	8	5		t5_2sdsw	False
1371586647.0	1glvjo	Jurassic Park 4 Targeted for 2015, to be Shot in 3D	halfmast	79	12	33		t5_2sdsw	False
1374361026.0	1ipxjq	Can't compete with all the JP jeeps and cars on here, but I bought my first car and had to put this on	LaserQuest	75	4	9		t5_2sdsw	False
1366476007.0	1cqxv3	My friends and I did a spot on JP reenactment. We spared no expense.	RedAnarchist	76	8	8		t5_2sdsw	False
1363051892.0	1a4c03	How'd we do? Info in comments	CaptJordi	76	8	14		t5_2sdsw	False
1358350809.0	16osm1	My Jurassic Park ballcap from 1993 - suede brim!	sashafiero	73	3	6		t5_2sdsw	False
1351070283.0	11zy1p	Jurassic advert currently airing in the UK	FullofAwesome	67	0	6		t5_2sdsw	False
1334837284.0	shovk	Found my favourite childhood hat the other day!	ParksVS	68	3	3		t5_2sdsw	False
1333585550.0	rttty	Jurassic Park Map	oneyeartrip	68	1	3		t5_2sdsw	False
1330232662.0	q6d6d	loved this game	ephphatha	75	8	11		t5_2sdsw	False
1368319349.0	1e5pk1	The day at Dinosaur Ridge turned out GREAT!	bearsa113609	69	6	11		t5_2sdsw	False
1361449352.0	18y86q	Legit Jurassic Park Movie Party [x-post from r/movies]	hefranco7	73	4	8		t5_2sdsw	False
1355441074.0	14t8yy	He doesn't roar anymore, but he's still my favorite childhood toy 	minimilker	71	7	15		t5_2sdsw	False
1347800531.0	zywma	T-rex pumpkin I carved in 2009 (x-post from /r/dinosaurs)	sillyokio	71	2	0		t5_2sdsw	False
1324742291.0	np75a	I know what I'm doing this weekend!	MadMageMC	70	2	12		t5_2sdsw	False
1372376107.0	1h7on4	Saw this bad boy cruising around the other day.	Chillinthamost	75	9	7		t5_2sdsw	False
1368261886.0	1e4d3o	Saw this parked at my local gas station.	LifeDisrupter	74	8	3		t5_2sdsw	False
1365360791.0	1bv6te	Couldn't help thinking this during the last scene of the first movie	Kreetan	75	12	6		t5_2sdsw	False
1359060525.0	177lqz	I have been thinking up JP tattoos for years now and I finally might have the balls to get one. What do you think? 	ROTM2011	69	6	31		t5_2sdsw	False
1334541371.0	sborf	Been wearing it all day, nobody has caught the reference. 	jhra	70	5	4		t5_2sdsw	False
1329590274.0	pvgkp	Shits about to go down	sry4partying	69	4	4		t5_2sdsw	False
1376196136.0	1k4nq9	helped cleaning out my Grandma's garage... Score!!!	adz1179	69	8	8		t5_2sdsw	False
1376086377.0	1k1zd6	Cleaning out the basement a little and found one of my favourite childhood toys, it even roars stil!	brittney8282	74	8	7		t5_2sdsw	False
1366233829.0	1ck71e	Come on, Dryosaurus... there's a reason you're extinct	DinoBenn	71	8	23		t5_2sdsw	False
1364996624.0	1bl45m	Honest Trailers - Jurassic Park	antdude	68	2	18		t5_2sdsw	False
1364852827.0	1bgkus	My girlfriend's reaction to my Jurassic Park Builder obsession. I don't think she gets it... Do any other redditors share my obsession?	theacklen	76	12	15		t5_2sdsw	False
1343716267.0	xfr4u	The first NSFW pic I ever took. I've had this guy for over 16 years.	squidofhearts	115	56	31		t5_2sdsw	False
1357848021.0	16byd2	A while back on Etsy, I came across this artist and his JP map/poster. Thought I'd share it here in case you haven't seen it.	lagerithm	64	2	6		t5_2sdsw	False
1356021248.0	1568ys	My JP Toy Collection, some of which I've owned for almost 20 years now!	Nerherfaderp	65	4	14		t5_2sdsw	False
1334075601.0	s2qer	Jurassic Park Prius	jporigins	67	7	4		t5_2sdsw	False
1326766228.0	ok6xy	January 17th, 11:59pm... [x-post from r/pics]	SpikeKintarin	68	2	1		t5_2sdsw	False
1370966340.0	1g4lzd	We decided to celebrate the 20th anniversary of the Jurassic Park release (today). What do you think?	AutoRef	70	8	8		t5_2sdsw	False
1367599589.0	1dmlvf	Driving down the highway and saw this park ranger. (Facebook feed)	TotalAnarchy	63	4	2		t5_2sdsw	False
1365429633.0	1bx13v	Glad to see I'm not the only one who dressed up! Here's my Dr. Grant costume.	Sea-Salt	78	15	3		t5_2sdsw	False
1327732912.0	p0931	Stumbled Across This Wonderful Revelation Today	thespadeinator	68	7	4		t5_2sdsw	False
1326823820.0	ol3z3	I thought you guys might like my jacket :)	unrealtrip	65	4	4		t5_2sdsw	False
1325905015.0	o6af1	Thought you guys might enjoy my wifi name.	BrynHavoc	67	9	4		t5_2sdsw	False
1322756724.0	mw91e	"Found a twitter account by an ""intern"" at Jurassic Park."	Draw_Ring_Pad	65	4	2		t5_2sdsw	False
1368671637.0	1efdgd	Just got this in the mail!	LifeDisrupter	65	5	4		t5_2sdsw	False
1368013267.0	1dxcth	Jurassic Park 4 Put On 'Hold'	IOnEIFalcon	66	7	32		t5_2sdsw	False
1350439790.0	11luju	Found this old guy in the  closet one of my favs	Waasmer	67	7	11		t5_2sdsw	False
1346357077.0	z3fik	YES!!! FUCK YES!!! OMG!!!	hyena419	71	11	9		t5_2sdsw	False
1332790176.0	remk4	Got 4 copies of the novel Jurassic Park for 5 cents each. Got 5 other Crichton books as well. Grand total $0.93	jporigins	64	8	24		t5_2sdsw	False
1332742169.0	rdufc	Painted my nails tonight. (x-post from r/RedditLaqueristas)	squidofhearts	65	3	5		t5_2sdsw	False
1332631812.0	rc00r	Found this at my local subway...	Melcoal	62	2	5		t5_2sdsw	False
1374503165.0	1ita91	Wayne Knight would like to be in JPIV.	velocicopter	61	1	25		t5_2sdsw	False
1372286171.0	1h50za	Cool story about the Lumineer's JP Jeep	tinybucket	64	5	4		t5_2sdsw	False
1330639454.0	qdiu8	My monitoring system at work (WIP)	herpyourderp	60	4	15		t5_2sdsw	False
1326740460.0	ojlwl	Made this shirt for my brother-in-law	TheBrokenNinja	66	9	3		t5_2sdsw	False
1364675437.0	1bbiu2	I like this motion poster	HereToHumilateAFrand	67	13	2		t5_2sdsw	False
1359414284.0	17gi38	If Ingen &amp; Facebook Existed in the 80s... (something I made a while ago)	ColourCrisis	65	11	19		t5_2sdsw	False
1349210700.0	10u3wn	Nedryland. Dennis you sly fox.	therandomizer	61	2	17		t5_2sdsw	False
1339005972.0	uoal5	Easy, Breezy, Beautiful...	MadeOfStarStuff	74	14	4		t5_2sdsw	False
1334792225.0	sgvz2	Velociraptor Awareness Day 	Elzear1	60	2	3		t5_2sdsw	False
1371090517.0	1g8pi3	15 Things Jurassic Park never answered	arthurdentxxxxii	68	14	37		t5_2sdsw	False
1367252742.0	1dcg7e	Jurassic Park was already released in 3D 21 years ago	vinnycthatwhoibe	70	14	4		t5_2sdsw	False
1365625220.0	1c3423	My friend just made this about the kid from JP	thmndr	60	4	12		t5_2sdsw	False
1365556208.0	1c14xn	An Australian billionaire is planning to build 2 Jurassic Park resorts, each featuring 135+ (animatronic) dinosaurs.	furlerer	66	11	22		t5_2sdsw	False
1361390595.0	18wlbk	I shared an xbox project earlier and got a lot of love. Here it is almost finished	ThePearman	69	11	5		t5_2sdsw	False
1358287229.0	16n6fe	Jurassic Park IV: What We Want - IGN	jade-E	57	0	29		t5_2sdsw	False
1348518437.0	10erut	Jurassic Park Blu-Ray concept, lots of other goodies	originaldave77	65	7	15		t5_2sdsw	False
1343845002.0	xinco	Australian Billionaire Wants To Build Jurassic Park-Style Resort with cloned dinosaurs.	jhra	62	9	13		t5_2sdsw	False
1365207983.0	1brpmp	DON'T FUCK THIS UP PHIL. WE'RE COUNTING ON YOU.	the_enemy_is_you	64	5	6		t5_2sdsw	False
1350095448.0	11ecco	Found these 3 years ago in a gas station somewhere in the Nevada desert	Arkomas	60	3	1		t5_2sdsw	False
1347669767.0	zwlpj	I present the label from my first homebrew. It ended up being infected, but I'm way too proud of my name for it. [x-post from /r/homebrewing]	SuperMcRad	60	4	10		t5_2sdsw	False
1331778004.0	qx672	Malcolm (x-post from r/funny)	megustcizer	62	7	10		t5_2sdsw	False
1330554145.0	qbym8	Just one job. (x-post from /r/funny)	BeaumontTaz	69	14	4		t5_2sdsw	False
1327173058.0	oqhf6	Look at all the blood...	hawkeyehandgrenade	57	3	12		t5_2sdsw	False
1376967758.0	1kpkhr	my first JP painting: Oh, Mr. DNA...where did YOU come from?	Leenpants	57	3	5		t5_2sdsw	False
1373981512.0	1ietw4	Poor T Rex (repost from R/dinosaurs)	WhaleboneMcCoy	74	18	11		t5_2sdsw	False
1365706562.0	1c5hzf	Cool dino poster set!	monkeyinthemaddle	61	7	2		t5_2sdsw	False
1363809873.0	1aon0a	NO Feathered Dinosaurs in JP4	Anisette	64	5	13		t5_2sdsw	False
1363651752.0	1ak5o2	Update on my Jurassic Park Police Interceptor. Painted the side.	how_do_i_name	64	10	12		t5_2sdsw	False
1346738172.0	zbnfp	"""It's a UNIX system! I KNOW THIS"""	shidarin	57	2	4		t5_2sdsw	False
1339297351.0	uu2xr	Day = Planned	ashzilla	64	8	13		t5_2sdsw	False
1337537715.0	tw8sb	Just noticed this while re-watching JP, haha		63	6	21		t5_2sdsw	False
1361541103.0	190qei	Jurassic Park theme slowed down 1000%	smorebtts	60	8	12		t5_2sdsw	False
1360380859.0	186ag5	I finally found it again !!!	z_DiMiTRi_z	62	8	18		t5_2sdsw	False
1357953521.0	16ew1g	All aboard the hype train!	kmmgreen5	59	6	8		t5_2sdsw	False
1352148636.0	12oqi0	Coloring Book (finally)	thiskittensgotclaws	57	2	13		t5_2sdsw	False
1339422355.0	uw4e4	Found these Wedding Cake Toppers that I Totally Want! Thought all your JP Fans Might Enjoy!	justined0414	55	4	3		t5_2sdsw	False
1328588143.0	pe784	How to make a T-Rex	hawkeyehandgrenade	57	5	4		t5_2sdsw	False
1326229942.0	obbhp	Wanted to share this sweater I just bought on Ebay. What do you think?	sundayfunday	58	2	9		t5_2sdsw	False
1375947575.0	1jxyyz	Finally ready to share a little sneak peak of the project I've been working on since January... will share more next week along with progress pics.	scoodidabop	58	4	16		t5_2sdsw	False
1361828668.0	197sh0	Children's picture book style Jurassic Park by Pakoto Martinez	Bossit	60	9	1		t5_2sdsw	False
1358195681.0	16kkao	"Spielberg: ""That (barbasol) can is still buried there somewhere, just waiting... for another Jurassic Park movie""."	Anisette	64	14	29		t5_2sdsw	False
1334253589.0	s6ida	Just a little off the top...	JPOG	60	6	3		t5_2sdsw	False
1373054275.0	1hpj4k	Possible Jurassic Park IV teaser poster leak	Christian661	64	13	19		t5_2sdsw	False
1371472430.0	1gifna	Spotted in the Wild in Annapolis!	mgrin88	56	4	1		t5_2sdsw	False
1365108058.0	1bop4b	Just in time for the 3D Release. Check out this song built purely from sounds in Jurassic Park. Dr. Ian Malcolm - 'That's Chaos'	egLAIKA	60	7	6		t5_2sdsw	False
1364398430.0	1b44mg	Jurassic Park soundtrack: John Williams add four songs for re-release	are_you_trolling	55	3	6		t5_2sdsw	False
1364337461.0	1b2ljd	Velociraptor Silhouette Poster	frankreddit5	67	16	2		t5_2sdsw	False
1362750976.0	19wt1i	Rules for the Tyrannosaur pen, how did I never notice this before?! 	ParksVS	61	8	12		t5_2sdsw	False
1367242213.0	1dc423	Would Muldoon Have Been Left Behind, Even if He Hadn't Gotten Eaten?	scribdecahedron	58	8	25		t5_2sdsw	False
1348696428.0	10j2lh	r/JurassicPark, I give you the world's greatest Jurassic Park Desktop and wallpaper!	SonVolt	55	7	34		t5_2sdsw	False
1344305262.0	xsu5g	Found this at a thrift store $15.99 letterman jacket.	WESBC	58	4	7		t5_2sdsw	False
1365436175.0	1bx8ob	Found this parked outside of the Moore Warren Theater on the first night of screening of JP3D!	Dole_of_the_Bobs	57	9	5		t5_2sdsw	False
1363296657.0	1ab5rk	"Colin Trevorrow Set To Direct ""Jurassic Park IV"""		58	4	25		t5_2sdsw	False
1361680799.0	19496i	The animators go out for a lunch break.	Rosesaddow	63	14	12		t5_2sdsw	False
1355014205.0	14ivoa	007 vs T-Rex 	Type1Padawan	62	9	2		t5_2sdsw	False
1351533507.0	12abs2	The Making of Jurassic Park - MUST SEE!	GrumpyGandalf	52	5	8		t5_2sdsw	False
1344804585.0	y3wqk	T-rex head render test for JP:Origins. Teeth aren't textured yet, but you'll get the basic idea :)	jporigins	57	5	8		t5_2sdsw	False
1334344289.0	s8d8p	8 Minutes of Rare On-Set Footage from ‘Jurassic Park’	drianmalcolm1	54	4	8		t5_2sdsw	False
1329382110.0	ps3pc	Lego Jurassic Park Cast	BeaumontTaz	54	6	8		t5_2sdsw	False
1328587971.0	pe72n	Map of Isla Nublar-Site A 	hawkeyehandgrenade	52	3	8		t5_2sdsw	False
1324794158.0	npxu4	I have absolutely nothing of substance to give r/JP for Christmas, so here's an image I found while playing with the pause button.	psykulor	54	3	1		t5_2sdsw	False
1376486405.0	1kcgwe	Colin Trevorrow talks Jurassic Park 4	antonabreu	56	7	8		t5_2sdsw	False
1374003594.0	1ifnbs	Met a guy yesterday with a clever tattoo	pandasquare	58	10	0		t5_2sdsw	False
1365257632.0	1bso5r	20 years later, 'Jurassic Park' reopens in 3-D	antdude	54	1	18		t5_2sdsw	False
1365046251.0	1bmzfi	Favorite tie	icemanx322	52	6	2		t5_2sdsw	False
