created_utc	id	title	author	ups	downs	num_comments	selftext	subreddit_id	is_self
1341621896.0	w5nsd	Is this true? Are those actors all confirmed?	TheToolMan	30	4	14		t5_2sdsw	False
1328992727.0	pl4yx	Dinosaur 3D model demo reel by Julien Romeo, CGI-lead for fanfilm JP:Origins. [repost for JP fans :)]	jporigins	30	4	4		t5_2sdsw	False
1327988237.0	p477k	Where can I get these curtains?!?		30	3	10		t5_2sdsw	False
1376634255.0	1kh2go	Found a dino to go with my rc	rcborg	28	3	3		t5_2sdsw	False
1367097949.0	1d8j1v	Replay – Jurassic Park: Trespasser	antdude	28	2	12		t5_2sdsw	False
1365578093.0	1c1t1d	Just came back from the IMAX 3-D showing (My thoughts)	raptorhunter666	31	5	14	"So, I know that most if not all of you here have gotten the chance to experience JP in 3D after a wonderful 20 years since its original and amazing release back in '93. I just want to say that, as my first time experiencing it on the Big Screen, it was even more amazing than watching it at home (Which I have done more than 50 times). The sound, the music, the color and clarity of the picture was astounding. There were a mere 6 other people there and I went with my brother and father. I just can't express in words how happy I am now that I have seen it on the big screen, and hell, this day is probably one of the most joyful and exciting days of my life. 

All in all, I greatly enjoyed the experience and I will treasure this memory forever. "	t5_2sdsw	True
1363982837.0	1ati75	As long as we're talking about Jurassic Park Weddings, here's my Jurassic Park *proposal*.	paleeoguy4	29	5	5		t5_2sdsw	False
1362892038.0	1a0dwr	We've got Dodgson here.	NiggaSmith	33	7	8		t5_2sdsw	False
1362097197.0	19fi1d	Just though you guys would like my Jurassic Park car project.	how_do_i_name	48	21	12		t5_2sdsw	False
1344967481.0	y7pu7	Why is the triceratops so cute?	hyena419	28	2	0		t5_2sdsw	False
1340291470.0	vdu8o	Jurassic Park 4 Gets Two New Screenwriters	LegendZelda	29	3	23		t5_2sdsw	False
1329185975.0	pofrj	IAN, FREEZE!	megustcizer	31	4	14		t5_2sdsw	False
1328833540.0	pild1	In Honour of John Williams' 80th Birthday, Here is a Tribute Someone Did To His Classic Jurassic Park Theme	EmperorYork	31	4	2		t5_2sdsw	False
1376575563.0	1kf2xf	Could one of you, wizards create a movie poster out of this? [Linton Zoo, UK]	FartQuotes	32	9	5		t5_2sdsw	False
1364854536.0	1bgoyh	One of the best days of my life so far.	5starninja	30	6	7		t5_2sdsw	False
1364269060.0	1b0rqv	SOO EXCITED	tinyassassin	32	7	10	Me and a friend just bought two tickets to see Jurassic Park in Imax 3D next Thursday.  Who else can't wait for the re-release?	t5_2sdsw	True
1350180637.0	11fxvr	JURASSIC PARK - Evolution of a Raptor Suit with John Rosengrant	antdude	26	1	1		t5_2sdsw	False
1346827972.0	zds7x	[X-POST from r/funny]The last movie we did together	zrag123	27	2	0		t5_2sdsw	False
1346726640.0	zbd80	Jeep I saw driving the other day on Isla Nublar	TCKS85	26	2	0		t5_2sdsw	False
1341892773.0	wb6r7	Fan-made Jurassic Park Vehicle Tour Audio	jporigins	28	2	11		t5_2sdsw	False
1337805735.0	u1kua	This is now the soundtrack to everything you do.	mybowtiesayshi	28	3	3		t5_2sdsw	False
1326451267.0	ofb92	Found some Jurassic Park props in line for Horror Make-Up Show at Universal Studios Florida	TheFigment	27	0	5		t5_2sdsw	False
1323225856.0	n3dg7	This came in the mail today. Thought i'd share.. 	oldmonkmgm	26	1	8		t5_2sdsw	False
1320297477.0	lynr8	And that's why you always lock your doors.	neotubesox	28	2	3		t5_2sdsw	False
1376349874.0	1k8osd	Jurassic Park of Decay: An idea for a Jurassic Game	Tr1xCadeyrn	30	6	4	"I see that alot of people post their ideas about a jurassic park game on here and thought to do the same. I was thinking of a mix of state of decay with dinosaurs set in a jungle island. In case you don't know about state of decay, read this first paragraph. If you do, skip it!

Recently released, State of Decay a zombie-survival game where you must scavenge and fend of zombie with your fellow survivors hold up somewhere. Your objectives are to protect, keep fed and survive the zombie outbreak until you find a way to escape. You can switch from character to character, all who have different abilities and sets of skills. You can use melee weapons or guns to kill zombies or use stealth to remain unseen. A fight with a zombie could attract more and end up getting your character killed. Either way, you must scavenge for resources in abandoned houses and manage the ones you already have. So now that I've given you a gameplay summary of State of Decay and I'll move into Jurassic Park of Decay and trust me It's right up your alley!

Imagine you are in group of survivors, maybe 12 people, stuck on one of the islands (maybe even site C). You all were left stranded in a old dilapidated building with enough resources to start out but won't last for long. In order to survive the characters in need to search the jungle or red wood forest (depending the island) in order to keep themselves alive. They'll need food, water, medicine, etc to stay alive. You and the group must go out and get the things you need. The reasoning for their situation is unclear but becomes more of a problem and causes fights between the survivors. It's up to you to make sure everything is going smoothly (or smoothly as can be) to keep everyone alive. The main problem with your current location is the proximity to the center of the island. Carnivorous dinos are lurking waiting to strike for their next snack. 

You must move quickly if you want to survive. The issue is the farther you move from the island's center, the less supplies are easily available. Ingen left many storage sheds and building for their personal, who at the time were safe. Also only few buildings even exist on the coastal areas so adequate living space is hard to find. It's a trade-off between two evils. Either live in constant danger of predators or the danger of starvation, lack of sleep, etc. Fear not. There would be many ways to keep your group alive. 

While scavenging for prepackaged food, take note that fruits and berries exist out in the wild. Be careful though. Without proper knowledge, you may be unwitting poisoned. Also game trails exist throughout the island, just not as anyone would know it. Dino meat is meat. How you get it is question? Quietly stalk your prey or go out in some of Ingen's loud and old roundup vehicles? Be careful though! Noise attracts predators and there is nothing stopping a T-rex from chomping on your vehicle. While a T-rex may be a little easier to avoid, more clever dinosaurs may follow you back home and discover your hold group, compromising safety. The jungle, which may have provided you the ability to be stealthy and move unnoticed, is not fickle and grants that ability to the dinosaurs. Raptors can come in full force or in a small recon mission, testing your defenses. If you see a small hole in your fences, RUN! Unless you have acquired some of Ingen's weaponry that is scattered throughout the island. Shotguns, pistols, hunting rifles, all at your disposal. Want something a little more humane? A tranq or two can be found along side many of the weapons. 

Either way be careful, Killing or taking down a dinosaur isn't easy. You may find outmaneuvering a simpler way of getting out of danger, but the dinosaurs are more clever than you think. A dinosaur you've shot but didn't kill may comeback for revenge. With all this danger, you must use your knowledge of the park and the animals to counter it. 

Someone in the group must be scientist or a hunter or someone native to island. Even a computer nerd can come in handy, seeing as Ingen interconnected the entire park with a vast array of computer. Use them to your advantage, whether it's getting maps and information on specific dinosaurs or unlocking doors and moving transport cars. Use their knowledge and skills to keep away from dino jaws.

 Speaking of Dinosaurs, Raptors and T-rex aren't the only thing listed on Ingen's Species list. Brachiosaurus, stegosaurus, triceratops, you name it! Look in awe as the island holds a complete ecological system. Maybe you want to take a photo? or video? Just bare that sightseeing may lead to a chase scene, so keep on your toes. Also, Ingen had a nasty habit of not mentioning all the dinosaurs and different prehistoric creature so be prepare for new, exciting and scary things. 

The point is survive long enough and maybe everyone makes it back home. 

What you you guys think?"	t5_2sdsw	True
1365758070.0	1c73d6	A bit late, but here I am ready to go the show.	Raumcole	28	3	6		t5_2sdsw	False
1361651793.0	193g0r	Vienna Horns play the JP theme, simply awesome!	MrNiko	25	2	2		t5_2sdsw	False
1357792229.0	16anul	Desperately looking for this same long sleeve jumper. can anyone help me find it with the same logo?	GusIsBored	27	4	10		t5_2sdsw	False
1337265129.0	trof6	The Making of Velociraptors	justined0414	24	0	4		t5_2sdsw	False
1330036703.0	q35xx	Jurassic Park Water	dr_wang	30	6	5		t5_2sdsw	False
1324000609.0	nelng	What us poor kids got when we asked for a gameboy for Christmas... [x-post from r/pics]	HolyShitAPenguin	30	7	3		t5_2sdsw	False
1322261603.0	mpatr	Excellent Jurassic Park Poster Designed by Aaron Horkey (Crosspost from r/dinosaurs)	Dracovitch	29	4	0		t5_2sdsw	False
1319666924.0	lq80o	"Spielberg reconfirms Jurassic Park IV, confirms Mark Protosevich is writing the screenplay for a story that's ""better than JPIII"""		28	5	9		t5_2sdsw	False
1374212072.0	1im4za	Looks like I have a new goal next time I see Wayne Knight, if ever	M3wThr33	24	2	1		t5_2sdsw	False
1373498417.0	1i1jrn	Welcome to Juraslam Park (Quad City DJ's vs John Williams) [x-post from /r/comeonandslam]	obviously_oblivious	31	6	5		t5_2sdsw	False
1366336783.0	1cng4s	JP: Operation Genesis - If they were to make a sequel, what features would you want it to have?	DangerCascadel	24	0	20	"With the upcoming Jurassic Park 4, we may be lucky enough to see a new generation of Jurassic Park games and (fingers crossed) something like JPOG might be on that list. I loved this game, and I know lots of you did as well.

So what would you like to see done differently? What do you think the best parts were? What could current technology bring to JPOG? 

For anyone who doesn't know JPOG, go play it. Here's some information:

[Wiki](http://en.wikipedia.org/wiki/Jurassic_Park:_Operation_Genesis) and [a million Youtube videos.](http://www.youtube.com/results?search_query=operation+genesis&amp;oq=operation+genesis&amp;gs_l=youtube.3..0l10.1208.2830.0.3000.17.12.0.4.4.1.217.1288.6j5j1.12.0...0.0...1ac.1.Wd2kqOlom7I)

"	t5_2sdsw	True
1365969708.0	1cccju	Went to Universal Studios yesterday and rode on Jurassic Park. I thought this guy should belong on here.	morgsy	29	5	0		t5_2sdsw	False
1365047242.0	1bn0nq	"""And he slashes at you with this; a six-inch retractable claw..."""	Sea-Salt	27	5	0		t5_2sdsw	False
1362633403.0	19turv	NEW Sculpt Jurassic Park Toys Found at Toys R Us!!!	LeakySuitBrigade	30	6	14		t5_2sdsw	False
1362616640.0	19t8jj	Just came across this old photoshop I did in high school..... Makes me laugh every time 	Kenbat	31	10	1		t5_2sdsw	False
1361563329.0	191f6o	"The only two words i find more important than ""clever girl"" "	cobra9613	27	5	49	"During the opening scene where they are placing the raptors into the cages, the gate keeper is grabbed. Muldoon is holding onto his as he screams, ""Shoot her!"" These two words have been with me through my childhood for some odd reason. They hold so much happiness. What quotes do you find personally important other than ""clever girl.""?"	t5_2sdsw	True
1360965114.0	18lqlz	As I'm watching the news about the broken down Carnival Cruise...	JurassicPFan	27	4	10	"[The cruise broke down, and then when they docked, the bus taking them to the hotel broke down.](http://www.nbcnews.com/travel/not-again-bus-carrying-passengers-nightmare-cruise-breaks-down-way-1C8392067) I couldn't help but think:

""Well, we're broken down again."" ""Yeah, but at least we're not in the ocean."""	t5_2sdsw	True
1360801436.0	18havo	Hey Android users, Jurassic Park builder is finally out on the Play Store!	obviously_oblivious	26	2	4		t5_2sdsw	False
1344256612.0	xrgw7	Jurassic Park: Operation Genesis 	zrag123	26	3	19	"There must be a few of you that have played this game. I absolutely love it, although it looks harsh on the eyes now. I know it wasn't a success to the overall gaming community, however i would love to see a sequel. 

With addition to new Dinosaurs as well as new features I'd think it would be an awesome break to what you can currently in the contemporary games market. Anyone else feel nostalgic about the game? 

"	t5_2sdsw	True
1330910463.0	qhvtk	Easy, Breezy,Beautiful... 	RaveRaptor	33	13	2		t5_2sdsw	False
1329572559.0	pv7ds	I made this the other night when I was drunk and watching Jurassic Park, thought you guys would enjoy it... (FIXED)		26	4	2		t5_2sdsw	False
1324763341.0	npiby	Thought u guys would like what I found in the darkest corners of my closest. Used to carry them everywhere when I was a kid. 	gothamgaj	24	3	9		t5_2sdsw	False
1324684849.0	noj0o	I was in the Jurassic Park Discovery Center at Universal and noticed this.  What great attention to detail. 	anthony112358	26	1	3		t5_2sdsw	False
1375730063.0	1jrbas	"Saw this and thought it belonged here. ""Life finds a way"""	bananafish42	43	20	6		t5_2sdsw	False
1364951865.0	1bk27n	I write for a movie magazine in Australia and was lucky enough to see one of my all-time favourite films in IMAX 3D! I'd love it if you guys check out my review and tell me what you think!	jnatsis-1	24	2	4		t5_2sdsw	False
1348439047.0	10d10t	Clever Girl SFM style 	EmperorYork	24	1	0		t5_2sdsw	False
1348368607.0	10brap	Decided to print a little something up at work on the plotter. What do you think?	InsufficientPostage	24	1	11		t5_2sdsw	False
1323805667.0	nbcyw	Beyond Dog Fort, Episode 11: Jurassic Park		23	3	3		t5_2sdsw	False
1321382417.0	mdciz	Jurassic Park the game is out today!!!	CanisLupusArctos	23	1	16		t5_2sdsw	False
1320470406.0	m15vc	Obligatory crosspost from r/pics	alphaeighteen	23	1	5		t5_2sdsw	False
1319850443.0	lstb5	My favourite piece of JP fan art. 	jhra	23	0	0		t5_2sdsw	False
1319250933.0	lkn2p	jurassic park halloween costumes, 2008	emfail	28	6	4		t5_2sdsw	False
1371262367.0	1gdmm9	Jurassic Park 4 put back to 2015 release	antonabreu	22	0	6		t5_2sdsw	False
1369283938.0	1evvy9	Nostalgia Critic reviews Jurassic Park	scotch_on_the_rocks	35	12	20		t5_2sdsw	False
1368246326.0	1e438m	Power wheels done right.	M33kaz	28	7	2		t5_2sdsw	False
1367447659.0	1dig03	Walking With Dinosaurs - International Teaser Trailer [HD]	BoredBurrito	22	2	1		t5_2sdsw	False
1367098966.0	1d8k62	(X-Post from r/TodayILearned) TIL there is a species of Ankylosaurid named nedegoapeferima after the main actors from Jurassic Park	astrofreak92	26	5	0		t5_2sdsw	False
1366796812.0	1d01ce	Mr. Hammond, after careful consideration, I've decided - to deal with your park. [OC, yes it is my imgur account]		31	9	0		t5_2sdsw	False
1365297032.0	1bttms	If you have the chance to watch JP in IMAX 3D, I highly recommend it. Great experience.	JesusHRChrist	22	1	4		t5_2sdsw	True
1361586325.0	192537	MakingOf - Movies - Jurassic Park	antdude	25	5	7		t5_2sdsw	False
1360793168.0	18gzq2	My second mug shot	reptomin	22	1	0		t5_2sdsw	False
1360631593.0	18cher	MAD: Jurassic Parks and Recreation	houinator	30	10	4		t5_2sdsw	False
1359566622.0	17kjnd	Anyone out there still play Jurassic Park Builder? Be my friend!	LALocal305	25	3	23	I'm at the point in the game where it costs over 10k per attempt at unlocking DNA and evolving dinosaurs. With more friends it seems like it would make the process go much more quickly, and not be such a huge money pit. Reply or PM me and we can add each other on Facebook!	t5_2sdsw	True
1350457656.0	11mbct	It was a good weekend!!	shanic77	23	1	3		t5_2sdsw	False
1346988718.0	zhl5v	"""PLEAAAAAASE!"""	Kunt_Vonnegut	24	2	3		t5_2sdsw	False
1346861340.0	zecqp	New Jurassic Park Game for iPad by Ludia and Universal Studios	bigatrop	25	4	5		t5_2sdsw	False
1339587545.0	uzo1t	my town produced this.	yeahdef	23	3	4		t5_2sdsw	False
1334873088.0	sijns	These were just delivered to my work - I'm a bit nervous to see what's inside... 	MasterWizard	24	3	11		t5_2sdsw	False
1329537049.0	puu43	Hold on to your butts	megustcizer	22	1	0		t5_2sdsw	False
1328862908.0	pj5ca	Jurassic Park Brochure Reproduction	supersepia	26	4	6		t5_2sdsw	False
1322618071.0	mu4v2	Any MTG players in here? If so, you'll like my new project.	Dracovitch	21	0	7	"In order to get my creative juices flowing again I combined my love of dinosaurs with my favorite card game. 

And have made a custom MTG Jurassic Park Set. 

[Here, have a look!](http://lordsethd.deviantart.com/gallery/33979788)

The set is ongoing, as I haven't added any instants, sorceries, etc. I'm also not going by any guidelines, this is all just for fun."	t5_2sdsw	True
1376065827.0	1k186y	Hilarious JP reference in Regular Show	ThoughtNinja	31	11	2		t5_2sdsw	False
1369864811.0	1faooi	Drove to the nearest BK just to get this toy xD	dreadfulnite	23	1	6		t5_2sdsw	False
1367329444.0	1der8l	A Jurassic Park inspired tune I just finished, you guys might like it. Life finds a way..	milkythomas	25	7	6		t5_2sdsw	False
1364738723.0	1bcw19	Which console had the best Jurassic Park game? Super Nintendo or Sega Genesis?	levelonerules	29	8	16		t5_2sdsw	False
1364353885.0	1b376h	"Not a big fan of these ""Keep Calm"" posters, but I made these hoping you guys would appreciate them!"	stevebates14	25	5	6		t5_2sdsw	False
1363152433.0	1a77o3	It looks like Jurassic Park 4 will be filming in Baton Rouge!	Alexbell89	22	3	5		t5_2sdsw	False
1351674449.0	12e2ph	The future of ILM and Jurassic park?	DavidRandom	24	3	9	Now that Disney owns Industrial Light and Magic (part of the Lucasfilm purchase), are they still going to be involved in Jurassic Park IV since Universal and Disney are competitors?	t5_2sdsw	True
1349055439.0	10qm1o	I have had these guys for quite a long time.	The-PageMaster	31	9	9		t5_2sdsw	False
1344922515.0	y6t6e	I reject your childhood and substitute my own	dovah-kun	21	0	8		t5_2sdsw	False
1340124142.0	va6hb	My summer just got awesome! Thanks Barnes and Noble!	darkkite23	21	0	8		t5_2sdsw	False
1337120880.0	toy9p	Jurassic Park Live!	theninjasquad	24	4	3		t5_2sdsw	False
1329332413.0	pr1s9	It's a UNIX system, I know this.	KuloDiamond	23	3	1		t5_2sdsw	False
1326038548.0	o80ss	Alan Grant's location-specific cry for help.	AbrahamWhistler	22	3	5		t5_2sdsw	False
1315607217.0	kajgs	How to build an authentic Jurassic Park jeep	EmperorYork	22	2	2		t5_2sdsw	False
1370637309.0	1fvwnf	The Lunch Discussion	lorddeezee	22	2	5		t5_2sdsw	False
1366195546.0	1cix49	JURASSIC PARK TRICERATOPS - Puppeteering an Animatronic Dinosaur	antdude	19	1	1		t5_2sdsw	False
1366086487.0	1cfxex	Let's be Monday morning quarterbacks. How would you have designed Jurassic Park to not fuck up?	arrowoftime	24	4	47	"Obviously, over-reliance on electricity. Even with geothermal power, interruption of power, either through equipment failure or something else was bound to happen eventually.

Supposedly, concrete moats and other physical security was in place to keep most animals from making it to the visitor's center, but clearly the T-rex made it there anyway in less than a day.

Placement of the raptor pen and the use of thin bars and cables for containment was a weird error given the level of respect they had for them before either incidents even occurred.

Additionally, when transporting the raptor from its holding box to the raptor pen, the use of a mechanical mating system and two gates seems pretty obvious. Even dog parks get this right.

What do you guys think? What should have been done differently?"	t5_2sdsw	True
1363954205.0	1asma6	Clever girls... JP Weddings	BigTrenton	38	19	3		t5_2sdsw	False
1360091971.0	17y59v	Jurassic Park Meets Metal [Music 4:12]	SadJam	22	3	0		t5_2sdsw	False
1356816308.0	15n2kl	Who here has read both books and seen the corresponding movies? What are your thoughts?	beneathmiskin	23	3	35	This may have been asked already, but it's always good to have a conversation. I saw the movies before I read the books, and they were fantastic reads. Personally, I would have liked to have seen the second movie follow the book more. 	t5_2sdsw	True
1349827429.0	1181ia	"""This is T-Rex pee? How'd you get it?"" ""You don't wanna know."""	evansreddit	21	2	8	YES I DO.	t5_2sdsw	True
1336756688.0	tiffc	"Just finished ""Jurassic Park: The Game"""	LeonHRodriguez	21	2	9	"I finished the fourth and final episode last night and I must say that I am VERY happy with this game.  Shockingly enough, it genuinely *does* do a good job of re-creating the atmosphere and theme of the original film.

The input detection is quite spotty at times, some of the textures are a little muddy and be ready for some **EXTREMELY** cheap, frustrating deaths - the positives definitely outweigh the negatives though, thankfully

All in all the writing is top-notch, the voice acting is solid, the characters are dynamic and interesting and, most importantly of all, we finally find out what happened to Nedry's Barbasol can..."	t5_2sdsw	True
1334899851.0	sj7k2	Rare Jurassic Park On-Set Footage	antdude	25	7	7		t5_2sdsw	False
1328654373.0	pfbjw	Who would've thought Mose was a fan? (from Season 4, Episode 4)	Billbeachwood	20	3	0		t5_2sdsw	False
1327719902.0	p01pi	For those of us who don't have a car	angrysaki	23	4	3	"I just discovered this subreddit and thought I'd post the paintjob (and custom bag) I did on my bike a few years ago. I used crappy paint and it's pretty banged up now...so it looks like I just barely made it off Isla Sorna :) .

http://www.angrysaki.com/Upload%5Cjpbike1.jpg

http://www.angrysaki.com/Upload%5Cjpbikebuilt2.jpg

http://www.angrysaki.com/Upload%5Chandlebarbag2.jpg

http://www.angrysaki.com/Upload%5Chandlebarbag1.jpg

http://www.angrysaki.com/Upload%5Chandlebarbag4.jpg

http://www.angrysaki.com/Upload%5Chandlebarbag3.jpg
"	t5_2sdsw	True
1323227748.0	n3etq	Tourettes Guy Replaces Grant in Jurassic Park. Childish but funny	EmperorYork	21	2	6		t5_2sdsw	False
1322595039.0	mto1n	This user is relevant to our interests.	psykulor	21	2	10		t5_2sdsw	False
1319518408.0	lo1um	Begging for: theater re-release of Jurassic Park?	CalamityJane1852	20	1	4	It would be so great to see Jurassic Park on a giant screen in HD. How do we make this happen, reddit?	t5_2sdsw	True
1376747917.0	1kjsa0	Compilation of all the Jurassic Park dinosaur scenes	dirtyrobot	20	2	1		t5_2sdsw	False
1370045850.0	1ffrjr	I thought some fellow JP fans might enjoy seeing some of the sights of the island of Kauai, Hawaii (shooting location for much of the original Jurassic Park). I filmed this video of landscapes during a 2 week stay in May 2013. [10:43]	jporigins	18	1	1		t5_2sdsw	False
1364360575.0	1b3elk	Star Wars vs Jurassic Park	BoredBurrito	19	2	1		t5_2sdsw	False
1361682595.0	194as2	Just watched The Lost World for the first time in years...	ZakkuHiryado	19	0	34	"How the hell did the T-Rex kill the people on SS *Venture* but somehow work its way back down belowdecks by the time the ship hit the pier?? Granted there are numerous unanswerable questions in this movie but that one really stood out to me. It kills these people and then just decides to chill back inside the hold?? It bothered me even more than the whole ""rappelling down the side of the fence where the T-Rex was just standing"" scenario from the first movie.

Thoughts?"	t5_2sdsw	True
1361598139.0	192g4a	Being made of fun of liking JP for so long, I was amazed when I found the JP SUB	Jurassicparknerd	22	4	3		t5_2sdsw	False
1361071597.0	18o9lo	This is probably a long shot...	kjolley3	23	5	10	i know it's a lot to ask, but my boyfriend loves Jurassic Park, and he had a shirt growing up that he got from Universal Studios ten years ago or so. His mom donated it to Goodwill not knowing how much it meant to him. Have any of you ever seen a Jurassic Park shirt that has a picture of an egg cracking with a raptor eye showing through? I've been trying to find it for months with no luck. Any help would be greatly appreciated!	t5_2sdsw	True
1354851939.0	14fb79	I never knew what subreddit to submit this to.  Then I found this one.	Calibansdaydream	20	2	3		t5_2sdsw	False
1347664801.0	zwh8b	T-Rex Enclosure	Doug1080	23	5	7		t5_2sdsw	False
1347574351.0	zuf7u	"""Mine would have been Aliens with dinosaurs, I'd have gone further, nastier, much nastier."" J.Cameron on how he almost got to JP before Spielberg"	Anisette	21	3	6		t5_2sdsw	False
1341132064.0	vvg8s	Draw Me...	lefayad1991	27	9	1		t5_2sdsw	False
1338582919.0	ug61a	Jurassic Park IV – Impending Dino Damage 	LegendZelda	21	3	1		t5_2sdsw	False
1324872129.0	nqt3k	so who remembers this card game! 10 points to anyone who can find a link to buy it online	smk3200	20	1	2		t5_2sdsw	False
1375371710.0	1jhzxm	Jurassic Park IMAX 3D bookings now available in the UK	herpyourderp	18	2	1		t5_2sdsw	False
1373313045.0	1hvv0f	The Avengers vs. Jurassic Park	zatan130	31	13	5		t5_2sdsw	False
1369055375.0	1eowhg	Found this in the parking lot while shopping this weekend	J0hnMcG	19	2	1		t5_2sdsw	False
1368204314.0	1e2sgz	Took dad to see JP3D, he unwittingly brought a prop!	phrodo913	26	7	5		t5_2sdsw	False
1367682578.0	1dokby	Thanks to feedback/comments by redditors I altered the wording in one of my illustrations/designs!	BCDCLC	22	3	4		t5_2sdsw	False
1366025527.0	1cdti6	The super old Jurassic Park stickers I found while packing.	5starninja	18	2	4		t5_2sdsw	False
1365948237.0	1cbpqq	Found this in my neighbor's driveway! (xpost pics)	DavidHK	18	3	0		t5_2sdsw	False
