created_utc	id	title	author	ups	downs	num_comments	selftext	subreddit_id	is_self
1374865194.0	1j44e7	JP Games?	Ski_3143	8	1	4	Is there a list somewhere of all the JP licensed or inspired games (Video, Board, or Pen and Paper) anywhere around here? If not, we should totally make one.	t5_2sdsw	True
1370223042.0	1fjxct	"Advantages of ""Friends"" on Jurassic Park Builder?"	coinnn	7	3	5	"Can someone please explain what ""friends"" are capable of doing in Jurassic Park Builder? I am only level 5 having just started out.. do they gain more abilities down the track and can I do anything in their parks down the track or is it all just for show? "	t5_2sdsw	True
1368828918.0	1ejmdl	What is jp operation genesis worth	Finndogs	7	0	7	Ive looked at multiple sites and they are all different. I have it for Xbox and im looking to sell. Its in great condition	t5_2sdsw	True
1368029201.0	1dxsg3	My friend is not taking the news of JP4 being put on hold very well...	velocicopter	12	7	0		t5_2sdsw	False
1366836856.0	1d1a1z	For JP4: Would you rather see the current scientifically accurate characteristics of dinosaurs or continue with what is established from the previous movies?	ltjisstinky	7	1	6	We all know that the Velociraptors from the movies are not that big IRL; they also had more feathers. Also, baby dinosaurs can be dramatically different based from the TED talk from Jack Horner. There are plenty of other fallacies from the movies that current scientific evidence suggest.	t5_2sdsw	True
1365251544.0	1bska4	I saw Jurassic Park in 3D last night. Here's my review.	thornff	7	1	2	"Now, I'm no movie critic, but I thought JP3D was easily one of the, if not the absolute best movie I've ever seen in cinema. The effects were amazing, and that just added to the awesomeness. The score, as always, was very euphonious and will happily be stuck in my head for the next few days. I would highly recommend this movie to anybody.

The only thing that disappointed me was the audience, or lack thereof. There couldn't have been more than 10 other people there. This was a 730pm showing in a theater that usually fills its seats."	t5_2sdsw	True
1365197787.0	1brdxn	For those wanting a little more after the excitement of seeing it in 3d.	FlopsieDisk	8	3	0		t5_2sdsw	False
1365190575.0	1br4iu	My Jurassic Park Cover is Back! With MP3 Download This time :D	5oundwav3fresh	7	1	4		t5_2sdsw	False
1365145322.0	1bpxl5	'Jurassic Park 3D' B-roll	antdude	8	3	0		t5_2sdsw	False
1365127115.0	1bpexc	I spared every expense. [First post]	simplyblessed	10	3	4		t5_2sdsw	False
1365123092.0	1bp9s8	Jurassic Park in 5 seconds.	flotilla-the-hun	7	0	0		t5_2sdsw	False
1365097151.0	1bo95j	Quick question about JP 3D	Sir_Pointy_Face	7	2	7	Just wondering if anyone knew how long it was going to be in theaters. Is it going to be a while, or is this a one weekend kind of deal? I really want to see it with my sister, but she can't come home this weekend. Thanks	t5_2sdsw	True
1365053411.0	1bn7be	Girlfriend taught me how to make gifs. This one is very simple, but I love it	BlazingCondor	9	4	0		t5_2sdsw	False
1365042827.0	1bmv0o	Anyone Remember This?	SilverPhantom1	8	2	0		t5_2sdsw	False
1364957890.0	1bkaa0	Just got back from an early Jurassic Park 3D IMAX screening...	beardednugget	7	1	5	"This comes from a someone who generally finds 3D to be a complete waste (aside from maybe Prometheus) and even rolled his eyes when I heard JP was due for a 3D IMAX re-release, but...

that was the single greatest movie going experience of my life.

The visual effects were absolutely incredible. I've always thought JP held up well over the years but seeing it on the big screen brought it to a whole new level. And the 3D was hands down the most effective I've seen in a movie thus far. The level of depth in some of the shots was always there, but you don't truly appreciate it until you see it in the 3D. The kitchen scene, Gallimimus chase, Brontosaurus feeding scene, helicopter coming into Isla Nublar...it was all breathtaking.

The score, T-Rex roars, were BOOMING. I've seen this movie countless times now but it was brought to a whole new plateau of amazing. After 20 years, it still got shrieks from every T-Rex roar and laughs from every single one of Malcolm's lines. People were ""...oh shiiiiiit"" every time a raptor's head popped up and just generally captivated. Really speaks to the staying power of this movie. I wish more action movies learned from this. They all don't have to be vapid, mindless nonsense.

Goddamn that was simply magical. Makes me realize the power of the movie-going experience. I'll be seeing it at least one more time before the weekend is out."	t5_2sdsw	True
1363195281.0	1a84wt	"Fan of Jurassic Park and beautifully illustrated comics? Check out the 1 Million dollar stretch goal for ""The Tomorrow Girl: Dresden Codak Volume 1"""	SowGoodSeed	15	9	1		t5_2sdsw	False
1358292617.0	16ndn0	My possible plot for JP4. Let me know yours!	naturallycontrary	10	4	6	"My idea:


The idea of a small number of people stranded a dinosaur infested island after willingly going there with limited equipment is a silly idea, and JP3 was most guilty of that. People don't want to go places like that.


So the park has been reclaimed after a massive attempt by InGen to reinstate a working (and safe) resort on the island. After several months of incident-free operation, the park is visited by a representative of the U.S. government. The representative informs the new C.E.O. of InGen (who is just as enamored with the dinosaurs as Hammond was, having been named his successor by Hammond himself) that due to InGen's massive debt and a few illegal actions taken while reclaiming the island, the United States government is repossessing all InGen properties--including the dinosaurs.


Now obviously the new InGen C.E.O. fights this tooth and nail and comes to find out that this decision was pushed through by a lobbyist representing a rival company which will receive much of InGen's properties and records. I think that this corporate wrestling match would ideally take up the first third of the film, allowing viewers to become invested in characters (including one employee of the park who is a handler and appears to have strong opinions about the well-being of the animals)and to be reintroduced to the wonder of the idea of a park filled with dinosaurs (and in true movie fashion, T-Rex, the velociraptors, and other carnivores won't be shown until they are actual threats).


So the litigation continues until, eventually, it becomes apparent that the park is closing down and the dinosaurs are going to have to be hauled off. Representatives from the rival companies arrive and pick and choose which dinosaurs are worth transporting and which are not, with the latter being killed, allowing the main characters (as well as the audience) to regard the dinosaurs as living animals rather than movie monsters. Of course, the majority of animals chosen are the more...voracious ones.


The animals are caged in criminally small quarters and tranquilized for transport. They are loaded onto one of a handful of ships that cast off for the mainland. At this point, the handler is revealed to the audience as a radical animal-rights activist. This character's morals break upon witnessing the cruel treatment of the dinosaurs and he begins to neglect their tranquilization and the dinosaurs become rowdy. Then a storm comes through and a combination of bad luck, disruption by the handler, and the incompetence of the company taking control of the dinosaurs renders the ship without power, in a storm, with raptors loose in the halls (imagine the suspense there). The main characters jump ship and weather the storm which casts them away on a nearby island.


Here the question comes up: are there dinosaurs here as well? The main characters are wary and decide that the safest path is to go for higher ground (what appears to be a plateau) and begin to journey into the island, resting in trees for safety and always keeping a lookout for dinosaurs, but they see none. They soon discover that the island is volcanic and that the plateau is a volcano. They pick their way up and get a good view of the island. It's tiny. And worse: their dinosaur-laden ship has been beached on the opposite side. At once this is a blessing and a curse. The dinosaurs are on the island and likely wandering towards the main characters, but the human castaways now have a goal and a place from which to possibly call for help.


At this point the characters must begin making their way towards the boat, perhaps being attacked by a T-Rex near a lava-flow or a raptor attack in an area filled with hot springs. They may be cornered into caves and flee raptors in a claustrophobic subterranean chase. I believe that there are unexploited ideas to still be used on one last tropical island dinosaur romp of a movie. And if Hollywood is interested in making more films, let them explore what could happen once this rival company gets the other ships filled with dinosaurs.


***TL;DR: New park built over old one. InGen dissolved in corrupt move by U.S. gov. which is pushed by a rival company that gets ahold of the dinosaurs. The dinosaurs get shipped out, but one ship runs aground on a small island with a variety of treacherous tropical landscapes.***"	t5_2sdsw	True
1347464619.0	zrqee	A Jurassic Park Restrospective [podcast]	thetravisnewton	8	1	1		t5_2sdsw	False
1347350555.0	zp75y	They just wanted to say hey.	SirYak	7	0	0		t5_2sdsw	False
1347345836.0	zp4q1	Jurassic Park Live	antdude	6	2	0		t5_2sdsw	False
1347184780.0	zli2d	Jurassic Park Builder: Obtain more coins	Sh1g	7	1	7	"For those who need more coins or feel that the game is too slow, there is an easy answer for you. 

*Use at your own risk.*

All you have to do is manually change your times in the settings.

Settings&gt;General&gt;Date &amp; Time&gt;Set Automatically (OFF)&gt;Set Date &amp; Time (Move by a couple of hours)

After that move back to the game and it will register as if that amount of hours passed by.

This is merely a suggestion, use at your own risk, your experience of gameplay will change, etc...

"	t5_2sdsw	True
1345698598.0	yoj7v	These two things must be combined. 	MostModern	8	1	2	"[This song](http://www.youtube.com/watch?feature=player_embedded&amp;v=-w-58hQ9dLk)

must be combined with...

[This song](http://www.youtube.com/watch?v=Y9AVTlvbhKM)

if it's not time consuming, and someone knows how to do this, will you please do this?"	t5_2sdsw	True
1345313823.0	yfqdu	For JP4, name one new dinosaur/creature you want added into the movie, and name one old	InHarmsWay	8	2	29	"For new, I want elasmosaurus. This guy is my favourite water reptile and plesiosaur.

For old, I want the Dilophosaurus back,"	t5_2sdsw	True
1341897257.0	wbaxc	Tattoo Idea?	fmjxbritishkid	7	0	6	"I'm gonna get a tattoo of Dr. Ian Malcom's Quote, ""Life, Finds a Way..."" and I'm looking to reddit to choose my font. I'm getting it within the month and I'll post pictures to show off. Any and all help thanks!
"	t5_2sdsw	True
1340627314.0	vkhku	Could JP4 not suck now?	LegendZelda	9	2	5		t5_2sdsw	False
1337763047.0	u0rix	The Biggest Goof in Jurassic Park (x-post from r/movies)	Caf-fiend	8	2	0		t5_2sdsw	False
1337275967.0	trxit	How about no.	tabbeee	7	1	11	"Watch this: http://youtu.be/VdSkKaFW_nM

It's long but here's my response:
Sorry to whoever took the time to do this, but no, just no.

First of all, let me start out by saying that 1. calling people ignorant for complaining about the idea of remaking JP when you sit there calling people whiny and dumb fanboys makes you look really rude and ignorant yourself and 2. you are being ignorant by not thinking this thoroughly and assuming Universal can pull whatever out their butts to do whatever they can whenever they can because you demand it. Your youtube channel is full of very rude and childish comments in reply to other comments that have been removed by you or other’s down votes which shows they probably wanted to write their opinion but you or others felt like they didn’t matter.

With that said, I’ll explain why I don’t agree with this at all. From here on I will complain (ignorantly) and be a whiny dumb fanboy(girl).

I run iheartjurassicpark with over a thousand followers who love the original movie for what it is. Many of these people including myself have read the books. I understand when people complain about book &amp; film adaptation but we need to understand that no movie is ever going to be exactly the book it adapted from. This is because of time and money. It costs a lot of money to film on locations, props, makeup, costumes, etc. The list goes on. Film to book adaptation is a very costly and timely responsibility.

Like said, I’ve read the books and I don’t see how much different they are except a few character changes and details. As a whole, they are just about the same.

Also, Jurassic Park (1993) won many awards and is one of the best movies to be made. They made $914,691,118 worldwide off this movie. I highly doubt they would do this again unless they do it many many many years from now (and it will probably end up being bad like the rest of remade films).

Film wise, the 93’ movie is amazing - CGI, animatronics, and all. It’s was basically the birth of amazing CGI work. I honestly believe that whether or not a person dislikes the movie they can’t sit there and say it was poorly filmed, especially because it was a little different from the book.

While Jurassic Park II: The Lost World wasn’t as up there as the first, it still wasn’t all the different from the book either.

Not to mention that Michael Crichton himself did the screenplay for Jurassic Park. That’s kinda like telling him he didn’t do good enough approving the movie that adapted from his own book.

Plus, if you haven’t noticed, Jurassic Park IV is being made and Steven is producing it while Johnston is directing it AND Jurassic Park is being remade in 3D. Think about it. Why in the world would they spend the time and money to remake the Jurassic Park movies?

You also mentioned that if Universal is hesitant about remaking the movies because of the whiny fanboys who commplain (ignorantly) about the idea of remaking JP… there was a solution for this, which was to convince them to get spielberg to be the producer of the remakes. Why in the world would we want him to produce it? “Hey, the same guy who directed the first film is supervising the remake! That’s Great!” You think that because Steven Spielberg isn’t going to direct it, will make it better and more like the book? No. Steven and Crichton were good friends and Spielberg is one of the greatest directors of all time. Who would you want to direct it? Johnston over Spielberg? No. Crichton has passed away. Who’s going to work on the screenplay and approve the adaptation, you? No. Plus now, a lot of us fanboy/girls know your evil plan so that’s not going to work :P You’re not going to calm fans by showing that Spielberg is producing it. Were not stupid. That would only make us more upset (as it should that Spielberg isn’t directing the 4th movie. stay optimistic people!)

You aren’t Michael Crichton. Give the man some respect.

“We want these remakes to start being produced while Spielberg is still alive, so that he can be the producer of the remakes.” Wow, that just sounds horrible.

I’m sorry for getting your hopes up but I highly doubt this will happen. If it does it will be years and years from now by some money hungry director who wont make it more like the books. Of course I’ll go see it, but I wont be surprised if it’s bad.

And next time you try to do something like this, be a little more respectful to dinosaur, film, and Crichton fans because here on my blog we are all one and we are grateful for the film and book that both Spielberg and Crichton has given us.

Thanks,
tabitha



What do you guys think about this video and his idea?"	t5_2sdsw	True
1335484621.0	sufju	Billy and the Clonosaurus, by Seymour Skinner (x-post /r/TheSimpsons)	viper1001	7	1	0		t5_2sdsw	False
1334440980.0	sa0d5	Had a great time at Dave &amp; Buster's today.	TheToolMan	7	1	0		t5_2sdsw	False
1332905250.0	rgziw	The Kids From 'Jurassic Park' Aren't Doing So Well In Their College Paleontology Class (quite old but still funny)	IlliniXC	7	1	0		t5_2sdsw	False
1323223457.0	n3bpl	Screw Citizen Kane	YummyCuppyCakes	10	3	0		t5_2sdsw	False
1320701972.0	m3zfh	So, in what direction would you like to see JPIV go? What would be a good story?	frankichiro	8	0	31	"I'm asking because I really don't know what to expect. I have no idea what more you could do that makes sense and haven't been done already.

Unless, they change genres a bit.

I could imagine different corporations fighting over the technology, for use in new DNA experiments. I can see black market trading and some very interesting sci-fi concepts with cloning and ""playing God"", but I can't figure out how to make it a ""Rawrr, dinosaurs!""-movie.

Perhaps there is a more political approach? Animal rights groups fighting to prevent a second extinction of these precious animals, while the corporations are trying to claim them as copyrighted property?

Military involvement? Will they try to breed weaponized dinosaur mounts/soldiers?

How deep does the rabbit hole go when you start to investigate InGen Technologies? All the way to something like the Umbrella Corporation?

I'm pretty sure it will involve another science expedition to Isla Nublar, which goes horribly wrong, again. At its core, it's mostly just a monster movie with a dinosaur angle, so I guess it's all about characters and cool scenes to make it a fun movie, but I'm not sure how to stretch it out into another trilogy.

What are your thoughts?"	t5_2sdsw	True
1320087817.0	lvh6o	The cult of Jurassic Park - Grantland	halfmast	7	1	0		t5_2sdsw	False
1319506844.0	lnuml	"""We were copying Mother Nature when we made that film."""	drianmalcolm1	6	0	0		t5_2sdsw	False
1374779622.0	1j1oh5	Found a Jurassic Park Jeep for sale in NY	racer_ohms	6	0	2	http://newyork.craigslist.org/wch/cto/3956243293.html	t5_2sdsw	True
1366783244.0	1czszv	Jurassic Park redubbed with RCT music!	skmokyle	9	5	2		t5_2sdsw	False
1365647881.0	1c3yor	The Animals Hiding in a T. Rex’s Roar	SciPhile	8	2	0		t5_2sdsw	False
1365583177.0	1c1w3n	Is IMAX 3D Better Than Regular 3D? And If You Dress Like John Hammond And His Pals, Does It Matter?	bearclawbill	9	5	2		t5_2sdsw	False
1365324676.0	1bufdp	How long is JP3D in theaters?	locustsla3r	6	1	3	I've heard one week but that might be just Imax. I can't find out anywhere else.	t5_2sdsw	True
1365136407.0	1bpq1m	I'm sitting in the theater waiting for JP3D IMAX	BlazingCondor	6	1	3	"So the first show of JP 3D in Burbank is at 10p.m. On the 4th, so I couldn't resist. 

I'll tell you guys how it is!"	t5_2sdsw	True
1365024404.0	1bm5xn	My facebook timeline photo. I'm the one in the middle.	garrettj	6	3	0		t5_2sdsw	False
1364495624.0	1b6x6h	Is Hammond a less sadistic Willy Wonka?	scribdecahedron	8	2	0		t5_2sdsw	False
1363828761.0	1apcap	15 Of The Greatest Jurassic Park Gifs.		7	2	0		t5_2sdsw	False
1363274144.0	1aad9r	What's your favorite scene?	CoasterLady	9	3	34	What's your favorite scene from the movie? It could be a scene from any of the movies.	t5_2sdsw	True
1362863558.0	19zlob	Help finding costume pieces?	CaptJordi	7	1	6	"Hi /r/JurassicPark! Any chance you guys could help me find pieces fro a [Dr Sattler](http://images3.wikia.nocookie.net/__cb20110802042204/jurassicpark/images/7/7e/4785641918_d408b00faa.jpg) costume for next weekend? I've been searching thrift stores for the past few weeks with no luck and running out of options! We leave next Thursday! I have shorts, and plan on snagging a pair of hiking boots at Ross or somewhere similar. But the shirt is proving difficult! And is that tank top blue or purple? Any suggestions?

We are doing a Jurassic Park theme for our 24 Hours of LeMons race. [A little about the car](https://www.facebook.com/KnoxvegasLowballers)"	t5_2sdsw	True
1361300898.0	18u0gh	How long should this take? I knew I should have restarted the docks...	gallonofpcp1	20	16	17		t5_2sdsw	False
1360285161.0	183nkk	Selling a Book?	theory4chaos	7	1	2	"Huge Michael Crichton fan here, I have in possession a first edition hardcover w/ dust jacket autographed copy of 'Binary' by Michael Crichton, written under his then pseudonym John Lange that I purchased a few years ago for $300.00 

Due to current monetary troubles I am curious as to how I may go about selling this book, without going the normal route. I've tried eBay several times and have never had any luck. I've reached out to rare book websites for info and have had no replies. Any ideas?"	t5_2sdsw	True
1359861729.0	17sem5	The True Malcolm Laugh	FaelSafe	9	5	3		t5_2sdsw	False
1347594139.0	zuyq1	Jurassic Park Beetles: Old, internet wise, but possibly new to you!	hanibalicious	6	1	0		t5_2sdsw	False
1346381754.0	z45uv	Tourettes Guy - Jurassic Park 	hyena419	7	4	1		t5_2sdsw	False
1335904943.0	t22g9	The Flubs of Jurassic Park (x-post from r/todayilearned)	BeaumontTaz	8	4	3		t5_2sdsw	False
1326592384.0	ohgok	Jurassic Park - Theme Song (Metal / Rock) Cover	unrealtrip	7	4	0		t5_2sdsw	False
1321848889.0	mjrj6	What would go into your favorite JP game?	BigMax55	6	1	17	There seems to be a lot of JP games but none have received much acclaim. What would you like your perfect JP game to be like? 	t5_2sdsw	True
1300702050.0	g83ik	another good place	EmperorYork	5	0	0		t5_2sdsw	False
1375796492.0	1jt6hn	CCR and Jurassic Park? Maybe best combination ever...	clentz1129	4	0	0		t5_2sdsw	False
1373496253.0	1i1gz0	Velociraptor being a clever girl cartoon	Denabby	5	3	2	I need help finding a short animated clip. So my little brother has recently found the How It Should've Ended videos on youtube and he saw the jurassic park one and found it hilarious.  Well I wanted to show him a clip someone posted on some thread a while back. It's a cartoon where the velociraptor is knocking on the door and can't get in so she jiggles the doorknob until the key falls off onto the matt and she slides it out to herself and opens the door haha! Can't find it anywhere. I think the clip was from an animated show from the 90s. Thanks in advance. 	t5_2sdsw	True
1372294943.0	1h5brj	Which Jurassic Park Dinosaur are You? [Survey]	exstasie	7	2	4		t5_2sdsw	False
1371850311.0	1gtjn6	Rumor: ‘Jurassic Park 4′ Plot Details Revealed?	SonOfSalem	5	1	5		t5_2sdsw	False
1368116804.0	1e0bwx	Amidst the sorrow of JP4 being put on hold, check out my web series Kickstarter about a guy who wants to make a Jurassic Park Musical.	vidgameplaya	5	0	1		t5_2sdsw	False
1367997540.0	1dx4eb	"JURASSIC PARK 4 ""ON HOLD"""	MandoSkirata	4	0	3		t5_2sdsw	False
1366916446.0	1d3n0a	Pretty good: Spared No Expense (The Remix)	ColourCrisis	4	0	0		t5_2sdsw	False
1365364237.0	1bvb2f	JURASSIC PARK T-Rex - Part 1 - Building an Animatronic Dinosaur	neslisahcetin	5	1	0		t5_2sdsw	False
1365133427.0	1bpmup	Just in time for Jurassic Park 3D - Acrylic Badges	Jadraptor	5	2	0		t5_2sdsw	False
1365114574.0	1boyez	There will be a new star dinosaur in Jurassic Park 4!	Alexbell89	7	3	8		t5_2sdsw	False
1364679236.0	1bbmss	Check it Out, We Got Nearly 300 New Subscribers This Month!		6	1	0		t5_2sdsw	False
1364262569.0	1b0jq0	"Angry giraffe causes ""Must go faster"" moment for vacationers on safari"	gcalpo	6	2	2		t5_2sdsw	False
1364215769.0	1ayxrg	Does Alan Grant ask Timmy what the dinosaur -Gallimimus are, because he does not know or because he is testing Timmy?	n7graduate	13	10	13	"Me and my boyfriend have 2 different views on the scene where Alan, Lex and Tim are in the open field and the Gallimimus are ""flocking"" away from danger. Dr.Grant asks Timmy ""Can you tell me what they are?""

I would appreciate it if fellow Jurassic Park lovers could give there views on this? 

https://www.youtube.com/watch?v=nM-RPO10aPY"	t5_2sdsw	True
1363545657.0	1ah5g1	My complete Kenner JP S1 &amp; S2 collection + lots of other toys (X-Post from r/actionfigures)	Anonimusdinonicus	7	2	4		t5_2sdsw	False
1363534696.0	1agtpo	Has anyone won that official 3D sweepstakes or know anyone who has?	iFucksuperheroes	5	1	1	I feel like it's a scam cause I have been playing it every damn day with no luck.	t5_2sdsw	True
1357948830.0	16eqye	Does anybody have any cool HD JP related wallpapers?	WinkeyBalls	4	0	5	Preferably 1280x800 but I'll take what I can get!	t5_2sdsw	True
1357524467.0	163ejn	Jurassic Park Half-Life 2 mod	stateofdenial	8	2	0		t5_2sdsw	False
1352092735.0	12njev	Dinosaur Heels DIY - would be awesome to make out of some JP toys	Arkomas	4	1	0		t5_2sdsw	False
1343839219.0	xigv3	"Jurassic Park: The Musical - 3. ""Spared No Expense / Jurassic Park""
      - YouTube"	dovah-kun	4	2	0		t5_2sdsw	False
1335914340.0	t2bd5	Apple DNA sequence 	cdmcali	7	2	0		t5_2sdsw	False
1330027053.0	q2xru	"Soundtrack for the Playstation game ""The Lost World: Jurassic Park"" - A full orchestra was used!"	dmk2008	7	1	2		t5_2sdsw	False
1328061093.0	p5ggj	Does anyone know where I can get a Papo Velociraptor model with the Jurassic Park coloring?	HMacyFan4eva	5	0	1	"I thought I had found one on Amazon, but when it arrived it had the new grey coloring. I'd happily buy a second hand one if such a thing is for sale anywhere. 
Thanks in advance!"	t5_2sdsw	True
1317345076.0	kvxva	"How It Should Have Ended: How Jurassic Park Should Have Ended -- ""Man those Raptors are smart. Smarter than snakes and way smarter than
those darn kids! ..."""	antdude	6	3	1		t5_2sdsw	False
