created_utc	id	title	author	ups	downs	num_comments	selftext	subreddit_id	is_self
1372593758.0	1hd0ku	Found this in /r/cHRISTIANITY. Just a reminder that /u/jij stands for everything anti-reddit.	fingerhands	156	15	15		t5_2t659	False
1371746478.0	1gqi5m	Richard Dawkins was at my middleschool debating /u/jij. This quote really hit me hard in the fedora.	MYAAH	157	18	12		t5_2t659	False
1366346595.0	1cnsp9	TIL: Carl Sagan Replied To A Bigoted Preacher Who Told Him To Go To Hell “If that is Gods plan for me, I’d love to see his to do list.” Flabbergasted the preacher converted to science on the spot. His name? Neil Degrasse Gervais Sr.	oreography	147	11	5		t5_2t659	True
1363957359.0	1asohz	Fundies = dumb, thus spaketh Sagan.	Lord_Mahjong	156	18	29		t5_2t659	False
1361566332.0	191ivr	All my friends believe in le science!	onca51	155	13	35		t5_2t659	False
1356480692.0	15fxgq	We are LITERALLY Anne Frank hiding in the attic		152	14	20		t5_2t659	False
1355959766.0	154wwl	Literally the new tank man. Bravery for the history books.	wparkers	161	20	59		t5_2t659	False
1355163875.0	14m652	Upvote to merge r/atheism with r/circlejerk.		164	27	11		t5_2t659	True
1376685633.0	1kie82	Just some BRAVERY from le horse cartoon [OneClick]	Uncreative_guy	151	14	20		t5_2t659	False
1372282946.0	1h4xfv	Just happened today	KalebNoobMaster	155	14	12		t5_2t659	False
1371090845.0	1g8pwp	A comic we can all relate to	bopoqod	147	12	6		t5_2t659	False
1367268278.0	1dd1ro	No phony gOD's blessings are welcome at my local Ben and Jerry's!	VermilionLimit	161	23	4		t5_2t659	False
1365423105.0	1bwv8l	Gay Marriage of celebrities should be allowed	juggaloholocaust	157	18	15		t5_2t659	False
1364736042.0	1bcuak	[deleted] posts all the best content.		145	11	37		t5_2t659	False
1359691418.0	17obza	This is atheism. 	so_valid	155	18	56		t5_2t659	False
1376222969.0	1k52gn	Non-censored Bravery spotted in New Jersey	Not_Blittzcrank	158	24	22		t5_2t659	False
1375449601.0	1jk8ub	What do you, my fellow Scientists, think of my new tattoo? Please be honest.	donkey_punch_kong64	157	20	47		t5_2t659	False
1368741264.0	1eh86d	DAE Think that all black christians are dumb? So edgy guise!	llamanatee	164	29	33		t5_2t659	False
1368408095.0	1e7tk8	some fUNdie bashing data	aidankiller4	166	29	12		t5_2t659	False
1364978088.0	1bks7p	Upsagan this if you want /u/Aalewis as head moderator of /r/scientist	TheCroak	143	6	13		t5_2t659	True
1364506706.0	1b7asj	Brave Facebook friend :')	lgf92	149	8	78		t5_2t659	False
1362437585.0	19o15x	SCIENCE proves fundies wrong once again	hexacat	153	16	11		t5_2t659	False
1344523720.0	xxvvg	One axis may be unquantifiable, it may make blatant historical lies, and it may have been posted here 100 times, BUT SAGAN DAMMIT THIS LOGIC DESERVES MORE UPVOTES.	pimpst1ck	147	13	58		t5_2t659	False
1340686118.0	vm4go	"I just wasted my money on ""Brave"".  It wasn't about athiests at all!"	RomeoZedman	157	19	9		t5_2t659	False
1338914029.0	um9za	MFW religion exists.	twentyone_21	153	17	13		t5_2t659	False
1337166451.0	tpsd1	Sexism? Check. Condescension? Check. LOGIC? Checkmate, theists! 		155	16	19		t5_2t659	False
1374569181.0	1ivh2z	My 5 year old brother dropped this on me today.	maalicious	159	23	28		t5_2t659	False
1371678510.0	1gonjz	&gt;mfw I get my daily dose of euphoria from Ricky Gervais' twitter feed	Dracula_Gottfried	153	14	5		t5_2t659	False
1370533240.0	1fsnp2	The top post in /r/Christianity right now...	test-throwaway	149	12	18		t5_2t659	False
1364016541.0	1augu6	Truly a good Scientist to have as a friend	nicklikesmilk	152	16	21		t5_2t659	False
1357826995.0	16bb10	"NukeThePope vs. Darqwolff. Not kidding. The amount of logics in this debate is incredible. 
"	twentyone_21	160	26	80		t5_2t659	False
1356282547.0	15bxzb	It's not vandalism if it's BRAVE and ends in a joke	meowmeow85	155	21	11		t5_2t659	False
1352911477.0	136raz	Think of the children.		157	21	58		t5_2t659	False
1347584021.0	zuoyo	THE ONION GOES 5 KILOSAGANS FULL BRAVE MODE		155	17	17		t5_2t659	False
1371264448.0	1gdolw	In June 2013, after jijtler overthrew skeen, I was abruptly woken in the middle of the night by two mods who subsequently threw me in a van and drove me 200 mi. to a facility that I would later find out serves the sole purpose of eliminating may-mays.	FalmerbloodElixir	155	23	9	"I hate those 2-click memes. I truly hate them. I'm really sorry you had to go through what I went... I guess I'll share my story, and hopefuly I'll make some people realize that these new policies are... more than evil.

As a kid I really denied any form of authority. I often harrased fUNDIEs on facebook, and the idea of a great man in the sky ruling over me was not only ridicoulous to me, but also hazardous... I came out to the mods as a lover of 1-click memes at the age of 14. They cried, threatened me, did everything they could to turn me back into a robot...

About 1 month after I came out, 3 mods came into my house at night, and told me to stay quiet and walk with them. I tought it was a kidnapping, as most people who experience this...

I walked into the van, and they explained themselelves. I was shocked and filled with hate, but I knew I shouldn't do anything, the van was small and I couldn't defend myself.

My first day at that new /r/atheism was horrible... everything I did was supervised, and also controlled. The only time I got to watch Cosmos and pwn fUNDIEs on facebook was at night, 10 o'clock. After 1 week I just couldn't take the 2-click memes, and my complaint posts were deleted. Two posts. Two. fucking. Posts.

After the first post I began hearing voices in my head, and after another post, the voices formed into a big, strong voice... Almost like Neil DeGrasse Tyson. I only had one conversation with it.

NDT : ""Escape.""

Me : ""How?""

NDT : ""Strong. Then Kill.""

After the last sentence I never heard him again. But it was enough. I knew my goal. At the time I had about 100 lbs... I was skinny, I didn't have force... I was helpless.

Every time I got out of isolation, I said ""fuck gOD."". All I did in isolation was drink Mountain Dew and eat Cheetos. I was so full of hate I didn't care about time... In there there was no natural light, just a little crack... I had no clock, so I would just look at the crack while pwning fUNDIEs.. Everytime light started to get through the crack, meaning it was day, it was a great achievment. I felt.. great. Small things where all I had, so it was incredible... I ate Cheetos and drank Mountain Dew Code Red in there for 8 months... breaks of 20 minutes, exercises for 1 and a half. And repeat. Repeat. Repeat...

After 8 months, I finnaly got out... everyone was so surprised I didn't shout ""fuck gOD."".

For about 4 days I was heavily looked at by all the mods... that was the day I began the brainwashing. They thought the mods deleting my complaint posts broke me down. It only made me stronger.

Everytime I entered the brainwashing room I would see a broken window. The room was on the first floor, so I could get out without too much damage. But I was... nowhere. Nowhere meaning a forest. I could run, of course, but how long would the forest last? I didn't know. Forest was memes. Memes are good. So I got to get in the forest.

One day, instead of the 5 athletic ~~mods~~ nazis that went with me to the room, there were only 2 fUNDIEs. I was so surprised... yet calm. I knew that was my day.

As I was approaching the window, I felt some Logic and Reason going down my neckbeard...

I quickly facebook pwned one guy while kicking the other with Logic and Reason, and managed to pull a Sagan quote on the facebook pwned guy.. I got ready, then jumped off the window. I fell, rolled, and managed to don't get hurt bad... I was running, running, running... I could hear some sounds, but I was so thrilled I didn't pay attention.. after about 4km running I finnaly stopped. I could feel my 1-click may-mays. It was... beautiful.

I heard a ""fuck! Watch how you're driving, man!"". My instinct moved me, and I approaced a yellow car...

""Please.. just.. let me come.""

The guy looked at me surprised, then told me to get in. After about half an hour, when I recovered, he asked me my story, but I was still afraid. What if he would get me to the mods? What if he was one of them? I didn't know. I just said ""No time to explain. Where are you going?"". He said /r/atheismrebooted.

I arrived in /r/atheismrebooted at the age of 15. I'm 19 now, and I never spoke with the ~~mods~~ nazis again, and will never do it. I truly hate jijtler.

But the experience made me realize how important 1-click memes are. .. aaaaand I grew fucking awesome muscles.

Thanks for reading so far :)! I means a lot to me that I can share my story... it hurts even now, after 4 years.

TL;DR : It took me 1 year to escape but, it takes you only 5 minutes to read.

EDIT : Thanks for all your support guys! It's been 4 years since I escaped the 2-click memes, so I had plenty of time to rebuild my neckbeard, and to find a job. I work right now as a Keyboard Warrior, Professional Quote Maker and a Meme Maker, which is more than I could have achieved while I was with new /r/atheism :)  
Anyone here gonna share his story? I figured out we could make a little book out of them, and if we would really start a petition to put skeen back as a moderator, every story counts!"	t5_2t659	True
1364799261.0	1ber2q	Upvote to rename April Fools' Day to April Christians' Day	Cirus	143	8	14	Eh?	t5_2t659	True
1358903943.0	173d3r	Daily reminder that Buddhists are really Atheists	N-e-i-t-o	157	22	23		t5_2t659	False
1355257683.0	14okzl	HOLY FUCK NYC YOU JUST WENT FULL 20123120938 MILLION KILOSAGANS OF BRAVERY 	dwarfwarrior	156	22	32		t5_2t659	False
1349723027.0	115gig	A serious question to present to the scientists in this subreddit	shameful_execution	149	16	19		t5_2t659	False
1349110100.0	10rn5u	Every time I'm arguing with a fundie...	FMCSIMMONS	149	15	23		t5_2t659	False
1373457963.0	1i03hf	Get this man some Doritos and Mountain Dew! This amount of bravery is Sagan-tastic!!!	donkey_punch_kong64	144	13	15		t5_2t659	False
1371781134.0	1grpol	A Brave, Euphoric Sci[ent]ist Posted This in /r/atheismrebooted...	MoonMetropolis	160	28	22		t5_2t659	False
1368290318.0	1e4uz9	"When people give me ""proof"" of gOD"	Serotone	152	19	14		t5_2t659	False
1364303480.0	1b1ezt	MRW I learned what fundies actually believe	bodom2245	146	12	9		t5_2t659	False
1358952873.0	174gqp	Never forget	three_am	161	25	8		t5_2t659	False
1356708315.0	15kpib	Atheism is like Google Chrome	meowmeow85	156	24	27		t5_2t659	False
1350895007.0	11vyv7	Ricky Gerbrave in what might be his greatest display of bravery.	SantiGE	154	22	50		t5_2t659	False
1350320981.0	11ipa0	My daughter may have failed her test, but she earned her PHD in bravery. 		154	18	39		t5_2t659	False
1332694731.0	rctrp	Take that, skytheist oppression!  I WEAR MY HOOD AS I PLEASE	preveyt	142	12	6		t5_2t659	False
1327464330.0	ovkmj	Seriously, Neil DeGrasse Tyson.	culturalelitist	139	8	8		t5_2t659	False
1370972989.0	1g4vij	"""PS4"" - Carl Sagan"	AbuCalypso	156	26	21	"Please upvote for visibility

---

**Edit:** PS4 is the scientific notation for tetra PowerSagan, or [HyperSagan](http://upload.wikimedia.org/wikipedia/commons/d/d7/8-cell.gif), a cubic PowerSagan that extends through the fourth dimension.

Get it right funDIES!"	t5_2t659	True
1369683012.0	1f5ivl	Ricky Gerbrave deals with funDIE oppression	thevoicesmademedoit	155	22	30		t5_2t659	False
1362777257.0	19xmza	This is my face when my asshole fundie parents make me go to church.  (Can't wait to get my driver's license.)	Lord_Mahjong	165	31	56		t5_2t659	False
1361456620.0	18ydbm	Quadraposting some logic to Facebook.	Lord_Mahjong	152	19	31		t5_2t659	False
1371586744.0	1glvoe	Literally me at the baptism my funDIE SHITHEAD PARENTS made me go to.	donkey_brains	153	24	8		t5_2t659	False
1366226023.0	1cjvm8	Injustice	whatisthisieven	158	24	32		t5_2t659	False
1362418650.0	19ncck	Pokemon Are Atheists		144	12	26		t5_2t659	False
1360934601.0	18kv9z	MFW a stupid fundie attempts to debate me	sexyhamster89	139	10	4		t5_2t659	False
1359724534.0	17oxkn	This should be the only metric in determining the greatness of a country	N-e-i-t-o	141	11	23		t5_2t659	False
1351441863.0	128264	gOOGLE gets it right!!	badlucklincoln	145	16	18		t5_2t659	False
1351144137.0	121wt7	Browsing OKCupid when this fine fellow r/atheist won my heart	RUDE_NAME_IN_ALLCAPS	155	19	29		t5_2t659	False
1347476611.0	zs2zr	AM I THE ONLY ONE WHO THINKS FUNDIES SHOULD JUST KILL THEMSELVES??	gruhfuss	161	29	9		t5_2t659	False
1374426380.0	1ira4c	Proof Doritos heal and not some phony gOD	bodom2245	147	14	9		t5_2t659	False
1370560114.0	1ftq2h	He's got my vote.	bigDean636	145	15	5		t5_2t659	False
1366978693.0	1d5dpi	You can't disprove atheism without a PhD in /r/atheism	directed-by	155	25	18		t5_2t659	False
1361496674.0	18zr43	THIS IS GETTING SORT OF RIDICULOUS.	juggaloholocaust	140	12	30		t5_2t659	False
1360291237.0	183v5x	The sheer audacity of this noble ambassador of the mothership (which literally happened) left me speechless		145	14	33		t5_2t659	False
1348736346.0	10k0fb	The truest story ever told [part 1]	pheakelmatters	149	17	16		t5_2t659	False
1337324701.0	tsyv4	True Beauty. True Bravery. A Commercial for r/atheism. 	TurningItIntoASnake	137	8	32		t5_2t659	False
1373519626.0	1i294w	&lt; Bags of Doritos you've consumed	PBMadCat	147	20	12		t5_2t659	True
1371685689.0	1gox4o	Found on r/atheism awhile back, figured it should be here as it was something that made me really start thinking against god.	RipStudly	146	14	30		t5_2t659	False
1370853445.0	1g19m2	Brave Atheist Calls Out New /r/atheism Policies for Being LITERALLY HITLER	MoonMetropolis	136	7	28		t5_2t659	False
1370539844.0	1fswzj	MFW the saganometer... broke	befege	139	11	6		t5_2t659	False
1358084328.0	16ho6y	This is Atheism.		156	26	30		t5_2t659	False
1335088172.0	smh2x	Stood up for my rights as an atheist in science class today.	culturalelitist	140	9	47		t5_2t659	False
1372556112.0	1hcb8y	First they came...	zimm3rmann	140	8	9		t5_2t659	False
1370966974.0	1g4mth	One of these things is not like the other...	EnlightenedYouth	155	26	14		t5_2t659	False
1364201076.0	1ayq6l	God bless, bitch.		147	15	29		t5_2t659	False
1363049291.0	1a48t5	I guess they have PhD scientists in Las Vegas	synthesisman	138	11	9		t5_2t659	False
1362318962.0	19kqt0	NDT explains why religion is stupid 	Gaylord666	151	21	30		t5_2t659	False
1360430698.0	1876vm	Breakfast of champions of **reason**	swordmaster006	150	20	30		t5_2t659	False
1359928711.0	17tu3l	It's Sunday – r/atheism relevance score: 1.5/10!		150	20	18		t5_2t659	False
1351335032.0	1263d4	I KNOW I'M GOING TO GET DOWNVOTED BUT DAE REMEMBER THESE TWO LE GEMS?	Ushankaclock	144	14	13		t5_2t659	False
1331921304.0	qzon3	Neil Tyson saying things	dhamster	142	15	8		t5_2t659	False
1370418933.0	1fpk1t	DAE Love Being Right?	MoonMetropolis	143	14	11		t5_2t659	False
1362770195.0	19xee6	The true face of euphoria	Ikbentim	139	9	8		t5_2t659	False
1361999649.0	19cnm5	S[weed]en is the best; Amerikkka is [le]terally Hitler.	Lord_Mahjong	149	19	71		t5_2t659	False
1359938215.0	17u4c4	Sick of FunDIES car fishes so i'm making my own	Unlinkedhorizonzero	142	12	12		t5_2t659	False
1359466793.0	17htas	I think this expresses my thoughts pretty well.	3brave5u	150	25	9		t5_2t659	False
1358361826.0	16p5e4	22 years old Christian here. I found out about r/magicskyfairy today.. and now I am confused.	Cirus	145	17	69	I grew up in a Christian family going to Church every Sunday. I am a senior in a big Christian college surrounded by many people with strong belief in Christianity. I happened to find out about this subreddit earlier today, and I have literally spent past 6 hours clicking on all the posts on this subreddit. Atheist quotes, memes about Christian hypocrisy, flaws in the Bible and Christian logic, and so goes on. What gets me the most is the fact that there are so many comments written by you guys that make so much sense. Have I been misguided for my entire life? Can somebody share why you chose to be an Atheist? Is there anyone willing to show me why the Bible is wrong? I feel very confused.	t5_2t659	True
1354369730.0	143p5l	As an Atheist in le European Utopia, I can confirm that literally nobody here believes in gOD.	JuggernautClass	152	25	25		t5_2t659	False
1372092119.0	1gz6px	Bravery from a great prophet, NukeThePope.		147	20	86		t5_2t659	False
1366922393.0	1d3vab	Fami[le] Guy is the master of subtle and clever social comm[ent]ary	I_am_the_horker	137	9	12		t5_2t659	False
1362765133.0	19x8br	For every upvote I will donate a thanks to a doctor without credit. (No limit, hurt me good MSF! Please upvote this post for which I receive no karma.)	Joeygforce	140	16	6		t5_2t659	False
1352612375.0	12zyvz	How the fuck is my answer wrong?	Horizons93	149	22	17		t5_2t659	False
1336092028.0	t61b3	Do you hate /r/magicskyfairy? Then please read this.	TurningItIntoASnake	145	19	16	"There's a few points I want to reiterate for most people who keep seeing /r/magicskyfairy on their front page and they ""can't stand this shit"".

/r/magicskyfairy  exists for a few reasons,

1)Guys, look, we are ALL prominent, brilliant Scientheists who are oppressed and horribly misunderstood in our personal lives. We're just here to VENT. 

VENT. VENT. VENT. VENT. VENT. VENT. VENT. VENT. VENT. VENT. 

Our method of venting is viscerally insulting and berating every poor soul (LOL GET IT? SOUL) out there who even UTTERS a word that is tied to religion. Facebook posts, rage comics, there's no other way for us to overcome these hurdles of everyday life than huddling into a corner snickering at other people on a website.

2) We respect all people's beliefs on religion, but our goal is to convert EVERYBODY to believing what we believe because that is the only true path. God and Religion serves NO GOOD whatsoever and nobody has EVER done anything good in the name of God or religion. It completely decays our society, and offers no good incentives whatsoever. Need I remind you that Hitler was a Christian? I think that's a strong enough argument by itself.

3) America is LITERALLY a Christian theocracy/fascist regime. You saw how close we came to Rick Santorum shoving his metaphorical throbbing fairy penis down our throats. We as Atheists must speak out and be pompous douchebags otherwise the world will suffer. WHY WOULD WE BE QUIET WHEN THE STAKES ARE SO HIGH?

4) We're not really assholes in the real world, we just fucking HATE all walks of theist scum who so ignorantly post ""Thank God"" on their Facebook status. We're misunderstood when we try to spread LOGIC and REASON to the dumb-ass neanderthal knuckle-dragging fundie masses. We're not arrogant pompous social outcasts. We are NORMAL people with NORMAL social lives. We just have major insecurities and need to channel it through a perceived sense of intellectual superiority.

Basically, if you're tired of outspoken atheists, SORRY. Humanity has been held back by religion long enough, and to a point, we still are. 

We're SICK and TIRED and OUR VOICES MUST BE HEARD, AND OUR NECKBEARDS STROKED.

EDIT: OMG THE KARMA I WISH I DIDNT MAKE THIS A SELF POST!!!111"	t5_2t659	True
1376056379.0	1k0wyh	So you're born A) crippled and B) too stupid to park and THIS is the vanity plate you choose? SERIOUSLY?!	SadStumpy	151	23	34		t5_2t659	False
1372794017.0	1himtk	American Atheists' new billboard	LeMayMayPoster	155	31	9		t5_2t659	False
1372613804.0	1hdgnn	Malicious Advice Mallard	LeMayMayPoster	145	19	12		t5_2t659	False
1363277014.0	1aagnl	The new pope has a STEM degree, making him the first atheist pope. WE DID IT REDDIT!!!!!	MrRichardNixon	141	16	11		t5_2t659	True
1361908606.0	199zqp	My girlfriend is a Christian. Upvote me to prove her wrong.	ohcontraire	150	24	12	I really don't want to stick my dick in crazy, but if you guys don't upvote this I might have to.	t5_2t659	True
1361730160.0	19543n	Enjoy looking stupid on Reddit	Ikbentim	145	23	20		t5_2t659	False
1361062674.0	18o0jd	From a /r/magicskyfairy user to the rest of reddit	oreography	147	19	38	"I'm getting tired of the anti-/r/magicskyfairy circlejerk. It seems like in every subreddit, as soon as something is associated to faithsmashing, people start bashing /r/magicskyfairy


You may think this subreddit is full of incredible posts, that it always talks about atheism and is full of logic and reason. Fine. I won't even argue with that. The fact is, it's none of your business. Either you like this bastion of bravery and stay subscribed to it, or you don't and you unsubscribe.

The community upvotes posts that it believes ABSOLUTELY RIGHT, just like in any other subreddit. Who are you to decide what shouldn't be in there? Who are you to decide that /r/magicskyfairy aren't allowed to post things about left handedness, pickles or black pride month? Only the community and the moderators should be concerned.

As a matter of fact, I'm not speaking in the name of all /r/magicskyfairy  Only upvotes will determine if the rest of the community agrees with me or not.

We aren't responsible for  /r/magicskyfairy being the bravest subreddit, but YOU are responsible for unscribing from it if you don't like it. Don't come in our subreddit to tell us that you don't like us, this is probably the most DELUSIONAL thing you can do. 

##FUCK OFF CONCERN TROLLS!!!! DON'T TELL ME WHAT TO DO!!!

Thank you.


"	t5_2t659	True
1358428164.0	16qzwm	Perfect analogy.	Slinger17	142	15	24		t5_2t659	False
1354217143.0	140ba6	MFW I see fundies at the park.	vainamo-	143	14	15		t5_2t659	False
1375883672.0	1jvskd	TIL Carl Sagan and Neil deGrasse Tyson once conducted a study to see if fedora and Mountain Dew purchases decreased the likelihood of being friendzoned.	Asotil	155	29	15		t5_2t659	True
1367297915.0	1de5p8	Atheists always win at tipping and feeding the homeless	juggaloholocaust	143	18	27		t5_2t659	False
1364657367.0	1bazsu	A jesus I would care about	Stussyu	143	19	16		t5_2t659	False
1359916659.0	17tfmm	Sokka is the bravest warrior in the water tribe.	Atlanta_BRAVEs	136	9	7		t5_2t659	False
1350748307.0	11sucy	Downvote if you love gOD		169	47	20		t5_2t659	True
1371945559.0	1gvryx	So, I Ran Into This Friendzoning CUNT Today...	MoonMetropolis	138	11	21		t5_2t659	False
1370571623.0	1fu3zp	Our prophet, MG-SOLID.	lolpancakeslol	141	16	8		t5_2t659	False
1368838862.0	1ejwrl	Dear Mom ;)	DontDropSoapx	139	13	35		t5_2t659	False
1362491799.0	19pfdd	Le me, the sexy atheist	this_is_a_sign	150	23	12		t5_2t659	False
1360448324.0	187qbz	So this [LE]TERALLY happened to our bartender tonight	Anal_Justice_League	133	12	11		t5_2t659	False
1350031153.0	11cwd9	So brave	mongzords	136	8	13		t5_2t659	False
1347921440.0	101p1y	LOGIIIIIIIIIIIIIIC!!!!!!	gruhfuss	138	13	14		t5_2t659	False
1374163922.0	1ikeek	Like a pro	heywhatsgoingon	143	21	24		t5_2t659	False
1371847485.0	1gtg0f	When was the last time your bravery was challenged MSF?	3brave5u	139	18	9		t5_2t659	False
1370481716.0	1frev6	Oppressed r/atheism subscriber speaks out against new rules	Eugle	138	16	23		t5_2t659	False
1359394648.0	17fse0	Science! Logic! Reason!	BraveryLlama	146	22	66		t5_2t659	False
1356460599.0	15fgm3	Double helix cloud, His Holiness is sending us a sign!	ProfessorDerpenstein	138	16	10		t5_2t659	False
1352560259.0	12yqjg	Your daily reminder that only religious people are violent.		148	24	7		t5_2t659	False
