created_utc	id	title	author	ups	downs	num_comments	selftext	subreddit_id	is_self
1371909591.0	1gut4f	This man here has the most exquisite taste for quotes I've ever seen.	_Kubes	202	34	34		t5_2t659	False
1370609664.0	1fuwxd	Take that, theist oppressers!!!	AverageCanuck	182	17	10		t5_2t659	False
1374437098.0	1irlui	My 7yr old bro just dropped this one	FeelPositive	187	22	12		t5_2t659	False
1374421532.0	1ir5gj	This just in: the MSF mods are LITERALLY /u/jij. CASE IN POINT	DerHellste	177	11	19		t5_2t659	False
1359041283.0	176y10	Scientist-fundie Hybrid	badlucklincoln	185	24	20		t5_2t659	False
1371208066.0	1gbxzo	So much opression these days	dirkdiggler7678	182	21	5		t5_2t659	False
1363450641.0	1aewrh	Scientist oppressed in /r/minecraft	Strephyl	182	20	25		t5_2t659	False
1347551211.0	ztrk4	By request	Serotone	181	14	6		t5_2t659	False
1375189121.0	1jcg2e	As an atheist sci[ent]ist with PhDs in Logic and Reason: This.	OccupyTamriel	192	29	32		t5_2t659	False
1372785320.0	1hiapr	Any atheist m'ladys looking for a fine gentlesir?	Typo_Knig	194	34	31		t5_2t659	False
1372542074.0	1hbxhm	Fighting oppression, one church sign at a time!!!	NukeThePoop	179	17	22		t5_2t659	False
1370061308.0	1fg6nr	Ain't science cool?!	EnlightenedYouth	178	12	10		t5_2t659	False
1362351703.0	19lokh	True Story	DiscipleOfSagan	198	38	21		t5_2t659	False
1358612121.0	16voey	More youtube comment bravery	Serotone	196	34	16		t5_2t659	False
1358564377.0	16uu5c	Jesus or Skyscrapers. Pick one.	Serotone	193	28	9		t5_2t659	False
1373470574.0	1i0gtv	Now trending: Science is winning!	seinfan9	183	20	14		t5_2t659	False
1372979476.0	1hnt7r	Atheist = good person | Religious = bad person	Hitti-Litti	193	35	43		t5_2t659	False
1372634566.0	1he451	&lt;-- Tears shed upon NikeThePope's rage quit from Reddit.	BlindSniper18	190	31	15	"**EDIT: Wow, because of the number of UPSAGANS this comment has, I have decided to give REDDIT GOLD to homeless gay liberal atheist swedish African orphans. We all made MAGIC today (Pun intended).**

**Also, shameless plug time! Check out /r/magicskyfairyrebooted for a more euphoric experience.**"	t5_2t659	True
1366728060.0	1cxrff	FUNDIE GIRLFRIEND AVOIDED! CRACK THE DEW, MY LOGICAL BROTHER OF SAGAN!	faithsmasher9001	185	24	41		t5_2t659	False
1344555578.0	xyu83	Damn straight.	Dean_Peterson	193	32	8		t5_2t659	False
1339648655.0	v15ir	The logical response.	twentyone_21	168	5	4		t5_2t659	False
1375293874.0	1jfp0e	One of the many great philosophical quandaries I often think about.	New_Wav	191	27	30		t5_2t659	False
1375125370.0	1jan7j	A Fundie Slut Friendzoned Me Again :(	MoonMetropolis	222	63	39		t5_2t659	False
1375029305.0	1j7z2c	Artist's depiction of ancient Mesopotamia if 'Jesus' was never a word.	pyrowolf8	179	19	17		t5_2t659	False
1370367189.0	1fnw99	Sometimes I cry myself to sleep at night thinking of what earth could of been ;_;	Burnhaloflame	195	35	32		t5_2t659	False
1362933072.0	1a10z7	Got a raging bravery boner over at quotes porn.	Cmrade_Dorian	180	20	13		t5_2t659	False
1365088638.0	1bnxrs	http://en.wikipedia.org/wiki/List_of_burn_centers_in_the_United_States	titan413	178	15	17		t5_2t659	False
1362941761.0	1a19uq	Now this is real Atheism.	Cultiststeve	175	16	12		t5_2t659	False
1376488528.0	1kcj0c	Atheismsterdam	juggaloholocaust	185	24	44		t5_2t659	False
1375135108.0	1jb14n	rise, my fellow science warriors!	paginginspectordupin	187	30	28		t5_2t659	False
1371514300.0	1gjw7l	r/AtheismRebooted: what people think we do.	BlindSniper18	188	27	19		t5_2t659	False
1366405883.0	1cp7r1	"And Sagan asked, ""Is there one brave enough to show the world why the funDIEs truly fear r/atheism?"" and a lone redditor whispered back, ""Yes."""	hellolion	171	11	16		t5_2t659	False
1337535895.0	tw7d2	A day in the life	TurningItIntoASnake	168	10	8		t5_2t659	False
1373547734.0	1i2ser	"""The Death of Socrates"" by Jacques-Louis David (1787), depicting u/jij forcing Socrates to choose between jESUS or eating poisoned doritos. The option was clear."	synthesisman	180	21	13		t5_2t659	False
1370863206.0	1g1eod	We must let go of this anger towards jij and remember what would jESUS do?	BryanWake	176	15	18		t5_2t659	False
1367157481.0	1d9sba	To become an atheist, simply don't believe in any gods. To become like me, you'd have to double your IQ, triple your age and get a clue.	Agnostic_Thomist	178	17	45		t5_2t659	False
1366419371.0	1cpo1q	Babies=Atheists	Eugle	181	27	34		t5_2t659	False
1364312953.0	1b1on8	I thought we had a safe space free from persecution.  But the mothership has been infiltrated by fundies!	Carl_DePaul_Dawkins	168	11	22		t5_2t659	False
1363441052.0	1aep5v	If Christians loved the homeless, they would let them freely wander their churches at all hours of the night.	Lord_Mahjong	191	29	27		t5_2t659	False
1354546776.0	147a5m	"Dr. Penn Jillette proves that literally everyone is an atheist in his dissertation entitled ""Religion or Safety: PICK ONE."""	EnlightenedYouth	174	17	56		t5_2t659	False
1376537577.0	1keb2o	I...can't even think of a clever title due to overwhelming euphoria...	maalicious	180	20	29		t5_2t659	False
1375465109.0	1jkr72	mfw my professor told me he was a fundie	doyouunderstandlife	191	35	39		t5_2t659	False
1361028161.0	18n1ba	SO BRAVE THEY ASKED ME TO APOLOGIZE OR LEAVE	Lord_Mahjong	184	25	17		t5_2t659	False
1372348492.0	1h6nmj	This was amazing to see!	EnlightenedYouth	171	14	31		t5_2t659	False
1370514341.0	1fs6ow	Collection of the best quotes concerning the Mothership Oppression Drama.	OccupyTamriel	180	27	88	"- ""Christians have been trying for a long time to get rid of this sub-reddit, and with this mod policy change they've gotten the next best thing. Now, atheism doesn't seem so exciting or interesting and will seem as boring as their religion. They couldn't get rid of the sub-reddit but they could, through their constant whining and complaining about the sub-reddit, get it's hipness neutered. This way, in their view, people checking out the place won't be swayed as easily to the dark side.
Will I unsubscribe? No. But, only because I want Atheism to remain a default sub-reddit with it's posts making the front page of Reddit in general. It may be a more boring atheism than it was, but I still want it to get exposure to people, and keep pissing off Christians with it's presence.""

- ""r/atheism has an online reputation.""

- ""all that stuff was the reason i became an atheist. fuck this bullshit.
im just not that into the sub that saved my life anymore. it was the memes and the jokes that made me comfortable enough to accept my disbelief, and i dont think i would have been able to ""come out"" without them.""

- ""If the reputation of r/atheism is terrible it is because christians go all over the internet spreading that reputation to keep people away. Christians don't want people going to this sub-reddit, and will bad mouth it, subscribe and unsubscribe to make it look bad, and generally do whatever they can to keep people away from it.""

- ""I also think we are overlooking an important thing. young people age 13-19 would tend to gravitate to the memes and facebook screencaps. they are the next generation. where many of them used to be privy to seeing the crappy side of religion daily and formed their opinions based on it, now, we're probably influencing the 20-40 age group.
Well, we tried, the next generation might shift back to religious, the r/atheism of the past will be a myth that we will be nostalgic about in years to come.""

- ""I wouldn't be here posting this now without the ragecomics and Facebook screencaps and meme images. their humor brought me to the place where I could accept the criticism the more serious conversations threw at me.
I spent many a night compiling a folder full of images I called ""theism"" from here, which I still browse through from time to time when I get irritated by the people around me because of stupid things they say or do related to religion. I'm sure I'm not alone. I'm sure those laughs are very important to people.""

- ""but I still want it to get exposure to people, and keep pissing off Christians with it's presence.""

- ""Now it's just a bunch of news stories that makes it seem more like we're attacking individual ""idiots"" instead of the general misogynistic and racist religion itself.
People will come here and think: ""Ah, it's okay that I'm christian as long as I'm not an asshole like that guy about it"" without realizing what views they're really aligning themselves with.
That's my opinion, anyway.""

- ""People are warned against it in church. This sub has got the church scared shitless their secret is finally out and the gravy train may soon be over. This is a war for them.""

- ""Mocking religion is one of the best tools we have to spread the ideas of atheism &amp; reason. People don't like to have their ridiculous beliefs shoved in their face.""

- ""If the reputation of r/atheism is terrible it is because christians go all over the internet spreading that reputation to keep people away. Christians don't want people going to this sub-reddit, and will bad mouth it, subscribe and unsubscribe to make it look bad, and generally do whatever they can to keep people away from it.""

- ""I said to myself, "" I'm Christian, but that shit cray"" the more and more I started saying that, the more I realized I am not a Christian, but a logical thinker, and perhaps Christianity is not for people that think rationally.""

- ""I was raised a religious fundie. The earth was 6,000 years old, end of story. Why? Because the Bible said so, dammit dangit! I was sent to a private Christian school for twelve years. We barely did biology, and in Logic class, we were shown videos of a brilliant new apologist, better known today as the Banana Man[1] . I shit you not, we watched Banana Man in fucking Logic class. And the scary part is, my impressionable, still-developing 16-year-old brain was 100% convinced by this bullshit. And I was the valedictorian.
My point to all this is, religion grabs kids as soon as they exit the vag and begins to build walls around their minds. By the time they discover places like reddit, those minds are a fucking fortress. You can hurl all the Evolution, Physics, Astronomy, Geology, Anthropology, Philosophy, and Logic you want at those walls for years, and it may not even make a mark. I know, because I remember what it was like.""

- ""This is fascism right here. Our own little microcosm has developed fascism. I hope you're proud of yourself.""

- ""Thank you OP. You have put it beautifully. /r/atheism is (was) probably the single best deconversion entity on the internet. I still remember the Southpark meme stating ""Hey this is a cool website. Aaaaaaaaaaaand I'm an atheist."" - it describes exactly what /r/atheism is (was).""

- ""How do you propose we overthrow them [The Mods]? Lenin always said a solid revolutionary plan was necessary for success""

- ""Religion is silly. Period.
Any attempt to side-step that or draw attention away from that only legitimizes religion ultimately.""

- ""I didn't come here for thoughtful discussion. I can do that elsewhere; in real life and on the internet (such as /r/trueatheism). I came here because I wanted to laugh and share other people's experiences. Who cares the same stuff was posted more than once? Tons of people still enjoyed it. I probably won't frequent this site as much as I used to.""

- ""If this subreddit is not open and free, then I honestly don't see the point.
Socrates died for this shit and we're taking it too lightly.""

- ""Do you know why religion is so great at gathering followers? It meets them right where they are. People [on the internet at least] are generally lazy individuals who form online habits. Not everyone opens self posts for of a number of reasons:

They're new users and self posts are strange to them.

They're looking for a laugh and just want to browse images.

They sit in church on Sunday morning and looking at an image of Christpoher Hitchens with a genius quote is the only thing keeping them sane while the people around them babble in ""tongues"" and writhe on the floor.

We need a ""come as you are"" mentality, or the theists win. Deregulation needs to happen.""

- ""/r/magicskyfairy won."""	t5_2t659	True
1359751916.0	17prif	Coexistence would be possible if only everyone thought like us.	EnlightenedYouth	171	18	31		t5_2t659	False
1351546215.0	12as04	This is why I hate AtheismPlus.	JuggernautClass	189	30	63	"Now real criticisms of the atheist/bravery/logic movement(s) are a 100% stupid thing, as we are obviously right, and everyone else is wrong. Everyone reading this knows what that entails and why it's important, I don't need to go into that here. We all know there are plenty of legitimate criticisms of fundies, and literally nothing wrong with brave atheists, etc.

http://www.reddit.com/r/atheismplus/comments/1263px/this_is_why_i_hate_magicskyfairy/

So here's an alleged ""atheist,"" who is basically saying that we're not really atheists, and we hate gay people. To me, this is nothing more than saying ""Fuck you, I'm braver than you are."" How is that anything but ignorant? Literally every true atheist knows that being anti-religion = pro LGBT rights.

I'm sick of seeing these ""progressive"" Christians pretending to be atheists. They say they don't believe in gOD, but they lack bravery, so you know they're secretly worshiping a magic sky daddy. If you feel the need to mock true atheist activists for bringing up religion, you're not progressive. You're a bigot. If your reaction to bravery is a little privileged pity party for yourself, you're a bigot fundie skygoose.

Edit: Oh no, the AtheistPlus undercover fundies found this. Take cover, they have downvotes and they lack bravery."	t5_2t659	True
1373937536.0	1idqd6	I work at a pizza shop and my favorite autistic customer asked for a joke on his pizza box. I stapled a bible to it.	DontDropSoapx	186	31	9	i deserve to drown in karma	t5_2t659	True
1369960250.0	1fdgfz	I am a girl and an atheist. Upvote this or I'll friendzone you. Your move, MagicSkyFairy.	TheFriendlyStranger	181	29	32		t5_2t659	False
1368548509.0	1eblbl	[Mild NSFW] This is how I browse /r/atheism.	Rapelord-Fascist	179	23	15		t5_2t659	False
1367594201.0	1dmfbo	The Matrix and blindfolds and something something=ATHEISM!	meowmeow85	164	9	44		t5_2t659	False
1362261066.0	19jjkz	Age, tis but a number when it comes to being brave!	billclinton69	170	15	54		t5_2t659	False
1369852944.0	1fa8oo	Redditor Atheist Comes Up With Plan to LITERALLY ERADICATE fundies from the Earth. Euphoria is ACTUALLY LEAKING from my orifices right now, not joking.	Peteos	172	18	60		t5_2t659	False
1369644555.0	1f4nld	The Saganometer has been pretty low these days, perhaps this tattoo will raise the Kilosagans.	OccupyTamriel	177	24	26		t5_2t659	False
1368032795.0	1dxws4	What a bastard	pheakelmatters	173	22	25		t5_2t659	False
1360508232.0	188xie	A map of how Christian conservatives view the world.		199	46	46		t5_2t659	False
1360358821.0	185l3j	Rome in 30 CE, just before Christianity	SMUT_ADDICT	177	23	18		t5_2t659	False
1352990178.0	138nxk	No prayer, no religious service, this is how I want to be buried.	Serotone	176	20	12		t5_2t659	False
1373213798.0	1ht24w	&lt;--- Number of funDIEs you've pwned.	khachaturianlick	191	41	6	"Edit: 0? Really MSF? I thought you were braver than that! [](/nogod)

Edit 2: We did it MSF!!!!! *Over 100 billion funDIEs pwned!*^TM

[](/cm)"	t5_2t659	True
1371352928.0	1gfove	I am a scientist who accidentally took a powerful hallucinogenic substance and now I am temporarily euphoric due to a phony god's blessing - AMA	slept_in	183	29	48	My faculties of logic and reason are disabled and I am experiencing the world as a funDIE for the next eight to twelve hours. Probe my feeble mind in the name of science!	t5_2t659	True
1367356024.0	1dfqhe	To celebrate another fine addition to our Chapter of Quote Makers.	Kode47	172	17	18		t5_2t659	False
1372852455.0	1hk8jk	thanks gOD!	juggaloholocaust	181	32	20		t5_2t659	False
1369848548.0	1fa31o	Definition of Atheism	titan413	166	17	17		t5_2t659	False
1364759111.0	1bdh3i	Fundies are LITERALLY the only thing holding back the human race from evolving into pure energy.	RJPennyweather	167	16	17		t5_2t659	False
1352737757.0	132gfl	SCIENCE'D!!!	Xqwzt	171	22	32		t5_2t659	False
1351011354.0	11yczk	I didn't know Geoff Keighley was a scientist.	TeeThreeN7	165	17	26		t5_2t659	False
1348344529.0	10b7hs	So inspiring.		176	26	17		t5_2t659	False
1373116194.0	1hqwas	God is watching you post may-mays to /r/atheismrebooted	NickWasHere09	200	47	11		t5_2t659	False
1370609213.0	1fuwkn	One Of Our Enlightened Bros of 4Chan Shares A Typical Day Of Logic &amp; Reasoning	S-Bird	166	13	7		t5_2t659	False
1363722678.0	1am30f	gOD didnt do that!!! DOCTORS DID THAT!!	d4rkhorizoN	162	11	30		t5_2t659	False
1346538873.0	z7csh	How I feel living in the LIEble Belt	jacobhghs43	160	11	12		t5_2t659	False
1374842850.0	1j3dsz	Jeff McGarland (The Creator of The Simpsons) Nails It	MoonMetropolis	182	35	36		t5_2t659	False
1374587227.0	1ivtcg	MRW /r/atheism gets removed from the default subs	breakingmad1	170	17	9		t5_2t659	False
1373317097.0	1hw0md	Upvotes to the left -MestR	MestR	168	15	9		t5_2t659	False
1370775076.0	1fz5ro	POLL: UPVOTE = ONE ATHEISM, DOWNVOTE = ONE THEISM	trolllord1995	166	16	14		t5_2t659	False
1365972010.0	1ccfen	Delusional Fundie Gets PAWND on Facebook	OnADock	181	32	31		t5_2t659	False
1350247143.0	11h5ef	10/10 would bang	FuckinDonny	164	14	20		t5_2t659	False
1347391531.0	zq2kg	Not so extreme....just brave	MrGeneralDisarray	182	33	28		t5_2t659	False
1372817037.0	1hjfu3	C'mon /r/magicskyfairy lets get rid of that funDIE jij	aidankiller4	162	12	12		t5_2t659	False
1372608539.0	1hdb8w	Absolutely disgusting.	heywhatsgoingon	169	24	10		t5_2t659	False
1370284743.0	1flhr1	[Official Statement] MSF would like to make an official statement about the recent events in /r/atheism	agentlame	183	33	60		t5_2t659	False
1368820490.0	1ejcdo	What my brave daughter said when her teacher told her we can know both the speed and momentum of an electron trapped inside a box.	Kalatnikov	170	22	24		t5_2t659	False
1363573554.0	1ai1m6	&gt;mfw I go to a fundie funeral	NickWasHere09	176	27	23		t5_2t659	False
1358225294.0	16lmkf	I witnessed some extreme faithsmashing on facebook (more like fundie-book amirite)	TeeBane	166	17	15		t5_2t659	False
1358005338.0	16ftuc	What if..?	faithsmasher9001	168	22	22		t5_2t659	False
1350947262.0	11wpe3	/r/atheism has temporarily relocated to /b/	SMUT_ADDICT	179	34	59		t5_2t659	False
1374770440.0	1j1bp6	[Le]terally MFW I log onto Facebook [one-click]	Typo_Knig	163	16	6		t5_2t659	False
1373829591.0	1iagun	The new Scientific Monthly	JABernz	187	40	15		t5_2t659	False
1364638815.0	1baoks	So This Totally Happened Today.	agentlame	181	33	68		t5_2t659	False
1358873095.0	1728jf	how to troll rELIGIOUS nutjobs IRL	pro_skub	167	17	36		t5_2t659	False
1374884037.0	1j4rny	"How to say ""funDIE"" in every European language (DAE socialism &gt; capitalism?)"	Gehalgod	185	39	22		t5_2t659	False
1374096168.0	1iiida	SOS MAYDAY SOS THIS IS THE MOTHERSHIP R/ATHEISM WE ARE GOING DOWN I REPEAT THE MOTHERSHIP IS GOING DOWN SOS MAYDAY SOS	Kode47	166	18	13		t5_2t659	False
1373557692.0	1i33rt	Oppressive Facebook Girl	LeMayMayPoster	163	18	10		t5_2t659	False
1372164569.0	1h18qc	He's the hero science deserves, but not the one it needs right now.	titan413	168	21	13		t5_2t659	False
1371389034.0	1ggb0s	For the fashion conscious scientist in need of a shirt to match his trenchcoat and fedora	Unag1	171	24	13		t5_2t659	False
1365129089.0	1bphjv	Stumbled upon this piece of logic today	bodom2245	168	20	23		t5_2t659	False
1359630234.0	17mguf	Since the Saganometer is running low, I've submitted this bravery to move it up a notch.		170	24	42		t5_2t659	False
1341812308.0	w9ags	A stupid THEIST literally said this to me today	918	169	20	10		t5_2t659	False
1334193508.0	s5do5	EXPOSED: Real oppression in 21st century America		162	15	8		t5_2t659	False
1370349010.0	1fnbmm	[META] MSF, we need to talk.	ICanHazTP	169	22	104	In this moment, I am euphoric. Not because of any phony god's blessing. But because, I am enlightened by my intelligence.	t5_2t659	True
1366823595.0	1d0r6a	I use this OKC picture to filter out the friendzoning fundie bitches who aren't worth my time. What do you think, kind atheist gentlewomen? :-)	creeping-cautiously	166	21	35		t5_2t659	False
1363708088.0	1alj79	Atheism is literally the source of intelligence and enlightenment 	OccupyTamriel	163	16	21		t5_2t659	False
1362691850.0	19vbih	Can you guess the word?	Ikbentim	161	16	28		t5_2t659	False
1346517469.0	z6tno	DAE science?	Aschebescher	162	19	23		t5_2t659	False
1372794018.0	1himtl	It is truly a dark time for us faith smashers	Dracula_Gottfried	162	16	19		t5_2t659	False
1371045788.0	1g71tu	The picture which converted me to atheism.	Duckshunz	168	23	19		t5_2t659	False
1369536034.0	1f29hg	HITLER WAS A CHRISTIAN	Eugle	168	20	20		t5_2t659	False
1368355658.0	1e6f6f	This is atheism!	Agnostic_Thomist	166	24	27		t5_2t659	False
1366290237.0	1clpt4	.		168	26	30		t5_2t659	False
1339421281.0	uw3pf	Upvote if you think 'religion', 'creationism' and 'homophobia' are all the same thing!	notnotkarmanaut	168	23	9		t5_2t659	True
1373839009.0	1iartc	I CAN'T STAND IT ANY MORE!!!	Adramel3ch	167	23	11		t5_2t659	False
1372337196.0	1h6b4v	My FunDIE mOM [Le]terally Just Said This	MoonMetropolis	168	26	7		t5_2t659	False
1366065115.0	1cf4ui	Wise words from my older brother.	oopsmachete	167	26	43		t5_2t659	False
1361625530.0	192tl8	SAGAN SMASH! #Sagna #Scienec #Lgoic #Bill Ney	larg3-p3nis	172	29	13		t5_2t659	False
1360587428.0	18b15r	You know who didn't resign today? This guy!	badlucklincoln	168	27	10		t5_2t659	False
1360254032.0	182jsl	GG Ron Jeremy destroying faith from a hospital bed. 		165	19	22		t5_2t659	False
1355148221.0	14lqzz	"""Bless you?"" More like ""OPPRESS YOU."" Amirite?"	TrindadeDisciple	160	16	22	Besides, why would I bless someone who just got snot all in my neckbeard?	t5_2t659	True
1354102656.0	13xgvu	Whenever my mom says I should go to church I just show her this:		162	16	22		t5_2t659	False
1348527150.0	10f1ie	I got LITERALLY de-friended out of my bible belt middle school and kicked out by my parents after making this. My face of ATHEISM. FUCK gOD!!!!1!1	gfour	172	24	24		t5_2t659	False
1375733270.0	1jrfz5	This Happened.	djherp	161	17	28		t5_2t659	False
1369929336.0	1fcc64	Six gems in a row from the one and only.	ler_hit	170	31	44		t5_2t659	False
1365887966.0	1cafrb	Brave dad leaves ignorant skytheist speechless with logic; scientist son captures the unforgettable moment in a short but beautiful image macro.	SaltyChristian	167	22	21		t5_2t659	False
1365690191.0	1c4w70	No one understands our oppression: I give you permission to funDIE	ArchangelleShitspoon	159	18	21		t5_2t659	False
1364045485.0	1auvmv	My gay atheist oppressed hero Alan Turing.	Lord_Mahjong	156	14	32		t5_2t659	False
1361906946.0	199xo1	"""The world needs more atheists."" - Mark ZuckerBrave"	JuggernautClass	157	16	31		t5_2t659	False
1357486142.0	1629rm	Eh?	badlucklincoln	172	28	4		t5_2t659	False
1337902206.0	u3kyn	Come get your free smug! 	ENovi	155	10	37		t5_2t659	False
1376596839.0	1kfuq2	"They misspelled ""ruin""."	tjb0607	158	18	13		t5_2t659	False
1374930845.0	1j5puv	Those Brave Sci[ent]ists from Family gUY show us how OPRESSION got the best of us	slimzimm	170	28	58		t5_2t659	False
1374762502.0	1j11jn	He's the hero we deserve, and also the one we need right now	rzw	174	33	20		t5_2t659	False
1373758871.0	1i8u7s	Hey guys, meet fATHER funDIE [Single Click May May]	Fundie_Fighter	164	20	17		t5_2t659	False
1370627736.0	1fvj87	An urgent message for the mods	NoveltyAccount5928	156	14	12		t5_2t659	False
1360869894.0	18j5qj	Why can't everybody be this rational?	AreYouSuchADreamer	164	23	44		t5_2t659	False
1350594783.0	11plq5	No one will ever be braver than me	God_loves_redditors	153	11	33		t5_2t659	False
1375406723.0	1jjall	Brave sci[ent]ist wears saganic shirt	neon_joygrey	160	17	33		t5_2t659	False
1374984281.0	1j77bm	Neil's up to his old tricks again!	Serotone	149	8	14		t5_2t659	False
1374067829.0	1ihfvr	Office Space is BRAVE	djherp	170	28	17		t5_2t659	False
1370796215.0	1fzkij	I just looked on /r/atheism for the first time in a few days and have converted back to Christianity.	tetuphenay	156	15	16	Thanks, jijler.	t5_2t659	True
1370735342.0	1fybx0	Any love for these gay atheist puppies I found in a dumpster this morning?	xXxBloodyTears666xXx	155	14	12		t5_2t659	False
1368908061.0	1eld4b	The mothership did not appreciate my atheist victory.	Halbakan	154	16	21		t5_2t659	False
1362203928.0	19ieg6	My personal message to fun[DIE]s	Briak	182	41	37		t5_2t659	False
1361052112.0	18npl5	Why is it okay to have Black History Month, but not Atheist History Month?	EnlightenedYouth	157	12	27	Seriously, as a straight white male scientist I am tired of being disallowed by society to be proud of anything. Just *try* to name even one other group that has suffered oppression anywhere near what we go through on a daily basis. Just *try.*	t5_2t659	True
1359562082.0	17ke8e	✞ = 卐	sizzzzzzle	157	15	35		t5_2t659	False
1356968098.0	15q5ju	DAE THINK BRITISH MONEY IS MORE BRAVE THAN AMERIKKKAN MONEY?	SirSchrodingersCat	161	17	18		t5_2t659	False
1352328892.0	12tofo	Stronk and brave atheist warrior perilously battling skyfundies [960x720] [x-post /r/atheism] [potentially NSFW? - majestic neckbeard]	Cilibinarii	154	9	14		t5_2t659	False
1366299239.0	1clzr2	Witnessed some epic facebook bravery today.	dustinyo	163	22	11		t5_2t659	False
1365192559.0	1br73e	This is atheism!	larg3-p3nis	168	28	81		t5_2t659	False
1364083339.0	1avy0g	THIS IS ATHEIST ACTIVISM	trolllord1995	168	25	17		t5_2t659	False
