created_utc	id	title	author	ups	downs	num_comments	selftext	subreddit_id	is_self
1372516608.0	1hb7ut	← Carl Sagan's IQ	titan413	1374	256	45		t5_2t659	True
1358694796.0	16xj5l	Professional quote makers INC	CircleJerkAmbassador	1129	93	38		t5_2t659	False
1370795903.0	1fzk5y	IF THE MODS CAN BAN MAY-MAY'S FROM /R/ATHEISM, WE SHOULD BE ABLE TO BAN THE BIBLE FROM /R/CHRISTIANITY. UPSAGANS TO THE LEFT IF YOU AGREE.	Igottabefresh	937	131	65	I feel like the mods in /r/atheism have literally crucified Carl Sagan. How are young scientist's suppose to learn how to logic and reason without the infinite knowledge contained within image macro's and quotes over pictures of space?	t5_2t659	True
1357465683.0	1620cd	I made the bravest pie chart ever	badlucklincoln	845	78	26		t5_2t659	False
1363108026.0	1a5mvr	I'm not a professional GIF maker or anything, but I was just too euphoric last night and this was the result. I am open to any and all criticism. Eh?	Kode47	817	110	73		t5_2t659	False
1362833407.0	19yvo8	TRUE BRAVERY 	Unlinkedhorizonzero	860	155	18		t5_2t659	False
1361389169.0	18wjhj	Do you even have to ask how I'm doing?	rzw	794	88	41		t5_2t659	False
1357501776.0	162ouz	Almost oppressed today, managed to save face.	bennjammin	774	79	27		t5_2t659	False
1357406448.0	160ibr	Never Forget	mongzords	706	48	41		t5_2t659	False
1347334993.0	zowaa	Upvote this post to merge r/magicskyfairy with r/science.	twentyone_21	706	86	169	"As a mod, I can do this, obviously.

(OBLIGATORY UPVOTE THIS POST FOR WHICH I RECEIVE NO KARMA)"	t5_2t659	True
1366768430.0	1czbcz	******~~~~~~~FIVE MINUTES AFTER YOU UPVOTE YOU WILL BE EUPHORIC IT WORKED FOR ME I SWEAR IGNORE IF YOUR A FUNDIE*****~~~~~~	FightWithTools	672	80	31		t5_2t659	True
1349128598.0	10s785	Rome in 30 CE, just before Christianity	bayernownz1995	581	22	16		t5_2t659	False
1359171243.0	17aqcs	If this gets one upboat, I will repost to r/atheism.	CallOfDutyNdNicCage	635	83	26		t5_2t659	False
1360940102.0	18kz2w	So I just came back from r/christianity	3brave5u	589	44	31		t5_2t659	False
1353157188.0	13clk8	FUCKING OPPRESSION		569	35	20		t5_2t659	False
1370694670.0	1fx8p3	Upvote if you support memes on /r/magicskyfairy, downvote if you killed Socrates.	oreography	639	109	36		t5_2t659	True
1361927922.0	19ape2	How many atheists does it take to change a lightbulb?	wexlam	540	40	28	None, we're already enlightened by our own intelligence!!	t5_2t659	True
1368458185.0	1e8xlo	Ran into this scumbag today	badlucklincoln	531	55	17		t5_2t659	False
1362753018.0	19wurv	A new emoticon to symbolize our bravery and  enlightened intelligence	bopoqod	516	41	52		t5_2t659	False
1374503178.0	1ita9j	More bravery from /r/AskReddit	dustinyo_	539	73	60		t5_2t659	False
1374091793.0	1iic60	&lt;--- Number of times /u/jij wants you to click to view a meme	ArrestLove	539	84	15		t5_2t659	True
1370523247.0	1fscin	Take that /u/jij!	khachaturianlick	530	80	91		t5_2t659	False
1363179996.0	1a7o4z	Exactly the same thing.	darkstar36	532	81	59		t5_2t659	False
1362080679.0	19ewq3	After a day of pwning funDIES on [F]acebook	Ikbentim	486	38	17		t5_2t659	False
1363808240.0	1aokpl	I Award you the Medal of Bravery, for courage in the face of tHEISTS	titan413	488	50	24		t5_2t659	False
1372935820.0	1hmlxj	&lt;----how many gallons of Mt.Dew you have drunk	breakingmad1	539	110	37		t5_2t659	True
1357165646.0	15umqd	My favourite quote		468	40	9		t5_2t659	False
1371041985.0	1g6y0h	I [le]terally just uncovered a funDIE conspiracy.	lodged_in_thepipe	557	130	36		t5_2t659	False
1360679914.0	18dmmt	So many likes were had on facebook. Oh the bravery!	grab29	468	48	13		t5_2t659	False
1365216053.0	1bry54	Just owned some fundies on Facebook.	JuggernautClass	476	65	71		t5_2t659	False
1346618757.0	z8uqr	"OUR OFFICIAL ""UPVOTE"" SIGN"	JarrusMarker	445	46	8		t5_2t659	False
1323041507.0	n0al2	Science prevails yet again	NewBornAtheist	513	124	22		t5_2t659	False
1370961136.0	1g4ezg	Parents found out I was an atheist yesterday. This is what they told me.	Abroham-Lincoln	433	46	49	"""We know. That is why we wanted to give you this when the time was right.""

Then my dad whips out a mahogany case with gold inlay.

""This was my father's and his father's before him. It originally belonged to the first man in our family to come to the new world.

My hands trembling, I open the case. In it lies the crispest, jet black fedora I had ever seen.

I embraced my father in tears. As we embrace he leans in towards my ear and whispers.

""Your laptop is connected and there is Mountain Dew Code Red in the fridge. Get to work son."""	t5_2t659	True
1369671105.0	1f55gw	How to pwn a fundie	Battlesheep	428	46	31		t5_2t659	False
1370546969.0	1ft7jt	Petition Obama to reinstate Skeen as the top mod of /r/atheism	Drunken_Economist	453	72	27		t5_2t659	False
1347644687.0	zvxd1	A Muslim moved in next door to me ಠ_ಠ	pheakelmatters	437	61	30		t5_2t659	False
1371224253.0	1gcd2h	Stop.	ICanHazTP	442	61	57		t5_2t659	True
1364576196.0	1b919n	Atheist Final Form	titan413	424	46	28		t5_2t659	False
1330636415.0	qdg6e	Authentic Facebook conversation inside. [no srsly] (x-post from r/circlejerk)	culturalelitist	399	19	2		t5_2t659	False
1371137502.0	1g9tqf	MFW /r/JustAtheism implements its first rule because of me	fbackwardsRed	430	54	33		t5_2t659	False
1362586854.0	19s53n	They said I would never be euphoric...	Pippen_Aint_Easy	416	45	24		t5_2t659	False
1371224238.0	1gcd1d	Think.	ICanHazTP	432	58	7		t5_2t659	True
1373147243.0	1hrplm	&lt;-- Number of peop[le] (in mILLIONS) converted to atheism thru one-click may mays	CatholicApologetist	439	70	11	DAE [real]ize this count won't go up anymor beCAUSE OF /u/JIJ 	t5_2t659	True
1366160614.0	1ci2b2	This is LITERALLY how atheism works	bofman	398	38	22		t5_2t659	False
1371224224.0	1gcd0k	Atheism.	ICanHazTP	425	66	11		t5_2t659	True
1371602834.0	1gmgig	I am a gay, atheist man living in Saudi Ara... you know what, fuck it. You saw the first 6 words of that sentence. Upvote me.	4-6forceout	417	60	36		t5_2t659	True
1373198390.0	1hsrko	&lt;--- Number of marijuanas which Neil Smokedegrasse Tyson has 420blaz0red.	CypressTree	438	82	8		t5_2t659	True
1371939607.0	1gvm4u	And in that moment I was euphoric.	3brave5u	382	30	25		t5_2t659	False
1363209417.0	1a8pbp	How I and the rest of r/atheism felt today		383	27	5		t5_2t659	False
1366113742.0	1cgfjv	Fellow Saganite is literally OPPRESSED for his tale of bravery!	three_am	399	53	49		t5_2t659	False
1371856975.0	1gtre4	When I'm getting ready to go to a debate.	dustinyo	379	31	21		t5_2t659	False
1372022365.0	1gxfvs	Upsagan if you fucking love science. Keep scrolling if you love church.	The_Magic_Sky_Fairy	390	53	18		t5_2t659	False
1370796764.0	1fzl3m	I feel the opposite of eufedoria right now	heywhatsgoingon	374	39	7		t5_2t659	False
1368695653.0	1efwo5	"Official Petition to rename ""karma"" to ""carlma"", please upsagan this post for which I receive no carlma"	neotek	369	38	25	"I am just so *sick* and *tired* of being oppressed by these pseudo-fundie Buddhist admins who insist on perpetuating their irrational stone-age MYTHS. 

Karma DON'T REAL and if you don't like it you can FUCK OFF."	t5_2t659	True
1372444209.0	1h9i0g	Does anyone else agree this is a massive improvement?	3brave5u	365	38	20		t5_2t659	False
1353956678.0	13tqdk	&gt;mfw xtians	meowmeow85	348	23	17		t5_2t659	False
1338223548.0	u8w01	Guys.  Hey, guys.  GUYS!!  Guess what?  I-PFFFT... No, guys, listen.  I- No seriously, guys, this is the funniest thing ever.  I... I put the... Guys, I'm serious, listen.  I put the, the... I PUT THE BIBLE IN THE FICTION SECTION!!! BAHAHAHAHAHAHAHA!!!	Carl_DePaul_Dawkins	359	32	23		t5_2t659	False
1366697836.0	1cx5tq	After submitting my 7 word thesis, I was awarded a PhD in economics. My thesis was: Tax le churches and legalize le weed.	dustinyo	367	44	23		t5_2t659	False
1349941463.0	11at4y	4Chan comment on atheism. For some reason, the mother subreddit didn't pick this one up. 	ENovi	347	26	13		t5_2t659	False
1348419610.0	10cidd	How to tell if someone is really brave	SMUT_ADDICT	343	23	15		t5_2t659	False
1372623653.0	1hdrx3	I ask all scientists to bow their fedoras in respect for the passing of one of our brightest.	Kode47	366	52	57		t5_2t659	False
1370869635.0	1g1j1y	A heartfelt message to /u/jij	getchar	396	82	44		t5_2t659	False
1368795703.0	1eijj2	You know what to do.	DKXIII	355	37	35		t5_2t659	False
1372000307.0	1gwszu	Such wisdom from YouTube scientist	Knailsic	349	32	24		t5_2t659	False
1371151818.0	1gadhi	True story about Jij literally ruining lives. [not me][true story][oppression]	3brave5u	359	50	39		t5_2t659	False
1375547546.0	1jmrih	No wonder they're the #1 search engine.	droogans	356	47	30		t5_2t659	False
1370534922.0	1fspxx	I went undercover in the mothership and took this photo of jij and tuber	meowmeow85	349	43	13		t5_2t659	False
1369103406.0	1eqlz3	MFW I browse /r/magicskyfairy	Serotone	332	27	23		t5_2t659	False
1364790987.0	1beja0	Congratulations /r/magicskyfairy, you're Subreddit of the Day!	agentlame	345	40	64		t5_2t659	False
1374341911.0	1ipcxe	I struggle with this decision every day.	NickWasHere09	357	52	45		t5_2t659	False
1371397885.0	1ggird	Le Darwin gem	maalicious	346	44	29		t5_2t659	False
1372103607.0	1gzm67	MFW my religious friend says he is going to do better than me on a science test.	faithsmasher9001	338	31	38		t5_2t659	False
1346596045.0	z8b13	Has anyone seen my smugmobile?		335	35	32		t5_2t659	False
1375760873.0	1jsfda	&lt;-- Length of Neil deGrasse Tyson's dick in millimeters (Lel do u think i'd use non-scientific 'MURICAN units???)	AfraidOfSnails	376	78	20	Why the fuck are you looking at this and not upvoting me???? You might as well be praying	t5_2t659	True
1362164537.0	19h7aw	A new BRAVERY-METER GIF for these times of unprecedented euphoria!	Kode47	330	32	25		t5_2t659	False
1373507529.0	1i1v50	"I saw a young child watching ""All Dogs Go to Heaven"". I said, ""Son, you may not even realize it but you are being oppressed. Here is a much braver version of that movie""."	Gehalgod	354	56	25		t5_2t659	False
1364687839.0	1bbvyy	What the fuck is wrong with you?	RegisteredInMinutes	399	108	428	"I can't believe half the shit I've read here. You people make me feel ashamed to be an atheist.

You're immature, you make things up and lie, and you're abusive (anyone that threatened me [here](http://www.reddit.com/r/magicskyfairy/comments/1baoks/so_this_totally_happened_today/c957yzz) has been reported to the Reddit authorities)

Take [this](http://www.reddit.com/r/magicskyfairy/comments/1bbg6n/a_truly_brave_faithsmashing_emoticon/c95cog9) for example. BEING AN ATHEIST DOES NOT MAKE YOU A SCIENTIST AND BEING A SCIENTIST DOES NOT MAKE YOU AN ATHEIST. NEWTON STUDIED THE BIBLE TOO!!!

You people are making atheists look bad, and you make me sick with all of your lies and abuse.  "	t5_2t659	True
1370193215.0	1fiz8z	"""Gay marriage"" - Carl Sagan."	heartosay	325	30	18	Upvote for visibility, please.	t5_2t659	True
1366579078.0	1ctkwg	Never lose hope, brothers. We are winning this fight.	dustinyo	327	35	37		t5_2t659	False
1361798982.0	196vhu	&gt;mfw fUNDIES think they're winning a facebook debate	three_am	316	26	10		t5_2t659	False
1363529035.0	1agp9s	Whenever I try to load r/atheism and r/magicskyfairy  at the same time in separate tabs.	3brave5u	331	42	19		t5_2t659	False
1365347479.0	1bus89	Wow. Kim Jong-Un showing us what it truly means to be atheist.	ohcontraire	312	28	38		t5_2t659	False
1369944956.0	1fcwt1	Trigger Warning: Atheist oppression on Reddit	AutismPolice	315	33	37		t5_2t659	False
1374715150.0	1izwvv	I Know I'll Probably Get Downvoted for Having Such a Brave and Controversial Opinion, But I Had to Get It Off My Chest Anyways	MoonMetropolis	345	66	33		t5_2t659	False
1375303435.0	1jg2tm	A true story of my encounter with a funDIE the other day [One click for your pleasure]	trampus1	316	38	23		t5_2t659	False
1365540763.0	1c0jrl	&lt;MFW fundie bible thumpers try to convert me.	Kode47	308	30	27		t5_2t659	False
1373240006.0	1htv87	OFFICIAL /R/MAGICSKYFAIRY POLL: Upvote if you don't believe in god. Downvote if you do believe in god.	so_valid	453	172	41	"I will publish the results on the front page.

Edit: Downvotes? Really?

Edit 2: I guess there are brigading fundie concern trolls. Let's show them Reddit!!"	t5_2t659	True
1370945430.0	1g41x7	Le Scumbag Jij Maymay	MoonMetropolis	325	48	8		t5_2t659	False
1371653359.0	1gnonc	Mfw on church.	conTrolling_athens	304	31	16		t5_2t659	False
1372256920.0	1h3xvb	BREAKING: US Supreme Court strikes down DOMA, thereby legalizing atheism; Reddit maymays cited as key influence for the decision	EnlightenedYouth	315	38	25		t5_2t659	True
1367525471.0	1dkmkn	Proof that Amazon is literally atheist		301	27	31		t5_2t659	False
1367231790.0	1dbwj9	Finished My Self Portrait. What do you scientists think?	oreography	311	39	29		t5_2t659	False
1337377561.0	ttvk8	My favorite Dawkins quote for shutting down idiot Christians	AN_ATHEIST_HERO	293	20	11		t5_2t659	False
1331156736.0	qmbak	So... all I have to do is add text to any image of Carl Sagan?		295	22	8		t5_2t659	False
1369158822.0	1erz51	Ricky Gerbrave knows how to use a tragedy to his advantage.	JuggernautClass	320	46	65		t5_2t659	False
1370126628.0	1fhksp	One of the most euphoric kids in my high school's gay atheist PhD program had this as his quote in the yearbook	Gehalgod	314	46	60		t5_2t659	False
1354648312.0	149wy4	I literally wept. He speaks to my non-existent soul.	CircleJerkAmbassador	308	35	54		t5_2t659	False
1368060738.0	1dyxzk	"After much deliberation, I decided today to tell my father I am an atheist. Without saying a single word, he walked out of the room. He came back in, sat down next to me and said, ""Here, this is for you."" I love my dad."	TheFriendlyStranger	297	30	22		t5_2t659	False
1369838444.0	1f9qju	PSA: /r/magicskyfairy, we have found the new Ambassador of Bravery right here. Holy shit.	OccupyTamriel	306	40	40		t5_2t659	False
1354825831.0	14eh64	/r/magicskyfairy turned 1 year old this week. Please circlejerk.	twentyone_21	292	28	46		t5_2t659	False
1365259143.0	1bspdb	My fUNDIE parents dragged me to church last Sunday, here is an actual picture from it. I'm the guy in the circle.	dhlrebel	296	35	15		t5_2t659	False
1362670929.0	19ukmi	DAE think STEM should be STEAM (for Science, Technology, Engineering, Atheism, Math) to better encompass the important fields we want our children to learn?	EnlightenedYouth	293	31	34	also Gaben lol	t5_2t659	True
1370812318.0	1g03hc	THIS. ENDS. NOW.	only_never	287	27	22		t5_2t659	False
1372202883.0	1h2lhq	This one click meme literally earned me my PhD.	MCskeptic	292	31	20		t5_2t659	False
1370611136.0	1fuy9q	PUT IT BACK. FUCK YOU.	bigDean636	294	33	48	PUT BACK MY FUCKING EUPHORIA. FUCK YOU. WHO DO YOU THINK YOU ARE, THE MODERATORS OF AN ONLINE FORUM WHO MAKE RULES TO INCREASE THE QUALITY OF SUBMISSIONS??? SKEEN DIED FOR THIS SHIT.	t5_2t659	True
1364240580.0	1azq5f	The Soviet Union literally never existed.		294	35	60		t5_2t659	False
1374447348.0	1irxs2	"I hacked jij's Google Ca[le]ndar. Looks like July is ""Oppress Scientists Month"""	Typo_Knig	283	29	28		t5_2t659	False
1369875629.0	1fb1w5	Mom said I could wear what I like to church now that I'm 14. I still hate her	plebnation	287	29	32		t5_2t659	False
1367691635.0	1doto6	MFW I hit the submit button to smash some faith	Joeygforce	284	32	13		t5_2t659	False
1352128572.0	12o402	The FAQ	JIVEprinting	283	28	24		t5_2t659	False
1376155638.0	1k3ipy	Atheist Master logician is fighting organized religion, Pack your mountain dews and prepare for battle!	JarvanTheIV	294	39	43		t5_2t659	False
1373647680.0	1i5uy5	So brave	Pianotic	288	36	38		t5_2t659	False
1374407813.0	1iqw6o	NAILED IT!	MoonMetropolis	287	37	22		t5_2t659	False
1359889923.0	17sx7a	My face of Atheism	trolllord1995	291	41	37		t5_2t659	False
1363618749.0	1aiyrl	Religion is so dumb. Edit: downvotes, really?	clyspe	298	44	24		t5_2t659	False
1364333349.0	1b2fy2	Two girls kissing? THIS. IS. ATHEISM.	Ikbentim	279	28	47		t5_2t659	False
1360583686.0	18az3d	WE DID IT REDDIT	calmyourselfman	278	26	34		t5_2t659	False
1346521775.0	z6xd7	This just happened to me this morning. How pathetic can fundies get?	pheakelmatters	293	42	19		t5_2t659	False
1364515578.0	1b7lol	mfw i walk past a church	djherp	275	24	11		t5_2t659	False
1362554158.0	19ris4	Hugo Chavez, truly an inspiration to us all even in death. 	spoderman_tim	273	26	37		t5_2t659	False
1342974108.0	wyxuf	Neil Degrasse Tyson is LITERALLY Neil Degrasse Tyson.  THAT'S ALL THE LOGIC YOU NEED FOR UPVOTES.	pimpst1ck	277	32	23		t5_2t659	False
1360334522.0	184s1i	Amen Hitler.	JuggernautClass	282	34	56		t5_2t659	False
1372689309.0	1hfebs	ignor[ent] fundie doesn't understand how he is being rude	breakingmad1	298	52	36		t5_2t659	False
1368137467.0	1e1385	It's easy if you try	Futhermucker	272	25	13		t5_2t659	False
1361293385.0	18tqyi	I predict by this time tomorrow the world will be rid of religion because of this single perfect argument.	Godfodder	274	31	16		t5_2t659	False
1374086317.0	1ii47g	Leaked image of the reddit admins discussing new default subreddit changes this morning	Serotone	266	23	14		t5_2t659	False
1372275882.0	1h4nmx	This.	jacobstime	276	30	51		t5_2t659	False
1350129787.0	11etk8	Religious people are stupid. Upvotes to the left.	jarllarx	281	37	18		t5_2t659	False
1373988751.0	1if2it	Science.	heywhatsgoingon	281	42	16		t5_2t659	False
1369057099.0	1eoy0b	lol gOD is so dumb xD	scheide	273	34	31		t5_2t659	False
1368208547.0	1e2xmx	A scientist (like le me) did this	ler_hit	263	25	31		t5_2t659	False
1359987054.0	17v7bn	I didn't know that Audi were le scientists!	LowlifePiano	270	30	11		t5_2t659	False
1371552357.0	1gksps	Burned Fedora [NSFW][NSFL][GORE]	MoonMetropolis	274	35	28		t5_2t659	False
1369326141.0	1ewsog	I'm about to wear this to my ultra-religious family's reunion. Wish me luck	ifinallyreallyreddit	264	28	21		t5_2t659	False
1370742502.0	1fyiv3	/r/atheism's Current Bravery Level	MoonMetropolis	267	30	31		t5_2t659	False
1375795499.0	1jt5hr	Get this. He didn't need reddit to convince him to be atheist.	Gehalgod	267	30	39		t5_2t659	False
1373815425.0	1ia1rt	Neil DeGrasse Tyson hits the nail on the head	Unag1	265	32	19		t5_2t659	False
1368369999.0	1e6nkv	MSF Sunday Roll Call. Upsagan if you're not a funDIE in chURCH right now.	bodom2245	254	22	34	Anyone who doesn't Upsagan is automatically assumed to be on their knees, praying to some phony gOD. 	t5_2t659	True
1361135911.0	18pkj6	AdviceAnimals blasphemes our prophet 	juggaloholocaust	270	34	34		t5_2t659	False
1372881971.0	1hl7b1	Yesterday, over three million godless Redditors participated in a march against /u/jij, fundies, and the friendzone. Not one mainstream news outlet picked it up.	LeMayMayPoster	266	30	23		t5_2t659	False
1367774337.0	1dqmh1	As an atheist, this is true [FIXED]	this_is_a_sign	266	28	18		t5_2t659	False
1375088038.0	1j9lud	Scientific Poll: Upvote if you want memes back.	sirboozebum	261	29	18		t5_2t659	True
1355623626.0	14x7so	Upvote to merge r/catholicism with r/jailbait 	so_valid	265	28	20		t5_2t659	True
1363792755.0	1ao05y	The face of militant atheism	pheakelmatters	271	36	38		t5_2t659	False
1363338426.0	1acb58	Dear /r/Magicskyfairy bashers	Horizons93	266	37	82	"So you have figured out that the majority of /r/magicskyfairy isn't very happy with religion and believe that religions are pretty silly. You might find some of this shit offensive even. You might even feel that you need to post about how much /r/magicskyfairy sucks.


I have a 10 step plan in order for you to correct this issue.


1. Go fuck yourself. This is a crucial step, and will be recommended should you decide to openly voice your concerns about /r/magicskyfairy. Might as well get this out of the way so when it *is* recommended, you can proudly claim 'I've done that already' and the discussion can continue. A broken bottle is ideal, but whatever tool you have available it fine, even if it is a portal gun.


2. Repeat step 1 to ensure completion.


3. Unsubscribe. You don't HAVE to be here, you don't HAVE to read the memes, sagan quotes, and dumbasses on facebook. Red button on the right. Go away, we don't want you.


4. Repeat step 1 again.


5. Understand our user base. If you live in the UK, you might legitimately not understand a LARGE portion of our users. Google the Bible belt. I will wait..... Ok, that's long enough. There are many atheist teens in the Bible belt, whom stay in the proverbial closet to prevent bad shit from happening to them. This includes something as trivial as being cut off from college (which in the US is not a right, but a paid privilege), to something as sever as being thrown in the streets or (in the rare case) murdered. There have been users on here asking for help due to parents wanting to involuntarily commit them to a psyche ward for their atheism. This subreddit is for them to vent.



6. Repeat step 1


7. We have every reason to hate religion. While we don't necessarily hate religious *people*, we do find their beliefs silly and worth mocking. However, religion is responsible for many deaths in Iran, Sudan, and the Bible Belt, especially among this particular faith known as Christian Science, which believes prayer is a legitimate alternative to MEDICINE and SURGERY, which sometimes ends up killing the unfortunate kid.


8. Repeat step one, one last time.


9. If you are still here and have concerns, discuss. If not, unsubscribe button is on the right, have a nice day and don't forget to go fuck yourself.


10. [Go fuck yourself](http://www.reddit.com/r/atheism/comments/1abmbq/dear_ratheism_bashers/)"	t5_2t659	True
1371841569.0	1gt8ad	A Tale of Two Cities	Mythodiir	255	23	12		t5_2t659	False
1358268013.0	16mhu8	Joined reddit...when do I get my PhD in atheism?	chaosakita	270	38	25		t5_2t659	False
1360075080.0	17xm2k	Just the tip of the iceberg.  	BardicSpoon	258	28	45		t5_2t659	False
1372730654.0	1hgwan	Mother of Hitchens, he actually did it!	LeMayMayPoster	259	33	22		t5_2t659	False
1375621426.0	1jofao	Get logicd muslim funDIEs	Slakter	264	35	59		t5_2t659	False
1375245242.0	1jegg9	MFW I realized that magicskyfairy = MSF which spelled backwards is FSM = Flying Spaghetti Monster.	Porter_of_Hellgate	249	20	25		t5_2t659	False
1373727604.0	1i7wty	How I feel as an educated man going into a church	LeMayMayPoster	276	54	19		t5_2t659	False
1370850733.0	1g185f	Always Remember	filletsack	247	21	28		t5_2t659	False
1370642855.0	1fw3t4	Join the maymay club TODAY!	EscherTheLizard	239	14	9		t5_2t659	False
1369235552.0	1eu642	Fuck you, mom.	CircleJerkAmbassador	239	12	15		t5_2t659	False
1367342142.0	1df771	Life in the rural South is hell.	fingerhands	246	23	24		t5_2t659	False
1338481704.0	ue28b	REMEMBER GUYS, IT DOESN'T WORK BOTH WAYS! we ARE being persecuted in 21ST CENTURY AMERICA		244	20	14		t5_2t659	False
1373174528.0	1hsfe9	☜ Number of Lies in the bIBLE	MoonMetropolis	257	35	8		t5_2t659	True
1348166227.0	107e1d	How I imagine our savior Dawkins felt when he wrote The gOD Delusion 	shameful_execution	254	31	9		t5_2t659	False
1371755316.0	1gqucm	Some fundie [le]terally said this to me after I sneezed.	VinnyMB25	281	59	22		t5_2t659	False
1371154933.0	1gai20	We all could only be so lucky to meet a guy like this.	Kelmon	253	31	13		t5_2t659	False
1368101380.0	1dzvmq	Viva [Le] Revolution	siegfryd	253	28	46		t5_2t659	False
1351518450.0	129vs1	MFW someone quotes the LIEble	vainamo-	253	29	24		t5_2t659	False
1361985608.0	19c4uk	Atheism because gay marriage. Don't ask, just upsagan.		266	44	56		t5_2t659	False
1339267070.0	utgu4	Why I'm an Atheist	SUPER_HITLER	241	19	8		t5_2t659	False
1364945349.0	1bjtqo	Why Isn't the upvote symbol a fedora instead of an arrow? This way instead of pointing to heaven we tip our fedoras in approval.	conservativeopinions	245	23	23	It just seems to me that we should tip our fidoras instead of pointing to a phony god that blessed someone. 	t5_2t659	True
1376351379.0	1k8qms	I can't wait for the swimsuit issue...	americansuperpower	246	30	35		t5_2t659	False
1376013023.0	1jzyl4	Lines are approximately one god delusion apart	LoopyDood	263	45	31		t5_2t659	False
1363876317.0	1aqetf	TIL that, in a Swedish experiment, when showed science, 80% of the fundies were euphoric compared to 100% of atheists who are always enlightened by their own intelligence.		249	28	23		t5_2t659	False
1362620060.0	19tdcs	WHY I'M AN ATHEIST [FIXED]	Kode47	251	36	21		t5_2t659	False
1370536810.0	1fssjw	WE DID IT REDDIT! We broke the Saganometer!	ohcontraire	236	18	45	Thank you based /u/jij.	t5_2t659	True
1367121050.0	1d96r0	Our brothers in r/Atheism know how it really is	AC4	258	41	50		t5_2t659	False
1373808593.0	1i9wdz	I know this is an uncommon opinion but this is how it often feels like living in the Bible Belt [One Click]		256	41	14		t5_2t659	False
1371231156.0	1gcm4l	Yet another piece of Nazi bigotry from /u/jij. When will it end?	fbackwardsRed	236	23	15		t5_2t659	False
1370505211.0	1fs1ow	Graphical Depiction of the Mothership Drama	americansuperpower	239	24	22		t5_2t659	False
1365601531.0	1c28nq	Does this offend you too?	juggaloholocaust	247	32	43		t5_2t659	False
1371475485.0	1giicg	Finally, /r/atheismrebooted is posting REAL atheism.	dustinyo	261	48	39		t5_2t659	False
1367953983.0	1dvodh	I came up with this quote just a few minutes ago	SorryButThereIsNoGod	248	34	26		t5_2t659	False
1358297764.0	16njz8	Good Guy Nero	Smoke_deGrasse_Sagan	240	27	17		t5_2t659	False
1358744615.0	16z0ma	Is anybody else the bravest fourteen year-old they know?!	LowlifePiano	236	27	23		t5_2t659	False
1365085881.0	1bnug1	New FB profile picture.	larg3-p3nis	252	41	28		t5_2t659	False
