created_utc	id	title	author	ups	downs	num_comments	selftext	subreddit_id	is_self
1347553142.0	zttgu	Dear r/magicskyfairy: I was BRAVE today	meowmeow85	134	12	19	"Gather around scientists as I tell you a harrowing tale of bravery coming straight from the underground. It was lunch, I was hungry, and a SAP needs to eat. While driving I saw a popular food van, however this time it was parked at a church, A CHURCH. Let that sink in for a second. The gurgling in my gut told me I needed food though, despite downing a bag of Doritos an hour before. I had no choice, I had to go into enemy territory. 

I was in a line with about 20 people when it was my turn. The situation was tense, I was on deadly ground, the lion's den if you will, with my Cannibal Corpse shirt. I felt like a naked woman in Riyadh. My extensive military career with Battlefield 3 DLC (seriously fuck EA for making my mom pay for extra maps) has taught me that this was not a good position to be. Spawn camping wouldn't get me out of this pickle. But yea as I walk through the valley of the shadow of irrationalism I will fear no fundies for Sagan art with me. As I ordered my food I asked for some Mountain Dew. They said they only offered Coke, Diet Coke, Sprite and Fanta. My heart sunk. There was no wind in my cosmic sails. I will sail nevermore. I felt crushed, friendzoned even. 

Reluctantly I ordered a Coke and received my Devil Crab wad. I looked at it and couldn't help but feel my conviction growing. The Devil isn't real. I tasted the Devil Crab, but it turned into Chik-fil-A in my mouth. I saw the young lady that gave me the food had a cross necklace, this was the last straw. I stroked my neckbeard, wheezed to arch my shoulders and very loudly proclaimed ""MA'AM I AM AN ATHEIST"" and I threw it on the ground (LOL DAE Lonely Island).

There was a lot of confusion, left and right, I could see the glares. I asked Hitchens for strength, for my life may have been at it's end. Then the unexpected happened. A couple of people started to whistle and cheer. Others started clapping, hoopin and hollerin, even the preacher. There was a funeral being held, since I knew Science I punched the dead man right in the fucking sternum and he woke up (lol these skygeese were praying their fairy daddy would bring him back).

As I stood there with a feeling of accomplishment, the lady who gave me the ~~devil~~ crab tore off her necklace. She sensually licked the Doritos dust from my fingers and slowly went down. I motioned for a brown girl who may have been Muslim or something, who cares, she was brown. She tore off her hijab and burka thing to reveal a beautiful bellydancer who had boobs I might add. She helped lift up my gut so the first fundie could have access to my ""Rod of Reason"". After barely 15 seconds the friendzone was shattered by my explosive *LOGIC*. Though it wasn't much logic because I had been masturbating for hours in my moms basement beforehand, was pushing rope. Still it was enough logic that I could convince them to vote for Obama.

TL;DR : It took me 15 seconds to bust my load but, it takes you only 5 minutes to read.

EDIT: I told this on facebook and my fundie mom is throwing me out for  my ""poor behavior"" (i.e. BRAVERY), can I shack up with one of you? Maybe filletsack or twentyone_21?

EDIT 2: Downsagans really?

Edit 3: Wow frontpage, you guys are the best."	t5_2t659	True
1344259715.0	xrivh	The MOST IMPRESSIVE part of NASA accomplishing something monumental	seinfan9	146	25	16		t5_2t659	False
1375024306.0	1j7ufz	Came across this peer reviewed article today, don't let your funDIE mUM make you shave	Agnostic_Thomist	150	26	16		t5_2t659	False
1372255893.0	1h3woh	You should see their faces when I wear this to school!	these_mods_suck	140	15	43		t5_2t659	False
1371397262.0	1ggi32	converting funDIES day by day	OfficerTwix	146	25	5		t5_2t659	False
1371240634.0	1gcyp0	Woah, has anyone else ever noticed this?	Kelmon	133	14	9		t5_2t659	False
1368451678.0	1e8r1u	RELIGIONS ARE ALL LE CULTS	StupidIntellectual	139	20	14		t5_2t659	False
1366670584.0	1cw8g0	So I was pointed here and told to repost this... here goes.	Coyote27	131	10	17		t5_2t659	False
1366286656.0	1cln1q	A new career in professional quote making has begun.	elbythirtysix	141	6	42		t5_2t659	False
1364225754.0	1az78v	THE SCIENTIST PIG	Gaylord666	135	11	25		t5_2t659	False
1363499368.0	1agaie	I'm just not as buh-buh-buh-brave as some of you ;_;	N-e-i-t-o	136	15	14		t5_2t659	False
1359988133.0	17v85k	I came	mongzords	145	23	11		t5_2t659	False
1357918657.0	16dsgt	WTF?!??!! CODE RED!! CODE RED!!! R/FUNNY HAS BEEN OVERRUN WITH THEISTS!!!!!!	ProfessorDerpenstein	136	15	13		t5_2t659	False
1357665722.0	166xim	SCUMBAG CHRISTIAN 	Unlinkedhorizonzero	147	21	12		t5_2t659	False
1352472909.0	12wxp8	Have you ever wanted to be as brave as the top posters on r/atheism? Here you go!	CinLordOfGwynders	143	19	37		t5_2t659	False
1350778106.0	11tksd	MFW a fundie tries to convert me	RomeoZedman	133	13	24		t5_2t659	False
1349787413.0	116yxx	A true warrior of logic and reason (from r/confession)		138	15	48		t5_2t659	False
1339249289.0	ut527	Congratulations, /r/MagicSkyFairy: you are today's subreddit of the day!	PotatoMusicBinge	145	22	28		t5_2t659	False
1338498991.0	ueia1	A skytheist on FB? THANK YOU FOR THE FREE KARMA	LunaRosa	125	3	3		t5_2t659	False
1376433500.0	1kb65w	How euphoric?	DAE-atheism	137	19	17		t5_2t659	False
1363529124.0	1agpbw	TIL Count Dracula has a PhD in reason	vileevillevi	137	14	18		t5_2t659	False
1360702792.0	18edkd	I posted this le gem on Facebook so I can weed out all of the fundies.	dustinyo	132	11	12		t5_2t659	False
1357271782.0	15xiwt	There's so many jerks here I don't know where to post it.		135	11	39		t5_2t659	False
1351309042.0	125r0h	My favorite movie.	twentyone_21	131	10	5		t5_2t659	False
1346811920.0	zde2v	The ONLY brand of hardware trusted by atheists		139	18	3		t5_2t659	False
1345782352.0	yqkb2	I never knew Jack Black was a scientist.	lemonfreedom	133	15	14		t5_2t659	False
1369226069.0	1etwdh	Euphoric Fashion Tips: The camo fedora, for when you need to disprove fun[DIE]s on a safari.	Seadrake	131	11	10		t5_2t659	False
1367142294.0	1d9kc4	BRAVEST. CAR. EVER.	numandina	135	13	21		t5_2t659	False
1362937837.0	1a15kn	Checklist to see if your neighbour is a terrorist!	Atheist_Smurf	142	22	26		t5_2t659	False
1353388130.0	13ht52	This is all atheism.  WHERE DO I SIGN UP??	gruhfuss	141	19	30		t5_2t659	False
1350410587.0	11kxiv	Ricky GerBRAVE is at it again, smashing faith on twitter.	twentyone_21	144	24	47		t5_2t659	False
1346420943.0	z4v1m	My crusade against fundies on Facebook continues.	Who_is_Zander	183	61	30		t5_2t659	False
1340799204.0	vojhk	This LITERALLY happens all of the time in their backwards cultures.	twentyone_21	136	17	7		t5_2t659	False
1370918519.0	1g3cdv	This is what religion has done to us. (slightly NSFW)	CosmicGuts2323	132	12	24		t5_2t659	False
1370899392.0	1g2m96	Wow, his speech is so relevant today!	WorldOneWon	130	11	12		t5_2t659	False
1370278527.0	1fl9cj	I am an atheist... ... for Euphoria, she calls to me.	titan413	131	12	29		t5_2t659	False
1368702425.0	1eg06t	Found this brave le gem today	Agnostic_Thomist	136	16	34		t5_2t659	False
1364248912.0	1b01o8	Since discovering r/atheism, I have let my intelligence blossom, and my beard run free. 	so_valid	137	14	16		t5_2t659	False
1363905493.0	1argte	The difference between us and them	this_is_a_sign	130	11	21		t5_2t659	False
1362881821.0	1a04bn	DAE Oppression?!	JuggernautClass	128	12	21		t5_2t659	False
1362506244.0	19pvfj	DAE SCIENCE?	meowmeow85	129	12	9		t5_2t659	False
1362412139.0	19n4sv	Some stone-cold logic from one of my favorite Scientific journals.	Jimbohones	130	10	16		t5_2t659	False
1360851690.0	18ij4v	TIL the flag of S[weed]en is a fallen cross (symbolising the downfall of fUNDIE oppression) on a blue blackground (which symbolises the democrat (read: atheist/scientist) party). [x-post /r/circlejerk]	Cilibinarii	146	23	6		t5_2t659	False
1360765088.0	18g17e	Atheist Mom	dustinyo	140	20	14		t5_2t659	False
1355938285.0	1548e9	This is Atheism.	filletsack	135	17	13		t5_2t659	False
1355391387.0	14s1bg	Burger King? More like OPPRESSION King!!!	Who_is_Zander	136	18	49		t5_2t659	False
1353125765.0	13c5qx	[MOD POST] We hit 5000 faith smashers yesterday. Please circlejerk.	twentyone_21	128	8	32		t5_2t659	False
1352405606.0	12vgwl	There's atheism in here somewhere, I just know there is!	shameful_execution	129	11	16		t5_2t659	False
1346965110.0	zgvzf	Try and tell me atheists are NOT the most persecuted group of people. I dare you.	EnlightenedYouth	137	19	29		t5_2t659	False
1344087122.0	xo4jq	My little scientist protesting ChicKKK-Kills-Gays. She LITERALLY understands what's going on.	seinfan9	142	24	17		t5_2t659	False
1374581452.0	1ivo8j	Being a head of state or being a Christian, pick one skytards	Agnostic_Thomist	135	17	4		t5_2t659	False
1370543565.0	1ft2ik	/r/atheism censored my faith-shattering meme due to mod oppression. Is it welcome here?	Pro_Quote_Maker	136	18	7		t5_2t659	False
1367170211.0	1da4sb	IAMA AMA Request: NukeThePope	Crazybay46913	136	18	54	"* How do I le brave like you?

* Why are so few atheists real and smash faith like you?

* What makes atheists better than everyone else, and why is our extreme intellect?

pls respond"	t5_2t659	True
1355774622.0	150chm	I lost a few facebook friends that day.	gfour	181	62	48		t5_2t659	False
1353029062.0	139ug3	DOLLAR TREE IS LITERALLY OPPRESSING ME RIGHT NOW.	gruhfuss	131	12	7		t5_2t659	False
1352867596.0	135yk0	Wow fuck you guys	MegaAtheist	138	19	52	"I used to be atheist and am now a Christian but you guys are fucking disgraceful! 

Atheists like you are part of the reason I went back but the main reason is that you and all atheistson reddit are stupid and just don't fucking understand what religion is really about, 

There's more to it then a ""magicskyfairy""

I'm sorry but I'm just pissed. If you want to have a real discussion then PM me."	t5_2t659	True
1347394768.0	zq69i	TIL 9/11. DAE 9/11??	gruhfuss	135	17	15		t5_2t659	False
1336794173.0	tj80w	I'm not a skilled photoshopper but it needed to be done...		127	8	10		t5_2t659	False
1373321268.0	1hw66u	Please peer-review my dissertation	these_mods_suck	135	17	29		t5_2t659	False
1365361027.0	1bv739	How I feel working in an office full of fundies who are euphoric because of a phony god's blessing	420BLAZE_IT_FAGGOT	127	11	8		t5_2t659	False
1357254891.0	15wzfn	This is DEFINITELY related to atheism!	Hk37	139	22	73		t5_2t659	False
1354284932.0	141vl1	South Park on middle eastern illiterate fanatical peasants	maxlaser	123	6	7		t5_2t659	False
1354202634.0	13zvi9	CSI: Dawkins		135	15	20		t5_2t659	False
1350459934.0	11mcmi	This egregious friendzone never would have happened if the girl had been a REAL scientist.	DemanRisu	132	11	19		t5_2t659	False
1344724302.0	y2eyt	My son is so brave when he pretends to read	rpsayshi	124	10	28		t5_2t659	False
1374082868.0	1ihz4u	MFW r/atheism no longer default sub-reddit.	Drpackman5000	135	17	10		t5_2t659	False
1371224640.0	1gcdle	Mfw /u/jij literally oppresses my memes	theKgamer72	130	12	0		t5_2t659	False
1370755186.0	1fyv2y	Came across this GEM	twentyone_21	132	16	7		t5_2t659	False
1370014802.0	1feqcq	No one else stood a chance in the quote-off...	JABernz	127	11	16		t5_2t659	False
1367866108.0	1dt3k6	The Saganometer is falling fast. Emergency Imgur album of bravery: Activated	kettesi	132	14	34		t5_2t659	False
1364142421.0	1ax2ql	NDT WITH SNACKS	Gaylord666	132	13	15		t5_2t659	False
1357094745.0	15sxjr	I've finished my dissertation.	Serotone	130	14	10		t5_2t659	False
1372324584.0	1h635x	MFW downvoting all of /u/jij's comments.	badlucklincoln	133	17	8		t5_2t659	False
1369762699.0	1f7lmj	DAE have logic and rationale????	douggie2194	128	16	15		t5_2t659	False
1369479169.0	1f0w38	LOL stupid funDIEs! I better post a meme about it on reddit so all my friends will convert to atheism.	OccupyTamriel	134	21	17		t5_2t659	False
1366208654.0	1cj7jq	Destroying fundies = Bravetheism. Give me my Sagan medal please.	faithsmasher9001	133	21	17		t5_2t659	False
1366120045.0	1cgkmn	I modified it for EXTRA BRAVERY!	haikuginger	136	22	20		t5_2t659	False
1359338378.0	17ehr9	Deal with it, fundie.	gogannamide	132	16	37		t5_2t659	False
1356890343.0	15ohxj	Boom. Load of logic right in your face.	gruhfuss	136	20	18		t5_2t659	False
1351620511.0	12cl2c	DAE think fundies = fun dies?	gruhfuss	124	10	12	Hit that upSagan or you hate logic.    	t5_2t659	True
1341329831.0	vzdgp	Presented without comment.	Serotone	137	25	25		t5_2t659	False
1337179712.0	tq099	Stupid Christians	spudmaster34	136	22	6		t5_2t659	False
1375838848.0	1jupt3	DAE gOD doesnt real #oneclicknation #fuckjij	breakingmad1	131	18	12		t5_2t659	False
1373470594.0	1i0gur	S[WEED]ish chef pwns fundies with this logic.	Kelmon	128	15	10		t5_2t659	False
1369408983.0	1ez3rl	Telling it like is to fundies	donkey_punch_kong64	123	10	23		t5_2t659	False
1363479693.0	1afrij	Told that fundie where to go.	3brave5u	121	6	8		t5_2t659	False
1353738789.0	13pe26	Bravery bear on rELIGIOUS sheeple	shameful_execution	121	9	21		t5_2t659	False
1351717274.0	12f4i4	Take note, THIS is how you Atheism. 	Old-Ben-Kenobi	135	22	53		t5_2t659	False
1350946179.0	11wnbi	Whenever I see a screenshot like this, I know that it's just Carl Sagan being modest and trying to make himself anonymous.	DemanRisu	121	7	6		t5_2t659	False
1349482522.0	110qmk	Christians are so dumb! They haven't even memorized all of Hitler's inspirational quotes!!!	pheakelmatters	129	15	36		t5_2t659	False
1348667941.0	10i8ji	GOOGLE is using their SPELLCHECKER to shove their RELIGION down my THROAT	RomeoZedman	127	15	4		t5_2t659	False
1348082846.0	105g8m	Religious people literally torch cities	EnlightenedYouth	123	11	23		t5_2t659	False
1347286147.0	znioy	Just finished my dissertation.	MichealJacksonXD	129	17	28		t5_2t659	False
1375054716.0	1j8qvf	I've never seen le braver true qoute by Neil LeGrasse Tyson	le_swagger	132	19	14		t5_2t659	False
1374946919.0	1j643c	My atheist dad died of cancer last week. He gave me and my autistic brother this advice on his deathbed.	FrenchfagsCantQueue	137	25	17		t5_2t659	False
1373309494.0	1hvq2u	/u/jij didn't expect this [One Click]		137	26	12		t5_2t659	False
1373229483.0	1htjbp	"93% of atheist teenagers have started making ""Number of _______"" posts, which are dominating MSF, the last bastion of atheist freedom. Upvote if you're one of the 7% who still like maymays."	LeMayMayPoster	137	25	12		t5_2t659	True
1372431568.0	1h91qr	it reminds you of how small you are	srsly-4-dorkz	135	22	30		t5_2t659	False
1366319728.0	1cmsj9	gOD's to-do list	FlyingJ747	122	12	13		t5_2t659	False
1365168235.0	1bqbpf	Something something Mormons mumble.	Lord_Mahjong	134	16	21		t5_2t659	False
1364824720.0	1bf76q	His fundie mom was so pissed about his bravery	ler_hit	120	8	18		t5_2t659	False
1360015764.0	17w4kh	I didn't know Richard Dawkins was a scientist	3brave5u	123	13	12		t5_2t659	False
1358017006.0	16g4mk	RED ALERT! RED ALERT! THIS IS NOT A DRILL! ALL MEMBERS OF THE 305th NECKBEARDS REPORT TO BATTLESTATIONS! ARM YOURSELF WITH ALL THE LOGIC AND REASON YOU CAN CARRY!	meowmeow85	129	14	14		t5_2t659	False
1356632198.0	15j1bi	Devil &gt; gOD	50shadesofbrave	127	11	22		t5_2t659	False
1356605397.0	15ijep	Want to only pay 3% of your tax ??	juggaloholocaust	136	24	46		t5_2t659	False
1354614275.0	1497l0	MFW bronze-age fairytales santa claus invisible pink unicorns	crushthehorns	127	13	15		t5_2t659	False
1352836664.0	135014	We are not brave enough, so for every upvote I get on this literal le gem, I will donate 10 billion dollars in order to raise the amount of Kilosagans in the Saganometer. Hurt me good, /r/magicskyfairy		125	12	10		t5_2t659	False
1347408789.0	zqlop	Atheists: 1; Christians: 0	Paul7185	147	34	27		t5_2t659	False
1346686633.0	za7r2	As a scientist, I have a confession to make	RomeoZedman	136	20	14		t5_2t659	False
1375279928.0	1jf6oe	Why is it okay to convict and sentence Bradley Manning while jij brazenly gets away with mass murder?	EnlightenedYouth	128	17	13	####SAGAN DAMN AMERIKKKA FOR CHOOSING BARRABAS.	t5_2t659	True
1374596727.0	1iw4o0	This is why we need to keep fighting the good fight! [One Click]		131	17	25		t5_2t659	False
1372440282.0	1h9csg	The assassination of Skeen by the coward Jij		126	15	14		t5_2t659	False
1370741155.0	1fyhj9	Upsagan this if you are a strong, indepen[ent] scientist who don't need no mOD.	suspectation	122	10	5	Upsagans to the left. You know what to do. Fuck funDIE mods.	t5_2t659	True
1370360758.0	1fnnum	I'm not gonna be part of your system!	OccupyTamriel	125	11	14		t5_2t659	False
1367344989.0	1dfb0t	Ricky Gerbrave does it again!!	faithsmasher9001	126	15	19		t5_2t659	False
1366028377.0	1cdvbo	I have been exiled from the Mothership.	Lord_Mahjong	127	15	38	Pour out a Big Gulp of Mt. Dew for me, my fellow logicians.  [I think they were displeased with my offering.](http://www.reddit.com/r/atheism/comments/1ccdiv/neil_tells_it_like_it_is/)	t5_2t659	True
1365005790.0	1blfkt	Le fundies should've known not to mess with me		123	11	30		t5_2t659	False
1364439586.0	1b5l82	This is relevant to Atheism. 		122	11	14		t5_2t659	False
1364401836.0	1b48tp	Why April Fools is a Religious Holiday	EnlightenedYouth	136	24	22		t5_2t659	False
1363668446.0	1akqi1	"""Confession Bear"" says religious people are automatically dumb, part XXVIII"	4-6forceout	139	24	33		t5_2t659	False
1360781174.0	18gjpy	Bradley James Peterson was literally so right about everything in this masterpiece.	3brave5u	126	15	26		t5_2t659	False
1357734835.0	168uqe	As an atheist,	blitz79	127	16	20	Edit: OMG frontpage? Thanks guys!	t5_2t659	True
1355558233.0	14vylh	College = cHURCH	EnlightenedYouth	131	18	19		t5_2t659	False
1348597319.0	10gng4	DAE think the LIEble and quran are full of bullshit? Upsagans to the left.	Nubthesamurai	130	17	23		t5_2t659	False
1372477355.0	1hajx6	On Tuesday, there will be 30 000 brave scientists watching the Texas Rangers in Arlington	trollunit	120	12	9		t5_2t659	False
1370800207.0	1fzoy6	Jij is LITERALLY hitler	btingle	118	11	18		t5_2t659	False
1369615263.0	1f3yx3	So a gay atheist scientist and a fUNDIE muslim walk into a hospital...	OH__THE_SAGANITY	121	13	48		t5_2t659	False
1368258269.0	1e4bfr	Mother of Hitchens. It all makes sense now. [FIXED]	occupy_this	121	12	13		t5_2t659	False
1367166060.0	1da07u	This is literally Atheism.	bodom2245	126	17	9		t5_2t659	False
1366465390.0	1cqnk6	CONFIRMED: MARK ZUCKERBERG IS A SCIENTIST!!!	three_am	130	16	18		t5_2t659	False
1363847009.0	1apwhs	Euphoria : now available as a tattoo 	zimm3rmann	122	11	30		t5_2t659	False
1363198381.0	1a8975	I WILL NEVER HIRE A FUNDIE 	Dickton_Bungeye	130	18	36		t5_2t659	False
1358953706.0	174hjp	Needless to say, this was deleted seconds later	dustinyo	130	18	18		t5_2t659	False
1357667002.0	166yvm	Sagan came to me in an experiment last night	McFlippyhoo	119	10	6		t5_2t659	False
1349622941.0	11385r	My [f]irst time being [le] brave. Please be logical.	meowmeow85	124	14	21		t5_2t659	False
1346080682.0	ywn52	ATHEISM BECAUSE RAPE		131	20	52		t5_2t659	False
1330854339.0	qh1ao	We had a visit from Sir Professor Richard Dawkins today, and he had a message for us	neotek	122	8	4		t5_2t659	False
1375811048.0	1jtosb	Literally this	Doctor_Chill	134	25	12		t5_2t659	False
1370634165.0	1fvs85	Can we get Skeen as a moderator here?	IamActuallyJoeBiden	120	9	7	"I know the mod list is decently large, but could we invite /u/skeen to be at least some sort of mod here? I really liked his free and open policy, and so long as no one requests his deletion from this one we could be just as good as /r/atheism in its heyday.

After all, /r/atheism was a key step for me in shedding religion- and honestly most of what got me to really start thinking about my beliefs (or lack thereof) were the memes and Sagan/Gervais quotes.

We owe this man more than money, we owe him our upvotes."	t5_2t659	True
1369788181.0	1f8jhu	The only gOD I worship #TYBG	srotidderkcuf	126	20	15		t5_2t659	False
1365545762.0	1c0qw7	TIL that Pitbull is an atheist!	Falafeltree	119	11	34		t5_2t659	False
1361485778.0	18zdgu	Urban Dictionary, now there's a site that truly understands religion	farangiyeparsi	124	12	22		t5_2t659	False
1360047636.0	17x6v7	STOP OPPRESSING ME IN N' OUT, YOU'RE LITERALLY RAPING ME	andrewjackson5	122	10	18		t5_2t659	False
1358524708.0	16tkfu	A love letter to the scientists of Reddit	Ushankaclock	125	15	14		t5_2t659	False
1356545514.0	15h655	YOLO Bravery	rzw	143	30	15		t5_2t659	False
1355282743.0	14pe98	DAE Science????	Kellerbier	125	17	12		t5_2t659	False
1345738518.0	yp9p8	Le me took the red pill	siegfryd	126	15	21		t5_2t659	False
1374957928.0	1j6fmf	lol I posted it again! 2edgy5me	Agnostic_Thomist	152	41	12		t5_2t659	False
1373474911.0	1i0mqq	DAE gOD is a murderer? (bonus: majestic neckbeard)	3MinuteHero	124	16	24		t5_2t659	False
1372356319.0	1h6y6e	How did we not see this coming?!?	WorldOneWon	121	12	6		t5_2t659	False
1370093138.0	1fgofe	Need I Say More?	Subotan	133	24	19		t5_2t659	False
1364311031.0	1b1mg9	"""A downvote won't stop the coming enlightenment."" - Can this be our new slogan?"	JuggernautClass	122	13	17		t5_2t659	False
1363742231.0	1amtmc	Fuck you Mom! (please don't tell her I said that!)	WorldOneWon	122	13	24		t5_2t659	False
1363033295.0	1a3neb	Seth MacFarlane?  He.  Gets.  It.	Lord_Mahjong	128	17	16		t5_2t659	False
1360381362.0	186az9	Good thing nobody sneezed in front of this funDIE during the recordings 	deprivedaccountant	121	13	12		t5_2t659	False
1359847670.0	17s0k6	Atheism or rape. Pick one.		127	19	12		t5_2t659	False
1359627562.0	17mfm1	Fixed.	Serotone	125	18	10		t5_2t659	False
1359283783.0	17d4y3	Since I am officially banned from the mothership; en memoriam, I will share my bravest post of all time.	sexyhamster89	132	23	43		t5_2t659	False
1352046090.0	12m6of	Le bravery 	twentyone_21	132	23	44		t5_2t659	False
1347809289.0	zz1xx	My fundie parents made me go to church today (because I'm 12). Thank Sagan for my smartphone.	shameful_execution	139	27	13		t5_2t659	False
1343498660.0	xb0q3	A poem about religion		123	13	19	"Roses are red
Violets are violet
Religion is stupid
Upvotes to the left"	t5_2t659	True
1370375209.0	1fo7aa	Respect for this guy!	donkey_punch_kong64	120	13	23		t5_2t659	False
1355072250.0	14jwod	Fundies are LITERALLY Opressing my Youtube Free Speech Rights	thernkworks	118	12	36		t5_2t659	False
1351596628.0	12c013	"Firefly - I wish I could watch it again for the first time.
"	juggaloholocaust	117	10	10		t5_2t659	False
1349890956.0	119g2l	yeah fuck yeah atheists, all over my body.	EnlightenedYouth	120	12	30		t5_2t659	False
1328054157.0	p5aut	This bravery will not go unrewarded	bobappleyard	115	8	14		t5_2t659	False
1372352222.0	1h6siw	SkyfunDIEs know nothing about morality	these_mods_suck	128	19	20		t5_2t659	False
1371913954.0	1guwde	To summarize...	ICanHazTP	121	16	15		t5_2t659	False
1370624661.0	1fvex4	MFW I pwn some fundies	yourbloodyvalentine1	124	19	1		t5_2t659	False
1369740273.0	1f6yzr	Two brave Atheists debunk the beliefs of Mormons with reason and logic.	OccupyTamriel	129	21	34		t5_2t659	False
1369542765.0	1f2fhk	r/magicskyfairy has a new magazine. Take a look at the cover!	twentyone_21	138	28	21		t5_2t659	False
1349037308.0	10q4mn	Cards FOR humanity.	CircleJerkAmbassador	134	23	11		t5_2t659	False
1334595738.0	scm9r	"TIL ""thinking for yourself"" equals agreeing with r/atheism. "		126	19	24		t5_2t659	False
1373543725.0	1i2pa4	MFW Fundies Try to Debate Me.	liberterrorism	122	13	7		t5_2t659	False
1370660335.0	1fwn1b	Lest we forget what he gave his life for.	EnlightenedYouth	110	5	10		t5_2t659	False
1370397132.0	1fozac	Fuck it, any ladies of /r/magicskyfairy want to have an intentional pregnancy aborted at a heavily protested abortion clinic?	twentyone_21	124	20	42	"[I am moderately attractive and clean](http://www.reddit.com/r/atheism/comments/1fok1e/fuck_it_any_ladies_of_ratheism_want_to_have_an/), but if you prefer artificial insemination I am open to negotiation. I will pay the cost of the abortion as long as I can keep the remains in a small jar.

I haven't really thought out any of the ethical ramifications of this yet, but I mostly want these people to know that at least one baby was intentionally conceived and aborted because of their actions."	t5_2t659	True
1370037015.0	1ffhto	This bumper sticker is giving me a braverection.		118	12	23		t5_2t659	False
1360166787.0	1805l1	TV is all the proof I need.	dustinyo	121	13	12		t5_2t659	False
1359087998.0	178kq4	SCIENCE BITCHES	CircleJerkAmbassador	115	11	16		t5_2t659	False
1356188054.0	15a4rh	Rob DenBleyker, Ph.D. pwns some fundies via the second-bravest medium, Twitter.	faithsmasher9001	119	15	4		t5_2t659	False
1355427358.0	14steg	Baby's First Faithsmashing Meme	EnlightenedYouth	123	15	19		t5_2t659	False
1355170932.0	14meek	My fUNDIE parents totally oppress me, so i made this Le gem memeface to show my superiority as an atheist	Not_Blittzcrank	122	16	16		t5_2t659	False
1352951772.0	137zyr	Every once in a while, I get that defeated feeling that we simply cannot outjerk the mothership	fagiupronsdotjpg	116	11	28		t5_2t659	False
1349193608.0	10tkz7	Found this on facebook.	FMCSIMMONS	116	6	19		t5_2t659	False
1336008330.0	t4bvf	IAmA well-adjusted individual and in no way a needlessly confrontational sociopath AMA	Carl_DePaul_Dawkins	117	13	9		t5_2t659	False
1376281567.0	1k6r3s	Not sure what's going on... but still very atheist.	bunker_man	132	24	11		t5_2t659	False
1376116549.0	1k2t79	Inspiring quote from the Dawk	ActuallyDavidCrosby	126	21	7		t5_2t659	False
1374033033.0	1igp0j	MFW my friendzoning grandma invites me and my bro to church	NukeThePoop	122	15	2		t5_2t659	False
1372703060.0	1hfw0i	Le NukeThePope Memorial in Stockholm, Sweden	EnlightenedYouth	116	13	17		t5_2t659	False
