created_utc	id	title	author	ups	downs	num_comments	selftext	subreddit_id	is_self
1357280929.0	15xs16	I have a question involving tungsten, can anyone here help me?	pookymama2007	9	4	20	"Hey, went looking for a subreddit to help me, and I'm hoping I've found it!

I work in a movie theater, and I've received permission from my boss to take some of the tungsten from burned out bulbs.  What I would LOVE to be able to do with it is turn it into wedding bands for my husband and I.  Currently we're wearing silver celtic knot bands bought cheaply from two different random mall stands.  They're lovely and mean a lot to both of us, but we'd like something that's a little more... sturdy.  My husband's band is flattened on the bottom from drumming.  :/

Does anyone here know how to work with tungsten?  If not, could anybody point me in the direction of someone who could take the metal I have and turn it into new wedding bands?



I apologize, profusely, if I'm asking in the wrong place.

Thanks for taking the time to read this!

*Quick edit - I have to head to bed right now.  In hindsight, I probably should have submitted this in the morning.  So, I'll be back some time tomorrow to see if anyone replied.  Thanks again and again for taking the time to take a peek."	t5_2qkuc	True
1356652265.0	15jm34	help determining how I should fasten together my DIY bedframe...	umlikewhateverok	6	1	15	"hi!

I'm looking at constructing my own (metal) bed frame and have already drawn up a plan using google sketchup. I'd like to move forward with my plan but before I do so I was wondering if I could get some advice on how best to join together the various pieces of my frame. 

[Here](https://www.dropbox.com/s/rsesv1q5xbrzjmb/bedframe.skp) is the google sketchup file for my bed frame. 

As you can see, there are 4 pieces: a 'footboard,' two side-rails, and a 'headboard.' I'm trying to figure out how to best join the side rails to the foot and headboards so that they maintain structural stability and don't end up collapsing. 

For what it's worth, I plan on making this frame out of 1/8th inch steel , powdercoated. 

In my current plan, I've extended two 'arms' on the side-rails to allow for bolt space. Would four bolts (two connecting to the headboard and two connecting to the footboard) per side rail be sufficient? 

let me know if you have any questions... I'd really appreciate any help with this endeavor! 

thanks! :) "	t5_2qkuc	True
1355450948.0	14tji8	Have a Machine Shop?  I need 100 brackets !	TwixSnickers	9	3	27	"[Imgur](http://i.imgur.com/feziQ.jpg)

I was hoping a hobbyist could take a crack at this.

I need these in stainless steel
How much would you charge?  "	t5_2qkuc	True
1353909325.0	13st6l	How do I go about melting a (bronze) cymbal?	fwubglubbel	7	1	17	"I am building some wooden side tables (probably oak) and I have some old cymbals. I am toying with the idea of carving channels in the wood and melting bronze to make some cool patterns in the table tops. 

I have some experience welding with bronze rods, and my welder friend has offered to help. What do I need to know? It can't be as simple as melting the cymbals with an acetylene torch, can it?
"	t5_2qkuc	True
1353790794.0	13q8b4	Alternative chrome plate/dip methods? Asking for a friend. 	dobedos	7	2	9	"I'm not sure the right subreddit for this topic, but I (and a friend) need some help to complete a project soon. 

Heat and cost are big issues because what we would like to chrome are 3d prints. One of them is powder, the other plastic. Is there possibly some offshoot way to achieve a chrome like finish (appearing to be solid) without resorting to those rattle cans? Or potentially damaging heat/chemicals that would ruin the prints underneath? 

Thanks so much in advance! (Let me know if there are better subreddits for this question, too? I'm going to x-post in r/crafts right now.)"	t5_2qkuc	True
1351334676.0	12639g	Belt Sander?	Mischeviousman	7	0	6	Hey /r/metalworking I'm in the market for a Belt Sander, At first I was thinking I could just make one for cheap, but there's some pretty cheap ones on harborfreight's website. I have one concern though, would this be for woodwork or metalwork, as I have never owned or used a beltsander. I was looking at http://www.harborfreight.com/garage-shop/stationary-sanders/1-inch-x-30-inch-belt-sander-2485.html which seems nice and cheap, and I was wondering the alternatives to buying this, or building one myself. This seems alot cheaper than building one myself to be honest, and alot easier than making it also. As above I was stating that I was wonder whether this would be for metalwork or woodwork, so I am assuming that all I would have to do would be to switch out the belt for either? 	t5_2qkuc	True
1351286756.0	1257yu	Does anyone have any suggestions on what I could do or make from these.  	ky420	9	3	23		t5_2qkuc	False
1348849273.0	10mhfr	How much brazing time do you think I can get out of tanks this size?	cweeks2	7	1	6		t5_2qkuc	False
1343897780.0	xk05l	Working with aluminum question and a few others...	mudslag	6	1	9	"Im a noob with metal working and Id like to know how to get this darken affect like in the following image. The aluminum was punched with metal punchs and the punched numbers are darkened some how. Whats the process for doing that and can that process be applied to other cutting/punching methods?
http://imgur.com/6ltw7

Also Im having a hard time understanding the different levels of hardness for aluminum. Im looking to get some pieces to test with from [onlinemetals](https://www.onlinemetals.com/merchant.cfm?id=68&amp;step=2&amp;top_cat=60) but I dont know whats a good simple one to get that will work for punch sets and other similar marking aspects from a hardness POV.

Lastly (for now) whats the process called when you heat metal up with a torch and discolor the metal? Iv used the process on some zinc covered steel key stocks but can that process also be done on aluminum and stainless steel? 



Thanks"	t5_2qkuc	True
1342471399.0	wnvjv	Making rings and other jewelry	This_is_Tiring	8	2	11	"Right now I've got a homemade forge setup, and I've been doing some work with dowels and railroad spikes. I'd like to also like to make some rings, maybe even getting up to more (seemingly) difficult projects like a crown or tiara. 

My main questions would be, is anyone here aware of some good books or reliable websites for a beginner? What materials and/or tools would you suggest for a beginner?"	t5_2qkuc	True
1340813541.0	vovau	how many times can a low temp solder be used as a casting material.	relbeek	7	1	1	pewter solder has been used for a while and gone through many molds. how often should your casting material be changed.	t5_2qkuc	True
1339655359.0	v1a9r	Carnival Game - Wacky Wire	SabinMoon	6	1	2	"I'm interested in building a custom version of the carnival game Wacky Wire, as I'd rather not pay top dollar for the manufactured one, plus, I imagine building my own would be a proud achievement. 

I'm a complete novice with metalwork, so I thought I'd turn to you fine folks. 
The only details to building your own that I've found online has been from [this thread](http://forums.makezine.com/comments.php?DiscussionID=850). There's a lot of information there, but I'm not entirely sure it's complete. 
More articles that may help: 
[Link](http://partylandutah.com/pdf/wacky%20wire.pdf) &amp; [Link](http://www.brightideas.ca/downloads/Smart%20Wire%20Brochure.pdf)

Any advice or suggestions would be great! 
Thanks!"	t5_2qkuc	True
1339289432.0	utxkf	Help! I refuse to get my dad another damn beer opener for Father's Day! He's recently taken up custom knife making and I'd like to get him a nice handle material to play with. (x-post Ask Reddit)	sadeami	8	3	15	"About a year ago my dad took up knife making from raw materials as a hobby. I've asked him several times about websites where I could maybe send him a gift from or any special bits he's been eyeing but he's not the helpful gift receiving type and because I know next to nothing about any of this I don't want to accidentally send him a piece of X, Y, or  Z he can't really use. I'd appreciate any suggestions for supply websites/product dimensions/things to avoid ya'll might have to offer.

EDIT: thanks everyone for the suggestions! There were a big help! I ordered a Damascus blade and some pretty stone handle bits. I'm sure he'll enjoy them!

Edit2: the gifts were a huge success! Thanks everyone!"	t5_2qkuc	True
1338410985.0	ucoir	I'm attempting to make a old style metal forge. Spot of trouble	sleepyfreshman	7	1	16	I am attempting to make a metal forge to heat and shape metal, and I am planning the forge, but I have no idea what material i should make the fire pot out of, or what to line it with to prevent it from melting, any advice on the subject would be VERY helpful.	t5_2qkuc	True
1337818517.0	u1wfq	Telescoping gauge techniques	CheckOutMyVan	6	0	10	"I'm in the process of rebuilding a vintage motorcycle and needed to check the cylinder bore size to determine if a re-bore is needed. We don't have bore gauges at work, so the next best thing is a telescoping gauge and a mic. I found that after multiple different readings the bore was .0005-.002"" over the upper limit, which means a re-bore (and another $150+ for a new piston and rings). Now, to get to the point... After bringing this up to a guy that's worked there for 35 years, he mentioned that the reading you get from a telescoping gauge depends on how tight you tighten the lock down, and should turn the thimble on your mic accordingly. I've heard him say this many times in the 7 years i've worked there, and have questioned it, but never really tried that technique until today. I measured the bore multiple times with different tensions on the tele gauge and it read exactly the same every time. I'm not one to believe someone based on the fact they've been doing it for a long time; I need visual evidence when it comes to situations like this. It's also hard to tell him he's straight-up wrong, when he's been doing it for so long. So, if anyone can give me some thoughts or techniques for accurate telescoping gauge readings, it would be appreciated. "	t5_2qkuc	True
1336794270.0	tj83f	How can I etch 530 steel? (x-post from blacksmithing)		12	5	7	"I have a favorite knife that I've had for years and has been with me through a deployment and I just got lucky enough to get it signed by Glen Marhevka and Scotty Morris-- lead trumpet and singer of Big Bad Voodoo Daddy, respectively.  
  
I want to permanently make the signatures part of the blade.  They each signed one side of the blade in black permanent marker, and I want to keep as much of the character of the signatures as possible. How should I best go about doing this?

Thanks in advance!"	t5_2qkuc	True
1336517514.0	tdp9v	Finishing steel	zeppelinfromled	7	0	6	"I'm just getting into metalworking, and I'm planning a project.  I would like to make some [supplemental kitchen counter space](http://i.imgur.com/yoclR.png).  I drew the model on Sketchup with just the idea, and I'm currently taking a metalworking class designed to teach the use of the metalworking tools in a shop where I'm a member (I'm much more familiar with the woodworking shop).  My initial plan was to make the frame out of 2"" square tubing, but it's become apparent that that would be overkill, so maybe I'll use something smaller (and cheaper).  I'm also realizing that the 45 degree shelf support will probably be unnecessary.  Either way, the counter surface will be a butcher's block top that can be flipped over to slow down wear, and I have yet to decide the details of the lower shelves.

But my question is about finishing it.  When I drew that model, my idea was to paint it with a flat black/gray color, but that just feels meh to me.  I think I'd like to grind/sand it down to a nice pretty silver and leave it that color.  It's not going to be immersed in water or anything, but it will sometimes be humid in the room (no AC in the house), so what should I do about rust?  Could I put a clear coat of paint on it?  If so, do you have any details/advice about it?  Can I do a spray-on clear coat?  Would I need primer?  Etc.  Any advice is appreciated (also critiques on the design are welcome)."	t5_2qkuc	True
1333637816.0	ruohd	My first ever welding project (Fine Arts/Sculpture major)	Ratatatertot	6	2	0		t5_2qkuc	False
1333248747.0	rn92v	hey r/metalworking know of any other subreddits 	TheRageMeat	6	0	6	Do you know of any other subreddits that are even loosely related to metal working or CAD? Any would be greatly appreciated. Thanks	t5_2qkuc	True
1314746000.0	jzk7l	For the Swarm buckle.	junglepoon	8	2	3		t5_2qkuc	False
1305661431.0	hdlyz	Thefabricator.com's New Metal Fabricating Glossary	ImSpicy	6	1	2		t5_2qkuc	False
1376465479.0	1kc3q4	Summer Camp Forge in need of tools list...	er21	8	2	3	Some of you might remember my old [Post](http://www.reddit.com/r/metalworking/comments/1jsjbb/metalworking_at_summer_camp/). To summarize I'm working to set up a metalworking forge at my local Boy Scout camp. So I'm working on the cost analysis to present to my BSA Camping Committee to try and convince them that we they need to spend money. In doing so I need to know the what kinds of tools we'll need. I've already accounted for safety equipment and the forge itself, and anvils. Sadly, I don't know what kind of tools will be needed so if you lovely folks could tell me that would be swell. We'll need any tools required to complete these [requirements](http://meritbadge.org/wiki/index.php/Metalwork), we'll do the blacksmithing subset. You're awesome! Thanks for everything!	t5_2qkuc	True
1373948974.0	1ie4kf	Cheapest way to go about this lathe spindle adapter?	Bulldogg658	6	2	9	"I need [one of these](http://www.amazon.com/PSI-Woodworking-L5818-Headstock-Shopsmith/dp/B000KIEC88/ref=sr_1_5?ie=UTF8&amp;qid=1373884946&amp;sr=8-5&amp;keywords=spindle+adapter) for my small wood lathe. This is the closest one to what I need but my spindle is 1/2"" smooth rather than 5/8"". I guess I see 3 options. Have one machined custom. Buy that one, fill the hole with metal epoxy and have it drilled to 1/2"". Have machined or find to buy a 5/8"" to 1/2"" bushing and drill a hole in it for the locking screw to pass through. 

I don't have a metal lathe so only the last option would I be able to do entirely myself. Are there any other options and of them all which would be the cheapest way to go? Assuming one of the first 2 options, would I be able to find anyone here to do the machining? 

Thanks"	t5_2qkuc	True
1372514914.0	1hb6nj	I want to work with titanium to make a ring with a wooden inlay. I understand I'll have to use a lathe because of it's melting point it's not worth to cast.	RetroYouth	6	1	13	"I'm curious if anyone has any ideas how I could get a wood inlay between two pieces of titanium and put them back together without cracking the wood. 

similar to this style ring 
http://www.ebay.com/itm/6mm-Gold-GP-Center-Strip-Inlay-Beveled-Edge-Tungsten-Carbide-Unisex-Wedding-Band-/161054857676?pt=US_Mens_Jewelry&amp;hash=item257f9e19cc

except with wood, I would have to have two pieces of Titanium and fit them together...right?  do you guys think that's  possible?"	t5_2qkuc	True
1371398385.0	1ggjat	Looking for a metal/stainless steel fabricator.	doubleD1991	6	1	11	"preferably in Southern California to replicate a firing button mechanism for tobacco liquid vaporizer. Here is a picture http://i.imgur.com/ywHesw0.jpg

Do you think this will be hard to replicate? how much will it cost? "	t5_2qkuc	True
1369996954.0	1feav1	Wooden handle brass banding inlay?	SerPuissance	5	0	6	"Hey guys,

I'm looking to make some brass banded inlay in a wooden handle, going around the circumference of the handle. My initial thought was to use a barrel hoop type technique, forexample by cutting a 1cm wide ring from an 8cm circumference of brass tube (say 1mm thick walls), and then adding it to a very slightly larger circumference wooden handle by heating it up so that expands enough to slip over the handle and then contracts into place.

Will this technique work? Can brass be heated enough to achieve this with a blowtorch? Any tips would be greatly appreciated :)."	t5_2qkuc	True
1368754168.0	1ehnu8	request for project guidance: metal ankh (socketed) with zircon gem in head	sp00gedragon	7	2	2	"Hey /r/metalworking,

total newbie here...I thought of this with my girlfriend's brother, we want to make two over the summer.  The ankh symbolizes eternal life, and zircon is a crystal that has been around since the formation of the earth. Eventually we'd like to make/put it on a double helix necklace to symbolize life's desire for immortality. Anyways, we're not even sure what kind of metal to make the ankh out of, and were curious as to what kind of procedure/materials/tools we'd be looking at.  Danke schön - "	t5_2qkuc	True
1368392150.0	1e7b5x	[Help] I am making a 3 part object out of metal.	eth1_	10	3	9	I want to make a small crossbow out of metal but cannot decide on the best one to make it out of. It will be 10Inches long, Will use 3 separate parts that will join together. [Drawings](http://imgur.com/a/962iH) . Any help would be appreciated. I need info on best materials to use for the Limb, Arrow retention part and the main stock / body.	t5_2qkuc	True
1367614828.0	1dn4pn	Hey guys, I'm working a metal casting term paper. I'm wondering if there's any alternative process to casting I can add to my paper.	elatedninja	9	4	23	"Any and all help is appreciated. Thank You

Edit from comments: Thank for all the great feedback. The paper is pretty open ended. I did a short history and then went into the process of casting, specifically steel casting with blast furnace, treatment, then into molds. Part of the paper needs to be about alternatives. Obviously there are tons of die and mold casting types but really needed to know if there are any hard alternative processes which many of you guys have given. Any help is great or anything you guys think would be a great addition to the paper including; environmental impacts, future of casting, very new technologies to help the process, etc."	t5_2qkuc	True
1366502843.0	1crsda	Flame cut- 15mm thick Butterfly	hawtdawgspudder	5	0	0		t5_2qkuc	False
1365845041.0	1c9fwy	Needing some custom parts either machined or cast. Anyone have some suggestions? Details inside.	preternaturous	6	0	2	"I'm working on an interesting project with a couple friends and we need some custom parts either machined or cast. We are not sure how or what best to make these out of. We think we want cast iron, but we're definitely not smiths of any sort. The parts will definitely need to be rated to hold a fair amount of weight. Probably 50kg per piece, but we haven't quite worked out the details yet. [I have linked](http://imgur.com/a/R2H0J) a couple of images on imgur of what we need so you can see the parts, and the dimensions and amount we need are in the image descriptions. Does anyone know the best way to go about making something like this? What's the most cost effective way?

We'll also need something similar to a brake rotor cast as well, if anyone has any input on that."	t5_2qkuc	True
1362760452.0	19x2pf	Need help with diagnosing machine problem.	rekloki	10	4	13	We have an old mikron 79 gear hobbing machine that has stopped feeding. The one guy we can contact that knows anything about these machines at all is in switzerland. Any help would be appreciated. If any more info is needed, I will try my best to provide it.	t5_2qkuc	True
1361287640.0	18tkk4	Recommend a good sand bag? 	ebolafever	8	3	9	"Also pics of other surfaces you use for metal work (stumps etc). This is for motorcycle tanks and the like.

Thanks!
"	t5_2qkuc	True
1358378579.0	16pr8j	noob question.. what's the most accurate way to transfer a template onto an uneven metal surface?	xOohShinyThing	5	0	5	"so, i'm into making small carvings of wood and plastic and resin, and want to start trying my hand at metalworking. my first project: cutting a pendant from a silver coin with a dremel, file and such.

when i work with wood, i've always drawn over the back of the template with graphite and then traced the design onto the wood, carbon-paper style. but that's not at all working with the metal, and the uneven surface of the coin makes it difficult to draw on with a sharpie.

i was looking for a faq but to no avail.. so. any handy tips for someone making the jump from woodwork to metalwork?"	t5_2qkuc	True
1358131604.0	16j037	Question about securing a metal tree guard	balthus1880	7	2	12	"Not sure if this is correct sub for this but here goes nothing. I live in NYC and I am hoping to commission an iron tree guard and install it myself. Lots of dogs using it as a bathroom, so this will at least not let them walk on the dirt.

How would you guys install an iron tree guard in the ground? 

Any recommended other subs to ask this in would be helpful too.

Thanks for reading.
"	t5_2qkuc	True
1356030034.0	156ifa	Darkening nickel plating. (x-post pcmods)	_Vova	21	14	5	"I've got a [mips iceforce](http://www.mips-computer.com/images/mch5002.jpg) waterblock which has a nickel plated brass bracket. I use black nickel [ek fittings](http://www.ekwb.com/shop/media/catalog/product/cache/1/image/5e06319eda06f020e43594a9c230972d/e/k/ek-psc-10mm_800_1.jpg) along with black nickel pump top, reservoir etc.

Is there any way to darken the nickel plated brass to match the fittings using either household or readily available items?"	t5_2qkuc	True
1354700917.0	14be8e	Posted a picture a few days ago of metal I rolled. Thought enjoy like the finished product! (Kind of) 	Tewpawn	7	3	2		t5_2qkuc	False
1354404229.0	144i3g	Hardening Brass Punches	TwistedSou1	5	0	16	I made a set of brass punches out of round stock in a machining class, and I'd like to harden them.  I'm not having much luck with Google and Youtube searches.  I have access to Acetylene, but that's about it for adding heat.  About all I've found out is that it's very different from hardening steel.  Also, should I harden the whole shaft, or just the ends to keep them from mushrooming?	t5_2qkuc	True
1352427615.0	12w4ot	I am looking for a miceo temp gauge that can be attached to surface medal.	ilikerealmaplesyrup	5	1	8	"Like this but smaller and will work with medal.
https://encrypted-tbn1.gstatic.com/images?q=tbn:ANd9GcQXVouNlnNjI4PpWwGNySLG3RwwXALGuL4xZ0ys5-d1pMEeb08m[1]

Edit:http://www.dhgate.com/hot-5pcs-lot-digital-thermometer-metal-probe/p-ff8080813976b0550139b96878cd502c.html"	t5_2qkuc	True
1346360119.0	z3j0c	Open Source Ecology is looking for a master metalworker	opensourceeco	7	1	2		t5_2qkuc	False
1346196809.0	yzmy6	Having a hard time deciding what size tap and die to use for a project. 		5	0	7	"My project involves threading a piece of round that's about 1/8"" and then making a corresponding threaded hole on another piece. I know how to do all of these operations but for some reason I can't figure out what size die to use on the 1/8"" piece."	t5_2qkuc	True
1340581673.0	vjn65	Where to find table legs like this?	DrDose	6	1	9	"I'm looking to make a table like this? 

http://magnussen.com/Pages/Products_Collection.aspx?catId=4&amp;groNumber=T1690

I have zero experience welding so I was looking to find predone legs like this or ones that I can screw together. Any thoughts on where to buy them?"	t5_2qkuc	True
1339796736.0	v438k	Want to Build a Metal Casting Furnace - Will This Set Up Work?	PhilGarber	6	1	9	"Hey R/Metalworking,

   I want to get into metal casting, so I want to build myself a simple furnace. What do you think of [this design?](http://imgur.com/ppxZc) (Just pretend everything is of equal thickness and centered.. I'm a photographer, not a sketcher.) I'm loosely basing it off of [this](http://backyardmetalcasting.com/book_fp.html) design, I'll admit I'm just too lazy to order the booklet. 

   Will my simple idea work? For the refractory I'll use furnace cement, and the webpage claims that BBQ charcoal will get the hot enough. As a beginner I'd want to start with simple things - bronze, aluminum, etc. Will I need ventilation at the bottom of my furnace, or will it get hot enough without one? For my final question.. **As long as I don't melt anything galvanized, this won't kill me, right?** 
 "	t5_2qkuc	True
1339370981.0	uv9iv	"Machining a 3 1/2""x48"" 4 TPI threaded rod and the chatter is impossible to get rid of. Any tips on how I can reduce the chatter and improve my workpiece?"	Jappetto	7	3	10	I've tried a number of things including a front cut/back cut method, bringing down my depth cuts, using spindle speed variation during and in between cuts and I can't seem to get rid of the chatter. The material i'm machining is a piece of 4340 Steel.	t5_2qkuc	True
1338951397.0	una1z	I'd like to get into Knifemaking, questions abound...	TheBaconExperiment	6	1	5	"So I'd like to make some kitchen cutlery (chef's knife, petty, and perhaps steak knives). For the most part none if the shaping or sharpening seems to difficult, just time consuming. What I am worried about is the hardening process. It seems that for a small batch of knives that this is worth outsourcing to a professional. The problem is that I can't really find a good reference to how much this would cost. I'm still considering between some 52100 carbon steels or something like CPM154 or S30V stainless (because that will obviously change the cost). Does any one have a good reference for that price?

Secondly, anyone know of good, active knife making forums? The ones I've found so far have really out of date FAQ's and broken images or links to other write-ups that don't exist any longer.

TIA."	t5_2qkuc	True
