created_utc	id	title	author	ups	downs	num_comments	selftext	subreddit_id	is_self
1369280761.0	1evsln	Modifying Drill Press for Milling	Agent_Smith_24	15	4	29	"So I have a ~15 year old drill press I'm modifying. The old 1/3 hp motor is no longer usable so I'm replacing with a 1 hp compressor motor I bought at a garage sale for $20. 

The first problem is the motor spins 2x as fast, in the wrong direction, and is non-reversible. I'm probably going to make a friction wheel drive, or mount the motor upside down (either would also use the existing belt and pulley setup) to compensate for this. 

I figured this would also be a good time to try setting this up for light milling work. The Jacobs chuck has a taper to it, which will pull loose during milling. I'm thinking about drilling a hole through the column to put a pin through the chuck to keep this from happening, but I'm not sure it that will work since it is enclosed in the (non-rotating) support column (maybe a threaded insert instead?)

Other: I also plan on ordering an XY table to mount to the existing table, and attached an old car scissor-jack for Z travel. Possibly attaching digital calipers to the 3 axes for measurements. Structural reinforcement if needed.

Thoughts? Ideas? Additional problems? Solutions? I'm trying to keep this project kinda cheap (hopefully &lt;$100) because obviously if I had more money I'd just buy a mini-mill. 

"	t5_2qkuc	True
1368630869.0	1edwvf	Don't know where else to ask -- question about *fixing* copper patina	samjowett	11	0	11	"I am trying to get copper patina on a few objects by suspending them in a enclosed area with concentrated acetic acid underneath.  The vapours make for an even and bright green patina.  A little sanding on edges, etc., and the contrast between copper and patina is awesome.  The **problem** is that the result is water soluble.

----
Do I need to *fix* or coat the patina?  If so, how?  Heat?  Polyurethane?  Shellac?

----
Thanks very much -- sorry if this is the wrong sub for this type of question.  "	t5_2qkuc	True
1365047013.0	1bn0d6	How to make an Altoid tin	thebruce44	12	1	21	"Could an Altoid tin be made from a piece of sheet metal or are they cast?

Yes, I realize I could just buy one (and get the delicious mints) but I am more interested in making something similar in shape.

Any links to get me started?"	t5_2qkuc	True
1361476124.0	18z0du	Looking For Sheet Metal Union Jolly Roger Logo.	whosis	16	5	5		t5_2qkuc	False
1360054093.0	17xasu	Best welding helmet for the buck.	pegged_	16	5	18		t5_2qkuc	False
1359513847.0	17jcjj	Does anyone here know anything about making cemented (tungsten) carbide parts?	odin_the_wanderer	15	5	18	"So, I'm working on planning and building a machine for some (relatively) high pressure experiments. From what I can tell, cemented tungsten carbide seems to be the best bet for this. Unfortunately, I haven't had much luck in terms of figuring out how to make actual parts. It seems to me that cemented carbide is made by mixing up powdered carbide (in this case tungsten) with powdered cobalt, and heating it to the melting point of cobalt. The cobalt acts as a glue which holds together all the carbide particles. Now, unfortunately, things are never this simple. So, some questions:

* Does this need to be done under inert atmosphere? 
* I'm assuming Co-WC can be cast in the first place, is that true?
* Cobalt melts at 1500 C, do I need special materials (e.g. plasters, crucibles) for these temperatures?
* Is there any sort of heat treatment that needs to be done to anneal the part?
* Is there anything else I should know that I'm overlooking?

If you can't tell, I'm rather new to metalwork, but I am eager to learn! I am a very cautious person, and I have worked with potentially dangerous situations before (chemistry) so I understand the need to take the hazards of working with metals at high temeperatures seriously, and to respect them. Anyway, if anyone here has any experience with this stuff, please let me know!

EDIT: Just to be clear: the Co-WC goes inside a steel vessel. I didn't ask about steel because there's a lot of information on steel casting online. The reason why Co-WC needs to be used is that it functions as a pressure transmitter essentially. I need something which is brittle so I can exert a lot force without plastic deformation.

2nd EDIT: I just wanted to say, I love this subreddit! Thank you everyone who has answered thus far, it has been an immeasurable help!"	t5_2qkuc	True
1357912552.0	16dn1q	Finding the center of a large hole	created4this	14	3	13	"I have a mill and want to make sure I find the dead center of a hub so I can drill holes on the rim. 

My plan was to mount a dial indicator with a finger in the collet and run it along the hub x to find the highest point, then hub y and use these locations as x/y = 0, but I think this is prone to error if the DTI is not properly rotated. (especially as offsets could be huge, and the finger drags)

Now I wonder if I should mount it in a boring head and spin it moving the table until there is no deflection on the gauge.

This must be a pretty common problem - how is it usually solved?"	t5_2qkuc	True
1357425768.0	1611zi	Question on sharpening metal lathe tooling	shroutm	11	0	12	"I have recently acquired a small metal lathe, and have a question on sharpening HSS tooling for it.

I have both a bench grinder, and a slow-speed bench grinder which is used for sharpening woodturning tools. Is there any advantage to using the slow-speed grinder to sharpen high speed steel tooling for the metal lathe? I know it would take longer, but would not generate as much heat, so the tooling would not need to be quenched as much."	t5_2qkuc	True
1356783848.0	15meyi	Petrobond sand too crumbly	jedilion	12	1	3	I got some petrobond sand at Christmas so I could try my hand at pewter sand casting, I've been using it over the last few days and it seems to be getting crumblier (dunno if that's a real word but anyway). I was wondering what I could add/do to it to get it sticking to itself more. Cheers 	t5_2qkuc	True
1353377160.0	13hhif	Where would I go to school to apply/improve my skills?	ajpers321	12	0	5	"I'm mostly interested in blacksmithing and lathe work, but I would love to learn more about TIG and other metal fabrication techniques. I just have no idea what organizations would accommodation my ""picky"" growing skill set. Most places I've discovered in Illinois are only for structural welding, but nothing else. Any info is greatly appreciated."	t5_2qkuc	True
1352841223.0	1355hw	Assembling a beginner setup.	RookV2	12	3	9	I want to get into metalworking/blade forging.  I have gathered a few tools to start with but I am having issues finding others.  Anyone know a good place to get cheap/low cost tools and supplies or suggestions on how to make or acquire them?  I need an anvil, tongs, coal or other fuel, railroad spikes or other metals, and a vice.  So pretty much everything.  If you can think of anything else that would help it would be appreciated.	t5_2qkuc	True
1352330549.0	12tqd6	Where to get brass/aluminum sheet? Having trouble finding the right stuff.	iheartvintage	10	0	38	"Hi r/metalworking, I figured this would be the best place to post this. I'm in NYC/Long Island and I'm trying to find either brass or aluminum sheet in 1/16ths thickness and about 3""x3"" in size. I figured it would be easy but the widest home depot carries is about 1.5"" in width an ridiculous lengths.

I'm trying to make an adapter/spacer ring for a camera mount.

Any leads to reasonably priced sources would be fantastic."	t5_2qkuc	True
1349360595.0	10xq2k	Question about tapers on a lathe	zeppelinfromled	11	1	6	"I recently learned to operate a metalworking lathe (recently = last night), and I'm starting to put together ideas for projects.  One of my ideas involves turning an hourglass figure in aluminum round rod (let's say 1.5"" diameter, and 3"" tall, with the center of the hourglass having a 0.5"" diameter - these are just estimates).  To be clear, [this](http://i.imgur.com/Pk8ufl.jpg) is what I'm talking about (sorry for the ad hoc sticky note drawing).  The stock could continue to the right (+z axis), but if it did, it would be cut off/faced down for the final product.

So, I know how to turn a taper on the end of a piece, like if I wanted to make a spike point on the end.  That's pretty easy (and I'll need to do so at a later point in the project).  But how do you cut a taper going the other way?

It seems like, now matter how I think to do it, there's going to be metal in the way of my tool.  Would I need to make a pass in one direction, then a pass in the other direction, and repeat until I get there?  Because man, that would suck.  I suppose I could cut a groove down almost to the center diameter to provide some relief for the tool, up until I get close.  Any thoughts?"	t5_2qkuc	True
1347002658.0	zhvtl	Mice Cufflinks. Client commissioned them for her husband, used diamonds from a really ugly ring she inherited. Sterling silver, cast, about .25ct. Used Delft Clay and flush set. 	ursacrucible	21	11	11		t5_2qkuc	False
1343949571.0	xl9zk	Welding a piece on my bicycle; Need advice.	sfc949	10	0	2		t5_2qkuc	False
1341594209.0	w4x4q	What's the best way to remove mill scale?	Denki	10	1	11	"My old shop used mostly cold-rolled steel or other non-ferrous metals.  We were expected to sand it to a near-perfect finish, and I generally had no problem.  I'm at a new shop and their scope is a little different.  They brought me on board to improve the metal fab quality of their shop.

However, they use a lot of hot-rolled metal and ironically, despite all of my metal finishing knowledge... the mill scale is proving to be a challenge.  I'm having trouble removing the mill scale without bringing in 'the big guns'.  

- I tried using a [flap disc](http://www.google.com/imgres?um=1&amp;hl=en&amp;sa=N&amp;biw=1280&amp;bih=933&amp;tbm=isch&amp;tbnid=wRc9e100zPlsoM:&amp;imgrefurl=http://www.sparkyabrasives.com/Item--i-FD9C&amp;docid=haTl8xxERz06LM&amp;imgurl=http://www.sparkyabrasives.com/ItemImages/Large/Flap%252520Disc_CER_lg.jpg&amp;w=520&amp;h=400&amp;ei=zRf3T7GgHOrZ0QH4o_3wBg&amp;zoom=1&amp;iact=hc&amp;vpx=983&amp;vpy=157&amp;dur=81&amp;hovh=197&amp;hovw=256&amp;tx=148&amp;ty=118&amp;sig=107638348039183385518&amp;page=1&amp;tbnh=144&amp;tbnw=168&amp;start=0&amp;ndsp=24&amp;ved=1t:429,r:5,s:0,i:97) but it was tricky to maintain clean edges (especially for the un-experienced in the shop)

- A hard grinding disc/stone would be even worse... causing increased potential for unwanted material removal and accidental gauging. 

- I've been using [fiber back sanding discs](http://www.google.com/imgres?um=1&amp;hl=en&amp;biw=1280&amp;bih=933&amp;tbm=isch&amp;tbnid=uG91Gj6e3cgvIM:&amp;imgrefurl=http://rhymestersaemuling.info/4inch-742087a5-makita-abrasive-disc-100-5pack.html&amp;docid=1LB1FQveREjvMM&amp;imgurl=http://ecx.images-amazon.com/images/I/316A6BLMrWL.jpg&amp;w=250&amp;h=250&amp;ei=yxj3T6fzO7Hk6QHyyaD1Bg&amp;zoom=1&amp;iact=hc&amp;vpx=722&amp;vpy=628&amp;dur=837&amp;hovh=200&amp;hovw=200&amp;tx=95&amp;ty=154&amp;sig=107638348039183385518&amp;page=2&amp;tbnh=146&amp;tbnw=200&amp;start=32&amp;ndsp=36&amp;ved=1t:429,r:9,s:32,i:204) for years (again, rarely on hot-rolled) and have success... but I seem to go through a lot of discs when bringing it against the mill scale.  



Ideally I want to convince them to stop using hot-rolled material.  But in the meantime, what can I do?  The fiber backed discs are aluminum oxide... would all of my problems be fixed if I moved to zirconia alumina discs?  I believe that muriatic acid strips mill scale... but lets skip that option.  I hope reddit has a sneaky answer for me!  THANKS!

"	t5_2qkuc	True
1335595037.0	swiwz	Heirloom Junk [x-post from /r/blacksmith]	LongRod_VanHugendong	16	6	5	"Alrighty, so I found an old single-bit axe-head in my grandparents' garage. Supposedly, it's been through about three generations of use. There's a small crack about a centimeter long at the bottom of the eye, near the blade, so it's use was discontinued when my mom was about my age. I was welcomed to it, because I'm handy with metal and, by my grandpa's reckoning, it was akin to a birthright. So here I am, with a damaged axe head, and I want to turn it into a tomahawk. Here's the basic idea: http://i.imgur.com/jn2mV.png
I have access to pretty decent facilities, so I ask you, what's the best way to go about doing this? Grind it all away, or bandsaw? Jeweler's saw? Cut-off wheel for straight cuts, then grinding? .... Belt sander?
Also, what's the best way to drift-out the hole to support a bigger handle, but without a forge and drift?"	t5_2qkuc	True
1332976748.0	ric42	Dear r/metalworking...?	PleadTheSixth	10	0	7	"Hi r/metalworking!

Does anyone know of a website/retailer which sells custom-format small-scale metal lettering for mounting?

I'm looking for a 1/2-3/4 inch high, 1/2-3/4 inch wide metal letter in Garamond font, suitable for mounting.

I've done my best with Google, etc. Most websites can provide the right font, but stop at 1 inch size. The letter is going to be mounted on the front of a walking stick, so the size isn't too flexible (1 inch high would be fine, for example, but 1 inch wide is too wide).

Alternatively, does anyone have any tips on how I could buy a letter that was slightly too wide and curve it to the contours of the stick so that width wasn't a problem?

Sorry if there's a better subreddit for this question."	t5_2qkuc	True
1327563053.0	oxcc2	Anyone knowledgeable about bending sheet metal? 	boolean_union	11	1	11	"This is an example of what I'm designing: http://i.imgur.com/K7k3G.jpg

What is the longest bend possible using conventional methods? (probably air bending).  The air bending press brakes at my work can bend sheets at least 5' long, but I am wondering about 20' to 30'... is this insane?  The intention is to laser cut the parts from steel sheet metal (I have found laser cutters able to cut material around 50' long, so that isn't an issue, though I'm sure it is expensive...)

Update: Thanks everyone for the feedback, you are a very knowledgeable bunch."	t5_2qkuc	True
1322633978.0	mufv4	Any suggestions on a good Metalworking book?	epicRelic	12	3	10	I'm a newbie to all of this, but I'd like to learn a lot more. Anybody have any books that they would recommend?	t5_2qkuc	True
1320432062.0	m0kuw	First experience in metal working ...	rainbowdongs	10	1	8	"http://imgur.com/BHojU

In school for machining at the moment, our first project was this. Started out as rough cut 1018 (C.R.S.). Began with two pieces 2"" x 2-1/2"" x 1/5"", had to hand file it true and to size within three thou, and all cuts were done with a hacksaw followed by a hand file. The tolerance for the fit was .002"". 

Not a very impressive or useful part, but it was exciting for me!"	t5_2qkuc	True
1319808669.0	ls5uk	My current job	Ketamyne	12	1	2	"Milling squares and flats on .100 eccentric shafts. These shafts are going to Hamilton Ontario to run in ArcelorMittal's guide roll housing.

Edit: Pics : http://i.imgur.com/utm5R.jpg"	t5_2qkuc	True
1318262313.0	l75s1	Hydraulic drive pole saw	Zugzub	10	1	6		t5_2qkuc	False
1371188631.0	1gbm29	where can I buy copper and other metal shavings/pellets	2killatons_of_fun	9	0	10	it must be in a form that can be easily measured and mixed	t5_2qkuc	True
1370366174.0	1fnuw8	Is it possible/acceptable to use this subreddit to try to commission someone to build a project for me?	Stinky_Eastwood	10	0	6	I have a relatively simple project in mind, but lack the tools/skills to pull it off. I'm willing to pay someone to do the work for me, but I have no idea how to do that. If you're interested, PM me and I can provide details. Thanks.	t5_2qkuc	True
1368206572.0	1e2v94	Request: Clever solution for mounting a metal light box on a column that can't be drilled into.	bemodriver	9	1	13	"I welded a light box that can be mounted onto a wall easily. Here's an image to get an idea of the dimensions etc.
http://i.imgur.com/sOu8Kath.jpg

Now, I finished another frame that should be mounted to a column and I'm not allowed to drill into it. The brackets as in the other light box are not yet installed. So if anyone has a good idea on how to make it easily mountable, that would be really cool

The column has about 34 x 20 cm.

I only came up with this so far:
http://i.imgur.com/onIdpOah.jpg
A clamp with thread and screw.
But I don't like the looks very much and I need to make it a bit more flexible - I don't have the exact measurement of the column (+/- 3mm).

Any hints are highly appreciated."	t5_2qkuc	True
1367960821.0	1dvxzv	Platinum casting for the beginner	Gregrs	10	1	17	"I am carving the wax model for an engagement ring for my girlfriend, and I would REALLY like to cast it myself out of platinum. Can anyone recommend a way that I can do this in the NJ area? I would be willing to take a class, work with a silversmith (what I would prefer), or just rent equipment. 

It is important to me to make as much of the ring as possible, and I'd rather not just send the wax out to be cast for me.

Thanks!"	t5_2qkuc	True
1363307216.0	1abj1o	Stupid dial indicator question	shroutm	11	4	11	Do most dial indicators have standard diameter mounting shafts? In other words, will most indicators fit most magnetic bases?	t5_2qkuc	True
1361913185.0	19a5sm	Small modular steel stock storage rack	sparr	10	2	7	"Sometimes I've got a few dozen 20-24' pieces of stock that I need to keep stacked up somewhere for a few hours or a few days, during or between projects, or when a group order at the local makerspace shows up and people are waiting to pick their personal stuff out of the pile. I'm trying to design something small that I can make a few copies of to deploy in times like this.

Here's what I have so far: http://i.imgur.com/4YjiChm.png
It's all 1x1.5x.1 steel tube, with .25"" steel plate for the ""hooks"". The legs are shaped the way they are so multiple copies can be stored next to each other.

Any advice before I put these together?"	t5_2qkuc	True
1361351428.0	18vmfw	Soldering magnesium alloy	ikinone	11	3	17	"I recently dropped my camera, and while it largely survived unscathed, there is a crack in the magnesium alloy shell.

I have minimal experience soldering or working with metal.

I was wondering how feasible it would be just to heat up a soldering iron and try to melt the crack back together. Is this a stupid idea? Would I be better off using regular solder to fill the crack? Is there anything I need to be wary of if I do this like toxic fumes from the magnesium if I were to melt it? Would a typical soldering iron even reach high enough temperature to manage magnesium alloy?

Thanks for any advice!"	t5_2qkuc	True
1360656325.0	18d96m	Two Love Birds on a Tree Swing that I made for Valentine's Day	FidgetTheMidget	10	1	0	"Material is pewter.

[Link](http://www.youtube.com/watch?v=NWfElOFRlK0)"	t5_2qkuc	True
1358646726.0	16wo7c	Metal inlays and edging help needed	LSatyreD	9	0	18	"Hey /r/metalworking! Crafter of all sorts here, some of you may have seen the whole thrift store painting fad going on lately, well I do something similar to that with playing cards. I'd like to start adding metal inlays and edging the cards. I do a lot of knotwork and [insular style work](http://en.wikipedia.org/wiki/Insular_art) so curves, bends, and overlays are very important. I'm a big fan of bronze, gold, and white gold but open to all materials. So far I've just been acrylic medium (basically white glue) mixed with metal pigments and just painting it on but I'd like to get it right.

What I was thinking so far is to use thin strips and fold them over the edge. Inlays being held in place by tucking them under the edging. The two problems I see with this is:

* Inlays would have to always go to the edge of the card.

* I hardly know anything about metalworking and have no clue how to get clean, precise curves.

Any and all suggestions are greatly appreciated! :) Thank you! **edit:** Formatting and lost words

**edit2:** as per Nubwithachub's suggestion I have looked into gilding resources and I will definitely be adding that to my skill set toolbox however my original question still stands."	t5_2qkuc	True
1354587477.0	148koy	The main nut on my vise just broke. Does anybody have a source for a new one?	pingiscoolest	11	1	11	I am not sure if this is the right place to post this, and if it isn't feel free to recommend another subreddit. Earlier today, I was using my vise, and I guess I tightened it too much because the main nut snapped. [Here]( http://imgur.com/a/HNgm0) is my vise and main nut. As the title says, I am looking for a replacement. Does anybody know of a source where I can find one? Thanks	t5_2qkuc	True
1349384924.0	10ygs1	Can someone explain how this dimpled cooling jacket is made/attached?	dildo_cd0	9	1	7		t5_2qkuc	False
1345603547.0	ym7kz	My pole saw (better video)	Zugzub	11	3	3		t5_2qkuc	False
1344560533.0	xyz5o	Looking to get involved in the smithing community but don't know where to start. an anyone tell me where to start?	Rambi	10	2	9	I've always been interested in working metal and I've never known where to start and could really use some help getting started. Any information would be awesome 	t5_2qkuc	True
1344358456.0	xtx0b	Where can I find 10 gauge (and under) half-round sterling silver wire, without a minimum purchase amount?	idontgiveitout	10	1	5		t5_2qkuc	True
1344279527.0	xs2cv	Question about metal types and stick welding	Buy_the_Ticket	9	0	9	I just recently got into welding about 6 mons ago. My grandfather, who was a welder by trade, used to make these little sculptures out of brass masonry nails (stick figures playing baseball or in football poses, etc). I do not know what methods he used, though I would like to make some of my own- I am currently using my fathers' (who also got into it as a hobby about 2 years ago) stick welder and so far the ones I've made have been pretty...ugly (charred, ugly welds not holding, etc.) I know some of this is due to my lack of experience- but is it likely that the masonry nails I'm working with (not brass) are chemically treated or otherwise not good to weld with? Should I grind off some of the surface for a better hold or treat them with acetone? Any advice would be appreciated. My jargon is weak, so forgive me for not knowing all the technical terms. 	t5_2qkuc	True
1342559202.0	wq0ft	What are the pros and cons of using tallow vs rosin as a flux for retinning copper pans? 	Hamsterdam	9	0	1	I am trying to gather information about an area I have very little knowledge of: retinning copper pans. I was wondering if anyone had any knowledge or advice about this topic they could share? I am leaning towards using rosin as the flux of choice for this project but was wondering if there was some benefit to using tallow instead? Are all rosins food grade? 	t5_2qkuc	True
1342203715.0	wiekf	First pewter casting attempt:  antiqued arrow	brothulu	11	2	11	"I carved the arrow shape out of a piece of wood, melted some pewter on my stove, and poured it in.  There was some spillover near the arrowhead that I attribute to bad pouring, too much pewter, and shaky hands.  Any advice on making better (cheap) molds would be appreciated!

Instagram [picture](http://imgur.com/uzcJC)...don't judge me..."	t5_2qkuc	True
1342128219.0	wgp9i	Just starting out but limited by location	Karokash	11	1	4	I have been interested in it my entire life but just started collecting what I can to start my own hobby shop. Unfortunately I'm in the middle of Louisiana, which makes finding materials extremely difficult. No one around here even knew what an anvil was and not one book store has any material on working metal. So my progress has been a little slow. If anyone has any simple plans for making the tools needed for the trade (blocks, forges, etc) feel free to share. Anything that helps me get farther into my dream is much appreciated. 	t5_2qkuc	True
1341088173.0	vur4u	What kind of steel is this barrel made from?	Dr_Von_Spaceman	10	1	16	"Hi /r/metalworking ,

http://imgur.com/a/9n6YQ

I've got this barrel that I plan to cut and weld (OAW), but I want to know what material I'm working with here. Carbon steel? Galvanized? Stainless? How can I tell so I can weld appropriately? Namely, I really don't want to start burning off, and breathing, a layer of zinc."	t5_2qkuc	True
1339704319.0	v279m	What do you guys know about bronze smelting?	wait_Wait_WAIT	13	4	4	"I'm completely new to metalworking, but I'm interested in undertaking a project where I attempt to create a bronze item entirely from scratch, starting with smelting copper and tin to make the bronze.  I have a lot to learn before I even start planning this project, so I was wondering if anyone knows of any resources (books, websites, documentaries, etc.) that might explain the smelting process for a beginner.  I've done some research, but so far I've found loads of information on casting, but next to nothing on smelting.  I should also mention that I'm planning on carrying out this project using mostly primitive methods (if I can), so any info on ancient metallurgy would be awesome.

Also, where can I find raw copper, tin and/or lead?

Thanks for any information you can give me."	t5_2qkuc	True
1339679944.0	v1ljw	Push graver vs hammer and chisel	quickrelief	9	0	2	Discussion on the pros and cons of the two engraving techniques.	t5_2qkuc	True
1336690137.0	th8vq	I want to make a ring out of a coin.	solhaLee	11	3	5	I have a few questions. Is a coin okay for staying on your finger for a long time? Will it irritate your skin? And also, is smelting the metal the easiest way to go about this? Thanks!	t5_2qkuc	True
1336585529.0	tf02g	"A Custom Television Enclosure I Made With 
Corrugated and Etched Aluminum For A Client"	studioartebello	10	3	1		t5_2qkuc	False
