created_utc	id	title	author	ups	downs	num_comments	selftext	subreddit_id	is_self
1341868071.0	wah3l	I want to make copper rivets for my Roman Centurion armor. Where do I start?	erichhaubrich	6	2	6	"I was thinking about making a form out of scrap steel by drilling an 1/8"" hole about 1/2"" deep then putting 1/8"" copper rod into the form, snipping off most of the excess and forming the round head of the rivet by using a concave tool and a hammer. Once this is done I would put the rivet through the materials I'm joining and peen the head and use the same concave tool to make the round shape, or just flatten it, depending on the location of the rivet.

I want the rivets to be as authentic-looking as possible, so I don't want to use quick rivets or other similar modern-style rivets.

A) Will this method work?

B) Where's a good place to buy 1/8"" copper rod?

C) Is there a better method for making authentic rivets?

Thanks in advance for your advice. :)"	t5_2qkuc	True
1340674126.0	vlsdr	/r/metalworking, what type of stock is this?	f1pflier	4	1	9	I only have [this picture](http://imgur.com/Rya3i) to work from.  You can see that its purpose is as a track which that cart-looking thing can travel on.  Can one of you ever so helpful metalworkers tell me where i can purchase this?  If not, any ideas that would get the job done?	t5_2qkuc	True
1339291370.0	utywx	Made My First CNC Part Today..The Fibonacci Cam	Hobie918	6	1	1		t5_2qkuc	False
1336476427.0	tcs4l	Dear reddit, we've got a cast iron pan with its handle broken off. Can we do something about it?	adimit	9	6	18	"We got the pan without the handle, and its otherwise perfectly fine, but of course a little unweildy. Is it possible to weld *a* handle back on? Like, find a random piece of metal an weld it back on?

I'm unfortunately entirely clueless about metal working, and I don't have any tools. I guess if it were possible, I'd go look for someone who has both a clue and equipment. We asked a local blacksmith already, but they said that ""they don't do such things,"" which could mean anything, I guess.

Here are some pictures of the stump:

http://imgur.com/a/n21mQ#zDwPf"	t5_2qkuc	True
1336437637.0	tc3da	Can anyone make a custom business card case?	Nova7ny	6	3	10	My company has a unique size and shape card. Everyone has problems keeping it In their wallet.  If someone could make a badass case for this it would be sweet.  I am willing to pay for mine and if it's really good there are 30 other people who might be Interested. http://imgur.com/mgrMB	t5_2qkuc	True
1336351005.0	taflm	Hey Reddit, I fabricated a 4.5ft tall Nokia phone for my senior project. [Update]	charangutan	11	7	1		t5_2qkuc	False
1322740020.0	mw1ij	Any suggestions for making Christmas presents?	jellystone	8	6	14	I've started making an aluminum chess set.  I need ideas for small welding or lathe projects for a beginner.  	t5_2qkuc	True
1317522736.0	ky0s4	What it cost for a fellow Redditor to make the image in the post a reality?		6	3	6	"My girlfriend absolutely loves the Pixar film Ratatouille. She adores cooking and is moving to Texas this December for a career making job in dairy foods. I'd like to give her one last parting gift before she moves.

[This sign](http://images2.wikia.nocookie.net/__cb20110515112814/pixar/images/6/6c/La_ratatouille_sign.png) stood out as a perfect gift for her.

Is there any way that could be reproduced with metal(plastic would seem cheap) and at least made to look like it does in the film with paint? If you require an Illustrator file for a cutter I can provide that to the specifications you need and I by no means expect this free.

Think anyone could help me give her one last parting gift to remember me until I'm able to join her in the summer? :)"	t5_2qkuc	True
1317281620.0	kv2b3	Straight Tapping a Hole	BenCelotil	4	0	7	"I'm sure the workshop veterans already have a tool to help with this, but I thought I'd post this anyway.

When tapping holes it's easy to tap crooked, especially in soft materials, so I took a piece of scrap stainless steel and made a ""foot"" for tapping.

I'd already made the foot before deciding to take a couple of pics or taping it, but [here's a couple of pics of the setup I used to make it](http://celotil.imgur.com/in_the_workshop#miCT8).

Take a piece of stainless steel, lock up everything on your drill press tight, and for a M12 tap drill a 11mm hole, then take out the drill bit and in its place put a Dead Centre so the tap is perfectly straight to start with - unless your drill press can do tapping, which ours can not. You get the idea.

Then if you've got 10 holes to tap or 100 (damn it), you can always keep them straight. I just use the foot to start the tap, but you can leave it there the whole time if you like. If the material you're tapping is a bit hard and the foot is just lifted up by the tap, use a pair of vice grips or small clamp to hold it down.

[Here's the video](http://www.youtube.com/watch?v=Sgi_9GqrbV8)."	t5_2qkuc	True
1314924228.0	k1wyl	introduction to a South Bend lathe	colechristensen	5	0	8	"My father acquired a South Bend lathe and I want to learn how to use it.  It seems to be in good repair besides the fact that the seller put a new belt on the thing inside out.

Question the first: How do I go about re-installing the belt properly? (it is a flat seemingly rubber belt that is... crimped together with metal wires)

Question the second: What do I need to do to get the most basic things done? (necessary maintenance, setup, a metal to use, etc)"	t5_2qkuc	True
1314692158.0	jyvi8	I have shaky hands and I want to start a career as a welder.	exposed_knees	4	0	8	"I just got accepted into a 1 year course to learn how to weld, MIG/MAG, TIG, MMA. Everyone who has done the course last year got a job and I am really looking forwards to starting it this Monday.

The thing is that I have Essential tremor, Shaky hands. It is really not that bad in my opinion but I would like to hear what you guys think.

I just filmed this short clip:
http://www.youtube.com/watch?v=WLn0luHE4EY

There is a medication for it, beta-blockers: propranolol (Inderal), so if it becomes really bad I can start taking the medication on daily bases to stop it.
http://en.wikipedia.org/wiki/Essential_tremor#Medication

What do you guys think? Would it be a problem for me? Shall I talk to my teacher about it? Talk to my doctor and ask for medication?"	t5_2qkuc	True
1312839405.0	jctf5	Never worked with Metal before but...	PatchesOhHoolihan	6	2	8	"I would like to make a machete.  I live in Miami and I have a pretty decent sized backyard (1.5 acre lot) and when storms roll in, especially hurricanes, it can get ugly.  I would like to make a square machete but I have no idea where to get the metal and what tools it would take.  Any suggestions? 
"	t5_2qkuc	True
1299177246.0	fwpk5	Casting medals out of metal. Cost effective to do at home? Cheap place to get them made?	TimTimmington	5	1	5	"Hello!

I want some medals made, in the shape of a Georgia font ""T"", about the same size as your average military medal.

I only need about 10 made.

I've no experience with this sort of thing, but is this the sort of thing I could buy a kit and do myself? Any idea of a company that would do this for me? What metal would be suitable to make them from?

I'm in UK by the way.

Any advice would be much appreciated!"	t5_2qkuc	True
1296672999.0	fdyzz	Anodized aluminum, how can I erase mistakes?	oh_bother	5	0	15	"Hey folks, I have a computer enclosure that is this beautiful brushed anodized black aluminum. I have been going crazy and modifying just about every aspect of the enclosure, and in the process a few bumps/scrapes have appeared in various places. 

Does anyone have any good techniques/chemicals that can match the look of the anodized aluminum? There is another area where I have machined a large area of the metal and it will show bright metallic, how can I get that anodized look without deconstructing everything and dipping it in acid!?

Thanks in advance!"	t5_2qkuc	True
1295909508.0	f8cru	"Can welds this small be done with thin electrodes on 
an AC arc welder? How are they done?"		5	1	13		t5_2qkuc	False
1291833153.0	eif6x	Where to buy metal?	andhint	5	0	14	So I'm in college right now and I'm starting to mess around in the machine shop but I don't know where to get my own stock metal. Is it better to get off the internet or some kind of shop?	t5_2qkuc	True
1290736897.0	ebv03	Complete beginner, would like to get into welding. Where do I start?	Blaidd_Dwrg	5	1	7	Any recommended books? Should I take a course at a local college or just buy some equipment and start sticking bits of metal together?	t5_2qkuc	True
1375526127.0	1jmd3q	I'm not familiar with these parts but I'm trying to add a mechanism inside a pretty big rhino head sculpture I'm making. Can any of bounce off ideas or add suggestions for doing such a thing? Thanks	zammywhammy	3	0	7	Basically we're making a rhino head, definitely, but what we're stuck at is how we'll make the rhino head expand. Basically what were thinking is the rhino head will split in half/fourths, and then the horns will pop up as well. He's a whiz with this kind of stuff but he's only thinking about pistons and the head is not big enough to fit the pistons and everything else needed to push that air through. is there any way we could use a crank or something mechanical?	t5_2qkuc	True
1369891349.0	1fbjbk	Metal Casting Request (Small Coin)	PhilGarber	4	1	14	"Hey,

  I've wanted to get into metal casting for a while, but I haven't. I'd like to get my friend a small coin/token made for his 18th birthday. To keep things cost-effective, I don't really care about the metal. It'd have his name on the front, and his initials on the back. If I paid for materials, would anyone be interested in this?"	t5_2qkuc	True
1367885646.0	1dtu3f	Any advice on bronze casting?	Vorril	3	0	7	"A friend and I have decided to try to smelt and cast bronze for a bit of a summer project. We've done a lot of research so far but still have questions so I'm hoping reddit can come to the rescue.


In no particular order:

1. Furnace design. It seems a lot of people are divided over coal vs propane. We only plan on casting ~3 lbs at once tops. My friend is leaning towards coal but I really like [this propane design](http://www.howtocastbronze.com/2012/02/constructing-cheap-and-efficient.html). I can't seem to source that refractory blanket in non-bulk though, and I'm concerned that a lot of what I've read says many propane torches can be quite weak. Also unsure of how much propane would be needed. Thoughts?

2. Casting. We're just thinking plaster or sand methods, does anyone have any strong opinion?

3. Crucible tongs. Where can we get something sufficient without breaking the bank? We've sourced a crucible, [A2](http://www.budgetcastingsupply.com/Crucibles.php)

4. Cooling. Apparently you can quench in motor oil. Is this necessary or even advisable for bronze?


That's all I can think of for now. Really appreciate any advice! Thanks reddit."	t5_2qkuc	True
1364615677.0	1baagn	Directional sign	reeper55	5	2	0		t5_2qkuc	False
1361906078.0	199wje	What is the one indispensable silversmithing tool you'd buy first?	SweetKri	5	3	8	Hi there, metalworkers!  I'm looking for a gift for someone who would like to do more silver work on their own, but have no idea where to start.  What are the most basic things that you would want to have to start your own silver workshop area?	t5_2qkuc	True
1357895084.0	16ddwj	Need to make a stainless steel heat exchanger	boredislander	4	1	9	Hi all.  I need to coil a length of stainless steel pipe ( to make something like this http://www.selectivekoisales.co.uk/shop/index.php?cPath=28_35) Friends have suggested sealing one end, filling the pipe with sand, sealing the other end, welding one end to a pipe which has the same coil diameter i require, heating and bending around the pipe. Does anyone have any other suggestions or tips? I am thinking of using 10mm pipe and turn it a 100mm diameter.  I am not very experienced in metalworking and own basic tools.  Your views are appreciated.	t5_2qkuc	True
1354235748.0	140wni	Where can I go to get a custom metal piece made? (Pics and question inside)	Rascal_Mouses	4	1	22	"I'll post a TL;DR at the bottom.  Bare with me as I explain the problem (or just jump to the bottom).

I have a google CR-48 chromebook.  For those of you who don't know, these ""prototype"" laptops were built poorly and google wont service them.  They have this ""hinge"" issue where the hinges break.  No parts are made for them, either.  

Mine had the hinges break.  Now, this is where it gets weird.  From all the stories I've read on these, it's the actual hinge that breaks (and to keep it from breaking, you just need to epoxy them).  I had the *same* issue but the *cause* was different.  

The way the laptop is built, the LCD screen sits on top of these two metal pieces. These metal pieces get screwed into the hinges, connecting the top half of the chromebook to the bottom (screen to keyboard).  I took mine apart to find that it was one of these metal pieces that actually broke.  Not the hinge.  [Here](http://i.imgur.com/AS1Cm.jpg) is picture of the metal pieces I'm talking about. The one on the right is perfectly fine. The one on the left, however, the lower-right portion of it is bent up (which causes the chromebook to not open/close properly as it doesn't sit on the hinges).

Before anyone asks, I have looked for pieces on ebay and for broken models to use for parts but no one is breaking them OR they want $$$ for them!

Does anyone know of what sort of shop I could get a custom one made?  Cutting a new piece out of steel (or other metal) doesn't seem like it would be too difficult, but the bends/holes need to be precise.  I'd like to get it done in Seattle, WA and preferably not pay $$$.  I've tried getting ahold of a couple ""hackerspaces"" but none have gotten back to me.  Or, if anyone here could do it, I'd be happy to send them out to you/pay you for your work! 

**TL;DR:
Metal piece that sits behind laptop LCD and connects the top half of the laptop to the bottom half (Screen to keyboard) broke so the laptop wont open/close properly.  Does anyone know how/where I can get this done in Seattle, WA or can anyone here do it/point me in the right direction?**"	t5_2qkuc	True
1353940299.0	13ta42	Could someone give me a quick insight on the explanations from this video (russian)?	diamened	5	1	5	"[Here is it](http://www.youtube.com/watch?v=H0OqtvQ4258)

I can understand that he's modifying the tips of drillbits in order to cut better. Since I can't understand a word, I'm probably missing some inportant information there.

Some concerns arise. Doesn't this procedure take the temper off of the drill bits?

There's a part where he seems to speak about the proper angles and dimensions. I think that is the important part.
"	t5_2qkuc	True
1353547732.0	13ljgs	Starting an internship at a machine shop soon. Looking to do some research before I begin.	mikesauce	5	3	8	I'm returning to school soon for mechanical engineering and after speaking with some folks and thinking about what works for me, I've decided to explore machining as a job for the next couple of years while I'm in school. I start an internship soon, and while they know I'm not going to know much when I start, I'd still rather go in having some basic knowledge. Can anyone point me to something like a machining 101. 	t5_2qkuc	True
1346347377.0	z34eg	not sure where else to look. i have two quarter inch diamond plate sheets that i want to clean up. what is the best way to remove the rust?	zenstic	3	0	15		t5_2qkuc	False
1343860989.0	xj537	3d Printing/Rapid prototyping	BMEJoshua	6	2	21	"I know this isn't exactly metalworking, but I figured that some professionals in here might know where to direct me. 

I'm looking for a way to print teflon or high density polyethylene with very high precision in a small cyclindrical shape. About 2 inches high with 7/8"" diameter. The cuts need to be as exact as possible, and small holes in different locations cut to the diameter of ~50 microns. I tried going through a milling company and while they did create the product, the precision was no where near what I needed and I wasted $100.

Does anyone have a company in mind that would be able to accomplish this for me?"	t5_2qkuc	True
1342680231.0	wt15u	Minitorch advice	Tramagust	3	0	4	"I have this torch from China that I bought just to have a quick and easy source of flame. It has 2 valves: one to control the air intake (on top) and one to control the butane gas intake on the side.

I know that in theory I should supply more air for more temperature but I'm not sure how this translates to a handheld torch.

Sliding the airvalve all the way to the left gives me a nice blue jet flame. Does this mean the airvalve is open completely?

Sliding the airvalve all the way to the right gives me a yellowish regular lighter flame. Does this mean the airvalve is closed completely?

Sliding the gas valve just seems to increase and decrease the size of the flame.

I am left wondering what position the valves should have for maximum and minimum temperature. Can anyone offer some helpful information?
"	t5_2qkuc	True
1339395628.0	uvsay	Mail and armour	NastyGrandma	3	0	3	"Looking for tips/sources to get in to making mail armour. Anyone?
Did I miss a subreddit somewhere?"	t5_2qkuc	True
1338329177.0	ub1fj	mexican homemade welding machine (en español)	nomorevoicesinmyhead	4	1	0		t5_2qkuc	False
1338043160.0	u600u	Brass cutting And shaping	ColonolCool	4	1	8	I need to cut and shape a sheet of brass into a 5cm quilateral triangle. What tools might I use to cut the brass into an exact shape?	t5_2qkuc	True
1335181567.0	so183	Some chap casting on a beach.	drunkonthepopesblood	3	0	0		t5_2qkuc	False
1334803296.0	sh6i3	Question about types of metal	longhairedhippie	7	4	19	"I'm looking for a summer project to work on after I come home from college. I was thinking about making a couple of sets of [dice](http://images.frpgames.org/products/product_19151.gif). I was thinking of doing a very rough looking hammer and grind with stamped numbers. 

What metal or finish should I use that would keep tarnish/wear to a minimum?"	t5_2qkuc	True
1334207631.0	s5qbi	Need advice on Roman armor.	spasmann	3	0	1	"Hey guys, I'm new to /r/metalworking but came here to ask for some advice.  I'am looking to buy a Lorica Segmentata; which is basically the type of armor the Ancient Romans used to wear.  Which I intend on wearing every now and then.  Now here's where I need advice, the reviews I looked at said that the piece (http://www.amazon.com/Lorica-Segmentata-Roman-Legionare-Medieval/dp/B0017U6E5M/ref=pd_sbs_a_1) rusts really easily.  It is made from 18 gauge polished steal.  Then I found another one (http://www.amazon.com/Roman-Segmentata-Lorica-Breastplate-Chest/dp/B003ZWWA0S/ref=pd_sbs_a_2) that just says it has a chrome plating finish.  It is also about $30 more though, so I don't know if it is worth the extra money.  I have no experience in metals so anything you know would be useful.  Obviously I want the one that will take the least amount of work to keep from rusting or is there even a difference between the metals?  Also any advice on *how* to keep the armor from rusting would be much appreciated.

Thanks

Edit 1: spelling errors"	t5_2qkuc	True
1331201969.0	qn6a4	Tin Can Book Title	thorsteinn	5	1	1	I was hoping to source a little assistance in finding the proper title of a book.  It was a book printed in the 1930's or 40's on working with tin at home.  Something about working tin at home for fun and profit.  My Google-fu is currently not working and I was wondering if anyone knew of it.  Thanks to you all.	t5_2qkuc	True
1317972745.0	l3xk1	I would like to commission someones skill for a charm.	khronojester	3	0	8	I would like some help from a metalworker in making a charm for a charm bracelet that looks identical (or as close as possible) to a sour patch kid. Its your general chain bracelet, so a link for it to dangle about with would be ideal. I can go into more details and such if anyone is interested, I'm not very good at these kinds of posts nor am I knowledgeable in this field at all so I may have left out important details.	t5_2qkuc	True
1315917535.0	ke5m0	So I have some questions about making a type of Long Knife from a plasma cut pattern. (Crosspost from Knifeit) Seems like this might be the best place for this. 	Neurosis	4	1	4	"Ok so heres the deal. I have a pattern for some chinese elbow knives and I would like to make identical trainers and then a matching pair thats combat ready. I was thinking of either haveing the place I work ( which has a plasma cutter) do it if they will, or haveing a local steel company that contracts do it. Now if I get them cut out with the plasma cutter my questions would really start for the hardening and tempering of the blades and if the plasma cutting would negativly affect the edges of the blade and also what kind of steel i should use. The trainers of course will have a rounded edge and only have to be hard enough for sustained impacts against something matching there own hardness. If there is any thing I did not ask or you have info on feel free to let me know the more education I can soak up from you guys brains the better. Let the Imparting of Wisdom Begin!

**Edit: I talked to a guy that works in the sheetmetal department and he will cut them out for me. So really the next step is deciding the type of metal.**




"	t5_2qkuc	True
1314906612.0	k1n7j	Reddit, I need your help getting a part made quickly!	jgrindal	5	2	14		t5_2qkuc	False
1314866049.0	k14ep	Is it possible to fill a #2 pencil lead sized dent in aluminum?	punchingtrees	3	0	15	I have an aluminum laptop that was bitten by my cat. Left a tooth mark about the size of a #2 pencil lead and is a real eye sore. I don't think taking this thing apart and trying to squeeze it out is an option so I'm wondering if it's possible to use some kind of filler material.	t5_2qkuc	True
1312133664.0	j4xon	Hey guys, I'm new to r/metalworking, I'd like to start off with a question about piloted piston valves.	junglepoon	4	1	2	"I was wondering how hard it is to machine a 5/2 valve piston valve?

Is there any resource material I can look at?

Thanks a lot!"	t5_2qkuc	True
1303244095.0	gtv6d	Bridgeport M-Head vs. J-Head	BlueFamily	3	0	2	So, I'm a little closer to buying my machine tools, and I have a problem.  I know I *want* a J-Head, but I'm having troubles ignoring the low-priced M-Heads.  I know I won't be taking deep cuts, and my precision requirement is ±.005, occasionally ±.002 in boring/honing.  So does the lighter M-Head really have THAT big of a disadvantage over the J-Head?  The difference is 1700 to 700.  Thank you.	t5_2qkuc	True
1296095270.0	f9r6e	Advice for brazing hole in aluminum motorcycle engine block?	RaygunWizzle	4	1	2	"Hey all, im looking for some advice here about the aforementioned hole in my block. My chain broke a nice 1"" by 2"" rectangular hole in the block right in front of the sprocket. The chunk is still there, but I cant get it out without breaking it more, so prolly destroying the piece. My idea was to remove the chunk and shape some sheetmetal steel to just oversize of the hole and braze it in place followed by some JB weld to ensure oil-tight sealing. 
Any suggestions? I brazed back in welding school but that was a long time ago... I have all the equiment (torch welding wise), but no brazing rods or flux or anything..."	t5_2qkuc	True
1291077085.0	edm9h	Need some tips for decorative quenching	oh_bother	3	0	13		t5_2qkuc	False
1287303406.0	dsbm1	Advice for a beginner?	ketin0	3	0	1	"I have enjoyed welding trivial things and structures I can build with a band saw, but I am ready to do some more serious fabrication. I've been working with a band saw and a hack saw where it is needed, but recently I need the ability to cut ""sharp"" angles, about 45 degrees or more through angle iron, square stock, etc. I have heard of some sort of slow cutting saw that you can align and leave to cut those angles but don't know the name of it. 2 other things I would like to have are a metal roller and press to make straight bends. I think I could make these myself given plans, so if you have them, they would be appreciated.

A little background: Been welding for fun with a cheap MIG(it just does up to 1/4 inch) both flux and shielded, been soldering electronics and oxyacetylene for years. Built a tack welder with the old microwave transformer trick, building a plasma cutter soon. I'm not so much of a fan of stick because of how hard it is to keep the rod on target at that distance. TIG sometime in the future, when I have the money to make one(yeah, I know the difficulty but I'm mostly a coder and a partial electronics guy so it's just a step up to voltages capable of melding). TIG seems fairly interesting to me and much more controlled, plus a separate hand for the feed like I am used to in soldering.

Edit: [Mirror](http://www3.telus.net/public/a5a26316/TIG_Welder.html) for some TIG plans if you want them and [plasma plans](http://www.youtube.com/watch?v=6W3tLDBdPQQ)(directions on the channel).

Edit 2: I have a tendency to over penetrate without burn through(cause a hump on the inside without distortion of material) when doing closed pipe/stock, possibly because I'm paranoid about getting a good joint. I know this isn't desirable for aesthetics but from what I've heard it is fine structurally. Anyone care to correct me if I'm wrong?"	t5_2qkuc	True
1286894998.0	dq7md	Home metal shop articles	chunky_bacon	3	0	0		t5_2qkuc	False
