created_utc	id	title	author	ups	downs	num_comments	selftext	subreddit_id	is_self
1357068503.0	15s62b	Crossbow Ring I Made In My Metals Class.	modestmouse89	132	4	40		t5_2qkuc	False
1357579272.0	164m9z	Copper chimney cap I built	thecarguy85	105	7	20		t5_2qkuc	False
1371015939.0	1g6gve	Tool organizer for my pickup's toolbox.	jdchambers01	99	8	13		t5_2qkuc	False
1332951761.0	rhprt	Hey guys check out my gearbox. Had to make it as part of the first year of my apprenticeship!	Orchazm	91	4	24		t5_2qkuc	False
1358940247.0	1748gl	I built a proper welding table.	zora	93	8	23		t5_2qkuc	False
1340227041.0	vck40	what i did with 257 knives, two forks, tank tread, and scrap metal.	garbieleus	87	5	11		t5_2qkuc	False
1344035818.0	xn90u	I got tired of shopping for a table.	jackaltr	77	0	16		t5_2qkuc	False
1355918244.0	153sm5	It seems people like my work pictures, here's a bucket I made with me inside. Request pictures and I'll see what I can do. :)	Tewpawn	78	11	10		t5_2qkuc	False
1362186235.0	19hxfd	Belt Grinder I Built	amitymachine	70	3	16		t5_2qkuc	False
1370560235.0	1ftq8t	My grandfathers lathe. 102yrs old and still gets the job done	ParoXYZm	73	8	17	"Took a cpl of quick pictures of the lathe in my grandfathers garage/workshop.

8 pics: http://imgur.com/a/vBge1


I knew it was old, since the house was built in 1953 and they installed the lathe while building the house, but I never knew HOW old it was until tonight when I cleaned the metal 'sign'/lable whatever on the front. was kinda surprised tbh. He still uses this ol' bastard on a regular basis. Only difference from a newer lathe is when you want to switch gears, you REALLY have to SWITCH the gears.. 

sry about the crappy quality. And yeah: ÅR means year in english"	t5_2qkuc	True
1358053713.0	16h7b8	My friends welding test - amazing. 	Tewpawn	65	2	12		t5_2qkuc	False
1362608401.0	19sxp1	A recent project. 500 laser cut flowers. Powder coated cold rolled steel. 6 feet high and 5 feet wide.	LIGHTFASTdesign	69	9	9		t5_2qkuc	False
1348722330.0	10jsvn	Augmented Reality Welding Mask With 100 Million to 1 Contrast Ratio - Welding with superhuman eyes	junkpile1	68	7	4		t5_2qkuc	False
1365384022.0	1bvzq4	My stepdad, Alan Jones, is a chaserr and has recently been experimenting with motorcycle parts, check it out.	silvervp5	65	8	19	"Hey everyone. This has gotten a lot of positive attention on r/motorcycles, r/harley, and r/pics. Hope you guys like it too! His website is www.decmetal.com and for the lazy here's a quick imgur link. 

http://imgur.com/a/HbuXS"	t5_2qkuc	True
1360974840.0	18m1it	Progress pictures of one of my copper raisings (x-post r/art)	Squeeums	63	3	18		t5_2qkuc	False
1365825664.0	1c93kx	I made this 1940's motorbike in my garage. I'm 16.		84	24	20		t5_2qkuc	False
1346429094.0	z52ol	Found this on a guy's porch in Bethlehem, NH. Thought this subreddit might appreciate it! 	hmsbeagle00	62	6	1		t5_2qkuc	False
1373144829.0	1hrn05	You guys liked my silverware, here's a copper kettle I just spent the past couple of months on.	SteampunkOtter	60	5	19		t5_2qkuc	False
1370652649.0	1fwew6	Here's a Waterjet-cut stainless steel meat cleaver I made at TechShop.	fireproofsalamander	63	4	18		t5_2qkuc	False
1369864333.0	1fao1q	day three of the metal challenge - hubby dared me to make one new thing out of metal every day for the next year	nicilaskin	62	7	17		t5_2qkuc	False
1366491540.0	1crfve	My first competed commission work - Forged Sterling Silverware Set	SteampunkOtter	64	6	11		t5_2qkuc	False
1369782798.0	1f8clp	day 2/365 new metal item every day for a year	nicilaskin	63	9	11		t5_2qkuc	False
1357217517.0	15vwqc	How to make a Fly Reel - Guy makes his own reel from scratch, including hardware.	junkpile1	59	4	9		t5_2qkuc	False
1329369443.0	prwsn	Hey metalworking! check out this Hydralisk my friend made of copper	GetYourEarsWet	58	1	7		t5_2qkuc	False
1356066237.0	157m9x	Does size matter? A picture of my tig welding practice. Better than welding scraps together! 	Tewpawn	59	6	14		t5_2qkuc	False
1366575217.0	1ctg4b	V6 end table I made for a friend	ross340	63	14	6		t5_2qkuc	False
1372028108.0	1gxm8h	Occasionally I run our shop's plasma table. Here it is cutting mild steel (x-post r/welding)	Graeme_G	53	2	9		t5_2qkuc	False
1364999447.0	1bl7c0	Today is going to be a good day!	BURNSURVIVOR725	57	5	4		t5_2qkuc	False
1370371884.0	1fo2ij	Final product	reeper55	55	6	9		t5_2qkuc	False
1355805892.0	151b4a	180mm thick plate with a 189mmx68mm bevel I did today. 	Tewpawn	51	5	21		t5_2qkuc	False
1360338199.0	184vnt	Blasphemy.	framerotblues	57	11	12		t5_2qkuc	False
1358368203.0	16pdlg	First Copper Smelting	jedi_knt	53	1	27		t5_2qkuc	False
1354279240.0	141sdp	Rolled these two bits of metal today separately to be joined together. I am happy how they turned out. 	Tewpawn	51	6	17		t5_2qkuc	False
1361310716.0	18udk7	My first CNC Part	Drdoomz	50	5	18		t5_2qkuc	False
1353278897.0	13f2yt	Bronze pour of a buddah i made. 	Thunderpickles	46	0	3		t5_2qkuc	False
1335708029.0	sy56y	What does Reddit think of the present i made for my Nephews birthday?	kevbarlas	49	3	12		t5_2qkuc	False
1375542832.0	1jmn8r	How about some control arms? This sub needs a new post.	ross340	50	6	9		t5_2qkuc	False
1366765093.0	1cz6o0	Turtle Shell Ring I cast in class	koondar	53	5	3		t5_2qkuc	False
1349066419.0	10qwfb	Mahogany and Angle Iron Desk (x-post from r/woodworking)	Logan_Chicago	51	6	15		t5_2qkuc	False
1333639000.0	rupis	Polished stainless prototypes. They turned out so well, I wanted to share.	TauntaunScott	48	1	8		t5_2qkuc	False
1360005141.0	17vqiw	Giant dragonfly made of scrap metal	Smithium	49	6	3		t5_2qkuc	False
1351371687.0	126t3a	Brass and stainless steel lockpick (xpost from /r/lockpicking)	Aedalas	46	2	12		t5_2qkuc	False
1342150267.0	whba8	I made a firepoker this week. Tell me what you guys think.	CaptainBruno	46	1	11		t5_2qkuc	False
1366686279.0	1cwts3	[Album] Copper Raisings from my Senior Exhibition	Squeeums	50	5	15		t5_2qkuc	False
1346859495.0	zeayd	Never knew this subreddit existed until today. Here is some of my SheetMetal  	ItsBail	46	2	17		t5_2qkuc	False
1358479676.0	16snev	Notes from training as a watchmaker	shobble	45	3	3		t5_2qkuc	False
1364017854.0	1auhrr	My favorite pic from an iron pour in Denver tonight	rocketwikkit	45	7	4		t5_2qkuc	False
1362141405.0	19gjw7	3D printing with foundry sand. 	ReasonReader	43	3	15		t5_2qkuc	False
1339742847.0	v3322	I am an apprentice to a master diamond setter and he is having me do the original apprentice tasks from Italy where he apprenticed. Here is the first one. All of the edges are perfectly square on the outside and I only got to use a file, saw and a square.		44	1	16		t5_2qkuc	False
1335920639.0	t2hal	Picked this up today	Zugzub	44	5	10		t5_2qkuc	False
1338657623.0	uhdae	Did some machining today	Dra9on	43	6	7		t5_2qkuc	False
1334308003.0	s7p5p	Hey r/metalworking, I'm fabricating a 4.5ft tall Nokia phone for my senior project. What do you guys think of what I have so far?	charangutan	45	4	17		t5_2qkuc	False
1364101260.0	1awfcq	Hung a body on my racecar this week. Coming along nicely.	in_circles	42	2	14		t5_2qkuc	False
1345904089.0	yt0yl	Making use of empty tin cans - I used a jewler's blowtorch	swimmer714	41	2	6		t5_2qkuc	False
1372141953.0	1h0v1z	I got my own tools a week ago and this is most of what I've finished so far	Weehauh	43	5	14		t5_2qkuc	False
1369521549.0	1f1vz7	Set of channel letters I made	reeper55	38	2	5		t5_2qkuc	False
1365529029.0	1c02qc	Finally getting to fire up the forge for the first time. Absolutely beautiful.	Karokash	43	4	10		t5_2qkuc	False
1364222757.0	1az3v4	a BIG bumper for a mini truck	EnragedLurker	46	5	8		t5_2qkuc	False
1360254458.0	182k9j	My dad is a mechanic, and had a slow day at his shop yesterday. So he made this. 	wenhaver	43	5	3		t5_2qkuc	False
1343394664.0	x8uaz	Finished off a armour grade scale mail gladiator armoured sleeve!	mstrjames	41	4	14		t5_2qkuc	False
1339351136.0	uuttk	In case you didn't see it already here is a really cool video of metal being cut slowed down and magnified [x-post from /videos]	gandi800	48	10	0		t5_2qkuc	False
1337033843.0	tn5o0	I started metalworking almost ten years ago now, when I was 12. Here's a collection of some of my favorites.	Nolano	38	3	8		t5_2qkuc	False
1340165136.0	vb9b0	I like to make metal bugs when there's a down time in the shop.	CaptainBruno	41	2	6		t5_2qkuc	False
1367914588.0	1dunwc	Crank powered articulated hand I made for a sculpture class. ~2ft tall.	blondofblargh	37	5	5		t5_2qkuc	False
1359584539.0	17l7ez	Lightsaber- Programmed with Mastercam X6 turned on Haas CNC lathe 	yablewitlarr	46	12	12	"Made for my final in Basic Mastercam class , I am planning on finishing it when i take advanced Mastercam and get into 4th axis work 

http://i.imgur.com/Juj8ufT.jpg"	t5_2qkuc	True
1359345802.0	17equf	Couldn't Find a Source for Steel NACA Ducts, How Hard Could it Be?	Ben_Wojdyla	39	6	7		t5_2qkuc	False
1343145186.0	x2sxp	I've been making these in my spare time at work, does the price seem fair?	longhairedhippie	37	3	26		t5_2qkuc	False
1360715111.0	18etlw	Just a rose will do. [X-post from r/blacksmith]	br1anfry3r	39	3	2		t5_2qkuc	False
1350922887.0	11wghs	I decoded to try repoussé.  OMG this is fun.  It's like painting with iron brushes. 	IronAnvil	39	5	6		t5_2qkuc	False
1336539087.0	te87y	Picked this up off of Craigslist today	Cboy808	37	2	10		t5_2qkuc	False
1370625727.0	1fvgf2	Handmade Miniature Swords and Axe, 4 to 5 inches in Length	Weehauh	41	5	5		t5_2qkuc	False
1369701235.0	1f63nd	one new thing every day for 1 year	nicilaskin	41	11	7		t5_2qkuc	False
1353639579.0	13ne72	Made a pepper mill.	Raffii	37	4	12		t5_2qkuc	False
1334899055.0	sj6zj	Been waiting to create something out of metal. What do you think of my first project?	kidvideo	36	3	16		t5_2qkuc	False
1332300196.0	r67j5	Hey r/metalworking! Check out the fire-pit I'm building for school. 	Shake_Well	36	2	7		t5_2qkuc	False
1328979139.0	pkvtv	Bringing a 50,000-ton forging press back to Life (x/post from TrueReddit)	nubwithachub	33	3	4		t5_2qkuc	False
1344475355.0	xwxr6	Experimental Foundry	bik3r3157	32	0	21		t5_2qkuc	False
1336579234.0	teuka	TIL about the fonly lathe, a simple and inexpensive metal lathe which can be made in a few hours.	scarabeetle101	34	2	0		t5_2qkuc	False
1333679658.0	rvojl	This is what I did from 5pm-2am last Thursday night.	garthnet	34	2	14		t5_2qkuc	False
1372400005.0	1h8f3g	Could finding center really be this easy?	4000rights	39	9	16		t5_2qkuc	False
1366926039.0	1d40bd	Figured you guys would appreciate this, some of the most amazing milling I have ever seen.	Digimoz	35	4	9		t5_2qkuc	False
1365166078.0	1bq9r5	Back lit sign for a trade show.	EnragedLurker	33	3	5		t5_2qkuc	False
1358287038.0	16n669	My friend really liked what you guys said about his weld test - he wants me to show you his sub arc on a RH200 face shovel base edge. 	Tewpawn	35	4	6		t5_2qkuc	False
1358208288.0	16l0um	Anyone interested in an AMAA from a CNC machinist/programmer/shift supervisor/etc.	rekloki	39	7	10	"Did one a while back on r/iama, but it got little attention.



Edit: I will do something in r/casualiama, and cross-post here and probably a couple of other places. Just as soon as I have the time.


Original: 
http://www.reddit.com/r/IAmA/comments/owacd/iama_cnc_machinistprogrammer_who_works_for_my_dad/"	t5_2qkuc	True
1356162848.0	159uf1	Make your own gun. CAD files for several weapons.	bikiniduck	46	16	31		t5_2qkuc	False
1353551691.0	13lmy1	Castings from my first home aluminum pour!	thechort	34	4	16		t5_2qkuc	False
1346850016.0	ze2u1	Handmade knife from a Nicholson file. My first one. Before heat treat. 	CigarDog	32	1	18		t5_2qkuc	False
1330240367.0	q6h9q	Just wanted to share a pic I took at work.	PeeTea	35	5	6		t5_2qkuc	False
1328568924.0	pdros	"I just completed a Starrett style v-block! (Ground within 0.001"")"	rainbowdongs	32	0	14		t5_2qkuc	False
1327806954.0	p19xn	Indicating Parts in a Lathe Quickly	pdq	32	4	6		t5_2qkuc	False
1365981435.0	1ccqt7	Camera-Equipped 'High Dynamic Range' Helmet Gives You Superhuman Vision	vtc4	33	4	3		t5_2qkuc	False
1359471046.0	17hwlp	Hey crossbow ring, meet my gatling gun ring.	fruitpoops	35	7	6		t5_2qkuc	False
1356304532.0	15cgno	Make your own AR-15 (x-post from r/gunsmithing)	chunky_bacon	38	11	6		t5_2qkuc	False
1353702700.0	13ojy2	Jatoba and Aluminum Coffee Table [xpost from r/woodworking]	Logan_Chicago	38	4	7		t5_2qkuc	False
1340978066.0	vsmfj	I raised my first bowl last night. I used the last of the gas in the line to do some flame coloring.	JERKFACE9000	32	1	9		t5_2qkuc	False
1349412876.0	10z8zf	some of my old work....tiny front wing adjusters	unabiker	31	3	2	"[These](http://i.imgur.com/zwCdB.jpg) are front wing adjusters I made at an old job. The aluminum bits were roughed on a manual mill and finished with tiny files. The screws are all 2-56 thread. The larger tube has 4-40 nuts that i tig'd on one end and a couple of circlips with matching grooves to hold it to the endplate mount. 

Most certainly a de-caff type of job. 

Edit: These were used on 40% models of race cars for wind tunnel testing. Specifically, they controlled the front flap angle and allowed adjustment of the flaps to a tenth of a degree. "	t5_2qkuc	True
1346333990.0	z2rcm	Handmade Knife (No Machines)	Operist	50	18	8		t5_2qkuc	False
1338092875.0	u6wtl	CAD and CNC are for pussies.	zora	37	8	9		t5_2qkuc	False
1337218678.0	tqy1o	This is my first casting ever, with my second rivet ever, just finished tonight. 34 grams of scrap silver, and a copper tack.	pegothejerk	36	7	2		t5_2qkuc	False
1372391741.0	1h86yu	Storm Shelter Build (xpost: /r/diy)	cableswiresohmy	32	3	15		t5_2qkuc	False
1368565096.0	1ec7nq	Had a moment of cerebral rectal inversion today.	BURNSURVIVOR725	32	6	12		t5_2qkuc	False
1362379732.0	19mjzq	First attempt: Aluminum sand casting from melted down windowframes	Wheelman	35	9	15		t5_2qkuc	False
1357557378.0	1645r3	Metal looks awesome after being beveled. 	Tewpawn	30	1	2		t5_2qkuc	False
1348446044.0	10d7u5	Cutting steel magnified and slowed down. [VIDEO]	royaldandy	35	8	4		t5_2qkuc	False
1331920612.0	qzo22	The Knife Maker	JohnMakesHisMove	30	2	12		t5_2qkuc	False
1327983835.0	p43v6	Aluminum Dominoes	levi1212	31	3	15	"I made a couple sets of dominoes and I thought I would share:
[Domino](http://imgur.com/3CE06) and
[double six](http://imgur.com/Csw2T)
Cut them out of a 1""x1/4"" aluminum bar, rounded the corners, polished, and did a partial drill for the dots. 

Enjoy"	t5_2qkuc	True
1370038367.0	1ffjd4	day 5 of the metal challenge	nicilaskin	31	5	4		t5_2qkuc	False
1369585885.0	1f34xo	How to use your Mill Vise in your Drill press - without messing it up. This video is hilarious and informative.	wubbadubba	34	7	7		t5_2qkuc	False
1364352834.0	1b35us	Never made a cone before. Any tips for next time?	ross340	28	3	4		t5_2qkuc	False
1363797159.0	1ao5qa	Golf Ball Drill Press Mod	pdq	29	2	6		t5_2qkuc	False
1361318791.0	18uocg	My headache last week: Hastelloy Pocket	ctyleruf	30	2	11		t5_2qkuc	False
1356886093.0	15oee0	I milled my first thing out of metal today ! 	InactiveRobot	34	6	11	"I have been tinkering with mills for about 2 years now, always trying to do metal, never succeeding due to feeds, speeds, deflection, inadequate motors, controllers.. etc.. 

Over Christmas i made https://www.dropbox.com/s/f6miuut1ecu2dua/2012-12-27%2014.49.35.jpg

Shortly after my first test - https://www.dropbox.com/s/omth6zpxgofcze9/2012-12-27%2021.05.22.jpg 

I was able to make 
https://www.dropbox.com/s/a083mjgj2nockqg/2012-12-29%2016.39.25.jpg

https://www.dropbox.com/s/fygsvgnz8cfijhw/2012-12-29%2022.03.03.jpg

The one on the right is when i got my programming of the passes correct. 

This is my first post. So happy to have milled something out of metal ! :D "	t5_2qkuc	True
1356149434.0	159kgw	Machined Aluminum Speakers	dennisjss	31	4	17		t5_2qkuc	False
1352269955.0	12s8j5	"you guys may like this,
		
Resources for machining, machining tutorials, metals and metalworking"	hootiehoo	29	3	0		t5_2qkuc	False
1352070901.0	12mw3i	I made an ash tray out of a trumpet the other day . . .	brassologist	35	10	9		t5_2qkuc	False
1349718973.0	115cbb	Just found this sub, and figured you guys might like my iron floating-arm trebuchet.	FussyCashew	34	8	21		t5_2qkuc	False
1362060183.0	19e8v7	Videos from our annual community iron pour in Madison, WI. Including gopro footage from behind the fire suit	jkerman	29	3	11		t5_2qkuc	False
1348063000.0	104w0x	You all might like this vise I ran across. They only wanted $200 for it!	TheRedditMachinist	31	4	7		t5_2qkuc	False
1345045260.0	y9kbz	Archway my partner and I made about 5 years ago.	karma_dontgiveashit	33	6	5		t5_2qkuc	False
1337928917.0	u453t	You start off with a bunch of scrap aluminum, a charcoal foundry, some sand, and some hand tools, and you work your way up to a full manual machine shop using one tool to make the next.	bikiniduck	28	1	9		t5_2qkuc	False
1335927927.0	t2o87	Just my first attempt at forming and planishing. (Any love for alloys on this subreddit?)	Flamingyawn	30	4	4		t5_2qkuc	False
1333816646.0	rxzu1	Hand engraving a metal pickguard	pdq	29	2	1		t5_2qkuc	False
1325045018.0	nt5kz	I got a lathe (Atlas 618) for Xmas!	etotheix	31	4	10		t5_2qkuc	False
1371051488.0	1g78mv	the metal challenge 365 days 13, 14,15,16 are up if anyone is interested for an update , some have small tutorials posted too	nicilaskin	32	6	6		t5_2qkuc	False
1370387097.0	1fon4h	day 9 is up at the metal challenge 365 and i have posted a tutorial with it if anyone is interested	nicilaskin	28	5	5		t5_2qkuc	False
1370215124.0	1fjod6	day 7 of the challenge - fun little project with polka dots	nicilaskin	29	5	8		t5_2qkuc	False
1367681834.0	1dojn7	Making a Wootz Steel Ingot	pdq	30	3	4		t5_2qkuc	False
1360376612.0	18660g	Elegant silver doorknocker [1024x683]  (x-post from r/DesignPorn)	br1anfry3r	32	9	4		t5_2qkuc	False
1347372588.0	zpitn	An Interesting Way to Weld.	kidvideo	30	4	7		t5_2qkuc	False
1345410673.0	yhlol	/r/DIY suggested I post this here a while back and I forgot, so here's my shaving stand. Not really too much metal working, but it's a ton of metal. 	awwbeans	27	2	12		t5_2qkuc	False
1345062356.0	ya3a3	Working on my engraving [xpost from r/craftit]	celtic_smith	28	4	2		t5_2qkuc	False
1376711489.0	1kj69y	part of a job i've been working on	Angry__Jonny	28	2	15		t5_2qkuc	False
1362339684.0	19l9sc	Casting Blast Furnace, a WIP.	CdeoD	26	1	9		t5_2qkuc	False
1361731747.0	1955ru	Built an aluminum furnace and cast some ingots.	Shenaniganation	29	5	11	"I built an small furnace using the Gingery directions:

http://www.amazon.com/Charcoal-Foundry-Build-Metal-Working/dp/1878087002/ref=sr_1_1?s=books&amp;ie=UTF8&amp;qid=1361731557&amp;sr=1-1

I have a mountain of bike parts that are unused/out of date/broken so I melted down a few rims, a handlebar, a stem, and some old chain rings and cast them into ingots as an intermediate step to casting them into actual useful shapes.  Wrote up a small tutorial about how I did it.  Please note - those of you who do this for a living can probably find fault with my methods.  I understand, this is just how I'm getting things done.

http://shenaniganation.dozuki.com/Guide/How+to+Running+the+El+Cheapo+Foundry/1/1"	t5_2qkuc	True
1351263083.0	124iyr	I made this butterfly for a Christmas gift a few years ago, good gift idea for women on your list.	1337Heretic	26	2	2		t5_2qkuc	False
1342129525.0	wgql8	Copper parts for the Roman Soldier Armor (Lorica Segmentata) I'm making as part of my Halloween costume.	erichhaubrich	26	3	6		t5_2qkuc	False
1337091551.0	to81y	World Championship Blacksmiths' Competition Eagle Eye Class	pdq	25	0	5		t5_2qkuc	False
1332283489.0	r5st5	Has r/metalworking ever seen a Friction Stir Weld?  Solid-state joining.	nagant_info	25	0	8		t5_2qkuc	False
1317825805.0	l1qpy	How to TIG weld aluminum beverage cans	pdq	25	0	4		t5_2qkuc	False
1366993231.0	1d5tmb	D2 machines like balls but makes pretty chips!	ross340	27	4	11		t5_2qkuc	False
1363231093.0	1a9gqe	Forging Game of Thrones Sword (Jaime Lannister) - MAN AT ARMS	Piper7865	30	7	6		t5_2qkuc	False
1361729112.0	19530h	"A small dished ""stump"" I made for shaping small parts. "	ebolafever	26	1	10		t5_2qkuc	False
1360860738.0	18itc0	Metal Head I just finished. Critique appreciated!	AgentCoopersCoffee	25	2	3		t5_2qkuc	False
1360222091.0	181ysi	Every once in a while we get to do fun projects at work:  Custom kayak trailer.  (x-post from r/kayaking)	TauntaunScott	24	2	9		t5_2qkuc	False
1351903317.0	12jkd9	Steel and brass lock pick, v2	Aedalas	28	5	14		t5_2qkuc	False
1342647977.0	ws6qm	Just came in. Friend of mine from YouTube makes these along with other items at modernblacksmith.com. Huge help in getting me started.	Karokash	25	2	7		t5_2qkuc	False
1352099811.0	12noq1	 Meteorite Damascus Steel knife making.	MattDubbaU	25	3	3		t5_2qkuc	False
1341542191.0	w3y8m	Forged Silverware, Raised Copper Bowls, Bronze Hardware, and other projects from my studio	SteampunkOtter	24	0	10		t5_2qkuc	False
1334518340.0	sb5qs	"The Multimachine $150, 12"" Swing, Metal Lathe/Mill/Drill — DIY How-to from Make: Projects"	ar0cketman	25	1	6		t5_2qkuc	False
1329592640.0	pvi58	Another view of the copper hydralisk	GetYourEarsWet	27	5	3		t5_2qkuc	False
1322929300.0	mysbz	Plasma cutting: first attempt	jellystone	28	6	5		t5_2qkuc	False
1370010509.0	1feleg	Another pic of school of rock before riveting	reeper55	25	3	2		t5_2qkuc	False
1369099859.0	1eqh7y	WWI trench art 2 coin ring from my great-grandpa &amp; my simple silver band	Fr0gm4n	25	4	1		t5_2qkuc	False
1366062642.0	1cf1f1	Started a website! Look in here.	Tewpawn	26	4	13	"Hello everyone! 

So basically I've started a website called the fabricators handbook. It's going to have all kinds of nifty things like how to weld, basic fabrication information, the maths that is used in fabrication, a few free plans for easy beginner projects and a lot of other information in regards to fabrication. 

It's not up yet but id love to know what you guys would want on there/what I should put on there! 

Thanks!"	t5_2qkuc	True
1357875340.0	16cwpj	Making a Tuba	dsr0057	23	2	7		t5_2qkuc	False
1345078081.0	yakh9	What does r/metalworking think of the belt buckle I made this week? 	chrisassault	27	5	15		t5_2qkuc	False
1342178316.0	whsyn	Great knifemaking video from Chow.com	Cb1976	23	2	2		t5_2qkuc	False
1340009872.0	v7u90	Playing with sand-casting, tried an antique button this time.	ursacrucible	25	4	10	"A good friend of mine was digging through her mom's old stuff, found a box of antique buttons. She let me steal a bunch to play with, and I decided to test it out with my sand casting stuff. [Here's the button and the cast item](http://i.imgur.com/xQLEn.jpg) and then here is the [silver duplicate cleaned up](http://i.imgur.com/4khj6.jpg). 

I really like the detail that came out, kind of stumped what to do with the finished piece. I thought I had an idea, and now I'm just so jazzed I can't see straight. I think I'll end up flush setting a gem in the vines and turning it into an actually necklace instead of just a pendant. What do you guys think I should do with it?

What should I try to cast next? I've got a lot of bronze which works pretty well (I did some MLP:FiM cufflinks last time), but silver melts at a lower temp. Open to suggestions!"	t5_2qkuc	True
1331153547.0	qm8nb	I made a sunflower for my girlfriend's 20th birthday. What do you guys think?[x-post r/art]	charangutan	22	2	4		t5_2qkuc	False
1328807335.0	phz4t	As requested: Vee Block plans	rainbowdongs	22	2	9		t5_2qkuc	False
1372321665.0	1h61m7	Waterjet cutting strut ends for a geodesic dome at TechShop	fireproofsalamander	22	1	12		t5_2qkuc	False
1366690232.0	1cwyoo	My DIY Adjustable Angle Jig for woking on knives and other projects where grinding at a precise angle is necessary.	erichhaubrich	24	4	10		t5_2qkuc	False
1357065931.0	15s3l3	Colonial Gunsmith of Williamsburg.  Vintage machine porn.	pestilence	20	1	7		t5_2qkuc	False
1356116527.0	158o9n	Machined lamp	dennisjss	21	0	5		t5_2qkuc	False
1326751267.0	ojv10	As promised - how to build a bicycle frame - welding jig special part 2(now with more metal)	ahtopahtel	20	2	9		t5_2qkuc	False
1318009130.0	l4bph	The PROFESSIONal	pdq	21	3	4		t5_2qkuc	False
1371696433.0	1gpage	Has anyone ever manipulated a meteorite?	rudebrew	22	4	10	"I'm trying to make my girlfriend a ring.  I found a meteorite I'd like to use, it's an H Chrondite (http://en.wikipedia.org/wiki/H_chondrite). From what I've read about its composition it seems fairly malleable.  I'm trying to hammer it into a strip, then form it into a ring, possibly mount an addition on it.  Does anyone have any tips on a specific process when working with metal laden rock?

Any advice is greatly appreciated."	t5_2qkuc	True
1366664105.0	1cvzba	(xpost from r/pics) Some steel skull flowers my boyfriend made me for my birthday.	shparkly	23	4	3		t5_2qkuc	False
1362285170.0	19k7r9	Great YouTube channel filled with a variety of jobs done by a one man shop on Cape Cod.		19	0	4		t5_2qkuc	False
