created_utc	id	title	author	ups	downs	num_comments	selftext	subreddit_id	is_self
1357674110.0	1677b4	Looking for an overseas penpal for my 9 y/o daughter (UK.) 	fatalillusion	15	3	6	"My daughter has expressed a wish to  have a penpal from another country. She's pretty open to either a girl or a boy, but would like someone roughly the same age who likes reading, sweets, art, football (soccer), rollerblading and watching TV. She would like to swap letters, stickers, and sweets as well as possibly trading book recommendations.

If any of you have a child of similar age who you think might like a penpal, please do let me know and we'll see if we can get something set up.

edit :Thanks for all the replies, going to show them to my daughter, and see how many people she feels able to write to, then get back to people!"	t5_2r076	True
1357423511.0	160zqf	26/F/Vienna - looking for snail mail penpal	Koalakitten	11	1	5	"I am bedridden right now and have a lot of time on my hands. I read a biography recently and I thought how sad it is that no one writes letters anymore, especially since I always enjoyed writing them.
A bit about me: I am actually from South Germany, but I moved to Austria to study Delevopment Studies. I work in a bookshop. Sometimes I think I am quite the stereotypical liberal leftist: vegetarian, feminist, reading marxist philosophers..but then again I find I have quite conservative views. I love tv series(game of thrones, downton abbey, walking dead, the wire, doctor who), and movies, and books..the usual.
I speak German(obviously) and English, and I don't care about age or gender.

"	t5_2r076	True
1357311165.0	15ya2e	30/F/US Looking for email/snail mail penpal	purplepolkadot	13	3	1	"Hello :) Looking to find a pen pal from wherever to share emails/mail with. I'm newly 30 and from the east coast of the US. I enjoy computer games (through Steam), reading (currently reading ""John Dies At The End"" and ""War and Peace""), learning how to cook...slowly, being crafty, television, and science. 

So PM me if you'd like a writing buddy!"	t5_2r076	True
1357162347.0	15uio4	[REQUEST] Laid up with a broken foot. Letters/postcards/get well soon cards/etc. Plz? 	joliedame	13	3	13	"Hello all. You should know me from my fabulous Hello Kitty and cat Christmas cards. I've also sent out many a postcard from here. 

Yesterday I fell and broke my foot. No, it was not alcohol related. I am in a cast for three weeks and out of work for 1 1/2. So I'm stuck at home with not much else than reddit and Netflix to keep me company. 

If you have the kindness in your heart, PM me and I'll give you my address. "	t5_2r076	True
1356877283.0	15o983	18/F/The Netherlands 	JolyJoelle	13	2	7	"Hey everybody that took the effort of clicking on my post!

I've just stumbled upon this subreddit, and it seems like great fun to snail mail with somebody:)
I'm quite impulsive and I haven't really thought about what to write, but I'll give it a shot:

As stated in the title, I'm a eighteen-year-old female from the Netherlands (which isn't a very interesting country, I'm afraid...)
I'm pretty much interested in everything, so you can talk to me about anything:)
I love traveling, reading, drawing, books, movies, painting, cooking (I'm a terrible cook), photography, music, philosophy  and many more.

I'm an enormous nerd when it comes to Harry Potter or LOTR ;)

I'd love to receive anything you feel like sharing (music, drawings, opinions, ideas, recipes, ANYTHANGG)

I don't care where you're from, how old you are, what you look like or whether you are male or female, as long as you're not against equal rights, gay marriage or a member of the ku klux klan.
That's where I draw the line.

If you're interested in writing to me, please sent me a message with some information about yourself, and include your email adress, and I will surely respond :)

With love,

Joëlle "	t5_2r076	True
1356832757.0	15ni15	27/f/wa, usa - I find communication fascinating and have a wide array of interests. I love hearing peoples' stories. 	rexallia	15	5	5	Message me if you're interested in writing! :)	t5_2r076	True
1356314395.0	15cpb2	14/F/USA looking for a penpal to snail mail/text/Skype/email I like practicing calligraphy and would love to write something for anyone	ilovethemahlersymph	13	3	4	I have a wide range of interests and hobbies which include: playing cello, guitar, piano, I love any form of art, such as oils, pastels, acrylics, charcoal, sculpting, welding, jewelry making, you get the idea. I read like a madman and reads basically every genre, so I'd love to have book discussions and whatnot. I run cross country and track, I was on a swim team for 4 years, and I enjoy playing basketball, lacrosse, bowling, and quite honestly respect every sport there is. I love to sing and dance, as music is a huge part of my life. And that's...pretty much a very, very general idea about myself. PM me if you're interested in talking [:	t5_2r076	True
1355928821.0	153zcw	25/F/AZ Looking for an Email/Snail Mail penpal. 	owliemcowlerton	12	3	3	"I am thinking that we can do a high bred of both email and snail mail. Maybe switching off and on or something like that. I wouldn't mind if it was just email or just snail mail either though :)

A little about me. I am a nerd and love reading. I read just about anything I can get my hands. Mostly fiction though. I am in college for Childhood Development specializing in Autism. I want to become an advocate for parents of special needs kids and possible teach/counsel special needs children. I haven't decided yet. 

Well PM me if you are interested and let me know which one you would like to do :) "	t5_2r076	True
1354883246.0	14fvw1	27/M/England looking for a penpal.	Artemis_clyde_frog	12	1	0	"I'm a 27 year old male who works in education and is currently working on a postgraduate degree.

I am a fairly active person, who enjoys the outdoors and generally keeping busy. My interests include sports (gym, cycling, swimming badminton), graphic and website design, computers, history, reading, gaming and many other things.

I speak Polish and English and am always keen to meet new people.

Snail mail may be a bit of a problem, because I tend to move from one accommodation to another quite frequently, so would prefer emails."	t5_2r076	True
1354299696.0	14299r	"17/M/UK First timer! Interested in the idea of Penpals!
Any communication :)"	Fpk23	11	0	10	"I'm really interested in penpaling! (If that's what you call it)
I've never had one but i love the idea of getting to know new people from around the world! 
I don't really know how to set it out but here's my BIO: 

-I'm a sixth form student taking Maths, Physics, Computer science and Business &amp; Economics

-I love my sports! I Play football for my local football mens team

-I also like to play golf and longboard in my spare time

-I live on an Island with a population of like 150,000 ish, full of old people!

-I love listening to music and I like to write lyrics in my spare time

There's so much more about me but that pretty much describe who I am real quick! 

If you'd like to make contact with me, send me an inbox! I'm up for any kind of communication! Email, online, snail mail etc.

Would love to get to know anyone around my age range (3 max) don't mind where you're from as long as you can speak well in English :)

Is the way i posted this right? 

Anyway, looking forward to hear from y'all :) 
"	t5_2r076	True
1353770671.0	13prvx	16m from australia. Looking for  Email and text buddies	d3thkoala	11	0	0	Hey im dane I play rugby league. listen mostly to metal music but I also listen to any thing that has a band. favourite movie would have to be two hands or the dark night. Im finishing grade 10 this year and probably joining the army next year. Any questions just pm me.	t5_2r076	True
1352492702.0	12xi1f	19/Female/USA :: Looking for a Pen Pal! (Read inside!)	ohsnapitskelz	10	0	5	"My name is Kelly I am a college student in the United States and I'm looking for a Pen Pal. I'm obviously fluent in English, but I've been studying French for a few years as well so, if you speak French, we may be able to work something out (it would certainly help me to study)!

I enjoy all sorts of things. I love video games and Doctor Who, so, if you like either of those, that would be perfect! I'm also into music (both popular and classical, of every genre) and I want to be a writer! But, don't let my interests stop you. I'd like to talk to you either way!

In terms of how I'd like to communicate, anything is fine. I'd prefer snail mail, because it's lots of fun. But e-mail is okay as well! Also, if you want to text/SMS, that works too as long as you're okay with extra fees for potentially international messages!

Anyway, if you're interested, either post here or PM me and we can exchange contact details!"	t5_2r076	True
1351654570.0	12dpcs	21 and lookin' for fun	WhoNeedsProductivity	10	0	1	"Not really, I'm just bored and I remembered how I used to have pen pals back in the day and so I would like to start that up again. Here's a speed round of fun facts about me:

aged 21

female

Hoosier born (that means I'm from Indiana Y'all) 

I don't actually say ""y'all""

I have commitment issues so I'm gonna try to tell you my favorite things, but it's really hard for me to choose, so don't think this is an inclusive list of my loves. 


Okay, things I like:

baseball (and other sports too). Cards are my favorite. 

music (I like blues and swing the best but I honestly like a lot of different things) Fun fact, I can play the piano.

Films/movies. My favorite Comedy might just be Clifford (Not the big red dog, asshole). My favorite drama is To Catch A Thief (love me some Cary Grant). I love older films and idgaf what you say, Bob Hope is funny as fuck. I also love newer movies as well, obviously. I don't live in a fucking cave.

Food. because I'm human.

Psychology. (it's my major. Junior in college) 

Art. I paint and draw. Not professionally or particularly well, but it's something I enjoy and people tell me I'm decent. 

okay, I really can't think of anything else for that...so here's some characteristics that are love or hate for most people, but I happen to love. just so you know:

I like sarcasm

Reference humor

humor in general

cheesy/corny jokes

Lighthearted banter

the ability to be serious when need be

the ability to listen to long rants about annoying roommates/friends/or days

Lightheartedness

etc...

and that's pretty much it. pm me if you love me. 

p.s. I'm just looking for a friendly pen pall right now btw, just for clarification. "	t5_2r076	True
1350914018.0	11w8c4	23/F/US-I have a plan! Hopefully someone is crazy enough to do it.	zombuzzle	14	4	21	"Hey Everyone!

23/F/US chick here. I just moved to my new apartment in Charleston a few days ago! So I'm still fairly new to the area and I would love to have penpals!

The biggest reason I wanted to have penpals (besides the exchanging of awesome stationary and doodles pictures in the corners) is one of my interests is to travel and there are plenty of places I want to visit (and revisit) overseas and in the US. So my ultimate goal is to make friends through penpals from all different locations and hopefully come to visit my penpals in the future and vice versa.

I used to live in Japan so I have a bunch of crazy girly stationary. However, I also have non-man threatening man stationary as well I could use. I love to doodle so you might get a picture or two from me :)! I also craft a bit so once I get my sewing station in order, I might make you a few things like a ballroom gown or a upholstery set for your couch. I do not discriminate on gender or location, but I'd prefer to have a penpal that's 21 and over.

A little about me: I work for an indie studios as a marketing assistant. I too hate the cold weather. I enjoy being active. I do roller derby, kickball, and flag football on occasion to keep fit. I also love monsters, music, video games, science (Human Physiology/Astronomy) and traveling! Have pics if you want to trade.

Hope to hear from you soon!"	t5_2r076	True
1350736967.0	11snd8	30/m/US - Deployed military		10	0	4	"I've been deployed for about 5 months now and all the people I talk to are just military people.  Looking to meet new people while I'm out here and talk about something other than being here.  Email / Reddit msgs only since mail takes forever here. 

Edit: I guess I have to introduce myself a bit. I am in the USAF and I'm deployed supporting the war in Afghanistan.  I'm fly on airplanes for a living - not the pilot, I'm like Goose but on a much bigger airplane.  I enjoy going to movies, a bit of a LoTR and SciFi geek but only a minor affliction.  I try to keep my star wars references to about one per day.   
I enjoy reading books and traveling.  I have been to Japan, Greece, England, New Zealand, S. Korea, Australia and a few other places I choose never to remember. "	t5_2r076	True
1350658051.0	11qywm	21/F/Maryland - Another mom to snail mail with perhaps?	Swtrbl555	12	2	1	"Hello, I'm looking for someone to exchange snail mail with; I would love to have another Mom to be able to talk about kids with **but** I also want someone who isn't a Mom to help me remember I'm more than just a Mom and am my own person outside of Motherhood.

About me: I'm 21 and my son will be 1 year old on November 20th

* I work in a [pharmacy](http://www.reddit.com/r/TalesFromThePharmacy/)  (shameless, self plug)

* I think I finally decided I would like to be a Veterinarian

* I am in a steady, secure relationship with an awesome guy

* I'm incredibly lonely and battling chronic depression

My interests include: animals, video games (Open World RPGs like Fable, Mass Effect etc), Reddit, playing with my son and trying to find something I enjoy doing.

I could really just use a friend to snail mail with; I love getting things in the mail."	t5_2r076	True
1350183812.0	11g0jt	VideoPals? Say whaaat? - A new Redditor to Redditor experience. 	stargoslaby	12	2	2	"Hi there! I will keep this short and to the point.

We at /r/videopals[1] are a brand new community with interests very similar to yours; we are taking the concept of pen pals to more of a face-to-face format, using youtube to send messages to one another. We're all about sharing our day-to-day experiences with each-other; it's pretty cool to step into someone else's world for a few minutes! We are all pretty excited about this new experiment/experience and would love it if you stopped by and checked us out!

Thanks for your time!"	t5_2r076	True
1349055785.0	10qme2	23/F/US in search of an/some awesome penpal(s)!		13	4	1	"Hello everybody, I'm looking for a penpal to write e-mails to and who'd write e-mails back. I'm pretty much unoccupied these days and would love to hear or share recent experiences via letters. So I went to graduate school for creative writing, had been overseas most of my life, etc. I guess writing to people would really be an interesting way to learn new things. Either way, I like science fiction, cats, and art (mostly). I listen to metal, progressive and post-rock. I also like things like going to exhibits, seeing shows, and discovering new things about people.

Okay, so what I'm looking for in a penpal is: you could either be male or female (I don't care). And basically that's it. I'm cool with talking about anything anyway. If you're down with writing via snail-mail, I'm down with it too. "	t5_2r076	True
1348778130.0	10kyaf	"29/M/France - Email/Snail mail - Looking for two ""kinds"" of penpals.."	FullMicroWarpDrive	10	0	3	"Hail everyone,

Alright, let me explain that title.
First of all, as you people can read, I'm French. I was born and raised in France, though both my parents are from a different country. As many people who share multiple cultural roots, I've grown up with a slight distance to my adoptive country's culture and am pretty sure that gives me the ability today to act as some kind of bridge between French culture and other ones, and that is something I would like to share with anyone who would be interested in ""discussing"" France without facing too much unconstructive chauvinism. 
Also, I have a pretty deep knowledge of the French language, and would love to simply help anyone who's looking to get better at it (I'll gladly correct all your mistakes, so, fire away!)
Ok, so that was the first point.
The second one is, for some reason, I've been feeling the need lately, to discuss some important matters with people who don't share my culture. I've been recently sensing that my life history, where I grew up, who I met, everything which makes me ""me"" in general, act as restrictions about how I see things (seems obvious, right?). However, today, I feel like I need to try and understand how things look through a different prism than my own, and I'd be glad if you could help me, you, anyone from a far away place. Obviously, and as most of you, I have many interests, but exchanging about the TV shows I like or the music I listen to is not what I'm looking for right now. If you feel like skipping the small-talk, and getting to the real stuff right now, then let's just go.

Disclaimer : I'm extremely tired from work and slightly drunk, so I'm not sure whether anything that I wrote makes real sense, or if it's some kind of pseudo-intellectual jibberish. So, my apologies to those who read to the end, yet feel like they lost their time doing so. Peace, Reddit!

**EDIT : I've received quite a few answers, far more than I was expecting anyway. I am kind of busy right now, but I'll try and at least have the decency to reply to everyone in the next couple of days. Thanks to you all!**"	t5_2r076	True
1348707704.0	10jefb	World Domination though Postcards!!!	LilRach05	11	2	15	"*Not tonight Pinky!*

Hey there Redditors! An update from my previous posts! I have gotten 31 postcards so far! In no particular order:
Arizona
Idaho
Massachusetts x2
Michigan
Minnesota
Missouri
New York
Pennsylvania x2
Norway
France x2
Slovenia x2
Utah
Minnesota
Canada x2
China
Indiana
Argentina
Colombia
Oregon x2
Delaware 
Nebraska
South Korea x2
Costa Rica
Malaysia
California
Wanna take a peek at all the wonderful [postcards](http://imgur.com/a/mzgsm#0)?? ;)

Who am I? I'm Rachel!

I live with 4 dogs (3 chihuahuas and an aussie/border collie mix) and an African Grey Parrot named Gandalf (who can sing the star wars theme song and close encounters of the 3rd kind) I am left handed and am the 2nd oldest of 5 kids (although we are all adults now!) I am Catholic and I am a HUGE nerd for things like Star Wars, Star Trek (TNG), Dr. Who, Firefly, Futurama, X-files, X-men, conventions and most nerdy things in general. I am a dental hygienist but LOVE sweets and candy (a HUGE sin, I know) :( I also love scrap booking and crafting things. I also have a chronic illness (Crohn's disease) and I want to do something cool and fun while I recover from a flare! and try to find work...so I would like to get postcards from every state and soon the WORLD!!! And although world domination through postcards may sound weird, I gotta start somewhere! ;)
So, if you would like a lovely Chicago postcard (or a cool and funky one), send me one from your state or country! ;D

I would love to here from you!! (and perhaps about you, your town, or just something cool!!) By the way; age, sex, gender, religion, sexual orientation; it doesn't matter!! The only thing that matters is YOU!! :D

*Also if you have sent me a postcard and I haven't commented on getting it, please let me know*

**TL/DR: Send me postcard, and I'll send you one**"	t5_2r076	True
1348612604.0	10h450	28/F/Germany: Nutshell looking for squirrel		10	0	10	"Well, 28, I'm turning 29 next month, but most people judge me some three years younger, anyway. Either I'm gonna look awesome when I'm older or I behave like a three year old.

Anywho, I'm a mathematician by trade, now working on my PhD in history of mathematics, or in other words, I'm pedantic and anal in some things and fancyshmancy and highbrow in others. But I can also be quite chaotic and happy-go-lucky, yeeha. I'm very fond of my Xbox and my machines running Linux even if I don't always understand what I'm doing; I like action movies, podcasts, and baking bread, and I enjoy taking pictures, reading out loud, and being silly. The man of my dreams has a nicely kept beard/stubble and looks absolutely dashing in a suit, chip chip cheerio. Brownie points for sideburns!

I've also been burned a couple times, or maybe I have burned myself, who knows. I have my anxieties and I do my best to work with and around and against them, but it's difficult not to just give in to the void below at times. I've been on my own for awhile, despite having made a few friends, and I painfully miss having someone to confide in, someone I can trust to be there for me, but also someone I can take care of myself. Especially the past year has been quite difficult for me.

Well, I guess that's supposed to be me in a nutshell, then ;) If you're squirrely enough, drop me a line, and we'll see about further nutty mails.

(Yes, that was awful, but it's late here - half past midnight - and I'm tired, so - excuuuse me, princess.)"	t5_2r076	True
1348048542.0	104nza	[Request] Would you send a postcard to my girlfriend for her 22th birthday? (30-09-2012)( x-post from r/Favors)	utdemir	10	2	5		t5_2r076	False
1346110352.0	yxix2	Male Muslim looking for a friend	Registra	11	0	5	"Hey 

I have been feeling a bit cut off from other people lately due to somethings going on in my life. I do use the computer quite a lot though and would love to have some people to talk to on a normal basis.

I have many experiences that I can share and have traveled to many places and seen many things. I find that usually it is hard for me to express myself so unless you ask a certain question you might find my answer not very satisfactory. 

I come from a very large family and spent much time taking care of my younger siblings and directing them.

I do believe my religion completely and faithfully if you dislike this please do not approach me, it will only lead to hatred rather than friendship between us. If you want to learn about Islam I will be happy to teach you but I am not the most devout person so my actions do not reflect actual Islam. 

I want to find good friends no matter where you are, I hope that maybe we can visit each other in other countries if we do find a good friendship

Many people find it hard to put up with me sometimes, during my childhood I learned to speak in a commanding voice and tone because I always told me younger siblings what to do. I have in my recent years found that when I get relaxed with people though, I tend to get a bit childish myself but not in a way that will harm anyone.  

I think this is enough for you to understand whether you want to become my friend or not. 

Thanks, if you find this interesting please send a message"	t5_2r076	True
1344669116.0	y1g7f	25/F/England looking for an international snail mail mail snail (humans also welcome)	LeeksForGeeks	14	3	5	"Hi folks! I recently stumbled upon r/penpals on one of my 'can't sleep, lets explore the wonderland of subreddits' stints and thought it sounded like a great idea! So here I am!  In a nutshell, I adore gaming (mostly of the RPG variety), music (listening to and playing the piano), films (huge Studio Ghibli fan), and reading.

I'm essentially just your run of the mill geek. With boobs.

:-D

Any international folks welcome of either gender. So yes, message me here or PM me if you fancy it!

Edit: this is a throwaway account for those wondering. I didn't fancy posting here on my main account out of fear of weirdos/stalkers/murderers/TheFBI etc etc "	t5_2r076	True
1344055452.0	xnpqz	16/Y chromosome/U.S.	atheist_maybe	12	3	6	"TL;WR:Intellectual person who likes lots of things seeks mentor/and or peer to discuss and learn from and talk about lots of things. 

I spent way too long thinking about how to phrase this message, and eventually decided to start this message with what I am writing now. This creates a shared emotion with others who have done the same thing - and the apparent honesty behind writing out my motivations in doing so looks good, as does what I wrote and am writing.

Yes, I can be a little crazy. Anyway, on to my interests and passions. 

I am passionate about politics(the substantive problems of running a government more than the scheming), learning about stuff, and martial arts. I am interested in the sciences in general, pysch and other fields that relate to politics especially. Also philosophy, debate, reading, history, and a heck of a lot of other things. Basically, if it is considered to be intellectual, I probably like it.

I also enjoy watching good TV shows like Doctor who or Game of Thrones, or reading good books like a Game of Thrones or the LOTR, playing video games, and talking about more random stuff. 

People around my age would be nice, but I am also interested in the wisdom of the ancients - anyone over 20 falls into the latter category. Having someone wiser than I to guide me as I learn about the world, and especially about politics and philosophy would be awesome. You too can be a wise mentor figure who is killed a quarter of the way into the story. Especially poli-sci or international relations majors -or similiar fields. I am planning in majoring in one of those for college.

Or just peers to learn from each other and talk about stuff. Either gender is great.

Words I would use to describe me: Ambitious, intellectual, creative, introverted, sarcastic and *the most humble person ON EARTH*.

That was longer than anticipated. And because dogs are [awesome](http://i.imgur.com/ZJG4j.gif)."	t5_2r076	True
