created_utc	id	title	author	ups	downs	num_comments	selftext	subreddit_id	is_self
1364455655.0	1b5zke	Found inside a purchased book	ElectronicFlesh	190	29	6		t5_2r076	False
1354496616.0	146cop	By popular request, here's a quick photo tutorial I made on how to fold a letter into its own envelope. Use it in good will.	grantthejester	171	10	9		t5_2r076	False
1362008644.0	19cznv	Since the rest of reddit doesn't care, I hope my fellow penpals will like to see what I received in the mail!	pansymarks	128	13	11		t5_2r076	False
1370799599.0	1fzoag	I was excited to go check my mailbox, but then I remembered-	NeverSayNiver	133	22	7		t5_2r076	False
1334782212.0	sgmvd	I sent a letter to my new pen pal...I felt this was the only proper way to do it.	jar0fair	111	9	21		t5_2r076	False
1367013503.0	1d6jme	Seriously thank you to all my pen pals :D	Isaderp	100	4	14		t5_2r076	False
1343952983.0	xldgm	70 yr old man's wish is to receive postcards	lokihk	104	7	12	"I thought that since you guys like writing letters, you could help this guy out.

http://seniorwish.org/blog/send-a-postcard-grant-a-wish/"	t5_2r076	True
1355290799.0	14pmsz	"Dalton Dingus is a 9-year-old boy from Salyersville, KY, living with stage 4 cystic fibrosis. They have only given him a couple of weeks to live. He wants to beat the Guinness World Record for the most Christmas Cards. The record is 35,000. 
Dalton Dingus 
H.C. 62 Box 1249 
Salyersville, KY 41465"	Darlingside99	111	17	12		t5_2r076	False
1361668328.0	193xc2	Update 2: For those who sent cards to my Grandmother for Valentine's day, thank you. I promised an update so here she is opening them!	ImSexyy	103	12	1		t5_2r076	False
1356138644.0	159ax7	It Came! It Came!! After sending many many letters, a redditor finally wrote me back!!	katiejane1610	94	16	14		t5_2r076	False
1363093591.0	1a588p	My awesome penpal :)	JephanieStones	88	7	3		t5_2r076	False
1338148672.0	u7n8m	New rule for r/penpals?	klr4866	90	15	28	"I don't know if I'm the only one but it's really frustrating to see ""m4f"" or ""f4m"", this subreddit isn't r/r4r or r/dirtypenpals

Doesn't pal within itself have a sense of amicability? And not to find that special someone or a new flirting partner? I subscribed to this subreddit to make friends, not find someone to ""send pics to"" or search for someone gender specific.

Maybe I'm alone?"	t5_2r076	True
1352938803.0	137lur	"A dear friend with special needs, his only bday wish is to receive cards - ""Lots of em""! "	heyitsal	84	10	20	"[Picture](http://i.imgur.com/ioCkq.jpg)
On the left is my wonderful friend Carrie, she is a youth group leader at my church who played a huge role in who I am today. On the right is her brother, Tim. Tim is a man with special needs. He lives in Florida and Carrie doesn't get to see him too often. His 56^th birthday is November 29^th, and all he wants are birthday cards - “LOTS OF EM” so, we’re trying to make his wish come true! They’ve set up a P.O. box and everything, and it would be awesome if you guys could help out!

* PM me for the address
* please just send cards, no gifts or anything!
* write 'Happy Birthday' on the outside of the envelope, and he won’t open it until his big day!!! 
* don’t need to put your return address on it
* just sign your first name (please no reddit usernames)

It would mean a lot to Carrie and I, and the world to Tim!

**edit**: thank you all so much for the awesome response to this! I know it's annoying to have to pm me, but I just want to be able to (try to) tell that people actually have a genuine interest in sending a card. I have good faith in /r/penpals, and doubt that someone would troll something like this, I just still feel a little wary of posting the address.


**UPDATE!** [here is a picture of Tim on his birthday!!](http://imgur.com/aE8bH) I am still working on getting a picture of him with all of his cards, but he received about 50 in all, and I know that /r/penpals had a big hand in that. Thank you!!!"	t5_2r076	True
1357076724.0	15seg6	[META] Can we implement some sort of trusted penpal certification system? Or some reliability flair?	grantthejester	77	11	25	"I picture it like this: 

You add potential penpals to a list, if you  consistently return letters, or correspondence your penpal can go in and confirm you as reliable. These confirmations are redeemable for points, and then are automatically exchanged for certain flair (tiered medals or something). In this fashion active writers would then be more recognizable and there would be an incentive to write responses and return letters. 

Every six months, I would be happy to send prizes to the most active penpals in this subreddit. (Probably pens, inks, nibs, or stationery.)

In addition, some people have reservations distributing their personal information, if they could see a user's community activity they might be more comfortable. 

Just a thought. 

Sincerely,

Grantthejester"	t5_2r076	True
1333043409.0	rjjiq	Dodgy stuff	amybexx93	76	7	25	"I'd just like to state that I think a couple of people are on the wrong subreddit. I don't know if this has happened with anyone else, but I came on here looking for new friends and I got a couple of guys who wanted me to do some sort of sexual cam thing with them. There are other subreddits for that: /r/r4r, /r/dirtypenpals, gonewild, etc.

I'd very much appreciate it if these people would use the above subreddits instead of this one, where innocent girls - and guys - are just looking for someone to talk to."	t5_2r076	True
1355007500.0	14ip55	So this is why my letter is taking so long... (x-post from r/UnitedKingdom)		66	7	1		t5_2r076	False
1354584782.0	148hdh	"UPDATE: ""A dear friend with special needs, his only bday wish is to receive cards - ""Lots of em""!"""	heyitsal	65	9	7	"Hey /r/penpals! A couple weeks ago I posted [this](http://www.reddit.com/r/penpals/comments/137lur/a_dear_friend_with_special_needs_his_only_bday/) asking for the favor of sending a birthday card to a friend, Tim. A lot of you responded wanting to send Tim a card, which was SO awesome! 

[Here is a picture of Tim on his birthday](http://imgur.com/aE8bH), smiling as always!! I am still trying to get a picture of him with the actual cards, but he received about 50 cards, and I know you all had a hand in that! 

So, THANK YOU for helping to make Tim's day (:"	t5_2r076	True
1340038961.0	v8c2b	8/M/USA - Looking for a soldier an 8 year old boy can write to	WWSSADADXZ	63	3	8	/r/penpals, I work with an 8 year old boy that is trying to improve his writing over the summer. He is deeply interested in military history and absolutely loves soldiers. I am looking for a military veteran or active military service man or women who wouldn't mind exchanging a few letters over the summer months.	t5_2r076	True
1369148249.0	1erlqq	I have an idea for a subreddit dedicated to pairing up volunteer redditors and elderly people who'd like a pen pal. Would anybody be interested?	Qcollective	59	1	42	"I'm not sure if this is an idea worth doing so I'd like to know if anybody here would like to participate in something like this. 

Elderly people can get very lonely in retirement/nursing homes and I'm sure many of them would enjoy having a pen pal. Elderly people have plenty of life experience and would likely make very interesting conversation. It's already quite common for people to volunteer as visitors to the elderly, and people who do tend to get more out of it than they would have expected.

So, does it sound like something worth doing? The moderators of the subreddit could contact nursing and retirement homes to find elderly people interested in having a pen pal, and anyone interested in volunteering could post their contact details and wait to be paired up. 

Let me know what you think, and feel free to PM me if you'd like to help or advise me in any way :-)

**update: The sub is r/WriteTheElderly. If you're interested PLEASE post there so I can find you and give you an address once I've got some. You can PM too but it'll be easier for me to respond to posts in the sub.**"	t5_2r076	True
1330552988.0	qbxlk	Hey /r/penpals; I got to meet mine!!	tairygreen	60	2	7	"http://i.imgur.com/S5iip.jpg

A few weekends ago I got to meet my penpal. We have exchanged about twenty letters back and forth, and it just so happened to be that she was visiting my locale on a business trip. I ended up showing her the local downtown, we barhopped, checked out some restaurants, and had a great time. I am the one on the far left, and she is right from me. It was a great experience. I hope you all find someone as awesome as I have!"	t5_2r076	True
1359605998.0	17lz48	Received this from a fortune cookie!	CatGodOrDie	61	8	3		t5_2r076	False
1364017142.0	1auhaf	I missed my cake day! But in the last 28 minutes, I wanted to thank this sub!	Aridawn	56	5	8	"So, despite being on here all day instead of working, I failed to notice it was my cake day. For the second year!

Anyway, I just wanted to thank all the people here for being such a great, welcoming, positive, and responsive community! I felt at home the second I found you guys. I have found some amazing friends on here, and while I'm not always on the ball with my letters, they have always been patient and forgiving.

Keep it up, guys. You're my absolute favorite sub!

And [here's a picture of my kitty!](http://i.imgur.com/lDQj5.jpg) Don't be dirty.

P.S. Kitties are well and good, but since this*is* for penpals:
My card display and my wax seal kit: http://imgur.com/a/q9wh4

Edit: Apparently it goes by hours, and not just the day...so...I didn't miss it! Yay!"	t5_2r076	True
1375494339.0	1jlpx5	"[META] Please mark your posts as ""filled"" and politely decline offers- don't be that person who simply never replies or follows up."	scattering_words	63	12	0	"This sub has been fantastic so far, with me sending out several letters and postcards. However, it's astonishing how many messages go ignored- especially when those whom they concern are looking for social interaction. So please do your part to keep this an awesome sub and either mark your post with the ""filled"" flair or politely decline the offer :) "	t5_2r076	True
1372050005.0	1gy91q	My penpal I met here passed away...	truthspeakstwice	56	7	13	So, I basically had an amazing penpal. We confided in each other, we talked often, wrote letters. He was battling cancer, and he passed away. I'm so sad, and I actually feel like I'm being insensitive by looking for a new one.. but, I am. So, anyone interested in being my penpal? 21/F/USA.	t5_2r076	True
1344092218.0	xo7d0	A small rules refresher. 	Herborist	62	15	17	"I've received two PM's so far and far too many bogus reports on threads about people who aren't actually breaking any rules, so I thought I'd let you all know what is and isn't against the rules.

* Being young is **NOT** against the rules. Don't report people who are younger than what you'd expect, don't PM the moderators, and especially don't send me personal PM's. 
* Asking for a penpal for a relative or daughter/son is **NOT** against the rules. If someone defrauds you, PM the moderators, we'll ban them, and if it's egregious enough, we can forward the case to the administrators, but don't start reporting everyone who does it. They are not all con artists, they are nice folks who just want to help their children or relatives make a friend.
* Writing too little or too much is **NOT** against the rules. I'm exceedingly perplexed at why some people think this is. I applaud anyone and everyone who encourages others to write more, but reporting them is silly and I'm not going to argue with people via PM's about it. The punishment for writing too little is risking not finding a penpal – that's as far as that will go.

Now, I would like to remind people that if you lose touch with your penpal, trying to find them with *one* thread or *one* comment is more than fine. Feel encouraged. Spamming their thread over and over several days/weeks/months after the fact is **NOT** fine and you will be banned. Yes, I will go through the thread and ban each of your alternate accounts. That's how dedicated I am to preventing this kind of wanton harassment. 

[Have a nice day.](http://www.google.com/url?source=imglanding&amp;ct=img&amp;q=http://i.telegraph.co.uk/multimedia/archive/01599/walrus-close-up_1599316i.jpg&amp;sa=X&amp;ei=MzgdUJC1DuXh0QHs2IGYBw&amp;ved=0CAkQ8wc4LA&amp;usg=AFQjCNHMyi5-kdJILdhLscp5Efnl04uyKg)"	t5_2r076	True
1344281061.0	xs46m	Not sure if this is something that should be posted in /r/penpals, but....	jtwilson136	50	4	65	"I just had the greatest idea, I would like to work together with a goal of 200-300 random people from all over the united states to write a short story where I write one paragraph. Send it to the next person. They would write another sentence or two, a paragraph if they like, then Send it to the next person on the list, then that person does the same thing. And the story would eventually be sent back to me once everyone on the list has written, the last person would write the end. I would try to get the story published somewhere with credit to every author. The way I would like this to work is I write my paragraph on a piece of paper, put it in an envelope with a list of the addresses of all of the people that are interested. After the first person gets it, they would write their paragraph, scratch their name off of the list and post here once they have sent the unfinished story, along with the address list to the next person so the story can be tracked and doesn't get lost in transit. I would like everyone that is involved to be as creative as possible and take the storyline anywhere they like. Is this an idea anyone would be interested in? Any ideas to make it better? 


Edit: 

This is now open for international writers also, provided you write in English. 

There will be a minimum of two paragraphs and a maximum of two pages, that you can add to the story. 

My goal for this is to be a continuous story, created by hundreds of people instead of a bunch of different stories.

Each writer should write their name on the side of the page beside the start of your section. 

Everyone that is interested can send me their addresses on here with ""worldwide shared story"" at the top of your message or at jtwilson136@gmail.com with a subject of ""worldwide shared story"" and I will start making the list. Once I have enough people willing to get involved, with enough addresses I will notify everyone and send it to the first person. 

Thank you all for your interest in this; I feel as though we, redditors united, could make this something of epic proportions. "	t5_2r076	True
1358903401.0	173chn	SUGGESTION: Why not write to people in long-term care, such as elderly and special-needs people? Do you know anyone in this or a similar situation that would appreciate such a letter?	tooMuch411_orNotEnuf	47	4	8	"Hey Everyone,

How are you today? There are a lot of posts of people who want to exchange a letter with somebody else in order to practice a language or just to receive a handwritten note in the mail. I saw a recent couple of /r/penpals posts written on behalf of someone in prison. 

These made me think of a group of society that, like the prisoners mentioned above, may be confined to a facility or their own home due to special needs, mobility issues or whatsoever else the reason may be. 

Sure, I don't feel like visiting a local old folk's home in my free time, but I think I could write at least one letter. So, why not? Anybody in here know anyone in a situation like the one I described that would like to receive mail to pass the time?

I think this would be good to do."	t5_2r076	True
1315476863.0	k8o5t	Teacher in China looking for about a dozen native English speaking penpals for my college age students	TheDark1	47	3	48	"Hi, I am an English teacher in China (I am from Australia), and I want to find a few penpals for my students. Instead of doing one on one things, I will assign each penpal to a group of 4 or 5 students, and they will work together to draft letters, pose questions to you, and then prepare presentations to their class about you and your life/hobbies/culture etc.

I would prefer to do all of this via email rather than snail mail. 

My students are: age 19-22, English Majors (their English is not great, it is tough for students here), 90% are female, 10% male, they are very interested in Western culture, movies, TV, etc.

You should be 20 - 40 years old (Outside this range is not a huge problem but it is better if the students can relate to you), a native English speaker, friendly and forthcoming about your life and interests. Photos would also be appreciated, pics of family, your home, car, pets, workplace etc. NOT YOUR DICK. 

Please note, do not join if you are seeking ""Asian bitches"", if you want to get into hard core political discussions, or if you cannot maintain this commitment for less than 5 months (the duration of the semester). 

All mail both ways will go through me and I will edit anything I think is uncouth, provocative, racist or overtly political. The goal is for the students to find common ground with some friendly westerners, not to create an international incident, or a dispute between me and my employers. If this is something you would be interested in, please contact me through this thread or via PM. I look forward to hearing from you!  
EDIT: Amazing response so far! Thanks so much! So I will let you all know what I am doing. I have sent PMs to those who have expressed an interest. I can accommodate about 12 now for my 2 writing classes, and I have another writing class beginning in a few weeks time. I have had about 8 responses so far, so looking for 4 more for now, and possibly more before October. That would enable me to put the students into groups of 5. If there is much more interest I could make it groups of 4, or even 3 (though that would see me doing a lot of work). Anyway, we shall see...  
RE-EDIT: Wow! Awesome response. I have no received interest from about 15 people, in less than 8 hours! For now it looks like 18 will do, but by all means continue to PM. I am sending PMs back with my email address, asking for a fairly quick response - I want a 100 or so word introduction letter. The first 12 I receive will be distributed to students next week. The next 6 (possibly more), I will distribute in a few weeks when my freshman class begins (they are doing their military training now, poor things). Any further responses, I will do my best to find a correspondent for you. Maybe I can set you up with some of the more gifted students, or see if one of my colleagues would be interested in setting up a similar program. Cheers!  
3rd edit: Wow, more than 50 replies now, through this thread and PM. Thank you all so much! If I can get 20 or more written letters by next Tuesday, I will look at dividing the class into pairs or trios and giving a letter to each. I have already received 6 or 7 letters and I think the students will have a lot of fun and learn a lot about western culture. I am sure they have never heard of disc golf!
4th Edit: I have assigned 10 of you to one of my classes. The next class is advanced so I will make the groups smaller. I think I can find penpals for 14 or 15 of you. I have another writing class starting next week which I can assign 10 more people to. The bad news is that I have received more than 50 letters so some will miss out. I will however, keep your letters and email addresses, and continue to look for penpals for you. I'd like to say again, thank you all so much for your submissions. The students were so happy to receive the letters and I have never seen them working so hard to make sure they made very few grammar errors. "	t5_2r076	True
1363726582.0	1am8ho	r/cameraswapping - Swap disposable cameras with other Redditors and gain insight into their lives!	snaedis	58	18	3		t5_2r076	False
1375749551.0	1js1gg	Please refrain from downvoting submissions for any non-legitimate reasons.	Herborist	66	28	17	"It's come to my attention that some people are wantonly downvoting submissions just because they may not agree with the content. That's not a valid reason to use your downvoting privileges and here at /r/penpals, we uphold the [reddiquette](http://www.reddit.com/wiki/reddiquette). 

Just to be clear: the only time you should be downvoting a submission is when they are breaking any of Reddit's rules. If they're too young, too old, or any other subjective reasons like that, then you shouldn't be downvoting (or reporting, for that matter).

It's very discouraging to see downvotes on submissions for people who are new here and just trying to find some friends.

Thank you."	t5_2r076	True
1364307815.0	1b1ix0	65 UK male looking for email penpal	old_brit_man	45	6	5	hope folks don't think it's too creepy me asking, I just want to expand the range of people I talk to. Interested in history, travel, poetry, football, (soccer) computers amongst other things.	t5_2r076	True
1365744422.0	1c6uol	Anyone up for sending letters to a little old lady?	Aridawn	46	3	5	"Hey all!

So, before I moved to town, I would send letters and pictures and cards to my grandma. Before she entered senility she often wrote back, but now she doesn't really have the ability of wherewithal to do it (plus I like like 2 miles away from her now). 

But she still *loves* going to her mailbox! The only letters she gets are from her sisters who still live in Wyoming. Otherwise, she just gets bills. I think she would really appreciate if someone send her a letter, and maybe I could help her write you back. 

She's a pip! She's 83 years old. And she insists on going to breakfast every. Single. Day! My parents are leaving the country for a few weeks, starting next week, and my brother, husband, and I will be her chauffeurs. So I'd be able to help her even more! 

She was in the Korean War, I believe. Her father died working on the railroad in the 30's. Her mother raised like 7 kids, and she raised 4. She has stories!

And this is [her](http://i.imgur.com/afsf3Fy.jpg). She has a mama duck living right outside her apartment. They are buddies.  

Anyway, PM me if you are interested! It would be crazy appreciated!"	t5_2r076	True
