created_utc	id	title	author	ups	downs	num_comments	selftext	subreddit_id	is_self
1368042890.0	1dyaaj	26/M Sweden looking for email penpals from wherever!	Macosaur	11	2	1	"Hello!

I am a 26 year old guy that studies in Stockholm and in Enköping, Sweden. 

A bit about me: 
I like being outside in nature and enjoy going on hikes. I have been hiking in the north of Sweden and once slept in a cloud at quite some altitude. Protip: Nothing dries in a cloud.

 I like cooking, I didn't say I am very good at it but I still like it. I usually make real easy food but I'd like to improvemy cooking but it's hard with the budget of a student.

I like watching movies and reading. I kind of like to watch and read almost anything but something about sci-fi and fantasy is more intriguing to me. I also am a big fan of documentaries and a Discovery-addict.

I like playing videogames and I am abit worried about my backlog of games I have to play through. I've been saving Arkham City for this summer since I really liked Arkham Asylum for instance. I am worried about Bioshock: Infinite going to take up a huge amount of my time as well. 

I am just looking for some nice people to talk to about whatever. Tell me how your day has been or maybe some cool recipes or share some photos or talk about whatever. I'd prefer to use email or something along those lines since my handwriting is horrible.

Wow, I sound kind of boring reading this through. Whatever! If it sounds like your cup of tea then send me a PM.

Hope you are well.

macosaur"	t5_2r076	True
1367994165.0	1dx25g	[21/m/USA] interested parties should be: adventurous, candid, opinionated yet open-minded, eloquent, and, above all, passionate	lethargic_lothario	12	6	0	"I'm finishing up my junior year of college at a university in Ohio. I have lots of interests. I'm interested in becoming famous one day, I'm interested in helping my friend make the most of his burgeoning hip-hop career, I'm interested in meeting someone who's interesting.

Let's share life stories and experiences together."	t5_2r076	True
1367867339.0	1dt55w	18, Irish to exchange stories (fictional or real) with anyone around the world. Snail mail in any language.	jjrg2020	9	1	6	Hi, I'm 18 and living in Ireland. I'd love to exchange stories with you by post stories about anything at all, that's up to you, and in any language you feel comfortable writing, if I can't read it it's cool. I speak English, German and Irish. Thanks for reading, have a nice day, let me know if you want to hear a story.	t5_2r076	True
1367723013.0	1dppd4	It's my birthday!...	Gary_Oaks_Eevee	14	6	13	"...Tomorrow, wish me a happy birthday and lets me friends! 

22/f/ us!"	t5_2r076	True
1367677573.0	1dog3a	M/20/Germany - Share, learn and have fun via Snail mail	DasSchnitzel	12	5	3	"Hey!

I think every person has an interesting story from which I can learn and experience the world in a different way than my own, so I would like to get to know you and learn what makes you special and what you think about life, the universe and everything :)

I'm 20 years old and live in Hamburg, Germany, maybe the most beautiful city in the world. My interests lie in writing, reading, outdoors, music, movies, games and of course in law, because that's what I study at uni. I think a lot about life, what our purpose in life is, about other people and myself. But I am no introvert but like to meet new people and try to find out what differs them from the others. My love-life is almost always complicated, although I think an interesting women can be the most exciting creature in this world. I love to talk about love, boys and girls and sex (nothing dirty intended) and what other people think about it and how they experience it.

My greatest wish is simply to write the best book that has ever been written and read, because I want to show people what a life with purpose and meaning can achieve and how fulfilling it can be.

I hope that we can share our experiences, talk about what is important and the little things in life. If you want to exchange letters I'd be glad to read your PM to get a first impression :) Beware though, I live in germany so the will be postal charges.

Bis bald und liebe Grüße,

DasSchnitzel"	t5_2r076	True
1367488523.0	1djjqo	Ahoy hoy. Lookin' for a bit of chess playing and involved conversations via invertebrate delivery systems	smackofham	10	3	3	"Hello, I was thinking it would be a nifty idea to try play a game of chess by snail mail. Or backgammon or what have you. 

I am fairly mediocre at chess, and I normally take a few days to decide my move when I'm playing, so this might actually be a faster way for me to play.

I also have....interests. Interests, and likes and dislikes, and those sorts of things, which we can discuss over the course of a very drawn out chess game. 

I am currently 23/Aus, although I imagine both will change by the end of the chess game. Probably still be a male though.

Anyway, lemme know if keen. "	t5_2r076	True
1367467312.0	1dj4zv	19/F/Texas looking for another pen pal	cavedew	10	3	2	"Hello, 
just looking for someone to talk to about whatever. I have two Persian cats whom I adore, I breed hedgehogs, I'm ent friendly. I'm going to college. I like hiking and delicious snacks. 90's cartoons are awesome. So yeah, let's talk."	t5_2r076	True
1367339543.0	1df3qe	22/M/Colombia (South America) Im not sure how to start this but it would be great to have a pen pal.	morfosis	9	1	3	"Its my first time doing this, but it looks like a great way to improve my english and to know people around the world. Maybe if you're interest you can learn some spanish in the proccess.

I'm finishing my Industrial Engineering career, i love soccer, working out in the gym, i like David Fincher, Darren Aronofsky, Guy Ritchie and Chan-Wook Park movies, i'm also an atheist in a very catholic society, also love rock n roll (especially the 60-90's music) and for me theres nothing like a good hookah before getting to bed. 

Thanks for reading, i'm not exactly sure how to procced so i'll be ready to answer any question you have"	t5_2r076	True
1367295755.0	1de3ay	18/M/USA; Never had a penpal; but looks like fun.	EchoHound	10	2	0	"Hello, I won't write a wall of text of who I am, but I am into technology, gaming, music, and biking among other things.

I would prefer to email or possibly text the other person, mail will take too long for me. :(

Contact me if interested."	t5_2r076	True
1367249749.0	1dcccy	M/30/German looking for English native speakers	fixpunkt	9	1	5	"First time poster here. I hope, I am not too old for Reddit, but I thought, why not give this a try.

As you may have noticed, English is not my first language and I am looking for native speakers who want to help me practice everyday conversation in English and, of course, I am also looking for fascinating people (preferably with a dark sense of humor ;)). But first things first: I am a 30-year-old guy from Southern Germany. I have earned my Master’s degree in Contemporary German Literature and American Studies (which makes the lack of English skills even more embarrassing). I even lived in Seattle for a couple of months and it would be especially cool if people from the Seattle area would be interested in writing me. 

In my leisure time, I visit the theater/opera, work out, or write articles for different music magazines (mainly 80’s stuff like post-punk, pop, and new wave etc.). I am also interested in literature, politics, art in general, traveling, playing chess and much more. 

That’s it for now …
"	t5_2r076	True
1367162727.0	1d9wu4	(Romania here) Looking to make friends from other countries	traummaschine	10	1	8	Hello,I'm a girl, 19, from Bucharest, Romania. I'd like to make new friends from other parts of the world, as well as from Romania. We can exchange emails, letters and maybe gifts and stuff.	t5_2r076	True
1366986631.0	1d5le6	16/F/ Australian Teen, Looking for Snail Mail Overseas Pen-Pals!	happyowlpenpal	9	1	5	"Hi Reddit, 

I am 16 year old female from Australia. I aspire to travel all over the world and would love an in site into someone else's world. Looking for a pen pal close to my age, from various destinations outside Australia. 

Hobbies:

- Photography

- Graphic Design

- Playing Sims and Habbo

- Watching Films

- Collecting Ornamental Owls :D especially from Typo!

Looking for down to earth person, who likes to chat.

Ciao Groovy People, Hope I can chat to you soon. :)"	t5_2r076	True
1366932417.0	1d48to	16/F/UK - Send me your postcards!	jamescoupe10	10	1	4	Hi, i've been creating a postcard wall in my room and lately i've barely had any to fill it. Would any of you be so kind to send me a postcard and be a part of something beautiful? PM or comment for more :)	t5_2r076	True
1366707557.0	1cxbx7	Snail or email. 37 F from MA, USA. Mother, many hobbies	Tansette	9	2	1	"I would love to have a penpal. My best friend died and I really miss a good ol conversation.

 I love gardening, photography, Doctor Who, sewing and quilting, painting, Game of Thrones, reading obscure discount store books, I'm on a almost 4 year journey threw a back injury and bursitis, a mother of 2 young girls, I had a child 17yrs ago whom I put up for adoption, woodworking (even though I suck at it), trying to quit smoking, just started back to the gym, i was a mechanic and tow truck drive, I raised birds for show, I love talking about anything or everything!

See I just got a bunch to talk about!"	t5_2r076	True
1366575400.0	1ctgcd	16/M/Utah, USA. looking for email-pal.	unknowndirection	10	2	2	"Hello everybody, I was looking for a penpal. I figure we could talk about anything. I write a diary, so I figure it could be kind of like writing a diary, but to another person. A kind of interactive diary, in a way. I don't know, just an idea.

I like to play guitar, read, and am learning Arabic on my own. I like so many kinds of music, but I always come back to Pink Floyd, my favorite band ever. Dunno what else to say. Let me know if you're interested, and I can send you my email . Your can send the first email or I can, whichever is preferred."	t5_2r076	True
1366531675.0	1cshq7	18yo Gay Australian Male (Victoria) - Looking for pen pal friend.	alecZzZ	9	3	1	"Hi, I'm looking for a someone to be penpals with. I live in Australia, and I'm a university student majoring in Journalism. I'm into literature, a bit of sport (I'm a black belt in martial arts, but I'm a huge tennis fan!), music, fitness, fashion and travelling. But I love to be open minded, so there is no topic I wouldn't mind talking about. I'd like it to start with emails, then we'll see if it'll become postal.

I wrote 'gay' on the title because it would be nice to meet and speak to other gay people from other parts in the world, and be able to share  life experiences with each other. Emotionally, I have a lot on my plate, especially in terms of coming out (and the negative reactions I received from it), so gaining another perspective and support would be really great. That being said however, I wouldn't speaking to anyone else! (the open minded thing again)

If you have any questions, feel free to ask away. If you're interested, PM me :)"	t5_2r076	True
1366418645.0	1cpn1d	Any love for a lonely Royal Marine?	DatRoyalMarine	17	7	6	Umm so yeah i've no idea what im doing as this is my first post. Basically been outposted to my home town london. Got a load of time on hands but I cant see friends for a few weeks and thought it would be cool to talk to someone who's not just a jarhead and maybe in the future in afghan and other deployments it would be nice to talk to someone who's back in civilian life. Any age or gender or location :)	t5_2r076	True
1365905143.0	1cay7n	18/M/Aus looking for a Swedish person to learn Swedish from!	captaincrunchie	10	2	0	I'd really love to learn swedish, pm me if interested! 	t5_2r076	True
1365429747.0	1bx172	Seeking Postal Chess Partner	OtisTheZombie	10	1	3	"Hello Redditors!

I've got an itch to play chess via letters or postcards that I can't seem to scratch. Anyone interested?

I'm an amateur chess player looking for someone around the same level as me... Personally I know the rules well and have some knowledge of tactics, openings, endgame, etc. but I am not an incredibly strong player. I like to have fun and to contemplate moves.

For this game, we can use algebraic notation. I may slip in some descriptive notation since it sounds so cool but I will include the algebraic equivalent as well. I'll be setting the game up on my chess board at home, and you will also need a place to keep track of the game.

I think that's about it... If you think you'd be interested in this form of penpallery, please let me know and I'll get back to you. Thanks!"	t5_2r076	True
1365165829.0	1bq9jw	23/M/France	Machicoulis	9	1	8	"As kind of everyone here, i would love to talk to new people :D
Letters or emails are fine by me !
I'm currently working in Paris, working in IT.
I'm a huge SF reader, enjoy rugby, wine, beers, and food in general ! I'm actually not a bad cook myself.
I speak french, obvioulsy, english, and german (a bit rusty though).
If you would like to practice French, or just talk, i would be delighted to help !"	t5_2r076	True
1364959718.0	1bkcme	19/F/NC, US; aspiring teacher and vinyl collector -- all other topics welcome, too! [snail mail | email]	SetSailToTheStreets	9	3	14	"I just got some new pretty cherry blossom themed stationery, and I'd love to have someone to use it for! 

I prefer snail mail to email but both are fine."	t5_2r076	True
1364950573.0	1bk0ig	23/Female/GA, USA (mail of snail)	torimusictraveler	10	2	4	"Hi everyone!

I am very interested in finding one (or more) penpal(s). I enjoy reading/learning about other people and their environments. Right now, my interests are mainly focused on ethnomusicology and all that it involves (world music, traveling, dance, writing, folklore, anthropology, languages, etc). Currently, I am studying music performance (piano) after taking a few years off to figure things out. 

Would love to discuss our interests, thoughts, ideas, plans for the future, wherever the conversation leads. Please feel free to message or leave a comment. 

Thanks for reading!

Tori

 "	t5_2r076	True
1364765890.0	1bdoxk	16/F/USA Musician looking for someone to talk with and to meet new people.	bandgeek1575	9	1	14	I'm a bassoonist. If you have no idea what that is, that's what Google is for. I also enjoy learning new instruments, playing Xbox, rowing, and playing softball when I'm not injured (which happens frequently). PM me if you're interested and we can go from there. (:	t5_2r076	True
1364540241.0	1b8b1o	19/M/USA Looking for penpal or texting buddy or anything really! Just someone to talk with. 	fyidiot	9	1	1	From South Dakota, going to school for Criminal Justice degree; just looking for someone to talk to when I'm bored I guess..	t5_2r076	True
1364504163.0	1b77mu	39/F from KY looking for snail mail penpal 	brunee092	10	1	11	Anyone interested in becoming a snail mail penpal let me know. I would love to send letters back and forth with someone :) I had a penpal for many years when I was younger and would like to do it again. I live in Kentucky. I don't mind international pen pals either. I send lots of mail overseas so that's really no problem. 	t5_2r076	True
1364491982.0	1b6smg	30/M/Pakistan, non-religious, looking for anyone to talk with about games, anime, coding, Japanese/Chinese culture, or anything. (email preferred)	KilledHisCat	11	1	0	"I'm pretty much the local variant of the Western basement-dweller, with too much time on my hands and interested in just about everything, but I've never really had any friends here to talk with about anything. Now at 30 and having lost a number of special people and pets in my life I feel it's time to be more receptive towards making new friends.

I'm not religious and I don't hate whatever it is that people here are supposed to hate. I'd love to have someone to share my obscure discoveries in games and anime and movies with, and discuss anything from philosophy to the latest Adventure Time episode.

I'm mostly straight edge (the idea not the music,) into retro games, RPGs, D&amp;D, steampunk, dabbling in game development, movies like Fight Club and The Cube and Sweeney Todd, all genres of music (I love Linkin Park, Papa Roach and A.F.I., though I mostly only get exposure to game and anime soundtracks,) books like Chrestomanci, Romance of the Three Kingdoms, Sword of Truth, anything by Tolkien, Temeraire and the Redwall series, and I frickin LOVE CATS.

Most of all I'd love to have someone to practice the Japanese language with, and discuss Japanese and Chinese culture with, so anyone with any experience or interest in that area is highly welcome!

You may also feel free to ask me about life in Pakistan and the like.

I'd prefer email because you can't really trust the snail-mail over here, but I don't mind using more reliable courier services if you really want me to.

EDIT: Tidying up."	t5_2r076	True
1364409586.0	1b4itp	21/F/USA Looking for email penpal	NagisaFurukawa	10	1	4	I'm a stay at home mom, so I'm looking for an email or IM penpal. I'm into anime and manga, as well as art and video games. I'm a political science major with a minor in east asian studies. So if any of that stuff interests you, send me a message and we can talk :)	t5_2r076	True
1364364611.0	1b3i0a	23yo gay Texan male	coilythespringsprite	13	5	2	"I'm into poetry, writing in general, games from table top to hand held and anything in between. I've recently been getting into natural foods and plan to increase my hippie level over 9000. I've never really left this state, do I'm looking for any one to talk to. Over seas would be nice, but I'm not to picky. Preferably emails then maybe Skype or some other chat then pics. I'm kind of shy and new to this.

Pm me if interested."	t5_2r076	True
1364303978.0	1b1ff7	21/M/Belgium. International snail mail.	pieterdc1	10	1	2	"I can write about anything, I'd love to hear all kinds of stuff you do in your life, passions, hobbies, troubles, anything really, involve me in your personal life like I would be an interactive diary, I would like to do something similar. 

I'm a creative person, I study Computer Science at the university of Ghent. I enjoy all kinds of SF, fantasy and anime. I love videogames. I am intruiged by science. I really love Roman and Greek mythology and phylosophy. I am building a robot. I go swimming three times a week. I got a lot to talk about and tons of cool stories to tell.

I'd like a pen pal who's open minded about things and can talk about things like drugs as well."	t5_2r076	True
1364238632.0	1aznjr	An anonymous letter.		10	1	1	I don't want you to know where I live, or even my age, or sex(although, you might be able to figure it out from the writing). I don't want replies. I don't care who you are or where you are from, I just want to write to you. Just PM me if you are interested.	t5_2r076	True
1364209518.0	1ayu2n	22F USA - (e-mail but snail mail can be discussed)  Struggling with depression, looking for another blue buddie so we can get out of this together	unodosetrace	9	2	8	"So I'm trying to handle my depression in the healiest way possiable. My boyfriend is extremely unhelpful and doesn't understand depression or what it does to you. He told me ""I've been sad but I never let myself get depressed"".

So what I'm thinking is my pen pal(s) we can be each others support and therapy (unless one of us needs serious.help in which I want you to tell me, girl get your ass to a Professional! And I will tell you the same if its serious and you need it). 

Sometimes you need to vent. Sometimes you need a set of eyes outside of your own life. We can commiserate  together and then get up and move on together. It's my hope that we can positively impact each other and kick our depression to the curb. Or at least beat it back into submission."	t5_2r076	True
1364101220.0	1awfap	16/M/USA Photography pals?	timnitro	12	3	1	"Looking for a friendly person with a camera to exchange emails and photos with eachother. Particularly if you live in an ineresting area PM me. Im alittle busy but im good on keeping up on things.I appreciate music,art,photography and recently writing. Im a good listener feel free to tell me anything. oh and I speak english and a spanish( not very well).
If you are interested PM me or leave a message in the comments. 
All you need is a digital camera of any kind. "	t5_2r076	True
1363983010.0	1atief	23/F/USA Starting a new life adventure and looking to share stories with new folks	jwesternstate26	10	4	7	Hi! I'm starting a new job in a week and a half in a new state and will be living in a cottage by myself. I want to try and have some cool snail mail and email pals to help my move go easier and I love talking to new friends. 	t5_2r076	True
1363917259.0	1arvm6	15/M/USA Extremely bored lately, Penpal-ing seems exciting...	Orangebanannax	11	4	2	"Well, like i said, i'm a 15 year old guy that lives in the USA. I enjoy retro gaming, reading old books, collecting old stuff...you get the picture. I like old things.

I am open to talking with almost anyone (unless you're a creep. Then no.), so let's see who wants to talk to me!

*edit

Wierd sentence structure...."	t5_2r076	True
1363818728.0	1aoz21	18/F/USA looking for a British penpal!	morganjarvis88	12	5	9	"Hi! I have a Uni project that requires me to talk to some folks from across the pond, but I would also love to meet some new people in general.

Some more about me, my name's Morgan, I'm in my first year of college, I love cooking and baking, travel, pottery, and sloths. "	t5_2r076	True
1363474077.0	1aflqb	18/F/Canada, be my snail mail pen pal?	contenido-energetico	9	1	4	"Hello! I'm 18 years old, and I live in Newfoundland, Canada. I'm looking to find a pen pal (or a few!) to exchange things via real mail. Writing and receiving mail is fun, and I think you can tell a lot about a person by the stamps they use.

About me, I'm in my first year of university studying engineering, hoping to specialize in electrical. I like to read newer poetry but also older books. I've been doing improv (improvised theatre) for 6 years, and am now a trainer as well as a performer.

I like to listen to a lot of different music, but I generally avoid the big heavy shouty music. Dainty ears, I guess. My favourite album is either Graceland (Simon &amp; Garfunkel) or 69 Love Songs (The Magnetic Fields). I would love to trade music suggestions or mixtapes or something.

If you're interested send me a message/comment/etc, and I hope to hear from you soon! :)

Edit: I mean message me to become **snail mail** pen pals. I like letters. :)"	t5_2r076	True
1363353368.0	1acjgw	35/F Seeking Pen Pal via email.	Lisabeth1577	11	4	3	"I recently broke my ankle and am currently couch bound for the next 5 weeks. Looking for pen pals to pass the time and hopefully develope friendships outside of the circle of people that I know. I would describe myself a dreamer/realist just looking for a friendly email exchange. If you or someone else has
 described you as creepy, please do not respond. 
"	t5_2r076	True
1363289746.0	1aawp1	23/M/Uruguay	jay2011	11	1	1	"Looking for someone to talk about anything really.. English is not my first language but I really love it and I would love to improve it, so if any of you guys need help with spanish just let me know.
I really like to watch movies, play games online and I love science.
Let me know if you would like to send Emails, talk/chat on skype or even texting.
Sorry if I made any grammar/spelling mistake.
Have a nice day :)"	t5_2r076	True
1363215390.0	1a8x5i	24/M/US - Looking for people to converse with	TheGreatWildFrontier	10	3	4	"Hello. I've never had a penpal before but this is something I would love to try. Email probably preferred but snail mail (depending on location) would be great to try as well. I really enjoy writing and talking to people. 

I enjoy music, hiking, photography, cooking, traveling, camping and driving on winding roads. Music is the love of my life. I listen to a lot of folk, indie, jazz and electronic music. I'll listen to virtually anything though. I get out to live shows pretty often - the last band I saw was Yo La Tengo. I also play several instruments. The other love of my life is the great outdoors. If I could, I'd go hiking every single day. I love everything about nature. I also love beer and tea.

I work as a graphic designer and spend my days on the computer so I would reply fairly often. I love hearing other people's stories and telling stories of my own. If you feel like we have any common interests or would just like to talk about anything, please feel free to PM me!"	t5_2r076	True
1362862479.0	19zkk7	23/M/New Mexico USA looking for someone to chat with on Skype or email.	tjones22	9	1	0	I live in New Mexico in would love to meet some different people from around the world. PM me if you are interested!	t5_2r076	True
1362777975.0	19xnvk	20/F/US Looking for a reciprocal snail mail participant	shady-sam	10	2	0	"I'm looking for a like-minded penpal preferably in the same range, but not necessarily. I love to write and draw, but haven't as of late because I haven't the motivation to. I hope to change that by exchanging letters with one of you lucky lads, gals, etc!

I'm quite paranoid that one of you will try to hunt me down and kill me so I'll need you to send some verification, please. 

I'm interested in art, music, small animals, other people, other species, books, tv shows and movies (if they're on Netflix esp. documentaries, science fiction movies, indie films), video games (Xbox mostly).

How to strike my interest: Tell me a story! It doesn't have to be long or true, it's just to see whether we would get along or not. Thank you for your interest and have a wonderful day!"	t5_2r076	True
