created_utc	id	title	author	ups	downs	num_comments	selftext	subreddit_id	is_self
1318185728.0	l67pa	How I Feel About Ryan Bates	seriouslyawesome	240	26	23		t5_2qh21	False
1334948579.0	sk4qq	Freightrain - easy Ruby desktop development	bolthar	174	10	32	"Hello everyone,

This is a little framework of mine that I've built out of a personal need - basically, I wanted to write a desktop app using Ruby and I found it daunting to say the least.

So, I've built Freightrain to take care of all the stuff I really shouldn't care about, like loading interface definitions, cross-toolkit compatibility and the likes.

Now I've been working on it for almost 2 years (on and off of course) and, since I've just fixed it so it loads the newest glade specifications, I thought that I could ask you guys for an evaluation.

There's a little readme on the github page and there are some examples in the /examples folder.

[Link to the github page!](http://github.com/bolthar/freightrain)

WHOA! Thanks for the attention, I thought this was going to be ignored...

How many of you would be interested in a step by step tutorial over the major features? I will build that if there's enough interest."	t5_2qh21	True
1361696882.0	194kf4	Ruby 2.0.0 Released	laerien	165	10	26		t5_2qh21	False
1277917923.0	cklw4	Ruby sex symbol	retardo	162	14	5		t5_2qh21	False
1352404220.0	12vfbk	101 Things You Didn't Know You Could Do (with Ruby 1.9.3) by James Edward Gray II - My head is about to explode	obviousoctopus	143	12	7		t5_2qh21	False
1283124624.0	d6zx4	Rails 3.0: It's ready!		123	5	20		t5_2qh21	False
1328107959.0	p65l2	Just got back from an excellent ThoughtBot training -- got one of these.	s3ddd	130	15	48		t5_2qh21	False
1294357928.0	exkar	My development career thus far	Perceptes	139	24	31		t5_2qh21	False
1250703978.0	9c5uk	_why's sites %w(poignantguide hackety hobix etc) down and %w(github twitter) accounts deleted	slowernet	132	21	12		t5_2qh21	False
1331817047.0	qxpyq	Where’s _why?	tuker	144	35	29		t5_2qh21	False
1355841191.0	151wds	We had a discussion about hash syntax at work today. It didn't end pretty.	Stuffchunk	129	23	50		t5_2qh21	False
1351983186.0	12l390	Met this nice guy at Rubyconf!	stillspiraling	139	31	23		t5_2qh21	False
1310502123.0	inqva	Matz joins Heroku	chrisledet	112	8	9		t5_2qh21	False
1372557378.0	1hccg2	Ruby 1.8.7 is officially retired. Please stop using it.	dagbrown	118	13	45		t5_2qh21	False
1293060390.0	eq53g	_why the lucky stiff, we miss you	zombiecharlesdarwin	147	39	19	Please come back :)	t5_2qh21	True
1343320032.0	x72d1	Fail Whale	eventhorizon42	121	25	33		t5_2qh21	False
1333025932.0	rj5s6	The Award for the Advancement of Free Software 2011 goes to Matz	mytrile	97	7	6		t5_2qh21	False
1338519568.0	uf0id	Please don't use Cucumber	Perceptes	110	17	64		t5_2qh21	False
1318948815.0	lgb6e	Guess I won't be getting any work done today...	jaked409	116	26	26		t5_2qh21	False
1375206063.0	1jd15p	Yet another ruby shortcut (`&amp;&amp;=`)	mikdiet	94	6	23		t5_2qh21	False
1359570666.0	17koua	Rubygems.org compromised	gurgeous	94	4	30		t5_2qh21	False
1370534038.0	1fsopk	Ruby vindicated: eye-tracking study finds that snake_case is more readable than camelCase.	metamatic	99	12	61		t5_2qh21	False
1330969673.0	qit3b	Why critics of Rails have it all wrong (and Ruby's bright multicore future)	bascule	98	8	9		t5_2qh21	False
1312337879.0	j7bdx	The Official Ruby Site Is Proudly Maintained by No-One		91	6	26		t5_2qh21	False
1352740645.0	132jfl	Ben Orenstein refactors code, live on Stage at Aloha Ruby Conf. And tought me a lot	berkes	95	9	29		t5_2qh21	False
1230062467.0	7ld78	Merb and Ruby on Rails merge for Rails 3.0	carllerche	95	10	15		t5_2qh21	False
1335107003.0	smo01	"Matz: ""How Emacs changed my life"" (and influenced Ruby)"	the-fritz	95	12	34		t5_2qh21	False
1318517714.0	lav7x	Gitlab released. A similar to github application but for your servers with private repositories only.	randx	97	16	18		t5_2qh21	False
1296139306.0	fa1nh	Oracle discontinues Ruby development support on NetBeans 7.0	mauriciolinhares	89	6	66		t5_2qh21	False
1363943111.0	1asgse	Why Ruby?	paran0ide	97	16	8		t5_2qh21	False
1291813176.0	ei9ax	Salesforce.com Buys Heroku For $212 Million In Cash	radim99	87	4	20		t5_2qh21	False
1357446648.0	161mik	_why's site is back up  - link to discussion on Hacker News	jaggederest	103	21	14		t5_2qh21	False
1332520351.0	ra587	Why You Should Be Excited About Garbage Collection in Ruby 2.0	pat_shaughnessy	81	2	2		t5_2qh21	False
1298364573.0	fq5yk	Why PHP is better than Ruby	djhworld	122	39	47		t5_2qh21	False
1363107259.0	1a5lvq	Ruby 2.0.0 in Detail	timblair	92	14	2		t5_2qh21	False
1303112020.0	gslll	The #1 Rubyist excuse for slacking off	Sirupsen	97	19	23		t5_2qh21	False
1358185427.0	16k7hl	A Look at Ruby 2.0	jesusangelm	87	7	12		t5_2qh21	False
1336065300.0	t5cup	I'm learning! :D	KerrickLong	103	29	33		t5_2qh21	False
1332536608.0	raixx	GitHub's Ruby Style Guide	requiemderseele	90	10	36		t5_2qh21	False
1268869628.0	ber8d	Ruby Best Practices: Full Book Now Available For Free!	BioGeek	79	1	2		t5_2qh21	False
1373845771.0	1iazk0	Master Matsumoto	Sudoaptgetreddit	101	24	17	"When Matsumoto first came to these shores, he met a precocious young hacker who was strong in the way of Perl, which had many practitioners then.

“Matsumoto,” the young man said, “why should I learn your foreign Ruby? I am strong in the way of Perl, and I have yet to find a problem it is not flexible enough to solve.”

Matsumoto smiled his kind smile and said, “One does not learn Ruby for oneself. One learns Ruby for others.”

“Ha,” the young man said, “then your way is not for me. I am not the cooperating type. I work on my own projects and my projects alone. No one but me reads my code.”

Matsumoto bowed his head and said, “All hackers cooperate, even you.”

“You are a fool, Matsumoto! Did I not just say I work alone?”

To this Matsumoto said, “Even he who works alone, cooperates with all the men he was and will become.”

Upon hearing this, the young man was enlightened."	t5_2qh21	True
1373682561.0	1i72ww	On Monday, I start a new career as a web developer in Ruby on Rails	caadbury	95	17	44	...and thanks to everyone in /r/ruby, /r/rails and /r/programming who helped me gain not only the skills but the confidence to make the switch.  I've been a lifelong marketer who always felt unfulfilled and spent nights/weekends/free time learning Ruby, Rails, MySQL, PostgreSQL, jQuery, and more, finally culminating in my first full-time development job.  Wish me luck!	t5_2qh21	True
1372180326.0	1h1qzd	Rails 4.0 final released	zigomir	81	6	18		t5_2qh21	False
1367595068.0	1dmgcg	A self-hosted, anti-social RSS Reader written in Ruby	_swanson	80	4	13		t5_2qh21	False
1313523782.0	jksg3	_whyday is Friday	thecoffman	88	14	18		t5_2qh21	False
1261251273.0	agk5s	_why's Estate	hober	76	3	32		t5_2qh21	False
1323348648.0	n4rt6	How I felt yesterday when I opened up some old PHP files after working on ruby full time for the last 6 months	s3ddd	98	26	10		t5_2qh21	False
1326330691.0	od7ev	I just got a 7+ year old rails app that started on rails 0.8.0 (or before), to load on rails 3.1 and ruby 1.9.3. This is how I feel.	taelor	98	26	26		t5_2qh21	False
1350042515.0	11d0x2	Ruby 1.9.3-p286 is released	Maledictus	76	8	19		t5_2qh21	False
1320812793.0	m5q0o	All gem pages should have this...	mannix913	79	10	6		t5_2qh21	False
1265928011.0	b10ww	Evolution of a Ruby Programmer	bschaefer	84	13	17		t5_2qh21	False
1342502616.0	worfg	I made a nice Ruby Debug Cheat Sheet.	appleyard	78	9	21		t5_2qh21	False
1337295227.0	tse0o	Ruby 1.9 lands NaCl support, can run in Chrome	matematikaadit	72	5	6		t5_2qh21	False
1281556127.0	d02bs	My husband is a programmer; I have no idea what that means.	renaebair	82	13	10		t5_2qh21	False
1365694648.0	1c51j3	Ruby 2.0 Works Hard So You Can Be Lazy	gthank	71	4	1		t5_2qh21	False
1360169334.0	1808d6	Announcing Topaz: A New Ruby	KerrickLong	79	14	54		t5_2qh21	False
1288826216.0	e0vtf	A latent gift from _why	retardo	74	8	6		t5_2qh21	False
1273861633.0	c46jh	Rubinius 1.0	judofyr	70	2	6		t5_2qh21	False
1375333419.0	1jh41u	Lets Build a Sinatra App	mweppler	76	6	17		t5_2qh21	False
1338911187.0	um7jb	15 Things for a Ruby Beginner	jackhammer2022	77	10	4		t5_2qh21	False
1363379771.0	1add8f	Ruby app server options [2013 edition]	FooBarWidget	78	12	29		t5_2qh21	False
1356040273.0	156uc8	Dammit Rubymine!	SCD101	81	15	46		t5_2qh21	False
1348265682.0	109rqk	Ruby’s magic underscore	threedaymonk	73	12	7		t5_2qh21	False
1347033501.0	zied3	Writing a successful Ruby gem (humor)	bioneuralnet	78	12	8		t5_2qh21	False
1375823220.0	1ju5yt	The Difference Between a Block, a Proc, and a Lambda in Ruby	awaxman11	74	10	6		t5_2qh21	False
1374998764.0	1j7gsg	RubyWarrior: a triumphant quest of adventure, love and destiny all within a few lines of code	paran0ide	68	9	20		t5_2qh21	False
1339013866.0	uoid4	Ruby is faster than Python, PHP, and Perl	retardo	81	18	38		t5_2qh21	False
1325559313.0	o0l7a	Rails Has Turned Me Into a Cannibalizing Idiot	retardo	90	27	15		t5_2qh21	False
1258986458.0	a7a6x	Amp - Mercurial rewritten in Ruby. Easily customizable. A young project with big ideas.	bobindashadows	70	11	13		t5_2qh21	False
1361336422.0	18vaog	Ruby - Handling 1 Million Concurrent Connections		75	9	21		t5_2qh21	False
1357582034.0	164pd1	ruby 2.0.0-rc1 released	mssola	69	6	22		t5_2qh21	False
1325705107.0	o2ugy	Never create Ruby strings longer than 23 characters - Pat Shaughnessy	indefinitearticle	74	14	17		t5_2qh21	False
1273187852.0	c0t1r	Why's (Poignant) Guide to Ruby	lukjad007	73	10	19		t5_2qh21	False
1269440854.0	bhl2q	Ruby Summer of Code	judofyr	69	7	4		t5_2qh21	False
1234803861.0	7xsyo	_Why the Lucky Stiff Drawn Interview	Sobe	73	14	7		t5_2qh21	False
1225739785.0	7b2gn	why the lucky stiff responds to nokogirl (about hpricot)	aneeley	73	13	13		t5_2qh21	False
1368547838.0	1ebkfu	Ruby 2.0.0-p195 is released.	duggieawesome	66	7	8		t5_2qh21	False
1316405912.0	kk5ln	Ruby to be the first Japanese made programming language to become an international standard sometime next year	cwgem	63	2	10	"This is a translation of [an article by 日刊工業新聞 (nikkan)](http://www.nikkan.co.jp/news/nkx0220110919aaac.html) which is a publication dedicated to industry news in Japan.

  The Japan based Ruby language is set to become an international standard in 2012 through the International Organization for Standardization (ISO). Ruby was already standardized through Japanese Industrial Standards (JIS), and the focus will now be directed towards its recognition in the global community by becoming an official ISO standard. This would be the first time a programming language of Japanese origin would become an ISO standard. The nation of Japan hopes that this will increase its recognition in the primarily western dominated software field.

  Ruby was developed by fellow Yukihiro Matsumoto at the National Applied Communication Laboratory (Matsue city). Features such as the ability to architect high level applications with ease has gained Ruby fast popularity around web development both inside and outside the country.

  The ISO standardization of Ruby is being pushed by the Information-technology Promotion Agency (IPA). Domestically Ruby became a JIS standard (JIS X3017) in March from a proposal by the Ruby Standardization Study Working Group."	t5_2qh21	True
1365801980.0	1c8dv0	_why updated his site	AaronLasseigne	76	15	15		t5_2qh21	False
1335294303.0	sqdzl	Finally, a gem to help during the interview process. 	duggieawesome	68	7	3		t5_2qh21	False
1368115569.0	1e0acw	RubyMotion Goes 2.0 And Gets OSX Support, Templates and Plugins	OnMyDevAccount	62	1	5		t5_2qh21	False
1366207558.0	1cj6e5	_why is publishing something on April 18th, and this is the (OCaml) code he released for it. Be sure to run it tomorrow.	iandennismiller	72	13	50		t5_2qh21	False
1359744252.0	17phw0	RubyGems is back - give the Team a Hug	chrisarchitect	73	10	3		t5_2qh21	False
1366307874.0	1cmb3v	_why's site updated again	timruffles	75	17	12		t5_2qh21	False
1365459295.0	1by48q	Decaf : Ruby in the Browser	AaronLasseigne	61	6	12		t5_2qh21	False
1344953131.0	y7axy	This is pretty much THE rake tutorial -- give it a look!	KerrickLong	64	4	2		t5_2qh21	False
1237478480.0	85xi9	"""Rails Is A Ghetto"" -- Zed deletes the rant, with a statement. Nice."	mshiltonj	75	18	23		t5_2qh21	False
1371055463.0	1g7dy3	Nobody understands the GIL	jstorimer	67	11	22		t5_2qh21	False
1366460790.0	1cqkod	Scorched Earth game clone in Ruby!	moriarty_	66	6	19		t5_2qh21	False
1353259786.0	13ekhd	British Ruby Conference Cancelled	atariboy	73	14	114		t5_2qh21	False
1351876107.0	12it24	Preview of the new features in Ruby 2.0.0	boffbowsh	69	11	22		t5_2qh21	False
1345485873.0	yj8h1	University of Reddit : Web Programming with Ruby on Rails	schneems	66	8	16		t5_2qh21	False
1345218575.0	ydqip	Rails Hosting Survey 2012 Results Are In!	whitet73	62	7	0		t5_2qh21	False
1310885339.0	irurq	Ray, a ruby game library	Mon_Ouie	64	6	11		t5_2qh21	False
1250442291.0	9b59b	Teaching Ruby to High School Girls	avdi	62	5	10		t5_2qh21	False
1360360222.0	185mz0	Ruby 2.0.0-rc2 is released	KerrickLong	62	6	1		t5_2qh21	False
1356597766.0	15ifu6	DHH: The five programming books that meant most to me	paran0ide	74	17	2		t5_2qh21	False
1327519782.0	owfd1	Lisp in 40 lines of Ruby		60	5	8		t5_2qh21	False
1319983611.0	lu2vk	[ANN] Ruby 1.9.3-p0 is out	cwgem	58	1	17		t5_2qh21	False
1312592517.0	jaeg0	RubyLang.info - a new Ruby site for us, by us!	chrisledet	58	3	34		t5_2qh21	False
1282146072.0	d2mbm	[ANN] Ruby 1.9.2 is released	tenderlove	60	7	17		t5_2qh21	False
1274656436.0	c7d30	_why: A Tale Of A Post-Modern Genius	abc-xyz	69	13	9		t5_2qh21	False
1348144313.0	106t3o	What to expect in Rails 4.0	paran0ide	61	6	11		t5_2qh21	False
1340299535.0	ve25a	Using Sublime Text 2 with Ruby and RSpec	brynary	55	2	12		t5_2qh21	False
1320598448.0	m2hfc	Well, this is embarrassing... (*serious* RSA bug)	Pyryara	59	4	17		t5_2qh21	False
1319256884.0	lkpx8	This man singlehandedly pulled my head out of my ass: a Ruby internals primer	uzimonkey	54	0	10		t5_2qh21	False
1233335478.0	7tnoa	[ANN] Ruby 1.9.1 is released	yaserbuntu	63	9	6		t5_2qh21	False
1361896750.0	199l03	strftimer - A Ruby strftime generator I made for lazy Rubyists like myself	edforshaw	62	9	14		t5_2qh21	False
1351105640.0	120rp0	Ruby 2.0.0 feature freeze	just_lest	59	6	30		t5_2qh21	False
1327976533.0	p3xu0	I learned ruby a few weeks ago and redesigned the reddit front page using the API. How did I do?	brandonroot	66	16	19		t5_2qh21	False
1325017889.0	nsne9	Ruby Developers Offended by $2,800 Ruby Class	citadrianne	65	13	39		t5_2qh21	False
1299529204.0	fz8sv	Hey Apple, please be nice and share: MacRuby in OS X Lion	retardo	61	6	7		t5_2qh21	False
1251133664.0	9dnd6	Yehuda Katz's 10 Favorite Things About Ruby	wifelette	61	6	13		t5_2qh21	False
1375105091.0	1j9wqw	What is one thing you wish you knew when starting Ruby?	ProductiveThings	59	8	69	"Hello /r/ruby 

I am new to Ruby, however I've programmed in C, C++, Java, and C# along with VB.NET, HTML, and minimal Python. 

I've heard that Ruby is a bit different and has quite the steep learning curve. So I ask you...

What is the one thing that you wish you knew before starting to learn or really use Ruby?

I also plan on using RoR if anyone has thoughts on that as well!

Any comments are appreciated! Thanks Guys!"	t5_2qh21	True
1351756670.0	12g5w4	Ruby 2.0 patch that could make Rails startup 2.2x faster	just_lest	64	10	10		t5_2qh21	False
1340899000.0	vquz7	Build Reddit Using Sinatra 	drurly	66	16	15		t5_2qh21	False
1295978162.0	f8tb5	Clever Algorithms, Nature-Inspired Programming Recipes in Ruby	judofyr	59	7	8		t5_2qh21	False
1260234822.0	ac6kl	Worst. Ideas. Evar. RubyConf 2009 Slides	zenspider	69	16	1		t5_2qh21	False
1226996301.0	7e26x	EngineYard reduces Rubinius team to 2 developers - time to consider helping out the Rubinius project 	murphee_	54	2	0		t5_2qh21	False
1371500992.0	1gjecw	Ruby 2.0.0 Now Default on All New Heroku Applications	schneems	61	12	3		t5_2qh21	False
1358903578.0	173cpc	Storyboard : A gem that turns your TV and Movies into eBooks	markolson	52	2	11		t5_2qh21	False
1354217701.0	140bxn	Matz: I decided not to introduce full refinement for Ruby 2.0.	awj	58	7	25		t5_2qh21	False
1323737024.0	nabmy	Programming With Nothing	jackhammer2022	56	4	9		t5_2qh21	False
1276615968.0	cf8xe	Rethinking PDF Creation in Ruby	gst	60	12	12		t5_2qh21	False
1272453279.0	bx733	What I wish a Ruby programmer had told me one year ago..	Sirupsen	74	25	16		t5_2qh21	False
1374075218.0	1ihol8	Good guy ruby community member reminds you to add a license to your gemspec	markrebec	67	18	2		t5_2qh21	False
1368839457.0	1ejxf3	Sandi Metz’ rules for developers	Croaky	67	16	14		t5_2qh21	False
1362968487.0	1a23m7	What's new in Sinatra 1.4?	KerrickLong	61	9	0		t5_2qh21	False
1362853366.0	19zay2	Ruby Demystified: and vs. &amp;&amp;	AaronLasseigne	56	9	17		t5_2qh21	False
1337192323.0	tqav1	The Bastards Book of Ruby	PilotPirx	54	5	10		t5_2qh21	False
1323231095.0	n3h73	How not to recruit	ambethia	51	3	12		t5_2qh21	False
1320447719.0	m0upe	The Number One Trait of a Great Developer	egreenberg	58	10	6		t5_2qh21	False
1311631073.0	izkjn	Ruby Coding Style Guide	chrisledet	59	8	52		t5_2qh21	False
1310593121.0	iotqi	Appreciating the power of a true community (Ruby from a .NET dev's perspective)		52	5	4		t5_2qh21	False
1297980338.0	fnhem	What's next for Rubinius?	retardo	51	4	0		t5_2qh21	False
1361549586.0	190ylf	Ruby 1.9.3-p392 is released - security fixes about bundled JSON and REXML	AaronLasseigne	56	6	1		t5_2qh21	False
1348685215.0	10iqao	"Turbolinks - replace &lt;body&gt; instead of loading the whole page. dhh says ""default-on in Rails 4.0"""	gurgeous	59	10	85		t5_2qh21	False
1334160863.0	s4ifz	Ubuntu is finally getting a new version of Ruby	cunningllinguist	57	8	24		t5_2qh21	False
1327082795.0	op3lw	Rails 3.2.0: Faster dev mode &amp; routing, explain queries, tagged logger, store	jsnk	54	5	4		t5_2qh21	False
1312994463.0	jeq52	gem install lolcat	gemr4	60	11	16		t5_2qh21	False
1260350931.0	acpmi	"""Ruby seemed like it might bring the fun back, and it hasn’t disappointed."""	annjellicle	51	5	5		t5_2qh21	False
1254896737.0	9rldy	I like Unicorn because it's Unix		52	3	2		t5_2qh21	False
1245342769.0	8tmzu	Ruby has entered the Enterprise thanks to the Enterprise gem	aaronp	56	7	15		t5_2qh21	False
1373292947.0	1hv4lm	The Self-Pipe Trick Explained	jstorimer	53	5	4		t5_2qh21	False
1340643310.0	vkuwx	Data Scraping and More With Ruby, Nokogiri, Sinatra and Heroku	hpowers	56	6	15		t5_2qh21	False
1324737344.0	np5by	Christmas tree in 140 characters Ruby code	camilleroux	52	6	19		t5_2qh21	False
1248078827.0	92r0k	Rails 3: The Great Decoupling 	gst	49	3	0		t5_2qh21	False
1367433422.0	1dhwpx	Hey Judy, don't make it bad	chrisledet	57	9	2		t5_2qh21	False
1353692462.0	13oaeq	Falcon's performace patch for ruby-1.9.3-p327 is here	funny_falcon	50	7	23		t5_2qh21	False
1329746086.0	pxrj5	A friend sent me some Chunky Bacon from South Africa	TheChunkyBacon	64	18	9		t5_2qh21	False
1308343270.0	i2fpt	Making HAML faster	cheald	50	1	0		t5_2qh21	False
1287091003.0	drc4u	ARel 2.0	coffeesounds	50	1	2		t5_2qh21	False
1280419186.0	cv4au	Rails Snowman (☃): What's with the _snowman tag in Rails?	retardo	57	7	9		t5_2qh21	False
1265146526.0	axaal	Ruby on Rails 3.0 Release Notes	retardo	52	2	4		t5_2qh21	False
1260196694.0	abzdg	Ruby Gets An Official Spec: Heading To Become An ISO International Standard	gst	51	3	10		t5_2qh21	False
1251085069.0	9dge7	Rush: Rush is a replacement for the unix shell (bash, zsh, etc) which uses pure Ruby syntax.	malcontent	57	6	20		t5_2qh21	False
1323904508.0	nd09p	What's the difference between rack, thin, sinatra, mongrel ,etc?	ZestyOne	54	7	29	"I understand from command line what I have to do and the steps involved, but more specifically I'm not sure what these commands actually ARE. I understand they're handling all the requests from ruby &lt;--&gt; http requests but thats about the extent of my knowledge.

For example with sinatra i can just do 'ruby main.rb' and it ""takes the stage"" on a certain port. how come this isnt enough? Why do I need rack too?

Second, what does rack actually do?

What does thin and mongrel actually do?

Does rails have to use these too or does it have one built in?

Thanks!"	t5_2qh21	True
1311096954.0	iu00i	Rails development mode 300% faster	snatchery	54	8	18		t5_2qh21	False
1308567710.0	i48i0	Rubular: a Ruby regular expression editor and tester	creatures	50	4	21		t5_2qh21	False
1288015803.0	dw2lp	Sinatra 1.1.0 is out, and it looks like some solid changes made it in (SCSS, before/after with URL filters, settings at top level)	johnbintz	54	9	11		t5_2qh21	False
1262497666.0	akza0	The Craziest F***ing Bug I’ve Ever Seen	cldwalker	54	9	0		t5_2qh21	False
1246890126.0	8ymju	HAML 2.2 released	aubergene	49	3	3		t5_2qh21	False
1367366259.0	1dg40x	YSK that Confreaks publishes a solid stream of awesome talks, mostly from Ruby-related events. On their website (linked) but also on YouTube and via twitter as @confreaks	obviousoctopus	46	3	4		t5_2qh21	False
1364152206.0	1axddn	I found Kickstarter's API and started a gem to access it: Kickscraper	markolson	53	6	10		t5_2qh21	False
1360654621.0	18d83h	YAML f7u12, by tenderlove	blambeau	53	9	14		t5_2qh21	False
1355562696.0	14w0nj	Ruby on Rails Instruction - v3.2.8 (+30 videos)	Alsqr	47	1	0		t5_2qh21	False
1348954655.0	10omln	Show Reddit: I was frustrated with programming interviews, so I made this.	initialround	55	7	16	"I launched my startup last week and I thought it might appeal to the users of /r/ruby.

The idea is to improve programming interviews by making applicants fix code with broken unit tests in the browser. Versions of Javascript, Python and Ruby are currently supported.
Please let me know what you think: [Initial Round](http://initialround.com)

Also, I wrote some blog posts [here](http://blog.initialround.com/) to expand on the concept.

Finally, I've been asked by other Ruby devs whether the app supports rspec and other declarative testing frameworks. Right now, sadly not, it's limited to core Ruby, but it's on my feature master list :)

Edit (09/30) : I've added a free plan for evaluating the app. Right now, it's limited to one interview per month, but this might increase as I assess usage."	t5_2qh21	True
1340379420.0	vfthx	My company's 2-day hackathon project...mayhem ensues.	beholdthepanda	59	17	15	"http://onebigchatroom.com

Many thanks to my employer and coworkers at Eastmedia for turning an idea for a joke website - into a joke website.
http://onebigchatroom.com is the product of our two day hackathon.

It is what it says it is - one, boisterously loud, pachinko machine of a chatroom - where you can delete your fellow chatter's messages.

Along the way we got to play with:

    HTML5 audio
    Web Sockets (Faye)
    CSS Animations
    Coffeescript
    The patience of our office's neighbors

It's the Friday before GORUCO.
You deserve a break today.

-Te Amo.
Eastmedia Developers

EDIT: For a bit of privacy http://onebigchatroom.com/YOURROOMNAM"	t5_2qh21	True
1329396217.0	ps8gz	Ruby 1.9.3-p125 and 1.8.7-p358 have been released	emboss_	48	5	15		t5_2qh21	False
1317321298.0	kvjrw	Ruby newbie - I don't understand yield	glenbolake	47	3	36	"I'm going through the Ruby Koans right now as part of trying to learn Ruby. I just finished the about_blocks koan and I really just don't understand how the `yield` keyword works. Example code from the koan:

    def many_yields
      yield(:peanut)
      yield(:butter)
      yield(:and)
      yield(:jelly)
    end

    def test_methods_can_call_yield_many_times
      result = []
      many_yields { |item| result &lt;&lt; item }
      assert_equal [:peanut, :butter, :and, :jelly], result
    end

I can see that `result` is getting all four yielded values from `many_yields`, but I don't really understand what's going on. I especially don't understand the cases where yield is called without any values. Can somebody explain this keyword to me?"	t5_2qh21	True
1315321316.0	k6gjx	What I learned in four years as a Rails consultant	noelrap	51	6	2		t5_2qh21	False
1295365889.0	f4hbw	To the person pleading for RoR help	ClobberMcAdams	53	9	15	"Posting here because the thread seems to be deleted.

If you have a CS background, you can easily learn RoR from:

**Books:**

[Ruby on Rails 3 Tutorial book](http://www.amazon.com/gp/product/0321743121/ref=s9_simh_gw_p14_d0_i1?pf_rd_m=ATVPDKIKX0DER&amp;pf_rd_s=center-2&amp;pf_rd_r=1NBTF1DCVPCNP296JJTF&amp;pf_rd_t=101&amp;pf_rd_p=470938631&amp;pf_rd_i=507846)

or free online version: http://railstutorial.org/

[Beginning Rails 3 book](http://www.amazon.com/gp/product/1430224339/ref=s9_simh_gw_p14_d0_i2?pf_rd_m=ATVPDKIKX0DER&amp;pf_rd_s=center-2&amp;pf_rd_r=1NBTF1DCVPCNP296JJTF&amp;pf_rd_t=101&amp;pf_rd_p=470938631&amp;pf_rd_i=507846)

[Agile Web Development with Rails book](http://www.amazon.com/gp/product/1430224339/ref=s9_simh_gw_p14_d0_i2?pf_rd_m=ATVPDKIKX0DER&amp;pf_rd_s=center-2&amp;pf_rd_r=1NBTF1DCVPCNP296JJTF&amp;pf_rd_t=101&amp;pf_rd_p=470938631&amp;pf_rd_i=507846)

[The Rails 3 Way book](http://www.amazon.com/Rails-Way-Addison-Wesley-Professional-Ruby/dp/0321601661/ref=sr_1_1?ie=UTF8&amp;qid=1295365344&amp;sr=8-1)

**Plus Rails 3 screencasts:**

http://rubyonrails.org/screencasts/rails3

http://railscasts.com/

or http://railsforzombies.org/

**Sources:**

http://programmingzen.com/rails-books/

http://programmingzen.com/ruby-and-rails-recommended-books/"	t5_2qh21	True
1285737682.0	dkcv4	An Introduction to Desktop Apps with Ruby	gst	62	14	6		t5_2qh21	False
1269381119.0	bhb73	Sinatra 1.0 Released: Major Milestone for Ruby's Best Webapp DSL	xternal	51	6	8		t5_2qh21	False
