created_utc	id	title	author	ups	downs	num_comments	selftext	subreddit_id	is_self
1228708006.0	7i0mz	Shoes 2 has been released: includes debugger, packager, integrated manual, and lots of neat stuff	mcantelon	50	3	5		t5_2qh21	False
1344008320.0	xmgd5	Why Rails 4 Live Streaming is a Big Deal	FooBarWidget	51	7	12		t5_2qh21	False
1331637995.0	quehl	Ruby 2.0 Enumerable::Lazy	gregolsen	53	10	15		t5_2qh21	False
1317086764.0	ksfsd	 Learn Ruby The Hard Way 	cdwillis	50	7	17		t5_2qh21	False
1292985988.0	epo4e	Rubinius 1.2.0 released	bakkdoor	45	1	2		t5_2qh21	False
1284559906.0	de6ox	Phusion Passenger 3.0.0 public beta 1 is out!	acangiano	53	8	21		t5_2qh21	False
1276269226.0	cdywq	August 19th is Whyday!		52	6	9		t5_2qh21	False
1269039660.0	bfoj0	Ruby Scales, AND It's Fast - If You Do It Right!	wifelette	49	4	6		t5_2qh21	False
1265052117.0	awsnl	OMG has been removed from Rails	tenderlove	51	3	5		t5_2qh21	False
1257428997.0	a18y5	A Japanese Teenage Boy Improved Ruby 1.9 Performance Up to 63%	gst	64	19	6		t5_2qh21	False
1250634151.0	9bvpn	Yehuda Katz's Five Favorite Things About Rails 3	frofro	48	6	1		t5_2qh21	False
1237217959.0	851zk	Rails 2.3 released	frofro	49	4	4		t5_2qh21	False
1235374001.0	7ziis	Building and Scaling a Startup on Rails: 12 Things We Learned the Hard Way	gst	51	6	3		t5_2qh21	False
1366400408.0	1cp0cl	_why's complete printer spool [PDF]	BadgerPriest	52	12	19		t5_2qh21	False
1360957820.0	18li35	Working With Ruby Threads: an upcoming ebook about multi-threading in Ruby	jstorimer	53	12	12		t5_2qh21	False
1357685167.0	167lc7	Multiple vulnerabilities in parameter parsing in Action Pack (CVE-2013-0156) (includes remote code execution, UPDATE IMMEDIATELY!)	ROFISH	47	7	2		t5_2qh21	False
1349687217.0	114phr	Keyword arguments in Ruby 2.0	just_lest	52	11	16		t5_2qh21	False
1321310088.0	mcakc	RVM gets a release manager, stable releases	retardo	43	2	8		t5_2qh21	False
1315876058.0	kdpdx	Eric Wong, author of the Unicorn and Rainbows webservers, has started a mailing list about Unix systems programming with Ruby	retardo	46	3	2		t5_2qh21	False
1306579447.0	hm68p	Speeding up Rails startup time	kamui	44	1	16		t5_2qh21	False
1263928689.0	arkoi	How many Ruby hackers does it take to change a lightbulb?	cldwalker	50	6	4		t5_2qh21	False
1250873073.0	9cujo	whymirror needs help finding maintainers for old _why projects	juliend2	49	6	0		t5_2qh21	False
1227306986.0	7ex4d	Rails 2.2 Released	arsal	44	1	5		t5_2qh21	False
1371676579.0	1gokqf	Meet Fifteen Ruby Core Committers	bleeding_light	46	4	0		t5_2qh21	False
1367921454.0	1dur29	Tutorial: iOS (iPhone) app using Rubymotion with a Ruby on Rails API backend	lucatironi	47	4	17		t5_2qh21	False
1361745109.0	195le6	My favorite part of Ruby 2.0.0p0	s3ddd	65	25	34		t5_2qh21	False
1336064533.0	t5c52	RubyMotion - Ruby for iOS	acangiano	50	6	18		t5_2qh21	False
1335966703.0	t399u	What Makes an Awesome Command-line Application?	davetron5000	50	12	12		t5_2qh21	False
1334897258.0	sj5kh	mruby	riko_tachibana	49	7	11		t5_2qh21	False
1328629495.0	pere6	Ruby Trick Shots: A video medley of Ruby tips and tricks	petercooper	47	2	17		t5_2qh21	False
1327708929.0	ozung	"Patch ruby 1.9.3-p0 for 30% faster rails boot (one-liner!)
"	burke	48	5	4		t5_2qh21	False
1318989424.0	lgzrj	What Ruby's ||= (Double Pipe / Or Equals) Really Does	petercooper	47	5	0		t5_2qh21	False
1305749881.0	heh2p	"RailsConf 2011: Aaron Patterson, ""Double Dream Hands: So Intense!"""	retardo	51	7	21		t5_2qh21	False
1270969464.0	bpb8m	Rails 3: Want it? Give.	retardo	55	14	18		t5_2qh21	False
1256569526.0	9xvs1	Gemcutter would be moving to rubygems.org and becoming RubyGems.org	weppos	45	6	0		t5_2qh21	False
1240073882.0	8diqr	Book of Ruby Completed: 425 pages, 300+ Sample Programs, FREE!	gst	49	8	16		t5_2qh21	False
1235546377.0	803j8	Net::SSH, Capistrano, and Saying Goodbye	gst	49	9	3		t5_2qh21	False
1201543003.0	66vrq	Suggestion: If you like ruby.reddit.com, please spread the word: blog about it!	raganwald	49	8	17		t5_2qh21	True
1376059507.0	1k10dw	What is the difference between a block, a proc, and a lambda in ruby?	gthank	63	23	10		t5_2qh21	False
1372808793.0	1hj641	Since 1.8.7 is retiring, will you continue using hash-rockets?	duggieawesome	44	6	68	Just a question of style. I personally love hash rockets, but may start moving over to the 1.9 syntax.	t5_2qh21	True
1368647205.0	1eei2p	Locks, Actors, and STM in pictures	egonSchiele	45	7	4		t5_2qh21	False
1360699230.0	18e93v	TIL that Array#first supports an optional argument. What are some stupid simple things that you didn't realize until much later into learning ruby?	Nanosleep	47	5	29	Pretty lame, I know. It's just always been force of habit to slice my arrays.	t5_2qh21	True
1359649785.0	17mvtq	What the rails security issue means for your startup	lpetrazickis	48	10	7		t5_2qh21	False
1358703149.0	16xqhc	RubyJS : RubyJS is a JavaScript implementation of all methods from Ruby 	kilik2049	57	17	9		t5_2qh21	False
1357074227.0	15sbva	Ruboto (JRuby on Android) 0.10.1 released! Updates to JRuby 1.7.1.  Makes Ruby 1.9 the default compatibility mode.	donv	47	4	0		t5_2qh21	False
1353592997.0	13mc3s	Making your ruby fly	lazmd	48	6	12		t5_2qh21	False
1347325155.0	zolxx	The Legend of Zelda - Overworld Theme	colonpee	49	9	20	"I've been goofing around with [UniMIDI](https://github.com/arirusso/unimidi) the past week and decided to sit down this weekend and make myself a little MIDI sandbox.


What this isn't:

  - an example of good programming practices

    I'm not out to build a good and dependable MIDI DSL, I just want to goof around with patterns, sequences and key changes. I've committed many atrocities - patching NilClass with method_missing being only a drop in the bucket. Some of it was taken directly, word for word, from the Necronomicon.
     

  - bug free

    I couldn't wait to translate my first chiptune. I haven't broken it down into small repeated sequences yet, I haven't fully tested all possible interactions yet...


  - a library you would want to include in your project

    (see above)


What this is:

  - commented and documented (with examples)
    
  - fun on a bun

  - Zelda


[The Legend of Zelda - Overworld Theme (source)](https://github.com/glucero/zelda/blob/master/zelda_overworld_theme.rb)

[mp3 rendering](https://github.com/glucero/zelda/raw/master/zelda_overworld_theme.mp3)"	t5_2qh21	True
1344729339.0	y2j8i	Unexpected Ruby behaviour	greyblake	46	7	13		t5_2qh21	False
1333727847.0	rwemt	Notch inspired me to write my own CPU in Ruby, similar to x86. Check it out!	robinw	44	6	18		t5_2qh21	False
1330526305.0	qbbx9	The Joke Is On Us: How Ruby 1.9 Supports the Goto Statement	nonrecursive	45	3	9		t5_2qh21	False
1327461607.0	oviaz	Big new RVM release, with changes to ruby installation, color output, and a mixed-mode gemset management feature	darkclark	47	7	9		t5_2qh21	False
1314760712.0	jzsjc	Ruby on Rails 3.1 Release Notes	tvon	47	2	3		t5_2qh21	False
1310703788.0	iq4g7	Amazon Web Services Blog: Introducing the AWS SDK for Ruby	gst	45	3	0		t5_2qh21	False
1303638631.0	gw8h7	Introducing a new and powerful alternative to IRB	banister	43	2	18		t5_2qh21	False
1295533847.0	f5t3u	Reddit shows its influence in Rails commit discussions	bluepojo	53	12	6		t5_2qh21	False
1292361657.0	elu2h	Beyond Ruby: Mirah, Reia, Rite 	PanosJee	45	7	0		t5_2qh21	False
1284874433.0	dfv6v	Read Ruby 1.9: Free Ebook About the Ruby Programming Language	gst	47	6	2		t5_2qh21	False
1282336417.0	d3l5r	Ruby 1.9.2 - is the first 'production-ready' version of Ruby 1.9 - and Rails 3 will be a big benefactor.	technologyjournalist	48	4	11		t5_2qh21	False
1230063399.0	7ldak	Merb gets merged into Rails 3	slowernet	49	4	0		t5_2qh21	False
1222358656.0	73iaz	RIP Guy Decoux	avdi	46	3	0		t5_2qh21	False
1372425040.0	1h8uqs	The Elements of Style in Ruby #3: Make Sure Something Is an Array	bozhidarb	43	4	20		t5_2qh21	False
1370116583.0	1fh9ti	Code Smells: Your Refactoring Cheat Codes	jpignata	51	11	6		t5_2qh21	False
1354478901.0	145w7u	krypt - the Next Level of Ruby Cryptography	emboss_	50	8	2		t5_2qh21	False
1352848662.0	135e9c	TermNote - Write Ruby or YAML, get keynote in your terminal	krainboltgreene	45	6	17		t5_2qh21	False
1350479172.0	11mlut	7 Ways to Decompose Fat ActiveRecord Models	just_lest	50	10	6		t5_2qh21	False
1348833937.0	10m545	Lightning JSON in Rails	just_lest	48	8	0		t5_2qh21	False
1347545266.0	ztlvj	raise “hell”: Better Programming Through Error Messages	just_lest	42	3	14		t5_2qh21	False
1324912608.0	nr6r0	RubyDoc is still w/ GoDaddy		68	27	5		t5_2qh21	False
1322580733.0	mtefu	The Ruby Reading List 	expertvoice	45	5	16		t5_2qh21	False
1305047372.0	h88ub	Here's how to contribute to Ruby's documentation. Let's all pitch in for 1.9.3!		42	0	2		t5_2qh21	False
1292377299.0	elygz	What is the biggest current problem in Ruby community?	progfu	47	8	134	"I've been trying to figure this one out in past few days and I'm quite unable to come up with reasonable answer.

* We have GitHub, most awesomest *social network* on the internet.
* We have RubyGems, centralized libraries for everything.
* We have JRuby, for those who want to stick in the Java world or do some real threading.
* We have Rails, possibly the best web framework available (django people please don't burry me alive)
* We have RSpec and Cucumber, which make me cry when I have to work with JUnit.
* We have great cloud hosting solutions like Heroku and Engine Yard.
* We have huge number of screencasts and tutorials, especially those high quality ones (Peepcode, Think Vitamin, Railscasts).
* Last but not least, we have Ruby, language which is fun to work with, expressive ... well you know.

The list could go on and on, so I guess you get my point. 

My question is: **What is missing? What do we need, but don't (yet) have?**"	t5_2qh21	True
1290641610.0	ebdaj	The Ruby Stdlib is not a Ghetto	hc5duke	47	10	6		t5_2qh21	False
1269179799.0	bg6sp	RSense - The most useful development tools for Ruby	gst	45	5	6		t5_2qh21	False
1267160295.0	b6oji	How to Apply to a Job - in Ruby	cldwalker	48	10	0		t5_2qh21	False
1262900387.0	amvbz	try ruby! (in your browser)	mebrahim	46	6	11		t5_2qh21	False
1261174576.0	agar5	Why I think Mongo is to Databases what Rails was to Frameworks	jnunemaker	40	0	13		t5_2qh21	False
1220418050.0	6zcrc	Ruby on V8 	gst	51	12	6		t5_2qh21	False
1369105535.0	1eqond	My first Ruby game. What did I do right/wrong?	demiankz	41	5	55	"I'm working my way through Zed's *Learn Ruby the Hard Way* and just completed my first week-long, make-your-own-game section.

Here it is on github (also my first repo):
https://github.com/demiankz/escapezeta.git

I've used most of what I know about ruby to make this game: functions, global variables, arrays, if/else, .include?, booleans, and a couple other random things. I have a feeling that there are major flaws in my code (nested if/else and global variables first among them, I'm sure).

I'd love to hear how an experienced rubyist would improve on my attempt."	t5_2qh21	True
1368168901.0	1e21f1	I recently launched a Ruby website and I would really appreciate any feedback on good / bad parts of the site. Thank you.	spilruby	44	5	39		t5_2qh21	False
1351817824.0	12hn01	Ruby 2.0.0-preview1 released	jesusangelm	44	4	11		t5_2qh21	False
1347897187.0	100z85	Cryptic Dollar Variables &amp; Their Meanings in Ruby	nixterrimus	49	10	6		t5_2qh21	False
1340195553.0	vbq8n	Ruby OpenSource Challenge	vinylova	45	5	19		t5_2qh21	False
1339796804.0	v43ap	RSpec's New Expectation Syntax	retardo	43	2	8		t5_2qh21	False
1329573968.0	pv7ux	An Introduction to Procs, Lambdas and Closures in Ruby	Bullwinkle_Moose	40	4	4		t5_2qh21	False
1329223161.0	pp0l1	The Pry Ecosystem	yorickpeterse	42	4	8		t5_2qh21	False
1324354053.0	njevm	Rails 3.2 RC1: Faster dev mode &amp; routing, explain queries, tagged logger, store	LindsayMorton	39	0	0		t5_2qh21	False
1319479475.0	lncjr	Ruby 2.0 Release Schedule Announced: Roll on 2013!	petercooper	42	1	2		t5_2qh21	False
1319205488.0	ljwuu	Unofficial Ruby on Rails 3 Style Guide		43	1	1		t5_2qh21	False
1308238838.0	i1ais	What if Rails isn't for beginners anymore?	mbleigh	51	11	25		t5_2qh21	False
1281643721.0	d0i0e	RIP rails snowman :(	retardo	46	9	7		t5_2qh21	False
1259518001.0	a988j	Rubyconf 2009 videos are out!	rb2k	44	4	8		t5_2qh21	False
1255121278.0	9sjsy	Github discontinues support for building gems	retardo	40	3	11		t5_2qh21	False
1246393434.0	8x35n	MacRuby Drops GIL - Gains Concurrent Threads	murphee_	40	1	13		t5_2qh21	False
1232578312.0	7rh3p	 When in Doubt, Turn to _why	gst	46	8	0		t5_2qh21	False
1220632339.0	6zuyx	Why is JRuby such a polarizing issue?	gst	43	3	9		t5_2qh21	False
1216741684.0	6sxdc	Don't forget about RubyForge	judofyr	45	6	9		t5_2qh21	False
1370263309.0	1fkssq	Here is how you wrap an existing C library, for use in Ruby	michiels	42	4	17		t5_2qh21	False
1361994354.0	19cgf0	Python for Ruby Programmers (LA RubyConf 2013)	facebiff	44	6	16		t5_2qh21	False
1360552623.0	18abdk	What are some good open source projects for Ruby beginners?	ghostwarfare	44	6	22	"Hey everyone, do you guys mind sharing what are good open source projects for Ruby beginners? 

Thanks for the help in advance!"	t5_2qh21	True
1354576045.0	1486y3	Ruby is more than Rails.	kingjacob	55	17	23		t5_2qh21	False
1353944713.0	13tdk9	The Split is Not Enough: Unicode Whitespace Shenigans for Rubyists	petercooper	43	1	21		t5_2qh21	False
1352718873.0	13248v	Ruby 1.9.3p327 released. Contains a security fix - check your apps!	emboss_	39	3	0		t5_2qh21	False
1350701523.0	11s6ey	Start Using Ruby % (Percent) Notation	teohm	49	8	13		t5_2qh21	False
1350566583.0	11orh7	Better Specs http://betterspecs.org  # good practical spec writing guidelines for #rspec	number5	47	8	6		t5_2qh21	False
1339424357.0	uw5t8	We found Capistrano and Vlad too slow, so we made our own deployer gem, and would love to hear your feedback.	aescnt	41	4	24		t5_2qh21	False
1335452257.0	stmgu	A little Ruby trick that made my night - rescuing multiple exceptions	pedrobelo	47	8	13		t5_2qh21	False
1334241586.0	s67pm	Wisdom I picked up from Eloquent Ruby, Chapters 10-19	thephilster	41	5	8		t5_2qh21	False
1320723276.0	m4dqg	The Ruby Standard Library May Be Converted to Gems for Ruby 2.0	RIP_Kashin	41	1	10		t5_2qh21	False
1288204520.0	dxavv	+= vs. &lt;&lt; 	adamgamble	50	13	34		t5_2qh21	False
1284501612.0	ddw4j	wycat's says goodbye to EY	tenderlove	46	6	5		t5_2qh21	False
1284311292.0	dcusn	Highly Recommended Book: Metaprogramming Ruby 	gst	43	8	5		t5_2qh21	False
1265339522.0	ay9ji	Rails 3.0.0 Beta released to Gemcutter.org. Plugin/gem developers, time to get to work!	nathanielb	39	1	0		t5_2qh21	False
1263583687.0	aq47z	Latest Developments in Ruby 1.9.2	3po	41	2	2		t5_2qh21	False
1249341284.0	977o9	Upgrading ruby from version 1.8 to 1.9.2 doubled the speed of my application. Thanks, ruby development team!		40	4	15	This particular app processes terabytes of data and runs for days at a time, so the extra speed boost makes a huge difference. The future of ruby is bright :-)	t5_2qh21	True
1237567513.0	867tc	I am learning Ruby. Reddit, could you tell me 3 Reasons why Ruby is your preferred Language?	kunjaan	53	11	72		t5_2qh21	True
1226299897.0	7ceci	Merb 1.0 approved by Matz (Ruby creator)	matt_aimonetti	48	9	0		t5_2qh21	False
1203588473.0	69had	Do not learn Ruby!	raganwald	46	9	4		t5_2qh21	False
1352135999.0	12obu2	Ruby 2.0 Preview Available on Heroku	schneems	39	2	1		t5_2qh21	False
1350946935.0	11worf	I've started helping teach a ruby/rails club at my U, and wrote up this blogpost for the students. Thought it might be interesting to r/ruby too	Paradox	47	11	20		t5_2qh21	False
1344228521.0	xqz6h	Rubymonk.com has their metaprogramming lesson up now! And it's free!	taterbase	45	9	7		t5_2qh21	False
1338698410.0	ui797	Try Ruby... Seriously.	canweriotnow	43	8	0		t5_2qh21	False
1336500984.0	tda6e	Hacker Says - quotes from hackers to hackers	juuser	45	8	7		t5_2qh21	False
1334681806.0	sefor	Introducing DCell: actor-based distributed objects for Ruby	bascule	42	3	7		t5_2qh21	False
1331050659.0	qka4c	Sinatra + Heroku = Super Fast Deployment on Ruby	oneforreddit	41	4	0		t5_2qh21	False
1330021496.0	q2t4m	r/ruby: writing gems is easy and fun. Do it!	xyzzy_b	41	4	52		t5_2qh21	False
1326731709.0	ojf8b	Rails or Sinatra: The Best of Both Worlds?	aaron_osteraas	42	2	29		t5_2qh21	False
1324319404.0	niqno	Fibur allows full concurrency during I/O operations in ruby	tenderlove	46	9	13		t5_2qh21	False
1300044397.0	g38e8	Ruby on Rails served by unicorn with nginx for static files and reverse proxy on Ubuntu – detailed guide.	trumansdog	48	10	36		t5_2qh21	False
1290969037.0	ecxlp	Ruby is beautiful (but I’m moving to Python) 	gst	43	6	24		t5_2qh21	False
1265563188.0	az5m7	The Building Blocks of Ruby	gst	41	6	0		t5_2qh21	False
1226607683.0	7d7k7	Concurrency is a Myth in Ruby	avdi	45	8	13		t5_2qh21	False
1203782858.0	69qb3	Matz google tech talk on Ruby 1.9	eegreg	41	2	1		t5_2qh21	False
1372872622.0	1hkucc	Exploring Rack	juror-number-8	40	5	0		t5_2qh21	False
1366817976.0	1d0jnn	Google Glass for Rubyist	jasonincode	41	3	0		t5_2qh21	False
1365004964.0	1blehc	MountainWest RubyConf 2013: Live Stream	blowmage	43	6	5		t5_2qh21	False
1348453870.0	10dfmx	A Unix Shell in Ruby	jstorimer	36	0	12		t5_2qh21	False
1344519818.0	xxsg9	Narihiro Nakamura: Ruby’s GC Innovator	pat_shaughnessy	42	8	0		t5_2qh21	False
1341533489.0	w3qac	DHH speaks out against RSpec and FactoryGirl. Do you agree?	russianbandit	44	8	121		t5_2qh21	False
1333591074.0	rtyuo	Wisdom I picked up from Eloquent Ruby, Chapters 1-9	thephilster	40	3	9		t5_2qh21	False
1333550402.0	rsx6x	Zero to Jekyll in 20 minutes	rwjblue	41	3	12		t5_2qh21	False
1326989860.0	onepa	pws: A command-line password manager written in 234 lines of Ruby	J-_-L	47	10	11		t5_2qh21	False
1323659463.0	n96v1	Why metaprogram when you can program?	retardo	38	1	14		t5_2qh21	False
1318431844.0	l9lxr	Creating Your First Gem	ruprict	43	7	4		t5_2qh21	False
1317906358.0	l2y8m	Rubyists Already Use Monadic Patterns	DuoSRX	43	9	15		t5_2qh21	False
1307032710.0	hq0tu	10 Ruby One Liners to Impress Your Friends	acangiano	56	18	24		t5_2qh21	False
1292589618.0	endmb	rails admin done right	cnicolaou	40	1	8		t5_2qh21	False
1284733187.0	df7nf	Ruby on Rails; How did you learn it?	inhll	41	7	29	"I've got a background in PHP and can't seem to figure out a good way to get started with RoR. I've worked on Lynda and that's fine but is outdated, I've run through the tutorials and I understand the agile framework, DRY, and scaffolding but I feel like there's something missing. I feel like Pragmatic Programmers is too deep, should I just keep going until I finish it and wait for the ""a-ha!"" moment?


**EDIT ONE:**

Thank you all for your help!

* [Heroku](http://heroku.com) seems like a really valuable way to push your stuff live on the web without worrying about setting up complicated web servers.
* [Ruby on Rails Guides](http://guides.rubyonrails.org/) are pretty good too.

I'm going to set up a simple app and see if I can get it going on Heroku and I'll share it here.

Thank you all again for all your help.

**EDIT TWO:**

Most useful command so far is:
    rails destroy scaffold [scaffold-name]

**EDIT THREE:**

After hours of fighting with pushing something live I've started from scratch using http://railstutorial.org/ and so far it's the best, clearest, most current tutorial I've seen. Thanks again folks, I'll keep you updated. I've got a way to go (setting up the environment is so far what seems to be taking the most time). I'll get there.

THANK YOU ALL AGAIN. Seriously, Reddit rules.

**EDIT FOUR:**

Git branches, [Heroku](http://heroku.com), and [Ruby on Rails Tutorial](http://railstutorial.org) are so far the best tools I've found. I'm about 1/3 of the way through RoRT and loving it. I'm running everything on 10.04 Ubuntu so if anyone has any questions or issues please PM me.

Thanks again to everyone for the help and advice."	t5_2qh21	True
1284401687.0	ddaw9	How two Pythonistas accidentally fell in love with Rails	retardo	42	7	2		t5_2qh21	False
1264348325.0	atk6p	suggestion: /r/ruby should have it's own cool icon, like /r/python does	anothernut	39	6	15		t5_2qh21	True
1258022763.0	a3l5i	Better Ruby Idioms	cldwalker	39	2	3		t5_2qh21	False
1244746023.0	8rr00	Rip - A rubygems alternative?	cldwalker	39	2	9		t5_2qh21	False
1243458276.0	8nqgy	MacRuby, changing the Ruby ecosystem	matt_aimonetti	44	7	4		t5_2qh21	False
1241212744.0	8h5gs	The future of Rails is Ruby 1.9 - real performance of 1.8, JRuby and 1.9 compared	adymo	40	4	7		t5_2qh21	False
1226132755.0	7c4ef	Merb 1.0	gst	46	9	1		t5_2qh21	False
1368466016.0	1e97aw	Learning Ruby, is this an ok place to ask questions?	Retsejme	40	3	34	"Hi ya'll.

I'm trying to learn Ruby from Codeacadamy.

In [this lesson](http://www.codecademy.com/courses/ruby-beginner-en-mzrZ6/0/6) I keep getting an error message, but the course says I can move on. I don't want to miss something fundamental, but can't figure out why I'm getting an error message. Any insight?

    puts ""Type in a short story""
    words = gets.chomp
    puts ""Type in the words you need to hide from your mom""
    redact = gets.chomp
    
    words.split ("" "")
    
    words.each do |word|
      if word != redact
        print word +"" ""
      else print ""HIDDEN ""
      end
     
    end        


Also, if this is the wrong place for these kind of annoying questions, I apologize."	t5_2qh21	True
1363706470.0	1alh9v	Rails updates to 3.2.13 to close denial of service and XSS holes	credativ	42	7	0		t5_2qh21	False
1359738836.0	17pb9h	Let's figure out a way to start signing RubyGems	bascule	46	9	14		t5_2qh21	False
1358275258.0	16mqt9	I added syntax documentation to ruby for the 2.0 release, what is missing?	drbrain	36	1	0		t5_2qh21	False
1357391985.0	1608nu	A collection of Ruby books compiled by a Rubyist of 7 years	nonrecursive	45	10	23		t5_2qh21	False
1356662366.0	15jvto	Ruby 1.9.3-p362 is released	johdu	42	3	18		t5_2qh21	False
1355486419.0	14u7zs	Don't subclass Struct classes please	makaroni4	47	14	23		t5_2qh21	False
1354035019.0	13voz2	"Dozens of Ruby tricks from James Edward Gray II
(slides from Aloha Ruby conference)"	criskiev	43	8	8		t5_2qh21	False
1349886471.0	119b47	A Fireside Chat About Optional Parentheses	yaserbuntu	47	13	10		t5_2qh21	False
1334086480.0	s30qi	Ruby Off Rails, Part 1: your first Ruby web app using Sinatra and Heroku	hmans	37	4	7		t5_2qh21	False
1332768595.0	re5ok	Practicing Ruby's second volume is now freely available	sandal	39	1	0		t5_2qh21	False
1318361849.0	l8mzy	"""What I've learned about testing over the last year"""	docwhat	36	1	5		t5_2qh21	False
1317250127.0	kulnn	(Real) Modern Ruby Development	cwgem	41	4	23		t5_2qh21	False
1317015559.0	krk8y	"""What Killed Smalltalk Could Kill Ruby, Too"" (RailsConf '09)"	emporsteigend	40	8	16		t5_2qh21	False
1316821351.0	kpl3a	Be Prepared for Ruby 1.9.3 and 1.9.4: What's New and What's Different	petercooper	42	4	14		t5_2qh21	False
1315953953.0	keppj	A totally unofficial Ruby coding style guide	cwgem	41	6	26		t5_2qh21	False
1314339413.0	juvgc	10 Ruby on Rails Best Practices	aaron_osteraas	44	7	14		t5_2qh21	False
1313978867.0	jq5pp	Scala and Ruby Rosetta Stone	jbrechtel	35	3	6		t5_2qh21	False
1302799392.0	gq0vv	Hey rails devs!		56	21	25		t5_2qh21	False
1299819313.0	g1pia	Hello r/ruby. I'm your new moderator, how would you improve r/ruby?	ViralInfection	41	8	53	"So jamesgolick was kind enough to make me moderator of the community. I want to make a promise to you guys that I'll do my best to keep it clean.

If you have any requests please let me know (like a valid link for the side navigation).

How do you want to see r/ruby improved? - A contest, guides, removing spam, etc. Let me know!"	t5_2qh21	True
1298531794.0	frnhi	Happy 18th Birthday, Ruby!	gst	41	7	3		t5_2qh21	False
1296059286.0	f9fan	How-to: Music Visualizer in 7 Steps with Ruby	foxbarrington	41	3	4		t5_2qh21	False
1279619497.0	crjyo	Camping vs Sinatra	judofyr	38	4	4		t5_2qh21	False
1255043309.0	9s7pm	"What I've Earned (And Learned) From Writing ""Beginning Ruby"""	zsoltika	41	8	4		t5_2qh21	False
1250797374.0	9cjyw	His Name is Robert Paulson	avdi	50	15	5		t5_2qh21	False
1249484495.0	97rx8	How to setup your Rails server right - Part 1	patched	43	6	3		t5_2qh21	False
1228832993.0	7ic48	The Great Ruby Shootout December 2008	Sobe	37	2	3		t5_2qh21	False
1223558531.0	76532	Why Ruby is My Favorite Language	gst	39	7	3		t5_2qh21	False
1206014349.0	6crnx	Big Name Companies Using Ruby on Rails	ellen_james	42	7	4		t5_2qh21	False
1205976204.0	6cpzv	Shotgun: The Rubinius Virtual Machine	PossibleMat	37	3	0		t5_2qh21	False
1205952414.0	6col3	Eric, please release the fast version RubyGems soon	aaronp	40	6	11		t5_2qh21	False
1373993349.0	1if8qe	The Plan for RSpec 3	spyc3r	37	5	3		t5_2qh21	False
1372012400.0	1gx4u3	Make Your Rails Application Multi-Threaded on Heroku	craz8	42	4	0		t5_2qh21	False
1362182679.0	19hth6	Code Typos Got You Down? Stop Worrying with close_enough	canweriotnow	46	11	31		t5_2qh21	False
1361853902.0	198p4c	TIL Ruby 2.0 Was Released On Ruby's 20th Anniversary	KerrickLong	47	11	4		t5_2qh21	False
1361790323.0	196qri	I'm deprecating rbfu; use chruby instead.	hmans	41	7	4		t5_2qh21	False
1358433799.0	16r484	Ruby 1.9.3-p374 is released	HornedKavu	40	9	13		t5_2qh21	False
1356490911.0	15g5zx	advanced guides to ruby?	ColonelHapablap	37	3	25	"Hi, 

I was wondering if there were any guides or books about understanding how Ruby works behinds the scenes--something that's just one step above looking at the source code itself.

thanks"	t5_2qh21	True
1352914123.0	136ub4	Why Ruby Class Methods Resist Refactoring	just_lest	36	2	7		t5_2qh21	False
1351610697.0	12caes	Phusion Passenger 4.0 supports JRuby, Rubinius	acangiano	40	4	0		t5_2qh21	False
