created_utc	id	title	author	ups	downs	num_comments	selftext	subreddit_id	is_self
1351734446.0	12fnzh	No Seconds: the final request of a condemned man - Photographs that recreate death row inmates' last meals.	footagenotfound	325	14	33		t5_2s9td	False
1352046781.0	12m79a	Last photos of victims, taken by their killers. (x/post from /r/MorbidReality)	crazystrawman	244	26	17		t5_2s9td	False
1376689346.0	1kiipe	The bite mark that convicted Ted Bundy	spinney	233	22	6		t5_2s9td	False
1359441139.0	17hfau	Serial Killer IQs 	stacyhatesmacys	230	23	34		t5_2s9td	False
1359680682.0	17nz7w	One of Dahmer's victims. With torso cannibalized. (Xpost from r/MorbidReality)	StoicGunner	213	17	21		t5_2s9td	False
1371467452.0	1giceo	A list of the what they did to victims.		235	40	12		t5_2s9td	False
1373573296.0	1i3reg	I laughed my heart out	akerbaker	246	72	9		t5_2s9td	False
1360028656.0	17wlci	x-post from r/wtf - Ted Bundy post-electric chair	Redbeard2467	195	21	21		t5_2s9td	False
1370513282.0	1fs64t	4-year-old Ted Bundy (cute, but remember this is taken the year after his aunt woke up to find he'd surrounded her with kitchen knives...) (X-post from r/TedBundy)	misanthropicmarlowe	192	25	19		t5_2s9td	False
1350160483.0	11fg8c	Went to a serial killer-themed haunted house in NYC and my date and I got our pictures taken in front of actual John Wayne Gacy art!	mafoo	185	19	20		t5_2s9td	False
1337275954.0	trxic	I promised you more about Jeff Dahmer's signature in my father's yearbook(s). Here you are, reddit. [x-post from WTF]	DeadBundy	183	13	23		t5_2s9td	False
1351281447.0	1252e3	Human skin gloves made by Ed Gein (x-post from /r/morbidreality)	shortnblonde	175	13	15		t5_2s9td	False
1365551663.0	1c0ywj	Dennis Rader, 'BTK Killer', posing in some of his victims' clothes (X-post from WTF)	PorkedPork	173	20	16		t5_2s9td	False
1336866012.0	tk9q4	So... Jeffery Dahmer went to my friend's dad's school. Found this in his year book. x/post WTF		160	14	10		t5_2s9td	False
1370623655.0	1fvdl9	‘Night Stalker’ Richard Ramirez Has Died	brosenfeld	162	15	76		t5_2s9td	False
1366575510.0	1ctgh4	A few of the pieces from an art project I did on serial killers	cyanide_zombie	178	35	26		t5_2s9td	False
1364239578.0	1azosf	The public has never seen these, new John Wayne Gacy crime scene photos.	DoomBox	146	14	18		t5_2s9td	False
1358475639.0	16simr	Death Row Inmates' last meals, including Gacy and Bundy [X-post from r/pics by down_vote_magnet]	eatingboys	156	23	32		t5_2s9td	False
1359070428.0	177yvz	Chilling Final Photos of Murder Victims taken by their Killers (X-Post from /r/wtf)	AppleAtrocity	160	27	18		t5_2s9td	False
1360184054.0	180qzz	Came across this site by chance, I think I could spend hours there.	Bandit72	147	15	11		t5_2s9td	False
1346795652.0	zcwcz	Top 10 Serial Killer Quotes	Aschebescher	135	13	18		t5_2s9td	False
1365113603.0	1bowyj	The Manson Family Murders . Crime scene &amp; coroner photos with death certificates of the victims including living profile pictures of the victims.	c1a1rehunt	140	15	14		t5_2s9td	False
1357664595.0	166wae	BBQ sauce recipe from known cannibal and serial killer, Otis Toole. (x-post from r/morbidreality)	jonathan_a	131	14	14		t5_2s9td	False
1374035595.0	1igrvb	In 1973, a man purchased an old hearse, telling people at his favorite bar that he needed the vehicle to haul all the people he killed to his private cemetery. The man was not lying and he was Donald Pee Wee Gaskins	akerbaker	133	17	11		t5_2s9td	False
1366686936.0	1cwun8	David Parker Ray played this tape shortly after capturing his victims, this is the only article i couldn't bring myself to finish [x-post from /r/morbidreality]	Elijah20100	132	17	36		t5_2s9td	False
1356742528.0	15lngl	Got something interesting from my Secret Santa, real or not I think you guys might like it.  (x-post from /r/secret santa)	CJZero	133	22	15		t5_2s9td	False
1361420717.0	18xo36	Interesting insight on how a serial killer can be formed.	Madame_Red	115	9	34		t5_2s9td	False
1351017590.0	11yjru	"My favorite photo of a serial killer, such a sense of gloom and sadness from this shot. r/serialkillers, what is your favorite ""portrait of a killer""?"	jonathan_a	119	17	19		t5_2s9td	False
1362974568.0	1a2aib	"""Charles Manson's Epic Answer"" It's actually a really fascinating line. "	MrGCar	121	19	17		t5_2s9td	False
1371433252.0	1ghjjq	Ted Bundy's Murder Kit	vxqz	175	73	19		t5_2s9td	False
1354267078.0	141n8f	"A bit less than a year ago, a friend and I reported a girl to the school. Then this happened... Not a serial killer, but described as ""one in the making"""	LilithImmaculate	114	17	38		t5_2s9td	False
1351370105.0	126rna	What is that kid smiling about?	kube20	100	4	18		t5_2s9td	False
1366851632.0	1d1u24	BTK Serial Killer aka Dennis Rader - masked and posing in numerous self photos of bondage ties/position's (better quality than the masked grave picture on my last post) Very eery.	c1a1rehunt	116	19	21		t5_2s9td	False
1348174891.0	107nuc	Albert Fish liked to drive needles into his groin and was found to have 29 in him when arrested [x-post from r/wtf]	nggrlvr	104	11	23		t5_2s9td	False
1352513490.0	12y1wy	The 911 call by Jake Evans, a seventeen-year old boy who murdered his mother and sister.	mizzk008	105	12	35		t5_2s9td	False
1370724820.0	1fy103	"My cousin who lives in Oregon posted this ... ""Look who came to the game tonight"""	SilentPixel	127	33	11		t5_2s9td	False
1360557134.0	18agn2	GG Allin as drawn by John Wayne Gacy. From r/Punk	Hannasouri	98	6	6		t5_2s9td	False
1362508883.0	19pyup	[x-post from TIL] TIL a man was writing articles and reporting about deaths of people who he actually killed. He was arrested when they found he has more information than the police	NarcolepsyShark	102	14	4		t5_2s9td	False
1373727868.0	1i7x2p	Serial killer wall of fame, found in a pub in Warsaw, Poland.	jojobeans27	105	22	24		t5_2s9td	False
1367273549.0	1dd9fu	TIL of a new suspect in the 'Zodiac killer' case. He was an editor for a counterculture newspaper in San Francisco, his voice has been ID'd by a 911 operator, and his full name appears in one of the ciphers; among several other pieces of circumstantial evidence. (x-post from /r/til)	ColonelDredd	102	18	18		t5_2s9td	False
1369512207.0	1f1mkl	TIL, that on January 1, 1993, Colin Ireland made a New Years resolution to become a serial killer… 3 months later he had brutally murdered 5 men.	montreal01	97	16	6		t5_2s9td	False
1363227569.0	1a9cd6	Alaskan Serial Killer Robert Hansen killed over 20 women. He would kidnap them, rape them, release them into the wild and hunt them down. He is serving 461 years now.	blitzballer	89	10	8		t5_2s9td	False
1332956826.0	rhu7d	they're unforgettable 	samanthakm9	89	7	22		t5_2s9td	False
1356149342.0	159ke5	Not serial killers but they were trying... South Africa’s Ripper Rapists and Their Strong Survivor: On December 18, 1994, Alison Botha was abducted, raped, disemboweled and nearly completely decapitated before being left for dead in a ditch...	mturner13	89	8	14		t5_2s9td	False
1351362981.0	126l3o	History's most educated serial killers (infographic)	dickralph	87	7	11		t5_2s9td	False
1371220726.0	1gc8r7	5 serial killers who are free right now.	beggingoceanplease	87	12	5		t5_2s9td	False
1362352030.0	19loyn	Ted Bundys crime scene photos of Margret Bowman,Karen Campbell, Lisa Levy including Ted Bundy after his execution.	c1a1rehunt	85	8	7		t5_2s9td	False
1357178369.0	15v1e6	Top 10 Most Common Traits of Serial Killers	Knerk	92	14	21		t5_2s9td	False
1363648539.0	1ak1at	The Doodler is an unidentified serial killer from 1974-75, who would sketch his victims prior to sex then stab them to death. He targeted the gay community; surviving victims didnt want to out themselves by testifying	blitzballer	79	8	19		t5_2s9td	False
1334253422.0	s6i7j	Posted a while ago, but it needs another one.  David Parker Ray abducted as many as 60 women between 1957-1999, tortured them in a sadistic sex chamber and usually killed them.  No bodies were found.  He is, in my opinion, the worst serial killer America has ever seen.	thegreat_destroyer	79	7	20		t5_2s9td	False
1370739877.0	1fyg8k	Jeffrey Dahmer		85	12	15		t5_2s9td	False
1328182189.0	p7ku2	i found that a young george w bush looks like ted bundy.	zombie_carebear	93	21	21		t5_2s9td	False
1365900502.0	1catc9	A Netflix documentary on H.H. Holmes (The Devil in the white city)	donvito7335	84	13	9		t5_2s9td	False
1366914452.0	1d3k85	I did a series involving serial killers. Statement in comments if you're interested.	Diluculoa	88	19	17		t5_2s9td	False
1351259407.0	124fp3	NYPD police officer arrested for planning to kidnap, rape and cook women.	PoPoDisco	79	13	6		t5_2s9td	False
1358666252.0	16x5ay	Letter from Charles Manson. Read the last line, if nothing else. [x-post from r/wtf a few month ago]	Yourdomdaddy	76	11	11		t5_2s9td	False
1339202672.0	ush52	Can't believe I never heard of Paul John Knowles, The Casanova Killer. Murdered 35+ people in 4 months.  	skeeter80108	70	3	10		t5_2s9td	False
1363723967.0	1am4qd	Top 10 Jeffrey Dahmer Quotes	EmilyJackson	76	13	5		t5_2s9td	False
1337823773.0	u212n	Serial killer Robert Rhoades and his torture chamber on wheels. 	stacyhatesmacys	67	4	10		t5_2s9td	False
1375433328.0	1jjyu1	Sweden's 'worst serial killer' to be released after admitting to making it all up	ZodiacSF1969	73	8	2		t5_2s9td	False
1350950134.0	11wuam	John Emil List - Killed his family, whose bodies were not found until nearly a month later, in 1971. To add to the creepy, when they were found, there was organ music on repeat playing on the house's intercom. He wasn't apprehended until 1989.	CN5	66	8	11		t5_2s9td	False
1365381645.0	1bvwp6	Top 50 Serial Killer Moments with Real Footage and Information		75	14	12		t5_2s9td	False
1330427034.0	q9k8x	"David Parker Ray built a sexual torture chamber which he called ""Satan's den"" or ""The Toy Box"" and is believed to have tortured and murdered several women. (45 minute documentary. NSFW, NSFL)"	Quepster	63	2	18		t5_2s9td	False
1361899024.0	199no5	"Pictures showing the brutal bite that Bundy left on victim Lisa Levys, Which was used as evidence in court to convict him of the murder of 12 year old Kimberley Leach 
"	c1a1rehunt	66	8	17		t5_2s9td	False
1359351650.0	17ex65	Found this license plate in a barn in Wichita, KS. now it hangs in my kitchen, and makes my guests very uncomfortable. (X-post from r/wtf)	deaflemon	68	7	13		t5_2s9td	False
1350662121.0	11r34s	Charles Manson's opinion on himself		67	9	16		t5_2s9td	False
1356673579.0	15k6fh	Russia had never seen anything quite like the prolific serial killer Alexander Pichushkin, for whom “life without killing is like life without food.” 	masturbatin_ninja	69	8	9		t5_2s9td	False
1373928747.0	1idf8e	"""God as my witness, I just didn't dump a little boy in the hands of a murderer. That's not what happened"" - Police Officer Defended Giving Laotian Boy Back To Serial Killer Jeffrey Dahmer"	wubbadubbdubb	66	8	10		t5_2s9td	False
1364406292.0	1b4ehp	Mother of serial killer Ted Bundy dies in Washington after long illness	sweetabix	64	4	3		t5_2s9td	False
1371777470.0	1grlnu	This is Albert Fish's account of what he did to one of the victim. He was a cannibal.	akerbaker	75	14	17		t5_2s9td	False
1363356726.0	1acmcv	TIL that Robert Pickton, Canada's worst serial killer, may have sold pig meat containing human flesh to the public.	Schwarzwind	68	9	7		t5_2s9td	False
1327017765.0	oo29x	Some of America's Deadliest Serial Killers in Their Own Words (Letters from Prison)	theblackandblue	61	4	6		t5_2s9td	False
1317301436.0	kv85t	Possibly the most fucked up thing I've read on the internet.		62	9	31		t5_2s9td	False
1369076630.0	1eplp9	I write serial killers. Ask them anything via a snail mail AMA (by request)! (X-post from r/IAmA)	beggingoceanplease	77	20	57	"I recently did this AMA: http://www.reddit.com/r/IAmA/comments/1ej436/i_am_a_penpal_with_serial_killers_ama/
I had a few requests to set up a snail mail AMA with one of my penpals. I'll ask them the top 10-15 upvoted comments. PLEASE read through the comments instead of re-asking things that have been asked. I will judge solely based on the number of upvotes. If I am uncomfortable asking them a certain question, I will reserve the right to not do so. I would love some interesting questions that I may have never thought of and to give you guys a chance to ask them a question without having to write them yourselves. Thanks!"	t5_2s9td	True
1364393994.0	1b3znn	Head found on Hopewell, N.J., golf course in 1989 finally identified - Victim of Joel Rifkin	Zombie_Apocolypse	62	7	2		t5_2s9td	False
1358316232.0	16o61r	Sex. Beauty. Violence. 66 years since the “Black Dahlia” slaying	Kensforce	63	7	1		t5_2s9td	False
1337629145.0	txyoo	It's Jeffrey Dahmer's birthday today. 	stacyhatesmacys	64	9	7		t5_2s9td	False
1370860297.0	1g1d5j	Ted Bundy's school pictures (7th grade - graduation) (X-post from r/TedBundy)	misanthropicmarlowe	64	7	2		t5_2s9td	False
1339987086.0	v7emk	Marcus Wesson had children with his daughters, convinced his family that he was a Jesus Vampire. Police found nine of the kids dead in a pile. 	stacyhatesmacys	59	6	9		t5_2s9td	False
1371393012.0	1ggdww	Top 50 Serial Killer Moments with Real Footage and Information	vxqz	117	63	4		t5_2s9td	False
1368306465.0	1e5c3x	Jeff Dahmer did duckface before duckface was duckface.	CycloneCowgirl	56	7	3		t5_2s9td	False
1345375994.0	ygwl0	"Edmund Kemper once had an FBI agent at his mercy while prison guards were occupied. What he said to him was;  ""If I went in apeshit in here, you'd be in a lot of trouble, wouldn't you? I could screw your head off and place it on the table to greet the guard"""	StoicGunner	56	5	11		t5_2s9td	False
1338045670.0	u61fx	Anyone able to find Jeffrey Dahmer's full 166 page confession?	Tara1122	62	8	13	Even if not the full confession, parts of it is good too!	t5_2s9td	True
1374916886.0	1j5j3m	Was there ever a specific quote from a certain serial killer that gives you chills and an unsettling feeling every time you hear or read it?	wubbadubbdubb	67	16	60		t5_2s9td	True
1364992715.0	1bl0mx	"""Top 10 Deadliest Female Killers"""	Hid3nka	59	7	7		t5_2s9td	False
1357828842.0	16bcgu	10 Most Vicious Women in History	mturner13	58	8	7		t5_2s9td	False
1350366733.0	11k3fk	r/serialkillers I present to you my most prized possession.	clickforlisa	73	21	22		t5_2s9td	False
1345328725.0	yg2xi	Jeffrey Dahmer's childhood home (where he committed his first murder) is up for sale. 	glitterpenis	59	8	5		t5_2s9td	False
1370031626.0	1ffb8i	Anyone who lived near or had connections to a killer?	WonderBoyMan	62	9	134	My dad told me about how, after college, he volunteered with a organization that was like the Peace Corps except exclusively within the US. Apparently the house where he lived was only a few blocks from where Jeffrey Dahmer lived. My memory is kind of fuzzy, but with the dates he gave me, this would have been either right before or around the time he started killing. Anyone have any similar or better stories?	t5_2s9td	True
1357612705.0	165qfk	Potential future Canadian serial killer?	Lupawolf	52	5	30		t5_2s9td	False
1324594509.0	nn72t	Top 10 Evil Serial Killers	Beastly_Jules	54	7	7		t5_2s9td	False
1374970163.0	1j6tpd	My Brother the Serial Killer (2012) - terrific documentary about Glen Rogers (Casanova Killer) as told by his brother Carl... family claims that Rogers confessed to them that he murdered Nicole Simpson...	montreal01	59	12	0		t5_2s9td	False
1371641478.0	1gndse	"Etsy shop ""Dahmer Obsession"" sells jewellery with pictures of school shooters and serial killers (x-post from /r/rage)"	Swazi666	63	15	14		t5_2s9td	False
1375771454.0	1jspot	The Jeffrey Dahmer Files (Full)	wubbadubbdubb	61	13	13		t5_2s9td	False
1375218947.0	1jdjov	Just found out about Enriqueta Marti- Kidnapped, trafficked, and murdered at least 12 children, also used their body parts in witchcraft.	TheHoundsOFLove	61	13	4		t5_2s9td	False
1365037751.0	1bmo78	Jeffrey Dahmer - Serial Killer - Full Trial	shugan	54	5	0		t5_2s9td	False
1375965399.0	1jya12	I visited her former house in New Orleans on a tour. Presenting Delphine LaLaurie, socialite and serial killer of servants.	Valadia	62	14	12		t5_2s9td	False
1372879765.0	1hl49r	Are there any good serial killer books that are must reads?	genericusername26	54	8	52	  	t5_2s9td	True
1365837030.0	1c9c6o	Why Dr. Kermit Gosnell's Trial Should Be a Front-Page Story - Conor Friedersdorf	LapsedPacifist	54	8	15		t5_2s9td	False
1359507805.0	17j51q	Serial Killers: Ken &amp; Barbie Killers  Paul Bernardo &amp; Karla Homolka (Full Documentary) - YouTube		53	6	0		t5_2s9td	False
1339776810.0	v3lot	Ever thought about writing a letter to a serial killer? Check out how you can do that here! Careful though - you may get a reply!	killercentral	52	3	14		t5_2s9td	False
1328664638.0	pfjx3	If you want a creepy read, may I introduce you to Mary Bell. Child killer at 10 years of age. [xpost from r/creepy]	lindsly	50	5	11		t5_2s9td	False
1376341117.0	1k8crr	"""First"" Woman Serial Killer, Jumps off Platform and hung herself in her wedding gown."	KaoticKano	53	9	2		t5_2s9td	False
1374709358.0	1izpye	Has the code of the Zodiac killer been solved?	Sproose_Moose	78	31	17		t5_2s9td	False
1370632801.0	1fvqc3	Stewie Griffin by Richard Ramirez	dgeister	55	10	7		t5_2s9td	False
1355295434.0	14pqlm	A serial killer blogs -- Joseph Edward Duncan blogged as he gave in to his demons 	apexcp	54	9	17		t5_2s9td	False
1376178408.0	1k471b	New Book Contends That Charles Manson Doesn't Have A Childhood of Abuse to Excuse Who He Became--He Was Always A Psychopath.	catofnortherndarknes	59	11	27		t5_2s9td	False
1363769228.0	1anjeq	Can anyone recommend any documentaries to a newbie?	cimd09	48	5	25	"I have read quite a bit about some of the most well-known serial killers, like Bundy, Gacy, Dahmer, BTK, Ramirez, etc.

I'd love it if you could recommend any good/interesting documentaries about these and other serial killers - I haven't seen any, so by all means include the popular/well-known docos."	t5_2s9td	True
1358488579.0	16sx25	Seems appropriate if you think about it.	Tee_Aye76	55	10	5		t5_2s9td	False
1331829934.0	qxyyy	"edmund kemper was 6' 9"". that's a big scary fucker."	killjoy_for_fun	47	1	17		t5_2s9td	False
1319725630.0	lqz3e	"There are more gruesome killers, and those with higher body counts, but I have yet to learn of anyone ""Crazier"" than Richard Chase."	pogue23	51	5	36		t5_2s9td	False
1374399154.0	1iqske	3 Bodies found in Ohio, suspect, if the killer, may have been influenced by Anthony Sowell.	MakeMeBeautifulDuet	50	6	0		t5_2s9td	False
1362616027.0	19t7sb	Watch the Dahmer Files	IEnjoyBeatingMyWife	49	4	7	"So the 'Dahmer files' is now on putlocker. Just thought you guys would like to watch. There are no downloads, you just stream it. However, it's better to use adblock or else you'll get ""Hey, want a fuck buddy in (insert your town here)?""

Enjoy http://www.putlocker.com/file/51F2B269D5E969F2#"	t5_2s9td	True
1355628928.0	14xc8e	Serial killer confesses to killing Nicole Brown Simpson and Ron Goldman		52	8	8		t5_2s9td	False
1345475091.0	yix25	"""Killers: A Nightmare Haunted House"" Exhibition Opening In NY"	necromancy	48	4	4		t5_2s9td	False
1375943907.0	1jxwey	Is anyone aware of any active serial killers that haven't been caught?	my-secret-id	52	9	39	I was just wondering if anyone here has sort of 'tracked' what they believe may be a serial killer? Or are aware of a recognised by law enforcement serial killer that hasn't been caught yet? Wouldn't mind some discussion and/or some reading. 	t5_2s9td	True
1365047920.0	1bn1ho	What are the best (or your favorite) movies about serial killers?		47	6	58	"The only one that immediately pops to mind for me is *Silence of the Lambs*--what else is really good?

Also, if you could distinguish if you like it because it's a really good *movie* or because it's really *accurate* (that is, it accurately portrays real life serial killers and how they operate), that would be great, because there's definitely a difference between the two and I might like a movie for either reason.  For example, *Mindhunters* is a decent movie, but it's really not very realistic at all with regards to how FBI profilers or serial killers work.  I would enjoy watching that movie, but not because it's the least bit realistic."	t5_2s9td	True
1360815441.0	18hsij	series of serial killer portraits I did -self	resonanteye	46	2	18		t5_2s9td	False
1358160374.0	16jnqy	I just finished one of my serial killer novels.  My coworker saw it laying out and seemed interested, so I let him borrow it...	enigmaurora	62	18	55	"...he returned with it 2 hours later and told me, ""I can't read anymore... it makes me feel weird.  I'm creeped out.""  He apparently majored in Criminal Justice in college... could have fooled me.  I guess that makes me weird... as it didn't bother me at all.  I just found it insanely fascinating. 

[This is the book I finished.](http://amzn.com/0425196402)  I do recommend it... it was very well written.  There are some uncensored crime scene photos in it as well.  Which I did warn my coworker about beforehand.


Next up, I've got [this book](http://amzn.com/0495600814) which has promising reviews.


Do any of you have books* or documentaries to recommend?  I have a lot of free time at work.
"	t5_2s9td	True
1347178160.0	zlfp8	TIL When police finally killed Mark Essex. They had shot him so many times they had to pick his body up with a scooper.	StoicGunner	48	8	4		t5_2s9td	False
1343630181.0	xdpg1	"Carl Panzram the man who wished, "" . . the entire human race had one neck, and I had my hands around it!"""	b3d0u1n	45	2	17		t5_2s9td	False
1337088763.0	to673	Serial killers as kids. 	stacyhatesmacys	46	2	1		t5_2s9td	False
1321915027.0	mkopt	10 Monumental Malignantly Narcissistic Sociopaths (r/post from WTF)	FuneralDirector	46	4	4		t5_2s9td	False
1367455526.0	1dipyn	Feature length dramaticized Ted Bundy film from 2002. Not sure how many of you have already seen it.	EvilFuckingSociopath	52	10	10		t5_2s9td	False
1341119860.0	vva66	Fred and Rosemary West, two of the most notorious killers in modern history.	attackedbydroids	48	9	5		t5_2s9td	False
1370989757.0	1g5l00	What was the most unusual method used by a serial killer?	quaker-Oats	52	12	29	What odd weapons/systems did a serial killer use to murder his victims? Where there any who's method held meaning or significance to them?	t5_2s9td	True
1369668733.0	1f533z	Serial killers who blog from prison?	Lupawolf	57	15	10	"I've seen a few examples of murderers who I haven't heard of, and one with Fred West that I'm going to look up after this post. But have any of you found any personal blogs or anything of that type that belong to serial killers in prison? I have no idea what the procedure is in prison for inmates to earn privileges like computer time, but if they were allowed online, there's a chance they'd be allowed to blog, right? Thy are allowed correspondence, can receive and send letters. I'm sure there is some kind of monitoring system. 
I'm just interested in what might be said, but can't really be bothered with trying to politely write in a letter about my curiosity and down right confusion about WTF is going on in their heads. 
Awhile ago I found a blog that a serial killer kept during his decent into madness. I believe he was a pedophile and was fighting his urges, while also trying to convince his followers that he was innocent and wasn't going to do anything to harm anyone. 

Does anyone have any good links?   "	t5_2s9td	True
1369149603.0	1ernam	Long-Missing Suspected Serial Killer Captured	Cynical_Hermit	49	8	6		t5_2s9td	False
1364020934.0	1aujw0	Serial Killer, Dennis Nilson, Had Sex with Dead Victims Before Boiling Their Brains	blitzballer	43	2	8		t5_2s9td	False
1360014707.0	17w33i	Black Dahlia Murder Case Gets New Life After Dog Smells Death Scent At Suspect's Home	mturner13	47	7	6		t5_2s9td	False
1342543957.0	wpj1u	Men and women that married convicted murderers. 	StoicGunner	45	4	7		t5_2s9td	False
1336607821.0	tfku8	I never had Coulrophobia, until this fucker ruined that for me 	donvito7335	47	5	14		t5_2s9td	False
1375386064.0	1jik1u	Paul Bernardo's request of being moved to medium security has been denied	PorkedPork	56	13	8		t5_2s9td	False
1374253834.0	1in4nc	"Dubbed 'Satan in a skirt', Irina Gaidamachuk is Russia's worst serial killer, with a total of 17 victims. ""I did it for money. I just wanted to be a normal mum, but I had a craving for drink."""	RyTheRussian	50	8	10		t5_2s9td	False
1367321978.0	1del2m	The court transcript for the Otero family murders committed by serial killer Dennis Rader (BTK). Please be aware this is highly disturbing.	c1a1rehunt	54	12	11		t5_2s9td	False
1362690922.0	19va8h	Are serial killers fans of other serial killers?	b3d0u1n	44	6	28	"After watching a plethora of documentaries about serial killers, this is one topic that's never really been discussed.  It seems like the people most fascinated by serial killers have absolutely no inclination to mimic their behavior, not even an as a curiosity.

On the other hand, I've always been under the impression that serial killers themselves are fairly uninterested in the work of others.  If one is a musician or writer he studies the greats -- but perhaps that's because those two activities are a more creative impulse while wanting to kill or rape is much more carnal.

Or maybe I'm totally off and many serial killers were 'fans' of previous killers but it just was not documented -- although it seems like an interesting tidbit the media would drool over.  Perhaps each serial killer believes he is different from other serial killers, and might even despise their work or consider it immoral?   "	t5_2s9td	True
1359156917.0	17ab6k	Painting of Ted Bundy by yours truly. 	HookedOnBathsalts	63	24	10		t5_2s9td	False
