created_utc	id	title	author	ups	downs	num_comments	selftext	subreddit_id	is_self
1352630331.0	1307fi	"Moses Sithole a Serial Killer in South Africa was ""put in his place"" recently when he tried to stop his re-location from one prison to another. Check out his reasons! You will be amazed at his cheek!"	killercentral	33	7	16		t5_2s9td	False
1351016439.0	11yier	The Iceman tapes, a look into the mind of Richard Kuklinski.		29	4	4		t5_2s9td	False
1349007920.0	10pi4j	Another Active serial killer in South Africa! This time in Limpopo	killercentral	30	3	4		t5_2s9td	False
1367423058.0	1dhitf	Carl Panzram: The Spirit of Hatred and Vengeance	timconradinc	36	10	7		t5_2s9td	False
1361127832.0	18pbcv	"""We absolutely stopped a person who was going to kill again"""	IEnjoyBeatingMyWife	27	2	2		t5_2s9td	False
1355887387.0	1537pi	Group Working To Erect Memorial For Green River Victims »	ChroniclesCriminal	28	3	2		t5_2s9td	False
1354901395.0	14gawm	"""Collectors"", full length documentary about two men who collect serial killer artwork and put the art on exhibition. Very interesting. (Sorry I could only find the film featuring limited commercial interruption.)"	mturner13	27	0	2		t5_2s9td	False
1351372380.0	126tqt	Bloody Benders: A family of post-Civil War serial killers who were never apprehended.		28	3	2		t5_2s9td	False
1349065603.0	10qvr9	"""Speed Freak"" killer breaks silence on where the bodies are. Claims 72 Victims."	mje267	28	1	1		t5_2s9td	False
1346124142.0	yxxpt	There's an AMA going on right now with a girl who claims to be pen pals with Richard Ramirez aka the Night Stalker.	Mandee430	38	11	1		t5_2s9td	False
1336099287.0	t67tr	Jeffrey Dahmer's Trial		28	1	4		t5_2s9td	False
1334278274.0	s75dz	David Gore, an infamous Florida serial killer, was executed today for the murders of 6 women 28 years ago.	nowamandathinks	25	0	5		t5_2s9td	False
1325778479.0	o41jw	New book on serial killers includes stomach-turning letters from [David] Gore	bpcombs	29	5	7		t5_2s9td	False
1373777894.0	1i9e07	Scottish serial killer and necrophiliac Dennis Nilsen O' Superman	wubbadubbdubb	33	10	13	"A paragraph about music dennis would play to a victim

&gt;At one point, Dennis handed his companion a pair of headphones and played one of Carl’s favourite songs, ‘O Superman’, a spooky, sparse tune by eccentric American singer Laurie Anderson. “While I was listening I suddenly sensed that he was behind me,” says Carl. “Something made me turn round and Dennis was quietly standing right behind me. That really unnerved me. I asked him what he was doing and he asked me if I wanted another drink.” They both kept drinking, to the point when Carl felt sick.

[link](http://www.bizarremag.com/news-and-videos/latest-features/7704/serial_killer_survivor.html)"	t5_2s9td	True
1367110270.0	1d8w3i	Did anybody catch the John Wayne Gacy reference in Arrested Development?	anlcntrox	44	16	9	"The other day I was watching the episode where Job tries to give a rufie to Michael's girlfriend, and explains that they are to keep somebody who discover's a magician's secret from remembering it. Then he says ""that's also why clowns always have a rag full of ether."" I remember reading that Gacy often used a rag with chloroform. Maybe it's just a coincidence but it made me chuckle."	t5_2s9td	True
1365851654.0	1c9in0	Lesser known yet brutal serial killers.	jhunt0	32	7	0		t5_2s9td	False
1364083426.0	1avy3i	H. H. Holmes (Serial Killer)	doorkeeper	28	5	10		t5_2s9td	False
1360988488.0	18mepv	who are your favorite serial killers and why?	jesusdildo	41	21	100	so i just found this subreddit, but ive always had a strange fascination with serial killers, just the motives and trying to understand them i guess i really dont know what it is other than interesting, mot of my friends think its creepy, but my favorites are H.H. Holmes, for the ways he deployed his plan and also the new evidence surfacing suggesting he was also jack the ripper, Richard Kuklinski, for his intelligence and ability to fool the police for so long, and general ambivalence to killing, the zodiac killer for never being caught, pablo loopez for sheer numbers and creepiness due to him being free now, and B.T.K. for almost getting away with it, what about you guys?  	t5_2s9td	True
1357840774.0	16bp95	"Peter Sotos' ""Pure"" : An 80's zine about serial killers, rapists and child torture. Not uninteresting, but a harsh read. PDFs of the 3 issues at the bottom of the article."	Hakim_Bey	28	2	6		t5_2s9td	False
1349523970.0	111e8f	Wikipedia -David Parker Ray, The Toy-Box Killer	shroomkween	26	2	12		t5_2s9td	False
1349229988.0	10up24	"Snowtown (2011) full movie. Based off australian ""body in a barrel"" serial killers"	Patrick5555	29	4	8		t5_2s9td	False
1338433508.0	ud8vb	Suspected Canadian Killer Who, Sent a Foot to the Conservative Government, Dated Serial Killer Karla Homolka and Apparently posted Video Online of The Killing :(including seperate video(s?) of him killing cats)	DuDEwithAGuN	28	4	30		t5_2s9td	False
1337193613.0	tqbzn	Possible serial killer in the making?	thegreat_destroyer	24	1	9		t5_2s9td	False
1337003612.0	tmfuv	Letters from Carlton Michael Gary, the Columbus Stocking Strangler.  Check out that handwriting. 	stacyhatesmacys	25	1	5		t5_2s9td	False
1316071664.0	kgast	I didn't know who the BTK serial killer, Dennis Rader was... until today.	MissButterTree	29	4	9		t5_2s9td	False
1375304214.0	1jg3wx	Six Serial Killers and the Artists They Loved	stevenothing	39	16	5		t5_2s9td	False
1374331806.0	1ip2si	The Pig Farm Robert Pickton Serial Killer	MFSleep	30	7	0		t5_2s9td	False
1371679674.0	1gop6p	One topic seemingly not covered much is music about killers.	Fidgetstic	32	10	26		t5_2s9td	False
1370801499.0	1fzqeg	John Gardner answers your questions.	beggingoceanplease	31	8	8	"I know he's not a serial killer but it relates to my previous post in this subreddit, found here: http://www.reddit.com/r/serialkillers/comments/1eplp9/i_write_serial_killers_ask_them_anything_via_a/

1. I'd like to know what their favorite childhood memories are.  
I asked him this but he didn't answer.    

2. Are you going to blame your actions on your childhood?  
I reworded this so it was less aggressive. He said ""Yes I had a rough childhood but I didn't know it until I was older. But yes the poor and almost non-existant relationship I had with my father was part of whats wrong, also genetics I am bi polar or manic depressive and it is really hard to just live. I want to be normal so bad but I'm not. Now I'm glad I'm not because I see things differently than others.""        

3. Do you have any regrets about the crimes you've committed?  
He mentioned in a previous letter that he did not have regret about his other crimes but felt remorse for the murders because their families didn't deserve that. I modified this question and asked how the murders were different than previous crimes that he did not have remorse for. John: ""You asked about other crimes that I don't feel remorse for. I set fire to a field while playing with (illegible word) me and another kid. It was next to my school I was like 8 or 9 years old. Nothing got burned down just the weeds in the field. I also used to break into cars, and shoplift everywhere I went. I started drinking after highschool and would steal bottles of anything and party with my friends mostly girls. When I was 18 I was having sex with a girl who was 15. Technically thats a crime but I see it differently mentally men are a few year more imature where women/girls are a few years more mature.""    

4. I'd like to ask any and all serial killers about their mothers.  
He said: ""Yes, I still have contact with my family and I see my mom on occasion. I talk to her on the phone once a week.""    

5. What would be the defining point for you as a serial killer?  
""You asked if there was a defining moment. Not really. I had a breakdown of every thing in my life many losses and felt abandoned by everyone just real depressed and angry. THe year before my first victim I lost my dad, my fiance took my kids and started seeing the guy she was cheating on me with. I lost my job and I was close to being homeless again for the second time. I was a stressed out wreck.""  

6. Have you ever met another serial killer?  
John is friends with ""Charlie"" Manson. He wrote ""I mentioned friendships and yes nick and charlie are probly who I'm closest to. I think Charlie has some plan for me that he wants to see happen but he never just comes out and says things he hints at them or uses analogies.""    "	t5_2s9td	True
1369152243.0	1erqjb	What is your favorite serial killer controversy?	dharmabum_27	27	4	34	Such as: how many 'boston stranglers' were there. (dna has ruled out albert desalvo in at least 1 killing) who was the zodiac, or jack the ripper and so on. the link goes to my personal favorite concerning the true motivations of charles manson in the tate, labianca murders. http://gorightly.wordpress.com/2009/05/03/revised-and-updated-edition-of-the-shadow-over-santa-susana/	t5_2s9td	True
1365536693.0	1c0dmb	Have you gotten used to the gore?	llawless	34	11	23	"Hi fellow weirdos, 

Yes, I think we are kinda weird for being interested in serial killers. I was always a big fan of crime shows, and our cable package has Investigation Discovery and CI now, so I've been watching even more real crime shows. It fascinates me a lot, and then I stumbled upon this subreddit. I think I like this place, but have to admit... I am kinda creeped out by some of the posts too. Which is a good sign I guess. 

So, I can't imagine ever hurting some one, or taking a life, life is such a beautiful thing and people are always loved and missed by some one. It is not anyones right to take them away. I don't feel any sympathy for serial killers and their crimes and I really can't stomach the more gruesome details of what they did. Yet the whole process of how they came to be and how they are caught fascinates me. Upon finding this subreddit and reading through all the links here I feel like delving into the subject a bit more. But I have this crazy worry that I'll eventually won't be put off by the gore anymore. And who knows if there's a sliding scale from there on? I mean - I don't believe you can become a serial killer from reading about it. But I was just wondering:

Has delving into this subject changed you in any way? Has it shifted the boundaries of what you accept as normal?

Interested in your stories of how your interest started and how you experience it on a more personal level.



"	t5_2s9td	True
1362807499.0	19yj4t	Luka Magnotta Documentary	michaelghan	27	4	10		t5_2s9td	False
1361649515.0	193di9	Gerard Schaefer interview, disturbing and intriguing.	anlcntrox	25	0	1		t5_2s9td	False
1352496551.0	12xm7e	Melvin Rees, Jazz musician and serial killer.	NinjaDiscoJesus	30	7	2		t5_2s9td	False
1345121963.0	ybggw	Birnies' house of horror for sale (it's under offer!)	ClaireyBee	24	1	3		t5_2s9td	False
1340470976.0	vhl69	The Iceman (X-Post from r/videos)	ZachariasCannon	28	6	3		t5_2s9td	False
1335581273.0	swat0	I think r/serialkillers would love a series on NetFlix called Deadly Women.	AISim	24	1	0		t5_2s9td	False
1331882911.0	qz450	Sagawa Issei	slayristo	24	2	13		t5_2s9td	False
1326840504.0	oli2s	My favorite serial killer...The Rostov Ripper.	tsaleigh	28	7	7		t5_2s9td	False
1376502318.0	1kd0lo	judge orders serialkiller suspect-Felix Vail to give handwriting samples to the prosecution	sleepingdogs50	26	5	1		t5_2s9td	False
1374673515.0	1iye70	Can't get enough Albert Fish	cronikz69	36	12	2		t5_2s9td	False
1370569985.0	1fu243	Just some info on Pichushkin.. Couldn't help but notice there's not a hell of a lot on my favorite serial killer on here.	Jamason17	29	7	7		t5_2s9td	False
1367929266.0	1duvm5	Hey /r/SerialKillers! I am looking for a book inspired by Serial Killers.	SubjectAlpha	29	8	26	"I hope some of you can help me.

I've already seen the movies The Silence of the Lambs, Psycho and American Psycho.

EDIT: Would prefer a fictional book. As in a book that is inspired by the deeds of serial killers.

EDIT: Thank you so much /r/SerialKillers for all the suggestions!"	t5_2s9td	True
1358599504.0	16vgip	10 Most Notorious Indian Serial Killers. The person at #1 is also the world's worst serial killer in terms of kills.	Chillarparty	30	8	1		t5_2s9td	False
1355259635.0	14ona4	"Israel Keyes: ""A serial killer addicting to killing."""		27	6	6		t5_2s9td	False
1353515354.0	13kl3e	Serial Killer Groupie Sondra London - Fascinating documentary by Errol Morris	mafoo	25	2	10		t5_2s9td	False
1349097084.0	10rbr5	Just watch Snowtown Im deeply shocked... Anybody in the same situation?	spkg	28	6	30	"I ve watched this movie last night.
Never heard about this story because I live in France.
What happened there was hell on earth... 
Has someone also been disturbed by what happenned in Snowtown?"	t5_2s9td	True
1348638585.0	10ht8n	Has anyone ever seen Paul Bernardo's video tapes or Lawrence Bittaker's audio tapes?	qozon	26	5	17		t5_2s9td	False
1343334201.0	x7ip0	Today is the anniversary of Ed Gein's death. Here's a great, very short documentary about him.	stacyhatesmacys	26	3	2		t5_2s9td	False
1341034079.0	vtxij	An incredible rare story of how a victim survived Tommy Lynn Sells, ( The Cross County Killer). Who confessed to murdering as many as 70+ people, ruthlessly. And is still in death row. 	StoicGunner	24	1	2		t5_2s9td	False
1339745499.0	v34ak	Let's discuss our motivations for reading this subreddit - and also talk about your favorite case and why it's so interesting	bantam83	23	1	27	"Sometimes I feel like a creep for being fascinated by true crime stories - whenever I see Forensic Files or read about these monsters, I think of ways they could have avoided capture, as if to figure out how to do it myself.  I would never do so, of course, but I can't seem to help thinking of contrafactual getaway scenarios for crimes that I learn about.  It makes me examine my own motivations - after all, maybe everybody (including me) is a potential serial killer and a person just needs the right stimulus to act.  It's a disturbing thought.

So how about you?  Are you some kind of deliberate genius type of killer who's gathering information for his/her next crime?  Are you into law enforcement and figuring out ways of catching these monsters?  Are you into psychology and want to try and understand why people do what they do?  Perhaps you're a survivalist who wants to be aware of behavior that signals someone who could potentially be dangerous to you.  Please share! :)"	t5_2s9td	True
1337546711.0	twfhl	The latest in the world of serial killers. William Gibson	StoicGunner	24	1	11		t5_2s9td	False
1336521074.0	tdsb5	I saw this man's decapitated head recently in The Museum of Death in Hollywood. The real life Blue Beard, Henri Landru.	StoicGunner	23	1	14		t5_2s9td	False
1328209308.0	p81nz	My new favorite serial killer - Seito Sakakibara	TopPercentage	24	3	16		t5_2s9td	False
1326328254.0	od5ga	Joran van der Sloot pleads guilty to killing 21-year-old Peruvian woman	jenamtaylor	25	3	2		t5_2s9td	False
1323745308.0	nahc2	Great place for crime scene photos, many serial killer victims.	quantumregulator	25	3	12		t5_2s9td	False
1373549604.0	1i2u5q	Major development in ‘Boston Strangler’ case will be unveiled today.	NinjaDiscoJesus	30	9	1		t5_2s9td	False
1370809821.0	1g00hl	Aileen's original confession. It's pretty emotional..	Jamason17	25	4	2		t5_2s9td	False
1370740743.0	1fyh44	Charles Manson		32	10	2		t5_2s9td	False
1354562655.0	147qpe	Investigators use Gacy’s blood in bid to solve old slayings - Chicago Sun-Times	Icantevenhavemyname	25	4	4		t5_2s9td	False
1350058105.0	11dcy3	Just found this subreddit 	whoatethekidsthen	27	7	7	I've been very interested in serial killers and mass murder since I was a child and the Dahmer trial was going on. I just wanted to say you guys have a really good subreddit here and I wish I had found it sooner. 	t5_2s9td	True
1343973810.0	xlwk9	It's a John Wayne Gacy Christmas! (filmed in 1969 when in prison for child molestation.) 	jeff_jizzr	27	5	0		t5_2s9td	False
1332088019.0	r24rv	I survived BTK. Will be available for purchase in April. I'm definitely adding this to my collection.	StoicGunner	25	5	4		t5_2s9td	False
1376016083.0	1k02aq	What demographics of people do you think are most and least likely to become victims of serial killers?	SergeantFartbox	33	14	33	Just curious	t5_2s9td	True
1372424774.0	1h8ujm	Do you think the Zodiac Killer was Arthur Allen or was it another person?	jrgreen1	28	10	40		t5_2s9td	True
1370659023.0	1fwlnq	A republished article today concerning Richard Ramirez ... loved the story.	hokoonchi	25	4	0		t5_2s9td	False
1365476532.0	1byrnc	Why was Dahmer not found criminally insane?	FearAndLoathing122	31	11	24	"Dahmer is an interesting character, and by far my favorite(?) serial killer. He is an intelligent, well-spoken, often times nice person in interviews and such, but was it all an act? When he said he would give his life to bring back those he killed? Was it a sham? The ramblings of a charismatic and manipulative serial killer? I don't think so, which leads me to my question.

I mean, if it was, how he stated ""compulsory"", how is that not insanity by some mean? If someone murdered 17 people, committed necrophilia and cannibalism compulsively, that's not ""I'M OUT TO GETCHA"". That's clearly an illness, which Dahmer even stated he wanted a psychologist to come and evaluate him to see why he wanted, scratch that NEEDED to kill. But he didn't get the chance.

**EDIT: Meant legally insane, not criminally**
"	t5_2s9td	True
1360883878.0	18jp2k	How Israel Keyes got the razor blade that he killed himself with.	IEnjoyBeatingMyWife	24	6	1		t5_2s9td	False
1351087552.0	1207k2	"East Area Rapist/Original Night Stalker

The uncaught serial killer could be watching you right now"	sluttyredditho	23	4	9		t5_2s9td	False
1350676024.0	11rign	12 unsolved murders may be tied to Manson family	fuckyoushima	22	1	2		t5_2s9td	False
1347500692.0	zssi3	Interesting Ask Reddit thread about meeting/knowing a killer IRL	toiletghost	28	7	0		t5_2s9td	False
1346441252.0	z5fam	Headless Torso found off Niagra Falls, Police say the case is not related to two similar cases of body dismemberment in the area this year.	Bl1ndz	22	1	7		t5_2s9td	False
1344891682.0	y5xju	"Psychopaths: Good or Evil (BBC) a documentary. 
      "		24	3	3		t5_2s9td	False
1344887521.0	y5sst	Son of Sam interview on Gun Crime in the USA today	killercentral	25	6	6		t5_2s9td	False
1340295083.0	vdxlm	There is an active serial killer roaming the streets of Gauteng Johannesburg in South Africa!! 	killercentral	23	3	9		t5_2s9td	False
1339173047.0	urrph	Serial Killer Gacy and his artistic hand	killercentral	20	0	8		t5_2s9td	False
1337054876.0	tno03	I knew Charles Mason was into music, I did not know he was any good.	Arctic_Winds	21	3	9		t5_2s9td	False
1308079744.0	hznnn	Possibly my favorite quote...	EllieWelch96	23	3	1		t5_2s9td	False
1294955886.0	f1tov	This has been in my pictures folder for years. It keeps me studying what I study - forensic psychology and criminology. 	mobzoe	20	1	19		t5_2s9td	False
1372850131.0	1hk739	H.H. Holmes Is an Angry Ghost or maybe Jack the Ripper.	mspace55	25	7	6		t5_2s9td	False
1369586813.0	1f35vc	World's Worst Serial Killer ➠ Luis Garavito - YouTube	Cynical_Hermit	24	5	4		t5_2s9td	False
1368303502.0	1e58z9	[request] David Parker Ray welcome tape recording	lennarn	33	13	8	"I managed to dig up a transcript of Toybox Killer's ""welcome tape"" but would love to hear it in his own voice. Hope someone knows of a leaked copy.  
[Here's the transcript.](http://pastebin.com/HSKHsg65)"	t5_2s9td	True
1365047021.0	1bn0dn	Redditor's family had the opportunity to buy Gacy's house... and didn't? Lame.	MakeMeBeautifulDuet	32	13	8		t5_2s9td	False
1364630748.0	1bal8d	r/SerialKillers: The Brief Time I knew BTK	DuckMrKennedy	30	13	12	"Hello fellow redditors. I just stumbled upon this subreddit, and thought I'd share my fascination with serial killers. 

When I was 11-13 I lived in Olathe, KS and had relatives in Wichita. I briefly did boy scouts with my older cousin in 2004, and Dennis Rader was a supervisor/leader for one of the tribes. He wasn't in our tribe but I remember he was always there when our whole troop had the gatherings. I was just a kid at the time but I remember that Dennis was always really nice to me. He was to everyone. I remember reading after the fact that he was a leading figure in one of the Wichita churches too. I talked to him a handful of times but I always saw him around and just figured he was one of the kids' dad. 

It's weird to think about that that guy was once BTK, one of America's most prolific serial killers. I left the troop before he was caught in 2005. I didn't really follow the news and my dad didn't share the BTK story with me until I was a little older and had moved out of state. It was so surreal when I saw his courtroom confessions on YouTube of his murders where he was essentially describing the play by play. This was a guy I had been in the same room with on countless occasions. At my parents' home, somewhere there is a group picture in which him and I are both in it! And not only that, he had admitted that he planned on killing again even though it had been a decade and a half since his last murder. 

I guess that's what sparked my fascination for serial killers. "	t5_2s9td	True
1363200281.0	1a8bz8	"""Are there any records of serial killers in ancient times? If so, how were they found out and how were they dealt with?"" on /r/AskHistorians right now!"	smackfairy	26	7	4		t5_2s9td	False
1352398599.0	12v8z4	Innocent men executed?	NoxNeno	24	5	1	I've read that apart from Alexandr Kravchenko, two additional innocent men were convicted and executed before they arrested and convicted the actual murderer Andrei Chikatilo. Can anyone confirm or deny this? Who were these men?	t5_2s9td	True
1343407048.0	x95fx	Australian serial killer Paul Denyer (who now goes by Paula) is suspected in four prison rapes. 	stacyhatesmacys	21	1	3		t5_2s9td	False
1342366321.0	wlg27	[Video] Confessions of the Iceman, Richard Kuklinski. 	stacyhatesmacys	27	8	6		t5_2s9td	False
1342106237.0	wg0im	Girls Disappearing: Behind the Headlines of the Long Island Serial Killer		22	2	3		t5_2s9td	False
1341272063.0	vy87s	Chicago Theater Company Brings John Wayne Gacy's Story To The Stage	bpcombs	20	1	0		t5_2s9td	False
1337296957.0	tsfe1	Ten lesser known serial killers. I bet you know all these guys. 	stacyhatesmacys	20	0	13		t5_2s9td	False
1333395631.0	rpydo	"An ""artistic"" serial killer?"	Ladymia69	22	3	5		t5_2s9td	False
1331762846.0	qwtor	Looking at a list of 10 prolific serial killers. Are they trying to tell us something with the picture between numbers 6 and 5?	countrybuhbuh	24	5	12		t5_2s9td	False
1327036071.0	oogkx	"Edmund Kemper: ""Now would you get in a car with this man?"" - [6:04]"	Grouplover	26	5	5		t5_2s9td	False
1322501028.0	ms68e	"A&amp;E to air two-hour show on “The Long Island Serial Killer"""	bpcombs	20	2	0		t5_2s9td	False
1317193044.0	ktv2d	If you have 24 hours to kill in LA ya gotta stop by here.	countrybuhbuh	21	2	11		t5_2s9td	False
1302548053.0	gnla0	Ny serial Killer calls sister of his latest victim 	againer	19	1	1		t5_2s9td	False
1375297310.0	1jftz9	"(x-post from r/funny) Accused Serial killer tells judge ""I've been better"" at arraignment when asked how he was..."	pseudo_nipple	36	17	1		t5_2s9td	False
1374443848.0	1irtmd	Ottis Toole Documentary	MFSleep	21	3	0		t5_2s9td	False
1373559784.0	1i36kv	Was Albert Desalvo the Boston Strangler. Some evidence against it.	dharmabum_27	20	4	3		t5_2s9td	False
1373514577.0	1i23nf	Albert Fish documentaries?	saramia00	25	5	3	"I already know about the one on netflix ""Albert Fish: In Sin He Found Salvation"" (2007), but I heard it was really badly made and I am really interested in Albert Fish right now. Thanks."	t5_2s9td	True
1371291433.0	1ge70c	Does anyone else think that the amount of people David Parker Ray is said to have murdered is grossly exaggerated?	kiwimark	27	8	13	"I reckon he what just a loner creep who fantasized about these things more than he did them. What are your thoughts?
"	t5_2s9td	True
1363569649.0	1ahx35	Indonesian Ahmad Suradji, convicted of killing 42 women, believed that doing so would give him magical powers. He was executed for his crimes in 2008.	blitzballer	25	8	1		t5_2s9td	False
1361208765.0	18rdka	New Bedford Highway Killer - My friend grew up here and was telling me about this today.	CJZero	25	7	5		t5_2s9td	False
1350626334.0	11qhac	I completely apologize for only only having the mobile link available. Charles Manson family linked with a dozen murders. And are now being investigated.  	StoicGunner	18	0	2		t5_2s9td	False
1346746919.0	zbsai	Favorite video clips of serial killers?	Patrick5555	20	1	8	The iceman tapes is good	t5_2s9td	True
1345742109.0	ypdlm	"I getting a chance to ask questions to a serial killer currently on death row known as ""The Folsom Wolf"" - What would you ask?"	killercentral	23	6	8		t5_2s9td	False
1345517711.0	yk6ry	Can anyone link any good serial killer documentaries to me?	Aziral	20	3	19	I have been watching a decent amount of them but I have finally run out of ones that I can find. So I thought I would ask if you guys have any interviews or documentary links.	t5_2s9td	True
1342627526.0	wrjcw	[Interview] A private investigator makes interesting revelations about her work on the Green River Killer case. 	stacyhatesmacys	20	3	1		t5_2s9td	False
1342324983.0	wkvgz	Carroll Edward Cole killed 16, the first being a classmate who made fun of his name	malenkaia	22	4	3		t5_2s9td	False
1338821894.0	uk9ea	Video: BTK Confessions	stacyhatesmacys	20	3	6		t5_2s9td	False
1333075528.0	rkbnw	Sheriff wants new dig for Gacy victims	misterbuckets	22	2	1		t5_2s9td	False
