created_utc	id	title	author	ups	downs	num_comments	selftext	subreddit_id	is_self
1350482532.0	11mogp	I need your help serial killer connoisseurs. 	arkanemusic	10	4	4	"Does any of you know where I could listen to radio reports about serial killers?

A transcript would be okay to, but I'd much rather listen to it.

Anything like: ''This serial killer is still in the streets, we recommend you to lock your doors...''  or something like this.

Thanks.

"	t5_2s9td	True
1345519532.0	yk8nl	Texas Department of Criminal Justice List of Last Statements from Executed Offenders (x-post from r/MorbidReality)	Mandee430	11	4	0		t5_2s9td	False
1341616294.0	w5j4d	"Jerome Henry ""Jerry"" Brudos (January 31, 1939 – March 28, 2006)"	malikou	8	1	3	On 28 March 2006 I was one of the First people to know that he died in prison. My dads sister was one of his victims. When i Informed my dad of the phone call. he was much relieved and had to go and be by him self. Later he told me, that he was almost caught when someone ran a vehicle into his wall and the police tarped the hole without looking in. No idea how that is possible or if that at all is true. 	t5_2s9td	True
1333949780.0	s0ehe	Does r/serialkillers like cannibals?	zombalicious	8	3	8		t5_2s9td	False
1333928697.0	rzxjh	Female Serial Killers	Ninamgrey	12	4	0		t5_2s9td	False
1329686902.0	pwuvb	Great documentary on Andrei Chikatilo - 'The Butcher of Rostov'	xaverxerx	11	3	0		t5_2s9td	False
1327563750.0	oxcmz	Church of Misery, badassed songs about serial killers	SabineLavine	11	3	5		t5_2s9td	False
1327430225.0	ourp0	"Criminal Minds : (Ep. 711) ""True Genius"""	chevallier	10	2	2		t5_2s9td	False
1318995503.0	lh3gi	Meet Dennis Nilsen, Britain's Jeffrey Dahmer	b3d0u1n	10	3	3		t5_2s9td	False
1318882176.0	lfhfs	21 year old British Columbia man charged with an additional 3 murders.  Already in jail accused of killing a 15 year old girl.	AppleAtrocity	7	1	0		t5_2s9td	False
1318621408.0	lcev0	UNT lab in Fort Worth helping to identify Gacy victims	bpcombs	8	1	0		t5_2s9td	False
1318515919.0	lau61	Kim Rossmo tried to warn of serial killer, Pickton inquiry told	bpcombs	7	0	0		t5_2s9td	False
1317431651.0	kx2v1	Clifford Olsen Dead [x-post from \r\canada]	chrunchy	7	1	1		t5_2s9td	False
1317108621.0	ksqga	Robert Pickton cell video.	koldsnap	8	0	2		t5_2s9td	False
1317108011.0	ksq9e	If you were a serial killer whom would you target and why? What would be your method of killing?	countrybuhbuh	11	6	28	Also where/how would you dispose of the bodies? What if anything you would keep as a trophy? How in the end would you be caught? please feel free to sound off in your posts. Don't just post 1 or 2 word answers. Let's play with this and have fun.	t5_2s9td	True
1302901370.0	gr1br	More coverage of the Long Island killer	lextenou	7	1	0		t5_2s9td	False
1302822163.0	gqard	How can we make this a bigger community?	tiger_lily	7	0	17	We don't have enough posts! I really would love for this to be a more active community.  Especially right now that we have an active SK to discuss and dissect.  How can we promote it without spamming? Anyone?	t5_2s9td	True
1302632677.0	goeep	Anyone feel like speculating on the type of person the new NY killer may be?	tiger_lily	9	2	12	"I used to read those awesome FBI profiling books by John Douglas so I was wondering if anyone would like to speculate on this guy.  I haven't read them in a while so I'm going to go back and check them out to see if I see anything that might help.

Heres some patterns I've noticed about the victims(note: i haven't followed this case that much, so this is just surface things i've noticed.)
All white females
All petite
In vulnerable situations(prostitutes)
All strangled
Most found in burlap sacks on the beach(does this guy work in the fishing industry perhaps?)

So, most likely, he's definitely got to be a white male. No doubt in my mind. SKs usually choose their own race, and(if i'm not mistaken) all victims are white.  The fact that they are petite also is interesting to me.  I'm assuming(i know i know, assume makes an ass out of you and me) he got pictures of them before meeting them since craigs list and all -- a SKs paradise, unfortunately.  So he probably narrowed them down to fit his 'type.' So he might be a smaller guy himself if he purposely chose petite women.

Any one else?

Edit: One more thing.  I think they're using the media to draw him out to communicate with them.  I read an article posted a few days ago that was talking about a phone call he made to a victims sister in 09 IIRC.  "	t5_2s9td	True
1302520616.0	gnbh7	Police Think Suspected Long Island Serial Killer May Be Ex-Law Enforcement	Datamite	9	2	5		t5_2s9td	False
1300900500.0	g9tzn	Ottis Toole killed Adam Walsh		7	1	1		t5_2s9td	False
1297123576.0	fh6jc	Serial Killer's Secret Photos		7	0	5		t5_2s9td	False
1295104414.0	f2to4	Zodiac Killer Facts - A debunking of Robert Graysmith and a look at the information available on the case.	BosAnon	7	0	0		t5_2s9td	False
1295079620.0	f2q6d	Serial Killer Quiz	cxde	7	0	2		t5_2s9td	False
1376704447.0	1kiz6e	Could a hit man be a serial killer?	Bailliebugs	6	0	4		t5_2s9td	False
1370748896.0	1fypdf	good books about psychopathology, sociopathology? (sorry for spelling)	TheDarkdefender0529	8	4	10		t5_2s9td	True
1370443479.0	1fq1n9	Graham Young, the Teacup Poisoner	Cern_Stormrunner	10	2	2		t5_2s9td	False
1370054505.0	1fg088	Have any of you ever communicated with imprisoned killers?	thrwy-sk	11	5	7	If so, how did you find their information?	t5_2s9td	True
1366903714.0	1d35sy	what does reddit think about the 'smiley face' killer theory. possible new victim?	dharmabum_27	18	12	10		t5_2s9td	False
1359920513.0	17tk44	Looking for some more good, well-researched books on serial killers/cases.		6	1	15	"I'm about halfway through [In The Wake Of the Butcher](http://www.amazon.com/Wake-Butcher-Clevelands-Torso-Murders/dp/0873386892), which chronicles the official active years of the Clevland Torso Killer.  Up next I have [Cries In the Desrt](http://www.amazon.com/Cries-Desert-Martins-Crime-Library/dp/0312977565/ref=sr_1_1?s=books&amp;ie=UTF8&amp;qid=1359920359&amp;sr=1-1&amp;keywords=cries+in+the+desert), which details what we know about the crimes of David Parker Ray.

I'm looking for more books of these caliber.  I understand that Ann Rule's [The Stranger Beside Me](http://www.amazon.com/Stranger-Beside-Me-Ann-Rule/dp/1416559590) is supposed to be the definitive Bundy book, but I'm looking for other killers.  The more obscure the better."	t5_2s9td	True
1359503479.0	17j05d	Sheriff eyes possible Gacy connection to Michigan cold case - Chicago Sun-Times	Icantevenhavemyname	7	2	1		t5_2s9td	False
1357786072.0	16agky	My little subreddit posting old letters seems to contain a lot of correspondence from serial killers. Here's the latest from Son of Sam. What do you make of it?? Why do so many serial killers write letters?	Girlwithnousername	9	2	0		t5_2s9td	False
1356877526.0	15o9br	The story of Serial Killer William Vincent Brown	investigativevoice	12	6	4		t5_2s9td	False
1349007416.0	10phxa	The Folsom Wolf - lesser known serial killer currently on death row!	killercentral	6	2	8		t5_2s9td	False
1340651122.0	vl3h5	Victim Studies 021: Raymont Hopewell	bpcombs	6	0	0		t5_2s9td	False
1340395090.0	vg8pm	Book says Karla Homolka is a Mother, Living in Guadeloupe	bpcombs	7	0	5		t5_2s9td	False
1335713993.0	sy8es	Keith Hunter Jesperson - The Happy Face Killer	thegreat_destroyer	7	2	2		t5_2s9td	False
1334769048.0	sg9z6	Victim Studies 017: Colonel Russell Williams	bpcombs	6	0	0		t5_2s9td	False
1331228172.0	qnjws	Victim Studies 014: Karla Homolka	bpcombs	7	0	2		t5_2s9td	False
1330358303.0	q87fu	Book Review: “The Serial Killer Whisperer” by Pete Earley	bpcombs	8	2	2		t5_2s9td	False
1327356682.0	oth1k	A Serial Killer 'Talks' Too Much, May Speed Up His Own Execution	theblackandblue	6	2	0		t5_2s9td	False
1327003874.0	onq9f	"""People You'll See In Hell"" A site dedicated to exactly that, the nastiest, heinous, murderous individuals that plague our planet."	patrickaaron	8	1	1		t5_2s9td	False
1325606191.0	o16nw	Albuquerque businesses help hunt for a killer	bpcombs	9	3	1		t5_2s9td	False
1323136420.0	n1wgv	Tonights A&amp;E special on the Long Island serial killer.	edify	7	1	4		t5_2s9td	False
1323099284.0	n1677	Ripper horror still intrigues	bpcombs	6	0	0		t5_2s9td	False
1322720898.0	mvufk	Police suspect all 10 Long Island victims were killed by one person.	thegreat_destroyer	7	1	1		t5_2s9td	False
1318988788.0	lgzdr	bones found in David Parker Ray case	myslavename	7	0	0		t5_2s9td	False
1314220458.0	jtajp	David Berkowitz Won’t Seek Parole in 2012	bpcombs	6	1	0		t5_2s9td	False
1313745179.0	jnpln	Vera Renczi, the black widow	ShittyMF	7	0	0		t5_2s9td	False
1312560381.0	j9yti	If Albert DeSalvo Wasn’t The Boston Strangler, Who Was?	bpcombs	6	0	1		t5_2s9td	False
1312554058.0	j9vhu	Ted Bundy’s DNA to be Uploaded Today	bpcombs	6	0	2		t5_2s9td	False
1311478675.0	iy4w3	Zodiac code cracked?	LaheyDrinks	13	5	6		t5_2s9td	False
1310306649.0	illg8	Is a Serial Killer Targeting Prostitutes in Mexicali?	bpcombs	6	1	1		t5_2s9td	False
1305760065.0	heldz	Long Island police revisit two cases with possible link to Gilgo beach serial killer	edify	8	1	0		t5_2s9td	False
1305727702.0	he7in	Auction of the Unabomber's personal effects.	crummy_water_tower	6	0	3		t5_2s9td	False
1305560441.0	hclls	Reports: NYPD Officer Among Last to Contact Gilgo Beach Victim	bpcombs	6	0	8		t5_2s9td	False
1305498158.0	hc3cf	Reports: NYPD Cops Being Looked at for Gilgo Beach	bpcombs	8	1	1		t5_2s9td	False
1295561789.0	f62yr	X-Post from r/creepy, Ed Gein would be so proud		9	2	4		t5_2s9td	False
1295494049.0	f5k02	Dahmer probably had one of these.	room750	9	4	6		t5_2s9td	False
1295280685.0	f3un3	Ted Bundy- the most evil human being of the 20th century?		9	4	7	"I'm sure that Ted Bundy is a name that you have all heard.  However, are you fully aware of the details surrounding his crimes?

To start: Bundy murdered women.  All young, attractive and fitting a certain appearence pattern (which many believe matches that of his ex girlfriend, who seriously impacted his already disturbed life).  He would assault/murder them, kidnap/transport the body, rape them, dispose of them, and simply move on with every day life.  He did this between 35-90 times.  The large gap is only due to the fact that he never told anybody the real number.  

In at least one instance, he took two girls to one spot, raped and killed one of them infront of the other, then performed the deed on the unfortunate witness.  Once apprehended, he escaped from prison twice.  On the second escape, he murdered three more girls.  The final of which being twelve years old.

This entire time, he was living as a clean cut law student in a lengthy and (seemingly) healthy relationship.  Many saw him with a future in politics, especially when he worked in the party of a republican candidate.  Was Ted Bundy the most evil man to exist in the 20th century?  I think so."	t5_2s9td	True
1295222560.0	f3hsj	John Wayne Gacy - The FBI Files (warning: PDF files!)	BosAnon	6	1	0		t5_2s9td	False
1295077369.0	f2ptf	List of murderers by number of victims	cxde	6	1	0		t5_2s9td	False
1295076040.0	f2pkt	Paul Bernardo - Canadian serial killer and rapist, known for the murders he committed with his wife	cxde	7	1	6		t5_2s9td	False
1295029870.0	f2cv3	Which SK have you guys found to be of the most interest to you personally?		6	0	8	"For me it's probably Edmund Kemper, IQ of a genius, and the way he plotted his murder spree from start to finish (start with family, end with family). Can't help but wonder what's going on inside the guys head. 

He's always been the perfect example of cold and calculated, he shows that serial killers aren't necessarily psychotic beasts... 

What are some of yours?"	t5_2s9td	True
1359859065.0	17sc3o	"Audrey Marie Hilley - Subject of Lifetime Movie ""Wife, Mother, Murderer"".  "	stacebabe	6	0	2		t5_2s9td	False
1356771223.0	15m9vc	Highway of Tears - A haunted highway that attracts evil ... over 20 girls missing or murdered. Who killed them? Peter Van Sant investigates.	masturbatin_ninja	7	2	0		t5_2s9td	False
1351304440.0	125nb1	Made a short film about a serial killer!	NiceAsACanadian	8	2	1		t5_2s9td	False
1347685428.0	zwxwn	The number of Serial Killers in SA continues to grow, this is just another to add to the list	Amzddd	6	0	0		t5_2s9td	False
1343998782.0	xm8l6	The BTK Killer - www.serialkillerscentral.com	killercentral	9	4	3		t5_2s9td	False
1341122163.0	vvbn3	Gambino family soldier Roy DeMeo and his crew were suspected in nearly 200 murders. 	Mickey_Meatballs	9	2	4		t5_2s9td	False
1339140448.0	ur9lu	"In Seattle the proposed ""Green River Killer Tour"" is canceled"	zomboi	10	5	0		t5_2s9td	False
1338820150.0	uk834	Victim Studies 020: Ivan Milat	bpcombs	5	0	1		t5_2s9td	False
1338543028.0	ufeie	The Killer Clown John Wayne Gacy - Put some info on my blog about this serial killer!	killercentral	11	8	5		t5_2s9td	False
1338454421.0	udm8s	Long Island Killer is still out there guys! Rumours of his capture dispelled	killercentral	6	1	7		t5_2s9td	False
1337670980.0	tyxla	My Freind Dahmer: the best comic I read this year	Brian_McGee	6	2	1		t5_2s9td	False
1335989767.0	t3u23	Victim Studies 018: Edmund Kemper	bpcombs	5	0	1		t5_2s9td	False
1335988797.0	t3t1h	Book Review: “The Devil in the White City” by Erik Larson	bpcombs	6	1	3		t5_2s9td	False
1335987572.0	t3rqx	Shannon Gilbert's death ruled inconclusive, still no answers about her connection to the Gilgo Beach serial killer	girltano	6	0	0		t5_2s9td	False
1334090886.0	s353a	Victim Studies 016: Robert Lee Yates	bpcombs	5	0	0		t5_2s9td	False
1334062495.0	s2gjx	Why do we read about this stuff?	clfr21	5	1	8	I'm just curious as to why you read about about serial killers and murders? What is our fascination? I am guilty myself of this and read up on these things but i only go so far with what i want to read or more importantly see. Do you have a limit?	t5_2s9td	True
1332771847.0	re7tp	Review: “Blood on the Altar” by Tobias Jones	bpcombs	5	0	0		t5_2s9td	False
1331566856.0	qt09z	Wesley Shermantine Writes Second Letter to Media	bpcombs	7	2	0		t5_2s9td	False
1329581680.0	pvbah	Retired FBI Agent Says Killer Shermantine ‘Seeks Value’	bpcombs	5	0	0		t5_2s9td	False
1326995387.0	onja2	Serial killers in China | Danwei	againer	7	2	1		t5_2s9td	False
1326592473.0	ohgqb	Las Poquianchis... over 91 killed	4mnesi4	6	1	5		t5_2s9td	False
1322581098.0	mten1	Profiler describes Norman murder suspect as ‘serial killer'	bpcombs	5	0	0		t5_2s9td	False
1320951618.0	m7pvh	"Doctor turned serial killer in World War II Paris
| Reuters

"	unwarrantedadvice	7	1	0		t5_2s9td	False
1319678327.0	lqezn	Fictional serial killer book recommendations?	tiger_lily	5	1	4	What are your favorite fictional portrayals of serial killers? Such as, silence of the lambs, etc.  I just finished reading Abducted by TR Ragan and I highly recommend it!	t5_2s9td	True
1318512665.0	lasj9	There’s no way to spot another Russell Williams	bpcombs	6	0	0		t5_2s9td	False
1315278392.0	k60ef	The Electric Hellfire Club - Mr. 44 (song about Son of Sam)	Shut_Up_Asshole	12	5	0		t5_2s9td	False
1311072980.0	itpp2	Possible Institutional Killer at Stepping Hill Hospital	bpcombs	6	0	0		t5_2s9td	False
1303603085.0	gw0bj	Human teeth found in serial killer search in New York	tiger_lily	5	0	0		t5_2s9td	False
1301974056.0	giuhs	Serial Killer On The Loose In NY (xpost from reddit)	ennuigo	8	1	1		t5_2s9td	False
1301331609.0	gd8xx	Female serial killer Dorothea Puente dies at 82. (convicted of three murders, possibly committed nine +, 7 bodies found in backyard.)	Mazarine	6	0	0		t5_2s9td	False
1300538752.0	g715c	The Zodiac Killer	meredona	6	0	0		t5_2s9td	False
1299082141.0	fvuov	My favorite Charles Manson song		5	0	0		t5_2s9td	False
1295033136.0	f2e1x	Derrick Todd Lee: The Baton Rouge Serial Killer	wordsauce	8	3	0		t5_2s9td	False
1294962182.0	f1vr0	Bundy Confession Tapes - Not the whole story, but some disturbing revelations.	BosAnon	5	0	0		t5_2s9td	False
1374352131.0	1ipo46	New movie about Robert Hansen out now	EvilFuckingSociopath	8	2	4		t5_2s9td	False
1373593599.0	1i4hxi	DNA points to DiSalvo in Boston Strangler case.	mspace55	7	1	0		t5_2s9td	False
1371220091.0	1gc81p	New serial killer captured, tied to 30+ deaths	ImaginalComponent	8	4	3	"Sounds like one cold SOB. Wonder if he uses Silkroad?

Interesting reply in the comments section:

""White shooter = Mental illness
Black shooter = thug/gang
African shooter = African Somalian pirates (i.e. St. Louis business shooting)

Hispanics/Mexican shooter = illegal immigrant/drug cartel gang
Middle-Eastern shooter = terrorist (w/ bombs)
White female shooter = PMS/self-defense."""	t5_2s9td	True
1370641840.0	1fw2ip	The 2006 Richmond Spree Murders. Among the victims were the Harvey family (including two daughters aged 4 and 9) who co-owned a toy store called World of Mirth	girltano	5	2	4		t5_2s9td	False
1359558315.0	17kaaj	Daniel Conahan and eight local unsolved (serial?) murders.		7	2	1		t5_2s9td	False
1359480713.0	17i74t	"Online Gallery: ""Grown-up Jokes"""	coffinkiss	6	2	0		t5_2s9td	False
1359173626.0	17asm3	The Following may struggle to find one	JohnWMorehead	4	1	2		t5_2s9td	False
1351443189.0	1283d8	"Does anyone have the Hideous Crimes doc series, 
especially one for Robert Maudsley, the OG 
Hannibal the Cannibal? "	galaghe	4	0	0		t5_2s9td	False
1339431372.0	uwbf2	Victorian serial killer! A poisonous black widow - Mary Ann Cotton!	killercentral	7	2	4		t5_2s9td	False
1337117666.0	tov7l	A little help?	living-nightmare1331	4	2	10	"I was wondering if anyone knew any good podcasts,videos,magazines,books,etc. that talk about serial killers or getting in their head. maybe interview things like that...i already know of a website called serial killer calendar.com and they have awesome magazines that i will try to get soon, but are there others? I've also started the video on Jeff Dahmer's trial but anything else? or even like a good book that maybe has like a challenge attached to solve a case of some sort? ive heard of a book about a (fake)serial killer and there's sudoku involved and that seems cool....

but any suggestions are welcome. Maybe some other websites all bout serial killers?......"	t5_2s9td	True
1336809490.0	tjfrt	Solved (TV series) on Netflix	Mandee430	8	4	2	"Hey for anyone who has a Netflix account, I'd like to recommend a true crime show called Solved from the Investigation Discovery network. I've been hooked on the show because the way the cases are presented and how the show is formatted is really interesting to watch. 

An episode starts out with the discovery or a body (or bodies) and goes on to show how detectives solve the case with the help of forensics, witnesses, etc. Seasons 2 and 3 are available to stream on Netflix. I haven't finished both seasons to see if any famous serial killers are featured, but I have seen a few cases that I have heard of. The rest are cases I've never known about which makes it all the more interesting. Check it out and let me know what you guys think."	t5_2s9td	True
1334600858.0	scqwn	Norway Shooter is first of many..and a member of the new knights templar?	kroniktacoz	8	3	2		t5_2s9td	False
1334154204.0	s4cnp	Peter Tobin runs up £15,000 medical bill in prison with string of fake illness	bpcombs	5	0	0		t5_2s9td	False
1330460365.0	qa4zx	Victim Studies 013: Paul Bernardo	bpcombs	4	0	0		t5_2s9td	False
1329411043.0	pshby	Shermantine's burial sites sparks missing-person inquiry	bpcombs	4	0	0		t5_2s9td	False
1328629935.0	perop	Inquiry learns police had to stop watching Robert Pickton after he was tipped off	bpcombs	5	0	0		t5_2s9td	False
1327441811.0	ov1j8	The So-Called Serial Killer Math Formula	bpcombs	8	4	0		t5_2s9td	False
1327343870.0	ot634	Review: “The Gainesville Ripper” by Mary Ryzuk	bpcombs	4	0	0		t5_2s9td	False
1327172867.0	oqhap	Searchers hope Wesley Shermantine keeps word to locate graves after Calif. sheriff slows process	bpcombs	4	0	0		t5_2s9td	False
1326849263.0	olp31	Song about John Wayne Gacy by Sufjan Stevens	niallcloonan	7	3	2		t5_2s9td	True
1326570014.0	oh283	Green River Killer	4mnesi4	7	4	5		t5_2s9td	False
1325913665.0	o6fp0	Charles Manson Cell 13	4mnesi4	5	3	4		t5_2s9td	False
1322500627.0	ms5zj	Former investigators back on Gacy case	bpcombs	5	1	0		t5_2s9td	False
1319825625.0	lsfr7	Video of interviews with serial killers	birdsofprey	5	2	5	"I am wondering if anyone knows how to access videos of interviews with serial killers, like the ""iceman"" and the charles manson msnbc interview? "	t5_2s9td	True
1319818306.0	lsba2	Thanks, Wikipedia! Now we know what he looks like. Good lookin' out!	drgk	11	5	0		t5_2s9td	False
1319752256.0	lrgh3	Real life supervillians, courtesy of Cracked.	m0dus0perandi	4	0	0		t5_2s9td	False
1318018241.0	l4h1c	"""Green River Killer: A True Detective Story."" A graphic novel written by the son of a detective working the Green River case. Came out last month. Looks really interesting."	ribaldeer	5	1	1		t5_2s9td	False
1314123527.0	jrxso	Soil for Sale from Anthony Sowell’s Yard	bpcombs	7	2	0		t5_2s9td	False
1313941649.0	jpox3	Prosectors File to Block Sowell Retrial	bpcombs	4	0	0		t5_2s9td	False
1309310602.0	ibux0	Steve Miller is reporting from the Anthony Sowell trial, for you true crime addicts!	bpcombs	4	0	0		t5_2s9td	False
1308811522.0	i6ydv	[x-post from IAMA] Update on a guy who took 3 days off work to try to crack Zodiac serial killer's last remaining undeciphered message. Interesting thread.	cxde	4	0	0		t5_2s9td	False
1307282051.0	hs41k	Rose West's Friends	bpcombs	4	1	1		t5_2s9td	False
1305936227.0	hgbbc	Question: The Unabomber's personal effects are up for auction. The proceeds will go to the victims. Is this right or wrong? How and why?	edify	5	1	3		t5_2s9td	True
1305416770.0	hbj66	Serial killer/morbid memorabilia site.  Ted Bundy's tire iron is up for auction.	Shut_Up_Asshole	6	1	2		t5_2s9td	False
1304745373.0	h5w4c	Using forensics to catch serial killers.	crummy_water_tower	5	0	0	[Article](http://serialkillers.briancombs.net/1253/forensic-studies-001-the-atlanta-child-murders/). Found via [this thread](http://www.reddit.com/r/TrueCrime/comments/h5lq6/forensic_studies_001_the_atlanta_child_murders/).	t5_2s9td	True
1296504372.0	fckzh	'Grim Sleeper' photos: 4 missing persons cases opened, 53 women identified - Los Angeles Times	againer	5	2	5		t5_2s9td	False
1295459278.0	f5895	Accused Kensington Strangler confesses.	edify	8	4	0		t5_2s9td	False
1294965369.0	f1wq9	The Grim Sleeper, Lonnie Franklin Jr., arrested in Los Angeles, CA  July 7, 2010		5	0	0		t5_2s9td	False
1365913051.0	1cb607	Serial Killer that was in my area when I was a kid in Nebraska.	Senor_If_Statement	5	2	4		t5_2s9td	False
1362887548.0	1a09nh	What do you guys think of jodie arias?	jokergirl32	9	8	15	"Ok, she's not a serial killer But she did kill her boyfriend.  Obviously we all know that. I haven't been keeping up much with it, But what I've seen I can tell she's a HUGE manipulater.

I don't know if she's up against the death penalty or not. Does anyone know? But she can really flip a switch. In a way she reminds me of Ted Bundy by how cocky she acts. It really ticks me off. 

I don't think she's going to get off as easily as she thinks she will. So what do you guys think of her?"	t5_2s9td	True
1360030590.0	17wnxq	Russian Serial Killer Dreams of Freedom	iammanic	9	6	0		t5_2s9td	False
1351292560.0	125ddt	Billy in the Bowl - The Case of the legless Stoneybatter Strangler. [xpost from r/IrishHistory]	cazale	3	0	0		t5_2s9td	False
1344399154.0	xv434	Radford University Serial Killers Project	proudfangirl	6	3	4	This website has a lot of interesting information, especially in the PowerPoint.	t5_2s9td	True
1344090603.0	xo6dp	Holmies: James Holmes, the Batman Killer and his 100's of online groupies	rakista	4	1	4		t5_2s9td	False
1337098780.0	todo2	The Collectors: A documentary about people who collect artwork by serial killers. Quite good. 	stacyhatesmacys	5	2	0		t5_2s9td	False
1336617080.0	tft2m	Nathaniel Code's Opening Statement	Gdave21	3	0	0		t5_2s9td	False
1335528813.0	sv661	Female Serial Child Killer	peeples19831	3	0	0		t5_2s9td	False
1330623717.0	qd5nf	Police team leader defends 2-month vacation during Robert Picton's spree	bpcombs	5	1	0		t5_2s9td	False
1329412430.0	psifi	Robert Pickton began killing in 1991, inquiry told	bpcombs	4	1	1		t5_2s9td	False
1328568726.0	pdrh5	Review: Dark Minds, “The Eastbound Strangler”	bpcombs	3	0	0		t5_2s9td	False
1328213623.0	p85dc	Report: Police have Identified Gilgo Beach Suspect	bpcombs	5	3	2		t5_2s9td	False
1328202024.0	p7vi4	(Canadian investigative) Methods much improved since Bernardo case	bpcombs	3	0	0		t5_2s9td	False
1327018365.0	oo2sg	Victim Studies 009: Robert Pickton	bpcombs	4	1	0		t5_2s9td	False
1324003249.0	nenfs	Ottawa police believe a serial killer is preying on sex workers.	thegreat_destroyer	3	0	0		t5_2s9td	False
1323182377.0	n2iub	Cross posting from r/Rochester: Who wants to buy Arthur Shawcross' Chevy Celebrity for 15K?	lotusstp	3	0	2		t5_2s9td	False
1320944103.0	m7khx	Police looking for serial killer link to Daly City cold case slaying	bpcombs	3	0	0		t5_2s9td	False
1320877043.0	m6mif	Fraud-detection killers--white collar criminals who  murder to hide their crimes (pdf)		3	0	0		t5_2s9td	False
1320092330.0	lvkec	Stayin' Alive: How to Avoid Being Attacked by a Serial Killer	shillerz	4	1	0		t5_2s9td	False
1320072286.0	lv6uo	Sitcom Characters Who Would Make Perfect Serial Killers	bpcombs	5	1	0		t5_2s9td	False
1319839818.0	lso6n	Cardy parents prayed for daughter's killer Robert Black	bpcombs	3	0	0		t5_2s9td	False
1319640282.0	lpq7u	Twin Falls' Notorious Female Serial Killer (Lyda Southard)	bpcombs	3	0	0		t5_2s9td	False
