created_utc	id	title	author	ups	downs	num_comments	selftext	subreddit_id	is_self
1344676674.0	y1jho	"Chikatilo prison interview: ""I already suffered so much.."" [translation in comments]"	the_fearful_jesuit	14	2	4	"sorry, link here: [chikatilo interview liveleaks](http://www.liveleak.com/view?i=8b6_1295138377)


i will translate some of the main things he talks about, but he tends to speak in long winding sentences and some things he says seem unstructured and sudden. 
i added some explanations in []'s for the stuff he says that is implied in russian but gets lost in translation. judging by his intonations and by the way he misdirected his answers, chikatilo seems very sorry only for himself and considers himself wronged by life and the russian justice system.
russian is my third language, but i'm pretty fluent in it and am really into chikatilo, so i thought i'd share here. also, i was surprised just by how oblivious he is to his own guilt given the often quoted ""i am a monster"" bs and ""preserve my brain"" crap he gave the reporters. 

**LET'S GET TO IT**:
he talks about how his mother told him that his brother was cannibalized &amp; that his mother told him to be careful of cannibals. he is **asked if he loved god when he was a child (or ever) and c. says he doesn't know because his childhood was about surviving more than anything else** (ie not about religion or family relationships). he remembers crying because he was hungry and only having a morsel of old bread to eat.
the interviewer asks chikatilo if he feels sorry for the little red riding hood or if he ever had (when he heard the tale in his youth). he says ""yes of course, when i was a kid and heard the tale i cried and of course felt sad about it.."" he seems reluctant to talk about it and then the interviewer pushes him and asks if he felt sad for the wolf then? c. answers ""well somehow i didn't really assign it any significance (ie the wolf's death in the tale)""
**interviewer asks if he ever thought of what will happen if/when he meets his victims in the afterlife, chikatilo says ""no. i never thought about that. i think that all of that has nothing to do with me** and i don't think about it. i have gone through so much suffering in my life that no i do not think about this and if i was to write about all my sufferings it would be like writing about hell, so i have suffered so much that i have already come to peace with anything bad that may happen to me and i don't think about it "" he also says ""the judges, doctors and **society have been asking me why i did not hang myself [ie hang himself instead of going on a killing rampage]** and all these doctors who have written about the stress i must have been under to commit the crimes and such, and i can answer them that **if i was a more standard person, then i would have drank myself to death or hanged myself, but i have gone through my life being despised and having people pull the rug from under my feet** - everywhere (ie at work and at home) [so he is saying that he could bear the building pressure of needing to murder and stress *after* the murder caused by having to hide it from everyone only because he was ""not standard"" and was used to ""living in hell"" at work and elsewhere. so basically he is implying that if people in his life had not been so horrible to him, then he would not be already used to ""living in hell"" and he would of killed himself or drank himself to death instead of indulging his desires to kill and being able to tolerate the pressures of being a serial killer ---- he is not to blame..it's society's fault for developing his stress-resistance :)..]"" 

int.: are you tortured by nightmares?
chi.: **my psycho-sexual or sexual-psychiatric thoughts and perversions are piling up in my head.** they studied me, with electrodes on my head and everything, they have fixed proof of my illness... and all that stuff that the **doctors say and my lawyer has proved that i am sick and that i should not be shot, that i can be shot only if i am healthy, but o.k. never mind that, let's just say that my nightmares usually torture me when i have severe headaches because of the concussion i suffered after they [the police] took me in and also from when i was working as manager in the mines and tried to take away the vodka from the mine workers and they tried to poison me for that** (he got a concussion on that occasion as well). i do exercises in my cell, sometimes my heart feels like it is pounding so fast that it will explode and then i think - so be it, all this will end sooner, and i do this when my head aches, in an effort to distract myself from this.""
he talks about how he knew some big shots in the communist party etc and that he was really a somebody, that he traveled and such but most of it is very fragmented and unclear. he talks as if he thinks that the interviewer knows what he is talking about.
**he says that pornography never entertained him but that he rather was entertained by reading philosophy,Marxism (esp the logic in Marxist philosophy, he read about Lenin a lot)** and was interested in politics.
he says that he prefers cats over dogs because they had cats when he was growing up. **cats are the only animal he can distinguish as likeable.** "	t5_2s9td	True
1340861806.0	vq7fp	"Peter William Sutcliffe ""The Yorkshire Ripper"""	RebelTactics	14	1	5		t5_2s9td	False
1340399603.0	vgd4f	The River Man’s Closest Victim (Part 2)	ChroniclesCriminal	11	0	4		t5_2s9td	False
1339986150.0	v7dsi	"""There is no happiness without tears, no life without death. Beware! I am going to make you weep"" - Lucian Staniak"	StoicGunner	15	3	0		t5_2s9td	False
1332787987.0	rekp7	Dennis Nilsen bleats: I won't be able to retire on £9.60 per week prison wages	bpcombs	11	0	2		t5_2s9td	False
1332294796.0	r62rf	New possible victim of sadistic serial killer Randy Kraft identified.	StoicGunner	11	0	0		t5_2s9td	False
1327292588.0	osf27	In 1999 Luis Garavito admitted to the rape and murder of 140 young boys. (x-post from TIL)	MntnDw	11	0	1		t5_2s9td	False
1325866425.0	o5jba	Victim Studies 008: Jeffrey Dahmer	bpcombs	13	1	0		t5_2s9td	False
1324050197.0	nf8um	'Early adopters' of serial-killer theory were criticized, Pickton inquiry told	bpcombs	11	0	0		t5_2s9td	False
1320073425.0	lv7j7	Ten Best Serial Killer Movies You Haven't Seen (AKA Ten Unique Serial Killer Films For Halloween)	bpcombs	17	7	1		t5_2s9td	False
1320071185.0	lv691	Six More Deaths Linked to Grim Sleeper Serial Killer	bpcombs	11	0	0		t5_2s9td	False
1318803427.0	leg2d	Serial Killers Live Here 	barjonah	12	2	2		t5_2s9td	False
1318745834.0	ldvtp	Gacy might've had victims in other states.	Ajulutsikael	11	0	0		t5_2s9td	False
1314519125.0	jwvel	Who is your favorite Fictional serial killer?	countrybuhbuh	14	2	48	"I will except answers from any genre; Movies Books TV Video Games

My current favorite is Serge Storms written by Tim Dorsey (cheap plug alert) http://timdorsey.com/home.html

He has the most inventive kills this side of the Final Destination series :)  

For those that have answered would anyone prefer to state why your choice is your favorite?"	t5_2s9td	True
1314071653.0	jrbti	Ottis Toole Devil Art - American Serial Killer, Rapist and Cannibal 	danthoms	12	3	1		t5_2s9td	False
1312231693.0	j60tq	Ted Bundy to be added to FBI DNA Database	bpcombs	11	1	0		t5_2s9td	False
1296165814.0	fab7m	What serial killer fascinates you the most? Which one scares you the most?	tiger_lily	11	1	25	For me it would be Jeffey Dahmer(most fascinating) and the scariest would be Ted Bundy(because he was so normal acting..)	t5_2s9td	True
1294947896.0	f1qsy	This has been the go to site for me for as long as I can remember...		13	0	2		t5_2s9td	False
1371470685.0	1gieej	FBI search inventory of items recovered from one of Ted Bundy's stolen cars, 2/10/78 (part 2 in comments) (X-post from r/TedBundy)	misanthropicmarlowe	13	3	3		t5_2s9td	False
1371436198.0	1ghmne	Are there any 21st century serial killers?	saramia00	14	3	19	"I noticed that I have never heard of a serial killer operating only in the 21st century yet. I imagine that its because of advances in criminal profiling and forensic science that most of these murderers aren't able to become serial killers. But I was wondering if we have had a true, only 21st century killer.

P.S. I think its funny that one of the most polite and helpful subreddits I have found is about serial killers. :)"	t5_2s9td	True
1370563052.0	1fttr7	Alaskadispatch.com has several audio tapes from the questionin of Israel Keyes.	ContentWithOurDecay	14	3	0		t5_2s9td	False
1369376514.0	1eygxw	Ted Bundy Sits in His VW, In Between Abductions, at Lake Sammamish, WA; 1974. X-post from Morbidreality	ScarfWhore	14	3	1		t5_2s9td	False
1368132906.0	1e0x9z	Hello guys, any interesting serial killer documents?	clintrouseman	13	3	9	"My contribution, even though school shooters are, by definition spree killers. 
http://www.schoolshooters.info/PL/Original_Documents.html

All kinds of documents, but preference to writings and first hand stuff. "	t5_2s9td	True
1367038558.0	1d79ph	Is there any correlation between serial killers and self-injury?	einssein	20	8	5		t5_2s9td	True
1364221975.0	1az31h	Hunting for Long-Gone Serial Killers: Inside the Dead Man Walking Project	LapsedPacifist	12	3	0		t5_2s9td	False
1363655776.0	1akayb	Leonard Lake and Chares Ng; Abducted women and used them as sex slaves in what they called Operation Miranda, inspired by The Collector. They murdered the women afterwards as well as men and babies that were in their way.	blitzballer	12	2	1		t5_2s9td	False
1360334335.0	184ruz	Ex-police officer who shot 3 sent disturbing package to Anderson Cooper	Lupawolf	14	5	2		t5_2s9td	False
1360015944.0	17w4tb	Actual serial killer reviews 'The Following,' is not impressed	suture-self	14	4	8		t5_2s9td	False
1359783870.0	17qpba	Was browsing kijiji when I came across this gem. Is this John Wayne Gacy self portrait real and if so is there any history behind it?	Rigga_Mortizz	14	6	5		t5_2s9td	False
1347649172.0	zw1q2	Another killer caught... Although I think this one may make an insanity plea	Amzddd	13	5	3		t5_2s9td	False
1344886198.0	y5r9c	"So I'm related to a serial killer (distantly).
anyone have any interesting info about the guy?
-Speck"	littlespeck	13	1	8		t5_2s9td	True
1343944988.0	xl58i	"John Edward Robinson.... ""The Internet's First Serial Killer"" on YouTube"	forgottentea	12	2	0		t5_2s9td	False
1339472164.0	uxc5f	Just heard of this guy. Earle Nelson, His prodigious strength earned him the nickname Gorilla Killer.	StoicGunner	17	7	4		t5_2s9td	False
1336778969.0	tixtr	The difference between insanity and genius	nocturnaldeviant	15	5	2		t5_2s9td	False
1336692698.0	thaz4	Searching for the Ripper.	StoicGunner	10	0	8	"A few years ago I caught a very interesting show on cable tv. It was a brilliant detective who took about 6 suspects from the Jack the Ripper case and brought it down to one guy. He then by going through histories records followed this guys footsteps. And what he discovered was shocking. The man had come to America and in each state he stayed in there was a reported murder, Jack the Ripper style. News paper articles read ""The Ripper has come to America"".
This show pretty much solved the case of Jack the Ripper. And confirmed what I suspected. That Jack never stopped murdering, only switched his hunting grounds. The question is, I do not remember what show or channel this was. If any of you remember I'd be greatly indebted."	t5_2s9td	True
1333549630.0	rswkk	"Mother of ""Speed Freak Killers'"" victim speaks out"	bpcombs	10	0	0		t5_2s9td	False
1331151141.0	qm6l3	(formerly Colonel) Russel Williams on Killing Two Women	tricksterfox	11	1	0		t5_2s9td	False
1329757982.0	pxz09	Victim Studies 012: Beverly Allitt	bpcombs	11	0	0		t5_2s9td	False
1329484801.0	pttu2	North Georgia symposium to focus on criminal minds, serial killers and sexual predators - Dr. Godwin to present.	gmgodwin	12	2	0		t5_2s9td	False
1329153803.0	pno75	Man recalls encounter with serial killer's accomplice (Dean Corll/Elmer Wayne Henley)	Zombie_Apocolypse	10	0	1		t5_2s9td	False
1326733584.0	ojgi8	Mathematicians Reveal Serial Killer's Pattern of Murder	bpcombs	13	1	0		t5_2s9td	False
1326424908.0	oexeh	"Just watched ""Henry: Portrait of a Serial Killer"" and was a little disappointed.."	Mandee430	12	2	14	"I've been reading around that [""Henry: Portrait of a Serial Killer""](http://en.wikipedia.org/wiki/Henry:_Portrait_of_a_Serial_Killer) is a good serial killer film loosely based on Henry Lee Lucas and Ottis Toole. I thought it was going to be a little more graphic and detailed about his killings but it was more about his lifestyle/personality and relationship with Becky. The movie painted him out to be a sympathetic character and I was hoping it would have been more historically accurate but they changed a lot of things for dramatic detail. Has anyone else seen it and if so, what is your opinion on it? Any suggestions for good movies based on real serial killers?"	t5_2s9td	True
1323059692.0	n0omo	Pathology of a serial killer: Why this day?	sucrerey	11	1	4		t5_2s9td	False
1320907892.0	m765x	Beautiful Farmland for Sale... With a Dark History - Is Ed Gein's land too controversial to sell?		14	5	8		t5_2s9td	False
1320679032.0	m3jxm	Did serial murderer Gacy kill Canadians?	bpcombs	11	0	1		t5_2s9td	False
1319817627.0	lsaur	7 Steps for Working a Female Serial Murder Case	bpcombs	10	0	1		t5_2s9td	False
1311809645.0	j1n34	Any recommendations for books on serial killers?(my recs are in the thread)	tiger_lily	11	0	20	"Hey guys.  I'm an avid reader and I was wondering if you guys have any books to recommend to me about serial killers. I can't get enough of this stuff(its morbid, I know,  but quite fascinating to me)

The last month I read:

The Riverman by Bob Keppel, which chronicles his interviews with Ted Bundy while they try to catch the Green River Killer.  It was okay, but the only thing that bugged me was that Bundy skirted around and bullshitted the whole time(suprise suprise) until the very end, where you get to read his confessions(which, are also on youtube.)

Defending Gary - Amazing book written by one of the defense attorneys for Gary Ridgway, I highly recommend it.

Chasing the Devil - Written by Sheriff Reichert, who was the head of the Green River Killer investigation.  Highly recommended.

And of course, I've read just about everything by John Douglas and Ann Rule's book on Bundy, ""Stranger Beside Me."" And of course, also, the Hannibal Lector series.  Give me some fresh meat!!!! :)"	t5_2s9td	True
1305683231.0	hdur1	"Donald Henry ""Peewee"" Gaskins, convicted of nine murders and confessed to more than 200, contract killed a death row inmate named Rudolph Tyner."	edify	12	1	0		t5_2s9td	False
1304618843.0	h4zgj	1981 slaying of a couple linked to Original Night Stalker - a serial rapist and killer who preceded Richard Ramirez, the Night Stalker	lextenou	11	0	0		t5_2s9td	False
1301521410.0	gf0wu	Favorite Films with Serial Killers	SpookySean	10	2	2		t5_2s9td	False
1295046442.0	f2ij1	List of Serial Killers by country	Skeetronic	10	0	2		t5_2s9td	False
1370475535.0	1fr7t6	Crime Scene/Autopsy photos from the Chi Omega murders on January 15 1978 (X-post from r/TedBundy) [warning - graphic]	misanthropicmarlowe	12	1	0		t5_2s9td	False
1369606724.0	1f3qgo	The Garden City Butcher	shugan	13	2	1		t5_2s9td	False
1367893636.0	1du4ys	I made an audio transcript of David Parker Ray's toybox tape he would play for his victims.	wtfunking	11	0	5	"Part 1: https://www.youtube.com/watch?v=gV8EPMeu1X8
Part 2: https://www.youtube.com/watch?v=nfzxQIhdcPA
Part 3: https://www.youtube.com/watch?v=pSSk17gCAbw


I could only find a text transcript of David Parker Ray's famous toybox tapes that he would play for his victims so I decided to take that opportunity to record and put them on youtube. It was not easy reading these parts straight through without making a mistake. The link to the text transcript can be found here if interested. 

http://thinkingaboutphilosophy.blogspot.com/2012/10/david-parker-rays-audio-tape-transcript.html#.UHKGIn5MmUo.tumblr

I know it isn't the greatest and the voice used isn't anything too special, but I really enjoyed making these videos and I couldn't find a single recording of it on youtube. It's rare you get to do something that hasn't already been done on youtube so I decided to make them before somebody else did, thx for the listen."	t5_2s9td	True
1360042764.0	17x2ro	John Wayne Gacy may have used more than one burial site; Excavation request granted on Jan 11, 2013	RahRahWakeForest	10	2	0		t5_2s9td	False
1349007848.0	10pi3g	Murder in Niagara Falls not the work of a Serial Killer	killercentral	9	0	0		t5_2s9td	False
1342458750.0	wnh8k	On this day in 2002, the body of Pam Kinamore, Baton Rouge serial killer victim, was found in a marsh. 	stacyhatesmacys	13	5	0		t5_2s9td	False
1341543274.0	w3zby	Robert John Maudsley 	paranoidlost	10	2	3		t5_2s9td	False
1340348543.0	vfcr0	The River Man’s Closest Victim (Part 1)	ChroniclesCriminal	9	0	0		t5_2s9td	False
1333838458.0	ryg6r	Trying to find a monster.	Slowtwitch	9	0	9	 I saw a  video where the court allowed a serial killer of children to answer the victims families and possibly give closure.  Probably to the opposite effect, the video has him describing the final minutes of their child's life and it even seems like it is giving him some kind of thrill being able to describe it.  One of the more chilling vids I have seen. Our argument is it was Dennis Radar vs someone completely different. Does anyone here recall this video?	t5_2s9td	True
1332519604.0	ra4n9	Was Mohammed Merah a Serial Killer?	bpcombs	11	1	2		t5_2s9td	False
1327440431.0	ov0cy	Former VPD detective Kim Rossmo testifies about 'classic mistakes' in serial killer probes	bpcombs	12	3	1		t5_2s9td	False
1322453505.0	mrlcr	"My favorite serial killer - Donald ""Pee Wee"" Gaskins"	Dead_Motherfucker	14	5	2		t5_2s9td	False
1319643249.0	lps2p	John Wayne Gacy: Man thought to have been murdered by 'Killer Clown' found ALIVE in Florida  | Mail Online	b0mbduckie	10	1	0		t5_2s9td	False
1319100659.0	lij1c	Whole bunch of podcast about Serial Killers.  Seems like the right place for these.	Stucifer2	9	0	0		t5_2s9td	False
1316717003.0	ko6dl	Looking for a book on John Wayne Gacy, any recommendations?	WreckSpecks	10	0	6		t5_2s9td	True
1305086536.0	h8ocq	The Serial Killers Podcast	bpcombs	11	2	0		t5_2s9td	False
1371242041.0	1gd0i8	A play-by-play of Karla Homolka's life, including details of her assistance with Paul Bernardo and the murders.	eiennodorei	19	10	0		t5_2s9td	False
1364237897.0	1azmk5	'A Serial Killer Calls' First 48 episode chronicling the capture of Terry Blair, the Prospect Avenue killer.		10	1	3		t5_2s9td	False
1359131640.0	179f8j	Rodney Alcala's first known murder victim	uncle-woody	8	0	3		t5_2s9td	False
1358669660.0	16x7bu	The Cleveland Torso Killer.  Personally, my bet's on Dr. Sweeney.		13	3	4		t5_2s9td	False
1354251791.0	141dhu	Need a few books! No idea what to get...	freaksavior	9	2	18	"My sister in law is obsessed with serial killers. 
To my knowledge, she doesn't actually have any books on them, sure, I can go to amazon and search for serial killer books but I wanted to know what the followers of /r/serialkillers like?
She's been watching Dexter, American Horror Story, loves horror movies, and is now watching Six feet under which is based all around death as most of you will know, Im sure there are a lot more she has seen but those should give you an idea of what her taste it.
Any Suggestions for me guys?"	t5_2s9td	True
1351443119.0	1283ar	Unabomber and the Zodiac		13	5	8		t5_2s9td	False
1350883427.0	11vsfd	The Torso Killer	MFSleep	9	0	4		t5_2s9td	False
1348898876.0	10npkr	Ted Bundy interview hours before he was executed	jokergirl32	8	1	4		t5_2s9td	False
1345580674.0	ylk02	Hometown murderer, Hugo Selenski makes it in Wikipedia page - Prison Escapes (2000-Present)	mrsmarvtracey	10	1	3		t5_2s9td	False
1345491561.0	yjeu5	Little House on the Prairie, serial killers, and the nature of memoir	Morrigane	11	2	1		t5_2s9td	False
1341095680.0	vux2c	"(pending) ""the"" most prolific serial killer ever? "	GloomySundae	16	7	12	"The investigation has just started, but ""Brother Andreas"" is said to have killed 37 severely handicapped children between 1952 and 1954 at a home for the disabled in the Netherlands. This news comes right after the whole sexual scandal with the catholic church in Holland.

Incredible. "	t5_2s9td	True
1340523703.0	vinpi	South Los Angeles (minimum requirement) serial killer Michael Hughes sentenced to death.	stacyhatesmacys	9	1	0		t5_2s9td	False
1335905080.0	t22lk	Albert Fish's letter to Delia Budd. The guy who made the movie got the name wrong (Grace was the victim), but the letter is still awful. 	IntrinsicSurgeon	14	7	1		t5_2s9td	False
1332776113.0	reax3	Robert Pickton: Prison Officials Keeping Media Away, Pickton Tells Canadian Press To Pose As Lawyer	bpcombs	9	0	0		t5_2s9td	False
1332436324.0	r8lk9	Manorville Bodies: New Details on Two Bodies Found in Pine Barrens | Long Island Press		10	2	1		t5_2s9td	False
1331833030.0	qy1m5	Report: Itzcoatl Ocampa Joined Marines Because He Needed to Kill	bpcombs	10	2	2		t5_2s9td	False
1330948724.0	qigw4	Article on Ted Bundy		13	6	3		t5_2s9td	False
1329329084.0	pqz15	Accused spree killer demands 'Cocoa Puffs'	bpcombs	10	3	2		t5_2s9td	False
1325002985.0	nsdj3	Victim Studies 007: John Wayne Gacy	bpcombs	11	4	0		t5_2s9td	False
1324574967.0	nmt48	Trying to catch a killer when there's no clear cause of death	bpcombs	9	1	0		t5_2s9td	False
1322755896.0	mw8ic	Calif. AG urges court to send Rodney Alcala to NYC to face new murder charges	bpcombs	9	2	0		t5_2s9td	False
1321459759.0	mehkr	Mystery still surrounds 100-year-old LaPorte serial killer story	bpcombs	10	2	3		t5_2s9td	False
1321296618.0	mc14u	Murderabilia: The Macabre Online Market for Serial Killer Artifacts	bpcombs	10	3	2		t5_2s9td	False
1319918677.0	ltgm3	Manson Direct-Charles Manson current interviews &amp; related news	Shut_Up_Asshole	14	4	3		t5_2s9td	False
1319056292.0	lhviu	John Wayne Gacy, Runaways, and the Decline of the Serial Killer	bpcombs	9	0	0		t5_2s9td	False
1316791840.0	kp4mk	Are there any decent books, movies, etc. based on Edmund Kemper?	awfulcanawful	10	1	4	The man is almost 7ft tall, has an IQ of 136, and did some really nasty stuff but I can't seem to find anything about him worth reading or watching (apart from the actual interviews on YouTube).	t5_2s9td	True
1310221563.0	ikwm4	Is a Serial Killer Hunting Motorists in Northern Nevada?	bpcombs	8	1	1		t5_2s9td	False
1302734912.0	gpfs7	Alliterative killer charged in Marin County - four confirmed victims, total unknown	lextenou	8	0	3		t5_2s9td	False
1296251917.0	fazp2	Well hello everyone, I'm your friendly moderator/creator, rynbadass!		9	1	8	"Hey guys,

I just wanted to submit a little something telling everyone thank you for joining, and for the huge interest in this lil community! I have been extremely interested in this whole taboo subject for quite sometime, when I realized that there wasn't already a subreddit, I knew I had to create one.

I've gotten several messages from people about moderating as well and I am definitely going to be getting back to you guys soon. So sorry I haven't done it yet, I've just been insanely busy. But I've been loving everyone's submissions and I can't wait to read more! This is my first time moderating, so please feel free to leave tips and suggestions. If you have any questions for me, anything SK related to anything about the subreddit, please feel free to ask away in here and I'll get back you :)

Happy reading,
rynbadass"	t5_2s9td	True
1294953407.0	f1srf	Night Stalkers - Japan.  Including Issei Sagawa.		10	1	0		t5_2s9td	False
1294952002.0	f1sar	Another great source for info... This site used to even have addressess so you could write letters to those still alive in prison.		9	1	1		t5_2s9td	False
1375236357.0	1je5wp	Thinking of writing someone...	Pope-ron-paul	15	8	16	"Writing a killer has been on my mind for a while, but I don't know who answers and what I would even write to get a response.  What do I do?  Is there a ""right"" way to do this kind of thing?"	t5_2s9td	True
1374543722.0	1iusre	The Gainesville Ripper	MFSleep	9	2	2		t5_2s9td	False
1374188541.0	1ile1a	X-post from r/news. Possible serial killer in northern California...I found this amusing, to say the least.	Bailliebugs	31	26	13		t5_2s9td	False
1373888061.0	1ic0u5	Serial Killer ➠ Arthur Shawcross Interview - YouTube	Cynical_Hermit	9	2	1		t5_2s9td	False
1370624468.0	1fveoe	Richard Ramirez aka The Night Stalker has died.	monsterchronicles	10	3	0		t5_2s9td	False
1370475782.0	1fr841	Joseph E. Duncan III (abductor of Shasta and Dylan Groene, killer of their parents, sister, and other children)'s blog, leading up to the Groene murders (ends 3 days before)	misanthropicmarlowe	12	4	1		t5_2s9td	False
1363651484.0	1ak5bn	Serial Killer Richard Cottingham's 1st Ever Interview +  Serial Killer Elmer Wayne Henley Interview	doorkeeper	8	1	0		t5_2s9td	False
1363227837.0	1a9cpm	Serial Killer Documentary - Richard Speck Biography	doorkeeper	7	0	3		t5_2s9td	False
1358655968.0	16wwzq	"John Hughes - ""A self confessed serial killer."" Does anyone else think he's putting on an act? "	cablereadytechnoslut	9	2	7		t5_2s9td	False
1358095954.0	16hw0j	A Cold Case of Cold-Blooded Murder - (about Rodney Alcala)	Marska	10	3	0		t5_2s9td	False
1357586179.0	164u9h	Rodney Alcala on The Dating Game. Sorry if it's been posted before.	sally_hardesty	13	7	1		t5_2s9td	False
