created_utc	id	title	author	ups	downs	num_comments	selftext	subreddit_id	is_self
1327896225.0	p2jt0	To the brave soul who held up the Reddit sign	gornky	18	3	1	I noticed and appreciated your valiant effort. I couldn't manage to get a good picture of your sign though, as I was 6 seats away from you. 	t5_2rau9	True
1327858180.0	p1u24	25 interesting Royal Rumble facts	shanthat	19	2	2		t5_2rau9	False
1376888857.0	1kne40	Evolution 2.0!	athnndnly	19	5	29	Since Triple H and Randy Orton turned heel tonight, I hope Batista returns to RAW tomorrow night and we get to see an Evolution reunion!	t5_2rau9	True
1375392427.0	1jit4p	Which one of you was this? (Read end of first paragraph.)	SaintPhoeniix	28	14	4		t5_2rau9	False
1375365479.0	1jhsfu	Orton's attacker identity revealed, was a fan trying to get noticed by WWE	dburk75	20	4	10		t5_2rau9	False
1374739238.0	1j0kvu	I have a question about smackdown.	hctazpalmer	19	4	11	I have tickets to a live event tonight, and I know that Smackdown events are usually taped on Tuesday nights, Will this be aired on live TV?	t5_2rau9	True
1371919149.0	1gv16f	John Cena in a Fruity Pebbles commercial?	aisf61	22	8	11		t5_2rau9	False
1371679726.0	1gop9e	Trying to defend wrestling to an outsider	TimeTravelVandal	27	12	6		t5_2rau9	False
1371559269.0	1gkx50	For those who missed Payback, here are some highlights I found on YouTube	4466	15	0	0		t5_2rau9	False
1370336238.0	1fn3uf	Fantasy Feud #1-Ryback	Blabe	20	5	6	"Ryback burst into the spot light early last year, appearing dominant after squashing low card employees and local wrestling talent. Soon, he was given a chance at the WWE title at Hell in a Cell, against CM Punk.

A rogue referee killed his chance, and isntantly all of his momentum hit the floor. Another loss at survivor series,from the shield TLC left him on the floor. Royal Rumble, picked off by Cena. Lost again from the Shield. Then, what surprised us all. His loss at Wrestlemania. His loss at extreme rules.

This did not bode well with Ryback. Poor booking has left him down again, even though he gets more and more title shots, do we really expect someone who has lost every match since Hell in a Cell to be a viable contender for the WWE Championship?

No, we don't, and he will probably lose again at Payback. But, if we could turn this around, who could of Ryback feuded with from the start, or at least after Payback?

.

.

.


4-Brock Lesnar

Ryback and Brock Lesnar are similar in size and strength, making a feud between the two very intriguing.

Although Lesnar and Goldberg didn’t have a great match or feud with one another, it had nothing to do with their size and strength.

Instead, it had to do with the fact that they knew it was their last match in WWE, giving them less motivation to put on a good show.

Ryback is an up-and-coming WWE Superstar who, although having a morbidly bad losing streak, may be a World Champion this year, or in 2014. Brock Lesnar needs to stop wrestling other part-time wrestlers and begin to challenge current top Superstars in WWE.

Ryback as World champion would be a great fit for Brock Lesnar in 2013. You can almost see it. Ryback wins the MITB. The years second biggest event, Summerslam, is when he cashes in. The current World Champion may be Dolph Ziggler, or even someone else, but it doesn't matter, because Lesnar is competing against them.

Ryback storms down the ramp, cashes it in and beats them to the floor, pinning them. Suddenly, Lesnar comes from behind, picks Ryback off his feet and delivers an F-5, setting them up for a feud and keeping Lesnar in the spot light until Wrestlemania 30, where some speculate he may face The Rock.

.

.

.

3-Sheamus

Another WWE Superstar with similar size and strength as Ryback is the former WWE and World Heavyweight champion, the Celtic Warrior, Sheamus.

Sheamus has been impressive in the past with the moves he has been able to pull off on someone like Big Show, making a feud with Ryback must-see.

Right now, Sheamus is lost without anything to do. He is currently in a feud, or was with The Shield. A feud with Ryback could once again bring him into the spot light.

Sheamus has had difficulty rising to be the next top babyface in WWE due to his corny jokes and becoming the next silly John Cena.

A feud with Ryback could help Sheamus become popular once again with WWE fans, especially if Ryback continues his heel run.

.

.

.

2-Daniel Bryan

Although not being the same size as Ryback, or having the same strength, Daniel Bryan may be WWE's most valuable, or most skilled asset at the moment. Rybacks match with Bryan was one of his best, and shows that Daniel Bryan can carry anyone though a match, and make it good.

Daniel Bryans speed could merge well with Rybacks strength. Even though it may not be a title feud, it could very well still be very entertaining. With Daniel Bryan as a face now, it could garner a lot of heat for Ryback as a heel.

While Ryback is still green, both on the mic and in the ring, feuding with Bryan could help him progress into a good superstar, and a title contender in the future.

.

.

.

1-Wade Barrett

Even though barrett is a good heel, he could also work as a face. Keeping him heel would require Ryback to change back to face.Barrett certainly would match up with Ryback for an extended feud. His character revolves around being master of the underground fighting world. Ryback destroys everything WWE puts in the ring with him. Together, it would make for a very beneficial feud.

For Ryback, it could allow him flexibility to expand his character. But in the end, it represents an opportunity for him to move up the ranks while confronting his former leader of Nexus. (A great callback to Ryback's previous incarnation as Barrett's lackey.)

For Barrett, feuding with one of the WWE's up and coming monsters is an opportunity to demonstrate his position of becoming one of next big stars. There's no doubt he'll be in a title picture soon. But to have the pathway paved to a World title with a victory over Ryback under his belt would further boost his stock.

Yes, ultimately, Barrett should be the one to defeat Ryback.

It wouldn't hurt Ryback's character to do the job. Doing so would only show how well he can lose. After all, wrestling is one big hustle anyway. The best hustlers are the ones who can lose as a true professional.

This could be a very interesting feud, especially if Ryback were to go for the Inter Title instead of the WWE title. The WWE should let him build up, not force him at us. As I said earlier, Barrett could benefit from a push more than Ryback, as he is arguably the most talented of the two.


Thank you for reading this if you did. I was just bored and decided to write this down. If you have any ideas for who I should do next time, please say.

By the way, the ""."" is to separate each one to make it easier to read."	t5_2rau9	True
1369062998.0	1ep4di	I laughed for a good 15 minutes when I saw this	papaJAWN	19	5	0		t5_2rau9	False
1367741970.0	1dq2le	As a comic book, and Wrestling fan....i want a full version of this as a poster	TheCrimsonNutcase	16	0	1		t5_2rau9	False
1366791219.0	1czygi	"Ryback: the true leader behind... Team Rocket? ""Feed me Meowth!"""	Jimbabwe88	23	8	0		t5_2rau9	False
1365515713.0	1bzlvj	Thank you Jersey fans!	RadikalRalph	17	2	3	Thanks to you I have the fandango theme stuck in my damn head. Last night was hilarious.	t5_2rau9	True
1364156818.0	1axite	Freaking awesome fanmade HHH vs. Brock Lesnar promo!		20	5	4		t5_2rau9	False
1363833318.0	1api4o	WWE March Madness Bracket?? (This is long)	sonnylarson	19	3	4	"So with March Madness going on I was wondering if the WWE Reddit would be interested in putting together a bracket of 68 WWE Superstars (Past and present) and voting on who the best all time is. The way I'm thinking of it is to be spilt up into 4 Regions, Pre Attitude Era, Attitude Era, Post Attitude Era (aggression era) and The PG Era. Also if a superstar has wrestled consistently in more then one Era they can be seeded in another Era but only one entry per superstar. Example: Let's take Undertaker He has been around forever so he can be placed anywhere in my mind he should be a 1 seed, But Stone Cold Steve Austin would be my Attitude Era 1 seed so what do I do with Undertaker? I make him the Post Attitude 1 seed. Also superstar feeling blind seeding. Example I know you hate John Cena but besides C.M. Punk ho has done more in the PG Era? Not many so Cena although we hate him could?should be a 1 seed in the Era. Also if we as a whole hate the PG Era instead we can have a miscellaneous Region that has Mangers and other personality's from the WWE In general. If not then we can sprinkle them in in their respected Eras. 
So what do you all think about this? Are you interested? Let me know "	t5_2rau9	True
1362799569.0	19ybuc	Just a heads up - there is a charity auction being held for Paul Bearer's funeral expenses / family members.  (Grandchildren).  Found it on eBay.	darknemus	18	2	4		t5_2rau9	False
1360636987.0	18com0	So what was with that really racist monologue by Jack Swagger's manager Zebb Coulter?	CognitivelyDecent	23	8	28	"Big Jack Swagger fan here. Zebb Coulter seemed a little racist there durng the monologue. ""I see people with faces that don't look like mine."" ""This is a land to protect and defend. Home of the free and land of the Brave, not the land of the free and the home to who ever wants to cross our borders!!"""	t5_2rau9	True
1360014323.0	17w2ju	Official Monday Night Raw Discussion Thread: 02-04-2013	WWE_Mod	18	3	44	"###Monday Night Raw Discussion Thread

February 04, 2013

Live from the Philips Arena

Atlanta, Georgia

***
**Who is in Brock Lesnar's sights?**

After Brock Lesnar defeated Triple H at SummerSlam, he said in a Tout that he accomplished everything he set out to do and he was never coming back to WWE. Why did Lesnar resurface in WWE last week? Is there something new he is hoping to accomplish in 2013? If he’s willing to attack The Chairman, is anyone safe? Lots of questions remain about what the former UFC Heavyweight Champion might do next.

**How will the Chairman Respond to Lesnar's attack?**

Certainly, Mr. McMahon is not one to simply forget what Brock did to him. It’s a safe bet that there will be repercussions after The Chairman recovers from his injury … or maybe even sooner. But since Lesnar is not currently a contracted WWE Superstar, Mr. McMahon can’t fire him. So how will The Chairman get retribution?

With a roster of Superstars at his command, could Mr. McMahon employ their services? Will action come as soon as Monday, or will the boss bide his time before he unleashes holy hell on Lesnar for what he did? Regardless of how big or bad Lesnar is, Mr. McMahon is certain to find a way to even the score.

**Is Heyman on borrowed time?**

After an incriminating video left Paul Heyman squirming about his ties to The Shield and Brad Maddox, Mr. McMahon appeared poised to fire him last week … until Lesnar came calling. Although Heyman appeared shocked at what Lesnar did to Mr. McMahon, he certainly didn’t do anything to stop things. Heyman, an admitted liar, may have found a way to hide his ties to The Shield and Maddox for months, but how could he possibly talk his way out of his latest predicament with The Boss? Perhaps his upcoming appearance on ""Miz TV"" will shed some light on recent events.

**What will the Shield do next?**

With Lesnar and Heyman on The Chairman’s least favorite list, The Shield can’t be far behind. At Royal Rumble, Mr. McMahon was very explicit about keeping The Shield away from the WWE Championship Match. If they interfered, Punk was to be stripped of his title. When the black-clad group seemingly jumped The Rock, Mr. McMahon was ready to take action … until Rock demanded the match not end that way. 

When The Shield first surfaced in WWE, they claimed to stand for justice. Now that the gig is up, what will they do next? 

**Will CM Punk stick with Heyman?**

Say what you want about CM Punk, his 434-day reign as WWE Champion is something very few Superstar have, or ever will, accomplish. Even WWE Champion The Rock gave The Second City Saint props for such a lengthy reign. But now that the cat is out of the bag so to speak about Heyman’s dealings with The Shield and Brad Maddox, will Punk stick with Heyman? If Punk wants to reclaim the WWE Title from The Rock at Elimination Chamber ), will he start to distance himself from Heyman … or completely cut off all ties? Punk’s next move ought to be interesting. 

Preview Courtesy of WWE.com's ""Raw Five-Point Preview""

http://www.wwe.com/shows/raw/2013-02-04/five-point-preview-26089093


"	t5_2rau9	True
1359686405.0	17o633	You had one job	matt_bison	32	17	2		t5_2rau9	False
1358556205.0	16um8c	So Sad...	BabosScribe	20	5	15	Was channel hopping. WWE Vintage Collection was on featuring the 2000 Royal Rumble. So sad that so many from that class of the WWE are dead today and one is reportedly doing porn (Chyna).  A lot has happened in the last 13 years. :(	t5_2rau9	True
1357790113.0	16alhy	Where can I get one of Y2J's amazing jackets?	Tenderoni	24	10	7		t5_2rau9	False
1357610792.0	165ob1	"Anybody else spot the ""No, grumpy cat"" Sign on Raw?"	MattyD95DXV2	22	7	11	"Anybody else spot the ""No, grumpy cat"" Sign on Raw? Front row centre, popped up in the D Bryan and Kane tag match with the Rhodes Scholars."	t5_2rau9	True
1357480268.0	1626fy	the first time DX had their entrance theme play.. and i was there live in 1997 the day after the montreal screwjob!!!	zeronormality	21	7	2		t5_2rau9	False
1357454491.0	161tmt	What my cousin got me for Christmas!	mrdancingalpaca	17	3	6		t5_2rau9	False
1353654040.0	13npe6	It's time we make this happen.	E_Wander	17	3	1		t5_2rau9	False
1353631159.0	13n7g6	How WWE could make The Miz a huge star.	BananaSheet	19	4	14	"As most of you probably know, The Miz has slowly, but surely, been turning face the last couple of weeks. In a lot of ways this all culminated when he joined Team Foley for Survivor Series, cementing his faceturn. I've always thought that Miz would make a great face. On the mic he's one of the very best in the company, in the ring he's also very good, especially lately as he has turned up his intensity, and he's got a lot of good looking, original moves.

The Miz really is the perfect underdog story. He started out as a reality TV contestant, eventually making his way to the WWE, where he was mocked and laughed at on a daily basis. But he didn't quit, he didn't let go of his dream. He kept on working his way up, constantly getting better and better, despite all his critics. Today he is a former WWE Champion, Intercontinental Champion, and one of the few Triple Crown winners in the company. If this isn't the perfect ""follow your dreams""-story I don't know what is. Needless to say, Miz has got everything he needs to make it as a top babyface, including mic and ringskills, catchphrases, charisma and backstory. The only thing he's really lacking right now is that big storyline that propels him into the top of the card, and the very top of the WWE as a whole. How do you do that? Well, here's how I would do it.

WWE TLC is coming up and The Big Show, the current World Heavyweight Champion, needs a challenger. The obvious choice of course is Sheamus, the former Champion, who lost to Big Show at Survivor Series in a controversial way. On an episode of Smackdown, Sheamus will come out and ask for a rematch, but before he can get an answer he is interrupted... By Wade Barrett. Barrett tells Sheamus that if anyone deserves a title shot it's him. This brings out another man, Randy Orton. Orton thinks that he's been out of the title picture for way too long, and that it now is his time to shine. Suddenly ""AWESOME!"" is heard throughout the arena and The Miz comes out. Miz says that out of all the guys in the ring, he's the hungriest and most deserving of a title shot. This brings out GM Booker T to make a match for the night's main event; A Fatal Fourway Number 1. Contenders match.

Miz wins this Fatal Fourway. He pins Wade Barrett after the Big Show had interfered and viciously attacked everyone but him. The following weeks Big Show will explain that the only reason he let Miz go was because he knew that out of those four men, he was easily the weak link. Big Show also says that at TLC he will have no problem beating The Miz, or anybody else for that matter, and that he simply picked the opponnent that required the less effort.

TLC comes around and Big Show defends his title against The Miz in a TLC match. The previous weeks more and more pressure has been building on The Miz. Will he be able to do the impossible, will he exceed the expectations and win his first World Heavyweight Championship? Everyone is wondering if Miz somehow can pull this off and become champion. Aaaand... He gets beaten to a pulp. The Big Show dominates the entire match, beating the living daylight out of him with tables, ladders and chairs, before easily climbing up the ladder and retaining his title. Miz will be so badly beaten that he will be out with injuries for the rest of the year.

Then, in January, The Royal Rumble comes along. The Road To Wrestlemania has begun! Sheamus, who was denied his rematch last month, is again back in the title picture and will try to win back the World Heavyweight Championship in a Last Man Standing match. After putting on an amazing fight though, he ends up not victorious. The Big Show is still champion.

Then the Royal Rumble match is up. This match will feature a lot of big names, more specifically people like The Rock and John Cena, who are the clear favorites to get the win. The match begins wrapping up, with only a couple of entrants left. Then, at the 29 mark, something unbelievable happens. A sudden voice yelling ""AWESOME!"" is heard throughout the arena and out comes Miz, looking to be back at 100%. Miz will then go on to eliminate the rest of the competitiors in the ring, before finally turning to the ramp for the final entrant. That entrant is Sheamus.

Sheamus, last years winner, and Miz will have a brutal back and forth bout, before Sheamus eventually gets Miz on the apron(similar to him and Jericho from last year). Sheamus will go for the Brogue Kick and Miz will duck in the last second, causing Sheamus to trip over the top rope and down to the floor. That is it, and The Miz has won the Royal Rumble. He will get a free Championship Match of his choosing at Wrestlemania, and Miz, without a doubt, chooses The World heavyweight Championship.

The weeks go by as The Big Show keeps embarassing The Miz. He shows footage from their match at TLC, he shows clips from Miz's reality TV past and his debut in the WWE, even going as far as telling Miz that he never should have even been in a wrestling ring, let alone in the biggest wrestling company in the world. Eventually Big Show will go on to Elimination Chamber, where he will defend his title against Randy Orton, Sheamus, Wade Barrett, Kofi Kingston and Dolph Ziggler. Big Show will win this match, truly proving his dominance and showing that he will never lose that championship. Then, when Big Show is about to go backstage, The Miz will come out on the ramp, with a microphone in his hands.

Miz, who has been unusually quiet since his return, cuts a long and detailed promo about how the only thing he ever wanted to do was be a professional wrestler. It's been his biggest dream since he was a little kid, and he has worked his ass off for years and years to get to where he is today. ""At Wrestlemania 29 it is you and me, big man!"" Miz will say, before announcing that nothing will stand in his way. He will become World Heavyweight Champion. He will fulfill his boyhood dream and there is nothing Big Show can do to stop it.

The following weeks leading up to Wrestlemania the rivalry between Miz and Show will continue to heat up, becoming increasingly hatefilled and dangerous by the day. When Wrestlemania finally comes around, these men will hate each other so badly that all they want to do at Wrestlemania is end the others career.

At Wrestlemania The Big Show and The Miz will have an amazing back-and-forth bout, lasting over 20 minutes and showing the absolute best out of both men. The finish will come after The Big Show sets Miz up for a huge top rope Chokeslam, which Miz counters. Miz will then grab Show's arms and put him in a Full Nelson, before performing a top rope Scull Crushing Finale on him and pinning him. The pin will be a successful one and Miz will be the new World Heavyweight Champion, after winning the biggest match of his life.

The Miz, with tears of joy running down his face, will celebrate with the fans and truly make the most out of this amazing moment. As he walks up the ramp he turns around to face the crowd, lifts the championship up in the air and gets an eroptous roar from the crowd. Right at this moment Dolph Ziggler suddenly appears from behind, hits Miz in the back of the head with the Money in The Bank briefcase, drags him to the ring and cashes in his contract.

Miz will eventually get to his feet and Dolph will hit him with the Zig Zag. 1, 2... Miz kicks out! Dolph looks absolutely shocked, before he puts Miz in the Sleeper Hold. After almost a minute in the hold, Miz will get to the ropes, forcing the break. Dolph will look absolutely infuriated, but as Miz struggles to get to his feet Dolph jumps up and delivers a second Zig Zag, finally earning him the pinfall.

This will spark the start of a new feud between The Miz and Dolph Ziggler, which could very well last for 3-6 months, perhaps culminating at Summerslam where Miz wins the title. This storyline will truly show Miz as a man who refuses to give up on his dreams, and keeps on coming back, even after suffering several serious injuries. It will lead to monster heat for both Big Show and Dolph Ziggler and the WWE will have created a new megastar in The Miz.

**What do you think, r/WWE? Do you think this would work? Do you agree/disagree? What would you do differently? Let me know!**"	t5_2rau9	True
1351819538.0	12hou0	My CM Punk Halloween Costume!	xDESTROx	36	19	8		t5_2rau9	False
1347835079.0	zzq33	Looks like CM Punk is kicking cancer's ass tonight.	Unprettier	25	12	1		t5_2rau9	False
1346171372.0	yyutl	Cast and pics from Chyna's adult WWE parody 	pizzlemynizzle	22	8	5		t5_2rau9	False
1345367073.0	ygtpd	WWE still doesn't know how to use apostrophes correctly 	The_Pale_Blue_Dot	19	5	1		t5_2rau9	False
1344979767.0	y846n	Vince McMahon Upset With Roddy Piper	jackwindham	21	7	11		t5_2rau9	False
1343020610.0	x0380	Is Raw 1,000 bigger than most PPV's?	guhreen	18	2	22	I'm getting a feeling its gonna be the biggest thing for WWE in a long time.  What are your takes?  You think this will be something big enough for a DVD release?  I had the pleasure to be in the crowd for 999, and will definitely tune in for this one.	t5_2rau9	True
1333304882.0	ro99g	Former UFC Champion Brock Lesnar Signs 1-Year Contract with WWE	JerryWWEFanatix	17	2	4		t5_2rau9	False
1333127918.0	rl5wc	Why CM Punk HAS to fight Stone Cold at WrestleMania 29	hoofbooster	15	0	0		t5_2rau9	False
1313971149.0	jq26c	Don't tell Finlay wrestling is fake!	Vecro	16	2	3		t5_2rau9	False
1375904118.0	1jwk8d	ASK HIM!!!	UrbanRaptor	15	3	1		t5_2rau9	False
1375067695.0	1j9561	E! Total Divas, looks like it might be a good show.	Thatguy1477	21	6	18	Just watched the first episode. I loved seeing the behind the scenes stuff for wwe. What are your thoughts?	t5_2rau9	True
1374735332.0	1j0i34	Elmo is a wrestler?	HAJ46	26	11	3		t5_2rau9	False
1373777005.0	1i9d7d	Jim Ross MMA Commentary (UFC Highlights)	ImmaRedditN00b	17	4	0		t5_2rau9	False
1370572389.0	1fu4vz	Latest on Scott Hall.	SaintPhoeniix	17	3	7	"Scott Hall is looking fantastic now, for anyone that cares about him.

http://www.youtube.com/watch?feature=player_embedded&amp;v=Mvob_xTMx3Q#!

DDP raised money for Scott to have a hip replacement, dental surgery and got him clean and healthy and turned his life around, for those that don't know what this is about."	t5_2rau9	True
1369703393.0	1f6646	Tonight on Raw 05/27/13	nando5209	17	5	0		t5_2rau9	False
1369633624.0	1f4gli	Dean Ambrose as a Jobber on WWE Velocity [MNM vs. Dean Taylor and Jon Moxley]	Consciouswrdsbt	16	1	4		t5_2rau9	False
1369004195.0	1enpoq	Official WWE Extreme Rules PPV Discussion Thread	WWE_Mod	17	3	91	"###WWE Extreme Rules 2013

May 19, 2013

Live Scottrade Center

St. Louis, MO

Begins 7:00 PM EDT

***

-- WWE champion John Cena vs. Ryback in a Last Man Standing match for the WWE Title.

-- Brock Lesnar vs. Triple H III in a steel cage match.

-- Alberto Del Rio vs. Jack Swagger in a #1 contender I Quit match.

-- Mark Henry vs. Sheamus in a strap match.

-- Big Show vs. Randy Orton in an Extreme Rules match.

-- Chris Jericho vs. Fandango.

-- WWE tag champions Kane &amp; Daniel Bryan vs. Shield's Roman Reigns &amp; Seth Rollins in a Texas Tornado tag match for the Tag Titles.

-- U.S. champion Kofi Kingston vs. Dean Ambrose for the U.S. Title.

-Pre-Show match: The Miz vs. Cody Rhodes. "	t5_2rau9	True
1367610302.0	1dmz57	Stephanie McMahon talks about Anal	CrypticCube	16	3	7		t5_2rau9	False
1367385991.0	1dgs5u	You know it's only fake right	mankool19	31	16	14		t5_2rau9	False
1365900444.0	1cata2	Faaan-Daaaan-Gooo's Theme Meets Space Jam	krak_is_bad	16	2	2		t5_2rau9	False
1365797228.0	1c87kz	Undertaker vs HBK WM 25. One of the greatest matches ever	gwords16	17	2	3		t5_2rau9	False
1365622802.0	1c30ms	If they had MITB in the attitude era, then which mid-card wrestler you think had the best chance to be a WWE/F champion?	Jkoby510	15	1	30	I would say Billy Gunn or Shamrock	t5_2rau9	True
