created_utc	id	title	author	ups	downs	num_comments	selftext	subreddit_id	is_self
1372707852.0	1hg2qy	R.I.P. Doink The CLown Matt Osbourne	LOUCIFER_315	44	9	3		t5_2rau9	False
1372596589.0	1hd242	Congratulations Natalya and Tyson Kidd	FloopDaWoop	44	6	5		t5_2rau9	False
1365380204.0	1bvuwh	I made this during the day while watching classic Randy Savage matches	Local_Shop	37	3	5		t5_2rau9	False
1365131172.0	1bpk86	Am I the only one that feels this way?	petenuts	54	16	7		t5_2rau9	False
1365096498.0	1bo872	If you happen to be a fan of pro wrestling and BioShock Infinite, you may get a chuckle from this (Slight Spoilers)	Darkmaster2110	45	11	6		t5_2rau9	False
1363208097.0	1a8nh1	Not on RAW and it didn't matter	goblue44	42	7	18		t5_2rau9	False
1361247003.0	18sqs6	FINALLY! A New WWE Championship Belt. First thoughts?	MattyD95DXV2	42	5	49		t5_2rau9	False
1361135501.0	18pk19	WWE works fast	SKCham	41	3	3		t5_2rau9	False
1356643305.0	15jcwj	Doodlin Sandow	WorkFriendlyAcct	46	7	1		t5_2rau9	False
1355981994.0	155jgz	Boy Gets Christmas Wish &amp; Meets WWE's Daniel Bryan	STUPID-GUY	42	6	8		t5_2rau9	False
1353098476.0	13bfd7	You Can't See Him...	TRace_ON	51	14	0		t5_2rau9	False
1340824146.0	vp6ox	Umad Triple H?	NokiaPhone	44	6	2		t5_2rau9	False
1333372150.0	rpg6s	This guy was the highlight of my Wrestlemania XXVIII	B_MCC	41	4	20		t5_2rau9	False
1374196169.0	1ilngk	Don't get super excited yet but you ~COULD~ see Steve Austin wrestle at Wrestlemania 30 against either Punk or Triple H.	SaintPhoeniix	39	2	16		t5_2rau9	False
1373890677.0	1ic2r1	Ultimate Warrior returns as the WWE 2K14 pre-order bonus (Official)	TheCrimsonNutcase	39	5	12		t5_2rau9	False
1369536167.0	1f29lb	Since we are on the subject of selling; this one pissed me off the most.	MojoJuJu_Universe	41	6	16		t5_2rau9	False
1368215585.0	1e36e8	AJ+Mortal Kombat=Sex Godess	Nelly_platinum	42	6	3		t5_2rau9	False
1366597184.0	1cu75c	Worst wwe storyline?	Nelly_platinum	41	6	39		t5_2rau9	False
1366376309.0	1coajf	What would you like to see in a wrestling game?	gfw_game	42	4	61	"Hay wrestling fans! If this is in the wrong place, please ignore it!

I'm an indie game developer and a friend of mine and myself decided that we miss the good old days of wrestling games that had more of an arcade feel. Games like WCW/NWO Revenge and WWF No Mercy both for the n64. I still think that these and the first couple of the PSX SmackDown games are the best wrestling games around.

So, we decided that we're going to try and emulate the N64 games, update them with more modern graphics, and add what we think was missing back in the day.

I've got my own personal preferences on what I think would add greatness to those games, but I wanted to get the feedback from what the wrestling community had to say.

What features, abilities, game modes would YOU like to see in a potential wrestling game? What stuff from the WCW/NWO and No Mercy games didn't you like which we should stay clear from?

Our initial plan is to build a decent demo, show what we're thinking, then run a kickstart campaign to get further funding for the finished thing. We're initially looking to build for PC, OS X and Linux (probably only Ubuntu at the moment)."	t5_2rau9	True
1363901591.0	1arbik	There's a '100 Greatest Moments in Raw History' thing on Netflix. Paused during The Pipebomb.	HeilYeah	50	14	15		t5_2rau9	False
1363598148.0	1aikxh	"Just thought I'd share this..
WWF Royal Rumble 1998 [FULL SHOW]"	Dranyos	40	5	8		t5_2rau9	False
1363130817.0	1a6hs5	Me n some buddys took a big head of our other buddy bob to see paul heyman	packerman09	47	11	2		t5_2rau9	False
1358238896.0	16lxtn	Cena Is Literally Unbearable	BenLaird	52	16	31	I don't want to come across as yet another Cena hater, but after watching tonight's Raw, I found myself increasingly frustrated at how Cena consistently gets the best of his opponents with no losses on his part. When Ziggler beats him, it's because Cena was betrayed. Now, Cena beats Dolph even with the help of another wrestler and a valet for the second week in a row! THIS MAKES DOLPH LOOK INCREDIBLY WEAK! If you can't beat Cena with the help of others, how are we expected to buy him as a credible champion? I just hate how strong Cena is booked to look at the expense of other talents. It is at this point, unbearable. 	t5_2rau9	True
1358214664.0	16l965	Wow. Best pic ever of Alicia Fox.	countz3r0	39	4	4		t5_2rau9	False
1356917195.0	15p7hr	Does anyone else see this coming?	scarecrow2407	43	7	28	"Antonio Cesaro has beaten all challengers for the United States title so far, and I think I know why. This is just conjecture, but I think that WWE may be settng the stage for Jack Swagger to make his triumphant return and beat Cesaro for the title. Cesaro has stated over and over that ""no American can beat him"", and every time he says it, I keep thinking of Swagger retorting ""Well, how about an All-American American?"", or something equally cheesy. Am I alone here? "	t5_2rau9	True
1356430438.0	15f031	Are You Embarrassed To Be A WWE Fan? 	BenLaird	48	9	160	"This is a question I have a very difficult time answering myself. On one hand, I watch WWE religiously. I am a super-fan in every definition of the term. However, when questioned about my fandom I often find myself quickly changing the subject and having to defend myself from the worlds ""less than enthusiastic"" view on Pro Wrestling. So I pose the question: Are you embarrassed to be a WWE Fan? And how do your friends react/ respond to your being a WWE fan?"	t5_2rau9	True
1342830986.0	wwhof	"I got bored at work yesterday, so I drew was hoping this drawing would get me a ""Cheap pop"""	Herr_Opa	44	7	3		t5_2rau9	False
1375927796.0	1jxff6	Why Cena is already the best heel the WWE has.	scarecrow2407	49	14	32	"It has been rattling around in my head for a while that, given WWE's vast resources, it has surely not escaped their attention that John Cena is not popular with the ""hardcore"" fan base.  They can't just have him turn heel like Randy Orton or CM Punk would, though, because the kiddies love him, and that's a big fucking deal.

So, instead, by keeping Cena EXACTLY the same, they've created a perfect character.  Think about it: A self-aware company man, adored by children and more superficial fans, and despised by the more cynical and ""old-school"" fans.  He is face and heel wrapped up in one shtick.  Just by playing the same character he has for 10 years, he generates more heat AND more pop than any other superstar.

By keeping Cena as he is, WWE gets to milk him as a face and gives stars like Daniel Bryan, who, even if they turn heel, will still be cheered and loved by a significant chunk of the audience, simply because they're not Cena.  So the tickets are sold to the shows through Cena, and the rest of us are kept happy by giving us matches involving CM Punk, Daniel Bryan, Kane, Jericho, and many others.  Besides, if Cena turns heel, who are we going to bitch about?

I may be wrong, but I think it's at least an interesting angle of thought to pursue.  Any thoughts?"	t5_2rau9	True
1375161993.0	1jbxjw	Athlete's Beard	burgov_VI	55	17	1		t5_2rau9	False
1371187660.0	1gbl5x	The Rock doesn't care for your trash talk	MLBBlueJaysfan	45	9	2		t5_2rau9	False
1369156716.0	1erwck	I can't wait for this guy to start cutting promos	king_noro	45	8	17		t5_2rau9	False
1367631237.0	1dnm7j	If R truth was a cat.		53	17	8		t5_2rau9	False
1367284386.0	1ddol0	Wil Wheaton's plushie doll looks like Wade Barrett, crooked nose and all.	psylocke_and_trunks	44	10	4		t5_2rau9	False
1365561455.0	1c1byp	Big E Langston receives custom My Little Pony	king_noro	43	8	8		t5_2rau9	False
1365386691.0	1bw2z7	Table is gone!	captain-_-hindsight	43	9	0		t5_2rau9	False
1365092369.0	1bo2k5	saw this plate today and almost wanted to take it (hashtag oldschool)	robromero1203	40	7	7		t5_2rau9	False
1363193773.0	1a82wt	Jim Ross Calls Jadaveon Clowney Hit on Michigan Running Back	robcan	44	8	6		t5_2rau9	False
1359150863.0	17a3il	My buddy is Macho Man Randy Savage	IVE_GOT_THRONES	45	12	5		t5_2rau9	False
1359032383.0	176qra	Great Royal Rumble infographic.	everyonesgayexceptme	42	5	1		t5_2rau9	False
1352225337.0	12qohe	The Best in the World should go for a 4 year championship term!	kujo-prime	50	16	0		t5_2rau9	False
1343096051.0	x1u7t	Bad Luck Daniel Bryan	CaptainSmallz	44	12	5		t5_2rau9	False
1376782280.0	1kkre4	Can't be the only one who's misses these brother.	Itachi96	55	19	8		t5_2rau9	False
1375471348.0	1jkze6	Communication During Matches	thamonsta	37	5	13		t5_2rau9	False
1374367337.0	1iq3pv	my friend made this joke today. we had no idea it existed.		44	10	4		t5_2rau9	False
1371397982.0	1ggiv3	I always thought this is an awesome 3D from Bubba Ray	beemer2011	40	6	10		t5_2rau9	False
1370537909.0	1fsu23	Pretty jealous my buddy got to meet one of the greats!	Papaspartan05	41	7	7		t5_2rau9	False
1368885007.0	1ekqtu	Anyone else?	Ectoplasmic	44	11	41	Anyone else REALLY pushing for Ryback to beat Cena just so Cena doesn't pull a superman and just win for no logical reason? 	t5_2rau9	True
1367157275.0	1d9s67	John Cena injured	raysfan85	35	1	26		t5_2rau9	False
1363793125.0	1ao0lo	Can anyone help my 86 y/o Nana meet John Cena on March 25 (Philly)?	osin144	45	13	2	"I'm taking my 86 year old Nana to Monday Night Raw this coming Monday, March 25. I've tried the ""contact a superstar"" option on their website, but to no avail. She's a huge fan of WWE and John Cena in particular, so if she got to meet him, I'm sure it would be one of the best things ever. [Here's a photo](http://imgur.com/YBr0nIO) of my Nana and I if that helps. Thanks Reddit!"	t5_2rau9	True
1354734951.0	14c516	He's a Paul Heyman guy!!	Robbo1971	59	25	3		t5_2rau9	False
1353424095.0	13ieov	Kayfabe Is Not Dead		38	4	14		t5_2rau9	False
1342912161.0	wxyiz	Triple H Wrestlemania 28 Scream [gif]	alvivar	41	5	3		t5_2rau9	False
1341942569.0	wc6f2	Guess what? Cougar butt!	Tomfoolery8888	38	6	4		t5_2rau9	False
1336092726.0	t61x4	Using Facebook to Commemorate the Big Show at Extreme Rules 2012	Thinksgeek	36	4	2		t5_2rau9	False
1332290126.0	r5yod	The Premiere of the Marine 3	KingHenrikLundqvist	38	7	7		t5_2rau9	False
1328655317.0	pfccj	CM Punk Gets Pissed Off At A Fan | Wrestler Junkie	amboutwe	37	4	6		t5_2rau9	False
1327529690.0	ownsp	I can't be the only one who sees the resemblance?	kimmydkill	37	4	4		t5_2rau9	False
1374054427.0	1ih64e	Randy Orton suffers injury at SmackDown taping just two days after winning MITB.	GryllslyBear	40	6	23		t5_2rau9	False
1368028178.0	1dxr6u	still the greatest booker t moment ever	Nelly_platinum	38	6	10		t5_2rau9	False
1367497306.0	1djopr	Happy Birthday to The Rock!		47	13	3		t5_2rau9	False
1366684262.0	1cwr38	WWE Awesome Sign! And Yes, yes I will!	wildmikefargo	40	4	3		t5_2rau9	False
1365793467.0	1c82ho	Patrick was at Wrestlemania	dandin2	38	5	0		t5_2rau9	False
1364311077.0	1b1mi4	(Former WWF Wrestler) X-Pac nearly dies after tearing his anus during wrestling match in Minneapolis [VIDEO]	ACE_C0ND0R	38	5	10		t5_2rau9	False
1360806548.0	18hhbo	PG Logic	Jordan-311	49	13	1		t5_2rau9	False
1360047732.0	17x6xm	I hear voices in my head and they are AWWESSSOOOOMMMMEEEE	TheAVGN	40	7	4		t5_2rau9	False
1346728306.0	zbeta	Kane and Daniel Bryan Hug It Out on Raw 9/3/12	bscott17	40	9	8		t5_2rau9	False
1324347301.0	nja90	Everyday tasks in graph form	ronald182	35	1	0		t5_2rau9	False
1375730628.0	1jrc5z	New Daniel Bryan shirt. (x-post r/sc)	robromero1203	45	11	6		t5_2rau9	False
1374273200.0	1inu7d	X-Post from pics. Steve Austin drinking beer in Iraq half dressed as Santa. (2003)	b3nj4m1n	38	6	5		t5_2rau9	False
1374270382.0	1inqto	I wonder what Brie thinks of this...	ToyfareMark	48	16	2		t5_2rau9	False
1374234823.0	1imjlc	When I saw you could get free Wolverine claws for your Xbox 360 avatar, I knew what I had to do.... Best avatar in the world!! (x-post from r/Wrasslin)	lk79	40	12	7		t5_2rau9	False
1373857217.0	1ibcqq	With every passing Money in the Bank, I just miss this superstar more and more	joshoutloud	41	13	5		t5_2rau9	False
1372439820.0	1h9c6q	CM Punk is the rumored front-runner to win the 2014 Royal Rumble. Yay or Nay?	theoisjonesing	37	6	28		t5_2rau9	False
1369281328.0	1evt66	Dear Vince McMahon, This. From, Vince McMahon	justintensity	36	2	9		t5_2rau9	False
1366864184.0	1d2ad6	CM PUNK and the invisible mic	Nelly_platinum	36	8	4		t5_2rau9	False
1366107127.0	1cgbsu	Fans rescue wrestler Scott Hall from razor's edge	samofny	33	1	5		t5_2rau9	False
1365362382.0	1bv8r5	Official WrestleMania XXIX Discussion Thread (With Real-Time Updates!)	WWE_Mod	37	2	251	"###WrestleMania XXIX Discussion Thread

Watch this thread for Real-Time match Results and Updates!

April 7, 2013

Live from Metlife Stadium

East Rutherford, NJ

Begins 7:00 PM EDT

***

**Live Play By Blay**
-Cena Pins Rock with the AA.  New WWE Champion.

-Rock Kicks out of Rock Bottom

-Cena Counters with A.A.

-Rock Attempts You cant see me.  

-Cena Kicks out of Rock Bottom

-ROck to Cheers

-Cena Enters to Heavy Boos

-Hall of Famers Re-introduced

-Triple H Pins Lesnar after pedigree on Steps

-Michaels Super Kicks Heyman

-Lesnar Throws Rung Steps into ring

-Lesnar F-5's Michaels

-Brock Lensar Entrance with Paul Heyman

-Shawn Michaels Entrance

-Undertaker Pins CM Punk after a TombStone.

-Punk Tries to Elbow drop Taker Through Announce Table .  Table doesnt give....

-Punk Performs Old School on Undertaker

-Undertaker Enters with what Appears to be a pack of Walkers trying to drag him back to Hell.

-Punk Enters with Heyman and the Urn.

-In Living Colour Live Performance

-Del Rio Retains by Submitting Swagger with the Cross Arm Breaker

-Swagger Zeb Video

-Diddy Performance.  Performs a medley of his songs. 

-Fandango Pins Jericho with a small package.

-Fandango comes out to a group of dancers.

-Daniel Bryan Pins Dolph Ziggler after a Kane Choke SLam and Flying Head Butt to Retain the Tag TItles.

-Ryback gives Shell Shock to Henry during post match beat down.  Seems to have legit hurt his arm.

-Henry beats Ryback via Pinfall

-Ryback tries to give Mark Henry Shell Shock but Henry Lands on Ryback.

-Mark Henry Vs Ryback

-Snooki Was shown

-The Shield Defeats Orton, SHeamus, and Big Show when Ambrose pinned Big Show

Pre Show

-The Miz Defeats Wade Barrett Via Submission to Capture the Intercontinental Championship



***
WrestleMania Card

**WWE Title Match**
John Cena vs. The Rock

**World Heavyweight Title Match**
Jack Swagger vs. Alberto Del Rio

**WWE Tag Team Title Match**
Dolph Ziggler and Big E Langston vs. Kane and Daniel Bryan

**No Holds Barred Match with Triple H’s Career On The Line**
Brock Lesnar vs. Triple H
Shawn Michaels will be in Triple H’s corner

CM Punk vs. The Undertaker

Sheamus, Big Show and Randy Orton vs. Seth Rollins, Dean Ambrose and Roman Reigns

Ryback vs. Mark Henry

Fandango vs. Chris Jericho

Brodus Clay, Tensai, Cameron and Naomi vs. Cody Rhodes, Damien Sandow and The Bella Twins

Pre-show:
**WWE Intercontinental Title Match**
The Miz vs. Wade Barrett
"	t5_2rau9	True
1363398114.0	1adxm0	What's your Wrestlemania dream match?	oldirtygecko	44	15	49		t5_2rau9	False
1362660545.0	19ubxj	Will Punk play the ultimate heel card?	rousseaux	44	10	38	...and disrespect Paul Bearer in the run-up to Wrestlemania?  Personally, I hope he does.  That'll really add some gravity to his match with Taker, which at the moment doesn't have much going for it.  It seems like the match was made to let Punk down from the top gently, but I really hope it's been made to blast Punk through the stratosphere, and is maybe Taker's way of handing the torch over.  And what better way to really make the match and the lead-up interesting than to have Punk disrespecting the dead?	t5_2rau9	True
1361666386.0	193vd3	Jack Swaggers WrestleMania XXX Match	ciano316	47	17	2		t5_2rau9	False
1360458094.0	1880ig	Awesome birthday part 1	Tomboy123	40	10	5		t5_2rau9	False
1359318759.0	17dv34	Decided to share WWE wrestlers I've met	MrRicker	36	3	4		t5_2rau9	False
1347639217.0	zvrta	Jerry Lawler Has Won Some Titles... 168 to be exact.	AlexFTLOW	32	0	3		t5_2rau9	False
1347457781.0	zrk1n	"Jerry ""the king"" Lawler Update"	mrbigron2u	37	1	16	"WWE Hall of Famer Jerry ""The King"" Lawler continues to recover in a hospital in Montreal, Canada, after suffering a heart attack during Monday's RAW broadcast.

Lawler's family members are with him, including son and former WWE performer Brian Christopher Lawler, who released a statement Tuesday evening concerning his father's condition. Though stable, the concern now is whether he suffered brain damage following the heart attack.

His message reads: “Ok, here’s the latest real update. Lauren and I are here at the hospital in Montreal. He does not look good at all. He is responsive to questions that he is asked which is very good. His sedation and breathing support are being lowered slowly right now. He was shocked a total of 7 times at the arena and underwent a balloon stint to open up a clogged artery when he arrived at hospital. Everyone out there needs to say a special prayer for his brain at this point, please. Tests on his brain will not be available until the morning. One of us two will keep all you guys informed as we know more.”

Stacy Carter, Lawler's former wife, remains optimistic on ""The King."" She tweeted late Tuesday night, ""Gonna try to get some sleep. Been a long 24 plus hours. I just know there will be some good news about @jerrylawler 's condition tomorrow!!!"" "	t5_2rau9	True
1333527074.0	rsly4	did a google search for mark henry and found this	apollo84	36	5	2		t5_2rau9	False
1328814173.0	pi4w7	Teddy Long sent me a valentine present	FredGuyVIII	35	5	2		t5_2rau9	False
1375145363.0	1jbe25	So I recently went to a Dodger game and...	nvlahakis	41	8	5	"was sitting in the right field pavilion. It was a pretty slow game so when the Dodgers got men on base, naturally the crowd got excited. Some fans in our section began chanting a ""YES!"" chant over and over and a big chunk got involved as well. After those chants subsided a ""Daniel Bryan"" chant was also attempted. It was just an awesome part of the game that I thought was hilarious!"	t5_2rau9	True
1374645160.0	1ixuhs	How Vince trolls for Wellness violations.	ToyfareMark	56	26	0		t5_2rau9	False
1374412354.0	1iqyke	Hit you with that drop kick!	KazamaSmokers	47	12	6		t5_2rau9	False
1373572456.0	1i3q74	Undertakers streak.	Itachi96	37	3	76	 As wwe fans, what are your guys opinions on the undertakers streak? Would you guys like to see his streak ended or would you guys prefer seeing the undertaker retire with his streak unbeaten? My personal opinion is that I would love to see the undertaker retire with his streak unbeaten, because that would be the most significant thing about him. He would be the only one in wwe history to have a streak like that. That could be the thing that most people would remember him by.	t5_2rau9	True
1372395231.0	1h8ash	WWE in the kitchen	wh4td0g	34	1	4	"Today at work, I got to meet Ted Dibiase Jr and Lillian Garcia who were attending an event in our vault. Much fun was had. I was so excited I couldn't keep a straight face, even for the 'oh so serious' fist clench shot. They were both great, 10/10, would meet again.

[proof is here!](http://imgur.com/a/mRtD9)"	t5_2rau9	True
1371495509.0	1gj6m8	WWE B-Day Game..thingy	UrbanRaptor	43	13	133		t5_2rau9	False
1370992917.0	1g5pb0	How much do WWE wrestlers get paid?	ghostmoon	32	1	25	Does anyone have any idea about this? Is it per appearance, a yearly salary, or what? Thanks.	t5_2rau9	True
1369417189.0	1eze01	My new Roman Reigns art.	i-drive	42	11	1		t5_2rau9	False
1365508654.0	1bzfr2	The best moment of Raw was Fandango correcting the announcer's pronounciation of his name after Jericho delivered a brutal beatdown.	GryllslyBear	35	8	1		t5_2rau9	False
1364743685.0	1bd05a	Cool CM Punk picture	CycloneTWF	42	12	0		t5_2rau9	False
1362057319.0	19e6tr	The Rock basically confirms what we all thought, he's going to job to Cena at Wrestlemania	deusflac	35	4	14		t5_2rau9	False
1361415334.0	18xhee	Two former WWE writers weigh in on how to handle Swagger arrest	form_wrestle_account	37	7	15	"Taken from Wade Keller and PWTorch:

http://pwtorch.com/artman2/publish/WWE_News_3/article_68806.shtml

By Wade Keller, PWTorch editor

Two former WWE writers have told PWTorch what they think Vince McMahon will do with Jack Swagger now that he's made headlines for a DUI and pot possession arrest.

Former WWE creative team member Court Bauer (@courtbauer) tells me this afternoon he wouldn't trust Jack Swagger again.

""Irresponsible and immature,"" he told me a few minutes ago. ""I wouldn't trust Swagger again, frankly. What a stupid, stupid move by Swagger. This is RVD allll over again. I remember that situation quite clear and what the options and sentiment were as a result. WWE has 3 options: 1- Stay the course; 2- Reboot + replace Swagger; 3- Abort angle.

""I'm curious to see which way they go. I think they can salvage this and find an even better talent to build this around. I've heard Vince LOVES the concept and has been more focussed on this than 80 percent of the WWE creative since it started. He's going to likely opt for option 1 or 2. I am DYING to see what goes down.""

Another ex-WWE writer who opted to remain anonymous chimed in via email with similar thoughts. He wrote:

""That's so unfortunate. It's a good thing Zeb Coulter was getting all the heat anyways. I don't know what they do. Either keep his spot if they don't like other options or somehow they get them to wrestle sooner and put someone else in the role at Mania. Orton? Henry? Regardless it's more fuel for anyone opposed to pushing him.""

Bauer concurs that having Swagger wrestle sooner than WrestleMania would be the way to get him the World Title shot he earned by winning the Elimination Chamber, but punish him by excluding him from the WrestleMania line-up.

I suggested perhaps Chris Hero get brought in to replace Swagger, since Hero is a veteran who has paid dues in developmental and the indies scene for years.

Bauer said: ""Hero is a good option. Bray Wyatt or Luke Harper might be more 'authentic.' Harper still isn't ready for the bright lights and Bray may not fit the criteria for the super push. Hero might be able to adjust and project that type of persona. The hillbilly beard certainly helps.

""If this was up to me, I'd hot shot the Del Rio-Swagger match and put it on Raw, and put Del Rio over strong. Swagger fades out of picture… Then Dutch calls for reinforcements and out comes one of the above and that guy does the BIG heat angle that sets this thing on fire. He demolishes Del Rio, Rodriguez… maybe send out Rey &amp; Sin Cara and more of the same. They cut a promo saying 'Wrestler X' is the man behind the movement and this was all a trap. They then finally take this from being a straight-laced political stance to a dialed up wrestling warped POV on an issue and make it something controversial (instead of just a relatively sterile political perspective).

""They go for the jugular and get some real (cheap) Tennessee heat on this bad boy and Del Rio suffers a big injury. The next week Del Rio demands a fight with the new guy and the new guy refuses unless he has it at WM - the #1 media market so he can spread his message and he wants the belt. Del Rio accepts and they build him as a fighting champion - even when severely injured going into WM. That sets up a plausible finish that keeps Del Rio on good footing despite losing at WM. You could still insert Swagger as a Mr. Hughes/Diesel heater where he doesn't have to talk and can get physical and yet be completely disposable down the road.""

The other ex-writer says: ""Developmental would be the way to go if it didn't involve a World Title or WrestleMania. No way Vince gives a fresh guy that spot. They may just go forward with it and deal with his consequences after Mania and have Zeb recruit someone else who can 'get the job done'.""

In our PWTorch website and app poll, with over 500 votes already in just a half hour, 43 percent voted for ""Stay the Course, but he's on probation."" The rest - 57 percent - want him to be demoted or fired, but are split on whether to do it right away or wait until after WrestleMania. Second place was ""Demote him or fire him post-WM29"" with 34 percent, followed by ""Fire him now"" in third place at 23 percent. "	t5_2rau9	True
1355719868.0	14z8bv	These boys have a bright future after stealing the show tonight!	MrSandman42	40	8	15		t5_2rau9	False
1349753483.0	116ey7	CM Punk Hits a Fan 10/8!	Kuznetzov	37	8	19		t5_2rau9	False
1345434129.0	yi7vn	Alberto Del Rio First World Problem	joecool5	38	6	2		t5_2rau9	False
1376410515.0	1ka9vf	Where did the Mid Card Go?	fn_hipster	35	4	19	It seems like week in, week out the mid card of the WWE is lacking. I think the mid tier titles need to be brought proper feuds and stories again... The US Champion rarely defends the title and when it does happen its a dark match... I haven't seen a US defense in 2 months... RVD and Ambrose will be a great match but the Summer Slam pre show really? Anxel's matches are boring and no real feuds just random matches... Why not change the low tier titles on TV? Why toss new stars directly into main-eventer fights (a la Bray and Kane) Does anyone else want to bring back the meaning of mid card?	t5_2rau9	True
