created_utc	id	title	author	ups	downs	num_comments	selftext	subreddit_id	is_self
1375284797.0	1jfcl5	Daniel Bryan upvote gif.	robromero1203	383	40	7		t5_2rau9	False
1366238628.0	1ckdpr	WrestleMania Photobomb by The Rock	ProfessorEl	350	36	14		t5_2rau9	False
1367726444.0	1dpsf7	Sometimes, history just repeats itself...	Herr_Opa	272	17	29		t5_2rau9	False
1370115992.0	1fh97m	Friend just took this pic with Daniel Bryan	NorthernWV	253	32	19		t5_2rau9	False
1374360144.0	1ipwmx	Found this deep in r/funny comments.	hctazpalmer	234	24	6		t5_2rau9	False
1368552238.0	1ebqdq	This sign on raw pretty much sums up the wwe in its current state.		242	33	32		t5_2rau9	False
1363652538.0	1ak6pl	Could it be possible? Good guy Vince McMahon???	tb25uga	247	39	6		t5_2rau9	False
1371578532.0	1gljv2	And the Oscar goes to...	OmarGzzRdz	216	27	11		t5_2rau9	False
1360021655.0	17wcgh	Whenever I'm harassed for watching wrestling..	TheGodfathersDealer	212	22	20		t5_2rau9	False
1365437943.0	1bxaw8	CM Punk and Undertaker stole the show last night. Ring psychology like his is a lost art.	SteveIslesTCL	220	32	28		t5_2rau9	False
1358115028.0	16ih0b	Look who I ran into at the airport at 4am	Calicagoan	202	19	25		t5_2rau9	False
1373981641.0	1ieu11	Every. Single. Time.	suckaduckunion	206	39	31		t5_2rau9	False
1373911932.0	1icrje	I was getting a new tire when I ran into this guy...DAMMMNNNN!!!	CDWolfe2108	192	24	14		t5_2rau9	False
1365977613.0	1ccm7u	How I did not notice this 10 years ago when it happened is beyond me. (NSFW)	robcan	193	29	16		t5_2rau9	False
1375814072.0	1jtt3d	The Raw announce team these days.	Patty-Jack	192	26	28		t5_2rau9	False
1372251332.0	1h3s1k	CM Punk, a true Chicago hero..	I_mean_am_i_right	189	30	8		t5_2rau9	False
1374549149.0	1iuzeu	Brie Bella's nipple on RAW. Beautiful..	UDontEvenKnowWhoIAm	204	51	34		t5_2rau9	False
1370518899.0	1fs9fa	My favorite wrestler as a child. Even more now because I can relate.	Dikkbao14	172	18	9		t5_2rau9	False
1360509845.0	188ym5	NEWEST MEMBER OF DX! 	WexTheCat	189	32	4		t5_2rau9	False
1359473421.0	17hyvy	One of the Most Beautiful and Talented Women to Ever Wrestle: A 2013 WWE Hall of Fame Inductee	form_wrestle_account	184	33	26		t5_2rau9	False
1370820545.0	1g0diq	Girlfriend Win	RaptorRZRKTD	167	16	7		t5_2rau9	False
1371683635.0	1gouek	So my friend works at an applestore in new york...guess who he ran into	Nelly_platinum	168	20	38		t5_2rau9	False
1368777096.0	1ei8u8	"So me and my friend dug out ""No Mercy"" for a few matches..."	Foxxxy24	158	7	17		t5_2rau9	False
1366185071.0	1ciro6	Every time anyone asks me why I still watch WWE	ksflow	200	56	35		t5_2rau9	False
1357619518.0	165yrx	Grumpy Cat sign on Raw.	MattyD95DXV2	167	22	12		t5_2rau9	False
1363784987.0	1ans6y	I love Vince but where's the creativity In this??	Dikkbao14	158	23	28		t5_2rau9	False
1346194046.0	yzk4k	Never forget late 90s Vince!	kespin	140	8	9		t5_2rau9	False
1374259869.0	1incz4	[X-Post from /r/gifs] What if wrestling ended like this?	nkrlive	151	22	7		t5_2rau9	False
1359946607.0	17ue26	Thank you Jericho for saving us from the SuperBowl	Slapnutjoey	154	21	2		t5_2rau9	False
1365033331.0	1bmib2	The People's Chump?	Erink2241	170	38	15		t5_2rau9	False
1360679020.0	18dlva	At work. Shit's about to go down..	negative_noise	147	14	8		t5_2rau9	False
1359388504.0	17flgh	Inside the mind of Vince McMahon 	tb25uga	148	18	7		t5_2rau9	False
1367596999.0	1dminj	When I was a little kid and I'd sneak out of bed to watch late night wrestling, hear mum coming down the hallway so I quickly turned the tv off and lay in the dark waiting until she went back to bed and hadn't seen me.	Spacehh	148	19	11		t5_2rau9	False
1361225918.0	18s05t	"In '99, I went to Times Square to meet Mick Foley at his first huge book signing...I was dressed up, but didnt have a camera back then.  Today my friend sent me this from still his ""Attitude Era"" dvd."	yourpalmatt	147	17	8		t5_2rau9	False
1366992504.0	1d5sof	The Rock is the only man to hold four versions of the WWE/F Championship.	macmannumberone	135	11	38		t5_2rau9	False
1372105908.0	1gzpd5	"Who wouldve thought a comicbook nerd like this would turn out to be ""The Best In The World"""	Nelly_platinum	141	16	14		t5_2rau9	False
1364137111.0	1awy5a	Noticed this on Andre the Giant's Wikipedia page...	delta5	141	16	10		t5_2rau9	False
1366684401.0	1cwr9y	Daniel Bryan contemplates tonight's loss against the Shield	tb25uga	155	37	26		t5_2rau9	False
1365385262.0	1bw196	Growing up the right way!	aaronrod13	137	18	10		t5_2rau9	False
1362598680.0	19sk8o	RIP Paul Bearer	Koey4Shoey	142	26	6		t5_2rau9	False
1365398147.0	1bwfuw	The best entrance of the night.	king_noro	125	11	13		t5_2rau9	False
1372476781.0	1hajdr	Did you hear the one about the man who can't be destroyed?	OtherOtie	133	19	14		t5_2rau9	False
1370891510.0	1g2ag2	My pick for Kaitlyn's secret admirer...	tb25uga	132	15	16		t5_2rau9	False
1363978318.0	1atcdk	First World Mark Problems	shushilly	128	12	25		t5_2rau9	False
1362406913.0	19mzrr	Bumped into this guy at the Arnold Classic. After I regained consciousness, we took a photo	robcan	120	5	12		t5_2rau9	False
1364749289.0	1bd5qx	When he throws you over his Shoulder	CycloneTWF	125	12	2		t5_2rau9	False
1347371194.0	zphmn	Who else thinks Michael Cole, the commentator we love to hate, showed some incredible courage in keeping his composure last night?	CaptainSmallz	125	11	25		t5_2rau9	False
1364272158.0	1b0v43	Bret Hart is not impressed with your Rock Bottom	TimeTravelVandal	120	7	12		t5_2rau9	False
1362690132.0	19v943	What Robert Trujillo does when he is not on tour	hashtagLJB	121	9	15		t5_2rau9	False
1371754648.0	1gqtfr	Lets just take a moment to realize where Chris Jericho is from... (@IAmJericho on Twitter)	ckleino39	118	9	4		t5_2rau9	False
1357756464.0	169f86	x post r/sc loved this and thought wwe should share in the greatness 	robromero1203	127	17	16		t5_2rau9	False
1372985777.0	1hnz26	'Murica...WWE style!	ElRobZilla	118	9	2		t5_2rau9	False
1369761778.0	1f7kdo	I was on RAW last night!!	KatieCat86	121	13	17		t5_2rau9	False
1374594352.0	1iw1jg	Clear close-up of Bella Twin Nip Slip [NSFW]	OFWGriff	153	48	16		t5_2rau9	False
1363742308.0	1amtq4	Today I had a substitute teacher who claimed he taught The Rock in seventh grade he showed me the yearbook picture.	SebastardMontoya	121	14	11		t5_2rau9	False
1364325786.0	1b25ml	If you get up in a legend's face...	Jayzero	120	15	9		t5_2rau9	False
1361344542.0	18vial	one of the best meme on PG Era of WWE	STUPID-GUY	126	18	4		t5_2rau9	False
1375661637.0	1jpjck	Because the world is begging for it.	ToyfareMark	126	19	3		t5_2rau9	False
1365873927.0	1c9zsx	My favorite entrance from Wrestlemania, these guys rocked!	Wheeto	119	10	8		t5_2rau9	False
1363457480.0	1af3ue	Today is...	weirdrabbit	123	15	5		t5_2rau9	False
1362185453.0	19hwkj	my exact reaction.	58dermo	111	6	33		t5_2rau9	False
1375445751.0	1jk5pv	Well that escalated quickly (The Rock)...	Tengushee	110	6	13		t5_2rau9	False
1365900398.0	1cat8f	I think i had good seats at Wrestlemania 29	Nelly_platinum	115	7	15		t5_2rau9	False
1355282569.0	14pe1y	I am the 1%	kujo-prime	117	14	8		t5_2rau9	False
1368488540.0	1ea20s	Why did I stop watching? Oh yeah...	djreynolds27	124	28	27		t5_2rau9	False
1363680724.0	1akzbn	What a nice guy	CrypticCube	112	13	5		t5_2rau9	False
1366315299.0	1cmlva	Jack swaggers WrestleMania 29 which was not televised	Nelly_platinum	105	7	20		t5_2rau9	False
1362544268.0	19r912	Paul Bearer passed away today...	skard4life	114	14	34		t5_2rau9	False
1368400118.0	1e7ke0	Saw an old Roseanne Halloween episode. Roseanne in drag = Zeb Colter.	MashedPotatoesDick	110	14	2		t5_2rau9	False
1361915566.0	19a937	I'm ashamed to admit it, I fell for it too...	tb25uga	109	8	19		t5_2rau9	False
1370806840.0	1fzwsg	How I would book Punk upon return.	OtherOtie	116	15	60	"Punk no-shows Payback, forcing Heyman to substitute Curtis Axel in against Jericho. The Chicago crowd is pissed, vying and chanting for CM Punk through the entire match. Axel pins Jericho after Heyman uses Punk's music again as a distraction. Crowd is PISSED. During Axel's celebration, Punk's music hits again. This time it's Punk. He hits the GTS on Axel and Heyman looks confused.

The next night on Raw, Punk expresses his dissatisfaction with Paul Heyman on the Highlight Reel. He says he had no right to speak for Punk these past few weeks, signing a contract with Jericho without even consulting him, and using his music for his own advantage. Heyman was never Punk's manager like Brock and now Curtis, he was his associate, and his friend. But he's disrespected their friendship by making this about himself. 

Heyman apologizes to Punk, saying he made a mistake and he was only acting in the best interest of the Best in the World. Punk reluctantly accepts Heyman's apology and they hug it out.

Over the next few weeks, Punk plays the heel, although not overtly doing anything to illicit a heel response. He continues to face babyfaces, teaming with Curtis Axel against Jericho and Triple H one night on Raw. Axel intentionally causes Punk to take the fall, and Heyman has to hold Punk back from hurting Axel.

Next week, Punk challenges Axel to a match. Heyman is in a frenzy, completely broken up by the tension within his stable. He begs Punk to call off the match, but Punk says this isn't about Heyman, it's about teaching Axel a lesson. Heyman assures Punk that he's making the wrong decision, but Punk won't have any of it. 

It's Punk vs. Axel in the main event of Raw. The match is back and forth, in Punk's favor. Heyman is at ringside, but isn't in anyone's corner, occasionally pleading with the two not to hurt each other and that they should be on the same page. Punk hits the GTS on Axel and goes for the cover, but Heyman breaks it up and causes a DQ for Punk. 

Punk and Heyman argue, and Punk gets on the microphone, cutting a brief promo about how he doesn't need Heyman anymore. Heyman still pleads with Punk, but he tells Heyman it's over, and his ""services"" are no longer required. Punk says he'll always be a Paul Heyman guy, but not like this.

Punk walks out on Heyman. It cuts to backstage, with Punk angrily leaving the building. Matt Striker tries to get an interview, but Punk blows him off. Suddenly, Axel hits him from behind. Paul Heyman is at his side: ""GET HIM AXEL! GET HIM!"" Axel completely incapacitates Punk, and the show fades to black with Axel and Heyman standing over him.

Next week, Heyman says that if CM Punk doesn't want to be a Paul Heyman guy anymore, then he will no longer receive any of the benefits of being a Paul Heyman guy. That means Punk is no longer off limits for his other clients, and Curtis Axel is going to show him how big a mistake Punk has truly made. At Money in the Bank, CM Punk will face Curtis Axel in a down and dirty street fight. 

It's Money in the Bank, the second to last match on the card. Punk and Axel have taken each other to the limit all over the arena. Finally, they return back to the ring, and Punk is about to put Axel to sleep in the middle of the mat. Heyman runs in and delivers a low blow to Punk, letting Axel go for the pin. Punk kicks out and knocks Axel out with a kick to the head. Punk runs after Heyman and catches him in the GTS, when suddenly...

[BROCK LESNAR! IT'S BROCK LESNAR!](http://youtu.be/YToXwtyqmjM)

Piss runs down Punk's leg. He drops Heyman from the GTS and arms himself with a kendo stick. Lesnar roars on the stage and marches down to the ring. Punk is swinging the stick, ""COME ON!"" Lesnar slides into the ring and Punk goes for the beatdown. Lesnar no-sells the shots, promptly catching Punk in a fireman's carry. F5!!! Heyman drags Axel's unconscious body over Punk's, and the ref pins... 1... 2... 3!

Curtis Axel has pinned CM Punk.

Heyman, Lesnar and Axel retreat down the ramp, CM Punk can barely get to his feet.

At Summerslam, it's CM Punk vs Brock Lesnar.

--- EDIT ---

[My buildup to Brock vs. Punk.](http://www.reddit.com/r/WWE/comments/1fzwsg/how_i_would_book_punk_upon_return/cafkici)"	t5_2rau9	True
1370277862.0	1fl8ie	Parenting. Are we doing it right?	Managoo	119	25	27		t5_2rau9	False
1369694875.0	1f5wq4	Wwe comes to Calgary even the little ones love it	sanfallan	111	14	2		t5_2rau9	False
1355967099.0	1554m6	Good lawd ( kaitlyn)	MoonMan420	118	19	13		t5_2rau9	False
1351449173.0	1289aj	"Dan ""Soupy"" Campell from The Wonder Years and his girlfriend as Team Hell No for Halloween. I think they nailed it pretty well."	lightsisqueen	111	12	7		t5_2rau9	False
1347501250.0	zst53	Passing the torch to the next generation. My 8 month old having a royal rumble with my 1990's hasbro wwf wwe figures and ring.	Customkitchenclix	102	7	14		t5_2rau9	False
1375889698.0	1jvzum	SmackDown might actually be creative for once!	BeNintendo	117	17	15		t5_2rau9	False
1373405860.0	1hyoe4	Found this pic from RAW (7/8)	hctazpalmer	107	9	11		t5_2rau9	False
1365585470.0	1c1xaa	If I was gonna get double teamed, this is how I'd want it to happen.	Robbo1971	111	13	9		t5_2rau9	False
1373946270.0	1ie1dw	My stream buffered during MITB but i thought you guys would enjoy this	baseballpro24704	109	12	8		t5_2rau9	False
1365375053.0	1bvokq	Patrick was surprised Miz beat Barrett	PoliticaLIncorrect	115	18	5		t5_2rau9	False
1361841959.0	1989qb	Only 13 Minutes in.	Curiouscrispy	104	10	23		t5_2rau9	False
1361247057.0	18squ9	This belt is still better then the new one.	jakelewis74	122	26	33		t5_2rau9	False
1375733061.0	1jrfp9	Met Fandango at hotel	aaronptrsn	110	15	24		t5_2rau9	False
1374936832.0	1j5u4w	Don't let go, Sandow	burgov_VI	113	18	0		t5_2rau9	False
1376556793.0	1keqb1	Darren Young comes out of the closet.	DeathMountainDew	112	18	34		t5_2rau9	False
1368398684.0	1e7iqg	Me at Axxess 2000 with the former Champ.	MashedPotatoesDick	104	12	22		t5_2rau9	False
1365526538.0	1bzzam	Script for the rock vs John Cena @ Wrestlemania 29	MattyMatt5481	109	17	18		t5_2rau9	False
1363281296.0	1aalu7	We're doing favorite finishing moves now?	falkerman	102	7	21		t5_2rau9	False
1366818391.0	1d0k77	I've never told anyone...	XK310	119	27	10		t5_2rau9	False
1365475385.0	1byq4n	Support Fandango	Ryndar_Locke	102	8	46	I feel that as fans of the WWE we owe it to the crowd at NJ/NY to continue what they started.  We must hum his entrance, cheer his name, and make him the next Stone Cold Steve Austin.	t5_2rau9	True
1362447033.0	19odn1	The Deadman Returns	Andydawson37	115	19	31		t5_2rau9	False
1359182999.0	17b0a9	Best wrestling game ever!!!!	jakelewis74	108	17	28		t5_2rau9	False
1375515744.0	1jm85o	Chris Jericho and Colin Mochrie: Canadian Dragons.	Baconstrips1	96	8	5		t5_2rau9	False
1373336617.0	1hwp9i	Did anyone else catch this?	bryanmeans	109	16	21		t5_2rau9	False
1365382397.0	1bvxnz	Classic Zeb Colter Face	DennyYaDeadHomie	98	8	8		t5_2rau9	False
1372183192.0	1h1uw8	I wonder why the camera panned out so quickly...Heh he he heh	SHARK_249	111	18	8		t5_2rau9	False
1367861394.0	1dsxlo	Present VS Future	Nelly_platinum	101	13	13		t5_2rau9	False
1367712103.0	1dpevr	Cult Of Personality	Nelly_platinum	109	19	12		t5_2rau9	False
1366257195.0	1cl28s	Reply to Rock Photobomb, the otherside	chegini	93	7	4		t5_2rau9	False
1371673983.0	1gogrz	The road to Wrestlemania	Nico17	98	12	4		t5_2rau9	False
1368311631.0	1e5hp8	I also faced off against stone cold a few years back	aglassofguiness	93	5	9		t5_2rau9	False
1362901381.0	1a0kgq	John Cena without Creative Control	CrypticCube	101	12	20		t5_2rau9	False
1359416237.0	17gkld	Everyone's favorite drinking buddy. 		95	8	16		t5_2rau9	False
1355737054.0	14zk1r	Aj Lee	MoonMan420	114	22	10		t5_2rau9	False
1343135110.0	x2k4b	Best Clothesline from Hell sell ever?	jtwellcle	97	10	20		t5_2rau9	False
1374266551.0	1inlvq	"""Husky Harris"" chants made me think about the original Nexus…"	thamonsta	99	12	41		t5_2rau9	False
1376881880.0	1kn6nj	[SPOILERS] The prophet /u/warriorman calls it.	Orzabal	109	21	18		t5_2rau9	False
1376153105.0	1k3g76	Vintage Orton	tverre01	108	21	8		t5_2rau9	False
1370454003.0	1fqfcl	Heads up: Mick Foley is doing an AMA on June 11th at 12pm EST!	aisf61	101	15	15	Link to the reddit AMA calendar: https://www.google.com/calendar/embed?src=amaverify%40gmail.com	t5_2rau9	True
1368109228.0	1e02rv	I got to meet Mick Foley in Coventry, UK. He agreed to this photo with such grace.	BeNintendo	94	8	9		t5_2rau9	False
1361269958.0	18t8va	The new WWE Title in HQ.	SegaSky	100	12	33		t5_2rau9	False
1359342252.0	17emo5	And this'll be the rest of my night... 	tb25uga	104	20	9		t5_2rau9	False
1376690474.0	1kik10	A diva we can all appreciate	jack-mayne96	101	18	10		t5_2rau9	False
1376096576.0	1k2al4	Sure would be cool to see this feud again.	godfather02	95	13	8		t5_2rau9	False
1373462908.0	1i07oy	Shamus tweeted this in remark to losing to Daniel Bryan	hctazpalmer	100	16	7		t5_2rau9	False
1366502041.0	1crrin	I've seen a lot of hate for wwe figure collectors on here. Here's a small part of my collection.	JermPFC2	92	6	17		t5_2rau9	False
1366122678.0	1cgndj	I know people will try to call me a fanboy, but the company is going to suck without punk. He got me back into wrestling in 2011 and he is the only reason I really tune in every week. Rest easy champ	tailsisdope	102	22	34		t5_2rau9	False
1365793526.0	1c82kf	Pic I took of Spenny meeting Ryback in Kingston Ontario. FEED ME MORE!	tazkoen	93	7	13		t5_2rau9	False
1361732209.0	1956al	From WrestleMania 28: Look at my username then look at the photo!	ciano316	116	33	23		t5_2rau9	False
1375564121.0	1jn8kb	Dolph's new friend	OmarGzzRdz	92	10	4		t5_2rau9	False
1370580219.0	1fudlq	seth rollins moonsault off fat guy	Nelly_platinum	94	9	10		t5_2rau9	False
1374819945.0	1j2zq6	"The greatest small package I've ever seen, by ""Mr. Small Package"" himself."	enigmaisdead	93	12	14		t5_2rau9	False
1367796642.0	1drbmu	Looking at Syrian Civil War pics when suddenly...	Inkstier	90	8	7		t5_2rau9	False
1367252588.0	1dcg06	As a lifelong wrestling fan, this is one of my favorite memories.	robbiegreen	93	12	2		t5_2rau9	False
1358035644.0	16gp09	Ladies and Gentlemen, Paul Heyman's loyalty and dedication to your reigning, defending, WWE Champion goes a long way...	Herr_Opa	104	19	7		t5_2rau9	False
1335441399.0	stfd4	Sheamus has truly battled adversity to be where he is.	xbyte	93	10	11		t5_2rau9	False
1367344038.0	1df9qm	Couldn't help but think this last night during RAW. I give you: Team Hell Gnome	Herr_Opa	98	18	1		t5_2rau9	False
1351698962.0	12ej32	25 longest WWE Title reigns of the last 25 years	form_wrestle_account	93	12	22		t5_2rau9	False
1369095724.0	1eqbqb	Heyyy	KidNamedIsmar	96	14	1		t5_2rau9	False
1375892680.0	1jw3s9	Am I the only one who was happy when this happened?	mrporkchop012	121	42	27		t5_2rau9	False
1371431510.0	1ghhx8	Rob Van Dam is coming back at Money In The Bank!	mxzh	90	10	25		t5_2rau9	False
1367197234.0	1db1o0	I knew I had seen Fandango somewhere before!	bigboltrules	105	27	4		t5_2rau9	False
1365626087.0	1c35ba	In just 2 days, this has happened.	gorillathunder	87	6	13		t5_2rau9	False
1346306245.0	z2cd1	Raw GM Logic	r0gueleader	91	14	15		t5_2rau9	False
1372695912.0	1hfm99	Canada day? Ziggler is not impresed	Nelly_platinum	91	15	4		t5_2rau9	False
1364331242.0	1b2cz3	It's surely been posted before. But by God it's worth it.	rousseaux	92	17	10		t5_2rau9	False
1359887748.0	17swe8	CM Punk meets a Cena fan. As well as he plays the heal, Punk is such a good sport	i_ate_stalin	93	15	10		t5_2rau9	False
1343085115.0	x1j9i	My friend and I made this sign for the 1000th episode of Monday Night Raw tonight. Keep an eye out for it. (x-post from r/pics)	UltimateTool	97	22	40		t5_2rau9	False
1373765863.0	1i915g	(NSFW) in response to someone asking about the kaitlyn nip slip a while ago not quite but figured you might like	xXFLAVORSXx	96	21	14		t5_2rau9	False
1344055888.0	xnq26	Me Sheamusta?	MrSandman42	84	9	3		t5_2rau9	False
1372811142.0	1hj8z7	"Happy Birthday Bret ""The Hitman"" Hart!"	vmartin96	98	20	5		t5_2rau9	False
1333421147.0	rql58	Well Vince sums it up	BMGabe	86	11	14		t5_2rau9	False
1367954072.0	1dvoi8	The group that has benefited the most from WWE lately.	jbroussard	92	17	7		t5_2rau9	False
1365723566.0	1c65cz	Made this Undertaker and CM Punk poster..	i-drive	84	10	5		t5_2rau9	False
1365472457.0	1bymaf	The brothers of destruction (minor RAW spoilers)	king_noro	78	4	16		t5_2rau9	False
1364628926.0	1bakd2	Goldust did it first..	maxbunag	90	19	1		t5_2rau9	False
1361890811.0	199elt	Well...I really hope my son grows up to like wrestling...	SJBradleyNY	80	8	21		t5_2rau9	False
1358221856.0	16lies	This guy has more cleavage than any diva.	keethantom	83	11	9		t5_2rau9	False
1354071737.0	13wv4z	Never gets old	dc8291	88	14	1		t5_2rau9	False
1369048363.0	1eorjb	Is that Fandango at the Billboard awards?	idlevoid	76	1	7		t5_2rau9	False
1366596533.0	1cu6ci	3-month rule'd	OtherOtie	82	10	15		t5_2rau9	False
1366060505.0	1ceyn1	WWE, you're an international company, with employees and fans from all four corners of the globe. So why am I greeted with this when I want to watch one of your Youtube clips?	jurwell	86	12	11		t5_2rau9	False
1362544765.0	19r9m0	An absolute legend just died.	gpearce4	83	9	2		t5_2rau9	False
1356122023.0	158ubf	Thought you guys might like/remember this	SuperDiglett	84	9	4		t5_2rau9	False
1369870676.0	1favy4	Old WWF programs and promo photos from the early 90's and some PPV ad's from the attitude era.	bowzerb	80	12	17		t5_2rau9	False
1345886269.0	ysto3	Sudden Clarity Booker T	octagonalquadraplex	87	16	9		t5_2rau9	False
1343649255.0	xdy2z	One of the many reasons why I love Dolph Ziggler. He came up with this spot himself and had to beg Tensai to do this.	jtwellcle	85	9	37		t5_2rau9	False
1343103993.0	x225x	Cm Punk Dark Knight	Hockeymask27	93	20	6		t5_2rau9	False
1376588687.0	1kfjll	Every true fan knows who the real first openly gay wrestler is.	itschrisinvegas	108	36	21		t5_2rau9	False
1365444680.0	1bxjtu	An open letter from a wrestling fan and father-to-be to WWE management.	UniverseofEnergy	84	13	5		t5_2rau9	False
1362085931.0	19f3jw	On my way to work when...	Foxxxy24	82	8	5		t5_2rau9	False
1368066811.0	1dz611	Ric Flair's face reaction when Batista denies the Smackdown contract.	TheBostonBattletoads	79	9	5		t5_2rau9	False
1358947907.0	174cpp	Just got this. My 12 year old self said HELL YEAH!	negative_noise	79	13	11		t5_2rau9	False
1347591804.0	zuwkb	Wrestler Triple-H sees down syndrome fan in the crowd, breaks character, and brings him into the ring (crosspost r/videos/)	i_ate_stalin	82	9	9		t5_2rau9	False
1373032003.0	1houtq	WWE 2K14 Never Say Die Edition	geekyvelma	75	10	8		t5_2rau9	False
1368273901.0	1e4i78	Look who I met today	aglassofguiness	84	17	9		t5_2rau9	False
1363038852.0	1a3v61	Best in Time and Space!	agtz87	83	14	9		t5_2rau9	False
1343255435.0	x5n4i	I was a huge fan of these guys when they were in ROH.  I never thought I'd actually see them in the mainevent at WWE doing a hot angle with The Rock.	form_wrestle_account	76	5	5		t5_2rau9	False
1374234343.0	1imj9s	For my Cake Day, I thought I would show you guys one of my favorite things...	Retayk	82	12	2		t5_2rau9	False
1367440605.0	1di6g2	Best SuperKick?	Nelly_platinum	76	8	15		t5_2rau9	False
1363310500.0	1abn0e	found these while going through some old boxes	Munster570	76	10	6		t5_2rau9	False
1331764054.0	qwuo2	Look who I found at my gym	MrFlobot	73	1	27		t5_2rau9	False
1375363685.0	1jhqcz	WWE 2k14 Phenom Edition. SOLD!	RaptorRZRKTD	78	10	12		t5_2rau9	False
1369327350.0	1ewu9v	Found my favorite thermos from when I was a kid. Unfortunately I could not find the Hulk Hogan lunch box it went with.	papaJAWN	72	5	6		t5_2rau9	False
1365681128.0	1c4ns8	Look what just arrived in the mail. Wish I got the second city saint shirt	tailsisdope	76	7	6		t5_2rau9	False
1372541011.0	1hbwbr	Fifteen years ago yesterday, the greatest match of the Attitude Era went down.	DastardlyMime	70	3	26		t5_2rau9	False
1360272295.0	183715	Ryder in A.J's box. 	JermPFC2	75	10	20		t5_2rau9	False
1351907864.0	12jo9w	The Miz and The Big Show got upvoted irl	zero_forever	72	5	4		t5_2rau9	False
1334033588.0	s23gw	Brock Lesnar Turns Super Saiyan At RAW	jonnybutler	79	12	9		t5_2rau9	False
1375772585.0	1jsqhu	CM Punk laying down some amazing grammar lessons using fan mail	Alchemist_92	76	8	6		t5_2rau9	False
1361763350.0	19668o	I made this cake . Figured r/wwe would enjoy it . 	KetrinaKetrina	73	6	8		t5_2rau9	False
1371659069.0	1gnw10	First class in college: Say Hello to the Bad Guy...	Perhaps_Perhaps	74	11	6		t5_2rau9	False
1376896414.0	1knk0i	(SPOILERS) Nice surprise WWE, I honestly didn't expect that.	hctazpalmer	88	24	30		t5_2rau9	False
1376037907.0	1k0kws	So this happened (X- post r/funny)	hctazpalmer	103	38	5		t5_2rau9	False
1370210592.0	1fjj7r	Going to raw hope the second city saint returns	race2816	71	9	20		t5_2rau9	False
1366529618.0	1csgcs	Some people liked my figure post here's some of my replica belts	JermPFC2	66	3	20		t5_2rau9	False
1363802352.0	1aocr5	WrestleMainia Then and Now	Mattyj24	70	9	2		t5_2rau9	False
1361527617.0	190j1d	I hope they'll bring back the spinner belt...	theanrkist	82	17	29	"broken into several pieces and held together with some duct tape to form a new Hardcore division! 




"	t5_2rau9	True
1369013265.0	1eo0dc	The Start of something? Spoiler	Andydawson37	80	16	52		t5_2rau9	False
1368202064.0	1e2pqx	Netflix knows perfection...kind of.	hu1kamaniac	68	8	5		t5_2rau9	False
1368029736.0	1dxt22	my zeb coulter bobble head	Sirsilentbob423	72	11	1		t5_2rau9	False
1367982506.0	1dwqnz	So this guy friended me on LinkedIn today...	maxbunag	71	8	2		t5_2rau9	False
1367181190.0	1dahzz	So I met WWE Hall of Famer Hacksaw Jim Duggan last night	em-dawg1	67	8	13		t5_2rau9	False
