created_utc	id	title	author	ups	downs	num_comments	selftext	subreddit_id	is_self
1374787984.0	1j1zzh	Possible SummerSlam Predictions for Kane	broph	27	5	14	"Kane has been off television for a few weeks now because of the vicious attack by The Wyatt Family. Many people are predicting that Kane will square off against Bray Wyatt at SummerSlam. This is indeed a safe bet to predict, but I expect their to be a twist. A match against these two should have a stipulation to add interest. If Bray Wyatt wins then Kane should be forced to ""follow the buzzards"". If this happens then this is when the twist will occur. The main event is the WWE Champion John Cena versus Daniel Bryan for the title. Predicting a winner is 50/50. If Bryan comes out on top expect Kane to then approach the ring. He will come dressed in different clothing and a cover for his face so no one can tell who it is. While Bryan is celebrating, the big red machine will attack his ""best friend"" resulting in a Randy Orton cash-in for the WWE Championship. After Kane reveals himself, he will no longer be wearing his mask. By ""following the buzzars"" Kane will become a heel in the WWE. This is a great idea because it spices up his character with a new gimmick. Since Kane is 46 years old and been in the buisness for 20+  years, the WWE Universe needs to witness something extreme and unpredictable. The prediction I just made may not even come close to happening, but I feel like it will be a hit and refresh the story line between Bryan, Kane, and Orton since they have teamed up multiple times this past year against The Shield. Expect a twist to occur during SummerSlam, but I think my prediction and theory would best be suited for each of the superstars involved. "	t5_2rau9	True
1374162968.0	1ikd6u	Punk vs Lesnar	CruxfieldVictor	34	11	17	I am getting some serious Wolverine vs Sabretooth vibes from this match-up and I adamantly believe that the WWE is secretly promoting the new Wolverine movie through the use of Punk's sideburns. (You can't convince me otherwise)	t5_2rau9	True
1373917250.0	1iczc5	"Deadspin claims ""A Redditor Has Been Leaking WWE Outcomes For Months"""	DeathMountainDew	32	7	4		t5_2rau9	False
1373253998.0	1huawb	A. Lil racist	chasetslice	46	24	3		t5_2rau9	False
1371516348.0	1gjymn	LET ME FINISH MARKING OUT	longislandicedz	28	4	18	RVD IS COMING BACK, AND THEN CHRISTIAN JUST CAME BACK, AND THEN MARK HENRY AND THE WYATT FAMILY ARE RETURN/DEBUTING. THIS IS THE BEST MONTH EVER	t5_2rau9	True
1370934538.0	1g3v7q	The TRUE 'Best in the World'?	king_noro	48	26	9		t5_2rau9	False
1370429609.0	1fppt4	Wade Barrett	chrismc4567	27	4	14	Is it me or has he lost most matches he's had since winning the title back from The Miz? He has a title but is not exactly being pushed.	t5_2rau9	True
1369791370.0	1f8nla	Bray Wyatt is coming to Raw	hashtagLJB	28	5	12		t5_2rau9	False
1366911366.0	1d3g0q	stuff it, heres the rest	diamondking13	28	4	2		t5_2rau9	False
1366576006.0	1cth32	My story with sheamus. Pics soon.	Mediumraah	24	3	5	Ok,so last week i find out Sheamus,a wrestler from WWE Is going to be in the UK and is at my local Tesco supermarket. So i decide to go there and join the queue to meet him and take a few pics with him. However when we got there the queue was huge,couldn't see him in the 2 hours he was there. So here's where the magic happens.I know the store layout and know which door he's coming out of to get to the floor.i stay there for about 20 minutes see his manager and out he comes take a few quick shots and follow him to the signing area. I'm behind his manager and the official WWE photographer. All of a sudden i though i may as well follow them into the signing area because it's huge and there's only the 2 of us and his manager.So im following them and the Tesco security and they just let me in. So for about an hour i was taking photos of the signing and it was an unforgetable experiance, Such a great feeling and i was buzzing for the rest of the day.	t5_2rau9	True
1366337705.0	1cnhge	John Cena Pre WWE at UPW training to be a WWE/F Superstar	CrypticCube	26	3	8		t5_2rau9	False
1365542485.0	1c0m9x	CM Punks entrance at Wrestlemania (xpost r/squaredcircle)	robromero1203	26	5	0		t5_2rau9	False
1365393870.0	1bwbjp	My first WrestleMania!!	fozzie_TLTG	26	3	10		t5_2rau9	False
1365314697.0	1bu9rg	disabled veteran who couldn't walk and was over weight, Runs and loses 140 pounds due to DDP yoga	themurphman	29	7	3		t5_2rau9	False
1365087181.0	1bnvzo	Funny comic strip predicts result of match between Rock and Cena	marleyfish	39	13	3		t5_2rau9	False
1361899313.0	199nzy	Even though I don't watch WWE much anymore, this torrent pack on the site I belong to really brought some memories back	brtdud7	28	5	16		t5_2rau9	False
1361687043.0	194eq9	TIL There once was an Undertaker Halloween maze at Universal Studios Hollywood	MillionDollarBuddy	27	4	1		t5_2rau9	False
1361478951.0	18z449	Who would you want to end Undertaker's streak?	Wallzo	28	4	91		t5_2rau9	True
1359326748.0	17e4k5	Official Royal Rumble 2013 Thread	form_wrestle_account	27	4	211	"WWE Royal Rumble 2013
Phoenix, AZ
7:30 EST

- WWE champion C.M. Punk vs. The Rock for the WWE Title. If The Shield interferes, Punk will be stripped of the WWE Title.

- World Hvt. champion Alberto Del Rio vs. Big Show for the World Title in a Last Man Standing match.

- WWE tag champions Daniel Bryan &amp; Kane vs. Rhodes Scholars for the Tag Titles.

- (YouTube Pre-Show): U.S. champion Antonio Cesaro vs. The Miz for the U.S. Title.

- 30-man Royal Rumble match. 18 of 30 slots are officially accounted for:

John Cena
Sheamus
Randy Orton
Ryback
The Miz
Daniel Bryan
Kane
Great Khali
Kofi Kingston
Titus O'Neil
Darren Young
Dolph Ziggler (#1 or #2)
U.S. champion Antonio Cesaro
IC champion Wade Barrett
3MB members Heath Slater, Jinder Mahal and Drew McIntyre
Bo Dallas (NXT tournament winner) "	t5_2rau9	True
1359182102.0	17azlr	I'm just not seeing why everyone says the WWE ratings are horrible. 		26	2	9		t5_2rau9	False
1355804312.0	1519io	Found This on Big E Langston's Wikipedia Page	bscott17	26	3	2		t5_2rau9	False
1351011985.0	11ydon	5 Reasons Why Wrestling Fans Need WWE 13	monalisaart	30	6	9		t5_2rau9	False
1349923919.0	11afqm	You've got to be kidding me. 	TevieTime	24	1	9		t5_2rau9	False
1347346392.0	zp51c	Audience footage of Jerry Lawler leaving arena after suffering a heart attack	weFightFoo	27	4	0		t5_2rau9	False
1344642394.0	y0v2x	Breaking News: AW Released By WWE; Speaks Out On Twitter	DSaga	29	5	14		t5_2rau9	False
1344023941.0	xmx69	Mark Henry Visiting the Summer Olympics	form_wrestle_account	27	2	2		t5_2rau9	False
1343713136.0	xfouk	I know I'm a week late, but does anyone think this  should've been the opening for RAW1000?	bigbund	35	12	14		t5_2rau9	False
1343626492.0	xdmsh	Did anyone else think this while watching Raw 1000?	StraightEdgeSavior	45	23	21		t5_2rau9	False
1342563486.0	wq53a	The Champ is Here.	robromero1203	39	15	7		t5_2rau9	False
1339472526.0	uxcg7	It's an old picture of CM Punk but the face was worth it [WARNING: SPOILER from RAW 6/11/2012]	Thinksgeek	29	5	6		t5_2rau9	False
1376814693.0	1kliof	was just watching Top 50 Finishers on netflix, and I was wondering...	scotsman81	24	2	6	if anyone else was annoyed that the same moves with different names were used?  like the Diamond Cutter and the R.K.O, for example (and, in my opinion, the Stunner is basically the same move again).  Just felt like they could have used a wider range of finishers, without resorting to this (although, fair play, there was a nice mix of old and new finishers)	t5_2rau9	True
1374089526.0	1ii8xu	Arrest Warrant Issued For “The Nature Boy” Ric Flair	SteakHead99	27	5	8		t5_2rau9	False
1371521654.0	1gk4ut	AND THE OSCAR GOES TO.....(SPOILERS)	Nelly_platinum	24	2	21	man that has got to be the best acting ive ever seen in wrestling,cannot wait to see what they do with henry	t5_2rau9	True
1369010700.0	1enxev	It just struck me when watching this: Dolph Ziggler is an amazing seller, but Orton sells Ziggler's superkick better than any of Ziggler's sells IMO.	Hadouken_98	25	4	5		t5_2rau9	False
1366870321.0	1d2gek	Team Ziggler	diamondking13	31	7	0		t5_2rau9	False
1365478857.0	1byukk	Especially for WWE, with the new chant, I took 5 minutes hoping WWEshop will make a better one with flashing lights Fandango version,	Zodiacd	25	3	0		t5_2rau9	False
1363375900.0	1ad8fp	Scott Hall rehabing with DDP and Jake the Snake. Needs support.	Sluggocide	27	3	5		t5_2rau9	False
1362464765.0	19ozfx	This is Why All The Face Vs Face Promos Are Gonna Suck Leading Up To Cena/Rock WrestleMania	bruiserbrody45	24	3	27	"Cena: Rock, you're so good, I couldn't beat you last year. My entire life revolves around beating you, because you are that much of a super hero. Seriously, you are perfect.

Rock: Cena, you're such a beast, you are so big and strong and great. You're better than everyone but me! 

And it just goes on and on until it becomes I'm gonna beat you! No, I'm gonna beat you!

There's just nothing left to say. Everything was said last year about The Rock never being around, that was something to roll with. But if they bring that up now when he's the champ, it makes everything look dumb. Unless something changes in this match, the promos are going to suck."	t5_2rau9	True
1362340559.0	19lasa	As a fan of wwe and a new dad...	Deanisamazing	24	2	19	"At what age did you introduce your son/daughter to wrestling if ever? I watch every wwe event to include Smackdown, Raw and PPV, and I'm just curious when you think I  should start having my son watch with me?

TL:DR What age did your child start watching wrestling?"	t5_2rau9	True
1362243163.0	19j0ni	Pretty much a foregone that Cena will win at WM 29 and WWE officials expecting him to be booed out of the arena	gwords16	22	0	10		t5_2rau9	False
1361489365.0	18zi18	My Biggest Issue of Being a Wrestling Fan	MajoraOfTime	28	4	63	"Ever since I started watching WWE again back in 2009, I've been a member of the ""IWC."" 
Obviously, it was pretty cool getting to talk online to people about wrestling, but slowly, it has gotten pretty annoying. 
The biggest issue I have with being a wrestling fan is just how hard it is to actually talk about the sport. I don't have many friends who actually like wrestling, so most of the time, I turn to the internet for my fix. However, it feels I can't even post an opinion without being attacked. My favorite wrestler is CM Punk. Has been since 2009. And yet any time I mention that, I hear:
1) About how skinny he is, despite the fact that he has martial arts training and is great at his craft.
2) How he is a ratings killer, despite the fact that his segments usually gain ratings.
3) How I'm just on his bandwagon because he breaks kayfabe. 
It isn't even just about Punk. If I say ""Swagger shouldn't be punished,"" I'm called an idiot. Say the Undertaker's streak should end? Guess I'm not a **true** wrestling fan. Not a fan of the Rock as WWE champ? Just an ignorant mark. 
I mean, why the hell are wrestling fans so damn opinionated to the point of mocking anyone who doesn't share their opinion?

Thoughts?"	t5_2rau9	True
1359091153.0	178o5j	"November 22, 1993 two episodes of Raw were recorded only one aired here is a ""lost"" episode of Raw. "		22	2	0		t5_2rau9	False
1358284021.0	16n25b	The Rock Eric Clapton Cover	robromero1203	38	15	12		t5_2rau9	False
1356044662.0	156ze4	How Dean Ambrose can say a lot with only 2 sentences...	BarelyReal	27	4	3		t5_2rau9	False
1355863939.0	152iy7	Now I can Live The Revolution (post from /r/SecretSanta)	zipKill_FRAG	27	6	4		t5_2rau9	False
1355724742.0	14zcpj	The Future		35	13	10		t5_2rau9	False
1350766654.0	11tao4	The top forgotten stars of ECW	dhalsim007	25	4	5		t5_2rau9	False
1347937963.0	1026mm	Back to into wrestling after a long break.  Couple of questions for you experts.	KidCasual	26	4	26	"Hi All,

I was big into WWF when I was a kid.  Hulk Hogan, Ultimate Warrior, Tatanka, Crush, Bret Hart, Shawn Micheals, the list could go on forever.  I took a break in my early teens but was pulled back in during the attitude era and I started watching some WcW as well.  Great characters and a lot of fun.

Now, I just recently came back and started watching at SummerSlam.  Things have changed significantly over the probably ten years I was not watching.  I have gone back and checked out some of the PPV's and raw/smackdowns through the past year, and although I am still enjoying the greatest spectacle on earth, I have a couple questions.

1. Why is Cena always referred to as the most ""polarizing superstar""? and has he actually won that many titles? I have done some reading on him out of the ring and he seems like a real stand up guy.  Why do people boo him and chant ""you can't wrestle"".

2. CM Punk is supposed to be a heel now right? but, him and some of the other ""heels"" still get positive crowd reactions.  This confuses me because I remember the heel being hated and booed, and the face getting the big pops and applause.

3. Why are there two heavy weight belts and which is the top belt? what CM Punk has?

4. What happened to the Tag division? Prime time players have a good character and Kane and Brian could be great, but the others really seem pretty lame.

5.  Are they trying to be more safe? seems like a lot of the finishers and big moves don't look as dangerous anymore.

6.  Is it worth it to check out the other wrestling companies? Are they all under the WWE banner now?

7.  Finally, If anyone would be so kind as to recommend the most ""much watch"" ppv event in the last couple of years, I would be grateful.

I realize that is a lot to answer, but I appreciate it! Thanks!

Edit: Thanks to everyone who took the time to answer my many questions.  I feel much more informed now.  I wasn't aware of a lot of what people mentioned, like the wellness policy.  I will begin my hunt for some older DVDs, starting with money in the bank 2011."	t5_2rau9	True
1346888406.0	zf55o	Triple H gets a haircut	MrFive7Two	32	10	11		t5_2rau9	False
1344371072.0	xuawi	Wrestling deaths documentary (min 8:10 vince puts reporter in check) lololol	robromero1203	26	2	8		t5_2rau9	False
1334759831.0	sg1n7	THIS SUBREDDIT SUCKS	fillari	34	14	20	as an avid fan, this sub reddit does nothing but disappointment!  we either need new/more mods to spruce this up.  I've seen the same stories for the past week.  I try to spice things up with my (#heel) submissions and stuff but this sub reddit is going no where!  any ideas? or should we just make a sub reddit for die hard wwe fans??	t5_2rau9	True
1333446820.0	rqzj1	Aj's version of Yes chant	sakata1	27	5	1		t5_2rau9	False
1331017943.0	qjvo0	Just a suggestion...	gmann1003	27	7	6		t5_2rau9	False
1327285993.0	os9td	WWE Reddit Attempt	zdigital13	31	8	3		t5_2rau9	False
1375761679.0	1jsgah	"""Paul, say something stupid."""	fu7ure	29	7	16	"Oh JESUS that was the hardest I've laughed in weeks watching this show.  Also, did anyone else feel like tonight was an absolutely amazing show?The storylines, the crowd, the matches, everything just seemed amazing tonight.  The crowd shit on Cena, Bryan played possum with The Boss, Punk got the upper hand on Lesnar, Rhodes Scholars drama just gets better and better and The Shield performing like they always do.The only shitty part IMO, aside from the usual waste of space Divas, was the Ryback retreat.  Im getting tired of that fucker tbh.  Fix his character or get rid of his ass."	t5_2rau9	True
1370791433.0	1fzfr8	Walking Into The Club Like...	Ducky3Moons	46	28	1		t5_2rau9	False
1370375339.0	1fo7gb	My Dream WWE Match	WippitGuud	30	9	25	"CM Punk vs Daniel Bryan - Iron Man match.

And when 1 hour is done, and the score is 0-0, they shake hands in the ring."	t5_2rau9	True
1369948693.0	1fd1xs	CM Punk return	goblue44	25	4	43	"With the supposed Punk return I had some ideas  on how it could go.

1. Doesn't show due to he does what he wants ie mad at Paul

2. Doesn't show makes Paul look bad and Paul is upset with Punk

3. Shows has another epic match with Y2J and wins

4. Shows has another epic match/or a stale I don't want to be here match with Y2J and loses

5. Music hits he walks strait to the ring no banter (ie look at watch,it's clobberin time) steam rolls through Y2J squash type match and walks to the back grabs his gear and leaves.

Which if any would you like to see?"	t5_2rau9	True
1369745392.0	1f72ht	The Shield and Team Hell No could put on that match over and over for three hours and it would have been the best RAW since the post-WrestleMania RAW.	oldirtygecko	28	7	13		t5_2rau9	True
1369698940.0	1f6138	At WWE Calgary	Binki	25	2	5		t5_2rau9	False
1369591736.0	1f3as0	What wrestling figure is this?	zanderflow	28	7	33		t5_2rau9	False
1366504913.0	1cruj3	Since everyone's posting their collections now, I'll show mine...	Retayk	26	3	6		t5_2rau9	False
1366492040.0	1crggf	WWE FIGURES...Does anyone collect them?if so post pics	Nelly_platinum	30	8	25		t5_2rau9	False
1365311199.0	1bu76m	I found this old collection of pics that my dad took when I was a kid. Was developed from negatives.	Ory619	26	6	8		t5_2rau9	False
1363740182.0	1amqzq	As a kid I rented this VHS once a week. I'm gonna watch the whole PPV for the first time in 17 years and nostalgia all over the place.	HxH21	25	6	5		t5_2rau9	False
1362600518.0	19smp7	RIP. You will be missed.	The_Colonel1292	24	4	2		t5_2rau9	False
1362372669.0	19md1o	This is one of my favorite promos.	KingGrant	21	0	2		t5_2rau9	False
1361870883.0	1992ff	Was tonight's raw punk vs Cena the greatest Raw match ever. 		23	2	38	I always put Hbk vs Marty as the best in  Raw 1.  But i think punk Cena surpassed it tonight. Even though the result wasn't what we wanted.  They both put it all on the line. Bravo.....	t5_2rau9	True
1361809694.0	1974z1	Who Is The Most Poorly Booked Superstar in WWE History?	BenLaird	22	2	83	I don't mean who is the worst, but rather who is the worst booked. Who had the most talent, but was booked so poorly that it went completely to waste. If I were to answer, I'd think it was Colt Cabana (Scotty Goldman). He has charisma, in-ring talent and size to boot, but WWE simply refused to give him a decent gimmick or a push. What do you guys think?	t5_2rau9	True
1361642335.0	1935yn	Roman Reigns - I think this guy has massive potential	Wheeto	27	8	21		t5_2rau9	False
1361141250.0	18pqxh	Official Elimination Chamber PPV Discussion Thread	WWE_Mod	25	4	174	"###Elimination Chamber PPV Discussion Thread

February 17, 2013

Live from New Orleans Arena

New Orleans, LA

***

The Rock (c) vs. CM Punk – WWE Championship match; no champion's advantage for The Rock

Alberto Del Rio (c) vs. Big Show – World Heavyweight Championship match

Chris Jericho vs. Mark Henry vs. Randy Orton vs. Jack Swagger vs. Daniel Bryan vs. Kane – Elimination Chamber match to become No. 1 contender for World Heavyweight Championship

John Cena, Ryback and Sheamus vs. The Shield – Tag team match

Kaitlyn (c) vs. Tamina Snuka – Divas Championship match

Antonio Cesaro (c) vs. The Miz – United States Championship match

Brodus Clay and Tensai vs. Team Rhodes Scholars – Pre-show Tag team match
"	t5_2rau9	True
1359606222.0	17lzdv	William Shatner Sings Superstar Entrance Theme Songs 	Robbo1971	26	3	5		t5_2rau9	False
1356644069.0	15jdqd	check out this Terry Funk signed card I got in a pack of wwe cards from walmart.. 	zeronormality	25	5	0		t5_2rau9	False
1353997669.0	13v186	Sheamus vs Antonio Cesaro was some of the best actual wrestling WWE has put on free TV in years.	bruiserbrody45	23	4	11	"Seriously. Some of the best free wrestling in years. This is the one benefit of the three hour format - they're letting these semi-main event matches towards the middle of the card go for a while, and when they book the matches well like they did tonight, it ends up for great wrestling.

I expected Sheamus to handly defeat Cesaro, but they let Cesaro really roll in this match. They really showed him off and talked him up, he probably outshined Sheamus overall throughout the match. Even though Sheamus picked up the win, the count-out saved some face and nobody really expected Sheamus to job this out, US Champion or not.

They really put out a bunch of good matches tonight. Sin Cara vs Del Rio, Mysterio vs Bryan, Ziggler vs Cena, Sheamus vs Cesaro, Punk vs Cane. Give the guys credit when credit is due, they actually put on a wrestling show tonight."	t5_2rau9	True
1349738286.0	115xxn	STONE COLD E.T. ........WHAT?!	Sirtroz	29	8	5		t5_2rau9	False
1348768786.0	10kntj	Team by Team breakdown of the new and improved WWE Tag Team Division	AlexFTLOW	23	1	9		t5_2rau9	False
1347854075.0	1008pq	All I was thinking about after the WWE Title match tonight	jtwellcle	24	2	7		t5_2rau9	False
1342651395.0	wsael	You know you're a WWE Fan when.....	SodaAddict619	34	11	43	"Lets make a list for this...I'll start with a few

1. You chant ""YOU SUCK"" when ever you hear Kurt Angles old theme
2. You own an entire closet of WWE clothes
3. Your ringtone is the entrance theme of your favorite superstar/diva
4. You still get goosebumps when you hear HHH or Undertaker's theme..
5. You have every action figure from when they started

More Reasons Added from the ideas below:

6. You're up 'til 4am every Monday night (UK based)
7. You do the Triple H water exhale when you've finished showering
8. Whenever you hear glass break no matter where it is, you get goosebumps
9. You loved The Rock before Dwayne Johnson was known
10. Every time someone talks you can't listen without saying or thinking WHAT?!?!
11. When you use the legend killer pose or cena's ""you cant see me"" as a celebration pose
12. You prefer a better wrestler to a ""performer""
13. When you have pretend matches with objects and actually start selling their offence and near falls
14. You comment on any sport like JR
15. You've gone as a WWE superstar for Halloween
16. You walk into a room blasting entrance music like it was your own
17. Your Gamertag or ID has a WWE Reference in it
18. If someone doesn't like you, you've got two words for them
19. Whenever anyone asks you a Yes/No question you scream YES!"	t5_2rau9	True
1341065245.0	vuaoi	Is it just me or are the poster on WWE starting to become very irrelevant?	JustAnotherRedditor1	28	8	5		t5_2rau9	False
1333765776.0	rxazs	Last Tuesday was amazing.	jandv411	21	0	8		t5_2rau9	False
1306702749.0	hn0ss	This shit has to stop	bigmillion	27	7	5		t5_2rau9	False
1373304819.0	1hvjh0	The McMahon Family Is The Best Target For the Wyatt Family	Consciouswrdsbt	26	6	5		t5_2rau9	False
1370718739.0	1fxudl	Is the introduction of Wyatt Brothers a fix to at least part of what's missing?	Absolution7	24	6	17		t5_2rau9	False
1369614443.0	1f3y3e	Who is a Wrestler that you couldn't stand when they first debuted but you have now come to like?	Spacehh	20	2	66	Mine would be The Miz. When he first came into WWE I thought he was the biggest douchebag I'd ever seen with his stupid fedora and board shorts. But now I think he has matured a bit and presents himself quite well.	t5_2rau9	True
1368591317.0	1ed42f	ESPN Top Ten Power Rankings of the WWE... I didn't know this existed until now	omnipotentjefe	23	3	2		t5_2rau9	False
1366840508.0	1d1f8f	Did you meet Ryback and Kaitlin in Nottingham?	Mediumraah	25	3	1	"If so,i was the official photographer for that event and i may have taken a pic of you. IF you want them hit me up at

@craigclews
craig.clew@gmail.com"	t5_2rau9	True
1362726669.0	19wfop	El Generico makes his NXT in ring debut without his mask under his real name.	form_wrestle_account	28	7	3		t5_2rau9	False
1362411008.0	19n3kw	Ricardo Rodriguez an extra in porn?	TimeTravelVandal	20	2	5		t5_2rau9	False
1361592973.0	192bhe	Weed The People	Curiouscrispy	51	31	2		t5_2rau9	False
1359942379.0	17u8ec	Is anyone else expecting the shield to pop out at the superbowl now?	kirlianvoyager	31	11	1		t5_2rau9	False
1359615300.0	17m8ir	Why Punk vs Taker Is The Best Thing That Can Happen Now	toasterstrudells	27	7	31	"Let me start this off by saying, as much as it hurts to see CM Punk loose the title - if you told me 10 years ago that CM Punk would be a world champion for over a year, only to loose it to the biggest star in wrestling history, I'd laugh you out of the building. 

But now that this rumor has bumbled up, it's perfect. Provided Taker is healthy enough to really put on a show, this would be the match of the night. Takers' matches have overshadowed the title match the last three times. It's pretty much a legend maker at this point. Even with the obvious loss, it puts CM Punk into that upper stratosphere of legendary superstars almost automatically.

What do you do when you loose the title after a year long run? The normal answer would be take a break, but CM Punk is still fresh, there's no reason to take him off TV. He gets this one rematch but you know it's gonna be Cena vs Rock at WM. So what does Punk do? Where's there a feud?

Punk vs Taker would be as big as the main event. Even with the loss, he can say he walked out of WM on his own leg, which HHH and HBK couldn't do.

Oh, and so the match doesn't come out of nowhere, how about this for wrapping it all together? During CM Punk vs Rock, the lights go out again - except this time, when they go on, The Shield and CM Punk are laid out and you get the signature chime of the bell. Boom. It's on."	t5_2rau9	True
1359544890.0	17k1al	Not everything in the attitude era was good #2		29	7	28		t5_2rau9	False
1358324744.0	16ocdv	This girl broke up with Dolph Ziggler  because he banged her to hard.	wadester007	34	15	14		t5_2rau9	False
1357073153.0	15sar9	I loved the way Dean Ambrose sold this RKO.	TxMayer89	26	7	15		t5_2rau9	False
