created_utc,id,title,author,ups,downs,num_comments,selftext,subreddit_id,is_self
1372785498.0,1hiaye,Lebron/Wade afterparty vs. Shane Battier afterparty,HallowedAntiquity,116,6,35,,t5_2qhsv,False
1359039172.0,176vyf,Nice Move [X-post /r/gifs],PhilaDopephia,106,10,8,,t5_2qhsv,False
1365651547.0,1c439o,Being a benchwarmer making this corner 3 for the very last shot of the very last game of the season. Practically made my year.,Klove128,103,12,18,,t5_2qhsv,False
1361281206.0,18teva,Michael Jordan's comeback statement in '95 was one of the coolest press releases ever written,FinalSay,106,16,2,,t5_2qhsv,False
1364609347.0,1ba4d4,Surprised I haven't seen this one yet.,pappazilla,97,14,1,,t5_2qhsv,False
1364767208.0,1bdqhs,(disturbing) Kevin Ware snaps his leg at the NCAA elite 8 game,pluckyrabbitsfoot,98,18,30,,t5_2qhsv,False
1346165726.0,yyp3o,Every week at the gym,yamarwook,85,6,7,,t5_2qhsv,False
1364236585.0,1azkwn,"Meanwhile, IN Indiana SNOW&gt;&gt;&gt;",bcoup1199,82,8,http://www.reddit.com/r/Basketball/comments/1azkwn/meanwhile_in_indiana_snow/,http://f.thumbs.redditmedia.com/X-WmPX7dtFDT_gnq.jpg,
1372165442.0,1h19fh,Played basketball in a rest stop parking lot today,mattdouglasm,83,8,3,,t5_2qhsv,False
1341951708.0,wcgow,Close enough..,bithcplease,85,10,9,,t5_2qhsv,False
1368908761.0,1elduo,Kobe don't flinch.,eazy_,92,24,11,,t5_2qhsv,False
1354886708.0,14fxr1,Dangerous in the Paint [gif],Scopolamina,72,8,4,,t5_2qhsv,False
1372066134.0,1gyk8b,"all of Lebron James' 37 points in game 7, made in one gif.",YoungCheddah,84,16,http://www.reddit.com/r/Basketball/comments/1gyk8b/all_of_lebron_james_37_points_in_game_7_made_in/,http://b.thumbs.redditmedia.com/Dw6v5zygcguAcc9a.jpg,
1353997432.0,13v10v,"I met Muggsy Bogues when I was 12 years old and the one question I asked him was: ""Did you have a fun time on Space Jam?"" His answer was (and I quote): ""Yea! I had a really good time on Space Jam!""",OldMonet,74,6,3,,t5_2qhsv,False
1357421740.0,160xx9,This is wrong on so many levels...,mikedarsh51,74,14,7,,t5_2qhsv,False
1365189876.0,1br3kd,"Doug Anderson rocks a 360, through-the-legs slam",travelling_anth,63,3,http://www.reddit.com/r/Basketball/comments/1br3kd/doug_anderson_rocks_a_360_throughthelegs_slam/,http://b.thumbs.redditmedia.com/_7XWQpjF6AFmpt-g.jpg,
1373462631.0,1i07fh,Spiderman got mad handles.,The_right_time,66,4,8,,t5_2qhsv,False
1370883277.0,1g1ys5,Spurs Dynasty GIF! AMAZING!,SearchNerd,73,11,2,,t5_2qhsv,False
1365737956.0,1c6nxv,Me dunking in a college camp,The_GingerBreadMan06,77,18,11,,t5_2qhsv,False
1364787099.0,1beef0,HD close up of Kevin Ware Injury(Bone out of Leg),T-money723,74,12,15,,t5_2qhsv,False
1368816135.0,1ej72a,"Brittney Greiner is now learning how to do the ""sky hook"" from Kareem Abdul-Jabbar. Will anyone be able to stop her?",dynamicDERP,69,10,19,,t5_2qhsv,False
1376920968.0,1knzu0,Pickup ball stereotypes. Something to laugh at.,TotallyMyThing,64,6,22,,t5_2qhsv,False
1367150772.0,1d9o6v,The iron is way too friendly to Kevin Durant [x-post from /r/nba],dantesemore,65,8,8,,t5_2qhsv,False
1354056743.0,13wdu1,I get buckets,AndrewBrac,60,10,6,,t5_2qhsv,False
1357764576.0,169pni,Found this in a flat box after moving. yes my son is on his tippy-toes trying to measure up to greatness,enigmatik1,57,5,2,,t5_2qhsv,False
1356937663.0,15ppxz,Damn it feels good to be a Jayhawk,ajacks88,62,8,5,,t5_2qhsv,False
1375380660.0,1jicbj,"4000 members of our community!! In around 7 months, we've been able to double our subscribers, hopefully we'll be able to get to 5000-6000 by the time Christmas rolls around!",townie_immigrant,58,3,False,
1364046140.0,1auw1u,Thanks Georgetown,MJWORD,52,4,6,,t5_2qhsv,False
1362455473.0,19ootf,My school is hosting a basketball tournament so we decided to set up a camera at the net. here are the results,pifarm,55,4,10,,t5_2qhsv,False
1356628260.0,15ixiz,Best xmas gift I could have asked for (even though I didn't),Anthmt,55,8,3,,t5_2qhsv,False
1376043774.0,1k0nwy,I don't know if this is the right place but I just dunked for the first time in a game,Disgruntled_Fridge,54,9,18,"I was playing a pickup game with some friends and acquaintances down at my local outside court. I'd been playing alright

It was a 2 on three fast break situation

I've dunked before off a no dribble run up

It was nothing fancy

My teammates got hyped

(I also hit a dirk fadeaway later but forgot to call bank smh)",self,t5_2qhsv,False,,,True,http://www.reddit.com/r/Basketball/comments/1k0nwy/i_dont_know_if_this_is_the_right_place_but_i_just/
1366332188.0,1cna30,Seventh Woods Is The BEST 14 Year Old In The Country! CRAZY Athlete,Twist83,53,5,18,,t5_2qhsv,False
1365567681.0,1c1jtk,HA! Basketball games are so unrealistic.,funnlks56,58,12,5,,t5_2qhsv,False
1369180860.0,1essvt,"I'm only 5""6 and all my hard work is paying off, finally grabbing 10ft ""barely""",theNatural915,99,56,http://www.reddit.com/r/Basketball/comments/1essvt/im_only_56_and_all_my_hard_work_is_paying_off/,http://d.thumbs.redditmedia.com/EhLiflV--9_Rlh1-.jpg,
1364419893.0,1b4wnc,matt barnes is not clutch,eazy_,54,7,6,,t5_2qhsv,False
1362952227.0,1a1lrf,My buddy's dad invented a device that vastly improves player's free-throw percentage; he's currently trying to get manufacturing off the ground.,thepodgod,49,4,22,,t5_2qhsv,False
1360707693.0,18ek76,"So, this throw over the whole field counts just as two points because the ball bounced once within the three point line..",JEBOTEBOG,48,4,http://www.reddit.com/r/Basketball/comments/18ek76/so_this_throw_over_the_whole_field_counts_just_as/,http://d.thumbs.redditmedia.com/4pBBCHXYLteCpwT3.jpg,
1360069952.0,17xieg,Arvydas Sabonis (48 y.o.) playing this Sunday in the match of veterans against CSKA,ChFoMa,45,3,10,,t5_2qhsv,False
1350580431.0,11p52d,Sweet Freedom,jmart1392,44,0,2,,t5_2qhsv,False
1371757929.0,1gqxv4,Sad LeBron,Zeophyle,61,17,1,,t5_2qhsv,False
1368485678.0,1e9y91,Kid gets posterized at school,Xraging,55,11,6,,t5_2qhsv,False
1373689860.0,1i7a0y,"Went out to shooting some hoops late at night. Took a brake to snap this, well worth it.",AIpha_Kenny_Body,54,13,http://www.reddit.com/r/Basketball/comments/1i7a0y/went_out_to_shooting_some_hoops_late_at_night/,http://c.thumbs.redditmedia.com/Ew-OWGdMQIVmSOyz.jpg,
1367203395.0,1db9nu,As a Knicks fan watching the western confernce playoffs,TonyStarks21,50,9,4,,t5_2qhsv,False
1359384847.0,17fhze,This coach has a good reaction,tristashtuk,47,5,3,,t5_2qhsv,False
1342875582.0,wx789,Their basketball team isn't going to London but I still love Team Poland,putitup,45,4,0,,t5_2qhsv,False
1365460427.0,1by5ul,Carmelo Anthony pretends to be a wax figure to surprise guests (Funny),Schmidget23,52,11,2,,t5_2qhsv,False
1358295147.0,16ngrm,You think you work hard at basketball? Check these guys out.,lookatamonkey,43,5,19,,t5_2qhsv,False
1375126789.0,1jap8m,The Upcoming Soundtrack for NBA 2K14 was picked by LeBron James. Here's the list of songs he chose.,BhrisCosh,47,4,29,,t5_2qhsv,False
1351866564.0,12ijpf,Kyrie Irving and Kevin Love as Uncle Drew and Wes for Chapter 2 of Pepsi Max and Kyrie Irving present: ,Spearajew,47,8,4,,t5_2qhsv,False
1368305025.0,1e5aju,"Lebron James Gets Blocked By 5' 9"" Nate Robinson",eazy_,45,4,3,,t5_2qhsv,False
1361979666.0,19bxji,Why the Cavs in a few years will be a legitimate threat,twosixteen,49,11,7,,t5_2qhsv,False
1376319279.0,1k7jmo,Sunrise Ballin',alexturc,43,7,4,,t5_2qhsv,False
1373427532.0,1hzg6u,Ice cream man was passing while I was balling out front. Bet him free ice cream if I drained a three first try.,XbanditX,46,5,5,,t5_2qhsv,False
1367248536.0,1dcaur,Jason Collins becomes first openly gay NBA player,SpiderMunn,44,3,3,,t5_2qhsv,False
1362793893.0,19y68j,"8-year-old looking to be a basketball scout, charts his 4-year-old brother's skillset...",carver1976,45,7,http://www.reddit.com/r/Basketball/comments/19y68j/8yearold_looking_to_be_a_basketball_scout_charts/,http://f.thumbs.redditmedia.com/jnYPN7LauYOyQVEY.jpg,
1358532491.0,16ttv4,The Block of My Life,SteveDensmore,49,10,13,,t5_2qhsv,False
1370280918.0,1flcor,Jason Kidd Retiring After 19 Seasons. One of the top ten PGs of all time,unsoughtzach,49,13,6,,t5_2qhsv,False
1365484923.0,1bz18z,"Trey Burke's ""block"" that was called a foul.",MrClucks,43,3,9,,t5_2qhsv,False
1357175537.0,15uy43,OH MY GOD!!!,synthesis11,41,1,10,,t5_2qhsv,False
1357074344.0,15sbzi,"Well, there's a dunk you don't see very often...",Bananq,39,2,http://www.reddit.com/r/Basketball/comments/15sbzi/well_theres_a_dunk_you_dont_see_very_often/,http://b.thumbs.redditmedia.com/uz0wAM2Z0zv5j9aI.jpg,
1355411305.0,14scm2,Referee blocking Kris Humphries attempt to shoot a free throw,Bachse,37,1,5,,t5_2qhsv,False
1355075101.0,14jza4,Worst Free Throw Attempt Ever,buckethead73,46,5,11,,t5_2qhsv,False
1373507536.0,1i1v5d,So today they're re-paving the court i always play on,ryanc69,41,5,24,,t5_2qhsv,False
1369963219.0,1fdjtx,TIL the only way not to get ejected from shoving someone in a game is to play for the Miami heat,Patdaman89,48,16,8,No way Anderson shouldn't have been ejected. Any thoughts? Edit: and should he be suspended for game 6?,t5_2qhsv,True
1367714394.0,1dph4h,When i watch players this generation...,dynamicDERP,70,33,16,,t5_2qhsv,False
1365031218.0,1bmfdj,TIL Lithuania once had a coin devoted entirely to basketball,awh444,37,4,2,,t5_2qhsv,False
1354322702.0,142wz4,Awww yeah,Zab18977,43,5,1,,t5_2qhsv,False
1358000921.0,16fqy2,This kid is loving life at the moment - Over the head buzzer beater!,,37,4,3,,t5_2qhsv,False
1355453540.0,14tm5w,am I the only one who finds something wrong with this headline?,misterchainsaw,50,14,10,,t5_2qhsv,False
1366498349.0,1crnju,"In Canada, this is how we roll. (Yes, this was taken today, April 20)",slap_shot_12,6,,False
1358730473.0,16ykwk,Ball so hard...,dope93x,46,13,3,,t5_2qhsv,False
1376165989.0,1k3txv,"How To Shoot a Step Back: Even Short, Unathletic players can score 30+ with this move...",augie5390,33,1,http://www.reddit.com/r/Basketball/comments/1k3txv/how_to_shoot_a_step_back_even_short_unathletic/,http://c.thumbs.redditmedia.com/dEggTCJr5_l7Z6Hz.jpg,
1373575584.0,1i3up8,I still love this dunk even though pretty much everyone has seen it. [Gerald Green 2012],Hammer989,37,2,2,,t5_2qhsv,False
1370837424.0,1g0x23,The nastiest highschool dunk of all time,Pobearo,32,0,8,,t5_2qhsv,False
1365554173.0,1c126o,"Me ballin' in Benin, Africa. What you guys think?",Ballbeg13,42,9,http://www.reddit.com/r/Basketball/comments/1c126o/me_ballin_in_benin_africa_what_you_guys_think/,http://f.thumbs.redditmedia.com/1-Ihi7N0T94_0Jqk.jpg,
1355712905.0,14z1eb,One handed basketball player! Pretty amazing,Leggitydip,32,0,7,,t5_2qhsv,False
1371667302.0,1go727,Foul Or Not? Danny Green Last Second 3-Point Attempt,JosephCurrency,42,11,48,,t5_2qhsv,False
1369768754.0,1f7ts4,Micah Lancaster is a beast. And now I feel like a bum. So inspirational!,arachnih,31,1,0,,t5_2qhsv,False
1367959533.0,1dvw6r,Chris Herren came to my school today,MyAlarmClock,33,2,6,,t5_2qhsv,False
1366938829.0,1d4gy1,"Michigan's Nik Stauskas shoots 3-pointers, hits 92% (70/76) 46 in a row in 5 minutes",yeropinionman,30,0,http://www.reddit.com/r/Basketball/comments/1d4gy1/michigans_nik_stauskas_shoots_3pointers_hits_92/,http://b.thumbs.redditmedia.com/dCXKp2PyesY-pzGg.jpg,
1363889589.0,1aqv8u,Thanks coach...,Brozilla,32,3,2,,t5_2qhsv,False
1358622563.0,16vz86,Kid wins a cruise during half-time show at my college.,GingerBadger22,34,1,4,,t5_2qhsv,False
1356477175.0,15ful9,Kobe Bryant explaining how to basketball,John-Boner,35,3,3,,t5_2qhsv,False
1367008808.0,1d6duq,Rick Pitino promised he’d get a tattoo if the Louisville Cardinals won the National Championship. The Cards delivered and so did he.,dhf510,38,9,0,,t5_2qhsv,False
1362237678.0,19ivw4,Magic Johnson offers $1M if LeBron enters slam dunk contest,Commandant1,35,2,2,,t5_2qhsv,False
1359132445.0,179g55,Today marks the 25th Anniversary of Jerome Lane's backboard shattering slam dunk,zack1x,31,1,4,,t5_2qhsv,False
1355807955.0,151d73,Just basketball,donttazemeBRA,38,8,2,,t5_2qhsv,False
1340961908.0,vsefq,This 6th grader is my hero,misterturban,31,0,5,,t5_2qhsv,False
1336431566.0,tbxt8,Take Anthony Davis' unibrow,TheDroppedD,33,2,1,,t5_2qhsv,False
1376329988.0,1k7xd2,Deeeetroiiiiit Basketballllllllll,thegodawfultruth,38,9,4,,t5_2qhsv,False
1372381449.0,1h7uu9,"David Stern, full on WWE",TheDonkey,32,2,http://www.reddit.com/r/Basketball/comments/1h7uu9/david_stern_full_on_wwe/,http://a.thumbs.redditmedia.com/04bd6UJJ8Mir8IqB.jpg,
1364007234.0,1au860,"Whenever people try to swat my lay-ups, seems like they are sporting these beauties.",Morningstar269,41,11,http://www.reddit.com/r/Basketball/comments/1au860/whenever_people_try_to_swat_my_layups_seems_like/,http://c.thumbs.redditmedia.com/0dGBRPe-Azao7uNP.jpg,
1362974659.0,1a2alv,NBA Dunk of the Year??? DeAndre Jordan Posterizes Brandon Knight!,GC05,38,5,2,,t5_2qhsv,False
1354856430.0,14ffuz,Playing franchise mode in NBA Live 06 and it's time to sign free agents.,SkillyBeeba,34,5,3,,t5_2qhsv,False
1375481740.0,1jlcpu,2013 BASKETBALL INSPIRATIONAL VIDEO *RELEASED JUST NOW*,the6hiddenmasters,30,1,3,,t5_2qhsv,False
1374245348.0,1imtk3,NBA approves Charlotte name change back to Hornets,SubbyDoo,28,0,5,,t5_2qhsv,False
1361337886.0,18vce3,that awkward moment when yo think you got a break away and...,MrUltimateNGA,32,3,1,,t5_2qhsv,False
1351807399.0,12hbwo,Jordan shames Kobe and James in so many ways,IThinkErgoIAmAbe,47,20,7,,t5_2qhsv,False
1349120834.0,10ryhj,Seriously just happened. I feel so bad.,Thatguy0427,37,9,6,,t5_2qhsv,False
1369603531.0,1f3n9l,Charles Barkley Calls Himself a Dumbass- Old but good,ScottishSwimmer,27,1,2,,t5_2qhsv,False
1365725106.0,1c67el,Jesus is faster,Fiapgaming,53,26,2,,t5_2qhsv,False
1334246960.0,s6ca6,"UNC players in a pickup game against students, turns AWESOME at the 3:00 mark (x-post from /collegebasketball)",ma6ic,30,4,http://www.reddit.com/r/Basketball/comments/s6ca6/unc_players_in_a_pickup_game_against_students/,http://a.thumbs.redditmedia.com/Wijb9lf-kuNmX57T.jpg,
1364889631.0,1bi5d8,Barack Obama plays basketball. Misses first 17 shots,FinalSay,35,11,12,,t5_2qhsv,False
1357273473.0,15xkpy,Good call refs...,bothaniel,31,6,3,,t5_2qhsv,False
1356280609.0,15bwji,Breakthrough Basketball Drills (153 pgs.),Locus_Delicti,32,5,0,,t5_2qhsv,False
1353622068.0,13n0f8,Kevin Durant kiss old fan,GizliForvet,28,2,0,,t5_2qhsv,False
1371417230.0,1gh3uk,When a white boy plays basketball,samminier,49,24,14,,t5_2qhsv,False
1361033433.0,18n5qu,a redditor's day out at kansas.,slothpimp,28,4,0,,t5_2qhsv,False
1358208163.0,16l0ou,How To BLOCK Shots the SMART Way!,ShotScience,27,3,7,,t5_2qhsv,False
1356834681.0,15njr3,Any r/Basketball card enthusiasts? Here's some of my collection,Bushmage,33,8,12,,t5_2qhsv,False
1353967903.0,13u39o,7 Dribble ATTACKS you need to have DOWN!!,ShotScience,27,1,6,,t5_2qhsv,False
1320806859.0,m5m04,Kobe being Kobe,lilstumpz,27,1,1,,t5_2qhsv,False
1372219722.0,1h3554,Video: Little High School Guard Absolutely POSTERIZES Dude On A Fast Break,anniedunbar14,25,1,3,,t5_2qhsv,False
1360286353.0,183p17,Monster Dunk by CJ Aiken - Saint Joseph's Hawks,xplato,29,3,6,,t5_2qhsv,False
1360007673.0,17vtn7,How to STOP the Fastbreak in a 2-on-1 situation!,ShotScience,25,1,4,,t5_2qhsv,False
1352776687.0,133pbc,My ankle after rolling it playing basketball at the Y.,vilechild,28,3,10,,t5_2qhsv,False
1368439773.0,1e8jco,"remember Michaels ""Ball Fake""",leinad022513,24,2,8,,t5_2qhsv,False
1368288772.0,1e4tcy,Joakim Noah loves the pretty life,GOPdefender,37,14,0,,t5_2qhsv,False
1368121885.0,1e0ihm,@MensLeagueGuy is funniest new account on twitter.,benholcomb,26,4,2,,t5_2qhsv,False
1366762633.0,1cz3an,Allen Iverson admits to being broke,peopleu2,26,5,10,,t5_2qhsv,False
1364615878.0,1baane,Florida Gulf Coast,eagleface,26,3,0,,t5_2qhsv,False
1364477796.0,1b6c2q,Picture that was posted from Fake ESPN,Avanue,31,9,1,,t5_2qhsv,False
1360446307.0,187o4a,"27 Dunks never done in the Slam Dunk Contest, all would get 50s!",,25,2,http://www.reddit.com/r/Basketball/comments/187o4a/27_dunks_never_done_in_the_slam_dunk_contest_all/,http://e.thumbs.redditmedia.com/KA4brE572EQ4orrv.jpg,
1358710338.0,16xyfw,Probably the best Center to ever play the game of Basketball,LeSpy97,28,5,15,,t5_2qhsv,False
1358273777.0,16mou3,"Ish Smith Jumps Over John Wall, Then Blocks His Shot",eazy_,24,0,http://www.reddit.com/r/Basketball/comments/16mou3/ish_smith_jumps_over_john_wall_then_blocks_his/,http://f.thumbs.redditmedia.com/QTDnDfOgE3LOH2Ye.jpg,
1357864946.0,16ck7s,27 Sick Dunks Never Attempted in the NBA Slam Dunk Contest,eazy_,27,4,2,,t5_2qhsv,False
1347300752.0,znwk4,Looking for a court to play on?Google maps+basketball=great times,thebluehippo,27,3,5,,t5_2qhsv,False
1376674972.0,1ki0pj,Mad respect for this guy,Louis4357,23,1,3,,t5_2qhsv,False
1372648527.0,1hejpe,Pickup basketball summed up in one bar graph,matts41,33,11,4,,t5_2qhsv,False
1371173999.0,1gb6gy,Who here likes the Spurs,sexy_gangsta,42,20,4,,t5_2qhsv,False
1365364758.0,1bvbqg,I'm 22 and love basketball. But I'm a novice. Do you have advice/links for breaking down the game and working on each aspect?,elamo,24,2,24,"I'm hoping that I can become a decent player within a year or two. I find tons of stuff when I search but I don't know which to look at. 

The things I can do: 
-shoot free throws around 50% 
-play basic defense
-make layups with my right hand and some with my left 
-basic dribbling
-passing. I think I can pass pretty well and have okay court vision from watching a lot. 

My problem areas: 
-shooting. I learned to shoot without jumping and now taking jump shots feels really weird. 
-rebounding. I'm 6' 3"" but I often still get outrebounded by smaller guys. 


",self,t5_2qhsv,False,,,True,http://www.reddit.com/r/Basketball/comments/1bvbqg/im_22_and_love_basketball_but_im_a_novice_do_you/
1359957990.0,17uqvo,We beat our rivals with this clutch buzzer beater :),suzeee0,24,2,1,,t5_2qhsv,False
1359859428.0,17scgf,The lone fan,russianyes,25,3,0,,t5_2qhsv,False
1353870353.0,13rpum,This guy has made one of the nest mixes I've ever seen. He deserves way more credit.,bro_calm_down,25,5,4,,t5_2qhsv,False
1350521989.0,11nvvi,Kobe's reaction at the end...,AyshineMatt,23,3,1,,t5_2qhsv,False
1340222408.0,vcf7r,It’s time for the NBA to address the Flop!,mceagle611,24,3,5,,t5_2qhsv,False
1376624207.0,1kgsoi,"One-armed basketball player offered a spot on the 2-time, NCAA champion Florida Gators basketball team. Wow!",gotnext,24,2,http://www.reddit.com/r/Basketball/comments/1kgsoi/onearmed_basketball_player_offered_a_spot_on_the/,http://d.thumbs.redditmedia.com/CN6vQhA_D8caJ5lW.jpg,
1375846840.0,1juzhd,Unexpected Ballers: Mormons In The Hood,ifornia,26,4,2,,t5_2qhsv,False
1375320758.0,1jgp7v,Never Dribble Off Your Foot Again With These Basketball Shooting Drills and Ball Handling Drills,augie5390,24,5,3,,t5_2qhsv,False
1370439742.0,1fpxkl,Awesome dunk! Kid is/was a junior in HS.,theFletch,22,0,4,,t5_2qhsv,False
1367292442.0,1ddzej,Can Steph Curry Become the Best 3 Point Shooter Ever?,currymadness,22,0,3,,t5_2qhsv,False
1366138993.0,1ch8sg,Is this move legal?,ay01,23,2,38,,t5_2qhsv,False
1361137133.0,18plzv,Ben McLemore's 360 Dunk on Texas,webology,22,1,0,,t5_2qhsv,False
1360385463.0,186ewq,Friend of mine takes down the rim!,GoldenTechy,24,3,7,,t5_2qhsv,False
1355719226.0,14z7o5,Damian Lillard with the game fucking winner!!!,Grytslar,26,4,4,,t5_2qhsv,False
1353470076.0,13jr65,How is it possible to score 138 points in a basketball game?,dolphinwrangler,22,0,15,,t5_2qhsv,False
1352471751.0,12wwr8,Must have been the clutch play from Durant,RatherFastBlackMan,26,5,1,,t5_2qhsv,False
1327293795.0,osg06,AMA Request: NBA Referee,caffiendx27,23,2,6,,t5_2qhsv,True
1375944837.0,1jxx2y,Mormon missionaries dominate basketball court in the ghetto volume 2,storminmorm,29,10,9,,t5_2qhsv,False
1374096592.0,1iiixo,Paul George admits Lakers will be an attractive destination in 2014,LordsantosSK,28,9,3,,t5_2qhsv,False
1371958941.0,1gw3yn,Having open gym at Galiger Iba arena was amazing,theNatural915,28,9,2,,t5_2qhsv,False
1366296939.0,1clwxg,"Chandler Parsons' arc-less buzzer beater - ""the laser""",aurolingo,27,5,3,,t5_2qhsv,False
1363986986.0,1atnd3,"Classic Michael Jordan, March Madness style...1983 vs. James Madison",carver1976,22,1,http://www.reddit.com/r/Basketball/comments/1atnd3/classic_michael_jordan_march_madness_style1983_vs/,http://b.thumbs.redditmedia.com/OzVq8_CQEraIBBrO.jpg,
1361986399.0,19c5tt,Heart-warming sportsmanship. ,scienceben,23,2,2,,t5_2qhsv,False
1359923898.0,17to6u,That's just...,troll_face4-ever,25,6,1,,t5_2qhsv,False
1352851671.0,135gtb,Gopro POV Basketball [X Post from R/gopro],DRowney,26,5,7,,t5_2qhsv,False
1352569059.0,12yxm1,Happened to me today. Anyone got some recovery tips?,crazmnky90,28,9,6,,t5_2qhsv,False
1350746071.0,11ssl1,"Must watch documentary: Magic &amp; Bird, A Courtship of Rivals",thaddad12,21,1,http://www.reddit.com/r/Basketball/comments/11ssl1/must_watch_documentary_magic_bird_a_courtship_of/,http://f.thumbs.redditmedia.com/_d7jQHCESspRnuzS.jpg,
1349648290.0,113uv7,My Wallpaper,RedsArmy786,22,3,7,,t5_2qhsv,False
1375795227.0,1jt58p,Why do you like this sport ?,bpyd,20,0,17,"I'm new here, but which one is yours ?",t5_2qhsv
1373870538.0,1ibpzx,1 on 1 basketball as a professional sport,V1F,24,5,7,,t5_2qhsv,False
1373348075.0,1hx2fh,Basketball Moves - Learn the Kobe Bryant Pivot Move,ShotMechanics,22,5,8,,t5_2qhsv,False
1371824654.0,1gsmy2,A letter to David Stern - the new Flopping as demonstrated by the Heat,stoli7188,30,13,14,"Mr. David Stern

I want to congratulate you on doing such a fantastic job as League Commissioner and wish you the best in your future endeavors.

As a life time basketball fan I have tremendous respect for the League and the job you have done over the years, mainly by the Heat players.  I am neither a Spurs nor a Heat fan but simply a basketball fan as I watched The Finals (Knicks 2014!) this year.  However I strongly feel that talking back to the officials, whining about calls, or doing the arms up- out to the side- surprised pose, that so many on the Heat seemed to do is equally as detrimental to the game as flopping.  

In my sons peewee basketball league we teach the kids to play - key word - to play the game.  We are trying to build strong characters, character building traits basketball can instill in men.  The Spurs showed that professional players can simply do their job and play the game (key word - play the game) with class and integrity and will allow the officials to do their jobs.  Please do something about the talking back to officials and the whining face/pose that most players seem to make to ""plead"" their case.  Please help me explain to my son why he should celebrate the Spurs even after such a loss and not use certain Heat players as his role model - for life and for basketball.

Thank you.





EDIT::

After reading some replies I want to add a few points.  I agree that blindly accepting authority is not a good thing to teach kids or a good principal to live by.  However we are talking here about the game of basketball which has rules and that by agreeing to play this game you are agreeing to the rules.  

After getting my thoughts in writing I guess my main problem is simply how ridiculous a lot of the players look when they are whining or arguing with the officials

I understand the passion and the emotions involved,,False,self,t5_2qhsv,1371833044.0,,True
1370601722.0,1fursa,23 Greatest Moments of Michael Jordan (ESPN 02/17/2009),despotovski01,20,2,1,,t5_2qhsv,False
1369519012.0,1f1tfo,Paul George Dunks Hard on Chris Andersen,eazy_,21,2,3,,t5_2qhsv,False
1369249116.0,1eunv8,"Is the word ""Mature"" misspelled on Kevin Durant's new back tattoo?",harrynlloyd,21,2,6,,t5_2qhsv,False
1363405544.0,1ae54n,My view for the Duke vs Maryland game,AlwayzPro,29,10,1,,t5_2qhsv,False
1362897752.0,1a0i8y,[crosspost] Dwayne Wade blocks Amare Stoudemire and shoots a halfcourt buzzer beater.,pluckyrabbitsfoot,23,1,1,,t5_2qhsv,False
1362457655.0,19orj8,"In all fairness, she'd probably make them better.",iwouldhitthatshit,25,4,http://www.reddit.com/r/Basketball/comments/19orj8/in_all_fairness_shed_probably_make_them_better/,http://f.thumbs.redditmedia.com/CEWHLWYn6ru-INmS.jpg,
1360393547.0,186lgb,"Origin of one of the most vicious moves in the game of basketball, the crossover.",bgiang,21,4,http://www.reddit.com/r/Basketball/comments/186lgb/origin_of_one_of_the_most_vicious_moves_in_the/,http://d.thumbs.redditmedia.com/2YuYxElMouMHmtbE.jpg,
1358388685.0,16q495,Ever Missed a WIDE-OPEN Layup?!?,ShotScience,21,1,1,,t5_2qhsv,False
1350592818.0,11pjis,"Utah Jazz forward Jeremy Evans showed off his freakish athleticism last night, as he tagged a lazy jumper from Ronny Turiaf then proceeded to yam on Turiaf’s braids a few seconds later.",eazy_,21,2,http://www.reddit.com/r/Basketball/comments/11pjis/utah_jazz_forward_jeremy_evans_showed_off_his/,http://d.thumbs.redditmedia.com/mSAFXMpWgkU2vy-W.jpg,
1348667121.0,10i7vh,"Shortest Professional Dunker at 5'5""",rwarner13,19,0,5,,t5_2qhsv,False
1373837235.0,1iapqc,1998 All Star Game: Jordan to Kobe - Passing of the torch,seandrizzy,21,3,1,,t5_2qhsv,False
1372347572.0,1h6met,Gilbert Arenas arrested for having truck full of illegal fireworks,Commandant1,20,1,6,,t5_2qhsv,False
1371087243.0,1g8lj0,Jason Kidd is officially the next Nets head coach.,tonytreesNYY,23,4,3,,t5_2qhsv,False
1366296166.0,1clw24,"Britney Griner, comes out, tells others to be ""who you are""",Commandant1,25,2,False,
1362088205.0,19f6lw,This is one of my all-time favorite blocks...,JewWithAFlamethrower,21,4,10,,t5_2qhsv,False
1362023269.0,19dijh,Stephen Curry just made 11 out of 13 3-pointers for a total of 54 points,rttrumbl,22,2,4,,t5_2qhsv,False
1356034076.0,156n4k,5th Grader starts for High School Basketball team,BenStL13,22,5,9,,t5_2qhsv,False
