created_utc,id,title,author,ups,downs,num_comments,selftext,subreddit_id,is_self
1365105257.0,1bol0l,What type of sleeves do Ricky Rubio &amp; Iman Shumpert wear on their knees?,kitarp,7,0,4,"I've also torn my ACL and had reconstructive surgery just like Rubio and Shumpert and want to start playing basketball again.  I've noticed they have a sleeve around their operated knees and would like to know what sleeve it is they wear.

Also if anyone has had ACL reconstruction and could recommend any sleeves or braces they think were good would also be great.  I'd like to keep it none bulky as possible as well.

Thanks!",self,t5_2qhsv,False,,,True,http://www.reddit.com/r/Basketball/comments/1bol0l/what_type_of_sleeves_do_ricky_rubio_iman_shumpert/
1364867468.0,1bhhk8,Detroit bad boys,thegreatestever19,8,0,2,,t5_2qhsv,False
1364611771.0,1ba6qf,March Madness 2013 - Michigan v. Kansas: Trey Burke drains a 30-footer to send Game into Over Time,329054,8,2,0,,t5_2qhsv,False
1364482779.0,1b6h6p,I could see him doing this,jewettman2,14,5,0,,t5_2qhsv,False
1364275369.0,1b0y6i,My friend and I made a dunk video,bigDIEter,14,6,11,,t5_2qhsv,False
1364247304.0,1azzla,Trick Shots with the help of hair?,mOceanLA,7,1,0,,t5_2qhsv,False
1363879144.0,1aqhv9,"Made this for work, got me even more pumped for the Madness. ",ne0n_valkyrie,8,1,http://www.reddit.com/r/Basketball/comments/1aqhv9/made_this_for_work_got_me_even_more_pumped_for/,default,
1363564515.0,1ahrai,I need your help with fighting zone defense reddit!,yteacher,8,2,15,"I've been playing in an amateur weekly basketball league and I've become down right frustrated with playing against a 2-3 zone.  My team is made up of all street ball players so we don't have a strong understanding of organized play

So how do you fight a 2-3 zone?  Are there videos I can watch or things that I can read about it?


I play a PF/C.  ",self,t5_2qhsv,False,,,True,http://www.reddit.com/r/Basketball/comments/1ahrai/i_need_your_help_with_fighting_zone_defense_reddit/
1362874072.0,19zwk9,Basketball shoes that increase jumping height?,averageatsoccer,9,3,11,I've never had basketball shoes so I don't know too much about them. I have a Nike gift card so I was wondering if anyone had opinions on nike bball shoes.,t5_2qhsv,True
1362401617.0,19mw0k,Half court shot with .1 seconds on the clock to win a state championship,ayb,10,5,2,,t5_2qhsv,False
1360454731.0,187wzv,"I've just started coaching a bunch of 8 years old, anyone got any good ideas/drills to do? They're pretty new so I want to start with the basics.",kackelur1337,10,3,http://www.reddit.com/r/Basketball/comments/187wzv/ive_just_started_coaching_a_bunch_of_8_years_old/,self,
1359761119.0,17q2va,Bogut's inbounds defense. Word to your moms.,pointofinformation,11,3,0,,t5_2qhsv,False
1358962475.0,174rkm,"Hey r/basketball, what's your favorite play for a last second shot?",MaxwellsDaemon,7,0,http://www.reddit.com/r/Basketball/comments/174rkm/hey_rbasketball_whats_your_favorite_play_for_a/,False,
1358536234.0,16tyd1,Denver NUGS ;) ,Himynameisericteboul,10,4,3,,t5_2qhsv,False
1357869793.0,16cpyp,My foot arches cramp when I play basketball. Anyone know why?,NbBurNa,8,2,11,"I did get new shoes that are slightly big for me


thanks!",self,t5_2qhsv,False,,,True,http://www.reddit.com/r/Basketball/comments/16cpyp/my_foot_arches_cramp_when_i_play_basketball/
1357789389.0,16akn1,Youth B-ball accidental half court shot,burntheministry,8,1,1,,t5_2qhsv,False
1357572651.0,164flu,"Caron Butler. NBA All Star, father, semi-reluctant Twilight fan and all around great guy. ",pjquinn76,19,2,False,
1357001694.0,15r277,"How to do the ""FIGURE EIGHT"" Dribbling Drill - Shot Science Monday",ShotScience,8,2,3,,t5_2qhsv,False
1356775015.0,15mbk6,A video of me and my friends dunking around. ,chiefff,13,6,8,,t5_2qhsv,False
1356581957.0,15i3mm,Basketball work out partner,basketballdoesntslee,8,0,13,"Hi all at /r/basketball. Ive been playing the sport my whole life
Thanks all! Have a happy holiday season .",self,t5_2qhsv,False,,,True,http://www.reddit.com/r/Basketball/comments/15i3mm/basketball_work_out_partner/
1356070507.0,157qg8,Tips for highschool player?,tomthebomb53,7,0,17,I am a 6 foot 2 post player but I am benched most of the time. Any tips for getting more time in games?,t5_2qhsv,True
1355032887.0,14jbz8,Youth coaching help... I have a team of kids who are all stars... could be tough.,coachmecoach,7,1,8,"The draft went crazy lucky on my part. Normally each team has 1 or 2 players who need to be double teamed or at least need to be accounted for. But I have like 6 of 8 players that are ballers. Which is great but also brings in a dilemma.


My question is how do you get a team made up of players who are used to being the primary scorer



",self,t5_2qhsv,False,,,True,http://www.reddit.com/r/Basketball/comments/14jbz8/youth_coaching_help_i_have_a_team_of_kids_who_are/
1354764736.0,14d43q,"hey r/basketball i have osgood schlatters and it makes it really hard to play ball, any experiences or solutions?",estebandelasexface7,10,3,http://www.reddit.com/r/Basketball/comments/14d43q/hey_rbasketball_i_have_osgood_schlatters_and_it/,,False
1354577319.0,1488g4,MEET THE PASS (If you want the advantage)!! -- Shot Science Tip,ShotScience,9,3,6,,t5_2qhsv,False
1353197912.0,13dj2p,Defense Advice (High school basketball player trying out for the team),brillyx,8,1,8,"Hey /r/Basketball. I'm a junior trying out for my high school basketball team. Today we didn't have any try outs, I intercepted a pass, that leaves space open for good juniors to move up to varsity bench

But one thing is, the goal of it, was to make them use their weak hand. *I made the mistake of trying to block the right side but they went with their right anyways, which I'm still kicking myself in the butt for...*. Anyways, I had some trouble sliding with the person taking the ball to the hoop. Do you think I should have been backing up instead of sliding, or do you think my slides were too slow?

Also,False,self,t5_2qhsv,False,,,t3_13dj2p
1352660337.0,130qay,Suggest me some basketball shoes.,Herbiscuit,8,2,30,"I bought a pair of Lebron 8's last year mainly because they felt ridiculously comfortable in the shop and also because as a player I was a perimeter shooter who didn't move all that much. Now I've moved to a more defensive role and they feel clumsy and awkward to move quickly in.

So what sort of shoes would you guys recommend that aren't so heavy and are easier to move in? Are low cuts still the way to go? That recent bad luck Brian here freaked me a little.  ",self,t5_2qhsv,False,,,True,http://www.reddit.com/r/Basketball/comments/130qay/suggest_me_some_basketball_shoes/
1351824542.0,12hu5h,Gerald Green HEAD ABOVE THE RIM!,ShotScience,9,3,4,,t5_2qhsv,False
1351469029.0,128uzs,Looking for a jersey site for our leagues teams,pandapimpin,7,0,5,"I've done some searching on the internet and found an amazing amount of results i was just wondering if anyone on here has ordered jerseys off an online site? If so what site and how would you review the quality? Were looking to spend probably around 70 dollars on shorts and jerseys hopefully with team name

Thanks in advance

Sorry I`m actually Canadian.",self,t5_2qhsv,1351489054.0,,,True,http://www.reddit.com/r/Basketball/comments/128uzs/looking_for_a_jersey_site_for_our_leagues_teams/
1350350077.0,11jm97,Up and Coming Season,SPORTSandGAMEs4LIFE,9,1,9,I need some drill or something to get ready for the season. Im a Power Forward.,t5_2qhsv,True
1350348311.0,11jk8d,Worst free throws ever,Durant3535,9,2,0,,t5_2qhsv,False
1349846219.0,118lcl,"Kobe Bryant: “IF And When I Announce My Retirement, I Will Do So Directly To You”",BasketballYes,7,0,http://www.reddit.com/r/Basketball/comments/118lcl/kobe_bryant_if_and_when_i_announce_my_retirement/,http://b.thumbs.redditmedia.com/mnTAEkDj7Pj5-ryI.jpg,
1348956360.0,10onz0,Reading the defense on drives,MrPoopMouth,9,2,6,"I am 16 and play point guard or shooting guard (5'7"") and I am just wondering what advice any of you have on what to look for when driving. Is there anything I need to look for on the second level of defense? Getting past the first defender is fine but it seems like sometimes the help defense comes right away and other times I can get to the basket without resistance. Does this have anything to where the defenders are and what should I look for? Thanks!",t5_2qhsv,True
1348941320.0,10ob63,Sheeeeeeeeed!,the_green_glass_door,7,0,5,,t5_2qhsv,False
1347677171.0,zwrsr,"How can I become a better Shooting Guard, but have the ability to drive and to guard players effectively?",CP3toBlakeGriffin32,10,3,http://www.reddit.com/r/Basketball/comments/zwrsr/how_can_i_become_a_better_shooting_guard_but_have/,False,
1347429440.0,zr5h0,Thoughts on Hyperdunk 2012 Nike+ system.,SpoonyQuake,7,0,5,I just got a pair this past weekend and have worn them in several games the past few days. Honestly they are one of the best feeling shoes I've ever worn. Aside from that I'm really trying to find out other people's takes on the Nike+ system. From what I've gotten it is really interesting to see a breakdown of how you play. Amount of running vs. walking. Number of jumps and how high. I really believe it can be a an awesome tool for self-evaluation and I'm wondering what others have gotten from it.,t5_2qhsv,True
1345814853.0,yr3e2,Top 5 things a PG needs to have?,StewieGriffindoor,9,1,15,"Im thinking
1.Passing
2.Handling
3.Defense
4.Shooting
5.Stealing",self,t5_2qhsv,False,,,True,http://www.reddit.com/r/Basketball/comments/yr3e2/top_5_things_a_pg_needs_to_have/
1342827675.0,wwerb,Funniest thing you've seen in this game,Tadayoshi,8,2,2,"Could be about you or a friend or whatever.

I'll start. During our practices with my team, and it got right into the hands on one of the defenders. A guy in my team (on the offence) quickly shouts: ""Jonas! What are you waiting for? Put it in!"" And with a half-a-seconds hesitation, the defender with the ball turns to the basket and lays it in. We all lost it and started to laugh at him uncontrollably.",,False,self,t5_2qhsv,,http://www.reddit.com/r/Basketball/comments/wwerb/funniest_thing_youve_seen_in_this_game/
1340942201.0,vs215,David Stern needs the Hulkamaniacs,pointofinformation,7,0,1,,t5_2qhsv,False
1340504901.0,vibgg,Have You Ever Seen A Cartwheel Dunk?,SCHLAMPtheCHAMP,13,6,5,,t5_2qhsv,False
1339645520.0,v12wu,TIL NBA ref Bob Delay was once an undercover cop who infiltrated the New Jersey mafia,jatorres,7,0,0,,t5_2qhsv,False
1338730125.0,uik9a,"Lakers star hacked, FBI involved?",pdecola,7,2,http://www.reddit.com/r/Basketball/comments/uik9a/lakers_star_hacked_fbi_involved/,http://a.thumbs.redditmedia.com/Au-rwkMtyf87ho_f.jpg,
1335133922.0,sn7li,World Peace ejected for violent assault.,tbscotty68,11,5,3,,t5_2qhsv,False
1334342439.0,s8bjv,Just started a subreddit for NBA stats I thought you guys might be interested in,samlearner,7,1,0,,t5_2qhsv,False
1331874946.0,qz00i,"Oh Mississippi, you den of heathen bullshitters",dude_eronomy,8,0,http://www.reddit.com/r/Basketball/comments/qz00i/oh_mississippi_you_den_of_heathen_bullshitters/,http://f.thumbs.redditmedia.com/CHZTCXYCX4VwGGPA.jpg,
1331148543.0,qm4bs,Harden: Lock for NBA 6th Man Award,sjvear,7,0,0,,t5_2qhsv,False
1329398270.0,ps9a8,hitler hates jeremy lin,snapNGturtle,9,3,0,,t5_2qhsv,False
1329274924.0,pq53i,Jeremy Lin's Three Point shot winning against the Raptors ,screamingmonkeys,9,2,1,,t5_2qhsv,False
1327754204.0,p0fn5,"As you read this now, know that Kobe has taken almost 100 more field goals attempts than any other player this season.",Nwildcat,9,3,http://www.reddit.com/r/Basketball/comments/p0fn5/as_you_read_this_now_know_that_kobe_has_taken/,default,
1325557261.0,o0jv2,Ridiculous basketball full court shot,simeonthebruce,8,1,0,,t5_2qhsv,False
1325495815.0,nzmhw,Not Sure if Perverted... or just French.,soweallgrow,9,2,0,,t5_2qhsv,False
1323894837.0,nct1f,Pick-up Basketball vs. Organized basketball strategies,RobotBirdHead,9,2,13,"So I play full-court ball with a bunch of guys a couple nights a week at a high school gym. No league. No consistent teams. Basic rules. 

I'm a decent shooter and defender

I thought it would be cool to have a thread with some tips on (or links to) some basic offensive and defensive strategies that most streetball players use regularly,False,self,t5_2qhsv,False,,,t3_nct1f
1319809801.0,ls6e7,For the love of the game,GotItCoach,11,2,1,,t5_2qhsv,False
1316891696.0,kq8iw,This is my brother.  My brother can throw down.  Will post his recruiting video if interested.,CxDub1,8,3,10,,t5_2qhsv,False
1285125963.0,dh5yo,Who else is obsessed with John Wall as much as I am?,scottieee,7,1,7,,t5_2qhsv,False
1376997755.0,1kq6yk,Shaq does a Rodman for Halloween,DRowney,7,1,0,,t5_2qhsv,False
1376659655.0,1khipu,How do you get on one of these practice squads?,J-Ram,6,1,5,,t5_2qhsv,False
1376525246.0,1kdwbb,Preventing foot blisters?,Panthertron,8,1,14,"Hey guys

Aside from obtaining better footwear (already bought some hyperdunks that seem to fit better and offer much more arch support),False,self,t5_2qhsv,False,,,t3_1kdwbb
1376125286.0,1k2y70,Kid gets posterized!!!!,19905974561402199509,13,8,1,,t5_2qhsv,False
1375314138.0,1jgh9o,"""I ain't quittin'!"" Badass elderly women play in a bball league every week in Chicago.",lonicat,6,0,1,,t5_2qhsv,False
1375278755.0,1jf5g2,Steve Nash discusses his soccer tryout with Inter Milan (VIDEO),Commandant1,7,0,2,,t5_2qhsv,False
1373349122.0,1hx3dt,Wanting to launch a site reporting on Australian basketball. What should I call it?,arkie,6,0,12,"Hey guys

So the coverage of the Australian NBL is quite poor. I'm hoping to improve that with my website. I'm also wanting to report on the Australian national team as well as Aussies playing in the NBA.

I'm not really sure what to call the site! Most domains I can think of are taken like aussiehoops.com. I was thinking of aussiehops but I'm not sure. Perhaps a name that isn't actually associated with the words aussie

Anyway,False,self,t5_2qhsv,False,,,t3_1hx3dt
1373086305.0,1hqg1d,Best way to improve vertical?,Johnnyiso,15,7,10,,t5_2qhsv,True
1372609218.0,1hdbvo,Report: Chris Paul to stay with Clippers,Commandant1,9,2,8,,t5_2qhsv,False
1372115642.0,1h0204,Nerlens Noel faces pre-draft Critics,SubbyDoo,7,1,0,,t5_2qhsv,False
1371832338.0,1gsw9o,Stuff I Learn From Ten Year Old Basketball Players,AustinBasketballCamp,7,3,2,,t5_2qhsv,False
1371701140.0,1gpg1p,Andrew Wiggins dunks in KU camp game,harrynlloyd,6,0,4,,t5_2qhsv,False
1371656798.0,1gnt1p,#SignDreBaldwin : Getting Dre Baldwin into NBA Training Camp,Corey1845,9,3,1,,t5_2qhsv,False
1370956604.0,1g4a0f,Greatest Individual performances in NBA Post-season,Commandant1,6,0,1,,t5_2qhsv,False
1370878729.0,1g1srs,my best move (in painful detail). post yours if you'd like!,asdjmo,6,0,3,"As a gift, so I will be painfully thorough.  OK

**Get the ball in the post (step 0):** this is a post move.  Set yourself up 2-3 feet above the block.  Post up with your elbows out, even if they deserve to be.  

(I am going to assume you are on the left block from now on)

**Set up (step 1):** OK, maybe do a different move.  If you are too far out, take one dribble and use your body to gain some ground on your defender to get a little closer.  If you are in the sweet spot, don’t hesitate.  When you catch the ball immediately make a dribble with your left hand and then half spin to your left side, like a drop step left.  In this motion, you are dribbling and then dropping your left shoulder back while taking a small step toward the block with your left foot.  Imagine you were going to dribble, quickly fake left and then go right for a fade-away—this is exactly the action you want to do (minus shooting the fade-away).  This is effective for two reasons 1) you pick up your dribble.  Defenders are more likely to jump/bite on the fake if you pick up your dribble.  2) the jab left it really sells the shot fake.  Both are really subtle and the key is doing them quickly and smoothly.

**The fake (step 2):**  so you have dribbled

**The prestige (step 3):** you have done the shot fake and your defender is now jumping out of his shorts trying to block it (seriously this almost always works on the first time, it does expose the ball to the defender (also results in too much contact sometimes) but you should do this instead: reverse pivot on your right foot and spin back to the left with total disregard for human life.  You are undoing the steps that got you in the shot fake position, plus spinning a little bit more to get your body squared to go up for a layup.  The reverse spin also looks cooler and can be done faster and more gracefully.  The downside is you break eye contact with the basket but you be able to re-orient yourself quickly, especially with practice.  Now just make the damn shot!  

This works on every kind of defender.  I can usually feel when I am posting someone up, like he is ready to pounce.  I love doing this when I am guarding the best guy on the floor.  I am surprised how much it works against smaller guys, but they jump like crazy.  Bigger guys too--especially bigger guys, actually.  When you post up a bigger guy, you are like attacking his ego or something and he really wants to put you in your place.   A caveat is that when I do this move on guys that are 6’6 and over, some can fall for the shot fake and still recover to block the lay-up.  If the guy on you is really athletic and huge you may have to dribble, half-spin left, spin left

**TL;DR catch ball above left block in post, pivot right into shot fake, spin left, layup.  ‘Up and under with reverse pivot’**
",self,t5_2qhsv,False,,,True,http://www.reddit.com/r/Basketball/comments/1g1srs/my_best_move_in_painful_detail_post_yours_if_youd/
1370277953.0,1fl8ma,Question on traveling,wittyrandomusername,7,0,2,"For reference [here is the wikipedia entry on traveling](http://en.wikipedia.org/wiki/Traveling_%28basketball%29)

The other day I was playing in a pick up game, but it was a pick up game so I didn't argue.  Anyways, even if I did jump off of my non pivot foot, would that still be a travel?  I know you're supposed to get two steps, and most of the time that's when you're running towards the basket.  I don't know if it applies differently when your back is to the basket or if you don't dribble out of the post.  Most of what I've found doesn't address specific situations.  Granted I did dribble, but still.  So anyway if anyone can help me get some clarification here, I'd appreciate it.",False,,http://www.reddit.com/r/Basketball/comments/1fl8ma/question_on_traveling/
1370125401.0,1fhjg0,Rumors: Houston Rockets Place PF Robinson On Block In Order To Pursue Howard,Inscriber,6,1,8,,t5_2qhsv,False
1369921034.0,1fc2p4,Openly gay men's college basketball player on coming out,Commandant1,10,5,1,,t5_2qhsv,False
1369579617.0,1f2zay,Kravitz: Dwyane Wade should be suspended for elbow,Commandant1,13,7,3,,t5_2qhsv,False
1369446470.0,1f0aqh,Anyone have any suggestions on a solid basketball hoop in the 300-600$ range?,tdubs27,10,4,4,"Been looking online and at sporting goods stores but so far nothing has caught my eye. Dicks definitely had some nice hoops but their displays were a little wobbly

Edit: must be portable. ",self,t5_2qhsv,False,,,True,http://www.reddit.com/r/Basketball/comments/1f0aqh/anyone_have_any_suggestions_on_a_solid_basketball/
1368672914.0,1efez6,Brandon Roy Career Mix,mbarrow21,9,2,0,,t5_2qhsv,False
1368292570.0,1e4xcb,One of the darkest stories in international basketball.,uututhrwa,7,1,3,,t5_2qhsv,False
1368156471.0,1e1qes,5 most important aspects of SG's game,Raamsh,6,1,3,What are the five most important aspects of a 2 guard's game/what should they work and focus on?,t5_2qhsv,True
1368144151.0,1e1bka,best shoes to play in?,coasttocoastkid,8,2,11,I just received a gift card for footlocker and I wanted to get a new pair of shoes to play in. The price of the shoe has to be less than $200,t5_2qhsv,True
1367922373.0,1durj2,720° is so easy,leinad022513,7,0,5,,t5_2qhsv,False
1367673609.0,1dodb1,"Playoff Putbacks: Time for Celtics to trade KG, Pierce?",Commandant1,7,1,http://www.reddit.com/r/Basketball/comments/1dodb1/playoff_putbacks_time_for_celtics_to_trade_kg/,http://a.thumbs.redditmedia.com/BJhuweqjNv43xHil.jpg,
1367465999.0,1dj3j4,I want to play basketball but never been in a team before,HotNacho,6,0,11,I've always wanted to play basketball but I couldn't because of my weight in middle school. I am 14 yr old freshman and I weigh 155 and 6'1. Is there anything I can do to help me get better I'm alright in shooting and a decent defender. Also what can I do to jump higher or dunk.,t5_2qhsv,True
1366866104.0,1d2cjs,Best lunchtime meal for someone who plays a rugby game in the morning and a basketball game in the afternoon?,yummypuffcakes,8,2,7,"So from next week,self,
1366469906.0,1cqrek,"Celtics Confident, Whatever the Record. Hell ya!",celtics4life,7,1,http://www.reddit.com/r/Basketball/comments/1cqrek/celtics_confident_whatever_the_record_hell_ya/,default,
1365563824.0,1c1f42,What was your best basketball game ever?,KabyRabbi123,7,0,13,"And tell us why it was your best. 

(You can include stats,False,self,t5_2qhsv,False,,,t3_1c1f42
1362803305.0,19yfea,"Okay guys I didn't get the video but this will be on YouTube. Big sandy versus westby. 1.1 seconds left. Tied game. Full court pass, fadeaway three nothin but net. thunder wins. i call it right now.",Dr_StrangeClouds,9,2,http://www.reddit.com/r/Basketball/comments/19yfea/okay_guys_i_didnt_get_the_video_but_this_will_be/,http://a.thumbs.redditmedia.com/ttklyU6rrLVuKiuB.jpg,
1362360142.0,19lycv,Serge Ibaka punches Blake Griffin in the groin!!,avy88,10,2,2,,t5_2qhsv,False
1361815883.0,197c5g,New Basketball Player,Commanderghost,8,3,17,"Hello,,False
1361633564.0,192y7o,Lakers respond to Mark Cuban's remarks about Kobe being Amnestied,Commandant1,9,2,5,,t5_2qhsv,False
1361117225.0,18p19l,"Do ankle braces limit mobility on the court?
",0,11,http://www.reddit.com/r/Basketball/comments/18p19l/do_ankle_braces_limit_mobility_on_the_court/,"I'm looking to get a new pair of basketball shoes and I really like the feel of the Kobe 7's and 8's, but I'm kind of put off by the fact that they're low-top. I don't necessarily have a history of ankle injuries or anything, but I'd like to avoid them at any cost. So

Side note: If anyone has any suggestions on a better pair of basketball shoes,False,self,t5_2qhsv,False,,,t3_18p19l
1361076576.0,18oego,Bosh's 2013 All-Star Shoes,sportswiththree,9,3,1,,t5_2qhsv,False
1361033874.0,18n65o,"Help out nooby ""big guy""",zereal,7,0,12,"Hey guys Im a 6'1'' 220lb guy and i only have i recently been playing ball last year. I only play pick up games at the park or the gym with some friends. Im pretty decent with the post moves but still suck at it. My handles fairly decent, i have no idea what to do as offence or defence. Usually i just stand in one area until the ball comes to me and use my size to drive the ball in with some post moves that i come up watching others. Or i set up screens up top but when i get the ball i have no idea how to drive it in. Who should i watch in the nba to learn some low post moves

Thankyou!!",self,t5_2qhsv,False,,,True,http://www.reddit.com/r/Basketball/comments/18n65o/help_out_nooby_big_guy/
1360844943.0,18ie1p,Basketball 101,,8,0,12,"For a total noob. Up until recently

I know absolutely nothing about pro basketball. I used to play half-court sometimes after school

Should I just use wikipedia to figure out what each position entails? How can I learn more about tactics used? 

With football...I learned that by playing Pro Evolution Soccer everyday. I was a crappy player

Thanks!",self,t5_2qhsv,False,,,True,http://www.reddit.com/r/Basketball/comments/18ie1p/basketball_101/
1360596173.0,18b83a,"Knicks need to keep on shooting, and James Harden needs to defend better",max1mus91,7,0,http://www.reddit.com/r/Basketball/comments/18b83a/knicks_need_to_keep_on_shooting_and_james_harden/,http://a.thumbs.redditmedia.com/0N2yY7lXVnzD7856.jpg,
1360372490.0,1861rr,Quick question about the rules,clitmaster,6,0,4,"Scenario: 

Knicks are down by 1 and are fouling to send someone to the line
",self,t5_2qhsv,False,,,True,http://www.reddit.com/r/Basketball/comments/1861rr/quick_question_about_the_rules/
1359422372.0,17gspj,The SCISSOR DRIBBLE ATTACK!,ShotScience,7,2,0,,t5_2qhsv,False
1359246146.0,17cchp,"Vote for a fellow redditor for Best Girls Basketball Coach in San Antonio, Texas!",Stay_see,9,2,http://www.reddit.com/r/Basketball/comments/17cchp/vote_for_a_fellow_redditor_for_best_girls/,,False
1358001061.0,16fr15,"Rudy Fernandez, you're a SCUMBAG! - YouTube",Promitto,7,1,http://www.reddit.com/r/Basketball/comments/16fr15/rudy_fernandez_youre_a_scumbag_youtube/,http://b.thumbs.redditmedia.com/EP8l-puw5X0EXg2a.jpg,
1357521971.0,163bq8,anyone know where i can buy this?,RastafariPanda,7,3,5,,t5_2qhsv,False
1357372844.0,160021,Mental Problems (im not crazy FYI),SPORTSandGAMEs4LIFE,6,0,13,"Im gonna keep this short.
Im 6'2 and a freshman. I use to be a starting post, heck ive lately dribbled the ball good too. The frist game of the season i started and did good, since then ive progessively gotten worst and worst. To put the icing on the cake i even had a back problem that kept me out for 3 weeks .(back spasms and something else the doctor said). To sum it up i just dont feel the same any more out there. And the varsity coach is telling me that he hates watching me play and he is getting into my head . I know its very early in my life but i love basketball . I just want to play like i used to . So anything will help. Thank you.",,False,self,t5_2qhsv,,http://www.reddit.com/r/Basketball/comments/160021/mental_problems_im_not_crazy_fyi/
