created_utc,id,title,author,ups,downs,num_comments,selftext,subreddit_id,is_self
1361488660.0,18zh4s,Tips,tomthebomb53,6,0,8,What are some tips for playing that not many people know but everybody should know?,t5_2qhsv,True
1361470015.0,18ysga,Do I have potential?,Jaceanator,11,6,7,"Hi all
Thanks for any tips/comments.",self,t5_2qhsv,False,,,True,http://www.reddit.com/r/Basketball/comments/18ysga/do_i_have_potential/
1361259874.0,18t386,What do i do against a bigger guy then me?,zereal,5,0,12,I play as a big guy 6'1'' 220 lbs and i can do some post moves in low post alright but when i go against someone much bigger than me and taller than me i get no baskets no rebounds since he can block my shots or just box me out complelty. What do i do against someone like this? I cant move them and im also not as fast.,t5_2qhsv,True
1360959952.0,18lklv,TIL NBA stats have been tracked since 1946. Here are the league averages for every season since then.,Furmz,8,2,3,,t5_2qhsv,False
1360825040.0,18i31o,Anybody know the release date for the Li-Ning Way of Wade in the United States?,gotham7,7,3,2,,t5_2qhsv,False
1360553053.0,18abwl,The Height of Wonkery: An In-Depth Look at the NBA With the Most Innovative Technology Available,Commandant1,6,0,2,,t5_2qhsv,False
1359327616.0,17e5ld,Need help identifying model of jordan shoe. Comment if you know it. ,Rsimps,7,2,7,,t5_2qhsv,False
1359225471.0,17bq71,"So lately I've been ice cold. I don't know what I'm doing wrong, but shots that I never miss just aren't falling. I've been missing catches, jump shots, and even layups. Any advice?.",Dr_StrangeClouds,1,,False
1359181047.0,17ayus,Five NBA Players Deserving of More Minutes,CJKPTP,6,2,4,,t5_2qhsv,False
1358274619.0,16mpz6,I think this is pretty cool. Do you?,bro_calm_down,5,0,2,,t5_2qhsv,False
1357357650.0,15znff,What's softer than bedsheets after using downy ultra-soft?,RastafariPanda,16,10,2,A low-post battle between Pau Gasol and Andrea Bargnani,t5_2qhsv,True
1357150313.0,15u420,"What I Want UNC Coach Roy Williams To Say To Andrew Wiggins
",0,1,http://www.reddit.com/r/Basketball/comments/15u420/what_i_want_unc_coach_roy_williams_to_say_to/,,,False,t5_2qhsv,False
1356857988.0,15o1n1,Good indoor/outdoor basketball?,WowYoureNotDead,6,0,5,"I'm new here so sorry if this has been asked before. 

I'm looking to get a new basketball

Target has the Spalding Elevation for $20. Does anyone have experience with this ball? Did the grip wear away quickly?

Thanks for the help r/basketball! ",self,t5_2qhsv,False,,,True,http://www.reddit.com/r/Basketball/comments/15o1n1/good_indooroutdoor_basketball/
1356814716.0,15n13y,My brother made 26 free throws in a row. Watch and enjoy reddit...,lukajlo24,11,8,12,,t5_2qhsv,False
1355647892.0,14xp9a,top ten basketball training exercises ,CaptainKey,7,0,2,"Squats
The squat is a functional exercise that trains the muscles in the lower body. The squat movement resembles the movement executed during jumps for rebounds or when making shots. To perform a correct squat
Sponsored Links
Basketball Training
Free PDF w/ 98 Training Drills For Scoring
www.BallersInstitute.com
Push-ups
Push-ups are another functional sport-specific exercise that trains a movement regularly seen in a basketball game. Increasing upper body strength with push-ups can improve passing and shooting ability. Start with your hands and feet on the ground
Lateral Line Hops
Agility and quickness are skills that are used to play defense or run down loose balls. Lateral line hops train ground reaction and footwork to improve agility and quickness. Stand next to any line on the basketball court and hop horizontally over the line as fast as possible for 20 seconds. Take a 10-second rest and repeat for another 20 seconds. Complete a total of eight rounds following 20 seconds on and 10 seconds off.
Sit-ups
Sit-ups can improve abdominal strength. Basketball players use their abdominals for core stability while running and playing defense. Start by lying on the ground with your knees bent and feet flat on the floor. Crunch your torso up towards your knees as far as you can go
Box Jumps
Jumping exercises can improve rebounding and jump shots. Set a box about 20 inches off the floor and stand next to the box. Jump explosively and land on top of the box. Either step down or jump down to the starting position
Lunges
Lunges can increase running speed
Shuttle Run
A basketball game is full of accelerations and decelerations as the players change directions. The shuttle run is designed to improve your defensive ability by teaching you to change directions quickly and powerfully. Start on a baseline and run to the closest free throw line, change directions and run to half court. Upon reaching half court, touch the line and run back to the baseline. Change directions at the baseline and run to the opposite free throw line. Touch the line, return to the baseline, touch the line and run to the opposite baseline. Touch that line and return to the starting point.
Jump Rope
Jumping rope can improve stamina
Pull-ups
Pull-ups are a classic upper-body exercise that is sport-specific to basketball. They train nearly every muscle in the upper-body
Deadlift
Deadlifts can increase lower-body strength that will result in stronger box-outs to obtain more rebounds. They can also increase your vertical jump by training the major muscles involved in jumping. Set the deadlift bar at a weight that is challenging for five repetitions and perform a total of five sets.
",self,t5_2qhsv,False,,,True,http://www.reddit.com/r/Basketball/comments/14xp9a/top_ten_basketball_training_exercises/
1354252410.0,141e2d,How can I stop getting blisters on my feet?! ,Dr_J,5,2,17,"I play basketball (for recreation) anywhere from 3-5 times a week. I wear different types of shoes and I have encountered this problem in about 3 different pairs. I get blisters on the both balls of my feet from rubbing the skin,self,
1353369833.0,13h9aa,How to Get Open and get the Ball!,ShotScience,8,3,0,,t5_2qhsv,False
1352666316.0,130w8c,Are there any good books or videos on Bball fundamentals?,,8,2,7,"Hi, but also the overall fundamentals of the game.

Do you know some good books or videos I can read/watch. ",self,t5_2qhsv,False,,,True,http://www.reddit.com/r/Basketball/comments/130w8c/are_there_any_good_books_or_videos_on_bball/
1352516045.0,12y3z4,Drills for JV Team,herpderpydoo,8,1,5,"I have volunteered to help coach a JV team for my old coach. He expressed how much he really wants me to get involved with the practices and help the players. It is a team of about 11 5th, while many are beginners. Anyone have any ideas that will help them? I want them to have fun too,self
1352499909.0,12xpp2,Basketball Courtvision - a visualization of where NBA players make their shots from.,imperator285,6,1,1,,t5_2qhsv,False
1352413203.0,12vpge,"Ankle issues, can anyone relate?",FiveDollarShake,6,0,http://www.reddit.com/r/Basketball/comments/12vpge/ankle_issues_can_anyone_relate/

I roll my ankle (either one) at least a few times through the year. Most likely 4-5. It all started early in highschool and although I've never actually broken an ankle or tore a tendon

It has felt worse lately. As in- I don't just roll them by accidently stepping on a foot

I wear high bball shoes (derrick roses) and have large legs (I've always read ankle injuries are a result of weak calves

Recently I purchased a 60$ ankle brace for the one foot after an injury and it feels really nice and secure. But just yesterday I rolled the other one! mother fucker! My question is- is there anyway to solve this without grabbing another brace for the other foot? 

I'm worried that the braces will just weaken my ankles even more and maybe I would roll them often doing other things (the gym

I've tried ankle strengthening excersises at the gym and that shit hasn't helped

TL:DR: My ankles keep giving out and have been doing more so lately. I love basketball and need advice on what has helped others and whether braces are a good idea?


Thanks guys,False,self,t5_2qhsv,False,,,t3_12vpge
1352309860.0,12t1v2,one of the kids in my HS literally breaks some ankles on this dribble,GhostlyEmployee,7,2,3,,t5_2qhsv,False
1350576107.0,11p0az,My grandfather played basketball in 1942 on an Army Air Corps team.,,6,1,1,,t5_2qhsv,False
1350411018.0,11kxyj,Does anyone know of any good shooting guard drill videos out there?,Iliveinthesouth,5,1,6,,t5_2qhsv,True
1350044242.0,11d1st,"Dunkers of r/basketball, how do you prevent injuries to your hands?",Refilon,6,1,http://www.reddit.com/r/Basketball/comments/11d1st/dunkers_of_rbasketball_how_do_you_prevent/, nothing to extreme, not rusted or anything. How can I prevent these injuries? 

Cheers.",self,t5_2qhsv,False,,,True,http://www.reddit.com/r/Basketball/comments/11d1st/dunkers_of_rbasketball_how_do_you_prevent/
1349903065.0,119tjx,"Brief analysis of Carlos Boozer, why this could be his year. ",Hakim123,7,1,http://www.reddit.com/r/Basketball/comments/119tjx/brief_analysis_of_carlos_boozer_why_this_could_be/,http://f.thumbs.redditmedia.com/vA5Fn7wI-IvqEJeS.jpg,
1349498443.0,1113fv,XBOX360 NBA2K13 Reddit Online Association! Spots Left! Please Join!,coleson,6,1,3,"Alright

It's a private league

Search - RUN N GUN

Password - whitemamba

League ID - 17789

fantasy draft scheduled for 11:30pm monday

Spots taken:

Cavaliers (SpareRhyme)

Clippers (KV Victum)

Magic (C0LES0N)

Pistons (JJmaster 922)

Rockets (AlKeefe)

Suns (rfgm37)

Wizards (coaltrain2371)",self,t5_2qhsv,False,,,True,http://www.reddit.com/r/Basketball/comments/1113fv/xbox360_nba2k13_reddit_online_association_spots/
1349480729.0,110p6e,Blake Griffin Shows Up His NBA 2k13 Avatar,SportsBro,5,1,0,,t5_2qhsv,False
1349454681.0,10zytz,NBA Predictions: Players That Will Lead The League In Flopping Fines,BasketballYes,6,2,3,,t5_2qhsv,False
1349128966.0,10s7m0,Sports Writer Challenges Bill Simmons to a Game of 1v1 to 11...and spots him 10 points. ,,8,4,1,,t5_2qhsv,False
1348071967.0,1054mp,Carrying/Discontinued Dribble Rule Clarification,trogdor5,6,0,5,"I've been practicing dribbling lately and I can't tell what exactly is a carry and what isn't. Let me be clear, especially in a crossover.

I've been told that one should never put his hand underneath the ball

Any help would be appreciated. Also

Thanks!",self,t5_2qhsv,False,,,True,http://www.reddit.com/r/Basketball/comments/1054mp/carryingdiscontinued_dribble_rule_clarification/
1347264506.0,zn7ne,Can't finish,alowaish,6,0,5,"For the life of me,False,
1346177766.0,yz1ql,What are pickup games like in your neck of the woods? ,utardjazz,5,0,11,"I'm in Utah

The first 5 to hit free throws makeup one team

As far as rules go

With the older crowds, but most younger folk disagree. Also with the older crowds your team is guaranteed a 2 on 1 off rotation so everyone gets equal playing time. You also must bring two shirts/jerseys, one light and one dark. ",,False,self,t5_2qhsv,,http://www.reddit.com/r/Basketball/comments/yz1ql/what_are_pickup_games_like_in_your_neck_of_the/
1346177276.0,yz15l,Time to brag: what's been your best performance to date?,inkoso,8,1,19,"Mine was at our local YMCA.

5 on 5, but i was hanging out around the 3, and kept getting open. 

Best part was i hit a contested 3 pointer for the win; so contested that the guy pretty much landed on me when he came down. felt absolutely amazing when he walked off pissed as fuck because he couldn't do anything about it.

What's been your best game so far?",self,t5_2qhsv,False,,,True,http://www.reddit.com/r/Basketball/comments/yz15l/time_to_brag_whats_been_your_best_performance_to/
1346111290.0,yxjwi,What shoes have been your favorite so far? I'm trying to figure out my next pair.,inkoso,7,2,21,"Currently

I'm an Adidas guy, and i had trouble finding a pair for a decent price, i'm wondering what shoes adidas makes now are the best.

I like to play in the post, it makes me feel like i'd roll my ankle in a second), and of course looks.

What have been your favorite pair,False,self,t5_2qhsv,False,,,t3_yxjwi
1345330163.0,yg438,Any tips on shooting?,bmkid1,6,0,10,"I used to be pretty good at shooting,,False
1343236721.0,x51x1,One of the Best Basketball YouTube series is back!,jdamon96,7,2,1,,t5_2qhsv,False
1342733106.0,wu79w,Remember me buddy,DKBB,10,4,0,,t5_2qhsv,False
1342550991.0,wpqyi,My pictures from the USA vs Brazil game last night in DC.,dkwince,6,3,2,,t5_2qhsv,False
1342065014.0,wfa07,Kyrie Irving is dirty,DKBB,5,0,2,,t5_2qhsv,False
1340726169.0,vmu36,A Letter to the 2012 NBA Season,mceagle611,7,2,1,,t5_2qhsv,False
1340289739.0,vdsq5,Uncle Drew on Devour.com,PPCwarren,6,1,0,,t5_2qhsv,False
1340024942.0,v80sg,Adidas Stupidly Light vs. Adidas adiZero Shadow,PPpwnz,6,3,6,"I'm considering buying a pair of either the [Stupidly Lights](http://www.footaction.com/product/model:164634/sku:149613/adidas-stupidly-light-mens/white/black/?cm=GLOBAL%20SEARCH%3A%20KEYWORD%20SEARCH#sku=149611) or the [adiZero Shadow](http://www.footaction.com/product/model:171203/sku:147527/adidas-adizero-shadow-mens/white/blue/?cm=GLOBAL%20SEARCH%3A%20KEYWORD%20SEARCH#sku=156564) sometime soon,,False
1339510683.0,uxy7i,NBA Finals Preview : Thunder vs. Heat Series Guide,mceagle611,8,2,0,,t5_2qhsv,False
1339298096.0,uu3gv,Funny Shane battier tongue,Gaba_Fiend,10,4,0,,t5_2qhsv,False
1339221513.0,usue0,Harlem Globetrotters,somefreedomfries,13,9,0,,t5_2qhsv,False
1338149001.0,u7nia,KY hoops fan uses cereal to make a portrait of Anthony Davis ,therealatri,7,2,1,,t5_2qhsv,False
1336405237.0,tba6c,Embarrassed at the thought that I am getting old and still trying to hang with young kids playing basketball.,JPMessiah,7,2,7,,t5_2qhsv,False
1335144712.0,sngly,The Ultimate Guide to Criticizing LeBron James,mceagle611,5,0,3,,t5_2qhsv,False
1334692587.0,sepra,Off Season Workout Program Suggestions,pseudostar04,6,1,5,"So I'm a college student looking for a good workout program with a basketball focus. Does anyone have any suggestions? I feel like this may be my last shot to become a great basketball player before I have to get an ""adult job"". Thanks in advance",t5_2qhsv,True
1334204986.0,s5od6,Brandon Roy 52 points vs Suns,Intangible6,7,1,1,,t5_2qhsv,False
1333954337.0,s0h6f,Why didn't teams see Jeremy Lin's potential?,GameRange,8,1,5,,t5_2qhsv,False
1333601230.0,ru748,Kentucky and the False End of College Basketball,djshampoooo,7,2,0,,t5_2qhsv,False
1332859606.0,rfw7n,Deron Williams is so underrated,DKBB,10,4,5,,t5_2qhsv,False
1332717394.0,rdbnw,Mark Cuban Sits Lamar Odom Down For A Talk.,DeeDee1971,7,2,0,,t5_2qhsv,False
1332356927.0,r75es,The biggest flop ever in the history of basketball! ,Sportando,8,2,3,,t5_2qhsv,False
1332292452.0,r60pt,LIVE: More free codes for all-platform NCAA March Madness Access (just fill out everything bogus),blacksunseven,5,0,1,,t5_2qhsv,False
1330908647.0,qhuh0,Miami Heat lose their composure in key loss against the Los Angeles Lakers.,soundking,6,3,2,,t5_2qhsv,False
1330758026.0,qfnrv,Wilt Chamberlain scores 100 points!!,chambersohio,6,0,1,,t5_2qhsv,False
1327418510.0,ouiva,"""The Other Dream Team"":  trailer for movie about the *third*-place squad in the '92 Olympics.  Lithuanian blood, sweat and tears, Don Nelson jr., Bill Walton, *and* the Grateful Dead all appear",6,,t5_2qhsv
1327104847.0,opklg,LeBron James runs over Marlins owner Jeffrey Loria,Jacobs30,7,2,0,,t5_2qhsv,False
1326393607.0,oe7yp,Mavs' Carlisle ejected after back-to-back techs ,TomCat1022,8,3,1,,t5_2qhsv,False
1325745626.0,o3nt2,Incredible Faried Dunk,alioh,5,0,0,,t5_2qhsv,False
1325502276.0,nzojj,1994 Australian NBL Basketball - LONG BOMB - Matt Earp - Perth Wildcats (rare footage),,5,0,0,,t5_2qhsv,False
1323718615.0,n9yrd,"Chris Paul-to-Los Angeles Clippers trade dies; price too high, sources say",motang,6,0,http://www.reddit.com/r/Basketball/comments/n9yrd/chris_paultolos_angeles_clippers_trade_dies_price/,http://d.thumbs.redditmedia.com/H8HOsAXcw1k7cbrW.jpg,
1323391336.0,n5l1f,La Lakers Trade Pau Gasol &amp; Lamar Odom for Chris Paul!,vp42,8,3,7,,t5_2qhsv,False
1323047427.0,n0etc,Fishing pole basketball shot with the Harlem Globetrotters. ,,8,2,0,,t5_2qhsv,False
1322790487.0,mwxm7,How to improve at basketball?,thedudelol,5,1,19,"I'm looking for in depth info at how to get better at basketball. Drills

Anyway to build confidence also? I guess just keep playing... but I'm just sick of losing :(.",self,t5_2qhsv,False,,,True,http://www.reddit.com/r/Basketball/comments/mwxm7/how_to_improve_at_basketball/
1322315203.0,mpux5,"With the NBA lockout over, it's time to get to work: ranking the 2011 NBA free agents.",foxyjj,5,0,http://www.reddit.com/r/Basketball/comments/mpux5/with_the_nba_lockout_over_its_time_to_get_to_work/,http://c.thumbs.redditmedia.com/-ZR5asaaZEnMt50h.jpg,
1322149157.0,mny45,2001/12 NCAA Dunk of the Year Candidate: Eric Griffin's (near) free throw line takeoff on a defender.,foxyjj,5,0,1,,t5_2qhsv,False
1318650099.0,lctty,Cloud 9,msgbonehead,7,2,1,"So I just got to shoot some hoops with Dwade, I didn't know who else to tell so I decided to tell reedit. Cloud 9 baby. ",t5_2qhsv
1317053404.0,krxis,Jay-Z: New Jersey Nets to become Brooklyn Nets,dtdtroll,6,2,1,,t5_2qhsv,False
1316442103.0,kkhoc,Kobe Bryant and Lebron James to offer loans if lockout continues?,,6,2,0,,t5_2qhsv,False
1315230171.0,k5blf,LeBron James in China: NBA Stars Visit Overseas Fans as Lockout Looms,brankam,7,1,0,,t5_2qhsv,False
1312377586.0,j7p72,The idiocy of the NBA lockout in cartoon form,silvsy18,5,0,0,,t5_2qhsv,False
1309856675.0,ih1fc,Anybody got some workouts for centers that they can share?,Adytzah,5,0,15,"First of all


Just tips are also good, and so on. Preferably gym-related since I won't have a lot of places I can practice basketball drills because we stop practicing until september, but I'll try my best.
I play center(2.10m/6'11"" height and 140kgs/310 pounds weight) for the local under-18/19 teams and I'm gonna play for the 2nd division team soon. Recently started working out at the gym, but who can jump almost 3 feet and play the same position. Also, what about those weights you put on/above your ankles? I've read somewhere that they cause more damage than do good when it comes to strengthening your legs but I can't help but wonder why everyone is wearing them if they're so bad.
Some low-post moves would also be very helpful. I rely a lot on a pump fake and after that a hook shot from the outside, I don't have a lot of time to think my move through so I just go with the hook-shot after I back down into the defender a bit. My coach isn't helping at all, he's not teaching me anything(except for how to drive from the high-post after he realised I could be pretty unstoppable if I kept doing it), and I can't really limit myself to just 2 moves on offense for scoring(save for the occasional putback after an offensive board). I feel that because of my bigger size and weight, most of the local defenders won't stand a chance when I start backing down, and they don't do either. The problem is finishing around the rim. I can get to it with ease, but I can't finish the play.
The last thing that's been bugging me is a pretty common problem: free-throw shooting. I have a good release, I'm shooting 40-50% on a normal day and 60% on a good day). I've considered shooting underhand, like Rick Barry used to, and I even found a youtube video of him teaching how to do it(can't say I ever tried to do so. it just seemed so weird). I personally wouldn't feel any shame or anything shooting like that. After all, who can argue with how you shoot it as long as you're making most of your free throws? Anyway, I'd love an opinion regarding this style of shooting, if you can call it that(I know I should try it and see if it fits me well first

Thanks in advance
",self,t5_2qhsv,False,,,True,http://www.reddit.com/r/Basketball/comments/ih1fc/anybody_got_some_workouts_for_centers_that_they/
1305144905.0,h97gb,"RIP Robert ""Tractor"" Traylor",StvYzerman,5,0,0,,t5_2qhsv,False
1303221607.0,gtljc,2010/11 College Dunk of the Year Tournament - the Elite Eight round. Vote now to help determine which dunks make out Final Four.,foxyjj,5,0,1,,t5_2qhsv,False
1298596385.0,fs7o8,Great moments in basketball - 1987: The Celtics' Robert Parish finally snaps and beats the crap out of Detroits Bill Laimbeer.,KazamaSmokers,6,2,1,,t5_2qhsv,False
1297884705.0,fmnzc,"This Day In Sports History: 19 years ago today, the Lakers retired Magic's #32",Robbo1234,6,1,http://www.reddit.com/r/Basketball/comments/fmnzc/this_day_in_sports_history_19_years_ago_today_the/,http://thumbs.reddit.com/t3_fmnzc.png,
1296230447.0,fas97,Big Coach In The Little Gym,AlbinoTunalips,6,0,0,,t5_2qhsv,False
1294895165.0,f1d60,Video montage: top 100 dunks of all time.,flippinkittin,6,1,2,,t5_2qhsv,False
1292429642.0,em9z2,"Led by Derrick Rose and Joakim Noah, the Chicago Bulls are coming together",gusbustafunk,5,0,http://www.reddit.com/r/Basketball/comments/em9z2/led_by_derrick_rose_and_joakim_noah_the_chicago/,http://thumbs.reddit.com/t3_em9z2.png,
1284143752.0,dc6v6,Rich Cho becomes NBAâs first Asian American GM,pezboy82,7,1,1,,t5_2qhsv,False
1264375415.0,ato4t,The Daily Dunk is a new feature on The Hoops Manifesto where we search the many corners of the internet to find the best dunk videos to save you the time and trouble.First up:Damien Wilkins on Nenad Krstic.,foxyjj,5,1,1,,t5_2qhsv,False
1376180288.0,1k48uq,as many free throws as you can hit in 1 minute - $100 (LIVE NOW),beatyourrecord,7,1,4,"Hey r/basketball

My friends and I just launched a mobile app to allow people to compete in  physical games anywhere against anyone by recorded video! 

We really like basketball

So here's the deal: hit as many free throws you can in 1 minute and recording it using our app. 1 ball. You can have people help you rebound. Must be a public/legit court and ball.

$100 for 1st

Here's the app (only on Android at the moment): https://play.google.com/store/apps/details?id=com.BeatYourRecord

And here's the explainer video: http://www.youtube.com/watch?v=Z16hs5KmyM4 (yes

Here's a sample recording we made: http://www.youtube.com/watch?v=oL0NRUA_e9w

Would love it if you guys gave it a shot. As many attempts as you like. It's in 'beta'

Thanks for reading!",self,t5_2qhsv,False,,,True,http://www.reddit.com/r/Basketball/comments/1k48uq/as_many_free_throws_as_you_can_hit_in_1_minute/
1375735411.0,1jrj1e,"These Guys Are Outworking You! – 10,000 Hours",augie5390,9,5,http://www.reddit.com/r/Basketball/comments/1jrj1e/these_guys_are_outworking_you_10000_hours/,http://d.thumbs.redditmedia.com/i4JeQCLVf8B6MVHo.jpg,
1375591403.0,1jnyyu,Another Smallville 1 on 1 Game w commentator,V1F,7,3,4,,t5_2qhsv,False
1375219307.0,1jdk82,Rawle Alkins dunks on Luis Santos,NYCHoops,5,0,2,,t5_2qhsv,False
1374356580.0,1ipsry,SOCIAL MEDIA AND THE NATIONAL BASKETBALL ASSOCIATION,AustinBasketballCamp,6,1,1,,t5_2qhsv,False
1374351746.0,1ipnq0,Making the team? (Originally posted on basketballtips),thenomeer,5,0,2,"Hey reddit
I'm just going to get to the point. I REALLY REALLY want to play on the team next year. The problem is,"" team because I was injured for half of the season. Now when my school has open gyms, no one wants me on their team. As you can imagine, this probably doesn't give a good chance of making the team as the coach notices I'm not getting picked. Ive been working out with a basketball training coach in my area, but i dont know if thats enough.Can you guys give me tips?
Sorry for the grammar/usage errors... It's very late.",self,t5_2qhsv,False,,,True,http://www.reddit.com/r/Basketball/comments/1ipnq0/making_the_team_originally_posted_on/
1374329103.0,1ip0od,2 questions: dunking hand pain and listening to music while playing,Yeti60,4,1,21,"Hi folks

1) I'm just now developing the vertical to dunk.  I've been doing a lot of hiking and I think that might have given me the extra half inch of vertical and I can now dunk semi-regularly when getting a running start

2) I really like listening to music while shooting around by myself

",self,t5_2qhsv,False,,,True,http://www.reddit.com/r/Basketball/comments/1ip0od/2_questions_dunking_hand_pain_and_listening_to/
1374116833.0,1ij8pd,Split Allen Baseline,donthazemebrah,5,1,1,,t5_2qhsv,False
1373844758.0,1iayeu,Five NBA Players that would kick your a**!,LordsantosSK,16,12,9,,t5_2qhsv,False
1373769840.0,1i95qn,How to further improve my game,Atsuma,5,1,8,"I've been playing for almost 2 years now. I've been playing each week for about 16 hours
sorry about long post :3",self,t5_2qhsv,False,,,True,http://www.reddit.com/r/Basketball/comments/1i95qn/how_to_further_improve_my_game/
1373530995.0,1i2hx6,What do you think about my dunk mix? Just starting out,Duhoo,9,7,2,,t5_2qhsv,False
1373159946.0,1hs25o,Why Dwight Howard made the right decision for all the wrong reasons,LordsantosSK,11,6,6,,t5_2qhsv,False
1372974375.0,1hnobc,Reports: Tyreke Evans to New Orleans in three team trade.,Commandant1,5,0,1,,t5_2qhsv,False
1372347648.0,1h6mih,Tim Hardaway Jr. could be draft night surprise,Commandant1,4,0,1,,t5_2qhsv,False
1372253553.0,1h3u3v,Danny Ainge of Boston Celtics stunned by Doc Rivers going to Los Angeles Clippers,robert32907,10,8,0,,t5_2qhsv,False
1372209571.0,1h2tdp,so how long did it take you before you could dunk?,zereal,4,1,13,What muscle specifically should i be training? I want to get hops just so i can block shots and get boards really easily. Whats theBest way to get this? ,t5_2qhsv,True
1372088472.0,1gz27t,Would the media have been more happy with a LeBron loss?,bobloblawlawblog101,4,1,2,"Let's face it, is the media kind of bored in a way by LBJ's victory?",t5_2qhsv
1371849010.0,1gthyx,Dumb dino gets confetti stuck in his mouth during Heat celebration.,Ch33fKeith,28,25,0,,t5_2qhsv,False
1371831519.0,1gsv80,Watch Drake get blocked from Miami Heat locker room,JoeAllan,4,2,0,,t5_2qhsv,False
