created_utc,id,title,author,ups,downs,num_comments,selftext,subreddit_id,is_self
1360028573.0,17wl6b,Bulking up for Basketball?,ts159377,12,1,33,"Hey guys, etc. Also

EDIT: Thanks everyone for your replies/advice! Very much appreciated. I look forward to many more discussions in /r/Basketball,,False,self,t5_2qhsv,1360121603.0,,True
1357537350.0,163syq,How to gain confidence when playing,PinkBobby007,15,2,10,"How do i gain confidence in dribbling? When anywhere but a pickup game with my friends,False,
1357490903.0,162dnd,25 Years Ago: Pistol Pete Maravich Dies at 40,bruce_the_butcher,14,4,3,,t5_2qhsv,False
1355516638.0,14uygc,Point/shooting Guard Questions/Workout?,PenguinLovers,13,1,6,"TLDR; Kinda chubby

So I'm trying to get better (a LOT better) in order to play in an intramural basketball league at my college. I'm a short guy, but not the point where I'd like to be. I'm kind of a chubby guy, but I'm still able to keep up with everyone on the court so I'm not insanely out of shape.

Basically

Also

Sorry for all the newbie question guys

EDIT: I found this earlier and was thinking about using a hybrid of the soccer/basketball training regimens. Would that be fine? http://www.bodybuilding.com/fun/paul3.htm

EDIT2: A friend of mine also recommended me to use the vertical jump bible and the layout plan in there and just incorporate 2/3 compound upperbody workouts. I'll wait and see what the redditors say first before choosing anything however. ",self,t5_2qhsv,1355521218.0,,,True,http://www.reddit.com/r/Basketball/comments/14uygc/pointshooting_guard_questionsworkout/
1351609553.0,12c9au,My Hoop Champ for iOS.  Basketball player stat tracking utility.,fifthrig,17,4,4,"I created this app in my spare time to track my kids' basketball games.  

It is free.  

I'd appreciate any feedback on the app and suggestions for improvements and new features.

https://itunes.apple.com/us/app/my-hoop-champ/id551531305?ls=1&amp;mt=8",self,t5_2qhsv,False,,,True,http://www.reddit.com/r/Basketball/comments/12c9au/my_hoop_champ_for_ios_basketball_player_stat/
1351553015.0,12b0ry,What's a GOOD SHOT?! Some quick tips from Shot Science,ShotScience,17,3,0,"Hey guys! This is our advice on choosing a good shot in a game. After you've gotten some experience with these guidelines

Video: http://www.youtube.com/watch?v=xJMiTiemJn0

Blog Post: https://plus.google.com/u/1/104819408694472654289/posts/XcF8UGdfkNj
",self,t5_2qhsv,False,,,True,http://www.reddit.com/r/Basketball/comments/12b0ry/whats_a_good_shot_some_quick_tips_from_shot/
1348856845.0,10mpms,Bikini Basketball League Gearing Up For Inaugural Season,MaineEvent,15,1,0,,t5_2qhsv,False
1348038468.0,104juv,Which one are you?,joreclros92,14,1,13,,t5_2qhsv,False
1345614083.0,ymhf8,"Whose signature is this?  It's on a ball signed by Shaq, Magic, Kobe and Abdul-Jabbar.",XScotX,13,8,False,
1345216130.0,ydo5i,Farewell Iguodala  | Stoop Sports,StoopSports,15,5,1,,t5_2qhsv,False
1344320361.0,xt7wl,IAMA 15 year old basketballer who recently got selected for the u17's Australian squad. Need tips.,Miscaaba,12,0,19,"I turned 15 years old this year, they have told me what they expect of me. This includes playing outside aswell as inside,False
1342094961.0,wfrsr,A new arrival explores New York through pickup basketball (x-post from r/nyc),But_Wait_Theres_More,13,1,2,,t5_2qhsv,False
1336516787.0,tdolr,6th grader with insane ball handling skills. Future phenom.,Joeyfingis,14,2,5,,t5_2qhsv,False
1333657530.0,rv61b,Crazy dunk at 2:24!,EdwardParkk,28,15,0,,t5_2qhsv,False
1307504969.0,hubzb,Ever remember Jordan scoring 8 points in the NBA Finals?,TheResPublica,14,0,8,,t5_2qhsv,False
1306752289.0,hnegi,"Click on the court location, it shows you a youtube video of the famous shot. Pretty damn cool. I've been looking at it for over an hour.",estrtshffl,15,2,http://www.reddit.com/r/Basketball/comments/hnegi/click_on_the_court_location_it_shows_you_a/,http://thumbs.reddit.com/t3_hnegi.png,
1290469106.0,ea7om,"NBA player visualization created by mapping player statistics to physical attributes of simple, cartoon, caricatures.",nomdeweb,13,0,False,
1376857430.0,1kmfxc,Before Anthony Davis Trademarked It,Flying_Burrito_Bro,15,3,0,,t5_2qhsv,False
1376661682.0,1khkpx,"Finally, A Ball Handling Drill That Gives You Ball On A String Handles...",augie5390,15,4,http://www.reddit.com/r/Basketball/comments/1khkpx/finally_a_ball_handling_drill_that_gives_you_ball/,http://a.thumbs.redditmedia.com/qMUZSftd1E0wj8Er.jpg,
1375318381.0,1jgmen,"Anna Wilson, younger sister of Seattle Seahawks QB Russell Wilson, gets full basketball scholarship to Stanford",SGMD1,13,0,False,
1373905932.0,1icj8h,How to heal a jammed finger from basketball?,kash1080,12,3,11,"I know we are supposed to give it time and occasional ice doesn't hurt either. I was wondering if there was anything else r/basketball suggested to do. 

EDIT: Thanks everyone for the advice. I really appreciate all of them. I wish I could thank you all individually without looking like a complete dork. Hopefully it heals quickly and I can play again soon. Thanks again!",self,t5_2qhsv,1373990223.0,,,True,http://www.reddit.com/r/Basketball/comments/1icj8h/how_to_heal_a_jammed_finger_from_basketball/
1373572330.0,1i3q0i,Me the summer before my Jr. year in high school. Totally forgot about this video. Huge nostalgia for me. Excuse the awesome quality of the video taken with the 1st Motorola Razor ever.,J-Ram,14,2,2,,t5_2qhsv,False
1373142327.0,1hrkc2,Help me find the video pls :),piddel,13,3,2,"hey
a year ago two asians dudes started a documentary on how they tried to get a scolarship and become a nba player in the end... they published a new video every 1 or 2 weeks on youtube and even had a decent coach to practice.
It was really cool to watch but somehow i lost track and now i dont know how it was named :(

Maybe someone can help me with it,False,self,t5_2qhsv,False,,,t3_1hrkc2
1372460495.0,1ha2g8,Doc Rivers' Son Bashes Bill Simmons On Twitter During NBA Draft,robert32907,19,6,2,,t5_2qhsv,False
1371302694.0,1gecpt,Top 10 NBA Buzzer Beaters Of the Past 2 Years,NotTMLTalk,15,3,0,,t5_2qhsv,False
1370372975.0,1fo416,Dwyane Wade's sweet crossover dunk in game 7 of the ECF.,dynamicDERP,16,5,4,,t5_2qhsv,False
1368208937.0,1e2y3s,"Knicks' Smith fined $5,000 for flopping",JoeAllan,12,1,http://www.reddit.com/r/Basketball/comments/1e2y3s/knicks_smith_fined_5000_for_flopping/,http://a.thumbs.redditmedia.com/cnvMplmitrdxHd4T.jpg,
1367280346.0,1ddizy,2013 - Stephen Curry - The Breakthrough [HD],JColeykins,13,1,1,,t5_2qhsv,False
1366183308.0,1ciqm2,Damian Lillard Rookie Mix HD,mbarrow21,14,2,1,,t5_2qhsv,False
1364677924.0,1bblf8,"I love playing basketball, but is it too late for me to start?",,12,2,http://www.reddit.com/r/Basketball/comments/1bblf8/i_love_playing_basketball_but_is_it_too_late_for/,,False
1364235130.0,1azj0f,Pass through four players (MGoBlog special),FluidHips,14,5,2,,t5_2qhsv,False
1362368551.0,19m89r,MOST INSANE BASKETBALL FINISH EVAR!,FartsMcMasters,14,3,4,,t5_2qhsv,False
1362215390.0,19il4b,Why LeBron may never reach Jordan's legacy,huskers37,17,6,7,,t5_2qhsv,False
1362072940.0,19emru,Monta Ellis sinks ridiculous game-winner for the Bucks over the Rockets,trueslicky,12,1,1,,t5_2qhsv,False
1361484768.0,18zc2t,Efes basketball team gets surprised by their fans. Amazing video,,11,1,1,,t5_2qhsv,False
1360127783.0,17zf4w,NBA secret to Greatness: Weird Mouth Habits ,airdee62,16,4,1,,t5_2qhsv,False
1358001260.0,16fr5r,Carmelo: ,troll_face4-ever,12,1,0,,t5_2qhsv,False
1357506401.0,162u31,What do i need to do to dunk??,chaveto,11,0,12,"I am a D1 Track &amp; Field athlete in my 2nd year. 19 years old, how can i go about fixing that and what timeframe do you think i need to work within to be able to dunk? thanks a ton!",t5_2qhsv
1356340142.0,15d95w,Now this is what I call beautiful .....,Jtorres94,14,4,4,,t5_2qhsv,False
1355188711.0,14mzgo,How To Shoot a LAYUP! (One of our older vids... don't LAUGH!!),ShotScience,16,3,4,,t5_2qhsv,False
1354813321.0,14e2vp,pick up basketball pet peeves.  the people that can dunk like 1 in 50 times but routinely practice alley oops with their friends and miss all of them.,scrappydoofan,19,6,22,"link some what related.


admit it

",self,t5_2qhsv,False,,,True,http://www.reddit.com/r/Basketball/comments/14e2vp/pick_up_basketball_pet_peeves_the_people_that_can/
1349390297.0,10ymqm,Tryout Tips?,Nuqqets,13,2,12,"Tryouts are in 4-5 weeks for me,False,
1344571011.0,xz9mw,Dwight Howard Traded to Lakers,RatePublic,14,5,5,,t5_2qhsv,False
1343748771.0,xgb4t,Nike’s Sneaker Lineup for USA Olympic Basketball Team ,ninjatune,11,1,0,,t5_2qhsv,False
1339690999.0,v1u87,Trying to learn basketball from scratch,KreatorExodus,11,1,9,I'm 17 and I'm tired of always being the worst on the floor when my friends get a pickup game going. Assuming I'm a complete beginner where should I start/what should I do to get better at the sport. I've been trying to work on shooting recently but I know that there are a ton of other things I have to master as well.,t5_2qhsv,True
1332806807.0,rf187,Greatest to ever play the game. ,texanfury262055,13,3,1,"http://www.youtube.com/watch?v=Nln3jrIq8SI&amp;feature=related
A video I stumbled upon today,False,self,t5_2qhsv,False,,,t3_rf187
1331938637.0,r02o8,"Norfolk State 86, Missouri 84!",luckytiki8,11,0,http://www.reddit.com/r/Basketball/comments/r02o8/norfolk_state_86_missouri_84/,http://c.thumbs.redditmedia.com/hG-org8Ytcwow6Y8.jpg,
1331420810.0,qqtec,Ricky Rubio out for season,sjvear,12,0,2,,t5_2qhsv,False
1328651948.0,pf9ke,All I do is....,Bchinly,15,3,0,,t5_2qhsv,False
1324953445.0,nrs64,I did this today..,,12,1,1,,t5_2qhsv,False
1294958833.0,f1uo4,TIL: Only 4 NBA player have gotten Quadruple-doubles and the last one was in 1994,mondojay,11,0,11,,t5_2qhsv,False
1376681404.0,1ki91q,Most Clutch Shot You've Ever Shot,SwissCheez,10,0,17,"So,self,
1376356482.0,1k8ws5,Vertical Jump help?,bobcarlson,12,1,9,"Ok so im 5' 10"" and 15 y/o goin into soph year and I've got a little more than 3 months until the season starts. What kind of exercises or programs can I do that can make me gain enough inches on my vertical so that I can dunk? By the way I can grab the rim right with one hand as of now. My vertical right now is about 28-30 inches.",t5_2qhsv,True
1375649169.0,1jp5p7,Dwight Howard is NOT the best Center in the NBA,lookatamonkey,15,5,26,"Marc Gasol in my opinion is the best center in the NBA. His PPG and Rebs are lower

Anyways, comment, tell me why, and flame me to hell haha. 

http://onemanbreak.wordpress.com/",self,t5_2qhsv,False,,,True,http://www.reddit.com/r/Basketball/comments/1jp5p7/dwight_howard_is_not_the_best_center_in_the_nba/
1373899499.0,1icb4t,Clippers now Rule LA - Reilly,Commandant1,12,0,2,,t5_2qhsv,False
1373376175.0,1hxldg,On twitter Metta World Peace handles amnesty news like Metta World Peace,Commandant1,11,1,1,,t5_2qhsv,False
1370690861.0,1fx6sl,"No matter what they might've said later, when LeBron James told Erik Spoelstra he needed a rest at the start of the fourth quarter in Game 1 against the San Antonio Spurs, it came as a surprise.",robert32907,16,1,False,
1370188075.0,1fiu0r,NBA star Grant Hill announces his retirement,Commandant1,14,2,4,,t5_2qhsv,False
1368320878.0,1e5r0k,Stats app for pickup game,eitang,13,5,3,"Hi looking for a stats app (ios or android) for our pickup game. We switch teams all the time so pls take this into consideration when recommending an app.

Thanks!",self,t5_2qhsv,False,,,True,http://www.reddit.com/r/Basketball/comments/1e5r0k/stats_app_for_pickup_game/
1368059018.0,1dyvrs,"AAU tryouts tommorow, any tips for a amateur guard?",dynamicDERP,13,4,http://www.reddit.com/r/Basketball/comments/1dyvrs/aau_tryouts_tommorow_any_tips_for_a_amateur_guard/,,False
1367802720.0,1dripd,How can I improve my footwork in basketball?,smallbzman,10,1,13,"I used to ball a whole lot and it was almost natural for me

Anyone have some suggestion on things I can possibly do at home or at a gym to improve my foot work?

Thanks in advance",self,t5_2qhsv,False,,,True,http://www.reddit.com/r/Basketball/comments/1dripd/how_can_i_improve_my_footwork_in_basketball/
1367097416.0,1d8ihp,How do I get better at shooting?,AdiAir,13,4,20,"I am 13. Turning 14 in September. I am 5 11"" and I usually play Forward. Sometimes Center. I weigh 150. I am **really** good at Defense, I need to learn how to shoot! I clearly know that Basketball isn't all about shooting, or some drills. Please tell me everything that you got. Becoming a professional basketball player has always been my dream. Nothing that you say will be stupid. Please tell me all your tips! Thank you!



TL;DR: How do I shoot better? I suck.",self,t5_2qhsv,False,,,True,http://www.reddit.com/r/Basketball/comments/1d8ihp/how_do_i_get_better_at_shooting/
1367090908.0,1d8bah,"After 49 hours of trying, these guys finally got it down. [3:15]",grannyguy12,16,7,http://www.reddit.com/r/Basketball/comments/1d8bah/after_49_hours_of_trying_these_guys_finally_got/,http://b.thumbs.redditmedia.com/OM5wVbW4-p0MRVE1.jpg,
1366403797.0,1cp4wa,Report: Man Sues Derrick Rose For Missing 2013 Season,bline79,13,2,1,,t5_2qhsv,False
1365828122.0,1c95qw,10000 Hours - episode 3.5,demonraiser112,15,5,0,,t5_2qhsv,False
1365790528.0,1c7yib,Jack missed that 70 footer by 70 yards.,eazy_,12,3,0,,t5_2qhsv,False
1364895004.0,1bi887,Harlem Globetrotters 3/4 Court Shot Swish!,SamDunk91,12,1,0,,t5_2qhsv,False
1364800866.0,1bes77,Quick message from the mods about recent posts.,townie_immigrant,10,1,0,"Hey guys, it would be wise to consider marking it as NSFW.  Please do so for the sake of others even if your title is descriptive.  Thanks.",t5_2qhsv
1364753413.0,1bdaev,Found last week in an elevator of the Venetian Hotel in Vegas,Darwinsmonkey,12,2,1,,t5_2qhsv,False
1363665956.0,1aknw5,Hey Guys I need Help in The Low Post. ,dkrp,10,0,7,"I'm 5'11 220lbs

How do I score against these guys in the post. Usually I just try to out muscle the other people comparable to my height in the post. But with these tall guys it's much harder to do so. 

What do I do? Get stronger on my squat and deadlift? Learn more post moves/pump fake in the post more? I usually outrebound my friends

 I really enjoy being in the post and getting down n dirty so I have no idea how to improve my game. 

Any advice is appreciated /r/basketball. Thanks in advance. ",self,t5_2qhsv,False,,,True,http://www.reddit.com/r/Basketball/comments/1aknw5/hey_guys_i_need_help_in_the_low_post/
1361929616.0,19arhj,Bill Russell Jumping Over Guy From Just Inside the Free Throw Line,jdn212,14,3,0,,t5_2qhsv,False
1361411922.0,18xd3e,"Reports -- Thomas Robinson, 2012 No. 5 overall pick, dealt by Sacramento Kings to Houston Rockets",Commandant1,10,1,False,
1361228243.0,18s35r,"Even bosh couldn't believe it. He's like, ""noooo"". ",Jewdontknowme,17,6,http://www.reddit.com/r/Basketball/comments/18s35r/even_bosh_couldnt_believe_it_hes_like_noooo/,http://c.thumbs.redditmedia.com/Od1ktVlNYte8Wcfh.jpg,
1361033170.0,18n5hh,Usain Bolt Dunk,FinalSay,16,6,2,,t5_2qhsv,False
1360897474.0,18k58t,Help with vertical,ts159377,10,0,23,"I'm about 5'11"" and I reeeeeally want to be able to dunk. How should my lower body routine look? I'm open to all suggestions/advice...I'm super determined to dunk even though I know it'll take a lot of hard work. Thanks! :)",t5_2qhsv,True
1360331847.0,184ppw,NBA Changes Slam Dunk Contest Format - EAST vs WEST,Cdnhustler,12,1,3,,t5_2qhsv,False
1358809855.0,170o9t,How to do the JAB STEP ATTACK!,ShotScience,12,0,2,,t5_2qhsv,False
1358645626.0,16wn4t,"I need help finding good performance, wide basketball shoes.",genetic_jackhammer,10,2,http://www.reddit.com/r/Basketball/comments/16wn4t/i_need_help_finding_good_performance_wide/,False,
1357683803.0,167jgx,La La's Honey Nuts,jdknicks,20,10,3,,t5_2qhsv,False
1357302260.0,15y4ep,"Hey r/basketball, I am an aspiring 17 year old basketball player. I am not American I just want to make a living off of athletics. What can you tell me?
 ",7,19,http://www.reddit.com/r/Basketball/comments/15y4ep/hey_rbasketball_i_am_an_aspiring_17_year_old/,"Hey guys. I don't want to make millions of dollars just want to make a living off of this game I really enjoy. Hope that doesn't make me come off as a douche, I kind of did in r/fit. I am not american and I live in Europe. Other than practicing as hard as I can, getting in the gym

Edit: I play guard",self,t5_2qhsv,False,,,True,http://www.reddit.com/r/Basketball/comments/15y4ep/hey_rbasketball_i_am_an_aspiring_17_year_old/
1355676939.0,14y2mg,Basketball or Streetball - what's your game?,DariusG187,19,9,32,"Most of you probably are all about basketball so I guess it's a ""any streetballers here?"" post but yeah, Ball Up has the game though.",t5_2qhsv
1354446705.0,145bcf,Coaching?,tralfey,10,2,3,Is anyone familiar with how a career in coaching is started? I'd like to see how viable coaching is as a way to make a living and wanted to know the likelihood someone intelligent/diligent can make an okay living off coaching. Are there ways to get your name out there (such as coaching a team to victories) that could potentially land you another job?,t5_2qhsv,True
1353016127.0,139g0p,"With the start of HS Basketball here, I bring you one of the most amazing games in Wisconsin State History. 2011 D1 State Championship Game. 3 OT",DidoTyme,14,4,http://www.reddit.com/r/Basketball/comments/139g0p/with_the_start_of_hs_basketball_here_i_bring_you/

http://www.youtube.com/watch?v=Q9ijdhp7r9Q

Fast Forward to 50 seconds for late game action",self,t5_2qhsv,1353016485.0,,,True,http://www.reddit.com/r/Basketball/comments/139g0p/with_the_start_of_hs_basketball_here_i_bring_you/
1352485789.0,12xal0,"Los Angeles Lakers have fired coach Mike Brown, source says",Eligreat2,13,3,http://www.reddit.com/r/Basketball/comments/12xal0/los_angeles_lakers_have_fired_coach_mike_brown/,default,
1349495073.0,1110tz,I want to get decent at basketball (I've never played before) so that I can show my coach.,Couldbesomeone,11,0,25,"So, I joined the basketball team. Our season hasn't started

However, and after practice I went and asked my coach if I could play, and the douchebag told me that I was too bad to play, and he wanted to take me off the team. This is against school policy, and he cannot do that, but I'm pretty sure he is trying to make me quit. I however, have no plans of doing that. I want to get as good as you can, and show him that I can do it.

I know how to do most of the stuff,,False,self,t5_2qhsv,False,,True
1347197910.0,zln6g,Are there any Division 1 or 2 players here?,ajaxsmellsdooky,11,0,18,"Just wondering if there are,False,
1345834474.0,yrnpw,"Kenny George 7'9""!",hweichel,14,3,6,,t5_2qhsv,False
1345681637.0,yo2jb,"Uvais Akhtaev was one of the most prominent basketball players of the 1950s, a member of the Soviet national team,his height was 7.74 feet! ",flatbily,10,4,False,
1339781222.0,v3pj1,dream team documentary was great but this is what basketball means to me. can't wait to watch,mnguyen26,12,1,1,,t5_2qhsv,False
1338907705.0,um4ly,Drills or routines I can practice for ball-handling?,SonOfSamJackson,12,2,7,"So I have recently fallen tragically in love with the game of basketball. I started playing pick-up with my friends a lot and I'm not very good

Thanks a lot for anyone who does.",self,t5_2qhsv,False,,,True,http://www.reddit.com/r/Basketball/comments/um4ly/drills_or_routines_i_can_practice_for_ballhandling/
1337487974.0,tvm8g,Why are rules easier for nba players than high school players?,Jwill20,16,5,16,"If some one was to only watch nba games then use that knowledge in high school they would be screwed. In the nba there is virtually no walks or travels called even though they happen nearly every play. Another example is free throws,,False
1333599164.0,ru5ip,"Blake Griffin does what Blake Griffin does...this time, it's on Pau Gasol.",nguyentx31,10,0,http://www.reddit.com/r/Basketball/comments/ru5ip/blake_griffin_does_what_blake_griffin_doesthis/,http://c.thumbs.redditmedia.com/YFlQ6LcKm_z77xqb.jpg,
1333399156.0,rq1kx,This just shows how much chemistry there is between Lebron and Wade,DKBB,12,0,4,,t5_2qhsv,False
1331948489.0,r09cf,My reaction to the entire Duke vs Lehigh game,beachbum101,15,5,5,,t5_2qhsv,False
1329169406.0,po1fb,"17,708 points. 10,141 assists. 5 NBA Championships. One announcement that changed everything.",trepidatious_timmy,11,0,False,
1314054961.0,jr364,Wilt Chamberlain destroying players in high school,mannatee,11,2,5,,t5_2qhsv,False
1285831959.0,dkwik,"Hey, we got some new, active mods at /r/NBA now and are taking logo requests and hoping to make a push for the upcoming season!",misterFR33ZE,10,5, but he's added a couple mods to /r/NBA) and has allowed us to make a push


[Here's](http://www.reddit.com/r/nba/comments/dkvhj/request_your_nba_logos_here/) the thread for the logos. Also


I used that subreddit successfully over a month ago,,False,self,t5_2qhsv,True,,True
1376142024.0,1k36m2,Shabazz Muhammad could be headed to D-League if he doesn’t shape up,Commandant1,12,3,3,,t5_2qhsv,False
1374963788.0,1j6ne4,Basketball longest rebound shot,Toz4,14,6,1,,t5_2qhsv,False
1374063377.0,1ihbxd,"If you're Canadian and interested in basketball, join me at this subreddit /r/Canadabasketball",swarleyderWunderhund,17,9,http://www.reddit.com/r/Basketball/comments/1ihbxd/if_youre_canadian_and_interested_in_basketball/,http://a.thumbs.redditmedia.com/fzaD2ImLNMJh7RWB.jpg,
1374028723.0,1igjuz,You be the coach.,Captain_Roy,14,4,15,"OK, everyone here may have different knowledge of basketball, I can finish over both shoulders


On the other hand, and have for the most part worked either out of zone defences or had help good help defence from bigs. 


Maybe this could be a weekly topic,,False,self,t5_2qhsv,1374039587.0,,True
1373956414.0,1ieboe,Where should the ball be when shooting it?,iamredditdude,11,2,12,"What position should the ball be in when you shoot it?
Should it be at the center of the forehead or slightly to the left or right depending if the shooter is right-handed or left-handed. Refer to this link to see which one it should be http://imgur.com/w1hoQP0",self,t5_2qhsv,False,,,True,http://www.reddit.com/r/Basketball/comments/1ieboe/where_should_the_ball_be_when_shooting_it/
1373740958.0,1i8arb,How can I improve at basketball?,JonSloan,11,2,25,"I'm 6'3 and I love playing basketball

I would like to fix my ball handling and dribbling first. I always look down when I dribble. I'm also really inflexible,False,self,t5_2qhsv,False,,,t3_1i8arb
1372891359.0,1hlj7d,Brad Stevens is hired as the new Boston Celtics head coach | Ball Don't Lie,Commandant1,11,2,0,,t5_2qhsv,False
1372730048.0,1hgvku,How to get open/strengthen my drive?,Yaak22,9,0,8,"I am a player who relies heavily on his jump shot to score. When I am under heavy D though, books,self
1372287966.0,1h5377,"After year away, Bird returns to Pacers as president",Commandant1,11,2,http://www.reddit.com/r/Basketball/comments/1h5377/after_year_away_bird_returns_to_pacers_as/,http://f.thumbs.redditmedia.com/8pp6M4MMNm4uULpk.jpg,
1370989126.0,1g5k3t,"USA Under 16 beats Mexico, 130-31",jared123j,12,5,http://www.reddit.com/r/Basketball/comments/1g5k3t/usa_under_16_beats_mexico_13031/,default,
1370538125.0,1fsudv,"George Karl fired, immediately is talking to the Memphis Grizzlies",Commandant1,10,1,http://www.reddit.com/r/Basketball/comments/1fsudv/george_karl_fired_immediately_is_talking_to_the/,http://e.thumbs.redditmedia.com/AcNEmrr4TxMEVxrd.jpg,
1370502915.0,1fs0ao,"You can watch basketball, in HD, with no blackouts",mrmcgu,12,19,False,
1370038936.0,1ffjzh,Masai Ujiri is The Toronto Raptors New General Manager,SubbyDoo,13,3,0,,t5_2qhsv,False
1369751890.0,1f78he,"Parker leads Spurs to sweep, NBA Finals",Commandant1,9,0,http://www.reddit.com/r/Basketball/comments/1f78he/parker_leads_spurs_to_sweep_nba_finals/,http://d.thumbs.redditmedia.com/-_VLvtLusNRHXRFW.jpg,
1369315305.0,1ewgfl,Report: Carmelo Anthony finished playoffs with torn labrum,Commandant1,11,2,3,,t5_2qhsv,False
1368566844.0,1ec9zs,Who's your NBA comparison ?,chiefff,10,1,29,"So basically like the title,self,
1367958782.0,1dvv4b,"Pickup players of r/basketball, what do you think of our app?",Huddup,9,0,http://www.reddit.com/r/Basketball/comments/1dvv4b/pickup_players_of_rbasketball_what_do_you_think/

If you're interested,False,self,t5_2qhsv,False,,,t3_1dvv4b
1367939013.0,1dv511,"I wonder how well known Nikos Galis is to basketball fans, outside Greece.",sotyrion,10,0,http://www.reddit.com/r/Basketball/comments/1dv511/i_wonder_how_well_known_nikos_galis_is_to/,http://f.thumbs.redditmedia.com/SOXDANIQEnUMXamS.jpg,
1367783459.0,1dqwiz,Lebron misses unanimous MVP by 1 vote.,ThisisFKNBS,11,2,12,"http://espn.go.com/nba/playoffs/2013/story/_/id/9244504/lebron-james-miami-heat-1-vote-shy-unanimous-mvp-honor

This is the second time it happened. Last time it was Shaq who got 120 votes and lost one to Allen Iverson. This year it's Lebron with 120 votes but lost one vote to Carmelo.

I would really like to know the justification for the one person who didn't vote for Lebron? I know there are hell of a lot of Lebron haters but when you compare the actual statistics and then compare the intangibles of the respective players.. how does Carmelo ever come ahead? I just don't get it,False,self,t5_2qhsv,False,,,t3_1dqwiz
1366466960.0,1cqosi,Canadian Olynyk will skip senior year and enter NBA draft,SubbyDoo,10,1,3,,t5_2qhsv,False
1365569995.0,1c1mb2,"Reddit I'm 5'6 and can grab rim, any tips on how to palm a basketball?",TonyStarks21,11,2,http://www.reddit.com/r/Basketball/comments/1c1mb2/reddit_im_56_and_can_grab_rim_any_tips_on_how_to/,False,
