created_utc,id,title,author,ups,downs,num_comments,selftext,subreddit_id,is_self
1335135015.0,sn8i1,Does anyone else have these feelings toward their house?,dickherber,14,5,14,"I recently wrote this out of frustration with my brothers:


(My fraternity) is bashing my face into a brick wall
It is climbing uphill, clawing my way to Light, but hopelessly trapped in a dark and unknowing pit of ignorance. I’m clawing at the walls to draw passion from the passionless, but the ears of the unknowing are clogged with their vices. The “brotherhood” around me is usually my biggest adversary in every project.  It represents everything I despise: apathy, arrogance, entitlement, and pointlessness.  I have less faith in my brothers to come to my aid than I do a random stranger in the street.  

Every single day, I have to withstand my brothers talking behind my back, ostracizing me and mocking me because I have passion.  I care about what I’m doing, and I act intentionally.  (my fraternity) is hypocrisy and cowardice and the institutional imperative—mindless mirrors of men reflecting shadows of a flawed system.  It is degradation, humiliation, and a bullet point on my resume which makes me less attractive to employers.  (My fraternity) is daddy’s money and a C average stirred together in an effort to never grow up.

What is it we try to achieve as a group? What is our purpose? To strengthen one another and fight for what we believe is good? To be a collective force for what is right? To support one another like brothers would support brothers? I see none of this.  As individuals, I believe our fraternity would stand for…nothing because action is a prerequisite of standing.  We don’t stand for shit because we don’t have passion. 
",,t5_2s0mx,False,,,True,http://www.reddit.com/r/Frat/comments/sn8i1/does_anyone_else_have_these_feelings_toward_their/
1334772746.0,sgdg9,"Just finished packing for a brother's bachelor party. We graduated 6 years ago, but I had to bring it. Am I missing anything else? [xpost]",firstcity_thirdcoast,14,4,http://www.reddit.com/r/Frat/comments/sgdg9/just_finished_packing_for_a_brothers_bachelor/,,Gold
1331010763.0,qjqyl,x post from /r/videos frat house documentary ,,14,5,16,,t5_2s0mx,False
1328132662.0,p6pc2,What are some unique brotherhood events your fraternity organizes?,Thunder-ten-tronckh,12,3,13,"As a recently-instated VP,False,
1326062159.0,o8g0d,Philanthropy ideas?,pike1868,11,2,7,I just became the community service chair for my chapter and want to do something new. You guys got any project ideas?,t5_2s0mx,True
1322292862.0,mpp2q,Brothers of ACACIA Fraternity at IU-Bloomington show off their awesome chapter house,brolome,11,2,27,,t5_2s0mx,False
1317849807.0,l25vi,"Another one of these... Of course because the guy was a jerk he must've been in a ""frat"" (hate that word) ",ycpa68,12,4,6,,t5_2s0mx,False
1315358802.0,k7226,is anyone else on social probation? IT FUCKING SUCKS.,cocainesmellsnice,12,3,24,"any ideas to sneak around it?

""Big girls do cry...especially on bid day. TFM""",,t5_2s0mx,False,,,True,http://www.reddit.com/r/Frat/comments/k7226/is_anyone_else_on_social_probation_it_fucking/
1315211660.0,k56al,Purdue needs help; one of the nation's biggest greek systems is overseen by the world's biggest GDI.,boilerup11,13,5,6,,t5_2s0mx,False
1314752925.0,jzo0l,A GDI's Life Mission to End Greek Life.,Peirce77,12,4,6,,t5_2s0mx,False
1314711356.0,jz1fl,"On the right side of this page, it says ""because reddit is the anti-frat"", today, I've come to see first hand that this is true.",NigelMK,2

http://www.reddit.com/r/reddit.com/comments/jynmn/a_fraternity_brothers_response_to_the_its_shit/

Anti-frat geeds...",,t5_2s0mx,False,,Gold,True,http://www.reddit.com/r/Frat/comments/jz1fl/on_the_right_side_of_this_page_it_says_because/
1313718999.0,jneyg,LSU: The good ole days of frat life,lateatnight,11,3,10,,t5_2s0mx,False
1376021714.0,1k08nu,Ideas for mixers?,Fratticus_Finch,13,3,30,"Due to a probationary situation, like go karting etc.

My question to you is,False,,t5_2s0mx,False,,,t3_1k08nu
1375568303.0,1jncv9,Fall rush Is coming up,wayfaringbandito,19,11,46,What kind of interview questions should I get ready for?,t5_2s0mx,True
1375398727.0,1jj150,Where to buy clothes?,wealthy_shark,12,5,26,"Since /r/fratdeals was taken down,False,
1375162403.0,1jbxwz,Do grad students ever rush/pledge?,throwaway71978,18,10,26,"I've seen a few posts on here about older undergraduates who had been in the military or out of school for some other reason for a few years going Greek. Do grad students ever do so? Is that even allowed?
I'm going to be doing a master's degree next year. I'm 25 and actually did have the normal four-year college experience from 18 to 22. I always kind of regretted not giving Greek life a shot. I played a club sport in college that liked to talk about how they were ""better and cheaper than being in a frat"" but really had a bunch of drama and other than practice and competition I really didn't hang out with them and basically haven't stayed in touch at all since graduation. I came away from college without any really close friends and feel like there's a hole in my life there that I can't really figure out how to fill. I'll see guys on Facebook posting stuff about hanging out with their brothers from college,,False,,t5_2s0mx,False,,True
1374730056.0,1j0dsg,Mother of Golf Prodigy in Hazing Death Defied by FratPAC,lurkerdontpost,11,3,19,,t5_2s0mx,False
1373290595.0,1hv28c,Drunk students show hilarious ignorance of US history,cowboyhaze,13,4,17,,t5_2s0mx,False
1373242441.0,1htxyd,Ideas for wall art / paintings?,TRbarron,10,2,18,"I have seen the city skyline,,
1373163235.0,1hs57m,Bar design ideas?,Henry788,11,3,14,I'm looking to put a bar in my room. It doesn't have to look professional. Mostly functional maybe with a cool feature like a tap or something. I have about a 10' by 16' space to work with but a pretty low ceiling. Any ideas?,t5_2s0mx,True
1372358713.0,1h71kj,"Actual indepth post about a House in the UK, relates to the mentality of getting good pledge classes in the US",ghettobacon,11,4,http://www.reddit.com/r/Frat/comments/1h71kj/actual_indepth_post_about_a_house_in_the_uk/,,Gold
1372277756.0,1h4q9b,Tailgate recomendations?,turtsmagurts,10,2,15,"I am in charge of planning and running our tailgates next semester

Any recomendations? ",,t5_2s0mx,False,,Gold,True,http://www.reddit.com/r/Frat/comments/1h4q9b/tailgate_recomendations/
1371244301.0,1gd3co,TFM Sucking Less? Interesting article about misogyny,No1sadvocate,18,10,6,,t5_2s0mx,False
1371145004.0,1ga3u1,party room has carpet flooring?,maz1848,9,1,13,So the house my brothers and I just leased for next semester has carpet flooring in one of the bigger rooms that we intend to use as the party room...any ideas on how to keep it from getting completely ruined? I was thinking maybe a layer of tarp or something over it?,t5_2s0mx,True
1367154218.0,1d9q5t,So I am looking for a little advice.,maybe_pledging,14,7,19,"I am going to go to University of Texas next year,False,
1364846027.0,1bg47i,I make greek glasses with your letters on the lenses. Please let me know what you think!,ScreenplaysEyewear,23,15,34,,t5_2s0mx,False
1362733611.0,19wjss,Spiteful article aimed at Greeks in student newspaper at LSU,norm1414,12,4,11,,t5_2s0mx,False
1361427969.0,18xvqv,Recruitment Help Wanted!,gnargenstein,9,1,19,"Tomorrow we have our preference night. We are taking our rushees to a restaurant where they will be sitting down with a brother and doing a one:one interview. I am a part of the recruitment team and in the process of writing the interview questions that we will use when we take the rushees to voting. We already have questions like their name,,False
1360613681.0,18btje,Anarchists Declare War on UNC Fraternities,ButImNota_Rapper,12,4,6,,t5_2s0mx,False
1360574070.0,18aucy,UNLV's Zeta Beta Tau Harlem Shake,Mograne,20,12,4,,t5_2s0mx,False
1359396918.0,17fv78,Who are you sponsored by? ,rebellion650,16,6,56,"Was wondering simply what companies (large or small) sponsor your chapter/chapters you know of? 
",,t5_2s0mx,False,,,True,http://www.reddit.com/r/Frat/comments/17fv78/who_are_you_sponsored_by/
1354751840.0,14cpez,Rush booth ideas,iamfrankthetank,10,3,12,So my fraternity has started to get ready for spring rush.  We're trying to think of new ideas for things to do at our rush booth during the day.  We usually do events like have lunch or play cornhole with a sorority.  Any other ideas on things we could do at the booth to attract rushees?,t5_2s0mx,True
1352140586.0,12oh4h,Tips for a new risk manager?,rogue_mason,13,5,23,"We just had elections last night and I was elected risk manager for my chapter. My house just got put on disciplinary probation because during fall rush we had two incidents in a two-week time span. We had two freshman girls go back to the dorms really drunk and say they were at our house.

So basically if our chapter has one more incident between now and the end of February we will almost certainly be put on social probation.

In light of our current situation our current risk manager is not allowing any freshman girls in our house

Our house really needs a successful spring rush

Are there any risk managers who have any tips for me? I want my house to have a successful spring rush

Thanks you guys",,t5_2s0mx,False,,,True,http://www.reddit.com/r/Frat/comments/12oh4h/tips_for_a_new_risk_manager/
1349772305.0,116rwr,"I've been a shitty pledge and I'm afraid I might get balled, how can I go the extra mile to redeem myself? ",holyshmitt,22,15,http://www.reddit.com/r/Frat/comments/116rwr/ive_been_a_shitty_pledge_and_im_afraid_i_might/,,
1349662662.0,114855,Problem with our pins,saint69,13,5,30,"Hey so I'm the Pledge Ed for my Fraternity and over the last 3-4 semesters we've been repeatedly having our pledges break their pins.  When I pledged I never had a problem and the company that produced them switched I believe.    The guys have never broken them intentionally or even by being too rough.  They just seem to be really fragile.  We don't want to keep spending the $7 to buy new pins so what would you guys suggest doing?  What about an alternative option to where we could still use the pins are broken.  All ideas are welcome,,
1349229878.0,10uox8,I don't know how I feel about this. ,caseyracer,11,4,6,,t5_2s0mx,False
1345514460.0,yk3bn,"Why Should You Join a Fraternity?
      - YouTube",8,2,http://www.reddit.com/r/Frat/comments/yk3bn/why_should_you_join_a_fraternity_youtube/,,,False,t5_2s0mx,False
1341285822.0,vyl55,Tailgating ideas for this fall,mikew0440,11,3,13,"Looking for suggestions for purchases to make our tailgates better for this fall. Last year our tailgates were mainly informal drinking in our back parking lot and grilling burgers and dogs.

I have a few ideas for this year.

-Large canopy for sun protection

-Old turf under the canopy. No one likes a hot asphalt parking lot

-Beer bongs from 2nd story window.

-Multiple TVs for CFB watching.

-Better food

-Live band?

-Spiked watermelon


Anyone have any other ideas to make tailgates more fun this fall?
",,t5_2s0mx,False,,,True,http://www.reddit.com/r/Frat/comments/vyl55/tailgating_ideas_for_this_fall/
1339093757.0,uq5so,What's your houses beer of choice?,BGSO,12,5,44,We're a natty light house.  I'm constantly amused at how dedicated people are to their houses beer of choice.  God forbid someone make me drink Keystone light!,t5_2s0mx,True
1336979715.0,tm5kh,Football season tailgate throwback. ,treehoused,15,8,11,,t5_2s0mx,False
1336459781.0,tclcm,Proof that most redditors have never seen the aftermath of a real party,thebookofeli,18,10,13,,t5_2s0mx,False
1334092973.0,s373s,Every fraternity softball team should attend this camp,El_Jimmer,11,4,2,,t5_2s0mx,False
1330454987.0,qa0it,Picking a Bid,Dertankder,12,4,16,I'm a second semester freshman and I'm rushing for the first time in spring. I just got callbacks from the two Fraternities I was rushing and I'm going to the interviews soon. The one Is the biggest on campus with around 80 members and I know alot of the fall freshmen who live around my dorm and some of the potential pledges. The other one is new on campus but I know the brothers alot better and there's more In common. Any firsthand advice on how and why you chose the Frat you're in?,t5_2s0mx,True
1326418686.0,oesj9,Need Help With a Dying Fraternity,throwaway493094593,14,6,20,"I'm a new brother.

My fraternity, our inactive chapters more than quadruple the still active ones, and finding another active brother in the US is a game of Where's Waldo. It makes me sad because we used to be great in years past but in a couple of years we're going to end up having to merge.

Anyway, is virtually unknown to people at my college. Parties are hard to come by, and we're very insular. On top of that, we've recently been suspended for 2 years for hospital visits during pledging, though we're appealing it. By the time we're back, most of our fraternity will be gone, leaving one or two pledge classes in addition to mine.

I want people to know our chapter again on campus. We need to continue recruiting, well-connected individuals to our fraternity. I also want to start doing parties for the fraternity, but I need a place of my own first. I've been thinking of trying to rent out a brother's first floor of the house for the night or something, but I'm not sure if it would work. Also, befriending other fraternities may be an option for parties.

Any other ideas to get people talking about our fraternity is also appreciated. Thanks.

ΠΛΦ",,t5_2s0mx,False,,,True,http://www.reddit.com/r/Frat/comments/oesj9/need_help_with_a_dying_fraternity/
1323901078.0,ncxpr,Starting a Frat,subsequent,13,5,83,"I'm trying to start a chapter in my school (as a freshman). Any tips

EDIT: Fraternity

EDIT2: What about fundraising methods? I have to be able to prove ourselves financially stable as a chapter.",,t5_2s0mx,True,,,True,http://www.reddit.com/r/Frat/comments/ncxpr/starting_a_frat/
1317271060.0,kuxoy,"KA chapter at Texas tells nationals to shove it, after nationals bring a suit against them.",r0sco,11,2,http://www.reddit.com/r/Frat/comments/kuxoy/ka_chapter_at_texas_tells_nationals_to_shove_it/,,Gold
1317184031.0,ktr6m,Some of the comments on this front page post really make me mad. People really have no understanding what the pledge process is really about and what being in a Fraternity is really about. Sometimes Reddit just makes me mad,Manisil,10,2,4,,t5_2s0mx,False
1302425863.0,gmmta,The Original Fratstar (x-post from /r/pics),Strayl1ght,11,4,2,,t5_2s0mx,False
1375835830.0,1jumal,School is eliminating ALL rush this year. What's a smaller fraternity to do?,hayzie1,10,5,17,"Hi guys, and solutions to typical greek problems. Now I'm faced with a huge one. My school is desperately trying to phase out greek life, I've been thinking of secret rushing/pledging (rushing in the fall and pledging in the spring only) but I'm not sure how other brothers will react

TL;DR: My school is eliminating all pledging for next year,,False,,t5_2s0mx,False,,True
1375833497.0,1jujgz,How we do we change our image on campus?,throwaway38384,9,4,31,"It seems like the general consensus on campus(or just on that greekrank site) is that our fraternity has a few good guys but is mostly filled with creeps and weirdos. As someone on the inside I don't personally see it. We're one of the three largest fraternities on campus and we didn't get there by just bidding random kids either,False,
1373058985.0,1hpol7,Fall Recruitment Ideas,blakerz25,9,2,12,"So next Saturday I am meeting with our recruitment board to go over possible ideas for fall recruitment. We're a small state school

So far we have welcome week parties lined up

Does anybody have some other recruitment tactics that have worked well for your organizations in the past? Appreciated,False,,t5_2s0mx,False,,,t3_1hpol7
1371072400.0,1g82ay,New house. Additions?,treyday22,7,0,24,"Hello I've been recently appointed as the first housing manager for our housing complex (three houses side by side). What additions have you made to your houses that compliment it and make it unique?
We've added a volleyball court, and a studyroom fitted with cubicles.
Post your ideas!
LEDN",,t5_2s0mx,False,,,True,http://www.reddit.com/r/Frat/comments/1g82ay/new_house_additions/
1370653434.0,1fwfs0,"Hello r/Frat, I am interested in bringing an existing Fraternity onto my campus. I have a few questions.",40sAndBlunts,12,6,http://www.reddit.com/r/Frat/comments/1fwfs0/hello_rfrat_i_am_interested_in_bringing_an/, because of the type of men I plan on recruiting and the lackluster state of some of the few other Orgs around here.  I have not decided on a specific one because of the varying requirements of individual orgs and the fact that I plan on seriously committing to this

I know I must find good men

My question is, and coveted, but at the same time charging a modest overall amount for full chapter integration into the national organization?

For example two I recently looked into were Sigma Chi and Kappa Sigma, with a 5,000 dollar fee for pledge paraphernalia and some other costs, is this a normal and expected amount? The latter only provided contact info on their site, but no numbers.

Im going to be a junior, it is a Cali State Univ, and Latino and Black orgs run it, nothing against them but they are too limited for our taste). Please help and upvote this, I want to start something this semester and am currently just a big pool of energy, any help in finding out how to successfully and economically efficient-ally to do this would be greatly appreciated. Upvote please so intelligent and informed Fraternity men on reddit can spare any advice for me, Thank you sirs.",False,,http://www.reddit.com/r/Frat/comments/1fwfs0/hello_rfrat_i_am_interested_in_bringing_an/
1368764860.0,1ehzn8,Scared to pledge... Advice?,txrangers2011,22,15,62,"Hey guys, and doing things that pledgeship would require of me but I worry about physical hazing and other things. What would you guys say to a scared shitless PNM?

EDIT: Thanks for putting my mind at ease,False,,t5_2s0mx,1368851238.0,,,t3_1ehzn8
1365928193.0,1cbg1k,Convincing Parents to Join a Frat (and you opinion too),,11,3,34,"In advance

I'm would be a Junior this coming up year

1) How do I convince my parents?

Background: I know that at some point, seeing as how it's not only costly to rush, but to pledge and stay active.  
My uncle did a fraternity, doesn't look highly upon greek organizations. What do I do? Statistics haven't seemed to work on him.

2) What you honestly think of CULTURAL frats. i.e. Asian
Everyone who is Greek answers differently
Some people I've talked to consider them to be Greek

Thanks for your input.",,t5_2s0mx,False,,,True,http://www.reddit.com/r/Frat/comments/1cbg1k/convincing_parents_to_join_a_frat_and_you_opinion/
1363712844.0,1alpam,Any tips on recruiting at an anti Greek university? ,berger912,9,3,15,"Title basically sums it up. I'm the Rush Chairman of my chapter,False,
1362554253.0,19riud,"Pi Kappa Alpha Fraternity Scavenger Hunt List Left On Public Printer, Hilarity Ensues",Shawasted,20,12,http://www.reddit.com/r/Frat/comments/19riud/pi_kappa_alpha_fraternity_scavenger_hunt_list/,,Gold
1361904031.0,199tuh,Make chapter meeting fun?,pike1868,16,7,65,"My chapter is a bunch of dedicated, and eye-rolling. How can we make chapter meeting something fun to go to?",t5_2s0mx
1361502225.0,18zxzr,"I just moved to a new town, and am not currently in school. What's the best way to meet the guys of my local chapter?",celticmagnum,8,1,http://www.reddit.com/r/Frat/comments/18zxzr/i_just_moved_to_a_new_town_and_am_not_currently/,False,
1360607026.0,18bkx3,Could use some good advice for dealing with pledges my age,the_shit_I_say,10,4,31,"So I am a freshman and was recruitment chair for our spring class, if anybody said that to a brother it would be the last thing they ever did

TL;DR- Pledges getting too comfortable around me because I became friends with the majority of them before pledging started,False,,t5_2s0mx,False,,,t3_18bkx3
1359996042.0,17vfsx,"I'm in a frat looking to go back on campus, but the regulations seem strict, what do you have to deal with on your campuses?",pike1868,11,21, attend all kinds of seminars on hazing/studying/rushing,
1359675352.0,17nsnc,Ideas for a mixer with a sorority ,saskatoonshred,14,7,38,My fraternity is trying to decide on a theme for a mixer with a sorority and we can not agree on a theme. Any suggestions?,t5_2s0mx,True
1358898441.0,17362r,Auburn's dry and joke of a fraternity (Farm House) trying to sway Chi O from FIJI,HuffMyStuff69,17,9,11,,t5_2s0mx,False
1354566616.0,147vd2,"Greek brothers, can you help a sorority girl out?",LittleSnarf,10,3,http://www.reddit.com/r/Frat/comments/147vd2/greek_brothers_can_you_help_a_sorority_girl_out/
My boyfriend joined a fraternity three years ago as a freshman. However
I'm in a sorority
Would it violate some sort of fraternity ""code"" if I were to get him a paddle? We have been dating for 3 years now,False,,t5_2s0mx,False,,,t3_147vd2
1354499445.0,146f7e,Paddles... I need your opinion boys.,Th1rtyThr33,13,5,42,"On my campus, big bros name, and even they paint paddles different colors etc...

Do you guys do this? I always thought the multiple paddles and colorful paddles was more of a sorority/girly thing. I feel like our chapter is the only one doing things the old fashioned way.",,t5_2s0mx,False,,Gold,True,http://www.reddit.com/r/Frat/comments/146f7e/paddles_i_need_your_opinion_boys/
1353648804.0,13nlpx,A strange thanksgiving.,jmould0326,52,43,22,"So I work at Boston Market, they gave me a ham, took a leap of faith onto the ledge below me and to the left
1352834873.0,134xuf,Thoughts on the new TFM book?,SororityPin,12,5,15,,t5_2s0mx,False
1350773098.0,11tgea,Spring Break 2013 Ideas?,,9,2,30,"Where are your favorite places to go and why?

I'm going to be in charge of booking this year and I'm looking for something new. We've been to Gulf Shores and Destin my past two years,False,,t5_2s0mx,False,,,t3_11tgea
1350707050.0,11sakh,Colonization Questions,bowties_n_blazers,10,4,20,"Hey guys I have some questions for those of you who are a part of

* How did you go about starting the whole thing up with nationals an campus
* Was it hard to get an interest group to start up
* How long did it take to go from colony to chapter
* Any advice for someone trying to start a colony

*story time* I attend a university where i pledged and became an initiated member of my fraternity. Because of many reasons I am going to be transferring schools and the school I am going to does not have a chapter,False,,t5_2s0mx,False,,Gold,t3_11sakh
1348609008.0,10h0dh,Just signed a lease on a huge house for next year.  Any suggestions for what to do with the ginormous basement?,mcsailor25,10,3,31,,t5_2s0mx,True
1348497517.0,10e6dt,Making pledges use the find my friends app?,downhiller2010,11,5,8,Has anyone done this? I guess the equivalent would be google latitude for android users. I think it would be rather entertaining to pull up a map on the phone and track your PC. Should make a lot of logistics easier and pledges can't try to pull a fast one on ya cause you know where they are. ,t5_2s0mx,True
1346213550.0,z04ji,How much does a legacy matter?,beatle567,8,2,16,"My dad was a part of the beta theta pi fraternity during his college years,,False
1344019905.0,xmsu8,"There's really only one writer left on TFM worth reading: Bacon ""On Browning Out""",boilerup11,16,9,3,,t5_2s0mx,False
1343358695.0,x88c7,Why nobody should ever buy a Kia ,coltjackson,17,10,9,,t5_2s0mx,False
1340855624.0,vq216,Any good GDI stories? ,smadd,15,8,43,"So I was browsing Reddit,False,
1336579062.0,teues,Beach Bash: Twelve Tons of Sand (Taken from TFM's facebook),ghettobacon,17,10,4,,t5_2s0mx,False
1336347158.0,taclm,So They're Taking The Paper Work More Seriously Now...,ChainStyles,16,9,26,"The themes for mixers and parties at my school are no longer allowed to be 'racy'. So now I have to get creative on the theme names.

Ex- CEOs and Office Hoes is now CEOs and respectable women at the work place.

Help me troll the school,False,,t5_2s0mx,False,,,t3_taclm
1335996038.0,t40h3,What are the nationally dry fraternities?,El_Jimmer,9,4,45,"I've looked around but can't really tell who is dry. Phi Delt is,,Gold
1335080755.0,smeuw,"Does your fraternity cut people? If so, why? Am I in danger if I don't perform?",daydrinkin,9,2,http://www.reddit.com/r/Frat/comments/smeuw/does_your_fraternity_cut_people_if_so_why_am_i_in/

1. You only get cut if you creep on girls, or not show up to pledge events. In other words, you have to fuck up really badly to get cut.

2. They keep saying

3. Some of the seniors said

I guess my question here is,False,,t5_2s0mx,True,,,t3_smeuw
1332709596.0,rd5jb,Lavaliere policies?,Asdetevo,13,6,19,"if a brother want's to lavaliere someone,,Gold
1331188389.0,qn0o4,Good Ideas for Themed Parties?,MikeyMitch,14,5,38,"Sup guys
I'd like to hear yours!!
Golf Pros/Tennis Hoes and Rugged Loggers/Sexy Joggers
",,t5_2s0mx,True,,,True,http://www.reddit.com/r/Frat/comments/qn0o4/good_ideas_for_themed_parties/
1330299966.0,q7azp,Law and Order SVU Blasphemes Fraternity,El_Jimmer,14,8,15,"So as a brother in Phi Delta Theta I was quite disturbed to see an episode of Law and Order SVU in which brothers in a ""fictional fraternity"" rape a young woman. This does not only look bad for greek life,,Gold
