created_utc,id,title,author,ups,downs,num_comments,selftext,subreddit_id,is_self
1352574664.0,12z2xy,How open is your house about drugs?,AleX002,31,9,72,"Obviously don't post anything incriminating,False,
1351730600.0,12fjt9,University of Alabama President Resigns- Don't Doubt the Machine,relee1865,38,17,31,,t5_2s0mx,False
1347909367.0,101bx8,Party Ideas: Input yours or get some here.,Sir_smokes_a_lot,25,3,81,"I was thinking about the social aspects of fraternities. Naturally it led me to how parties are thrown and the different types that exist out there. There are seasonal parties (halloween, pimps and hoes,
1347493537.0,zskzt,I´m member of a german fraternity AMA,pelleus_balls,29,8,71,"We are a non fencing fraternity and exist since 1881. Our whole system is different to the greek system,,
1347081386.0,zjm9h,"I work for ""Nationals"" AMA!",Nationals_OMG,27,6,69,"I work for one of the top Fraternities in the nation as a consultant.  I can't really give proof

I will NOT acknowledge questions or comments saying ""You suck"" ""Fuck you"" etc.  I joined my staff a year ago after graduating so I figured you guys may like to think what our logic is on certain things.",,t5_2s0mx,False,,,True,http://www.reddit.com/r/Frat/comments/zjm9h/i_work_for_nationals_ama/
1338144188.0,u7jzq,It looks like our beloved Natty Light is the first beer in space. TFM.,torma616,26,5,1,,t5_2s0mx,False
1331937256.0,r01mc,Shit Frat Guys Don't Say,swordcop,36,15,11,,t5_2s0mx,False
1331621248.0,qu8a1,"It's ""Fraternity Four Year Old""'s best friend! (x-post from /r/pics)",torma616,28,6,0,,t5_2s0mx,False
1330976009.0,qiybp,Faux Loko: The DIY Drink I Shouldn't Be Telling You About,gsabram,32,9,8,[EDIT:  Link Fixed?](http://gizmodo.com/5889806/faux-loko-the-diy-drink-i-shouldnt-be-telling-you-about/gallery/1),t5_2s0mx,True
1314740802.0,jzhh6,"I made a fratty alien logo and posted in another thread. It wasn't seen, so here it is again. What do y'all think? ",FisherKing22,29,9,http://www.reddit.com/r/Frat/comments/jzhh6/i_made_a_fratty_alien_logo_and_posted_in_another/,,
1303936816.0,gyp6t,"If he was ranked number one back in 2007, who's ranked number one now?",the_patriot_bearcat,23,1,http://www.reddit.com/r/Frat/comments/gyp6t/if_he_was_ranked_number_one_back_in_2007_whos/,,
1376408396.0,1ka787,Will I need a pair of dress shoes for pledging?,Jajsjdka,26,8,61,So I'm leaving for my freshman year in two days and I plan on pledging right away. My question is will I need a pair of dress shoes while I'm a pledge? Ive got a really nice pair but im getting a little tight on space in my suitcases and I'm already bringing loafers and sperrys. I'm going to school 1500 miles away from home so I can't just go home and get them if I need them. ,t5_2s0mx,True
1375276409.0,1jf313,The GDIs reddit admins banned /r/fratdeals for no reason. Show your support here!,cowboyhaze,30,9,5,,t5_2s0mx,False
1369802064.0,1f90nx,Rough luck for Sig Ep. Anybody at VT with more insight?,Mikevercetti,29,9,30,,t5_2s0mx,False
1361074913.0,18oczf,"University of Michigan Pikes Send Nearly Nude Pic to Sorority, And It’s Blowing Up on Campus",iminthinkermode,29,9,http://www.reddit.com/r/Frat/comments/18oczf/university_of_michigan_pikes_send_nearly_nude_pic/,,
1354570442.0,14801i,Cigar nights ,c4pathway,24,6,19,My fraternity loves to smoke cigars and we are wondering if we can bulk order cigars from a company at a discount. I know stores can bulk order but they have business permits. Does anyone here have any experience with this?,t5_2s0mx,True
1353977729.0,13uf5a,"Our I-Week is this week, and it makes me wish that I could go through it again, what are your guy's favorite I-Week memories?",ustbro,25,27,,False
1353059510.0,13ajcr,Chico State suspends Greek activities,drice89,26,5,28,,t5_2s0mx,False
1339888007.0,v5n9h,/Cigars are a bunch of geeds and didn't appreciate this...,doublecoatofhair,30,10,10,,t5_2s0mx,False
1337202349.0,tqjtc,Find out your Chill:Pull,blasteye,25,5,15,,t5_2s0mx,False
1325703127.0,o2sv0,The difference between Fraternity people and non-fraternity people. ,karmasutur3,29,8,24,"Being an alum of my chapter because I transferred in my senior year

Non-Greek dudes:

* They drink a lot. If they are underage and get caught
* They play video games like BF3 and COD. They are messy. No one cares about their mess.
* They aren't involved on campus
* If they are hungover and sleep in class
* If they are capable
* If they go to an event or party
* If they party too much
* If they hit on women
* If they have a large
* If they dress nicely

Greek Dudes: 

* They drink a lot. If they are underage and get caught, and it will be in the school and local news.
* They play video games like BF3 and COD. They are messy. Everyone thinks this is totally unacceptable.
* They are involved on campus and do community service.
* If they are hungover and sleep in class
* If they are capable, and academic achievement is met with accusations of cheating.
* If they go to an event or party, and the chapter could face consequences, and it will be in the school and local news.
* If they party too much
* If they hit on women
* If they have a large
* If they dress nicely

Did I miss anything? 
",,t5_2s0mx,True,,,True,http://www.reddit.com/r/Frat/comments/o2sv0/the_difference_between_fraternity_people_and/
1323235551.0,n3k8r,"Christmas in Knoxville, TN",sweatyballs27,21,2,http://www.reddit.com/r/Frat/comments/n3k8r/christmas_in_knoxville_tn/,,
1376783414.0,1kksjr,How to flip a bad reputation into a good one?,Sir_smokes_a_lot,22,3,8,"Long story short our fraternity is a ""disgraced"" DSP chapter that turned local after a scandal erupted in the early 90s. We've managed to stay afloat for twenty years without any attachment to the school and have recently become recognized on campus about two years ago.

We are the only house in the city due to a grandfather clause but we are struggling to grow. About 4-5 pledges are admitted every semester. Part of the reason for the low numbers is that the actives number between 10-15 and moral is low. The other cause of our slow growth is the reputation the fraternity has accumulated on campus.

The scandal mentioned above was over an alleged rape that occurred about 20 years ago. In the end no one got arrested and all charges were dropped. Story from the alumni goes that one of the girls that routinely partied with us got mad over something and cried rape. I dont know the real story but thats besides the point. 20 years later the house is unkept and struggling to pay the mortgage and utility. On campus the freshman and non greek students are told that going to our house WILL get you raped and that our members are drug addicts. We make efforts to break this stereotype but many people have it set in there minds of the character of our members. Our parties have been said to be the best by our patrons seeing how ours is the only actual house. 

I'm writing this to hear yalls feedback on the situation. Maybe some of yall have been in a similar circumstance and can offer assistance. For instance a good way to flip the perception is to highlight the perils of gossip as an incentive to be open minded towards our fraternity. Feel free to add your two cents so we can evaluate each others claims.     ",,t5_2s0mx,False,,,True,http://www.reddit.com/r/Frat/comments/1kksjr/how_to_flip_a_bad_reputation_into_a_good_one/
1375983348.0,1jyva8,"Still no word from the admins on /r/fratdeals, so we launched FratDeals.net!",fratdeals,23,6,http://www.reddit.com/r/Frat/comments/1jyva8/still_no_word_from_the_admins_on_rfratdeals_so_we/,,
1370488240.0,1frmus,"Guys who don't have houses, what's that like?",itszuck,22,5,http://www.reddit.com/r/Frat/comments/1frmus/guys_who_dont_have_houses_whats_that_like/,False,
1367723737.0,1dpq12,Older dude.... Concerns?,GoldyGoldy,23,4,42,"Hello.

So, but would like an answer to these questions:  I'm in my mid-20's...what are some of the things I should consider while looking further into rushing/pledging/etc?  What problems will I encounter?  Is it normal to have an ""older"" guy?

Thanks.",,t5_2s0mx,False,,,True,http://www.reddit.com/r/Frat/comments/1dpq12/older_dude_concerns/
1367298605.0,1de6ev,An article about the Greek system by The Daily Aztec (SDSU Newspaper) getting some heat. What do you think?,beanpwns,22,3,24,,t5_2s0mx,False
1366488648.0,1crcgq,How does your party handle alcohol for parties?,JustAGuy22,26,8,34,"We're not allowed to use chapter funds for alcohol. So every party we always have a last minute scramble to scrap up money from whoever will pitch in to get alcohol at the party. Of course this means that about 1/3 of the brothers are suddenly out of town or make up some excuse why they're unreachable to pitch

I feel like this shouldn't be a problem,,False,,t5_2s0mx,False,,True
1361944862.0,19b9xl,"If you partake, don't be a fucking moron.",thelowbrow,27,8,http://www.reddit.com/r/Frat/comments/19b9xl/if_you_partake_dont_be_a_fucking_moron/,,
1357950670.0,16et12,Why is TKE and some other fraternities so hated?,krnaxe1,35,17,97,"I am a TKE member in Maryland and around here we are pretty big.  When I go online I see so much TKE hate and some other fraternities such as Pike get hated on too and I was wondering why?  

I personally love TKE and we hold onto out fraternity values and traditions and go hard unlike some other watered down fraternities.  SO why all the hate?",,t5_2s0mx,False,,Gold,True,http://www.reddit.com/r/Frat/comments/16et12/why_is_tke_and_some_other_fraternities_so_hated/
1355901021.0,153jxa,Kansas chapter of Beta Theta Pi suspended after allegations of animal cruelty,KUmitch,24,7,29,,t5_2s0mx,False
1345168689.0,ycro1,"I have no idea how MSN related this to frat boys, but they did...",SonoftheMorning,27,6,http://www.reddit.com/r/Frat/comments/ycro1/i_have_no_idea_how_msn_related_this_to_frat_boys/,,Gold
1368413723.0,1e807l,"Transferring Schools, how does this work for Greek life?",Webby2012,22,6,http://www.reddit.com/r/Frat/comments/1e807l/transferring_schools_how_does_this_work_for_greek/

I joined a Fraternity last year, emailing them or calling them, are there any other general processes I have to go through? Any tips for people who've done this before? Because I have a feeling that they'll kinda be skeptical of a guy who they don't really know all that well and didn't go through their pledge process etc....

Thanks. ",,t5_2s0mx,False,,Gold,True,http://www.reddit.com/r/Frat/comments/1e807l/transferring_schools_how_does_this_work_for_greek/
1367961624.0,1dvz4x,"Some of Willamette's Sigma Chi's facebook group posts get publicized, they're coming under some heavy fire for it.",AverageShenanigans,25,7,http://www.reddit.com/r/Frat/comments/1dvz4x/some_of_willamettes_sigma_chis_facebook_group/,,Gold
1367715140.0,1dphur,"""Make me laugh""",fratbrahh,24,5,13,Has anyone been asked this in an interview?  What are some funny stories you'd tell if you were told to make one of the brothers laugh on command?,t5_2s0mx,True
1367622204.0,1dnd4j,This is why you don't wear letters when you're planning on getting tanked.,FLHCv2,25,7,10,,t5_2s0mx,False
1367203084.0,1db991,"Gettin reaaaaal tired of your shit, Reddit.",greatcolor,27,8,http://www.reddit.com/r/Frat/comments/1db991/gettin_reaaaaal_tired_of_your_shit_reddit/,,
1366252322.0,1ckw2w,How do you guys make members show up to certain events?,kjandre,24,5,39,We have been having members not show up to things like greek life office sponsored events where it looks terrible when you have the least amount of members there. What can we do to stop this?,t5_2s0mx,True
1365864562.0,1c9qnc,Pike at Rowan University dies after being hit by drunk driver (X-Post r/RowanUniversity),SparkleDad,22,3,12,,t5_2s0mx,False
1361460735.0,18yhdh,This is what we have to deal with at my school,when_,24,4,15,,t5_2s0mx,False
1359521506.0,17jlvq,Our intramural logo... What? it's the year Neil landed on the moon...,smadd,23,5,1,,t5_2s0mx,False
1355384317.0,14rxo4,Brings me back to the first night of pledgeship (x-post from r/videos),Fratitude,21,4,24,,t5_2s0mx,False
1343413906.0,x9cw9,Russian Mobsters Attack UW Fraternity ,fratinand,25,8,23,,t5_2s0mx,False
1341786201.0,w8mms,"More Fraternity hate, I did what I could",PabstBR,27,9,http://www.reddit.com/r/Frat/comments/w8mms/more_fraternity_hate_i_did_what_i_could/,,
1338755951.0,uj107,best places to get party playlists?,gosports123,26,7,24,newly elected social chair. i appreciate any advice,t5_2s0mx,True
1334857593.0,si4n0,Our house definitely needs an old doug,,24,6,0,,t5_2s0mx,False
1371679911.0,1gophl,What's everyone doing for Independence Day?,RowdyOtis,22,6,39,"I'll be in Chicago for my internship but my roommates are in fraternities at other schools. We plan on doin the Red,False,
1369143161.0,1ergj7,"This month we will be donating ALL profits from our Oklahoma tank top to the Red Cross to help those affected by the tornado in Moore, OK. (x-post /r/fratdeals)",campusretro,23,6,http://www.reddit.com/r/Frat/comments/1ergj7/this_month_we_will_be_donating_all_profits_from/,,
1364612430.0,1ba7d1,Questions about being in a frat.,williamyes,30,14,69,"I'm planning on attending Vanderbilt in the fall

As a Canadian

I'm just curious on what it's like to be in one on a day to day basis. Thanks!",,t5_2s0mx,False,,,True,http://www.reddit.com/r/Frat/comments/1ba7d1/questions_about_being_in_a_frat/
1364237431.0,1azlza,How to grow a new chapter?,Shensell,20,5,31,"Our chapter was recently founded, average is approx 60). So,
1362968644.0,1a23ti,Need Some good ideas for brotherhood events.,hut285,22,5,46,I am in charge of brotherhood events for my chapter and I was wondering what are some good ideas to do as just brothers?   ,t5_2s0mx,True
1360246717.0,182cie,"I wrote this. A response to the Duke Kappa Sigma story. I'm submitting it to r/Frat first, then x-posting to r/GreekLife. If you agree with the contents of the article, please distribute it however you can. Facebook/Twitter/whatever. This discussion needs to be had.",wellyesofcourse,38,27,False,
1357842079.0,16bqvl,Rush Advice,Cohenj4,28,10,65,I'll be rushing next week and was wondering if there was any universal tips you could give me.,t5_2s0mx,True
1355010420.0,14is1m,What are the clothing styles of Greek Life at your school?,BrooksBroBeta,29,14,134,"I go to a Big Ten school and for us we have the usual Brooks Brothers

I've seen some schools where it looks like their Greek system has no sense of clothing what so ever

Just trying to see how universal our school is in terms of clothes.  

",,t5_2s0mx,False,,Gold,True,http://www.reddit.com/r/Frat/comments/14is1m/what_are_the_clothing_styles_of_greek_life_at/
1340212358.0,vc4kw,Getting recognized by letters,TurningAway,21,5,43,"I'm up in Canada right now, etc.)?

Edit because I'm still a little drunk..",,t5_2s0mx,False,,Gold,True,http://www.reddit.com/r/Frat/comments/vc4kw/getting_recognized_by_letters/
1339402228.0,uvvn4,Thoughts on Coolers?,Kraeheb,20,5,24,"Thanks to TFM

Do girls paint coolers for their Formal dates at your school? Have you ever gotten one? Do you find it over-the-top/awesome/creepy/sweet?",,t5_2s0mx,False,,,True,http://www.reddit.com/r/Frat/comments/uvvn4/thoughts_on_coolers/
1337263307.0,trn3s,It's time for the monthly anti-greek circle jerk,CoruthersWigglesby,22,4,10,,t5_2s0mx,False
1336001247.0,t45do,AMA request: somebody who was in a chapter when it got shut down for hazing,CaptainHindsight93,19,2,39,"I don't mean hazing as in doing push ups or getting yelled at

Just some random questions:
1) Did any parents get involved?
2) Who got in trouble/went to jail?
3) What was your chapter caught doing?
4) How did you get caught?
5) What did your nationals say/do?",,t5_2s0mx,False,,,True,http://www.reddit.com/r/Frat/comments/t45do/ama_request_somebody_who_was_in_a_chapter_when_it/
1335156037.0,snps5,(x-post from Pics) Why you don't wear flatbills. Not only do the looks stupid but...,OperationJack,22,5,0,,t5_2s0mx,False
1333391626.0,rpuvr,You keep using that word...  NF,stonedotjimmy,35,17,4,,t5_2s0mx,False
1328711052.0,pg8z2,"""Like a fraternity"" - for when anti-greeks are bringing you down",ITLady,27,8,1,,t5_2s0mx,False
1370896035.0,1g2h49,"Started this website with my fraternity brother... Roadioh is a trip adviser site that helps college kids find peer-to-peer reviews of road trip/spring break locations. We are trying to collect submissions, and would appreciate 30 seconds of your time",imagine92,22,8,http://www.reddit.com/r/Frat/comments/1g2h49/started_this_website_with_my_fraternity_brother/,,
1363125716.0,1a6avf,I think they're starting to take it a little to far now..,marcopollo13,22,7,6,,t5_2s0mx,False
1362542691.0,19r75h,Sig Ep? No pledge process?,throwawayrushee,25,9,73,"My school's spring rush is just ending. I rushed a few fraternities that I liked

I was just wondering if this is a national thing and does it make them any less of a fraternity?",,t5_2s0mx,False,,,True,http://www.reddit.com/r/Frat/comments/19r75h/sig_ep_no_pledge_process/
1354907418.0,14ghg7,Ivy League Cracks Down as Students Spiral Out of Control - Bloomberg,TheTrueGentleman,18,3,14,,t5_2s0mx,False
1354282465.0,141u2t,"Cornell reduces pledging to 6 weeks in 2013, 4 in 2014",Drulan,20,6,http://www.reddit.com/r/Frat/comments/141u2t/cornell_reduces_pledging_to_6_weeks_in_2013_4_in/,,
1348262358.0,109ohq,"We couldn't decide on which flag to use, so we used them all.",NickWasHere09,28,13,http://www.reddit.com/r/Frat/comments/109ohq/we_couldnt_decide_on_which_flag_to_use_so_we_used/,,Gold
1346281607.0,z1o1y,As a pre-rush freshman who's been hanging around a lot of fraternities...,the_shit_I_say,23,5,37,"How the fuck do you guys get anything done?! I've been to houses every night since I've been here and I've had a fucking blast,False,
1335930229.0,t2qcw,"Princeton: Freshmen who pledge, rush or join fraternity or sorority should expect suspension",imitationcheese,20,4,http://www.reddit.com/r/Frat/comments/t2qcw/princeton_freshmen_who_pledge_rush_or_join/,,
1320690943.0,m3rjp,So whose representing what here? ,DLit,18,1,151,"You don't have to list your chapter or school,,Gold
1370954132.0,1g47q6,Reddit's hivemind strikes again...,Lasereye,31,17,22,,t5_2s0mx,False
1366177699.0,1cimlc,Happy to see that Reddit has a better opinion on Frats than I thought.,ANatale,21,5,5,,t5_2s0mx,False
1361315747.0,18uked,"Pi Kappa Alpha's Nationals response to the pics/email ""BETA TAU CHAPTER PLACED ON INDEFINITE SUSPENSION""",iminthinkermode,18,2,14,,t5_2s0mx,False
1360633236.0,18cjnm,Tatro Joins the Total Frat Movie,merkmerthews,29,12,15,,t5_2s0mx,False
1355264137.0,14osu9,Sperry Smell,Mograne,22,7,64,How do you guys get rid of it? I've tried sticking newspaper in there for 2 days and odor blocker spray to no avail.,t5_2s0mx,True
1341965722.0,wcvtc,"I started college a bit late...so I'm 27 now and was wondering if I'm ""too old"" to be joining a frat.",Cynikal818,24,8,74,I've been a full time medic for the past 5 years decided to go back to college. A bit late...I know. Would they look at me like a geezer? ,t5_2s0mx,True
1337467672.0,tv9fb,"Horse ""I'll Have Another"" wins Preakness",rockchalk,22,7,1,,t5_2s0mx,False
1334897183.0,sj5i2,Just saw this on our listserve,djdrev,23,7,5,,t5_2s0mx,False
1334212269.0,s5t9h,This is a TFM if I've ever seen one.,torma616,41,26,15,,t5_2s0mx,False
1323812392.0,nbi0x,The People Who Make Chapter Awful [Article],jdunmer1018,19,4,16,,t5_2s0mx,False
1317691439.0,l006k,TFM,dekkpimp,21,7,2,,t5_2s0mx,False
1367864483.0,1dt1ga,Using smartphones as rush tools.,firesIncreaseDPS,18,6,14,"As my chapter's new Recruitment Chair,,False
1367305643.0,1dec4y,Why is Greek Life Greek?,wigglemonster,18,4,22,"Hey guys so I've always wondered why American fraternities chose to be ""Greek"". I'm not a history buff or anything but does anyone know why it was decided to be Greek instead of say Roman, or ""secrets"" often have Christian background or undertones.
",,t5_2s0mx,False,,Gold,True,http://www.reddit.com/r/Frat/comments/1dec4y/why_is_greek_life_greek/
1362080951.0,19ex2c,"Heading to PCB for the first time, Do's/Dont's?",swoopthereitis,17,4,http://www.reddit.com/r/Frat/comments/19ex2c/heading_to_pcb_for_the_first_time_dosdonts/,,Gold
1354821839.0,14ecla,You are able to build a recruitment process from the ground up. What do you do?,An0n_Sequitur,18,6,19,"I was just elected the IFC VP of recruitment for my college which is a Big 10 school. Our greek life is nowhere near where it should be,,
1354142375.0,13yjk9,"Trinity Forcing Fraternities, Sororities To Go Coed",rs16,17,3,http://www.reddit.com/r/Frat/comments/13yjk9/trinity_forcing_fraternities_sororities_to_go_coed/,,Gold
1352958427.0,1386hk,How do you trick rushees to give them bids?,eastsideski,19,6,25,We're in the middle of rush and we keep having to make up stories to git rushees down to the house to give them their bid without them suspecting it. Anyone have any good lines?,t5_2s0mx,True
1349407131.0,10z3w0,"One of the many advantages of being in a fraternity, landing a Pro Bowl QB who happens to be your brother",El_Jimmer,23,7,http://www.reddit.com/r/Frat/comments/10z3w0/one_of_the_many_advantages_of_being_in_a/,,Gold
1349330382.0,10x98h,What benefits has being in a fraternity brought you that you otherwise wouldn't of had?,Mograne,21,7,13,"Besides brotherhood/meeting people/raging/girls/philanthropies

For me,,False,,t5_2s0mx,False,,True
1346376804.0,z40jb,Pledge name ideas,hungryhungryhipbro,18,6,25,"Current Best is ""Ball-sacagawea""",t5_2s0mx,True
1325728003.0,o3btn,Good themes for events with sororities?,bruin11awp,15,1,40,"I always have trouble coming up with themes for the events we have with sororites,False,
1323410231.0,n5xtw,Fraternity 4 year old,Red_Hot_Chile_Miners,19,6,1,,t5_2s0mx,False
1318474954.0,ladjo,You guys remember that asshole dean in charge of fraternities at Purdue? He was arrested for shoplifting from a Walmart. Priceless.,boilerup11,22,7,3,,t5_2s0mx,False
1376109823.0,1k2nrv,Can you be a student athlete and in an fraternity?,BroseidonSirF,21,10,56,,t5_2s0mx,True
1375399253.0,1jj1t3,Anyone else work in a sorority house?,thenoopq,19,5,18,"I got an interview to do bussing/kitchen work

EDIT: Got the job. House mom was super cool,False,,t5_2s0mx,1375743692.0,,,t3_1jj1t3
1370873419.0,1g1mkm,"I attend Sewanee: The University of the South, home to only 1700 students but 80% Greek involvement, the 2nd highest in the country, AMA about small school frat life",tuck_the_police,8,,False
1370376662.0,1fo9d3,Reddit and cargo shorts,wallawalla22,15,2,15,,t5_2s0mx,False
1369071882.0,1epfh6,Decorating?,Flaxofication,18,6,44,"So I doubt anyone on here is a interior decor guru,,False
1366982820.0,1d5h6y,Fraternity Blackface Video Sparks Outrage at UC Irvine,cowboyhaze,18,6,19,,t5_2s0mx,False
1364540396.0,1b8b4z,Pledging as a sophomore. ,Laxbro189,15,3,31,"Hey everyone,,
1364279921.0,1b11p8,"Transferring schools next year, in the middle of pledging now, see it through or call it quits?",taaaylor15,15,21, I've decided not to come back to the school I attend now so I can work along with going to school and start really getting my life together. &lt; That kinda needs to happen. So I'm pledging Phi Kappa Psi here as a sophomore pocket pledge. I didn't get to pledge my freshman year because of my grades and they weren't quite there this semester, to a school without a phi psi

Has anyone been in a similar situation? Have any advice? Anyone have any advice they can give from a brother's standpoint? Anything can help I just really want some sense of direction,False,,t5_2s0mx,False,,,t3_1b11p8
1363843886.0,1aptyn,Let us sponsor your next event,dogwoodblack,19,7,23,"We've been traveling around sponsoring all kinds of events recently..

We've given away tens of thousands of koozies croakies stickers and t-shirts. We just enjoy hanging out.

Heres the big one everyone is interested in. If the event is big enough or the right fit

If you're interested,False,,t5_2s0mx,1363844447.0,,,t3_1aptyn
1357847972.0,16byaq,This app helped my chapter tremendously with communication. It is worth looking into if you do not have it for your chapter. ,stenglish92,18,5,17,,t5_2s0mx,False
1349146412.0,10spdn,Total Frat Movie?,squidmuncha,19,8,17,,t5_2s0mx,False
1341421575.0,w1dmj,"So, rush is going to be coming up soon, should we just be good guys and get a quick ""rush guide"" together so it can be sidebarred.",Chrisduhhhfur,21,16,False,
1339520125.0,uy6jj,What GDIs think of jager,lordofthebrocean92,22,10,14,,t5_2s0mx,False
1336069277.0,t5ghp,"Reddit post about sorority squats. Found the comments funny, thought you might too.",torma616,15,3,http://www.reddit.com/r/Frat/comments/t5ghp/reddit_post_about_sorority_squats_found_the/,,Gold
1335518998.0,sv2iw,Just initiated some Freshmen tonight...,marlborokid91,29,14,26,"...and God Damn it,,
1328593618.0,peb7l,"Who has an ""alcohol-free housing"" policy and how do you deal with it?",ghettobacon,17,3,38,,t5_2s0mx,True
1314832903.0,k0psj,DAE get an annoying little accumulation of dead skin stuck to the bottom of their Sperrys underneath your big toe?,Strayl1ght,14,1,5,,t5_2s0mx,True
1373612630.0,1i517e,[OC] Automated Big / Little matchup maker,TRbarron,19,6,16,I created a program that does some of the heavy lifting for big / little matchups. It works great in my tests but I'd love some full scale runs. Check out the article and the program itself [here](http://barronwasteland.wordpress.com/2013/07/12/the-big-bro-selector/),t5_2s0mx,True
1367805600.0,1drm2s,Fall rush shirt ideas and rules,KulpDontCare,16,5,30,"We're trying to create rush shirts for the fall but our E board is full of dicks who aren't about this life. Won't let us put ""rush"" on the shirts nor our greek letters. Is this a rule?",t5_2s0mx,True
