created_utc,id,title,author,ups,downs,num_comments,selftext,subreddit_id,is_self
1364706087.0,1bcevj,Is anyone else tired of running into this chick on campus?,itszuck,340,39,24,,t5_2s0mx,False
1366304627.0,1cm6ne,Sorority Greek Week chair sends out epic email to her lower tier Sorority,fratlovs,270,19,57,,t5_2s0mx,False
1361947304.0,19bc4m,Best quote from Animal House. ,sloSRT4,266,15,22,,t5_2s0mx,False
1336593140.0,tf7b2,That just about sums it up,,270,21,16,,t5_2s0mx,False
1350847997.0,11uuh9,Evolution of the Sorority Girl,thekillertoaster,291,46,19,,t5_2s0mx,False
1374607268.0,1iwjil,Typical GDIs (cross-post from r/cringepics),TittyCityMayor,271,31,42,,t5_2s0mx,False
1363720892.0,1am0fd,You gotta love alumni.,killerado,274,36,25,,t5_2s0mx,False
1358283910.0,16n1zg,Best advice I got while pledging ,bowties_n_blazers,266,30,12,,t5_2s0mx,False
1367214291.0,1dbls0,She's a real beauty [x-post r/pics],stonedotjimmy,243,25,5,,t5_2s0mx,False
1365093396.0,1bo3ze,One of our actives got drunk again....,ernie1850,251,38,19,,t5_2s0mx,False
1370837852.0,1g0xhx,when people ask if we haze,tuck_the_police,243,33,22,,t5_2s0mx,False
1371219122.0,1gc6yz,Slobro really is a true bro,BuckNation_,256,50,22,,t5_2s0mx,False
1359487689.0,17ifpw,"Pledges, You have until sunrise (Saw this in r/funny)",happyhank,181,17,http://www.reddit.com/r/Frat/comments/17ifpw/pledges_you_have_until_sunrise_saw_this_in_rfunny/,,Gold
1357151637.0,15u5k8,I've been bothered by the logo of /r/frat since I have been here (especially mismatching colors). I'm not very good at Photoshop. ,mbm7501,176,17,24,,t5_2s0mx,False
1345221093.0,ydt5d,When rushees first walk in...,nyrfan317,170,18,2,,t5_2s0mx,False
1355680618.0,14y5qr,"Maybe I'm a little slow, but I just realized that this is totally a fraternity initiation.",noobprodigy,167,17,http://www.reddit.com/r/Frat/comments/14y5qr/maybe_im_a_little_slow_but_i_just_realized_that/,,Gold
1336087881.0,t5xqq,"FaF, as usual the rest of Reddit hates it",stonedotjimmy,167,15,http://www.reddit.com/r/Frat/comments/t5xqq/faf_as_usual_the_rest_of_reddit_hates_it/,,
1348250180.0,109b8g,How to treat pledges,caindaddy,178,26,8,,t5_2s0mx,False
1374090008.0,1ii9mj,My weather app is trying to tempt me,mcslick12,178,32,20,,t5_2s0mx,False
1366084210.0,1cfupe,My god... The Geed... It burns,itszuck,182,31,50,,t5_2s0mx,False
1359556189.0,17k8cd,A Slightly-Offensive Rush Sandwich Board Prank.  ,Wayyside,169,19,11,,t5_2s0mx,False
1343489907.0,xau3u,Even the world has GDIs,mybrainisfullof,174,31,7,,t5_2s0mx,False
1373293908.0,1hv5p1,My girlfriend put a lot of work into my cooler; I honestly couldn't have asked for a better one. What do you think?,mashed_cows,172,29,38,,t5_2s0mx,False
1328235234.0,p8ne5,First Time On Reddit,RollsTheDice,167,23,8,,t5_2s0mx,False
1346203849.0,yzubc,"How do I ever get anything done? Oh, wait..",doublecoatofhair,153,16,http://www.reddit.com/r/Frat/comments/yzubc/how_do_i_ever_get_anything_done_oh_wait/,,
1355332378.0,14qe69,Just another Christmas at the fraternity house...,Time_To_Rebuild,145,11,12,,t5_2s0mx,False
1368819833.0,1ejbkz,8 Beer Can Innovations We'd Actually Use,spaghettifier,143,12,14,,t5_2s0mx,False
1359612134.0,17m5tb,Sig Ep,itsprovocative1,167,41,17,,t5_2s0mx,False
1375864840.0,1jveu5,"GDI thinks he is the law, incriminates himself [x-post /r/pettyrevenge]",Charlestonian,145,24,http://www.reddit.com/r/Frat/comments/1jveu5/gdi_thinks_he_is_the_law_incriminates_himself/,,Gold
1335809799.0,t032m,Beer... and America,ehoverthere,131,10,20,,t5_2s0mx,False
1341989236.0,wdh7g,"""My family came to visit. We're white..."" [x-post from r/funny]",DirtySnakes,129,10,21,,t5_2s0mx,False
1347415749.0,zqt5m,Kansas Delta Chi covers front lawn in American flags for 9/11 tribute.,Kcafo,127,5,13,,t5_2s0mx,False
1372650324.0,1helm8,One of my Chapter's pong tables,LegendsNeverDie,138,23,20,,t5_2s0mx,False
1366128964.0,1cgvbz,"If there are any MIT Phi Kappa Thetas here, thank you!",shandelion,124,11,http://www.reddit.com/r/Frat/comments/1cgvbz/if_there_are_any_mit_phi_kappa_thetas_here_thank/, bathrooms,
1346353362.0,z3bau,Got put in charge of making new tops for our houses pub room tables,stlepin,120,7,18,,t5_2s0mx,False
1345944201.0,ytzwj,"We all know that the first man on the moon passed away today, but all Phi Delts know him as the man who carried our pin to the moon.  In coelo quies est.",SonoftheMorning,124,10,http://www.reddit.com/r/Frat/comments/ytzwj/we_all_know_that_the_first_man_on_the_moon_passed/,,Gold
1371140042.0,1g9x2g,"""Frat City.""",cowboyhaze,138,28,23,,t5_2s0mx,False
1360879506.0,18jj7e,The Kappa Sigma frat hound Sadie wishing all the ladies a Happy Valentines Day,HawkeyeFan321,127,17,14,,t5_2s0mx,False
1359437565.0,17hbxm,oh how I wish I was there.,FLHCv2,131,18,24,,t5_2s0mx,False
1348023039.0,1047jd,"This is what's fucking wrong with coed ""fraternities.""",ormindcanhide,130,15,48,,t5_2s0mx,False
1364919830.0,1biu43,One of our pledges isn't the sharpest tool in the shed.,ANatale,123,10,49,,t5_2s0mx,False
1363262388.0,1aa2r2,Words for the Risk Manager,kaf1880,115,8,6,,t5_2s0mx,False
1361135313.0,18pjuf,Makers Mark Reverses Decision to Water Down Whiskey,bmcgeehan,112,3,13,,t5_2s0mx,False
1369690440.0,1f5rob,"""The Great Fratsby"" Trailer",slmolevhqlbxv,141,35,18,,t5_2s0mx,False
1371093371.0,1g8sws,"Bro walked in the house, put the cardboard down, then face-planted.",KulpDontCare,115,50,False,
1358499632.0,16t4k6,A brother lost,tatersaregoodferyou,114,14,14,"I know that at many times we are all rivals as fraternity's, and all of those who love and cherish the bonds that we share as fraternity men.",t5_2s0mx
1372086989.0,1gz0h9,"Finally, Kate up tons tits. (X post from celebs)",pike1868,133,33,http://www.reddit.com/r/Frat/comments/1gz0h9/finally_kate_up_tons_tits_x_post_from_celebs/,,Gold
1368562705.0,1ec4fg,Preparing for Greek Week Day 1 (Fixed),PaperEmpire,121,22,30,,t5_2s0mx,False
1366905916.0,1d38o6,"In honor of the upcoming football season, how to sneak your favorite liquor into the stadium (xpost from /r/CFB)",FLHCv2,107,7,http://www.reddit.com/r/Frat/comments/1d38o6/in_honor_of_the_upcoming_football_season_how_to/,,
1359135238.0,179jle,"Something we are probably all told while pledging, but something very important to remember when active.",bedubb,125,26,http://www.reddit.com/r/Frat/comments/179jle/something_we_are_probably_all_told_while_pledging/,,Gold
1358923997.0,17400i,Canadian Club: FaF,Iustinus_Maximus,118,21,6,,t5_2s0mx,False
1329441566.0,pt6nd,How I Feel When We Get New Pledges,cornballer876,116,18,12,,t5_2s0mx,False
1346439163.0,z5d4e,Frat World Problems,Flatwounds91,110,9,5,,t5_2s0mx,False
1333339926.0,rp1v7,Family Guy... NF,tailOfTheWhale,110,14,35,,t5_2s0mx,False
1363744872.0,1amx7n,"Dedicated to my girlfriend, who has way too many littles. ",FLHCv2,116,16,http://www.reddit.com/r/Frat/comments/1amx7n/dedicated_to_my_girlfriend_who_has_way_too_many/,,
1366924335.0,1d3y1a,H.W. looking FAF.,cocaine_blues,114,21,22,,t5_2s0mx,False
1355155696.0,14lx4f,Infographic For Fraternity Men,BrooksBroBeta,111,15,25,,t5_2s0mx,False
1371783398.0,1grs5j,Chess Drinking Game [x-post from pics],Go_Terps,102,12,15,,t5_2s0mx,False
1375514584.0,1jm7i0,Toga Enthusiast [X-Post],c4pathway,105,13,8,,t5_2s0mx,False
1375326269.0,1jgvxu,Is this someone's pledge?,cowboyhaze,104,11,20,,t5_2s0mx,False
1372217392.0,1h32mn,Would not be surprised if this was a fraternity house... [X-Post from WTF],MaybeStopCalling,107,13,7,,t5_2s0mx,False
1349279214.0,10vocd,Thought this belonged here (X-post from /r/funny),,112,19,2,,t5_2s0mx,False
1352663269.0,130t9k,"Stuck at house elections.. It's 
taken 2 1/2 hrs to elect just 2 of 
our exec board positions..",9,29,http://www.reddit.com/r/Frat/comments/130t9k/stuck_at_house_elections_its_taken_2_12_hrs_to/,,,False,t5_2s0mx,False
1362599762.0,19slni,The Kappa Sigmas At Tulane Sent Their Pledges To Steal Every School Newspaper That Reported Their Drug Bust,theholyllama,101,13,18,,t5_2s0mx,False
1366144720.0,1chgrh,Prep inspiration album from MFA. Thought maybe you guys would appreciate it.,Saintlame,104,13,25,,t5_2s0mx,False
1357364071.0,15ztfy,starting them young (x-post from r/pics),gnargenstein,102,16,2,,t5_2s0mx,False
1356565709.0,15honl,Why the fuck didn't I join my fraternity earlier in college? ,When_In_Doubt_,107,23,47,"Looking back, and didn't really achieve anything of real value. 

I pledged this last semester to a large fraternity at a large university down south. I was the oldest pledge at 21, 3 active) I've done more than I have in my entire college career put together. 

*I've made God knows how many friends this semester. And not just friends that say they're my friend because we're brothers, and just all around treat me like they've known me their whole life. 

*I've slept with three girls...IN ONE FUCKING SEMESTER! That's a 200% increase over my first three years of college put together. Fraternity life in general,000% more outgoing when it comes to girls. I can't explain what it is, but I somehow gained confidence I've never had before and girls (and guys) noticed. 

*I've gone places and done things that I never imagined I would. Gone on trips and adventures with my pledge brothers I thought only happened in 1980's style fraternity movies. I made so many memories in just one short semester

And all of this happened because I decide to take a chance and do something outside of my comfort zone. No it wasn't easy

I really needed to get that off my chest and I figured this would be the best place. ",,t5_2s0mx,False,,,True,http://www.reddit.com/r/Frat/comments/15honl/why_the_fuck_didnt_i_join_my_fraternity_earlier/
1375646083.0,1jp29a,Putting the finishing touches on this week.,turtsmagurts,110,24,29,,t5_2s0mx,False
1337275432.0,trx0l,TFM pledging graph. Couldn't be more true,easyskanking420,95,11,13,,t5_2s0mx,False
1348451129.0,10dctr,How we party in Montana...,FrattasticSigmaChi,98,17,36,,t5_2s0mx,False
1348465918.0,10dq4k,Sounds like our kind of guy (X-post r/funny),Theeunknown,92,9,10,,t5_2s0mx,False
1363965984.0,1aswuv,"What most people overlook when it comes to Greek Life, real Brotherhood. Here is something I'm very proud of my Chapter for doing:",LegendsNeverDie,82,3,http://www.reddit.com/r/Frat/comments/1aswuv/what_most_people_overlook_when_it_comes_to_greek/,,Gold
1343761536.0,xgowj,"Saw this kid in /r/ funny, thought he deserved to be here. ",smadd,101,20,http://www.reddit.com/r/Frat/comments/xgowj/saw_this_kid_in_r_funny_thought_he_deserved_to_be/,,Gold
1334443915.0,sa2ia,Kramer going hard in the paint. FaF,LiveFreeFratHard,94,13,7,,t5_2s0mx,False
1376501211.0,1kcyya,Latest house project.,notalivemau5,92,15,29,,t5_2s0mx,False
1336152971.0,t74sv,"How I feel about all the ""forever alone"" posts on here. ",MountainDewFountain,97,23,7,,t5_2s0mx,False
1340591586.0,vjvvt,x-post from r/trees. made me laugh. ,raging_since_1858,85,11,4,,t5_2s0mx,False
1360973200.0,18lzpb,I miss summer. ,flacomattman,100,26,16,,t5_2s0mx,False
1345762079.0,ypzrm,"These two newly ""initiated"" Americans get it. [x-post from /r/pics]",marlborokid91,89,19,10,,t5_2s0mx,False
1342722084.0,wtuza,What the fuck happened to TFM?,Opulent_Pledge,85,15,80,"I've been wanting to get this off of my chest for a while now: I cannot stand Total Frat Move these days. With its rehashed content

Remember the days of Sterling Cooper? When comments actually supplemented a post instead of declaring ""first""? Where brothers from all chapters came to assert our dominance over GDIs instead of bickering who had the best chapter/school/greek life? Remember when TFMs actually made you laugh?

TFM has devolved into a marketing machine void of entertainment; instead focused on building a brand that should have stayed a strong niche subculture to begin with. I was there when the site first started to gain popularity; when pictures

I miss it. It was a fun ride while it lasted.",,t5_2s0mx,False,,,True,http://www.reddit.com/r/Frat/comments/wtuza/what_the_fuck_happened_to_tfm/
1360617922.0,18bz1k,Coolest Cooler,kattttiebabyy,110,38,22,,t5_2s0mx,False
1349210651.0,10u3ui,This subreddit needs a new header image.,cowboyhaze,84,12,28,Because the current one is really gay.,t5_2s0mx,True
1339032835.0,up0ne,Classic Fred,,84,12,6,,t5_2s0mx,False
1333412724.0,rqdh6,"This kid is FAF, I don't know why is dad would be concerned (x-post from pics)",OperationJack,79,9,http://www.reddit.com/r/Frat/comments/rqdh6/this_kid_is_faf_i_dont_know_why_is_dad_would_be/,,
1346029347.0,yvo30,Typical.,HoneyBadgerKing,79,11,5,,t5_2s0mx,False
1331228890.0,qnkgi,Thursday nights on the row,stonedotjimmy,79,7,2,,t5_2s0mx,False
1367344799.0,1dfaru,"Mizzou AEPi raises $123,000 for the American Cancer Society during their Rock-A-Thon philanthropy",mikew0440,77,10,http://www.reddit.com/r/Frat/comments/1dfaru/mizzou_aepi_raises_123000_for_the_american_cancer/,,
1360529589.0,189j7l,Harlem Shake Fraternity Edition,BurntOne,88,21,29,,t5_2s0mx,False
1348638091.0,10hswg,GEEEEEEEEEEEEDS,EnterTheHazement,92,24,14,,t5_2s0mx,False
1345669481.0,ynpqh,The Original Frat ,gtharris,84,15,22,,t5_2s0mx,False
1342235969.0,wj8ky,Athletes spill details on dirty secrets in the Olympic Village. It's basically a giant frat party with no ugly chicks.,Fratbos,73,5,16,,t5_2s0mx,False
1366999386.0,1d61q0,My Fraternity's Spring Philanthropy - Sorority Mud Tug of War,SaturdayInAthens,71,5,35,,t5_2s0mx,False
1366734949.0,1cy0ay,"Just got this email, I can smell a PR nightmare about to break for ""Pikinis"".",oakea,78,11,http://www.reddit.com/r/Frat/comments/1cy0ay/just_got_this_email_i_can_smell_a_pr_nightmare/,,
1358988290.0,175q24,The view from the roof of Cal's ATΩ (ΓΙ).  That's the Golden Gate.,talzer,76,9,11,,t5_2s0mx,False
1355797842.0,1512po,"well, this is convenient -- x-post from r/pics",Broseidons_Brocean,74,6,http://www.reddit.com/r/Frat/comments/1512po/well_this_is_convenient_xpost_from_rpics/,,Gold
1365793550.0,1c82lh,"Our school's SAE chapter has been accused of date rape for the second time since '08, and received an immediate suspension. The next day, this showed up in the school paper.",LiveFreeFratHard,77,61,False,
1342146008.0,wh75p,TIL the FBI lists Alpha Tau Omega as a gang in Alabama,feeling_infinite,72,3,15,,t5_2s0mx,False
1350354633.0,11jrnr,Read the description. How would this in any form be acceptable at a frat party.,theclassierfastener,75,12,25,,t5_2s0mx,False
1376701829.0,1kiwjt,Preparing for the new semester the right way (x-post from r/pics),frankenstein7,75,11,17,,t5_2s0mx,False
1352270300.0,12s8vz,TIL my house is constantly filled with educated women. (xpost /r/todayilearned),reshan,76,15,7,,t5_2s0mx,False
1370613436.0,1fv0lk,Take Alcohol to Drink on Your Flight,cowboyhaze,79,16,9,,t5_2s0mx,False
1341002926.0,vta3f,Have a good weekend yall,Thejimdandy,68,5,12,,t5_2s0mx,False
1364875883.0,1bhtgg,I was really shocked to see this post from Reddit outside of /r/frat. I guess there is a difference between GDIs and nongreeks,StinkyWanker,70,9,6,,t5_2s0mx,False
1363159971.0,1a7d9g,Probably the worst TFM article you will ever read,actuaryut,82,21,40,,t5_2s0mx,False
1348619715.0,10hbaq,"Uh oh, somebody is mad they weren't invited",thajugganuat,70,6,http://www.reddit.com/r/Frat/comments/10hbaq/uh_oh_somebody_is_mad_they_werent_invited/,,
1337463539.0,tv6mg,Total GDI Move [12 sec],champly,71,10,16,,t5_2s0mx,False
1345775010.0,yqctz,Old school fratvertisement. (x-post from r/funny),Jesters,68,7,2,,t5_2s0mx,False
1368619873.0,1edmar,"""Blaming greeks for your campus problems is the easy and cheap way out"" TFM column written about my school, Chico State. What do you all think?",vanilla-lightning,73,14,http://www.reddit.com/r/Frat/comments/1edmar/blaming_greeks_for_your_campus_problems_is_the/,,
1361997341.0,19ckko,"Local satirical school newspaper wrote this brutal article today about the ""ugly"" sorority AXO. Paper is distributed all over campus.",ghettobacon,107,47,103,,t5_2s0mx,False
1342400442.0,wma04,This car. NF,Beef_Chief,67,7,1,,t5_2s0mx,False
1325616407.0,o1de9,Good friend is being a true Fraternity Gentleman and doing some serious philanthropy,sweatersandshit,64,5,6,"Good friend of mine is a ΠΚΦ at CU Boulder

http://support.pushamerica.org/site/TR?px=1029483&amp;fr_id=1100&amp;pg=personal

I think it would be cool if Fraternity redditors gave a few bucks and left their name and Chapter as the recognition name. For every upvote this gets I will donate a $1.",,t5_2s0mx,False,,Gold,True,http://www.reddit.com/r/Frat/comments/o1de9/good_friend_is_being_a_true_fraternity_gentleman/
1366940425.0,1d4izq,"The University of Rochester screwed over Sigma Chi. Pledge class president here, and this sucks. We were six hours away from being initiated.",cwinch17,63,4,http://www.reddit.com/r/Frat/comments/1d4izq/the_university_of_rochester_screwed_over_sigma/,,
1347404556.0,zqh11,Girl Scout Cookies [X-post from F7U12],bowties_n_blazers,100,43,8,,t5_2s0mx,False
1372191402.0,1h26c8,"Not an American Fraternity, but I think we can all respect it: Cambridge drinking society is forced to ban jelly wrestling; replaces it with giant bucking penis",Strayl1ght,69,8,http://www.reddit.com/r/Frat/comments/1h26c8/not_an_american_fraternity_but_i_think_we_can_all/,,Gold
1339818903.0,v4js6,Soup's up,TerribleTauTG,64,5,2,,t5_2s0mx,False
1375974586.0,1jyjhx,The 80s,,63,11,9,,t5_2s0mx,False
1368505370.0,1ean9x,Preparing for Greek week! Day 1,efrainmontes,73,17,28,,t5_2s0mx,False
1366898594.0,1d2zir,No..... beach? No problem,dapi331,70,16,4,,t5_2s0mx,False
1322551925.0,mt49a,Born a fratstar,An0n_Sequitur,66,11,5,,t5_2s0mx,False
1320800484.0,m5htb,8 pledges you will eventually meet (and often times blackball),ycpa68,58,3,22,,t5_2s0mx,False
1355794325.0,150yvv,22 Pike fraternity members face arrest warrants in relation to student's death,iminthinkermode,60,9,53,,t5_2s0mx,False
1346791266.0,zcrjx,Another current Frat World Problem,wolverine6,78,20,6,,t5_2s0mx,False
1337804983.0,u1k4h,Why I love and hate being the US when we play Vietnam War.,JoolNoret,58,6,20,,t5_2s0mx,False
1335931600.0,t2rjb,How many sorority girls does it take to screw in a lightbulb?,flacomattman,68,13,9,"Ten. One to screw it in,False,
1372610732.0,1hddds,Keynote address by my brother on how the fraternity may have saved his life. A powerful counter to fraternities being all about partying and buying your friends,RegressToTheMean,62,5,7,,t5_2s0mx,False
1370211887.0,1fjkqm,Cargo shorts pride in /r/cringepics. Interesting look at people who mock clothes such as fedoras but get horribly offended when you mock things they wear.,retnuh730,58,8,51,,t5_2s0mx,False
1354748801.0,14clyg,Naughty Photos at Vandy Sorority Formal,rs16,58,6,23,,t5_2s0mx,False
1352829353.0,134rg6,Back in the day...,ehoverthere,63,10,0,,t5_2s0mx,False
1338076037.0,u6lxm,Great picture from Spring Break this year. TFM took it down for some reason but I thought you guys would enjoy it! ,Kcafo,67,13,17,,t5_2s0mx,False
1366813572.0,1d0e5r,Michael Shannon reads insane sorority letter,chooch178,61,9,10,,t5_2s0mx,False
1365543728.0,1c0o1k,Can't find nothing that he can't fix with a can of Natty and a craftsman wrench.,ibangedstacysmom,67,18,14,,t5_2s0mx,False
1361542763.0,190rqa,"On Reddit, when someone is an asshole, they're a frat guy. When someone is helpful and also an actual frat guy, they're a ""helpful student.""",thelowbrow,14,,False
1354386995.0,1441p8,What are Sig Ep's letters again?,coldgluegun,66,15,46,,t5_2s0mx,False
1339202566.0,ush2g,Cornhole Board I made for the house,C12_Hit,62,9,12,,t5_2s0mx,False
1362732737.0,19wjd6,Hilarious. Kudos to SigEp at Purdue for this one,Thepappas,51,3,21,,t5_2s0mx,False
1361583298.0,1921yc,Woke up today and found this. It was on our roof the night before. Taken from a fourth story window.,Le_Ron_Paul,64,13,12,,t5_2s0mx,False
1370924201.0,1g3kxi,Frathound down,JTB_IV,55,7,4,,t5_2s0mx,False
1333585170.0,rtthm,"My Organic Chemistry Lab Rules, FAF.",Tapeboy,58,12,http://www.reddit.com/r/Frat/comments/rtthm/my_organic_chemistry_lab_rules_faf/,,
1360205954.0,181i97,Rush Boobs!,guysings,54,7,12,,t5_2s0mx,False
1359156975.0,17ab95,This One Hit Me Last Night.,killerado,117,68,7,,t5_2s0mx,False
1343935346.0,xkuea,This belongs here.,awc130,60,11,3,,t5_2s0mx,False
1363884234.0,1aqo7e,So what is Greek life really about?,ForeverBoned,55,8,54,"I've been on here and on TFM. Both sides describe a different story. So can someone explain to me how Greek life really is

EDIT: Wow,,False,,t5_2s0mx,1363902041.0,,True
1356927180.0,15pgyw,"Paul Ryan, in his years at Delta Tau Delta.",stenglish92,67,20,http://www.reddit.com/r/Frat/comments/15pgyw/paul_ryan_in_his_years_at_delta_tau_delta/,,Gold
1350964407.0,11xe5a,"I was a pledge at Alabama when shit went down, AMAA",,63,16,http://www.reddit.com/r/Frat/comments/11xe5a/i_was_a_pledge_at_alabama_when_shit_went_down_amaa/

Edit: I didn't drop.  The university forced everyone to end pledgeship and initiate early,False,,t5_2s0mx,1350975206.0,,,t3_11xe5a
1316385701.0,kjvpw,"I'm sure I'm not the first person who's though this, but I'm new to reddit so I thought I'd say it",ycpa68,50,5,http://www.reddit.com/r/Frat/comments/kjvpw/im_sure_im_not_the_first_person_whos_though_this/,,Gold
1367452554.0,1dim5m,"The antithesis of everything TFM, from Delta Oops' open facebook group at my school",OleBobbyMorrison,71,23,http://www.reddit.com/r/Frat/comments/1dim5m/the_antithesis_of_everything_tfm_from_delta_oops/,,
1361733975.0,19589j,The end of an era,patientbearr,66,18,18,,t5_2s0mx,False
1340679124.0,vlxm2,Friend sent a picture he took of me this weekend at Country Stampede,,55,12,8,,t5_2s0mx,False
1339517915.0,uy4fd,(x-post from r/CFB) University of Tennessee plans for sorority row.,boilerup11,47,4,3,,t5_2s0mx,False
1372711530.0,1hg817,Found this in one of our house's toilets [x-post from WTF],dcg2011,57,11,10,,t5_2s0mx,False
1366134124.0,1ch29w,"Made this cooler a few years ago, thought you guys might enjoy it.",neketa1,49,4,http://www.reddit.com/r/Frat/comments/1ch29w/made_this_cooler_a_few_years_ago_thought_you_guys/,,
1360119767.0,17z5na,sigma chi 4th of july parade car. 'murica,amdiakier,63,15,22,,t5_2s0mx,False
1359928174.0,17ttg5,40 men isn't a bad start to a colony! Beta Theta Pi spring recruitment 2013 @ Baylor.,deltapsi,71,25,28,,t5_2s0mx,False
1322023024.0,mmcwx,Total Frat Name ,zmuel4,53,8,0,,t5_2s0mx,False
1376539895.0,1kedoa,My paddle with my numbers.... AMERICA!!!,John-A-Smith,68,27,5,,t5_2s0mx,False
1376063569.0,1k15b5,Transformation,TylerKey,55,9,5,,t5_2s0mx,False
1349070904.0,10qzsg,The Dancing Tampon,kevmo1,56,15,17,,t5_2s0mx,False
1347222610.0,zm83d,"Brother Luke Donald signing the flag at the BMW Championship [from TFM]
",9,7,http://www.reddit.com/r/Frat/comments/zm83d/brother_luke_donald_signing_the_flag_at_the_bmw/,,,False,t5_2s0mx,False
1365976939.0,1ccle4,"Interesting read, 65 year old going Greek",Mwg239,50,8,http://www.reddit.com/r/Frat/comments/1ccle4/interesting_read_65_year_old_going_greek/,,
1357454998.0,161u1b,"I didn't expect a comment about fraternities to be at the top, or even upvoted. ",HawkeyeFan321,48,8,http://www.reddit.com/r/Frat/comments/161u1b/i_didnt_expect_a_comment_about_fraternities_to_be/,,Gold
1352142616.0,12ojg9,Ok now I'm mildly concerned...,jmould0326,52,11,40,"So we had a drain in our kitchen back up,,False
1341622021.0,w5nw3,Sig Ep Bear Mace,alpinemonster12,48,8,10,,t5_2s0mx,False
1375032995.0,1j82xa,Favorite party songs of 2013,Mxpx2002,51,9,75,"What are your favorite songs to play at parties that just get people going?

Big Sean- Guap
French Montana- Pop That
Schoolboy Q- Hands on the Wheel",,t5_2s0mx,False,,,True,http://www.reddit.com/r/Frat/comments/1j82xa/favorite_party_songs_of_2013/
1366776176.0,1czlkb,"""Men into young men""",UncleFaggot,54,15,5,,t5_2s0mx,False
1336498330.0,td7q3,They know what's up.,raging_since_1858,52,9,5,,t5_2s0mx,False
1335292288.0,sqc4y,"H.R. 1327 will give greek organizations tax breaks for building/renovating their house as we are listed as ""charitable organizations""",El_Jimmer,49,9,17,,t5_2s0mx,False
1358880566.0,172i0z,Vanderbilt senior explains why going Greek is awesome in student column. ,Impune,50,9,12,,t5_2s0mx,False
1375138350.0,1jb5ek,Fraternity to Johnny Manziel -- You're TOO YOUNG to Party &amp; Booze Here,gentimmy,45,5,33,,t5_2s0mx,False
1350590546.0,11pgo3,Alabama Greek Affairs suspends fraternity pledgeship for fall,epmatsw,46,7,30,,t5_2s0mx,False
1336520239.0,tdrl2,Because Greeks just do stuff better,tporty21,45,8,6,,t5_2s0mx,False
1335192489.0,so7nl,#MiamiTriad (Printed in the Miami Student),Brickstreet,43,6,23,,t5_2s0mx,False
1363647336.0,1ajzmb,Best party theme ideas?,seanm0946,43,3,83,"Looking for truly unique party ideas we just had a great Gatsby party that was a huge success. We spent about $700 on it and it was awesome. Good themes like that are what I'm looking for
Sorry if this has already been posted. 
EDIT: My objective in this post is to find something besides the old standby of ""___ and sluts""",,t5_2s0mx,1363652532.0,,,True,http://www.reddit.com/r/Frat/comments/1ajzmb/best_party_theme_ideas/
1363360411.0,1acq1b,Dick Clark left $1 Million to DKE in his will,rs16,48,8,12,,t5_2s0mx,False
1360700035.0,18ea2l,Bradley University bans fraternity parties where alcohol is served,moosology,45,7,22,,t5_2s0mx,False
1345665897.0,ynlpc,Binge Drinking College Students Are Happier Than Peers That Don't Binge Drink,SonoftheMorning,47,7,5,,t5_2s0mx,False
1370564654.0,1ftvpn,Wagon wheels gets the best of everyone,00488890,48,9,16,,t5_2s0mx,False
1368037136.0,1dy2d0,"First fraternity in Ireland, Year One of the 'Trinity Frat' (Zeta Psi",kinda_torqued,48,9,http://www.reddit.com/r/Frat/comments/1dy2d0/first_fraternity_in_ireland_year_one_of_the/,,
1332907668.0,rh1np,We prefer to sit on Natty thrones,charbok,48,10,16,,t5_2s0mx,False
