created_utc,id,title,author,ups,downs,num_comments,selftext,subreddit_id,is_self
1335063925.0,sm5ns,Basement renovations and new Equipment,bowsntoes,3,2,13,"So I have been tasked with thinking up new shit to put in our basement,,False
1332045859.0,r1ozf,Sigma Chi County Fair ,Jstarb14,16,16,5,,t5_2s0mx,False
1329692264.0,pwyq8,how i feel about sorostitute facebook rush pictures,alwaysTFTC,3,2,0,,t5_2s0mx,False
1316400709.0,kk2xb,What are tips to make your little brother sweet?,LegendsNeverDie,4,3,4,,t5_2s0mx,True
1376511595.0,1kde0r,Any advice?,HPE125,1,1,2,"Anyone care to weigh in? I am attending a SoCal university. I am majoring in Finance don't have many friends at school atm. This fall semester I plan on taking 5 to 6 classes

Thanks in Advance
",,t5_2s0mx,False,,,True,http://www.reddit.com/r/Frat/comments/1kde0r/any_advice/
1376366757.0,1k99hk,Anyone interested in buying 3 pairs of chubbies from me? only $100 with shipping.,AsksHonestQuestion,3,3,2,"They're the 'Mericas,False,
1375504690.0,1jm021,Snapbacks,wealthy_shark,1,1,5,What does r/frat think about snapbacks?,t5_2s0mx,True
1375277635.0,1jf496,"Just released our KA tank, enjoy!",campusretro,6,6,http://www.reddit.com/r/Frat/comments/1jf496/just_released_our_ka_tank_enjoy/,,
1374911398.0,1j5g9i,Anyone else not care about their nationals?,greekinquiry,9,9,2,"The one thing that I loved about the house I'm part of is that it's just about the brotherhood and the letters we wear set us apart from the other frats on campus but just because we wear those letters doesn't mean we agree with nationals and many times we tell the pledges ""fuck nationals,,
1374715478.0,1izxb6,"Looking at investing in some hidden cameras, anyone have any experience with this?",curiouslywtf,3,3,http://www.reddit.com/r/Frat/comments/1izxb6/looking_at_investing_in_some_hidden_cameras/, etc. These should be able to be somewhat discreet. Does anyone have any experience with this sort of thing?",t5_2s0mx
1374525070.0,1iu4d4,Who else has been a pledge to nationals?,imaybe_FAF_,4,4,4,I am new member awaiting initiation for a chapter that is working hard to be re-chartered. Has anyone else colonized or re-colonized? What was your experience like? And why haven't I been hazed by nationals yet? ,t5_2s0mx,True
1373414631.0,1hz013,"I want to rush, but as a D1 recruit, will I have time?",jda2014,3,15,,False
1373134707.0,1hrc3w,Frat room ideas?,LDHegemon,6,5,3,I'm moving into the house next year and wanted to know what the frat stars of Reddit have used to deck out their rooms. Flags on the walls? Posters? Futons? What are the frat room essentials?,t5_2s0mx,True
1372634569.0,1he454,"Websites for discussing greek life? I know of Old Row but that seems to be for southern fraternity life, or at least that's how the site describes itself. Any sites for greek life as a whole?",mm1255,6,4,http://www.reddit.com/r/Frat/comments/1he454/websites_for_discussing_greek_life_i_know_of_old/,,
1372383653.0,1h7xfm,What are some of the nicknames for other greek organizations on campus?,rowdyBLUEGRASS,3,3,2,"What are some of the nicknames that y'all have for other greek organizations on campus? Most bad,,Gold
1371699533.0,1gpe69,Plan on rushing in the fall at WVU. What clothes should i buy for my wardrobe.,westvirgkegstand,6,6,13,"on a $500 budget. have a few RL plain polos,False,
1368998461.0,1eniqy,Asians and Sophomores Question,obeboy,4,4,10,"Hey r/Frat! I'm an Asian guy and this coming fall I'll be a sophomore at UT Austin. I really enjoyed Freshman year however I feel like I may be missing out on some great times I could have in Greek life. I see a lot of fraternity guys around campus but rarely are they Asian. So my question is: How do you view asian guys and sophomores that want to pledge? And in your honest opinion,,False
1368146892.0,1e1euc,VP of Programs Speech,samcro25,4,5,8,"Just asking for some advice on what i should put in a speech running for VP of Programs 


Edit: Thank you for all your advice. I GOT THE POSITION!!",,t5_2s0mx,1368218428.0,,Gold,True,http://www.reddit.com/r/Frat/comments/1e1euc/vp_of_programs_speech/
1367813034.0,1druqp,Advice on rushing/transferring?,dubdank,5,4,9,"I'm starting college in the fall (at GSU [Southern]) and at the moment my GPA isn't high enough for Greek Life (2.67/2.75). Due to my fucking up in high school, I naturally want to join a fraternity. Here's my problem:

I'll be eligible for Spring Rush but don't plan on spending more than my freshman and possibly sophomore year at GSU. I've already looked into some different fraternities and one that particularly interested me at UGA said they normally don't give bids to sophomores. Should I try and rush in Spring then stay at GSU through my sophomore year or try my luck transferring as soon as possible and rushing fall of my sophomore year?

tldr: Grades suck

Edited for formatting.",,t5_2s0mx,False,,,True,http://www.reddit.com/r/Frat/comments/1druqp/advice_on_rushingtransferring/
1367261077.0,1dcrf8,What do you guys know about slip n slides?,Sir_Joel43,3,3,15,Thinking about setting one up at our spring formal this coming weekend. I think all I need would be a massive tarp and bottles of dish soap for lubricant (I don't think we'll have access to a hose). Do you guys know general costs? Is this a bad idea to do? What have you done in the past?,t5_2s0mx,True
1366217144.0,1cjiyr,Social media for recruitment/online presence,superduper15,2,2,3,"How do you guys go about using social media to benefit your chapters? I recently took charge of my chapters facebook and twitter page and have been posting relevant content/pictures of events going on within Greek life and our chapter.

What are some ways you guys utilize social media for recruitment? I feel like when used properly it could be a huge asset to a chapter in being a name that sticks out come summer/rush season.",,t5_2s0mx,False,,Gold,True,http://www.reddit.com/r/Frat/comments/1cjiyr/social_media_for_recruitmentonline_presence/
1366162606.0,1ci50k,One of my chapter's founding fathers just won the Pulitzer Prize,chitownfan1,2,2,0,"What are some of the more famous alumni from specifically your chapter?

Link for those interested: http://www.latimes.com/features/books/jacketcopy/la-et-jc-adam-johnson-wins-the-pulitzer-prize-in-fiction-for-2013-20130415

",,t5_2s0mx,False,,Gold,True,http://www.reddit.com/r/Frat/comments/1ci50k/one_of_my_chapters_founding_fathers_just_won_the/
1366084822.0,1cfvgu,What are some hazing events that are fun for actives and relativity fun for pledges during there Iweek?,garebear80,3,3,29,Its our pledges Iweek this week and I am pretty disappointed with how its going so far. It seems our active members have just resorted to yelling at the pledges that they suck and making them clean up a mess that they make in front of them. It seems childish and uncreative to me. What I want to know is what are some great Iweek hazing things activities you do or have been the one forced to do the doing that are both fun for actives and the pledges can at least laugh about it later when they initiate? Help a brother out. ,t5_2s0mx,True
1365911609.0,1cb4ns,"Hey y'all, I'm not even Greek, but check the standard fraternity hate going on here. Alpha Psi Rodeo in Auburn for those of y'all that know about it.",brass_cojones,1,0,False,
1365704327.0,1c5erz,"My chapter's Greek Sing rendition of Macklemore &amp; Ryan Lewis's ""Same Love"". It ended up being so powerful that it got a standing ovation until we exited the room.",chas11man,15,15,2,,t5_2s0mx,False
1365565161.0,1c1guh,Ideas for how Pledges should earn my signature?,ChinchillaSanchez,1,1,5,"Part of our pledging process is that all the pledges buy mini-paddles and need each brother to sign it,,False
1365559022.0,1c18p4,"Fellow Fratenity Men, what have those of you that are the sweetheart of a sorority did throughout the ""campaigning"" process?",AtomikaNova,3,3,http://www.reddit.com/r/Frat/comments/1c18p4/fellow_fratenity_men_what_have_those_of_you_that/

EDIT: How it goes in greek life at my school, talents, etc etc, basically do stuff to impress the chapter they'd like to be the sweetheart of. The chapter votes on it one during a chapter after the process is done to elect said person.",,False,,1365614015.0,t3_1c18p4
1365036159.0,1bmm2z,Are you required to pay dues as a pledge?,Dantheman0,4,4,27,"This might be a dumb question but I haven't come across the answer.
How significant are pledge fees compared to dues?",,t5_2s0mx,1365036846.0,,,True,http://www.reddit.com/r/Frat/comments/1bmm2z/are_you_required_to_pay_dues_as_a_pledge/
1364969751.0,1bkmzt,Need signature ideas for the pledges.,domuseid,1,1,2,"Basically the title,,
1364918727.0,1bisky,"We are market testing our new greek line of tank tops - first up is Sigma Chi... All presales will be $15, regular pricing will be $20-25 - Feedback appreciated!",campusretro,2,2,http://www.reddit.com/r/Frat/comments/1bisky/we_are_market_testing_our_new_greek_line_of_tank/,,
1364268384.0,1b0qz5,Need advice on current situation,fratbra,4,5,29,"I pledged a frat last semester as a junior,,False
1363983900.0,1atjjm,SAE brothers: Paddy Murphy party ideas?,mafurious5,5,4,3,What things do you guys do at your Paddy Murphy party that make it memorable?,t5_2s0mx,True
1363632373.0,1ajf8h,To JI's who bitch about how hard pledging is. ,,7,7,1,,t5_2s0mx,False
1362893152.0,1a0eui,Questions about Fraternity Flags on Beaches (Spring Break),ThrowawayScrewBama,1,1,1,"Just a few general questions about flags such as the ones [in this pic](http://collegethrival.com/wp-content/uploads/2012/03/cropped-Spring-break-pic.jpg)


1. What type of flagpole do you use for this? These seem different than usual since they're flexible.

2. Where can these types of flagpoles be purchased? Walmart? Target?

3. Do cops give you any shit for this being obnoxious? I know they treat beer-bongs like anthrax.
",,t5_2s0mx,False,,,True,http://www.reddit.com/r/Frat/comments/1a0eui/questions_about_fraternity_flags_on_beaches/
1362155296.0,19gw05,What do you get when you mix two bros and a business loan? a fatter head.,dreinken37,16,15,11,,t5_2s0mx,False
1361984667.0,19c3q2,Tulane Kappa Sig students arrested for accepting molly from a police officer,hurricane47,2,2,0,,t5_2s0mx,False
1360389352.0,186ia9,Are there any quality rush videos like this that you guys know of?,Schwartz91,2,2,3,,t5_2s0mx,False
1360170280.0,1809i9,"When a freshman says ""I don't drink""",Brobach,9,9,2,,t5_2s0mx,False
1359576439.0,17kwea,Chubbies: Walk of Fames OR The Journeys,kidkrush,2,2,1,,t5_2s0mx,False
1359487782.0,17iftu,Cornell alumni reveal secret traditions of their kicked off fraternity while defending its wanton decorum. [xpost from r/greeklife],wantondipper,7,7,1,,t5_2s0mx,False
1359441110.0,17hf9s,Texas Roundup for spring break?,dwheat1,3,3,6,"Anyone been to this? Going down there to visit a friend and get rowdy for spring break. Wanna know what the experience is like

Hit me",,t5_2s0mx,False,,Gold,True,http://www.reddit.com/r/Frat/comments/17hf9s/texas_roundup_for_spring_break/
1359397236.0,17fvl9,I need some help planning a 5K for our philanthropy,Genieinthebottle7,1,1,8,So my chapter is planning on doing a 5K to fundraise for our philanthropy. I was wondering if you guys had any experience with planning anything like this and if you guys had any advice,t5_2s0mx,True
1359173740.0,17aspi,Anyone else at the IFC Academy in Indianapolis?,LDM312,3,3,8,"Just got here

On a more embarrassing note
",,t5_2s0mx,False,,Gold,True,http://www.reddit.com/r/Frat/comments/17aspi/anyone_else_at_the_ifc_academy_in_indianapolis/
1359139668.0,179p0j,"Opinions on the co-ed frat, pi sigma pi, here?",killerado,8,22

Edit: TO BE CLEAR,,False,,t5_2s0mx,1359156446.0,,True
1359072450.0,1781pv,In a sticky situation.,Wagneo,5,6,11,"I am a freshman this year at a Big Ten school who starts Spring rush next week. I have already started meeting some of the guys in each of the frats im rushing and everything is going great so far. However,,False
1358978338.0,175d1x,"Dorm rushing tonight, any tips?",DropkickMikey22,4,4,http://www.reddit.com/r/Frat/comments/175d1x/dorm_rushing_tonight_any_tips/,,Gold
1358894568.0,17312d,Frat furniture ,deehan26,4,5,21,"I was in charge of getting new furniture for our chapter house this past year. 45 total members,,False
1358806322.0,170jw7,Rush round 2,Swolelife,5,5,12,"Hey i've got a quick question for yall. 

I'm a freshman in a southern college and just finished round 1 of rush. I was invited back to 10 of the houses but can only go to 6 for the next round.

The thing is that I straight up missed the second part of round 1 and only eventually ended up visiting 6 fraternities. I got invites from some fraternities I haven't ever visited (even for parties) - why is this? 

Do these fraternities just need a minimum number of people to invite or what? One of the fraternities I was invited to is top 2 so I doubt it's the case for them (my bad if this sounded arrogant hahah)",,t5_2s0mx,False,,,True,http://www.reddit.com/r/Frat/comments/170jw7/rush_round_2/
1358799389.0,170atc,This is how we brush our teeth,nbg18x,7,6,3,,t5_2s0mx,False
1358793503.0,1702wi,Rush Help,bmur,4,5,4,"Hey Gents
During my college search I went through informal recruitment at a state school, or is there anything you wish you did during the recruitment process? ",,False,,t5_2s0mx,False,Gold,
1358378030.0,16pqj0,80's party decoration advice?,Panoptic0n8,2,2,10,"We're havin our first 80's party of the year this weekend
",,t5_2s0mx,False,,Gold,True,http://www.reddit.com/r/Frat/comments/16pqj0/80s_party_decoration_advice/
1357888356.0,16d9t3,Fraternal Rings?,Impune,6,7,11,"My Chapter is thinking of commissioning some rings from [Dexter](http://www.familysealrings.com/Fraternity_Seal_Rings.html). I like the idea

We're most likely going straightforward with [our crest](http://pks.org/images/Crest%20b%20small.jpg) as a deep ingraved signet (so it could make a wax impression)

What are your opinions on fraternity (or class/school) rings? What's your initial impression of them,False,,t5_2s0mx,False,,Gold,t3_16d9t3
1357888053.0,16d9lm,How do you evaluate pledges?,itsziggy,2,2,2,"I'm the new Pledge Educator of a newer fraternity on my campus. We're only 3 years old and are still trying to solidify certain aspects of our brotherhood. I'm trying to make a kick-ass pledge education program that makes a really close pledge class. In the past we evaluated pledges with points

How do you evaluate pledges in your fraternities?",,t5_2s0mx,False,,,True,http://www.reddit.com/r/Frat/comments/16d9lm/how_do_you_evaluate_pledges/
1357442224.0,161i9l,Who would like to see an updated version of Animal House,fraekmaester,13,14,11,"Just watched Animal House for the first time,False,
1356957108.0,15pz2e,Is it right to condone frat business when drunk?,GalacticExplosion,5,6,9,"I need an honest opinion; today my prez and I were day drinking with friends at a bar/grille. We have recently come to good terms with another frat and their VP was hanging with us. My Prez openly talked about the idea of rushing togethor,,Gold
1356738107.0,15ljfq,Fratty literature,TXLAX,24,26,57,"Since linking new novels that aren't TFM's gay ass book is apparently not kosher,,
1355691967.0,14ygln,Age old question: Is the recreational use of marijuana Frat?,yonkatonka,7,8,9,"I have been in different arguments over the past few years about whether weed is FAF or NF.

What I have personally decided (feel free to disagree) is that marijuana culture is NF

Please give your thoughts.",,t5_2s0mx,False,,,True,http://www.reddit.com/r/Frat/comments/14ygln/age_old_question_is_the_recreational_use_of/
1355673724.0,14y0am,Create a YouTube page for your chapter to share accomplishments and good times. Here's an awesome example,pkt-Steve,6,6,6,,t5_2s0mx,False
1355558652.0,14vyt9,"I'm a big-ass Senior in high school, wanting to rush next year. Looking for nice big and tall clothes",hm94991,4,4,http://www.reddit.com/r/Frat/comments/14vyt9/im_a_bigass_senior_in_high_school_wanting_to_rush/, Southern Proper,False
1354593072.0,148rc5,"Alcohol paraphernalia, looking for creative fun shit to bust out at parties to get everyone fucked up  ",,1,1,http://www.reddit.com/r/Frat/comments/148rc5/alcohol_paraphernalia_looking_for_creative_fun/,False,
1354079278.0,13x3hq,Rushing sophomore year in the spring (UT at Austin),UTexas16,3,3,3,"What's up fellow redditors. I've been considering for quite some time rushing a fraternity, or just being indecisive. My question is,
1354002381.0,13v4jq,Pinning Ceremony,stonedotjimmy,7,7,10,"One of the brothers wants to pin his girlfriend,,False
1351736389.0,12fq54,The pledge shopping list for our first homecoming as alums,butters231,4,4,2,,t5_2s0mx,False
1349740860.0,1160te,fratmusic.com playlists,agentprice007,1,2,1,hey does anyone know where one can find a list of the songs on various playlists from fratmusic.com? thanks,t5_2s0mx,True
1349441922.0,10znn6,This is one of my pledges,BigBadBacon11,7,7,2,,t5_2s0mx,False
1349318669.0,10wxfe,Opinions on Debate?,Carson_Perry,5,5,3,"In my opinion,,Gold
1349155379.0,10sxfu,When frat meets overly attached girlfriend,sjennings,4,5,0,,t5_2s0mx,False
1348802093.0,10lngi,Bro Rape: A Newsline Investigative Report ,Sir_smokes_a_lot,14,14,4,,t5_2s0mx,False
1348706366.0,10jd04,Need ideas for mountain weekend/retreat shirt,Zidless,6,6,12,"So my fraternity is having a mountain retreat in about 2 months and I have been put in charge of designing a shirt for this year. I have a few ideas,,Gold
1348531896.0,10f6le,Homecoming T-Shirts?,chitownfan1,2,2,2,Do any of yall have some good homecoming t-shirt ideas? I'm in charge of making my chapter's shirt and I was looking to see what some of yall had come up with in the past.,t5_2s0mx,True
1347201122.0,zlp3q,Greatest living frat stars,Pharaca,2,2,1,"I saw a comment a while ago on TFM that W was the greatest living frat star. It got me thinking

W, Drew Brees, Eli Manning (Not Aaron Rodgers, sorry but ""honorary"" members don't count for this exercise) are all up there. Who else?",,False,,False,t3_zlp3q
1346884529.0,zf0z7,TKE's Call Me Maybe - House Sweetheart cover,kevmo1,3,3,0,,t5_2s0mx,False
1346382698.0,z46tf,What are some original ideas for giving sorority girls your rose after you serenade them?,SgoSgoSgo,3,3,1,I know a lot of universities in my area have the pledges serenade the new freshman girls from different sororities around campus. After each serenade each girl gets their name called out and a pledge has to give them a rose in a unique (usually funny) way. What are some ways you guys have given girls a rose? ,t5_2s0mx,True
1346283797.0,z1qg8,New Rush Shirts,zmuel4,21,22,8,,t5_2s0mx,False
1345944575.0,yu08c,How much ass do you really get in a frat?,Mymotherslover,3,3,7,I have never been in a frat but from what I have seen it looks like the guys are getting a lot of tail.,t5_2s0mx,True
1345761846.0,ypzii,"Free Fratpack (sunglasses, shot glasses, flasks, shirts)",mohawk906,6,,False
1345564382.0,yl2fn,Do Frats accept Online Students? ,Thinktankjf,4,4,5,"I will be enrolling in computer sciences at an accredited uni
Before i met my girlfriend
Through her
I used to think greek types where shallow
They do allot of charity work and are usually well rounded people.
 Coming from the working world, sometimes silly thing.
( Seriously

Are there any international or local frats that accept students from online schools ?
",,t5_2s0mx,False,,,True,http://www.reddit.com/r/Frat/comments/yl2fn/do_frats_accept_online_students/
1345093447.0,yazv1,Mitt Romney is NF,Broseidons_Brocean,9,7,2,,t5_2s0mx,False
1344902088.0,y68ps,What's the best online fraternity management website?,AlaskanSoccer,7,8,23,"We were using Chapter Board,,False
1343186824.0,x41ot,Anyone have a party plan for money?,iveyiv,3,3,9,"So im sure alot of your fraternities have parties and you pay dues. However the dues do not cover alcohol at all. If any of you made a plan let me know

110 people X 150$ at the begining of the semester = 17.6k for booze for whole semester

15 weeks in my semester so comes down to 10 dollars a week per person. Totals in 1173$ per week. We have 3 parties a week

Has anyone ever tried something like this or have advice?",,t5_2s0mx,False,,,True,http://www.reddit.com/r/Frat/comments/x41ot/anyone_have_a_party_plan_for_money/
1343113081.0,x297z,Any Lambda's going to this week's national convention?,,1,1,0,,t5_2s0mx,True
1342295794.0,wk7x6,Decent substitution to khaki Chubbies to hold me over.,boatz_n_hoez,1,1,2,Mine are out of commission and god knows when Chubbies will get new ones. Any suggestions?,t5_2s0mx,True
1341979012.0,wd901,"Making Greek Social Management Website, need y'alls input",FreshNeverFrozen,6,5,http://www.reddit.com/r/Frat/comments/wd901/making_greek_social_management_website_need_yalls/

A few of us had some similar ideas all based around greeklife so we decided we could make something out of them. Facebook really doesn't cut it. It's way to public and too difficult to manage people in groups that you aren't part of (e.g. you can't make use of a sorority Facebook group).

Problems we saw:

* Its difficult to get the word out to the people you want and only them
* Frats are terrible at keeping their brothers on track with the social schedule
* Finding dates to formals or date-parties is really annoying unless you plan on taking your friend in another sorority
* Getting set up by friends is awkward
* There is no forum for two houses (one frat and one sorority) to discuss their activity
* Organizing a Formal out of town is very time consuming and expensive including busses

We aim to solve these problems.

[Here](http://vimeo.com/44292496) is a link to our pitch deck (I'm not in the video).

What I need from y'all:

* What is difficult for you as a brother?
* What is difficult for the social chair?
* How could a service improve the quality of greek life?
* Would you use such a service?
* Have you heard of innergreek? Do you use it?

Please give me any feedback you can

Thanks boys",,t5_2s0mx,False,,Gold,True,http://www.reddit.com/r/Frat/comments/wd901/making_greek_social_management_website_need_yalls/
1341706611.0,w780q,Any fraternities or sororities with dark/interesting rituals?,Threedin,5,5,14,know any modern day organizations with interesting rituals? Most of the sacrificial or other illegal tidings have been (or to my knowledge) pretty much changed to something vanilla and harmless. ,t5_2s0mx,True
1341239277.0,vxar8,What fraternity on your campus can you not stand?,,9,8,48,"This by no means should be offensive to anyone. Every campus is different.. But at my school,,
1338842912.0,uktmf,Rush Branding Techniques,surferdude313,2,2,3,Some fraternities put their letters on bottle openers or keychains etc. and hand them out during rush events. Just wondering if anyone has had any really creative items to put letters on to give out during rush.,t5_2s0mx,True
1337915519.0,u3w52,Getting ready for Greek Week!,sexpert17,3,3,1,,t5_2s0mx,False
1337810532.0,u1pir,"Can't decided if I want these pants in gray or gray heath. Decisions, decisions...",sufferingohioan,7,8,http://www.reddit.com/r/Frat/comments/u1pir/cant_decided_if_i_want_these_pants_in_gray_or/,,Gold
1337562057.0,twrf6,Do all frats haze?,q0w9e8123,8,8,24,"I'm planning on pledging next year as an incoming freshman. I am not sure which frat I will join. I enjoy partying and all

",,t5_2s0mx,False,,,True,http://www.reddit.com/r/Frat/comments/twrf6/do_all_frats_haze/
1336928916.0,tl5a6,"Finally found this subreddit, but I need help.",Tim_Tebow_fan,9,9,http://www.reddit.com/r/Frat/comments/tl5a6/finally_found_this_subreddit_but_i_need_help/,,Gold
1336281767.0,t9d3k,r/frat's opinion on movies,reekomds,3,3,3,Best fratty movies. These can be fraternity related or any other movie. I feel Animal House is an obvious one. My favorite movie is I Hope They Serve Beer In Hell what about y'all,t5_2s0mx,True
1336269211.0,t9554,Aisle FAF,,6,6,0,,t5_2s0mx,False
1336025880.0,t4q2q,Fratty hair styles?,Mograne,6,4,3,"Going to the barber in a couple days. What are some fratty hair styles? I have always kept it short and clean(besides a styling phase I went through in like,,
1335989717.0,t3u03,Transferring fraternities?,Westtex,4,4,29,"I am currently a brother (for a semester) in a fraternity yet I  have to transfer to another college as I am enlisting in the national guard in that state,,False
1335939911.0,t2x9m,The Best Colleges for Bros,LegendsNeverDie,3,3,1,,t5_2s0mx,False
1335903094.0,t20lo,Real Life Beta: How To Make It Through College (from American Gentleman Magazine),AmericanGentleman,3,3,0,,t5_2s0mx,False
1335476136.0,su81h,/r/adviceanimals is NF,Broseidons_Brocean,10,9,4,,t5_2s0mx,False
1335278542.0,sq03g,Greek Week Banner (Sigma Pi),Frinkles,9,11,5,,t5_2s0mx,False
1334999646.0,sl38x,What does your nationals do to support your chapter?,Broseidons_Brocean,3,3,18,"As a Kappa Sigma

What we don't get:
Rush support
Active involvement by nationals

What we DO get:
Increased rules stifling our creativity
Sanctions
Ultimatums

Just wondering what some other fraternity's nationals do to help your chapters out.",,t5_2s0mx,False,,Gold,True,http://www.reddit.com/r/Frat/comments/sl38x/what_does_your_nationals_do_to_support_your/
