created_utc,id,title,author,ups,downs,num_comments,selftext,subreddit_id,is_self
1369415341.0,1ezbmc,Evolution of medieval helmets,Zebra2,103,6,12,,t5_2sa8g,False
1356413229.0,15eqmb,"Just received this for Xmas, The Coat of Arms of the Great Monarchs of Europe. Thought y'all would be interested.",NecroKnight,92,6,http://www.reddit.com/r/MedievalHistory/comments/15eqmb/just_received_this_for_xmas_the_coat_of_arms_of/,http://b.thumbs.redditmedia.com/r-FsBnsOs8w2PAsU.jpg,
1339579064.0,uzkkn,"I recently visited the Art Institute of Chicago, here's my photos of their Arms and Armor section featuring a lot of mid-1400's to early-1600's examples as well as some artwork",huxtiblejones,72,3,http://www.reddit.com/r/MedievalHistory/comments/uzkkn/i_recently_visited_the_art_institute_of_chicago/,http://e.thumbs.redditmedia.com/1YlKon89yA1xEJRp.jpg,
1350260579.0,11hiii,From the Gorleston Psalter. 1310-1324,birdinspace,70,5,3,,t5_2sa8g,False
1344254591.0,xrfrs,Greed was different in the Middle Ages,baduhar,64,1,2,,t5_2sa8g,False
1345931662.0,ytozu,Found this interesting illustration in a Flemish book of songs (1542),birdinspace,66,2,8,,t5_2sa8g,False
1346204374.0,yzuwh,"speaking of interesting illustrations...this is from the Codex Justinianus. (Bologna, 3rd quarter of the 13th century).",birdinspace,61,3,http://www.reddit.com/r/MedievalHistory/comments/yzuwh/speaking_of_interesting_illustrationsthis_is_from/,nsfw,
1337987061.0,u57tr,Gorgeous Medieval Alphabet Cookies,Pandora_Glovebox,63,7,6,,t5_2sa8g,False
1363365823.0,1acw61,The Book of Kells is now available for online viewing,runbikekindaswim,57,5,1,,t5_2sa8g,False
1372040771.0,1gxzon,Names for medieval pet dogs and cats that actually appear in the historical record,historybuffCO,55,8,2,,t5_2sa8g,False
1334124035.0,s3y53,"Luna: a website with over 30,000 high quality scans of medieval manuscript pages - would love to hear what other people think on the sub. ",OldEnglishNerd,51,1,http://www.reddit.com/r/MedievalHistory/comments/s3y53/luna_a_website_with_over_30000_high_quality_scans/,http://e.thumbs.redditmedia.com/AeFKHaaqDpUs4lvj.jpg,
1359996618.0,17vgev,King Richard the III,specieshumanoid,58,8,3,,t5_2sa8g,False
1359127454.0,179ast,"On January 25, 1308, King Edward II of England married Isabella of France.  The couple were not well matched.",historybuffCO,51,6,False,
1367169169.0,1da3mj,A piece of wood from a storehouse in Norway reflects back to a story of a young girl who survived the bubonic plague,historybuffCO,54,7,1,,t5_2sa8g,False
1365363474.0,1bva3v,"Mary Tudor, sister of King Henry VIII, began her married life as a victim of circumstances but ended up marrying the love of her life.",historybuffCO,56,6,False,
1357838278.0,16bmdo,Six of the strangest medieval diseases,historybuffCO,56,7,1,,t5_2sa8g,False
1362075833.0,19eqdg,"Medieval History in the Movies: Fordham University has put together comprehensive list of the good, the bad, and the cliché. (x-post from /r/movies).",18brumaire,52,3,False,
1350841614.0,11uo4h,"Additional medieval tombs near Timbuktu were destroyed by extremists this week - “They arrived aboard 6 or 7 vehicles, heavily armed &amp; flattened everything with a bulldozer &amp; pulled up the skeletal remains.” N Mali is now under the control of rebels. ",anutensil,49,3,http://www.reddit.com/r/MedievalHistory/comments/11uo4h/additional_medieval_tombs_near_timbuktu_were/,http://c.thumbs.redditmedia.com/mwP6G5UbYPg5FFs2.jpg,
1358960585.0,174pc7,"Beauty, Health and Hygiene of Medieval Women",historybuffCO,46,2,http://www.reddit.com/r/MedievalHistory/comments/174pc7/beauty_health_and_hygiene_of_medieval_women/,http://d.thumbs.redditmedia.com/DfuusE_SX5byPU-K.jpg,
1366932423.0,1d48tz,"The Danelaw, as recorded in the Anglo-Saxon Chronicle is a historical name given to the part of England in which the laws of the “Danes” held sway and dominated those of the Anglo-Saxons.",historybuffCO,47,5,http://www.reddit.com/r/MedievalHistory/comments/1d48tz/the_danelaw_as_recorded_in_the_anglosaxon/,http://e.thumbs.redditmedia.com/Fqv1oxKduf1zqhW4.jpg,
1358035888.0,16gpao,Pictures from medieval manuscripts of snowball fights,historybuffCO,50,6,0,,t5_2sa8g,False
1347868451.0,100i9l,"How to Make a Medieval Film [""Hark, a vagrant"" comic strip]",mykindoftown,50,5,http://www.reddit.com/r/MedievalHistory/comments/100i9l/how_to_make_a_medieval_film_hark_a_vagrant_comic/,http://b.thumbs.redditmedia.com/jG6wr3GBAMO2VtHs.jpg,
1335385794.0,ssc42,Great timeline chart of the crusades,imagineyoung,45,3,0,,t5_2sa8g,False
1371403943.0,1ggood,"Rindoon: Deserted medieval town in Country Roscommon, Ireland",historybuffCO,40,0,http://www.reddit.com/r/MedievalHistory/comments/1ggood/rindoon_deserted_medieval_town_in_country/,http://d.thumbs.redditmedia.com/tIr3nHVINvqekwyW.jpg,
1370442571.0,1fq0kl,The Merovingians: The Kings and Queens of the Franks,historybuffCO,42,1,0,,t5_2sa8g,False
1371685355.0,1gownw,Medieval Warfare in the Reign of Charlemagne,historybuffCO,40,5,4,,t5_2sa8g,False
1362758865.0,19x0vp,A sad day for the city of Worcester MA and people who like Medieval History,sbaat,39,5,9,,t5_2sa8g,False
1346412369.0,z4p87,"Couple finds medieval well, believed to date to 16th century, beneath sofa (x-post from /r/history)",miskatonic_dropout,40,3,False,
1358100880.0,16i104,"Tiny prayer book that belonged to Queen Claude of France, late 15th-early 16th C.",historybuffCO,38,1,http://www.reddit.com/r/MedievalHistory/comments/16i104/tiny_prayer_book_that_belonged_to_queen_claude_of/,http://a.thumbs.redditmedia.com/MOSEFz4h6CIqqoSf.jpg,
1372685840.0,1hfayw,"A skeleton found in a stone sarcophagus in Lincoln Castle could belong to a Saxon king or bishop, c. 900 AD",historybuffCO,39,4,http://www.reddit.com/r/MedievalHistory/comments/1hfayw/a_skeleton_found_in_a_stone_sarcophagus_in/,http://c.thumbs.redditmedia.com/aaV_7APss2x5an_D.jpg,
1369239614.0,1eub4z,Archaeologists uncover Saxon Pagan skeletons at housing development near Stonehenge,historybuffCO,43,7,0,,t5_2sa8g,False
1363214322.0,1a8vty,Another archaeological discovery under a UK car park! A 13th century medieval nobleman!,runbikekindaswim,39,5,2,,t5_2sa8g,False
1358207258.0,16kzkb,Aethelred the Unready was King of England from 978–1013 and 1014–1016.  He was beseiged by Vikings from everywhere.,historybuffCO,38,4,4,,t5_2sa8g,False
1350954105.0,11x02l,Fascinating new image of Henry VIII discovered - depicted as an 11 yr old boy grieving his mother (top left of image).,borysSNORC,37,0,2,,t5_2sa8g,False
1365693118.0,1c4zku,"Ӕlfwynn of Mercia, Anglo-Saxon princess, grand-daughter of King Alfred the Great",historybuffCO,35,0,False,
1348975622.0,10p3eo,Surnames given to children abandoned at monasteries?,SteampunkGeisha,43,6,12,"I'm doing a write up for a story concept and I'm trying to do some research into the surnames that were given to babies that were abandoned at monasteries back in the medieval/renaissance period. Was there a pattern?  Were they even given surnames?  Or was it a generic name given to all children like ""Kirkpatrick""

Any information would be greatly appreciated.",self,t5_2sa8g,1348985969.0,,,True,http://www.reddit.com/r/MedievalHistory/comments/10p3eo/surnames_given_to_children_abandoned_at/
1336906505.0,tku6r,Terry Jones' Medieval Lives - A look at the Medieval world with the intent of finding out what it was really like. ,seouldavid,40,2,3,,t5_2sa8g,False
1372437792.0,1h99is,"Over half a millennium ago, the child who would one day reign as Henry VIII was born June 28, 1491 at Greenwich Palace, London to parents, Henry VII and Elizabeth of York.",39,,t5_2sa8g
1371518394.0,1gk10v,Face of 16th-century English archer revealed,luvisgreaterthanfear,39,1,7,,t5_2sa8g,False
1365217545.0,1brzms,They put the evil in Medieval; Some real-live bad guys of the Middle Ages,mykindoftown,44,13,2,,t5_2sa8g,False
1323049691.0,n0glw,Useful Map for Visualizing the Changing Borders in the Medieval Period,leavesoflorien,36,2,6,,t5_2sa8g,False
1368632854.0,1edz85,"Dating from the 8th century AD, the Moylough belt shrine is one of the great treasures of early Ireland.",historybuffCO,36,1,http://www.reddit.com/r/MedievalHistory/comments/1edz85/dating_from_the_8th_century_ad_the_moylough_belt/,http://e.thumbs.redditmedia.com/MXt-s8dYE2mXvZLd.jpg,
1365629076.0,1c39nd,"Inns appeared in England in the twelfth and thirteenth centuries, and were apparently fairly common, especially in towns, by the fifteenth century.",historybuffCO,4,,False
1334269876.0,s6xq3,Oxford's Bodleian Libraries and the Vatican's Biblioteca Apostolica plan to digitise 1.5 million ancient texts to make them available online. - BBC News,OldEnglishNerd,33,0,1,,t5_2sa8g,False
1371084729.0,1g8ihd,Help save manuscripts that date back to the 14th century.,Jesufication,35,3,2,,t5_2sa8g,False
1368718015.0,1egea6,"1000 year old church found under Lincoln Castle, possibly pre-Norman Conquest",historybuffCO,35,4,http://www.reddit.com/r/MedievalHistory/comments/1egea6/1000_year_old_church_found_under_lincoln_castle/,http://e.thumbs.redditmedia.com/jVhdNWm4ZBpKkrTF.jpg,
1367447648.0,1difzj,What did the Renaissance man wear? Historian recreates outfit from the 16th century,historybuffCO,35,0,1,,t5_2sa8g,False
1365363207.0,1bv9rn,Bones of the Vikings: when raiding goes wrong,historybuffCO,33,1,1,,t5_2sa8g,False
1364756606.0,1bde4v,Happy Hug A Medievalist Day!,runbikekindaswim,41,6,2,,t5_2sa8g,False
1350377938.0,11k97o,"Byzantium, The Lost Empire - video documentary in 4 parts (x-post from r/EastRome)",Qwill2,37,3,http://www.reddit.com/r/MedievalHistory/comments/11k97o/byzantium_the_lost_empire_video_documentary_in_4/,http://b.thumbs.redditmedia.com/CX7laKiiY270_Ja7.jpg,
1346985293.0,zhhk8,What the game of Operation would look like in the Middle Ages,garmonboziamilkshake,34,2,4,,t5_2sa8g,False
1342348851.0,wl7zg,"Medieval Prostitution : The Sex Trade in Medieval Europe (institutions, laws and govt response).",borysSNORC,35,1,http://www.reddit.com/r/MedievalHistory/comments/wl7zg/medieval_prostitution_the_sex_trade_in_medieval/,http://a.thumbs.redditmedia.com/ovnfq6Fq3szFB8vl.jpg,
1375136881.0,1jb3ha,Ten Beautiful Medieval Maps,historybuffCO,36,4,4,,t5_2sa8g,False
1369879645.0,1fb6pg,Henry VIII's lost men: Faces of doomed sailors who went down with the Mary Rose revealed for first time as part of new £27m maritime museum's exhibition,historybuffCO,36,6,2,,t5_2sa8g,False
1369057849.0,1eoypi,"Today is the anniversary of the battle of Dun Nechtáin in which the Picts, led by their king Bridei, defeated the English of Northumbria. It was fought on 20th May 685",historybuffCO,32,0,False,
1363676982.0,1akxbo,Egil Skallagrimsson and the Viking Ideal,Qwill2,32,1,0,,t5_2sa8g,False
1359909133.0,17t7w9,Zoom views of the interior and Byzantine art of the Hagia Sophia in Istanbul,historybuffCO,35,1,2,,t5_2sa8g,False
1370892229.0,1g2bh6,14th C. parchment manuscript mended with silk thread,historybuffCO,30,2,0,,t5_2sa8g,False
1370512903.0,1fs5xs,What Did Medieval Kings Really Look Like? (xpost from r/ukhistory),travellersspice,33,5,2,,t5_2sa8g,False
1369835007.0,1f9mz2,Archaeologists find underground medieval refuge in France believed to be dated from the 11th C.,historybuffCO,32,2,0,,t5_2sa8g,False
1368239567.0,1e3wtz,"""England's Atlantis"" - The medieval town of Dunwich, a former major English port, lies submerged off the coast today",born_lever_puller,33,0,False,
1366141098.0,1chbpv,The discovery of an apparent Anglo-Saxon grave underneath a church could be proof of the siting of a Seventh Century monastery.,historybuffCO,33,4,0,,t5_2sa8g,False
1360700913.0,18eb4h,A Decent FREE Site with Gregorian Chants,JoeAllan,32,2,7,,t5_2sa8g,False
1352904060.0,136k9q,"Illuminations, The Private Lives of Medieval Kings - BBCFour documentary in 3 parts.",iamnotmichelle,31,3,http://www.reddit.com/r/MedievalHistory/comments/136k9q/illuminations_the_private_lives_of_medieval_kings/,http://b.thumbs.redditmedia.com/Je0-91aFzcuRO1U1.jpg,
1344185798.0,xpx0u,"Anglo Saxon Riddle from the Exeter Manuscript: original and translation, can you solve the riddle?  comments welcome!",OldEnglishNerd,32,1,http://www.reddit.com/r/MedievalHistory/comments/xpx0u/anglo_saxon_riddle_from_the_exeter_manuscript/,http://b.thumbs.redditmedia.com/euk1be1xPBLZxfJm.jpg,
1333543610.0,rssep,"Medieval books digitized, posted online",italianjob17,30,0,http://www.reddit.com/r/MedievalHistory/comments/rssep/medieval_books_digitized_posted_online/,http://c.thumbs.redditmedia.com/Q06jaudoF5dXpj5J.jpg,
1375107668.0,1j9zfz,The Last Will and Testament of King Alfred the Great now available digitally from the British Library,historybuffCO,29,1,1,,t5_2sa8g,False
1345886543.0,ystre,"The Early Middle Ages (Open Yale Courses) - Major developments in the political, social, and religious history of Western Europe from the accession of Diocletian to the feudal transformation. ",seouldavid,30,8,False,
1344616395.0,y04l7,Thousands of 13th-Century Londoners may have been killed by a distant volcano,miskatonic_dropout,30,2,0,,t5_2sa8g,False
1341085422.0,vuoz2,24/7 non stop medieval and renaissance music.,faxillus,33,6,8,,t5_2sa8g,False
1369965120.0,1fdm2u,Carbon Dating Confirms World's Oldest Torah,runbikekindaswim,31,5,0,,t5_2sa8g,False
1368208030.0,1e2x12,The Last of the Great Chained Libraries,travellersspice,28,0,2,,t5_2sa8g,False
1360876566.0,18jf1l,New archaeology project has begun to bring to light hundreds of secretive inscriptions that have lain hidden on the walls of Norwich Cathedral for many centuries.,BAJR,32,4,0,,t5_2sa8g,False
1358708913.0,16xwst,Prominent Figures of the First Crusade,deannap,31,3,5,,t5_2sa8g,False
1358468923.0,16saf8,The Devil and Demons in Medieval Art,historybuffCO,29,1,1,,t5_2sa8g,False
1356295009.0,15c8jc,Aelfthryth was a 10th C. Anglo-Saxon Queen of England with a fairy tale life,historybuffCO,32,3,2,,t5_2sa8g,False
1355864550.0,152jlc,Christmas in the Middle Ages.,borysSNORC,30,0,1,,t5_2sa8g,False
1340571421.0,vje8w,Bamburgh Sword,varangianway,28,1,1,,t5_2sa8g,False
1333228055.0,rmua9,Crosspost from r/Documentaries - Terry Jones' Medieval Lives,Ladymia69,28,0,3,,t5_2sa8g,False
1315918371.0,ke5xc,Lindisfarne. A comic.,Skadler,32,4,1,,t5_2sa8g,False
1368896066.0,1el0hk,"The Lindisfarne Gospels is a spectacular example of Insular or Hiberno-Saxon art—works produced in the British Isles between 500-900 C.E., a time of devastating invasions and political upheavals.",historybuffCO,28,1,http://www.reddit.com/r/MedievalHistory/comments/1el0hk/the_lindisfarne_gospels_is_a_spectacular_example/,http://c.thumbs.redditmedia.com/C5I0PlnvxiesF_-D.jpg,
1368826827.0,1ejk0e,"Syphilis, sex and fear: How the French disease conquered the world",borysSNORC,29,3,http://www.reddit.com/r/MedievalHistory/comments/1ejk0e/syphilis_sex_and_fear_how_the_french_disease/,http://c.thumbs.redditmedia.com/cJNyUckrIHSSSBQJ.jpg,
1366222711.0,1cjqwo,"Pardon the digression from scholarly works, but the 60s were a rad time, man.",bobosaurs,33,2,False,
1361486431.0,18zebf,Anglo-Saxon England went off horse meat because it was viewed as 'pagan' food,konstantin1389,30,1,1,,t5_2sa8g,False
1361298346.0,18tx5q,Medieval Village Discovered Outside Selkirk,JoeAllan,29,1,0,,t5_2sa8g,False
1355757995.0,14zvbr,Some pictures from the 11th C. illuminated Book of Kells,historybuffCO,32,5,3,,t5_2sa8g,False
1345712402.0,york4,"Whether you were a cleric grappling with celibacy or a noble forced to demonstrate his virility in combat, what was it like to be a man in the Middle Ages?
",2,11,http://www.reddit.com/r/MedievalHistory/comments/york4/whether_you_were_a_cleric_grappling_with_celibacy/,,,False,t5_2sa8g,False
1343774559.0,xh2h0,Sixth-century Anglo-Saxon woman discovered by British soldiers in Operation Nightingale,borysSNORC,27,0,0,,t5_2sa8g,False
1324191498.0,nh50h,"Medieval knights are often depicted as bloodthirsty men who enjoyed killing -  However, new research has led to the conclusion that this picture is a flawed one",anutensil,35,8,http://www.reddit.com/r/MedievalHistory/comments/nh50h/medieval_knights_are_often_depicted_as/,http://a.thumbs.redditmedia.com/GEAFNum-5211o2eN.jpg,
1308156965.0,i0fkv,"If You Wan't to be a Medievalist, Break your Armour Misconceptions!",VonPlutz,29,4,http://www.reddit.com/r/MedievalHistory/comments/i0fkv/if_you_want_to_be_a_medievalist_break_your_armour/,http://thumbs.reddit.com/t3_i0fkv.png,
1371148155.0,1ga8bj,The Art of Onfim: Medieval Novgorod Through the Eyes of a Child,fuzz_junket,30,4,2,,t5_2sa8g,False
1370357573.0,1fnk0y,Brunanburh: The Battle that Created Britain (937 AD),historybuffCO,30,5,1,,t5_2sa8g,False
1369695657.0,1f5xkf,Illuminated manuscripts depicting women artists in the 1400's,historybuffCO,28,2,1,,t5_2sa8g,False
1369146237.0,1erjl5,"Was the ""White Ship"" disaster mass murder? The death of William Aetheling put the English succession in disarray",historybuffCO,30,2,2,,t5_2sa8g,False
1363097750.0,1a5bsf,What Does This Head from the Thirteenth Century Tell Us About Medieval Medicine?,historybuffCO,27,3,6,,t5_2sa8g,False
1356102954.0,1589p3,Huge online database on mercenaries operating in Italy between 1300-1350 [in Italian],kowalsky9999,29,2,0,,t5_2sa8g,False
1340969547.0,vshha,"Recent evidence dates complex stringed instruments in northern Europe at being 2000+ years old! ""An incredible find"" from the Isle of Skye, Scotland.",EmirikolWoker,27,0,http://www.reddit.com/r/MedievalHistory/comments/vshha/recent_evidence_dates_complex_stringed/,http://e.thumbs.redditmedia.com/neQsqPD-05ezf6dX.jpg,
1327541111.0,owx0w,Viking mass grave linked to elite killers of the medieval world,anutensil,27,2,0,,t5_2sa8g,False
1376237369.0,1k5dfw,Pet Care Advice from the Middle Ages,historybuffCO,25,2,0,,t5_2sa8g,False
1372967338.0,1hnghi,"Kings, knights, monks, peasants – everyone in the Middle Ages ate bread.",historybuffCO,5,,False
1370704691.0,1fxg28,"James Stewart I, King of Scots had an unusual reign in many ways. His rule began while he was a prisoner in England &amp; his rule certainly ended in a tumultuous &amp; violent manner.",historybuffCO,25,0,http://www.reddit.com/r/MedievalHistory/comments/1fxg28/james_stewart_i_king_of_scots_had_an_unusual/,http://f.thumbs.redditmedia.com/7DuImJhUSb2xjyy_.jpg,
1370616411.0,1fv43m,"Archaeologists find coin from the time of Charlemagne in Trondheim, Norway. It's a very unusual find.",historybuffCO,27,3,http://www.reddit.com/r/MedievalHistory/comments/1fv43m/archaeologists_find_coin_from_the_time_of/,http://e.thumbs.redditmedia.com/NkEp5zYrfN7Pf5ZL.jpg,
1364140350.0,1ax0v6,"The life of Mary of Burgundy, only child of Charles the Bold, came to a tragic end when she was 25",historybuffCO,29,2,False,
1362957987.0,1a1rty,"""Pax Mongolica"" - great article",1914177614921066476,25,0,2,,t5_2sa8g,False
1348132181.0,106njw,Medieval Manuscript (a Royal Romuléon) with footnotes for the illuminator giving instructions on what to draw!,borysSNORC,28,3,5,,t5_2sa8g,False
1346653042.0,z9os9,Anyone know of any very cool movies (foreign or not) regarding the Byzantines or Ottomans? ,LBOIV001,25,0,4,"I can't find much on these two fascinating subjects. There (to me) is much more dramatic subject matter to be drawn from in the history of both of these empires.....

Ancient Rome seems to be one of the only fallen empire that Hollywood cares about..... I think Byzantine history is far more interesting

Does anyone here agree

Thanks in advance....",self,t5_2sa8g,False,,,True,http://www.reddit.com/r/MedievalHistory/comments/z9os9/anyone_know_of_any_very_cool_movies_foreign_or/
1345146359.0,yc4uq,If you're interested in the art of Illuminated Manuscripts please take a moment to check out the new community /r/illuminatedmanuscript and stay informed about this spectacular tradition,huxtiblejones,27,3,0,,t5_2sa8g,False
1339110093.0,uqlgr,Shakespeare's Curtain Theatre (where Henry V and Romeo &amp; Juliet were first performed) is finally located in a yard behind a Shoreditch pub.,borysSNORC,28,2,0,,t5_2sa8g,False
1324408677.0,nk6hd,Nice Presentation of the Bayeux Tapestry,leavesoflorien,26,3,4,,t5_2sa8g,False
1318444675.0,l9uh0,The Black Death has been conclusively proven to have been caused by Yersinia pestis (aka Bubonic Plague).,koselig,25,0,10,,t5_2sa8g,False
1374452959.0,1is419,Picture from A Carolingian Masterpiece: the Moutier-Grandval Bible,historybuffCO,25,2,1,,t5_2sa8g,False
1359678127.0,17nw12,Chaucer once lived in apartments above Aldgate in the Roman Wall of London. Here is a history of Aldgate,historybuffCO,25,1,0,,t5_2sa8g,False
1376445481.0,1kbklt,Should I have sex with this person? A medieval flow-chart,medievalrockstar,56,31,8,,t5_2sa8g,False
1374603158.0,1iwd9w,Archaeologists are hoping to discover who was buried in a 14th century stone coffin found near the final resting place of Richard III.,historybuffCO,24,1,2,,t5_2sa8g,False
1374460592.0,1iscjc,The Night the Moon exploded and other Lunar tales from the Middle Ages,Astronoid,25,4,1,,t5_2sa8g,False
1370114880.0,1fh824,A fragment of a unique and mysterious silver plaque discovered in South Karelia may force historians to rethink some of Finland's early Merovingian Iron Age history (600-800 AD).,historybuffCO,24,2,0,,t5_2sa8g,False
1365860906.0,1c9nsn,"4th C. Roman coins found in the Neolithic passage tomb of Newgrange, Ireland",historybuffCO,27,4,http://www.reddit.com/r/MedievalHistory/comments/1c9nsn/4th_c_roman_coins_found_in_the_neolithic_passage/,http://c.thumbs.redditmedia.com/Ul91_wL4WQCRtjRb.jpg,
1364493487.0,1b6uic,"Eberhard Kummer sings ""Es nahet gen der Uasenacht"" (by tyrolean poet and composer Oswald von Wolkenstein a.d. 1422)and plays a hurdy-gurdy ",Grilled_Bear,25,3,2,,t5_2sa8g,False
1363128588.0,1a6et5,"The remains of a Saxon hut at the proposed site of a nuclear power station near Bridgwater, Somerset is shedding new light on 7th C. England.",historybuffCO,25,2,http://www.reddit.com/r/MedievalHistory/comments/1a6et5/the_remains_of_a_saxon_hut_at_the_proposed_site/,http://f.thumbs.redditmedia.com/15-4Mro_potxxjg5.jpg,
1357483128.0,1627x1,The monks who liked to draw bottoms,kateshrewsday,25,1,8,,t5_2sa8g,False
1355589073.0,14wcwd,Digital gallery of Scandinavian medieval tapestries,historybuffCO,25,2,0,,t5_2sa8g,False
1346320343.0,z2jlc,Recently digitized Talbot Shrewsbury Book - The Art of Chivalry.  Beautiful manuscript with gorgeous detailed illuminations.,borysSNORC,24,2,0,,t5_2sa8g,False
1337909618.0,u3r65, Would anyone recommend a good academic book on the Holy Roman Empire in the High Middle Ages?,tehguitarman001,23,0,8,,t5_2sa8g,False
1335031679.0,sliha,"The reading habits of medieval people have revealed details of their lifestyle, in research carried out at St Andrews University.",arte_misia,23,0,http://www.reddit.com/r/MedievalHistory/comments/sliha/the_reading_habits_of_medieval_people_have/,http://b.thumbs.redditmedia.com/XkAuOgzNSxlpY-n7.jpg,
1312129389.0,j4w8v,"(April 4, 1561.) A war in the heavens. 16th century citizens of Nuremberg document sighting of aerial phenomena.",_belly_in_my_jelly_,26,3,http://www.reddit.com/r/MedievalHistory/comments/j4w8v/april_4_1561_a_war_in_the_heavens_16th_century/,http://thumbs.reddit.com/t3_j4w8v.png,
1370790937.0,1fzfbk,Article: Music and Verse in Anglo-Saxon and Viking Times,historybuffCO,22,2,0,,t5_2sa8g,False
1367678020.0,1dogg4,"The story of the hot-tempered &amp; rash Charles the Bold, 15th C. Duke of Burgundy (France &amp; the Low Countries)",historybuffCO,22,1,http://www.reddit.com/r/MedievalHistory/comments/1dogg4/the_story_of_the_hottempered_rash_charles_the/,default,
1361522346.0,190ggm,Narni underground: The mysterious Inquisition Trial and the Room of Torment in Narni,kowalsky9999,23,0,0,,t5_2sa8g,False
1358357621.0,16p087,Isabel of Portugal married Philip the Good when she was in her thirties. She was Duchess of Burgundy from 1430-1471.,historybuffCO,29,5,2,,t5_2sa8g,False
1353450945.0,13j7ti,The Ottoman Empire’s Life-or-Death Race,_Remy_,25,3,3,,t5_2sa8g,False
1351784120.0,12gm8n,The Byzantine Empire on The Brink of Destruction,deannap,29,8,1,,t5_2sa8g,False
1351206839.0,123dsy,A subreddit dedicated to Medieval Art.,ShadySam,26,4,6,"I personally love medieval art and think it would be great if a group of people could share some of the great works of the time. [R/Medievalart](http://www.reddit.com/r/Medievalart) is a place where you can share the work,False,
1343151926.0,x305n,Madness and Gender in Late Medieval Literature,birdinspace,22,0,1,,t5_2sa8g,False
1341876415.0,waq4d,"During Genghis Khan's day, the Mongolians would practice monumental hunts, in which entires armies would drive every living thing from thousands of miles around to one massive killing ground and spend days massacring every trapped animal.",wassworth,23,3,False,
1338953219.0,unbts,Medieval 'vampire' skeleton unearthed by archaeologists in Bulgaria.,borysSNORC,24,4,0,,t5_2sa8g,False
1338863124.0,uldn1,Medieval Glasses,ThyApache,22,1,9,What happened to people during the Medieval Ages with bad vision? When was the first treatment developed?,t5_2sa8g,True
1315786737.0,kcj2c,"Wonders of the medieval world - 
From Byzantine mosaics to grand cathedrals,22,0,5,http://www.reddit.com/r/MedievalHistory/comments/kcj2c/wonders_of_the_medieval_world_from_byzantine/,,,http://thumbs.reddit.com/t3_kcj2c.png,,
1375392047.0,1jism9,Hairstyles in Eleventh Century Anglo-Saxon England,historybuffCO,27,5,2,,t5_2sa8g,False
1371818367.0,1gshdy,"Voices on the Medieval Page : The Reader ""While in our modern day scribbling on the page is perceived as an almost offensive deed, medieval readers regarded it a normal practice, an integral part of the reading experience.""",travellersspice,25,4,False,
1370205687.0,1fjdcx,Grand Princess Olga: Pagan Vengeance and Sainthood in Medieval Kievan Rus,historybuffCO,25,5,0,,t5_2sa8g,False
1366852661.0,1d1vh3,Rooftop walkways of Siena's medieval cathedral open for a short time to the public - looks simply amazing!,borysSNORC,24,3,3,,t5_2sa8g,False
