created_utc,id,title,author,ups,downs,num_comments,selftext,subreddit_id,is_self
1341168419.0,vvz97,Hello! I was wondering if anybody could recommend me some good books on French History?,Xmaspast,10,0,7,"I've only ever really studied Islamic history,,False
1339972816.0,v72ip,What's the best university in Europe to study Medieval History? ,birdinspace,11,0,19,"Hi guys. I'm about to enter my junior year of college at a school in the United States. (I'm studying medieval history,self,
1325813801.0,o4s51,Scientists crack medieval bone code,anutensil,11,1,1,,t5_2sa8g,False
1314041239.0,jqvns,"In Ireland’s County Meath, students are assisting in the excavation of the Black Friary, which was built in the 13th century near Trim Castle. “This was a busy town &amp; there was a constant bustle and activity here for a couple of hundred years.”",anutensil,11,0,False,
1306525951.0,hlrix,Skeletons of 5 people found underneath the Royal Chapel at Scotland’s Stirling Castle includes a woman killed with a war hammer during Scottish Wars of Independence. “To find a woman allows us to speculate on matters that otherwise we wouldn’t have been able to imagine.” ,anutensil,11,1,0,,t5_2sa8g,False
1304850005.0,h6m10,Archaeologists find new Viking site in Temple Bar ,Koka-Noodles,10,1,2,,t5_2sa8g,False
1376511050.0,1kdd9z,"Book review: 'Later Medieval Metaphysics: Ontology, Language, and Logic' (2013)",Qwill2,9,1,False,
1375119719.0,1jaezb,"Interview with Michael Haag, author of ""The Tragedy of the Templars"": Middle East, Crusades and the Templar head!",Lebendigger,10,0,False,
1367169266.0,1da3qq,Romanian Romeo and Juliet? Ancient Skeletons of Young Couple Holding Hands Uncovered,historybuffCO,11,1,1,,t5_2sa8g,False
1364102071.0,1awg33,A numismatist named David Rucker has created a series of references on medieval coins and made them available for download as PDF files (x-post from /r/AncientCoins),born_lever_puller,13,2,2,,t5_2sa8g,False
1363652149.0,1ak66k,Story of a Welsh princess: The Lively Maiden of Dumbarton,historybuffCO,11,2,0,,t5_2sa8g,False
1360183780.0,180qob,Crusades and Crusaders has Moved! Just need to add new content.,deannap,11,4,0,,t5_2sa8g,False
1358206089.0,16ky0f,"Book of Hours of Anne, Duchess of Brittany, France (1477-1514)",historybuffCO,10,0,False,
1358110404.0,16ibrn,Peter the Hermit's Crusade Meets its Fate,deannap,9,0,4,,t5_2sa8g,False
1357795746.0,16armh,"Claude, Duke of Guise fought at the Battle of Marignano, Italy in 1513. Here's what happened....",historybuffCO,12,3,False,
1334990322.0,skzye,Where’s the money in early Anglo-Saxon England?,imagineyoung,10,0,1,,t5_2sa8g,False
1318816824.0,lenad,Studying for Old English literature mid-term... (x-post from /r/pics),MalSponseller,13,4,3,,t5_2sa8g,False
1314122347.0,jrwph,"More than 40 medieval tombs have been uncovered at Kaliadra, on the Bulgarian coast of the Black Sea",anutensil,12,3,http://www.reddit.com/r/MedievalHistory/comments/jrwph/more_than_40_medieval_tombs_have_been_uncovered/,http://thumbs.reddit.com/t3_jrwph.png,
1312390381.0,j7vnv,Skeletons have been unearthed outside the boundaries of a church cemetery in England - Some could date to 500 A.D. “We thought the graveyard boundary had remained where it was since the church was 1st built. It indicates Kempsey was a lot more important than the smaller village we have now.” ,anutensil,9,0,0,,t5_2sa8g,False
1306805432.0,hnvkr,Climate played big role in Vikings' disappearance from Greenland,davidreiss666,11,4,2,,t5_2sa8g,False
1303585391.0,gvv7a,"Debunking a myth: In medieval Christianity, dissection was often practiced
",1,2,http://www.reddit.com/r/MedievalHistory/comments/gvv7a/debunking_a_myth_in_medieval_christianity/,,,False,t5_2sa8g,False
1303497830.0,gv77g,Archaeologists in England have been excavating an unfinished castle started in the 1100s near lands claimed by the King of Scotland &amp; the Earl of Chester - The Earl eventually moved the border of his lands 60 miles to the north &amp; the castle was no longer needed ,anutensil,11,2,0,,t5_2sa8g,False
1302296313.0,glr5n,A skull showing signs of leprosy &amp; a fatal head wound has been discovered in a soldiers’ cemetery in central Italy. Other skulls from the medieval cemetery bear evidence of surgical intervention. (With Large Photo of Skull),anutensil,11,1,4,,t5_2sa8g,False
1297636651.0,fkrbk,Amazing portable medieval manuscripts (make sure to view them all),Hexa6ram,11,2,0,,t5_2sa8g,False
1375910755.0,1jwtps,"Michael D. Bailey interviewed about his new book, 'Fearful Spirits, Reasoned Follies: The Boundaries of Superstition in Late Medieval Europe' (2013) [audio]",Qwill2,8,1,False,
1373986178.0,1iez8i,"The medieval Dunmore Castle in Co. Galway, Ireland",historybuffCO,10,2,http://www.reddit.com/r/MedievalHistory/comments/1iez8i/the_medieval_dunmore_castle_in_co_galway_ireland/,http://a.thumbs.redditmedia.com/wkO40nMhx4wOnAXr.jpg,
1366902611.0,1d34ep,Infante Ferdinand was the youngest of the family known in Portuguese history as the “illustrious generation”. He had a sad fate.,historybuffCO,11,2,0,,t5_2sa8g,False
1364275811.0,1b0ykp,"Vladimir the Great, Help Finding Sources? ",dmar15,10,1,http://www.reddit.com/r/MedievalHistory/comments/1b0ykp/vladimir_the_great_help_finding_sources/,False,
1362966172.0,1a2138,"In 1472, Charles Duke of Burgundy thought the town of Beauvais would surrender in terror. He was wrong.",historybuffCO,9,0,http://www.reddit.com/r/MedievalHistory/comments/1a2138/in_1472_charles_duke_of_burgundy_thought_the_town/,http://d.thumbs.redditmedia.com/zWdh02M16jfvvp4W.jpg,
1361382833.0,18wbbe,"The life of the medieval Saint Wulfric of Haselbury, England",historybuffCO,11,1,http://www.reddit.com/r/MedievalHistory/comments/18wbbe/the_life_of_the_medieval_saint_wulfric_of/,http://e.thumbs.redditmedia.com/j5QSJmeLkJLxavbv.jpg,
1359693622.0,17oef8,Margaret Stewart was the daughter of King James I of Scotland. She married Dauphin Louis (future Louis XI) of France,historybuffCO,9,1,0,,t5_2sa8g,False
1322800675.0,mx4vu,"What are some good books about the hashshashins (assassins), Alamut, etc?",Sidian,8,8

Thanks.",self,t5_2sa8g,False,,,True,http://www.reddit.com/r/MedievalHistory/comments/mx4vu/what_are_some_good_books_about_the_hashshashins/
1318424827.0,l9i6n,Contradictory Examples of Feudalism,ServerOfJustice,8,0,5,"The most well known one

This apparent contradiction interests me, or any other counter-intuitive situation you may know of?",,False,self,t5_2sa8g,False,,
1317593579.0,kyptp," In an area north of Dublin, Ireland, construction crews find an early medieval cemetery",anutensil,10,1,False,
1314926195.0,k1y08,Looking for some books to brush up on Medieval Historiography ,bobosaurs,8,0,5,"I was at a History Department function tonight, Making the Middle Ages

I'm only a sophomore

Any and all Medieval Historiography is appreciated,False,self,t5_2sa8g,False,,,t3_k1y08
1311750187.0,j0y99,Where should I begin studying the medieval history of the British Isles?,clawedjird,9,2,9,"I don't really have any background in European history at all

Edit: Just to be clear, and specific academic resources to consult. Thanks!

Edit 2: Thanks for the guidance everyone! You've given me more than enough to start with. To answer some recurring questions-I'm more interested in early medieval history. I'm actually not as interested in learning about medieval England, Picts, Vikings, etc. and the interactions between them. Then again, I'm fairly interested in all types of history, so I won't turn down good books on late medieval history... Also, to those who mentioned them-I have actually read (at least part of) Canterbury Tales and Beowulf, thanks again for all the suggestions! It looks like I'll be quite busy for the near future...",t5_2sa8g,True
1311446457.0,ixtbx,The Fine Rolls of Henry the III of England: A new look at medieval legal and courtly life.,rockne,10,2,2,,t5_2sa8g,False
1308139223.0,i08j6,The ongoing life of Iceland's medieval sagas (x-post from r/history),,8,1,1,,t5_2sa8g,False
1304606004.0,h4u1l,Medieval Studies Featured at Maney Publishing ,wedgeomatic,8,0,0,,t5_2sa8g,False
1303741956.0,gx07h,Greek and Muslim Automata: Influence of Greek Knowledge in Medieval Islamic Science,wedgeomatic,8,0,1,,t5_2sa8g,False
1296327797.0,fbfl4,The Burgundian Civil War,wedgeomatic,9,1,1,,t5_2sa8g,False
1295759747.0,f7dzc,Waldensians: a Christian movement of the later Middle Ages,davidreiss666,8,1,0,,t5_2sa8g,False
1295586229.0,f6a9g,Norman Centuries: Norman History Podcast by Lars Brownworth -- very much worth your listening time.  ,davidreiss666,8,0,3,,t5_2sa8g,False
1295555265.0,f60om,"[podcast] When it comes to the Eastern Roman Empire, you can't get a better introduction/survey then this. ",pi_over_3,10,2,http://www.reddit.com/r/MedievalHistory/comments/f60om/podcast_when_it_comes_to_the_eastern_roman_empire/,default,
1375342389.0,1jhbn7,What is black bile and yellow bile?,DrScabhands,8,1,5,"It is urine and feces,self,
1373916428.0,1icy6m,IAMA with Peter Adamson of the History of Philosophy Podcast without any gabs in /r/history. Please come on by and ask him some questions.,davidreiss666,17,9,0,,t5_2sa8g,False
1367169613.0,1da44n,"Elizabeth de Burgh was the second wife of Robert the Bruce, King of Scots",historybuffCO,8,1,http://www.reddit.com/r/MedievalHistory/comments/1da44n/elizabeth_de_burgh_was_the_second_wife_of_robert/,http://f.thumbs.redditmedia.com/zf9pXXAOyEYziw4e.jpg,
1359652643.0,17mz77,"Second part of the Documentary "" Michael Servetus. The love for Truth"".  His ten hiden works, true name proved by the King of France, Henry II ",michaelservetusres,7,2,False,
1358085907.0,16hoyc,"[video] J. A. Josephson the traces the Christian conceptual schema that determined the European concepts of religion (idolatry, piety and heresy) in roughly the period from 100AD to 1600AD ",Qwill2,8,1,http://www.reddit.com/r/MedievalHistory/comments/16hoyc/video_j_a_josephson_the_traces_the_christian/,default,
1356192879.0,15a7vm,"Pictures from the illuminated ""Bedford Book of Hours"" from the 15th C.",historybuffCO,7,0,0,,t5_2sa8g,False
1356024643.0,156cf4,Walters Art Museum Illuminated manuscript photostream,historybuffCO,8,1,2,,t5_2sa8g,False
1355688817.0,14ydfc,What is this thing?,iirainey,9,1,8,"It almost looks like a ribauldequin without any guns in it

http://i.imgur.com/9trKy.jpg",self,t5_2sa8g,False,,,True,http://www.reddit.com/r/MedievalHistory/comments/14ydfc/what_is_this_thing/
1339099229.0,uqb5d,Researchers look to save deteriorating Viking treasures of Oseberg,dragon_toes,9,4,0,,t5_2sa8g,False
1336535499.0,te5h4,Were there wheelchairs in Medieval times? What if you had a spinal injury?,riorevealed,9,4,13,"Just curious. I assume they had wheelbarrows at least

Edit: Thanks for all the answers! ",self,t5_2sa8g,True,,,True,http://www.reddit.com/r/MedievalHistory/comments/te5h4/were_there_wheelchairs_in_medieval_times_what_if/
1336359957.0,talt2,Anyone else attending the conference at Kalamazoo this weekend?,leavesoflorien,8,1,27,"http://www.wmich.edu/medieval/congress/

I'm flying out early Thursday morning and will be staying in the WMU dorm.

Anyone else attending? Anyone giving papers? Maybe we could orchestrate a meetup.",self,t5_2sa8g,False,,,True,http://www.reddit.com/r/MedievalHistory/comments/talt2/anyone_else_attending_the_conference_at_kalamazoo/
1334963232.0,skhxz,"Grave Yields Treasures of Prosperous Medieval Abbot - Found in the Furness Abbey ruins, were a gilded silver ring with a secret compartment, an abbot’s or bishop’s crozier with some of the staff's wood &amp; an iron spike at its base, a silk &amp; linen sweat cloth, &amp; skeletal remains. ",9,,t5_2sa8g
1324014004.0,neugn,Recommendations on books about Medieval Alchemy,,10,2,4,"As a medical student,self,
1318345748.0,l8c3j,Could you recommend a book for Anglo-Saxon through early Renaissance history?,MalSponseller,7,0,12,"Hello all!

I'm a first year English Graduate student who is focusing her MA and PhD in the area of Medieval literature.  Starting this semester, when in high school, was greatly glossed over.  I was wondering if any history buffs could recommend an easy-to-read, enjoyable, comprehensive book that goes through the history of the Anglo-Saxon period in Europe through, perhaps, the beginning of the Renaissance?  This is a huge portion of history, but I think it might help me formulate a better base for understanding the literature I'm currently reading.

I would love if the recommended book was just one book

Edit: Would like to add the ""fun to read"" aspect to my list of desired traits for the book.  Cause a big,,False,self,t5_2sa8g,True,,True
1317051232.0,krwbp,Memories of Old Awake: A short film about the Icelandic sagas.,,9,2,1,,t5_2sa8g,False
1311234181.0,ivn2l,"The French may have had a better chance at the Battle of Agincourt had they not been weighed down by heavy body armour, say researchers",anutensil,10,3,http://www.reddit.com/r/MedievalHistory/comments/ivn2l/the_french_may_have_had_a_better_chance_at_the/,http://thumbs.reddit.com/t3_ivn2l.png,
1308603994.0,i4nof,"The start of the holy Roman Empire and the Order from Chaos, 54m",Digirak,12,5,http://www.reddit.com/r/MedievalHistory/comments/i4nof/the_start_of_the_holy_roman_empire_and_the_order/,http://thumbs.reddit.com/t3_i4nof.png,
1301877911.0,ghyfj,"/r/history has need of more medievalists, stat!",FG_SF,8,0,http://www.reddit.com/r/MedievalHistory/comments/ghyfj/rhistory_has_need_of_more_medievalists_stat/,default,
1300738326.0,g8fe6,Any Medievalists at UT Austin?,manicmuse,8,0,2,"I've just been accepted to the Medieval Lit PhD program at UT Austin and I wanted to know if anyone has experience with or insight into the program. I'm waiting to hear back from a few more schools,,False
1299442717.0,fyjv8,The Wolf Child of Hesse Betrays the Human,wedgeomatic,7,0,0,,t5_2sa8g,False
1297024793.0,fgfo9,"Infinite Realms and Alternate Worlds: Barrows, Portals and Possibility",wedgeomatic,7,1,http://www.reddit.com/r/MedievalHistory/comments/fgfo9/infinite_realms_and_alternate_worlds_barrows/,http://thumbs.reddit.com/t3_fgfo9.png,
1296509351.0,fcmrr,The Heroic Age: One of the finest online journals for medieval studies,,8,1,7,,t5_2sa8g,False
1295715664.0,f73pe,Middle Ages in Film: Can we add to this list?,,8,2,0,,t5_2sa8g,False
1376777747.0,1kkmo3,"The Early Life of Eleanor, youngest sister of King Henry III of England",historybuffCO,9,1,http://www.reddit.com/r/MedievalHistory/comments/1kkmo3/the_early_life_of_eleanor_youngest_sister_of_king/,http://f.thumbs.redditmedia.com/CFC9t12ayWbqgdO_.jpg,
1372802631.0,1hiydx,"The Round Table in Winchester's Great Hall, Hampshire, England. Was it built during the reign of King Arthur?",historybuffCO,13,3,False,
1370208447.0,1fjgoo,The future King Henry V of England was struck with an arrow to the face at the Battle of Shrewsbury - how did he survive?,borysSNORC,7,2,1,,t5_2sa8g,False
1369316949.0,1ewi34,"Looking to recreate medieval warfare for a civ mod based on the ASoIaF series (game of thrones), figured this would be the place to ask",jokul,9,3,http://www.reddit.com/r/MedievalHistory/comments/1ewi34/looking_to_recreate_medieval_warfare_for_a_civ/

Infantry
---
* Swordsman - Strong against other infantry and ranged units.  Weak vs. cavalry.  (my research has indicated that the sword is a very flexible and lightweight dueling weapon)
* Axemen - Deals additional damage based on the enemy's health (I have no justification for this
* Maceman - Ignores enemy armor (maces as blunt weapons were more reliant on crushing power and blunt force  trauma
* Spearman - Higher defense anti-cavalry unit (they can carry a shield in their off-hand)
* Pikeman - Lower defense anti-cavalry unit
* Halberdier - Medium bonus vs. cavalry

Ranged
---
* Skirmisher - Deals damage to high health units, to the best of my knowledge, the role skirmishers have played historically)
* Archer - 2 first strikes
* Crossbow - 1 first strike

Cavalry
---
* Raider - Used for pillaging
* Light Cavalry - Bonus vs. ranged and light infantry (just my gut)
* Knight - Heavily armored cavalry unit.  Effectively a juggernaut.  Only truly beaten in efficiency (amount of effort put into making on vs. effort put into killing them).

Siege
---
* Ballista - Bonus vs. heavy units (a ballista generally wouldn't care how well protected you are and heavier targets would be slightly easier to hit)
* Catapult - Deals damage to multiple units (need a generic field weapon)
* Trebuchet - Reduces city defenses faster than other siege
* Siege Tower - Ignores large portion of wall defense

---

In regards to heavy vs. light, estocs, etc.) but players will be able to specialize their forces and these weapons would likely have a place in customization.  Now I know that this list is somewhat large, but do these mechanics more or less fit (within reason) the role these weapons played on medieval battlefields?  Thanks for any help with this!",,False,self,False,t3_1ewi34
1367447704.0,1dig27,Drawings of camels from three Anglo-Saxon illuminated manuscripts,historybuffCO,7,1,0,,t5_2sa8g,False
1365629144.0,1c39qi,Food &amp; drink in the Bayeux Tapestry and Domesday Book,historybuffCO,7,0,1,,t5_2sa8g,False
1361381374.0,18w9ju,I Need Your Help Doing Research!!! - Medieval England,,6,1,4,"I am having some trouble researching genealogies and would be incredibly grateful for any help. A town in England in 1241 named Lincoln was home to a large amount of money lending and I am trying to find out who was doing the lending, list of the rulers in charge,False
1359908642.0,17t7ht,Depictions of Bathsheba from illuminated manuscripts,historybuffCO,7,1,0,,t5_2sa8g,False
1357834993.0,16bimh,The Arrival of Peter the Hermit in Constantinople,deannap,6,0,2,,t5_2sa8g,False
1357003107.0,15r3eo,"A short history of Gloucester Cathedral, Gloucester, England",historybuffCO,8,0,False,
1353001077.0,138z0x,Medieval period's most painful medical procedures,kashmiir711,6,0,0,,t5_2sa8g,False
1334869821.0,siggn,itunes lecture - Oxford University - Old English and the Anglo-Saxons ,OldEnglishNerd,7,1,1,,t5_2sa8g,False
1317131677.0,ksxkl,Are there any holidays connected to King Arthur or the Arthurian legend in general?,_belly_in_my_jelly_,7,0,3,,t5_2sa8g,True
1314676260.0,jyp05,Curious about the past? Quench your thirst for answers! NEW: r/AskHistorians (NOW LOOKING FOR CERTIFIED HISTORIANS) ,Artrw,6,2,2,,t5_2sa8g,False
1313329821.0,jig7l,"
The Deep &amp; Surprising Connections Between Medieval Relics &amp; Contemporary Art",2,0,http://www.reddit.com/r/MedievalHistory/comments/jig7l/the_deep_surprising_connections_between_medieval/,,,False,t5_2sa8g,False
1310572489.0,ioiyv,"In the national cultural history of the Middle Ages, the figure of Uta of Naumburg was brandished as evidence of genuine German expression. A new exhibition casts doubt on the nationality of her sculptor.",blackstar9000,7,1,http://www.reddit.com/r/MedievalHistory/comments/ioiyv/in_the_national_cultural_history_of_the_middle/,http://thumbs.reddit.com/t3_ioiyv.png,
1308598722.0,i4l7v,Looking for a accurate and worthwhile read about the 1st crusade as called upon by Pope Urban II. ,kabuli,9,1,7,,t5_2sa8g,True
1307932013.0,hy6av,New Information about Cogs and Medieval Naval Logistics from an Eyewitness Crusade Chronicle,darwinfish86,6,0,0,,t5_2sa8g,False
1303790500.0,gxiib,"Professor Hopes to Shed New Light on
Medieval Theological Education",0,0,http://www.reddit.com/r/MedievalHistory/comments/gxiib/professor_hopes_to_shed_new_light_on_medieval/,,,False,t5_2sa8g,False
1303582026.0,gvu4x," Exploring a historic church’s subterranean secrets - It has stood for over 1,000 years &amp; is widely believed to be the site of the crowning of at least 2 Anglo-Saxon kings, &amp; possibly as many as 7",anutensil,9,0,False,
1295741477.0,f79yl,Ensemble Renaissance - Serbian early music ensemble,Gavranolique,6,1,0,[Skomraska igra](http://mediumaevum.tumblr.com/post/2856500535/ensemble-renaissance-skomraska-igra-serbian),t5_2sa8g,True
1376148770.0,1k3btk,800-year-old human skulls discovered in Limerick,historybuffCO,5,1,0,,t5_2sa8g,False
1370385781.0,1folg9,Jamie Jeffers of The British History Podcast is doing an IAMA thread at /r/History! Please come by and ask him questions about British history.,davidreiss666,15,10,0,,t5_2sa8g,False
1370291041.0,1flqqo,The Death of Thomas Beckett: Murder in the Cathedral,historybuffCO,7,2,0,,t5_2sa8g,False
1370104052.0,1fgwqp,"Lars Brownworth, creator of the 12 Byzantine Rulers and Norman Centuries podcasts, is doing an IAMA thread at r/History! Come by and ask some questions",davidreiss666,21,0,False,
1369110382.0,1equ9j,Questions for a Hundred Years War History Project.,DarkKnight813,9,2,2,"Can knighthood be revoked? And if so
What were the prayers before and after meals? 
If a knight were to be denied execution
Would tea be served at the King's dinner? 
How would a knight be addressed by the royals? 
What does a condemned knight need to do to regain his freedom after he has had his knighthood revoked?
What are the consequences for killing someone during a jousting tournament? 

I would greatly appreciate answers that are sourced. 
",self,t5_2sa8g,False,,,True,http://www.reddit.com/r/MedievalHistory/comments/1equ9j/questions_for_a_hundred_years_war_history_project/
1365630249.0,1c3bbj,The Bayeux Tapestry and the Princess Bride,cavedave,7,2,0,,t5_2sa8g,False
1359908995.0,17t7s3,"Spectacular exterior views of the Cathedral of Notre-Dame in Chartres, France taken from a drone",historybuffCO,6,1,http://www.reddit.com/r/MedievalHistory/comments/17t7s3/spectacular_exterior_views_of_the_cathedral_of/,default,
1358960786.0,174pla,"Empress Maud (Matilda), Lady of the English caused civil Anarchy in 11th C.  England fighting for the throne",historybuffCO,5,0,http://www.reddit.com/r/MedievalHistory/comments/174pla/empress_maud_matilda_lady_of_the_english_caused/,http://c.thumbs.redditmedia.com/jGcEAGPLqg_mjuoV.jpg,
1356131846.0,1594lf,Italian Medieval/Renaissance painter Fra Angelico (1287-1455),historybuffCO,5,0,0,,t5_2sa8g,False
1334889719.0,siyum,Fighting Words: Of Moats and the Middle Ages,secaa23,6,2,0,,t5_2sa8g,False
1330713332.0,qers2,Knights of Reddit-Paper topic?,kaiju21,7,2,14,"I am in a Medieval Warfare class, battles,self
1304793800.0,h67tk,Medieval clay ovens &amp; tanneries have been unearthed during housing development in southwestern England,anutensil,7,3,0,,t5_2sa8g,False
1303742094.0,gx095,Illegal Sexual Behavior in Late Medieval Norway as Testified in Supplications to the Pope,wedgeomatic,6,1,0,,t5_2sa8g,False
1303191939.0,gte40,Let's help this kid out! ,bobosaurs,6,1,1,,t5_2sa8g,False
1299807885.0,g1lxt,The formatting of the wikipedia page for Jean de la Grange is messed up. I don't know much about wikis - does someone want to fix it?,zweiapowen,5,1,2,,t5_2sa8g,False
1297451808.0,fjmnz,Dispatches from the Institute of Historical Research’s Earlier Middle Ages seminar,wedgeomatic,5,0,0,,t5_2sa8g,False
1297023372.0,fgf98,Human Sacrifice in Anglo-Saxon England,wedgeomatic,10,4,2,,t5_2sa8g,False
1297015103.0,fgcz1,"Carnivalesque -  A blog carnival dedicated to pre-modern history, every other one deals with the Middle Ages",wedgeomatic,5,1,http://www.reddit.com/r/MedievalHistory/comments/fgcz1/carnivalesque_a_blog_carnival_dedicated_to/,default,
1296318717.0,fbdbe,Feudal Transformation; A Corner of Tenth-Century Europe,wedgeomatic,6,1,0,,t5_2sa8g,False
1296318639.0,fbdau,Crusader Motives; A Corner of Tenth-Century Europe,wedgeomatic,6,0,0,,t5_2sa8g,False
1295887719.0,f856o,Schedule for the 2011 International Congress on Medieval Studies (pdf),wedgeomatic,7,2,0,,t5_2sa8g,False
1295542147.0,f5vwe,"For 500 years they had one of the most powerful empires on earth. But you are not supposed to know about them, or the identity of their offspring. ",mvlazysusan,13,8,http://www.reddit.com/r/MedievalHistory/comments/f5vwe/for_500_years_they_had_one_of_the_most_powerful/,default,
1375110417.0,1ja2jw,literature,viobio,5,0,1,,t5_2sa8g,False
1368714941.0,1egamf,"Sometime in the 8th century, King Offa of Mercia (reigned 757-796), of Offa's Dyke fame, is reputed to have given a Bible to the monks of Worcester.",historybuffCO,0,,False
1367381299.0,1dgnfw,How librarians saved Timbuktu mansucripts from Al Qaeda,runbikekindaswim,6,1,0,,t5_2sa8g,False
1365202751.0,1brjvq,1001 Inventions and The Library of Secrets - the Golden Age of Learning of the Muslim World.,saddetective87,5,0,0,,t5_2sa8g,False
1358022142.0,16ga6f,"Margaret, Maid of Norway was never crowned Queen of Scotland. She was engaged to marry King Edward II of England.",historybuffCO,4,0,http://www.reddit.com/r/MedievalHistory/comments/16ga6f/margaret_maid_of_norway_was_never_crowned_queen/,http://d.thumbs.redditmedia.com/3rwXiCb3GKHNIP7c.jpg,
1355234145.0,14nxgu,"The Forme of Cury: A Roll of Ancient English Cookery Compiled, about A.D. 1390",saint_cantaloupe,6,1,http://www.reddit.com/r/MedievalHistory/comments/14nxgu/the_forme_of_cury_a_roll_of_ancient_english/,default,
1354676420.0,14au8h,I thought you guys might enjoy my studies for a term paper.,Gibbenz,9,3,1,,t5_2sa8g,False
1337477628.0,tvfuz,Any suggests for books on the Sassanid Empire?,Gravesh,4,0,4,"*suggestions,self,
1333514028.0,rsemi,Ideas on dating medieval manuscripts please!,OldEnglishNerd,5,0,3,"Hey everyone, etc.   Any ideas?",t5_2sa8g
1314286214.0,ju3jv,"A big step in the preservation of one of Europe's finest barbican towers. 12th Century Laurence Gate, Drogheda, Ireland.",le_squiggle,5,6,False,
1311067560.0,itod9, Campaign to acquire the St Cuthbert Gospel,anutensil,4,0,0,,t5_2sa8g,False
1307192790.0,hrha9,New View on the Origin of First Settlers in Iceland,arte_misia,4,2,0,,t5_2sa8g,False
