created_utc,id,title,author,ups,downs,num_comments,selftext,subreddit_id,is_self
1296067997.0,f9ifr,"Medieval Chivalry and Combat.  Deeds of Arms: Formal Combats in the Late
Fourteenth Century [Review]",6,0,http://www.reddit.com/r/MedievalHistory/comments/f9ifr/medieval_chivalry_and_combat_deeds_of_arms_formal/,"Just got this listserv forward sent to me by my department head and thought others might be interested.

Muhlberger
Fourteenth Century*. Highland Village
Bookshelf

 Reviewed by Donald J. Kagay
      Albany State University


Like it or not
of medieval studies to the modern world has been the study of late-
medieval war and research concerning its honored but sometimes
uncontrollable child
this popularity has been a basic misunderstanding of the medieval
martial ethic by those who unabashedly serve the code of creative
anachronism and by an ill-informed general public that looks on
medieval warfare as a mild game always conducted according to
gentlemanly rules. To offset these misconceptions that have more in
common with the theme park's view of history than any realistic
historical record
the context of the organized combats that were firmly tied to the
realm of warfare
orbit of the tournament. To carry out this ambitious project
struggles to demonstrate that these bloody exchanges existed within an
evolving code of chivalry that attempted to establish at least a
modicum of order for battlefield and jousting ground alike.

The focus of this work--the late-fourteenth century--is largely
directed toward the era of the Hundred Years War (1337-1453). It is
built on the extensive use of the primary sources of the period (many
of which have been translated into English in the last century). These
include the chronicles of Jean Froissart
de Gomez
document collections associated with great chivalric figures as Edward
the Black Prince
(Boucicaut the younger). Muhlberger's initial direction with the use
of these sources is to demonstrate that the deeds of arms were firmly
connected to the brutal realities of medieval warfare
personified humanizing theories such as just war that the mediator of
medieval society
conflict. By a minute study of both individual and group combat
sparking into existence inside and outside organized military
campaigns
dangerous as the melée that inundated the battlefield. He also reviews
the quite meticulous rules set up for fairness and the maintenance of
personal honor that came into being for the regulation of such
combats. From his extensive reading of the sources
concludes that the evolving codes of martial rules did not come from
the jousting arena
out by small groups of combatants serving in campaigns of much larger
armies. From this ever-shifting environment came both the regulations
and the larger-than-life heroes who were judged by them.

Much of the remainder of Muhlbereger's book centers on how the
emerging ""industry"" of individual and group conflicts were carried out
between French, and Flemish participants. He follows
in great detail the challenge
the means by which fair play was supposed to prevent such conflicts
from lapsing into vendettas pure and simple. The highlight of this
discussion is Muhlberger's meticulous review of the Combat of Thirty
Against Thirty
during 1351. This encounter occurring in a backwater of the Hundred
Years War seemed to stir the imagination of European authors for next
few decades who viewed the small skirmish as a halfway-house of sorts
between the bloodiest aspects of actual warfare and the humane rules
of the tournament. From his discussion of this crucially important
incident of group conflict
such fighting on fourteenth-century societies. With the great interest
that deeds of arms caused
of honor he swore to uphold became a regular topos in chronicles and
romances down to the sixteenth century. This chivalric imprint on
late-medieval society shaped reality--at least among upper-class
circles--when kings tied tournaments to marriage celebrations and
other episodes of high-level negotiation. The most important of these
public combats occurred in 1390 at St. Inglevert near Calais when
three French knights challenged and bested all comers from the ranks
of the English invaders. Though originally a private enterprise
St. Inglevert jousts became a source of French pride and established
the model for ""national tournaments"" down to the sixteenth century.
These popular chivalric norms that eventually became anachronistic in
the face of European warfare increasingly marked by the use of
gunpowder weaponry provided lucrative careers both on the tournament
circuit and in royal service to many a fourteenth-century warrior.
Muhlberger discusses these super-stars in his last chapter.

In all of his chapters
chivalric authors led by Jean Froissart. The inclusion of large
passages from their works in English translation (a feat which
Muhlberger has already duplicated online) is helpful to the general
reader as well as to the military and social historians whose study
focuses on the later Middle Ages. Muhlberger's greatest contribution
in this work
&lt;i&gt;faits d'armes&lt;/i&gt; into a military spectrum that effectively
stretched from the tournament to the battlefield. In some ways
Muhlberger deserves to be placed in the company of the greatest modern
expert on individual and group combat of the later Middle Ages
Anglo.",self,t5_2sa8g,False,,,True,http://www.reddit.com/r/MedievalHistory/comments/f9ifr/medieval_chivalry_and_combat_deeds_of_arms_formal/
1376403069.0,1ka0xp,Anglo-Saxon Women in England,historybuffCO,15,1,0,,t5_2sa8g,False
1376148819.0,1k3bv7,"Blanche of Castile, the mother of Louis IX, was an extraordinary woman with a powerful mind and formidable personality. Gifted spiritually and intellectually, she had a reputation of a sensible and remarkably industrious woman.",historybuffCO,1,,False
1373405654.0,1hyo4c,Are there any decent to good documentaries on early Anglo-Saxon England or the period around the Norman Invasion?,bio-logic,14,0,6,,t5_2sa8g,True
1372006524.0,1gwynm,The town of Ludlow in the UK has ties to the Tudor era and the War of the Roses,historybuffCO,16,1,0,,t5_2sa8g,False
1370561960.0,1ftsfp,"Henry V: King, Conqueror, and...Musician?",historybuffCO,14,1,False,
1369940811.0,1fcr9p,"Beautiful illuminated pages from the 14th C. Bulgarian manuscript ""The Gospels of Tsar Ivan Alexander",historybuffCO,18,5,0,,t5_2sa8g,False
1368120566.0,1e0gqw,Battle of Nations Live Link,Tigerlily74,16,1,0,"If anyone is interested in watching the Battle of Nations - its live right now. Streaming!
Right now its the 21x21 battles

http://www.youtube.com/watch?feature=player_embedded&amp;v=Za5tq-E7loo
Edit: the link didn't post",self,t5_2sa8g,False,,,True,http://www.reddit.com/r/MedievalHistory/comments/1e0gqw/battle_of_nations_live_link/
1357506418.0,162u3p,"Edith of Wessex married Edward the Confessor, King of England in the 11th C.",historybuffCO,18,3,http://www.reddit.com/r/MedievalHistory/comments/162u3p/edith_of_wessex_married_edward_the_confessor_king/,http://e.thumbs.redditmedia.com/DlOrMv4FErkc1w1X.jpg,
1354391443.0,1445ux,Full Metal Jousting,specieshumanoid,25,10,16,,t5_2sa8g,False
1339574461.0,uziqj,This kickstarter campaign aims to create a detailed and accurate sword fighting video game that draws more on history than fantasy,huxtiblejones,15,0,2,,t5_2sa8g,False
1320623084.0,m2vb9,Good medieval history media?,Komnos,16,1,6,"I'm looking for media that portrays medieval history in a sequential, but the entire medieval period is of interest.  I feel like I have a relatively decent overview of medieval history,
1318981742.0,lgvck,"Viking burial boat surfaces after 1,000 years ",ovnem,14,0,http://www.reddit.com/r/MedievalHistory/comments/lgvck/viking_burial_boat_surfaces_after_1000_years/,http://thumbs.reddit.com/t3_lgvck.png,
1316519603.0,kli1q,Question about medieval taverns,dasredditore,14,0,23,"And before anyone says anything

My question is,,False,self,t5_2sa8g,False,,True
1310290527.0,iligi,"A student working at Bamburgh Castle in Northumberland, England, discovered a gold ornament dating to 800 A.D. “I think everyone was absolutely over the moon.”  (With Photo)",anutensil,14,1,False,
1302124162.0,gk7jd,Hundreds of skeletons have been unearthed at a medieval mental health hospital in London - The site is  being cleared for a new tunnel project. (With Video),anutensil,15,1,1,,t5_2sa8g,False
1374500594.0,1it7jd,"Annabella Drummond &amp; Robert III, King of Scots were married for over 35 years (14th C.)",historybuffCO,16,3,http://www.reddit.com/r/MedievalHistory/comments/1it7jd/annabella_drummond_robert_iii_king_of_scots_were/,http://f.thumbs.redditmedia.com/c0MLeYUIS3QLW-h_.jpg,
1372081064.0,1gyu9f,The English sweating sickness in the 16th C. didn't discriminate in who it killed,historybuffCO,15,2,4,,t5_2sa8g,False
1371769011.0,1grc5d,Shedding light on the Black Death,historybuffCO,14,1,1,,t5_2sa8g,False
1371674438.0,1gohg4,History of the Knights Templar at a glance,Lebendigger,14,2,3,,t5_2sa8g,False
1368976343.0,1emstd,Antoinette of Bourbon was the formidable matriarch of the Guise family in 16th C. France and the maternal grandmother of Mary Queen of Scots,historybuffCO,13,0,2,,t5_2sa8g,False
1364289346.0,1b16o9,[PDF] The Metaphysics of Peter Abelard (from 'The Cambridge Companion to Abelard'),Qwill2,14,0,1,,t5_2sa8g,False
1361991438.0,19ccbm,"New issue of Greek, Roman and Byzantine Studies is out [PDFs]",Qwill2,18,3,http://www.reddit.com/r/MedievalHistory/comments/19ccbm/new_issue_of_greek_roman_and_byzantine_studies_is/,default,
1352050887.0,12mb50,"Pope Urban's Speech at Clermont, November 1095: Part 1",deannap,18,4,http://www.reddit.com/r/MedievalHistory/comments/12mb50/pope_urbans_speech_at_clermont_november_1095_part/,http://e.thumbs.redditmedia.com/Y1IncG97l9ypzryR.jpg,
1341423047.0,w1eye,Four arrested in Spain over Codex Calixtinus theft,pentad67,13,1,2,,t5_2sa8g,False
1339333642.0,uuj9z,Walters Art Museum Illuminated Manuscripts' Photostream - 100s of beautiful period images.,borysSNORC,14,1,1,,t5_2sa8g,False
1337027040.0,tmz9g,"2 skulls with perforations, exhumed in Spain, date to the 13th &amp; 14th centuries – a period in which trepanation was not commonly practiced.  In the woman, a scraping technique was used while she was still alive. She survived for a “relatively long” given the advanced wound scarring. ",anutensil,2,,False
1336146728.0,t6za4,Did an English expedition BEAT Columbus to the Americas? Record of bank loan to sailor who found North America in 1497 hints that others may have been there first,imagineyoung,15,4,9,,t5_2sa8g,False
1335638227.0,sx2g7,"Translation and commentary on Aelfric's Old English Genesis ca 10th century, part I ",OldEnglishNerd,14,1,http://www.reddit.com/r/MedievalHistory/comments/sx2g7/translation_and_commentary_on_aelfrics_old/,http://e.thumbs.redditmedia.com/aLA2Y1GedphbB4s4.jpg,
1334962458.0,skhc4,Links to digital and facsimile medieval manuscripts from France - all free ,OldEnglishNerd,15,0,0,,t5_2sa8g,False
1328341447.0,pafm4,Does anyone know some good books for medieval Germany?,triton476,13,1,12,"I've always been interested in German history,False,
1328032617.0,p4sxs,The Luttrell Psalter Film,KarasuLincs,14,1,2,,t5_2sa8g,False
1326937369.0,omh51,"Recommendations, please?",sujetdirect,14,1,http://www.reddit.com/r/MedievalHistory/comments/omh51/recommendations_please/

I'm not sure how many people still read this subreddit as there has been no activity recently but I was wondering if anyone could point me in the direction of a book that details life in c. 1300 - c. 1400 England. I have recently became enamored with Ian Mortimer and I he's given me an itch.

Thanks in advance! ",self,t5_2sa8g,False,,,True,http://www.reddit.com/r/MedievalHistory/comments/omh51/recommendations_please/
1314372480.0,jv6ub,"Archaeologists searching for King Arthur's round table have found a ""circular feature"" beneath the historic King's Knot in Stirling.",arte_misia,16,2,0,,t5_2sa8g,False
1313435593.0,jjn2v,"Two medieval seals belonging to Constantine, Archbishop of Archidos, have been found at the site of Perperikon in southern Bulgaria. Such an archbishopric was previously unknown.",anutensil,14,0,False,
1307882162.0,hxqlr,"A daily reading of the entire Anglo-Saxon Poetic Records,which includes all poems written in Old English. By Michael D. C. Drout, Prentice Professor of English at Wheaton College, Norton, MA.",13,,t5_2sa8g
1305116606.0,h8vow,Western Michigan University's International Congress on Medieval Studies begins,wedgeomatic,15,3,7,,t5_2sa8g,False
1296221640.0,fapok,A couple doing DIY have uncovered a 20ft (6m) high medieval mural of King Henry VIII on the wall of their home,Hexa6ram,14,1,1,,t5_2sa8g,False
1295636959.0,f6mve,"The Lindisfarne Gospels, one of the most impressive manuscripts ever produced, can now be viewed in its entirety online",,15,2,False,
1376703858.0,1kiyl5,"Arthur Tudor, Prince of Wales",Astronoid,14,1,http://www.reddit.com/r/MedievalHistory/comments/1kiyl5/arthur_tudor_prince_of_wales/,http://e.thumbs.redditmedia.com/qSGmnNdDrpBzmRJd.jpg,
1374241419.0,1imp9k,Looking for some good secondary sources on the Black Death.,bmccd,13,0,5,I'm taking a Medieval History course focusing on the Black Death next semester and I was hoping to find some quality survey texts or anything related to the Black Death in general.  Any pointers would be appreciated! ,t5_2sa8g,True
1372287770.0,1h52xw,This is good! Christine de Pizan’s Book of the Queen (Harley MS 4431) is now online!,historybuffCO,16,4,0,,t5_2sa8g,False
1372004786.0,1gwwz2,"Bill Bailey's fantastic ""Pubbe Gagge"" (Chaucer-style)",cnnicolet,13,2,1,,t5_2sa8g,False
1369535160.0,1f28pk,"The story of the assassination of James Stewart I, King of Scots in February of 1437",historybuffCO,14,4,http://www.reddit.com/r/MedievalHistory/comments/1f28pk/the_story_of_the_assassination_of_james_stewart_i/,http://c.thumbs.redditmedia.com/Uu3kBFcUZ_9qs0yP.jpg,
1369133524.0,1er9je,"DigiPal - (the Digital Resource and Database for Palaeography, Manuscript Studies and Diplomatic) a new resource for the study of medieval handwriting. It currently has about 300 images of manuscript pages and over 12,000 images of individual letters",travellersspice,14,0,False,
1363415780.0,1aedhn,I'm a moderator on /r/coins and I just started a spin-off subreddit focusing on ancient and medieval coins. It may take a few days to get rolling but I'd welcome your participation.,born_lever_puller,17,7,0,,t5_2sa8g,False
1360778037.0,18gfjs,"Matilda of Boulogne was Queen to King Stephen of England. She fought her cousin Matilda during the ""Anarchy"" to keep her husband on the throne.",historybuffCO,16,3,2,,t5_2sa8g,False
1360531045.0,189kza,Image: Alexius I Comnenus and Godfrey of Bouillon,deannap,13,2,7,,t5_2sa8g,False
1359562553.0,17kesl,"A Menagerie of Miracles:  Pages from the illuminated  ""Illustrated Life of St. Cuthbert""",historybuffCO,12,1,0,,t5_2sa8g,False
1357024252.0,15ri6s,Abbeville Press books | The Grand Medieval Bestiary,mad_boethius44,14,1,3,,t5_2sa8g,False
1349048670.0,10qfi4,"I'm looking for a European university that has a Master's programme about the (eastern) Mediterranean somewhere around 14-1600's, any ideas?",kaastumor,15,4,http://www.reddit.com/r/MedievalHistory/comments/10qfi4/im_looking_for_a_european_university_that_has_a/

I started looking for universities that are located around the eastern Mediterranean but I don't know if these are somewhat decent

I'm currently studying International Relations

So,False,self,t5_2sa8g,False,,,t3_10qfi4
1347813597.0,zz5hz,"""Henry VIII (""Money, Money, Money"" by ABBA)"" - The title says it all",iamnotmichelle,14,2,False,
1327377374.0,otymw,"Early modernist here, wondering what medievalists think about the Pirenne thesis nowadays?",karpeeka,12,0,http://www.reddit.com/r/MedievalHistory/comments/otymw/early_modernist_here_wondering_what_medievalists/,http://d.thumbs.redditmedia.com/VKeIuirmUv8lAIG3.jpg,
1313075365.0,jfqrc,How were children punished in medieval times? ,Hexa6ram,13,2,7,"For example orphans who steal something,self,
1296366203.0,fboku,"Emma of Normandy: Married to two Rulers of England, Mother of two Rulers of England",forker88,13,1,http://www.reddit.com/r/MedievalHistory/comments/fboku/emma_of_normandy_married_to_two_rulers_of_england/,http://thumbs.reddit.com/t3_fboku.png,
1375370109.0,1jhxw9,"Photo Gallery: Medieval boat found buried alongside Lodden's River Chet, Norfolk, England",historybuffCO,14,6,False,
1373729405.0,1i7yho,"Thor’s Wood, a sacred grove near Viking Age Dublin?",historybuffCO,13,1,http://www.reddit.com/r/MedievalHistory/comments/1i7yho/thors_wood_a_sacred_grove_near_viking_age_dublin/,http://e.thumbs.redditmedia.com/dc-j8xKLvdS69fJL.jpg,
1373227976.0,1hthlw,The Digital Index of Middle English Verse is now available,runbikekindaswim,11,0,1,,t5_2sa8g,False
1369941549.0,1fcs7a,"Joan of Arc, ""The Maid of Orleans"" was burned at the stake on May 20, 1431. Here's a short history of her life",historybuffCO,12,2,False,
1366833460.0,1d154z,Information on the Aberdeen Bestiary project.,historybuffCO,13,0,0,,t5_2sa8g,False
1366636070.0,1cuzwu,"Joan Beaufort, Queen of Scotland, wife of King James I. It was a true love match.",historybuffCO,15,5,False,
1362620892.0,19tehb,Looking for books on arms and armor between 9th century and early 16th (x-post from r/armsandarmor),DrDeath100,12,1,10,"Hey all, Scots

Thanks for the suggestions!",self,t5_2sa8g,1362649301.0,,,True,http://www.reddit.com/r/MedievalHistory/comments/19tehb/looking_for_books_on_arms_and_armor_between_9th/
1361755268.0,195x0e,Looking for General Book on c.11th and 12th C England ,JoeAllan,11,0,7,"Hey

Thanks for your help!",self,t5_2sa8g,False,,,True,http://www.reddit.com/r/MedievalHistory/comments/195x0e/looking_for_general_book_on_c11th_and_12th_c/
1361122222.0,18p5jl,The March to Nicaea,deannap,13,1,0,,t5_2sa8g,False
1346452347.0,z5qjb,Erwin Panofsky's Habilitationsschrift has been found in a Nazi safe,pentad67,11,0,2,"Maybe not the best place to post this,self,
1341279045.0,vyep0,Interesting topics to research within the realm of medieval Europe?,emmr,13,1,23,"I have a research paper coming up and I'd like to choose a topic. Something specific enough to find some good sources on,self,
1339136564.0,ur7h5,Medieval cities,dheilix,13,3,8,"Can anyone recommend a good book or documentary about the development of Medieval cities? How they functioned, but I'd be interested in any city really!",t5_2sa8g
1338172195.0,u83zo,"India's Hampi’s 2,000 temples &amp; ancient stones attract half a million pilgrims &amp; tourists a year - Conservationists want the site restored to its medieval glory – but the price is the eviction of those who live in its old bazaar",anutensil,12,0,http://www.reddit.com/r/MedievalHistory/comments/u83zo/indias_hampis_2000_temples_ancient_stones_attract/,http://a.thumbs.redditmedia.com/CQLIrMMdRFL67KoH.jpg,
1332596849.0,rbdf0,King Edward I: Invasion of Wales,,12,1,2,,t5_2sa8g,False
1331232309.0,qnn9x,Human remains thought to predate the construction of York Minster have been uncovered within the church by archaeologists -  The building was constructed over a 250-year period between the 13th and 15th centuries.,anutensil,11,0,1,,t5_2sa8g,False
1320728644.0,m4h5u,Vikings. They excite me. (cartoon),creamyturtlesoup,17,7,4,,t5_2sa8g,False
1314298748.0,juavz,"3  medieval walls, thought to be nearly 700 years old, have been found in the grounds of a Conwy hotel",anutensil,16,0,False,
1313866504.0,jp0xh,"For Sale in Sweden: 3-bed house, includes medieval skeleton (With Photo) ",anutensil,12,2,http://www.reddit.com/r/MedievalHistory/comments/jp0xh/for_sale_in_sweden_3bed_house_includes_medieval/,http://thumbs.reddit.com/t3_jp0xh.png,
1313613652.0,jlzey,12th Century Chess piece discovered in Iceland - similar to Lewis Chessmen,dragon_toes,13,2,0,,t5_2sa8g,False
1309952804.0,ii17p,"A 13th-century pot decorated with a ram’s head was found at a manor house in Wales - “We’ve always known about the manorial estate, but the amount of highly decorative pottery we’ve found shows we’re looking at a high status family, more wealthy than we’d realized.” (With Photo)",anutensil,13,0,False,
1309511517.0,ie2rl,"Jocelin of Furness, medieval writer of Saints' Lives, and what he tells us about identity in northern England at the turn of the 13th century. (x-post from r/history)",,11,3,False,
1309068504.0,i9eba,I'm looking to learn everything there is to know about Scotland between it's formation and 900 AD. Any key sources I should know about?,HardDiction,11,1,8,"I haven't had much luck on the internet beyond wikipedia,self,
1308280676.0,i1tb0,The science of the space age is being deployed to probe the secrets of the Tudor tombs of the great Howard family. ,davidreiss666,11,0,0,,t5_2sa8g,False
1302216787.0,gl3q8,"Part of a 7th-century heavy iron plow was unearthed in southeastern England - It had been thought that such plows, which were pulled by a team of eight oxen, did not come into use in England until the later medieval period",anutensil,11,1,False,
1301978235.0,givyz,Can we please cut down on the viewzu.com links? It's sort of embarrassing to have a top link not even be anything close to coherent. ,meanfannypack,13,2,1,"For example

1453 AD The Siege of Constantinople:: 1204 crusaders sacked the city

1453-1204 seems to be 247 years
Also

If we're going to have a Medieval History subreddit,,False,self,t5_2sa8g,False,,True
1298503374.0,fre18,Vikings Possibly Carried Native American to Europe: DNA analysis reveals that four families in Iceland possess genes typically found in Native Americans or East Asians. ,davidreiss666,13,2,2,,t5_2sa8g,False
1297262331.0,fi104,Codex Aureus: 9th Century Carolingian Gospel,wedgeomatic,11,1,0,,t5_2sa8g,False
1296155863.0,fa7m4,The Bogomils were a Christian dualist sect of Eastern Europe during the Medieval period. ,davidreiss666,11,0,1,,t5_2sa8g,False
1376235191.0,1k5bd1,Herleva of Falaise was the mistress of Duke Robert I of Normandy and mother of William the Conqueror.,historybuffCO,11,1,4,,t5_2sa8g,False
1375910845.0,1jwtui,"'The Dragon in Medieval East Christian and Islamic Art', by Sara Kuehn [PDF, 312 pages]",Qwill2,12,1,False,
1374683648.0,1iyqe8,Travis Don and Pete Collman from The History of Alchemy Podcast are doing an IAMA at /r/Histrory.,davidreiss666,13,3,0,"Travis Don and Pete Collman from [The History of Alchemy Podcast](http://historyofalchemy.com/) are doing an IAMA at /r/Histrory. 

[Link to the thread in r/History here](http://www.reddit.com/r/history/comments/1iypfg/ama_were_travis_and_pete_from_the_history_of/)

Previously they did an IAMA on /r/AskHistrorians [here](http://www.reddit.com/r/AskHistorians/comments/1bkyi9/wednesday_ama_magic_alchemy_and_the_occult/).   When the current series of IAMA's started in r/History they requested that they be allowed to do one there as well. 

Previous IAMA threads done at /r/History can be [found here](http://www.reddit.com/r/history/wiki/historyiama). 

Again

Please come on by and ask these guys some questions about the history of Alchemy. 

Thank you. 

",self,t5_2sa8g,False,,,True,http://www.reddit.com/r/MedievalHistory/comments/1iyqe8/travis_don_and_pete_collman_from_the_history_of/
1373814881.0,1ia186,King Louis XI of France &amp; Charles the Bold duke it out at the Battle of Montlhéry in 1465. Who won?,historybuffCO,10,1,0,,t5_2sa8g,False
1370708100.0,1fxj8h,David Crowther of The History of England Podcast is doing an IAMA thread in /r/History now! Please come on by and ask some questions!,davidreiss666,17,5,0,,t5_2sa8g,False
1370291155.0,1flqwn,"Thirteenth Century Church of St. Celynin in Llangelyinin near Llwyngwril in Meirionnydd, Wales. 360 Panorama virtual tour",historybuffCO,12,1,http://www.reddit.com/r/MedievalHistory/comments/1flqwn/thirteenth_century_church_of_st_celynin_in/,http://b.thumbs.redditmedia.com/vGPDz6pOdXbyAVqy.jpg,
1370013865.0,1fep7g,A new edition of French fabliaux translated into English,runbikekindaswim,11,1,0,,t5_2sa8g,False
1364493258.0,1b6u7x,"New book claiming the Shroud of Turin is not a medieval forgery, and a new Shroud app.",runbikekindaswim,16,4,http://www.reddit.com/r/MedievalHistory/comments/1b6u7x/new_book_claiming_the_shroud_of_turin_is_not_a/,http://a.thumbs.redditmedia.com/dak3_KIRitrr7Jdf.jpg,
1361291427.0,18tooa,Incredible pictures of a Spanish Romanesque cloister that has been hidden from the public for half a century,historybuffCO,13,2,0,,t5_2sa8g,False
1360265642.0,182y7u,"If anyone lives in the Saint Louis Area and wants to learn more about the Crusades, I would highly recommend this Forum.",mjk182,13,3,http://www.reddit.com/r/MedievalHistory/comments/182y7u/if_anyone_lives_in_the_saint_louis_area_and_wants/,default,
1360014111.0,17w2a7,Seeking Medievalists: Will you help me with my novel about Charlemagne?,futureslave,11,0,12,"The first volume of my five volume epic is complete!  The history and legends of Charlemagne used to be the most common stories in Europe apart from the Bible from the 11th-15th centuries.  Until the 19th century everyone knew of Roland and Oliver

I don't want to be one of those authors who ignores scholarship for the sake of their story.  I need qualified help from scholars who specialize in the Matter of France.  Before I send this out to agents and publishers

[Song Of Charlemagne Volume I - The Oriflamme](https://docs.google.com/file/d/0B4BwXQFZgF1NVWxBY2lFN0pfd0k/edit?usp=sharing)

Thank you!",self,t5_2sa8g,False,,,True,http://www.reddit.com/r/MedievalHistory/comments/17w2a7/seeking_medievalists_will_you_help_me_with_my/
1357730304.0,168sez,The Selling of a Monument (Dennis Aubrey),Aginbyte,10,1,0,,t5_2sa8g,False
