created_utc,id,title,author,ups,downs,num_comments,selftext,subreddit_id,is_self
1365553850.0,1c11rg,Whitby Abbey stands near the site of an Anglo-Saxon monastery which was the venue for a hugely significant event in AD 664: an ecclesiastical synod where matters of grave concern were discussed.,historybuffCO,22,0,1,,t5_2sa8g,False
1360003132.0,17vo0i,It IS Richard III! ,Mediaevalgirl,23,3,2,,t5_2sa8g,False
1359494318.0,17io9a,This belongs in a museum!  I can't believe that if I had $10k I could have a copy of De Proprietatibus Rerum (On the Nature of Things) by Bartholemeus Anglicus!  So cool!,borysSNORC,21,0,1,,t5_2sa8g,False
1358611566.0,16vnx6,Carrots as illustrated in Ancient Manuscripts,historybuffCO,24,1,1,,t5_2sa8g,False
1340734737.0,vn36t,5th-Century Anglo-Saxon woman buried with cow,pentad67,22,1,0,,t5_2sa8g,False
1338273314.0,u9z52,Does anyone have any idea why Ancient Roman battle tactics such as the Testudo formation failed to continue into the medieval period?,goodoldbess123,25,3,38,"I always thought that Roman battle tactics in a melee were effectively second to none up until the fall of the Roman Empire

Furthermore the Testudo would surely have saved a lot of casualties even into the medieval period.

I guess we do see some reminiscent tactics in shield walls etc. but I don't understand why a number of other effective Roman tactics fell by the wayside?",self,t5_2sa8g,False,,,True,http://www.reddit.com/r/MedievalHistory/comments/u9z52/does_anyone_have_any_idea_why_ancient_roman/
1376517641.0,1kdmhv,"Aethelflaed, Lady of the Mercians as depicted in medieval illuminated manuscripts from the British Library",historybuffCO,23,2,http://www.reddit.com/r/MedievalHistory/comments/1kdmhv/aethelflaed_lady_of_the_mercians_as_depicted_in/,http://f.thumbs.redditmedia.com/kd6Ohfh0fM356UNS.jpg,
1375033001.0,1j82xo,The sisters of Anglo-Saxon King Aethelstan married into royal houses on the continent and went into the church.,historybuffCO,21,2,0,,t5_2sa8g,False
1374198367.0,1ilq6k,A great documentary about a part of the Viking Apocalypse - by National Geographic,specieshumanoid,24,5,0,"Part1) http://www.youtube.com/watch?v=TCerXdWHQDI&amp;feature=youtube_gdata_player

Part2) http://www.youtube.com/watch?v=xZMVoljYnBE&amp;feature=youtube_gdata_player

Part3) http://www.youtube.com/watch?v=F_luKltX9Mk&amp;feature=youtube_gdata_player",self,t5_2sa8g,False,,,True,http://www.reddit.com/r/MedievalHistory/comments/1ilq6k/a_great_documentary_about_a_part_of_the_viking/
1373381989.0,1hxrmy,"King Offa's charter from 790 confirming the grant of three principal ports of early medieval England to the national church of France: Hastings, Pevensey and Londonwick.",historybuffCO,21,1,http://www.reddit.com/r/MedievalHistory/comments/1hxrmy/king_offas_charter_from_790_confirming_the_grant/,http://f.thumbs.redditmedia.com/2FtcTqOoAx_NwTek.jpg,
1371050895.0,1g77uc,"Some miniatures from an illustrated manuscript of ""The Fall of Princes"" by John Lydgate, c. 1450-1460",historybuffCO,20,0,http://www.reddit.com/r/MedievalHistory/comments/1g77uc/some_miniatures_from_an_illustrated_manuscript_of/,http://c.thumbs.redditmedia.com/5OZz2MR15lpalxDV.jpg,
1369313415.0,1ewett,Some points about arrows! (Medieval lore),JoeKawano,21,3,10,,t5_2sa8g,False
1361386159.0,18wfjz,Crusaders Besiege Nicaea,deannap,25,5,0,,t5_2sa8g,False
1361371625.0,18vyhd,Medieval bones found under Reading's friar street,JoeAllan,23,2,0,,t5_2sa8g,False
1357863039.0,16chu6,Armed viking age valkyrie figure from Harby,dragon_toes,27,5,0,,t5_2sa8g,False
1357331607.0,15yvhb,Underground church of St. Jean in Aubeterre-dur-Dronne France carved in the 12th C. by Benedictine monks,historybuffCO,22,1,0,,t5_2sa8g,False
1357169062.0,15uqqq,Rare Medieval Sword from the Crusades is Highlight of Bonhams Auction,historybuffCO,21,1,0,,t5_2sa8g,False
1356561254.0,15hki1,"Aethelflaed, Lady of Mercia. She was the daughter of Alfred the Great. 10th C.",historybuffCO,22,4,http://www.reddit.com/r/MedievalHistory/comments/15hki1/aethelflaed_lady_of_mercia_she_was_the_daughter/,http://d.thumbs.redditmedia.com/bV_4ao956dfehdgi.jpg,
1342841816.0,wwqhw,New details on 15th century bras found in Austria,birdinspace,22,4,1,,t5_2sa8g,False
1339364818.0,uv4qf,"French Gothic architecture - incredibly detailed maps and charts with gorgeous panoramic photos, floorplans and more.",borysSNORC,23,3,http://www.reddit.com/r/MedievalHistory/comments/uv4qf/french_gothic_architecture_incredibly_detailed/,default,
1336482447.0,tcv7d,Have You All Checked Out /r/FortPorn?,Its_all_good_in_DC,21,2,0,,t5_2sa8g,False
1304913394.0,h72qh,General medieval history reading?,TotallyBrr,21,0,29,"I'm looking for some books to read during this summer break. My first year at university has helped me to develop a love for medieval history. I would love to do some reading on this period. Does anybody have anything to suggest?

I'm interested in all of it, and the barbarians. I haven't learned enough of it to be very specific, though, so I am very open to anything.

Thanks! :)",self,t5_2sa8g,False,,,True,http://www.reddit.com/r/MedievalHistory/comments/h72qh/general_medieval_history_reading/
1300895876.0,g9s4l,"Found this today: AncientFM, streaming Medieval/Renaissance music.",theKnightofMirrors,23,3,http://www.reddit.com/r/MedievalHistory/comments/g9s4l/found_this_today_ancientfm_streaming/,default,
1295967402.0,f8pmh,"Medieval Sourcebook at Fordham, one of the best, if not the best, online resources for medieval history.",wedgeomatic,2,,False
1373990470.0,1if4to,Have archaeologists found a lost Viking trading centre in Norway?,Qwill2,20,1,1,,t5_2sa8g,False
1373295056.0,1hv6yd,Mystery Medieval Archaeological Site Uncovered at Somerset Housing Development,historybuffCO,22,2,0,,t5_2sa8g,False
1371307203.0,1gefuq,"King Louis XI of France, known as the Universal Spider for all the webs of intrigue he spun over Europe",historybuffCO,23,2,http://www.reddit.com/r/MedievalHistory/comments/1gefuq/king_louis_xi_of_france_known_as_the_universal/,http://a.thumbs.redditmedia.com/X-UcwE_s2htPvQnr.jpg,
1371002940.0,1g622y,Was the Anglo-Saxon girl buried with this cross a Christian or a pagan?,historybuffCO,22,2,3,,t5_2sa8g,False
1366826576.0,1d0vfd,"History of Glastonbury Abbey, Somerset, England. There has been a church here since the 7th C.",historybuffCO,20,0,False,
1361895916.0,199k2o,"Margaret of York, sister of Richard III made a brilliant match when she married Charles the Bold, Duke of Burgundy in 1468.",historybuffCO,20,0,False,
1361863398.0,198y4r,The Story of Byzantine [video],Qwill2,20,0,0,,t5_2sa8g,False
1361371544.0,18vyer,Car park workmen unearth medieval well,JoeAllan,23,4,3,,t5_2sa8g,False
1361232291.0,18s8ak,A RARE Anglo-Saxon brooch unearthed in Oxfordshire has gone on show in Banbury.,historybuffCO,20,1,0,,t5_2sa8g,False
1360549204.0,18a75j,Julian Glover reads Beowulf,aethelberga,20,2,0,,t5_2sa8g,False
1359924994.0,17tphf,A good (but highly complicated) mapping of the Wars of the Roses,mervis,20,3,6,,t5_2sa8g,False
1358817146.0,170x9q,Cosmic bang hit Medieval Earth,birdinspace,22,1,0,,t5_2sa8g,False
1357146508.0,15u023,"Images from the illuminated manuscript ""The Macclesfield Psalter""",historybuffCO,20,0,0,,t5_2sa8g,False
1343145751.0,x2tii,Diarmaid Macculloch reviews 'The War on Heresy: Faith and power in medieval Europe' (2012) by R. I. Moore (xposted from r/HistoryofIdeas),Qwill2,19,0,0,,t5_2sa8g,False
1341995620.0,wdknq,Lets have a discussion!,5pmPirate,20,3,9,"I have been trying to get a good round of discussions going in all of the history subreddits. Lets have fun with this one!

A popular debate among historians is finding the origins of the nation-state. Some believe that there is evidence that suggests the origins can be found between the Fifth and Seventh centuries. I am wondering what /r/MedievalHistory thinks. 

Lets have fun with this. Please be specific with answers an questions so that others who want to join in the conversation can.

",self,t5_2sa8g,False,,,True,http://www.reddit.com/r/MedievalHistory/comments/wdknq/lets_have_a_discussion/
1334881977.0,sirmv,The Genius of El Cid,secaa23,21,3,2,,t5_2sa8g,False
1322955375.0,mz6cm,"If a Medieval-era army engaged a Marian Roman Legion, what would be the outcome? Who would have the advantage? ",henno13,21,2,http://www.reddit.com/r/MedievalHistory/comments/mz6cm/if_a_medievalera_army_engaged_a_marian_roman/

This question came into my head while playing as Byzantium in Europa Universalis III. I've only recently discovered my interest in Roman history, my Medieval history is fuzzy, so I hope to gain insight from both you guys and the guys over at AncientRome, who will know a lot more about the ups and down about both sides than I do. 

EDIT: On the advice of quellthesparkle,False,self,t5_2sa8g,True,,,t3_mz6cm
1311128815.0,iuff5,Are there any really great Middle Ages podcasts out there?,,21,1,10,"Anything anyone would recommend? I've enjoyed the ""History of Rome"" podcasts,False,
1304284038.0,h1lgj,"England’s only medieval clock tower has been repaired &amp; renovated -  Merchants were tired of being ruled by the abbey, which controlled the clock, to which they'd add 10 minutes or more, just so people worked longer. So the clock tower exists in defiance of the abbey.",anutensil,2,,False
1376663130.0,1khm9e,Where the Wild Things Are: The Medieval Bestiary,nothingtolookat,23,3,0,,t5_2sa8g,False
1373600483.0,1i4pt1,"Hans Holbein the Younger, Artist at the Court of King Henry VIII of England",historybuffCO,19,0,http://www.reddit.com/r/MedievalHistory/comments/1i4pt1/hans_holbein_the_younger_artist_at_the_court_of/,http://a.thumbs.redditmedia.com/pTv5u_Pw6r6XowTf.jpg,
1373035462.0,1hoxvu,Burning for St Anthony’s Fire - Ergot and Witchcraft in the Medieval Period,historybuffCO,23,3,0,,t5_2sa8g,False
1372837864.0,1hk06w,Love in the Time of Demons: Thirteenth-Century Approaches to the Capacity for Love in Fallen Angels (x-post from r/HistoryofIdeas),Qwill2,21,1,1,,t5_2sa8g,False
1372345676.0,1h6k0k,Medieval Latrine Preserves Crusaders’ Intestinal Parasites,robinn2003,23,6,0,,t5_2sa8g,False
1371698212.0,1gpcla,Types of Byzantine Swords,historybuffCO,21,1,1,,t5_2sa8g,False
1370091357.0,1fgn8q,"Mingary Castle: Mingary's Importance - ""The most intact thirteenth century castle in Scotland"" (xpost from r/scottishhistory)",travellersspice,18,0,0,,t5_2sa8g,False
1367557460.0,1dlpl1,Types of horses in Anglo-Saxon/Medieval England,historybuffCO,22,3,5,,t5_2sa8g,False
1367015770.0,1d6mab,Exceptionally rare 11th C. Anglo-Saxon charter has been purchased by the Canterbury Cathedral Archives.,historybuffCO,19,2,0,,t5_2sa8g,False
1363855017.0,1aq15c,Is anyone attending the Medieval Congress at Kalamazoo in May?,Sormur,20,0,31,"http://www.wmich.edu/medieval/congress/

I'm a grad student from Canada studying Old Norse.  Anyone attending?  Presenting?  Anyone want to meet up?  ",self,t5_2sa8g,False,,,True,http://www.reddit.com/r/MedievalHistory/comments/1aq15c/is_anyone_attending_the_medieval_congress_at/
1358521021.0,16tgtu,"Pages from the illuminated manuscript ""The Apocalypse of 1313""",historybuffCO,20,1,1,,t5_2sa8g,False
1351613960.0,12cdtw,Islam Before 1095,deannap,27,8,4,,t5_2sa8g,False
1343419342.0,x9iwx,Description or accounts of duels and/ or criminal bands in Medieval history...?,BrisketTooth,19,2,15,"I am a filmmaker and I am developing some story ideas centering on sword combat in a Medieval setting.  Especially the early to high middle ages.  What I am looking for is ballads, or even accounts of daring criminal activity,False
1339540827.0,uyr4z,Pre-industrial workers had a shorter workweek than today's,TheoryofTechnology,21,3,4,,t5_2sa8g,False
1322335582.0,mq2yw,"In Ireland, the skeleton of a young man whose skull had been pierced by an iron arrowhead was found in a shallow grave, near an underground passage dating to the 9th century.",anutensil,18,0,False,
1317523629.0,ky152,"Probably should have posted here instead of /r/
history.  What replaces the now-rejected ""Dark 
Ages"" concept?",4,42,http://www.reddit.com/r/MedievalHistory/comments/ky152/probably_should_have_posted_here_instead_of_r/,"If we're starting to decide that ""Dark Ages"" is an inaccurate term for Western Europe after the fall of the Roman Empire, is there a book or a good documentary that will give me a good feel for what the new understanding is as far as day-to-day life in, say, is it proper to completely reject the concept of the Dark Ages,self,
1376740427.0,1kjnts,"Part of a gigantic, thousand-year-old structure that served as the largest hospital in the Middle East during the Crusader period will soon be open to the public, following a 13-year excavation",God_Wills_It_,21,0,False,
1375825513.0,1ju946,Archaeologists complete dig at Richard III site,historybuffCO,18,2,0,,t5_2sa8g,False
1375629341.0,1jokvq,How much for an ear? Anglo-Saxon legal codes,historybuffCO,21,4,6,,t5_2sa8g,False
1374160886.0,1ikah7,Aethelstan was the first King of Wessex to bring together all the Anglo-Saxon kingdoms in England. A formidable warrior &amp; grandson of Alfred the Great.,historybuffCO,21,5,5,,t5_2sa8g,False
1372346365.0,1h6kvy,16th C. Voynich Manuscript is an enigmatic book that has frustrated codebreakers and linguists for a century,historybuffCO,23,6,2,,t5_2sa8g,False
1371222274.0,1gcalh,Everything you've always wanted to know about medieval feudalism,historybuffCO,20,2,0,,t5_2sa8g,False
1364070770.0,1avkn9,"A silver penny depicting King Edward II of England, 1307-1327 AD, discovered near Cashel, Co. Tipperary, Ireland",17,,t5_2sa8g
1363812755.0,1aor0p,The Lindisfarne Gospels will be on display in Durham this summer. Here's a lovely article about the manuscript.,runbikekindaswim,18,2,2,,t5_2sa8g,False
1363538152.0,1agx0v,Book of Kells fans... download the app for FREE today only! A St. Patty's day gift! ,runbikekindaswim,18,2,4,,t5_2sa8g,False
1363125539.0,1a6am9,"Münster’s Monster Mash - Frank Jacobs debunks the myth that ""mapmakers of yore, frustrated by the world beyond their ken, marked the blank spaces on their maps with the legend Here be monsters""",nastratin,20,0,False,
1355680555.0,14y5or,"Photos from illuminated medieval Book of Hours depicting the Nativity, shepherds and the Three Wise Men",historybuffCO,21,4,http://www.reddit.com/r/MedievalHistory/comments/14y5or/photos_from_illuminated_medieval_book_of_hours/,http://a.thumbs.redditmedia.com/0qss6H4RXKvyohjN.jpg,
1355589309.0,14wd35,Can the Oseberg Viking finds be saved?,historybuffCO,18,2,0,,t5_2sa8g,False
1353966736.0,13u1u7,"Eat Rabbit Justice, Hound (Mmm… Marginalia #82)",VerGuy,19,2,http://www.reddit.com/r/MedievalHistory/comments/13u1u7/eat_rabbit_justice_hound_mmm_marginalia_82/,default,
1352389363.0,12uz8g,"Body, soul and gold: quests for perfection in English alchemy",Flewse,17,2,http://www.reddit.com/r/MedievalHistory/comments/12uz8g/body_soul_and_gold_quests_for_perfection_in/,http://a.thumbs.redditmedia.com/bxKkS4Q8QsPDdzQx.jpg,
1350461484.0,11mdem,"[audiobook] 'The History of the Decline and Fall of the Roman Empire' (1776-89), by Edward Gibbon (more in comments)",Qwill2,19,3,http://www.reddit.com/r/MedievalHistory/comments/11mdem/audiobook_the_history_of_the_decline_and_fall_of/,http://d.thumbs.redditmedia.com/TrD1MwT2-EXBGIN-.jpg,
1311933106.0,j3369,"Who dug the Erdstalls of Germany &amp; why?  - Until recently, the tunnels &amp; galleries were explored only by amateur archaeologists. One recorded crawling through 400 vaults, lit only by candlelight, with ""strange winding passages"" through which ""one can often only force oneself like a worm.""",anutensil,2,,False
1375629405.0,1jokx6,"Everything you ever wanted to know about Domesday Book, 11th C. survey of England's holdings commissioned by William the Conqueror",historybuffCO,20,4,http://www.reddit.com/r/MedievalHistory/comments/1jokx6/everything_you_ever_wanted_to_know_about_domesday/,http://b.thumbs.redditmedia.com/tWVaRZAGD_Lg0mDU.jpg,
1372540282.0,1hbvmf,"The amazing Margaret of Austria, Duchess of Savoy &amp; Regent of the Netherlands for her nephew HRE Charles V (15th-16th C.)",historybuffCO,18,2,http://www.reddit.com/r/MedievalHistory/comments/1hbvmf/the_amazing_margaret_of_austria_duchess_of_savoy/,http://a.thumbs.redditmedia.com/FWtnz0c700VloASZ.jpg,
1371931515.0,1gvdrg,"Illuminated miniatures from Sforza Book of Hours, c. 1490",historybuffCO,17,0,http://www.reddit.com/r/MedievalHistory/comments/1gvdrg/illuminated_miniatures_from_sforza_book_of_hours/,http://a.thumbs.redditmedia.com/BYrFWPqPfcI8A_8B.jpg,
1363613564.0,1aiu1e,"Philippa of Lancaster, daughter of John of Gaunt, became Queen of Portugal when she married Joao I",historybuffCO,17,0,False,
1363338037.0,1acays,BBC News - 'Black Death pit' unearthed by Crossrail project,atheistmil,16,0,0,,t5_2sa8g,False
1359980599.0,17v3h3,The History of St Etheldreda’s Church - the oldest Catholic church in England and one of only two remaining buildings in London from the reign of Edward I.(xpost from r/ukhistory),travellersspice,16,1,1,,t5_2sa8g,False
1359068788.0,177wsf,King Egbert and the Naming of England from History Today,historybuffCO,17,0,0,,t5_2sa8g,False
1359013297.0,176hf1,"A friend of mine is attempting to get from NZ to the Battle of the Nations to fight other knights! Reddit, even moral support would be awesome!",ZeboSecurity,22,6,http://www.reddit.com/r/MedievalHistory/comments/176hf1/a_friend_of_mine_is_attempting_to_get_from_nz_to/,http://a.thumbs.redditmedia.com/7qF_MPLKCkPtnXur.jpg,
1358288359.0,16n7yc,"12th C. Romanesque Cistercian Abbaye Notre-Dame de Boquen in Brittany, France",historybuffCO,17,0,http://www.reddit.com/r/MedievalHistory/comments/16n7yc/12th_c_romanesque_cistercian_abbaye_notredame_de/,http://c.thumbs.redditmedia.com/BILej_vqQXvpA7Gn.jpg,
1352315561.0,12t8ef,"November 1556 -- Mughal victory assures ascension of  Akbar the Great
",0,0,http://www.reddit.com/r/MedievalHistory/comments/12t8ef/november_1556_mughal_victory_assures_ascension_of/,,,False,t5_2sa8g,False
1351444629.0,1284rt,Crusades and Crusaders,deannap,24,7,2,,t5_2sa8g,False
1344355944.0,xtug6,"Looking for a book of (theoretical) recipes: ""Just for a Hlaf: The Micel Folcland Cook Book of Theoretical Anglo-Scandinavian Recipes""",emacsomancer,16,0,2,"I've seen a couple of references to this book online,,False
1333649387.0,ruyn1,"""Was it good for you, too?"" - Medieval Erotic Art and Its Audiences, by Martha Easton [PDF] (x-post from r/HistoryofIdeas)",Qwill2,17,3,False,
1332630110.0,rbyu0,The Scottish Wars of Independence: Braveheart,,18,2,0,,t5_2sa8g,False
1321467151.0,memk4,"The Plan of St. Gall  is the earliest preserved and most extraordinary visualization of a building complex produced in the Middle Ages, produced sometime in the period 819-26 A.D.",blackstar9000,17,1,http://www.reddit.com/r/MedievalHistory/comments/memk4/the_plan_of_st_gall_is_the_earliest_preserved_and/,http://c.thumbs.redditmedia.com/I9cmP_f5227y6Gbb.jpg,
1376750104.0,1kjtyz,"Hildegard von Bingen: 11th C. German abbess, writer and composer",historybuffCO,19,2,http://www.reddit.com/r/MedievalHistory/comments/1kjtyz/hildegard_von_bingen_11th_c_german_abbess_writer/,http://d.thumbs.redditmedia.com/kBIS7FwylHIcYEXi.jpg,
1376350714.0,1k8psy,12th C. Illuminated manuscript: The fabulous Melisende Psalter made for the Queen of Jerusalem,historybuffCO,16,0,1,,t5_2sa8g,False
1376161997.0,1k3pgj,Forgotten by history: Medieval royal babies you've never heard of,historybuffCO,18,2,0,,t5_2sa8g,False
1375918240.0,1jx3kt,"Article with some history about London Bridge, including the origins of the song ""London Bridge""",historybuffCO,15,1,http://www.reddit.com/r/MedievalHistory/comments/1jx3kt/article_with_some_history_about_london_bridge/,http://c.thumbs.redditmedia.com/j726E9PyDQkNP1A8.jpg,
1371930392.0,1gvcoh,"""Saints or Sinners? The Knights Templar in Medieval Europe."" Early article on Knights Templar history by Helen Nicholson.",Lebendigger,17,2,0,,t5_2sa8g,False
1368541499.0,1ebctc,"Isabella of Bourbon was the second wife of Charles the Bold, before he was Duke and the mother of Mary of Burgundy",historybuffCO,19,4,http://www.reddit.com/r/MedievalHistory/comments/1ebctc/isabella_of_bourbon_was_the_second_wife_of/,http://c.thumbs.redditmedia.com/KbxmOq7frqvTDYSV.jpg,
1364605188.0,1b9zze,"Jack Weatherford speaks very evocatively on Genghis (Chingiz, Jinghis) Khan",1914177614921066476,18,3,http://www.reddit.com/r/MedievalHistory/comments/1b9zze/jack_weatherford_speaks_very_evocatively_on/,http://c.thumbs.redditmedia.com/qdPDHPFUNtn-_PhD.jpg,
1364083243.0,1avxx5,How Medieval and Renaissance Tapestries Were Made,historybuffCO,15,2,0,,t5_2sa8g,False
1360868117.0,18j39j,Alexius and Bohemond of Taranto,deannap,15,1,0,,t5_2sa8g,False
1360192591.0,1812cb,New Content: Alexius and Godfrey of Bouillon,deannap,17,2,0,,t5_2sa8g,False
1359234796.0,17c0bz,French noblewoman Ermengarde de Beaumont was Queen of Scotland in the late 11th C.,historybuffCO,17,3,2,,t5_2sa8g,False
1356216355.0,15aspi,Images of stags or deer from medieval illuminated manuscripts,historybuffCO,16,0,0,,t5_2sa8g,False
1355529508.0,14vbp4,Pictures and covers from The Morgan Library collection of Medieval and Renaissance manuscripts,historybuffCO,18,3,3,,t5_2sa8g,False
1353716692.0,13owj1,Murder and execution in 15th century Politics... very interesting thesis.,borysSNORC,17,2,1,,t5_2sa8g,False
1351687605.0,12e93w,Just in time for Halloween - The Satanic Phenomenon: Medieval Representations of Satan... fascinating reading.,borysSNORC,18,4,1,,t5_2sa8g,False
1343077730.0,x1bbv,New Battle of Bannockburn visitor center and website promoting 700th anniversary celebrations and medieval history.,borysSNORC,15,0,1,,t5_2sa8g,False
1342516534.0,wozo6,Weird socially contagious 'Dancing Mania' in the Middle Ages in the wake of the Black Death in 14thC Europe.,borysSNORC,22,8,2,,t5_2sa8g,False
1336759494.0,tihuv,Was Henry VIII to blame for his wives’ miscarriages?,ElizWiz,21,8,1,,t5_2sa8g,False
1323497702.0,n76xq,What are the best TV Shows/Movies concerning the Medieval Period?,celtictool,16,0,31,"Of particular interest would be Medieval Europe (esp. The Isles,,False
1321899683.0,mke34,Leather and Leatherworking in Anglo-Scandinavian and Medieval York,sanpilou,16,1,2,,t5_2sa8g,False
1316871372.0,kq0j6,Can anyone recommend a book or article on the hierarchical structure of the Church in England circa 12-13th centuries?,leavesoflorien,15,0,11,"I am working with Gerald of Wales for my master's thesis

I would also love a recommendation for a book or article addressing common ecclesiastic knowledge/beliefs at that time.

Any suggestions? I'm looking for a more general survey that would cover this topic rather than an in-depth examination of a particular facet (unless that article is particularly worth recommending). 

I am reading a book on miracles and the medieval mindset right now by Benedicta Ward. 

Thanks!

edit: I should probably say that I am approaching Gerald from a literary angle since I am an MA English student,,False,self,t5_2sa8g,False,,True
1314160041.0,jsj3l,Medieval Clothing,OxfordTheCat,17,1,12,"Hey folks.

Just wondering if anyone has a list of resources for information on medieval clothing.

I'll take print or online!

I'm trying to find some information on cold weather / winter clothing, linen undergarments"" routine over and over again.

Any direction would be appreciated!


Thanks!",self,t5_2sa8g,False,,,True,http://www.reddit.com/r/MedievalHistory/comments/jsj3l/medieval_clothing/
1310067414.0,ijbih,"The Codex Gigas (aka, The Devil's Bible)",theKnightofMirrors,17,2,http://www.reddit.com/r/MedievalHistory/comments/ijbih/the_codex_gigas_aka_the_devils_bible/,http://thumbs.reddit.com/t3_ijbih.png,
1306526083.0,hlrkl,Construction work in England reveals medieval village with cobbled streets &amp; timber-framed houses - Archaeologists also found a bronze lion head that is thought to have been worn as a hat badge,anutensil,16,0,0,,t5_2sa8g,False
1305135849.0,h93a6,"The search is on in a medieval convent in Florence for the grave of Lisa Gherardini, thought to be the model for Leonardo da Vinci’s Mona Lisa. “We want to find the skull &amp; make a portrait of the Mona Lisa.” ",anutensil,17,3,http://www.reddit.com/r/MedievalHistory/comments/h93a6/the_search_is_on_in_a_medieval_convent_in/,default,
