created_utc,id,title,author,ups,downs,num_comments,selftext,subreddit_id,is_self
1354107205.0,13xj6d,Guy turns an electric organ into an 8-bit synthesizer. The results are pretty authentic and quite awesome sounding.,,10597,4659,596,,t5_2qh1u,False
1351603891.0,12c4iv,Lupe Fiasco draws excellent parallel between Blackface comedy and entertainers like Nicki Minaj.,ag3nt0range,21432,16972,3062,,t5_2qh1u,False
1368392674.0,1e7btj,"A few months ago, you requested I record Space Oddity. From my last full day on board the International Space Station - I hope you enjoy it.",ColChrisHadfield,19752,15490,http://www.reddit.com/r/Music/comments/1e7btj/a_few_months_ago_you_requested_i_record_space/,,
1355851313.0,15258k,I meticulously tabbed this video of 100 guitar riffs. Press Play and enjoy.,adrianh,17564,13425,1454,,t5_2qh1u,False
1347838734.0,zztiv,"Neil Young: ""Piracy is the new radio. That's how music gets around...That's the radio. If you really want to hear it, let's make it available, let them hear it""",pooterpon,11311,800,False,
1354571856.0,1481vk,"I know it's not a song, but for peaceful sounds..",Jinx_Minx,5171,1261,http://www.reddit.com/r/Music/comments/1481vk/i_know_its_not_a_song_but_for_peaceful_sounds/,,
1354726531.0,14bv76,"Dave Brubeck, jazz pianist, dead at age 91",thomfountain,14882,890,False,
1333667719.0,rveue,"An old man's reaction to hearing ""his"" music. I think we'll all be able to relate in ~70 years.",Rad9,11354,7694,1024,,t5_2qh1u,False
1371366687.0,1gg00x,Wanna know why MTV sucks now?,dono420,9455,5813,1098,,t5_2qh1u,False
1353244175.0,13eayf,Mom tears up the drums in Wipeout. Makes me laugh hysterically out of happiness. ,BarmackAttack,16261,12648,898,,t5_2qh1u,False
1356534853.0,15gx3p,"It may not fit here directly, but on my last post I was asked to record the ambient noise from the space station for use in recordings. Here it is.",ColChrisHadfield,9177,5777,http://www.reddit.com/r/Music/comments/15gx3p/it_may_not_fit_here_directly_but_on_my_last_post/,,
1370377196.0,1foa4g,Jack White saves historic Detroit venue by paying off their $142K tax bill,Kleverer,13880,10657,572,,t5_2qh1u,False
1354041025.0,13vvcm,"It's not Pandora, Spotify, or Rdio... but it's something I've been making the past 2 years. What do you guys think?",codyjackstewart,18597,2530

What is it? It's a music app for listening to music content on YouTube. Just type a band's name and click 'Just' or 'Similar'.

I make $0 bucks off this

Thanks!

EDIT: Holy shit, so bare with me :(

EDIT 2: I'm trying everything I can to contact Echo Nest right now

EDIT 3: Echo Nest to save the day!!! https://twitter.com/echonest/status/273589820973002756

EDIT 4: Wow

LAST EDIT: I'm going to go ahead and lay a blanket ""Holy shit, email, tweet, or whatever and soaking it in. ... wow

crazy late edit: theres a fix out there now for ff,False,,t5_2qh1u,1354205737.0,,,t3_13vvcm
1343717811.0,xfs5l,Snoop Dogg has changed his name to Snoop Lion after a spiritual rebirth in Jamaica. I shit you not.,Bigwood69,18153,14959,1917,,t5_2qh1u,False
1350999260.0,11y0xg,"4 years after his last YouTube video, Ronald Jenkees returns with ""Red Lemonade Remixed""",Randrage,11712,8529,http://www.reddit.com/r/Music/comments/11y0xg/4_years_after_his_last_youtube_video_ronald/,,
1330958378.0,qil1g,I am the 99%. Screwed by the industry.,Toliver182,28481,25358,2537,,t5_2qh1u,False
1374720620.0,1j03gn,"Ticketmaster charging $55.80 service charge on a $75 ticket. Sure, that seems totally reasonable.",MistletoeAlert,10637,7523,http://www.reddit.com/r/Music/comments/1j03gn/ticketmaster_charging_5580_service_charge_on_a_75/
[Exhibit A] (http://imgur.com/syxmNkI)",,t5_2qh1u,False,,,True,http://www.reddit.com/r/Music/comments/1j03gn/ticketmaster_charging_5580_service_charge_on_a_75/
1356365684.0,15dm9a,"Not sure if it's up to reddit standards, but here is a song I recorded yesterday on the International Space Station.",ColChrisHadfield,13126,10029,http://www.reddit.com/r/Music/comments/15dm9a/not_sure_if_its_up_to_reddit_standards_but_here/,,
1374029178.0,1igkf2,"I don't know where else to post this -- my buddy playing guitar, drums and singing at the same time.",darthnuri,10998,7915,http://www.reddit.com/r/Music/comments/1igkf2/i_dont_know_where_else_to_post_this_my_buddy/,,
1358256189.0,16m6wq,"Top 100 songs from yesterdays ""What is the most beautiful song you've ever heard?"" thread compiled on Spotify. Enjoy! :)",Dansecaribe,12143,9083,1160,,t5_2qh1u,False
1360360199.0,185my8,"Hi Reddit, from the International Space Station. Tonight I was playing the guitar here and thought of a question for you. If you could have me play one song here in space, what would it be?",ColChrisHadfield,13672,4856,False,
1374416594.0,1ir1ei,Marvin Gaye’s isolated vocal track on ‘I Heard it Through the Grapevine’ will give you chills,fishsandwich,10790,7771,698,,t5_2qh1u,False
1361281380.0,18tf04,Rage Against The Machine - 3/29/92 - A never before seen tape just surfaced,TheAnt06,10008,7013,911,,t5_2qh1u,False
1369083851.0,1epvr0,"Ray Manzarek, keyboardist and founding member of The Doors, passed away",Paastand,14408,1158, passed away today at 12:31PM PT at the RoMed Clinic in Rosenheim,
1369465098.0,1f0pjh,I didn't know this type of music existed. I'm in love and her name is Russia.,LukeEnglish,13903,10932,1695,,t5_2qh1u,False
1357480646.0,1626me,"My little brother covered Ray Charles' ""Hit The Road Jack"" while we were visiting with family over the holidays. Unbeknownst to him, we recorded it. (x-post from r/coversongs)",freckledginger,15616,12695,http://www.reddit.com/r/Music/comments/1626me/my_little_brother_covered_ray_charles_hit_the/,,
1336056109.0,t54ut,Challenge: Name a style of music you dislike and it's up to fans of said style to find artists that could change your opinion.,getjustin,9824,6901,14038,"I'll start: fucking reggae. It's one of those styles that's pigeonholed by a beat. And as much as I hate it when people say this

EDIT: Holy crap! 10K comments?",,t5_2qh1u,True,,rd,True,http://www.reddit.com/r/Music/comments/t54ut/challenge_name_a_style_of_music_you_dislike_and/
1278635936.0,cni9d,"Reddit, can we start a groundswell campaign to encourage Google to create a ticketing alternative to Ticketmaster?",yeahHedid,4951,2091,http://www.reddit.com/r/Music/comments/cni9d/reddit_can_we_start_a_groundswell_campaign_to/,,
1353502313.0,13kb1a,The official twitter hashtag for Susan Boyle's new album is #susanalbumparty. That is all.,Raerth,16075,13222,672,,t5_2qh1u,False
1348335803.0,10azpg,"Green Day got their set cut from 45 to 25 minutes at the Iheart Radio Festival so Usher could have more time on stage, here is Billie Joe's reaction...",ciababy,26506,23654,http://www.reddit.com/r/Music/comments/10azpg/green_day_got_their_set_cut_from_45_to_25_minutes/,,
1308667291.0,i5a61,To the people that stole my guitar,cheek_blushener,7844,4998,477,,t5_2qh1u,False
1373895223.0,1ic6mu,Stranded Dave Matthews hitches ride with fan to his own show,RoswellSpaceman,13903,11069,1215,,t5_2qh1u,False
1364166847.0,1axuj0,Girl absolutely rocking Hendrix on a gayageum (Korean stringed instrument),brazen_ape,8090,5260,462,,t5_2qh1u,False
1371882030.0,1guejk,Guy buys a ~100 year old piano for $75 and coaxes magic out of it.,gynoceros,8935,6119,629,,t5_2qh1u,False
1352231463.0,12qvti,Dave Grohl will play drums on new Queens of the Stone Age album  ,robotrock1382,12032,9245,602,,t5_2qh1u,False
1349182933.0,10tb7c,"So, I made a website that plays the top ten tracks of any band. If you recently discovered a new band, you should definitely check it out!",subtepass,15754,1004,False,
1370351503.0,1fndqw,"I made a Spotify playlist of the top 100 songs from yesterday's /r/askreddit ""Favorite One Hit Wonder"" thread and thought I'd share!",DJSlambert,9026,6267,756,"Original Thread: http://www.reddit.com/r/AskReddit/comments/1fkne7/what_is_your_favorite_onehit_wonder_song/

Spotify Playlist: http://open.spotify.com/user/1217111127/playlist/2H9FxCaDDqDOcc7gNTwIxL

Grooveshark playlist - From /u/jamesharland:  http://grooveshark.com/playlist/One+Hit%20Wonders/87231913  

Google Music playlist - From /u/kugfoomasta:    ~~https://play.google.com/music/listen#/pl/AMaBXyl7D3ueYzp-Ij9Nk3zQw9HwBA67T-QS35jV002IMBZWxDVR2AbQShNragMPcyrsOUoGE4QPC2RzyYf_Sja_YeD11dR29g%3D%3D~~     

https://play.google.com/music/playlist/AMaBXyl7D3ueYzp-Ij9Nk3zQw9HwBA67T-QS35jV002IMBZWxDVR2AbQShNragMPcyrsOUoGE4QPC2RzyYf_Sja_YeD11dR29g==

Mog playlist - From /u/Kady9:   http://mog.com/m/playlist/45129651?ci=20000

Rd.io playlist - From /u/MadOx75:  http://rd.io/x/QNRUL3tpPA/

Streamus playlist - From /u/MeoMix:  http://share.streamus.com/playlist/c8142bbec2b9/one_hit_wonders",,t5_2qh1u,1371404025.0,,,True,http://www.reddit.com/r/Music/comments/1fndqw/i_made_a_spotify_playlist_of_the_top_100_songs/
1361437139.0,18y1yf,About 4 months ago I posted a fast/simple youtube to mp3 converter.  I've kept my promise of no ads and continue to fund it from my own pocket.  Can you jump start it by pasting 1 youtube url?,yellowDoggieDog,15550,12799,1376,,t5_2qh1u,False
1306347649.0,hjz2z,I asked random New Yorkers with headphones on what song they were listening to...,idlesense,6997,4261,1328,,t5_2qh1u,False
1353130923.0,13c9uq,/r/music: The biggest missed chance on Reddit,OcelotPrince,9945,7217,810,"Bit of a rant here. I suppose I'm just disappointed every time I click on to /r/music and see the same indie standards
  
Reddit prides itself on being the 'front page of the internet'. /r/movies is, the new stuff is the most important.  
  
This is where /r/music totally falls over. In the last week it has popped up on my front page with Bon Iver's 'Skinny Love' and The Postal Service's 'Such Great Heights'
  
Meanwhile
  
Mess + Noise profiles [The New Melbourne Jangle](http://www.messandnoise.com/articles/4517534), Stereogum deconstructs [Sufjan Stevens and his relationship with Christian music](http://stereogum.com/1201912/deconstructing-sufjan-stevens-and-christian-music/top-stories/lead-story/) and Pitchfork explores the [emerging blur between indie and mainsteam pop music](http://pitchfork.com/features/articles/8981-a-small-pop/).  
  
But who cares about some snobby critics, or [Bat For Lashes](http://pitchfork.com/features/cover-story/reader/bat-for-lashes/) in a gorgeous e-magazine Pitchfork feature.  
  
There's [NPR First Listen](http://www.npr.org/series/98679384/first-listen), but how about a little less 'First Day Of My Life' (and man, I love Bright Eyes) and a little more like Rick Alverson's [stunning video](http://www.youtube.com/watch?feature=player_embedded&amp;v=7iljkaDZvyw) for Night Bed's 'Even If We Try', or the Garth Jennings directing Guitar Wolf's [cover of 'Summertime Blues'](http://www.youtube.com/watch?v=lLTJAZu70zo&amp;feature=related) for Adam Buxton's Bug TV show.  
  
I don't really have a solution
  
I've posted a few things here before, at least I can look forward to seeing them on the frontpage in 2016.  
  
**EDIT**: Alright enough of the bitching,,False,,t5_2qh1u,1353133492.0,,True
1325852045.0,o5cf3,Five people cover a song using only one guitar.,Confused_Spider,8946,6217,913,,t5_2qh1u,False
1336351767.0,tag6y,This is what music is all about. [x-post from r/jazz],ationsong,16315,13593,710,,t5_2qh1u,False
1374534313.0,1iuh7k,Sacha Baron Cohen Leaves Freddie Mercury Biopic because the remaining Queen band members wanted a PG rating,chewpendous,6398,3693,927,,t5_2qh1u,False
1355284797.0,14pgl3,Ravi Shankar has passed away,Actumen,7763,5056,424,,t5_2qh1u,False
1367424346.0,1dhkic,"I spent a lot of time transcribing and then learning Harder Better Faster Stronger, note for note, on piano. Here's the result.",BeamPacer,16066,866,False,
1365903796.0,1cawsg,Deftones bassist Chi Cheng died today at age 42. RIP Chi :-(,noktiis,9683,7036,825,,t5_2qh1u,False
1369270839.0,1evgmw,"Evolution of Popular Music: Scott Bradlee plays ""Twinkle, Twinkle Little Star"" in styles from ragtime to dubstep",BadgerPriest,9760,7119,http://www.reddit.com/r/Music/comments/1evgmw/evolution_of_popular_music_scott_bradlee_plays/,,
1328202153.0,p7vle,"Neil Young: ""Piracy is the new radio. That's how music gets around...That's the radio. If you really want to hear it, let's make it available, let them hear it""",nomdeweb,11836,840,False,
1354002915.0,13v4v7,Coffee Shop Acoustic Session... Get Low Cover,BlueFalconNation,10492,7870,667,,t5_2qh1u,False
1366580332.0,1ctmfz,"Pitch shift Daft Punk's ""Get Lucky"", add in a few ""Shamonas"" and you've got a new Michael Jackson hit!",kibitzor,7897,5275,http://www.reddit.com/r/Music/comments/1ctmfz/pitch_shift_daft_punks_get_lucky_add_in_a_few/,,sc
1350589830.0,11pft9,"Band discovers Michigan face-paint artist James Kuhn via reddit and they ask him to collaborate
on a video. 12 months later,8068,5454,518,http://www.reddit.com/r/Music/comments/11pft9/band_discovers_michigan_facepaint_artist_james/,,,,,
1375893763.0,1jw57b,Watch Stephen Colbert rip into MTV for stealing Daft Punk,rupeshjoy852,8483,5882,853,,t5_2qh1u,False
1359335642.0,17eekj,"Lenny Kravitz hears a band playing his music down the street, decides to join in.",Canigetahellyea,14502,11911,http://www.reddit.com/r/Music/comments/17eekj/lenny_kravitz_hears_a_band_playing_his_music_down/,,
1371777429.0,1grlm7,Andrew W.K. Successfully completes 24-hour drum marathon,random_potatoes,12469,9894,625,,t5_2qh1u,False
1363545397.0,1ah557,I've recorded a version of Danny Boy for today in orbit. Hope you like it! ,ColChrisHadfield,9555,6984,397,,t5_2qh1u,False
1337124956.0,tp1w9,band buys $20k worth of their own tickets from ticketmaster and sells them back to fans at face value eating all the ticketmaster extortion fees.,sksmith66,8707,6154,456,,t5_2qh1u,False
1354519639.0,146vl5,"Mashup of 50+ Pop Songs of 2012: Put together by a friend of mine, took approximately 500 hours",soondot,4643,2096,http://www.reddit.com/r/Music/comments/146vl5/mashup_of_50_pop_songs_of_2012_put_together_by_a/,,
1366160875.0,1ci2oq,"TIL Kid Rock is taking a pay cut of $50,000-$100,000 per night of his tour to make tickets and beer actually affordable for the common folk",werddoe,23229,1965,False,
1364063735.0,1avcu7,"Daft Punk's New Album is Called Random Access Memories, Out May 21",max_pretzel,11201,8670,http://www.reddit.com/r/Music/comments/1avcu7/daft_punks_new_album_is_called_random_access/,,blfm
1342789100.0,wvdj6,Marilyn Manson's commentary for Rolling Stone after Columbine is just as relevant for today's shooting in Colorado,EditingAndLayout,16811,14286,1903,"*EDIT*: It's happening already. News reports are coming in about WB possibly suspending screenings of *The Dark Knight Rises.* And don't forget the sensationalist news stories (e.g., you can't be crazy no more?""](http://www.youtube.com/watch?v=IOmb3Rp1pcU)

*EDIT 2*: And so it goes. [Dark Knight Rises ads pulled from television](http://www.latimes.com/entertainment/envelope/cotown/la-et-ct-tv-ads-dark-knight-rises-20120720

*EDIT 3*: [Paris premiere cancelled](http://www.sfgate.com/news/article/Shooting-cancels-Paris-premiere-of-Batman-movie-3722486.php)

**Columbine: Whose Fault Is It?**

*by Marilyn Manson*

http://www.rollingstone.com/culture/news/columbine-whose-fault-is-it-19990624

It is sad to think that the first few people on earth needed no books, the only motivation he needed was his own human disposition to violence. Whether you interpret the Bible as literature or as the final word of whatever God may be, Christianity has given us an image of death and sexuality that we have based our culture around. A half-naked dead man hangs in most homes and around our necks, and we have just taken that for granted all our lives. Is it a symbol of hope or hopelessness? The world's most famous murder-suicide was also the birth of the death icon -- the blueprint for celebrity. Unfortunately, for all of their inspiring morality, nowhere in the Gospels is intelligence praised as a virtue.

A lot of people forget or never realize that I started my band as a criticism of these very issues of despair and hypocrisy. The name Marilyn Manson has never celebrated the sad fact that America puts killers on the cover of Time magazine, since their inception, have turned criminals into folk heroes. They just created two new ones when they plastered those dipshits Dylan Klebold and Eric Harris' pictures on the front of every newspaper. Don't be surprised if every kid who gets pushed around has two new idols.


We applaud the creation of a bomb whose sole purpose is to destroy all of mankind, or maybe even participate in it, like their violent car chase of Princess Di. Disgusting vultures looking for corpses, exploiting, fucking, filming and serving it up for our hungry appetites in a gluttonous display of endless human stupidity.


When it comes down to who's to blame for the high school murders in Littleton, and we're the ones who tune in and watch the up-to-the-minute details of what they do with them. I think it's terrible when anyone dies, especially if it is someone you know and love. But what is more offensive is that when these tragedies happen, most people don't really care any more than they would about the season finale of Friends or The Real World. I was dumbfounded as I watched the media snake right in, not missing a teardrop, interviewing the parents of dead children, televising the funerals. Then came the witch hunt.


Man's greatest fear is chaos. It was unthinkable that these kids did not have a simple black-and-white reason for their actions. And so a scapegoat was needed. I remember hearing the initial reports from Littleton, since they were dressed in black. Of course, speculation snowballed into making me the poster boy for everything that is bad in the world. These two idiots weren't wearing makeup, and they weren't dressed like me or like goths. Since Middle America has not heard of the music they did listen to (KMFDM and Rammstein, among others), the media picked something they thought was similar.


Responsible journalists have reported with less publicity that Harris and Klebold were not Marilyn Manson fans -- that they even disliked my music. Even if they were fans, Jim Jones? Do you think entertainment inspired Kip Kinkel, or should we blame the fact that his father bought him the guns he used in the Springfield, Oregon, murders? What inspires Bill Clinton to blow people up in Kosovo? Was it something that Monica Lewinsky said to him? Isn't killing just killing, regardless if it's in Vietnam or Jonesboro, Arkansas? Why do we justify one, isn't he old enough to be held personally responsible for what he does with his car or gun? Or if he's a teenager


America loves to find an icon to hang its guilt on. But, and people tend to associate anyone who looks and behaves differently with illegal or immoral activity. Deep down, most adults hate people who go against the grain. It's comical that people are naive enough to have forgotten Elvis, Jim Morrison and Ozzy so quickly. All of them were subjected to the same age-old arguments, scrutiny and prejudice. I wrote a song called ""Lunchbox,"" and some journalists have interpreted it as a song about guns. Ironically, the song is about being picked on and fighting back with my Kiss lunch box, metal lunch boxes were banned because they were considered dangerous weapons in the hands of delinquents. I also wrote a song called ""Get Your Gunn."" The title is spelled with two n's because the song was a reaction to the murder of Dr. David Gunn


The somewhat positive messages of these songs are usually the ones that sensationalists misinterpret as promoting the very things I am decrying. Right now, depression, car crashes? We live in a free country, but with that freedom there is a burden of personal responsibility. Rather than teaching a child what is moral and immoral, right and wrong, we first and foremost can establish what the laws that govern us are. You can always escape hell by not believing in it, but you cannot escape death and you cannot escape prison.


It is no wonder that kids are growing up more cynical; they have a lot of information in front of them. They can see that they are living in a world that's made of bullshit. In the past, there's nowhere to run. People are the same everywhere. Sometimes music, movies and books are the only things that let us feel like someone else feels like we do. I've always tried to let people know it's OK, or better, if you don't fit into the program. Use your imagination -- if some geek from Ohio can become something, why can't anyone else with the willpower and creativity?


I chose not to jump into the media frenzy and defend myself, because their coverage of the event was some of the most gruesome entertainment any of us have seen.


I think that the National Rifle Association is far too powerful to take on, and I wouldn't want it to. I'm a controversial artist, one who dares to have an opinion and bothers to create music and videos that challenge people's ideas in a world that is watered-down and hollow. In my work I examine the America we live in, and I've always tried to show people that the devil we blame our atrocities on is really just each one of us. So don't expect the end of the world to come one day out of the blue -- it's been happening every day for a long time.


MARILYN MANSON
(May 28,False,,t5_2qh1u,1342894335.0,,,t3_wvdj6
1359056755.0,177grs,Macklemore the first unsigned artist in modern history to hit #1 on U.S. Charts,wagnerwork,18440,15919,1948,,t5_2qh1u,False
1339365700.0,uv5ef,I saw this picture of ZZ Top in 1969 the other day and subsequently almost dropped my phone.,SirSucculENT,15791,13275,481,,t5_2qh1u,False
1358163733.0,16jp93,"This is a girl from the small Australian country town where I grew up. She doesn't know I posted this, but I think she's unbelievable. That voice... ",jwestcott,15227,12707,http://www.reddit.com/r/Music/comments/16jp93/this_is_a_girl_from_the_small_australian_country/,,
1348035464.0,104i5a,[PSA] Please stop posting about how your life sucks then add a really generic plug to your music,Trottimus,10864,8353,686,"Also could you guys check out my music? Its called ""Thriller"" on YouTube. My music name is MJ",t5_2qh1u,True
1346961044.0,zgrg5,"I have to agree with r/metal, this is the greatest music video of all time. I present to you Nekrogoblikon.",SoSpecial,10973,8472,http://www.reddit.com/r/Music/comments/zgrg5/i_have_to_agree_with_rmetal_this_is_the_greatest/,,
1374164314.0,1ikexq,"Bohemian Rhapsody for solo guitar, meticulously tabbed out. Press play and enjoy.",adrianh,7398,4904,http://www.reddit.com/r/Music/comments/1ikexq/bohemian_rhapsody_for_solo_guitar_meticulously/,,
1373124217.0,1hr1tm,The imgur of audio.,7870FUNK,7125,4644,552,,t5_2qh1u,False
1361376753.0,18w3z1,This is what rap sounded like in the 1930s. Night Mail. [3:24],igphotography,8287,5809,576,,t5_2qh1u,False
1343759281.0,xgmdp,The State of the Music Industry,Hetalbot,12424,9952,1295,,t5_2qh1u,False
1360168438.0,180781,"In spite of having beaten up Rihanna, beaten up Frank Ocean over a parking spot, tweeted sexist things to a female comedian, broke his probation, lied about his community service, Chris Brown wonders why people criticize him. ",2979,False
1368968058.0,1emmmg,Daft Punk 'One More Time' singer and house producer Romanthony dies.,kungfukai,9670,7218,392,,t5_2qh1u,False
1364218345.0,1ayzr9,Dave Grohl: 'TV talent shows make everyone sound like fucking Christina Aguilera' ,carlobankston,11860,9410,1531,,t5_2qh1u,False
1353761048.0,13pney,"PSY with Gangnam Style has now surpassed Justin 
Bieber's Baby on YouTube's most viewed videos",23911,1534,http://www.reddit.com/r/Music/comments/13pney/psy_with_gangnam_style_has_now_surpassed_justin/,,,False,t5_2qh1u,False
1372367079.0,1h7d9j,Eminem terrified as daughter begins dating man raised on his music. (The Onion),doogie92,13280,10840,852,,t5_2qh1u,False
1355452741.0,14tlao,Mumford And Sons Can't Believe They All Got Each Other Mandolins For Christmas ,diggro,9724,7278,599,,t5_2qh1u,False
1367532486.0,1dkvzx,RIP Jeff Hanneman,Abovethecanopy,13809,11378,988,,t5_2qh1u,False
1375640754.0,1jow8n,"The lead singer/guitarist of my friend's band isn't 21, and on their tour a bar they played at would not let him in. This was their solution to the problem.",night_on_the_sun,12195,9779,http://www.reddit.com/r/Music/comments/1jow8n/the_lead_singerguitarist_of_my_friends_band_isnt/,,
1371164718.0,1gavaz,Pink Floyd's entire catalogue will be unlocked on Spotify once Wish You Were Here has been streamed one million times,rhyso90,5039,2621,729,"Here's the link. What are you waiting for?!

https://play.spotify.com/album/2NzyXZfWkRcFpsJ8phIjnl

**[Source](https://www.facebook.com/photo.php?fbid=10151485999122308&amp;set=a.10150285867642308.333957.5660597307&amp;type=1)**",,t5_2qh1u,False,,,True,http://www.reddit.com/r/Music/comments/1gavaz/pink_floyds_entire_catalogue_will_be_unlocked_on/
1360551028.0,18a9er,Chris Brown is the only one sitting as he loses a Grammy Award to Frank Ocean,,19385,16980,2666,,t5_2qh1u,False
1375369162.0,1jhwqe,"I'm a High School Math Teacher, and after countless nights recording in my bedroom instead of grading, I finally finished my first album. It's called Escalator Music, and I'd love it if you gave it a listen! (Just don't tell my students)",swelomusic,12403,,False
