created_utc,id,title,author,ups,downs,num_comments,selftext,subreddit_id,is_self
1370227108.0,1fk231,"restored my first axe, also sewed custom leather masks for it.",barkeep8,213,21,http://www.reddit.com/r/myog/comments/1fk231/restored_my_first_axe_also_sewed_custom_leather/,http://e.thumbs.redditmedia.com/7OPp_tDeKy6goLhL.jpg,
1364916700.0,1bipwp,Sewed a first aid pouch,barkeep8,161,15,39,,t5_2sclk,False
1373313215.0,1hvv83,MYOG Lightweight Bug Bivy - Successful Test Trip!,birdsbirdsbirdsbirds,105,3,17,,t5_2sclk,False
1353285898.0,13fa4t,"I made a sleeping bag, jacket and modified a pack for my dog to go backpacking. Xpost campingandhiking",legs,117,22,http://www.reddit.com/r/myog/comments/13fa4t/i_made_a_sleeping_bag_jacket_and_modified_a_pack/,http://b.thumbs.redditmedia.com/VrsqU9dKmNVwrZng.jpg,
1367436938.0,1di1gq,i made my first backpack,sploiz,95,16,12,,t5_2sclk,False
1359487469.0,17ifg5,Home made Camp Kitchen/Chuck Box - Made from expanded PVC and aluminum!,ha1ex,85,5,25,,t5_2sclk,False
1365458840.0,1by3m3,My 2p double walled tent.,Jordo_99,81,11,17,,t5_2sclk,False
1369061085.0,1ep27d,Tested out my first sewing project this weekend,DWillms,75,4,8,,t5_2sclk,False
1366655389.0,1cvmsa,Timelapse of the making of my latest bushcraft knife! (x/post from ArtisanVideos),aarongough,75,5,17,,t5_2sclk,False
1364362796.0,1b3gkb,Self-Igniting Fire Starters,RegisteredToUnsub,77,4,12,,t5_2sclk,False
1364827645.0,1bfagh,My myog hammock project.,worstwingmanever,75,4,6,,t5_2sclk,False
1365011624.0,1blnbe,My newest project...camp/backpacking utensils (x-post from r/paracord),Sohcracer891,73,8,10,,t5_2sclk,False
1362059436.0,19e8bc,DIY Denim Tool Roll (xpost from /r/bushcraft),calumr,61,5,4,,t5_2sclk,False
1311265388.0,ivxt3,Plastic Soda Bottle Lid Capsule,thomas533,60,7,8,,t5_2sclk,False
1371521658.0,1gk4v5,"Not sure if this would be useful here, a couple summers ago I figured out a beer bottle &amp; cap with a hole makes a perfect Tiki torch",PoopInMyHand,65,12,http://www.reddit.com/r/myog/comments/1gk4v5/not_sure_if_this_would_be_useful_here_a_couple/,http://a.thumbs.redditmedia.com/BnOE5PWOFhHKWJ3r.jpg,
1372695518.0,1hfls8,How to Make a Soup Can Forge,ThirstyOne,56,9,2,,t5_2sclk,False
1373221559.0,1htaes,"Has anybody ever tried to make these capsules? If so, how did they hold up?",eightbitlincoln,53,5,http://www.reddit.com/r/myog/comments/1htaes/has_anybody_ever_tried_to_make_these_capsules_if/,http://d.thumbs.redditmedia.com/_TZdlR0kl5kS8Axi.jpg,
1375038382.0,1j88sy,Simple ultralight shelter,clipsey,49,6,2,,t5_2sclk,False
1355270970.0,14p0su,"completed: 22oz 900fp quilt. thanks for your insight, MYOGGIT.",MountainManakin,52,9,http://www.reddit.com/r/myog/comments/14p0su/completed_22oz_900fp_quilt_thanks_for_your/,http://b.thumbs.redditmedia.com/RtUH2jWmdJTxUEna.jpg,
1357573576.0,164gge,"Making a Primitive Bow, part 1. - YouTube",gelatinous_poot,52,9,http://www.reddit.com/r/myog/comments/164gge/making_a_primitive_bow_part_1_youtube/,http://f.thumbs.redditmedia.com/7PYBNMCnggDaXw05.jpg,
1372683085.0,1hf8r7,Custom knife (from /r/videos),henry82,43,2,4,,t5_2sclk,False
1347589201.0,zuu0z,"My first myog knife and sheath, what do you think?",deadshaman9,49,4,http://www.reddit.com/r/myog/comments/zuu0z/my_first_myog_knife_and_sheath_what_do_you_think/,http://e.thumbs.redditmedia.com/PNfsstGMFhQvLVXv.jpg,
1370705751.0,1fxgyz,"So I made a mobile rock climbing training wall that can adjust angles between 80, 60, and 45 degrees. (x-post from r/climbing)",ninjaplushie,53,21,False,
1370599537.0,1fuqq1,Bifocals DIY.,timonoko,39,4,4,,t5_2sclk,False
1325636684.0,o1s74,"Tried the soda can stove, to mixed results (not pictured: My desk on fire)",Aspel,37,3,http://www.reddit.com/r/myog/comments/o1s74/tried_the_soda_can_stove_to_mixed_results_not/,http://b.thumbs.redditmedia.com/2tqMjrbYGRK7KMMm.jpg,
1364608029.0,1ba31e,Decided to fab up a couple of stoves. Pix inside!(x-post from r/backpacking),Sohcracer891,40,5,19,"I decided to go ahead and try my hand at a couple stoves. I first did a Supercat, and a push-pin

What do ya think?

http://i.imgur.com/do4tl97.jpg    Pepsi Penny Test Run

http://i.imgur.com/XrbPdgS.jpg   The Finished Pair

http://i.imgur.com/QcaCeib.jpg   Lit Superwiener

http://i.imgur.com/IMSdbb5.jpg   Lit Pepsi Penny
",self,t5_2sclk,False,,,True,http://www.reddit.com/r/myog/comments/1ba31e/decided_to_fab_up_a_couple_of_stoves_pix/
1361415165.0,18xh6n,How to make a homemade lighter using a gum wrapper and AA battery (x-post from Chaz42 in /r/LearnUselessTalents/),majestic_unicorn,40,4,5,,t5_2sclk,False
1352184059.0,12puhd,Make Rope from Plastic Bags (without tools) - YouTube,Thereax,38,4,7,,t5_2sclk,False
1335320415.0,sr2g5,Made my own tyvek Footprint-link to album,Slayer_Kitten,34,3,7,,t5_2sclk,False
1366906340.0,1d3980,DIY Gear Praise,sk8rgui,35,1,5,"I placed an order yesterday with [DIY GEAR Supply](http://www.backwoodsdaydreamer.com/) and messed up my order.  I ordered 70D coated material for both my tarp and hammock. Upon reading on several forums I realized my mistake.  The hammock should be breathable. 

I immediately contacted Scott at DIY Gear Supply and he helped me switch out material on my order

I'll post images in a few weeks when I get my materials and get my hammock built. Looking forward to my first hammock,False,self,t5_2sclk,False,,,t3_1d3980
1360090444.0,17y3du,"This is my hobo stove, made out of two cans of food and some wire.",estate8143,37,5,http://www.reddit.com/r/myog/comments/17y3du/this_is_my_hobo_stove_made_out_of_two_cans_of/,http://e.thumbs.redditmedia.com/xgi8GBpF0A7xLMLR.jpg,
1351486372.0,129dot,"Made my own ultralight backpack, a la flash pack 18 from REI",Rizak,38,7,http://www.reddit.com/r/myog/comments/129dot/made_my_own_ultralight_backpack_a_la_flash_pack/,http://d.thumbs.redditmedia.com/Whxhap-KGvWo2v0E.jpg,
1375116091.0,1jaa09,Xpost from r/ultralight: My DIY 1.9oz cook kit,mikriz,35,4,7,,t5_2sclk,False
1359696440.0,17oh8s,Sleeping bag as kimono. Just added the orange zipper and couple of hoops in front to keep it off the ground. ,timonoko,41,8,4,,t5_2sclk,False
1347239792.0,zmoa7,Simple DIY: a glasses strap so I don't lose them when canoeing/kayaking,eskay8,42,12,4,,t5_2sclk,False
1323029284.0,n01s7,Found this gem today: MYO Snowshoes,stanti,34,3,3,,t5_2sclk,False
1340466300.0,vhho6,DIY G4 Pack,digrat,33,2,14,,t5_2sclk,False
1326665063.0,oif2z,Cheap Bastard: Burn Test of the Hybrid Pocket Rocket Wood Gas Stove,sjg91,31,2,7,,t5_2sclk,False
1322667305.0,musmt,The best website I've seen for DIY alcohol stoves and accessories ,bronchospasm,32,1,5,,t5_2sclk,False
1374378671.0,1iqet4,x-post from /r/appalachaintrail: DIY Tyvek Stuff Sacks. neat video.,Rocksteady2R,30,3,0,[here ya go.](http://www.youtube.com/watch?v=IyYuET-UOEk),t5_2sclk,True
1351359291.0,126hoh,Dry Bag Backpack,somewhereonariver,31,5,20,"[Here](http://imgur.com/a/4di0H) are some pics of the drybag backpack I made. I created most of the pattern using Google Sketch Up and for materials I used 18oz. VPC and HH66 to create the water proof bonds for the main body of the backpack. All in all

http://imgur.com/a/4di0H",self,t5_2sclk,False,,,True,http://www.reddit.com/r/myog/comments/126hoh/dry_bag_backpack/
1330277815.0,q6usn,Ultra-Lightweight Backpacking Spice Kit (only 1oz.),thomas533,35,8,9,,t5_2sclk,False
1321924545.0,mkv18,"DIY Hammocks, bugnets, suspension, and underquilt",thomas533,3,,False
1313512207.0,jklg9,How to make newspaper logs for a fire,wamperton,33,5,5,,t5_2sclk,False
1371798918.0,1gs6gk,New Waterproofing Method? Will NeverWet Be Of Any Use to DIY Backpackers/Campers?,GuitarMaster5001,37,9,19,,t5_2sclk,False
1358155009.0,16jl5d,"I made a very light but warm jacket, to be prepared for the worst ",estate8143,33,6,http://www.reddit.com/r/myog/comments/16jl5d/i_made_a_very_light_but_warm_jacket_to_be/,http://e.thumbs.redditmedia.com/igCGYFLG-QoS5q_L.jpg,
1351251615.0,124anm,"$2 sweater from a thrift store, a sewing Machine and boredom = 100% Wool Socks.",Rizak,31,4,http://www.reddit.com/r/myog/comments/124anm/2_sweater_from_a_thrift_store_a_sewing_machine/

I found a [wool sweater](http://imgur.com/pBCXG) at a thrift store

I present to you

I've been wearing them all day with boots

I did an odd trial today where I wore one ""work sock"" from walmart and one of these. The wool sock was much more comfy but it was much MUCH warmer than the other sock. This is good if you're out in the cold... but on a decent day this just meant sweaty feet.

How did I do it? I tried looking up tutorials. I found one on instructables but I didn't want to cut out the pattern so I winged it. Started with a tube

Thoughts?",self,t5_2sclk,False,,,True,http://www.reddit.com/r/myog/comments/124anm/2_sweater_from_a_thrift_store_a_sewing_machine/
1376095817.0,1k29t7,DIY Webbing Tutorials via Core77,JuardVanD,32,4,1,,t5_2sclk,False
1368541979.0,1ebddz,i too made a hammock,sploiz,28,5,6,"back in my post about making a backpack i mentioned that i made a hammock and someone asked for pics. well i finally got around to getting some. i also posted this in the /r/hammocks but it fits in both places.

http://i.imgur.com/4ex5LPv.jpg

http://i.imgur.com/aLOVxaA.jpg

when i measured it,,False,self,t5_2sclk,False,,True
1363468736.0,1affxo,Sugru + Foster Pot,evilduck,28,4,5,,t5_2sclk,False
1331783388.0,qxal0,My first DIY underquilt build.,Pinus_rigida,25,2,0,,t5_2sclk,False
1363381766.0,1adfp5,"XeroShoes Huaraches Kit- A Decent ""Camp Shoe""",bghouse,29,6,12,,t5_2sclk,False
1312406608.0,j84xe,Ultralight waterproof backpack mk. III,thomas533,25,1,4,,t5_2sclk,False
1309746236.0,ig20e,Camp chair from dead wood,Danimaltanimal,26,1,2,,t5_2sclk,False
1335660782.0,sxj7z,How to make the Slatt's Rescue Belt,slanket,30,5,2,,t5_2sclk,False
1329860168.0,pzvsw,"Breakfast Scramble Recipe - ultra light, cheap, simple, and good flavor.  Just add water!",WarMace,3,,False
1362496935.0,19pk2h,Trekking poles as center poles for Shangri-La and Hexamid tipis,bghouse,23,3,7,,t5_2sclk,False
1361685885.0,194dt7,My attempt at the DIY 4x6 utility pouch at DIY Tactical...,barkeep8,29,8,3,,t5_2sclk,False
1323716143.0,n9x7t,Wood pellet hobo stove under $5 pretty ingenious ,,28,4,3,,t5_2sclk,False
1368597604.0,1ed9jt,Been Busy in the off season,Purple-Is-Delicious,23,2,7,"Since getting bit with the DIY bug

To accompany my ENO Doublenest, and a Tarp to keep away the wind and rain 

* [Jackets I started with](http://i.imgur.com/EdW2dO4.jpg)
* [JCP UnderQuilt w/o suspension](http://i.imgur.com/enNYc1Y.jpg)
* [JCP underQuilt deployed](http://i.imgur.com/Blq2HEk.jpg)
* [Bug net made from noseeum mesh](http://i.imgur.com/8aVRZCM.jpg)
* [SilNylon Tarp](http://i.imgur.com/clE02av.jpg)
* 0 degree Top Quilt converted from an old down Mummy bag: [Front](http://i.imgur.com/pbZFT8P.jpg) and [Back](http://i.imgur.com/4pDUNre.jpg)
* [Everything packed up](http://i.imgur.com/Wba8i3u.jpg) - (from bottom to top) Hammock+bugnet, Sap bag w/suspension.   weighs about 5lbs including HG 40*Burrow

I also made a Reflectix [pot cozy](http://i.imgur.com/yluE6NP.jpg) and [alcohol stove](http://i.imgur.com/hx1DiZx.jpg).
",self,t5_2sclk,False,,,True,http://www.reddit.com/r/myog/comments/1ed9jt/been_busy_in_the_off_season/
1346384859.0,z4908,Men's Wool Shirt.  Know of any other utilitarian clothing patterns?,BatteryLicker,24,3,7,,t5_2sclk,False
1340649047.0,vl135,Make your own USB charger,,24,1,19,,t5_2sclk,False
1362334577.0,19l3w2,"Building A Smaller, Lighter Cook System",bghouse,23,3,http://www.reddit.com/r/myog/comments/19l3w2/building_a_smaller_lighter_cook_system/,http://a.thumbs.redditmedia.com/KZpba78hVIj3zDSx.jpg,
1358797488.0,1708bf,Raptor Buckles available at MissionSpec.com.  Disclaimer: I work for MS.,brentk7,33,15,5,"http://missionspec.com/products/raptor-buckle/

Had this posted in /r/gundeals and several people told me that you guys might like it.  If you do not know what the Raptor Buckle is here is a great write-up (basically a US made competitor of the Cobra Buckle): http://www.itstactical.com/gearcom/load-bearing/raptor-buckles-offer-american-made-alternative-to-austrialpin-cobra-buckles/.

Currently

Available in 4 sizes (1"" through 2"") and 2 colors (black and coyote).  All options in the dropdown box are in stock and ready to ship immediately.  Reply here if you have any questions or feel free to use the websites contact form.

UPDATE: short vid: https://www.youtube.com/watch?v=QrO26DH2gXc",self,t5_2sclk,1358801831.0,,,True,http://www.reddit.com/r/myog/comments/1708bf/raptor_buckles_available_at_missionspeccom/
1336344948.0,taayu,"Soy wax emergency candles – fun, easy and a quick weekend project",bradclarkston,22,1,http://www.reddit.com/r/myog/comments/taayu/soy_wax_emergency_candles_fun_easy_and_a_quick/,http://d.thumbs.redditmedia.com/2fEefE76l7vC7vOQ.jpg,
1330702234.0,qejey,Time Lapse Tent- MYOG,somewhereonariver,21,1,6,,t5_2sclk,False
1324336524.0,nj2nw,"If you like to make your own meals for the trail, check out /r/TrailMeals",thomas533,22,1,http://www.reddit.com/r/myog/comments/nj2nw/if_you_like_to_make_your_own_meals_for_the_trail/,default,
1300488165.0,g6qt4,Build your own Solar USB charger,johnnyfresno,25,3,8,,t5_2sclk,False
1374009529.0,1ifvqs,Reusing old tents?,liquidfury,19,0,7,"I'd like to start making some of my own gear. I went to a local music festival last week and was shocked at the number of abandoned/destroyed tents at the end of the week. I grabbed a few tents, fly
",self,t5_2sclk,False,,,True,http://www.reddit.com/r/myog/comments/1ifvqs/reusing_old_tents/
1365409263.0,1bwnjn,Homebuilt Holster,ajn142,33,15,6,,t5_2sclk,False
1363610586.0,1airoy,MYOG Nalgene bottle pouch I made this weekend,barkeep8,20,3,8,,t5_2sclk,False
1372806746.0,1hj3mc,Super Cat Alcohol Stove - Which burn rate stencil (hole punch pattern) should I use?,JAWE,21,2,9,"Link to stencil: http://www.supercatstove.com/docs/SuperCat_HolePunchTemplates.pdf

I don't want to use up my fuel too quickly

Thanks in advance!",self,t5_2sclk,False,,,True,http://www.reddit.com/r/myog/comments/1hj3mc/super_cat_alcohol_stove_which_burn_rate_stencil/
1366176592.0,1cilng,"Youtube- Awesome Uses For Drinking Straws - ""Tip Of The Week"" E35 [11:35]",zfolwick,22,4,2,,t5_2sclk,False
1363380549.0,1ade7q,Make your own Underquilt,jacob_8806,18,0,4,"I recently purchased a [Warbonnet blackbird 1.7oz hammock](http://www.warbonnetoutdoors.com/blackbirds.php). I was wanting to make my own version of a [Yetti Underquilt] (http://www.warbonnetoutdoors.com/quilts.php). If anyone out there has/knows the dimensions for one of these underquilts,self,
1362676330.0,19ur0p,I'm developing a pattern for a MYOG packraft. Any feedback?,micro_cam,22,3,12,,t5_2sclk,False
1362605693.0,19stxs,Touring Roll Bag (xpost from /r/bicycletouring,DaveFromTWJ,22,3,6,"I come from a DIY background for outdoor gear. I know that /r/myog is mostly backpacking equipment

I made this [Touring Roll Bag](http://i.imgur.com/9qtsBg0.jpg) out of 10oz cotton duck canvas. (it could be made of Cordura Nylon for waterproofness

I purchased the fabric at JoAnne's for $10.99 a yard and it took half a yard, J A Stein cassette tool, chain tool and spoke wrench. It is 29in x 9 in.

I will be making a matching handlebar roll-bag and maybe a set of panniers. If there is interest
",self,t5_2sclk,False,,,True,http://www.reddit.com/r/myog/comments/19stxs/touring_roll_bag_xpost_from_rbicycletouring/
1344653446.0,y14ck,"Pictured: My dad, taking ""car camping"" to the next level. When you don't have suiting terrain, just carry some in the trunk!",KyleMistry,26,8,False,
1331411127.0,qqmnm,My DIY hammock/bugnet (x-post from r/Hammocks),Pinus_rigida,18,0,2,,t5_2sclk,False
1300480246.0,g6obn,Penny Alcohol Stove,mharriger,20,2,1,,t5_2sclk,False
1374354856.0,1ipqz4,Bought my first sewing machine yesterday and managed to break it already.,,17,0,17,Part won't be in for 2 weeks and it's a hundred dollar repair.  [Do you guys think it's worth it?](https://www.hammockforums.net/gallery/files/2/6/3/1/4/dscf1458_original.jpg),t5_2sclk,True
1367851348.0,1dslh9,"New Budweiser ""bow-tie"" has twice the amount of aluminum than regular cans...",theBullMousse,19,1,19,"[This](http://www.huffingtonpost.com/2013/04/17/budweiser-bow-tie-can_n_3094549.html) should have great potential for a pot or stove

edit: initially just listed stove,False,self,t5_2sclk,1367858261.0,,,t3_1dslh9
1361044569.0,18nhku,Good alcohol stove for small diameter pot?,KestrelLowing,18,2,12,"I've made cat food stoves in the past,,False
1353740464.0,13pf4a,Foot Operated Scroll Saw,IA_Guy,20,4,1,"http://www.youtube.com/watch?v=LmEHuTgtcvw&amp;feature=player_embedded

This fellow has a few good videos.. and a cool accent.  He also has a lot of not-relevant vids.  This one and his making a mini wood lathe are interesting.",self,t5_2sclk,False,,,True,http://www.reddit.com/r/myog/comments/13pf4a/foot_operated_scroll_saw/
1337284072.0,ts4h6,Does anyone have any DIY bug repellent recipes they'd like to share?,skeo,19,0,22,I'm heading out into Algonquin park this weekend an I need a bug spray? I'd rather not buy a commercial spray and try making my own. Does anyone have any recipes they'd recommend?,t5_2sclk,True
1336749420.0,ti9aj,Instructions on how to make a wood gasification stove (crosspost from r/ultralight),slanket,18,3,8,,t5_2sclk,False
1331414537.0,qqp3l,Just finished this DIY hammock tarp (x-post from r/Hammocks),Pinus_rigida,17,1,0,,t5_2sclk,False
1319744926.0,lrbn6,Started making my own walking sticks! Figured you guys would appreciate it.,abdias2,24,6,5,,t5_2sclk,False
1375731342.0,1jrd69,Need some advice on modifying a backpack,twolegsoneshot,21,3,5,"Greetings.
I have this awesome 35 lts backpack that is almost perfect for me. The only problem is that the hole to put the things in is too small. So I was thinking in putting a double lockable zipper between the red and black that goes all the way around the marked part. Like in these picts http://imgur.com/a/cn4ld

But the problem is,False,self,t5_2sclk,False,,,t3_1jrd69
1364791021.0,1bejbc,Any idea if this would work as a pot holder? Heat tolerance?,loungin,17,3,10,,t5_2sclk,False
1354842886.0,14f19m,DIY Tyvek tent,tbow2000,24,7,2,,t5_2sclk,False
1351968430.0,12kovn,I made Ferrocerium Flint Fire Starters - thanks to sprashoo,cwcoleman,21,6,7,,t5_2sclk,False
1343333654.0,x7i26,Gathered End Hammock,cloudedice,20,3,7,"I just started being interested in the idea of hammock camping. I didn't want to spend the money on a 'professionally' made hammock

I built the hammock yesterday in about 4 hours (including a trip to the store for materials). I had expected the project to be a lot more difficult

If you read through the comments there are a couple of additional mods you could do to improve on the basic design (most complain the sides are too floppy) but it's hard to beat the simplicity. There's almost no reason NOT to make you're own hammock.

Now to work on a bug net. I figure a blue poly tarp will do in the short term with only one overnight planned this year...",self,t5_2sclk,False,,,True,http://www.reddit.com/r/myog/comments/x7i26/gathered_end_hammock/
1338976530.0,unq8a,"Guides on making hammocks and associated gear, plus a store with those materials and more. (Cross-post from r/Hammocks)",vikingengineer,18,3,http://www.reddit.com/r/myog/comments/unq8a/guides_on_making_hammocks_and_associated_gear/,http://a.thumbs.redditmedia.com/zfj6OxluoERIe-50.jpg,
1333620927.0,ruftw,woodgas stove,ZEbbEDY,21,4,5,,t5_2sclk,False
1375736153.0,1jrk44,MYOG summer quilt considerations,DucksterLite,17,1,4,"I'm making a summer quilt when the materials arrive from extremtextil.de.

I have read ALOT of quilt guides
Ive ordered 250 g app 9 ounze of 700 cuin down.
2
2

My questions are.

Shoud i baffel ? its going to have about 1, or just more work ?

Should i do a foot box or just ad a strip of velcro so i can make the it if i need it. Im afraid the velcro might tear the fabric

Is it worth it in a summer quilt to ad a ""neck string"" like the [katabatic](http://www.outdoorgearlab.com/Ultralight-Sleeping-Bag-Reviews/Katabatic-Gear-Palisade) quilt has it.

Do you guys have attachment system to tie to quilt to the sleeping pad ? do you use it. is it needed on a summer quilt ?

I don't know anyone who have a quilt i can try out, so i hope you can help me.

p.s. english is my second language.",self,t5_2sclk,False,,,True,http://www.reddit.com/r/myog/comments/1jrk44/myog_summer_quilt_considerations/
1374462144.0,1ise85,"People who bring sewing kits on trips, how do you store them?",Zorro_Darksauce,17,3,http://www.reddit.com/r/myog/comments/1ise85/people_who_bring_sewing_kits_on_trips_how_do_you/

However,False,self,t5_2sclk,False,,,t3_1ise85
1373549393.0,1i2ty3,How do I make detachable should straps on a backpack or bag?,sploiz,19,4,11,"Edit: I screwed up the title and can't figure out how to change it on my phone. Should is shoulder. 

I want to make another backpack but I would like to have detachable shoulder straps

What are some good ways to make detachable shoulder straps? Also what about a detachable hip belt?",self,t5_2sclk,False,,,True,http://www.reddit.com/r/myog/comments/1i2ty3/how_do_i_make_detachable_should_straps_on_a/
1368656750.0,1eev82,Not sure if this counts; but I got a wicked sunburn yesterday. Got me to thinking about making my own Aloe Vera Gel.,My_New_Ego,19,4,8,"I went kayaking yesterday and came back absolutely fried. So I got to thinking

http://www.wikihow.com/Make-Aloe-Vera-Gel",self,t5_2sclk,False,,,True,http://www.reddit.com/r/myog/comments/1eev82/not_sure_if_this_counts_but_i_got_a_wicked/
1352922740.0,1373s2,Advice for building a tent....,theBullMousse,16,1,13,"So

Suggestions?! Advice?!  I'm making the tent because I want to get into backpacking (do a good bit of car camping atm),False,self,t5_2sclk,False,,,t3_1373s2
1352741479.0,132kb5,"i would like to make no sew backpack, but need help.",rickycodie,17,2,http://www.reddit.com/r/myog/comments/132kb5/i_would_like_to_make_no_sew_backpack_but_need_help/,self,
1348844504.0,10mcvq,Distill cheap vodka into ~95% ethanol for fuel?,sprashoo,16,1,15,"Just an idea that occurred to me, while water boils at 100ºC. Heat up a litre of cheap vodka to just over 78º

Or is this totally impractical? Obviously you'll want to monitor the temperature carefully and probably use a non-flame heat source just in case. I recall a setup like this from chemistry class - it seems like something that could be done at home?

http://www.chem1.com/acad/webtext/solut/solut-images/distillapp-plain.jpg

I've heard that it's very hard to distill ethanol to better than 95% (with 5% water remaining),False,self,t5_2sclk,1348844745.0,,,t3_10mcvq
1338924805.0,umkdk,Make your own tripod camping stool,skijeeper,17,3,1,,t5_2sclk,False
1325851547.0,o5c89,"Backpacking woodgas, pocket rocket, and alky stoves",jspate61,18,2,False,
1323493534.0,n750v,$10.00 ultraligh DIY tarp ,jspate61,18,2,7,,t5_2sclk,False
1323183839.0,n2jm4,How I build my own penny stove the easy way. With lots of pics.,FidgetTheMidget,16,1,2,,t5_2sclk,False
1309718756.0,ifsj9,"HAE been able to repurpose one of these chairs in anyway? It's got bent poles, ripped connections etc. But the fabric is still good.",phidel_kashflow,16,1,http://www.reddit.com/r/myog/comments/ifsj9/hae_been_able_to_repurpose_one_of_these_chairs_in/,http://thumbs.reddit.com/t3_ifsj9.png,
1376189029.0,1k4h7f,Tyvek - for sale,cwcoleman,22,10,12,"I bought a huge roll of Tyvek today and would like to sell the extra. I probably have 50-75 feet to sell. 

$2 a foot (9' wide) + $5 for shipping",self,t5_2sclk,False,,,True,http://www.reddit.com/r/myog/comments/1k4h7f/tyvek_for_sale/
1374535748.0,1iuj0y,"[Deadfall] Since you guys liked my last video so much, here is my older one. It is a variant of a Dead fall. Please feel welcome to subscribe if you would like to be notified of future videos.",Bombolini,24,10,http://www.reddit.com/r/myog/comments/1iuj0y/deadfall_since_you_guys_liked_my_last_video_so/,http://b.thumbs.redditmedia.com/3Fsy3TxR-qqaMMAg.jpg,
1374392966.0,1iqpp0,"[Spring Snare] I make survival videos every week. Here's a trap I made today, I hope you guys like it!!!",Bombolini,20,4,http://www.reddit.com/r/myog/comments/1iqpp0/spring_snare_i_make_survival_videos_every_week/,http://a.thumbs.redditmedia.com/Cp1HwfH72vge6pnT.jpg,
1372188043.0,1h21lh,Anyone used this to make rain tarps out of lighter material?,nekidfrog,25,12,19,,t5_2sclk,False
1371030083.0,1g6qb1,"Adding leather straps/replacing cotton webbing on my backpack, need assistance.",leeresgebaeude,19,5,http://www.reddit.com/r/myog/comments/1g6qb1/adding_leather_strapsreplacing_cotton_webbing_on/

Should I buy harness leather? Bridle leather? What weight is recommended? What does Filson or Duluth Pack use?

edit: Thanks for the suggestions. Just to add,,False,self,t5_2sclk,1371290337.0,,True
1367928268.0,1duuwa,Looking for book on Sewing outdoor gear,sixtyfootersdude,15,2,9,"Went to the book store yesterday to try and pickup a book on sewing but I couldn't find anything that wasn't full of frilly things.  

I am planning on making a framebag for my bike and have borrowed (long term) a sewing machine from my aunt.  Never sewed anything before and was thinking it would be fun to have a book to go over the basics.  ",self,t5_2sclk,False,,,True,http://www.reddit.com/r/myog/comments/1duuwa/looking_for_book_on_sewing_outdoor_gear/
1365263371.0,1bssw3,My cook pot needs a handle like a whore needs Jesus. What do?,tbag12,48,31,21,,t5_2sclk,False
