created_utc,id,title,author,ups,downs,num_comments,selftext,subreddit_id,is_self
[Diagram with approximate dimensions](http://www.hammockforums.net/gallery/showimage.php?i=7455&amp;c=newimages&amp;cutoffdate=1)",self,t5_2sclk,True,,,True,http://www.reddit.com/r/myog/comments/gf55u/the_jerry_chair_an_ultralight_camp_chair/
1298879326.0,fu6ev,Just Jeff's Homemade Gear,thomas533,4,0,0,,t5_2sclk,False
1298879192.0,fu6e0,Hammock Tarp,thomas533,4,1,0,,t5_2sclk,False
1365445283.0,1bxkn4,"I want to camp in the trees, but the tentsile tents are WAY too expensive...",everbodygetsgrubby,4,2,http://www.reddit.com/r/myog/comments/1bxkn4/i_want_to_camp_in_the_trees_but_the_tentsile/

Im just attached to the whole idea of it and id like to improvise.. because there is no way that the materials for this type of easy levitation would cost over 800 euros.",self,t5_2sclk,False,,,True,http://www.reddit.com/r/myog/comments/1bxkn4/i_want_to_camp_in_the_trees_but_the_tentsile/
1358407288.0,16qoxu,is there a 100% cotton fill sleeping bag?,Lizards_are_cool,10,7,37,"if not

update: thanks for all the feedback. i bought a coleman 30 polyester fill to try it out. so far so goo and just 25$",self,t5_2sclk,1359231138.0,,,True,http://www.reddit.com/r/myog/comments/16qoxu/is_there_a_100_cotton_fill_sleeping_bag/
1350884045.0,11vsvo,Ask MYOG: Lighting an alcohol stove -- can you use an electric charge to start combustion?,MountainManakin,7,5,8,Let me preface this -- I know that by far the easiest method of starting an alcohol stove would be to use a match. But I'm wondering -- could I use a 9v battery to close a circuit on my brass trangia or aluminum supercat to light the stoves? Ideally by sparking the vapor rather than through heating the metal as a resistor. Any thoughts MYOG?,t5_2sclk,True
1347898843.0,1010th,Suggestions for common materials to make a good sheath out of?,Standasone,4,1,6,I have a pretty sizeable buck knife and i need something that it's not going to stab through.,t5_2sclk,True
1336128353.0,t6nt2,"Quilt questions, noise and drafts",skyl4rk,5,1,http://www.reddit.com/r/myog/comments/t6nt2/quilt_questions_noise_and_drafts/

Before I make a quilt

The nylon material is very loud when I move around, which works but it usually ends up underneath me by morning.

I am wondering if anyone else has this problem and how they fixed it.

I am thinking about sewing some fleece on the quilt where my face rubs it. Do you think this would work?


Another comfort issue is that there tend to be cold drafts near my shoulders if I don't use a fleece blanket. I know one solution is to wear something

One crazy idea, and don't know if it would be comfortable, but it should be warm.

Or maybe I should just get used to the noise and wear a shirt at night?",self,t5_2sclk,False,,,True,http://www.reddit.com/r/myog/comments/t6nt2/quilt_questions_noise_and_drafts/
1369793133.0,1f8pxr,[Request] Pole specs for an on tent I bought.,chialms,2,0,7,"Hello

I've been looking around

Thank you.",self,t5_2sclk,False,,,True,http://www.reddit.com/r/myog/comments/1f8pxr/request_pole_specs_for_an_on_tent_i_bought/
1363050576.0,1a4ae1,Inexpensive leather pouch,SimonsDiscoveries,10,6,0,,t5_2sclk,False
1360774081.0,18gaqr,Any ideas for a packable dog bed?,Goldberry,3,1,10,"I hammock camp,self,
1356158617.0,159rwz,DWR / waterproofing down jacket? nikwax / other recommendations?,MountainManakin,2,0,1,"I just purchased a relatively low-end down jacket (Kirkland brand at Costco) and am interested in adding DWR. Good experiences with nikwax? bad experiences? advice?

Thanks in advance,False,self,t5_2sclk,False,,,t3_159rwz
1355199673.0,14nbuz,Food Coozie,cwcoleman,8,6,2,,t5_2sclk,False
1348633956.0,10hpt5,Pillow recommendations?,AdventurousAtheist,4,2,6,"Anyone have any pillow recommendations? I'm pretty set that an air pillow will not work for me. I have an Exped UL Air Pillow that I've tried to warm up to due to its weight and pack size


I'm pretty set on making my own pillow now since a lot of the filled ones seem to run at least 7oz in weight minimum. I think I can do better. Anyone have any recommendations? I searched ""pillow"" in this subreddit and only came up with a single thread. 


",self,t5_2sclk,False,,,True,http://www.reddit.com/r/myog/comments/10hpt5/pillow_recommendations/
1325161125.0,nuuqq,"Poor wannabe; I couldn't sleep and got the idea to make a bivvy out of PVC an old blanket, and other stuff",Aspel,4,2,http://www.reddit.com/r/myog/comments/nuuqq/poor_wannabe_i_couldnt_sleep_and_got_the_idea_to/,http://b.thumbs.redditmedia.com/jnoHzA3apQ20JC-7.jpg,
1325057936.0,ntd8r,17 oz Down Quilt Kit,thomas533,5,4,0,,t5_2sclk,False
1321924805.0,mkv78,Get ready for winter trips - make your own ski pulk (PDF),thomas533,3,1,1,,t5_2sclk,False
1298935878.0,funh5,Possum and Merino Blended Yarns,thomas533,2,0,0,,t5_2sclk,False
1376144611.0,1k38cn,Cheap fabric for a gathered-end hammock?,madamemoriarty,1,0,2,"I'd like to make an arsenal of hammocks for backpacking with gear-less friends,False,
1375661081.0,1jpis1,The most effective and resource inexpensive squirrel trap possible!,Bombolini,4,3,0,,t5_2sclk,False
1366170519.0,1cif8l,Best Material (fabric) to make a bike Frame Bag (or backpack?,sixtyfootersdude,3,2,9,"Good Morning!

I am planning on making a frame bag for my mountain bike in the near future.  Bought some cardboard last night to make a mockup.  I was wondering: 

a) What is the best material to use to make a frame bag?  Where should I purchase it?  I could go to a faberick store but there is nothing super close.  Something online would work or local could too.  Where do you by fabric?  What would you recommend?  

b) I also need zippers

Other info: 

 - I have a standard sewing machine that I borrowed from a friend.  I was thinking I will probably also need to get scissors, but will I need a special needle for the sewing machine?  
 - In Canada

Priorities for fabric: 

* Easy to work with -&gt; Maybe in the future I will make another one with a better or heavier fabric.  THis is my first sewing project so something easier would be good.  

* Waterproof

* Easy to clean - mountain biking = mud

* Durable 

* Non stretch fabric

* Other things I haven't thought of

This is what a frame bag looks like: [Image](http://lh4.ggpht.com/_BhBOJtgtve4/S21ls_znU2I/AAAAAAAADKI/IOu-48k4_Os/s400/IMG_4472.JPG).  The frame bag is the bag inside of the main triangle.  

** Note: My the bottom bracket (pedals) on my bike is higher than that bike and my top tube slopes down so the total size of my bag will probably be about half the size of the pictured bike.  ",self,t5_2sclk,False,,,True,http://www.reddit.com/r/myog/comments/1cif8l/best_material_fabric_to_make_a_bike_frame_bag_or/
1364759076.0,1bdh20,Making a rucksack transit bag?,thekev506,1,0,0,"Hi all!

Does anyone know/have experience with making transit bags for rucksacks?  Very large rucksacks in particular.  I work abroad and have used a [Berghaus Vulcan](http://store.berghaus.com/p/packs/mens-vulcan-rucksack/461218) for the last few years - fantastic rucksack, but I'd like a more permanent solution.  I've seen duct-taping all the seams of the transit bag to really toughen it up as a solution, but that doesn't seem like it would help all that much.

I have dyspraxia

Thanks!",self,t5_2sclk,False,,,True,http://www.reddit.com/r/myog/comments/1bdh20/making_a_rucksack_transit_bag/
1371684097.0,1gov0e,"Trying to locate 1.9 oz Ripstop for hammock DIY running into some issues. Anyone who has gone down this path and can lend some advice, please do",elevatedmovemENT,2,2,http://www.reddit.com/r/myog/comments/1gov0e/trying_to_locate_19_oz_ripstop_for_hammock_diy/, does that work?""

I want to be careful about ordering anything from afar before I order because if its not the right fabric I'm SOL.  

Anyway to get the point across

If they don't have the Denier rating or weight listed

Thanks for any help you can give,False,self,t5_2sclk,False,,,t3_1gov0e
1371413326.0,1ggzjj,Large capacity rucksacs,mynameistaken,2,2,1,"I currently own a GoLite Quest. I am very happy with how it fits me. However

I have two questions:

* Is it feasible to enlarge the pack by making it taller? This sounds simple to me (sew a ring of extra fabric round the top
* Does anyone have any links,False,self,t5_2sclk,False,,,t3_1ggzjj
1367812364.0,1drtzx,DIY $1 wind screen [video],LagT_T,3,3,0,,t5_2sclk,False
1366232821.0,1ck5je,"Thought you guys would like this thread from /r/Archery, PVC Pipe Bows",mgmdude1,2,2,http://www.reddit.com/r/myog/comments/1ck5je/thought_you_guys_would_like_this_thread_from/,default,
1356310491.0,15clyd,A Russian Stove- v. simple,dexcel,2,2,3,,t5_2sclk,False
1355690207.0,14yeuq,Any advice for using tent scraps+tyvek?,OptimumOlive,2,2,0,"I have tent scraps from a 4 man and a 6 man cheap Coleman tent. I was going to make a baker-style tent but

(I have like 7x10 of tyvek left over from making a rain fly)",self,t5_2sclk,False,,,True,http://www.reddit.com/r/myog/comments/14yeuq/any_advice_for_using_tent_scrapstyvek/
1349308543.0,10wlih,Anyone made any snowshoes?,somewhereonariver,2,2,2,"Winter is coming and I am thinking about making some snowshoes. Anyone have any experience or tips to offer? I have a bunch of heavy duty vcp which I was thinking of using for the snowshoe ""platform"",self,
1342278890.0,wjujv,cool light-weight utensil design idea.  ,Oomik,1,1,2,,t5_2sclk,False
1339725973.0,v2qkp,"Looking to make my own rain fly, need help.",isaiditsarcastically,2,2,http://www.reddit.com/r/myog/comments/v2qkp/looking_to_make_my_own_rain_fly_need_help/,self,
1335972003.0,t3das,DIY climbing shoes. Has anyone tried this?,cplegend,2,2,2,"I've recently gotten pretty into bouldering and would like to do this on stops along a backpacking route. However,self,
1325945841.0,o6qu0,Cheap structural. 1/2 in. 10 for $20.00,weedeater64,6,6,1,,t5_2sclk,False
1375069535.0,1j973b,Making Lemonade out of Sumac,Bombolini,3,4,0,,t5_2sclk,False
1335813184.0,t06eq,Footwear,evered,1,2,0,So my plan is to make my own outdoor sandals using this [sole sheet](https://www.lunasandals.com/products/10-sole-sheet) and the instructions on site.  I'll make my own straps with hemp.  Does anyone know where to grab single sole sheets for cheaper or have any advice on what type of material may be better suited for outdoor travels?,t5_2sclk,True
1320284703.0,lyfwk,Fisher Space Pen Refill | Ultralight Hack,sdillon7128,1,2,1,,t5_2sclk,False
1315513667.0,k97pz,House in a box,Life_Cube,2,3,1,,t5_2sclk,False
1359228229.0,17bt5f,"This deserves more attention, It's essentially a MYOG website.",mgmdude1,4,5,http://www.reddit.com/r/myog/comments/17bt5f/this_deserves_more_attention_its_essentially_a/,http://d.thumbs.redditmedia.com/A4W0-A1MlfXEFKRQ.jpg,
