created_utc,id,title,author,ups,downs,num_comments,selftext,subreddit_id,is_self
1322246351.0,mp2tt,Very Easy Fish/Bait Trap,AwwHellsNo,13,3,2,,t5_2sclk,False
1320690167.0,m3r1p,Jungle Radio Signal Booster?,fkndavey,12,4,32,"So, but not being able to radio someone 400 m away is getting to be a problem. Can any of you think of a solution to boosting our signal with some type of antenna/receiver/transmitter? I had seen a radio antenna designed to be shot out of a grenade launcher that looked like something to check into

TLDR: I work in the jungle and need a way to increase radio comms range for my crews. ",self,t5_2sclk,False,,,True,http://www.reddit.com/r/myog/comments/m3r1p/jungle_radio_signal_booster/
1312514035.0,j9hu2,Sewing Machine - suggestions and recomendations? ,zenbyte,9,1,4,"So, but that will change with practive. 

Think is

So - any and all DIYers - which machine,,False,self,t5_2sclk,False,,True
1370115778.0,1fh8zu,10 dollar 10 minute improvised warm weather underquilt.,clever_avatar,15,7,6,"Get one of those cheap fleece sleeping bags from walmart that are always on sale for like 5 - 10 bucks

Unsip the bag completely and/or rip out the zipper. About 6 - 8 inches in from the sides make a small cut parallel to the edge

Tie the rope on one end to each hole

Bam!! ",self,t5_2sclk,1370125207.0,,,True,http://www.reddit.com/r/myog/comments/1fh8zu/10_dollar_10_minute_improvised_warm_weather/
1366143316.0,1chexk,"I just made a light and minimalistic USB flashlight, to be used with a powerbank",estate8143,16,7,http://www.reddit.com/r/myog/comments/1chexk/i_just_made_a_light_and_minimalistic_usb/,http://d.thumbs.redditmedia.com/HCzVVTLdxZt2p6RK.jpg,
1355253702.0,14ogle,"DWR scraps --&gt; reflective, waterproof, insulated beast armor",MountainManakin,11,5,False,
1348186381.0,10800n,Looking for good source for 600-800 fill goosedown and advice  for my first down project,somewhereonariver,10,2,5,"I am about to embark on my first down sleeping bag project and I'm looking for a website or other source for 600-800 fill goosedown for a sleeping bag project. I know thru-hiker.com has 900 fill down,self,
1344926847.0,y6wf7,What kind of material for a stuffable pillow?,JakeRidesAgain,11,2,10,"So I'm looking for projects to do, but I'm not sure what to stuff the inside with. Regular ol' polyfill? I saw one tutorial that recommended Climashield, and what would you do different the next time around?"
1331400572.0,qqfq0,Electricity from frying pan.,timonoko,9,0,8,,t5_2sclk,False
1329334139.0,pr39m,"Xpost from r/backpacking: Please help, I am trying to add an external frame to my existing pack and gear.",neg8ivezero,11,2,http://www.reddit.com/r/myog/comments/pr39m/xpost_from_rbackpacking_please_help_i_am_trying/, strapping my tent, I really like the Kelty day-pack I use and I don't want to replace it. I want to buy a frame for cheap and then attach my kelty bag to it with compression straps and/or pins or whatever so I can take it off once I get to the campsite and wear just the day pack for scouting and water retrieval
1327775009.0,p0oug,"I have an old robe that I don't want anymore, and its lining is %85 polyester and %15 nylon. Is this good material?",spreadittor,8,0,http://www.reddit.com/r/myog/comments/p0oug/i_have_an_old_robe_that_i_dont_want_anymore_and/,self,
1326169169.0,oadi8,I think I have an idea about eating utensils...,neg8ivezero,11,2,10,"OK so I have seen these utensils that have a fork on one end and a spoon on the other and I was thinking

Has anyone else done this? If so

My thought is to cut 1/2 of the handle off of a spoon and fork and then drill a hole in the end of each remaining handle

If you guys have any ideas,,False,self,t5_2sclk,False,,True
1317643196.0,kz9wr,Making a 25lb max load pack,denniswinders,10,3,4,"I want to do a redesign of the pack I was just using on the AT,False,
1312388730.0,j7upj,A question about alcohol burning stoves.,the_nose,8,0,5,"I'm planning to build myself a supercat

A second question. Would I be able to regulate the flame size by changing the size of the holes.  Assume instead of one super cat, the other for a simmer.  Is that possible?

Thanks for the help!",self,t5_2sclk,False,,,True,http://www.reddit.com/r/myog/comments/j7upj/a_question_about_alcohol_burning_stoves/
1369004994.0,1enqln,Adding a waist strap to an external frame pack,crimsonskunk,9,2,8,"I've been browsing craigslist trying to find deals on camping gear

Anyways I just thought I'd ask if anyone has done this before. It's nice to get someone elses input even when doing a simple mod.

Here's pics of the pack
http://imgur.com/a/ijgoJ",self,t5_2sclk,False,,,True,http://www.reddit.com/r/myog/comments/1enqln/adding_a_waist_strap_to_an_external_frame_pack/
1369002857.0,1eno3h,"Help with alcohol stove, please?",Gavinmgraham,11,3,http://www.reddit.com/r/myog/comments/1eno3h/help_with_alcohol_stove_please/,False,
1364331153.0,1b2cv2,Cutting silnylon with a hot knife,notclive,7,0,4,"Has anyone cut silnylon using a hot knife or soldering iron and then left the edges exposed without hemming? Do the edges stay sealed for a long period of time?


**Edit**
I am making a hexamid style shelter. It probably won't get a thru-hike level of use.


**Update**
I've cut my material. I will probably hem the edges anyway as the cuts weren't very straight and the edges weren't very smooth.",self,t5_2sclk,1364421898.0,,,True,http://www.reddit.com/r/myog/comments/1b2cv2/cutting_silnylon_with_a_hot_knife/
1363487496.0,1afzeq,Dying my Nemo tent,ringadingaling,8,1,11,"Hello,False,
1357427279.0,1613h2,Sewn-through temperature limits on quilts,schfitzen,9,4,12,"I am looking to make a summer quilt for my first DIY project.  I'd like to get about 50 degrees out of it

I know that synthetic fill might be an easier option

What is the warmest I can get make a quilt using sewn through construction?  I'm guessing maybe in the low 50's?  I'm shooting for something at/under 8oz.
",self,t5_2sclk,False,,,True,http://www.reddit.com/r/myog/comments/1613h2/sewnthrough_temperature_limits_on_quilts/
1357358507.0,15zo8m,modifying backpack for long torso,zachgaston,9,2,2,"Hi all

I have searched around myog with no luck


Thanks",self,t5_2sclk,False,,,True,http://www.reddit.com/r/myog/comments/15zo8m/modifying_backpack_for_long_torso/
1356984804.0,15qm53,Converting a sleeping bag into a quilt?,,7,0,7,"Hey there,self,
1356152885.0,159niy,Any ideas on a gear storage system for hammock camping?,samwam,8,1,10,"Love hammock camping but need some way to hang my gear preferably along my hammock's ridgeline to keep it dry/off the ground. Any ideas? Also,self,
1351607541.0,12c7fu,Tips on cutting/drilling ferrocerium ('firesteel'),sprashoo,9,1,3,"I bought a cheap firesteel from eBay and it works great

The material (ferrocerium) is similar to aluminum in hardness - it's easy to cut with a hacksaw, which eventually catches on fire and flares up.

The trick seems to be just to keep the cut wet - after that

Anyhow

",self,t5_2sclk,False,,,True,http://www.reddit.com/r/myog/comments/12c7fu/tips_on_cuttingdrilling_ferrocerium_firesteel/
1348241990.0,10932i,Rolled hem with M50 nylon?,i_like_rocks,7,1,2,"Hi all

Any tips for sewing a rolled hem?",self,t5_2sclk,False,,,True,http://www.reddit.com/r/myog/comments/10932i/rolled_hem_with_m50_nylon/
1344529353.0,xy1lc,DIY inflatable mattress - what's the best way to go about this?,daxofdeath,9,2,5,"I have a [Eureka Apex 2](http://store.eurekatent.com/apex-2) that I got for a steal on black friday last year.  I'd like an air mattress so I can more easily entice my partner to join me on camping trips

I'm thinking of an inflatable mattress made from two pieces of fabric put together that can lie in the floor of my tent and be rolled up with it when not in use.  What I'm looking for is what that fabric should be and how best to join them together to create an airtight seal.  To blow it up,,False,self,t5_2sclk,False,,True
1341533011.0,w3pv7,Nylon webbing?,vote100binary,9,1,12,Can anyone provide a source for nylon webbing material? I'd like to make some things out of it and am curious about sources for various sizes/weights... Cheap stuff is ok for my purpose. Online or brick &amp; mortar.,t5_2sclk,True
1331782915.0,qxa6g,DIY Snakeskins. An easy way to store your tarp or hammock (and allow it to dry). (x-post from r/Hammocks),Pinus_rigida,8,3,0,,t5_2sclk,False
1300633118.0,g7lcp,The Pika Stove ,slanket,9,0,0,,t5_2sclk,False
1300461663.0,g6hdi,Berry Picker,thomas533,8,1,3,,t5_2sclk,False
1375380570.0,1jic76,Looking for some Gore-Tex?,Abcdguy,6,0,0,"Hey guys

It is a [4 Piece Military Modular Sleep System](http://www.amazon.com/dp/B002LLPILC/?tag=mkent-20), and the most interesting piece, a [Gore-Tex Bivy](http://www.amazon.com/dp/B00276IGM4/?tag=mkent-20). It's a huge piece of gore-tex that I figured you guys could do all kinds of things with, for a pretty cheap price. It's something like $20 for a (used) 7'x6' piece of Gore-Tex that (I think) could be turned into some cool shit.

Hopefully this helps you guys and post pics",self,t5_2sclk,False,,,True,http://www.reddit.com/r/myog/comments/1jic76/looking_for_some_goretex/
1369193372.0,1et8ye,Moldable HDPE or Polymer plastic for backpack frame.,Jdf121,6,0,8,"I'm looking for types of plastics and sources to make a frame for a backpack. I'm interested in taking a mold of my back and molding a plastic frame to that shape with a heat gun.

Anyone know what types of plastics are strong and easily molded?

EDIT: I was thinking something like [This](http://www.amazon.com/InstaMorph-Moldable-Plastic-34-oz/dp/B005EM9D3O/ref=aag_m_pw_dp?ie=UTF8&amp;m=A2C2L4358Y1E24)",self,t5_2sclk,1369193746.0,,,True,http://www.reddit.com/r/myog/comments/1et8ye/moldable_hdpe_or_polymer_plastic_for_backpack/
1367426246.0,1dhmwp,Hammock Sewing Help,sk8rgui,8,1,10,"I am building this [hammock](http://www.backwoodsdaydreamer.com/diy-guides/hammock/) with 1.1 oz 30d ripstop (double layered).  I have my side hems completed and the two pieces sewn together.  I still need to create the drawstring channel at the top and bottom.  

Upon inspecting I noticed a few areas the material were actually perforated and cut from too tight of a stitching pattern.  This is my first attempt at sewing and I did not realize this could happen.  

I plan to fix it by adding a grosgrain stip folded in half and sewn around each side of the seam (using a large zigzag pattern).  Is this sufficient to fix it? It seems like the double fold hem is mainly to prevent fraying.   

Bonus: the grosgrain will hide some ugly stitching that happened on my first side.",self,t5_2sclk,1367431629.0,,,True,http://www.reddit.com/r/myog/comments/1dhmwp/hammock_sewing_help/
1342230826.0,wj4gl,Merino wool is suitable wool?,LesserKey,7,0,6,"I had been looking at making some of my own hiking clothes and am trying to find some merino wool fabric. The problem is

Does anyone know anything about this?",self,t5_2sclk,False,,,True,http://www.reddit.com/r/myog/comments/wj4gl/merino_wool_is_suitable_wool/
1340999556.0,vt6o5,Tips for vinyl coated polyester fabric,somewhereonariver,6,0,6,I'm about to start making a waterproof backpack using vinyl coated polyester (basically a drybag with straps) and I am looking for any tips. I am planning on using cement to fuse pieces together (I don't know if my sewing machine will go through multiple layers of the 18oz fabric). Thanks!,t5_2sclk,True
1338147686.0,u7mjf,Practice projects for Ripstop?,_31415_,8,2,7,"I'm wanting to get into making more gear with nylon and I finally got access to a working sewing machine

Since I recently tore a hole in the stuff sack for my tent (and possibly a new one for my stakes as well), it's just a bag to hold a tent. Stitch the bottom and side edge together, roll down a lip for the drawstring, boom. Done. I would like to reinforce the bottom with a second piece of ripstop, though, not sure if that would alter anything.    

The second thing I figure could be a sleeping bag liner, to be able to cinch it up? I've never used a liner, so I don't know how practical it'd be, other than the practice of making it.

Eventually, though.    

So,,False,self,t5_2sclk,False,,True
1322620046.0,mu69h,Cheap Bastard's Guide to Alcohol Cook Systems,jspate61,11,4,0,,t5_2sclk,False
1319355674.0,llul5,"MYOG: Barefoot Winter Boots. I'm thinking Vibram soles. Is there a light, waterproof, tear/scuff resistant material out there? Could use some advice from a material expert.  ",arnar622,13,14

Im going to order 2 sheets of Vibram sole, 2 or four in the middle, and 2 at the top edges. I want the strips to be as form fitting to the natural shape of my foot as possible, so I'm going to position and cut all them appropriately. Around the perimeter of the trace Ill cut short rectangles ( wide end on the perimeter), again, to fit the curve of my foot best. These extra strips of sole are going to be where I anchor some sort of material to. 

Winter in Colorado is wet, rocks, whatever. I'd like the inner layer to be something warm....
Can anyone recommend a good materials for this?

If anyone is interested in hearing more
Right now I'm thinking that the best way to secure this to my foot is with parachute chord. Some how laced near the bottom of my toes up to my upper ankles. Water can seep into cracks
I'm going to hand sew everything together with some thick solid thread

Has anyone ever seen or made anything like this? 
Let me know if you have ideas for me,False,self,t5_2sclk,False,,,t3_llul5
1319126113.0,lisxj,MYO Cooking System,WarMace,8,2,2,,t5_2sclk,False
1300489878.0,g6rbi,BlackCat Tarp,thomas533,8,2,0,,t5_2sclk,False
1300484124.0,g6pll,DIY Hammock Underquilt Using a Sleeping Bag,grog_grows_own_tail,6,1,0,"Rather than buying a bunch of materials (that seem to be very hard to find locally) I wondered if you could use a sleeping bag to make an underquilt...  Turns out

[Here is a YouTube video by creativeKayt](http://www.youtube.com/watch?v=OWP7dmvTszk) that walks you through how to make a version.

[Here is an example by Redoleary (HammockForums.net)](http://www.hammockforums.net/forum/showthread.php?t=25730) that has less instructions

[Here is an example that the author says takes 10 minutes](http://gear-report.com/how-to-make-a-diy-camping-hammock-underquilt-from-a-sleeping-bag/) that will probably be my first effort.",self,t5_2sclk,False,,,True,http://www.reddit.com/r/myog/comments/g6pll/diy_hammock_underquilt_using_a_sleeping_bag/
1300462573.0,g6hq3,3-Layer Insultex Hammock Underquilt,thomas533,7,1,0,,t5_2sclk,False
1298879078.0,fu6d3,Night Wing tarptent,thomas533,7,1,0,,t5_2sclk,False
1355874506.0,152ubj,"Looking for geek/scientific info on down, any pointers?",_belikewater,8,4,http://www.reddit.com/r/myog/comments/152ubj/looking_for_geekscientific_info_on_down_any/, but I have more scientific questions:

 * How is the fill related to heat retention? is it linear? ie is a 800 fill bag 33% better at keeping heat than a 600 fill bag?
 * What sort of equation would you expect for # of fill to get a given EN rating? I don't expect it to be y=ax+b

Figured you DIY guys might know some of the answers,False,self,t5_2sclk,False,,,t3_152ubj
1348775672.0,10kvfh,"Can anyone recommend good, strong webbing buckles (i.e. the ones on a backpack waist band)",milesofpain,7,3,http://www.reddit.com/r/myog/comments/10kvfh/can_anyone_recommend_good_strong_webbing_buckles/,False,
1346936088.0,zg3xu,Backpack straps,flagrantaroma,6,2,7,"Hi folks

Looking for a good guide on making backpack straps. I'm trying to be frugal/economical/green and re-use the [old external frame](http://www.reddit.com/r/CampingandHiking/comments/ssbx4/identify_a_old_poorly_configured_backpack/) I found at a yardsale. We hiked the [Fundy](http://www.fundytrailparkway.com/en/the_fundy_footpath/) [Footpath](http://fundyfootpath.info/) with it and did alright, chest) for it, though it'll be my first foray into MYOG.

Any good first-time guides for straps? I came across [this](http://www.backpackinglight.com/cgi-bin/backpackinglight/forums/thread_display.html?forum_thread_id=41835&amp;skip_to_post=355431)

Thanks!",self,t5_2sclk,False,,,True,http://www.reddit.com/r/myog/comments/zg3xu/backpack_straps/
1343069239.0,x11x7,Make my own Tent Vestibule?,ampsmith3,6,0,1,I am looking to make a vestibule for my 7ft by 7ft tent so I have an area to remove wet and dirty stuff before mucking up my tent in poor weather conditions. Could this be done by someone with very minimal sewing expertise with a standard tarp?,t5_2sclk,True
1341899580.0,wbcr7,What is the Purpose of Catenary Edges?,vikingengineer,6,1,4,"I'm looking to make a tarp for my hammock because the one I had was torn by the wind in a recent storm

I've read that the reason for this is that the curve follows the outline of where the tarp would be taught as opposed to slack if the edges were straight,,False,self,t5_2sclk,False,,True
1338563741.0,ufp6y,Can one make their own weather radio? (cross post),,8,3,0,,t5_2sclk,False
1328135904.0,p6s58,"/r/Bushcraft - Wilderness Tips, Tools, Techniques, etc.",survivalcraft,1, so please post

We are ""re-starting"" the community after many months of neglect and inactivity,False,self,t5_2sclk,False,,,t3_p6s58
1327462792.0,ovjao,Wind-proof light source?,red_boogers,5,2,9,"Im looking for ideas on how to make a wind-proof lantern,False,
1325447626.0,nytyy,Best windscreen/pot stand combo?,_31415_,5,1,3,"I'm looking for something that can be packed inside of my pot/mug (.6L) when I'm not using it.    

I can't decide what style I want to make... any ideas from reddit?",self,t5_2sclk,False,,,True,http://www.reddit.com/r/myog/comments/nytyy/best_windscreenpot_stand_combo/
1324872490.0,nqtaj,"Hey MYOG, is it possible to make your own iodine drops?",jcperr03,8,3,http://www.reddit.com/r/myog/comments/nqtaj/hey_myog_is_it_possible_to_make_your_own_iodine/,False,
1323618752.0,n8inh,Any good Sewing 101s out there?,Vollholler,6,1,3,"So my wife gave me the green light to use her sewing machine!  :o)

Next step:

I'm looking for favorite books or websites that teach you the basics of sewing and sewing machine use for the purpose of making your own gear and hiking clothing. I've found a wealth of designs and plans for all kinds of neat items online (bear bags, sleeping bags, etc.), but I know nothing of the basic principles of holding materials together with thread.

Any suggestions?",self,t5_2sclk,False,,,True,http://www.reddit.com/r/myog/comments/n8inh/any_good_sewing_101s_out_there/
1323467727.0,n6qmq,Looking for MYO Fire Starter,dbenkatz,5,0,8,"If anyone has recipes for the ""perfect fire starter""

Chemical fire starters would be of great interest. Obviously thermite, and we have friendly competitions as to who makes a better fire. 

Alternatively,,False,self,t5_2sclk,False,,True
1307371804.0,hsvjn,The Klasslite Stove - Ultralight integrated pot stand and tea-light stove ,thomas533,7,2,0,,t5_2sclk,False
1306948472.0,hp7ay,How To Make a Reusable Paracord Grip For a Bic Lighter,thesurvivalnews,6,3,2,,t5_2sclk,False
1298903165.0,fub3x,Quart Can Wood Stove,thomas533,5,1,0,,t5_2sclk,False
1298879397.0,fu6fj,Bilgy 1 or 2 Person Light Tarp Shelter,thomas533,6,0,1,,t5_2sclk,False
1298879263.0,fu6eh,Instructions for Homemade Backpacking Gear,thomas533,5,0,0,,t5_2sclk,False
1298879122.0,fu6di,Meteor Bivy,thomas533,5,1,0,,t5_2sclk,False
1367696182.0,1doyhv,Help with tarp shelter,PRzitremedy1,5,0,7,"I am currently using a simple 90x76inch silnylon tarp with my hammock set up.  I was wondering if anyone had advice on the best way to go about making a light weight tarp hammock shelter that can also be set up with a trekking pole as a stand alone shelter.  

I'm not concerned about bugs or any extras. just curious if I should stick to a rectangle or if it's beneficial to to go with other shapes (diamond

Thanks!

Edit:  correct dimentions of my current tarp.",self,t5_2sclk,1367879045.0,,,True,http://www.reddit.com/r/myog/comments/1doyhv/help_with_tarp_shelter/
1363665114.0,1akmw5,Sleeping bag alternative for big man?,pseudokapi,6,2,31,"I'm starting here (I'll x/post to other related subs if you suggest). 

I'm a big man

I'd like to know your thoughts on an alternative on going with the standard ""mummy+foampad+tent"". Here's my thought:

1. wear a jacket (that I'd have anyway)
2. slip up to my arm pits in a really cheep sleeping bag (arms out) 
3. home made bivy made of Tyvek that's big enough to cover the sleeping bag and my jacket-arms with room to move around
4. on top of an air-style mattress for extra padding
5. warm headgear (I'd have this anyway)

The MYOG element here is really the [bivy](http://www.backpackinglight.com/cgi-bin/backpackinglight/forums/thread_display.html?forum_thread_id=17099) but the whole ""system"" is sort of a get-by-by piecing it together thing.

Is this foolish? Are there better MYOG alternatives?

Any tips from people who've made bivies before? Do I need a sleeping bag at all if I have warm clothing/long underwear? Maybe just a sleeping bag liner? What can I get away with?",self,t5_2sclk,False,,,True,http://www.reddit.com/r/myog/comments/1akmw5/sleeping_bag_alternative_for_big_man/
1362656875.0,19u9w7,Common man strop&amp;honer,SimonsDiscoveries,10,4,0,,t5_2sclk,False
1362499333.0,19pmnr,Experiences with Cuben fibres and tape?,estate8143,5,0,5,"
I am considering to build a light tarp using Cuben Fibre Sheets. Because of the light and thin material

Do you know any sucessful projects? ",self,t5_2sclk,False,,,True,http://www.reddit.com/r/myog/comments/19pmnr/experiences_with_cuben_fibres_and_tape/
1359562703.0,17keyt,Anyone know what (if anything) you can use to write/draw on silnylon without breaking it down or damaging it? ,Oomik,8,3,11,"I've been thinking about this for a while--I love to draw,self,
1358969802.0,17518d,(Request) How should I go about converting a 80L backpack to a more carry-on friendly size?,kjcraft,5,0,5,"Upon hearing that I plan on doing some travelling later this year

The pack is internal frame, or lugging around 40 pounds of souvenirs I'll be tempted to buy on trains or whatever else.  

I'd like to take it down to a carry-on size without sacrificing the integrity.  The only problem is,False,self,t5_2sclk,False,,,t3_17518d
1351979994.0,12l0cf,"How to charge small batteries/directly power small led flashlight in a post collapse situation, with household items. : PostCollapse",wonutt,4,0,http://www.reddit.com/r/myog/comments/12l0cf/how_to_charge_small_batteriesdirectly_power_small/,default,
1348957136.0,10oomi,Making a backpack out of a dry bag ,ThePurpleCloud,5,1,4,"I have a 10L Drybag that i would love to make into a backpack for Canyoneering
Thanks Guys
",self,t5_2sclk,False,,,True,http://www.reddit.com/r/myog/comments/10oomi/making_a_backpack_out_of_a_dry_bag/
1343876964.0,xjl42,Working with old blue jeans?,bear6_1982,6,3,5,"I'm going to be making some bags and sundry other things out of some old blue jeans I have around the house.  Got any tips?  Presently I don't have access to a machine,False,
1342275946.0,wjsta,Can anyone help me make my cat stove more efficient?,NerdMachine,4,2,6,"I've read that these stoves should be able to boil .5L of water in about 3-4 minutes.  My stove only does it in about 7 in perfect conditions.

Here are a couple pics:

http://imgur.com/PM3mB

It's a pretty crappy stainless steel pot I got at the thrift store.  Each time I used 2 tablespoons of gas-line antifreeze as fuel.",self,t5_2sclk,False,,,True,http://www.reddit.com/r/myog/comments/wjsta/can_anyone_help_me_make_my_cat_stove_more/
1338357312.0,ubq55,"Realistically, would it be difficult to make a Big Agnes UL1 clone?",f-ck,4,0,http://www.reddit.com/r/myog/comments/ubq55/realistically_would_it_be_difficult_to_make_a_big/,self,
1338184661.0,u8clv,Help: where to buy Sil Nylon?,praetordave,5,0,7,"I'm looking into doing the tarp thing.  I've read about Sil Nylon everywhere,,False
1335827043.0,t0k3x,"Free Supplies - Corvallis, Oregon",punkisdread,6,2,http://www.reddit.com/r/myog/comments/t0k3x/free_supplies_corvallis_oregon/,False,
1331315827.0,qp52r,Getting aluminum bottles for stoves?,_31415_,7,3,12,"I really like the aluminum bottle stove design, or a good way to get some of the empties?    

Also,False,self,t5_2sclk,False,,,t3_qp52r
1322379351.0,mqoo7,Help with making my own snowshoes?,rx7dude,6,3,14,"I am thinking about making a pair of snowshoes to cut the amount of money I spend on camping gear. I have a few concerns after looking at pre-made ones:
They should be able to support 280 lbs
They would need good traction.
They would need to be reliable. 
I don't know anything about making snowshoes
Edit: I am not too skilled in woodworking,,False,self,t5_2sclk,True,,True
1314315336.0,jujww,How would one make a water bladder or air mattress?,tuber,6,1,4,"I cam imagine chemical or heat sealing of the plastic membrane,self,
1301532614.0,gf55u,The Jerry Chair - An Ultralight Camp Chair,thomas533,8,4,3,"A sling type chair which uses trekking poles and sit pad

The original posting is [here](http://www.hammockforums.net/forum/showthread.php?t=11672) although you can't access it unless you are a donating member to hammockforums.net so I'll re-post the relevant info.

[Jerry in His Chair](http://www.hammockforums.net/gallery/showimage.php?i=7452&amp;c=newimages&amp;cutoffdate=1)

[View from the back](http://www.hammockforums.net/gallery/showimage.php?i=7453&amp;c=newimages&amp;cutoffdate=1)

[Set up](http://www.hammockforums.net/gallery/showimage.php?i=7447&amp;c=newimages&amp;cutoffdate=1)

[Layed out flat with my sit pad in the pockets](http://www.hammockforums.net/gallery/showimage.php?i=7449&amp;c=newimages&amp;cutoffdate=1)

