created_utc,id,title,author,ups,downs,num_comments,selftext,subreddit_id,is_self
1364177581.0,1ay725,I picked up a sewing machine today on the cheap. I'm looking for input from you master seamsters.,tyger74,16,2,6,"It's a well cared for singer model 477. I'm looking to get into basic packmaking using mainly cordura,self,
1356553061.0,15hcwr,[Ask] Anybody ever make a hammock?  Any suggestions on doing so?,omginternets,16,2,14,,t5_2sclk,True
1343321741.0,x745w,Working with Cuben Fiber,worstwingmanever,15,0,9,Has anyone done any work with cuben fiber?  I have sewn a tarp using sil-nylon and was thinking of trying a larger one with cuben fiber.  I have heard mixed reviews on sewing it. I was looking specifically at .74 oz/sqyd material for the tarp.  Any thoughts on needles or thread?,t5_2sclk,True
1342062113.0,wf76m,Cheap pre-made material for tarps or DYI tents,mlsherrod,17,2,4,"I purchased a [Coleman Sidewall](http://www.walmart.com/ip/Coleman-Sun-Wall-10-x-10-Accessory/19888054?findingMethod=rr)  a couple of years ago


It's water proof,,False,self,t5_2sclk,False,,True
1327540400.0,owwgt,Has anyone tried making a stove similar to the BioLite backpacking stoves?,ThirstyOne,17,1,7,"The stove in question is the BioLite backpacking stove as seen on this website: http://biolitestove.com/BioLite.html

It appears that it's simply a rocket stove with an added fan powered by what looks like some type of thermoelectric generator (see https://en.wikipedia.org/wiki/Thermoelectric_effect )

So,False,self,t5_2sclk,False,,,t3_owwgt
1373378749.0,1hxnwk,Making Barrel Buckets?,LucSkis,15,1,1,"Anyone out there have any experience/plans for making Barrel buckets or a barrel cooler?
I have always had a hard time with the craziness inside of my food barrel and I would like to build a couple of barrel buckets and a barrel cooler like the ones made by Ostrom Outdoors in Thunder Bay. [Like these ones](http://ostromoutdoors.com/paddle-sports-barrel-harnesses-c-22_28.html).

I have built a bunch of gear,False,self,t5_2sclk,False,,,t3_1hxnwk
1371178975.0,1gbc89,What to do with extra ripstop nylon,PRzitremedy1,15,2,16,I have about 2.5 yards of 1.6 oz Ripstop Nylon left over.  It's uncoated.  I'm looking for ideas on how to use it and figured you guys would have ideas!  What you think?,t5_2sclk,True
1370121806.0,1fhfg3,How do you sew a pouch that keeps its shape?,asoka101,13,2,6,"I'm thinking of sewing some molle style pouches to add to the sides of my bag or belt,False,
1369946772.0,1fczcx,Need to haul more gear than my Aether 70 can handle,KissMyCockImAVirgin,16,3,33,"I have an older version of the  Osprey Aether 70,False,
1363708727.0,1aljym,Where can I get a hole puncher sturdy enough for making the super cat stove?,ttagggttaggg,16,4,16,The one I have at home just isn't cutting it,t5_2sclk,True
1361329557.0,18v27u,"Sugru: given all the hubbub, I thought it bears asking -- have any of you found any exciting backcountry uses for sugru/oogoo?",MountainManakin,16,3,http://www.reddit.com/r/myog/comments/18v27u/sugru_given_all_the_hubbub_i_thought_it_bears/,self,
1360806255.0,18hgyp,DIY Pellet Gun Darts (Directed here from r/Bushcraft),GuruBushHippie,20,5,6,"A few weeks back my buddy and I were screwing around with our old pellet guns. He showed me a ""dart"" he made for it. he was using half of a q-tip attached to a small nail via electrical tape. It worked well

We decided to instead use the hollow plastic q-tips. We cut them in half. Using needle nose pliers we shoved 17 gauge wire brads into the hollow ends. They're the little nails with the ""round"" head on them rather than a ""flat"" head for those who don't know. That's all it takes!

Lick the cotton end of the q-tip to create breach pressure and stick it in the end of the barrel

For added fun

DISCLAIMER: I do not recommend you use a nice pellet gun for this

Pics: http://imgur.com/a/kVAwC",self,t5_2sclk,False,,,True,http://www.reddit.com/r/myog/comments/18hgyp/diy_pellet_gun_darts_directed_here_from_rbushcraft/
1355591046.0,14weew,Campers: I'm coming into a whole lot of Tyvek. I'll need to get rid of some. Anyone interested?,,20,8,2,"Going to pick up a partial 10 foot roll today. Let's talk prices. I live in Eastern Iowa and I obviously don't want to pay for shipping.

EDIT: Sale's closed,False,self,t5_2sclk,1355676164.0,,,t3_14weew
1354266036.0,141msl,Beginning a down quilt project tomorrow. Any advice? Details within.,MountainManakin,15,1,10,"Hi all

Encouraged by the success of my Shires tarptent-for-two project this summer, and 12oz goosedown. Everything seems like it's in good working condition.

The planned pattern (to be tested on cheap fabric in the AM) is similar to [Mike in FHAZ's quilt](http://www.teamgunnparker.com/software/pdf/35_Down_Quilt.pdf) with modified dimensions and shape:

* 40"" at feet

* 50"" at waist

* 50"" at shoulders

* 48"" feet to waist

* 30"" waist to shoulders

**My questions for you

* Any advice on sizing?

* Any advice on sewing in the baffles / working with the down?

* Footbox / no footbox? (pattern can still be changed)

* Velcro or zipper to knee portion?

* General advice?

Thank you to Thru-Hiker (+Jeremy Padgett) for the kit and guidance,,False,self,t5_2sclk,False,,True
1349724178.0,115hm5,How can I add an interior pocket to my new rain jacket?,womb-gobbler,14,1,9,"I just bought a [Patagonia](http://www.patagonia.com/us/product/mens-torrentshell-waterproof-rain-jacket?p=83800-0-791) rain jacket and it only has one interior pocket. I would like to add a second one (hopefully without having to sew anything). Any tips?

Perhaps this is the wrong subreddit,False,self,t5_2sclk,False,,,t3_115hm5
1338312445.0,ualoa,Your best penny stove from experience.,Crysilus,17,3,28,"I'm currently looking into building a penny stove and have found these two websites very helpful [ [1] ](http://zenstoves.net/Stoves.htm) and [ [2] ](http://www.jureystudio.com/pennystove/penny2.html).

I like the side burning models on the zen site since they don't need a pot stand

What are your experiences with alcohol stoves,,False,self,t5_2sclk,1338338463.0,,True
1323875323.0,ncfh3,Prototype $10.00 Hammock Hex Tarp,jspate61,13,0,6,,t5_2sclk,False
1322686383.0,mv5ye,Cheap Bastard's DIY Silnylon,jspate61,15,3,3,,t5_2sclk,False
1300632493.0,g7l6s,Instructable's Instant Hammock,slanket,17,4,1,,t5_2sclk,False
1300462084.0,g6hii,Multi-Function Walking Stick - Converts to a Chair,thomas533,14,0,0,,t5_2sclk,False
1373554666.0,1i2zxf,How does a clothworking newb make the biggest impact on his base weight?,,12,0,22,"Just started backpacking with some old gear my parents bought for me in my youth (gear is about 15 years old).  Problem is my big 3 weigh in at about 16lbs putting my base weight somewhere around 35lbs add food and I'm trekking in there with 50lbs on my back (but at least I can get out there).  So what are your best tips on MYOG for lightening pack weight on the uber-cheap.

Edit: My [gear list](http://www.geargrams.com/list?id=14351) after some preemptive lightening (no extra clothing and so forth) ",self,t5_2sclk,1373595911.0,,,True,http://www.reddit.com/r/myog/comments/1i2zxf/how_does_a_clothworking_newb_make_the_biggest/
1369632714.0,1f4fuv,Best insulator for an under-quilt in very cold climates.,zstrick741,13,2,14,"I am hoping to build a four season hammock sleep system for camping. The area I will be camping in is known to get to -40 F and as such I need to have a very warm under-quilt. I am trying to figure out what will have the best insulating qualities. Should I use down or a layered Insultex quilt. What are my options?

**Edit:** I am using this to compliment my other cold weather gear. I just need to know what will give me the best results.",self,t5_2sclk,1369635781.0,,,True,http://www.reddit.com/r/myog/comments/1f4fuv/best_insulator_for_an_underquilt_in_very_cold/
1369047400.0,1eoqym,Made a very light knive from an old blade and fiberglass and resin.,estate8143,23,9,7,,t5_2sclk,False
1368244578.0,1e41oq,"I'm Gonna Make My Own Tarp Tent! However, I May Need Some Help...",GuitarMaster5001,17,5,http://www.reddit.com/r/myog/comments/1e41oq/im_gonna_make_my_own_tarp_tent_however_i_may_need/

Today I went to Walmart and picked up some silnylon (or a very similar material) to use for camping gear. I have decided that it would be best put toward making a tarp tent. However, but a bathtub floor as well and plenty of space to move around in (as opposed to my current bivy). If anyone could provide me with some help, I would be eternally grateful and exercise the patience of a valley-cutting river (wow, that was a terrible analogy).

Thanks

GuitarMaster5001",self,t5_2sclk,False,,,True,http://www.reddit.com/r/myog/comments/1e41oq/im_gonna_make_my_own_tarp_tent_however_i_may_need/
1367705726.0,1dp8kx,Made A Hammock,sk8rgui,15,3,11,"I made a double layer 1.1oz 30d ripstop hammock based off the plans at 
DIY Gear Supply.  

[Here are some images of my test hang]( http://imgur.com/a/9hSgZ).  Still need to rig up some tie outs and a ridgeline.  I am going to have to fuss with it  a bit as my hang was not comfortable. I felt like a hotdog in a bun with pressure points in the shoulders and knees.",self,t5_2sclk,1367724672.0,,,True,http://www.reddit.com/r/myog/comments/1dp8kx/made_a_hammock/
1359070483.0,177yyo,"DIY Prototypes: Camp Stoves, Hammocks, Trailers, Canoes",jspate61,1,,False
1352780213.0,133tbp,What would you make with 30 yards of Cuben Fiber?,cwcoleman,15,2,17,"I just got 18 meters of 08 strength (the clear you see in most tarps/sacks) and 9 meters of 18 (a stronger version used for more durable applications) cuben fiber fabric. 52 inches wide.  
  
A tarp is definitely on my list. I saw somewhere plans for a backpack using just 1 yard of fabric - that sounds incredibly efficient. A stuff sack would be nice,False,self,t5_2sclk,False,,,t3_133tbp
1332364486.0,r7bzf,saw wire ideas?,evered,14,2,6,Does anyone have any ideas as to what kind of wire could be used to create a wire saw?  I would use key-chain rings for the ends.,t5_2sclk,True
1331479210.0,qrk43,To those of you making quilts: here is an easier way to cut out baffles.,Pinus_rigida,14,2,0,,t5_2sclk,False
1327462027.0,ovimx,Questions about making a backpack...,the_mental_ninja,15,4,9,"I'm making my first backpack for a 2 month expedition this summer, maybe water resistant

Also, weight bearing stitching?

Thanks!",self,t5_2sclk,False,,,True,http://www.reddit.com/r/myog/comments/ovimx/questions_about_making_a_backpack/
1324483928.0,nlcyb,DIY Hammock Camping Gear,jspate61,16,2,4,,t5_2sclk,False
1312213857.0,j5rly,What's the best source of materials?,C8H9NO2,12,1,7,"I'm interested in making my own DIY hammock (specifically the [Risk Test Hammock](http://www.imrisk.com/testhammock/testhammock.htm)) but don't know where to begin to look for materials.

What are your favorite brick and mortar and online resources?",self,t5_2sclk,False,,,True,http://www.reddit.com/r/myog/comments/j5rly/whats_the_best_source_of_materials/
1311173154.0,iuuq7,Uber light weight Spinnaker tarp - 8 guy points - 164g,ZEbbEDY,14,1,5,,t5_2sclk,False
1361005901.0,18mqmd,Three Mods For Your Mug,occupint,13,2,0,,t5_2sclk,False
1358400969.0,16qjfy,"What to do with small, lightweight neodymium magnet washers?",MountainManakin,15,5,http://www.reddit.com/r/myog/comments/16qjfy/what_to_do_with_small_lightweight_neodymium/,,False
1357997439.0,16fp52,1.1 oz Ripstop,worstwingmanever,13,3,18,I am looking to buy some 1.1 oz uncoated ripstop nylon for a couple of hammocks.  Does anyone know a cheap source?  So far the cheapest I have found is [here](http://www.rockywoods.com/Fabrics-Kits/All-Ripstop-Nylon-Fabrics/30-Denier-Pure-Finish-Ripstop-Nylon-Fabric-Coyote-Brown) for $5/yd.  Anyone have a cheaper source?,t5_2sclk,True
1357921471.0,16dvdx,"Ursack type food bag DIY. Looking in to this, has anyone tried it? ",Oomik,11,0,http://www.reddit.com/r/myog/comments/16dvdx/ursack_type_food_bag_diy_looking_in_to_this_has/,http://b.thumbs.redditmedia.com/mXE0eKr2jA2U45Rs.jpg,
1356213640.0,15aqbd,Want to add more down to a store-bought jacket. Tips?,_belikewater,12,3,5," 1. Where can I buy down? Don't need anything super high quality
 2. How would I go about doing this? I have a friend who can sew, then patch it?

Thanks! Love the resources of this community.",self,t5_2sclk,False,,,True,http://www.reddit.com/r/myog/comments/15aqbd/want_to_add_more_down_to_a_storebought_jacket_tips/
1349624815.0,1139kv,Ideas for survival rope belt buckle,lord-steezus,14,3,11,"I saw this
http://www.tacticalintelligence.net/blog/slatts-rescue-belt-part-2.htm
And i was wondering if you guys have any other ideas.
I also have this kind of belt buckle ready to be used.
http://thumbs3.ebaystatic.com/d/l225/m/mVjHi7I7TBHJBWvcGdB-v2g.jpg",self,t5_2sclk,False,,,True,http://www.reddit.com/r/myog/comments/1139kv/ideas_for_survival_rope_belt_buckle/
1337616236.0,txni7,Gear for kids to make?,the1grimace,13,3,11,"I am looking for some hiking themed projects to do with a daycare over the summer. I will be working with kids ages 6-12 of varying abilities. So far the only myog stuff I have planned is hobo stoves and pvc tents,self,
1327556465.0,ox8rk,What can you make with broken fishing rods?,spreadittor,12,2,15,"Don't say make fishing rods,self,
1326128768.0,o9gvw,My Twig Stove,neg8ivezero,16,5,5,"I know there are TONS of designs for wood stoves but this is one I pieced together myself after watching hundreds of youtube videos on various techniques. It works very well

+ Tin snips OR Dremmel with Cutting Bit OR Drill with UNIbit OR Pointy metal object with a hammer and LOTS of patience

+ 1 Quart Paint Can

+ 1 Progresso Soup Can

+ 3 Screws (to be used as pot stand

Here are a couple photos I took of it

[Photo #1](http://imgur.com/evtK2)

[Photo #2](http://imgur.com/wL0v9)

If an instructable is needed,False,self,t5_2sclk,False,,,t3_o9gvw
1321168304.0,majn9,Easy DIY Upgrade To The Fosters Cook Pot,thomas533,15,3,0,,t5_2sclk,False
1311032386.0,itaiw,cheap shower out of your hydration bladder.,Danimaltanimal,12,1,5,Take the top off a 2 liter of soda and drill about 4 small holes in it. Put it on your platypus/camel back and turn upside down and hang it with some paracord from a tree or branch. you can hold your finger over the holes while washing your hair with the other hand to save water until you need to wash off.,t5_2sclk,True
1371011104.0,1g6c0y,Help with making a rain fly.,iamjaykeys,11,1,1,"Original post [here](http://www.reddit.com/r/Hammocks/comments/1g5dmc/help_with_making_a_rain_fly/)

So I salvaged two interior dividers from a large tent the other day. Each is a trapezoid and has plastic tie in things on each corner. If I attach each down its long/base edge

My question to you is, it'd would be tough to pull off. Thanks!",,False,self,t5_2sclk,False,,
1370962644.0,1g4h2l,question about types fabrics / materials?,sploiz,11,1,18,"not sure if this is the right place for this question but it seems to fit. it is about making my own gear.

so far i have only been working with lightweight ripstop nylon and want to branch out into some heavier material. i made a backpack out of the nylon

so i'm wondering if someone could give me a rundown on the different types of materials or weights? or a good link to a site that describes them?

thanks y'all.",self,t5_2sclk,False,,,True,http://www.reddit.com/r/myog/comments/1g4h2l/question_about_types_fabrics_materials/
1370898855.0,1g2lfs,Anyone use paracord on the handle of their trekking pole?,CaptainBellamy,17,6,3,"I've noticed that some people replace the handle on their trekking poles with paracard. Has anybody here tried it? I like the idea of carrying extra rope around,self,
1370306587.0,1fmbi8,Colin Fletcher's Visklamps...any help?,gaussian45,10,0,14,"I've just finished reading Colin Fletcher's ""Complete Walker III"", designed to work with a ball in such a way that you punch the ball in a corner of the film

I've had a hell of a time trying to find these ""Visklamps"", but the visklamp idea sounded quick and easy. Thanks in advance!",,False,self,t5_2sclk,False,,
1365389193.0,1bw61c,Troubleshooting Cat Food Alcohol Stove - Flames Up Pot Sides,birdsbirdsbirdsbirds,12,1,23,"Hey guys

I just made my first two cat food can alcohol stoves (AKA Fancy Feast stoves). I used the first two templates from the [Supercat Stove Page](http://www.supercatstove.com/docs/SuperCat_HolePunchTemplates.pdf) to punch the holes (one template for each stove). I used the Disney Aristocat's brand cat food

I've used two different pots with similar results. The first is an Open Country 2qt aluminum pot with lid. The other is a MSR Titan Tea Kettle with lid. Ostensibly the flames-up-sides problem is worse with the Titan kettle. Both pots are filled with 2 cups cold water and stoves have just over 1oz fuel.

My problem is that the flames from the stove tend to reach up the sides of whatever pot I'm using. My burn times are pretty similar between stoves: 9min for the one with fewer holes

*My guess would be the fuel isn't getting enough oxygen.* The stove with more holes burns longer and tends to have a more contained jet of flame - which makes me think fewer holes isn't getting enough air. Because most people using pots of both sizes (2L and 850ml) without this problem

**TLDR**; Cat Food stove has marginal performance and flames frequently lick up sides of pot regardless of pot size. My guess is air flow problem. Halp plz!

Edit: I realize this could also be a non-issue

Double Edit: [Just took pictures of the process](http://imgur.com/a/GZ71o),False,self,t5_2sclk,1365398807.0,,,t3_1bw61c
1365354431.0,1buzbm,Ideas for a possible birthday present?,,10,0,19,"My husband's birthday is coming up next month and we are both big into anything outdoors. I was hoping this year I could make him something we could use for our various adventures. Would anyone care to brainstorm with me and help me come up with some ideas? Obviously nothing too outrageous since I only have a month,self,
1362154459.0,19gv1i,Any way to glue sil-nylon?,worstwingmanever,12,2,6,"I have a Sea to Summit Ultra-Sil dry sack that I use for my clothes during the day and my pillow at night.  My only problem with this is that the sil-nylon is slippery and not that comfortable against the skin.  I want to attach a small piece of micro fleece to make it a little more plush,self,
1360566678.0,18aq11,AskMYOGGIT: m90 fabric shrinking when sewing in insulation -- how serious of an issue will this be?,MountainManakin,12,3,3,"Hey MYOGGERs, is this going to be a major issue in fitting the pieces together or will they all pucker together equally? Thanks in advance.",t5_2sclk
1356021651.0,1569e8,I am interested in adding pockets the hipbelt of my backpack. Does anyone have any suggestions on how to get started?,ttagggttaggg,10,2,7,,t5_2sclk,True
1353480799.0,13k084,Suggestions on how to reuse old tent body and rain fly needed.,skate_lin,13,2,7,"Sadly a bull elk destroyed my tent this summer. I am hoping to make something out of the material. All ideas appreciated. 

picture of destroyed tent for reference:
http://i.imgur.com/h5g1y.jpg ",self,t5_2sclk,False,,,True,http://www.reddit.com/r/myog/comments/13k084/suggestions_on_how_to_reuse_old_tent_body_and/
1352256435.0,12rp91,Made a leather knife sheath. ,newrykillz,14,6,3,"http://imgur.com/a/MxH73#0

I have a nice late 80`s Buck 639v survival knife. After contacting BUCK and looking on ebay for a week i decided i would have to make my own sheath. 

Got the leather from a old leather coat that i picked up for 3 bucks from a thrift store. I choose it over 3 dollar leather boots because it was thinner. 

Cut the leather out with a knife and used a 10 dollar cheap-o rivet type squeeze gun to attach the circular rivets. Inserted a couple of rectangular pieces of craft knitting plastic for stiffness between the layers of leather. The backing is actually 2 pieces of leather with the strap piece and plastic in the middle. Same goes for the top cover over the blade. 

Sewn up with nylon saddle thread from the thrift store and coated with gorilla glue without adding water to the glue. Made a nice thick hard coat on the sheath and secured the nylon from being pulled off or fraying. 

I secure the strap with velcro. I have another piece of leather with huge snaps on it to add in the future as a 2nd strap for extra protection. 

The leather was really hard to sew. I used a finish nail at first to make the thread holes but eventually ended up getting a big ass needle and just forcing it thru. After stabbing my finger with the needle repeatedly i made a popsickle stick / gorilla glue thimble. =-)

",self,t5_2sclk,False,,,True,http://www.reddit.com/r/myog/comments/12rp91/made_a_leather_knife_sheath/
1330628874.0,qd9wa,Steel cans. Safe for cooking pots?,Spread_Liberally,10,1,16,"So

Though I've been using homemade alcohol stoves for a while

It looks like I missed the boat on the Heineken keg cans (I read they're no longer imported to the US).   I do have a few small coffee cans on hand though...  [This kind](http://i.imgur.com/AwcMD.jpg)

The can appears to be steel

Is it safe to use for boiling water?  Or will I leach nasty stuff out of the metal or seams?  I don't think it's galvanized.

Are there other cans in the size range (16-24 oz) that I should be using instead?

**Edit:**  Joy of joys,,False,self,t5_2sclk,True,,True
1325185781.0,nv7rx,MYOG pack plans,,14,6,2,"Looking for resources for making my first pack

To start:

* G4 - http://www.backpacking.net/makegear/gvp-pack/index.html
* Jan Rezac's Ultralight Waterproof Pack - http://gear.rezacovi.cz/backpack_mk3/instructions.html",self,t5_2sclk,True,,,True,http://www.reddit.com/r/myog/comments/nv7rx/myog_pack_plans/
1317962593.0,l3tow,Pack cover?,weirdwun,10,0,6,"I'm probably herping the derp pretty hard right now,self,
1300464421.0,g6if0,Original Tarptent &amp; Tarptent-for-2,thomas533,11,1,0,,t5_2sclk,False
1366081071.0,1cfqju,Converting a sleeping bag for a hammock. Any tips ?,HickSmith,9,2,5,"Prowling around an Army surplus store
I'm in the process of repairing the tears before cutting into them. I'm thinking I need a draw-string

",self,t5_2sclk,False,,,True,http://www.reddit.com/r/myog/comments/1cfqju/converting_a_sleeping_bag_for_a_hammock_any_tips/
1357181547.0,15v55z,anyone have any experience making moon boots? down booties for in-camp.,MountainManakin,12,3,3,seeking advice as I embark on my next MYOG journey. Thanks in advance MYOGGIT.,t5_2sclk,True
1356995251.0,15qwfq,"Not sure if this is the right place to ask, but I have a question about painting an ammo can.",SilentBounty,10,1,http://www.reddit.com/r/myog/comments/15qwfq/not_sure_if_this_is_the_right_place_to_ask_but_i/,,False
1356812992.0,15mzit,Anyone ever made a internal frame backpack?,OptimumOlive,12,4,5,Is it hard/impossible? What materials did you use/ How much did it cost? How long did it take you?,t5_2sclk,True
1356405467.0,15ekn1,Penny stove fuel question,Dumbspirospero,13,5,17,"I'm making a penny stove

Edit: Thanks a ton guys,False,self,t5_2sclk,1356412676.0,,,t3_15ekn1
1354671441.0,14aogr,Great Video on a MYOG Cuben Fiber Tarp using Tape.,worstwingmanever,15,5,4,,t5_2sclk,False
1348764187.0,10kizb,Anyone else find a priming pan to be vastly more effective for starting a penny stove?,sprashoo,10,0,9,"I know that the design of the JureyStudio penny stove is supposed to allow for pan-free priming

I use a steel can lid I hammered into a convex shape with the lip retained

Trying to prime in the recommended way, and I frequently see it all burn off without the stove getting started...

One issue is that the burner ring on my stove is more or less flush with the top of the bottom can, it sounds like a lot of fuel is required for priming (he suggests filling the top of the burner ring, which is a lot more than just a few drops).

What gives?",self,t5_2sclk,False,,,True,http://www.reddit.com/r/myog/comments/10kizb/anyone_else_find_a_priming_pan_to_be_vastly_more/
1348688854.0,10iu9z,Understanding Nylon Fabrics,worstwingmanever,10,2,16,"The more I research fabrics
Here is what I know right now (or at least think I know):

*1.10 oz/syd ripstop nylon (30D): breathable

*1.40 oz/syd ripstop nylon (40D): breathable

*1.90 oz/syd ripstop nylon (70D): breathable

*1.35 oz/syd silnylon = 1.1 oz/syd impregnated with silicone: not breathable

*2.30 oz/syd silnylon = 1.9 oz/syd impregnated with silicone: not breathable

*2.80 oz/syd coated = 1.9 oz/syd coated with Urethane: not breathable

I also see fabrics that are 20D, M50, M90, etc. fit into these categories?  What about Pertex?

Any experts out there?

",self,t5_2sclk,1348689034.0,,,True,http://www.reddit.com/r/myog/comments/10iu9z/understanding_nylon_fabrics/
1347922214.0,101pww,"What to make out of extra Amsteel Blue 1/16""",thetate,12,3,8,"So I mistakenly bought some 1/16"" Amsteel blue for some whoopie slings but needed at least 7/64"". Any ideas what to use my extra 30' of blue on?",t5_2sclk,True
1343503598.0,xb4tf,Is Tyvek a suitable material to use for making a tarp?,nekregttam2,9,1,10,"I want to make a tarp to use while hammock camping and have considered using Tyvek because of its versatility and cheap price. However,False,
1338424928.0,ud0zs,Easy waterproof material,twolovebuckets,9,0,8,"Basically,,False
1337271197.0,trtcr,Make a simple hobo stove from a metal coffee can,elasto,9,0,7,,t5_2sclk,False
1331524593.0,qsfuh,Could I have a little help with some pack mods??,savethebees,11,2,7,"I have [this](http://www.blackdiamondequipment.com/en-eur/shop/ski/snow-packs/covert-pack) backpack
My concern is this. The front face of the pack is made of a layer of nylon
So how worth it is this pack mod?
Thanks for reading!",self,t5_2sclk,False,,,True,http://www.reddit.com/r/myog/comments/qsfuh/could_i_have_a_little_help_with_some_pack_mods/
