created_utc,id,title,author,ups,downs,num_comments,selftext,subreddit_id,is_self
1369774124.0,1f8153,"Nine Inch Nails New Album Finished, Out This Year",unkn0wn1,433,34,http://www.reddit.com/r/nin/comments/1f8153/nine_inch_nails_new_album_finished_out_this_year/,http://c.thumbs.redditmedia.com/oU6-tZq0jNHNHus8.jpg,
1361804921.0,197050,"MAJOR NEWS: NIN to tour again Summer 2013, new lineup",astroot,383,33,http://www.reddit.com/r/nin/comments/197050/major_news_nin_to_tour_again_summer_2013_new/,http://c.thumbs.redditmedia.com/oU6-tZq0jNHNHus8.jpg,
1370490241.0,1frp8j,Listen to the new NiN single Came Back Haunted!,ztefal,270,28,172,,t5_2qhwq,False
1372428806.0,1h8yhx,Nine Inch Nails - Came Back Haunted,decoyoct,253,30,161,,t5_2qhwq,False
1370370838.0,1fo13m,"Nine Inch Nails will release a new single, ""Came Back Haunted,"" this Thursday June 6 at 11:30 a.m. PT",TreasurerAlex,230,36,False,
1367271380.0,1dd69t,HTDA +1,verthex,214,19,7,,t5_2qhwq,False
1345436453.0,yia1h,"Fuck me, right?",plahplahplah,230,35,http://www.reddit.com/r/nin/comments/yia1h/fuck_me_right/,http://c.thumbs.redditmedia.com/EcvMVr08nPL0gn1D.jpg,
1375714613.0,1jqqof,Trent Reznor and family at Disneyland,alpheli0n,221,32,38,,t5_2qhwq,False
1374855071.0,1j3r76,"NEW Nine Inch Nails: ""Find My Way"" [Live pro-shot at Fuji Rock 2013] [720p]",Scraptalicious,183,8,43,,t5_2qhwq,False
1371663261.0,1go1ik,"David Lynch to Direct Video for ""Came Back Haunted""",totallywhatever,181,15,35,,t5_2qhwq,False
1339870046.0,v59g5,"""'Fight Club' was mostly written with [The Downward Spiral] playing on repeat in the background."" - Chuck Palahniuk",polarbear_15,178,13,10,,t5_2qhwq,False
1323378381.0,n5bfh,"Trent Reznor: 'I'll spend a good portion of 2012 
writing for Nine Inch Nails'",3,43,http://www.reddit.com/r/nin/comments/n5bfh/trent_reznor_ill_spend_a_good_portion_of_2012/,,,False,t5_2qhwq,False
1360067934.0,17xh7s,"Grohl, Homme, Reznor - Making of Mantra (Soundcity Movie)",alentejano,167,30,False,
1364190989.0,1aykgt,nine inch nails : [ after all is said and done ] is officially released and available for download NOW. ,rubthebudha,169,14,19,,t5_2qhwq,False
1376271885.0,1k6gbn,Copy of A - Studio version.,Degrelle,154,12,94,,t5_2qhwq,False
1331428914.0,qqyp7,Good Guy Trent Reznor,oasis689,157,17,18,,t5_2qhwq,False
1368806718.0,1eivhx,@trent_reznor: It just didn't feel like @NineInchNails without Robin Finck. Now it does.,dimwell,152,9,44,,t5_2qhwq,False
1350413080.0,11l09h,Trent and Dre in the studio during the Fragile era,liveindreams,156,15,16,,t5_2qhwq,False
1345859025.0,ysbrt,"I had a NIN quilt (yes, quilt) made out of an alternate cover to THE FRAGILE...also, my dog loves it.",AgentDanaScully,143,32,False,
1331227749.0,qnjjj,Today marks the 18th anniversary of the release of The Downward Spiral.,norunningwater,148,10,46,,t5_2qhwq,False
1341780863.0,w8hpb,"So, guess what the National Museum of American History decided to use an an example of late 80's music technology? Needless to say, I was giddy.",,144,13,False,
1367984473.0,1dwszo,Is this picture real?,bbbbaconstrips,148,18,26,,t5_2qhwq,False
1376344937.0,1k8ib2,My girlfriends first thought when she saw this photo...,KarmicCorpse,158,34,11,,t5_2qhwq,False
1333032653.0,rja9w,"Trent Reznor to Receive American Society of Composers, Authors and Publishers (ASCAP) Golden Note Award April 18",plopous,122,3,http://www.reddit.com/r/nin/comments/rja9w/trent_reznor_to_receive_american_society_of/,http://d.thumbs.redditmedia.com/Z1ETamqYk-cmljy9.jpg,
1349724213.0,115hn9,How To Destroy Angels - Keep it together,f33rNapalm,135,12,40,,t5_2qhwq,False
1353068422.0,13an6e,Story of my freaking life!,,132,12,12,,t5_2qhwq,False
1352571634.0,12z00z,Trent Reznor'z Black Ops II Theme leaked,jrdsctt,124,8,28,,t5_2qhwq,False
1376840325.0,1klxb4,Trent is confused,joymode,133,16,16,,t5_2qhwq,False
1376198976.0,1k4q26,"I yelled, I cried. I can barely walk and my voice is gone. But here's the setlist from tonight. What a show.",nin3414,134,16,http://www.reddit.com/r/nin/comments/1k4q26/i_yelled_i_cried_i_can_barely_walk_and_my_voice/,http://b.thumbs.redditmedia.com/l7qIwqW9zpmP6GXg.jpg,
1376701958.0,1kiwoa,It's happening,teleekom,127,11,15,,t5_2qhwq,False
1332953321.0,rhr35,Nine Inch Nails on a 90s Dance TV show.  Seriously. ,Tgg161,117,3,35,,t5_2qhwq,False
1359646450.0,17ms8i,It's here! HTDA's new video clip for How Long.,ich_liebe_berlin,118,7,37,,t5_2qhwq,False
1373470443.0,1i0gnc,David Bowie - I'm Afraid of Americans -- I would not want to be followed by Trent like that.,stat1stick,120,11,14,,t5_2qhwq,False
1352321211.0,12tf6k,"""Yeah, there will be new music. There are some things in the works."" Trent Reznor: Nine Inch Nails Working on New Music, Possible Tour ",plopous,123,23,False,
1330868776.0,qh57q,"I love Homebrewing and NIN, so this decision was eventually coming",,118,8,http://www.reddit.com/r/nin/comments/qh57q/i_love_homebrewing_and_nin_so_this_decision_was/,http://c.thumbs.redditmedia.com/rnjwUQPg3gSdJ352.jpg,
1375995064.0,1jzc0c,Unused logo art created by Russell Mills for The Downward Spiral,meatspun,116,6,9,,t5_2qhwq,False
1376429184.0,1kb0fl,Snapped this shot of Trent this past Saturday. Hope you like it!,jonSF,114,11,11,,t5_2qhwq,False
1352827609.0,134phe,Trent Reznor will be doing an AMA at 11am PST today.,dimwell,115,11,16,,t5_2qhwq,False
1339770633.0,v3gkm,"Pretty Eight Machine, an amazingly awesome 8-bit take on PHM",BradGroux,115,10,http://www.reddit.com/r/nin/comments/v3gkm/pretty_eight_machine_an_amazingly_awesome_8bit/,http://a.thumbs.redditmedia.com/bwNCuW3HoVR_0qrT.jpg,
1338595490.0,ugg3z,when i hear someone play nine inch nails in their car or house without me asking,sixxsixxone,125,17,5,,t5_2qhwq,False
1361895719.0,199jud,"I've listened to Reznor's lyrics since I was 7, got me through my parents murder, loss of the rest of my family, all b4 the age of 25. These tats are my way of remembering the good, and understanding the bad.",129,,t5_2qhwq
1323995876.0,neial,Dave Grohl on Trent Reznor: 'He's My Generation's Most Talented Musician-Producer-Songwriter',jrdsctt,111,6,16,,t5_2qhwq,False
1374760089.0,1j0ywv,"Nine Inch Nails Is Back Onstage, With a Vengeance",foxglove23,114,11,http://www.reddit.com/r/nin/comments/1j0ywv/nine_inch_nails_is_back_onstage_with_a_vengeance/,default,
1370483814.0,1frhdq,"New NIN album title and release date (possibly)! ""Hesitation Marks""",Sarronix,111,5,22,,t5_2qhwq,False
1370494296.0,1frthz,Came Back Haunted,Jrod17,107,9,21,,t5_2qhwq,False
1361286992.0,18tjvw,"Listen to ALL of Welcome Oblivion, at Pitchfork",nooneimportan7,114,10,http://www.reddit.com/r/nin/comments/18tjvw/listen_to_all_of_welcome_oblivion_at_pitchfork/,http://a.thumbs.redditmedia.com/wfGhrAWbb50ZxgPf.jpg,
1375549666.0,1jmtlr,Best friend got his wish and crowd surfed last night at NIN. (Lalla),MatterSaves,107,11,21,,t5_2qhwq,False
1327376281.0,otxqc,This is what I think of every time I see a post tagged [Fixed],dan2551,102,0,7,,t5_2qhwq,False
1367861837.0,1dsy5x,"Broken, the entire movie",kyle6655321,114,15,http://www.reddit.com/r/nin/comments/1dsy5x/broken_the_entire_movie/,nsfw,
1307363379.0,hsspo,Trent Reznor. Marilyn Manson. Jon Stewart. I would love to know why they were all hanging out.,scaredsquee,104,5,9,,t5_2qhwq,False
1375634553.0,1joppt,Nine Inch Nails at Lollapalooza 2013 [Full Gig] 720p w/ Copy Of A Intro,fragilityv2,104,9,13,,t5_2qhwq,False
1351381895.0,12721q,Just found this in a local record store. Needless to say it won't be there very much longer. ,jkainz,107,12,29,,t5_2qhwq,False
1376071526.0,1k1frp,The nine lives of Trent Reznor - New Interview/article from The Guardian,refur,107,13,13,,t5_2qhwq,False
1363813655.0,1aos8j,Wonder if Trent will still be as gunned as this when he tours.. (Old forum photo),Scope575,106,13,24,,t5_2qhwq,False
1357657434.0,166ool,Getting sooo close to finishing this collection.,sixxsixxone,112,14,63,,t5_2qhwq,False
1345271833.0,yf3ho,"""Now HERE are some of your no-name bands""",GammaScorpii,102,10,11,,t5_2qhwq,False
1362442083.0,19o78m,Is it NIN or is pop music? Mashup: Call me a hole!,Cortisol,116,25,48,,t5_2qhwq,False
1346438123.0,z5c15,I present to you all 27 Halo album covers.,space1ord,101,10,22,,t5_2qhwq,False
1342841234.0,wwpzt,You know that white noise at the end of The Warning on Year Zero? It's actually a picture.,Chezlord45,111,18,39,,t5_2qhwq,False
1372106865.0,1gzqm3,Trent Reznor On New Nine Inch Nails Album – ‘I’m Doing Something A Bit Different,TotallyRandomMan,104,11,29,,t5_2qhwq,False
1371081902.0,1g8eyu,The Perfect Drug: Promo Pill Bottle,BurningSouls,107,16,13,,t5_2qhwq,False
1342224703.0,wizb7,Nine Inch Nails - Appendage (The song can only be found on the cassette version of The Fragile),RhythmsOfDeath,96,1,17,,t5_2qhwq,False
1326490557.0,ofyzq,Trent Reznor Says He's Writing New Music for Nine Inch Nails,refur,97,5,13,,t5_2qhwq,False
1375029412.0,1j7z6u,Full Video of NIN at Fuji Rock Fest [1h 33m],totallywhatever,101,15,16,,t5_2qhwq,False
1335154012.0,snobi,"Shit YouTube says (On a video of ""Hurt"")",Av3s,102,12,18,,t5_2qhwq,False
1369271681.0,1evhqa,Nine Inch Nails and the Industrial Uprising: A full documentary on the rise of NIN into the mainstream,thefirdblu,94,8,5,"A lot of the info is pretty common knowledge

[Part 1](http://www.youtube.com/watch?v=-ZQq11RbpEU)

[Part 2](http://www.youtube.com/watch?v=ua_t1cS2kkY)

[Part 3](http://www.youtube.com/watch?v=dHYguJoro8k)

[Part 4](http://www.youtube.com/watch?v=NK4-KY6OFK4)

[Part 5](http://www.youtube.com/watch?v=4X2SJVpRaLE)

[Part 6](http://www.youtube.com/watch?v=Rm_N4JIGiB0)

[Part 7](http://www.youtube.com/watch?v=-taYzH7i0Qo)

It's really interesting to hear the back story of the industrial scene

Interviews with a few well informed dudes gives some pretty good insight as to why exactly Trent Reznor is such a groundbreaking artist.  The best thing about it is that it doesn't focus so much on his personal life (actually only skimming over the details). Instead, some of the thought process behind it, the influence, etc.

Like I said before,False,self,t5_2qhwq,False,,,t3_1evhqa
1361863719.0,198ycq,"Haven't visited the website in a year, it's good to see this.",relinquishthedream,94,6,http://www.reddit.com/r/nin/comments/198ycq/havent_visited_the_website_in_a_year_its_good_to/,http://b.thumbs.redditmedia.com/92hCt2_880dvnzfO.jpg,
1329144263.0,pnhq7,"Rob Sheridan's Concept Art for ""Bleedthrough""",totallywhatever,89,4,29,,t5_2qhwq,False
1371488331.0,1giwxi,Showing support on my ride,firestream,100,16,14,,t5_2qhwq,False
1370544330.0,1ft3ly,I tell everyone who is interested in seriously getting into Nine Inch Nails to start at the beginning.,,96,10,30,"**Due to the new single

I tell everyone who is interested in seriously getting into Nine Inch Nails to start at the beginning.

First of all, moods, struggles, emotions, etc. The better you know the artist, the better you can understand the art, particularly when it’s such a personal journey.

PRETTY HATE MACHINE (1989) - His pilot project. At the time he was working in a Cleveland music studio doing engineering. The manager would let him use the facility after hours to make his own stuff. He said he was trying to make a pop album at the time, the lyrics were still very dark, a foreshadowing of what was to come.

BROKEN (1992) - Written during his battle with his label TVT and later Interscope over his creativity, an influence of industrial founder Peter Christopherson of Coil and Throbbing Gristle, and Ministry frontman Al Jourgensen both of whom he collaborated with during this time. He was even going so far into experimentation as to mess with phasing on the album, hence the warning against listening on mono devices.

THE DOWNWARD SPIRAL (1994) - A concept album about a man's descent into nothing. Themes of self-destruction, rebellion, using, ultimately going into hopelessness, misery, and suicide. Trent had already contemplated suicide, and at this time he was an alcoholic and addicted to cocaine, he had isolated himself in his New Orleans’s and Los Angeles residences. The TDS era is when he was basically hitting bottom. Musically he had perfected ""the beauty of dissonance"" with this album. Grating guitars

THE FRAGILE (1999) - Trent's grandmother who raised him had recently died. He was deep into his addiction which had hampered his creativity for five years since TDS. Another concept album, having firmly mastered dissonance, harmony began to make its way into his writing.

The next four albums while still personal were much more fan oriented

WITH TEETH (2005) - After two grueling tours to support The Fragile, started exercising and made peace (as best he could) with his label. With Teeth is probably the most rock-radio friendly of NIN's albums. He not only changed his lyrical and writing style but also his musical style. Definitely not as dissonant as his previous works it still had elements of experimentalism, utilizing unpopular and unusual analog sounds. He also became more political. After the world shocking events of 9/11 and the controversies of the Bush administration, songs like The Hand That Feeds hinted at things to come.
 
YEAR ZERO (2007) - The last album Trent wrote under contract. His mind was now clear for a grand project. Year Zero was released along with an alternate reality marketing campaign that started during 2006's With Teeth tour. Painting a picture of a world he believed we were heading for, war, greed, torture, religion, pollution, supernatural intervention, it reflected Reznor's growing collaboration with Atticus Ross.

GHOSTS (2008) - A completely different concept, no lyrics, just to see what they could come up with. After the success of the web based YZ marketing campaign, and after having dealt with major label BS for so long, Trent wanted to release the album to his fans the fairest way possible. The result, was releasing the first fourth of the album for free in MP3 format online, and offering different versions of the complete album for purchase online, $15 cheaper than if the album had been released on iTunes

THE SLIP (2008) - With Reznor wanting to move on to other projects (including matrimony) he foresaw the end of devoting all of his time to Nine Inch Nails. The Slip was pretty much a straight forward collection of songs and instrumentals. Somewhat like With Teeth in that there was no overall theme

In 2009 Trent decided to retire from touring Nine Inch Nails. The final tour consisted of gigs at various NYC

While this list includes only the studio albums, EPs, live performances, and music videos under NIN's ""halo"" numbering schematic. All of which have a story of their own.

Since his hiatus from NIN in 2009

But now

**TL;DR: Can't help you there. Can't summarize a summary.**

EDIT: Added dates. Fixed wording.

NOTE: This is for people who have heard some NIN and already like it. For those who want to ""seriously"" get into the music. ",self,t5_2qhwq,1370560223.0,,,True,http://www.reddit.com/r/nin/comments/1ft3ly/i_tell_everyone_who_is_interested_in_seriously/
1348529043.0,10f3k3,An Omen EP cover,joshuaes,93,5,18,,t5_2qhwq,False
1355152139.0,14ltw5,"Nine Inch Nails Best-Of Due With New Songs, Reznor Working on Streaming Service With Beats by Dre News | Pitchfork",fanboy_killer,97,9,http://www.reddit.com/r/nin/comments/14ltw5/nine_inch_nails_bestof_due_with_new_songs_reznor/,http://f.thumbs.redditmedia.com/DHx9uGG-qsUdra0e.jpg,
1370542377.0,1ft0q0,"What is your opinion on the ""Hesitation Marks"" album cover?",TrentonJ,89,5,50,,t5_2qhwq,False
1373043564.0,1hp6on,"It's not much, but this the happiest corner of my house!",,95,12,http://www.reddit.com/r/nin/comments/1hp6on/its_not_much_but_this_the_happiest_corner_of_my/,http://f.thumbs.redditmedia.com/IEgzkTDO91YPX8aG.jpg,
1341926999.0,wbrbf,Call of Duty: Black Ops 2 theme composed by Trent Reznor,foogles,88,8,30,,t5_2qhwq,False
1369076138.0,1epl4e,"Full version of Trent Reznor's collab with Queens of the Stone Age - ""Kalopsia""",xretroberryx,89,9,15,,t5_2qhwq,False
1340948891.0,vs7j2,"So I was listening to ""The Great Destroyer"" and I realized...",MayGusta,110,30,47,,t5_2qhwq,False
1361165123.0,18qhe3,Sold my soul for this rare tour shirt today,thefrecklefactory,98,16,23,,t5_2qhwq,False
1348459838.0,10dlfa,Was browsing David Carson's website when suddenly...[The Fragile Re-Release],Konstantino,85,2,4,,t5_2qhwq,False
1363364404.0,1acuir,"Nine Inch Nails: ""Something I Can Never Have"" (Still) (2002)",Deadl3ming,92,12,5,,t5_2qhwq,False
1354325852.0,142zrs,Awesome fan art of Trent from the 'Closer' video,E_Wander,88,11,9,,t5_2qhwq,False
1353605110.0,13mlck,Posts of Fangirls Aghast ,monstaro,94,15,6,,t5_2qhwq,False
1344042957.0,xnfdx,I tell everyone who is interested in getting into Nine Inch Nails to start at the beginning.,,91,14,32,"*I was originally going to post this as a comment to a thread from someone interested in learning about NIN

I tell everyone who is interested in getting into Nine Inch Nails to start at the beginning.
 
First of all, moods, struggles, emotions, etc. The better you know the artist, the better you can understand the art, particularly when it’s such a personal journey.
 
PRETTY HATE MACHINE - His pilot project. At the time he was working in a Cleveland music studio doing engineering. The manager would let him use the facility after hours to make his own stuff. He said he was trying to make a pop album at the time, the lyrics were still very dark, a foreshadowing of what was to come.
 
BROKEN - Written during his battle with his label TVT and later interscope over his creativity, an influence of industrial founder Peter Christopherson of Coil and Throbbing Gristle whom he collaborated with during this time. He was even going so far into experimentation as to mess with phasing on the album, hence the warning against listening on mono devices.
 
THE DOWNWARD SPIRAL - A concept album about a man's descent into nothing. Themes of self-destruction, rebellion, using, ultimately going into hopelessness, misery, and suicide. Trent had already attempted suicide, and at this time he was an alcoholic and addicted to cocaine, he had isolated himself in his New Orleans’s and Los Angeles residences. The TDS era is when he was basically hitting bottom. Musically he had perfected ""the beauty of dissonance"" with this album. Grating guitars
 
THE FRAGILE - Trent's grandmother who raised him had recently died. He was deep into his addiction which had hampered his creativity for five years since TDS. Another concept album, having firmly mastered dissonace, harmony began to make it's way into his writing.
 
The next four albums while still personal were much more fan oriented
 
WITH TEETH - After two grueling tours to support The Fragile, started excercising and made peace (as best he could) with his label. With Teeth is probably the most rock-radio friendly of NIN's albums. He not only changed his lyrical and writing style but also his musical style. Definitely not as dissonant as his previous works it still had elements of experimentalism, utilizing unpopular and unusual analog sounds. He also became more political. After the world shocking events of 9/11 and the controversies of the Bush administration, songs like The Hand That Feeds hinted at things to come.
 
YEAR ZERO - The last album Trent wrote under contract. His mind was now clear for a grand project. Year Zero was released along with an alternate reality marketing campaign that started during 2006's With Teeth tour. Painting a picture of a world he believed we were heading for, war, greed, torture, religion, pollution, supernatural intervention, it reflected Reznor's growing collaboration with Atticus Ross.
 
GHOSTS - A completely different concept, no lyrics, just to see what they could come up with. After the success of the web based YZ marketing campaign, and after having dealt with major label BS for so long, Trent wanted to release the album to his fans the fairest way possible. The result, was releasing the first fourth of the album for free in MP3 format online, and offering different versions of the complete album for purchase online, $15 cheaper than if the album had been released on iTunes
 
THE SLIP - With Reznor wanting to move on to other projects (including matrimony) he foresaw the end of devoting all of his time to Nine Inch Nails. The Slip was pretty much a straight forward collection of songs and instrumentals. Somewhat like With Teeth in that there was no overall theme
 
Nine Inch Nails final tour consisted of gigs at various L.A. venues across which pretty much the entire NIN catalogue was played.
 
This list includes only the studio albums. There have been many soundtrack releases, live performances, and music videos under NIN's ""halo"" numbering schematic. All of which have a story of their own.
 
Since retiring NIN in 2010

**TL;DR: Follow Trent Reznor's journey by listening to Nine Inch Nails from start to finish.**

EDIT [8/4 02:23]: Drug of choice. Added tl;dr.

EDIT [8/5 21:30]: ""The"" Social Network. ""analog sounds"". YZ ARG started in 2006.",self,t5_2qhwq,1344135453.0,,,True,http://www.reddit.com/r/nin/comments/xnfdx/i_tell_everyone_who_is_interested_in_getting_into/
1332113336.0,r2mw5,Nine Inch Nails - Woodstock 1994 (Full length concert) ,E_Wander,82,1,10,,t5_2qhwq,False
1376399579.0,1k9xie,"Copy of A, Free Download. Amazon US",workshop777,85,4,http://www.reddit.com/r/nin/comments/1k9xie/copy_of_a_free_download_amazon_us/,http://a.thumbs.redditmedia.com/H5gcZO08xXx7x5xr.jpg,
1375585035.0,1jnt2w,Nine Inch Nails - Lollapalooza 2013 (full concert),lageps,88,11,15,,t5_2qhwq,False
1330983865.0,qj4pi,R/Ladyboners just didn't get it. ,LucrativeLlama,80,2,16,,t5_2qhwq,False
1366106992.0,1cgbqd,Show us your collections. Here's my Trent pile.,Theloopcloses,92,15,35,,t5_2qhwq,False
1375327937.0,1jgxzt,Rolling Stone ranks NIN 17th on the 50 greatest live acts right now,Batberg,85,11,33,,t5_2qhwq,False
1353391771.0,13hwc4,"Making the ""Closer"" video",E_Wander,80,4,12,,t5_2qhwq,False
1352385090.0,12uvhr,The New HTDA EP Streaming online right now - The Hype Machine,Deadl3ming,82,10,11,,t5_2qhwq,False
1368156888.0,1e1qva,"My license plate got a little attention at the HTDA concert, I thought you all would like it as well",thefragile,86,10,http://www.reddit.com/r/nin/comments/1e1qva/my_license_plate_got_a_little_attention_at_the/,http://f.thumbs.redditmedia.com/UW9zohweVzMStl_k.jpg,
1364504598.0,1b7876,Leaked: Nine Inch Nails to headline Lollapalooza,totallywhatever,82,9,35,,t5_2qhwq,False
1362550236.0,19rff1,All of the track-specific album artwork on 'Welcome oblivion',rinoshea,82,10,3,,t5_2qhwq,False
1354090312.0,13xbbf,Ice Age.,eifersucht12a,81,6,21,,t5_2qhwq,False
1334620945.0,sdalz,@trent_reznor: Mulholland test drive of the finished new HTDA record.,unsaneroot,76,4,19,,t5_2qhwq,False
1371164693.0,1gav9g,Nine Inch Nails artwork by Russell Mills: The Downward Spiral and Hesitation Marks,sebas_marin,79,9,13,,t5_2qhwq,False
1354995221.0,14icqd,The most unflattering picture of Trent,Metal_Lyrics,80,8,7,,t5_2qhwq,False
1351861825.0,12ifzo,Trent was not impressed with Facebook's reaction to the new How to destroy angels_ video. [NSFW Langauge],jrdsctt,92,16,43,,t5_2qhwq,False
1337229740.0,tr73m,"While not critically successful, probably one of my favorite tracks off 'The Fragile'. (Where Is Everybody?)",joshmanzors,82,11,http://www.reddit.com/r/nin/comments/tr73m/while_not_critically_successful_probably_one_of/,http://f.thumbs.redditmedia.com/HnafStGOOmYP8snY.jpg,
1327824477.0,p1j01,A message from Trent,hiero_,89,16,7,,t5_2qhwq,False
1375802707.0,1jtdkq,For the crafty NIN fan. I'll be starting mine now to finish in time for winter XD,fragileteeth,83,11,21,,t5_2qhwq,False
1368540627.0,1ebbwk,"Regardless of how many times I go back and read about this, the concept never ceases to amaze me.",ich_liebe_berlin,83,9,http://www.reddit.com/r/nin/comments/1ebbwk/regardless_of_how_many_times_i_go_back_and_read/,http://e.thumbs.redditmedia.com/ziqYMOkc7i8_HhZj.jpg,
1335154075.0,snod7,Trent...if he were a cartoon. ,delibertine,80,11,6,,t5_2qhwq,False
1349922742.0,11aef7,NIN Spinal Tap moment (x-post from r/music),plahplahplah,74,0,8,,t5_2qhwq,False
1351159907.0,1224w6,"Hard Copy ""news report"" on Trent Reznor's supposed death after a farmer finds footage of ""Down In It"" video footage.",justdownvote,75,1,10,,t5_2qhwq,False
1371822736.0,1gskzm,Nine Inch Nails Unveil 'Hesitation Marks' Tracklist and Credits,jollyeasyzebra,82,11,58,,t5_2qhwq,False
1363187611.0,1a7vg0,"Nine Inch Nails have two new songs for 2013 live dates, also mentions the reconstructing of old songs",Deadl3ming,73,4,http://www.reddit.com/r/nin/comments/1a7vg0/nine_inch_nails_have_two_new_songs_for_2013_live/,http://f.thumbs.redditmedia.com/qqXas7Olw5sWgDF5.jpg,
1358466858.0,16s7vm,David Bowie - I'm Afraid of Americans (NIN Remix) ,E_Wander,76,5,7,,t5_2qhwq,False
1345654488.0,yn8wy,"Reznor's reaction to ridiculous CD prices..
""Steal it!""",5,3,http://www.reddit.com/r/nin/comments/yn8wy/reznors_reaction_to_ridiculous_cd_prices_steal_it/,,,False,t5_2qhwq,False
1330926765.0,qi7ri,I got this for $6 in a record store in Portland last summer. I trembled like a little girl when I found it.,KittenSmoothie,75,6,15,,t5_2qhwq,False
1374077236.0,1ihr9m,Hesitation Marks will have 4 different covers,totallywhatever,75,7,27,,t5_2qhwq,False
1363623177.0,1aj3nq,"A documentary of Nine Inch Nails’ 1994-1996 “Self Destruct” tour, including concert and behind-the-scenes footage. Part one of the 1997 “Closure” VHS. Includes NSFW content.",murnau1922,75,6,http://www.reddit.com/r/nin/comments/1aj3nq/a_documentary_of_nine_inch_nails_19941996_self/,nsfw,
1368236981.0,1e3u9o,The Fragile 1999 TV Spot,bbbbaconstrips,73,3,8,,t5_2qhwq,False
1322799487.0,mx439,Immigrant Song - Enjoy!,polarbear_15,70,4,18,,t5_2qhwq,False
