created_utc,id,title,author,ups,downs,num_comments,selftext,subreddit_id,is_self
1350922196.0,11wfpa,"Does anyone here know what 
happened to Aaron North?",7,13,http://www.reddit.com/r/nin/comments/11wfpa/does_anyone_here_know_what_happened_to_aaron_north/,"The band Jubilee he had going was awesome, the few songs that emerged had me stoked for the album. Then... nothing. Like literally nothing since. 
Ive trawled the net and read conflicting reports that he was in a motorcycle accident,,False,self,t5_2qhwq,False,,True
1350663469.0,11r4kj,Twitter / destroyangels: Listen to Dave Sitek’s remix of “Keep It Together”,unsaneroot,22,4,12,,t5_2qhwq,False
1349467400.0,110bwe,What are some of your guys favourite NIN music videos? Heres mine...,Capital_J,20,1,29,,t5_2qhwq,False
1348202399.0,108ftc,NIN website is down.,fragilityv2,25,6,15,,t5_2qhwq,False
1348110295.0,106952,How To Destroy Angels - An Omen Ep (Pre-Order),hellomika,19,0,6,,t5_2qhwq,False
1336519543.0,tdr03,"Fantastic interview from the Fragile Era. Trent details a band idea that became How to Destroy Angels, and says he'd ""love to do a real score for a film"".",kleiner352,19,1,http://www.reddit.com/r/nin/comments/tdr03/fantastic_interview_from_the_fragile_era_trent/,default,
1328651314.0,pf90v,"Tying all my other subreddit interests (r/politics, r/SOPA, r/Revolutionreddit, r/technology) together nicely. Check out this presentation on Trent Reznor's business model as a way forward for the music industry",,5,,False
1328214604.0,p868w,Return of NIN in 2012?!  |  West and Crooked,,29,8,3,,t5_2qhwq,False
1321826810.0,mje11,GWTDT Soundtrack complete. Trent to focus on HTDA,dj23,20,1,3,,t5_2qhwq,False
1321492913.0,mf40d,Took this when NIN played in Austin for the last time.,cosmicc,20,0,7,,t5_2qhwq,False
1316732579.0,koflc,"Ok everyone, post your embarrassing high school pics with only NIN to redeem yourself. I'll start...",,25,4,http://www.reddit.com/r/nin/comments/koflc/ok_everyone_post_your_embarrassing_high_school/,http://thumbs.reddit.com/t3_koflc.png,
1316214192.0,ki5tc,Anyone know where to get a copy of this song (or are you willing to share)?,FrankGrimey,21,3,12,,t5_2qhwq,False
1309587030.0,iettc,What moment in a NIN song made you instantly in love with it?,adamzwakk,19,1,45,"For me

[This moment](http://youtu.be/WY0NEQd3_co?t=1m44s)

Hearing this moment in the re-release will be amazing.",self,t5_2qhwq,False,,,True,http://www.reddit.com/r/nin/comments/iettc/what_moment_in_a_nin_song_made_you_instantly_in/
1294010397.0,ev4fz,"""Just Like You Imagined"" 9.08.09 @ Henry Fonda Theater... featuring Mike Garson on piano",TotallyRandomMan,20,0,2,,t5_2qhwq,False
1292781173.0,eodib,"Tavis Smiley . Shows . Trent Reznor . December 14, 2010 | PBS",unsaneroot,21,2,http://www.reddit.com/r/nin/comments/eodib/tavis_smiley_shows_trent_reznor_december_14_2010/,http://thumbs.reddit.com/t3_eodib.png,
1374873457.0,1j4f85,No full live show stream yet? I've been scouring these forums and found individual songs and a crappy partial set video... please say someone recorded the whole thing in HD? Please?,3rdie,21,2,6,,t5_2qhwq,True
1374861462.0,1j3zg0,2nd half of Fuji Rock show,kizerman86,20,1,6,,t5_2qhwq,False
1365114032.0,1boxls,"Official announcement for 2013 US Fall - The lineup of the band includes Eric Avery, Adrian Belew, Alessandro Cortini, Joshua Eustis, and Ilan Rubin,Jdalf5000,http://www.reddit.com/r/nin/comments/1boxls/official_announcement_for_2013_us_fall_the_lineup/,http://b.thumbs.redditmedia.com/FTHkAiujis6AKAyy.jpg
1362373064.0,19mdh9,"What's your most prized possession of memorabilia?
Mine would have to be my Ghost signed edition or And All That Could of Been signed edition",2,20,http://www.reddit.com/r/nin/comments/19mdh9/whats_your_most_prized_possession_of_memorabilia/,,,False,t5_2qhwq,False
1354287327.0,141xhf,What bands remind you of NIN?/What other bands would NIN fans like?,Yackemflaber,24,6,62,"I think all us NIN fans at some point start looking for other bands that sound similar to NIN in order to hold us over until the next release. Obviously none can come close

**Stabbing Westward** - Easily my favorite of the 90's era industrial bands

**The Naked and Famous** - These guys aren't actually industrial

*EDIT: Thanks for all the great suggestions! I forgot about this little gem by the man who would go on to create Mindless Self Indulgence:* http://www.youtube.com/watch?v=SAD5psVkgD8",self,t5_2qhwq,1354543863.0,,,True,http://www.reddit.com/r/nin/comments/141xhf/what_bands_remind_you_of_ninwhat_other_bands/
1342971186.0,wyvw6,"Lol, Poor Trent in 1987...",conhis,20,3,http://www.reddit.com/r/nin/comments/wyvw6/lol_poor_trent_in_1987/,http://d.thumbs.redditmedia.com/J6EMQXaGRKonCqio.jpg,
1342582879.0,wqoql,Nine Inch Nails - Lights In The Sky (Great Remix),GenghisTron00,19,2,6,,t5_2qhwq,False
1340777218.0,vo8qt,Beside you in times on iTunes,dfa79,24,4,9,,t5_2qhwq,False
1334101297.0,s3eqm,One of my favorite Something I Can Never Have performances,phistor,19,0,5,,t5_2qhwq,False
1330423481.0,q9j4j,Supernaut - This song just made a bad day great!,blowfisch,19,0,7,,t5_2qhwq,False
1325958175.0,o6whj,Favorite NIN Remix?,totallywhatever,22,4,35,Official or unofficial,t5_2qhwq,True
1325714443.0,o31rr,P. Diddy &amp; The Family - Victory [Nine Inch Nails Remix],polarbear_15,24,5,14,,t5_2qhwq,False
1322984829.0,mzkky,"The only pro/anti suicide song you'll ever hear.
Contradictions of a mans manifested curse of life exists in a single track,20,2,4,http://www.reddit.com/r/nin/comments/mzkky/the_only_proanti_suicide_song_youll_ever_hear/,,,http://b.thumbs.redditmedia.com/niQWrl86eE_9tTVU.jpg,,
1322803786.0,mx6ta,"""The Girl With The Dragon Tattoo"" Pre-Orders and Free Sampler - nin.com",joshuaes,18,1,6,,t5_2qhwq,False
1321053927.0,m98zp,The Bug working on something with Trent and Atticus for the next HTDA album. (twitter post),refur,20,1,5,,t5_2qhwq,False
1316733252.0,kofza,"New ""Girl with the Dragon Tattoo"" trailer will be run on Moneyball. ",MrSelfDestruct_XIII,18,0,3,,t5_2qhwq,False
1294596494.0,ez1m6,Elvis really Trent's dad?,Kevin_as_Himself,20,1,4,,t5_2qhwq,False
1284820150.0,dfmyl,The Social Network Soundtrack - Free five song sampler download available,bluecalx2,18,1,1,,t5_2qhwq,False
1283825273.0,daf2n,How To Destroy Angels - The Space In Between (ElliotNess APC40 Remix),ElliotNess,20,3,0,,t5_2qhwq,False
1376847861.0,1km4zy,NIN's Rock'n'Heim set will be live streamed in 2 hours,TreasureBandit,18,1,19,,t5_2qhwq,False
1376377549.0,1k9ji4,NIN set from Outside Lands.,umbringer,17,0,12,,t5_2qhwq,False
1372368511.0,1h7f37,What's your favorite NIN song?,puddlesofblood,21,6,86,"Post your favorite song. Alternatively

Why is it your favorite song?

This is a tough one. I really like **Down In It** because of the funky beat

*Did you happen to catch
or did it happen so fast?
What you thought would always last
has passed you by*

It's my favorite because I can definitely relate to the lyrics. I take the lyrics and they seem to fit perfectly with my life. Even if he doesn't mean what I feel,False,self,t5_2qhwq,1372370491.0,,,t3_1h7f37
1370543105.0,1ft1ud,halo 28. the upward spiral?,pnothing,22,5,15,"I think this will be a follow up to TDS. 

It's the same artist for the artwork
It's called Hesitation Marks

Perhaps its Trent's own journey

It could be about dealing with a dark past and the mark it leaves in us. An upward spiral of sorts.",self,t5_2qhwq,False,,,True,http://www.reddit.com/r/nin/comments/1ft1ud/halo_28_the_upward_spiral/
1370372933.0,1fo3zc,"""Come Back Haunted"" this Thursday",asaphelpschicago,23,6,4,,t5_2qhwq,False
1369436725.0,1f00xh,So I just spent €171 ($221) on a festival ticket just to see NIN this summer. Totally worth it!,ulv222,23,7,10,"NIN is playing the Pukkelpop festival here in Belgium this summer.

The day pass they are selling was sold out

I don't care about the rest of the bands really

Call me crazy

The last and first time I saw NIN perform was on their last tour in 2009.",self,t5_2qhwq,False,,,True,http://www.reddit.com/r/nin/comments/1f00xh/so_i_just_spent_171_221_on_a_festival_ticket_just/
1365843205.0,1c9f6k,How To Destroy Angels @ Coachella LIVE!,qyasogk,25,7,24,,t5_2qhwq,False
1362574143.0,19rthy,Simply the best version of March of the Pigs you'll ever see,dhf510,24,6,9,,t5_2qhwq,False
1360525490.0,189ef1,"Don't shoot the messenger, but has anybody heard this abortion? Or: A musical endurance test. How long can you last without foaming at the mouth and hitting stop?",eifersucht12a,34,15,http://www.reddit.com/r/nin/comments/189ef1/dont_shoot_the_messenger_but_has_anybody_heard/,http://e.thumbs.redditmedia.com/NNL58B2KaAYkNeDv.jpg,
1351450239.0,128ag1,Still may favorite live nin performance.,path0gen,24,5,4,,t5_2qhwq,False
1349751612.0,116cyx,TELEPATHE - Destroyer (Trent Reznor Alessandro Cortini Atticus Ross Remix) ,shnx_,17,0,0,,t5_2qhwq,False
1348259630.0,109lkn,"""New Info""",timrbrady,18,1,2,,t5_2qhwq,False
1342224596.0,wiz7a,Just finished painting this.,kiki6y6,25,8,2,,t5_2qhwq,False
1335040006.0,slosn,"Flash game from a few years back, using music from Ghosts.",deathplague,22,5,http://www.reddit.com/r/nin/comments/slosn/flash_game_from_a_few_years_back_using_music_from/,http://f.thumbs.redditmedia.com/8kWAG8oZxPXC09c5.jpg,
1334818322.0,shhpg,how i feel while Trent teases,TTHHEEPPAARRTTYY,20,3,1,,t5_2qhwq,False
1331697732.0,qvonj,Can't believe I havn't seen this before- Sactified from the Dissonance Tour,ryandaily,19,0,5,,t5_2qhwq,False
1328087484.0,p5xp4,Fellow NIN fans - Favourite era?,dj23,19,3,47,"I was thinking the other day that everyone seems to like different NIN songs, or Wave Goodbye tour.

With that said

I'm curious to see if age has anything to do with this.
For me it's Fragility (I'm 23). The combination of AATCHB

Plus

Anyways,False,self,t5_2qhwq,True,,,t3_p5xp4
1326938190.0,omibe,"I kept tweeting TE and RS, then I saw the ninhotline post (whichever one of you runs that site thank you so much), and then this came out. Couldn't be more proud to be a fan ",,20,5,False,
1326710053.0,oj68y,Year Zero viral marketing?,polarbear_15,17,0,5,,t5_2qhwq,False
1322327321.0,mpz3j,iPhone lock-screen,NickyNichols,23,4,2,,t5_2qhwq,False
1322291471.0,mpokv,get excited!,TTHHEEPPAARRTTYY,19,1,4,,t5_2qhwq,False
1321511223.0,mfeyv,The TGWTDT soundtrack is going to be over 2 hours and 40 minutes long,epsey,17,1,13,"From trent reznor's twitter:

""Just putting the final touches on the sequencing of The Girl With The Dragon Tattoo soundtrack record... it was very difficult. And why was that? It's clocking in at two hours and forty-some odd minutes! We've lost our minds. Clear some disk space!""

[http://twitter.com/#!/trent_reznor](http://twitter.com/#!/trent_reznor)",self,t5_2qhwq,False,,,True,http://www.reddit.com/r/nin/comments/mfeyv/the_tgwtdt_soundtrack_is_going_to_be_over_2_hours/
1321397577.0,mdmzq,TGWTDT Soundtrack update! Perhaps a December 2nd release date?,KevinThr,20,3,2,,t5_2qhwq,False
1320537758.0,m1vxl,anyone else still waiting for this?,ilackcreativity,19,2,7,,t5_2qhwq,False
1320300773.0,lype4,"1,000 subscribers!",hiero_,19,1,http://www.reddit.com/r/nin/comments/lype4/1000_subscribers/

[*You know what this calls for? A party!*](http://www.youtube.com/watch?v=NJ3ZGhzFx4Q&amp;t=0m5s)

[*...don't judge me.*](http://www.youtube.com/watch?v=8K7SY9S3yNE)

",self,t5_2qhwq,True,,,True,http://www.reddit.com/r/nin/comments/lype4/1000_subscribers/
1307805942.0,hx6ca,480p videos of SICNH &amp; The Becoming from AATCHB: Still,Leviathant,21,3,2,"So a little while ago
http://rob-sheridan.com/videos/sicnh.mov
http://rob-sheridan.com/videos/the-becoming.mov
I'm pretty sure this had only been released in 240p before (and that's what quality that SICNH on YouTube is at)

Enjoy",self,t5_2qhwq,False,,,True,http://www.reddit.com/r/nin/comments/hx6ca/480p_videos_of_sicnh_the_becoming_from_aatchb/
1307030720.0,hq01p,The Girl with the Dragon Tattoo - Movie Trailers - iTunes,,19,1,7,,t5_2qhwq,False
1252687191.0,9jllv,Trent Reznor says goodbye.,,17,0,0,,t5_2qhwq,False
1375234873.0,1je41q,Got ideas for the /r/nin theme? Submit them here! Even if it's just a header!,Leviathant,20,5,13,"unsaneroot graciously added me as a moderator, but before I pull the trigger on that

I've uploaded an interim header, but it's simple and effective for now :)

This all got set into motion by firestream's theme idea, it might be cool to rotate between them periodically. Thoughts?",,False,self,t5_2qhwq,1375236564.0,,
1374166419.0,1ikhsd,"Sincere apologies if this is the wrong place, but would anyone like 2 tickets to NIN in New York?",,17,2,http://www.reddit.com/r/nin/comments/1ikhsd/sincere_apologies_if_this_is_the_wrong_place_but/

You can have them both together, row 6, seats 3-4. I can email the PDF e-ticket. ",,False,self,t5_2qhwq,,http://www.reddit.com/r/nin/comments/1ikhsd/sincere_apologies_if_this_is_the_wrong_place_but/
1373952506.0,1ie86f,"Am I the only one who would like to see remastered version of ""Purist Feeling""?",serial_photobomber,24,7,12,I much prefer the purist feeling version of 'sanctified' and 'Maybe just once' is a great song. I really wish it wasn't omitted from PHM. ,t5_2qhwq,True
1373938217.0,1idr6v,Going to my first nine inch nails concert.,Orte94,20,5,48,"I've been listening to them since middle school and I have always wanted to go to a nin concert. What's it like to be in one,False,
1370527682.0,1fsgva,Definitive NIN: The Singles (1989-2013),kdwarn,19,3,4,,t5_2qhwq,False
1370492692.0,1frrv1,"""Came Back Haunted"" on YouTube now!",TrentonJ,17,1,2,,t5_2qhwq,False
1359136596.0,179l9e,"With HTDA and EL-P set to play Cochella, anyone else think we might get a live version of Flyentology soon?",Drainout,18,2,http://www.reddit.com/r/nin/comments/179l9e/with_htda_and_elp_set_to_play_cochella_anyone/,self,
1357351205.0,15zgzj,"Mariqueen Maandig in a video shoot for HTDA's ""The Loop Is Closing""",E_Wander,27,11,2,,t5_2qhwq,False
1345622938.0,ymmt4,NIN Meet&amp;Greet Toronto June 2nd 09.(with some SSSC pics too and concert pics.),canuck_rob,17,3,4,,t5_2qhwq,False
1343965633.0,xlpkt,Favorite interview w/ Trent,plahplahplah,17,0,1,,t5_2qhwq,False
1338137287.0,u7f8d,"Atticus Ross interview posted last week. No date on the HTDA album, but states there is something new he is working on with Trent. Any predictions?",TTHHEEPPAARRTTYY,18,0,http://www.reddit.com/r/nin/comments/u7f8d/atticus_ross_interview_posted_last_week_no_date/,http://d.thumbs.redditmedia.com/qI3gWQdkzwCgb2wu.jpg,
1335488577.0,suiyw,"“Finally got finished retail copies of our #DragonTattoo deluxe set! Here are a few invoicing details - photos of the full set are on my site at http://rob-sheridan.com. They start shipping out tomorrow!”
",2,6,http://www.reddit.com/r/nin/comments/suiyw/finally_got_finished_retail_copies_of_our/,,,False,t5_2qhwq,False
1335448151.0,stjfo,Atticus Ross To Score Keanu Reeves' Samurai Epic '47 Ronin' | The Playlist,unsaneroot,20,4,1,,t5_2qhwq,False
1335372809.0,srznj,"Carly Simon, Trent Reznor, Peter Frampton at ASCAP Pop Music Awards 2012. Trent = 25 seconds in and again at 2minutes in.",unsaneroot,18,6,False,
1334980729.0,skujd,First NIN song you guys fell in love with?,xxScythxx,18,1,66,"What was the first NIN song you guys fell in love with,self,
1334373864.0,s911h,Trent's Homage to Coil,grandplans,18,1,7,"[Coil - Tenderness of wolves](http://youtu.be/kZK7vja5FLA)

[NIN - 30 Ghosts IV](http://youtu.be/gZcJ4ZtY6AU)

We all know that TR loves coil (did't he even put an album out on Nothing Records?)  While listening to scatology the first time through, it seems that trent virtually quoted the first 90 seconds and expanded on it. ",,False,self,t5_2qhwq,False,,
1334277719.0,s74ws,Need some Reddit help finding some NiN sheet music to be played at my wedding!,geltoid,22,4,10,"I'm getting married this summer and I've always wanted to have an arrangement of  'We're in this Together' played at my wedding - I think its a powerful

Problem is

It's been arranged for strings before: [This quartet did it](http://www.youtube.com/watch?v=Vy0q4N6zClI) (I know they're just kids

So I'm asking my fellow Reddit NiN friends for some help finding a transcription of the song for my wedding or point me in the right direction - it will be greatly appreciated!",self,t5_2qhwq,False,,,True,http://www.reddit.com/r/nin/comments/s74ws/need_some_reddit_help_finding_some_nin_sheet/
1327955092.0,p3fz1,"Hey r/nin, TR didn't get an Oscar nod, but he sure did get nominated for the Reddit movie Awards!",,18,0,False,
1327764180.0,p0iy9,"Darkness II trailer featuring ""The Mark Has Been Made.""",MrSelfDestruct_XIII,18,2,2,,t5_2qhwq,False
1321605062.0,mgqrt,Did anyone else get really freaked out the first time they heard this song? The drop at 4:19 scared me so bad the first time I heard it.,,18,1,32,,t5_2qhwq,False
1317351941.0,kw1u3,"My photos from the NIN/JA Tour, June 2009 @ The Molson Amphitheatre (364 of them)",bigdaddyhame,17,0,http://www.reddit.com/r/nin/comments/kw1u3/my_photos_from_the_ninja_tour_june_2009_the/,http://thumbs.reddit.com/t3_kw1u3.png,
1315976014.0,kf1k2,I won that Twitter thing from MouthTapedShut earlier.,scaredsquee,17,1,14,"I don't know how many of you follow TRez on Twitter, and did as the account instructed. I got a direct message back

&gt;** and something interesting playing before it we'd like you to see.**

I'll be driving 2.5 hours for a trailer for The Girl with The Dragon Tattoo (*I'm assuming*), and see a friend :D win win.

Anyone else going to this thing on Thursday?

*edit*

screen caps with certain information blacked out:

http://i.imgur.com/lhxmn.png

http://i.imgur.com/d0RKg.png",self,t5_2qhwq,True,,,True,http://www.reddit.com/r/nin/comments/kf1k2/i_won_that_twitter_thing_from_mouthtapedshut/
1313288715.0,ji5gy,It sure is nice to get to watch/listen to this everyday I work. ,MrSelfDestruct_XIII,18,3,7,,t5_2qhwq,False
1313027106.0,jf8a6,This is the mp3 from dragontattoo.com,unsaneroot,17,1,3,,t5_2qhwq,False
1312931706.0,je06q,Does Nine Inch Nails make money?,bhb192,18,2,15,"A few years ago the band made a big deal about separating themselves from the recording industry by promoting itself

Has this worked for them? Are they making less money,,False,self,t5_2qhwq,False,,True
1312340299.0,j7chz,"Unless anyone objects, let's talk about NIN! Come in and share what's on your mind.",calobs,18,2,http://www.reddit.com/r/nin/comments/j7chz/unless_anyone_objects_lets_talk_about_nin_come_in/,False,
1311447099.0,ixtl9,"New NIN fan here, I've got a question.",The_Manwhore,17,1,http://www.reddit.com/r/nin/comments/ixtl9/new_nin_fan_here_ive_got_a_question/

Thanks! ",self,t5_2qhwq,False,,,True,http://www.reddit.com/r/nin/comments/ixtl9/new_nin_fan_here_ive_got_a_question/
1237566169.0,867ly,"Ninja2009.com goes live, includes free NIN/Janes Addiction/Street Sweeper EP, tour dates",alex10819,16,1,False,
1375758586.0,1jscqa,"[torrent/download] 08/02/2013 Chicago, IL, Lollapalooza 1080p Pro-Shot",Latch,19,3,False,
1375707240.0,1jqjgu,Official Lollapalooza Flickr album of Nine Inch Nails.,asaphelpschicago,19,2,4,,t5_2qhwq,False
1369162585.0,1es49b,Best live performances of Downward Spiral?,teleekom,18,3,14,"Hi guys

Fe. I love Mr. Self Destruct but there's very little good live recordings of this song on youtube except the Closure (which is insanely great) but it's just the end of the song and the other versions are sort of mixed and weird. Same goes to the Ruiner. 

So I'm asking for some, just say what show was good, etc.

Edit: I've been shown the [Dissonance Tour Project Videos](http://youtu.be/dGVZ5SJdbK8) which is exactly what I was looking for  ",self,t5_2qhwq,1369174940.0,,,True,http://www.reddit.com/r/nin/comments/1es49b/best_live_performances_of_downward_spiral/
1365836908.0,1c9c4r,In 5 minutes HTDA goes on live at Coachella - you can watch for free on Youtube,ItsMeCaptainMurphy,21,7,22,,t5_2qhwq,False
1365132056.0,1bplae,[REQUEST] Gatorade commercial with NIN ripoff music?,hdoa,22,7,4,"Hey

Apparently, they said ""Fine, we'll just get someone who sounds like you"". 

I'm just wondering where the fuck this commercial is

Any ideas? 

EDIT: Source 1

EDIT2: Source 2

""Trent: Well, exactly the same kind of thing as my voice. So I looked into how we can sue these fuckheads. I don't want money. I just don't want them using my song. Well, they changed it a little bit. I remember hearing a commercial and I thought, ""Joe Jackson, I thought he was cool, and now he's done a fuckin' commercial for something shitty."" It was that song, ""Stepping Out"". Someting almost exactly like that, ""They approached me to do this commercial, fuck you. And they did it. And everyone in the world thought it was him.""",t5_2qhwq
1364612901.0,1ba7sf,HTDA posted a new rehearsal photo- who's the fellow with long hair?,eifersucht12a,20,7,18,,t5_2qhwq,False
1361807017.0,197279,NIN returns!,Seibertron,32,17,0,,t5_2qhwq,False
1360921244.0,18koqs,What key does Trent write in?,ChemicallyCastrated,28,13,20,,t5_2qhwq,True
1360435536.0,187byf,What is this about? ,oldesch,17,2,7,"on theninhotline.com... if you scroll down to 1/30 news - it says this:

Adrian Belew

I dont know if id be more excited about nin touring or nin touring with adrian belew
",self,t5_2qhwq,False,,,True,http://www.reddit.com/r/nin/comments/187byf/what_is_this_about/
1359986986.0,17v79w,Just ordered this..excited!,thefragile,20,4,9,,t5_2qhwq,False
1358346597.0,16ooqn,I was told NIN albums don't decrease in value. Is this true?,h_p_bitchcraft,18,5,22,"In a bid to support my local independent record shop

I don't remember what was said but after asking if they could get me more albums the shop owner told me that along with the Rolling Stones,False,self,t5_2qhwq,False,,,t3_16ooqn
1357503671.0,162r05,"Was watching live footage of the Dissonance tour, and I couldn't help but notice that TR spit on himself by accident",thefirdblu,17,2,http://www.reddit.com/r/nin/comments/162r05/was_watching_live_footage_of_the_dissonance_tour/,http://c.thumbs.redditmedia.com/pch3WKRGYb3CpGa2.jpg,
1353908792.0,13ssqv,New Tweaker album - 'Call The Time Eternity',juskajo,22,6,8,,t5_2qhwq,False
1345664425.0,ynk3c,"Nine Inch Nails - We're in this Blurred Line Closer Now
      - YouTube",4,1,http://www.reddit.com/r/nin/comments/ynk3c/nine_inch_nails_were_in_this_blurred_line_closer/,,,False,t5_2qhwq,False
1337234540.0,tra0t,Happy Birthday to Trent!,justdownvote,18,1,0,,t5_2qhwq,False
1332981718.0,rigcj,Which NIN album did YOU start with?,thegreat_destroyer,15,0,53,"It was 2008, so I bought that.  Listened to it straight-through,False
1329193164.0,pom18,Have there been any updates on the HBO Year Zero show?,Ipecacophony,16,2,5,"Last I heard

Just wondering if anyone knows anything about it's progress. I really love the universe surrounding that album,False,self,t5_2qhwq,False,,,t3_pom18
1329018168.0,plmqx,Back stage Cigarette trick.,demos74dx,16,2,4,"I remember when I was in high school I was watching a backstage video of NIN over at my buddies house.  There was a scene where a guy did a pretty impressive trick.  I don't remember fully but I think he lit a match behind his back,,False
1322691673.0,mv9zv,TGWTDT score information,TTHHEEPPAARRTTYY,16,2,6,"trent tweet: Working with @rob_sheridan and Neil Kellerhouse on a cool package to house the Dragon Tattoo soundtrack's SIX vinyls.

htda tweet: Yes

here is the original ""is your love strong enough?"" if you havent heard it before... http://www.youtube.com/watch?v=h_wVC-w7jOw

... sadly it looks like we wont be receiving anything but information on december 2nd. but im hopefull for a sampler.",self,t5_2qhwq,False,,,True,http://www.reddit.com/r/nin/comments/mv9zv/tgwtdt_score_information/
1318337199.0,l87xw,Could you imagine? (Year Zero),grandplans,18,3,13,"if a slightly different year zero came out today?

I was pretty big into the ARG (Exhibit 24 #24.24.2.1030).

Could you imagine

Too bad Trent is always ahead of his time.  I don't mean to  just suck his dick here,False,self,t5_2qhwq,False,,,t3_l87xw
1316710497.0,ko2b6,What bands do you like that are similar to the style of NIN?,speedlimits65,16,0,46,"a feat i thought was impossible, but that phase got old quick. i tried listening to Skinny Puppy (too dark/goth for me), and while i thought it was good

tl;dr

EDIT: if you say ""How To Destroy Angels"",False,self,t5_2qhwq,False,,,t3_ko2b6
1312508836.0,j9fdj,2 interesting stories related to NIN in an AskReddit thread,calobs,15,1,6,"http://www.reddit.com/r/AskReddit/comments/j8wo0/your_bestworst_celebrity_encounter/c2a3pib

http://www.reddit.com/r/AskReddit/comments/j8wo0/your_bestworst_celebrity_encounter/c2a3lek

",self,t5_2qhwq,False,,,True,http://www.reddit.com/r/nin/comments/j9fdj/2_interesting_stories_related_to_nin_in_an/
1310611174.0,ip1zr,The Downward Spiral [tattoo] ,EffThatFace,17,3,7,,t5_2qhwq,False
1309791613.0,igf6m,"Index of /nin - nothing is really zipped up, but tons of downloads.",unsaneroot,18,1,http://www.reddit.com/r/nin/comments/igf6m/index_of_nin_nothing_is_really_zipped_up_but_tons/,default,
1307235114.0,hrtui,TIL Trent's son has a badass name.,hiero_,15,1,9,"Lazarus Echo Reznor.

You can't get much more badass than that. Kid is going to get *so* much pussy.",self,t5_2qhwq,False,,,True,http://www.reddit.com/r/nin/comments/hrtui/til_trents_son_has_a_badass_name/
1299980842.0,g2vla,Trent Reznor pulls out of 'Abraham Lincoln: Vampire Hunter' film project,isosafrole,15,0,0,,t5_2qhwq,False
1292382029.0,elzst,xpost from /r/music : Trent Reznor nominated for  Golden Globe for Best Original Score,fatalflaw0,18,3,0,,t5_2qhwq,False
1290373922.0,e9ls3,I almost forgot about these...,TotallyRandomMan,16,0,12,,t5_2qhwq,False
1285810702.0,dksdq,Trent Reznor on The Social Network Soundtrack -- a 50 minute interview with /Film,tenmilesky,15,0,3,,t5_2qhwq,False
