created_utc,id,title,author,ups,downs,num_comments,selftext,subreddit_id,is_self
1329259281.0,ppry6,"What copy of The Slip (Halo 27 CD-LE) do you have? (X / 250,000) And what stickers did you get with it?",NineDeadLives,11,0,http://www.reddit.com/r/nin/comments/ppry6/what_copy_of_the_slip_halo_27_cdle_do_you_have_x/, there were three stickers depicting the artwork for single songs from the album. Are these always the same three or a random three for each copy of this Halo? I got one for ""The Four of Us are Dying,
1328302990.0,p9r98,We need more of this sound in the new NIN.,polarbear_15,13,3,1,,t5_2qhwq,False
1328056863.0,p5czp,"""While Waiting"" - Great song from TGWTDT",E_Wander,13,2,0,,t5_2qhwq,False
1327030855.0,oocll,Show off your awesome NIN tattoos!,Kutchyx,14,1,21,"I would like to get one of my own
I currently have no tats,False,self,t5_2qhwq,False,,,t3_oocll
1321785391.0,mixjq,27 Ghosts III,yeahlikethat,15,2,4,,t5_2qhwq,False
1321383933.0,mddlh,A great piano cover of my favorite song from With Teeth.,calobs,13,1,9,,t5_2qhwq,False
1320681428.0,m3lbc,I want SO badly,grandplans,14,4,14,"To put together a NIN cover ban (specifically a Broken cover band) and set up on the shuttle platform in Grand Central and Rock NYC's fuckin SOCKS OFF!

I can sing (classically trained) and easily hit every note on that album(in the appropriate voice,False,self,t5_2qhwq,False,,,t3_m3lbc
1318888850.0,lflg0,"Former NIN recording studio slated for redevelopment into doctor’s office, shops",tenmilesky,14,2,http://www.reddit.com/r/nin/comments/lflg0/former_nin_recording_studio_slated_for/,http://thumbs.reddit.com/t3_lflg0.png,
1312644620.0,jatqg,Is The Fragile getting remastered?,calobs,12,1,19,"I thought I heard that it was going to be remastered/reissued in 2010. What's the difference

By the way,False,self,t5_2qhwq,False,,,t3_jatqg
1310004443.0,iin6y,What's the deal with SEEDS?,Baldish,11,0,5,I hope to one day complete my collection of NIN releases and I was reading a little about SEEDS. The Definitive NIN is one in particular. Are those SEEDS that are numbered legal to download? Were they put out by Trent or the band?,t5_2qhwq,True
1296079480.0,f9m5x,Looking for NIN clip!,zuff,11,1,1,"Can some fan on NIN point me out what clip I am looking for?

As I vague remember, that featured camera moving in slow motion (or slowly) across sky/mountain/forest terrain (to singers back of the head?), but I might be mixing stuff up. Tho nature and slowly moving camera is 100% :P

Now I cant find it on youtube. Was it fanmade? Please help. Do want.",self,t5_2qhwq,False,,,True,http://www.reddit.com/r/nin/comments/f9m5x/looking_for_nin_clip/
1272452247.0,bx6wy,How To Destroy Angels : Summer 2010,jwaters,11,1,5,"Just a quick teaser trailer at this point

edit: how embarrassing,False,self,t5_2qhwq,True,,,t3_bx6wy
1244428429.0,8qlcj,"NIN with Saul Williams - Survivalism, live on stage. Atlanta, 5/10/2009",alex10819,12,2,False,
1231225943.0,7nomc,Nine Inch Nail's GHOSTS album -- freely released by Trent Reznor online -- is Amazon's Top Selling MP3 Album of 2008,,14,4,4,,t5_2qhwq,False
1376568306.0,1kewf8,NIN are due to be on stage at Pukkelpop at 20:40 Belgian time tonight. Live streaming *should* be available (link in description.),splendick,17,5,27,"This is the link here: http://www.skynet.be/nl/festivals/pukkelpop-2013/live-stream

So...who's gonna record this?",self,t5_2qhwq,False,,,True,http://www.reddit.com/r/nin/comments/1kewf8/nin_are_due_to_be_on_stage_at_pukkelpop_at_2040/
1375832453.0,1jui5n,What do NIN fans share?,Batberg,14,5,35,"I saw NIN at lollapalooza and made an interesting observation. Compared to all the shows I saw over the course of the day,,False
1375497765.0,1jltdh,Come watch the stream with other fans. Link below!,I_PUNCH_INFANTS,14,4,2,Bring your beer and watch the live stream from http://tinychat.com/ninlolla,t5_2qhwq,True
1375168757.0,1jc32f,Your ideal setlist?,fourteeneyelet,11,0,13,,t5_2qhwq,True
1374969728.0,1j6t97,I totally want to do something like this!! (Make NIN songs using FL Studio),___dojob___,12,2,6,,t5_2qhwq,False
1370986702.0,1g5gme,Todays colossal fuck up that was presale tickets,mangas08,24,13,25,"I am extremely irritated that I was logged in two hours prior and clicked right at 1 o clock to get tickets when I was greeted with an error message. This happened for over ten minutes and finally it let me through only to find out that it sold out. I contacted the company involved via email four times no answer. I called the company spoke with representatives found out that tickets were also sold through the phone not online like the nin presale fact sheet said. Then the lady proceeds to not help me and says sorry the tickets are sold out. I ask is your company gonna make up for this or give a public apology and she tells ""sir if you have concerns voice it through social media"" and proceeds to hang up. ",t5_2qhwq,True
1370976348.0,1g50nc,Got in about 8 minutes after live sale for MPLS show - all tix say unavailable - am I doing something wrong or did I miss it?,Likes2PaintShit,12,0,26,"*I should say the Xcel

**I hesitated at the $100 price point per ticket and I know I shouldn't have :/",self,t5_2qhwq,1370976534.0,,,True,http://www.reddit.com/r/nin/comments/1g50nc/got_in_about_8_minutes_after_live_sale_for_mpls/
1366926277.0,1d40of,NIN their live performance and Reading 2013,SpoonyBear,16,7,13,So i have been getting into nine inch nails alot lately and have a ticket to a festival they are playing at and i'm super excited to see them after hearing about their kick ass shows. Can someone who has seen them live please shed some light on what i have to look forward to and what their shows are like.,t5_2qhwq,True
1364798764.0,1beqoi,"Found a fan-made music vid for In This Twilight, just awesome.",dhf510,15,4,http://www.reddit.com/r/nin/comments/1beqoi/found_a_fanmade_music_vid_for_in_this_twilight/,http://a.thumbs.redditmedia.com/BwmKJX_HHD3DGGc6.jpg,
1362797380.0,19y9qz,Call Me a Hole (Music Video),gregd4,27,19,5,,t5_2qhwq,False
1361286626.0,18tjiz,Just in case anyone missed it: /r/HTDA,timrbrady,12,2,1,,t5_2qhwq,False
1356100591.0,1587q7,"Considering how influential NIN is, how come more bands aren't attempting to pay tribute to it?",byte-smasher,17,6,http://www.reddit.com/r/nin/comments/1587q7/considering_how_influential_nin_is_how_come_more/,False,
1355196466.0,14n88w,Does anyone have a copy of the New Yorker interview (17/12/12)?,shnx_,13,2,6,Or a way around the paywall?,t5_2qhwq,True
1354164393.0,13z7e7,NiN Woodstock '94 - I'm looking for mp3 versions...,mental_fallout,16,4,9,"I can't find a decent torrent anywhere

Thanks in advance! And even if this can't be helped I will still raise a glass to one of the best sub-reddits out there. Long live the 'Nails",self,t5_2qhwq,False,,,True,http://www.reddit.com/r/nin/comments/13z7e7/nin_woodstock_94_im_looking_for_mp3_versions/
1352337212.0,12txza,"""The new HTDA EP will be streaming tomorrow in its entirety at The Hype Machine."" -Trent",black_obelisk,13,2,3,,t5_2qhwq,False
1348270497.0,109w77,"I did a full length 16 track reversioning of ""year zero"" - complete with new music - it took 4 and a half years to complete: from a parallel universe comes: year zero - countdown to twilight",nefthep,10,0,1,,t5_2qhwq,False
1347680751.0,zwumh,A Year Zero remix I made,tittsy,17,6,2,,t5_2qhwq,False
1337900470.0,u3jfn,'Sin' music video.,thegreat_destroyer,12,1,1,,t5_2qhwq,False
1334522324.0,sb90a,DOTA 2 Unofficial Hero Soundtrack: Into the Void is in the running poll for the Faceless Void hero!,norunningwater,13,3,1,,t5_2qhwq,False
1334231090.0,s6129,Thoughts on the end of the Year Zero ARG.,RobairRobair,11,0,5,"So, which is the same day the presence appears all over the globe at the same time. These are also the last two events in the wiki.

I've always taken it to mean that that Thursday was the end of the world ([which is a nice little reference to the Hitchhiker's guide to the Galaxy

Because things aren't matching up with the timeline from the game, thinking within the framework of the game, good job, everyone‽",,False,self,False,t3_s6129
1333476361.0,rrhv7,How many shows have you been to?,unsaneroot,12,3,43,"me - 19 total:

5/6/00 | 5/18/05 | 11/3/05 | 11/5/05 | 3/11/06 | 6/14/06 | 6/16/06 | 6/17/06 | 3/12/07(cancel) | 8/30/07(resched) | 8/3/08 | 8/27/08 | 8/29/08 | 11/6/08 | 12/13/08 | 5/15/09 | 6/3/09 | 6/7/09 | 6/9/09 | 8/26/09 ",self,t5_2qhwq,False,,,True,http://www.reddit.com/r/nin/comments/rrhv7/how_many_shows_have_you_been_to/
1332257295.0,r560q,"""Riverhead"" by Prick. I don't know if anyone ever got into this band. they were on Nothing, but were dropped very shortly.",ZaphodXZaphod,12,2,http://www.reddit.com/r/nin/comments/r560q/riverhead_by_prick_i_dont_know_if_anyone_ever_got/,http://c.thumbs.redditmedia.com/s97E21GwDkJlj04t.jpg,
1331961877.0,r0hu5,La Mer (version) - nin.com exclusive from Fragile era.,ZaphodXZaphod,10,1,1,,t5_2qhwq,False
1328030782.0,p4rhs,Year Zero canon discussion,hiero_,10,1,10,"I'd like to hear some of your thoughts about the YZ canon.

I'm personally fascinated by The Presence. I also love how it has it's own eerie ""sound"" in some of the songs on YZ. I was wondering what everyone else thinks of it? 

While it would be neat that Trent included it to be an alien-like thing or even God or angels, its very similar. So maybe that was trent's idea?  

And what exactly happens after ""Zero Sum""? ",self,t5_2qhwq,False,,,True,http://www.reddit.com/r/nin/comments/p4rhs/year_zero_canon_discussion/
1327636867.0,oynwd,"TGWTDT song stems, for those of you who remix NIN songs",TTHHEEPPAARRTTYY,16,5,http://www.reddit.com/r/nin/comments/oynwd/tgwtdt_song_stems_for_those_of_you_who_remix_nin/,default,
1325903601.0,o69k5,El-P Feat. Trent Reznor - Flyentology,polarbear_15,13,2,5,,t5_2qhwq,False
1325216213.0,nvs70,4 Ghosts I,offworld92,10,0,3,"http://www.youtube.com/watch?v=M72X-mXd-kA

Does anyone know if the main instrument in this song is an electric violin or not?  It sounds just like one,False,self,t5_2qhwq,False,,,t3_nvs70
1324633423.0,nnsj1,You guys heard these?,GammaScorpii,13,3,5,,t5_2qhwq,False
1323922162.0,ndcd0,My remix of The Beginning of the End,Swagger39,12,2,6,"I love that Trent gives us his stems to remix,self,
1320264769.0,ly2ty,nin.com - a note to musicians about TuneCore (full length HDA news),,10,0,2,,t5_2qhwq,False
1317092117.0,ksiui,"If you were to ever meet Trent, what would you ask him?",calobs,15,3,http://www.reddit.com/r/nin/comments/ksiui/if_you_were_to_ever_meet_trent_what_would_you_ask/,self,
1315574624.0,ka070,My Sharona + The Beginning Of The End mix - does it exist?,Axius,11,2,6,"The backing beats and the like sound practically identical. I can't help but feel it's something that just needs doing. Does such a thing exist?

It will probably be an abomination of sound,False,self,t5_2qhwq,False,,,t3_ka070
1311213869.0,ivf0b,Trent is giving out USA Spotify invites on Twitter. :),JaneRenee,10,0,1,,t5_2qhwq,False
1307116822.0,hqv5o,What is your least favorite NIN album?,churchdemo,12,2,47,,t5_2qhwq,True
1299257738.0,fxd4z,Trent Reznor in talks to score AND ACT in Abe Lincoln: Vampire Hunter,,17,8,11,,t5_2qhwq,False
1287591902.0,dtwn1,The Gift: Individual DVD/BD release of disc 2 of Another Version Of The Truth - NOW AVAILABLE,cliveholloway,11,0,3,,t5_2qhwq,False
1285918366.0,dle9n,"Here it is, seen on reddit first. The only (as far as I know) tab for The Day The World Went Away CRC Version for Acoustic Guitar-",,11,2,http://www.reddit.com/r/nin/comments/dle9n/here_it_is_seen_on_reddit_first_the_only_as_far/, and decided tonight to tab it out after a while. Hope you enjoy

Here is the tab (http://imgur.com/joYgs.jpg)

and here is what it sounds like on guitar (http://www.youtube.com/watch?v=-sz02dfcsrM) ",self,t5_2qhwq,False,,,True,http://www.reddit.com/r/nin/comments/dle9n/here_it_is_seen_on_reddit_first_the_only_as_far/
1271380287.0,brkb7,What do you want to hear out of Reznor this year?,hooch,10,0,12,"He mentioned that there were a few projects in the cards for this year. Some NIN and some non-NIN,self,
1220266782.0,6z13a,Music Milestones: 20 Years of NIN,unsaneroot,13,1,0,,t5_2qhwq,False
1376424573.0,1katyz,First review of HM I've found so far.,all3n_y,11,3,8,,t5_2qhwq,False
1376365135.0,1k97j8,Copy of A - Hesitation Marks - Nine Inch Nails,sebas_marin,11,2,0,,t5_2qhwq,False
1375484214.0,1jlfi2,Tonight's Show,b1uduk,9,2,10,Is anyone going to record tonight's show from youtube?,t5_2qhwq,True
1374815430.0,1j2vvr,Who do you think of when you hear the song 'Piggy'?,fourteeneyelet,12,2,15,,t5_2qhwq,True
1371415517.0,1gh1zg,Who WAS able to get pre-sale tickets?,lageps,11,2,16,"How many of you guys were able to get pre-sale tickets?  How close to the start of the sale was it?  Was anyone able to get them hours or days after the start?
I'm freaking the fuck out about pre-sale starting tomorrow.  It starts at 12:30 and I have a dentist appointment at 12:20 (FML).  And all this talk about people trying to purchase tickets as soon as it starts being denied is making it way fucking worse.
I guess i'm looking for reassurance even though it's probably not going to happen.

EDIT: HOLY FUCKING SHIT GUYS I GOT 2 GA FLOOR STANDING TICKETS TO THE RALEIGH

EDIT2: I just want to thank all of you for the warnings and making sure that I treated this shit as seriously as possible.",self,t5_2qhwq,1371487976.0,,,True,http://www.reddit.com/r/nin/comments/1gh1zg/who_was_able_to_get_presale_tickets/
1366748948.0,1cyk2x,For sale - an extra ticket for HTDA in Toronto this Thursday!,wildeyes,16,8,3,"I have an extra presale ticket for the HTDA show at the Sound Academy this Thursday

I'm selling it for face value

If you're interested,False,self,t5_2qhwq,False,,,t3_1cyk2x
1363776711.0,1anmvq,Just released performance of The Becoming (still) from the 2002 Self Destruct tour in New Orleans.,Cagaentuboca,17,7,5,,t5_2qhwq,False
1363479809.0,1afrm3,"Music video for ""The wake-up"" I made as part of a school project.",caterault,18,8,7,,t5_2qhwq,False
1358730974.0,16ylh8,"What all do we know about the new ""The Fragile Ultimate Re-issue""?",TrentonJ,13,5,11,"I've been excited for this for a while,self,
1354487203.0,1463y4,deadmau5's remix of Ice Age,caterault,14,4,2,,t5_2qhwq,False
1352829106.0,134r59,Trent is doing an AMA,walter_weego,14,5,3,,t5_2qhwq,True
1344684361.0,y1m13,What does the '1/2-step lower' thing mentioned with live renditions of some songs at ninwiki mean?,TheKiw,12,3,13,"""This live version is performed a 1/2-step lower than the album version."" - Does this mean that instead of a C

Also,,False,self,t5_2qhwq,False,,True
1344582991.0,xzixy,Pinion,jdmastro,14,5,7,,t5_2qhwq,False
1338643226.0,uh4mn,Who would you like to see collaborate with Trent Reznor?,ZaphodXZaphod,12,2,34,"I've fantasized frequently of certain collaborations - one of the most fabulous ones that fell through was the one with Zack De la Rocha. I was also very disappointed by Perry Farrell's douchebaggery killing the potentially amazing Jane's/NIN collaboration. The talk of Eric Avery, but that's far less impressive than Jane's + Trent. I'd love to hear Trent work with David Byrne, I think would both be pretty cool collaborations. I'd be interested to see Trent work with Serj Tankian
1335907694.0,t254u,"Non-Entity from BYIT, I always liked the visuals for this.",ZaphodXZaphod,9,0,http://www.reddit.com/r/nin/comments/t254u/nonentity_from_byit_i_always_liked_the_visuals/,http://e.thumbs.redditmedia.com/YbC0ac9uLhN9ejwL.jpg,
1334087950.0,s3273,"Some years ago I  made a fan video for ""And All that could have been"" - what do you think reddit?",imacgyv0r,11,3,3,,t5_2qhwq,False
1333129510.0,rl774,"@trent_reznor: Ilan Rubin's take on the lost art of the drum solo: http://www.youtube.com/watch?v=-CwASFrwkAc Well done, my friend!",unsaneroot,11,2,http://www.reddit.com/r/nin/comments/rl774/trent_reznor_ilan_rubins_take_on_the_lost_art_of/,http://a.thumbs.redditmedia.com/FwIpsyFGWmh7q136.jpg,
1332569172.0,rb4mi,Anyone else disappointed with the lack of music related stuff(Reznor/Ross) in TGWTDT special features? ,MrSelfDestruct_XIII,9,0,4,Just sat through and watched the entire special features(about 4 hours) disc that came with my Blu-ray copy and not a single mention of Reznor or Ross. The Social Network had some cool featurettes! What gives!?,t5_2qhwq,True
1330656023.0,qdwa3,I had a dream last night That I was allowed to fill in as the drummer for NIN for one song of my choosing as part of a contest,NoctGent,15,5,14,"It was awesome. That is all. no J/K

If you could fill in for one song on an instrument/vocal track of your choice

I picked WISH because ([im assuming this video was in my subconscious that made me dream this wonderful dream](http://youtu.be/qboe5CebixA?t=1m3s)) I would be too excited to play at a slower tempo.",self,t5_2qhwq,False,,,True,http://www.reddit.com/r/nin/comments/qdwa3/i_had_a_dream_last_night_that_i_was_allowed_to/
1328991224.0,pl3w5,What's the highest note Trent Reznor has ever sung in a song?,calobs,10,0,10,"If I had to guess I think it's either ""Somewhat Damaged"" (""Tear a hole exquisite red""?) or ""Sunspots"" (""I think I could have been someone"").",t5_2qhwq,True
1327352035.0,otd0k,Another Version Of The Truth: Kronos &amp; Enrique Gonzales Muller,DivineNebula,16,6,1,,t5_2qhwq,False
1323122014.0,n1m2t,"A beautiful rendition of 'Hurt', performed by 2Cellos.",AlexADGC,12,5,http://www.reddit.com/r/nin/comments/n1m2t/a_beautiful_rendition_of_hurt_performed_by_2cellos/,default,
1322814010.0,mxbv9,Anyone else have a similar experience?,nin3414,13,4,4,,t5_2qhwq,False
1322431464.0,mr84m,I thought /r/music stopped talking about NIN a long time ago...,calobs,12,4,0,,t5_2qhwq,False
1319808881.0,ls5ya,Something is Brewing...,FranklyCrafty,12,2,8,,t5_2qhwq,False
1262496975.0,akz7d,The Gift - Fan-created NIN DVD,jwaters,9,1,2,"Filmed in Sacramento, The Gift is a stunning work in 1080p High Definition video with 5.1 Surround Sound

Available in just about any form you'd like to see it - DVD, ps3, blu-ray (soon), and youtube: http://www.youtube.com/watch?v=3DHJIFko9pY&amp;feature=PlayList&amp;p=0652B79BAF05635F&amp;index=0&amp;playnext=1",,False,self,False,t3_akz7d
1256062551.0,9vz76,currently uploading my nin live shows here.....,unsaneroot,10,0,8,"things to note:

* some shows may be incomplete now

* some shows may be incomplete because they were incomplete when i acquired them

* shows that i have recorded myself have not been uploaded yet

* some shows need details on recording or venue or correct dates etc...you can post your adjustments to this thread.. *i will update those when i can*

* the directory structure will most likely change as updates are implemented...resulting in deadlinks...but all nin items will be in the [/nin](http://unsaneroots.net/nin) folder at my site....

* i'd like to have every known recording of nin hosted on my site as direct download....if you have anything to submit pm me.

* i have about 500+ gigs....maybe alot more...audio and video

- [unsaneroots.net/nin](http://unsaneroots.net/nin)


THANKS!",self,t5_2qhwq,True,,,True,http://www.reddit.com/r/nin/comments/9vz76/currently_uploading_my_nin_live_shows_here/
1241473510.0,8htrz,"Reznor's iPhone app rejected, and boy is he pissed!",Millstone99,10,1,http://www.reddit.com/r/nin/comments/8htrz/reznors_iphone_app_rejected_and_boy_is_he_pissed/,http://thumbs.reddit.com/t3_8htrz.png,
1241470606.0,8hteh,Trent Reznor and Mariqueen Maandig: Engaged.,unsaneroot,11,2,2,,t5_2qhwq,False
1239121287.0,8aot3,Nine Inch Nails iPhone App Extends Reznor's Innovative Run,Millstone99,11,2,3,,t5_2qhwq,False
1376399325.0,1k9x9u,More like Ghosts? Looking for new music.,grandplans,8,0,16,"I love ghosts.  The prepared instruments

Is there another artist that does similar stuff?  A genre that encompasses all of it?

I know Coil has stuff that could be grouped together

Any input would be greatly appreciated.


EDIT:::you guys are all fucking awesome thanks so much
",self,t5_2qhwq,1376404666.0,,,True,http://www.reddit.com/r/nin/comments/1k9x9u/more_like_ghosts_looking_for_new_music/
1375559779.0,1jn41v,"Nine Inch Nails live at Niigata, Japan, Fuji Rocks Festival on July 28, 2013",baiitsu,1,,False
1375365541.0,1jhsis,Does anyone know in which songs Ilan Rubin plays cello?,alpheli0n,8,0,5,The ninwiki page for Fuji and Ansan lists Ilan Rubin as drums/cello and I'd be interested in watching his live performance since he only recently picked up cello.,t5_2qhwq,True
1375158854.0,1jbuaz,So QOTSA and NIN are playing consecutively at lolla this Friday......,Batberg,9,2,5,"Knowing that Trent is good friends with Josh Homme (they've collaborated on several tracks) do you guys think its possible that Trent may show up during the QOTSA show or Josh during the NIN show? I've seen videos of Trent jumping in on a street sweeper social club performance and Saul Williams making an impromptu appearance during ""survalism"" at a NIN show,self,
1375062611.0,1j8zkf,Sons of Anarchy teaser with The Mark Has Been Made,KarmicCorpse,8,0,3,,t5_2qhwq,False
1374403861.0,1iquhm,"First impressions from the Hesitation Marks: ""peculiar mix of late 90's NIN with HTDA, Came Back Haunted being the best song from the first half of the album""",teleekom,18,10,http://www.reddit.com/r/nin/comments/1iquhm/first_impressions_from_the_hesitation_marks/,default,
1374263631.0,1ini0e,What songs can I expect to hear on the upcoming tour?,Batberg,12,6,17,"Hey guys,False,
1372543610.0,1hbz46,Fragile &amp; The Fragile,Virosa,9,0,3,"So I was just re-listening to Yes' The Fragile and it suddenly hit me that their album has similar musical components to NIN's The Fragile.  Quiet, blowing your brains for a bit and then suddenly becoming quiet again...and vocal manipulation and synths of course. I dare you all to give it a listen and tell me what you think...possibly a connection,False
1372106215.0,1gzpqp,Staples Center on 11/8,Madcatz7,9,2,24,"Just got 2 GA tickets,self,
1371004733.0,1g64dw,For those that purchased tickets - What were your options/what did you get?,nin3414,11,2,19,"I'm trying to remain calm after seeing the higher than usual ticket prices,,False
1370566382.0,1ftxs6,Adrian Belew leaves Nine Inch Nails,Randomwordcombo,14,6,13,,t5_2qhwq,False
1367990242.0,1dwyww,Nine Inch Nails performs “The Frail” and “The Wretched” from the Fragility 2.0 tour in 2000,E_Wander,10,2,2,,t5_2qhwq,False
1366761718.0,1cz20t,"Dirt cheap tickets on Stubhub + elsewhere for this week's HTDA shows. (Boston, NYC, Montclair, others).",rossignol91,5

Boston and NY have tons of tickets &lt;$10, for $3.

So if you're not going yet,False,self,t5_2qhwq,False,,,t3_1cz20t
1364068966.0,1aviqq,"Bear with me here, but what if The Downward Spiral was the sound track to a short film?",natron5000_,23,14,http://www.reddit.com/r/nin/comments/1aviqq/bear_with_me_here_but_what_if_the_downward_spiral/, one of them made a joke about that song making him want to shoot up a school, and my other friend (who had previously shown no interest in the idea) perked up and tuned in. 

So **TL/DR** in advance

1. “Mr. Self Destruct”: On a Sunday morning, well, utterly self-destructive. By the end of the song, the overwhelming impulse to commit atrocious acts of violence has taken over completely, much like the distortion in the song has. Overly angst-ridden teenager has made up his mind. He grabs a set of car keys and makes his way to the garage…
2. “Piggy”: Once inside the garage, as well as justified for the actions he is about to commit. He nonchalantly passes by a police officer, smiling as he does, only feeling more grandiose about what is about to occur. By the end of the song, Mr. Self Destruct has arrived at a local church nearby…
3. “Heresy”: He walks into the foyer of this place of worship, and cackling with a sense of twisted retribution, Mr. Self Destruct begins his rampage – his ultimate downward spiral. 
4. “March of the Pigs”: Running out of the building, the police pull over and arrest the wrong person in a similar car. “Justice” is brought to the city, and now they can all sleep soundly, for everything is alright. 
5. “Closer”: Mr. Self Destruct needs to lay low for a while, he slips drugs in her drink, and they proceed to have questionably-consensual, wildly animalistic and borderline grotesque filthy sex. She lets him violate her, and he feels her from the inside. Again, and again and again.
6. “Ruiner”: After the wild and animalistic
7. “The Becoming”: …No. Mr. Self Destruct – or rather the resurfacing of the overly angst-ridden that had been consumed – is the problem. But there’s nothing the young lad can do at this point. He is in a state of becoming
8. “I Do Not Want This”: The teenager enters a reflective state and a state of desire as he realizes there is nothing he can do to overcome Mr. Self Destruct. But even when he feels the desire for alleviation from his control is strong and authentic
9. “Big Man with a Gun”: In an effort to make known who is really in control, nothing can stop him now. He’s gonna come all over you, him and his fucking gun. 
10. “A Warm Place”: The teen sits down and enjoys one of his last moments of agency, and he knows he has no one but himself to blame. But just as he thinks this, he begins to recall the only other person that had made him feel before. The woman at the strip club…
11. “Eraser”: But as the fond recollection of this woman becomes sheer abhorrence for his own existence
12. “Reptile” …He comes to realize that, his precious whore – she was all he had left, and now he has nothing. 
13. “The Downward Spiral”: As the joint being – angst ridden, accepting the suicidal fate towards which he has brought himself, he slashes his body with the hunting knives attached to his hips, and shoots himself in the head. 
