created_utc,id,title,author,ups,downs,num_comments,selftext,subreddit_id,is_self
1355508969.0,14uq95,"Salt Lake, i'm a bachelor and childless this weekend for the first time in what feels like ages. What trouble can you get me into?",theusualshop,365,79,http://www.reddit.com/r/SaltLakeCity/comments/14uq95/salt_lake_im_a_bachelor_and_childless_this/, tours, sleep overs
1358950712.0,174ero,Saw this beautiful thing on trax this morning ,brown3218,272,23,41,,t5_2r7ac,False
1365008012.0,1blied,How I feel driving at night in Utah,,289,53,26,,t5_2r7ac,False
1366746197.0,1cyg5n,[STOLEN LAPTOPS from UofU] please upvote this for visibility seeing as I receive no karma for this text post!!,Votess,280,41,24,"My 17"" MacBook Pro was stolen from an office in the LCB on the third floor sometime between Friday (19th) afternoon and Saturday (20th) afternoon. My officemate's Dell Alienware 14"" was taken as well.  Any information regarding this would be incredibly helpful.  I won't even be mad at you. I just have a lot of work saved on it that I've done in the last year as a graduate student. 

edit-My OS was not up to date enough to install iCloud with its tracking feature(10.7.4 required).  Other tracking software was not installed.  And just to emphasize,False,self,t5_2r7ac,1366823029.0,,,t3_1cyg5n
1359075566.0,1785ju,Found this just when I thought the roads couldn't get any more slick after the freezing rain this morning... ,Kyyul,223,15,5,,t5_2r7ac,False
1376695722.0,1kiq7j,So this just happened downtown,thesilverecluse,228,28,14,,t5_2r7ac,False
1354592418.0,148qmn,"Saw this on CityPorn, thought you guys would love to see it as well. ",theredcheck,221,20,http://www.reddit.com/r/SaltLakeCity/comments/148qmn/saw_this_on_cityporn_thought_you_guys_would_love/,http://f.thumbs.redditmedia.com/PRcBMysievTMO8SG.jpg,
1352262982.0,12rxuh,How I feel as an Obama voter tonight in Utah.,BeatDigger,225,38,40,,t5_2r7ac,False
1352591106.0,12zhjv,A picture of Salt Lake City from my friend's window.,Killhouse,199,11,11,,t5_2r7ac,False
1371781097.0,1grpnb,Oxymoronic keychain,IhearBANJOmusic,216,32,28,,t5_2r7ac,False
1366921527.0,1d3u1b,Felt left out in /r/funny so I made this.,TweedProwess,245,58,36,,t5_2r7ac,False
1362358266.0,19lw8f,that seems about right,princdarknes,217,31,10,,t5_2r7ac,False
1362679762.0,19uve4,"Epic Brewery, fed up with Utah's ever-changing and rather absurd liquor laws, will invest $2M in Denver instead of growing it's business in Utah.",backeast_headedwest,208,41,False,
1358054364.0,16h7wu,"Salt Lake City skyline Saturday, Jan. 12",baney,191,14,http://www.reddit.com/r/SaltLakeCity/comments/16h7wu/salt_lake_city_skyline_saturday_jan_12/,http://c.thumbs.redditmedia.com/nbRce-Tpmb06uz4D.jpg,
1363979858.0,1atebc,For those of you who are unfamiliar with how the weather works here,everything_is_free,217,45,6,,t5_2r7ac,False
1364704521.0,1bcdff,Gotta love Facebook this time of year...,-BACON-,203,35,20,,t5_2r7ac,False
1365178952.0,1bqoqy,"Living Downtown, I get a tingle of dread this time of year...",joseph_sith,204,37,http://www.reddit.com/r/SaltLakeCity/comments/1bqoqy/living_downtown_i_get_a_tingle_of_dread_this_time/,http://d.thumbs.redditmedia.com/u54w6d1jLhpbNmdo.jpg,
1366597158.0,1cu745,I live in Oregon and I snapped this on my way into a connecting flight. You all live in a beautiful city; no doubt that I will be back.,benbarnesatl,181,17,31,,t5_2r7ac,False
1367416538.0,1dhbfi,Got this out of the shed just in time.,H4L9000,191,27,12,,t5_2r7ac,False
1351175077.0,122ei2,After four years I'm still never prepared for this...,KloverCain,183,23,25,,t5_2r7ac,False
1370707981.0,1fxj40,Sailing on the Great Salt Lake During Sunset,corrincrellin,172,9,13,,t5_2r7ac,False
1359047846.0,1775j2,This only one of several accidents I saw on my drive to work. ,randEntropy,175,20,40,,t5_2r7ac,False
1358117545.0,16ijw5,We live here.,backeast_headedwest,189,33,16,,t5_2r7ac,False
1369162342.0,1es3ya,Milky Way over Utah (X-post from /r/wallpapers),temporarycreature,171,15,8,,t5_2r7ac,False
1359325334.0,17e2xv,All this moisture with the snow is making it perfect to sculpt with.,darth_mo,174,17,27,,t5_2r7ac,False
1375234864.0,1je41g,Some people just want to watch the world burn,alexrjr42,190,32,7,,t5_2r7ac,False
1370206264.0,1fje1h,Here's my take from the Pride Parade Sunday. Are you in it?,baney,178,27,41,,t5_2r7ac,False
1358301826.0,16noyw,"In case you didn't see this, xpost from CityPorn",theredcheck,168,13,http://www.reddit.com/r/SaltLakeCity/comments/16noyw/in_case_you_didnt_see_this_xpost_from_cityporn/,http://c.thumbs.redditmedia.com/wkfSNgbwTbc4uxDb.jpg,
1368043003.0,1dyafs,"Seriously, guys, why have the police not caught the serial killer who is obviously behind these signs?",KloverCain,174,34,False,
1367289863.0,1ddw48,"Remember, the West Desert is only an hour and a half away...",corrincrellin,165,19,http://www.reddit.com/r/SaltLakeCity/comments/1ddw48/remember_the_west_desert_is_only_an_hour_and_a/,http://b.thumbs.redditmedia.com/9qnCJG8QAcU_onDC.jpg,
1360164351.0,18030o,The superhero Salt Lake needs...,,180,31,39,,t5_2r7ac,False
1349898601.0,119oks,"Oh, SLC. You crazy. ",yodamuppet,161,11,http://www.reddit.com/r/SaltLakeCity/comments/119oks/oh_slc_you_crazy/,http://e.thumbs.redditmedia.com/nU2YBUKGO-tKM5cX.jpg,
1340385704.0,vfzia,Dark Lords Only,ChrisMill5,166,18,9,,t5_2r7ac,False
1359397622.0,17fw2r,Saw something strange at work today.  Does anyone know what this is?,carleverett,175,33,35,,t5_2r7ac,False
1340144969.0,vaqz3,Milky Way from the Salt Flats last night.,gthing,152,8,20,,t5_2r7ac,False
1368747093.0,1ehfhv,How many of you remember these at the Hoggle Zoo. X-Post r/funny,rsantillan,150,14,40,,t5_2r7ac,False
1343103297.0,x21im,In honor of Pioneer Day:,biorad,164,24,23,,t5_2r7ac,False
1362506434.0,19pvol,View of Salt Lake from behind the capitol at midnight. Taken 12/12/12/,tacojoeIII,152,14,23,,t5_2r7ac,False
1364826730.0,1bf9e1,Would you be interested in an app that tells you what liquor stores have what products and for what prices?,ThankAPlumber,158,23,87,"I am in a unique position where I may be able to have private access to this information and I am curious if anyone else would be interested in something like this.

Sales price

Would you all use something like this if it were to come around? Is there anything you'd like to see included in it? 

Thanks in advance for the help!",self,t5_2r7ac,False,,,True,http://www.reddit.com/r/SaltLakeCity/comments/1bf9e1/would_you_be_interested_in_an_app_that_tells_you/
1359564574.0,17kh55,"Me too, bro. Me too. ",hyperjumpgrandmaster,175,43,http://www.reddit.com/r/SaltLakeCity/comments/17kh55/me_too_bro_me_too/,http://c.thumbs.redditmedia.com/5gzERIpsPWWbjECD.jpg,
1344901535.0,y684k,SLC,TheBird47,159,21,19,,t5_2r7ac,False
1367720839.0,1dpnbi,Salt Lake City this evening,masterschmo,150,14,9,,t5_2r7ac,False
1366227763.0,1cjy4b,Provo is getting Google Fiber,SideburnsMephisto,170,35,97,,t5_2r7ac,False
1373407292.0,1hyqcy,Tiny Utah-based ISP makes a name for itself by rebuffing government snoops,snrcbpco,153,19,25,,t5_2r7ac,False
1368671855.0,1efdpb,"Awesome double rainbow over SLC, May 15",baney,145,13,http://www.reddit.com/r/SaltLakeCity/comments/1efdpb/awesome_double_rainbow_over_slc_may_15/,http://e.thumbs.redditmedia.com/OJ9IZXXt_GlkP2bR.jpg,
1331951898.0,r0bpx,Gov. Herbert vetoes abstinence only sex ed bill,brheath,139,7,33,,t5_2r7ac,False
1328560310.0,pdm1k,Snatched from my Facebook News Feed. Solid Gold.,eaglebacon,149,25,36,,t5_2r7ac,False
1349970387.0,11baok,"Oh, SLC. You crazy.[FIXED]",eaglebacon,140,14,http://www.reddit.com/r/SaltLakeCity/comments/11baok/oh_slc_you_crazyfixed/,http://f.thumbs.redditmedia.com/xyAPsa9V2Y9WKPzq.jpg,
1365468434.0,1bygo5,Gov. Gary Herbert denied Las Vegas our water. Cheers!,billy-bumbler,137,11,20,,t5_2r7ac,False
1359227071.0,17brw8,It's like Silent Hill up in here,DesolationRobot,136,12,14,,t5_2r7ac,False
1376629813.0,1kgylt,Anyone need another red sun sunset picture?,crayolaz,140,16,9,,t5_2r7ac,False
1370629665.0,1fvly2,For my cake day I wanted to share a picture I took of an old tree near Salt Lake,kingscorner,147,23,7,,t5_2r7ac,False
1366645557.0,1cva1p,"Fellow Utahns, let's take a minute this Earth Day to be thankful for petroleum and our wonderful air quality. (Colbert Report)",skeezy801,141,18,http://www.reddit.com/r/SaltLakeCity/comments/1cva1p/fellow_utahns_lets_take_a_minute_this_earth_day/,http://f.thumbs.redditmedia.com/03zSHQelPE3CyOW_.jpg,
1363130715.0,1a6hnb,"Here for Spring Break. I took some pictures, I've never seen mountains in my life.",Vo1ture,132,12,http://www.reddit.com/r/SaltLakeCity/comments/1a6hnb/here_for_spring_break_i_took_some_pictures_ive/,http://a.thumbs.redditmedia.com/qWaMhSh8PFebzLXx.jpg,
1338688834.0,ui0bl,My friend has it right.,woogitywoogity,134,13,22,,t5_2r7ac,False
1369000161.0,1enktr,Downtown from the Library roof - Tinyplanet,davinkane,140,21,6,,t5_2r7ac,False
1370390008.0,1foqqj,Mit Romney is currently slumming it with the commoners at 5 guys,nuixy,152,38,68,,t5_2r7ac,False
1369932990.0,1fcgvy,My view of the epic spring storm of 5-29-13,Rustling_Leaf_Design,130,15,17,,t5_2r7ac,False
1375118426.0,1jad8s,Salt Lake City Public Library (X-post from r/architectureporn),Shaky14,131,13,12,,t5_2r7ac,False
1354730377.0,14bzl2,Utah Names,todaywasawesome,141,25,74,,t5_2r7ac,False
1321829893.0,mjfut,Salt Lake Pretty,,125,9,25,,t5_2r7ac,False
1355531418.0,14vdgu,"House Got Robbed By An Unknown Person, I Would Like To Help The Police ID The Man, West Valley City (/xpost from a couple other subs)",robberyvictim,126,46,False,
1325118082.0,nu8zr,The Salt Lake City Smith's grocery store on 9th &amp; 9th is the highest selling store in America for Pabst Blue Ribbon.,Killhouse,126,9,66,,t5_2r7ac,False
1373480404.0,1i0ufw,Utah Internet Firm Defies State's Warrantless Subpoena Law,adiquet,125,13,9,,t5_2r7ac,False
1358363254.0,16p76n,Only in Utah... (xpost /r/utah,skisnowwild,132,20,34,,t5_2r7ac,False
1365778059.0,1c7iad,Some of my pictures from the Uinta Mountians this past summer.,TheBird47,128,19,29,,t5_2r7ac,False
1372189749.0,1h23yp,Fat Tire Finally Coming to Utah,katkelli,127,17,27,,t5_2r7ac,False
1371933540.0,1gvfvx,89 North merging... Glitch in our Matrix,Thorrian,121,13,14,,t5_2r7ac,False
1361335122.0,18v97d,Fellow SLC folk will understand ,lambiscuit,144,33,46,,t5_2r7ac,False
1347643998.0,zvwmi,How I feel on a Sunday in Utah but can't go to the liquor store,pruittmckean,129,17,24,,t5_2r7ac,False
1343788057.0,xhfyx,Bad luck brian gets hired...,reParaoh,129,18,13,,t5_2r7ac,False
1369105539.0,1eqonj,Salt Lake City has highest rate of same-sex couples raising kids,shopvavavoom,123,14,16,,t5_2r7ac,False
1352417228.0,12vtr7,"Maybe if I read this paper, the people on this train won't know I am actually a bear...",pwnographic,115,5,http://www.reddit.com/r/SaltLakeCity/comments/12vtr7/maybe_if_i_read_this_paper_the_people_on_this/,http://b.thumbs.redditmedia.com/BdjeSy-9Qy7ljkCm.jpg,
1370972730.0,1g4v5n,Found at Lagoon. I thought it was funny.,Thehealeroftri,134,26,18,,t5_2r7ac,False
1370279854.0,1flb3j,400 Mormons Marched In Salt Lake City Pride Parade,ripode,137,28,61,,t5_2r7ac,False
1339047332.0,upcol,Waiting for the train...,gthing,121,12,15,,t5_2r7ac,False
1361733986.0,19589y,The day of rest.. Right?,TheBird47,128,23,5,,t5_2r7ac,False
1361467750.0,18ypmp,Salt Lake County Legalizes Kids’ Lemonade Stands and Eliminates Dozens of Silly Licensing Restrictions (x-post from /r/Libertarian),veruus,119,13,6,,t5_2r7ac,False
1348254047.0,109fdq,If WTC were in Salt Lake City,_d_c,114,12,15,,t5_2r7ac,False
1374849857.0,1j3knk,"After realizing that there isn't a SLC jobs subreddit, it decided to create /r/utahjobs/ What do you guys think of a place to post jobs for Utah redditors, by Utah redditors?",kirkbenge,124,22,False,
1364456664.0,1b6023,Our beautiful city 8/4/2010,Inebriator,115,12,12,,t5_2r7ac,False
1341411518.0,w15hf,Utah is on Fire (x-post r/pics),paxanimus,105,5,21,,t5_2r7ac,False
1374853439.0,1j3p45,Moments like these are the reason I live in Salt Lake City. The Flaming Lips @ Twilight last night.,beardedjack,130,26,32,,t5_2r7ac,False
1346960250.0,zgqlc,Assassins Creed parkour in SLC.,Killhouse,127,23,34,,t5_2r7ac,False
1357767165.0,169t5h,"I moved here from Dallas about 2 weeks ago, this is how I feel when driving.",,152,48,http://www.reddit.com/r/SaltLakeCity/comments/169t5h/i_moved_here_from_dallas_about_2_weeks_ago_this/,http://a.thumbs.redditmedia.com/OPik4bsndb0gt2tB.jpg,
1350758682.0,11t39x,Did anyone else see the sunrise this morning? ,theredcheck,114,12,15,,t5_2r7ac,False
1344966191.0,y7ob9,A View From Fourth South,strangeloveocean,115,13,12,,t5_2r7ac,False
1372112115.0,1gzxjy,Well next Monday is going to be a bit cold...,glitchvdub,111,12,13,,t5_2r7ac,False
1357334238.0,15yylq,"Utah cops, I don't think this is what you think this is.",F-That,114,12,http://www.reddit.com/r/SaltLakeCity/comments/15yylq/utah_cops_i_dont_think_this_is_what_you_think/,http://a.thumbs.redditmedia.com/VcyJRMnH3YNwhorx.jpg,
1334946208.0,sk2ef,It's okay. Daddy's here.,LAWLzzzzz,114,14,1,,t5_2r7ac,False
1368030238.0,1dxto8,Twilight Concert Series 2013 Lineup,projslc,119,16,47,,t5_2r7ac,False
1348591697.0,10gh5q,Snowbird reporting a few inches last night!,optikal801,112,15,23,,t5_2r7ac,False
1347919939.0,101ng9,"We have such amazing air quality here, I never want to leave. ",yodamuppet,118,19,http://www.reddit.com/r/SaltLakeCity/comments/101ng9/we_have_such_amazing_air_quality_here_i_never/,http://e.thumbs.redditmedia.com/3nwaySiDg1zfQb2p.jpg,
1338152826.0,u7q8j,Meanwhile on TRAX...,Garin2010,114,18,12,,t5_2r7ac,False
1337542810.0,twcl4,first world problem today,cahlima,125,26,15,,t5_2r7ac,False
1331240948.0,qnukh,meanwhile on 400 south..,dezbah,104,3,5,,t5_2r7ac,False
1358293809.0,16nf4q,Fuck this shit.,ChristPuncher5000,111,14,22,,t5_2r7ac,False
1365452201.0,1bxu8r,I have taken a lot of pictures of our city. This is my favorite one.,Ninthmission,113,17,11,,t5_2r7ac,False
1354341064.0,143clx,Not everyday you see this kind of thing.,TheBird47,128,33,12,,t5_2r7ac,False
1350070597.0,11dpln,UTA petition: Operate TRAX trains until 2:30 am every morning. SIGN IT!,spectacularspecimen,111,13,31,,t5_2r7ac,False
1365551567.0,1c0yrq,"""Nearly everything Colorado does, Utah does as well or better, without the kerfuffle, the crowds or the cost."" - Huff Post",backeast_headedwest,21,,False
1361503905.0,190035,How many salt lake residents support marijuana?,diambag,121,26,96,"How many of you support either medical marijuana,self,
1358177428.0,16jylx,Can we all please agree that these jackets are 10+ years old and shouldn't be worn anymore.,RussCargill,164,72,45,,t5_2r7ac,False
1349732527.0,115rc2,probably the best 'free' post ever!!!,zerorider_99,101,8,12,,t5_2r7ac,False
1346208664.0,yzzhy,Looking West Towards Antelope Island This Morning,CaptainRedbearrd,103,10,24,,t5_2r7ac,False
1373050331.0,1hpedz,I went to Mirror Lake yesterday. I had to post this on here,Bojan888,110,18,6,,t5_2r7ac,False
1371596279.0,1gm8nb,We found this little beagle girl today. Does she look familiar to anyone in the West Jordan area?,thebbman,106,14,5,,t5_2r7ac,False
1365689255.0,1c4v51,How I feel as a Jr. in high school.,TheBird47,182,89,81,,t5_2r7ac,False
1360534319.0,189oyx,Please turn on your cars headlights.,TheBird47,113,25,46,Especially if it is snowing or if it is really foggy out. I don't care if it's 2pm. I can barely see you. Turn on your headlights.,t5_2r7ac,True
1358541398.0,16u4q1,Back in my day there was a mountain there... Before and After: Inversion,jusfuccin10,110,17,17,,t5_2r7ac,False
1369848833.0,1fa3e9,"Mormon-owned DI cuts workers’ hours, avoids Obamacare",ripode,112,19,http://www.reddit.com/r/SaltLakeCity/comments/1fa3e9/mormonowned_di_cuts_workers_hours_avoids_obamacare/,http://b.thumbs.redditmedia.com/kG5mZP_uTcREznU1.jpg,
1371667875.0,1go7w3,My view at Rio Tinto (USA vs Honduras),hemmicw9,101,11,15,,t5_2r7ac,False
1352788429.0,1340oc,Someone made a snowsquid.,TheBreadnaught,92,4,9,,t5_2r7ac,False
1342660797.0,wsjso,OAGF Salt Lake City style,kittenstinkhauser,115,23,24,,t5_2r7ac,False
1326999862.0,onmyz,"Orrin Hatch backs down from PIPA, and now we are 5/5 on representatives voting no on PIPA/SOPA.  Great work everyone who put the pressure on.",wordofgreen,96,4,http://www.reddit.com/r/SaltLakeCity/comments/onmyz/orrin_hatch_backs_down_from_pipa_and_now_we_are/,default,
1376415534.0,1kah0m,I painted this painting about my journey from my city Mostar in Bosnia and Herzegovina to Utah. What do you guys think?,Bojan888,105,16,11,,t5_2r7ac,False
1348426867.0,10coze,"To reduce DUIs, my buddy and I are trying to put breathalyzer kiosks in Salt Lake bars. Where would you like to see one?",sah0605,110,22,http://www.reddit.com/r/SaltLakeCity/comments/10coze/to_reduce_duis_my_buddy_and_i_are_trying_to_put/

Most of us know that alcohol can impair peoples' judgement significantly.

We live in Salt Lake, ""I'm good to drive."" This is rarely the case, and a ridiculous amount of people drive under the influence. We really, really hate drunk driving. Frankly, these people just don't know when they're too intoxicated to drive.

Our goal is to provide people with an accurate reading of their blood alcohol content (B.A.C.) and if needed

From our mission statement

To do this, but they are sold to bar owners at high costs, not maintained, and aren't very accurate... Our kiosk is accurate to +/- 0.005%, every time.

The kiosk would cost $2 for patrons to use

We plan on putting these kiosks in bars at no cost to the venue owner

Any feedback would be awesome

**Here's where I would like your advice:**

* Where would you like to see BreathAdvisor kiosks placed? I'm thinking in bars and clubs that most people drive to. Where would you use one?

* Would you use a kiosk if you had been drinking and were considering driving home? (We need 4 uses per night if we're installing them for free.)

* Would you be willing to use the kiosk if it were free? I think $2 is cheap

* If you could throw us a ""Like"" on Facebook that would be pretty neat too

* If you know bar owners in Salt Lake that might be interested in this

*For our launch we'd love to do a bar crawl with fellow redditors, for example, getting higher alcohol content beers in our favorite bars. Lots of possibilities here if we do this right...*

**TL;DR We're trying to install breathalyzer kiosks in Salt Lake bars

**The first kiosk is being placed in Lumpy's South

**ANY FEEDBACK IS GREATLY APPRECIATED AND WE'D LOVE TO THROW YOU A PROMO CARD WITH FREE USES

**EDIT: A look at our first kiosk! http://imgur.com/SsGHZ **",self,t5_2r7ac,1348466515.0,,,True,http://www.reddit.com/r/SaltLakeCity/comments/10coze/to_reduce_duis_my_buddy_and_i_are_trying_to_put/
1360618028.0,18bz6c,Looking Down On Salt Lake Valley At Sunset (x-post from r/campingandhiking),maestro-sartori,94,6,10,,t5_2r7ac,False
1358876215.0,172c8u,Every single panel on the car was scrawled with similar rantings....,hemmicw9,98,10,17,,t5_2r7ac,False
1351560741.0,12baeq,Salt.,backeast_headedwest,95,9,9,,t5_2r7ac,False
1327217433.0,or8u6,Idiots trying to drive on 400 N during snowstorm in Bountiful today. Lots of crashes.,pandaspear,98,14,32,,t5_2r7ac,False
1370837862.0,1g0xid,I found what looks like a painted Utah quarter in my change jar. X-Post r/pics,rsantillan,95,10,31,,t5_2r7ac,False
1344540882.0,xye9z,I got to get up on top of the City and County building this morning... ,swankmotron,88,4,20,,t5_2r7ac,False
1328478789.0,pcb55,Explosion kills Josh Powell and kids,seejaydeja,95,9,60,,t5_2r7ac,False
1374015125.0,1ig36j,Looking for a Goat to Borrow.,carlius,100,15,17,"Caution: redneckery ahead. 

I'm looking for a goat to chomp down some weeds that I can't get with my lawn mower and don't care to weed  whack. I also would like having a goat in the yard for a couple weeks. I am looking for a job and could get one anywhere

This is a serious post. ",self,t5_2r7ac,False,,,True,http://www.reddit.com/r/SaltLakeCity/comments/1ig36j/looking_for_a_goat_to_borrow/
1367337468.0,1df0z6,"SLC activist is the first to be prosecuted under the new ""Ag Gag"" law.",jbrake,108,20,13,,t5_2r7ac,False
1359406150.0,17g799,"When I stepped outside today, this is what I immediately thought of",RangerFromTheNorth,108,25,http://www.reddit.com/r/SaltLakeCity/comments/17g799/when_i_stepped_outside_today_this_is_what_i/,http://d.thumbs.redditmedia.com/-uZJza-hNRBDzv-E.jpg,
1352275540.0,12sd7c,"Jim Matheson ekes out narrow win over Mia Love by ~2,500 votes in Utah’s hard-fought 4th Congressional District",CEOofEarthMITTROMNEY,91,8,http://www.reddit.com/r/SaltLakeCity/comments/12sd7c/jim_matheson_ekes_out_narrow_win_over_mia_love_by/,default,
1340522223.0,vin19,Thanks for the smile Xmission,byeberlin,92,11,7,,t5_2r7ac,False
1374954255.0,1j6bv4,Jim Matheson (Utah Representative) Voted to keep NSA funding,socceruci,101,15,27,,t5_2r7ac,False
1373467455.0,1i0crg,"As a newcomer to Utah, this is what I was thinking on my morning commute.",RanTheRedCedar,116,32,http://www.reddit.com/r/SaltLakeCity/comments/1i0crg/as_a_newcomer_to_utah_this_is_what_i_was_thinking/,http://d.thumbs.redditmedia.com/WR3BXnCkzA8pviZ3.jpg,
1357685582.0,167lwp,"So, about that inversion.. I'm not sure this was the best graphic.  But, I may just be immature... (Fb)",Ceedub260,110,12,False,
1371429405.0,1ghgoh,Took a few pics the other day while buzzing around,kalcy,93,6,19,,t5_2r7ac,False
1370044544.0,1ffq5l,My playground.,vawn,98,13,6,,t5_2r7ac,False
1369624969.0,1f48ma,"It was a good weekend for hiking (Lake Blanche, Big Cottonwood Canyon)",corezero,89,8,http://www.reddit.com/r/SaltLakeCity/comments/1f48ma/it_was_a_good_weekend_for_hiking_lake_blanche_big/,http://d.thumbs.redditmedia.com/Y3cFd1PlocdoHBqi.jpg,
1346028066.0,yvmvu,Great Mural Hidden Downtown,UndeadBarber,92,8,21,,t5_2r7ac,False
1302077901.0,gjrt2,Spring in Utah,sickyd,93,7,9,,t5_2r7ac,False
1376282038.0,1k6rnf,"Went for a motorcycle ride, caught a beautiful sunset from Suncrest",corezero,91,8,http://www.reddit.com/r/SaltLakeCity/comments/1k6rnf/went_for_a_motorcycle_ride_caught_a_beautiful/,http://c.thumbs.redditmedia.com/tA4z3V9Mu7HT12CD.jpg,
1375289873.0,1jfjgd,This morning at Sundial Peak,bbluez,93,9,10,,t5_2r7ac,False
1372622703.0,1hdqsn,"Nothing like spending your Sunday up at Cecret Lake, in Little Cottonwood",SilentGuardian1776,95,13,http://www.reddit.com/r/SaltLakeCity/comments/1hdqsn/nothing_like_spending_your_sunday_up_at_cecret/,http://b.thumbs.redditmedia.com/IOrgku-Q3UKUVOO1.jpg,
1372787218.0,1hiddk,"Canyons School District, educating our kids since 2009!",extremx,98,18,http://www.reddit.com/r/SaltLakeCity/comments/1hiddk/canyons_school_district_educating_our_kids_since/,http://c.thumbs.redditmedia.com/87kKsdrBOthp-3H8.jpg,
1342381873.0,wlsxb,Every time I get in my truck.,Commander_Cupcake,110,29,25,,t5_2r7ac,False
1374363118.0,1ipznm,Vandalism at Memory Grove Park. Who tags a war memorial?? Fucking animals.,LazarWulf,103,26,26,,t5_2r7ac,False
1363884342.0,1aqocl,Heroic beavers save Salt Lake City water supply,conundrummed,89,11,14,,t5_2r7ac,False
1362969730.0,1a251q,A Sunset in Utah County,undead_carrot,92,9,7,,t5_2r7ac,False
1347995628.0,103dv1,Banksy SLC? Around the corner from my office downtown (off of 400S and State),ElloGovnor,94,15,34,,t5_2r7ac,False
1343151923.0,x305k,"Happy Birthday, you glorious bastard!",4blockhead,98,17,http://www.reddit.com/r/SaltLakeCity/comments/x305k/happy_birthday_you_glorious_bastard/,default,
1375844977.0,1juxc0,MISSING PERSON: SLC Area - Allen Oliver.,lauraisbored,89,7,4,"Posted with her permission. Please upvote so this can be seen.

It's been 25 days since anyone has seen my Dad

If anyone has seen him or knows where he is can you please contact me or Detective Gordan 801-799-3454 or Sgt. Mitchell 801-799-3730 at the Salt Lake City Police Department. The case number is: 13112008 
Any help would be appreciated.

[here is his photograph.](http://i.imgur.com/PW8wJNk.jpg)",self,t5_2r7ac,False,,,True,http://www.reddit.com/r/SaltLakeCity/comments/1juxc0/missing_person_slc_area_allen_oliver/
1362582927.0,19s0q1,Swimsuit season in Utah,FireFly_87,129,50,116,,t5_2r7ac,False
1361289115.0,18tm2f,IAmA reporter who slept at the Road Home homeless shelter &amp; spent many cold hours on the street reporting on SLC's homeless. I will be taking any and all questions on Feb. 19 from 2-4 pm AMA ,epetersonCW,97,18,30,"Edit: Hey thanks for all the questions

From Dec. 2012 to mid February 2013 I spent over a dozen hours hanging out on Rio Grande street adjacent to the Road Home shelter in downtown SLC. I spent a night at the shelter before the weather turned. Hanging out on the street I saw a fight

http://www.cityweekly.net/utah/article-77-17123-i-know-im-invisible.html 

@EricSPeterson
epeterson@cityweekly.net",self,t5_2r7ac,1361314856.0,,,True,http://www.reddit.com/r/SaltLakeCity/comments/18tm2f/iama_reporter_who_slept_at_the_road_home_homeless/
1350931402.0,11wkyh,"Salt Lake City finally offering curbside glass recycling!  It's voluntary though, so make sure to sign up!",snowmanvt,89,11,http://www.reddit.com/r/SaltLakeCity/comments/11wkyh/salt_lake_city_finally_offering_curbside_glass/,http://e.thumbs.redditmedia.com/iH8mCBI790Iaaoh4.jpg,
1340542647.0,viu5i,Pictures!!! GIVE ME KARMA NOW ! ! !,RedBull7,105,29,37,,t5_2r7ac,False
1335454559.0,stoee,Took this shot yesterday morning. Looking good SLC!,carmenqueasy,93,14,12,,t5_2r7ac,False
1358210715.0,16l3xn,Atop Mineral Basin on Saturday morning [PIC],hemmicw9,86,11,0,,t5_2r7ac,False
1350679923.0,11rmrg,Salt Lake Tribune endorsing Obama,Volden,94,16,44,,t5_2r7ac,False
1347901235.0,10139j,I found this picture of the Centre Theatre during the flood of 1983...  Return of the Jedi is on the marquee...,swankmotron,84,9,13,,t5_2r7ac,False
1316135886.0,kh5b6,Only in Utah (xpost from r/pics),valjean260,82,5,13,,t5_2r7ac,False
