created_utc,id,title,author,ups,downs,num_comments,selftext,subreddit_id,is_self
1376450522.0,1kbqc3,STOLEN motorcycle 8/12,fiveminutewindow,43,9,6,"UPDATE:
Thanks to everyone that commented and upvoted. The motorcycle was found this morning in an apartment complex parking lot in South Salt Lake with both the ignition and gas cap drilled out. No damage other than that. Always lock your handlebars

My black 2003 Honda Shadow 600cc was stolen from the curb next to my avenues house last night (8/12)

http://www.motorera.com/honda/h0600/VT600C/vt600c-03a1.jpg

...with a sissy bar on the back, or through more back-alley means, please PM me. Any and all help is more than appreciated. Thanks Salt Lake Redditers!",,False,self,t5_2r7ac,,http://www.reddit.com/r/SaltLakeCity/comments/1kbqc3/stolen_motorcycle_812/
1372895367.0,1hlnuj,Restore the Fourth Utah Protest,roblatham90,52,17,5,,t5_2r7ac,False
1355359968.0,14ra86,"We keep chickens. My favorite has turned out to be a rooster, so we cant keep him. My girlfriend wants to kill him, but I want to find him a home! Help!",,44,24,False,
1353088263.0,13b3y0,Utah City Settles With Man Who Flipped Off Officer. ,t_r_andson,44,10,8,,t5_2r7ac,False
1351673182.0,12e2cw,I might try posting this around my local polling stations. What do you think /r/slc?,mormdem,67,31,36,,t5_2r7ac,False
1338572147.0,ufw66,"Friends, go to Salt Lake City's website and occasionally verify you don't have parking tickets. Salt Lake City's parking authority are a group of extortionists with no souls.",TylerRiggs,43,9,http://www.reddit.com/r/SaltLakeCity/comments/ufw66/friends_go_to_salt_lake_citys_website_and/

I told her I didn't know of any parking ticket and asked her if she could send me the information

She said that they tried to mail me a letter about the ticket, and which I traded in in January for a new car.) She then said they also tried to mail something to another address they had on file, which was my current address, except she had the wrong apartment number. So essentially, they failed to deliver any notification of a ticket to me because I didn't get a physical ticket, and they couldn't get letters to me. 

So I gave her my accurate address and she sent me a notice that didn't give any details about the date of the parking ticket, entered in both my current and old license plate numbers, and saw my ticket record for my old car, with yes, an outstanding ticket (incidentally, I looked at my calendar from back at that date and I did leave my car overnight in an area that had a time limit because I had too much to drink that night, and I remember expecting a ticket but being glad I didn't get one.) 

So I called this Rebecca Taylor back and left messages saying that I acknowledged the ticket, they are saying I owe them $125.) However, Rebecca Taylor, being a soul-sucker who works for a soulless agency, without a shred of humanity, has ignored my messages. I went ahead and paid the $125 today because I don't want my credit impacted and I don't have time to fight this in court.

I'm encouraging all of you though to occasionally check the city's website at www.slcgov.com and make sure you don't have phantom parking tickets. Salt Lake City can get fucked for all I care at this point and this is going to have a direct impact on how I spend my money around the community. Rebecca Taylor can pound sand too.

tl;dr - Salt Lake City's parking authority is a bunch of pig fuckers out to rape taxpayers. You should check to make sure they aren't trying to rape you too.

Edit: Thanks to eco_was_taken for linking to actual page where you can look up tickets: https://dotnet.slcgov.com/court/courtonlinepayment/Default.aspx ",self,t5_2r7ac,1338573391.0,,,True,http://www.reddit.com/r/SaltLakeCity/comments/ufw66/friends_go_to_salt_lake_citys_website_and/
1331879973.0,qz2so,Places to eat in Salt Lake City.,gthing,40,6,70,"I've created a Google Map with good places to eat in Salt Lake City. Mostly if not all local places

You can access this map from your smartphone in Google maps for a quick list of food ideas!

[HERE IS THE MAP](http://maps.google.com/maps/ms?msid=209094112346429313539.0004bb55f8444e88c26a9&amp;msa=0)",self,t5_2r7ac,False,,,True,http://www.reddit.com/r/SaltLakeCity/comments/qz2so/places_to_eat_in_salt_lake_city/
1322421759.0,mr2k8,Greetings from Lookout Peak,corrincrellin,40,4,3,,t5_2r7ac,False
1312925370.0,jdwt9,Cool overhead picture of the City Creek project.,TylerRiggs,37,0,15,,t5_2r7ac,False
1310931942.0,is6vl,TIL the lights on top of the Walker Center are a weather tower,huck_cussler,40,4,7,,t5_2r7ac,False
1374455967.0,1is7db,Verizon LTE down?,junior612,41,6,25,I noticed I was roaming yesterday in Cabelas and didn't think anything of it. But now I see its a problem for everyone else as well. ,t5_2r7ac,True
1373308337.0,1hvodx,"Jumping on the bandwagon, panorama at Flaming Gorge while fossil hunting.",RockabillyRebel,37,4,http://www.reddit.com/r/SaltLakeCity/comments/1hvodx/jumping_on_the_bandwagon_panorama_at_flaming/,http://f.thumbs.redditmedia.com/OwGWHeZ370nCY4fk.jpg,
1371737824.0,1gq7mr,Study shows link between pollution and autism; Utah has the highest occurrence of both.,lady_lady_LADY,43,10,15,,t5_2r7ac,False
1368852607.0,1ek9py,A real problem this weekend,puhnitor,60,26,5,,t5_2r7ac,False
1368432122.0,1e8fok,Sensory Deprivation Tank in SLC,Netloc91,43,6,17,,t5_2r7ac,False
1366747209.0,1cyhms,That's going to be a little tough to scan...,spangborn,37,4,9,,t5_2r7ac,False
1364147279.0,1ax7te,I went to Ensign Peak and found a really cool cave yesterday,brannonbuckley,47,12,16,,t5_2r7ac,False
1361849778.0,198k21,"Man dead after high-speed chase, standoff on I-15",jshultz,42,9,http://www.reddit.com/r/SaltLakeCity/comments/198k21/man_dead_after_highspeed_chase_standoff_on_i15/,http://c.thumbs.redditmedia.com/MsIvAOsKSb8AH-G8.jpg,
1348212679.0,108m6r,The iPhone 5 launch line at Fashion Place Mall,deweysmith,47,12,16,,t5_2r7ac,False
1346351043.0,z38k5,"Daily drink specials back in UT, I'll take it as a partial victory...",snowmanvt,38,5,http://www.reddit.com/r/SaltLakeCity/comments/z38k5/daily_drink_specials_back_in_ut_ill_take_it_as_a/,default,
1331361193.0,qq0vj,Guy was hiking in City Creek Canyon and snapped this picture (xpost r/pics),thebradhimself,43,9,17,,t5_2r7ac,False
1331189293.0,qn161,"What the hell, Utah legislature??",BabyOhmu,37,3,http://www.reddit.com/r/SaltLakeCity/comments/qn161/what_the_hell_utah_legislature/
Please contact Governor Herbert's office and encourage him to veto HB363.

http://governor.utah.gov/goca/form_comment.html

or 801-538-1000

Love

Anybody who is not a fan of chlamydia, abortion attempts, or unwanted babies

http://www.ksl.com/?nid=148&amp;sid=19501443&amp;title=parents-teens-upset-over-passage-of-abstinence-only-bill&amp;s_cid=featured-1",self,t5_2r7ac,False,,,True,http://www.reddit.com/r/SaltLakeCity/comments/qn161/what_the_hell_utah_legislature/
1327819934.0,p1h49,Ultimate Lurker,sequoimone,40,8,38,"I am, that's right,self
1322772084.0,mwjy2,Crazy photos from the wind damage Thursday around Utah ,LenMahl,35,3,10,,t5_2r7ac,False
1304124447.0,h0jp3,Scumbag University,brianw824,37,4,20,,t5_2r7ac,False
1373158828.0,1hs11p,I too was atop Granduer Peak...this is my panoramic,gwotet,46,12,5,,t5_2r7ac,False
1371043518.0,1g6zh9,Anyone know a quiet bar where people leave you alone?,Christouxphr,37,6,115,"Hello all!

I'm hoping someone knows of a nice dive where a depressed

I'm 22 and haven't hit up any bars yet because they all seem crowded

Is there a place where the occasional biker, easily ignorable background music playing?

If you watch its always sunny in philidelphia

Edit: wow guys thanks for all the replies! I'm going to have to check out a lot of these. ",self,t5_2r7ac,1371080123.0,,,True,http://www.reddit.com/r/SaltLakeCity/comments/1g6zh9/anyone_know_a_quiet_bar_where_people_leave_you/
1370570156.0,1fu2ay,The North Ogden police chief accidentally shot himself...,swankmotron,36,2,7,,t5_2r7ac,False
1366905276.0,1d37u2,Just got my pass checked on TRAX by a single UTA Police Officer and 2 DHS officers.,deweysmith,44,13,29,"There was a post up yesterday showing a photo of some TSA officers standing on a TRAX platform. I was happy to dismiss it as TSA inspectors taking the train to work.

Today on my way to work I had my pass checked by a single UTA Police Officer and two dudes in Department of Homeland Security POLICE jackets. Both were armed and one of them had a TSA badge. One of them told me to get my feet off the seat

WTF though?

EDIT: [Original post](http://www.reddit.com/r/SaltLakeCity/comments/1cy1sa/tsa_on_courthouse_trax_platform_just_now_anyone/)

EDIT 2.0: [UTA's response to my tweet](https://twitter.com/RideUTA/status/327451547439095808)",self,t5_2r7ac,1366905697.0,,,True,http://www.reddit.com/r/SaltLakeCity/comments/1d37u2/just_got_my_pass_checked_on_trax_by_a_single_uta/
1366896274.0,1d2x4b,"Provo city council approves Google fiber, but not sure where all their fiber is.",sirgregero,35,3,http://www.reddit.com/r/SaltLakeCity/comments/1d2x4b/provo_city_council_approves_google_fiber_but_not/,http://b.thumbs.redditmedia.com/kG5mZP_uTcREznU1.jpg,
1366564205.0,1ct30t,Have any of you heard about the Mummies exhibit in the Leonardo?,TehTrollord,44,11,30,"Just went to see it this morning

Thoughts?",self,t5_2r7ac,False,,,True,http://www.reddit.com/r/SaltLakeCity/comments/1ct30t/have_any_of_you_heard_about_the_mummies_exhibit/
1366208167.0,1cj70s,"Apparently Provo City is set to announce something ""epic"" at 1:30 today. Predictions range from mundane (Chik-fil-A, Cheesecake Factory) to earth-shattering (Google Fiber). Stay tuned.",CranialEruption,54,19,http://www.reddit.com/r/SaltLakeCity/comments/1cj70s/apparently_provo_city_is_set_to_announce/,http://b.thumbs.redditmedia.com/RpV6L-qi1M4HbHBy.jpg,
1364516844.0,1b7n5s,Best meal for under $5?,benkulbertis,42,8,64,My friends and I are poor U of U college students and we like to eat on the cheap when we can. Can anyone suggest their favorite meals in downtown and surrounding areas for under or around $5? My favorite that I've discovered so far is Big Ed's $3.75 Burger and Fries. Things similar to this are perfect. Thank you!,t5_2r7ac,True
1359388777.0,17flqy,"Is it just me, or are there far fewer snow plows these days?",Celestro,39,5,http://www.reddit.com/r/SaltLakeCity/comments/17flqy/is_it_just_me_or_are_there_far_fewer_snow_plows/

Throughout the entire trip I didn't see a single plow. Not one. I saw at least 10 accidents

Is there a reason the roads don't get plowed anymore? Did I miss a vote or something?",self,t5_2r7ac,False,,,True,http://www.reddit.com/r/SaltLakeCity/comments/17flqy/is_it_just_me_or_are_there_far_fewer_snow_plows/
1357686290.0,167msf,Some air quality maths...,lukehashj,46,11,14,"    Current air quality = 80 micrograms per cubic meter.
    1 gram = 1
    Current air quality = (80 / 1
    Current air quality = .00008 grams per cubic meter.
    Salt Lake City
    Salt Lake City
    Salt Lake City,000,000 m^3
    Mass of pollutants in SLC = 570,000*.0008 = 502 tons.
    EDIT (missing a zero):
        Mass of pollutants in SLC = 570,000*.00008 = 50 tons.

There are currently 50+ tons (about 100,False,self,t5_2r7ac,1357741613.0,,,t3_167msf
1355846067.0,15209p,Freaking out and worried about moving to Utah,FailedTeacher,44,10,90,"~~I feel really stupid posting this. Couple days ago

~~I've been looking at places, and after I got out just moved in with a friend in the area.~~

~~I've never gotten a place on my own

~~I'm going to be working in draper, so trying to find a reasonable place that is pet friendly seems to be hard.~~

~~I don't really know what type of help I'm asking for

~~Edit: Fuck

~~This is [her

~~2nd Edit: I've been calling all morning and getting really frustrated. If anyone knows something that could help by letting me live with them for a month or two

Update: Looks like James Point Apartments, so I am able to move in with them. Thank you for all the support guys!",,False,self,t5_2r7ac,1356036619.0,,
1346439685.0,z5doh,One big Salt Lake City Photo Gallery,jshultz,50,16,10,,t5_2r7ac,False
1335572179.0,sw4a3,[x-post from r/libertarian] Gun carrying man ends stabbing spree at Salt Lake grocery store,huck_cussler,41,8,19,,t5_2r7ac,False
1332201583.0,r49ew,"Radio West tomorrow (3/20/12):  Neil deGrasse Tyson.  KUER 90.1, at 11AM.",AgedAardvark,41,12,http://www.reddit.com/r/SaltLakeCity/comments/r49ew/radio_west_tomorrow_32012_neil_degrasse_tyson/,http://b.thumbs.redditmedia.com/lDryy2ugp2KdwOaa.jpg,
1324484969.0,nldlx,Shane Company Rage,librarylad22,48,16,30,,t5_2r7ac,False
1317701083.0,l05rs,Reddit SLC! Would you be interested in doing a Meet Up / Private Movie night at Brewvies to Show Support ? ... While having a Kick ass time?,eaglebacon,36,3,30,,t5_2r7ac,True
1317161759.0,ktf99,the GOP's congressional redistricting map has been unveiled. The Gerrymandering is even worse than expected,CEOofEarthMITTROMNEY,35,2,19,,t5_2r7ac,False
1305400226.0,hbe42,Neighborhood Watch sign in my neighborhood. I figured Midvale had more problems than this[xpost from r/pics],node18263652,34,2,24,,t5_2r7ac,False
1375051930.0,1j8nwr,My nerves are fried..,TheSeventhSon7,48,20,44,"I am ticked off and I need to vent.

""Parley's Nature Park"".. better known as ""The Gully"" in my neighborhood.. has become a complete joke.

This place used to be something special

A few years ago they redeveloped the entire area and created a paved path all the way through the park. They destroyed natural vegetation and created fake trails through the once dense-shrubbery. They created rules outlining specific sections of the park where you can have your dog on/off leash (it used to be allowed throughout the park) and they have turned it into fucking lagoon.

Just this afternoon

To top it off

Now I am not one to ever judge a dog based on stereotypes

I ended up picking up my dog and running as the rottweiler continued to attempt to jump up and attack my puppy. Any words I wanted to say to the owners were pointless as my yelling only seemed to antagonize the situation.

What used to be a great childhood memory is now a place I can promise I will never go back. Vent session,False,self,t5_2r7ac,False,,,t3_1j8nwr
1372358481.0,1h718i,"Salt Lake City, 1 of 5 cities with the happiest workers",snowmanvt,41,8,http://www.reddit.com/r/SaltLakeCity/comments/1h718i/salt_lake_city_1_of_5_cities_with_the_happiest/,http://c.thumbs.redditmedia.com/PIuAObF-0hDu4gbP.jpg,
1370390829.0,1forq6,I have a strange... origami... request.,duzio,39,8,14," I'm getting married in about 10  days and our original plan included  having 1000  origami  cranes folded for it.  Sadly  work,  if you've  got the motivation!

 I'm not expecting miracles

 thanks",self,t5_2r7ac,False,,,True,http://www.reddit.com/r/SaltLakeCity/comments/1forq6/i_have_a_strange_origami_request/
1365290738.0,1btmuq,Homeless shelter,Lankhmar,47,12,14,,t5_2r7ac,False
1364914668.0,1bingd,"McEntee: For me (and others), UTA takes too long, costs too much",Baljar,44,27,False,
1363734973.0,1amk1m,GREENbike SLC bike share launches April 8th - Free helmets to annual members,timthomaspsu,39,4,10,,t5_2r7ac,False
1360269538.0,1833am,"Beer Lake City, Tales of a ""Dry"" State
",9,15,http://www.reddit.com/r/SaltLakeCity/comments/1833am/beer_lake_city_tales_of_a_dry_state/,,,False,t5_2r7ac,False
1358182156.0,16k3or,Provo Canyon yesterday right before we got inverted again.,carleverett,37,6,2,,t5_2r7ac,False
1354250672.0,141cfa,Teen shoots self on skybridge near junior high school | ksl.com,caligari87,37,6,27,,t5_2r7ac,False
1353681395.0,13o1yw,Took this photo on Thanksgiving.  Beautiful day!,masterschmo,40,11,3,,t5_2r7ac,False
1351269578.0,124pmr,First snow for Salt Lake,fishwithlegs,45,11,5,,t5_2r7ac,False
1346425352.0,z4yyd,Pete Ashdown (xmission) argues that broadband internet is a fundamental community infrastructure. Others argue that private enterprise will provide given enough financial incentive.,toss_away_999,38,6,15,,t5_2r7ac,False
1344489915.0,xxbyk,Photo of the wildfire out at Camp Williams from Jordan Commons tower in Sandy (xpost from r/pics),deweysmith,34,1,11,,t5_2r7ac,False
1339738317.0,v309q,[Reddit Meetup] - June 23rd - Global Reddit Meetup Day at Sugarhouse Park,cdb,41,10,89,"**Time:** 7:30 PM on Saturday

**Location:** Sugarhouse Park - in this spot =&gt; (https://maps.google.com/maps/ms?msid=216465085101287411675.0004c279f921932ad6749&amp;msa=0)

**Food:** Bring food that you would like to eat

**Drinks:** BYOB

**Activities:** TBD

*****

Last year, so let's **try** *not* to steal one.


See the map link (https://maps.google.com/maps/ms?msid=216465085101287411675.0004c279f921932ad6749&amp;msa=0) to find the exact location within the park.


More details to come. Have at it


-CDB (Chrisby / Chris B. / Crispy)",self,t5_2r7ac,False,,,True,http://www.reddit.com/r/SaltLakeCity/comments/v309q/reddit_meetup_june_23rd_global_reddit_meetup_day/
1333088346.0,rkkqy,Wearing headphones or talking on your cellphone now illegal anywhere near Trax lines.,gthing,40,9,30,,t5_2r7ac,False
1332784096.0,rehd3,Good ol' trusty &amp; reliable San Rafael.,corrincrellin,33,1,13,,t5_2r7ac,False
1332267126.0,r5e2b,The NSA Is Building the Country's Biggest Spy Center in Utah,youaretherevolution,37,6,24,,t5_2r7ac,False
1332019856.0,r18za,"Mods: Can we work to create some *ultimate* ""Where to Eat in SLC"" and ""Where to Live in SLC"" and ""Life in SLC"" threads and permalink them on the side? ",TylerRiggs,39,4,10,"I

Can we work together to create an ultimate resource on different topics like where to live, etc...and permalink them in the sidebar?

EDIT: I see ""Yums"" is actually one of these in the sidebar,False,self,t5_2r7ac,False,,,t3_r18za
1327812279.0,p1d5y,Just got back from the Meetup,Rawrr_dinosaurs,36,7,23,,t5_2r7ac,False
1325826857.0,o51gm,"So, it was pretty cold in Bountiful tonight.",wellsdb,35,5,http://www.reddit.com/r/SaltLakeCity/comments/o51gm/so_it_was_pretty_cold_in_bountiful_tonight/,http://a.thumbs.redditmedia.com/5DJxCb3WnFBh_2sx.jpg,
1323460321.0,n6lic,Missing Huskies in Draper Area,TheBarioth,34,1,18,,t5_2r7ac,False
1322434502.0,mr9yb,"Interesting article from The Economist about Utah's backwards liquor laws, and how they are hurting business in our state. ",DoctorDank,37,3,http://www.reddit.com/r/SaltLakeCity/comments/mr9yb/interesting_article_from_the_economist_about/,http://f.thumbs.redditmedia.com/bE9IZhwfSKzw4INq.jpg,
1314494016.0,jwlyz,Scumbag meetup organizer,Paradox,35,7,6,,t5_2r7ac,False
1305898346.0,hfv5c,Any good neighborhood maps of SLC? (found this on Zazzle),SRSco,35,2,10,,t5_2r7ac,False
1376530488.0,1ke2o9,Here's a decent view of the giant ash cloud spewing from over the Oquirrhs.,Psyker101,40,6,16,,t5_2r7ac,False
1372179094.0,1h1pad,University of Utah student start-up launches new Kickstarter campaign. Practical Meter- help us fund!!!,powerofthepot,48,18,21,,t5_2r7ac,False
1371951453.0,1gvxb4,"""The Mighty 5"" A Commercial Showing Off Utah's National Parks",BantyRooster,35,5,3,,t5_2r7ac,False
1369599910.0,1f3jh4,Anybody know what happened to this guy?,THCTuesdays,36,4,19,"Last night at about 11:30 I witnessed an insane longboard crash, broke at least one arm and looked as if he broke some ribs. The guy was really hurt, sin paramedics. 

Does anybody have a follow up on this guy? His friends seemed pretty fucking medical irresponsible. ",self,t5_2r7ac,False,,,True,http://www.reddit.com/r/SaltLakeCity/comments/1f3jh4/anybody_know_what_happened_to_this_guy/
1368229709.0,1e3n4p,For all you beer lovers: May 13-19 is Craft Beer Week! Here's a list of events,weffey,37,5,13,,t5_2r7ac,False
1367598352.0,1dmkax,SLC Comicon: Is this really the best website they could come up with?,jshultz,43,12,21,,t5_2r7ac,False
1364333871.0,1b2goj,I saw these popup downtown. Anyone plan on using them?,jshultz,45,12,31,,t5_2r7ac,False
1359226629.0,17brfa,What SLC looks like right now...,lukehashj,50,15,9,,t5_2r7ac,False
1353019810.0,139keh,SLC/Utah Cannabis Activism?,GypsyViking,49,18,54,"I am a Cannabis activist from Alaska who now lives in SLC. I want to get back into the scene but I can't seem to find one. There is no NORML chapter in Utah

I'm totally up for starting my own NORML chapter but if there are already groups working legalization,False,self,t5_2r7ac,False,,,t3_139keh
1352848802.0,135ef4,Trying out my new camera! [FIXED],nix8,45,15,15,,t5_2r7ac,False
1345811855.0,yr191,Utah Barcraft Tonight! Nerd Chills!,JimmyDabomb,37,3,25,,t5_2r7ac,False
1338395053.0,uc9yn,Idaho bans Utah's Five Wives Vodka from shelves over label,cangetenough,33,3,5,,t5_2r7ac,False
1336846292.0,tjwir,Just saw this at the Downtown Sheraton. Made me chuckle.,eaglebacon,46,13,23,,t5_2r7ac,False
1332121100.0,r2stv,"Came across this ""BYU Memes"" facebook group today. I think its lameness ruined the internet for me.",TylerRiggs,47,14,13,,t5_2r7ac,False
1331419999.0,qqstx,Electrical storm in Utah. (xpost from r/pics),ObliviousIrrelevance,33,1,6,,t5_2r7ac,False
1324254013.0,nhtu0,"redditgifts is considering a move to SLC, can you help?",kickme444,34,4,http://www.reddit.com/r/SaltLakeCity/comments/nhtu0/redditgifts_is_considering_a_move_to_slc_can_you/

redditgifts is myself and 5days and we currently live in the bay area.  We happen to really enjoy Utah (my parents live in Kaysville) and are considering a move to SLC.  We would need to open a small office in SLC and give redditgifts a nice home there!  We have two major needs that we're hoping we can get any help on (especially from fellow redditors).  Here are our issues:

1. We want to buy a house.  We have been looking in 2 places (upper avenues

2. We have two children ages 8 and 10.  We want them to be in a good school but do NOT need public school.  We currently are in a charter school here in CA which focuses on community and does NOT focus on homework.  We LOVE this school and it is probably the only sticking point in our prospective move to UT.  So

We are also not religious (are atheist) so we don't want to live in happy valley or whatever.  

Any advice or help people could give us would be greatly appreciated!",self,t5_2r7ac,False,,,True,http://www.reddit.com/r/SaltLakeCity/comments/nhtu0/redditgifts_is_considering_a_move_to_slc_can_you/
1320508901.0,m1gwl,Is everyone ready to vote Tuesday?,pruittmckean,38,3,15,,t5_2r7ac,False
1320280511.0,lyd5j,"Meanwhile, after a hike up Millcreek Canyon...",broj1834,38,6,http://www.reddit.com/r/SaltLakeCity/comments/lyd5j/meanwhile_after_a_hike_up_millcreek_canyon/,http://e.thumbs.redditmedia.com/btWBWhtAUVKp0m_d.jpg,
1319682564.0,lqhno,Salt Lake City and Utah rank lowest for income inequality.,92235,37,6,13,,t5_2r7ac,False
1318182205.0,l65xz,I got Occupy SLC on Huffington Post,swankmotron,39,6,12,,t5_2r7ac,False
1309601024.0,iewtx,You know it's summer when you see this...,charlie_p,38,7,4,,t5_2r7ac,False
1302389669.0,gmejy,Lawmaker wants to privatize the sale of liquor,92235,32,0,12,,t5_2r7ac,False
1294400475.0,exuft,I would like to gauge interest in setting up a weekly/monthly gathering/potluck/game night. ,,36,5,20,"I am bored and fairly broke so going to movies or going to the theatre is not really an option. I was just thinking it would be cool if we could get a small and fairly mellow group of people together to play board games drink some wine bring a side dish etc.  
  
I am not thinking anytime in the immediate future just gauging the interest. I was also thinking this would be best at a private residence but my problem is I don't have a place of my own so while I am suggesting it I am a bit of a mooch because I can't supply the location.  
  
Why do I bring this up? I want more social interaction in my life and it seems like that means get shit faced and pass out to many friends. I am getting to old for that. I am however a gay man living in his in laws basement while the husband goes to school (almost done thank god). We are 25 and 27 but we both partied pretty hard in our youths and have settled down.  
  
So yeah if you want to hang out with some other childless couples share good food and drink and play board games chime in.  
  
TLDR: I feel old,False,self,t5_2r7ac,True,,,t3_exuft
1371411810.0,1ggxsr,Man shot in the back of the head during church service in Ogden.,wordofgreen,35,3,15,,t5_2r7ac,False
1359392291.0,17fpk9,It’s Too Bad The Inversion Cleared Out,ghosr,37,8,12,,t5_2r7ac,False
1352127366.0,12o2yp,Lost Dog,qlex,36,8,7,"The dog in the attached picture slipped her leash and run off at the west entrance to Tanner Park. Calling her proved fruitless. So did multiple foot chases and six hour foot search. If you see her

[Photo](http://imgur.com/a9xqA)",self,t5_2r7ac,False,,,True,http://www.reddit.com/r/SaltLakeCity/comments/12o2yp/lost_dog/
1336516654.0,tdohf,UTA Breaks Ground on Sugar House Streetcar Project,optikal801,35,4,24,,t5_2r7ac,False
1331057544.0,qkfhq,Utah State Legislature.,gthing,34,3,6,,t5_2r7ac,False
1329323524.0,pquhe,"New Downtown Harmon's store opens today. If anyone in /r/saltlakecity visits, please post your review!",TylerRiggs,35,5,http://www.reddit.com/r/SaltLakeCity/comments/pquhe/new_downtown_harmons_store_opens_today_if_anyone/,default,
1329263385.0,ppviw,"If you received a traffic ticket around July 2011, you may have a suspended license and warrant - even if you took care of it.",gthing,31,1,http://www.reddit.com/r/SaltLakeCity/comments/ppviw/if_you_received_a_traffic_ticket_around_july_2011/,"" issued warrants

A call the the SLC Justice Court is enough to get the warrant and record cleared

I am currently working through the bureaucracy to get this resolved

If you received a ticket anywhere in the state of Utah 90 days on either side of July 2011 and did traffic school

If you run into this issue please contact me as I am working on getting the attorney general involved to force the state to take care of this issue. 
