created_utc,id,title,author,ups,downs,num_comments,selftext,subreddit_id,is_self
1329960064.0,q1shi,Abstinence only sex-ed has passed the Utah legislature...  idiots....,swankmotron,58,4,33,,t5_2r7ac,False
1318008125.0,l4b3h,"Brewvies, an Update.",eaglebacon,56,7,http://www.reddit.com/r/SaltLakeCity/comments/l4b3h/brewvies_an_update/

(The short of it For those of you unaware

 The manager Andy a friend of mine is really excited on the idea of a little fundraiser/get-gether. The plan at this point is to Contact the makers and studio of the Hangover II and get permission to actually show the movie again with some funny edits for the offending scenes. Like splice in Tom n Jerry clips etc or have some funny crowd participation moment,False,self,t5_2r7ac,False,,,t3_l4b3h
1314886646.0,k1bgl,Gay man attacked outside of club in Salt Lake City,itsalldark,61,9,49,,t5_2r7ac,False
1360363897.0,185rn7,I spotted something remarkable in my yard today...,nixonneckweasel,90,39,12,,t5_2r7ac,False
1359483462.0,17iahe,Pic i took at the Regent open house,quinticus,63,9,6,,t5_2r7ac,False
1349297157.0,10w8to,Sugar House named one of America's 10 Great Neighborhoods.,jshultz,61,11,16,,t5_2r7ac,False
1344823991.0,y4eu1,Right now at the Broadway: 15 Miyazaki animated masterpieces all on 35mm. Aug 3rd – Sept 6th,CEOofEarthMITTROMNEY,56,4,15,,t5_2r7ac,False
1315928666.0,keax0,Logan accident yesterday: Crowd lifts burning car and pull out the motorcyclist at 1 minute,chodeys,54,1,12,,t5_2r7ac,False
1304450759.0,h3dqd,Your tax dollars at work.,pmhacker,54,6,8,,t5_2r7ac,False
1375383818.0,1jigmy,TED is coming to Salt Lake City in September,jonkopp,59,9,16,,t5_2r7ac,False
1372906709.0,1hlzud,"Hi friendly Salt Lakers, I just learned of an ordnance that is useful to know about. You cannot leave a vehicle on the street for more than 48 hours. It will get towed and impounded.",lusingm,59,10,http://www.reddit.com/r/SaltLakeCity/comments/1hlzud/hi_friendly_salt_lakers_i_just_learned_of_an/
No person shall park a vehicle, 1997: Ord. 48-86 § 1, 1986: prior code § 28-3-135)  

I had a motorcycle outside my apartment in the Avenues where I normally park it. I left for a long weekend and found it missing when I returned. I am fairly new here so maybe this is common knowledge. Hopefully someone finds this useful.",self,t5_2r7ac,False,,,True,http://www.reddit.com/r/SaltLakeCity/comments/1hlzud/hi_friendly_salt_lakers_i_just_learned_of_an/
1372440464.0,1h9d0j,My Instagram pic of downtown.,Ceedub260,97,45,11,,t5_2r7ac,False
1372107584.0,1gzrky,Salt Lake police looking for man accused in rape of child.,DominumFormidas,63,12,0,,t5_2r7ac,False
1359050526.0,1778t9,Don't worry. UHP has the freezing rain problem under control.,sgallen43,58,12,15,,t5_2r7ac,False
1358355214.0,16oxcr,"Utah liquor cops back off no-food, no-booze enforcement
     | The Salt Lake Tribune",7,15,http://www.reddit.com/r/SaltLakeCity/comments/16oxcr/utah_liquor_cops_back_off_nofood_nobooze/,,,False,t5_2r7ac,False
1356423054.0,15ex08,DIY-er in Utah ready and willing to get out and help with ANYTHING.,Kavemann,60,7,52,"I'm a former Marine with electronics

I love doing it

PM me with details of your project if you're interested
",self,t5_2r7ac,False,,,True,http://www.reddit.com/r/SaltLakeCity/comments/15ex08/diyer_in_utah_ready_and_willing_to_get_out_and/
1355638591.0,14xjv8,"Well, BreathAdvisor made it to Fox 13 news. Thanks for your constant support, Reddit! PM me for a promo card! ",sah0605,58,32,False,
1347851706.0,1006ix,Last Night,Baljar,55,6,12,,t5_2r7ac,False
1345931327.0,ytonz,I was your bartender yesterday. You guys left me a great tip and this...How did you know? ,amachination,76,24,6,,t5_2r7ac,False
1341605276.0,w58lg,"Fine: $25, Fucks Given: 0, Dicks Told To Eat: 1 bag",EquinsuOcha,63,53

For all of you that don't know


[And here's how I just paid the fine.](http://i.imgur.com/U67IV.jpg)

EDIT:  In case you're wondering why I didn't fight it - if found guilty (of the now $65 fine) ""a court imposed judgment filing fee of $60.00 will be added to the court case.  A judge may also impose attorney fees up to $75.00 and a collection fee of $45.00  A judgment will appear on your credit rating for 8 years"" (that brings the total to $245 for a fucking parking ticket!)

 and

 ""If your complaint is regarding a problem with the way the area is marked, or how you were treated by the officer, the courtroom is not the proper place for those types of complaints and will not be addressed by the judge.  The Hearing Officer or Violations Coordinate will be able to direct you to the proper person...""  

And that's when I got into an argument with the Hearing Officer who said ""that's the law - pay the fine"".",self,t5_2r7ac,1341611741.0,,,True,http://www.reddit.com/r/SaltLakeCity/comments/w58lg/fine_25_fucks_given_0_dicks_told_to_eat_1_bag/
1334084701.0,s2z30,Best Non-Mormon Conference Weekend Story?  I'll start...,AgedAardvark,66,13,47,"I was involved in a musical performance at Abravanel Hall that happened to be taking place the same night as General Conference.  After the concert

""You're awful dressed up for Conference

""I'm a musician

""What

""Something like that.""

Now, but I kept it together.  The train pulled up, and I climbed aboard.  I got off a few stops later, thinking I was in the right place, but I wasn't. I was one stop too soon.  So, there I am, walking down main street in the dark, going past the Wells Fargo building.  My tux shoes hurt

I notice, so I had a hunch what was going on.  

""WOOOOO!"" I yelled.

One of the girls turned and looked at me.  ""There's one, exposing their boobs, and shook them around.  ""Hope you enjoyed Conference!"" one of the yelled.  

TL;DR:  Was having a horrible night,False,self,t5_2r7ac,False,,,t3_s2z30
1329278100.0,pq7pf,Best response to the Mormon Church's posthumous baptisms I have ever heard.,Rusty-Shackleford,82,28,14,,t5_2r7ac,False
1374431050.0,1irf5z,"The movie ""Sandlot"" celebrates its 20th anniversary in Salt Lake City. Where have the last 20 years gone....",jsucese,58,9,8,,t5_2r7ac,False
1372720166.0,1hgjgi,Terrible parking meters failing under terrible heat.,pashdown,60,9,16,,t5_2r7ac,False
1366823920.0,1d0rme,Best Ghost Towns in Utah?,spectacularspecimen,54,8,29,"Looking to shoot some photos and explore some rad ghost towns in Utah. Anyone know of any?
What are the best? 
Where are they located?

You all are awesome! ",self,t5_2r7ac,False,,,True,http://www.reddit.com/r/SaltLakeCity/comments/1d0rme/best_ghost_towns_in_utah/
1365087418.0,1bnwap,If you see box elder bugs kill them.,corndogeater,76,25,65,"Especially if they are fucking. Each one you kill will prevent 10,self,
1364415362.0,1b4qih,In my drunken stumbling downtown I ran into this piece of poetry.,Killhouse,70,21,3,,t5_2r7ac,False
1364313742.0,1b1plc,This shady water deal makes me a little sad.  Here's a pic from just yesterday of me riding through the West Desert.,carleverett,65,18,12,,t5_2r7ac,False
1355425796.0,14srlx,Utah Tops Forbes 2012 List Of The Best States For Business [x /r/business],ChrisMill5,59,11,57,,t5_2r7ac,False
1345056923.0,y9x0u,"At the Gateway, xpost from WTF",ImPigBoT,58,10,http://www.reddit.com/r/SaltLakeCity/comments/y9x0u/at_the_gateway_xpost_from_wtf/,http://e.thumbs.redditmedia.com/3Qi1zrrjMu__mnPF.jpg,
1340289227.0,vdsbc,90 new restaurant liquor licenses created in special session,SlumpBustin,57,5,9,,t5_2r7ac,False
1335491483.0,sulje,"Both Jim Matheson and Jason Chaffetz voted for 
CISPA ಠ_ಠ",10,6,http://www.reddit.com/r/SaltLakeCity/comments/sulje/both_jim_matheson_and_jason_chaffetz_voted_for/,,,False,t5_2r7ac,False
1322697861.0,mvee4,"X-post from r/pics- Who is this mysterious person, seen on and near the University of Utah?",kpal,57,4,http://www.reddit.com/r/SaltLakeCity/comments/mvee4/xpost_from_rpics_who_is_this_mysterious_person/,http://c.thumbs.redditmedia.com/FRx5qQaNBOSkEpZ8.jpg,
1314575905.0,jxff8,Scumbag Utah lawmakers,TylerRiggs,56,9,2,,t5_2r7ac,False
1375292851.0,1jfnkb,Anyone else seen this chrome plated Lotus around SLC?,jshultz,57,10,32,,t5_2r7ac,False
1372601153.0,1hd4yx,"Found a lost dog, help?",DayGlowBeautiful,61,13,http://www.reddit.com/r/SaltLakeCity/comments/1hd4yx/found_a_lost_dog_help/,http://e.thumbs.redditmedia.com/sEbymN-1-To0rsBp.jpg,
1369303533.0,1ew8pm,"Hey, let's be friends.",ordinaryhomechef,61,13,http://www.reddit.com/r/SaltLakeCity/comments/1ew8pm/hey_lets_be_friends/

I'm a 21 year old lesbian in a three year relationship with my lady. I love Doctor Who and Sherlock and pretty much any BBC show. Also Futurama. I read quite a bit, but no drunken escapades for me, I'd rather sit at home with some friends and gab the night away. 

So anyway

Edit: Whoa lots of replies. Woot!",self,t5_2r7ac,1369333987.0,,,True,http://www.reddit.com/r/SaltLakeCity/comments/1ew8pm/hey_lets_be_friends/
1368477856.0,1e9nj4,Moochie's vegetarian sandwich actually cooked with meat,dicksfish,70,23,114,,t5_2r7ac,False
1363973389.0,1at5y7,Gov. Herbert vetoes constitutional carry bill,maestro-sartori,55,5,31,,t5_2r7ac,False
1342567625.0,wq9ds,"Cross from r/WTF. In Ogden one of you guys is hanging out with a local mountain goat heard, dressed as a goat, poorly.",BadDadWhy,56,7,False,
1336671182.0,tgrdq,Twilight Concert Series has been posted!,angryasiancrustacean,55,9,37,,t5_2r7ac,False
1317499003.0,kxq59,I made this sillyness in response to Brewvies DABC Violation,eaglebacon,57,7,4,,t5_2r7ac,False
1375809049.0,1jtlzd,One bike thief is off the streets and $4K stolen bike recovered.,emdubl,53,9,5,,t5_2r7ac,False
1373766576.0,1i91un,Rainbow after tonight's storm,abby89,58,9,4,,t5_2r7ac,False
1371490244.0,1gizfe,She Makes Me So Proud! Miss Utah Gives an Insightful Answer on Gender Inequality in America.,Phlair,72,28,32,,t5_2r7ac,False
1370876492.0,1g1q1u,Fixed Link: Sunset at Rio Tinto Stadium on 6/1/13,aj12to32,52,7,8,,t5_2r7ac,False
1369352791.0,1exs02,Found this in the bathroom at a bar... Which bar you ask? Me too! Can anybody remind me where I was? Bar hopping is hard!,chillsquee,60,13,7,,t5_2r7ac,False
1368669757.0,1efb8g,Have you ever seen such a magnificent rainbow?,PanzerPhoto,62,14,7,,t5_2r7ac,False
1368147819.0,1e1g06,This is...the best barbershop... in salt lake.,quickhorn,63,13,40,http://i.imgur.com/fiei6E5.jpg,t5_2r7ac,True
1366256417.0,1cl1bq,Comcast internet speeds in Provo after the Google Fiber announcement.,DawildWest,68,18,28,,t5_2r7ac,False
1365616537.0,1c2rtw,Comprehensive Utah Concert Calendar,justinpslc,58,10,19,,t5_2r7ac,False
1358182128.0,16k3nj,"Rather then compete with the amazing SLC pics, I give you the bad side. ಠ̯ಠ",sidetrak,53,9,http://www.reddit.com/r/SaltLakeCity/comments/16k3nj/rather_then_compete_with_the_amazing_slc_pics_i/,http://b.thumbs.redditmedia.com/BPlmIFH1ypbJBEGm.jpg,
1353553350.0,13lofc,SLC sunset 11-20-2012.,rebeccamck26,55,8,5,,t5_2r7ac,False
1343374657.0,x8kq2,I made a special postcard for Prime Minister David Cameron!  I hope he likes it!,TheConstable,62,18,16,,t5_2r7ac,False
1342549632.0,wppdt,And it's only barely used..,fart_joke,56,9,3,,t5_2r7ac,False
1337887751.0,u37zr,Snow White &amp; The Hunstman (x-post from /r/pics),gibbawho,63,18,4,,t5_2r7ac,False
1314855968.0,k11dy,The Forever Alone Trax Seat,chriswithac,58,11,9,,t5_2r7ac,False
1376508071.0,1kd906,Hate mongering Utah Attoreny General: Utah: State has ‘sovereign’ right to bar same-sex marriages,shopvavavoom,68,23,17,,t5_2r7ac,False
1371520070.0,1gk2zz,"Some beach, in UT",that1semiGoodcomment,57,15,http://www.reddit.com/r/SaltLakeCity/comments/1gk2zz/some_beach_in_ut/,http://d.thumbs.redditmedia.com/WlNSGr98LSBwwh2u.jpg,
1370973367.0,1g4w40,"St. George man rapes unconscious woman, claiming that she was cold and he was using his penis to warm her",swankmotron,49,3,http://www.reddit.com/r/SaltLakeCity/comments/1g4w40/st_george_man_rapes_unconscious_woman_claiming/,http://b.thumbs.redditmedia.com/kG5mZP_uTcREznU1.jpg,
1370746556.0,1fyn12,Great night at a Bees game!,TheBird47,62,14,8,,t5_2r7ac,False
1368332577.0,1e621c,Has anyone seen the new train in South Jordan?,sourburrito,54,10,4,,t5_2r7ac,False
1364925260.0,1bj1na,'Mountain Man' captured in Emery County,maestro-sartori,58,8,11,,t5_2r7ac,False
1361555770.0,1915ze,Traffic SB was *jacked* this morning. This is why. I hope he made it.,veruus,56,12,40,,t5_2r7ac,False
1360207195.0,181jq9,I don't know if Capt. Planet and the team would be able to see us through all this wonderful pure smog,ViceAdmiral,57,12,5,,t5_2r7ac,False
1359177762.0,17aw7o,My lungs hurt. ,Ceedub260,76,30,31,,t5_2r7ac,False
1356389303.0,15e7ur,"New tattoo done by Austin at Heart of Gold Tattoo, SLC",alpharudy,66,21,http://www.reddit.com/r/SaltLakeCity/comments/15e7ur/new_tattoo_done_by_austin_at_heart_of_gold_tattoo/,http://e.thumbs.redditmedia.com/OcjelUVstxzgkCav.jpg,
1348804050.0,10lpbr,Trax evacuated from bomb threat (Breaking),derdeutschbag,53,9,13,,t5_2r7ac,False
1341075866.0,vuhpk,Mormon Martini [x/post funny],paxanimus,68,20,6,,t5_2r7ac,False
1338829570.0,ukg8r,"Salt Lake City moves from 43 to 26th, in the list of best bike cities in America. ",skiierman,54,4,http://www.reddit.com/r/SaltLakeCity/comments/ukg8r/salt_lake_city_moves_from_43_to_26th_in_the_list/,http://b.thumbs.redditmedia.com/Fk9fU4FP2i0eNQKm.jpg,
1327722344.0,p0380,"Saw this at my local sushi shop. Overheard girl behind me say, ""isn't that the stupid game your boyfriend is always playing""",bstockton,55,9,http://www.reddit.com/r/SaltLakeCity/comments/p0380/saw_this_at_my_local_sushi_shop_overheard_girl/,http://f.thumbs.redditmedia.com/iYJZ3aJx948i8g55.jpg,
1322435842.0,mrarq,Salt Lake Cityscape from Library Panorama,ldsgems,48,2,23,,t5_2r7ac,False
1313536485.0,jkzmv,Scumbag Twilight Concert Series Attendee. ,beardedjack,51,3,9,,t5_2r7ac,False
1375806137.0,1jti0l,My faith in humanity restored,Rawrr_dinosaurs,61,17,10,,t5_2r7ac,False
1369879215.0,1fb64t,Donut Falls. Little Gem up Big Cottonwood Canyon.,vawn,50,7,10,,t5_2r7ac,False
1365269109.0,1bsypp,What is your favorite SLC easter egg?,undead_carrot,58,12,72,,t5_2r7ac,True
1364854642.0,1bgp7e,"Salt Lake judge arrested for distributing Oxycodone, police say",konkeydong,53,11,http://www.reddit.com/r/SaltLakeCity/comments/1bgp7e/salt_lake_judge_arrested_for_distributing/,http://d.thumbs.redditmedia.com/EO3r1Wwk7a0MVRZ3.jpg,
1364570731.0,1b8uqv,Prominent Utah gun lobbyist Clark Aposhian's AR-15 rifle stolen from car.,corrincrellin,54,10,18,,t5_2r7ac,False
1349639780.0,113msu,Saw this in the women's restroom at Cheers to You--made me smile!,CosmicOneness,61,19,11,,t5_2r7ac,False
1347775626.0,zymvn,"Hey BYU, apparently 3 chances to take the win isn't enough. Head south, see ya later.",backeast_headedwest,76,31,False,
1347349148.0,zp6j1,"Some of my pics from the undie run, crosspost from /r/pics I am gay so I gave the guys a bit more attention, probably enough guys there taking pictures of the girls anyway.",,66,5,False,
1346781180.0,zcgsq,Google can understand the Utah accent.,garhole,54,12,9,,t5_2r7ac,False
1346106827.0,yxf87,Do you think this is a game?,TheBird47,76,27,5,,t5_2r7ac,False
1344477561.0,xx013,The (Latest) Eagle Mountain Fire as Viewed from West Valley.,ElectroHouseIsDead,47,4,10,,t5_2r7ac,False
1343869411.0,xjdfx,"Is your birthday September 12, 1983 and were you adopted?   
If so,59,14,13,http://www.reddit.com/r/SaltLakeCity/comments/xjdfx/is_your_birthday_september_12_1983_and_were_you/,"26 years into my life and my mom tells me I have an older brother that she gave up for adoption.  
  
If anyone has this birthday and is adopted OR knows someone with that situation,False,self,t5_2r7ac,False,,,t3_xjdfx
1323969264.0,ndyth,My laser pointer in that fog last night,sazkion,52,5,8,,t5_2r7ac,False
1298400046.0,fqg2y,UT Hero: Tim is facing ten years in prison for derailing an illegal sale of public land from Bush administration to private oil developers.,jasno,50,5,6,,t5_2r7ac,False
1370659883.0,1fwmle,Anti-PRISM/domestic spying rally at State Capital (7/12/2013)(EFF),todaywasawesome,58,16,51,"On Wednesday **June** 12th at 3pm

[Join us on Facebook](https://www.facebook.com/RallyAgainstPrism) - (Yes we realize the irony)

**Read up on domestic spying**

* [The NSA and FBI Admit to Scanning Emails – Politico.com](http://www.politico.com/story/2013/06/report-nsa-fbi-have-accessed-internet-companies-emails-92376.html)

* [EFF Timeline of Government Privacy Violations – EFF.org](https://www.eff.org/sites/default/files/AT%26T%205-18-12.pdf)

* [NSA Indiscriminately Taps Verizon Call Metadata – Huffpo](http://www.huffingtonpost.com/2013/06/06/verizon-nsa-surveillance_n_3395925.html)

* [What is PRISM? – Gizmodo.com](http://gizmodo.com/what-is-prism-511875267)

**UPDATE: The rally is THIS wednesday (June), it should say 6/12/2013, not 7/12/2013.

**UPDATE 2:** We'll be meeting at the south stairs of the Utah State Capital. 
",self,t5_2r7ac,1370902672.0,,,True,http://www.reddit.com/r/SaltLakeCity/comments/1fwmle/antiprismdomestic_spying_rally_at_state_capital/
1366393558.0,1cor7q,Kennecott landslide could be largest in mining history,svenskt,48,6,16,,t5_2r7ac,False
1363059289.0,1a4l22,(Update) House strikes down tax on e-cigarette  ,Strongworks,54,7,3,,t5_2r7ac,False
1359071629.0,1780pt,"""Utah Winter Freezing Rain"" People slipping all over campus in Utah",TheBird47,51,9,3,,t5_2r7ac,False
1358015682.0,16g38w,"Went snowshoeing at Liberty Park this morning, not sure the snowshoes helped.",weffey,53,9,http://www.reddit.com/r/SaltLakeCity/comments/16g38w/went_snowshoeing_at_liberty_park_this_morning_not/,http://a.thumbs.redditmedia.com/iiMIGNY1X-N19w5Z.jpg,
1351625325.0,12cqiv,"Missing person, last seen in the Millcreek area",Tech7C9,52,7,http://www.reddit.com/r/SaltLakeCity/comments/12cqiv/missing_person_last_seen_in_the_millcreek_area/

People are currently being asked to search their yards, please call the Unified police Department at : 801-743-7000

The family have put up a blog with current status on the search and what you can do to help

[Find Fritz Helland](http://helpfindfritz.blogspot.com)

Latest [News article](http://www.deseretnews.com/article/865565564/Family-of-missing-Millcreek-man-expresses-gratitude-concern.html)

Hope there will be something new soon.
",self,t5_2r7ac,1351627586.0,,,True,http://www.reddit.com/r/SaltLakeCity/comments/12cqiv/missing_person_last_seen_in_the_millcreek_area/
1350657273.0,11qy6c,Dunkin' Donuts coming to SLC next year. ,Djbabybokchoi,52,7,32,,t5_2r7ac,False
1340572593.0,vjf7f,How it feels walking around downtown this week.,Glitchsbrew,60,16,12,,t5_2r7ac,False
1338055928.0,u685s,Found this Downtown today. Has anyone else stumbled across this gem?,FAGS_DRINK_COCA_COLA,55,11,9,,t5_2r7ac,False
1335204256.0,sohoz,Homocidal Lunatics Setting Up Deadly Booby-Traps on Utah Hiking Trails.,gthing,56,12,17,,t5_2r7ac,False
1330539582.0,qbm2l,"New anti-photography bill close to passing! The bill is so broad, anyone ""taking photographs on public lands"" could be prosecuted.",ldsgems,47,2,http://www.reddit.com/r/SaltLakeCity/comments/qbm2l/new_antiphotography_bill_close_to_passing_the/,http://d.thumbs.redditmedia.com/msrZZwptXM58urkE.jpg,
1317854734.0,l28uf,Scumbag OSLC!,cbween,53,9,11,,t5_2r7ac,False
1314809131.0,k0cbo,"Utah Sen. John Valentine on Radio From Hell talking about liquor stores, ""Zion Curtain"" derp derp derp",TylerRiggs,49,2,http://www.reddit.com/r/SaltLakeCity/comments/k0cbo/utah_sen_john_valentine_on_radio_from_hell/,http://thumbs.reddit.com/t3_k0cbo.png,
1311285995.0,iw8uy,Space Shuttle Atlantis snapped a pic of us on her final flight.,corrincrellin,46,3,16,,t5_2r7ac,False
1376324781.0,1k7qdu,I was robbed 8/10. Please help me find my stuff. Reward offered!,nuixy,50,4,46,"On Saturday my husband and I spent the afternoon at the movies and when we returned home we discovered the garage door open


2006 15"" MacBook Pro (W86435DUW0H)

2009 11"" MacBook Air (Serial Currently Unknown)

[Sony DSC-WX150 Digital Camera] (http://imgur.com/YAmraPQ) (6564012)

[Halo 4 Xbox] (http://i.imgur.com/MQCVCkl.jpg) (253540223643)

4 xbox controllers (2 Halo

[Xbox Game Case with Games] (http://i.imgur.com/03fIymn.jpg)

[Big Jambox] (http://imgur.com/RJw9LMx.jpg) (J2011229129E7D1)

[Women's Camelbak with 3L Bladder] (http://imgur.com/karDR0Q.jpg)


The MacBook Pro was able to be tracked to a triplex in the lower aves. One of those units is empty


**$500 reward for the return of the decade of personal photos and personal documents on the laptops and the years of saved games on the xbox and the USB drive connected to it.**",self,t5_2r7ac,False,,,True,http://www.reddit.com/r/SaltLakeCity/comments/1k7qdu/i_was_robbed_810_please_help_me_find_my_stuff/
1373129890.0,1hr732,Took this panoramic on top of Grandeur Peak! Such a great morning!,GET-WEIRD,57,12,3,,t5_2r7ac,False
1372458648.0,1ha0aj,"Some Shit Bird Stole my phone and has it stored at storage PLUS Self Storage, wut do??? I already emailed the storage place",roblatham90,60,20,http://www.reddit.com/r/SaltLakeCity/comments/1ha0aj/some_shit_bird_stole_my_phone_and_has_it_stored/,http://e.thumbs.redditmedia.com/M4vyaFF88dnDTwFj.jpg,
1353354340.0,13grfr,A mysterious sticker keeps showing up on my ex-wife's license plate in the middle between the numbers (Utah). Would appreciate an explanation.,toinfinitiandbeyond,57,13,40,"EDIT3: The mystery has been solved!  My ex and her mother took their cars to be waxed at Super Sonic Car Wash.  We called Super Sonic in Orem and they confirmed that they do indeed put these little stickers on your license plate when you get your car waxed.  They also said that they've had no complaints about it.  I think they haven't had any complaints because people have no idea where these stickers came from.

I originally posted this in AskReddit but no one seems to have any idea what these stickers are for.

My ex-wife informed me about a strange thing that keeps happening to her and her family's cars. A strange little sticker keeps getting placed on their license plates. I've noticed other cars on the freeway with similar stickers as well.

She doesn't live in an apartment or park in any time limited lots.

Here's a photo of her mothers plate with a ""2"" sticker in between the numbers on her Utah License Plate.
Photo http://i.imgur.com/tefiI.jpg?1

I found another car in SLC that has similar stickers http://i.imgur.com/MwYtb.jpg

She claims she's contacted the DMV and they have no clue what the sticker is or where it could be from.

The little sticker gets placed in between the numbers on their plates.

I would really appreciate it if anyone could solve this mystery for her.

EDIT: One of my friends was at the DMV earlier today and they said that Super Sonic Car Wash might be putting them on but I can't imagine what the purpose of that would be.

EDIT2: The same friend that called the DMV called Super Sonic Car Wash and confirmed that they put a sticker like this on your plate when you have your car waxed.  With that being said I can't imagine my getting her car waxed because it is super oxidized and she's dirt poor.  I am,,False,self,t5_2r7ac,1353424516.0,,True
1346816381.0,zdiq4,Ibapah...,corrincrellin,47,5,3,,t5_2r7ac,False
1343403047.0,x91e1,"As of 2002, ""Salt Lake City became the most populous area ever to have hosted the Winter Olympics...""",BeatDigger,51,10,http://www.reddit.com/r/SaltLakeCity/comments/x91e1/as_of_2002_salt_lake_city_became_the_most/,http://f.thumbs.redditmedia.com/zvTv5uM4ZzXRHoCk.jpg,
1342757136.0,wuur2,Goatman roaming around. This guy is awesome.,hsraffety,51,5,2,,t5_2r7ac,False
1341710757.0,w7b8o,My friend was brutally attacked at Maxwell's early this morning. He lost 2.5 litres of blood. Can you help us catch the suspect?,wellsdb,51,8,27,"My friend Jake was brutally attacked at Maxwell's

Here is what he posted on Facebook:

---------------------------------------------------------------
Hey guys. i wanted to let you know i was assaulted last night and am now at the u of u hospital. I lost a lot of blood but im stable for now. The police are looking for the guy that did it so i am posting pictures online so people will help me find him.

The police are still actively looking for the guy who cheap shotted me with a glass. Apparently the bouncers at Maxwell helped him get away. I tried to find him but lost over 2 ltrs of blood in the process and have racked up thousands of dollars in medical bills so far. He had friends at the club who didn't say anything. He is white

Around 12:00 last night, he said yeah. As i assessed the situation he immediately slammed his cocktail glass into the side of my head.

The guy that did this was white

---------------------------------------------------------------
The suspect was in his mid-to-late twenties and around six feet tall. If anyone has information that could help police nab the guy
",self,t5_2r7ac,False,,,True,http://www.reddit.com/r/SaltLakeCity/comments/w7b8o/my_friend_was_brutally_attacked_at_maxwells_early/
1334252072.0,s6gyh,When you really need something downvoted to oblivion... ,87StickUpKid,89,42,43,"there's no better place to post than r/saltlakecity. 

Someone else brought this point up recently and after some thought I couldn't agree more. Look around r/SaltLakeCity, there's hardly any posts here and I'm sure it's because people know as soon as you post something it gets pile-drived. Sorry, but it's getting a little ridiculous.

*Edit: It seems my comments are getting downvoted to hell and removed by the moderators. Soon I will be gone from this subreddit. I regret nothing. Remember me as I was...",self,t5_2r7ac,True,,,True,http://www.reddit.com/r/SaltLakeCity/comments/s6gyh/when_you_really_need_something_downvoted_to/
1317696800.0,l03c0,Another Utah hidden gem: Notch Peak.,corrincrellin,43,1,10,,t5_2r7ac,False
1314204960.0,jt12i,A 'Godless' Billboard in Mormonland,UndeadBarber,49,2,22,,t5_2r7ac,False
