created_utc,id,title,author,ups,downs,num_comments,selftext,subreddit_id,is_self
1372204764.0,1h2nur,Salt Lake Tribune: Failed talks derailed KCPW’s affiliation with NPR,4blockhead,27,2,6,,t5_2r7ac,False
1371747026.0,1gqitm,"Ranking: Salt Lake City 2nd best place for those young, single and broke",konkeydong,26,1,http://www.reddit.com/r/SaltLakeCity/comments/1gqitm/ranking_salt_lake_city_2nd_best_place_for_those/,http://b.thumbs.redditmedia.com/kG5mZP_uTcREznU1.jpg,
1371656416.0,1gnsjc,"So, I made fun of 'being proud' of Miss Utah yesterday. I'm eating my words. She was hilarious last night on Kimmel!",Phlair,34,11,http://www.reddit.com/r/SaltLakeCity/comments/1gnsjc/so_i_made_fun_of_being_proud_of_miss_utah/,http://e.thumbs.redditmedia.com/N_gHwf1z9njYclZj.jpg,
1370448572.0,1fq815,Cool article in the Trib about the potential of SLC's grid system,slcpasta,29,7,8,,t5_2r7ac,False
1369516828.0,1f1r6r,GMO protests at the capitol,Javrixx,36,13,36,,t5_2r7ac,False
1369435582.0,1ezzqf,beautiful day for a walk,wistan,27,6,8,,t5_2r7ac,False
1365910495.0,1cb3kc,"Guys, what are your favorite hiking/meditation/camping/otherwise outdoorsy spots in or around the Valley?",shelbzaazaz,29,4,http://www.reddit.com/r/SaltLakeCity/comments/1cb3kc/guys_what_are_your_favorite/
Also,False,self,t5_2r7ac,False,,,t3_1cb3kc
1365108019.0,1bop2d,Utah cancer patient searching for miracle bone marrow match. Testing drive on April 14th in Holladay.,hemmicw9,37,14,1,,t5_2r7ac,False
1364631695.0,1balne,I am getting conflicting information. Do I or do I not need a front licence plate in Utah?,Riplakish,28,3,28,,t5_2r7ac,True
1360959040.0,18ljj1,Feb 23rd Monthly Meetup at La Frontera!,McMoop,29,7,27,"It's that time again!

Saturday

They have good nachos.",self,t5_2r7ac,False,,,True,http://www.reddit.com/r/SaltLakeCity/comments/18ljj1/feb_23rd_monthly_meetup_at_la_frontera/
1357400174.0,160db9,"Lost Cat - Jasper, Liberty Park Area",lukehashj,33,8,http://www.reddit.com/r/SaltLakeCity/comments/160db9/lost_cat_jasper_liberty_park_area/,http://b.thumbs.redditmedia.com/ni_9ggcOFYYprMYs.jpg,
1353214280.0,13dwnp,"[xpost from Assistance] I'm a 1st grade teacher in Bountiful, my students asked for more science experiments. Can you help?",michann00,24,3,http://www.reddit.com/r/SaltLakeCity/comments/13dwnp/xpost_from_assistance_im_a_1st_grade_teacher_in/, if you use the code INSPIRE
http://www.donorschoose.org/project/she-blinded-me-with-science-and-enginee/804888/?verify=-235751322&amp;challengeid=37274",self,t5_2r7ac,False,,,True,http://www.reddit.com/r/SaltLakeCity/comments/13dwnp/xpost_from_assistance_im_a_1st_grade_teacher_in/
1351209589.0,123gt1,The approaching storm.,Hector_gone_bad,28,4,10,,t5_2r7ac,False
1351172726.0,122cfl,Damn.,Reinasrevenge,37,14,11,,t5_2r7ac,False
1348377432.0,10bxqv,"Hey guys, normally I wouldn't ask this, but my ride bailed, and I'm stuck downtown near gateway. Is anyone willing to give my friend and I a ride? I can give you gas money.",ColLingusPoonhammer,9, and why we are here.

I am an 18 year old male

I work at In The Venue, Hatebreed was headlining, our ride to the venue didn't like Hatebreed so he left, and now we are here, downtown, trying to get to the Cottonwood heights area.

Edit 2: I swear to dog that we will not rape you

Edit 3: Probably should have done this earlier,,False,self,t5_2r7ac,1348395767.0,,True
1348263292.0,109pf5,Big Cottonwood to Park City via Guardsman Pass,evolj,25,2,8,,t5_2r7ac,False
1346722245.0,zb8si,Met a redditor from Minnesota at the Green Pig on Friday night. We bar/club hopped all night long.,furmat60,30,9,14,,t5_2r7ac,False
1343402920.0,x919p,Colbert always says it best.,iheartnickleback,26,2,4,,t5_2r7ac,False
1343099583.0,x1xrj,"Pictures from a recent hike to Lake Mary, Martha, and Katherine",TheLatestDanceCraze,24,13,False,
1340656557.0,vl9pu,American Red Cross issues emergency call for blood donors,jortr0n,26,3,14,,t5_2r7ac,False
1340513951.0,vii6r,"So, I'm gonna be the first one to say it. The r/saltlakecity meetup was Awesome!",CatKicker69,29,6,http://www.reddit.com/r/SaltLakeCity/comments/vii6r/so_im_gonna_be_the_first_one_to_say_it_the/

Met a ton of new people and had a blast.

You guys rock.

That is all.

EDIT:  I was the short,,False,self,t5_2r7ac,1340553488.0,,True
1339614172.0,v09ps,"1Gbps speeds offered on Utopia now, but for $300/month",infinityprime,30,7,http://www.reddit.com/r/SaltLakeCity/comments/v09ps/1gbps_speeds_offered_on_utopia_now_but_for/,default,
1339605644.0,v01cg,"E.S. Glover's intricate map/illustration of Salt Lake City as it appeared in 1875. Great detail; 65+ megapixel image. [9,539px × 6,999px]",bigmapblog,29,4,False,
1338869922.0,uljxv,"Sure, they're the Deseret News, but if they liked my book, they can't be all bad... (though they sure are fond of typos...)",swankmotron,2,,False
1328756363.0,ph9rh,Alright.... Who is the redditor who works at Oh Sushi on 33rd?,RTLucent,29,8,21,,t5_2r7ac,False
1323468902.0,n6rdy,Show a little love for my favorite curry place.,AfterSpencer,27,4,19,,t5_2r7ac,False
1321898148.0,mkd3j,How about some nostalgia?,CEOofEarthMITTROMNEY,23,0,13,,t5_2r7ac,False
1321376118.0,md896,Driving through West Valley when I smelled something...,GonzoThompson,31,10,4,,t5_2r7ac,False
1317143225.0,kt42m,Killyons Canyon is looking might perdy right now!,corrincrellin,24,2,3,,t5_2r7ac,False
1314594423.0,jxofw,Anybody else watching this cool lightning storm?,,23,1,20,"If so,self,
1314312792.0,juiq4,TIL That Harry and Lloyd's apartment building from Dumb and Dumber is smack dab in the middle of downtown SLC.,vaselineviking,25,2,25,,t5_2r7ac,False
1312111484.0,j4rxi,"I am a Personal Chef, come to my house and I will cook you dinner! (Free for redditors)",Chefwil,30,7,http://www.reddit.com/r/SaltLakeCity/comments/j4rxi/i_am_a_personal_chef_come_to_my_house_and_i_will/

Check out my [website](http://www.chefgreer.com)",self,t5_2r7ac,True,,,True,http://www.reddit.com/r/SaltLakeCity/comments/j4rxi/i_am_a_personal_chef_come_to_my_house_and_i_will/
1298512417.0,frh5g,"**Reddit Meet Up** 2/26 @ 8 pm @ Sugar House BBQ--Look for the Alien! Minors welcome. Reservation is for ""Reddit.""",mllestrong,26,3,24,,t5_2r7ac,False
1297904293.0,fmuy8,**Reddit Meet Up** February 26th @ 8,mllestrong,23,1,46,"The location is up for grabs

~~I suggest [The Original Pancake House](http://www.originalpancakehouse.com/) in Sugarhouse.~~ Closes at 3

Options: The Pie or Big Ed's
(Any others?) Neither of these places allow reservations,False,self,t5_2r7ac,True,,,t3_fmuy8
1376061452.0,1k12qi,Advice for a friend (F/26) who just moved to Utah?,itwontbelongitude,28,7,20,"Hey /r/SaltLakeCity! I have two questions

My best friend (F/26) and her husband just moved to Layton, music, art, and museums. It's been a bit difficult for her to find things that she likes to do to keep her busy. Can anyone suggest some things for them to do? What about in any of the college towns nearby?

She's also concerned about job prospects. She graduated with high honors in media studies and worked for a pretty large digital media center where we went to school (U of Illinois). Are there many editing or video production jobs in the vicinity? 

Thanks!

",self,t5_2r7ac,False,,,True,http://www.reddit.com/r/SaltLakeCity/comments/1k12qi/advice_for_a_friend_f26_who_just_moved_to_utah/
1375706896.0,1jqj7t,Best place to skinny dip in SLC area,TheSiege82,29,6,32,"I was thinking blackridge reservoir in Herriman and Murray Park,self,
1374795193.0,1j292j,"Stolen 10 speed schwin road bike, red, from my house in sugar house. It's my main form of transportation. If you see one like it around please message me.",joshthewaster,25,7

I have reported it to the cops but I bet it got dumped someplace. It's not worth much but means a lot to me. 

Taken from a house between Westminster and sugar house park.

Edit here is the only pic I have http://imgur.com/9k6aMqy",self,t5_2r7ac,1374881514.0,,,True,http://www.reddit.com/r/SaltLakeCity/comments/1j292j/stolen_10_speed_schwin_road_bike_red_from_my/
1374347679.0,1ipjas,"Car broken into, musical equipment stolen.",ChrisMill5,22,1,http://www.reddit.com/r/SaltLakeCity/comments/1ipjas/car_broken_into_musical_equipment_stolen/, and a black briefcase full of cables and pedals,False
1373244481.0,1hu0ak,Hiked out to Sunset Peak by Alta. Incredible view.,corezero,28,8,6,,t5_2r7ac,False
1372119947.0,1h0723,Sunset photo from The Living Room (6/23/2013) with time lapse gif in comments.,casiopiano,26,3,4,,t5_2r7ac,False
1371251100.0,1gdbdl,[Meetup] June 15th is Global reddit Meetup Day!,weffey,28,4,20,,t5_2r7ac,False
1370817404.0,1g09oa,"It was a bit masochistic to bike up Jacob's Ladder at noon, but the view and downhill on Rush were worth it",puhnitor,28,6,http://www.reddit.com/r/SaltLakeCity/comments/1g09oa/it_was_a_bit_masochistic_to_bike_up_jacobs_ladder/,http://f.thumbs.redditmedia.com/M-noi6r6080902j5.jpg,
1370150190.0,1fi7m2,Favorite charities in the area?,JJJJShabadoo,24,0,25,"I have some money I can donate to almost any 501(c)3.  I'd like some of it to go local.  Are there any particular organizations that you know of that you feel are particularly deserving?

No religious organizations please.

EDIT: Thank you all.  I can spread it a bit among most of these.  The donations will be anonymous but your suggestions will be used.",self,t5_2r7ac,1370251197.0,,,True,http://www.reddit.com/r/SaltLakeCity/comments/1fi7m2/favorite_charities_in_the_area/
1369881853.0,1fb9av,"Was blown away by the view, took a panoramic of the storm leaving behind rainbow from my backyard",atomic_rectum,31,9,http://www.reddit.com/r/SaltLakeCity/comments/1fb9av/was_blown_away_by_the_view_took_a_panoramic_of/,http://d.thumbs.redditmedia.com/jHXTsH6bP0UCArrc.jpg,
1369779875.0,1f88ss,Old DI location in Sugarhouse undergoing a quick 2 week revamp in new plaza,spectacularspecimen,27,4,2,,t5_2r7ac,False
1369170576.0,1esfh5,A live stream webcam of Peregrine Falcons nesting in downtown SLC,sah0605,23,1,3,,t5_2r7ac,False
1367732709.0,1dpxga,Soccer referee Ricardo Portillo dies from attack injuries,manormango,36,13,17,,t5_2r7ac,False
1367099888.0,1d8l7a,Thank you everyone!!,Karrmah,31,8,2,"I posted [this thread](http://www.reddit.com/r/SaltLakeCity/comments/1d6z0w/ive_exhausted_myself_trying_to_find_better_work/) yesterday and already have a few interviews in the works. I just want to thank everyone for your help in finding more places to apply at. You all rock. Thank you thank you thank you,self,
1366759953.0,1cyzn9,"If you don't have a ipod hook up in your car, you can probably relate to this.",cleatusbrown,35,14,http://www.reddit.com/r/SaltLakeCity/comments/1cyzn9/if_you_dont_have_a_ipod_hook_up_in_your_car_you/,http://f.thumbs.redditmedia.com/B_PwIWjJt00qiczk.jpg,
1364949299.0,1bjyvg,Big Ed's,badrunnertorn,29,8,10,Anyone want to drink beer at Big Ed's?,t5_2r7ac,True
1364786038.0,1bed2v,Clark Planetarium to celebrate 10 year anniversary with 10 days of events/deals.,ToolCoughing,29,5,5,,t5_2r7ac,False
1363490025.0,1ag218,"Electric bikes? In my city? Just went and checked out the shop today, and wanted to share.",Katniss_Mellark,30,6,http://www.reddit.com/r/SaltLakeCity/comments/1ag218/electric_bikes_in_my_city_just_went_and_checked/,http://b.thumbs.redditmedia.com/RkOUMIjAjaSzYF01.jpg,
1358476404.0,16sjkl,"Moving to Salt Lake City in two weeks, I come to you with  a few questions",Deeeeeej,31,8,http://www.reddit.com/r/SaltLakeCity/comments/16sjkl/moving_to_salt_lake_city_in_two_weeks_i_come_to/
     I am moving to SLC in two weeks to work for FedEx. I am transferring there from Knoxville
      I am 24 and looking to meet some people. I want to learn how to ski. I enjoy craft brews and music. I play guitar and like to jam with people. I have a ton of backpacking gear and I am looking to pick a bike up to explore your fine city. Anything I need to know?! Thanks to all who give input and feel free to ask me any questions

Also, this is my first post, but my room mate is a vetern redditer and let me in on this secret. 

Thanks!
",self,t5_2r7ac,False,,,True,http://www.reddit.com/r/SaltLakeCity/comments/16sjkl/moving_to_salt_lake_city_in_two_weeks_i_come_to/
1357717169.0,168ldm,Unknown noise and shaking - anyone experience it Tueday?,jortr0n,25,3,36,,t5_2r7ac,False
1355251451.0,14oe2l,SLC Prison Divestment Campaign confronts Prison Profiteer Jane Marquardt at the Utah Democratic Party Central Committee meeting where she sought the party position of vice chair.,especifista,36,14,19,,t5_2r7ac,False
1354310473.0,142kr3,"Don't worry, some guy named 'Burningham' put out that fire at the pig farm before any ham was burned.",,30,6,http://www.reddit.com/r/SaltLakeCity/comments/142kr3/dont_worry_some_guy_named_burningham_put_out_that/,default,
1351832987.0,12i1tb,Saturday Bar HOP!!!,SLCpartybrigade,28,8,28,"We will be bar hopping this Saturday.  We never,False,
1351571293.0,12bmbw,My cat is missing and I'm on vacation in SF. She could be in the sugarhouse area please pm me if anyone has seen her!!!,CatsR00l,25,2,5,,t5_2r7ac,False
1350338177.0,11j8ss,Salt Lake City Haunted Attractions??,slc_,24,2,20,"Looking for what's best.

Already been to:

1. [XSI Factory / Zombie Apocalypse](http://zombieutah.com/) - Great. Got a T-Shirt
2. [Strangling Brother's Haunted Circus](http://www.stranglingbros.com/) - Good. Scary clowns and crap everywhere
3. [Nightmare on 13th](http://www.nightmareon13th.com/) - Meh. We went on a bounce back night
4. [Haunted Forest](http://www.hauntedutah.com/forest.html) - (went last night) This was the best so far! It felt so creepy right from the start! Lots of scares, it wasn't ""disconnected"" or just like random crap all over the place, they really kept with the theme. I would do this again!


Planning on:

1. [Fear Factory](http://fearfactoryslc.com/)
2. [Asylum 49](http://www.asylum49.com/NEW%20SITE/index1.html)
3. [Black Island Farms / Nightmare Acres](http://www.blackislandfarms.com/haunted.php)
4. [Haunted Hollow](http://www.hauntedutah.com/hollow.html)
5. [Cornbelly's Insanity Point](http://www.insanitypoint.com/index.html)
6. [Castle of Chaos](http://castleofchaos.com/)

Any others I MUST attend?

Thanks in Advance.

 
EDIT: added links for those interested.


EDIT: added additional links and my short reviews of each.",self,t5_2r7ac,1350402412.0,,,True,http://www.reddit.com/r/SaltLakeCity/comments/11j8ss/salt_lake_city_haunted_attractions/
1340998157.0,vt56j,I'm ridiculously excited...,Chewbies,30,10,13,,t5_2r7ac,False
1337815077.0,u1tg1,Saw this person driving in Sugar House today!,tummybox,44,24,11,,t5_2r7ac,False
1332874703.0,rg8ox,I need a place to live!,bencowtastic,27,6,6,"Lost my job,self,
1330103214.0,q48z4,"Billboard the local liberty movement funded on Salt Lake valley's I-215 freeway. Anyone know where this is, or part of this group here?  (x-post from r/libertarian.) ",zxcv73,24,2,http://www.reddit.com/r/SaltLakeCity/comments/q48z4/billboard_the_local_liberty_movement_funded_on/,default,
1324159105.0,ngpbw,Would there be any interest in organizing an anti-SOPA publicity campaign with the local media?,TylerRiggs,25,3,7,"If you've seen the link on the front page (http://www.reddit.com/r/technology/comments/ngd4r/i_work_in_news_this_is_how_you_stop_sopa/) there's some great input on how to get coverage against SOPA in the news. Although we thankfully have a congressional delegation in Utah who is by and large against SOPA

Anyone on board?",self,t5_2r7ac,False,,,True,http://www.reddit.com/r/SaltLakeCity/comments/ngpbw/would_there_be_any_interest_in_organizing_an/
1323709879.0,n9t5x,A view of the lunar eclipse Saturday over Salt Lake City.,LenMahl,24,1,5,,t5_2r7ac,False
1318666782.0,ld035,Occupy Salt Lake. We are the 3.2%. ,garhole,31,8,6,,t5_2r7ac,True
1316036461.0,kfsxn,Hey Salt Lake redditors I just realized something,angryasiancrustacean,22,0,14,"we just barely reached 1

edit: **nevermind**

edit 2: Yay!",self,t5_2r7ac,True,,,True,http://www.reddit.com/r/SaltLakeCity/comments/kfsxn/hey_salt_lake_redditors_i_just_realized_something/
1313735939.0,jnmob,Utah legislature puts an end to the mini-keg menace.,nildeea,26,3,15,,t5_2r7ac,False
1312254552.0,j6brz,Seriously...,imraven,25,2,19,,t5_2r7ac,False
1311113114.0,iu8c0,Who else loves the easy way to the top of the mountains?  ,johnybackback,27,5,14,,t5_2r7ac,False
1296767853.0,fer93,"SLC Reddit, please help my friend get his companion dog back",wcchaser,24,2,http://www.reddit.com/r/SaltLakeCity/comments/fer93/slc_reddit_please_help_my_friend_get_his/,default,
1292300430.0,elfdn,Picture Me Rollin',jordankasteler,24,2,20,,t5_2r7ac,False
1376453182.0,1kbtbb,Salt Lake City Corporate E-Games - Corporate Games For Nerds!,necromonius,30,8,6,,t5_2r7ac,False
1374343690.0,1ipezn,Moochie's owner pleads for return of 'Meatball Madonna',92235,23,3,10,,t5_2r7ac,False
1373047157.0,1hpar6,Little Cottonwood closed due to landslide,NotTheMuffins,23,3,2,,t5_2r7ac,False
1373003301.0,1hoe1g,"20 yo Iowan missing during cross country trek. Last seen in SLC, please look.",Forcefedlies,26,4,http://www.reddit.com/r/SaltLakeCity/comments/1hoe1g/20_yo_iowan_missing_during_cross_country_trek/,http://f.thumbs.redditmedia.com/nhjSIlNFo4AZaE3M.jpg,
1371398620.0,1ggjjw,"Stolen Bike: Morewood Izimu - Red, custom everything. Please keep an eye out.",price1869,25,4,http://www.reddit.com/r/SaltLakeCity/comments/1ggjjw/stolen_bike_morewood_izimu_red_custom_everything/

Stolen out of my garage on 6/14/13

That picture was taken when I first got my bike. 

Since then, sunline grips, sunline wheels, muddy mary tires (set up ghetto tubeless), and pedals are painted black.

If you see it

Thanks!",self,t5_2r7ac,False,,,True,http://www.reddit.com/r/SaltLakeCity/comments/1ggjjw/stolen_bike_morewood_izimu_red_custom_everything/
1371345251.0,1gfhk7,"Man slips handcuffs, steals police car before being recaptured",wordofgreen,24,1,http://www.reddit.com/r/SaltLakeCity/comments/1gfhk7/man_slips_handcuffs_steals_police_car_before/,http://b.thumbs.redditmedia.com/LXj84kwDLbn1svLC.jpg,
1368120268.0,1e0gbt,Who wants to play darts?!,cederboy,29,10,18,"Back in Utah,False,
1363807061.0,1aoj39,Looking for a Sr Developer,89vision,31,8,13,"Hi /r/saltlakecity

My company is looking for an experienced software engineer.  We're a small company in downtown Salt Lake City with awesome people and a great corporate culture.  We need someone with the ability to work on their own

Here are some of the technologies we use:
* Python
* Java
* Linux
* Talend
* Hadoop
* Hive
* Hbase
* MySQL

We offer full benefits and competitive salaries.  If you're interested shoot me a pm!  If you feel like you may not be qualified,False,self,t5_2r7ac,False,,,t3_1aoj39
1361901625.0,199qu2,hackSLC,slc_,26,7,21,"hackSLC is for geeks, coders

http://hackslc.org",self,t5_2r7ac,False,,,True,http://www.reddit.com/r/SaltLakeCity/comments/199qu2/hackslc/
1361660947.0,193pwh,"Panoramic view of the valley from Mount Calvary Cemetery after 4"" of fresh snow fell this morning [Feb. 23, 2012]",weffey,26,4,http://www.reddit.com/r/SaltLakeCity/comments/193pwh/panoramic_view_of_the_valley_from_mount_calvary/,http://a.thumbs.redditmedia.com/jtzksVQCwWLPWY5H.jpg,
1361140389.0,18ppxj,Gaming cafe?,,26,7,18,"My cousin is coming into town and I only have my personal computer to play with and I want to play some games with him. Google search brought up two places

Both of these places don't have websites or reviews or anything,False,self,t5_2r7ac,False,,,t3_18ppxj
1360535602.0,189qji,Herbert wants you to think he is on your side when it comes to pollution. ,,28,7,13,,t5_2r7ac,False
1359951604.0,17ujtv,Truck hits airplane at Salt Lake City airport; driver injured,jshultz,27,6,2,,t5_2r7ac,False
1359000579.0,1765qo,Monthly Meetup: Stoneground: Jan 26 at 7 PM,McMoop,24,5,40,"Title says it all. Drinks downtown at some bar afterwards.

If people still want to meet up to go climbing,,False,self,t5_2r7ac,False,,True
1358960939.0,174prn,Southerland Institute doesn't understand what Utahans value.,OregonOrBust,27,6,5,"In [this](http://www.wbur.org/npr/169983179/sundance-subsidy-stirs-conservative-pushback) article Paul Mero,"" Mero says. ""But these highly sexualized films don't complement the values of most Americans

Which made me think of [Utahans being number one in porn subscriptions](http://www.deseretnews.com/article/705288350/Utah-No-1-in-online-porn-subscriptions-report-says.html?pg=all)

I just don't think he understands Utahans as well as he thinks he does.",self,t5_2r7ac,False,,,True,http://www.reddit.com/r/SaltLakeCity/comments/174prn/southerland_institute_doesnt_understand_what/
1358273163.0,16mo4d,Good restaurants for an anniversary?,SaladBaron,26,4,74,"My anniversary is coming up and I'm looking for a nice romantic place for my wife and I. I'm still in school and we have a 7 month old so we are on a budget. Does anyone have any great ideas

Update:  It's been decided.  We're going to Mediterna for dinner and then onto The Melting Pot for dessert.  Thanks for all the help

Also,,False,self,t5_2r7ac,1358292841.0,,True
1357951360.0,16ets6,"Not sure if this can be here but here goes: Reddit SLC, who wants a cat?",Garviel_Loken,27,7,http://www.reddit.com/r/SaltLakeCity/comments/16ets6/not_sure_if_this_can_be_here_but_here_goes_reddit/

Here's the story ladies and gentlemen

My neighbor feeds many strays.  She works on getting them adopted, litter.  I would take him honestly, but I have two girls already and he doesn't play well with others.

He is awesome though.  He's a loner, neutered, and may be microchipped but we aren't sure.  He is crazy affectionate and loves attention.  Here, he can be a little testy because of all the other cats he has to deal with.  He has scratched me before but it was only because he was scared.  Also, he's not a mangy stray.  He's in really good shape.  In fact, he's a bit fluffier than the pictures in that album because his winter fur is crazy thick.

Here's what we're looking for:
Someone who will keep him indoors, will not have him declawed.  If he's declawed, he may become a biter.  Also, if in the worst case scenario he came back to us and needed to live as a stray again, he would be screwed without claws.  She (my neighbor) asks $30 dollars.  This is recommended by most animal welfare agencies to show the adopter is serious.  It will also help cover a small portion of the last vet bill.  

Don't be turned off by the reference to his clawing

**TL;DR: I have a stray in my house.  He is amazing and is well deserving of a home.  Contact me and save a kitty.**

",self,t5_2r7ac,False,,,True,http://www.reddit.com/r/SaltLakeCity/comments/16ets6/not_sure_if_this_can_be_here_but_here_goes_reddit/
1355394895.0,14s2w7,I'm a teacher in Bountiful who has an opportunity to get 7 laptops for $432 is I can get some support. ,michann00,29,9,19,"Google worked together with DonorsChoose to offer a limited amount of the Samsung Chromebooks for $99. I was fortunate enough to get in on the deal (which ran out within 24 hours of announcement). I have 2 programs I really would like my students to work on to individually work on skills they struggle with. This will not take place of teaching time
Why am I trying to get it funded in the first 7 days? Well
Usually when you donate through DonorsChoose, to you redditors, if you donate over $10 (so it'll be $20 with the code), message me and I'll have a few of my students write you a thank you note. I make sure it's safe by not including last names. I will tell you my students draw the greatest things on their thank you notes. You could even request pictures (as long as they were appropriate)
Anyway
http://www.donorschoose.org/project/samsung-chromebooks-for-a-portable-class/832654/?verify=1597357633

If you work for a company or know of a company who needs some charitable tax write-off's this is a non-profit and you'll get a receipt as well. Thanks you r/SaltLakeCity - Bountiful isn't that far away.

TLDR: Donate to my class using the code INSPIRE

UPDATE: Wow! We are already down to $283, they only give me info on those who give over $50, but I want to make sure I write thank you's to those who did $10 or more. I do see lots of pics of kittens in my near future.

UPDATE 2: Thank you Reddit! We have 7 Chromebooks coming to our classroom in January. I'm looking up some more things we'll be able to do with them and I cannot wait to get rid of the 4 computers and desks that are taking up a corner of my room. I see cats as my wallpaper and narwals as my screen saver (my class is themed an ocean,False,self,t5_2r7ac,1355804979.0,,,t3_14s2w7
1351992875.0,12lbz2,Best place in SLC for pie? ,bluuit,26,6,31,"Bonus points for 

* Local biz
* Fresh
* Selection of flavors 

Sub question

To be clear,,False,self,t5_2r7ac,False,,True
1351357977.0,126gl0,Any one know the Pros and Cons of voting to turn Millcreek Township into a City? ,DayGlowBeautiful,25,3,23,Futureofmillcreek.org and notocityofmillcreek.org both completely contradict each other but they are supposedly using the same reports as each other and getting different conclusions.  Does anyone know if it's really a good idea to incorporate? ,t5_2r7ac,True
1350248485.0,11h6ps,Handgun laws for Utah,dellis,28,5,35,Does anyone know the protocol for moving to Utah with a firearm? I have a conceal carry permit in another state but Utah doesn't recognize its permit. I don't want to break any laws. ,t5_2r7ac,True
1345742135.0,ypdmc,Body found in church parking lot in Holladay,konkeydong,30,9,11,,t5_2r7ac,False
1344531936.0,xy49s,$1 Jimmy Johns,BnothingP,28,5,10,"Today only 11am - 3pm. No delivery,self,
