created_utc,id,title,author,ups,downs,num_comments,selftext,subreddit_id,is_self
1376537659.0,1keb5z,Question on effects of shrooms,Mister_Towers,9,3,3,"Hey guys
While I was tripping
Anyway
I was just wondering if anyone has experienced anything like this or or knows the reason for it.",self,t5_2qszq,False,,,True,http://www.reddit.com/r/shrooms/comments/1keb5z/question_on_effects_of_shrooms/
1375758311.0,1jscep,First time tonight. This is exactly an 1/8th...what am I looking at here guys?,ChickenPotHigh,7,1,2,,t5_2qszq,False
1375730670.0,1jrc81,What are your favorite songs while tripping,McGibblets1,6,1,29,any bands are acceptable..especially Shpongle :D,t5_2qszq,True
1375340543.0,1jhaa8,First time taking shrooms questions,Notleontrotsky,9,2,13,"After a good portion of time searching, I am just looking for clarity for many of these and what a better place then with the pros.
1. They are safe right?
2. How many must one use to get high
3. How long do they last 
4. Tips for trips?
",self,t5_2qszq,False,,,True,http://www.reddit.com/r/shrooms/comments/1jhaa8/first_time_taking_shrooms_questions/
1375246234.0,1jehhl,How do you weigh shrooms?,SevenSeasOfRhye,8,1,10,"I heard that some people don't eat the stems.

I heard that 2g - 3.5g is good for a first trip. So would I weigh out 3.5g of caps,False,self,t5_2qszq,False,,,t3_1jehhl
1375191424.0,1jci8e,Should low doses of shrooms give weed-like effects?,SodomizeTheFamilyDog,7,1,4,"I decided to try shrooms for the first time last weekend.  Had some powdered shrooms.  I started weighing it out and then got nervous because I had a lot out despite the fact that the scale only read 0.8 (yeah

So I only took 0.8g in a small glass of lemon juice and water.
No visuals

Also,,False,self,t5_2qszq,False,,True
1375181310.0,1jcaio,"Tub growers, lend me your ear",maeon152,6,1,http://www.reddit.com/r/shrooms/comments/1jcaio/tub_growers_lend_me_your_ear/, I've got a fruiting chamber (2 at the moment) that I'm using pushing between 3 and 4 (not often) flushes per cake with the first being many small shrooms and any after being larger

All this is great, fermentation).

I really want to grow my garden

So

EDIT: I was asked for more detail. Here is the process I followed in detail.
1c rye grain (organic) per jar (6c total). Rinse VERY well, filled with a cotton ball for gas exchange (tight fit)  Covered with tin foil to avoid any water getting in. PC 15psi 90 mins. Let sit overnight. Inject varying ammounts of spore juice (I've got TONS, I make my own) from 2.5cc to 25cc (increasing in 5cc amounts each jar). As of now, I have had them almost a month in the inc chamber (80 degrees with air flushed every other day). The only 2 jars that look usable are the 2.5cc jar and the 5cc jar. Both are showing colonization, but VERY slow, about 50% colonized as of now. ",,self,,
1374613493.0,1iwsdy,Anyone from toronto here?,I_am_chris_dorner,6,0,12,It would be super awesome if you told me what the average rate for an ounce is in our smoggy city,t5_2qszq,True
1374530103.0,1iuboa,Level of self-control during shroom trip?,jchase1313,7,0,10,"I'm not sure if this is the best place to post this

I'm going to be trying shrooms for the first time in a few weeks and I am wondering what level of self-control one maintains on the average shrooms trip. Will I have trouble controlling my actions and thinking coherently and clearly? Or will I simply experience changes in perception without a loss of self-control and rational thought?

",self,t5_2qszq,False,,,True,http://www.reddit.com/r/shrooms/comments/1iuboa/level_of_selfcontrol_during_shroom_trip/
1374334012.0,1ip4ow,Does it change how you physically gel.,Detectiveoftheeast,8,2,7,"When I smoke too much weed,self,
1374263413.0,1inhpc,mushrooms on the carpet xpost /r/pittsburgh. Are they magic?,chadgauth,11,5,6,,t5_2qszq,False
1374259558.0,1incko,"Does ""strain"" matter when purchasing spores?",Throwawaaaaaaaay89,10,4,11,"I don't really have the attention span to ever actually grow them myself but I was browsing sites that sell the liquid mushroom spores and was overwhelmed by the variety of shrooms they had for sale. 

Is there really that much of a difference between all of the different ""strains"" or ""species"" listed on these sites? And what exactly is the difference between them? Are some easier to grow than others or are they more/less potent? ",self,t5_2qszq,False,,,True,http://www.reddit.com/r/shrooms/comments/1incko/does_strain_matter_when_purchasing_spores/
1374159507.0,1ik8nu,How do you make a proper spore syringe for further inoculations?,Ematthews0483,9,1,9,,t5_2qszq,True
1373948072.0,1ie3jm,newbie here. I just wanted to clear up some confusion about different shrooms.,mynamesbilly,7,2,10,"Hey guys,False,
1373855875.0,1ibb83,"Harvested half of a cake. First grow, and I think Im doing pretty good!",trekore,8,3,http://www.reddit.com/r/shrooms/comments/1ibb83/harvested_half_of_a_cake_first_grow_and_i_think/,http://a.thumbs.redditmedia.com/gHevU0XNjsvkOd0x.jpg,
1373418596.0,1hz4zf,Quick questions about truffles,panog,9,3,4,"Hey guys I'm going to Amsterdam with my friends in 2 weeks and we planned to eat truffles on a afternoon before going to the swimming pool of the center park we're staying at.
Anyway we never had them before, easy to handle in a place with a lot of people. 
Of course we're going to the pool once we're peaking
I know a lot of you guys are American and I think nobody bothers with truffles there but maybe someone could help me.",self,t5_2qszq,False,,,True,http://www.reddit.com/r/shrooms/comments/1hz4zf/quick_questions_about_truffles/
1373250137.0,1hu6im,Found these in a donkey pasture. Are they safe to eat? [MIC],KRSFive,8,2,6,,t5_2qszq,False
1373176555.0,1hsgum,Mushroom + microwave accident,Littlemoby,6,1,8,"So me and a bud melted chocolate and stirred the shrooms in the chocolate and measured out 1g per chocolate, for about 30,
1372974862.0,1hnou4,"First timer; not sure If I have enough, need tips for getting the best out of 2g for 2 people",Weed_n_Wisdom,8,3,http://www.reddit.com/r/shrooms/comments/1hnou4/first_timer_not_sure_if_i_have_enough_need_tips/,self,
1372535751.0,1hbqwc,"I got 18 grams of fresh, vacuum-sealed psilocybe atlantis ""truffles"". How to I store them for a week or two, until I can take them?",earnest_lothario,7,3

I've got a lot of projects I'm working on,False,self,t5_2qszq,False,,,t3_1hbqwc
1372516289.0,1hb7mo,How much for an 1/8 of shrooms?,Redditman10,9,3,39,"Hey reddit,self,
1372466792.0,1ha985,Love is a battlefield.,SolarDriftwud,8,1,6,,t5_2qszq,False
1372202514.0,1h2l0r,What kind of visuals do you experience?,successkid72,8,1,15,So I did shrooms yesterday for the first time after I found some in my yard. I didn't do a lot but enough so I got a good idea of what its like and I'm definitely exited to try them again. I didn't have to many strong visuals but i found them to be interesting. Some of the visuals I got that were cool was when I was walking down this dark wood hallway in my house and I remember it looking so cool like everything was moving in stop motion frames and it was slightly slowed down. I also went outside and looking in the distance at this orchard all the trees looked like they were double imaged and one was slightly offset. Looking in the mirror was also weird. Anyways just wondering what kind of visuals you have experienced because I find it interesting. ,t5_2qszq,True
1371750415.0,1gqnde,Advice for a first-timer?,spenserphile,6,1,11,"I will be taking mushrooms for the first time for my birthday next month and am now asking Reddit for advice.

I will be camping with trusted friends for one night. Any advice on intake method, and cool things to have on hand? Im trying to filter the stereotypical ""cool"" mushroom stuff from the actually cool mushroom stuff. Thank you for reading my post.",,False,self,t5_2qszq,False,,
1371574840.0,1glera,Are these Penaeolus worth eating for psychoactive effects?,karolscomp,12,6,3,,t5_2qszq,False
1371539135.0,1gklfs,Wondered for a while: These are long gone (from Nov. 2011). Found them growing in the dirt of a dead pine tree stump in northwest Oregon. What are these?,ihaveablockage,6,0,0,,t5_2qszq,False
1371394869.0,1ggfqu,My first ever drug trip. [Story],Hippowd0n,9,2,2,"Hey guys.
The only drugs I've ever done in my life is weed and shrooms. 
Only smoked a handful times
Friday night me and my best friend went round a friends apartment to try some shrooms to celebrate finishing school. 
We got there

We proceeded to eat them. My friend (who does psychedelic drugs but never shrooms) ate 2 grams off the bat. I wanted to have a slow come up so I have 0.4 grams. Around 30mins later I wanted more, so I just thought ""That looks cool, back to my phone"" So I went back on my phone to proceed to play mario. After 30 seconds of playing mario I was giggling too much to concentrate on the game, certain features of the game were emphasized then put into very high contrast along with yellow cross's that appeared around anything of significance on the game, e.g a mushroom enemy or brick. At this point I knew I was tripping balls, still really happy and enjoying myself. A few hours past and my friend still had no visuals just was really happy, at this point we had 1 1/2 grams left of our original 7 grams. It came to 6am and our hosts wanted to go to sleep, we felt it was time to leave as my friends sister wanted to get picked up from a friends house after having a bad trip (everyone at the house was on the same drug and/or mdma). Once we got their my friend deiceded to stay there for 30mins as they were good friends. I did not like this part. I was sat on a hard floor listening to VERY loud drum and bass with people who I did not feel comfortable and jailbait snorting mdma off a CD case next to me. My friend was cool as he is used too this scene and I am not. It is obvious from where I am sitting why my friends sister had a bad trip and it looked like all she wanted to do was to go home and cry. As did I, I had told him I don't feel comfortable tripping in that house and I didn't want to leave. As we hadn't sleep properly I would advise just get another hours worth or so sleep before going anywhere. Of course he did not listen ""I just want to go out, I found myself with little to no effort to do anything whatsoever. I wanted to sleep

Now

Overall, no work, nothing). I would not do it again as I don't think I would need too as I discovered things about myself I never knew. 

Thanks for seeing my story,False,self,t5_2qszq,False,,,t3_1ggfqu
1371272762.0,1gdw3o,Question about a soon to be first time trip.,hebrew_hamma,7,1,9,Would you recommend smoking weed and drinking shroom tea? Is this too harsh for a first timer? The measurements are 1/2 gram weed and 1 1/2 grams shrooms.,t5_2qszq,True
1371252493.0,1gdczu,What is this mushroom? More info in comments,kibbels47,8,2,7,,t5_2qszq,False
1371246128.0,1gd5nz,Video: Transformative Themes From Patients' Experiences in the NYU Psilocybin Cancer Anxiety Study,MAPSPsychedelic,9,1,1,,t5_2qszq,False
1371051652.0,1g78ud,Drying,whynotsoserious,10,3,2,,t5_2qszq,False
1371006009.0,1g65yd,"Are these safe, fun or bad to eat?",Frak98,7,2,http://www.reddit.com/r/shrooms/comments/1g65yd/are_these_safe_fun_or_bad_to_eat/,http://e.thumbs.redditmedia.com/WySf4J22epgLJJnv.jpg,
1370815149.0,1g06vm,Loud rumbling on psilocin. (Xpost from r/Psychonaut),Nyghtshade,10,2,4,"Some time ago

Try taking a really large yawn, and along with the sound; I lost my sense of balance and place in the world. My vision would fade and it felt like I was mentally brushing up against a wall.

I'm just wondering if anyone else has encountered anything like this in your journeys and what you think it might have been.",self,t5_2qszq,False,,,True,http://www.reddit.com/r/shrooms/comments/1g06vm/loud_rumbling_on_psilocin_xpost_from_rpsychonaut/
1370387466.0,1fonjz,Help with identification?,OpenlyGayPanda,7,2,8,,t5_2qszq,False
1369766488.0,1f7qp8,Flashbacks from Shrooms?,croution,6,1,6,"I know that LSD is famous for causing flashbacks; although interested i the chemical I have yet to try it. The only classic psychedelic I have tried to date is mushies. I have had them on only 3 occasions but have enjoyed them thoroughly each time. My first trip was and accidental ""heroic trip""; I ingested over an eighth of extremely potent mushrooms and had no idea what I was getting myself into. 

Since that first mushroom trip I have had memories ""burned"" into my mind. These memories are vivid
Sometimes under the right setting I can get into the shrooms consciousness after smoking kush. Earlier today I was frightened by one of these experiences

The entire experience appears random and only lasts a minute or two

I was wondering if anyone had any incite into this anomaly?",self,t5_2qszq,False,,,True,http://www.reddit.com/r/shrooms/comments/1f7qp8/flashbacks_from_shrooms/
1368818852.0,1ejad4,"Batch of shrooms has some Black caps, are these safe? Dakak beach, dealer says he has eaten black ones before and they were fine",ohiokush420,8,7,False,
1368094819.0,1dzrsg,Psilocybin Cubensis B+ fruiting problems??? Can anyone help? Thank you :),FearlessFelix,7,1,14,,t5_2qszq,False
1368027449.0,1dxqaz,Am I doing something wrong?,thevenividivici,11,6,22,"Hello shroomers!

I have a concern about myself. Whenever I take some shrooms with friends, making tea, pancakes also the lemon juice method. Can any of you give me some advice?
",self,t5_2qszq,False,,,True,http://www.reddit.com/r/shrooms/comments/1dxqaz/am_i_doing_something_wrong/
1367358005.0,1dft63,Wondering if this would be good for me?,SteveTheHorse,8,3,6,"So I've only been involved in marijuana as far as drugs go, but seeing as you guys would know much better than I

I've read a lot of stories on here about these insane trips people have about feeling at one with other people, but I've been really troubled by these deeper kinds of thoughts recently, such as the perception of time, and how we're all connected, and trying to find out who I really am, albeit I am still rather young. I've just been really confused about all these, and I don't feel comfortable discussing them with any of my peers, some of my friends have tried shrooms


I guess what I'm trying to ask is your guys opinion: would shrooms be a good choice to try and discover the answers to my questions? Such as self discovery

Sorry for kind of taking a roundabout way around my point,False,self,t5_2qszq,False,,,t3_1dft63
1366761793.0,1cz24g,Should I try Shrooms?,trenderman3000,7,2,14,"I am pretty young, and what should I do while tripping.",t5_2qszq
1365544080.0,1c0oji,Wanted to share some healthy mycelium,they_call_me_inky,13,7,9,"new to reddit and just found this sub wanted to show off some of my work

http://imgur.com/a/5E0LW#0",self,t5_2qszq,False,,,True,http://www.reddit.com/r/shrooms/comments/1c0oji/wanted_to_share_some_healthy_mycelium/
1365461555.0,1by7bv,Monotub 2nd Flush,Gnome17,9,3,1,,t5_2qszq,False
1364185857.0,1ayg1l,Ate about 1g (bought 4) of this with some noodles and didn't feel a thing (it's now 3 hours later.) am I safe to try lemon tek tomorrow? Or should I wait a bit?,Totalityclause,10,2,9,,t5_2qszq,False
1364066923.0,1avget,"Solo backpack, tripping with nature",hugthetrees,7,1,http://www.reddit.com/r/shrooms/comments/1avget/solo_backpack_tripping_with_nature/
I'm an experienced outdoorsman (I know first aid and everything required to take care of myself) but have only tripped a couple of times.
Any advice on safety when tripping alone?
I know set and setting will be ideal for me
Any advice, or anything  would be appreciated!
Can't wait!",self,t5_2qszq,False,,,True,http://www.reddit.com/r/shrooms/comments/1avget/solo_backpack_tripping_with_nature/
1363220161.0,1a935m,What do you guys think?,steadycomposure,7,1,4,,t5_2qszq,False
1362961199.0,1a1vfg,"I've done acid, dxm, dph and smoked weed. How will my first time on shrooms compare?",little_brother,7,5, second plateau dxm once and first plateau many times. I have 3g of dried shrooms. How much should I take,self
1362941260.0,1a19b0,First timers with questions ,TheBurn_253,6,2,10,So me and one other buddy are planning on taking shrooms for the first time soon. We were originally going to each take 1/8th but me research says that's wayyyy too much. Would splitting an 1/8 be okay for two people? Or should we do a little more? Your thoughts.,t5_2qszq,True
1362665864.0,19ufqn,My fully colonized jars have been sitting in a box for 3 months and I havent touched them. Are they useless?,Enop111,7,2,4,"I got all the stuff to grow in early December

Now it is March 8th. I never birthed the jars and the last time I looked at them,,False,self,t5_2qszq,False,,True
1362441487.0,19o6gn,"do these look okay? first time, no experience whatsoever. ",swogatron,9,2,http://www.reddit.com/r/shrooms/comments/19o6gn/do_these_look_okay_first_time_no_experience/,http://b.thumbs.redditmedia.com/EyUMKUBb1m2_ADNC.jpg,
1362258541.0,19jgu0,Does smoking weed effect the trip at all?,LoudpackJack,13,9,20,Does it make it better or worse or does it not effect the trip at all?,t5_2qszq,True
1362017782.0,19dbaz,Anyone have information/experience with HPPD (Hallucinogen persisting perception disorder? ,shrooms4life,11,4,13,Someone who is trying to get me to stop shrooming has been making a big fuss about this.,t5_2qszq,True
1361944145.0,19b981,What is a constant hallucination that always happens during your trips?,shrooms4life,8,2,10,,t5_2qszq,True
1361471411.0,18yu68,A life changing dosage?,looneygag,8,1,16, Friends and I tried 2g a piece and we didn't hallucinate.  We experienced a high for 3-4 hours and for a moment there was a slight distortion. We are going to try again. How much should we do for an awesome trip. ,t5_2qszq,True
1361155790.0,18q716,Is it possible for someone to be immune to shrooms?,MyWestpointStride,7,1,24,"I've done shrooms once in my life. My friends and I each ate 1/2 of an 8th. Within a couple of hours
ABSOLUTELY NO EFFECT ON ME. Needless to say

I can remember being like, but I honestly can't remember. So it makes me wonder if that same thing could be true for shrooms? ",,False,self,t5_2qszq,False,,
1360868869.0,18j49h,trying to decide on a strain,illicitaccount4567,7,1,12,I'm planning on attempting my first grow but I'm not sure of which strain  to buy. I'm regrettably not very knowledgable on the differences in strains so i would appreciate your recommendations as well as any information you can provide about your recommendations. much thanks in advance :),t5_2qszq,True
1360562722.0,18amr4,First trip,Milanapack,9,2,2,"I was a normal day at school, just took them. Like it was nothing. For a while, I felt a body high
1360510820.0,188zcv,First time tripper,Quantum_Immortal,8,4,7,"Hey guys

EDIT: I will be taking half the eighth to start,False,self,t5_2qszq,1360529406.0,,,t3_188zcv
1359778705.0,17qkrk,Blockbuster night ,Catphish,14,8,7,,t5_2qszq,False
1358816342.0,170wb3,Advise on a web site: www.thesporedepot.com,kpchronic,6,1,7,"A friend recently ordered some spores a few days ago. PES Hawaiian and Pink Buffalo (not to sure on the scientific names)

He went back on the site and read over the FAQ and started to flip when he read the disclaimer about the spores not containing psilocybin.

Should he be concerned or is the site just trying to cover its own ass?",self,t5_2qszq,False,,,True,http://www.reddit.com/r/shrooms/comments/170wb3/advise_on_a_web_site_wwwthesporedepotcom/
1358133541.0,16j2du,"Contam? Blueish at the bottom of the jar, took it out in hopes that it's just a bruise from being bumped. Jar was at 90% colonization. :(",,6,1,http://www.reddit.com/r/shrooms/comments/16j2du/contam_blueish_at_the_bottom_of_the_jar_took_it/,http://b.thumbs.redditmedia.com/kXaplJMy5XFavWla.jpg,
1357452358.0,161rv3,A quick question regarding posting,sydvito,6,0,3,"Hello! I've noticed most of these posts are related to mushrooms with the active ingredient Psilocybin,,False
1356923096.0,15pd48,I need some advice,deadjolly,8,2,6,"Hi there , so could you tell me which in your opinion is the most visual of strains?also advice in growing in small quantities is welcome as well. Thanks in advance.
Happy New Year to all of you :)",self,t5_2qszq,False,,,True,http://www.reddit.com/r/shrooms/comments/15pd48/i_need_some_advice/
1356284391.0,15bzhh,The day after shrooming,treesnotrehab,8,1,10,"I've been dealing with depression for most of my life (18 years old) and recently my symptoms have been getting a lot better, quit smoking cigarettes and started exercising again; my life was looking up for the most part.

 Well yesterday a few really good friends of mine and I decided to try some shrooms I had purchased before (this would mark the 3rd or 4th time i've tried shrooms). After each consuming about 2.5 g- 3 g

has other people experienced this feeling before? I know that some people report ""losing"" apart of themselves after tripping,False,self,t5_2qszq,False,,,t3_15bzhh
1355596736.0,14wjd0,How do you dry shrooms?,miminothing,12,6,11,"I have a friend who just grew a batch and wanted to know how to dry them (do they go bad,False,
1353214710.0,13dwym,Got shrooms for the first time got a quarter paid 70 how did I do? What kind are they? ,LevitatedPanda,9,3,11,,t5_2qszq,False
1352645685.0,130e7h,First time last night - strange/good but will not do again.,greentab,10,2,7,"Made some shroom tea with 2g last night. My bf was my trip sitter. I started feeling a little buzz pretty quickly within about 20 min. About an hour later the effects kinda hit me all at once. My hand started feeling tingly and like it wasn't a part of me. I started freaking out a little and it felt like I had a huge weight on my chest. Eventually I calmed down after listening to some music.

I went into the kitchen to get a snack and was eating slices of pickles. I looked down at the half eaten pickle I'm holding and I just start laughing hysterically to the point that I'm crying but then the crying turned into sadness and I started crying for real. I had to tell my bf to take the pickle from me cause I didn't want to let go of it. It was so strange how my emotions were all over the place. I just wanted to feel normal so I put Curb Your Enthusiasm on and we watched that for a while. 

At about the 2 hour mark was when the effects were peaking. I turned off the show and plugged my comp into the tv. I played songs over winamp with the visualizations tab open and that was extremely awesome. Watching the colors with the music was mesmerizing and made me feel really good inside. It was like I was on the verge of orgasm the whole time while watching it. 

I look down and see something on my shirt and freak out for a second but my bf says its just a fuzz so I pick it off and drop it to the floor while saying ""I don't even know what that is"". As soon as I said that I started crying again because it really bothered me that I didn't even know what that was and I just threw it away like it was nothing....without even trying to figure it out or looking at it first. I didn't give it a chance and just threw it away. 

I looked at my hand and it looked 3-D - like how you would see a 3-D drawing on paper. I flattened my hand parallel to the floor pointing away from me so when I looked at it

When I got up and walked around I felt really short like I was closer to the floor than usual. When I walked into a different room the ceiling seemed really close to my head. My hands started feeling really weak like I couldn't control them that well to grab things. I felt kinda like a crab using claws. If I started laughing really hard at something I would start to cry so I had to make sure I didn't laugh too hard.

After about 3 hours the effects started to fade and I was back to just the small buzz feeling. About an hour after that I was so tired that I had to go to bed. It was an interesting experience. The times I felt really good I could feel it throughout my whole body and the happiness was intense in every part of me. But I didn't like how a small thing like picking a fuzz off my shirt could send me into questioning myself and who I am. The emotional swings were unpredictable and came out of nowhere from unsuspecting sources triggering them. All in all I'm glad I did it to have the experience but I'd rather not do it again.",self,t5_2qszq,False,,,True,http://www.reddit.com/r/shrooms/comments/130e7h/first_time_last_night_strangegood_but_will_not_do/
1352524368.0,12ya4p,My first time ,Kdizzlenizzle,8,3,4,"I just feel.....really high but no visual stuff. My mood and logic keeps sliding around. One minute I have certain mindset and then the next I have another. I ate around a g. Chewed it up,self,
1351390713.0,1279pm,need help...,TheWalker3,8,2,5,Can someone please direct me to a website about growing my own mushrooms?  I have only done them once and loved it and want to try growing my own. Any advice would also be appreciated.,t5_2qszq,True
1350328238.0,11ixc8,What is this ... ? Have not found anything on it nor have I seen it before.,GreenEggsAndHamX,6,2,4,,t5_2qszq,False
1349641327.0,113obd,Could someone please identify these?,justanothertut,11,4,25,,t5_2qszq,False
1349191058.0,10tid7,Engineer's fruiting chamber! Just a few configuration questions... [pics inside],Pinkman2,7,1,15,"Pics here: http://imgur.com/a/3Vcbd

It's my first grow and I've built myself a fruiting chamber with an air pump

My questions:

* Does it look ok?
* The fans are hooked up to a timer. How often do I want to fan? 5 times a day? 10? 20?
* At what temperature should I set the heater? It does 38C max. Seems a bit warm to me.
* Drops tend to form in the roof of the box. Does it matter if they fall on the shrooms?

Great subreddit. Keep it up guys.",self,t5_2qszq,False,,,True,http://www.reddit.com/r/shrooms/comments/10tid7/engineers_fruiting_chamber_just_a_few/
