created_utc,id,title,author,ups,downs,num_comments,selftext,subreddit_id,is_self
1371194649.0,1gbqjk,Truth,malcolm_ross,226,27,7,,t5_2qszq,False
1359409551.0,17gbw8,I giggled^^,amicuscubensis,163,23,15,,t5_2qszq,False
1352830655.0,134sz8,Found this fella by a graveyard,jalla2000,149,11,11,,t5_2qszq,False
1365481191.0,1byxe9,"A reminder to use what you learn from your trips to benefit the world, and make yourself and your surroundings a brighter place.",nvann34,135,13,http://www.reddit.com/r/shrooms/comments/1byxe9/a_reminder_to_use_what_you_learn_from_your_trips/,http://c.thumbs.redditmedia.com/hYOjergZAryT74_z.jpg,
1361219931.0,18rs4w,"""pick your drug. we'll make your playlist."" best website ever ",snoahbear,130,16,7,,t5_2qszq,False
1363215927.0,1a8xvy,Mmmm Dat Feel [Comic],CookCookCookCook,138,26,1,,t5_2qszq,False
1370099094.0,1fgs2r,Went hiking in the woods on shrooms when I found this guy,znehpets,116,7,12,,t5_2qszq,False
1373475923.0,1i0o2x,My mother's horse pasture is a psychedelic goldmine.,Rumblesnap,108,8,26,,t5_2qszq,False
1371456104.0,1gi6aq,Veggie burger anyone?,shixxor,117,15,9,,t5_2qszq,False
1374557337.0,1iv89k,Please just stop..,townesboston,108,18,21,"Can people please stop picking random mushrooms and posting pictures on here. Nothing says ""I don't know what I'm doing"" more than a hand full of random fungus. Do some research and show some respect. I'm down for photo verification but more as a last resort when you're 99% sure,False,
1366651189.0,1cvh4b,"I made some yummy Choccy Shroomy Woomies, just under a gram in each.",Joshuaaa,103,17,http://www.reddit.com/r/shrooms/comments/1cvh4b/i_made_some_yummy_choccy_shroomy_woomies_just/,http://c.thumbs.redditmedia.com/ufVCMEoYChtFW6Lb.jpg,
1347109345.0,zjy35,The Mini Magic Forest on my desk,ThyHolyLord,89,7,19,,t5_2qszq,False
1373780082.0,1i9g09,A quart of magic,aband0nship,90,8,16,,t5_2qszq,False
1373451024.0,1hzz7s,My friend is starting a glass blowing class. Of course this is what I had to make! Relevant!,champinonesmagicales,104,21,6,,t5_2qszq,False
1371510393.0,1gjrbv,Bill Maher's AWESOME rant about LSD/Psilocybin .,Boris740,89,10,7,,t5_2qszq,False
1354650844.0,149zym,So my boyfriend grows..,shandawg90,93,17,3,,t5_2qszq,False
1375908838.0,1jwr1d,"When I'm on mush, I like to make trippy art. Here is what I did last trip.",Chorea,84,12,http://www.reddit.com/r/shrooms/comments/1jwr1d/when_im_on_mush_i_like_to_make_trippy_art_here_is/,http://a.thumbs.redditmedia.com/h_HCk_efp6pGDG2r.jpg,
1370865350.0,1g1fxn,First time shroomin'. my buddies eyes were big as fuck.,T_Reckz,90,12,6,,t5_2qszq,False
1375187975.0,1jcf2o,Today is the day :),rivu,85,11,26,,t5_2qszq,False
1357098624.0,15t1ka,First time. How did we do? What's the best way to get the vermiculite off the ends after picking?,barnbossswag,83,11,31,,t5_2qszq,False
1371002359.0,1g61ah,We've been doing them for thousands and thousands of years (300 a.d. mosaic),xeddyb,81,6,9,,t5_2qszq,False
1372052630.0,1gybcz,My new antidepressant: psilocybin cubensis 3500mg,aband0nship,80,9,25,,t5_2qszq,False
1351015503.0,11yhhn,Just thought you guys might appreciate this...,MarineR3con,94,22,1,,t5_2qszq,False
1349662483.0,1147yw,Just found this in a wallpaper dump and thought it belonged on here. ,KremlingMaster,77,13,5,,t5_2qszq,False
1372092908.0,1gz7ok,A psychedelic Lunch,txfinest2k7,80,12,10,,t5_2qszq,False
1367767772.0,1dqg1h,May the 1/4th be with you,ScenicFrost,78,12,8,,t5_2qszq,False
1373256719.0,1hudwk,Looks a lot like our favorite mushroom (x-post r/aww),I_Smoke_Trees_AMA,73,9,3,,t5_2qszq,False
1366776522.0,1czlzx,Can't wait to take these tmw at Disneyland!!!!,IThinkImJustHappy,74,8,21,,t5_2qszq,False
1374348145.0,1ipjsn,Thought I would share my collection so far... (.5lbs),psychashroomic,72,9,36,,t5_2qszq,False
1374317801.0,1iou48,Can we get rid of identification posts on this subreddit?,icyomer,80,18,13,If youre plucking mushrooms at random you probably shouldnt be eating them. On top of that risking your health by asking complete strangers is a bad idea. If people want to know what kind of mushroom they have they need to be well informed and capable of researching themselves,t5_2qszq,True
1358267819.0,16mhmq,My friend just gave me this for my birthday. This will be my first time. I'm ready.,eso808,63,7,15,,t5_2qszq,False
1370988150.0,1g5iq7,"First Grow, coming along nicely",blazenuttz,60,3,http://www.reddit.com/r/shrooms/comments/1g5iq7/first_grow_coming_along_nicely/,http://f.thumbs.redditmedia.com/hkxVa3zmeBIB2PHY.jpg,
1367197423.0,1db1x9,"Dear mods, Could you make some of the text more readable?",would_not_approve,65,9,http://www.reddit.com/r/shrooms/comments/1db1x9/dear_mods_could_you_make_some_of_the_text_more/, etc.) is grey on this lovely brown background. Could you change that text to be more readable? Red,False
1363284014.0,1aapc3,Camping = Doing a lot of drugs in the woods,TJB92,66,6,16,,t5_2qszq,False
1350255060.0,11hd2e,Mushrooms saved my life AMA,Smattzilla,64,7,92,"Well like the title says

Some additional info: It was my first trip,False,self,t5_2qszq,1350319116.0,,,t3_11hd2e
1375566498.0,1jnb1u,I must be doing something right.,4-PO_DMT,67,7,17,,t5_2qszq,False
1334069205.0,s2ky0,"Australian, golden tops, one of the most potent shrooms in existence, this is what me and my friends picked last year. the season is approaching again.... oh and cat included in photo :) ",sLIPper_,6,,False
1370325584.0,1fmwp6,Going to be a good summer.,shroomytime,66,8,10,,t5_2qszq,False
1364778274.0,1be36t,Ate about an 1/8th and got lost in the forest near Boulder... Today is a good time to be alive ...... or some shit.,nvann34,66,12,12,,t5_2qszq,False
1354568088.0,147x3l,"At 22.6 grams, this is my largest fruit to date.",champinonesmagicales,79,24,http://www.reddit.com/r/shrooms/comments/147x3l/at_226_grams_this_is_my_largest_fruit_to_date/,http://d.thumbs.redditmedia.com/vnXkujqzBdc58Ipu.jpg,
1376159590.0,1k3mvm,Magic Mushrooms treatment for depression being delayed by drug laws,cheesaye,68,11,13,,t5_2qszq,False
1367202228.0,1db84x,Was doing a photoshoot for my friends new clothing line and i thought you guys might enjoy this one,thejavorac,68,13,14,,t5_2qszq,False
1348515997.0,10ep63,Coraline's Liberty Caps.,thomicide,58,4,2,,t5_2qszq,False
1375419603.0,1jjoxx,Awesome little cluster.,champinonesmagicales,65,10,8,,t5_2qszq,False
1371298258.0,1gea70,First time ever eating shrooms - best night of my life [experience report],Vurba,57,7,20,"Yesterday I ate magic mushrooms for the first time with a couple of my good friends and that may just be the best thing I've ever done in my life. 

I've never tried any drugs except weed and alcohol so I was kind of nervous before shrooms and was even afraid I'd trigger a mental disease or freak out on a bad trip because usually I'm a really nervy and introspective person

Nonetheless

Right after I finished my meal I got excited and was ""feeling it"" even though it was probably placebo effect because shrooms take time to kick in.

45 minutes later
I didn't get visual hallucinations or classic ""trippy"" stuff...everything just felt normal. I felt sober. It felt like this is what life's supposed to be. I swear on everything that exists in this world

What is being able to fully control your emotions? I know. I'm enlightened. I was so positive and happy

Also I gained this magical ability to see myself from other people's perspective. Usually when I'm sober/on weed/alcohol I tend to get a bit carried off and I give off a creepy/weird guy vibe. On shrooms, myself and...

fuck.

I can't ramble on any more. Long story short

Shrooms gave me confidence I will carry with me for all my life and for that I thank them. They showed me who I really was. And I love myself.

Life changing experience,False,self,t5_2qszq,1371298575.0,,,t3_1gea70
1366937851.0,1d4fn9,"Will do Panda Express, will do",Time_For_That,63,8,http://www.reddit.com/r/shrooms/comments/1d4fn9/will_do_panda_express_will_do/,http://e.thumbs.redditmedia.com/LLsXcIDeBgAYCy2L.jpg,
1375273930.0,1jf0um,A friend of mine made a video talking about his trip as it was happening.,Stevorsh,60,11,28,,t5_2qszq,False
1372650707.0,1hem1p,"What does ""high score"" mean? New high score, is that bad? What does that mean? Did I break it?",SolarDriftwud,63,15,http://www.reddit.com/r/shrooms/comments/1hem1p/what_does_high_score_mean_new_high_score_is_that/,http://c.thumbs.redditmedia.com/k80WyRq1vtwSY75V.jpg,
1351532912.0,12ab2g,My favorite picture of shrooms.,aftermath966,58,5,3,,t5_2qszq,False
1345087939.0,yauql,Life is good.,Dumpsterhump,57,2,6,,t5_2qszq,False
1373350583.0,1hx4mx,"Second flush, 12 days later",aband0nship,58,5,http://www.reddit.com/r/shrooms/comments/1hx4mx/second_flush_12_days_later/,default,
1362756664.0,19wyf6,My kind of sandwich ,eddiebauer,54,5,5,,t5_2qszq,False
1348149316.0,106wrl,"After 2 months of research, planning, &amp; waiting...",theBedBurner,55,18,False,
1374720098.0,1j02u1,Another big beauty. Cambodian. 33.5g,champinonesmagicales,56,4,18,,t5_2qszq,False
1352381050.0,12usps,This subreddit is so damn hard to read. What is up with the color scheme?,faderf,51,5,12,,t5_2qszq,True
1362600649.0,19smup,Yo dawg (x-post from r/drugs),DanduryConundrum,55,8,7,,t5_2qszq,False
1358749217.0,16z50s,Anyone else think a change of font color would be nice?,Ares1221,50,5,7,It's hard to read a lot of things in this sub because it's nothing but shades of brown.,t5_2qszq,True
1340363538.0,vfj2v,let the weekend begin,thesandman313,52,2,12,,t5_2qszq,False
1374671806.0,1iycgd,Reasons Not To Do Drugs,TwoStrokeTommy,54,5,9,,t5_2qszq,False
1372100755.0,1gzia7,First flush is looking good,aband0nship,50,4,15,,t5_2qszq,False
1356027837.0,156fyk,12 grams :),ohiokush420,48,1,4,,t5_2qszq,False
1372392632.0,1h8802,We're going to Candy Mountain Charlie! Yaaay,SolarDriftwud,54,10,30,,t5_2qszq,False
1369842062.0,1f9uua,Ready for an adventure.. Wish me luck(:,NoSeedsNoSeeds,56,13,11,,t5_2qszq,False
1367324314.0,1demo6,I saw this while I was online during the come up. I thought they had kicked in.,matthaus15,67,19,1,,t5_2qszq,False
1355169673.0,14mcxu,Magic Spicy Dark Chocolates!,champinonesmagicales,57,11,20,,t5_2qszq,False
1376681671.0,1ki9d3,Shroom night(: (x-post r/trees),Potlord420,54,7,14,,t5_2qszq,False
1371675160.0,1goijs,"Tried shrooms for the first time two nights ago, changed my life.",BombproofBears,54,6,http://www.reddit.com/r/shrooms/comments/1goijs/tried_shrooms_for_the_first_time_two_nights_ago/,,False
1360423307.0,187029,Wish me luck in my journey tonight brethren! 1/8th,kpchronic,50,4,19,,t5_2qszq,False
1352654569.0,130kx2,My favorite drug of all time ,QuithidingPot,49,5,13,,t5_2qszq,False
1347646956.0,zvzjo,"Nice try, God!",,54,8,http://www.reddit.com/r/shrooms/comments/zvzjo/nice_try_god/,http://a.thumbs.redditmedia.com/giQGXdiQ9WuhRVtl.jpg,
1360842904.0,18icwl,Who wants some!? (X-post from r/drugs),eddiebauer,53,8,11,,t5_2qszq,False
1372158353.0,1h14n6,Gonna be a good weekend,grizzlyunicorn,50,6,1,,t5_2qszq,False
1362417642.0,19nb2t,5g of shrooms and a bowl for post trip,LoudpackJack,54,13,9,,t5_2qszq,False
1376645291.0,1kh9ce,Shrooms,trgc,52,9,5,,t5_2qszq,False
1373935958.0,1idoam,3 guys I picked today,ZornsLemmon,51,8,16,,t5_2qszq,False
1367531101.0,1dku7w,I'd like to suggest a change in the background on this subreddit.,kireiray,47,7,17,It's so brown.. I can't see anything!,t5_2qszq,True
1364167842.0,1axvo0,$30. 1/8th? My first pick-up.,synapsesynopsis,46,6,26,,t5_2qszq,False
1374289902.0,1iobki,"What I like to call ""Reserve Stock""",SolarDriftwud,47,4,9,,t5_2qszq,False
1358305551.0,16ntqq,First birth. Up close,Marley_TC,47,3,8,,t5_2qszq,False
1321971362.0,mlgf2,"""94% of those who received the drug said the experiment was one of the top five most meaningful experiences of their lives"" -Johns Hopkins",shagadellic333,43,6,2,,t5_2qszq,False
1376012841.0,1jzydk,"First flush, first cake",trgc,46,7,http://www.reddit.com/r/shrooms/comments/1jzydk/first_flush_first_cake/,http://c.thumbs.redditmedia.com/WOQ1C0PT2svb_-SV.jpg,
1375438737.0,1jk1l6,"My first trip went south, this is an inkling of what I saw.",wickedwonderful,45,7,http://www.reddit.com/r/shrooms/comments/1jk1l6/my_first_trip_went_south_this_is_an_inkling_of/,http://d.thumbs.redditmedia.com/fa9PqWEKS72o4_59.jpg,
1373020039.0,1honla,I'm going on a summer holiday and I'm bringing one mushroom.,Steaksauce,48,6,11,,t5_2qszq,False
1371882140.0,1guens,"I don't know what these are, but I know some people who can appreciate the natural beauty.",psycheDelicMarTyr,43,3,http://www.reddit.com/r/shrooms/comments/1guens/i_dont_know_what_these_are_but_i_know_some_people/,http://e.thumbs.redditmedia.com/KHYFu4dUc2K7ssLF.jpg,
1360905690.0,18kecn,Interested in understanding **why** you think the way you do on shrooms?  Are you wondering what areas of the brain are active when you trip?,thefriendweignore,46,6,8,"Using fMRI to Investigate the Effects of Psilocybin on Brain Activation and Blood Flow - Robin Carhart-Harris

http://vimeo.com/16776520

I had to take a few pages of notes during the video

Edit:  /u/Huck13b3rryF1nn posted a fantastic summary of the video but don't let it stop you from really dissecting exactly what this video has to share.  I found it so profound (the video and researching behind it) that I *had* to share it with fellow shroomers.  ",self,t5_2qszq,1360961103.0,,,True,http://www.reddit.com/r/shrooms/comments/18kecn/interested_in_understanding_why_you_think_the_way/
1350316988.0,11il6r,Overnight growth! Unbelievable!,champinonesmagicales,45,8,13,,t5_2qszq,False
1347741714.0,zxvsq,"For my first time growing, this is exciting!",spiral_in_the_sky,42,4,http://www.reddit.com/r/shrooms/comments/zxvsq/for_my_first_time_growing_this_is_exciting/,http://d.thumbs.redditmedia.com/0VzkEyA2qiTUfhu-.jpg,
1346151325.0,yyes3,"Ecuador cubes, mmmm...",HooperCrosby,42,1,http://www.reddit.com/r/shrooms/comments/yyes3/ecuador_cubes_mmmm/,http://f.thumbs.redditmedia.com/98OHwFbbwdqLesEk.jpg,
1376279479.0,1k6ot4,"So the perseids are happening tonight, and I made a nice 4.5 g shroom sandwich to go with it.",mrmanwiththehands,46,9,http://www.reddit.com/r/shrooms/comments/1k6ot4/so_the_perseids_are_happening_tonight_and_i_made/,http://f.thumbs.redditmedia.com/D_i-jAlrLVjk3PWk.jpg,
1371311438.0,1gejjd,"Look, guys :)",GuineaPigger,41,5,http://www.reddit.com/r/shrooms/comments/1gejjd/look_guys/,http://e.thumbs.redditmedia.com/uKfB7jQrjA4YPrhj.jpg,
1367900903.0,1dudrj,Prom is saturday.. but I'm excited for the camping afterwards!,GoodnightLava,52,17,8,,t5_2qszq,False
1367556774.0,1dlowv,"Just a heads up, if you're going to post pics on here of you doing illegal shit, make sure to AT LEAST use a throwaway account.",ShipYo,44,17

10 minutes ago, phone number, university, and **Dorm room Building** that they posted pictures from.

Being the paranoid (and creepy) person that I am

Seriously, use a proxy.

If you honestly think that law enforcement doesn't look at these subreddits,False,self,t5_2qszq,False,,,t3_1dlowv
1362079182.0,19euqx,2.5g of some nice boomers,LoudpackJack,47,8,2,,t5_2qszq,False
1333137197.0,rldqg,And here...we...go! ,Godimhigh,47,8,19,,t5_2qszq,False
1376497488.0,1kcttk,Found this beautiful Fly Agaric in Pikes Peak Forest,ifstarsalign,46,6,21,,t5_2qszq,False
1375659342.0,1jpgx8,Follow up on that giant cubensis :) picked and ready,MackHighVer,45,9,8,,t5_2qszq,False
1374822912.0,1j31wj,Family of cubes,moonchildren,40,5,0,,t5_2qszq,False
1373125761.0,1hr341,Witches Brew,SolarDriftwud,50,13,18,,t5_2qszq,False
1369691601.0,1f5t10,This restaurant knows what's up,dude8462,50,10,5,,t5_2qszq,False
1365878890.0,1ca5g2,Just came in the mail today...,CannabisCouple,44,6,20,,t5_2qszq,False
1360176240.0,180gum,First time: how do these look?,BoboddyVape,44,6,24,,t5_2qszq,False
1371702371.0,1gphdx,Zee Golden Teachers,usofunny,46,10,12,,t5_2qszq,False
1361663072.0,193s25,From my first grow... just a few that I took pics from... more to come after second grow...,shupenstein,41,3,6,,t5_2qszq,False
1349377605.0,10y8i1,You like? ,Shastycat,39,3,16,,t5_2qszq,False
1374792973.0,1j26av,Damn near just need the faces,momscooking,38,7,8,,t5_2qszq,False
1370911788.0,1g33cw,Could “Magic” Mushrooms Be Used to Treat Anxiety and Depression?,MAPSPsychedelic,40,1,7,,t5_2qszq,False
1366755809.0,1cyu57,Looking forward to summer with my first flush of McKennaii,Jezlin,37,1,3,,t5_2qszq,False
1330502376.0,qb2lw,"4 days, 4 hours after inoculation with spores. ",We_Just_Ate_Shrooms,38,6,http://www.reddit.com/r/shrooms/comments/qb2lw/4_days_4_hours_after_inoculation_with_spores/,http://d.thumbs.redditmedia.com/EmgcOjHR-whKA8-i.jpg,
1376417792.0,1kakd6,Am I doing this right?,akickinthedick,44,12,13,,t5_2qszq,False
1375116840.0,1jab0t,Heaviest shroom yet!!! And she looks cool too!,champinonesmagicales,40,7,20,,t5_2qszq,False
1367866361.0,1dt3vm,Let the fruiting begin!,Cylindrical,44,10,8,,t5_2qszq,False
1361382694.0,18wb5q,Thought I'd share with the shroom community.,alienanimal,51,21,2,,t5_2qszq,False
1353636341.0,13nbi0,TIL many Christmas traditions come from Amanita Muscaria mushrooms ,JoshTheDerp,43,10,5,,t5_2qszq,False
1348361637.0,10blrx,Friday night was lovely.,TheFeverFrenzy,38,0,9,,t5_2qszq,False
1348070262.0,1052to,Newest tapestry in my dorm,EC-Skier,36,2,2,,t5_2qszq,False
1375707829.0,1jqjye,I'm tripping balls.,eatALLthenoms,44,12,17,"I am on some boomers right now and my backyard is absolutely incredible. I cannot even describe the beauty that i have experienced. I made friends with a deer and explored a place that i thought i knew inside and out. I've been taking pictures the whole time to document it,,False
1374898295.0,1j5684,A favorite pic of a recent grow,throw_away_483,38,5,4,,t5_2qszq,False
1358820759.0,1711yd,Look good?,mynoob2,40,5,2,,t5_2qszq,False
1355348117.0,14qwfh,"My Cubensis B+, first attempt [Tek]",DaniZed,33,3,http://www.reddit.com/r/shrooms/comments/14qwfh/my_cubensis_b_first_attempt_tek/,http://b.thumbs.redditmedia.com/-4NO4M2toR7txIB1.jpg,
1342232435.0,wj5py,Thanks Toad...!,overused_ellipsis,39,5,1,,t5_2qszq,False
1374447874.0,1irye3,This time of year is like Christmas for this community....,I_AM_SLURMALICIOUS,37,3,14,,t5_2qszq,False
1370338048.0,1fn4u5,For your viewing pleasure (NZ P. Subaeruginosa),drugsanddub,35,5,7,,t5_2qszq,False
1369923275.0,1fc550,Biggest cubes I've ever grown!!! SO Proud,himmlerite,36,8,3,,t5_2qszq,False
1369765396.0,1f7p77,My First Shroom,ZornsLemmon,37,5,14,,t5_2qszq,False
1369094823.0,1eqalx,Stop with the frequently asked questions.,ShipYo,42,7,10,"[Several](http://www.reddit.com/r/shrooms/comments/1epqop/mushroom_storage_question/) posts [here](http://www.reddit.com/r/shrooms/comments/1eq43a/cultivation_and_simplicity/) recently [are](http://www.reddit.com/r/shroomers/comments/1eobx0/psa_why_friends_dont_let_friends_grow_on_cakes/ca27ag2?context=4) continually  [asking](http://www.reddit.com/r/shrooms/comments/1elitg/thinking_about_taking_shrooms_i_have_some/) some [of the](http://www.reddit.com/r/shrooms/comments/1ee73i/how_to_get_started/) most [common](http://www.reddit.com/r/shrooms/comments/1dtcj9/had_my_first_shroom_experience_saturday_night_how/) questions known to the shroom world.

Stop. Read the sidebar. Read all of the [General information](http://www.shroomery.org/1/Mushroom-Info) in the shroomery. There's no need to ask ""What's a good dose for a first timer?"" or ""What's a good guide on growing?"" every couple days. ",self,t5_2qszq,False,,,True,http://www.reddit.com/r/shrooms/comments/1eqalx/stop_with_the_frequently_asked_questions/
1368810261.0,1eizy6,"My lunch. mustard, cherry tomatoes, cheese and 4 grams of cubensis. Yum!",fooreddit,37,8,False,
1368774497.0,1ei79z,big bag of Blue Meanies,talituna,37,5,6,,t5_2qszq,False
1359852727.0,17s5z9,Is this considered big? ,CowboysAndAnthrax,39,8,7,,t5_2qszq,False
1349154913.0,10sx40,My largest fruit yet with PF tek. 13 grams.,champinonesmagicales,38,4,7,,t5_2qszq,False
1330574052.0,qcf6d,"All the mushrooms, and no one wants to do them with me :(",ZLegacy,38,3,http://www.reddit.com/r/shrooms/comments/qcf6d/all_the_mushrooms_and_no_one_wants_to_do_them/,http://c.thumbs.redditmedia.com/Zm5bhDX-ErX3d_rD.jpg,
1375749270.0,1js14a,What the fuck did I just buy? I'm an idiot.,Myfishwillkillyou,39,12,30,,t5_2qszq,False
1373570191.0,1i3mt7,Galerina marginata- A deadly lookalike that you should know well and look out for when hunting,CBDemon,35,3,4,,t5_2qszq,False
1370730627.0,1fy76g,My gf and I are going to have a good time!,SublimeCubensis,35,1,7,,t5_2qszq,False
1358177178.0,16jyce,mold and growth on single corn grain,TheElfai,33,2,5,,t5_2qszq,False
1347282264.0,znfva,Bioluminescent Fungi,trot-trot,32,1,5,,t5_2qszq,False
1337203420.0,tqkrh,Put the shroomery website in the side bar so that we can properly educate those wishing to gain experience. Instead of linking it in every question on this subreddit.,ronversation,35,3,2,,t5_2qszq,False
1375602030.0,1jo6i1,"This beast still has 2 days to go, is thicker then my thumb and 4 inches long.",MackHighVer,38,9,http://www.reddit.com/r/shrooms/comments/1jo6i1/this_beast_still_has_2_days_to_go_is_thicker_then/,http://c.thumbs.redditmedia.com/2hy0vhcfOKmWmDNb.jpg,
1373618813.0,1i5561,Cakes Cakes Cakes,maeon152,37,7,20,,t5_2qszq,False
1372463172.0,1ha5g8,"Silly mushroom, that's not your real house!",SolarDriftwud,35,6,http://www.reddit.com/r/shrooms/comments/1ha5g8/silly_mushroom_thats_not_your_real_house/,http://b.thumbs.redditmedia.com/mSKEzWY4ERr5zZms.jpg,
1366580115.0,1ctm62,8.5 gs in tea report,BlottedGoat,36,8,3,"this was about a year ago

it's a little hazy but i still recall the more important aspects of the night. I didn't have much money or any plans for the evening, and then made the tea. I sat down on my friend's couch and waited for the effects to start.

about a half hour in, getting ready to pregame and go to some shit ass kegger. they packed up some bongs, i ripped em, and then it was done. 

next thing i know i'm laying in the bathroom, maybe 15 min, it felt like an eternity. complete loss of ego. i became everything. it was ineffable. merging with the universe. 

after laying there long enough to come down i looked at my puke and saw thousands of faces in it. the puke was breathing at me, my parents meeting, every choice that anybody had ever made) and i was sitting there looking at my hands was too much for me to handle. i laughed. i was laughing hysterically for probably 15 min, looking at my hands. the cumulative point of everything was that moment. it was awe-inspiring.  

all in all
&lt;3 peace and love friends ",self,t5_2qszq,1366646010.0,,,True,http://www.reddit.com/r/shrooms/comments/1ctm62/85_gs_in_tea_report/
1355801622.0,1516or,Soon.,,34,4,5,,t5_2qszq,False
1338740537.0,uipni,HDR of my little Thai Cubensis guys,ThyHolyLord,32,0,4,,t5_2qszq,False
1336960618.0,tlszs,Two more weeks and I'll have my first flush of shrooms soo happy ,QuithidingPot,33,2,10,,t5_2qszq,False
1371791735.0,1gs0rn,"Friend got some Shrooms, and then sent me this..",Djdragon44,37,12,http://www.reddit.com/r/shrooms/comments/1gs0rn/friend_got_some_shrooms_and_then_sent_me_this/,http://d.thumbs.redditmedia.com/lfvRHLIijSTsBJy3.jpg,
1362319743.0,19kra0,B+ and Golden Teacher,TriggerNutzofDOOM,30,1,3,,t5_2qszq,False
1358661573.0,16x1ub,First time. Orange Juice mix. Euphoria :),bloody_me,40,9,4,,t5_2qszq,False
1354038430.0,13vsl0,"My friend asked me ""What are the downsides of shrooms?""",DrHighness,33,5,36,"All I could think of is ""They're illegal.""
Hahah",self,t5_2qszq,False,,,True,http://www.reddit.com/r/shrooms/comments/13vsl0/my_friend_asked_me_what_are_the_downsides_of/
1352071080.0,12mwa4,First Ego Death,twig_,33,5,7,"My entire aspect of reality was shattered, but I was running through this complex arrangement of roads winding through this world aging and gathering knowledge, and I remember thinking

Truly an eye opening experience and that's only part of it.",self,t5_2qszq,False,,,True,http://www.reddit.com/r/shrooms/comments/12mwa4/first_ego_death/
1350686974.0,11rtr4,It's a good night to trip. it's been to long  my good friend mister mushroom ,QuithidingPot,33,4,10,,t5_2qszq,False
1347012306.0,zi004,Absolutely delicious (in it's own way),pear_pot,31,3,9,,t5_2qszq,False
1376125250.0,1k2y67,"Cooling, waiting to be injected.",maeon152,32,3,http://www.reddit.com/r/shrooms/comments/1k2y67/cooling_waiting_to_be_injected/,http://c.thumbs.redditmedia.com/szackBSVXScIiDch.jpg,
1374632136.0,1ixfzm,Monster,HollowForm,32,3,5,,t5_2qszq,False
1371591450.0,1gm2cb,Summer is coming! time for some fresh fungus.,darkn30,34,5,10,,t5_2qszq,False
