created_utc,id,title,author,ups,downs,num_comments,selftext,subreddit_id,is_self
1277937605.0,ckpu0,Accidental semi-heroic dose cubensis,kaminix,11,1,12,"Hi
So yesterday I got a bit careless. A friend of mine had grown cubensis from one of those

Anyway

In my opinion it really was too late to start shrooming at 9:15 PM (or 21:15 as we say in Europe)

As I had left my pocket scale at home I was pretty much guessing how much it was. About two weeks ago three of us had tried about 15 g + about 10 g (second dose not weighted but close to same ammount) an hour later of fresh ones; that was a little less then half I thought so splitting the rest between the two of us would land us at 4-5 maybe 6 grams which I considered reasonable considering I barely felt anything the first time.

I later got to know that in those bag were probably somewhere between 12-15 grams dried cubensis each. I felt a bit bad after hearing that since it was my friends first psychadelic trip

Anyway, it's amazing really.

Then once we get inside the trip turns to the worse. I figure I should turn on some music but I can't think of any. I first turn on shpongle but it creeps me out and then some kashiwa daisuke but it too creeped me out. At this point I really couldn't figure out how to work my computer to I just paused the music and left it be. I started getting a belly ache from the shrooms and lie down feeling as if I've got a fever. My friend is laughing hysterically looking at his own hands and the whole room is starting to swing around. Thinking about it afterwards this probably would've been an awesome experience had it not been for the belly ache.

I go to the toilet trying to puke

I start looking around the dirty toilet thinking things like ""well

I go to my room mate (not the one tripping with me

So I hold on to her and I'm almost crying. I knew that the mushrooms aren't really dangerous in the sense that they can kill me and I know I'm quite safe from schizofrenia and things like that (judging from my family history), being careless with the dosing. I could feel his prescence much stronger than at any other of my trips and I could feel him wanting to destroy me.

As I held on to my room mate there was like a storm going through my head and the god tried to pull me out of reality in to another, then I would open up my eyes and reattach myself to reality. Even with my eyes open I could see very pretty, though frightening at the time, psychedelic patterns in the room. They were coming on and of like some sort of radio jitter.

Even though I was suffering through this trip I can still remember my room mate, that'd just ruin it"".

After a while my stomach ache calmed down and the trip took a more pleasant turn. I couldn't quite enjoy it as much because of what happened before this

----------

Well, though I'll be much more careful in the future. I also think, having felt as if I've been on the brink of insanity, I might learn to appreciate life and soberness more for what it is. I will still use drugs, psychedelics in particular because they teach me these things, but maybe a bit more carefully.

What do you think? Anyone ever done something similar?
Pardon my English,False,self,t5_2qszq,False,,,t3_ckpu0
1376613263.0,1kgfxm,Growth exploded after second dunk.,flowfall,11,2,8,,t5_2qszq,False
1375378049.0,1ji8n0,I need advice &amp; resources on shroom benefits.,Free_runner,11,1,2,"It's been many

I have however grown up A LOT since those early days and I feel drawn to shrooms once again

I plan to grow my own shrooms. I have ordered a mushroom growing kit and I will be ordering spores at the weekend. Can anyone recommend a particular strain? I am in england so I will have to order spores from a UK site. I plan to ease myself in gradually

One problem is that I am doing this alone. I have people who would sit with me while I trip but I would very much like someone to trip with me. All of my friends have the standard preconceived and socially demonized view of mushrooms. I have tried explaining the many benefits of taking hallucinogenic mushrooms

Cheers!

*edit*

Articles of this nature would be perfect

http://cognitivelibertyuk.wordpress.com/2011/09/29/magic-mushrooms-cause-lasting-positive-changes-in-personality/",self,t5_2qszq,1375383736.0,,,True,http://www.reddit.com/r/shrooms/comments/1ji8n0/i_need_advice_resources_on_shroom_benefits/
1375143387.0,1jbbnd,Has anyone here trancended anxiety thanks to shrooms?,Duckbill_Platypus_91,13,2,1,"Over the past few years I have dealt with crippling anxiety

I ordered a growing kit a few weeks ago and I now have them drying out. I have never taken mushrooms before and I dont quite know what to expect. I feel as if it is either going to be the most important experience of my life or it can make matters worse.

After listing to alot of Timothy Leary's talks I do feel confident I will flow through the trip confidently and peacefully

Edit: While I was checking on my shrooms to see if they were nice and crisp I decided to nibble on a peice. Not a big one

What then happened over the course of 30 mins I felt this sorta trance like state take over. I wasnt sure if it was placeebo. I still feel it sorta infact. But while in this state its almost like I lost control in a way. I was doing stuff I dont normally do and looking at the strangest things. But everytime I would look at things its like I would focus right in on it,False,self,t5_2qszq,1375151354.0,,,t3_1jbbnd
1374934197.0,1j5s0v,Accidentally misted trace amounts of pine sol into the fruiting chamber...,flowfall,11,3,5,"So I rinsed out an old spray bottle really well to the point it had no smell.
The Sprayer itself I later found after using twice, Maybe I'm being a little bit paranoid but do you guys think this is a big deal?",,False,self,t5_2qszq,1374935335.0,,
1374691769.0,1iz1yo,Am I still high?,Wumbowomboing,13,3,4,"I'm getting a little concerned because I still feel that tingling sensation or haziness when I move or touch something.  This past Sunday afternoon after smoking with some friends I wanted to see what my first mushroom would feel like from my first batch.  It wasn't a fully grown mushroom, I had to go to work and pretend everything was normal, the tingly feeling is still there

Has this happened to anybody else?  I've searched all over and can't seem to find anybody else this happened to.  I don't have a history of mental or physical problems, unable to function.

On an unrelated note, I am afraid of taking them given my experience with just *one*",,False,self,t5_2qszq,False,,
1374386962.0,1iqlwi,I think this is contamination - should these 3 be tossed?,HateWinslet,13,4,8,,t5_2qszq,False
1374334390.0,1ip50t,Not a very good pic. But me n mine friend split them and didnt feel shit.. Can someone explain why,ianrage30,12,2,7,,t5_2qszq,False
1374288991.0,1ioapm,I like to make them big!,33masons,12,3,6,,t5_2qszq,False
1373765166.0,1i90gm,DMT v shrooms,sinsehlovher,12,4,15,"Just got some DMT for the first time,False,
1373571703.0,1i3p2h,Do you eat the whole shroom?,hjhrocks,10,1,8,"From the photos i've seen,False,
1373374163.0,1hxjmw,Shrooms Starter Grow Kit?,FullyMetalz,10,0,7,"Just like the title says


Im looking to get into growing Mushrooms and have looked at some online TeKs


He recommended I used a starter kit for my first time",self,t5_2qszq,False,,,True,http://www.reddit.com/r/shrooms/comments/1hxjmw/shrooms_starter_grow_kit/
1372279150.0,1h4s6m,Smurf-ville,TZUNAM1,16,6,3,,t5_2qszq,False
1370216838.0,1fjq81,"Does mental ""strength"" play into trips?",Jrcrouch92,10,1,26,"I had a bad experience (personally I had a great time) with shrooms when one of my friends looped for the entire trip, I slowed myself down and realized what was happening.",t5_2qszq
1369541822.0,1f2eq3,Shrooms in Amsterdam?,Abbrevi8,11,2,12,"Hello shrooms, but I'm wondering if it's possible to acquire shrooms in amsterdam as well. ",t5_2qszq
1369286860.0,1evyq5,1.5 Gram Shroom Cookies yumm,Murphmonster,13,5,8,,t5_2qszq,False
1367034630.0,1d7621,"First time shrooming, report",would_not_approve,13,4,http://www.reddit.com/r/shrooms/comments/1d7621/first_time_shrooming_report/

So... I usually use trees

So we chilled out in a room and ate them with lemonade. I was told that they are awful, and they got stuck in my teeth.

We smoked a couple of bowls and relaxed for about an hour

suddenly, warriors, tidal waves, a whole art show in one tub of peanut butter.

at about that time, but the music stopped when I went inside, like I was leaving the world. We did eventually go in, and that's when the crazy stuff started happening. I felt the need to go into the bathroom, turn off the lights, and rest in the tub, but I saw dead people and writhing monsters in my mind. strangely, I wasn't scared

My Ego drew me to my friends for more entertainment and I found them in one of their rooms (we all live together) listening to techno in the dark watching Gordon Ramsay prepare food. The music matched with the show perfectly. My fiance was on the floor commenting about how she needs to feel better about herself and make comic strips

Suddenly i felt a twang

After my friends left, the third friend found me and we went into her room with her boyfriend, smoked some trees, and chilled out, as I had become a snail. The beanbag was now my shell.

I got lonely for my fiance, but she had to pee and my second friend took the beanbag!

""Pillow you whore!"" I shouted (mind you, but it was to no avail. the pillow was his now. We watched some music videos, including something called post-rap, and some angry music, which was really cool. Then I played the [Pucca song](http://www.youtube.com/watch?v=Yb946g2yOig) (it's one of the happiest songs ever). We all loved it. at that time, they got tired so my fiance went into our room, ordered pizza, but it is all I remember.

After report: My cheeks hurt from smiling so much

Thank you for reading

TL;Dr: That was the best time of my life. I will have to do again. I saw  stuff,,False,self,t5_2qszq,False,,True
1366578606.0,1ctkbx,"First time trip report, and the best night of my life",CJrox,12,3,http://www.reddit.com/r/shrooms/comments/1ctkbx/first_time_trip_report_and_the_best_night_of_my/

We had put together like $80 bucks or something and bought 4 Peanut Butter and Chocolate shroom cups, the chocolates tasted so bad that I could barely stomach them and nearly puked with each bite, but I suffered through them (oddly enough the guy who only had 1 was the only of us who actually liked them. Us and our sitter then sat around in my friend's house for like an hour playing guitar hero and just relaxing. At the time I didn't feel anything, aside from wanting to throw up, but as time went on I started feeling slightly more happy and a few colors would be more vibrant than before. Both my friends felt the effects before myself as they began to just run around and just have a fun time but I still felt relatively normal.
After about 2 hours I and the friend who's house we were at decided that we felt relatively normal and wanted to go smoke a bowl to see how we felt after that

During our time in the car we spent maybe 5 minutes out of 30+ smoking, but we were starting to peak actually and we spent our time in the car going on about how much we mean to each other as friends, and how the 3 of us are like family to each other, and other such things. After our sitter checked in on us a few times we headed back indoors.

Earlier in the night we had set up a really cool lamp that had 5 small lamps on it, and how cool it was. Then Friend 1 (guy who's house we were at) was going on about how cool the blue one was even though it didn't work, and then while explaining this he moved it to stand straight up and compare it to our sitter and how he watched over us when suddenly it turned on. This, as simple as it was, was utter fascinating and mindblowing to the three of us and we sat there laughing and in awe. And then friend 1 was waving his arms around and accidentally hit the not working lamp with his arm as the blue went out and it turned back on.

Most of the night continued with shenanigans

I've got to admit that shrooms were nothing like what I expected, but I will never regret it either, ever subtle change feels for the better.

TL;DR: I tried shrooms with my friends and aside from awful taste and nearly puking I had the greatest and most eye-opening/lifechanging and power experiences of my life.",self,t5_2qszq,False,,,True,http://www.reddit.com/r/shrooms/comments/1ctkbx/first_time_trip_report_and_the_best_night_of_my/
1365710703.0,1c5np2,Frozen shroom peanut butter sandwich?,muchmadness,13,3,2,"A couple of months ago (Edit: Actually four months ago), though

Now I have frozen shroom peanut butter sandwiches.  I know you can freeze peanut butter sandwiches and they're still edible

*Edit for those interested: We ate the sandwiches and had a great time.  They may have lost some potency,False,self,t5_2qszq,1365775689.0,,,t3_1c5np2
1365626840.0,1c36dr,Has anyone ever done this when on shrooms?,Ensiferum,11,2,0,,t5_2qszq,False
1364731295.0,1bcrq7,Another 1st timer question !,BlueberryWorms,11,3,17,"Me and my 2 close friends have never done shrooms before. We are purchasing 1/8 for 40$

Questions
1-Is that enough for 3 first time users?
2-Do we need a sober person to watch over us?
3-How long does a first time users trip last?
4-How likely is a bad trip and what are the consequences of a bad trip?

Thanks guys I'm really excited :)",self,t5_2qszq,False,,,True,http://www.reddit.com/r/shrooms/comments/1bcrq7/another_1st_timer_question/
1363205194.0,1a8jbf,"Gnarly lookin' shroom in this crop, is it still good? Looks like mold",Bobthehog,11,4,http://www.reddit.com/r/shrooms/comments/1a8jbf/gnarly_lookin_shroom_in_this_crop_is_it_still/,http://d.thumbs.redditmedia.com/KmsstPATScVN1FKu.jpg,
1362709179.0,19vx8e,"
First time solo adventure on shrooms tomorrow... Need help.",0,14,http://www.reddit.com/r/shrooms/comments/19vx8e/first_time_solo_adventure_on_shrooms_tomorrow/,"I was wondering what would be the correct dosage to take at 6'2 200 lbs. I am planning to go on an adventure in the woods with snow and coldness to search for the american dream. Anything I should worry about/keep in mind?

thank you very much
",self,t5_2qszq,False,,,True,http://www.reddit.com/r/shrooms/comments/19vx8e/first_time_solo_adventure_on_shrooms_tomorrow/
1362641598.0,19u28q,BE CAREFUL - I JUST WENT THROUGH LIVING HELL,omnibian,14,4,27,"Me and two other friends decided to take shrooms. We all took an eighth for our first experience (We later realized that this was maybe too big of a dosage).. this following story is about one of my friends that did it with us and I feel like this is important with any drug to know that it can have a negative effect and it should be respected. He weighed the least. Lets just call my friends S and the other A (A is the one who this whole ordeal happened too)

*Scroll all the way down for a shorter version

In the beginning, our pupils started to dilate. Nothing was really wrong and we seemed like we were about to have a good time. About 25 minutes in, we started seeing the floor breathe and it was pretty cool. I remember my friend A saying: ""I feel like I should be in a hospital bed"" which was obviously weird for him to say, but we discredited it as a joke. He started acting kind of weird, not willing to explore the house with me and S and just sat in the couch with 2 other people who were just drinking and playing cards and another person who was ""babysitting"" us on our first experience. After about 10 more minutes, me and S go into his mother's bedroom to look at ourselves in the mirror; we looked beautiful. A comes in the room and says he needs to lay down and he keeps asking me if the effects go away if he just sleeps but I tell him no. I start to get a little worried about him as I see he is not really enjoying it and he's starting to think the trip is going to get bad (If you think it, it will happen) but I try not to make it bother me because I really felt already I was fighting for my sanity as it kicked more and more in (If one bad thought took over my mind, just lay in the bed for 10 minutes and close your eyes and calm down and then come talk to us. He did so and me and S decide to go to the basement while our friend who is babysitting us (lets call him P) said he would check on him in 10 minutes. Meanwhile me and S were in the basement, my A friend takes the scissors and thrusts them as hard as he can in his chest and makes a weird grunting noise and my friend P stops him and takes the scissors and removes all sharp objects(please note that I was not aware of this happening as I was downstairs) and asks him why he did it to which he replied ""I need to die. I need to have sex right now. P, that early"" --- This is the last thing that he said that night that made sense. Two seconds after


*Short version*
I just held down one if my best friends down on the floor in a pool of blood as he was fighting my friends like a wild animal because he was trying to kill himself. he jumped through a window (he didn't open the window, cutting himself all over with glass then trying to stab himself with scissors and then he tried to get me to have sex with him. He said he couldn't feel anything. drugs. The actual experience of this is 100 worse than you think it was. thankfully we had great people there come help and strap him down in the car and drive him to the hospital. i talked to his step family and we both realized that he has major psychological issues that we never realized until now. however, he is now safe and just got released from the ER.

BE CAREFUL. 


P.S - I have been dealing with this reasonable well, what did you do? I don't know what to do. I am most likely going to counseling. 

Edit: so many errors and confusing sentences.

IMPORTANT EDIT: EDIT 2: there are people saying that I'm a complete idiot and what I did was stupid and I should've done this and that. I know this. Trust me, no more excuses, no more going around the facts. We were stupid, we paid the price and we have to face that. No lies. We told our parents - Something that would had never occurred to me happening before and they were VERY supportive, but still disappointed."" --",,False,t5_2qszq,True
1361860127.0,198vik,What is your most profound thought/experience that has happened during a shroom trip?,shrooms4life,11,1,17,,t5_2qszq,True
1359951445.0,17ujni,Bad pic. . But how do they look .. 14g of shrooms,TboneToker,20,12,6,,t5_2qszq,False
1359944785.0,17ubwf,Can dried mushrooms grow mold? How can I tell?,hehhehalright,11,2,13,"I have cubensis mushrooms in a plastic bag that I won't be eating for a couple weeks. Even then,,False
1359614366.0,17m7r4,The Skinny on Growing.,SteamedBrussleSprout,11,2,14,"Hey all,self,
1358527312.0,16tnd3,Do you dunk and roll or just dunk?,GottaAskme,12,3,7,I'm getting ready to go into birthing mode pretty soon. I was wondering if you guys have had experience with rolling after you dunk. Is the yield better if you do?,t5_2qszq,True
1357778248.0,16a6y6,Does anyone else get mad headaches after they come down?,YoungToke,12,1,12,I droppped around 6ish last night and after I came down around 9:30 I had a horrible headache all around the top of my head. I kept waking up at night with it and this morning I had it pretty bad. I took asprin after breakfast and its still there kind of. Anyone else get these?,t5_2qszq,True
1355620930.0,14x5i1,Tonight my best friend and I finally get to experience shrooms. Any last minute tips?,insta_mad,14,4,26,It just snowed for the first time in our town today and our plan during our trip is to walk around the neighborhood and enjoy my neighbors' Christmas lights. How does that sound?,t5_2qszq,True
1354510609.0,146otj,Lasting effects?,AliciaMarie5790,9,0,7,"So I'm still slightly coming down from my second magic mushroom trip and I'm not sure if the shrooms are still talking here but I feel
Some background: I have anxiety about everything and theres some depression too. I was once, like I know myself a little bit better, and like I'm less worried in general. 

Did anyone else come away from a trip with this experience? Do you think it actually changed you or could I still be experiencing some residual effects here?",self,t5_2qszq,False,,,True,http://www.reddit.com/r/shrooms/comments/146otj/lasting_effects/
1354291315.0,1420j4,'Shroom Tea...?,onkeljohn,12,1,20,"Hey r/shrooms - 

I'm going to be doing 'shrooms this afternoon

I'm fairly experience with mushrooms in general, as these are some of the strongest mushrooms I've ever had, and to waste them would be criminal. 

So, quick comedown. Chop up the mushies, get some water that's near boiling, throw the mushies in, let sit for 15 minutes, drink, trip. 

Now here are my questions:
1) Do I  need to add anything to the tea in addition to water? I don't care too much about taste

2) I've read a lot about doing washes of the 'shrooms

3) Can I finely chop up the 'shrooms and then put them in tea bags and staple them back together?

Thanks for your answers guys!
",self,t5_2qszq,False,,,True,http://www.reddit.com/r/shrooms/comments/1420j4/shroom_tea/
1353187319.0,13d99i,"New shroom hunter here, need help identifying these little buggers.",looneylevi,10,1,http://www.reddit.com/r/shrooms/comments/13d99i/new_shroom_hunter_here_need_help_identifying/,http://d.thumbs.redditmedia.com/29CKfCYM4UQeFw6W.jpg,
1349989177.0,11bvig,Tripping after donating blood?,Boogitybopshop,10,3,6,Today I donated blood at around 11:30 AM. Do you guys think ill be safe trip by tomorrow tonight? Do you think I should take a lower dose to compensate for blood loss?,t5_2qszq,True
1349454588.0,10zyqu,Drying shrooms?,pwjaonaj,10,1,27,"Do most people use a desiccant when drying their shrooms or is it not totally necessary? Is there some easier way


Thanks

-pwjaonaj",self,t5_2qszq,False,,,True,http://www.reddit.com/r/shrooms/comments/10zyqu/drying_shrooms/
1348288256.0,10aa17,"shake from an ounce, yay or nay?",doozerman,10,0,http://www.reddit.com/r/shrooms/comments/10aa17/shake_from_an_ounce_yay_or_nay/

its about 1.8g,False,self,t5_2qszq,False,,,t3_10aa17
1348280849.0,10a4pt,"I really enjoy this t-shirt entitled ""Magic Mushroom Trip"". The speech bubble is what gets me :D",1_0,10,1,1,,t5_2qszq,False
1347739781.0,zxu21,"So i've been out all day looking for liberty's.
How about these? [First]",1,13,http://www.reddit.com/r/shrooms/comments/zxu21/so_ive_been_out_all_day_looking_for_libertys_how/,,,False,t5_2qszq,False
1347734399.0,zxpca,"First timer here, I think things are off to a good start?",nathpenn,13,2,http://www.reddit.com/r/shrooms/comments/zxpca/first_timer_here_i_think_things_are_off_to_a_good/,http://e.thumbs.redditmedia.com/VPXMPU4KsgBgFhXX.jpg,
1345589181.0,ylsyb,can anyone tell me if either of these are magic,,14,4,12,,t5_2qszq,False
1345062484.0,ya3fk,What is this?,FlavorfulPigeon,9,0,6,,t5_2qszq,False
1344833434.0,y4nwl,Psychedelic Pareidolia and Synasthesia,bleedscolors,12,4,3,"Let's talk about the role of Pareidolia in a mushroom experience. I believe that much of our earliest religion came from pareidolia enhanced by hallucinogen leading to the beginnings of god and spirit related religious figures. Also the possibility of synasthesia being interpreted as divination or a communing with supernatural whatever the fucks =D

",self,t5_2qszq,False,,,True,http://www.reddit.com/r/shrooms/comments/y4nwl/psychedelic_pareidolia_and_synasthesia/
1343072875.0,x15xs,Input on the new design.,Curious_Individual,12,3,15,"As you guys have noticed

and of course,False,self,t5_2qszq,False,,,t3_x15xs
1338498115.0,uehhl,My tale of the forest,benwaaaaaaaah,12,1,2,"First I'd like to start by saying Hello /r/shrooms ! This is my first visit to your community and I surely don't want it to be my last. 

I had an amazing experience in the forests of northern Arizona last weekend and would like to share a small bit. I was up there with my girl and part of her family to spread the ashes of her recently deceased grandparents. We arrived Saturday mid-day and I started drinking some beers while my girl was drinking some Jack/Coke's. After we got camp setup everyone was drinking, accepted. About 30 minutes later, I was feeling pretty high on life and that's when I was offered shrooms.

One of her family members busted out a Tupperware container about 75% full of this magical fungi. Her and I (her first time doing shrooms and my second) both took decent size handfuls and munched them then washed them down with some H2O. This was around 5 pm. I would say they took about 20 minutes for me to start feeling them. It first started with a very light feeling. It felt as if my head and body weighed a lot less than it actually did. It felt great!!! 30-40 mins into the beginning stages of the trip my girl and I decide to walk the forest. We spent the next 2 hours looking at some of the most amazing images I have ever seen in my lifetime and giggling our asses off!!! I has so much fun. The trees were moving in unison beautifully. The forest ground was bright green from the grass, and the sky was beginning to turn orange and pink from the sunset. I stood in amazement as I tried to take all of this in. I would get lost looking at the trunk of an old tree that had fallen many years before and hear my girl call me to look at some pretty caterpillar.

I would look at something and just let my mind wander and do what it does and I would lose myself in the most peaceful way ever. I couldn't sit still, I did not see many mushrooms in it. Yes, I looked, don't judge me.

