created_utc,id,title,author,ups,downs,num_comments,selftext,subreddit_id,is_self
1361727030.0,195114,My first experience,syouganai,17,1,12,"So it has been a while now since I first did shrooms. About 2 months. I know many of you see these experience stories and lots of people post them but I just thought that a few of you might enjoy to read mine like I enjoy reading yours. I took about half an eighth with my bf early afternoon on a Sunday. When it started kicking in we were watching arrested development and green trails of light started to appear behind people walking on screen. Soon it looked like my entire wall was becoming the tv and I couldn't  handle looking at it. I went to talk to my roommate who was sober and quickly came to the conclusion that he could not keep up with my conversation and I left to go back to my room. 

I got stuck in my head, and felt timeless. This caused me to feel quite anxious but I managed. It was here that I figured out why it is called a ""trip."" When I closed my eyes I could still see in my mind. Was so bizarre. 

I dealt with these strange unexplainable visions in my head for a few hours until I reached a point where I could control my body and feel more connected so I got up and went back to my roommates room. He put on exogenesis symphony from Muse and it was fucking incredible. Those 3 tracks took me through every emotion and facet of my mind. I kept obsessing about things in my life...like my responsibility, I glanced at the clock and again my physical vision blurred as my mind took me elsewhere. I can't recall details of this part but I would snap back into lucidity and tell my roommate that I want to bring this back. Back to them. Back to the world. This new found truth that I had discovered. Part of that truth was an explanation on life...details evade me but I began thinking that I had ""woken"" up in this new reality. The new reality included this knowledge that our day to day lives were more controlled than we could possibly know...that there are cycles in life that are controlled outside of our knowledge. I dived further and further into music and tried to google a quote from my favorite series, Battlestar Galactica. ""Life has a melody Gaius. A rhythm of notes which become your existence once played in harmony with God's plan."" (Btw, I am atheist but this quote has always hit me hard. I love it. ) Anyway, I searched for this quote and as I was looking at the google results ...all of the links changed on their own. It was like the letters shifted into new words themselves and all of the search results were titles of all the songs that speak to my soul, so to speak. You know what I mean. 

Anyway soon after this, we are controlled. I thought that we had escaped so to speak...that me and my group of friends were using this time to meet for something...something big. Everything has a beat and a rhythm. I began thinking that my whole life was just set up for me (I was looping this back to the ""checks"" that always caught me before I could fail in life) everything made sense. I was so excited to believe that I could throw my whole life away for this new one. I kept tapping my foot to a beat this entire time (all along the watch tower) and no matter what was playing in the background, everything gravitated towards this beat. We were connected. 

As I type this I can't put into words what this did to me. My comedown was depressing. My brain was exhausted. I was upset that my new found knowledge of how there is so much more to life was just suddenly...gone. To this day I keep obsessing over one specific part. It was when I was looking up the ""Life has a melody gaius."" I felt like taking shrooms let me plug into something bigger, what are we, where are we"" my physical vision would blur...to my roommates I would zone out and speak a little nonsense but I would snap back into reality and I told them several times... ""I wish I could bring this back.""

I wish I could remember what ""this"" was. All I know is at the time it felt like some sort of grand enlightenment. Maybe someday I will remember. ",self,t5_2qszq,False,,,True,http://www.reddit.com/r/shrooms/comments/195114/my_first_experience/
1359228293.0,17bt7q,Has anyone tried magic truffles?,MMOTHS,16,1,13,"im thinking about ordering some magic truffles in and was wondering if anyone has done them and could offer an insight into the experience they had. 

saw this video on vice and it made me want to try some!
[vice on magic truffles](http://www.youtube.com/watch?v=Y8vaRVwF0xA)",self,t5_2qszq,False,,,True,http://www.reddit.com/r/shrooms/comments/17bt7q/has_anyone_tried_magic_truffles/
1359081165.0,178cg4,Does a first time trip at sand dunes sound like a terrible or an amazing idea?,menemai,19,4,20,"My friends an I have 10g between the 4 of us,,False
1357609413.0,165mm5,Shrooms and musical instruments?,ZLegacy,20,2,7,"Just curious as to how many people enjoy playing music or hearing instruments while shroomin.  New Years I was lucky enough to eat a batch and I had never picked up my guitar afterwards before,self,
1357479774.0,16265y,How to enhance your shrooming experience. ,salvu667,20,4,19,"Some of you may already know this. Grinding up your shrooms and putting them in lemon juice will make the effects of shrooms up to 3x stronger. All you have to do is frying up the shrooms

http://www.hipforums.com/newforums/showthread.php?t=385790",self,t5_2qszq,False,,,True,http://www.reddit.com/r/shrooms/comments/16265y/how_to_enhance_your_shrooming_experience/
1357428701.0,1614yn,"They spoke to me... i painted this after eating about 6 grams of my own aussies
",7,4,http://www.reddit.com/r/shrooms/comments/1614yn/they_spoke_to_me_i_painted_this_after_eating/,,,False,t5_2qszq,False
1353265067.0,13ep0c,What causes capless shrooms?,Linktor,18,3,17,,t5_2qszq,False
1350377688.0,11k93k,I had my first trip in my life this weekend in Amsterdam. It was really different.,bpkkdms,20,2,9,"My friend and I went to Amsterdam this past weekend. It was my first time there and my friend's been there several times before. First day


We woke up around 9AM in our hostel and had breakfast. We then rented bikes to go around the city for a couple hours. At around 1pm


After we waited half an hour


First, fast! I ran to the nearest fast food place and ordered fries. When I put that first fry in my mouth, I must have chewed it close to 5 minutes without successfully swallowing it. Later, I had to spit it out. I was desperately thinking to call a doctor or go to the police. At that point, I was feeling extremely small like a dwarf or even smaller and everything was much much bigger than me. Luckily, my friend was not feeling that bad and he was trying to help me overcome the anxiety.


It took us (me) around 2 hours to get over the anxiety. During that, we walked to the train station and were there around 5:30pm. We had 1 hour to kill but none of us had energy to do something. Last time we had something to eat was 8 hours ago and had been walking non-stop. So we stood there almost like zombies. We did not talk much. At one point, my friend had to pee so we ""tried"" to get into the station and find a toilet. When we found the toilet, we were too scared to go in! So, we got out of there and felt lucky to be alive (I know it sounds dumb but really that was the feeling). Finally, 10 minutes before our departure, we held hands together ( both male) and found our train and wagon and hop on it. 


The train ride was very calm. We talked non stop for 1.5 hours before a switch in my brain literally turned off. I was ""awake"" again and no more thoughts were rushing to my head. Everything seemed clear and silent. My friend experienced a similar wakening 5-10 minutes after than me. 


Sorry for the long post though I tried to leave a lot of details out. This was my first time living something this extreme. Your questions are always welcome.",self,t5_2qszq,1350378211.0,,,True,http://www.reddit.com/r/shrooms/comments/11k93k/i_had_my_first_trip_in_my_life_this_weekend_in/
1349433688.0,10zjjz,What is up with this color scheme?,Puppetz,19,3,14,"Brown on brown,False,
1345749033.0,ypldh,"Just found this sub-reddit, here are 3 drawings i made while on my first journey...",airbrush_wizard,19,2,http://www.reddit.com/r/shrooms/comments/ypldh/just_found_this_subreddit_here_are_3_drawings_i/

http://i.imgur.com/e6s58.jpg - 

http://i.imgur.com/grZks.jpg

i draw this stuff all the time",self,t5_2qszq,False,,,True,http://www.reddit.com/r/shrooms/comments/ypldh/just_found_this_subreddit_here_are_3_drawings_i/
1344369786.0,xu9he,"Last night, I became nature itself.",acdcfreak,19,4,http://www.reddit.com/r/shrooms/comments/xu9he/last_night_i_became_nature_itself/

2:20 am. I'm walking my bike up to my shed. I turn around and this cat that I had seen a few hours ago and had stopped to pet was behind me. 

It was a well fed black cat

He came up to me for more attention. I put my bike in the shed and turn around.

The cat is walking away, I notice the cat had followed me. He mows at me. I stare back at him.

Without skipping a beat

I kneel down to his level, but continues on.

At this point, around their trees, inspecting what he was inspecting and following him, all the while feeling like I was being led by the cat. 

He looked in a sewer pipe

Suddenly, about 9 or 10 feet off the ground. It continued to climb up and down the branches, and occasionally let out a meow.

At this point, something I had never witnessed before. I decided it was time to go, but I had no idea how to say this to the cat. I literally looked him in the eye, and went ""five...four...three..."" and counted to zero. At this point, he came down to the lower branches and was obviously looking for the easiest way down.

My jaw dropped. I had literally just counted down to zero and made an animal come down from a tree. I kept following him around and I tried to grab him a few times

What I see is this: A racoon, at their own rhythm and pace. I was at one with nature. I bent over and picked up the cat. I started to walk up my street, towards my house.

As if by magic, as I walked up my street holding this cat I had just met in my hands. The cat remained so calm, and I felt like he was an orb of power guiding my back home. I laughed, a crazy yet quiet mushy laugh, as I walked up the street. I felt emotions I can't even describe today.

I put the cat down infront of my house, and then disapeared into the backyard infront of my house. It was at this point that I went home.",,False,self,t5_2qszq,False,,
1341967009.0,wcx14,First time with shrooms do these look good,Sparks920,20,5,6,,t5_2qszq,False
1375687647.0,1jq7z8,Home-made Glovebox! TEK link in comments.,rivu,18,3,7,,t5_2qszq,False
1375172377.0,1jc5f7,Do u guys feel so emotional when tripping?,UnattendedBaggage,16,0,9,"All my emotions run to an all time high. There are tears sometimes,,1375212200.0
1375062650.0,1j8zm2,Best thing to watch on shrooms. (Animusic 2),ianrage30,19,5,2,,t5_2qszq,False
1373937326.0,1idq3g,Just had my first real trip.,trekore,17,3,10,"I had a small dose of shrooms (.9g) before just to try it, and stepped into the field of grass and clear skies with big puffy white clouds all around, instead of being in a building all day. Completely vibed with the environment."
1373404510.0,1hymh5,Can someone please help me out. These jars look like they have contaminants,ZDOmiami51,18,3,9,,t5_2qszq,False
1372674777.0,1hf3fl,I want to describe how psylocibin affects MY brain...,stretcheb,18,3,4,"because I read descriptions from people all the time and it hardly touches the prominent factors or my common trip. Obviously drugs affect each brain diffferently

*First of all

*The first word that always pops into my head to describe the place is ""simple"". Everything becomes much more simple to me. It's seems like there are less things in the world to think about and I can view everything as one simple thing with a wider view. 

*This one I have seen plenty of times but it is still a huge one. When I am tripping or ""in the place"" as I like to think of it

*I don't like moving. When I am in a safe place that's comfortable I see know purpose in doing anything and am perfectly content just sitting with some music for my whole trips.

I'm getting tired but I may edit more in tomorrow. For now,False,self,t5_2qszq,False,,,t3_1hf3fl
1371275610.0,1gdyej,"From Garfield's 9 Lives. Life #3. "" He told them never to open the crystal box on top of the checkered Toadstool.""",ouijahead,20,4,3,,t5_2qszq,False
1371229744.0,1gck86,"Some good ole, down south Panaeolus Cinctulus. Enjoy.",cheerioguvna,19,5,http://www.reddit.com/r/shrooms/comments/1gck86/some_good_ole_down_south_panaeolus_cinctulus_enjoy/,http://a.thumbs.redditmedia.com/1a4lPwNwYs2fFBol.jpg,
1369280847.0,1evsp8,How do these look guys?,Flyingpiez,22,6,4,,t5_2qszq,False
1368341114.0,1e68ek,The first day I ever found Psilocybe subtropicalis,AlanRockefeller,19,3,1,,t5_2qszq,False
1367276063.0,1ddcyp,Nature trip vs. Indoor/Online trip,Kyukumba,19,2,7,"There's an ongoing feud in a lot of drug subreddits about people who spend their trips going on reddit

I've always been one to spend a mushroom trip outdoors. However

I'll be eating an eighth that's in a chocolate. The set/setting will be kinda weird because I'm avoiding my family in the house a little bit. I'll probably stay in my room a lot. I've never tripped without smoking weed so that should definitely be a little weird. Let's see what happens. I'm excited.",self,t5_2qszq,False,,,True,http://www.reddit.com/r/shrooms/comments/1ddcyp/nature_trip_vs_indooronline_trip/
1364753757.0,1bdas1,First time grower. Is my entire first batch contaminated?,PollyNomial,19,4,20,,t5_2qszq,False
1363554801.0,1ahfzv,First time,fistingtrees,18,2,3,"So I did shrooms for the first time this spring break. I was walking around a very small coastal town (Seaside, and he was already really fucked up. So, and didnt even know whose house we were in. As we noticed someone with what looked like a small grinder

So yeah, it probably sounds stupid haha. I would love to hear what you guys think!



TL;DR: Did shrooms for the first time




Edit: Added TL;DR",self,t5_2qszq,False,,,True,http://www.reddit.com/r/shrooms/comments/1ahfzv/first_time/
1363391868.0,1adr59,"I don't have a scale, these are fresh, does it look like enough?",Bobthehog,17,13,False,
1360557015.0,18agih,How do my 50/50 mini tubs look? Ready to Fruit?,champinonesmagicales,18,3,4,,t5_2qszq,False
1356934536.0,15pnmx,Anyone from Illinois find psychedelic shrooms in the wild?,CommentsWhileStoned,17,2,5,,t5_2qszq,True
1352948357.0,137wa0,Thinking About using one of these to make some mushroom tea. Does anyone have any experience with using one of these or another tea infuser?,Mrsixxx,16,1,10,,t5_2qszq,False
1352358351.0,12uhx5,Which cap would you do?,chickenkabob,17,2,10,,t5_2qszq,False
1351208958.0,123g45,What gives Joe Rogan hope...,threenoms,17,3,3,,t5_2qszq,False
1342748114.0,wuma7,Shrooms Poem,chiquitobanana,22,7,0,"Random Saturday afternoon

4 Teens leaving soon

On a trip of their lives

Different backgrounds

One had a coma

The other never had a dad

Another lives a double life

And I'm just trying to find myself

One last cheers

Wait for it to sink in

Objects begin to move and appear

Hallucinations sooth me and disappear 

I chase the dark thoughts away

And welcome the peace

Now I'm sailing away

I begin to wonder what's real and not

A numbing feeling that it'll never stop

I wake up
",self,t5_2qszq,1342748297.0,,,True,http://www.reddit.com/r/shrooms/comments/wuma7/shrooms_poem/
1340827925.0,vpay6,You're not having a bad trip.,jkamalei,19,3,13,"Whenever I feel a bad trip coming on I tell myself ""You're on drugs and you're just having a tough time."" That usually keeps my adventures on a lighter and happier path.

What do you do to avoid bad trips?",self,t5_2qszq,False,,,True,http://www.reddit.com/r/shrooms/comments/vpay6/youre_not_having_a_bad_trip/
1339966876.0,v6xfv,Is this fuzz normal? Appeared on ALL cakes after dunking and rolling,twix1,17,0,13,,t5_2qszq,False
1338978363.0,unqvb,Small haul (subs),thrillho145,17,2,2,,t5_2qszq,False
1336219002.0,t88xm,David Cross on Tripping,i_never_know,15,2,1,,t5_2qszq,False
1335650344.0,sxbpn,Lost in shrooms. Drawn by me,bdrem01,15,0,2,,t5_2qszq,False
1376348559.0,1k8n4n,First time trip report. 5g,SPR19,19,3,10,"5g mushrooms
Before: 
I am going to take 5g dried mushrooms alone. I have no human company but my two dogs should keep me from feeling lonely, Neuro Bliss, coconut water, green tea, honey, and ginger root. I have some palo santo to light and meditate by while waiting for the trip to begin. I have also made an appropriate playlist of music to last throughout the experience. The weather is beautiful should I want to go out into nature, but the comfort of my home should provide a good setting. I realize that 5g is considered to be a strong dose, but I only have 5g and if I were to split it up I may not have the opportunity for a strong trip for quite some time. I can honestly say that I am not nervous at all. If this had been months or years ago I would most likely be nervous but that is no longer the case.
After: 
The mushrooms were much easier to eat plain than I had anticipated. I don’t understand the trouble some people have with it. They tasted earthy and plain. After eating them I drank a full glass of the drink that I made, and lit the palo santo. While waiting for the effects to begin I closed my eyes and meditated. I did not open them until I felt a strong body high starting to kick in. When I looked around the room everything still looked surprisingly normal, although this is probably not the correct word. I did not yet have any “visuals”, but the things around me seemed very strange. Objects that I had previously paid no attention to now seemed funny to me, and I couldn’t help but see faces and bodies in everything, much like cloud gazing. The next visual step was the colors. The smoke from the palo santo, as well as everything else, with almost no effort. The knowledge however was not gained, or I was just unaware of my the fact that it was there. Some things which I previously thought to be important issues to think about seemed silly, although the English language soon proved itself to be very insufficient. I kept telling myself that during some other trip I would write
	After a while my dogs needed to go outside so I stood up, moths, bees, flies, and other insects seemed to be highlighted and my attention was directed to them, as if my eyes were magnetized to life. When petting my dogs they seemed to be stuffed animals, but hollow on the inside except for a spirit that was, no less significant than my own. Rain soon started to fall
	When I returned inside my house, low light, and the scent of the palo santo transformed what was once simply my house into a sanctuary. I found myself appreciating the natural colors of my home, like the browns and greens, more than any others. When I sat down and covered myself with a blanket which proved to be a physical ecstasy, the inner dialogue resumed at full strength. I felt a strong desire to express myself through music, drawing, and writing, but instead a pure, meditating on the idea and even envisioning myself dying. None of this seemed the least bit frightening. It was a concept equally as beautiful to me as life
	As I found myself peaking, but it is worth noting that I remained firmly in this dimension. When I closed my eyes I still had visuals but the light that penetrated my eyelids was still disruptive, and when I put my hands over my eyelids this visuals became much more pure, like peering into space. I decided once again, to try this during another trip, with a blindfold, and perhaps hearing deprivation as well. Throughout my trip I felt a strong, in the back of my head. It did not feel painful and I mostly ignored it
	While my trip was still strong I suddenly felt myself compelled to something that I had not at all planned on. I somehow managed to turn on my TV and PS3
	When I felt myself starting to come down I took a shower, I felt down and disappointed with my ape-like, problem solving, sober consciousness. Nothing that I normally do to keep myself busy appealed to me in the least and I was very bored, although I had no desire to reflect on my trip. It was as if my brain was exhausted and needed to recharge. I went to sleep early, and when I woke up in the morning, despite the migraine, which was a very difficult task the night before.  As the day went on I found myself recalling more and more of it. Overall the trip was extremely positive.
",self,t5_2qszq,False,,,True,http://www.reddit.com/r/shrooms/comments/1k8n4n/first_time_trip_report_5g/
1376167181.0,1k3v7d,"My first trip - the good, the bad, and the kitten.",HateWinslet,15,5, it will not disappoint. The clouds were these infinitely cascading fractals with pale rainbow edges that sort of dissolved and swirled like paint. The bigger clouds had really big facets. This went on for about an hour or so. It was truly magnificent and I hope I never forget it.

2. I stood up and felt somewhat separated from my body. It was difficult to control it - I felt more like a pilot controlling a clumsy machine than a person. This continued throughout the trip and became a bit of a problem later on.

3. I stood and watched the dusk fall. My balcony faces east towards lake Michigan, in front of the backdrop of the neon fractal clouds, was incredible.

4. This is when I started feeling really melancholy about the futility of life. I was growing increasingly angry at how limited my body was. I kept thinking about how depressingly brief and fragile human life is - there are infinite beautiful things to see and hear and touch and experience emotionally

5. I went inside and talked to my kitten. This is the most ridiculous and hilarious part of the trip to me. I leaned down, so I kept telling her not to worry so much. 

6. I really, technology was very confusing - I didn't quite remember the differences between cable, internet, apple TV, and my phone. I texted my boyfriend and had to troubleshoot the modem while I was still on mushrooms.

7. Unfortunately, regardless of the fact that I knew it was a hallucination. I ran into the living room and things got real.

8. I sat on the couch and continued to feel sorry for myself - I was so frustrated about my limitations as a human in a body that I started punching my leg really hard. Understanding time was very difficult - I knew I'd be feeling better in a few hours

9. I finally managed to turn on the cable and felt instantly better - the temporal nature of television gave me something by which I could tell the passing of time. That was so comforting. Also, period. So, good luck there!

The whole trip only lasted about 4 hours. I ate 3 grams. I eventually managed to order some food and went outside to talk to my neighbors. I don't really feel like this was a bad trip - it just very real at times. I don't think I was expecting the self-reflection aspect of it to be so brutal and emotional. I study Buddhism and attend a temple regularly

I'm exhausted today and still a little foggy. I'm normally a good writer
",self,t5_2qszq,False,,,True,http://www.reddit.com/r/shrooms/comments/1k3v7d/my_first_trip_the_good_the_bad_and_the_kitten/
1375809945.0,1jtn8u,Is this a purple ringer? Found in a south florida horse pasture. There are hundreds sitting there waiting but I want to know for sure.,afreemind69,14,1,16,,t5_2qszq,False
1373617478.0,1i54en,Little harvest,maeon152,15,2,2,,t5_2qszq,False
1372816610.0,1hjfau,What kind of shrooms did I get? Bought a 8th for $30,nugs_mckenzie,18,3,29,,t5_2qszq,False
1372566275.0,1hckxm,Breaking Bread,SolarDriftwud,17,5,19,"At this moment

In preparation, a mini laser light show, and hes got a Hypnocube lol

We also have a cat.

See you guys on the other side! Cheers brothers and sisters!",self,t5_2qszq,False,,,True,http://www.reddit.com/r/shrooms/comments/1hckxm/breaking_bread/
1372277912.0,1h4qh4,"Sex on shrooms.... Good, bad, fun?",RedRam90,18,27,,False
1370741881.0,1fyi8a,Update: It took them long enough.,whynotsoserious,15,3,5,,t5_2qszq,False
1368563768.0,1ec5v2,Does anybody with autism have experience with shrooms?,ilikeshrooms,18,3,4,"I'm only slightly autistic

I'm also on medication

I already know about the trip-killing effects of the medicine

",self,t5_2qszq,False,,,True,http://www.reddit.com/r/shrooms/comments/1ec5v2/does_anybody_with_autism_have_experience_with/
1368424966.0,1e8b8s,Ran into this little one-eyed guy last night (Golden Teachers),quelnight,20,6,4,,t5_2qszq,False
