created_utc,id,title,author,ups,downs,num_comments,selftext,subreddit_id,is_self
1368121107.0,1e0hgh,"Vitruvian Man by Chris Toler, Danny's Ancient Art, Blacksburg Va.",oheythatguy,1877,49,False,
1372605280.0,1hd85k,Breathing by Joe W. Bremerton Wa,hellosquirtle,2273,886,83,,t5_2qj9g,False
1368540186.0,1ebbhb,(Unfinished) Octopus from Seattle Tattoo Emporium,Kailinee,2091,703,94,,t5_2qj9g,False
1361657818.0,193mn5,"Gf's In-progress Peacock Feather back piece by Joe at Blue Blood, Ottawa, ON",barrist,2135,46,False,
1351420998.0,127qt3,Tree of life tattoo,katemf,1905,520,46,,t5_2qj9g,False
1341726648.0,w7n4x,"My new tattoo! Action tattoo, Auburn WA",alyssakilledyou,1869,494,http://www.reddit.com/r/tattoos/comments/w7n4x/my_new_tattoo_action_tattoo_auburn_wa/,http://b.thumbs.redditmedia.com/tUvZXIoeG7vgoI6I.jpg,
1345976102.0,yujq4,No one can ever say this guy will regret getting it. (xpost from /r/pics),darthnuri,2023,646,68,,t5_2qj9g,False
1351291113.0,125c31,This beauty popped up on my Facebook feed. The artist is Carlos Torres.,karmacredditor,1689,314,38,,t5_2qj9g,False
1357959936.0,16f2dc,"Cattoo! by Dominick Manco at New Republic, Fort Wayne IN",mahhnica,1976,604,http://www.reddit.com/r/tattoos/comments/16f2dc/cattoo_by_dominick_manco_at_new_republic_fort/,http://b.thumbs.redditmedia.com/cCloBpE5P1Q7qlAO.jpg,
1368979936.0,1emw7l,"Feather tattoo- My favourite tattoo so far! Created and tattooed by Josie from Shaded Lady in Falmouth, Cornwall, England.",poofycakes,1935,24,False,
1352315574.0,12t8f2,My feet done by Jon Sanders in Colorado. Free hand drawn right onto my feet. ,corn4lunch,2088,719,59,,t5_2qj9g,False
1344966526.0,y7opk,Got my 10 Year Cancer Survivor Perk (cross-post),mongd66,1963,593,38,,t5_2qj9g,False
1367705999.0,1dp8ur,"My Japanese style owl completed. By Shayne at Triumph Tattoo, Burlington, wa. I know some of you suggested i leave it black.. I'm glad i went with color.",FuriousStyles13,1978,61,False,
1374625315.0,1ix7mf,My Jaguar- done by Al Perez at Zen Tattoo in SLC UT,xperrye,5441,4081,372,,t5_2qj9g,False
1374159612.0,1ik8ss,"Update: Forearm Tribal Coverup (Ricco Diamante, Gypsy Vault, Fort Wayne, IN)",rrkrueck,545,,False
1373074225.0,1hq49s,"Skull with sunflowers done by Paul Marino at Raw Power Tattoo in Feasterville, PA. Wish this was my tattoo.",i_am_indeed_human,2029,678,http://www.reddit.com/r/tattoos/comments/1hq49s/skull_with_sunflowers_done_by_paul_marino_at_raw/,http://e.thumbs.redditmedia.com/aChDTf_rHYno5vBd.jpg,
1358826625.0,17198w,"First tattoo, Plague Doctor by Teresa Sharpe @ Studio13 Tattoo, Fort Wayne, IN",makattak,379,,False
1358435535.0,16r5to,"My Adventure Time Tattoo done by Tony Amundson @ True Tattoo,  Richmond Va",iamgarrettt,2288,939,http://www.reddit.com/r/tattoos/comments/16r5to/my_adventure_time_tattoo_done_by_tony_amundson/,http://a.thumbs.redditmedia.com/qNnNRxYJj5M9rzof.jpg,
1351797299.0,12h0dk,Can anybody tell me who inked this masterpiece? Looking forward to see more works by him/her..,Endinelli,1899,545,60,,t5_2qj9g,False
1361718373.0,194tzx,"New tattoo, done by Frej Lind, Royal Arch Tattoo, Västerås, Sweden.",1854,,t5_2qj9g
1373225426.0,1hteri,First good piece and so stoked!!! By Frank Sanchez-cattattoo,sweetheather010,1981,630,89,,t5_2qj9g,False
1370668998.0,1fwv7v,broken angels sleeve - JUN CHA - LA,bluntobj3ct,1701,349,84,,t5_2qj9g,False
1353334568.0,13g8ei,"DNA Spiral Galaxy. First Sitting by David Rich, Vesania Ink",NorthChiller,1974,627,http://www.reddit.com/r/tattoos/comments/13g8ei/dna_spiral_galaxy_first_sitting_by_david_rich/,http://e.thumbs.redditmedia.com/ggVbWnhoYVd7O-6F.jpg,
1365428176.0,1bwzni,"Lace mandala- John Embry. Studio 14. Bowling Green, OH",marxist-tsar,1906,558,http://www.reddit.com/r/tattoos/comments/1bwzni/lace_mandala_john_embry_studio_14_bowling_green_oh/,http://b.thumbs.redditmedia.com/AOLnHz6RoxakQ6t1.jpg,machine
1356534888.0,15gx4k,"A double back piece by LittleSwastika, an artist I've admired for a long time.",FagOfTheAncients,2242,900,http://www.reddit.com/r/tattoos/comments/15gx4k/a_double_back_piece_by_littleswastika_an_artist/,http://c.thumbs.redditmedia.com/P5BozG2irXn8j4cn.jpg,
1351346206.0,1267vo,My First Tattoo - A Sweet Elephant.,mambacon,1904,563,59,,t5_2qj9g,False
1353466629.0,13jnw3,"My tree and birds. (Joey Hamilton, Club Tattoo, Vegas)",jbennett21,1863,37,False,
1354890703.0,14g0nk,"Saw this on fb- By Cindy Vega in Philadelphia, she is so amazing!",flufflesUSA,1640,297,http://www.reddit.com/r/tattoos/comments/14g0nk/saw_this_on_fb_by_cindy_vega_in_philadelphia_she/,http://a.thumbs.redditmedia.com/jPcLCQ0WIHn9X4f6.jpg,
1362565121.0,19rot5,"Done in one sitting [Not my piece] - Glen Hartless @ Bondi Ink, Sydney Australia",R3Mx,1876,548,http://www.reddit.com/r/tattoos/comments/19rot5/done_in_one_sitting_not_my_piece_glen_hartless/,nsfw,
1348668619.0,10i93v,"Brave Little Toaster done by Mindy @ Studio XIII in Cocoa Beach, Florida",Klucka,1844,518,http://www.reddit.com/r/tattoos/comments/10i93v/brave_little_toaster_done_by_mindy_studio_xiii_in/,http://d.thumbs.redditmedia.com/f6RULMkS6mPDBUCu.jpg,
1366254552.0,1ckz0n,"The sister and I figured we get one together. By Sam Guin at Artful Inc, Wilmington, NC",CJreye,2588,177,False,
1371170867.0,1gb2uf,I was blinded by a pencil in one eye a few years ago. Decided to get this today. [Done by: Dynamic Tattoos],angryscottsmen,2031,703,118,,t5_2qj9g,False
1361995325.0,19chrx,"Origami chicken with an obituary pirate hat- John Embry. Studio 14. Bowling Green, OH",marxist-tsar,1755,433,http://www.reddit.com/r/tattoos/comments/19chrx/origami_chicken_with_an_obituary_pirate_hat_john/,http://c.thumbs.redditmedia.com/irT10XpbtqJkbYXD.jpg,machine
1364206265.0,1aysj5,Is there a name for this style? Or any particular artist that does similar things? ,runtskies,1931,613,260,,t5_2qj9g,False
1364043100.0,1auu8l,Anybody know what this style is called? Or artists who do similar things? I think the artist is Brian Gomes but his online portfolio is down.,bangbang-,1756,433,68,,t5_2qj9g,False
1357574452.0,164h9q,Anatomical tattoo by Josh Payne,neffhead,2189,878,118,,t5_2qj9g,False
1359994793.0,17vedz,Hummingbird by Ellen Westholm,neffhead,1595,280,39,,t5_2qj9g,False
1354736068.0,14c6ef,My sleeve. Dragon and chrysanthemums. Done by Kanae @ Nine Tails Tattoo (London),Toomm,1756,444,81,,t5_2qj9g,False
1369146767.0,1erk5i,New tattoo for my daughter (Blake Irizumi),CU_Roo,2070,758,51,,t5_2qj9g,False
1359932875.0,17tz1q,"I don't have any tattoos, but I thought this up and drew it in pen with the possibility that I might actually get this done.",microcoins912,1974,662,http://www.reddit.com/r/tattoos/comments/17tz1q/i_dont_have_any_tattoos_but_i_thought_this_up_and/,http://a.thumbs.redditmedia.com/xqAUlTUQBcvwq_Vf.jpg,
1365614871.0,1c2pji,"My first tattoo, a Farschian Persian miniature by Kevin Stress in Columbus, OH",mytattoothrowaway,1732,86,False,
1351177845.0,122h2c,"Alex Grey's ""Oversoul"" on the forearm.",Devin_Cardosi,1746,440,67,,t5_2qj9g,False
1347601829.0,zv4yu,My Velma tattoo by Jay Wheeler at Eternal Tattoo in Livonia MI,wmubronco03,1938,635,102,,t5_2qj9g,False
1348540247.0,10ffl5,Side Piece completed...what do you think?,skunkape007,1860,557,95,,t5_2qj9g,False
1371332318.0,1gf4yj,"My first tattoo! Done by Jesse Perrault @ Daggermouth Tattoo Co. Calgary, AB (First post =])",Flyynak3d,1723,422,http://www.reddit.com/r/tattoos/comments/1gf4yj/my_first_tattoo_done_by_jesse_perrault/,http://d.thumbs.redditmedia.com/9VrazTs6XVFVEb3u.jpg,
1359058477.0,177j16,"Spirited Away / Miyazaki inspired tattoo in progress by Colbey Joyce of Black Hive Tattoo in Jacksonville, FL.",pinkconverse,1968,666,http://www.reddit.com/r/tattoos/comments/177j16/spirited_away_miyazaki_inspired_tattoo_in/,http://b.thumbs.redditmedia.com/fY6RzBgpyQOgZwwU.jpg,
1372536500.0,1hbroz,"Victorian heart w/ Da Vinci wings chest piece by Randy Muller @ Eye Candy Tattoo in New Orleans, LA",rollotony,1822,521,http://www.reddit.com/r/tattoos/comments/1hbroz/victorian_heart_w_da_vinci_wings_chest_piece_by/,http://a.thumbs.redditmedia.com/XWJOMXX0tBzvQJ7r.jpg,
1358880371.0,172hrb,"My baby sister passed away after 7 years battling terminal illness one year ago today - Matthew Stella @ Old Town Ink, Scottsdale AZ",damienshredz,1989,695,http://www.reddit.com/r/tattoos/comments/172hrb/my_baby_sister_passed_away_after_7_years_battling/,http://f.thumbs.redditmedia.com/vxOlxa4Hfq5soSew.jpg,
1356355152.0,15dfoo,Owl cover-up of my ghetto-ass army tattoo - Tattoo by Tom Kipp - Colorado,improphesize,1739,457,45,,t5_2qj9g,False
1374353018.0,1ipp1m,"Carved Skull Tattoo , Hayley Lakeman of Fu's Custom Tattoo Charlotte NC",the_sheist,1744,463,http://www.reddit.com/r/tattoos/comments/1ipp1m/carved_skull_tattoo_hayley_lakeman_of_fus_custom/,http://d.thumbs.redditmedia.com/2eJpjOtBsVZ0_ZSo.jpg,
1350397287.0,11kjx8,My only tattoo! Cherry blossom &amp; purple finches done by Renee Little @ Foolish Pride in St. Pete FL (:,scissorbaby,1672,384,44,,t5_2qj9g,False
1329963960.0,q1vk5,My gates of Moria.,,1906,620,229,,t5_2qj9g,False
1339160655.0,uri8h,"I literally said ""I want a lion coming out of the ground with a lot of color"" - Piece done by Blenner Silva ",Kiangel,1953,671,56,,t5_2qj9g,False
1363808627.0,1aol8w,"My brother's Detroit-themed tattoo by Jimmie Hayes at Liquid Chaos in Brownstown, MI",killingword,1868,586,http://www.reddit.com/r/tattoos/comments/1aol8w/my_brothers_detroitthemed_tattoo_by_jimmie_hayes/,http://f.thumbs.redditmedia.com/Z_SWIz1D8GPibBtG.jpg,
1369606735.0,1f3qgv,"Matt Hitt. Pins and Needles, MD",jimelovyacht,1868,595,http://www.reddit.com/r/tattoos/comments/1f3qgv/matt_hitt_pins_and_needles_md/,http://d.thumbs.redditmedia.com/9RAgOcMzqPymMjg-.jpg,
1347099172.0,zju8c,"Had the first session for my left arm sleeve done last night by Gino Anglov, Diamond Jacks [Soho]. What do you think?",jimjamwood,1952,674,http://www.reddit.com/r/tattoos/comments/zju8c/had_the_first_session_for_my_left_arm_sleeve_done/,http://c.thumbs.redditmedia.com/oSpIFh1Hw3ie13bz.jpg,
1368313265.0,1e5jha,"Just keep swimming - by Eric at Evolver Tattoo in Pittsburgh, PA",DoriIsRad,2271,994,http://www.reddit.com/r/tattoos/comments/1e5jha/just_keep_swimming_by_eric_at_evolver_tattoo_in/,http://a.thumbs.redditmedia.com/R7J70Gjl0v5nM-S0.jpg,
1373132042.0,1hr99k,"Amaryllis, Plumeria, and Jasmine Flowers by Jesse Buman - Black Cat Tattoos, Pittsburgh, PA",1996,,t5_2qj9g
1364331824.0,1b2dsp,"Cross section of tree tattoo by Dave Maier, Strange City. (xpost from /r/bodymods)",Galacy,1874,604,http://www.reddit.com/r/tattoos/comments/1b2dsp/cross_section_of_tree_tattoo_by_dave_maier/,http://d.thumbs.redditmedia.com/KJ6PuJyNSe3zd2G-.jpg,
1354038152.0,13vs9s,"My broken Pocket Watch. Nick @ OTT, Edinburgh",hypercinth,1743,465,http://www.reddit.com/r/tattoos/comments/13vs9s/my_broken_pocket_watch_nick_ott_edinburgh/,http://c.thumbs.redditmedia.com/G17LoltsWN2Lat1V.jpg,
1364656904.0,1bazcq,"Got my old tribal lasered and covered with a sailing ship by Cap Szumski, Timeless Tattoo, Atlanta, GA",rickmacc,464,,False
1371563091.0,1gl0my,"I got this almost a year ago, it's my biggest best piece yet! Ravenskin, Isle of Wight UK",joezeff,1955,66,False,
1351593737.0,12byo2,"Any love for a Geek tatoo? Done by Bacanu Bogdan at 2nd Face in Bucharest, RO",boosnow,1962,685,http://www.reddit.com/r/tattoos/comments/12byo2/any_love_for_a_geek_tatoo_done_by_bacanu_bogdan/,http://d.thumbs.redditmedia.com/jjorpHiiCTX8I1UQ.jpg,
1364747894.0,1bd4an,Probably the nicest use of white ink I've seen. Easy Sacha @ Mystery Tattoo Club. Not mine.,Toomm,1781,510,68,,t5_2qj9g,False
1361767163.0,196an6,"6 hours of pain for this. Full spine with DNA double helix. Done by Yngve Opaker, Frontline Tattoos, Oceanside CA.",earthwormjim91,2144,135,False,
1370097467.0,1fgrjv,"my second tattoo, a dedication to the first album I ever heard. Done by Ryan Fink @ Empire Tattoo- Asheville, NC",callicott,1682,43,False,
1352482139.0,12x6ps,Hi Reddit! They put me on the cover of the World's Largest-Selling Tattoo Magazine this month!! ,covermodel,1698,431,109,,t5_2qj9g,False
1347201397.0,zlpal,"Dad passed in 2002 when I was 11. After 10 years of not being sure what to get, I found an old signature of his and got it on my bicep (my first tattoo)",Raffinator,2047,790,http://www.reddit.com/r/tattoos/comments/zlpal/dad_passed_in_2002_when_i_was_11_after_10_years/,http://d.thumbs.redditmedia.com/Z-tuM21C0jQ6-qO-.jpg,
1364571959.0,1b8w5i,"finished tree half sleeve by Oak Adams at Painted Temple in SLC,UT",viccyslade,1758,497,http://www.reddit.com/r/tattoos/comments/1b8w5i/finished_tree_half_sleeve_by_oak_adams_at_painted/,http://b.thumbs.redditmedia.com/SaLouC1f681spIZI.jpg,
1346084543.0,ywqze,"It's only forever, not long at all",herlifedistractions,2001,736,http://www.reddit.com/r/tattoos/comments/ywqze/its_only_forever_not_long_at_all/,http://a.thumbs.redditmedia.com/udpJOe_7S5xWmKUZ.jpg,
1353514424.0,13kk7u,American flag embroidered. Joey Hamilton Vegas.,scottsusername,1967,705,175,,t5_2qj9g,False
1367332185.0,1deudk,"I always get shit for this tattoo, yet it's a 700 year old crest, and that's just how it looks. Crest of the town in Germany where my grandparents came from. (Fuz - True Image Tattoo, New Ken, PA)",2829,,t5_2qj9g
1367999395.0,1dx5go,"My first tattoo, a custom pauldron courtesy of Jake DeSade from Bushido Tattoo, Calgary AB Canada",DivineLines,1653,62,False,
1351275025.0,124vdt,"My half sleeve, second sitting, DONE! ",poopoochewer,1704,68,False,
1361230337.0,18s5vl,Traditional wolf done by Garret at Atomic tattoo.,Justdandy325,1515,259,50,,t5_2qj9g,False
1373905544.0,1icips,"Dark jellyfish. Two sessions of a half sleeve/cover up. Done by Michael J. Kelly of Dreams Collide in Lancaster, PA.",sloppyjoepa,1752,507,http://www.reddit.com/r/tattoos/comments/1icips/dark_jellyfish_two_sessions_of_a_half_sleevecover/,http://a.thumbs.redditmedia.com/yjCmdJmTQXXelAHT.jpg,
1346555146.0,z7qbr,My autistic little brother draws comic books. I got his characters tattooed on my back. He was ecstatic when I showed him.,adamandatium,1936,687,96,,t5_2qj9g,False
1369623561.0,1f475f,Update on Front Back Side Chest tattoo all done by Wes Brown @Rebel Muse Tattoo Studio in Lewisville TX...work in progress!,henman09,1585,338,59,,t5_2qj9g,False
1353411223.0,13i6ta,"Underwater Scene done by David Allen, originally of Blue Bird Tattoo in Portage, IN",CivEngineer,1593,72,False,
1343529849.0,xbqns,My first (but not my last) Yann Black tattoo!,furry_lumps,1699,459,76,,t5_2qj9g,False
1365185392.0,1bqxfr,Session two of three. Done by Chris Hale at Bigfoot Tattoo in Des Moines.,UnmuzzledSkunk,1672,432,73,,t5_2qj9g,False
1340584925.0,vjpxx,My Before and After,Fuzzbump,2230,990,187,,t5_2qj9g,False
1350477243.0,11mklw,"Batman fighting a giant octopus with a guitar. Done by Timmy Bee at the Electric Chair Clio, Mi",DesolationK,1845,604,http://www.reddit.com/r/tattoos/comments/11mklw/batman_fighting_a_giant_octopus_with_a_guitar/,http://c.thumbs.redditmedia.com/G2CMuY2BugriTI1t.jpg,
1373730050.0,1i7z42,"A ship in a teacup by Chris Anthon (guest spot at The Pearl Harbor Gift Shop, Toronto ON)",Bananafana,1725,487,http://www.reddit.com/r/tattoos/comments/1i7z42/a_ship_in_a_teacup_by_chris_anthon_guest_spot_at/,http://d.thumbs.redditmedia.com/fmFg791GVl_ig5E-.jpg,
1346843347.0,zdz1z,"Completed 14th Century Vampire - Justin Acca, Melb",forevermelborn,1678,440,http://www.reddit.com/r/tattoos/comments/zdz1z/completed_14th_century_vampire_justin_acca_melb/,http://a.thumbs.redditmedia.com/U4KfWfFfMcOlEuLN.jpg,
1376232847.0,1k5963,"Session two of many to start my sleeve. Outer space with a futuristic clipper ship. [By Curtis @ The Gallery in Lansing, MI.]",t3h_jream,1680,450,http://www.reddit.com/r/tattoos/comments/1k5963/session_two_of_many_to_start_my_sleeve_outer/,http://f.thumbs.redditmedia.com/n7OfJIOx48v7xUm5.jpg,
1350700396.0,11s5hd,"My first tattoo, done by Wendi from Rising Dragon Tattoo, NY",rafaisalive,1630,71,False,
1369768047.0,1f7st6,"After first session. Theatrum Symbolica Tattoo Studio, Warsaw, Poland",MankiManki,1620,40,False,
1373520142.0,1i29ll,"My battle-scarred lion after session #1. Courtesy of Jamie Parker of MD Tattoo Studio, CA.",masemc21,1643,418,http://www.reddit.com/r/tattoos/comments/1i29ll/my_battlescarred_lion_after_session_1_courtesy_of/,http://b.thumbs.redditmedia.com/PhZL-JgSL4sEMHJU.jpg,
1364487855.0,1b6nee,"Adventure Time sleeve by Chelsea Rhea @ Amulet Tattoo, St. Pete FL",orangemitch,1936,713,http://www.reddit.com/r/tattoos/comments/1b6nee/adventure_time_sleeve_by_chelsea_rhea_amulet/,http://e.thumbs.redditmedia.com/y95jeQ7cllg5peOp.jpg,
1359985605.0,17v6c7,"Part of ongoing sleeve by Bettie @ Nico Tattoo, Athens",Cabal_stgm,1659,439,http://www.reddit.com/r/tattoos/comments/17v6c7/part_of_ongoing_sleeve_by_bettie_nico_tattoo/,http://e.thumbs.redditmedia.com/kiMMiBqtMFvQ75Td.jpg,
1351184115.0,122njd,"My friend's new hand piece. (Rob Mulligan, Colour Works, Dublin)",scruffygoldfish,1567,40,False,
1372371375.0,1h7iti,Soft Pin-up Girl // Sarah Savage // Wolf Sheep Arthouse // Victoria BC,swag_killers,1722,493,57,,t5_2qj9g,False
1372199681.0,1h2hfb,"It's finished! Design by /u/mclairelxs and done by Ashley Shafer at Olde School Tattoo (Marietta, GA)",Museguitar1,1596,366,http://www.reddit.com/r/tattoos/comments/1h2hfb/its_finished_design_by_umclairelxs_and_done_by/,http://d.thumbs.redditmedia.com/9lepVnu3TUu35vGQ.jpg,
1369178245.0,1espnm,"Eyeball in Space. Teresa Sharpe, Studio 13 Ft. Wayne, IN",electricinjectionx3,1605,65,False,
1373645980.0,1i5smz,"Death Moth, by Matthew Chahal, Welwyn Garden City, UK.",Jessikaness,434,,False
1357405671.0,160hlw,Keeping it classy - By Tini @ Hello Sailor UK,herboholic,1647,427,44,,t5_2qj9g,False
1340106600.0,v9tbw,"Rework of a messed up (then filled in) shamrock done by Gerrit at Voluta Tattoo, Indianapolis.",Sullio,1626,402,http://www.reddit.com/r/tattoos/comments/v9tbw/rework_of_a_messed_up_then_filled_in_shamrock/,http://c.thumbs.redditmedia.com/gKuq6ybzvcbv_-Yh.jpg,
1363260464.0,1aa1ev,"My buddy got a pinup girl tattoo, you can tell me what you think (Serenity Ink, Milwaukee WI)",Strygyr,1774,132,False,
1358867847.0,1722ya,"My father passed away when I was 7. He always wrote me letters when I was little, so in his memory I got his signature from one of them on my ribs. By Sky @ Chameleon Tattoo &amp; Body Piercing, Cambridge, MA.",seachelle94,502,,False
1342665402.0,wsoih,"Another session at Kapala Tattoo, Winnipeg. Medusa Thigh Piece. ALMOST DONE. NSFW",Retrodress,1618,399,http://www.reddit.com/r/tattoos/comments/wsoih/another_session_at_kapala_tattoo_winnipeg_medusa/,nsfw,
1358490560.0,16sysl,Camera tattoo for a professional photographer (Helma Van der Weide),seditious_commotion,2188,974,73,,t5_2qj9g,False
1372014174.0,1gx6r4,Tattoo artist asked me to make him a custom armrest...,rexkwondow,1686,474,40,,t5_2qj9g,False
1367839892.0,1dsc0q,"Anyone like black and gray? First session by Skip Sampson, 1603 Tattoo in Ybor City, FL.",elephino1,1779,45,False,
1362940284.0,1a187s,"Steve Zissou, by Rich Fisher, Division Tattoo in Madison Heights, MI",chrsbdfrd,494,,False
1361372676.0,18vzjx,"I am a molecular geneticist, here is my sleeve; by Mankan at Rough Stuff Tattoo in Uppsala, Sweden.",oftakofta,1618,190,False,
1376116643.0,1k2t9o,"Mercury wing (my first tattoo) by Ian Olsen at Wolf/Sheep Arthouse, Victoria, BC",xentech83,1669,48,False,
1366557109.0,1csvqp,"My tattoos always end up buried, I'm hoping that phase one of my biggest yet gets a little more attention. By Wayne at Hearts of Fire Tattoo in Springfield, MO.",thefuckyoumeantho,3207,150,False,
1363965384.0,1asw5s,"My very first tattoo done several years ago by Jerry Blades @ Ocho Placas, Miami FL",unradical,1670,458,http://www.reddit.com/r/tattoos/comments/1asw5s/my_very_first_tattoo_done_several_years_ago_by/,http://a.thumbs.redditmedia.com/smcUbdFsHIRlYP8l.jpg,
1355214556.0,14nnvp,Was told to post here. My pirate/kraken sleeve.,enjoythesho,1363,154,44,,t5_2qj9g,False
1348496980.0,10e5xz,Ondrash tattoo just posted this to his Facebook page. I am inlove. ,Freakmo,1704,500,39,,t5_2qj9g,False
1364237811.0,1azmgb,Finally done! Cover up done by Tiago Ciurcio (Campinas - SP - Brazil) ,Godmother,1880,677,71,,t5_2qj9g,False
1365580909.0,1c1utx,"My first tattoo, go big or go home right? ""Born of fire"" by Brian Wilson of scapegoat tattoo, Portland OR",Immadino,1479,64,False,
1368167117.0,1e205p,"Tattoo Rule #2 Broken: ""Always remember that tattoos are forever!"" Done by Chad Whitson at Bearcat Tattoo, San Diego, CA",hellsongs,1621,81,False,
1349461713.0,110623,Tattooist by Norman Rockwell,margot-tenenbaum,1627,424,31,,t5_2qj9g,False
1362408106.0,19n0tg,"Just got this coloured! By Morten at Lucky 7 tattoo, Oslo ",whatthehoth,1757,563,http://www.reddit.com/r/tattoos/comments/19n0tg/just_got_this_coloured_by_morten_at_lucky_7/,http://d.thumbs.redditmedia.com/Uqun5dYsu3qiDoK3.jpg,
1376237919.0,1k5dyu,1st session out of three from Deon - The Daily Dozen @Singapore,ohaiyofman,1556,361,38,,t5_2qj9g,False
1363459835.0,1af6cx,"This is too much of an addiction. Two-headed cat done by Nic Rummel at Brüt Tattoo in Charlotte, NC. ",,1737,542,http://www.reddit.com/r/tattoos/comments/1af6cx/this_is_too_much_of_an_addiction_twoheaded_cat/,http://c.thumbs.redditmedia.com/jVuuFv9C7ZBR_p08.jpg,
1359168299.0,17andl,"Sleeping Beauty/Kingdom Hearts sleeve by Sean Beck at Mom's Tattoos in Wilmington, NC",kitka_,1906,714,http://www.reddit.com/r/tattoos/comments/17andl/sleeping_beautykingdom_hearts_sleeve_by_sean_beck/,http://d.thumbs.redditmedia.com/jVzIxaFrtrMkHZu3.jpg,
1343195547.0,x49s5,Not a tattoo but this is the truth,willycamps78,1530,345,57,,t5_2qj9g,False
1368922078.0,1elrjf,"just done by kris bushing from undead ink, oceanside ny",ITidder,1735,550,http://www.reddit.com/r/tattoos/comments/1elrjf/just_done_by_kris_bushing_from_undead_ink/,default,
1344811434.0,y42zc,"Barcelona Stained Glass Toro tattoo done by Javier @ Urbe Tattoo in Sevilla, Spain",xHeiKe,1659,469,http://www.reddit.com/r/tattoos/comments/y42zc/barcelona_stained_glass_toro_tattoo_done_by/,http://d.thumbs.redditmedia.com/wVq3FqSz3Ysn8nqu.jpg,
1331750208.0,qwiqk,"Tattoo from a watercolor painting (Artist: Wes Carter, KY)",metalinjection,1421,238,http://www.reddit.com/r/tattoos/comments/qwiqk/tattoo_from_a_watercolor_painting_artist_wes/,http://d.thumbs.redditmedia.com/CP6JOSBSzwAeTfE-.jpg,
1366855206.0,1d1ysv,"My brand new tattoo. Courtesy of Shaun at Blue Flame in Raleigh, NC",athe-physic-ist,1669,480,http://www.reddit.com/r/tattoos/comments/1d1ysv/my_brand_new_tattoo_courtesy_of_shaun_at_blue/,http://a.thumbs.redditmedia.com/sNkIRoERM2GDlAcZ.jpg,
1368589126.0,1ed1pn,"My wolf. I've been wanting this for years and finally got it today! (Sorry, slightly blurry). Harley at SLC Ink, UT",coliekins,1965,111,True,
1367574877.0,1dm0af,"Nordic Art Nouveau(Hel, goddess of the underworld) by Peter Madsen at Meatshop Tattoo in Copenhagen, Denmark.",JohanEA,1514,44,False,
1367547769.0,1dlelx,"My Skull Kid from Majora's Mask by Joe P of Uncanny Ink, Pemberton NJ",PhourLoko,1557,376,http://www.reddit.com/r/tattoos/comments/1dlelx/my_skull_kid_from_majoras_mask_by_joe_p_of/,http://d.thumbs.redditmedia.com/XaNJzLo9zFXBDGs-.jpg,
1364911405.0,1bijr2,"UPDATED-Secret of NIMH sleeve by Joey Ortega, Austin, TX",chrislovin,1587,55,False,
1376345466.0,1k8j1g,My Wall-E tattoo done @ Texas Body Art in Houston by Jesse Montano,thelovepirate,1704,530,53,,t5_2qj9g,False
1361568951.0,191m64,"[UPDATE 2] Owl on skull half-sleeve - day after fourth sitting - by Joe at Blue Blood, Ottawa, ON",barrist,1531,31,False,
1371498426.0,1gjaoa,"A butterfly cover up, by Natalie at Inky Fingerz in Enfield, UK.",Night-Sprite,1712,41,False,
1374378162.0,1iqed9,"Tattoo by Drew at STR Body Modifications, Wyong AUS",kismet-happens,1532,363,http://www.reddit.com/r/tattoos/comments/1iqed9/tattoo_by_drew_at_str_body_modifications_wyong_aus/,http://a.thumbs.redditmedia.com/Xoy0waJATvFvR5n6.jpg,
1359633098.0,17miad,"Brother's Tribute Tattoo to our Deceased Sibling - Fred Giovanitti - Las Vegas, NV ",Nekronicle,1463,290,http://www.reddit.com/r/tattoos/comments/17miad/brothers_tribute_tattoo_to_our_deceased_sibling/,http://e.thumbs.redditmedia.com/_N0ckxIL34NrtfQF.jpg,
1354219828.0,140edh,My first tattoo as an apprentice on my own knee! At Pino Bros Ink Cambridge Mass,canavo,1651,480,74,,t5_2qj9g,False
1354375694.0,143sb4,"For my cake day, I share my Tom Waits/Sailor Jerry tattoo,  by my dear friend Jo Treder at Steady Tattoo in Minneapolis MN",Clint0nBukowski,1725,46,False,
1348193674.0,1087kb,"First session of my neural network tattoo - Matt Sevig @ Permanent Addiction Tattoo, Brooklyn Park, MN",BoomerFresh,1439,54,False,
1370040122.0,1fflah,"Stag of the sun tattoo done on me by Peter Madsen at Meatshop Tattoo in Copenhagen, Denmark",kirikiri1,1528,360,http://www.reddit.com/r/tattoos/comments/1fflah/stag_of_the_sun_tattoo_done_on_me_by_peter_madsen/,http://e.thumbs.redditmedia.com/86Itysm2HWKbbrGX.jpg,
1327390194.0,ou7ie,Can we agree that this is animal abuse?,Tyashi,1759,590,309,,t5_2qj9g,False
1321991280.0,mlt2q,"My Van Gogh half sleeve - Sacred Heart, Atl GA",Janus80,1630,465,http://www.reddit.com/r/tattoos/comments/mlt2q/my_van_gogh_half_sleeve_sacred_heart_atl_ga/,http://c.thumbs.redditmedia.com/2sjigejr3P2RsAED.jpg,
1338183909.0,u8c61,"Got this at Wild Monkey Tattoo in Hiroshima Japan, the artists name is Katsu, about 15 hours.",Fauxperle,1532,82,False,
1327634967.0,oymfd,I went cross-eyed tattooing this. ,Schismatron,1576,407,57,,t5_2qj9g,False
1375653421.0,1jpafp,"Shoulder piece done in 5 hour session done by Q at OC Tattoo, westminster",soggy_bread,1612,452,http://www.reddit.com/r/tattoos/comments/1jpafp/shoulder_piece_done_in_5_hour_session_done_by_q/,http://e.thumbs.redditmedia.com/mVxSPsyn64bq0VY4.jpg,
