created_utc,id,title,author,ups,downs,num_comments,selftext,subreddit_id,is_self
1351650275.0,12dkr4,"My friends amazing tattoo by Putte Broberg at Spooky Fish, Sweden",animissen,1294,344,http://www.reddit.com/r/tattoos/comments/12dkr4/my_friends_amazing_tattoo_by_putte_broberg_at/,http://f.thumbs.redditmedia.com/Brgv5ZdKM1Iwn_YY.jpg,
1345815958.0,yr4bc,"Tattoo artists and enthusiasts of Reddit, for my eighth tattoo I was thinking of getting this. Thoughts? Suggestions?",chlobab1,1278,335,http://www.reddit.com/r/tattoos/comments/yr4bc/tattoo_artists_and_enthusiasts_of_reddit_for_my/,http://b.thumbs.redditmedia.com/MFaurhWZyReSDS8y.jpg,
1348090812.0,105p0f,"""Where the Wild Things Are"" Tattoo sleeve finished!
by- Luke LoPorto @ Timmy Tattoo
www.loportoart.com",162,41,http://www.reddit.com/r/tattoos/comments/105p0f/where_the_wild_things_are_tattoo_sleeve_finished/,,,False,t5_2qj9g,False
1355594433.0,14whaw,Here's a sugar skull that doesn't make me roll my eyes! (Not mine) By Eric Marcinizyn ,criminal98,1110,164,23,,t5_2qj9g,False
1341521055.0,w3ecv,"2 sessions down, 1 to go (hopefully)",Sincitybartendress,1305,368,http://www.reddit.com/r/tattoos/comments/w3ecv/2_sessions_down_1_to_go_hopefully/,http://a.thumbs.redditmedia.com/u_ADjRGuk2NlwMrN.jpg,
1375555085.0,1jmz5l,Done by Jasen Workman @314 Tattoo. (Not mine),strange-pdx,1093,157,25,,t5_2qj9g,False
1355894964.0,153f3k,"Tentacles forever! - Ernesto Romero, Ink Lab, Minneapolis, MN",semioticghost,240,,False
1364827225.0,1bf9zj,"My bad ass velociraptor (Dave Tevenal, Memento Ink, Columbus, OH)",tanzanianchimp,925,,False
1343174364.0,x3ozq,A Sailor's Leg (Colored) by Ryan Thompson @ FREAKS KCMO,KCKFD,1196,260,53,,t5_2qj9g,False
1367454211.0,1dioaf,"Koi cover-up of a 10 year old mistake I got when I was 18. Work done by Kelly Rogers @ Gearhead Tattoo, Cape Coral, Fl",B3RT0,1195,120,False,
1359518904.0,17jiwy,"So I got a tattoo of the Joker a few weeks ago. Done by Irish Jay of Tattoo Lou's, Selden, NY",imail724,1186,40,False,
1345213951.0,ydm6m,My Sleeve - Carson Hill - LA,Vanflipx1000,1222,290,61,,t5_2qj9g,False
1374872553.0,1j4e4a,"My Boba Fett tattoo, done by master artist Jeff Stevens @ The Tattoo Station in Jackson TN. 7+ hours in 1 session!",Sirflow,1233,301,http://www.reddit.com/r/tattoos/comments/1j4e4a/my_boba_fett_tattoo_done_by_master_artist_jeff/,http://b.thumbs.redditmedia.com/Sexstk0CTCN5d_I7.jpg,
1373943929.0,1idyg7,My deer tattoo by Todd Bruce at Chameleon Ink in Bellingham WA.,PHatattacka,1462,530,64,,t5_2qj9g,False
1356004877.0,155wrr,Does anyone know the name of the artist or the style of the tattoo?,SouthAdministration,1269,337,182,,t5_2qj9g,False
1338678688.0,uht06,Sexy lil thing I got,Cdaisy5484,1288,361,70,,t5_2qj9g,False
1358628184.0,16w58z,"Wife wanted me to do her last night, this is what happened. SFW
Fab Stella @ Twistedstarr Tattoos - Toronto,1236,309,46,http://www.reddit.com/r/tattoos/comments/16w58z/wife_wanted_me_to_do_her_last_night_this_is_what/,,,http://f.thumbs.redditmedia.com/9_l5_mFMczAF2aP_.jpg,,
1352290922.0,12skwd,First tattoo by David Evans. Still gotta finish some shading and color. What do you think?,Mlcopeland02,1108,186,41,,t5_2qj9g,False
1350777825.0,11tkjq,"My first! Done in Galle, Sri Lanka in June",tenthweasley,1360,438,http://www.reddit.com/r/tattoos/comments/11tkjq/my_first_done_in_galle_sri_lanka_in_june/,http://e.thumbs.redditmedia.com/olNKKhc20xYi05PL.jpg,
1342713602.0,wtltw,Boba Fett and Han Solo in carbonated done by me @Outsiders Ink in Tulsa ,TrukstopCale,1211,294,77,,t5_2qj9g,False
1364654968.0,1baxp6,"Majoras mask WIP. Part of my coming Zelda sleeve. Done by Linn Theres @ Memento tattoo, Oslo.",itardz,1241,322,http://www.reddit.com/r/tattoos/comments/1baxp6/majoras_mask_wip_part_of_my_coming_zelda_sleeve/,http://b.thumbs.redditmedia.com/IAm9bNLJeUfLMh4y.jpg,
1359123659.0,1797e3,[UPDATE #2] Death Rides A Horse by Greggletron @ Scapegoat Tattoo PDX,bake-kujira,1175,257,57,,t5_2qj9g,False
1358972784.0,17557b,"The start of my half-sleeve Lotus/Mandala done by T-Reb at Vintage Ink Clearwater, Florida",christophersee,1199,282,http://www.reddit.com/r/tattoos/comments/17557b/the_start_of_my_halfsleeve_lotusmandala_done_by/,http://e.thumbs.redditmedia.com/bGTOZa62RNEVOIlp.jpg,
1356054811.0,157abt,Matteo Pasqualin - Love &amp; Heart via Facebook,BoydCrowder,1095,183,37,,t5_2qj9g,False
1363388535.0,1adnid,Ganesh by Champ at Guru Tattoo in San Diego,AndHankMardukas,1073,161,40,,t5_2qj9g,False
1361996540.0,19cjhz,Healed and a few years old on my boyfriend's arm- Willie Nelson by Horacio Martinez.,imasleep78,1243,325,44,,t5_2qj9g,False
1369517857.0,1f1s8z,Start of my Polish eagle chest piece. (Done by joey knuckles in Philadelphia),FupaLoofah,1195,282,63,,t5_2qj9g,False
1370233048.0,1fk8ig,"A pic of one of my favorite tattoo artists, Jeff Gogue and the work he did for Sylvester Stallone.",jesbaker,1193,284,http://www.reddit.com/r/tattoos/comments/1fk8ig/a_pic_of_one_of_my_favorite_tattoo_artists_jeff/,http://d.thumbs.redditmedia.com/JZOnwcf3zDO8bxd-.jpg,
1375417258.0,1jjmpo,My new flapper girl by James Clements on the road.,Still_In_Beta,1167,257,37,,t5_2qj9g,False
1369339799.0,1exaxb,"And Eve said to the serpent... (Baylen Levore in Austin, TX)",devilsho,1241,332,http://www.reddit.com/r/tattoos/comments/1exaxb/and_eve_said_to_the_serpent_baylen_levore_in/,http://c.thumbs.redditmedia.com/K9EWJrCv1oX_aYtz.jpg,
1365504826.0,1bzdbp,"My bunny Lotti - Kristin Schubert, Holy Diver Tattoo, Essen, Germany",ralf_nase,297,,False
1349972026.0,11bce7,"Killer tattoos by Kyle Wood from Port Orchard, Wa",ionfromneon,1070,167,http://www.reddit.com/r/tattoos/comments/11bce7/killer_tattoos_by_kyle_wood_from_port_orchard_wa/,http://e.thumbs.redditmedia.com/Jaa8Lh-V5EIDHwWv.jpg,
1317187699.0,ktsy9,"I decided to sell my house, quit my job, and travel abroad for as long as possible. Got this to commemorate the decision. (Chad Koeplinger)",beardstink,1044,112,False,
1371652958.0,1gno7o,Picasso's Don Quixote by Nano Prudencio at British Ink DC,spkr4thedead51,1159,260,27,,t5_2qj9g,False
1350359486.0,11jx1g,Got this tattooed on me a couple months back. The Thing!,modest811,1120,224,27,,t5_2qj9g,False
1366587706.0,1ctvk2,"Sak Yant - done by Thai monk outside of Chiang Mai, Thailand",faux_bacon,1117,219,http://www.reddit.com/r/tattoos/comments/1ctvk2/sak_yant_done_by_thai_monk_outside_of_chiang_mai/,http://a.thumbs.redditmedia.com/o_eNlPQR4AqmSlPr.jpg,
1365255023.0,1bsmca,Bite my shiny metal ass. Done by Aurore at Lowbrow Tattoo in Montpellier (France),Himynameiskuk,1150,251,17,,t5_2qj9g,False
1345738085.0,yp98l,"Space Tattoo!!!  Teresa Sharpe, Studio 13, Fort Wayne Indiana",electricinjectionx3,1177,51,False,
1349360436.0,10xpw0,"The Start Of My Video Game Sleeve. 
Done by R2 @ 27,SteveGives,1285,383,60,http://www.reddit.com/r/tattoos/comments/10xpw0/the_start_of_my_video_game_sleeve_done_by_r2_27/,,False,,http://imgur.com/a/VC5Iw
1339580034.0,uzkxs,"A classy looking chap, wouldn't you agree?",long_wang_big_balls,1177,276,http://www.reddit.com/r/tattoos/comments/uzkxs/a_classy_looking_chap_wouldnt_you_agree/,http://c.thumbs.redditmedia.com/L6z2UMNGmiq-eoBV.jpg,
1362948131.0,1a1h2l,"My second tattoo, a phoenix, done by Ania Jalosinska, Kolektiv Tattoo, Warsaw (Poland).",1136,,t5_2qj9g
1360383877.0,186dgg,"My Mucha inspired rib piece, by Johnny Smith @ Off the Map Tattoo, Easthamptom MA",SuperEr111,1192,41,False,
1373405306.0,1hynlx,"Incredible batman piece by Piotr 'Deadi' Dedel - not mine, but I had to share!",ehuehuehue,1082,192,http://www.reddit.com/r/tattoos/comments/1hynlx/incredible_batman_piece_by_piotr_deadi_dedel_not/,http://d.thumbs.redditmedia.com/dyqNwHZXh2djNGWu.jpg,
1375642997.0,1joyxz,2nd session on my chest piece. By Jacob Wiman @ Black Magic Tattoo Karlshamn.,El_invalido,1338,441,85,,t5_2qj9g,False
1349214976.0,10u8pc,My first tattoo. Weird whale (by Jimmy Duvall @Invictus),OceanMagnus,1064,167,34,,t5_2qj9g,False
1345433609.0,yi7dg,This is my wife's birthday gift she got in honor of my 4 month old daughter. Let me know what you think! :),BurstMountain,1260,364,42,,t5_2qj9g,False
1359835826.0,17rnzc,"Girlfriend's first tattoo! Ponderosa pine tree by Leland at Pigments-Phoenix, AZ",Chriss1234,1238,349,http://www.reddit.com/r/tattoos/comments/17rnzc/girlfriends_first_tattoo_ponderosa_pine_tree_by/,http://e.thumbs.redditmedia.com/QTmFrjhRxvCm_qjv.jpg,
1330966101.0,qiq95,Cyborg Tattoo...,columbopicasso,1459,577,29,,t5_2qj9g,False
1369955383.0,1fdamm,"Second session on my chest piece by Chad Hunt at Name Brand Tattoo in Ann Arbor, MI.",martyidk,1239,352,http://www.reddit.com/r/tattoos/comments/1fdamm/second_session_on_my_chest_piece_by_chad_hunt_at/,http://f.thumbs.redditmedia.com/OTvpWp4669yY3_ce.jpg,
1376326359.0,1k7sfi,"Amazing piece by JL Navette, Lyon, France",Bobiego,1144,20,True,
1359804340.0,17r03b,"Mike's tropical sleeve by Ray Hunt @ Diablo tattoo, Kent, UK",scuwiffpixi,1161,28,False,
1353673185.0,13nxx4,My first tattoo almost done!,Derpskut,1152,268,64,,t5_2qj9g,False
1352127696.0,12o389,"My newest tattoo! By Ailton Reis, Joinville, Brazil",hardocre,1174,37,False,
1366050547.0,1cek3v,"WiP: Wing in Progress by Ray Frost @ Ray's Tattoo in Lexington, KY",walkSMASHwalk,1189,305,http://www.reddit.com/r/tattoos/comments/1cek3v/wip_wing_in_progress_by_ray_frost_rays_tattoo_in/,http://a.thumbs.redditmedia.com/OyeN0eX25xlgm66H.jpg,
1363639054.0,1ajo7l,"Amazing black and grey work by Jason Butcher @ Immortal Ink, UK.  (NSFW)",DocKronyk,1135,251,http://www.reddit.com/r/tattoos/comments/1ajo7l/amazing_black_and_grey_work_by_jason_butcher/,nsfw,
1363211522.0,1a8s9p,Large Cover Up by Sarah Savage | Wolfsheep Arthouse | Victoria BC ,swag_killers,1104,214,38,,t5_2qj9g,False
1343590981.0,xcqi3,"My grandmother made this belt buckle out of bronze back in the '70's for my dad. I got it as a kid and now it's my first tattoo. Done by Fat Ram @ Pumpkin Tattoo, Jamaica Plain, MA.",VendingMachetes,1217,41,False,
1372517056.0,1hb88c,"Newest tattoo. Simple fox from Paul Terry @ Skin Kandi, St. Helens, UK.",badgersforbreakfast,1170,33,False,
1345495477.0,yjjah,"My first tattoo (and first post)! Done by Tara at Phenomabomb Tattoo, Dublin PA.",SassyMarzipan,1102,219,http://www.reddit.com/r/tattoos/comments/yjjah/my_first_tattoo_and_first_post_done_by_tara_at/,http://c.thumbs.redditmedia.com/VR-QAsxQkvXd3pg8.jpg,
1359080338.0,178bgg,"Posted this in r/tattoo a while back. Thought you guys might like it. Here is my dancing skeleton, thanks to Donovan from GoldenOwl. ",Wazoisme,1079,201,http://www.reddit.com/r/tattoos/comments/178bgg/posted_this_in_rtattoo_a_while_back_thought_you/,http://b.thumbs.redditmedia.com/jnMuiPbG4YhSqlEO.jpg,
1367530869.0,1dktws,"my amazing cicada tattoo by David Hale of Lovehawk Studios in Athens, GA",tessjoh,1077,197,http://www.reddit.com/r/tattoos/comments/1dktws/my_amazing_cicada_tattoo_by_david_hale_of/,http://f.thumbs.redditmedia.com/lDLetbZBfLMz2E9_.jpg,
1359334777.0,17edkz,"My Deja Entendu astronaut, done by Brent Gilmore at Euphoria Ink in Roselle NJ. (My first tattoo)",Dejadrums,1131,246,http://www.reddit.com/r/tattoos/comments/17edkz/my_deja_entendu_astronaut_done_by_brent_gilmore/,http://f.thumbs.redditmedia.com/e7ijqwt_ddUtzGhM.jpg,
1357485683.0,1629g9,"Wild Boar Torso - Progress Report (Jason Kelly @ Live Free - Atlanta, GA)",VonSockthroat,1308,427,http://www.reddit.com/r/tattoos/comments/1629g9/wild_boar_torso_progress_report_jason_kelly_live/,http://e.thumbs.redditmedia.com/77s6nGmj2Tw9-llv.jpg,
1371653273.0,1gnok4,Free Hand by Sam Hudson ( Houston ),Gunnerm3,1349,475,71,,t5_2qj9g,False
1376487860.0,1kcics,"My fresh semi traditional snake, dagger, and skull piece. Done by Alex Trufant at Trufant brothers tattoo San Angelo tx. Sorry for quality.",Red_Ryder93,1257,46,False,
1327088211.0,op7xu,"Thought I should share my chest piece on here. By Tim Biedron, Chicago.",beardstink,1139,269,http://www.reddit.com/r/tattoos/comments/op7xu/thought_i_should_share_my_chest_piece_on_here_by/,http://e.thumbs.redditmedia.com/R7WwZDzxFZYz7ySd.jpg,
1360213769.0,181rmk,"My bird tattoo, done by Dave Lekens at Vertigo Tattoo in NC.",giraffeshley,1151,276,http://www.reddit.com/r/tattoos/comments/181rmk/my_bird_tattoo_done_by_dave_lekens_at_vertigo/,http://d.thumbs.redditmedia.com/r-TSr8EnARp1IlZi.jpg,
1372703402.0,1hfwif,"[Pocket Watch] by Gene Coffey @ Tattoo Culture in Brooklyn, NY",videboi,1075,202,http://www.reddit.com/r/tattoos/comments/1hfwif/pocket_watch_by_gene_coffey_tattoo_culture_in/,http://d.thumbs.redditmedia.com/gAEN-7vPYWhOK_G9.jpg,
1366334560.0,1cnd7l,"Dragon and Koi Fish sleeve by Adam @ Rose Gold's Tattoo, San Francisco, CA",Tattoodles,1045,31,False,
1352849384.0,135f1z,"A feather copied from a quilt my mother gave me. Three Kings Tattoo, NYC - Tamara",Squidbat,1178,305,http://www.reddit.com/r/tattoos/comments/135f1z/a_feather_copied_from_a_quilt_my_mother_gave_me/,http://c.thumbs.redditmedia.com/LeSYd0hJcbREEs0n.jpg,
1370438669.0,1fpwi1,"Kraken half sleeve outline, by Johnny Mac @ Body Marx",cldumas,1133,264,http://www.reddit.com/r/tattoos/comments/1fpwi1/kraken_half_sleeve_outline_by_johnny_mac_body_marx/,http://b.thumbs.redditmedia.com/A2dBKAyOQkmv3aWg.jpg,
1354126454.0,13y0hs,"My phoenix chest piece done by Tio-lu in Mtl, Canada. Url of his website on the pic, go see his work :)",Rabbit_Gun,1195,83,False,
1360862691.0,18ivs1,"This was my first tattoo: Matryoshka done by Duke Riley (East River Tattoo, NYC)",EffinStaniel,1023,160,http://www.reddit.com/r/tattoos/comments/18ivs1/this_was_my_first_tattoo_matryoshka_done_by_duke/,http://b.thumbs.redditmedia.com/3qCIjq3lcZ6tL_H1.jpg,
1349281627.0,10vqz2,Third tattoo (derek hess piece),Deadbeats27,1280,413,104,,t5_2qj9g,False
1360030295.0,17wnkg,"Legoman Bob Ross
Artist: Ricky LaCapria
Instagram: Littlerickytattoo",195,21,http://www.reddit.com/r/tattoos/comments/17wnkg/legoman_bob_ross_artist_ricky_lacapria_instagram/,,,False,t5_2qj9g,False
1357287003.0,15xwkg,"Finished and (mostly) healed half sleeve.  Done by Satoru at One Shot Tattoo, Okinawa, Japan.",Geoffhahaha,1069,32,False,
1356807341.0,15mu86,"My mom passed away about two weeks ago, her Xmas gift to me was money for a new tattoo. Only right that I got it dedicated to her. Kevin at Sinn Fein, Baraboo WI.",SethIdol,1208,44,False,
1332331628.0,r6mo2,Terminator Tattoo,praveshrana68,1261,394,40,,t5_2qj9g,False
1375910946.0,1jwu00,"The first tattoo I ever got -Picasso's Don Quixote. Done by Bill at Ambrotos Tattoo, Silver Spring, MD.",Creothcean,1128,74,False,
1334514976.0,sb33r,Latest addition to my flight-themed sleeve.,attempted,1053,190,41,,t5_2qj9g,False
1362617401.0,19t9j9,"My Sisters Jack Tattoo - Done by Che, Current Tattoo - San Jose, CA (Possible NSFW)",BrookeWantsBaybuh,1364,55,True,
1362594485.0,19sese,"My finished Polynesian piece by Orly Locquiao | Humble Beginnings | San Jose, CA",phase2style,1185,317,http://www.reddit.com/r/tattoos/comments/19sese/my_finished_polynesian_piece_by_orly_locquiao/,http://f.thumbs.redditmedia.com/HkyKDlhKyJDqEXdY.jpg,
1365391607.0,1bw8y4,"Delirium Tremens inspired tattoo. Jordan Old Tyme tattoo - Fullerton, CA.",lytes,1094,235,http://www.reddit.com/r/tattoos/comments/1bw8y4/delirium_tremens_inspired_tattoo_jordan_old_tyme/,http://c.thumbs.redditmedia.com/wNulHxokcsQ6LRr2.jpg,
1353162469.0,13co6q,"My eye and dagger. Done by Jerry Old Dog at Lucky7 Oslo, Norway. ",heidaft,1123,258,http://www.reddit.com/r/tattoos/comments/13co6q/my_eye_and_dagger_done_by_jerry_old_dog_at_lucky7/,http://a.thumbs.redditmedia.com/9DSMDhkvoKzk807H.jpg,
1362602306.0,19sp5w,"How well would something like this, hold up over time?",IAmOnTwo,1066,208,http://www.reddit.com/r/tattoos/comments/19sp5w/how_well_would_something_like_this_hold_up_over/,http://e.thumbs.redditmedia.com/6mqPNwDRljoH2Mtd.jpg,
1355116589.0,14l81m,"My first tattoo done by Mike  at Old Glory Tattoo in Absbury Park, NJ.",GoSky,1120,256,http://www.reddit.com/r/tattoos/comments/14l81m/my_first_tattoo_done_by_mike_at_old_glory_tattoo/,http://c.thumbs.redditmedia.com/W08iO50u2sDL04-2.jpg,
1327695756.0,ozkg8,dia de los muertos,Paullelujah,1110,247,45,,t5_2qj9g,False
1339362001.0,uv2fq,"My girlfriend just got her Radiohead ""Meeting People is Easy"" tattoo finished! It turned out perfect!",sonik_tooth,1098,244,36,,t5_2qj9g,False
1371057095.0,1g7g6w,"After many weeks of names and symbols, I got to do 3 animal tattoos, my first attempts at realism and I'm so pleased :) (Jess Parry Tattoos, Shrewsbury UK)",Mylifeforhire,215,,False
1368973220.0,1emq5t,"Gentleman by David Cote, Montreal",craigdaddy123,1113,269,http://www.reddit.com/r/tattoos/comments/1emq5t/gentleman_by_david_cote_montreal/,http://c.thumbs.redditmedia.com/r-f5qCIyVsPktwRP.jpg,
1351374570.0,126vm8,Crazy good geometry by Time Travelling Tattoo,Panda_is_Delicious,1021,165,29,,t5_2qj9g,False
1352397324.0,12v7je,"My dotwork piece done by Seán Kealy of Snakebite in Dublin, Ireland.",petebriquette,1041,191,http://www.reddit.com/r/tattoos/comments/12v7je/my_dotwork_piece_done_by_seán_kealy_of_snakebite/,http://f.thumbs.redditmedia.com/hWLTip4b1OZ_sA2w.jpg,
1376271814.0,1k6g8s,"Finished Boar front piece - Jason Kelly @ Live Free Tattoo - Atlanta, GA",VonSockthroat,1214,360,http://www.reddit.com/r/tattoos/comments/1k6g8s/finished_boar_front_piece_jason_kelly_live_free/,http://f.thumbs.redditmedia.com/uZK3eBEmcnlnZDlq.jpg,
1357918687.0,16dshs,Great thigh piece by artist: Kata Urban Urban Tattoo.,neffhead,1024,176,17,,t5_2qj9g,False
1371042584.0,1g6yml,"My brother's norse theme sleeve, by Dru Bias at Saints and Sinners Tattoo in Carrollton, TX",eyebrowfetish,1181,52,False,
1375281463.0,1jf8hg,"Very first tattoo, very excited to show you guys! (Sorry for the bad photo!) Done by Vid @ Skinzophrenic Tattoos, UK",Marvelous_Bauble,1074,30,False,
1373024387.0,1hopsv,"My deer and compass done by Jack Kidd at Lakeside tattoo in Brisbane, QLD",Das_Snack_Ops,1135,288,http://www.reddit.com/r/tattoos/comments/1hopsv/my_deer_and_compass_done_by_jack_kidd_at_lakeside/,http://e.thumbs.redditmedia.com/soWOwKu8gww4otFd.jpg,
1352556119.0,12yo6u,"Girlfriend's first tattoo done by Joe ""Joweone"" Nasatka at Orange Tattoo in Annapolis, MD",LurkinMcGurkin,1114,272,http://www.reddit.com/r/tattoos/comments/12yo6u/girlfriends_first_tattoo_done_by_joe_joweone/,http://c.thumbs.redditmedia.com/hSgIrNLiB2nm-Fh2.jpg,
1351016785.0,11yitp,My Van Gogh inspired background [update],Thisisbluue,964,115,39,,t5_2qj9g,False
1341268568.0,vy4rf,"An old friend was murdered on Christmas. Today is his birthday, so I got him this! (His signature from and old yearbook)",ouishi,1170,321,http://www.reddit.com/r/tattoos/comments/vy4rf/an_old_friend_was_murdered_on_christmas_today_is/,http://c.thumbs.redditmedia.com/WC9YKBnXfBRQ39_h.jpg,
1336676652.0,tgwds,"Moon Phases by Red @ Z Spot Tattoo Pittsburgh, PA",darcee1013,1116,271,http://www.reddit.com/r/tattoos/comments/tgwds/moon_phases_by_red_z_spot_tattoo_pittsburgh_pa/,http://b.thumbs.redditmedia.com/txMKs_KMFqAwMcPs.jpg,
1369346340.0,1exjt6,"Before and after. Done by Helena Darling, Newcombe's Ink in Halifax, NS",RazThePsycadet,1106,43,False,
1343488576.0,xat8u,"Third session of my Final Frontier side piece by Dave Kotinsley at Anthem Tattoo in Gainesville, FL. [Very Slightly NSFW]",prolificsalo,1174,335,http://www.reddit.com/r/tattoos/comments/xat8u/third_session_of_my_final_frontier_side_piece_by/,nsfw,
1336155159.0,t76rh,"Never forget who you are. Steve Gillespie, Witch City Ink",fishballin,1190,347,http://www.reddit.com/r/tattoos/comments/t76rh/never_forget_who_you_are_steve_gillespie_witch/,http://b.thumbs.redditmedia.com/2mUoEjwchUNjvxHI.jpg,
1373201984.0,1hste3,My Star Wars pieces by Wes Carter @ Carters Tattoo Company in Bowling Green KY,suburban_home,1196,353,36,,t5_2qj9g,False
1373459662.0,1i04sz,"A cover-up I had done recently. [Dan, Manchester Ink, Manchester, UK]",Slartibartfasttm,208,,False
1368121686.0,1e0i7t,Dali's Elephant. Done by Jason Stewart at Robot Tattoo. Portland Oregon,nativegod,1067,226,32,,t5_2qj9g,False
1363366383.0,1acwt5,"Iron Giant tattoo. Done by Katie Hollow from studio 123, Niagara. ",ab221,1212,376,http://www.reddit.com/r/tattoos/comments/1acwt5/iron_giant_tattoo_done_by_katie_hollow_from/,http://a.thumbs.redditmedia.com/FDKwkFBL8-LEujmZ.jpg,
1348927711.0,10o0uz,Sir Badger - By Tini @ Hello Sailor - UK,herboholic,1048,207,23,,t5_2qj9g,False
1347983739.0,103162,Fresh owl tattoo (now 3 months old),ShipwreckedBones,1056,219,36,,t5_2qj9g,False
1375103322.0,1j9v4c,"First session, second tattoo. Done by Tom William @ Carneval Tattoo in Stockholm, Sweden!",onyxques,1112,21,False,
1367927507.0,1duuer,"R2D2 Tattoo done by my sister Anne @ Ruby Tuesday Tattoos, Perth",marlaquinn,1174,337,http://www.reddit.com/r/tattoos/comments/1duuer/r2d2_tattoo_done_by_my_sister_anne_ruby_tuesday/,http://e.thumbs.redditmedia.com/lknyadrnxMJ6lULF.jpg,
1371848561.0,1gthey,"Free-hand roses on my hip! Done by Kings Hayward of Skin Illustrations in Canterbury, Kent.",MrsLovettsMeatPie,1155,321,http://www.reddit.com/r/tattoos/comments/1gthey/freehand_roses_on_my_hip_done_by_kings_hayward_of/,http://f.thumbs.redditmedia.com/WbhPp09GO3iIGpZG.jpg,
1351042089.0,11zc0a,My first and favorite tattoo,st0ne-love,1042,214,34,,t5_2qj9g,False
1368501749.0,1eaj4w,"My Han Solo tattoo! By Boy D'Boy in Albuquerque, NM",sheikonthestreet,1116,281,http://www.reddit.com/r/tattoos/comments/1eaj4w/my_han_solo_tattoo_by_boy_dboy_in_albuquerque_nm/,http://b.thumbs.redditmedia.com/wv0l1MIHwM1cRow7.jpg,
1351290715.0,125bpv,Moving away from my childhood home. Done by Jason Thompson at Reykjavik Ink.,Antilope,965,137,49,,t5_2qj9g,False
1374376862.0,1iqd54,"Hogwarts done by Mark Bentley at Hip Hop Robot Tattoo in Seattle, Washington",Cuntpuncher27,1132,307,http://www.reddit.com/r/tattoos/comments/1iqd54/hogwarts_done_by_mark_bentley_at_hip_hop_robot/,http://b.thumbs.redditmedia.com/1Ufnyy5c1E07RyjC.jpg,
1349288854.0,10vz4z,This is awesome.,fruit_punched,990,160,40,,t5_2qj9g,False
1354202782.0,13zvn0,"My underwater/sealife full sleeve is finally finished! Last color session was yesterday. Dave Scearce at Blood Sweat &amp; Tears Tattoo in Charlotte, NC.",mjar81,1025,196,http://www.reddit.com/r/tattoos/comments/13zvn0/my_underwatersealife_full_sleeve_is_finally/,http://c.thumbs.redditmedia.com/d1B7jsZpFivSjnzb.jpg,
1358551686.0,16uh7y,"Traditional rose w/ stem and buds. Josh Stephens @ Hold It Down, Richmond, VA",knedders,1100,33,False,
1331648369.0,qujm8,"My local tattoo shop just posted this, guess you're never too old to get your first tattoo!",Drag_King86,1142,316,http://www.reddit.com/r/tattoos/comments/qujm8/my_local_tattoo_shop_just_posted_this_guess_youre/,http://b.thumbs.redditmedia.com/t4CE5tVX_q3-47gs.jpg,
1374345630.0,1iph1y,"My friend's new tattoo done by Erica Scott @ Vintage Tattoo Parlour in Monroe, LA",sickteen,1099,276,http://www.reddit.com/r/tattoos/comments/1iph1y/my_friends_new_tattoo_done_by_erica_scott_vintage/,http://f.thumbs.redditmedia.com/PkOgQybNgIg4Adgk.jpg,
1336822794.0,tjjn6,"Medusa Side Piece - UPDATE - Justin Acca, Melb",forevermelborn,1058,238,http://www.reddit.com/r/tattoos/comments/tjjn6/medusa_side_piece_update_justin_acca_melb/,http://a.thumbs.redditmedia.com/nkAvWUliDPuP2obB.jpg,
1334632175.0,sdln6,"I finished off a Big Black Cock today (Custom Tattoos by Adam Sky, San Francisco, CA)",Tattoodles,1120,46,False,
1347752721.0,zy59l,My Henna-Style Tattoo by Kim Durham of Prix in Hollywood,dbl_entendre,1294,477,61,,t5_2qj9g,False
1368547122.0,1ebjjv,"Dantes Inferno Sleeve - Greg Caggiano of Lighthouse Tattoo, Rochester, NY",bigloserwithnofriend,1060,58,False,
1337439179.0,tuqoo,I turn up for my tattoo appointment today and see this slight inconvenience...,ButterMyMuffin,1123,302,50,,t5_2qj9g,False
1363614906.0,1aiv5d,"Started my tattoo this weekend on my side! By Derrick Oldham - Euless, TX",KelseyLT,1455,636,http://www.reddit.com/r/tattoos/comments/1aiv5d/started_my_tattoo_this_weekend_on_my_side_by/,nsfw,
1366391176.0,1coo1y,Wife's cover-up by Old School Jeff @ Nemesis Tattoo in Iowa City,donutsinthebreakroom,1055,233,29,,t5_2qj9g,False
1346517668.0,z6tt9,"What do you think of this tattoo artist? Style/execution? Ryan Smith, from Perth, Australia",reaction105,1033,53,False,
1360271420.0,1835si,My sleeve. Finished recently. Done by Kevin at Iron Hand in Cranston RI. ,phill0406,979,164,44,,t5_2qj9g,False
1357512805.0,1631a5,"Octopus, by Cliff Cox of Oshkosh Tattoo, Wisconsin",MtMcTwattybollocks,961,35,False,
1355158399.0,14lzyb,"Let's start an Owl thread!  Here's mine, done by Shaun Nel of Kings Avenue Tattoo NYC/Massapequa",rustybaker28,1025,211,http://www.reddit.com/r/tattoos/comments/14lzyb/lets_start_an_owl_thread_heres_mine_done_by_shaun/,http://e.thumbs.redditmedia.com/0WkQiXlo50BW1xzF.jpg,
1348178270.0,107rne,"Start of my Kandinsky half sleeve - by Keegan Lam @ Newcombe's Ink, Halifax, NS",orb_cz,1014,58,False,
1341193527.0,vwjhz,Thought you guys might like another badass old guy.,That_Frog_Kurtis,1031,223,30,,t5_2qj9g,False
1366271832.0,1clf4e,"Girls with tattoos - half sleeve covering scar damage finished! Artist: Sin Lanson, Never Say Die - London",,1011,202,http://www.reddit.com/r/tattoos/comments/1clf4e/girls_with_tattoos_half_sleeve_covering_scar/,http://a.thumbs.redditmedia.com/snRCbqrKJrljiMzB.jpg,
1365514163.0,1bzkdp,Lotus flower elbow tattoo. Underground Tattoos Chiang Mai Thailand. Felt great!,Gordini101591,1073,261,34,,t5_2qj9g,False
1354909916.0,14gkbc,My music and science sleeve by Russ Abbott at Ink and Dagger Tattoo in Decatur GA.,pcastleberry,929,120,35,,t5_2qj9g,False
1362769644.0,19xdow,"Birds: 1/4 sleeve by J Rodriguez at Metamorph Tattoos, Chicago (NSFW-ish)",rashewcashew,1320,509,http://www.reddit.com/r/tattoos/comments/19xdow/birds_14_sleeve_by_j_rodriguez_at_metamorph/,nsfw,
