created_utc,id,title,author,ups,downs,num_comments,selftext,subreddit_id,is_self
1363782135.0,1anq1w,"My Phoenix from Ian Simon at Bitter Hearts Tattoo in Youngstown, Ohio. ",rhizomeofthephoenix,1208,404,http://www.reddit.com/r/tattoos/comments/1anq1w/my_phoenix_from_ian_simon_at_bitter_hearts_tattoo/,nsfw,
1350312886.0,11ih9j,"the bees knees! my latest tattoo, done by Paul @ Paul &amp; Friendz - Brussels, Belgium",themilitantwife,1171,45,False,
1366683711.0,1cwqbl,"My new half sleeve and shoulder panel. Done by Steve Labofish, Bethesda Tattoo.",flerbal,1006,203,http://www.reddit.com/r/tattoos/comments/1cwqbl/my_new_half_sleeve_and_shoulder_panel_done_by/,http://d.thumbs.redditmedia.com/Wd2gTM-dRDEkKjpK.jpg,
1348975466.0,10p3ao,First Post. First Tattoo. ,Margaretto,1355,553,92,,t5_2qj9g,False
1337607984.0,txhg1,"I got a new tattoo, and my son said to post it, Ganesha, by Laura Kondon @ T&amp;A Tattoo, in Flint MI. I love it!",1051,,t5_2qj9g
1363188331.0,1a7w88,"finished chest piece - Richard Stell, Brainstorm tattoo Fayetteville, AR.",french-toast-mullet,1172,74,False,
1354097871.0,13xex4,"Not mine, but I think the style is incredible. By Jón Páll at Íslenzka Húðflúrstofan - The Icelandic Tattoo corp.",Kryptorchismus,929,129,http://www.reddit.com/r/tattoos/comments/13xex4/not_mine_but_i_think_the_style_is_incredible_by/,http://d.thumbs.redditmedia.com/vwyNdseaajmDTnp9.jpg,
1348847931.0,10mg5j,"Johnny the Homicidal Maniac. on Paul B. by Randy Nichols, Trifecta Body Art. one of my first year pieces. :)",godlesstattoos,1088,292,http://www.reddit.com/r/tattoos/comments/10mg5j/johnny_the_homicidal_maniac_on_paul_b_by_randy/,http://c.thumbs.redditmedia.com/unfTByyybvj7ahMD.jpg,
1337514524.0,tvwar,"Villain Sleeve by AJ at Sacred Rose Tattoo in Brisbane, Aus.",Gbirt1,1051,254,http://www.reddit.com/r/tattoos/comments/tvwar/villain_sleeve_by_aj_at_sacred_rose_tattoo_in/,http://c.thumbs.redditmedia.com/ZV1N7j1NrH0T3WD8.jpg,
1327998051.0,p4c6g,Great Depth Illusion - by Pavel Angel,dikfeld,984,184,54,,t5_2qj9g,False
1344180267.0,xpt0m,Kat Wilson - Hello Sailor UK. Best portrait Manchester International Tattoo Show. [X-Post from /r/pics],herboholic,1044,245,25,,t5_2qj9g,False
1336911011.0,tkvjq,"First tattoo and session, done by Pau at Global (Spain)",aubademaig,1088,291,http://www.reddit.com/r/tattoos/comments/tkvjq/first_tattoo_and_session_done_by_pau_at_global/,http://c.thumbs.redditmedia.com/3k0Mre6O75cYW5QD.jpg,
1325705309.0,o2umm,"This is a portrait I did of my friend David, a tattoo artist.  /r/art didn't appreciate it, but maybe y'all will.",scribbling_des,1189,89,False,
1347476126.0,zs2g3,"Getting it colored soon, I really like how it came out!",babababrandon,1145,350,http://www.reddit.com/r/tattoos/comments/zs2g3/getting_it_colored_soon_i_really_like_how_it_came/,http://c.thumbs.redditmedia.com/eZr-ptROBQytEkb2.jpg,
1353707551.0,13ooev,"Update: Fully coloured Octopus - Bryan, Tora Tattoo. I'm very happy with the end result. ",JustDoBetter,948,154,http://www.reddit.com/r/tattoos/comments/13ooev/update_fully_coloured_octopus_bryan_tora_tattoo/,http://b.thumbs.redditmedia.com/ryYWQSCrtgbxMohU.jpg,
1357574981.0,164hqi,"It's going to be full sleeve one day, all by one tattoo artist Nikke/red&amp;white Ink Lapland northern side",magpiesfledgling,939,150,http://www.reddit.com/r/tattoos/comments/164hqi/its_going_to_be_full_sleeve_one_day_all_by_one/,http://c.thumbs.redditmedia.com/aSHF9S5zJ2xX3iGz.jpg,
1371931442.0,1gvdp5,"Got an awesome triple cover-up done last night - Josh Montiel @ Valkery's in Gainesville, FL",molotovsoup,945,155,http://www.reddit.com/r/tattoos/comments/1gvdp5/got_an_awesome_triple_coverup_done_last_night/,http://c.thumbs.redditmedia.com/BL87Wo4KSLu7-P28.jpg,
1364688364.0,1bbwia,"My Owl Tattoo (outline) done by Thomas Sinnamond at Insight Studios, Chicago, IL",ncollogan,1001,48,False,
1350853047.0,11uzgf,"Hawaiian/Japanese sleeve. One session left. Done by Colin Dowling of Gold Rush Tattoo in Costa Mesa, CA.",50mac,927,135,http://www.reddit.com/r/tattoos/comments/11uzgf/hawaiianjapanese_sleeve_one_session_left_done_by/,http://c.thumbs.redditmedia.com/CkXGx311Xh_l2nWb.jpg,
1357110881.0,15td32,"Father-Daughter raven tattoos done by Daemon Rowanchild in Ontario, Canada. I don't have many, but this one is my favorite.",iyamwtiyam,897,36,False,
1367773819.0,1dqlwo,"My new Deku Tree tattoo, done by Angel Sanders at Flesh Tattoo in Fallston, MD. (x-post from r/zelda)",l328i,1007,19,False,
1330612719.0,qcxqj,....And Nothing Hurt.,Birtypoo,1236,449,161,,t5_2qj9g,False
1374330099.0,1ip1f4,"Walter ""Sausage"" Frank. Club Tattoo Las Vegas.",Murphelman,1058,273,17,,t5_2qj9g,False
1359309341.0,17dknx,"My Mario Tanooki tattoo by Luka @ Inkstitution, Rotterdam",mvhoute,1105,327,http://www.reddit.com/r/tattoos/comments/17dknx/my_mario_tanooki_tattoo_by_luka_inkstitution/,http://e.thumbs.redditmedia.com/alUzABfnGfWjIP04.jpg,
1353683945.0,13o3m7,Matteo Pasqualin - Rose &amp; Skull via Facebook,BoydCrowder,924,137,14,,t5_2qj9g,False
1343134315.0,x2jjz,Woah Dude,Kelwood,1093,310,47,,t5_2qj9g,False
1358951373.0,174fc3,"Compass/Globe Tattoo. By Pup @ All American Tattoo in Stafford, VA",Parisker79,1000,216,http://www.reddit.com/r/tattoos/comments/174fc3/compassglobe_tattoo_by_pup_all_american_tattoo_in/,http://b.thumbs.redditmedia.com/mXGH-M9NVBNLrNR7.jpg,
1345393408.0,yh5x9,"Blossom Tree by Derek Dufresne at Fleshworks Tattoo, Victoria, BC (Canada)",emilie_feathers,1019,43,False,
1335155311.0,snp9e,"My Alice In Wonderland tattoo by Greg Caggiano @ Lighthouse Studios in Rochester, NY",onestrawpleese,968,185,http://www.reddit.com/r/tattoos/comments/snp9e/my_alice_in_wonderland_tattoo_by_greg_caggiano/,http://e.thumbs.redditmedia.com/KgwjxMwd5MjmdmOF.jpg,
1368682330.0,1efohn,"Octopus and a ship in a bottle, done by Rob C., Valley Ink, Brisbane, Australia",944,,t5_2qj9g
1370803743.0,1fzt2k,"I see your 'lady of the sea' and raise you my 'zombified' version. Also awaiting color. (By J'Skin O'Sullivan - Black Rose Tattoo, Courtenay BC)",ExStalksMyOldAccount,1070,297,http://www.reddit.com/r/tattoos/comments/1fzt2k/i_see_your_lady_of_the_sea_and_raise_you_my/,http://e.thumbs.redditmedia.com/e6j_Gz1Y13TKVN_v.jpg,
1355931026.0,1541aw,"Done by Jen Guertin at Anchor Steam Tattoo in Newport, RI",GoodYatch,1016,244,http://www.reddit.com/r/tattoos/comments/1541aw/done_by_jen_guertin_at_anchor_steam_tattoo_in/,http://d.thumbs.redditmedia.com/-_b27MhbTZXCtH4o.jpg,
1353615710.0,13muxs,"Done by Jessie Ritacco @ Hole in the Wall Tattoo in Conway, SC (link in comments)",cliched,918,138,http://www.reddit.com/r/tattoos/comments/13muxs/done_by_jessie_ritacco_hole_in_the_wall_tattoo_in/,http://d.thumbs.redditmedia.com/ui5tzoeLNz1zNEWK.jpg,
1363979634.0,1ate0u,"Futurama spaceship (on right forearm) by Chris Hess at Abraxas Tattoo in Lawrence, KS",mezzanayne,974,199,http://www.reddit.com/r/tattoos/comments/1ate0u/futurama_spaceship_on_right_forearm_by_chris_hess/,http://d.thumbs.redditmedia.com/K9WHlDjgxvA7k8iE.jpg,
1363805563.0,1aoh0l,"Half body suit tattoo- This is the front with owl and cherry blossom on the right side left side is finches and chest is sparrows. Will connect to back when completed, work in progress. Done by Wes Brown at Rebel Muse in Lewisville TX",henman09,1145,368,http://www.reddit.com/r/tattoos/comments/1aoh0l/half_body_suit_tattoo_this_is_the_front_with_owl/,http://a.thumbs.redditmedia.com/6WCGVy5PhmQ2S0oN.jpg,
1357321463.0,15yk5m,"""Hanknee"" mask, by Paul Scarott at Tokyo Tattoo",tokyotattoo,993,225,http://www.reddit.com/r/tattoos/comments/15yk5m/hanknee_mask_by_paul_scarott_at_tokyo_tattoo/,http://e.thumbs.redditmedia.com/P26Wlk1IlkL0Pv5p.jpg,
1353160241.0,13cmzn,"Map of the world, places I've been coloured in. Slice 
Everlasting Inc Swansea",249,110,http://www.reddit.com/r/tattoos/comments/13cmzn/map_of_the_world_places_ive_been_coloured_in/,,,False,t5_2qj9g,False
1340723256.0,vmrbf,"My Sunny Leo - Done by Josh @ GoodMojoTattoos - Beverly, Mass",MikeFez,947,172,http://www.reddit.com/r/tattoos/comments/vmrbf/my_sunny_leo_done_by_josh_goodmojotattoos_beverly/,http://a.thumbs.redditmedia.com/0Lz9fwxRmPkC0Lrx.jpg,
1361341507.0,18vfvy,"So here's my latest finished tattoo, back to it after a 15 year hiatus.  Ahmed Eldarrat at Trader Bob's Tattoo, STL.",jedcaum,974,28,False,
1372353656.0,1h6uhf,Pair of embroidery scissors done by Roman Mitchell in Bristol VA.,Serulea,957,187,29,,t5_2qj9g,False
1362075491.0,19epxy,"Reddit didn't seem to like the last tattoo I posted. What about this one? @ Th'Ink Tank Denver, CO",djdblizzy,1658,894,http://www.reddit.com/r/tattoos/comments/19epxy/reddit_didnt_seem_to_like_the_last_tattoo_i/,http://c.thumbs.redditmedia.com/16tj4EbgEVwsdtxh.jpg,
1372672915.0,1hf2f0,"my newest tattoo, artist : sanchez, in sydney, Australia",mikelalillian,236,,False
1356974067.0,15qaw1,My friend loves fishing; the first fish she ever caught was a trout. This is her first tattoo. [by Shakey Pete],Varasque,1052,289,30,,t5_2qj9g,False
1335289202.0,sq9b9,Apparently r/gaming hates tattoos so here's my Little Sister by Andrew at Golden Eagle in Santa Barbara.,Cthulhu-Hoop,1131,364,79,,t5_2qj9g,False
1351771445.0,12gc7j,"Tattoo by Richard Warnock of Powerhouse Tattoo in Palmerston North, New Zealand",LyingVespa,950,185,http://www.reddit.com/r/tattoos/comments/12gc7j/tattoo_by_richard_warnock_of_powerhouse_tattoo_in/,http://c.thumbs.redditmedia.com/t7zPKYxKZQSfpm3t.jpg,
1343088107.0,x1mbp,"This man is a tattoo genius, Peter Aurisch",lavfisch,929,165,http://www.reddit.com/r/tattoos/comments/x1mbp/this_man_is_a_tattoo_genius_peter_aurisch/,http://c.thumbs.redditmedia.com/7PH-zuSxfyO_63lV.jpg,
1347895668.0,100xpu,"My Boston Terrier fighting zombie squirrels, by Jesse Smith (of Loose Screw Tattoo, Richmond, VA) - yesterday at the Keystone Tattoo Gathering in CO over 6.5 hours",DonnyPlease,213,,False
1341634173.0,w5xsw,My full chest piece is FINALLY done! High resolution pictures and artist details inside!,,997,234,65,,t5_2qj9g,False
1356826132.0,15nbwl,"A tattoo design I drew for fun.  Adam Sky, Rose Gold's Tattoo, San Francisco, CA",Tattoodles,155,,False
1347548525.0,ztoxx,"Don't know much about tattoos, but this guy is talented.",jeanpaulfartre,1005,240,http://www.reddit.com/r/tattoos/comments/ztoxx/dont_know_much_about_tattoos_but_this_guy_is/,http://c.thumbs.redditmedia.com/-koJtFdcFyHyHBKP.jpg,
1372426393.0,1h8vzs,Berliner Bear done by Anne at Berlin Ink,greenmoustache,1096,334,44,,t5_2qj9g,False
1347976539.0,102udw,"Today I created a tattoo design, I decided to call it 'Life Support' The idea of it started when I watched the Metropolis anime. Thoughts? Ideas for other tattoos?",Whammeh,962,197,http://www.reddit.com/r/tattoos/comments/102udw/today_i_created_a_tattoo_design_i_decided_to_call/,http://d.thumbs.redditmedia.com/XdgsDruQifn1XnL3.jpg,
1357750722.0,1698i6,now my axolotl salamander 'Abner' is with me all the time.,crapidrawatwork,906,146,31,,t5_2qj9g,False
1337960236.0,u4l4s,I need all of these.,wonderless2686,1073,309,58,,t5_2qj9g,False
1357930484.0,16e4wc,An amazing piece done by Matteo Pasqualin. ,pween23,894,133,25,,t5_2qj9g,False
1353609477.0,13mpa7,Guy Aitchison,iEnteredTheVoid,998,233,35,,t5_2qj9g,False
1331092587.0,ql7x7,Fox and Robin,HeavyArmor,913,150,44,,t5_2qj9g,False
1355931207.0,1541ft,"Fox in Forest tattoo (inner bicep) - Teresa Sharpe, Paradise Tattoo Festival in Keystone, CO",mydogwatchestv,874,59,False,
1349701621.0,114w5m,"My dia de los muertos and comedy/tragedy piece I got nearly a month ago. By Sigrún at Bleksmiðjan in Reykjavík, Iceland",IceViolet,1011,252,http://www.reddit.com/r/tattoos/comments/114w5m/my_dia_de_los_muertos_and_comedytragedy_piece_i/,http://b.thumbs.redditmedia.com/JKhaBaqKuncIZKJy.jpg,
1346434818.0,z58mb,"Four months ago I saw a piece of art done by a Redditer that floored me, I said I would strongly consider getting it tattooed, I was not joking. ",martinkelly6,1048,61
http://www.reddit.com/r/Art/comments/t30dg/did_this_back_in_november_thought_id_upload_it/

Original Image:
http://i.imgur.com/vTSOq.jpg

The process:
http://imgur.com/a/qBroT

I couldn't be happier,False,self,t5_2qj9g,False,,,t3_z58mb
1365352838.0,1buxij,"My little octopus, done by Jessie @ Hole in the Wall Tattoo in Conway, SC",cliched,870,28,False,
1364503026.0,1b766e,"Giant Squid tattoo -Premium Tattoo, Oakland CA",brainz_on_brainz,935,188,http://www.reddit.com/r/tattoos/comments/1b766e/giant_squid_tattoo_premium_tattoo_oakland_ca/,http://d.thumbs.redditmedia.com/nne8rm2shbTDBHqc.jpg,
1368484331.0,1e9wj8,"My first tattoo! Kristina Peltier- Carencro, LA",haydensayuri,1086,337,http://www.reddit.com/r/tattoos/comments/1e9wj8/my_first_tattoo_kristina_peltier_carencro_la/,http://f.thumbs.redditmedia.com/HBUUxRPmcIUaNmCS.jpg,
1367661206.0,1do7bg,"Geisha half sleeve By. Nihei, Sunsqlit Tattoo, Shibuya, Japan",Linkaboo7,219,,False
1357878863.0,16d0s7,"Japanese themed half-sleeve(for now) done by Red Demon Tattoos from San Jose,CA.",mrjngo,918,166,http://www.reddit.com/r/tattoos/comments/16d0s7/japanese_themed_halfsleevefor_now_done_by_red/,http://f.thumbs.redditmedia.com/b_JOeyDbDvLs20dk.jpg,
1350128809.0,11et6z,Jack and Sally - By Kat @ Hello Sailor UK,herboholic,992,244,24,,t5_2qj9g,False
1351797630.0,12h0r6,"A Photo of the Late Mitch Lucker, lead singer of suicide silence, who passed away early this morning. ",XscreaminggummybearX,1018,99,False,
1346352028.0,z39qg,My friend got a new tattoo.,a_soy_milkshake,1003,256,28,,t5_2qj9g,False
1369004587.0,1enq3b,Thank you Marshall brown (revolution tattoo in Chicago) coverup,maeritzgauh,970,224,56,,t5_2qj9g,False
1350835560.0,11uist,"My largest piece by Justin W Leifeste - Abilene, Tx.",dereksurfing,953,210,http://www.reddit.com/r/tattoos/comments/11uist/my_largest_piece_by_justin_w_leifeste_abilene_tx/,http://f.thumbs.redditmedia.com/dHkUUresjOzcuEZS.jpg,
1343667599.0,xedan,My water color magpie right after it was fininished,cosbyjuice,1000,257,29,,t5_2qj9g,False
1340979473.0,vsni6,"A Sailor's Leg by Ryan Thompson @ FREAKS KC,MO",KCKFD,931,191,http://www.reddit.com/r/tattoos/comments/vsni6/a_sailors_leg_by_ryan_thompson_freaks_kcmo/,http://c.thumbs.redditmedia.com/8MBWsOtedyqbQ5yD.jpg,
1364585425.0,1b9cu1,"Raven. Finally got my first tattoo at age 26. Sketch drawn by myself. Tattoo artist: Vladimir from House of Ink, Denmark.",thit,902,164,http://www.reddit.com/r/tattoos/comments/1b9cu1/raven_finally_got_my_first_tattoo_at_age_26/,http://c.thumbs.redditmedia.com/72VLCiV4y4_O4Xxh.jpg,
1361466331.0,18ynwh,This is tattooed on my girlfriend. By Kyle Giffen in Austin tx,xxxMDKxxx,875,138,23,,t5_2qj9g,False
1361155867.0,18q740,"Bought a new house, inspection didn't reveal the squirrel infestation in the attic... 8 months of battle later, all that remains is this tattoo (DJ Minor, Cleveland OH)",bcart82,214,,False
1366837834.0,1d1bh9,"Awesome geeky onepiece tattoo inspired me to post my equally geeky pokemon tattoo - by Dan Cox, Ballistic Tattoo, NZ",rhock0,917,40,False,
1349059092.0,10qpq3,"My second tattoo done by Seb Bonneau from Art En Mouvement, Hull, Que",WhenWhereWho,911,68,False,
1346720244.0,zb6q2,"Finally decided to post my side piece! Done by Broc at A Fu Kein Good Tattoo in Jacksonville, Fl (NSFW)",NapAddict,975,238,http://www.reddit.com/r/tattoos/comments/zb6q2/finally_decided_to_post_my_side_piece_done_by/,nsfw,
1344609682.0,xzxr7,"Chest Piece (a cover up) by Dennis Pase, Five Star Tattoo, Louisville KY ",Erase-Me,958,71,False,
1371143857.0,1ga29h,"Chiang Mai, Thailand @Skinart By Crab",michie05,930,191,http://www.reddit.com/r/tattoos/comments/1ga29h/chiang_mai_thailand_skinart_by_crab/,http://f.thumbs.redditmedia.com/NGVHRrpBYI_vB0HY.jpg,
1361972494.0,19bqsr,"Tree Of Life and Phoenix tattoo done by Steve B at Needlewurks in Saratoga Springs, NY [friend's tattoo]",,1031,296,http://www.reddit.com/r/tattoos/comments/19bqsr/tree_of_life_and_phoenix_tattoo_done_by_steve_b/,http://c.thumbs.redditmedia.com/qXOKdmG61rrtoHIh.jpg,
1368782812.0,1eibne,"In a random bar in Ibiza, Spain, I found a book of Sailor Jerry Flash!",pickfights,971,43,False,
1354138084.0,13yeb2,Shel Silverstein tattoo my cousin got a few months ago @ North Star NYC,xCELTICx,953,220,12,,t5_2qj9g,False
1356065239.0,157l97,"Done by Mr. Tung, Angel Art Tattoos, Bangkok",Damn_It_Janet,823,23,False,
1360348208.0,1857mq,"First part of colour sleeve inspired by Alphonse Mucha, by Bettie @ Nico Tattoo, Athens.",Dunkelheit83,857,21,False,
1348702078.0,10j8ml,"Northern Lights, session 2/3, by Tony Trip, Sutton Tattoo Co. Evansville, IN",954,,t5_2qj9g
1373850110.0,1ib4gw,Mermaid in Repose...done by Gabe at Hula Moon tattoo,Emily_0325,957,228,25,,t5_2qj9g,False
1366280681.0,1cljj9,"Gibson Guitar veins, Link Bossman, Mooloolaba Ink, QLD",Dunnkid,169,,False
1356884878.0,15odhm,"My newest piece: A Calvin and Hobbes tattoo done by Kyle at The Constable in Plainfield, IL",capitalhforhero,925,200,http://www.reddit.com/r/tattoos/comments/15odhm/my_newest_piece_a_calvin_and_hobbes_tattoo_done/,default,
1335720927.0,syd4e,"Free Hand- Aaron Sy @American Parlor; Fresno, CA",angelr00lz,957,229,http://www.reddit.com/r/tattoos/comments/syd4e/free_hand_aaron_sy_american_parlor_fresno_ca/,http://a.thumbs.redditmedia.com/t_efTSiT676vCLtf.jpg,
1346254482.0,z0vbz,"Start of the greek mythology leg sleeve. Hades. Done by Halo at Konkrete Jungle. Colombia, MD.",,892,167,http://www.reddit.com/r/tattoos/comments/z0vbz/start_of_the_greek_mythology_leg_sleeve_hades/,http://f.thumbs.redditmedia.com/rZOn5LRVtLKsqNHM.jpg,
1317833740.0,l1vhf,"Today's my reddit birthday so here's my first tattoo! By Ania Jalosinska, Warsaw.",desmondao,866,146,http://www.reddit.com/r/tattoos/comments/l1vhf/todays_my_reddit_birthday_so_heres_my_first/,http://thumbs.reddit.com/t3_l1vhf.png,
1360424113.0,1870pn,"Disney Fantasia Sleeve WiP by Mark VanNess @ Oak City Tattoo Raleigh, NC",douglasville,939,214,http://www.reddit.com/r/tattoos/comments/1870pn/disney_fantasia_sleeve_wip_by_mark_vanness_oak/,http://e.thumbs.redditmedia.com/PmFFYotRtiY5ww8v.jpg,
1331429281.0,qqyxj,Tattoo by Nazareno Tubaro at Amigo Ink in Halmsted Sweden ,McGibblets166,882,159,43,,t5_2qj9g,False
1373061635.0,1hprfv,"Industrial/ Neo-Traditional Sparrow by Rotor Finerats, Aloha Tattoos - Barcelona",piefection,910,186,http://www.reddit.com/r/tattoos/comments/1hprfv/industrial_neotraditional_sparrow_by_rotor/,http://e.thumbs.redditmedia.com/nRiMKM_UDUZjZt4F.jpg,
1371109519.0,1g980w,"My dad got this panther flash tattoo in the 80's. It doesn't mean much to him, but I grew up seeing this tat so I got it put on my back to honor him(pictures of both in the link). Mine was done by Seth Agar at Big Brain Studios in Omaha, NE.",ashley-san,906,26,False,
1344478766.0,xx1az,"Waiting for the day kids ask me ""what's that?""",ead4eyes,1094,377,71,,t5_2qj9g,False
1348757930.0,10kcxa,"People with .com tattoos for advertising websites 
that no longer exist",211,79,http://www.reddit.com/r/tattoos/comments/10kcxa/people_with_com_tattoos_for_advertising_websites/,,,False,t5_2qj9g,False
1319306744.0,ll6qv,Best. Coverup. Ever.,,852,134,31,,t5_2qj9g,False
1339718538.0,v2kaj,First Tattoo. Atlas holding up the heavens.,MaximumAwesome,916,200,55,,t5_2qj9g,False
1368639580.0,1ee7tp,"Black rose tattoo by Crystal from Rising Tide Studios in Newark, OH.",brandon_g1234,1002,290,http://www.reddit.com/r/tattoos/comments/1ee7tp/black_rose_tattoo_by_crystal_from_rising_tide/,http://f.thumbs.redditmedia.com/M9nZkKexCRGYcsp5.jpg,
1344218241.0,xqq13,"""Always"" said Snape.",starrstreet,1064,350,40,,t5_2qj9g,False
1338554304.0,ufizz,"No. 2 - done at Inka, Brighton",mooncrab,921,209,http://www.reddit.com/r/tattoos/comments/ufizz/no_2_done_at_inka_brighton/,http://e.thumbs.redditmedia.com/xeMuuhA_7ioTDyqd.jpg,
1366336008.0,1cnf2w,"My Beer tribute - Chris Iwaniuk/Lucky Strike Tattoo/Edmonton, Canada",Vanflipx1000,834,126,http://www.reddit.com/r/tattoos/comments/1cnf2w/my_beer_tribute_chris_iwaniuklucky_strike/,http://f.thumbs.redditmedia.com/vDddy6Cxtwe4ffvG.jpg,
1349399226.0,10yvvo,"r/Starwars didn't give me much love guess I'll see if I can get love here...Sith Lightsaber tattoo done by Jeremy ""Sloo"" at Subculture City in Concord, NC",xSharkPunchx,1551,844,http://www.reddit.com/r/tattoos/comments/10yvvo/rstarwars_didnt_give_me_much_love_guess_ill_see/,http://d.thumbs.redditmedia.com/wrM67cDYPx6uvMKE.jpg,
1345759385.0,ypwsy,First Tattoo!! Any Miyazaki fans?,ktktprettylady,885,174,43,,t5_2qj9g,False
1354662213.0,14adqp,possible tat? hmmm watcha think redditors,jron91,970,264,66,,t5_2qj9g,False
1333467042.0,rra35,"My son-in-law started an annual tattoo convention in my town, he hired his friend Ami James to come for a few days.",ILikeThemThick,1005,295,http://www.reddit.com/r/tattoos/comments/rra35/my_soninlaw_started_an_annual_tattoo_convention/,http://c.thumbs.redditmedia.com/tiERTFIi1WIiKqSz.jpg,
1338742896.0,uira2,"Covered up a lizard with a sea turtle. Client sat so well, her friend gave her a ribbon!",MelissaCapoTattoo,934,225,http://www.reddit.com/r/tattoos/comments/uira2/covered_up_a_lizard_with_a_sea_turtle_client_sat/,http://b.thumbs.redditmedia.com/p1747XNh7uUI5fyI.jpg,
1317750346.0,l0pws,quetzal by Steve Labofish is finally done! warning: huge pictures and NSFW,xanthochrome,793,82,58,,t5_2qj9g,False
1362795645.0,19y7zi,"Excuse the macaroni. Crash bandicoot anyone? @Stay True in Sharpsburg, GA.",dubtoast,837,131,http://www.reddit.com/r/tattoos/comments/19y7zi/excuse_the_macaroni_crash_bandicoot_anyone_stay/,http://b.thumbs.redditmedia.com/2M45PypSFU_R2oBs.jpg,
1343069434.0,x1256,"My Chest Piece. Done by Mitch Kirilo at Gastown Tattoos in Vancouver, BC.",ncheply,902,195,http://www.reddit.com/r/tattoos/comments/x1256/my_chest_piece_done_by_mitch_kirilo_at_gastown/,http://e.thumbs.redditmedia.com/vQrSh8u4FF30dr4j.jpg,
1319501291.0,lnr1r,Well damn.,weeLittleLeprechaun,965,264,51,,t5_2qj9g,False
1366958701.0,1d520m,"Tattoo done by Wade Davidson. In Portland, Or.",warformyself,1104,396,http://www.reddit.com/r/tattoos/comments/1d520m/tattoo_done_by_wade_davidson_in_portland_or/,http://b.thumbs.redditmedia.com/tkusEe5l9GetvEzy.jpg,
1375058167.0,1j8umj,"Hunter S Thompson portrait - Lee O'Gorman - Manchester, NH",JaccoMacacco,900,198,http://www.reddit.com/r/tattoos/comments/1j8umj/hunter_s_thompson_portrait_lee_ogorman_manchester/,default,
1364503569.0,1b76vh,My nerdy tattoo with dopamin and serotonin molecules. by IguanasArte,hamstersnail,1010,308,49,,t5_2qj9g,False
1353955174.0,13tol5,The Hanged Man - expertly done by Josh SoandSo of Wilmington Tattoo ,megaghost,927,227,35,,t5_2qj9g,False
1348423235.0,10clnk,"Salvador Dali themed Half-Life 2 strider. By Blair Atom @ Art Bomb, Massillon OH. ",pretendeavor09,813,115,http://www.reddit.com/r/tattoos/comments/10clnk/salvador_dali_themed_halflife_2_strider_by_blair/,http://d.thumbs.redditmedia.com/yrD4Y4ftkQ-Ll77o.jpg,
1360933316.0,18kuk7,"For those who remember the tiger shark, here's the completed piece. Done by Joe B @ Alliance Tattoo in Newark, DE.",marauderhex,890,24,False,
1357934515.0,16e9to,what do you think of this design?,sneakytrashman,793,96,47,,t5_2qj9g,False
1350501775.0,11n8pt,Thoughts on this x-ray effect? What are the chances of it holding up? ,CornOnMacabre,822,125,31,,t5_2qj9g,False
1373912106.0,1icrsn,Worried Rabbit ~ Freehanded by Matt 'eyor' of Metamorphic tattoo San Jose CA,x1ux1u,810,113,26,,t5_2qj9g,False
1349104391.0,10rhml,Decendants of Auschwitz survivors get serial number tattoos.,dubwoods,989,289,175,,t5_2qj9g,False
1374449226.0,1irzwr,"My golden retriever in a rocketship. RIP Sweet boy. By John Laramy, NE Tattoo MPLS",sugarfreehowl,871,176,http://www.reddit.com/r/tattoos/comments/1irzwr/my_golden_retriever_in_a_rocketship_rip_sweet_boy/,http://b.thumbs.redditmedia.com/qbFIhpLbuBWm7rA7.jpg,
1355942053.0,154cd0,"Pyramid Head done at the Temple of Visions in Berlin, Germany",T0b3,802,107,http://www.reddit.com/r/tattoos/comments/154cd0/pyramid_head_done_at_the_temple_of_visions_in/,http://f.thumbs.redditmedia.com/XAAdS88S5Ouq6ITk.jpg,
1329921302.0,q0xat,"By request, Grandpa Breeze and Me.",blackfoxtonic,960,261,http://www.reddit.com/r/tattoos/comments/q0xat/by_request_grandpa_breeze_and_me/,http://d.thumbs.redditmedia.com/rA4M8lv9IkA2_vsK.jpg,
1343672059.0,xei23,snake tatto by matt arriola @ 3 kings tattoo brooklyn,hoodratthangz,860,166,34,,t5_2qj9g,False
1372046405.0,1gy5kh,"Less than 48 hours old and it's already been called a transformer three times. Bucky @ Gold Rush, Costa Mesa, CA.",southbayray,1045,144,False,
1364229857.0,1azc4l,"I saw this image in /r/pics and fell in love with it. Colour is up next! By Chad Gilbert, Thunder Bay Ont. ",ShiroJoe,884,193,http://www.reddit.com/r/tattoos/comments/1azc4l/i_saw_this_image_in_rpics_and_fell_in_love_with/,http://b.thumbs.redditmedia.com/bow5FxgpZdQDGmfy.jpg,
1349379792.0,10yb0m,Rose Princess Freedom Tattoo a.k.a Tattoo I always wanted and my ex wouldn't let me. ,wildgirl1979,880,191,77,,t5_2qj9g,False
1345873378.0,ysnko,"got my first tattoo today, for my mom who lost her battle with cancer a year ago",prankfurter,953,263,http://www.reddit.com/r/tattoos/comments/ysnko/got_my_first_tattoo_today_for_my_mom_who_lost_her/,http://b.thumbs.redditmedia.com/oWx6LXNBCV6GbUjC.jpg,
1328219950.0,p8b01,"My artist made this. ""Yes, my body's a temple..."" ",soitalwaysgoes,1016,324,http://www.reddit.com/r/tattoos/comments/p8b01/my_artist_made_this_yes_my_bodys_a_temple/,http://d.thumbs.redditmedia.com/LklhiMuWqPXMzKNo.jpg,
1327336175.0,ot09m,"It's finally done! Underwater ink pants by Nikko Hurtado, Black Anchor Collective, Hesperia, CA",geekjive,151,,False
1372253266.0,1h3tu2,"Open your mind-done by Dave Clarke at sacred x pressions in Fort Walton Beach, FL",Makeembeatz,990,297,http://www.reddit.com/r/tattoos/comments/1h3tu2/open_your_minddone_by_dave_clarke_at_sacred_x/,default,
1358738109.0,16ytkj,What would you call the style of these waves?,LukeRenoe,831,142,48,,t5_2qj9g,False
