created_utc,id,title,author,ups,downs,num_comments,selftext,subreddit_id,is_self
1352222231.0,12qkp6,"My set. New to all this stuff, any general advice?",,17704,10322,http://www.reddit.com/r/tattoos/comments/12qkp6/my_set_new_to_all_this_stuff_any_general_advice/,http://e.thumbs.redditmedia.com/BaK_AY3uIRmw_4JR.jpg,
1360165890.0,1804lv,Done by Niki Norberg [wicked tattoo Sweden],neffhead,9249,4897,215,,t5_2qj9g,False
1360600130.0,18bciy,"Side Piece by Sergio Sanchez, California.",neffhead,7636,4054,http://www.reddit.com/r/tattoos/comments/18bciy/side_piece_by_sergio_sanchez_california/,http://d.thumbs.redditmedia.com/6gsBwz87PNiqPSH3.jpg,
1364444072.0,1b5qbo,My buddy Aaron Peters from Bugaboo Tattoos did this. How did he do?,KillTheKinderPS3,11920,8382,324,,t5_2qj9g,False
1370306397.0,1fmb9k,Flower of Life by Peter Madsen in Denmark,mcbaginns,8930,5781,190,,t5_2qj9g,False
1359735354.0,17p778,Space sleeve - Rom Azosky,neffhead,6862,3718,169,,t5_2qj9g,False
1352501763.0,12xris,My tea tattoo from the mix-up the other night. [cross-post from r/tea],,7664,4662,504,,t5_2qj9g,False
1342128081.0,wgp3p,"Celebrated my weight loss with a fat girl tattoo. Matty Carroll @ Mad Tatters in Bethlehem, PA.",zombiecupcake,5846,2854,http://www.reddit.com/r/tattoos/comments/wgp3p/celebrated_my_weight_loss_with_a_fat_girl_tattoo/,http://c.thumbs.redditmedia.com/jaDH8FLxnwiwRi9z.jpg,
1352646644.0,130etm,"my knitting tattoo, by Mac @ Hero Tattoo in Conway, SC",griptight,5010,118,False,
1363883965.0,1aqnuo,"A photographer friend had some pretty bad scarring after pregnancy complications...(David Allen,  Pioneer Tattoo, Chicago)",crapidrawatwork,6561,159,False,
1344888958.0,y5ug4,The Pen is a Tattoo,RobertBasil,5369,2546,129,,t5_2qj9g,False
1373371518.0,1hxhn7,"Flew to Hong Kong to get this piece from Wang at Tattoo Temple. 1 session, 7 hours straight.",dying_pteradactyl,8918,6087,http://www.reddit.com/r/tattoos/comments/1hxhn7/flew_to_hong_kong_to_get_this_piece_from_wang_at/,http://c.thumbs.redditmedia.com/XMOwEkbK20LSzrIV.jpg,
1358103769.0,16i47d,"My sleeve of the sky, sunset and ocean. (still incomplete) BY LEIF OLSON",DudeBug,6281,3498,http://www.reddit.com/r/tattoos/comments/16i47d/my_sleeve_of_the_sky_sunset_and_ocean_still/,http://b.thumbs.redditmedia.com/7S6K73nooZOth4jC.jpg,
1360684499.0,18dr5n,"Tony Mancia. Mancia studio Atlanta, Georgia",neffhead,5325,2587,http://www.reddit.com/r/tattoos/comments/18dr5n/tony_mancia_mancia_studio_atlanta_georgia/,nsfw,
1361513683.0,190aj3,"Scott Versago of Akron, OH fixes an internet-infamous portrait.",Whiskey_Throat,6319,3644,http://www.reddit.com/r/tattoos/comments/190aj3/scott_versago_of_akron_oh_fixes_an/,http://f.thumbs.redditmedia.com/r5VF6kumEHZyFLOY.jpg,
1351502163.0,129n2w,"Pink Floyd sleeve by Kyle Dyhrberg of Sinatras Custom Tattos in Wellington, New Zealand. ",duce01,3749,1099,http://www.reddit.com/r/tattoos/comments/129n2w/pink_floyd_sleeve_by_kyle_dyhrberg_of_sinatras/,http://c.thumbs.redditmedia.com/vCi8uhH6sH80xEd2.jpg,
1340430534.0,vh1tr,4.5 years and nearly 100 hours and it's about done.  By Dan Henk in Philadephia.,sspaceboy1,4103,1552,203,,t5_2qj9g,False
1375545415.0,1jmpgv,"I am in love with my new tattoo! Beautiful bearskin girl by Samantha Smith @Steveston Tattoo Co, Richmond, BC.",JamieTeamCool,6291,166,False,
1347025774.0,zi7j7,Ridiculously good sleeve!,yobigred,5363,2830,106,,t5_2qj9g,False
1354235808.0,140wq6,"it was a slow day at the shop, so i got zombie-fied",jetjnh,5212,2691,http://www.reddit.com/r/tattoos/comments/140wq6/it_was_a_slow_day_at_the_shop_so_i_got_zombiefied/,http://d.thumbs.redditmedia.com/2xu7YrI0BdluqxTu.jpg,
1350996582.0,11xywx,my girlfriends first tattoo done by Norbert Halasz in Dublin Ink,stecahill,4465,1943,188,,t5_2qj9g,False
1368379698.0,1e6x2u,A few weeks ago I got the same tattoo as my grandad from Daryl Rodreigez at hold it down in richmond va. I drove up to see him in the hospital.. His I from Pearl Harbor '42.,matter472,5473,2977,131,,t5_2qj9g,False
1353777591.0,13pwu4,"Tattoos and Turkey:  My buddy Scott, opening the doors of his shop to serve Thanksgiving dinner to his community.  (not pics of tattoos, but tattoo related)",PoppetFFN,4114,63,False,
1355492594.0,14ubae,"New tattoo on my left leg: 1984, by Loreprod @Tatto Theater, Italy",Scottie9,3517,113,False,
1352947953.0,137vv6,Tattooed Woman From The 50s.,STEADy_TOKErX,5248,2837,90,,t5_2qj9g,False
1353549603.0,13ll67,My birds on a cherry tree,Miwwies,3871,1464,85,,t5_2qj9g,False
1375123324.0,1jak9f,"3rd tattoo of my apprenticeship (also my 1st time using color) - Matt Buck @ Sacred Tattoo, NYC",illcoholic,5588,3194,http://www.reddit.com/r/tattoos/comments/1jak9f/3rd_tattoo_of_my_apprenticeship_also_my_1st_time/,http://d.thumbs.redditmedia.com/2v_2cJzBnVAfgGv9.jpg,machine
1353884835.0,13s4no,"Fox holding a human jaw bone , in memory of my friend Seb, Le Renard. Done by Paolo Acuna of Divinity Tattoo, Scottsdale AZ",bousy,2130,,False
1352275777.0,12sdc8,"My dads backpiece, done by Darcy Nutt of Chalice Tattoo",Fredent,3739,1362,http://www.reddit.com/r/tattoos/comments/12sdc8/my_dads_backpiece_done_by_darcy_nutt_of_chalice/,http://c.thumbs.redditmedia.com/QzlF9aJP9hCUG_2D.jpg,
1375938828.0,1jxrxc,"It looks weird because of my back/angles but it was to cover scars. ArtCore Tattoo Seattle, WA",,4626,2263,http://www.reddit.com/r/tattoos/comments/1jxrxc/it_looks_weird_because_of_my_backangles_but_it/,http://b.thumbs.redditmedia.com/K3SgLd46j70FIX4O.jpg,
1361449198.0,18y83r,"My accordion tattoo, done by Diel at Big Street tattoo (Örnsköldsvik, Sweden)",werewolfbaby,4030,132,False,
1330804633.0,qg84c,My Astronomy sleeve by Geoff at Port Side Tattoo in Vancouver,JimmyMarshall,3567,1269,143,,t5_2qj9g,False
1366739266.0,1cy6bz,"They're not scarlet, but they are begonias! Tattooed by Anastasia Powell at Eye of the Lotus in Edmonton, Alberta.",poeticterrorism,4233,200,False,
1368200933.0,1e2ofu,"Edward Scissor Hands by Jasen Workman out of St. George, Ut",rchamp08,4579,2293,http://www.reddit.com/r/tattoos/comments/1e2ofu/edward_scissor_hands_by_jasen_workman_out_of_st/,http://e.thumbs.redditmedia.com/3NnrS6p_InGx3GDd.jpg,
1366134631.0,1ch2z9,"Squid by Doug Love @ Staircase Tattoo in Santa Cruz, CA",Chippohippo,4121,1832,http://www.reddit.com/r/tattoos/comments/1ch2z9/squid_by_doug_love_staircase_tattoo_in_santa_cruz/,http://d.thumbs.redditmedia.com/xc3VyrcQ0sri7ihK.jpg,
1351063957.0,11zvbd,"Tattoo done by my tattoo artist, Jimmy Duvall, at Jimmy Duvall/INVICTUS (Custom Tattooing of Norway) in Oslo. Not mine unfortunately, but such a gorgeous piece. ",mjit,913,,False
1336266441.0,t93bt,My first tattoo. About 100 times more awesome than I had hoped.,PeregrineSkye,4419,2154,477,,t5_2qj9g,False
1368719420.0,1egfwy,"Cool geometric sleeve by Dillon Forte from Sri Yantra Tattoo in Oakland, CA",Dr_Octomom,4038,1768,http://www.reddit.com/r/tattoos/comments/1egfwy/cool_geometric_sleeve_by_dillon_forte_from_sri/,http://c.thumbs.redditmedia.com/vgcpb9l2U0lb1erh.jpg,
1358022948.0,16gb1r,Awesome anatomically correct heart by Yann Black,welcomechallenge,3942,1678,123,,t5_2qj9g,False
1369470037.0,1f0s1j,"Cover up my friend got the other day. By Nick at breaking ink, Hillsboro Oregon.",HerpDerpMcGurk,5294,3024,http://www.reddit.com/r/tattoos/comments/1f0s1j/cover_up_my_friend_got_the_other_day_by_nick_at/,http://b.thumbs.redditmedia.com/pWyf5iavxt59Vb-m.jpg,
1375364327.0,1jhr3i,"Just 'Wow', Florian Karg @Vicious Circle Tattoo, Germany",fog_horn,4318,107,False,
1367500099.0,1djqz7,"my favorite poem as a kid: lazy jane by shel silverstein! done by rodney taylor at golden spiral tattoo in greensboro, nc.",juleszy,5340,3086,http://www.reddit.com/r/tattoos/comments/1djqz7/my_favorite_poem_as_a_kid_lazy_jane_by_shel/,http://c.thumbs.redditmedia.com/qMHCjdnezkHFJj72.jpg,
1373332031.0,1hwjoc,"My tattoo by Steve Morris of Bodyworks Tattoo, Pittsburgh, PA",jaimemarie001,4588,169,False,
1362500267.0,19pnry,"Worst pain I've ever felt; by Boogie at Tatouage Iris, Montréal. [update #3] ",Thisisbluue,4815,2592,http://www.reddit.com/r/tattoos/comments/19pnry/worst_pain_ive_ever_felt_by_boogie_at_tatouage/,http://a.thumbs.redditmedia.com/K-7nJ_jHSJXd9_yH.jpg,
1373991335.0,1if5z7,My first tattoo by Iulian Popa from tattoo Peter in Amsterdam(X-post /r/tattoo),acebtard,4376,2152,183,,t5_2qj9g,False
1376576546.0,1kf41g,"""Flower of Life"" - Dmitry Rusky from Wyld Chyld Tattoos; Pittsburgh, PA",xSilly,3945,1759,http://www.reddit.com/r/tattoos/comments/1kf41g/flower_of_life_dmitry_rusky_from_wyld_chyld/,http://c.thumbs.redditmedia.com/pxk1YuCapEUJTuBP.jpg,
1375810845.0,1jtoj4,"5th tattoo of my apprenticeship - Matt Buck @ Sacred Tattoo, NYC",illcoholic,3685,1507,http://www.reddit.com/r/tattoos/comments/1jtoj4/5th_tattoo_of_my_apprenticeship_matt_buck_sacred/,http://d.thumbs.redditmedia.com/YHJ-2wsGkIyefwYK.jpg,machine
1368441561.0,1e8k7p,"New Tat (03/15/13) by Lukas Schneider, The Clinic, Austria",Herbert_Kehrwert,3971,82,False,
1369538087.0,1f2bcx,"My redditless boyfriend's wolves by David Hale at Lovehawk Studio in Athens, GA.",richardmanuelsbeard,3530,1351,http://www.reddit.com/r/tattoos/comments/1f2bcx/my_redditless_boyfriends_wolves_by_david_hale_at/,http://a.thumbs.redditmedia.com/0fU_Y-Po9oIJFmBN.jpg,
1375753568.0,1js6e1,My Tree. By Dub Weir at Divinity Tattoo in Phoenix Az. (NSFW),DailyTatTwo,4412,2240,168,,t5_2qj9g,False
1347644243.0,zvwve,Bad Ass Seniors!,iksworbeZ,4093,1940,178,,t5_2qj9g,False
1341857103.0,wa4o3,Friend on a dare had to get what ever tattoo was in a blind-package from 1979. I think its pretty cool. (X-post from r/pics),crapidrawatwork,4279,2138,147,,t5_2qj9g,False
1344263457.0,xrlqy,My award-winning torso! [NSFW],covermodel,4425,2279,345,,t5_2qj9g,False
1368246602.0,1e43gy,A collection of vintage tattoo shop photographs.,jesbaker,3701,1563,122,,t5_2qj9g,False
1357234268.0,15wao2,"Beautiful Work by Rember Orellana, Dallas Texas.",neffhead,3688,1547,http://www.reddit.com/r/tattoos/comments/15wao2/beautiful_work_by_rember_orellana_dallas_texas/,http://a.thumbs.redditmedia.com/DJMch_kEAabJ2h-0.jpg,
1376040647.0,1k0mdh,"I was lucky enough to get my first tattoo done by my favourite artist. Done by Wang at Tattoo Temple, Hong Kong",NachoNaanbread,4451,2312,http://www.reddit.com/r/tattoos/comments/1k0mdh/i_was_lucky_enough_to_get_my_first_tattoo_done_by/,http://b.thumbs.redditmedia.com/yLSgZtmI_Nest8LI.jpg,
1370491658.0,1frqrh,"I designed a raven tattoo for my sister, here's my drawing next to the final thing. Thanks to Nick of Tattoo Lou's (Long Island, NY)",EatYourPain,3940,160,False,
1376171559.0,1k3zt5,"My Ōkami Tattoo (FINISHED) (x-post r/gaming) @ Deadpigeon Tattoo, Sweden",axling,3706,1578,http://www.reddit.com/r/tattoos/comments/1k3zt5/my_ōkami_tattoo_finished_xpost_rgaming_deadpigeon/,http://e.thumbs.redditmedia.com/CmNu-iFXlufNhiVR.jpg,
1367102114.0,1d8nlt,Where the Sidewalk Ends by Eddie Morales in Illinois,ZBQ10,4714,2582,125,,t5_2qj9g,False
1354855903.0,14ffb0,"Not mine -- saw it on facebook -- but amazing nonetheless.  By Dmitriy Samohin in Odessa, Ukraine",ChristheGreek,3552,1430,http://www.reddit.com/r/tattoos/comments/14ffb0/not_mine_saw_it_on_facebook_but_amazing/,http://b.thumbs.redditmedia.com/ZiqaX9wRp3unhITs.jpg,
1365251489.0,1bsk93,"My enormous Bioshock cover-up tattoo. Done by Dan Loose at Fat Katz, in Ocala, FL. [x-post from /gaming by suggestion]",BikerJedi,4477,356,False,
1348633627.0,10hpjb,"My first real tattoo: Vulcan script, ""Live Long and Prosper,"" by Jorge from Reno Tattoo Co",nerdress,3164,149,False,
1366487734.0,1crbdf,"Iron Man/Tony Stark done by Jeff at Mother's in Erlanger, KY!",xkaiserxremx,4686,2572,http://www.reddit.com/r/tattoos/comments/1crbdf/iron_mantony_stark_done_by_jeff_at_mothers_in/,http://d.thumbs.redditmedia.com/IHbqn9XN7vn2SHl3.jpg,
1356283183.0,15byh2,Twin sister tattoos,p1nkanders0n,3420,1309,102,,t5_2qj9g,False
1373804439.0,1i9tzk,"Not mine but I love it: by Rob Sweet at Ascending Koi, Calgary.",doloresvselenium,4024,1922,http://www.reddit.com/r/tattoos/comments/1i9tzk/not_mine_but_i_love_it_by_rob_sweet_at_ascending/,http://c.thumbs.redditmedia.com/5nzdV47ycTNYrfKb.jpg,
1359566218.0,17kj4v,"This is fantastic cover up piece was done by Elania @The Buzz Bin in Dawson Creek, BC, CAN ",RabbitUnicorn,3660,164,False,
1358787566.0,16zv70,Detailed Aztec back piece - Eclipse Tattoo Studio [London],neffhead,3094,1001,57,,t5_2qj9g,False
1372883304.0,1hl937,"This is my rainbow giraffe tattoo, done by the fantastic Bryan Mozjesik at Big Brain in Omaha, NE. Three and a half hours of severe pain but so worth it.",ashley-san,4881,204,False,
1335831766.0,t0oli,Chef’s tattoo doubles as a measuring spoon (chef Carolynn Spence),lysserloo,3973,1901,189,,t5_2qj9g,False
1376058242.0,1k0ywp,"Couldn't be happier with this piece. Done by Angie Fey @ Archive Tattoo, Toronto, ON.",GreenOwl,3902,81,False,
1355329003.0,14qar1,Let's take a minute to recognize Sailor Jerry and all of his work. (X-post from r/pics),toomanypens,3051,980,117,,t5_2qj9g,False
1369058376.0,1eozaa,"*Final Update* Gray's Anatomy Textbook style illustration - Scott Spencer, The Inkery, ATX",Annodyne,4111,192,False,
1356457321.0,15fdww,My sisters and I live in four different cities so when we came together for the holidays we got tattoos to represent our birth order ,adeanpugel,3491,1432,124,,t5_2qj9g,False
1374495362.0,1it325,"Geometric sleeve done by Rose Price, Organic Element, UK",Lynx77,3733,100,False,
1352515602.0,12y3n4,I don't have any info but these sleeves are amazing!,Kelwood,3030,984,41,,t5_2qj9g,False
1359236027.0,17c1nu,"Just got a new tattoo! It's a poem my dad wrote to me the day I was born, he died this summer. Done by Anthony Audy at Yankee Tattoo in Burlington VT.",fuckthisgayearthh,3171,1128,http://www.reddit.com/r/tattoos/comments/17c1nu/just_got_a_new_tattoo_its_a_poem_my_dad_wrote_to/,http://b.thumbs.redditmedia.com/46-pBzNvFcktPhjy.jpg,
1371580102.0,1glm5d,Done at Pecka's tatueringskonst [Sweden],Rullponken,3328,1293,82,,t5_2qj9g,False
1370843417.0,1g12sx,"Well guys, I finally got it. Super stoked with how it turned out. The meaning to me is insane. Shout out to Trish who owns My Little Needles in Plymouth, MI for doing an amazing job!",phluffymuffin,4466,144,False,
1355733499.0,14zi9q,"Watercolor arctic fox by Phil Lambert, Sole Tattoo, Salt Lake City",FelixByrd,3079,133,False,
1346396077.0,z4hmj,"Awesome moving raptor, done by Koren Smoke at AV Ink",hopkinz,3250,1236,http://www.reddit.com/r/tattoos/comments/z4hmj/awesome_moving_raptor_done_by_koren_smoke_at_av/,http://b.thumbs.redditmedia.com/lBQyOarylTI77BWI.jpg,
1352475962.0,12x0g3,"Something silly for the ""extra life"" heart surgery gave me.  ",silla2389,3497,1481,107,,t5_2qj9g,False
1362274243.0,19jxd9,Portrait of my oldest daughter by Javier Eastman at Get Ink Tattoo in Norwalk Connecticut ,ParagonHI,3644,1636,93,,t5_2qj9g,False
1360005015.0,17vqd9,"This came up on my Facebook feed, apparently somebody is getting this tattooed today.",nickd87,3553,1542,http://www.reddit.com/r/tattoos/comments/17vqd9/this_came_up_on_my_facebook_feed_apparently/,http://a.thumbs.redditmedia.com/qPKoAQNXsRxcBXuH.jpg,
1354311359.0,142lqs,Any Monty Python fans in r/tattoos?,kickinfatbeats,3956,1953,80,,t5_2qj9g,False
1359896313.0,17szo5,"A years wait, but absolutely worth it! Giraffe by Noon @ The Family Business (London, UK)",zebulonthegreat,3274,93,False,
1360549031.0,18a6xv,Just finished my micro-to-macro science sleeve. Done by Deanna Wardin @ Tattoo Boogaloo in SF.,SplatterSack,3196,1198,80,,t5_2qj9g,False
1374759456.0,1j0y8u,"First tattoo. What do you folks think? Done by Bree from Slicks Tattoo, Montreal.",Dimitrodon,4143,2152,http://www.reddit.com/r/tattoos/comments/1j0y8u/first_tattoo_what_do_you_folks_think_done_by_bree/,http://d.thumbs.redditmedia.com/jFK6Kx-_M0T7qMaQ.jpg,
1370715426.0,1fxqw6,Some amazing tattoos by Domantas Parvainis,SheTroll,3166,1176,42,,t5_2qj9g,False
1355589540.0,14wd9t,"My backpiece. Done by Lukas Schneider @ The Clinic Tattoo, Austria.",Herbert_Kehrwert,2847,867,http://www.reddit.com/r/tattoos/comments/14wd9t/my_backpiece_done_by_lukas_schneider_the_clinic/,http://a.thumbs.redditmedia.com/7i1ascDWJpFBtApl.jpg,
1367251065.0,1dce0k,"New Tattoo. Done by Chris Collins @ Frontier, Cardiff UK",maffige,4481,2510,http://www.reddit.com/r/tattoos/comments/1dce0k/new_tattoo_done_by_chris_collins_frontier_cardiff/,http://d.thumbs.redditmedia.com/JLQ0VQauIZGMMOjK.jpg,
1355199477.0,14nbna,"red-winged blackbird shoulder piece by aubrey at sugar city tattoo in crockett, CA",deathofregret,2640,676,http://www.reddit.com/r/tattoos/comments/14nbna/redwinged_blackbird_shoulder_piece_by_aubrey_at/,http://a.thumbs.redditmedia.com/6ltZO4fjF0XldIdB.jpg,
1354075783.0,13wzs3,The tattoo shop I go to held a Black Metal Friday event the day after Thanksgiving. Reddit may recognize the subject of this tattoo... done by Tom Taylor at Deep Six in Philly,trippindicular,5065,3110,226,,t5_2qj9g,False
1349789392.0,1170e3,"Some guy ised my tattoos for karma most likely but couldn't provide artist info. So HERE it is. Sam Yamini did this at Saints&amp;Sinners in Carrolton, TX.",Stevhen,3066,1114,http://www.reddit.com/r/tattoos/comments/1170e3/some_guy_ised_my_tattoos_for_karma_most_likely/,http://b.thumbs.redditmedia.com/i6I3Msnjfvdmscqg.jpg,
1347820903.0,zzcdb,"As requested, a Non-Instagram version of my henna-style tattoo by Kim of Prix in Hollywood.",dbl_entendre,3036,1090,http://www.reddit.com/r/tattoos/comments/zzcdb/as_requested_a_noninstagram_version_of_my/,http://e.thumbs.redditmedia.com/F6yjs1JOIDBVpR3d.jpg,
1370964344.0,1g4j9u,"My Medusa by Emily Rose - Melbourne, Australia [Album]",Nostalgi4c,3193,1249,http://www.reddit.com/r/tattoos/comments/1g4j9u/my_medusa_by_emily_rose_melbourne_australia_album/,http://e.thumbs.redditmedia.com/Lu6oT1TAYV5S5vCL.jpg,
1365613254.0,1c2ncq,Calvin by Ty at Ink Addiction in Saskatoon,danthenyell,3794,1856,139,,t5_2qj9g,False
1360945150.0,18l3jl,Tattoo by Josh Duffy,neffhead,2872,939,56,,t5_2qj9g,False
1363540699.0,1agzrh,"Tiger - Jesse Pinette - Precision Tattoo, Maine",jessepinette,2935,1028,http://www.reddit.com/r/tattoos/comments/1agzrh/tiger_jesse_pinette_precision_tattoo_maine/,http://a.thumbs.redditmedia.com/0Mq_-b6UpFh-RWTN.jpg,
1353091526.0,13b7hp,"/r/tattoos: This is NOT OK, and I WILL ban you for it.",tobiasx,2837,924,http://www.reddit.com/r/tattoos/comments/13b7hp/rtattoos_this_is_not_ok_and_i_will_ban_you_for_it/

I'm sad that I had to actually update the sidebar to include this

/r/tattoos is meant for tattoos, but it does mean that anyone - guy or girl - should be comfortable posting a picture of themselves here without a barrage of comments about them physically.  

Tattoos are on skin, and sometimes people don't have access to photo editing, blur, or whatever else you could think of to make the picture more PG.  

tldr: Don't be assholes.  Don't say things to people brave enough to expose parts of their bodies for the intention of showing off their tattoos that you wouldn't say to your mother.",self,t5_2qj9g,False,,machine2,True,http://www.reddit.com/r/tattoos/comments/13b7hp/rtattoos_this_is_not_ok_and_i_will_ban_you_for_it/
1370044425.0,1ffq1d,"Beatles - Tiffiny at American Tattoo Studio in Brunswick, MD",sheriw1965,3328,1425,http://www.reddit.com/r/tattoos/comments/1ffq1d/beatles_tiffiny_at_american_tattoo_studio_in/,http://a.thumbs.redditmedia.com/EYrLQ4gL4S5Cdxaf.jpg,
1363705128.0,1alfsa,"Fresh! My forearm. Skull n Chrysanthemum - Johan Finnè - Evil Twins Tattoo Studio - Helsingborg, Sweden",irgens,2995,1091,http://www.reddit.com/r/tattoos/comments/1alfsa/fresh_my_forearm_skull_n_chrysanthemum_johan/,http://a.thumbs.redditmedia.com/ridLBe5vBQbvoWjH.jpg,
1373274106.0,1hurl4,"My shin piece by Drew Shallis at STR Body Modifications, Wyong NSW",seanmaan,2878,994,http://www.reddit.com/r/tattoos/comments/1hurl4/my_shin_piece_by_drew_shallis_at_str_body/,http://a.thumbs.redditmedia.com/yULpcQ_fpZf0G98x.jpg,
1364399911.0,1b46ei,We just took on an apprentice. These are a few of her drawings (Biro pen),herboholic,3173,1298,153,,t5_2qj9g,False
1366592941.0,1cu1y9,"Not mine but I think this is pretty awesome. Jim Ryan, DamCool Tattoo. Devon UK",MollySmithMS,2922,1054,http://www.reddit.com/r/tattoos/comments/1cu1y9/not_mine_but_i_think_this_is_pretty_awesome_jim/,http://a.thumbs.redditmedia.com/c8eUF_7vZIVpPhif.jpg,
1376406228.0,1ka4jz,"Our Tetris Piece Tattoos- done by Phil at Atomic Tattoo in Brandon, FL",CommanderAmander,4382,2518,http://www.reddit.com/r/tattoos/comments/1ka4jz/our_tetris_piece_tattoos_done_by_phil_at_atomic/,http://d.thumbs.redditmedia.com/mPLQ0espoa6eD06c.jpg,
1370378733.0,1foc9o,"Brand new tattoo all done in one sitting! I love it! Done by Valentine in Lost Gallery Tattoo, Dublin.",VickBack,2896,1048,http://www.reddit.com/r/tattoos/comments/1foc9o/brand_new_tattoo_all_done_in_one_sitting_i_love/,http://a.thumbs.redditmedia.com/dvuJl6Z6DyyPS92r.jpg,
1359928148.0,17ttf0,"The Four Tattoos You Need To Stop Getting Right Now
",2540,748,http://www.reddit.com/r/tattoos/comments/17ttf0/the_four_tattoos_you_need_to_stop_getting_right/,,,False,t5_2qj9g,False
1352729100.0,1329bq,My Medical Tattoo in the Sailor Jerry style,terraspatial,2697,853,174,,t5_2qj9g,False
1364754892.0,1bdc2w,"My second tattoo, cherry blossoms by JJ Linayao at Siick Tattoos- Los Angeles, CA",funkyraindancer,2949,55,False,
1352219624.0,12qhpy,"My chest by Big Al Fielder of FAMILY FIRST TATTOO Wilmington, nc",Jayintheworstway,3010,1173,http://www.reddit.com/r/tattoos/comments/12qhpy/my_chest_by_big_al_fielder_of_family_first_tattoo/,http://f.thumbs.redditmedia.com/xnh_-Ct3431B3R9G.jpg,
1366903164.0,1d353m,My good buddy's elephant tattoo sleeve (still in progress) by Adal at Majestic Tattoo NYC,ilovetechnoNYC,2970,1144,32,,t5_2qj9g,False
1350520041.0,11ntml,To celebrate national fossil day I got this!,5starninja,3298,1468,217,,t5_2qj9g,False
1373547236.0,1i2ryv,My cover-up done by Vincent @ Tattoo &amp; Co. in Miami. Getting rid of my Chinese symbol and replacing with an ode to my daughter and the song 'Blackbird.',Englishly,2721,893,77,,t5_2qj9g,False
1372701055.0,1hft9a,"Stunning portrait by Roberto Da Silva, germany",DeffKeff,2908,1080,http://www.reddit.com/r/tattoos/comments/1hft9a/stunning_portrait_by_roberto_da_silva_germany/,http://e.thumbs.redditmedia.com/6afygkOkM2XXjCyF.jpg,
1374426081.0,1ir9t5,Dot work by Aubrey at Hold Fast Tattoo in Kansas City.,thenewfrost,2661,834,91,,t5_2qj9g,False
1354597253.0,148vq3,"My new back tat. Battleship for my grandfather, senator of NH.",GuessWho_O,2825,1003,http://www.reddit.com/r/tattoos/comments/148vq3/my_new_back_tat_battleship_for_my_grandfather/,http://d.thumbs.redditmedia.com/uF903S2cjLACZf6c.jpg,
1343349117.0,x7ym6,First tattoo - My late mother's handwriting.,Fluctuater,3396,1583,112,,t5_2qj9g,False
1365340861.0,1bun3g,"Barn Owl in Autumn, on Breast Cancer Survivor, by Esther Garcia in Chicago",lowlight,2932,81,False,
1364073242.0,1avnfp,Thought you might like these: Vintage photographs of tattooed women.,prematurepost,3017,1202,66,,t5_2qj9g,False
1375480622.0,1jlbgg,"My first tattoo! Blackwork done by Josh Stephens at Hold It Down Tattoo in Richmond, VA",codyxcooper,2726,916,http://www.reddit.com/r/tattoos/comments/1jlbgg/my_first_tattoo_blackwork_done_by_josh_stephens/,http://a.thumbs.redditmedia.com/QaZpqBdjNtl2DJbf.jpg,
1356413317.0,15eqo4,Just wanted to wish everyone Happy and Safe Holidays from the Mods here at r/tattoos!,SinAndInk,2811,1004,22,,t5_2qj9g,False
1374939176.0,1j5wap,My homage to the greatest character ever. By Jon Mesa @ BangBang NYC,illcoholic,4486,2684,210,,t5_2qj9g,False
1369969887.0,1fdrlm,"Realistic owl, awesome color - Audie Fulfer, High Class Tattoo Fresno, CA",charizade,942,,False
1369086559.0,1epzk1,Not so typical owl tattoo by David Hale &amp; Kris Davidson,SexyOAG,2687,885,46,,t5_2qj9g,False
1367416861.0,1dhbq1,"Palm tattoo of the black spot from pirate folk lore. Done by Allen @ Elite Ink, Myrtle Beach, SC",Scruffy_the-janitor,3664,254,False,
1370901005.0,1g2opt,"My first tattoo! A clipper ship by Nora at Jade Lotus in Burlington, VT",katyjake,3077,1285,http://www.reddit.com/r/tattoos/comments/1g2opt/my_first_tattoo_a_clipper_ship_by_nora_at_jade/,http://a.thumbs.redditmedia.com/fF8irDBxC1scQZHN.jpg,
1371875695.0,1gu9k0,"*update* completed family crest/celtic knot tattoo -- Cesar Romero at Lucky Kat Tattoo in Whiting, IN",Nyte_,2741,943,http://www.reddit.com/r/tattoos/comments/1gu9k0/update_completed_family_crestceltic_knot_tattoo/,http://a.thumbs.redditmedia.com/il39ifo4w2MHd_Y0.jpg,
1347221424.0,zm6xw,"About a year and a half ago while crossing the street I got hit by a car going 65+ mph. I ended up breaking my tibia, fibula and shoulder. After all the struggle to relearn to walk and over come the PTSD and pain it left me with I decided to commemorate the occasion with a bit of humor.",dreambiggerdarling,2644,857,http://www.reddit.com/r/tattoos/comments/zm6xw/about_a_year_and_a_half_ago_while_crossing_the/,http://d.thumbs.redditmedia.com/sGR9dqF9CQSQzslK.jpg,
1369873161.0,1faywf,"My huge ass torso piece. Done by Dean Denney at Anonymous Tattoo in Savannah, Georgia.",anthonyjniosi,4927,3151,http://www.reddit.com/r/tattoos/comments/1faywf/my_huge_ass_torso_piece_done_by_dean_denney_at/,http://d.thumbs.redditmedia.com/O6qlI17HFqZK7J_o.jpg,
1353217061.0,13dysh,Newest piece! T-Rex Fighting an Octopus by Kevin Johnson of Calgary AB,RabbitDeathStar,2842,1068,220,,t5_2qj9g,False
1373761111.0,1i8who,"An album of the total process so far of my Egyptian War sleeve! By Billy Barnett @ Even Tide Tattoo, Cardiff by the Sea",gumby_arobics,2964,1190,http://www.reddit.com/r/tattoos/comments/1i8who/an_album_of_the_total_process_so_far_of_my/,http://f.thumbs.redditmedia.com/a0Bh89cz08ltPYR_.jpg,
